bill_number,bill_id,title
HB1523,146486,"County officials; provide those attacked by an animal while on duty with certain rights regarding the property/animal owner."
HB1524,146487,"Contractor's tax; designate owners of certain major industrial facilities as the prime contractor for certain projects."
HB1525,146488,"Mental health commitment laws; revise various provisions of."
HB1526,146489,"DA, asst. DA and criminal investigators; allow salaries to be supplemented by nonstate funds to be supplemented."
HB1527,146490,"District Attorney; allow additional employees without limitation of funds."
HB1528,146491,"Mississippi Rural Legal Services Scholars Program; establish."
HB1529,146492,"ICCCY and State System of Care; delete repealers, expand council and define authority of council."
HB1530,146493,"Community colleges; authorize to pledge taxes regarding auxiliary facilities."
HB1531,146494,"Judges; provide additional judge for the Twelfth Circuit Court District."
HB1532,146495,"Workers' Compensation Law; reduce compensation by employer's percentage of fault."
HB1533,146496,"Cooperatives; provide for the incorporation of."
HB1534,146497,"Mississippi Racial Justice Act; create."
HB1535,146498,"Mississippi Ethics Commission; revise jurisdiction of."
HB1536,146499,"Bad check; revise fee for deferral of prosecution."
HB1537,146500,"Legal Aid for Economically Deprived Mississippians Study Panel; create."
HB1538,146501,"Public lands; bring forward sections for purposes of amendment."
HB1539,146502,"Workers' Compensation Commission; require to promulgate rules and regulations regarding safety program."
HB1540,146503,"Eminent domain; allow opportunity for removal of house on property acquired by Department of Transportation."
HB1541,146504,"Child support; court may deviate from guidelines for child care expenses in certain cases."
HB1542,146505,"Preneed contract funded by insurance; authorize to be written up to $15,000."
HB1543,146506,"Pharmacy practice and controlled substances; revise certain statutes relating to."
HB1544,146507,"Candidate for judicial office; revise when qualifying petition may be filed."
HB1545,146508,"Corporations; provide method to break tie in vote of shareholders."
HB1546,146509,"Personal care home; require to notify resident's responsible party before moving resident to another facility or location."
HB1547,146510,"Open Meetings Law; prescribe civil penalty for disclosing information from executive session of a public body."
HB1548,146511,"Flood and Drainage Control Joint Legislative Study Committee; create."
HB1549,146512,"Flood and drainage control districts; revise composition of board of directors of certain."
HB1550,146513,"Public contracts; give preference to resident bidders, and prescribe specific penalties for violations."
HB1551,146514,"Public improvement districts; exempt certain projects from public bidding requirements."
HB1552,146515,"Rural Fire Truck Acquisition Assistance Program; authorize an additional round for counties and municipalities."
HB1553,146516,"Bullying or harassing behavior; prohibit in schools."
HB1554,146517,"Workers' Compensation Law; require every carrier to provide coverage to employees who have a nonviolent record."
HB1555,146518,"Construction contractors; require disclosure regarding general liability insurance."
HB1556,146519,"Law enforcement officer; create crime of public intimidation of."
HB1557,146520,"Civil actions; provide that P&amp;C insurers have burden of proof for exclusions/exceptions in ""all perils"" coverage policy."
HB1558,146521,"Environmental Health Fund; create and authorize Commission on Environmental Quality to deposit fees into."
HB1559,146522,"Alcorn State University; provide additional funding sources to enroll more graduate students in nurse educators program."
HB1560,146523,"Bonds; authorize issuance for certain highway improvements."
HB1561,146524,"Adams County; revise jurisdiction of St. Catherine Creek Utility Authority."
HB1562,146525,"Homestead exemption; increase for totally disabled veterans."
HB1563,146526,"Sales tax; exempt sales of tangible personal property and services to East Mississippi State Hospital Friends."
HB1564,146527,"Ad valorem tax; authorize partial exemption for agricultural land that is converted to a residential use."
HB1565,146528,"Inventory tax; authorize a tax credit for."
HB1566,146529,"Farmers' markets; clarify sales tax provisions regarding products sold at markets certified by Department of Agriculture."
HB1567,146530,"Income tax; authorize a credit for costs of installing certain energy-efficient products in homes."
HB1568,146531,"Homestead exemption; increase for persons 65 years of age or older or totally disabled."
HB1569,146532,"Income tax; provide a credit for certain energy efficiency improvements to homestead property."
HB1570,146533,"Homestead exemption; increase."
HB1571,146534,"Ad valorem tax; create 10% cap on increase in assessed value of agricultural property and commercial poultry houses."
HB1572,146535,"Income tax; increase credit for ad valorem tax paid on inventory."
HB1573,146536,"Income tax; authorize a credit for purchase and installation of wind energy systems/solar energy systems."
HB1574,146537,"Appropriation; Archives and History for preplanning new museum of Mississippi's Native American heritage."
HB1575,146538,"Housing repair grant program; authorize issuance of bonds to provide grants to low income individuals for home repair."
HB1576,146539,"Bonds; authorize issuance to provide funds for public school capital improvements."
HB1577,146540,"Income tax; exclude overtime compensation from gross income."
HB1578,146541,"Income tax; increase credit for ad valorem tax paid on inventory."
HB1579,146542,"Sales tax; reduce rate on sales of certain food and revise diversion to municipalities."
HB1580,146543,"Sales tax; reduce rate on sales of certain food and revise diversion to municipalities."
HB1581,146544,"Lowndes County; may enter into certain loan agreements with the USDA for terms of not more than 30 years."
HB1582,146545,"Homestead exemption; increase for persons 65 years of age or older or totally disabled."
HB1583,146546,"Growth and Prosperity Act; revise the date upon which supervisors districts are determined eligible."
HB1584,146547,"Small Municipalities and Limited Population Counties Fund; authorize issuance of general obligation bonds for."
HB1585,146548,"Local System Bridge Replacement and Rehabilitation Fund; authorize issuance of general obligation bonds to provide funds for."
HB1586,146549,"Ad valorem taxation; exempt pollution control equipment mandated by federal or state law."
HB1587,146550,"Sales tax; exempt certain organizations operating long-term care facilities for adults with mental retardation."
HB1588,146551,"Income tax; sales of certain interests in certain business entities are gain and include certain dividend income in gross income."
HB1589,146552,"Sales tax and use tax; exempt shipping and handling charges from."
HB1590,146553,"Income tax; authorize credit for portion of costs of college textbooks."
HB1591,146554,"Bonds; increase amount that may be issued for the Local Governments and Rural Water Systems Improvements Revolving Loan Fund."
HB1592,146555,"Community colleges; authorize additional tax levy for improvements and general support."
HB1593,146556,"Lauderdale County; authorize donation of certain real property to Northeast Volunteer Fire and Rescue, Inc."
HB1594,146557,"Mississippi Small Business Investment and Jobs Promotion Act of 2010; create."
HB1595,146558,"Income tax; authorize credit for taxpayers who maintain, support and care for dependent with diagnosis of developmental disability."
HB1596,146559,"Bonds; authorize issuance of state general obligation bonds for constructing a new spillway at Lake Mary in Wilkinson County."
HB1597,146560,"Town of Byhalia; authorize a tax on hotels and motels."
HB1598,146561,"Mississippi Existing Forestry Industry Enterprise Revolving Loan Program; create and authorize issuance of bonds for."
HB1599,146562,"Mississippi Optional Sales Tax Act; enact."
HB1600,146563,"Ad valorem tax; local governing authorities may grant an exemption on homesteads of certain residents serving in Iraq or Afghanistan."
HB1601,146564,"Tallahatchie County; authorize contribution to Emmett Till Memorial Commission."
HB1602,146565,"Sales tax; exempt retail sales of exercise equipment to individuals for home use."
HB1603,146566,"Appropriation; Health Department to develop and operate two STD/HIV specialty clinics."
HB1604,146567,"Appropriation; Archives and History for preplanning new museum of Mississippi's Native American heritage."
HB1605,146568,"Appropriation; IHL for Special Task Force for Revitalization of the Mississippi Delta Region."
HB1606,146569,"Sweetened Beverages and Syrups Tax Law; enact."
HB1607,146570,"Income tax; exclude transportation fringe benefits from gross income as allowed under the Internal Revenue Code."
HB1608,146571,"Tunica County; authorize contribution to Aaron E. Henry Community Health Clinic, P.A."
HB1609,146572,"Tunica County; authorize to contract with and/or contribute to Mid-State Opportunity, Inc."
HB1610,146573,"Tunica County; authorize contribution to Institute of Community Services, Inc."
HB1611,146574,"Bonds; authorize issuance to assist City of Jackson in making repairs and improvements to water and sewer systems."
HB1612,146575,"Bonds; authorize issuance provide funds for community and junior colleges technology upgrades."
HB1613,146576,"Sales tax; impose a tax on sales of machinery and construction services at certain refineries."
HB1614,146577,"DeSoto County; authorize contribution to Institute for Community Services, Inc., for a bus for Head Start program."
HB1615,146578,"Appropriation; Legislative Expense, Regular."
HB1616,146579,"Appropriation; Attorney General - support."
HB1617,146580,"Appropriation; District Attorneys and staff."
HB1618,146581,"Appropriation; Supreme Court Services."
HB1619,146582,"Appropriation; Office of Capital Defense Counsel."
HB1620,146583,"Appropriation; Office of Capital Post-Conviction Counsel."
HB1621,146584,"Appropriation; Office of Indigent Appeals."
HB1622,146585,"Appropriation; State Department of Education - General Programs, Education Reform Act and Vocational Education."
HB1623,146586,"Appropriation; Mississippi Authority for Educational Television."
HB1624,146587,"Appropriation; Library Commission."
HB1625,146588,"Appropriation; Department of Wildlife, Fisheries and Parks."
HB1626,146589,"Appropriation; Department of Environmental Quality."
HB1627,146590,"Appropriation; Governors Office - Division of Medicaid."
HB1628,146591,"Appropriation; State Department of Health-support."
HB1629,146592,"Appropriation; State Forestry Commission."
HB1630,146593,"Appropriation; State Board of Registration for Foresters."
HB1631,146594,"Appropriation; Soil and Water Conservation Commission."
HB1632,146595,"Appropriation; Department of Archives and History."
HB1633,146596,"Appropriation; Arts Commission."
HB1634,146597,"Appropriation; Department of Marine Resources."
HB1635,146598,"Appropriation; Grand Gulf Military Monument Commission."
HB1636,146599,"Appropriation; Mississippi River Parkway Commission."
HB1637,146600,"Appropriation; Pat Harrison Waterway District."
HB1638,146601,"Appropriation; Yellow Creek State Inland Port Authority."
HB1639,146602,"Appropriation; Pearl River Basin Development District."
HB1640,146603,"Appropriation; Pearl River Valley Water Supply District."
HB1641,146604,"Appropriation; Mississippi State Port Authority at Gulfport."
HB1642,146605,"Appropriation; Insurance Department."
HB1643,146606,"Appropriation; State Fire Academy."
HB1644,146607,"Appropriation; Department of Human Services-Consolidated."
HB1645,146608,"Appropriation; Rehabilitation Services - Consolidated."
HB1646,146609,"Appropriation; Tombigbee River Valley Water Management District."
HB1647,146610,"Appropriation; Public Employees' Retirement System-administrative expenses; maintenance and operation of building."
HB1648,146611,"Appropriation; Oil and Gas Board."
HB1649,146612,"Appropriation; Public Service Commission."
HB1650,146613,"Appropriation; Public Utilities Staff."
HB1651,146614,"Appropriation; Real Estate Commission."
HB1652,146615,"Appropriation; Real Estate Appraiser Licensing and Certification Board."
HB1653,146616,"Appropriation; Athletic Commission."
HB1654,146617,"Appropriation; State Board of Medical Licensure."
HB1655,146618,"Appropriation; Physical Therapy Board."
HB1656,146619,"Appropriation; Board of Psychology."
HB1657,146620,"Appropriation; Coast Coliseum Commission."
HB1658,146621,"Appropriation; State Board of Nursing Home Administrators."
HB1659,146622,"Appropriation; Board of Nursing."
HB1660,146623,"Appropriation; State Board of Registration for Professional Engineers and Land Surveyors."
HB1661,146624,"Appropriation; Board of Cosmetology."
HB1662,146625,"Appropriation; Board of Examiners for Social Workers and Marriage and Family Therapists."
HB1663,146626,"Appropriation; Veterans' Home Purchase Board."
HB1664,146627,"Appropriation; Auctioneers Commission."
HB1665,146628,"Appropriation; State Board of Barber Examiners."
HB1666,146629,"Appropriation; Board of Optometry."
HB1667,146630,"Appropriation; Department of Transportation."
HB1668,146631,"Appropriation; reappropriation, DFA - Bureau of Building; FY11."
HB1669,146632,"Sales tax; authorize sales tax holiday for retail sales of guns and certain other outdoor sporting goods."
HB1670,146633,"Sales tax; increase rate on sales of tickets or admissions to movie theaters."
HB1671,146634,"Bonds; authorize issuance to provide funds for construction of state law enforcement and fire museum."
HB1672,146635,"Bonds; authorize issuance to provide funds to Jackson State University for purchase of historical exhibit."
HB1673,146636,"Income tax; exclude amounts converted from traditional IRA to Roth IRA from gross income."
HB1674,146637,"Income tax; authorize job tax credit for new cut and sew jobs in the upholstered household furniture manufacturing industry."
HB1675,146638,"Income tax; revise new jobs required for tax credit allowed for company establishing or transferring national or regional headquarters."
HB1676,146639,"DeSoto County; authorize contribution to Historic DeSoto Foundation, Inc."
HB1677,146640,"Taxation; provide ad valorem, fuel and sales tax exemptions regarding private buses contracted to transport school students."
HB1678,146641,"Sales tax and use tax; provide certain exemptions for business enterprises owning or operating data centers."
HB1679,146642,"City of Booneville; authorize to contribute funds to Rails and Trails Museum."
HB1680,146643,"City of Booneville; authorize to contribute funds to Booneville Hardware Cultural Arts Center, Inc."
HB1681,146644,"Sweet potato industry; authorize issuance of bonds to provide funds for disaster assistance loan guaranty program."
HB1682,146645,"Bonds; authorize issuance to provide funds for upgrades to State Tax Commission information technology systems."
HB1683,146646,"Rental equipment; tax rental equipment and distribute revenue to local governments and exempt from ad valorem taxation."
HB1684,146647,"Sales tax; impose a tax on sales of machinery and construction services at certain refineries."
HB1685,146648,"Jackson County; authorize use of forfeiture funds to pay clothing allowance for undercover agents of Narcotics Task Force."
HB1686,146649,"City of Natchez and Adams County; authorize to contribute certain funds to Natchez, Inc."
HB1687,146650,"Hinds County; may establish Hinds County Economic Development Authority and abolish Hinds County Economic Development district."
HB1688,146651,"Bonds; authorize issuance for state highway and county road and bridge improvements."
HB1689,146652,"Economic development; authorize certain tax exemptions for certain clean energy and aerospace industry business enterprises."
HB1690,146653,"Housing Loan Assistance Pilot Program; create."
HB1691,146654,"Sales tax; levy additional one cent on soft drinks."
HB1692,146655,"Sales tax; exempt retail sales of fruits and vegetables."
HB1693,146656,"Sales tax; exempt certain retail sales made as part of toy collection campaign under U.S. Marine Corps Toys for Tots Program."
HB1694,146657,"Income tax; authorize a job credit for employers that hire certain unemployed persons."
HB1695,146658,"Bonds; authorize issuance for repair of bridges in Alcorn and Tishomingo Counties."
HB1696,146659,"Lauderdale County; authorize donation of certain real property to Northeast Volunteer Fire and Rescue, Inc."
HB1697,146660,"Homestead exemption; increase for totally disabled veterans."
HB1698,146661,"Mississippi Industry Incentive Financing Revolving Fund; create and authorize issuance of bonds to provide funds for."
HB1699,146662,"Suffrage; restore to Pamela Davis of Forrest County."
HB1700,146663,"Economic development; authorize certain tax exemptions and loans and grants for certain business enterprises."
HB1701,146664,"Bonds and economic development; authorize bonds for various purposes and provide/revise certain incentives."
HB1702,146665,"City of Fulton; authorize a tax on hotels and motels."
HB1703,146666,"Income tax; authorize establishment of catastrophe savings accounts and exempt contributions and distributions from tax."
HB1704,146667,"Income tax; authorize an adjustment to gross income for employers that hire certain unemployed persons."
HB1705,146668,"Bonds; authorize issuance to provide funds for improvements to state parks."
HB1706,146669,"Suffrage; restore to Richard Deon Williams of Greene County."
HB1707,146670,"Suffrage; restore to Jimmy Williams of Union County."
HB1708,146671,"Suffrage; restore to Ira J. Banks of Amite County."
HB1709,146672,"Suffrage; restore to Willie E. White of Amite County."
HB1710,146673,"Suffrage; restore to Mary H. Gregory of Winston County."
HB1711,146674,"Suffrage; restore to Richard Fulton Carson of Itawamba County."
HB1712,146675,"Income tax; increase personal exemption and dependent exemption for married persons living together."
HB1713,146676,"Cigarettes; impose tax on those manufactured for sale or distribution outside of this state."
HB1714,146677,"Rental equipment; tax rental equipment and distribute revenue to local governments and exempt from ad valorem taxation."
HB1715,146678,"Mississippi Development Bank; authorize DEQ and State Department of Health to borrow for loan programs."
HB1716,146679,"Income tax; allow credit for owner of lands dedicated to certain public or wildlife use."
HB1717,146680,"Income tax; provide investment tax credit for facilities producing renewable energy from biomass."
HB1718,146681,"Employment Security; revise unemployment for rates to make payment of the tax more equitable."
HB1719,146682,"Mississippi Small Business Investment Company Act; create."
HB1720,146683,"Bonds; authorize issuance to provide funds for improvements to state parks."
HB1721,146684,"Bonds; increase amount authorized for loans to develop the Farish Street Historic District, clarify use of loan proceeds."
HB1722,146685,"Tallahatchie County; authorize to name a family master for chancery court."
HB1723,146686,"Town of Como; authorize to impose certain sales tax on hotel rooms and restaurants."
HB1724,146687,"Forrest County; authorize contributions to various organizations."
HB1725,146688,"Oktibbeha County; authorize contribution to Institute of Community Services, Inc., for purchase of school bus."
HB1726,146689,"City of Ridgeland; authorize to impose local sales tax."
HB1727,146690,"Oktibbeha County; increase authorized debt limit for certain bonds."
HB1728,146691,"Harrison County; create Civil Service Commission for the Harrison County Sheriff's Department."
HB1729,146692,"Hancock County; authorize to levy a certain lien related to car tags for unpaid water and sewer bills."
HB1730,146693,"Bolivar County; authorize certain chancellor to appoint special master and family master for."
HB1731,146694,"City of Bay St. Louis; authorize two-year waiver for required state audit due to effects of Hurricane Katrina."
HB1732,146695,"Warren County; authorize to contribute funds to certain organizations."
HB1733,146696,"Hancock County Tourism Development Bureau; extend repealer."
HB1734,146697,"George County; authorize to issue bonds and levy tax for county sports and recreation complex."
HB1735,146698,"Three Rivers PDD; authorize certain counties and municipalities to apply for loans and grants made available by."
HB1736,146699,"Humphreys County; authorize to contribute funds to Humphreys County Dixie Youth Little League."
HB1737,146700,"Harrison County; authorize to create the ""Harrison County Motor Vehicle for Hire Commission."""
HB1738,146701,"City of Southaven; authorize to impose certain tax on restaurants to provide funding for promotion of tourism and conventions."
HB1739,146702,"City of Vicksburg; authorize to contribute funds and in-kind maintenance services to Beulah Cemetery."
HB1740,146703,"Suffrage; restore to Leon Bishop of Oktibbeha, County."
HB1741,146704,"Attala County; authorize to construct jail anywhere in the county."
HB1742,146705,"City of Jackson; delete repeal date on Jackson Convention and Visitors Bureau and expand authority of bureau to contract."
HB1743,146706,"Lauderdale County; authorize board of supervisors to negotiate apportionment of certain fee in lieu of tax revenues."
HB1744,146707,"City of McComb; authorize to impose a tourism tax to promote economic development."
HB1745,146708,"City of Fayette; authorize to impose a certain local sales tax."
HB1746,146709,"Claiborne County; authorize economic development district to expend certain funds for certain economic and industrial development."
HB1747,146710,"Town of Glendora; authorize to designate as a qualified resort area."
HB1748,146711,"City of D'Iberville; authorize to acquire and lease certain real property for economic and commercial development purposes."
HB1749,146712,"City of Biloxi; authorize to clean certain property and assess costs and penalties to landowner for such cleaning."
HB1750,146713,"Hinds County; authorize to pay PERS employer contributions on net fee income of constables."
HB1751,146714,"Harrison County; authorize board of supervisors to enter into certain contracts to promote tourism."
HB1752,146715,"City of Southaven; authorize to contract with AWG, Inc., for certain road improvements."
HB1753,146716,"Adams County; prohibit certain actions of St. Catherine Creek Utility Authority."
HB1754,146717,"Hattiesburg Public School District; authorize release of certain funds to Hattiesburg Public Schools Foundation."
HB1755,146718,"Unemployment eligibility; revise definition of base period."
HB1756,146719,"Employment Security Commission; reenact and extend date of repeal."
HB1757,146720,"Employment Security Commission; bring forward sections regarding."
HB1758,146721,"Expunction of certain criminal offenses; provide for filing fee."
HB1759,146722,"""Old School for the Blind"" Property; authorize Department of Finance and Administration to sell and convey or lease."
HR1,146871,"Crime and corrections; create House study committee to study and make recommendations."
HR2,146872,"Mrs. Jessie Polly Beverly; commend and congratulate on occasion of 100th birthday."
HR3,146873,"Myrtis Barnes Magee; commend life, legacy and memory upon her passing."
HR4,146874,"Mississippi businesses; urge to implement ergonomic practices to protect the health of the state's workforce."
HR5,146875,"House Rules; amend to allow member to request that conference report be read in full before vote on adoption."
HR6,146876,"Claire Walley; commend and congratulate upon being crowned 2009 Mississippi Miss Hospitality."
HR7,146877,"Worker's Bill of Rights; endorse adoption of."
HR8,146878,"Anna Tadlock; commend accomplishments as Miss Mississippi 2009."
HR9,146879,"House Rules; amend to limit additional compensation or allowance that may be paid to Speaker Pro Tempore."
HR10,146880,"House Rules; member may serve as Speaker for only two terms."
HR11,146881,"House Rules; amend to require approval of majority of House before employment of certain officers and employees."
HR12,146882,"Florida visitors; welcome to the State of Mississippi upon their first visit to the state."
HR13,146883,"McComb High School Girls Track Team; commend and congratulate."
HR14,146884,"Jackie Eaton Coleman; commend life and legacy and express sympathy upon her passing."
HR15,146885,"Brookhaven Academy Football Team; commend on 2009 Class AA State Title."
HR16,146886,"Mrs. Tensye Lee McCree; commend life and legacy of."
HR17,146887,"Mr. Andre' L. Curry; commend dedicated service to MVSU upon the occasion of his retirement."
HR18,146888,"Bennie L. Rayford, Sr.; commend life and legacy upon his passing."
HR19,146889,"April 20, 2010; designate as ""Mississippi Earth Day: The Green Generation."""
HR20,146890,"Columbia Academy Cross Country Team; commend on winning three consecutive MAIS Class AA State Championships."
HR21,146891,"Brenda F. Mitchell; commend upon gubernatorial appointment as District Attorney of the 11th Circuit Court District."
HR22,146892,"Mrs. Pauline Matthews; commend and congratulate on the occasion of her 100th birthday."
HR23,146893,"Dr. Charles A. Sisson, Jr.; commend merited and dedicated service at Gilmore Memorial Hospital."
HR24,146894,"Pierson Waring and Wesley Aldridge; commend as outstanding student athletes on the observance of The Spirit of America Day XXXX."
HR25,146895,"Morton Police Dept.; commend its exemplary efforts to serve and protect and recognize upon major seizure of suspected drug money."
HR26,146896,"Mrs. Zula Criddle Warnick; commend on celebration of her 104th birthday."
HR27,146897,"John H. Outlaw, Sr.; commend distinguished career and meritorious service to the City of Starkville upon his retirement."
