bill_number,bill_id,title
HB767,145730,"Radar; authorize sheriff and deputy sheriffs to use on county roads to enforce speed limits."
HB768,145731,"Administrative Office of Courts; may disclose to DPS certain information concerning children that is stored in office's data system."
HB769,145732,"Domestic violence; revise assault as an offense."
HB770,145733,"Ad valorem taxes; school district not required to advertise revenue increase when district proposes no millage increase."
HB771,145734,"Public benefits; deny to any person not lawfully present in the United States."
HB772,145735,"Homestead exemption; increase for totally disabled veterans and extend to unremarried surviving spouses of such veterans."
HB773,145736,"Blood tests; authorize EMTs to administer under Implied Consent Law."
HB774,145737,"Regional correctional facility; authorize Department of Corrections to contract with DeSoto County for."
HB775,145738,"Income tax; authorize adjustment to gross income for physician providing services for which no compensation is received."
HB776,145739,"Counties; expand types of drainage structures may incur costs for."
HB777,145740,"Ad valorem taxes; revise advertising requirements when school district proposes no millage increase."
HB778,145741,"Retirement; first responders who served in coast counties during Hurricane Katrina shall receive extra PERS credit."
HB779,145742,"Driver's licenses; authorize public school driver's education instructors to conduct driving tests in lieu of license examiner."
HB780,145743,"Dialysis treatment; require facilities providing to maintain backup power supply for dialysis machines."
HB781,145744,"Nursing education; unspent TANF funds may be spent to pay expenses of persons enrolled as part of workforce training."
HB782,145745,"Child care facilities; require to call child's contact persons if child hasn't arrived within one hour of normal times."
HB783,145746,"Food unsafe for human consumption; authorize State Health Officer to prohibit sale of in this state."
HB784,145747,"Healthcare Coordinating Council; require to make report on specific health goals for the state."
HB785,145748,"Health screening; require annually for Medicaid, CHIP &amp; State Health Plan recipients &amp; participants."
HB786,145749,"Children's Health Insurance Program; transfer administration to Division of Medicaid."
HB787,145750,"Sickle cell disease; create task force to study growing incidence and available treatment options."
HB788,145751,"Public school students; authorize community service as an alternative to suspension or expulsion."
HB789,145752,"Health Disparities Council; create."
HB790,145753,"Medical records; persons seeking disability benefits may obtain at no charge until final determination of disability."
HB791,145754,"Mental Health, Dept. of; not less than 40% of funds appropriated to must be expended on children."
HB792,145755,"MS Highways 24 and 33; designate certain segments of."
HB793,145756,"Judges; provide additional chancellor for the Fourth Chancery Court District."
HB794,145757,"All-terrain vehicles; establish ownership registration network and provide free safety course."
HB795,145758,"CON; issue for add'l ICF-MR beds at community living program for developmentally disabled adults in Madison County."
HB796,145759,"Retirement; earned compensation of judges of the Supreme Court and Court of Appeals includes all remuneration except mileage."
HB797,145760,"Driver's license; provide that retired law enforcement officer may be identified by distinctive symbol, character or endorsement."
HB798,145761,"Tax sales; require actual notice to owner and any mortgagee, beneficiary or lienholder of record before pending tax sale."
HB799,145762,"Crimes; revise crime of animal cruelty and exempt certain activities from constituting the crime."
HB800,145763,"Appellate judges; provide for appointed judges of Supreme Court and Court of Appeals."
HB801,145764,"Concealed weapons; allow persons with license to carry anywhere except into secure facilities."
HB802,145765,"Public funds; prohibit investment in countries sponsoring terrorism."
HB803,145766,"MAEP; define ""at-risk pupil"" and include a child diagnosed with an autism spectrum disorder in the definition."
HB804,145767,"School social workers and psychologists; authorize districts to employ and receive partial state reimbursement for salaries."
HB805,145768,"Mississippi Skill Standards Board; create as advisory board on industry standards."
HB806,145769,"Life jackets; increase maximum age of persons required to wear on certain vessels."
HB807,145770,"Identity theft; establish procedure for victim to have debt forgiven and credit reports purged."
HB808,145771,"Health insurance policies; require coverage for certain obesity treatments."
HB809,145772,"State employees with certain licenses; require to be paid same as other state employees with license if certain skills used."
HB810,145773,"Juneteenth Freedom Day; designate as day of commemoration, not legal holiday."
HB811,145774,"CON; shall not be extended more than one time and shall not be valid after 18 months."
HB812,145775,"Contributing to the neglect or delinquency of a child and abuse of a child; revise penalties for."
HB813,145776,"Crimes; create offense regarding throwing objects from an overpass and striking a motor vehicle."
HB814,145777,"CON; issue for nursing home in Holmes County."
HB815,145778,"Motorcycles; create Safety and Operator Training Program."
HB816,145779,"Family masters; clarify chancellors' authority in Seventh Chancery Court District."
HB817,145780,"Pharmacists; require to notify primary care physicians of persons to whom they give injections."
HB818,145781,"Retirement; authorize surviving spouses of PERS members to choose different spouse annuity."
HB819,145782,"All-terrain vehicles; provide penalty for driving on public highways, roads or streets."
HB820,145783,"Recreational vehicles; require repurchase of inventory by manufacturer when dealer ceases to be a dealer."
HB821,145784,"Gasoline excise tax; increase and use additional revenues for city, county and state highways purposes."
HB822,145785,"Local System Bridge Replacement and Rehabilitation Fund; authorize issuance of general obligation bonds to provide funds for."
HB823,145786,"Law enforcement officers and fire fighters; increase death and disability benefits under trust funds."
HB824,145787,"Jails; remove requirement that county jails be built in the county seats."
HB825,145788,"Small business health insurance pool; create."
HB826,145789,"District attorneys; provide additional assistant for the Twelfth Circuit Court District."
HB827,145790,"Uninsured motorist coverage; provide that coverage is mandatory in every automobile liability insurance policy."
HB828,145791,"Motor vehicle liability insurance policy; require to include medical payment coverage."
HB829,145792,"Uninsured motorist coverage; policyholder must reject knowingly in writing in order to decline coverage."
HB830,145793,"Workers' compensation; prohibit discharge of employee filing claim in good faith."
HB831,145794,"Workers' compensation; increase benefits for serious facial or head disfigurement."
HB832,145795,"Workers' compensation; provide for appeal of commission decisions directly to Court of Appeals."
HB833,145796,"Civil Rights Division; establish in the Office of Attorney General."
HB834,145797,"Workers' compensation; require emergency hearing upon request of either party."
HB835,145798,"Circuit Court Community Corrections Act of 2010; create."
HB836,145799,"Small Municipalities and Limited Population Counties Fund; authorize issuance of bonds for."
HB837,145800,"Sex education; require local school board to adopt a policy to implement abstinence-only or abstinence-plus education into curriculum."
HB838,145801,"Driver's lic.; allow persons whose parent has a disability or is a farmer to obtain intermediate after holding a permit 6 months."
HB839,145802,"Registered Interior Designer Registration Act; create."
HB840,145803,"Sales under execution; reduce time period during which those sales may be held."
HB841,145804,"Municipal utility districts, certain; place under jurisdiction of the Public Service Commission."
HB842,145805,"Mississippi Development Authority; require to conduct review of infrastructures in counties with high rates of poverty."
HB843,145806,"Elections; require electors to present certain types of identification before being allowed to vote."
HB844,145807,"Real estate; allow covenants to prohibit sale or lease of property to registered sex offenders."
HB845,145808,"Public benefits; agencies administering programs for must verify lawful presence in U.S. of applicants for."
HB846,145809,"Counties; authorize board of supervisors to employ attorney as full-time county employee."
HB847,145810,"Radar; sheriff may use in counties over 70,000 and impose additional state assessment for violations when radar used."
HB848,145811,"Radar; Pearl River Valley Water Supply District may use."
HB849,145812,"Liability insurance for certain vessels; require and provide for uninsured vessel coverage."
HB850,145813,"Marijuana; conform possession, possession in a motor vehicle."
HB851,145814,"Motor vehicle liability insurance; require insurers to notify Department of Public Safety in event of lapse."
HB852,145815,"Crime Victim Compensation; increase by 50%."
HB853,145816,"Early Voting Act; create."
HB854,145817,"CON; authorize transfer of nursing home beds from Hancock County and new nursing home beds in Lamar County."
HB855,145818,"Weapons; allow coroners to carry."
HB856,145819,"Sidearm; allow district attorneys and certain staff to retain upon retirement."
HB857,145820,"""Truth in Grading Act""; create to require school district to adopt a uniform grading policy."
HB858,145821,"DUI; create offense of child endangerment."
HB859,145822,"Distinctive license tag; reauthorize issuance to members of Civitan International."
HB860,145823,"""Truth in Grading Act""; create to require the State Board of Education to adopt a uniform grading policy for the state."
HB861,145824,"CON; issue for nursing home in Jones County."
HB862,145825,"Seat belt; allow for failure to provide and use to be considered as a factor in determining comparative negligence."
HB863,145826,"Income tax; authorize a credit for first-time homebuyers of principal residence."
HB864,145827,"Tort Claims Act; clarify statute of limitations."
HB865,145828,"Medical malpractice actions; revise certificate of consultation."
HB866,145829,"Income tax; provide a credit for taxpayers allowed to claim federal earned income tax credit."
HB867,145830,"Sickle Cell Disease; create task force to study growing incidence and available treatment options."
HB868,145831,"Sales tax; exempt sales of tangible personal property and services to Edwards Street Fellowship Center."
HB869,145832,"Bonds; authorize issuance for repair and renovation of certain state facilities."
HB870,145833,"Bonds; increase amount authorized to be issued for the Mississippi Museum of Art."
HB871,145834,"Alternative diploma/curriculum track for career-technical course of study; require State Department of Education to implement for students interested in."
HB872,145835,"Caller ID Anti-Spoofing Act; create."
HB873,145836,"DUI; revise use of ignition interlock device."
HB874,145837,"Child abuse; provide penalties for false reports and enact child protection measures."
HB875,145838,"Covenant marriage; enact as form of marriage."
HB876,145839,"State officers and agencies; authorize to appoint or employ special counsel."
HB877,145840,"Driver's license; allow translation of birth certificate of foreign-born applicant to be translated by college or university."
HB878,145841,"Stay of execution in civil actions; establish appeal bond requirements."
HB879,145842,"Headlights; require to be used whenever windshield wipers necessitated."
HB880,145843,"State employees raises; require agencies and colleges to comply strictly with legislative direction."
HB881,145844,"Owners of nonproducing mineral estates and certain leasehold interests; require to pay certain portion of property taxes."
HB882,145845,"Municipalities; revise laws related to cleaning private property."
HB883,145846,"State budget; require budget requests and appropriations to be based on zero-based budgeting principles once every four years."
HB884,145847,"Local emergency; authorize a mayor of a municipality to proclaim, if necessary."
HB885,145848,"DUI; create child endangerment provision."
HB886,145849,"Fee for future conveyance of property; prohibit payment of certain."
HB887,145850,"Architects; clarify qualifications for nonresident."
HB888,145851,"State Board of Architecture; clarify liability for legal costs."
HB889,145852,"Suffrage; prescribe conditions for reinstatement."
HB890,145853,"Expert testimony from crime lab; allow to be taken by video means."
HB891,145854,"Sales tax; increase diversion to municipalities."
HB892,145855,"Anatomical gift; Department of Public Safety to indicate donor status on license or ID card."
HB893,145856,"Elections; require voter ID."
HB894,145857,"Mississippi Eminent Scholars Program; eliminate GPA requirement for eligibility."
HB895,145858,"Transient vender law; require exempt persons to notify political subdivisions when transacting business."
HB896,145859,"Driver's license; require passage of vision screening exam upon renewal."
HB897,145860,"Motorcycles; create safety and operator training program."
HB898,145861,"Pawnbrokers; require prelicensing and continuing education."
HB899,145862,"Youth court; revise age that a child may be subject to a transfer proceeding."
HB900,145863,"Bail bonds and agents; revise certain licensing provisions."
HB901,145864,"Bail; revise certain bond and forfeiture provisions."
HB902,145865,"Public contracts; require review of certain change orders by the Board of Contractors."
HB903,145866,"Litter bag; require operator of motor vehicle to have when on public roads, streets or highways."
HB904,145867,"Special assessment, certain; require tax collector to pay to board of supervisors when property is sold at a tax sale."
HB905,145868,"Legislative qualifying petitions; file all with State Board of Election Commissioners."
HB906,145869,"Chancery clerks; revise monies to be included within salary limitation."
HB907,145870,"Workers' compensation; provide employer the right to require autopsy in death cases."
HB908,145871,"Workers' compensation; increase benefits for disfigurement, vocational rehab and death, allow employer to request autopsy."
HB909,145872,"Mississippi University for Women; authorize IHL to change its name."
HB910,145873,"Ad valorem taxation; exempt pollution control equipment mandated by federal or state law."
HB911,145874,"Motor vehicle privilege tax law; require persons claiming homestead exemption to register at least one vehicle at homestead location."
HB912,145875,"Radar; authorize sheriffs in certain counties to use."
HB913,145876,"I.B. Diploma Program; require IHL to grant minimum credit to certain graduates of."
HB914,145877,"County Prosecuting Attorney; revise salary of certain."
HB915,145878,"Justice court judges; exempt sitting judges from certain educational requirements."
HB916,145879,"Lobbyist; may not give anything of value to any official unless certain action taken."
HB917,145880,"Counties; authorize to dig graves and bury livestock without need for epidemic or contagious disease."
HB918,145881,"Eminent domain; restrict to direct public use."
HB919,145882,"Early Voting Act; authorize voting before election day."
HB920,145883,"Public property; convey tract of Columbia Training School to Marion County Board of Supervisors and economic development district."
HB921,145884,"Controlled substances; add certain drugs to Schedules II &amp; V."
HB922,145885,"CON law; revise various provisions of."
HB923,145886,"CON; include CT-PET services in those new health services requiring CON review."
HB924,145887,"Motor vehicle liability insurance; require insurers to notify Department of Public Safety in event of lapse."
HB925,145888,"Veterans' Day; may not declare other holiday in lieu of, and require schools to observe as holiday."
HB926,145889,"Public utilities; create ""Mississippi Agricultural and Forestry Industries Renewable Energy Development Act of 2010."""
HB927,145890,"District attorneys; revise funding source for legal assistants and criminal investigators."
HB928,145891,"Red deer processing plants; exempt from payment of state inspection fee."
HB929,145892,"Appellate judges; provide for appointed judges of Supreme Court and Court of Appeals."
HB930,145893,"Noncitizen's driver's license; revise requirements for."
HB931,145894,"Motor vehicle inspection fees; increase."
HB932,145895,"Emergency telephone call; authorize release to Mississippi Ethics Commission under certain conditions."
HB933,145896,"Mental health; prohibit expenditure of state funds for adult services except for those adults with certain diagnoses."
HB934,145897,"Uninsured motorist coverage; provide that limits will be equal to liability coverage unless insured selects otherwise."
HB935,145898,"Public Service Commission; may transfer portion of certificated area to adjacent utility upon certain findings."
HB936,145899,"Temporary license tag; authorize for certain period of time upon request."
HB937,145900,"Motor vehicles; allow Highway Safety Patrol to remove vehicles disabled by crash and to allow Highway Safety Patrol to direct traffic."
HB938,145901,"Public purchasing laws; exempt purchases made by local governments from federal government contracts."
HB939,145902,"English language; require state agencies and political subdivisions to offer all services and material only in."
HB940,145903,"National Popular Vote; authorize Mississippi to enter an agreement among the states to elect President by."
HB941,145904,"Mississippi Health Information Network Act; create."
HB942,145905,"Public swimming pools; require owners to post signs to contact Health Department for concerns about sanitation or safety of."
HB943,145906,"Crimes; clarify criminal offense of cruelty to dogs or cats."
HB944,145907,"Mental Health; amend certain provisions of the FY2010 appropriation to the department."
HB945,145908,"Contractors, remodelers and rebuilders; revise certain provisions and licensing requirements."
HB946,145909,"State Fire Academy; require cities and counties performing fire training on personnel outside jurisdiction to coordinate with."
HB947,145910,"Marriage and family therapists; allow to provide same services performed by social workers if within their scope of practice."
HB948,145911,"Personal care homes; delete limitation on number of certain persons allowed to continue residing in."
HB949,145912,"Personal care homes; revise certain licensure provisions for."
HB950,145913,"Asthma; require all school districts to take certain actions relating to children with."
HB951,145914,"MS ""French Merci Train"" Boxcar; authorize and direct Dept. of Archives and History to secure, restore, preserve and maintain."
HB952,145915,"Death certificates; require funeral establishments and crematories to send to county clerk of previous residence."
HB953,145916,"Gaming; courses related to being employed in industry may be taught at certain state universities and colleges."
HB954,145917,"Nurse; require to be present in operating or invasive procedure room for duration of operative or invasive procedure."
HB955,145918,"Builders and contractors; revise license and penalty provisions, establish Home Improvement Guaranty Fund and revise board."
HB956,145919,"Institutions for aged or infirm; authorize Health Department to remove residents from facility under certain circumstances."
HB957,145920,"PERS retirees; may not work for PERS employer until 90 day after retirement."
HB958,145921,"Department of Agriculture; provide for charging of fees for certain licenses and certifications."
HB959,145922,"State jet; require sale of."
HB960,145923,"Driver's license; make optional to have four-year or eight-year license."
HB961,145924,"Department of Agriculture; increase annual fee for pesticide registration with."
HB962,145925,"Highway Patrol officers; allow to be employed after retirement under certain circumstances."
HB963,145926,"Net metering and clean energy bonds; create study committee for purpose of making recommendations regarding."
HB964,145927,"Public venues for youth sporting events; prohibit smoking at."
HB965,145928,"Mental Health; amend certain provisions of the FY2010 appropriation to the department."
HB966,145929,"Public servants; extend time limit on prohibited actions and activities as a lobbyist."
HB967,145930,"Tourism; create statewide Mississippi Civil Rights Trail."
HB968,145931,"Gaming; regulated schools and training institutions may accept nonresidents as students."
HB969,145932,"Public utilities; limit inspections, audits and examinations strictly to the Public Utilities Staff."
HB970,145933,"Medicaid; require implementation of an APR-DRG reimbursement system for inpatient service."
HB971,145934,"Gaming; regulate sales of chances as a lottery and prohibit."
HB972,145935,"Public purchasing; define ""construction project"" and prescribe conditions for certain contracts."
HB973,145936,"Wireless telephones; prohibit use of while driving without use of hands-free device."
HB974,145937,"Medicaid; marriage and family therapist services shall be reimbursable under."
HB975,145938,"Medicaid; bring forward sections of Medicaid law for purposes of amendment."
HB976,145939,"Crimes; revise defacing, removing or destroying signs."
HB977,145940,"Public property; authorize sale of certain properties by MUW and USM."
HB978,145941,"Hospitals; require to publish any discounts provided to health insurers."
HB979,145942,"Elected officials; allow PERS retirees to receive retirement allowance while holding office as."
HB980,145943,"Security freeze; delete requirement for law enforcement report of unlawful information used to place freeze."
HB981,145944,"Preneed casket contracts; must meet all requirements applicable to preneed contracts for funeral services."
HB982,145945,"Banks; prohibit from charging fee for cashing check drawn on that bank."
HB983,145946,"Drug dealers; require registration of convicted."
HB984,145947,"Concealed weapons; allow certain elderly persons to carry."
HB985,145948,"Medical examiners; may pronounce deaths of persons in Louisiana and file death certificates with Health Department."
HB986,145949,"State Board of Dental Examiners; authorize to regulate individuals or businesses who sell metallic coverings for human teeth."
HB987,145950,"Gaming; sale of certain scratch-off cards is illegal gambling activity."
HB988,145951,"Sex offender propensity; chancery court may order custody in mental health facility."
HB989,145952,"Weapons; return to owner after dismissal, acquittal of charges."
HB990,145953,"Arbitration clause; considered nonbinding in certain contracts."
HB991,145954,"District attorneys; additional assistants and investigators for Seventh Circuit Court District."
HB992,145955,"Voter registration; authorize mail-in applications to be distributed in polling places."
HB993,145956,"Partition sale; right of first refusal for family members and co-owners."
HB994,145957,"Contracts; require to be written in large print."
HB995,145958,"Food unsafe for human consumption; authorize State Health Officer to prohibit sale of in this state."
HB996,145959,"Marriage license; previously married applicant must provide certified copy of divorce or annulment."
HB997,145960,"School sports; require school districts to adopt policies regulating outdoor practices during high temperatures."
HB998,145961,"Children; prohibit from working certain hours."
HB999,145962,"Candidates; allow to inspect voting machines and devices at least three days before an election."
HB1000,145963,"Public utility workers; require to present identification before performing duties if requested to do so by property owners."
HB1001,145964,"Employee Fair Solicitation Act; create."
HB1002,145965,"Water, sewer, garbage disposal and fire protection districts; authorize penalties for violations of regulations created by."
HB1003,145966,"Headlights; require to be used whenever windshield wipers necessitated."
HB1004,145967,"Jury duty; exempt permanently disabled from service."
HB1005,145968,"""Comprehensive Election Reform Act of 2010""; create."
HB1006,145969,"Criminal records; require permanent storage."
HB1007,145970,"Liability; create duty of train crew to look out for persons and property on railroad tracks."
HB1008,145971,"Unfair ins. practices; prohibit requirement of mandatory electronic funds tranfers for certain payment, as condition to acquiring."
HB1009,145972,"Real Estate Appraisers Licensing and Certification Act; revise to place appraisal management companies under the authority of."
HB1010,145973,"Liquefied petroleum gas; allow only owner to fill container."
HB1011,145974,"Budget; State Fiscal Officer shall not reduce budget of Mississippi Gaming Commission."
HB1012,145975,"Title to mineral estate; allow to revert to surface estate owner after a ten-year period."
HB1013,145976,"Mississippi State Penitentiary; require offenders convicted of certain crimes to be housed at."
HB1014,145977,"Voter identification; require for all except certain older electors."
HB1015,145978,"CON; psychiatric residential treatment facility beds in Meridian, Flowood &amp; Louisville &amp; child/adolescent psychiatric beds in Meridian."
HB1016,145979,"Child care facilities; require to call child's contact person if child hasn't arrived within one hour of usual time."
HB1017,145980,"School start date; prohibit schools from opening before Labor Day."
HB1018,145981,"Executive agency personnel; remove from certain State Personnel Board procedures."
