bill_number,bill_id,title
HB1,144964,"Income tax; authorize job tax credit for cut and sew jobs in the upholstered household furniture manufacturing industry."
HB2,144965,"Mississippi Optional Sales Tax Act; enact."
HB3,144966,"Assistant teachers; include under the Education Employment Procedures Law."
HB4,144967,"Sales tax; reduce rate on retail sales of motorcycles."
HB5,144968,"Sentences; provide that fines from failure to have insurance card in vehicle shall not be suspended."
HB6,144969,"All-terrain vehicles; establish ownership registration network for."
HB7,144970,"Traffic-control devices; placement that placement of shall be based on factors relevant to public safety."
HB8,144971,"Homestead exemption; increase for totally disabled veterans."
HB9,144972,"Landfills; require to be a certain minimum distance from municipalities, schools, etc., unless written agreement from owner."
HB10,144973,"Income tax; exclude active duty military compensation received by a resident while stationed out of state."
HB11,144974,"Public records; delete authority of public agencies to collect certain fees."
HB12,144975,"Homestead exemption; exempt portion of increase in assessed value above assessed value for preceding year."
HB13,144976,"Handicapped parking; reserve spaces for ramp-equipped vans."
HB14,144977,"Budget; state budget requests, recommendations and appropriations shall be based on zero-based budgeting principles."
HB15,144978,"Jackson County; authorize pilot program for sheriff to use radar."
HB16,144979,"Do not call registry; include text messages."
HB17,144980,"Security freeze; delete requirement for law enforcement report of unlawful information used to place freeze."
HB18,144981,"Homestead exemption; increase."
HB19,144982,"Homestead exemption; increase."
HB20,144983,"Lawsuits; plaintiff liable for defendant's costs if defendant prevails."
HB21,144984,"Youth taken into custody by law enforcement, certain; require presence of parent before interrogation of youth occurs."
HB22,144985,"School district superintendents; appoint in all districts."
HB23,144986,"Mississippi Renewable Energy Development Act of 2010; create."
HB24,144987,"Income tax; exclude active duty military compensation received by a resident while stationed out of state."
HB25,144988,"Mississippi Highway 42; require MDOT to reconstruct a portion in Forrest and Perry Counties to four lanes."
HB26,144989,"Campaign contributions; restrict use by candidate for purposes unrelated to election campaign."
HB27,144990,"Lobbying; prohibit legislator from engaging in for four years after leaving office."
HB28,144991,"Indecent exposure; revise penalties."
HB29,144992,"School district employees; authorize voluntary dues deductions for membership in professional organizations."
HB30,144993,"Charter schools; create new process for establishing."
HB31,144994,"Assistant teachers; include under the Education Employment Procedures Law."
HB32,144995,"School nurses; require school districts to grant same leave allowances as allowed teachers."
HB33,144996,"Crimes; revise crime of animal cruelty and exempt certain activities from constituting the crime."
HB34,144997,"Crimes; revise prohibition against conducting certain animal fights."
HB35,144998,"Educator sexual misconduct; revise reporting requirements and criminal penalty for such with a student."
HB36,144999,"Mississippi Charter Public School Act; create."
HB37,145000,"Ad valorem tax; bring forward certain sections of law regarding assessment of property for purposes of."
HB38,145001,"Mississippi Civil Rights Museum; construct in Leflore County and place under jurisdiction of Department of Archives and History."
HB39,145002,"Mississippi Civil Rights Museum; create under Department of Archives and History and issue bonds to construct."
HB40,145003,"Appropriation; IHL for Special Task Force for Revitalization of the Mississippi Delta Region."
HB41,145004,"Mississippi Delta Region Revitalization Act of 2006; reenact sections repealed on July 1, 2009, and extend repealer."
HB42,145005,"Implied Consent Law; provide enhanced penalties for higher blood alcohol concentration."
HB43,145006,"Child endangerment; provide for DUI violations."
HB44,145007,"Bonds; increase amount of bonds authorized for a space, science and education center in Hancock County."
HB45,145008,"Life support system; state's official position for courts to follow is to sustain life if conflict between family members."
HB46,145009,"Sales tax; exempt sales of utilities to churches."
HB47,145010,"Health care providers; provide for a lien on certain third-party payment for services to patient or policyholder."
HB48,145011,"Health insurance; prohibit issuance of policy restricting insurer from assigning benefits to provider."
HB49,145012,"Workers' compensation; prohibit discharge of employee filing claim in good faith."
HB50,145013,"Tobacco use by minors; provide penalty for possession."
HB51,145014,"Eminent domain; restrict use of."
HB52,145015,"Annexed territory; prohibit municipality from levying ad valorem taxes until services are provided."
HB53,145016,"Automobile insurance; provide that payment of a total loss claim include payment for certain taxes and fees."
HB54,145017,"Smoke Free Air Act of 2010; enact."
HB55,145018,"Death penalty; revise written finding requirements by a jury to impose."
HB56,145019,"Write-in candidates; allow voter to write in the name of any individual on the ballot."
HB57,145020,"Income tax; partially exclude active duty military compensation received by nonresident while stationed in this state."
HB58,145021,"Fishing privileges; authorize reciprocity with adjacent states for persons 65 or older."
HB59,145022,"Sales tax; reduce on retail sales of certain food."
HB60,145023,"Crimes; create offense of using cell phone without hands-free accessories while driving."
HB61,145024,"DUI; revise minimum penalty for death and maiming."
HB62,145025,"School buses; increase maximum authorized speed limits."
HB63,145026,"Death penalty; provide moratorium for purposes of completing study on impact."
HB64,145027,"All-terrain vehicles; prohibit the operation of on public highways, roads and streets."
HB65,145028,"Death penalty; require notice of state's intention to seek or reject."
HB66,145029,"DUI; clarify no plea bargaining for repeat offenders."
HB67,145030,"Election commissioners; provide that they will be members of the Public Employees' Retirement System."
HB68,145031,"Medicaid; provide reimbursement for breast prosthesis and bra after cancer surgery."
HB69,145032,"Retirement; allow retired county/city elected officials to receive salary of up to 50% of average compensation."
HB70,145033,"Youth adjudicated to perform community service, certain; authorize judges to order parents to participate in the service."
HB71,145034,"Ad valorem tax; remove provisions that prescribe the manner of determining true value of affordable rental housing."
HB72,145035,"Internal audit law; remove condition for specific appropriations to fund, and delay implementation date."
HB73,145036,"Uniform laws; create uniform unclaimed property act."
HB74,145037,"Uniform laws; create uniform premarital agreement act."
HB75,145038,"Uniform laws; create uniform prudent management of institutional funds act."
HB76,145039,"Implied Consent Law; clarify who may administer blood tests."
HB77,145040,"Homeowners; remove any liability when contractor fails to pay subcontractor."
HB78,145041,"Motor vehicle; provide it is unlawful for person under age 18 to ride in portion not designed for passengers."
HB79,145042,"Homestead exemption; provide for certain owners of manufactured homes or mobile homes."
HB80,145043,"Task force to study and report on the funding and implementation of universal pre-kindergarten programs; create."
HB81,145044,"Rest areas, highway; provide that transportation commission shall adopt and enforce parking duration restrictions."
HB82,145045,"Mississippi Dairy Industry Stabilization Act; create."
HB83,145046,"Municipalities, certain; extend time to borrow funds from date of incorporation in anticipation of collection of ad valorem taxes."
HB84,145047,"Open Container Law; enact."
HB85,145048,"Child support; obligations begin at conception."
HB86,145049,"Lien; allow for hospitals against damages recovered by patient."
HB87,145050,"Independent candidates; require to file qualifying petition with the Secretary of State."
HB88,145051,"Universities and colleges; create task force to study graduation rates at."
HB89,145052,"Income tax refund checkoff; authorize for Mississippi Council for Economic Education."
HB90,145053,"Income tax; authorize a deduction for contributions to qualified tuition programs."
HB91,145054,"Budget; prohibit certain actions by state agencies during current and next fiscal years."
HB92,145055,"Elections for state officers; change day of week to Saturday."
HB93,145056,"Local planning commission members; revise the maximum per diem amount to the federal per diem rate."
HB94,145057,"Homestead exemption; increase."
HB95,145058,"Uniform laws; create uniform interstate deposition and discovery act."
HB96,145059,"Constables; authorize to be paid after diligent search and inquiry upon unsuccessful service of process."
HB97,145060,"Municipal annexation; require election on question of."
HB98,145061,"Open primaries; establish and abolish partisan primaries."
HB99,145062,"Automobile liability insurance; require Department of Public Safety to implement database program on uninsured motorists."
HB100,145063,"Mississippi Motor Vehicle Safety Inspection Law; repeal."
HB101,145064,"Bonds; mandate election on issuing county or municipal bonds."
HB102,145065,"Public Swimming Pool Act; create."
HB103,145066,"Lobbyists; prohibit agencies, universities and colleges from hiring contract lobbyists with public funds."
HB104,145067,"Distinctive license tag; authorize for Silver Star recipient, exempt from additional fee, privilege taxes and ad valorem taxes."
HB105,145068,"Radar; authorize sheriffs, deputies and constables to use on county roads to enforce speed limits."
HB106,145069,"Department of Archives and History; provide for appeals of board decisions."
HB107,145070,"Group property and workers' compensation insurance program; require DFA to establish for all school districts."
HB108,145071,"Workers' Compensation Commission; provide that appeals from commission go directly to Supreme Court."
HB109,145072,"Sales tax; exempt sales of tangible personal property and services to certain organizations providing food to needy persons."
HB110,145073,"Workers' compensation; reduce amount an employer may receive from third party for damages by employer's percentage of fault."
HB111,145074,"Four-lane highway program; add segments of Highways 7 and 8 to high priority list."
HB112,145075,"Gaming license fees; redistribute portion of state's share to local system road and bridge programs."
HB113,145076,"Open records; revise time period available to a public body for response and allowable costs."
HB114,145077,"Early voting pilot program; create in Alcorn County."
HB115,145078,"Medicaid; require participation in medical home concept and require obese persons to participate in online program on obesity."
HB116,145079,"Appropriation; Health Department for additional funds for Office of Health Disparity Elimination."
HB117,145080,"Health Disparities Council; create."
HB118,145081,"Nursing education; unspent TANF funds may be spent to pay expenses of persons enrolled as part of workforce training."
HB119,145082,"Body mass index (BMI); require schools to collect for certain students and provide to parents with an explanation."
HB120,145083,"Mental health; create pilot program in Hinds County for single point of entry for persons detained by law enforcement."
HB121,145084,"Mental health commitment laws; authorize certain trained law enforcement officers to hold mentally ill persons for treatment."
HB122,145085,"TANF recipients; authorize DHS to require recipients to submit to drug test to determine eligibility for benefits."
HB123,145086,"Child custody; active military duty not a change in circumstance."
HB124,145087,"Voter identification; require."
HB125,145088,"Elementary school counselors; allocate funds under the Mississippi Adequate Education Program for."
HB126,145089,"Task force to address the disparity of African-American males in the judicial system; create."
HB127,145090,"Pre-kindergarten program; require Department of Education to create ""ABC Program"" to provide instruction via Internet."
HB128,145091,"Appropriation; Recreational Facilities Activity Program Fund administered by the State Department of Education."
HB129,145092,"Healthcare Coordinating Council; require to make report on specific health goals for the state."
HB130,145093,"School curriculum; require students to receive additional instruction in healthy living."
HB131,145094,"School nutrition; require school districts to serve low-fat meals and snacks to students diagnosed as overweight."
HB132,145095,"Minority set-aside; revise qualifications of eligibility for obtaining purchasing contracts under."
HB133,145096,"Outdoor advertising; prohibit promoting or marketing alcoholic beverages, tobacco products and fast food in certain areas."
HB134,145097,"Random drug tests; require of all public school students in Grades 6 through 12."
HB135,145098,"Mississippi Save Our Children Act; create to require the implementation of certain programs in certain school districts."
HB136,145099,"Teacher scholarship; authorize for college graduates for costs of courses required for teacher licensure."
HB137,145100,"Appropriation; Health Department to provide funding to federally qualified health centers."
HB138,145101,"Early Voting Act; require voting systems only."
HB139,145102,"Crimes; create for using cell phone without hands-free accessories while driving."
HB140,145103,"Sex Education Pilot Program; State Boards of Education and Health to jointly establish for public schools."
HB141,145104,"Medicaid; art therapy services shall be reimbursable under."
HB142,145105,"School districts; require policies if accredited at the 3 lowest levels as defined by the State Bd. of Edu. and alternate curriculum."
HB143,145106,"Medicaid; provide for a database of electronic medical records of Medicaid recipients, with access by Medicaid providers."
HB144,145107,"Broadcasting stations; require certain stations to provide fair opportunity to all candidates when used for campaigns."
HB145,145108,"Health screening; require annually for Medicaid, CHIP and State Health Plan recipients and participants."
HB146,145109,"TANF and Medicaid; require teenage recipients of to participate in programs about birth control, abstinence and parenting."
HB147,145110,"Comprehensive sex education; require teaching of in Grades K-12."
HB148,145111,"Mississippi Comprehensive Communities of Color Teen Pregnancy Prevention Act of 2010; create."
HB149,145112,"Motivating Parents and Children (M.P.A.C.) pilot program; establish within the State Department of Education."
HB150,145113,"Social workers; provide in schools having high incidences of crime and via video conferencing means."
HB151,145114,"Sales tax; reduce rate on certain sales of recycling equipment to commercial recycling facilities."
HB152,145115,"Retirement; prohibit PERS from holding equity investments in companies with business ties in certain countries."
HB153,145116,"Left-hand lane traffic; require to move over when overtaken by vehicle traveling at higher rate of speed."
HB154,145117,"Retirement; compensation paid to special masters in chancery included as earned compensation for PERS purposes."
HB155,145118,"State Parole Board; require recommendation be made to Governor either in support or nonsupport of requested pardon."
HB156,145119,"Bicycles; prescribe certain rights and duties of bicyclist in traffic."
HB157,145120,"Uniform laws; create uniform international wills act."
HB158,145121,"Workers' compensation; allow interlocutory appeal to circuit court of commission's denial of employee's right to medical benefits."
HB159,145122,"Health insurance; require coverage for treatment of infertility in certain policies."
HB160,145123,"Crimes; revise expunction of certain convictions."
HB161,145124,"Delinquent, abused or neglected youth; require county or city where charge arose to pay cost of certain conveyance."
HB162,145125,"Public office; allow board of supervisors to close in the event of death of elected or appointed official."
HB163,145126,"Weapons; authorize certain prosecutors to carry."
HB164,145127,"Homestead exemption; increase for totally disabled veterans and extend to unremarried surviving spouses of such veterans."
HB165,145128,"Medicaid; extend repealer on coverage for certain services provided by dentists under."
HB166,145129,"Local Governments Capital Improvements Revolving Loan Fund; extend repealer on MDA's authority to use for certain expenses."
HB167,145130,"Child Death Review Panel; extend the date of the repealer on."
HB168,145131,"Emergency telephone service (911) and enhanced wireless emergency telephone service (E911); extend repealer on (RP)."
HB169,145132,"Medicaid; require testing of applicants and recipients for illegal drugs."
HB170,145133,"Strip clubs; authorize boards of supervisors to regulate."
HB171,145134,"Public hearing; require when Governor exercises power to grant a pardon for a felony crime."
HB172,145135,"Mississippi Debt Management Service Act; extend the date of the repealer on."
HB173,145136,"MS Windstorm Underwriting Assoc. Reinsur. Assistance Fund; extend repealer on req. that certain tax revenues be deposited into."
HB174,145137,"State employee parking arrangements; extend repealer on authority of DFA to contract for."
HB175,145138,"Income tax; exclude from gross income amounts received as national service educational awards from the National Service Trust."
HB176,145139,"Medical records; revise photocopying charges."
HB177,145140,"State Board of Public Accountancy; revise regulatory laws."
HB178,145141,"Public Swimming Pool Act; enact."
HB179,145142,"Voting machines special fund; extend repealer on provision requiring certain large counties to create."
HB180,145143,"Counties; expand jurisdictional authority and police powers."
HB181,145144,"Mississippi Telephone Solicitation Act; extend repealer on."
HB182,145145,"Housing Development Revolving Loan Fund; extend repealer on MDA's authority to use bond proceeds for."
HB183,145146,"Group purchasing programs by certain public hospitals and regional mental health centers; extend repealer on authority to create."
HB184,145147,"Income tax; extend repeal date on tax credit for certain charges incurred at ports for import of cargo."
HB185,145148,"Emergency telecommunications; extend repealer on training requirements/funding."
HB186,145149,"State Port Authority; extend repealer on authority to use design-build method of contracting."
HB187,145150,"Mississippi Tourism Advisory Board; extend repealer on."
HB188,145151,"Mississippi Catfish Marketing Law; extend the date of the repealer on."
HB189,145152,"MS Veterans Monument Commission; extend repealer on."
HB190,145153,"Interagency Coordinating Council for Children and Youth; extend repealer on."
HB191,145154,"Child support payments; extend repealer on statutes relating to modification and judgments for nonpayment of."
HB192,145155,"Bolivar County Regional Facility; extend repealer on drug and alcohol program."
HB193,145156,"Public water systems; extend repealer on requirement to maintain optimum corrosion inhibitor levels."
HB194,145157,"Contraband tobacco; extend repealer on authority of law enforcement officers to seize."
HB195,145158,"Chancery clerks; authorize to exclude certain identifying and confidential information from public records."
HB196,145159,"Fire protection districts; revise voting requirement of board of commissioners for reducing certain district boundaries."
HB197,145160,"Cities and counties; authorize to donate to court appointed special advocates."
HB198,145161,"Mississippi Auctioneers License Act; extend repealer on."
HB199,145162,"Burial lots; require cemeteries providing for compensation to make filing of with Secretary of State."
HB200,145163,"Public utilities; create ""Mississippi Renewable Energy Development Act of 2010."""
HB201,145164,"Crimes; create felony offense of child endangerment."
HB202,145165,"Motor vehicle inspection fees; increase."
HB203,145166,"Deer hunting; delete the repealer on commission's authority to allow baiting and to establish deer management zones."
HB204,145167,"Paddlefish; delete repealer on penalties for unlawful possession of."
HB205,145168,"State Board of Mental Health; extend repealer on mental health services and protocol for providers of."
HB206,145169,"Medical radiation technologists; extend repealer on registration of."
HB207,145170,"Family protection specialists and workers; extend repealers on duty of DHS to establish employment standards for."
HB208,145171,"Dialysis transportation program; extend repealer on the Division of Medicaid's duty to implement."
HB209,145172,"School districts and State Department of Education; extend automatic repealers on certain programs."
HB210,145173,"Physician assistants; extend repealer on authority to grant temporary licenses to."
HB211,145174,"State Department of Health and reconstituted State Board of Health; extend repealer on."
HB212,145175,"Advanced practice registered nurses; extend repealer on licensing provisions of."
HB213,145176,"State Board of Cosmetology; extend repealer on."
HB214,145177,"Distinctive license tag; authorize issuance for supporters of Amory High School."
HB215,145178,"Distinctive license tag; authorize issuance to supporters of Lake Cormorant High School."
HB216,145179,"School district graduation rates; require local districts to receive education credit for resident students obtaining GED."
HB217,145180,"Hunting; create spring squirrel hunting season."
HB218,145181,"Distinctive license tag; authorize issuance to supporters of the African American Heritage Rodeo Association."
HB219,145182,"Intensive supervision program; revise eligibility requirements for offenders who may participate in."
HB220,145183,"Bonds; authorize issuance to provide funds for the Mississippi Community Heritage Preservation Grant Fund."
HB221,145184,"Auto club memberships; extend repealer on authority of small loan licensees to sell to borrowers."
HB222,145185,"Bank accounts; require bank to provide certain information to and obtain written acknowledgement from account holder before adding other persons to."
HB223,145186,"MS S.A.F.E. Mortgage Licensing Act of 2009; extend repealer on."
HB224,145187,"Health discount plans; extend repealer on requirements for."
HB225,145188,"Unauthorized insurance agents; extend repealer on prohibition against paying commission to."
HB226,145189,"Chickasawhay Natural Gas District; delete repealer on statute creating board of directors for."
HB227,145190,"Petroleum Products Inspection Law of MS; extend repealer on definitions and specifications under."
HB228,145191,"Municipal annexation; require approval by majority of electors in territory to be annexed."
HB229,145192,"Department of Employment Security and Workforce Training and Education Laws; extend repealer on."
HB230,145193,"Circuit clerks; require to file sentencing orders within 3 days of receipt from judge."
HB231,145194,"Drinking water quality reports; revise public notification requirements."
HB232,145195,"Sale or distribution of novelty lighters; prohibit and provide criminal penalties for."
HB233,145196,"Health insurance; require coverage for domestic abuse injuries."
HB234,145197,"Forensic evidence; require review of certain cases."
HB235,145198,"Distinctive license tag; authorize for supporters of Mississippi College School of Law."
HB236,145199,"Sales tax; exempt sales of personal property and services to Mississippi affiliates of Habitat for Humanity International, Inc."
HB237,145200,"Bonds; authorize issuance to provide funds for upgrades to State Tax Commission information technology systems."
HB238,145201,"Alcoholic beverages; allow certain direct shipments of wine from out of state."
HB239,145202,"Trusty status; prohibit individual convicted of murder or capital murder from becoming eligible for."
HB240,145203,"Wine tasting; create special permit for package retailer to conduct."
HB241,145204,"Distinctive license tag; authorize issuance to the supporters of the Aberdeen Main Street Association."
HB242,145205,"Sales tax; exempt sales of firearms, ammunition and hunting supplies during Second Amendment Weekend Holiday."
HB243,145206,"Mississippi University for Women; change name of the university to Mississippi University for Women and Men."
HB244,145207,"Sales tax; exempt retail sales of hearing aids."
HB245,145208,"Income tax; provide credit for contributions to school tuition organizations or public schools."
HB246,145209,"Sales taxation; exempt Central Mississippi Prevention Service, Inc."
HB247,145210,"Distinctive license tag; authorize issuance to supporters of Lewisburg High School."
HB248,145211,"Appropriation; Department of Insurance for windstorm reinsurance expenses."
HB249,145212,"Distinctive license tags; authorize issuance to supporters of Center Hill High School."
HB250,145213,"State employees; may not be reemployed with same state entity for one year after termination from employment."
HB251,145214,"Motor vehicle dealers; prohibit from charging document preparation fees."
HB252,145215,"Crimes; make it unlawful for motor vehicle dealers to charge certain document-related fees."
HB253,145216,"Abortion; felony to transport minor to another state to receive without parental consent."
HB254,145217,"Contracts; prohibit use of automatic renewal clauses."
HB255,145218,"Justice court judges; increase jurisdiction amount to $10,000.00."
