bill_id,date,action
662161,2014-12-03,"Introduced and Adopted, Voice Vote; Senate Journal Organization Day "
662238,2014-12-03,"Introduced and Adopted, Voice Vote; Senate Journal Organization Day "
662314,2014-12-03,"Introduced and Adopted, Voice Vote; Senate Journal Organization Day "
662391,2014-12-03,"Introduced and Adopted, Voice Vote; Senate Journal Organization Day "
662466,2014-12-03,"Introduced and Adopted, Voice Vote; Senate Journal Organization Day "
665787,2015-01-07,"Introduced and Referred to Judiciary; Senate Journal 2  "
665787,2015-01-08,"Hearing: 1/13/15, Room 100, State House, 9:30 a.m.; Senate Calendar 5 "
665787,2015-02-04,"Committee Report: Ought to Pass, 2/12/15; Vote 5-0; Consent Calendar; Senate Calendar 9 "
665787,2015-02-12,"Ought to Pass: Motion Adopted, Voice Vote; OT3rdg; Senate Journal 5  "
665787,2015-03-04,"Introduced and Referred to Children and Family Law; House Journal  22, PG. 628 "
665787,2015-03-17,"Public Hearing: 3/24/2015 10:00 Amendment Legislative Office Building 204 "
665787,2015-04-01,"Executive Session: 4/7/2015 1:00 PM Legislative Office Building 206 "
665787,2015-04-08,"Committee Report: Ought to Pass for Apr 15 (Vote 12-0; Consent Calendar); House Calendar 29, PG. 1301 "
665787,2015-04-15,"Ought to Pass: Motion Adopted Voice Vote; House Journal  34, PG. 1534 "
665787,2015-04-29,"Enrolled Bill Amendment #2015-1433-EBA: Amendment Adopted Voice Vote; House Journal  36, PG. 1597 "
665787,2015-05-07,"Enrolled Bill Amendment #2015-1433e Adopted, Voice Vote, (In recess of 5/7/2015); Senate Journal 13 "
665787,2015-05-19,"Enrolled (in recess of 5/6/2015); House Journal  41, PG. 1781 "
665787,2015-05-19,"Enrolled (In recess 5/14/2015); Senate Journal 15 "
665787,2015-06-03,"Signed by the Governor on 06/02/15; Chapter 0075; Effective 01/01/2016 "
665988,2015-01-07,"Introduced and Referred to Judiciary; Senate Journal 2  "
665988,2015-01-08,"Hearing: 1/13/15, Room 100, State House, 9:00 a.m.; Senate Calendar 5 "
665988,2015-02-20,"Committee Report: Ought to Pass with Amendment #2015-0502s, 3/5/15; Vote 5-0; Consent Calendar; Senate Calendar 11 "
665988,2015-03-05,"Committee Amendment 0502s, Amendment Adopted, Voice Vote "
665988,2015-03-05,"Ought to Pass with Amendment 0502s, Motion Adopted, Voice Vote; OT3rdg; Senate Journal 7  "
665988,2015-03-11,"Introduced and Referred to Judiciary; House Journal  26, PG. 1274 "
665988,2015-03-24,"Public Hearing: 3/31/2015 2:30 PM Legislative Office Building 208 "
665988,2015-04-01,"Executive Session: 4/7/2015 10:00 Amendment Legislative Office Building 208 "
665988,2015-04-08,"Committee Report: Ought to Pass for Apr 15 (Vote 16-0; Consent Calendar); House Calendar 29, PG. 1305 "
665988,2015-04-15,"Ought to Pass: Motion Adopted Voice Vote; House Journal  34, PG. 1545 "
665988,2015-04-29,"Enrolled; House Journal  36, PG. 1597 "
665988,2015-04-29,"Enrolled (In recess 4/9/2015); Senate Journal 12 "
665988,2015-05-08,"Signed by the Governor on 05/05/2015; Chapter 0017; Effective 07/04/2015 "
666235,2015-01-07,"Introduced and Referred to Commerce and Consumer Affairs; House Journal  7, PG. 118 "
666235,2015-01-07,"Public Hearing: 1/14/2015 2:00 PM Legislative Office Building 302 "
666235,2015-01-20,"Subcommittee Work Session: 1/21/2015 9:00 Amendment Legislative Office Building 302 "
666235,2015-02-03,"Subcommittee Work Session: 2/5/2015 2:30 PM Legislative Office Building 302 "
666235,2015-02-20,"Executive Seesion: 3/3/2015 1:00 PM Legislative Office Building 302 "
666235,2015-03-03,"Retained in Committee "
666235,2015-09-01,"Retained Bill - Subcommittee Work Session: 9/8/2015 1:00 PM Legislative Office Building 302 "
666235,2015-09-29,"Executive Session: 10/27/2015 1:15 PM Legislative Office Building 302 "
666235,2015-11-12,"Committee Report: Inexpedient to Legislate for Jan 6 (Vote 16-4; Regular Calendar); House Calendar 67, PG. 13 "
666236,2015-01-07,"Introduced and Referred to Education; House Journal  7, PG. 118 "
666236,2015-01-14,"Public Hearing: 1/20/2015 10:30 Amendment Legislative Office Building 207 "
666236,2015-02-11,"Executive Session: 2/17/2015 10:00 Amendment Legislative Office Building 207 "
666236,2015-02-20,"Committee Report: Ought to Pass for Mar 4 (Vote 18-3; Consent Calendar); House Calendar18, PG. 344 "
666236,2015-03-04,"Ought to Pass: Motion Adopted Voice Vote; House Journal  22, PG. 559 "
666236,2015-03-05,"Introduced and Referred to Education; Senate Journal 8  "
666236,2015-03-19,"Hearing: 3/24/15, Room 103, Legislative Office Building, 9:00 a.m.; Senate Calendar 14 "
666236,2015-03-30,"Committee Report: Ought to Pass with Amendment #2015-1145s, 4/9/15; Vote 5-0; Consent Calendar; Senate Calendar 16 "
666236,2015-04-09,"Committee Amendment 1145s, Amendment Adopted, Voice Vote "
666236,2015-04-09,"Ought to Pass with Amendment 1145s, Motion Adopted, Voice Vote; OT3rdg; Senate Journal 11 "
666236,2015-05-06,"House Concurs with Senate Amendment #1145s (Rep Ladd): Motion Adopted Voice Vote; House Journal  41, PG. 1747 "
666236,2015-05-14,"Enrolled Bill Amendment #1719e Adopted, Voice Vote, (In recess of 5/14/2015); Senate Journal 15 "
666236,2015-05-19,"Enrolled Bill Amendment #2015-1719EBA: Amendment Adopted Voice Vote (in recess of 5/6/2015); House Journal  41, PG. 1780 "
666236,2015-05-21,"Enrolled (In recess 5/21/2015); Senate Journal 16 "
666236,2015-05-21,"Enrolled (in recess of 5/6/2015); House Journal  41, PG. 1782 "
666236,2015-06-11,"Signed by the Governor on 6/8/2015; Chapter 120; Section 2 Effective Date 11/1/2016, Remaining Effective Date 6/8/2015 "
666237,2015-01-07,"Introduced and Referred to Election Law; House Journal  7, PG. 118 "
666237,2015-01-14,"Public Hearing: 1/20/2015 10:45 Amendment Legislative Office Building 308 "
666237,2015-01-21,"Subcommittee Work Session: 1/29/2015 10:00 Amendment Legislative Office Building 308 "
666237,2015-02-11,"Executive Session: 2/12/2015 10:00 Amendment Legislative Office Building 308 "
666237,2015-02-20,"Committee Report: Inexpedient to Legislate for Mar 4 (Vote 17-1; Consent Calendar); House Calendar18, PG. 344 "
666237,2015-03-04,"Inexpedient to Legislate: Motion Adopted Voice Vote; House Journal  22, PG. 559 "
666238,2015-01-07,"Introduced and Referred to Executive Departments and Administration; House Journal  7, PG. 117 "
666238,2015-01-14,"Public Hearing: 1/22/2015 10:30 Amendment Legislative Office Building 306 "
666238,2015-02-26,"Executive Session: 2/19/2015 Legislative Office Building 306 "
666238,2015-03-02,"Committee Report: Ought to Pass with Amendment #2015-0379h for Mar 11 (Vote 11-0; Consent Calendar); House Calendar19, PG. 399 "
666238,2015-03-11,"Amendment #0379h: Amendment Adopted Voice Vote; House Journal  24, PG. 784 "
666238,2015-03-11,"Ought to Pass with Amendment #0379h: Motion Adopted Voice Vote; House Journal  24, PG. 784 "
666238,2015-03-19,"Introduced and Referred to Executive Departments and Administration; Senate Journal 10 "
666238,2015-04-01,"Hearing: 4/8/15, Room 101, Legislative Office Building, 9:00 a.m.; Senate Calendar 16 "
666238,2015-04-13,"=== CANCELLED SESSION === Committee Report: Ought to Pass, 4/23/15; Senate Calendar 18 "
666238,2015-04-17,"=== RESCHEDULED === Committee Report: Ought to Pass, 4/30/15; Senate Calendar 19 "
666238,2015-04-30,"Ought to Pass: Motion Adopted, Voice Vote; OT3rdg; Senate Journal 12 "
666238,2015-05-13,"Enrolled (In recess 5/7/2015); Senate Journal 14 "
666238,2015-05-13,"Enrolled (in recess of 5/6/2015); House Journal  41, PG. 1779 "
666238,2015-06-03,"Signed by the Governor on 6/2/2015; Chapter 50; Effective Date 8/1/2015 "
666239,2015-01-07,"Introduced and Referred to Science, Technology and Energy; House Journal  7, PG. 117 "
666239,2015-01-07,"Public Hearing: 1/14/2015 10:00 Amendment Legislative Office Building 304 "
666239,2015-01-15,"Executive Session: 1/21/2015 10:00 Amendment Legislative Office Building 304 "
666239,2015-01-21,"Committee Report: Inexpedient to Legislate for Feb 4 (Vote 19-0; Consent Calendar); House Calendar10, PG. 152 "
666239,2015-02-04,"Inexpedient to Legislate: Motion Adopted Voice Vote; House Journal  14, PG. 275 "
666240,2014-12-03,"Introduced and Adopted, Voice Vote; House Journal  4, PG. 47 "
666242,2015-01-07,"Introduced and Referred to Executive Departments and Administration; House Journal  7, PG. 118 "
666242,2015-01-08,"Public Hearing: 1/20/2015 1:30 PM Legislative Office Building 306 "
666242,2015-01-21,"==POSTPONED== Executive Session: 1/27/2015 Legislative Office Building 306 "
666242,2015-01-26,"==RESCHEDULED== Executive Session: 1/28/2015 Legislative Office Building 306 "
666242,2015-02-05,"Majority Committee Report: Ought to Pass for Feb 11 (Vote 10-3; Regular Calendar); House Calendar11, PG. 179-180 "
666242,2015-02-05,"Minority Committee Report: Inexpedient to Legislate "
666242,2015-02-11,"Floor Amendment #2015-0295h (Rep Hoell): Motion Failed Voice Vote; House Journal  16, PG. 308 "
666242,2015-02-11,"Ought to Pass: Motion Adopted Voice Vote; House Journal  16, PG. 307-308 "
666242,2015-03-05,"Introduced and Referred to Executive Departments and Administration; Senate Journal 8  "
666242,2015-04-01,"Hearing: 4/8/15, Room 101, Legislative Office Building, 9:15 a.m.; Senate Calendar 16 "
666242,2015-04-13,"=== CANCELLED SESSION === Committee Report: Ought to Pass, 4/23/15; Senate Calendar 18 "
666242,2015-04-17,"=== RESCHEDULED === Committee Report: Ought to Pass, 4/30/15; Senate Calendar 19 "
666242,2015-04-30,"Ought to Pass: Motion Adopted, Voice Vote; OT3rdg; Senate Journal 12 "
666242,2015-05-14,"Enrolled Bill Amendment #1601e Adopted, Voice Vote, (In recess of 5/14/2015); Senate Journal 15 "
666242,2015-05-19,"Enrolled Bill Amendment #2015-1601EBA: Amendment Adopted Voice Vote (in recess of 5/6/2015); House Journal  41, PG. 1780 "
666242,2015-05-21,"Enrolled (In recess 5/21/2015); Senate Journal 16 "
666242,2015-05-21,"Enrolled (in recess of 5/6/2015); House Journal  41, PG. 1782 "
666242,2015-06-11,"Signed by the Governor on 6/8/2015; Chapter 119; Effective Date 8/7/2015 "
666243,2015-01-07,"Introduced and Referred to Legislative Administration; House Journal  7, PG. 118 "
666243,2015-02-04,"Vacated from Legislative Administration and Referred to State-Federal Relations and Veterans Affairs; House Journal  14, PG. 273 "
666243,2015-02-04,"Public Hearing: 2/13/2015 9:00 Amendment Legislative Office Building 210-211 "
666243,2015-02-17,"Executive Session: 2/19/2015 10:00 Amendment or one hour after House Session ends Legislative Office Building 303 "
666243,2015-02-23,"Committee Report: Ought to Pass for Mar 4 (Vote 13-2; Consent Calendar); House Calendar18, PG. 353 "
666243,2015-03-04,"Removed from Consent Calendar (Rep Notter); House Journal  22, PG. 559 "
666243,2015-03-04,"Lay on Table (Rep Notter): Motion Failed DV 156-170; House Journal  22, PG. 620 "
666243,2015-03-04,"Ought to Pass: Motion Adopted Regular Calendar 181-134; House Journal  22, PG. 620-622 "
666243,2015-03-11,"Reconsider (Rep Tucker): Motion Failed DV 135-224; House Journal  24, PG. 825 "
666243,2015-04-09,"Not Introduced, Pursuant to Rule 3-26, Motion Failed, Lacking necessary 2/3 vote, Div. 13Y-11N; Senate Journal 11 "
666244,2015-01-07,"Introduced and Referred to Education. "
666244,2015-01-21,"Public Hearing: 1/29/2015 2:30 PM Legislative Office Building 206-208 "
666244,2015-02-11,"Executive Session: 2/17/2015 10:00 Amendment Legislative Office Building 207 "
666244,2015-03-05,"Committee Report: Ought to Pass with Amendment #2015-0326h for Mar 11 (Vote 16-5; Regular Calendar); House Calendar19, PG. 420 "
666244,2015-03-11,"Amendment #0326h: Amendment Adopted Voice Vote; House Journal  24, PG. 864 "
666244,2015-03-11,"Ought to Pass with Amendment #0326h: Motion Adopted Voice Vote; House Journal  24, PG. 864 "
666244,2015-03-19,"Introduced and Referred to Education; Senate Journal 10 "
666244,2015-04-02,"Hearing: 4/7/15, Room 103, Legislative Office Building, 9:00 a.m.; Senate Calendar 16 "
666244,2015-04-13,"=== CANCELLED SESSION === Committee Report: Inexpedient to Legislate, 4/23/15; Senate Calendar 18 "
666244,2015-04-17,"=== RESCHEDULED === Committee Report: Inexpedient to Legislate, 4/30/15; Senate Calendar 19 "
666244,2015-04-30,"Inexpedient to Legislate, Motion Adopted, Voice Vote === BILL KILLED ===; Senate Journal 12 "
666245,2015-01-07,"Introduced and Referred to Executive Departments and Administration; House Journal  7, PG. 117 "
666245,2015-01-21,"==POSTPONED== Public Hearing: 1/27/2015 10:00 Amendment Legislative Office Building 306 "
666245,2015-01-26,"==RESCHEDULED== Public Hearing: 1/28/2015 10:00 Amendment Legislative Office Building 306 ==RECESSED== "
666245,2015-02-04,"Continued Public Hearing: 2/17/2015 2:00 PM Legislative Office Building 306 "
666245,2015-02-24,"Executive Session: 3/2/2015 12:30 PM Legislative Office Building 306 "
666245,2015-03-05,"Committee Report: Inexpedient to Legislate for Mar 11 (Vote 11-4; Regular Calendar); House Calendar19, PG. 423 "
666245,2015-03-11,"Special order to end of Regular Calendar on 3/12/2015 (Rep A. Christie): Motion Adopted Voice Vote; House Journal  24, PG. 884 "
666245,2015-03-12,"Inexpedient to Legislate: Motion Adopted DV 207-109; House Journal  26, PG. 1263 "
666246,2015-01-07,"Introduced and Referred to Election Law; House Journal  7, PG. 117 "
666246,2015-01-21,"==POSTPONED== Public Hearing: 1/27/2015 11:15 Amendment Legislative Office Building 308 "
666246,2015-01-26,"==RESCHEDULED== Public Hearing: 1/28/2015 11:15 Amendment Legislative Office Building 308 "
666246,2015-01-29,"Subcommittee Work Session: 2/5/2015 1:00 PM Legislative Office Building 308 "
666246,2015-02-11,"Executive Session: 2/17/2015 11:00 Amendment Legislative Office Building 308 "
666246,2015-02-25,"Majority Committee Report: Ought to Pass with Amendment #2015-0066h for Mar 11 (Vote 9-8; Regular Calendar); House Calendar19, PG. 421-422 "
666246,2015-02-25,"Minority Committee Report: Inexpedient to Legislate "
666246,2015-03-11,"Amendment #0066h: Amendment Failed Voice Vote; House Journal  24, PG. 878-880 "
666246,2015-03-11,"Lay on Table (Rep Hoelzel): Motion Adopted DV 254-85; House Journal  24, PG. 878-880 "
666246,2015-03-11,"Request opinion of Justices (Rep Hoelzel): Motion Adopted DV 190-148; House Journal  24, PG. 878-880 "
666247,2015-01-07,"Introduced and Referred to Election Law; House Journal  7, PG. 118 "
666247,2015-01-07,"Public Hearing: 1/13/2015 11:15 Amendment Legislative Office Building 308 "
666247,2015-01-21,"==POSTPONED==Executive Session: 1/27/2015 2:30 PM Legislative Office Building 308 "
666247,2015-01-26,"==RESCHEDULED== Executive Session: 1/28/2015 2:30 PM Legislative Office Building 308 "
666247,2015-01-29,"Committee Report: Ought to Pass for Feb 4 (Vote 11-0; Consent Calendar); House Calendar10, PG. 150 "
666247,2015-02-04,"Ought to Pass: Motion Adopted Voice Vote; House Journal  14, PG. 274 "
666247,2015-03-05,"Introduced and Referred to Public and Municipal Affairs; Senate Journal 8  "
666247,2015-03-17,"Hearing: 3/25/15, Room 102, Legislative Office Building, 10:15 a.m.; Senate Calendar 14 "
666247,2015-04-01,"Committee Report: Ought to Pass, 4/9/15; Vote 5-0; Consent Calendar; Senate Calendar 16 "
666247,2015-04-09,"Ought to Pass: Motion Adopted, Voice Vote; OT3rdg; Senate Journal 11 "
666247,2015-04-21,"Enrolled (In recess 4/9/2015); Senate Journal 12 "
666247,2015-04-22,"Enrolled (in recess of 4/15/2015); House Journal  34, PG. 1564 "
666247,2015-05-07,"Signed by the Governor on 5/5/2015; Chapter 05; Effective Date 7/4/2015 "
666249,2014-12-03,"Introduced and Adopted, Voice Vote; House Journal  4, PG. 47 "
666250,2015-01-07,"Introduced and Referred to Commerce and Consumer Affairs; House Journal  7, PG. 117 "
666250,2015-01-07,"Public Hearing: 1/15/2015 11:00 Amendment Legislative Office Building 302 "
666250,2015-01-30,"Subcommittee Work Session: 2/4/2015 2:00 PM Legislative Office Building 302 "
666250,2015-01-31,"Subcommittee Work Session: 2/5/2015 8:30 Amendment Legislative Office Building 302 "
666250,2015-02-12,"Subcommittee Work Session: 2/17/2015 3:00 PM Legislative Office Building 302 "
666250,2015-02-20,"Executive Session: 3/3/2015 1:00 PM Legislative Office Building 302 "
666250,2015-03-03,"Retained in Committee "
666250,2015-09-29,"Retained Bill - Subcommittee Work Session: 10/6/2015 10:00 Amendment Legislative Office Building 302 "
666250,2015-10-07,"Retained Bill - Subcommittee Work Session: 10/13/2015 1:00 PM Legislative Office Building 302 "
666250,2015-10-14,"Retained Bill - Subcommittee Work Session: 10/20/2015 10:00 Amendment Legislative Office Building 302 "
666250,2015-10-15,"Executive Session: 10/27/2015 1:15 PM Legislative Office Building 302 "
666250,2015-11-12,"Committee Report: Ought to Pass with Amendment #2015-2453h (NT) for Jan 6 (Vote 18-2; Consent Calendar); House Calendar 67, PG. 4 "
666251,2015-01-07,"Introduced and Referred to Transportation; House Journal  7, PG. 118 "
666251,2015-01-14,"Public Hearing: 1/20/2015 1:00 PM Legislative Office Building 203 "
666251,2015-01-21,"==POSTPONED== Executive Session: 1/27/2015 2:30 PM Legislative Office Building 203 "
666251,2015-01-26,"==RESCHEDULED== Executive Session: 1/28/2015 2:30 PM Legislative Office Building 203 "
666251,2015-01-29,"Committee Report: Ought to Pass for Feb 4 (Vote 14-0; Consent Calendar); House Calendar10, PG. 152 "
666251,2015-02-04,"Ought to Pass: Motion Adopted Voice Vote; House Journal  14, PG. 275 "
666251,2015-03-05,"Introduced and Referred to Transportation; Senate Journal 8  "
666251,2015-03-26,"Hearing: 3/31/15, Room 103, Legislative Office Building, 1:00 p.m.; Senate Calendar 15 "
666251,2015-04-01,"Committee Report: Ought to Pass with Amendment #2015-1218s, 4/9/15; Vote 5-0; Consent Calendar; Senate Calendar 16 "
666251,2015-04-09,"Committee Amendment 1218s, Amendment Adopted, Voice Vote "
666251,2015-04-09,"Ought to Pass with Amendment 1218s, Motion Adopted, Voice Vote; OT3rdg; Senate Journal 11 "
666251,2015-05-06,"House Concurs with Senate Amendment #1218s (Rep Steven Smith): Motion Adopted Voice Vote; House Journal  41, PG. 1747 "
666251,2015-05-19,"Enrolled (In recess 5/14/2015); Senate Journal 15 "
666251,2015-05-19,"Enrolled (in recess of 5/6/2015); House Journal  41, PG. 1781 "
666251,2015-06-03,"Signed by the Governor on 6/2/2015; Chapter 53; Effective Date 6/2/2015 "
666252,2015-01-07,"Introduced and Referred to Criminal Justice and Public Safety; House Journal  7, PG. 118 "
666252,2015-01-13,"Public Hearing: 1/20/2015 10:00 Amendment Legislative Office Building 204 "
666252,2015-01-20,"Subcommittee Work Session: 1/22/2015 11:30 Amendment Legislative Office Building 204 "
666252,2015-02-04,"Executive Session: 2/4/2015 1:00 PM Legislative Office Building 204 "
666252,2015-02-05,"Committee Report: Ought to Pass with Amendment #2015-0056h for Feb 11 (Vote 16-0; Consent Calendar); House Calendar11, PG. 171 "
666252,2015-02-11,"Adopt Amendment #0056h: Amendment Adopted Voice Vote; House Journal  16, PG. 298 "
666252,2015-02-11,"Ought to Pass with Amendment #0056h: Motion Adopted Voice Vote; House Journal  16, PG. 298 "
666252,2015-03-05,"Introduced and Referred to Judiciary; Senate Journal 8  "
666252,2015-04-15,"Hearing: 4/21/15, Room 100, State House, 10:00 a.m.; Senate Calendar 18 "
666252,2015-04-22,"Committee Report: Ought to Pass, 4/30/15; Vote 5-0; Consent Calendar; Senate Calendar 19 "
666252,2015-04-30,"Ought to Pass: Motion Adopted, Voice Vote; OT3rdg; Senate Journal 12 "
666252,2015-05-13,"Enrolled (In recess 5/7/2015); Senate Journal 14 "
666252,2015-05-13,"Enrolled (in recess of 5/6/2015); House Journal  41, PG. 1779 "
666252,2015-06-03,"Signed by the Governor on 6/2/2015; Chapter 51; Effective Date 1/1/2016 "
666253,2014-12-03,"Introduced and Adopted, Voice Vote; House Journal  4, PG. 47 "
666254,2015-01-07,"Introduced and Referred to Health, Human Services & Elderly Affairs; House Journal  7, PG. 117 "
666254,2015-01-14,"Public Hearing: 1/22/2015 2:00 PM Legislative Office Building 305-307 "
666254,2015-01-28,"Executive Session: 2/3/2015 10:00 Amendment Legislative Office Building 205 "
666254,2015-02-05,"Committee Report: Inexpedient to Legislate for Feb 11 (Vote 16-0; Consent Calendar); House Calendar11, PG. 173 "
666254,2015-02-11,"Inexpedient to Legislate: Motion Adopted Voice Vote; House Journal  16, PG. 301 "
666255,2015-01-07,"Introduced and Referred to Judiciary; House Journal  7, PG. 118 "
666255,2015-01-07,"Public Hearing: 1/15/2015 1:30 PM Legislative Office Building 208 "
666255,2015-01-29,"Executive Session: 1/20/2015 Legislative Office Building 208 "
666255,2015-01-29,"Committee Report: Inexpedient to Legislate for Feb 4 (Vote 18-0; Consent Calendar); House Calendar10, PG. 150-151 "
666255,2015-02-04,"Inexpedient to Legislate: Motion Adopted Voice Vote; House Journal  14, PG. 274 "
666257,2015-01-07,"Introduced and Referred to Health, Human Services & Elderly Affairs; House Journal  7, PG. 118 "
666257,2015-01-14,"Public Hearing: 1/20/2015 1:15 PM Legislative Office Building 205 "
666257,2015-01-28,"Executive Session: 2/3/2015 10:00 Amendment Legislative Office Building 205 "
666257,2015-02-05,"Committee Report: Inexpedient to Legislate for Feb 11 (Vote 16-0; Consent Calendar); House Calendar11, PG. 173 "
666257,2015-02-11,"Inexpedient to Legislate: Motion Adopted Voice Vote; House Journal  16, PG. 301 "
666258,2015-01-07,"Introduced and Referred to Municipal and County Government; House Journal  7, PG. 117 "
666258,2015-01-14,"Public Hearing: 1/20/2015 10:00 Amendment Legislative Office Building 301 "
666258,2015-01-14,"Executive Session: 1/20/2015 Legislative Office Building 301 "
666258,2015-01-21,"Committee Report: Ought to Pass for Feb 4 (Vote 18-0; Consent Calendar); House Calendar10, PG 151 "
666258,2015-02-04,"Ought to Pass: Motion Adopted Voice Vote; House Journal  14, PG. 274-275 "
666258,2015-03-05,"Introduced and Referred to Public and Municipal Affairs; Senate Journal 8  "
666258,2015-03-17,"Hearing: 3/25/15, Room 102, Legislative Office Building, 9:00 a.m.; Senate Calendar 14 "
666258,2015-04-29,"Committee Report: Ought to Pass with Amendment #2015-1496s, New Title, 5/7/15; Senate Calendar 20 "
666258,2015-05-07,"Special Order HB 102 to 5/14/15, Without Objection, Motion Adopted; Senate Journal 13 "
666258,2015-05-07,"Committee Report: Ought to Pass with Amendment #2015-1496s, New Title, 5/14/15; Senate Calendar 21 "
666258,2015-05-14,"Committee Amendment 1496s, New Title, Amendment Failed, Voice Vote "
666258,2015-05-14,"Sen. Bradley moved Ought to Pass, Motion Adopted, Voice Vote "
666258,2015-05-14,"Ought to Pass: Motion Adopted, Voice Vote, OT3rdg; Senate Journal 12 "
666258,2015-06-03,"Enrolled (In recess 5/28/2015); Senate Journal 17 "
666258,2015-06-03,"Enrolled "
666258,2015-06-16,"Signed by the Governor on 6/12/2015; Chapter 129; Effective Date 8/11/2015 "
666259,2015-01-07,"Introduced and Referred to Commerce and Consumer Affairs; House Journal  7, PG. 118 "
666259,2015-01-07,"Public Hearing: 1/15/2015 10:00 Amendment Legislative Office Building 302 "
666259,2015-01-29,"Subcommittee Work Session: 2/5/2015 8:30 Amendment Legislative Office Building 302 "
666259,2015-02-12,"Subcommittee Work Session: 2/17/2015 3:00 PM Legislative Office Building 302 "
666259,2015-02-20,"Executive Seesion: 3/3/2015 1:00 PM Legislative Office Building 302 "
666259,2015-03-05,"Committee Report: Ought to Pass for Mar 11 (Vote 20-0; Consent Calendar); House Calendar19, PG. 390 "
666259,2015-03-11,"Ought to Pass: Motion Adopted Voice Vote; House Journal  24, PG. 767 "
666259,2015-03-19,"Introduced and Referred to Commerce; Senate Journal 10 "
666259,2015-03-26,"Hearing: 3/31/15, Room 100, State House, 2:00 p.m.; Senate Calendar 15 "
666259,2015-04-01,"Committee Report: Ought to Pass with Amendment #2015-1221s, 4/9/15; Senate Calendar 16 "
666259,2015-04-09,"Committee Amendment 1221s, Amendment Adopted, Voice Vote "
666259,2015-04-09,"Ought to Pass with Amendment 1221s, Motion Adopted, Voice Vote; OT3rdg; Senate Journal 11 "
666259,2015-05-06,"House Concurs with Senate Amendment #1221s (Rep Hunt): Motion Adopted Voice Vote; House Journal  41, PG. 1747 "
666259,2015-05-19,"Enrolled (In recess 5/14/2015); Senate Journal 15 "
666259,2015-05-19,"Enrolled (in recess of 5/6/2015); House Journal  41, PG. 1781 "
666259,2015-06-03,"Vetoed by the Governor on 6/2/2015; House Journal  46, PG. 1981 "
666259,2015-06-11,"Veto Overriden: Regular Calendar 236-95 By Required Two-Thirds Vote; House Journal  46, PG. 1981-1983 "
666259,2015-06-24,"Notwithstanding the Governor’s Veto, Shall HB 122 Become Law: Regular Calendar 18Y-6N, Veto Overridden by required two-thirds vote "
666259,2015-06-25,"Veto Override 06/24/2015; Effective 08/23/2015; Chapter 0157 "
666260,2015-01-07,"Introduced and Referred to Election Law; House Journal  7, PG. 118 "
666260,2015-01-14,"Public Hearing: 1/20/2015 11:00 Amendment Legislative Office Building 308 "
666260,2015-01-21,"Subcommittee Work Session: 1/29/2015 10:00 Amendment Legislative Office Building 308 "
666260,2015-01-30,"Executive Session: 2/4/2015 2:00 PM Legislative Office Building 308 "
666260,2015-02-05,"Committee Report: Ought to Pass with Amendment #2015-0123h for Feb 11 (Vote 18-0; Consent Calendar); House Calendar11, PG. 172 "
666260,2015-02-11,"Removed from Consent Calendar (Rep Bates); House Journal  16, PG. 298 "
666260,2015-02-11,"Recommit (Rep Bates): Motion Failed DV 157-193; House Journal  16, PG. 322 "
666260,2015-02-11,"Amendment #0123h: Amendment Adopted Voice Vote; House Journal  16, PG. 321-322 "
666260,2015-02-11,"Ought to Pass with Amendment #0123h: Motion Adopted Voice Vote; House Journal  16, PG. 321-322 "
666260,2015-03-05,"Introduced and Referred to Public and Municipal Affairs; Senate Journal 8  "
666260,2015-03-17,"Hearing: 3/25/15, Room 102, Legislative Office Building, 9:30 a.m.; Senate Calendar 14 "
666260,2015-04-30,"Committee Report: Ought to Pass with Amendment #2015-1498s, 5/7/15; Senate Calendar 20 "
666260,2015-05-07,"Committee Amendment 1498s, Amendment Adopted, Voice Vote "
666260,2015-05-07,"Ought to Pass with Amendment 1498s, Motion Adopted, Voice Vote; OT3rdg; Senate Journal 13 "
666260,2015-06-03,"House Concurs with Senate Amendment #1498s (Rep Hoelzel): Motion Adopted Voice Vote; House Journal  44, PG. 1812 "
666260,2015-06-18,"Enrolled (In recess 6/11/2015); Senate Journal 19 "
666260,2015-06-18,"Enrolled (in recess of 6/11/2015); House Journal  46, PG. 1993 "
666260,2015-06-30,"Signed by the Governor on 6/26/2015; Chapter 159; Effective Date 8/25/2015 "
666261,2015-01-07,"Introduced and Referred to Executive Departments and Administration; House Journal  7, PG. 118 "
666261,2015-01-21,"==POSTPONED== Public Hearing: 1/27/2015 1:45 PM Legislative Office Building 306 "
666261,2015-01-26,"==RESCHEDULED==Public Hearing: 1/28/2015 1:45 PM Legislative Office Building 306 "
666261,2015-02-26,"Executive Session: 2/19/2015 Legislative Office Building 306 "
666261,2015-03-05,"Committee Report: Inexpedient to Legislate for Mar 11 (Vote 14-0; Consent Calendar); House Calendar19, PG. 399 "
666261,2015-03-12,"Removed from Consent (Rep Ratzki); House Journal  24, PG. 766 "
666261,2015-03-12,"Inexpedient to Legislate: Motion Adopted Voice Vote; House Journal  26, PG. 1270-1271 "
666262,2015-01-07,"Introduced and Referred to Municipal and County Government; House Journal  7, PG. 118 "
666262,2015-01-21,"Public Hearing: 1/29/2015 1:00 PM Legislative Office Building 301 "
666262,2015-02-04,"Executive Session: 2/4/2015 12:00 PM Legislative Office Building 301 ==RECESSED== "
666262,2015-02-05,"Continued Executive Session: 2/10/2015 2:00 PM Legislative Office Building 301 "
666262,2015-02-13,"Committee Report: Inexpedient to Legislate for Feb 18 (Vote 10-7; Regular Calendar); House Calendar13, PG. 248 "
666262,2015-02-18,"Inexpedient to Legislate: Motion Adopted DV 303-56; House Journal  20, PG. 520 "
666264,2015-01-07,"Introduced and Referred to Election Law; House Journal  7, PG. 117 "
666264,2015-01-14,"Public Hearing: 1/20/2015 1:30 PM Legislative Office Building 308 "
666264,2015-01-21,"Subcommittee Work Session: 1/29/2015 10:00 Amendment Legislative Office Building 308 "
666264,2015-01-30,"==CANCELED== Executive Session: 2/4/2015 2:00 PM Legislative Office Building 308 "
666264,2015-02-11,"Executive Session: 2/17/2015 11:00 Amendment Legislative Office Building 308 "
666264,2015-02-17,"Retained in Committee "
666264,2015-08-26,"Retained Bill - Subcommittee Work Session: 9/16/2015 10:00 Amendment Legislative Office Building 308 "
666264,2015-09-15,"Executive Session: 10/20/2015 1:00 PM Legislative Office Building 308 "
666264,2015-11-12,"Committee Report: Ought to Pass with Amendment #2015-2395h for Jan 6 (Vote 19-0; Consent Calendar); House Calendar 67, PG. 6 "
666265,2015-01-07,"Introduced and Referred to Transportation; House Journal  7, PG. 117 "
666265,2015-01-14,"Public Hearing: 1/20/2015 10:00 Amendment Legislative Office Building 203 "
666265,2015-01-21,"==POSTPONED== Executive Session: 1/27/2015 2:30 PM Legislative Office Building 203 "
666265,2015-01-26,"==RESCHEDULED== Executive Session: 1/28/2015 2:30 PM Legislative Office Building 203 "
666265,2015-01-29,"Retained in Committee "
666265,2015-05-13,"Full Committee Work Session: 5/20/2015 1:30 PM Legislative Office Building 203 "
666265,2015-10-07,"Retained Bill - Full Committee Work Session: 10/13/2015 10:00 Amendment Legislative Office Building 203 "
666265,2015-10-14,"Executive Session: 10/20/2015 2:00 PM Legislative Office Building 203 "
666265,2015-11-12,"Committee Report: Inexpedient to Legislate for Jan 6 (Vote 11-0; Consent Calendar); House Calendar 67, PG. 10 "
666266,2015-01-07,"Introduced and Referred to Transportation; House Journal  7, PG. 118 "
666266,2015-01-14,"Public Hearing: 1/20/2015 11:00 Amendment Legislative Office Building 203 "
666266,2015-01-21,"==POSTPONED== Executive Session: 1/27/2015 2:30 PM Legislative Office Building 203 "
666266,2015-01-26,"==RESCHEDULED== Executive Session: 1/28/2015 2:30 PM Legislative Office Building 203 "
666266,2015-01-28,"Retained in Committee "
666266,2015-05-13,"Full Committee Work Session: 5/20/2015 2:00 PM Legislative Office Building 203 "
666266,2015-09-21,"Executive Session: 9/29/2015 10:00 Amendment Legislative Office Building 203 "
666266,2015-11-12,"Committee Report: Inexpedient to Legislate for Jan 6 (Vote 11-0; Consent Calendar); House Calendar 67, PG. 10 "
666267,2014-12-03,"Introduced and adopted, Voice Vote; House Journal  4, PG. 47 "
666268,2015-01-07,"Introduced and Referred to Health, Human Services & Elderly Affairs; House Journal  7, PG. 117 "
666268,2015-01-21,"Public Hearing: 1/29/2015 1:45 PM Legislative Office Building 205 "
666268,2015-02-10,"Executive Session: 2/5/2015 3:30 PM Legislative Office Building 205 "
666268,2015-02-10,"Committee Report: Inexpedient to Legislate for Feb 18 (Vote 15-0; Consent Calendar); House Calendar13, PG. 240 "
666268,2015-02-18,"Inexpedient to Legislate: Motion Adopted Voice Vote; House Journal  20, PG. 501 "
666269,2015-01-07,"Introduced and Referred to Health, Human Services & Elderly Affairs; House Journal  7, PG. 118 "
666269,2015-01-14,"Public Hearing: 1/22/2015 10:00 Amendment Legislative Office Building 305-307 "
666269,2015-01-28,"Subcommittee Work Session: 2/3/2015 9:15 Amendment Legislative Office Building 205 "
666269,2015-02-03,"Subcommittee Work Session: 2/10/2015 9:10 Amendment Legislative Office Building 205 "
666269,2015-02-18,"Executive Session: 2/17/2015 Legislative Office Building 205 "
666269,2015-02-20,"Committee Report: Ought to Pass for Mar 4 (Vote 14-0; Regular Calendar); House Calendar18, PG. 359 "
666269,2015-03-04,"Lay on Table (Rep Itse): Motion Failed Regular Calendar 171-188; House Journal  588-590 "
666269,2015-03-04,"Ought to Pass: Motion Adopted Regular Calendar 199-162; House Journal  22, PG. 588-592 "
666269,2015-03-05,"Introduced and Referred to Health and Human Services; Senate Journal 8  "
666269,2015-03-19,"Hearing: 3/24/15, Room 101, Legislative Office Building, 2:00 p.m.; Senate Calendar 14 "
666269,2015-04-15,"=== CANCELLED SESSION === Committee Report: Inexpedient to Legislate, 4/23/15; Senate Calendar 18 "
666269,2015-04-17,"=== RESCHEDULED === Committee Report: Inexpedient to Legislate, 4/30/15; Senate Calendar 19 "
666269,2015-04-30,"Inexpedient to Legislate, Motion Failed, Voice Vote; Senate Journal 12 "
666269,2015-04-30,"Sen. Kelly moved Ought to Pass, Motion Adopted, Voice Vote "
666269,2015-04-30,"Ought to Pass: Motion Adopted, Voice Vote, OT3rdg; Senate Journal 12 "
666269,2015-05-13,"Enrolled (In recess 5/7/2015); Senate Journal 14 "
666269,2015-05-13,"Enrolled (in recess of 5/6/2015); House Journal  41, PG. 1779 "
666269,2015-06-03,"Signed by the Governor on 6/2/2015; Chapter 54; Effective Date 8/1/2015 "
666270,2015-01-07,"Introduced and Referred to Resources, Recreation and Development; House Journal  7, PG. 117 "
666270,2015-01-14,"Public Hearing: 1/20/2015 10:30 Amendment Legislative Office Building 305 "
666270,2015-01-21,"==POSTPONED== Full Committee Work Session: 1/27/2015 11:30 Amendment Legislative Office Building 305 "
666270,2015-01-26,"==RESCHEDULED== Full Committee Work Session: 1/27/2015 11:30 Amendment Legislative Office Building 305 "
666270,2015-02-11,"Executive Session: 2/10/2015 Legislative Office Building 305 "
666270,2015-02-23,"Committee Report: Inexpedient to Legislate for Mar 4 (Vote 14-0; Consent Calendar); House Calendar18, PG. 351 "
666270,2015-03-04,"Inexpedient to Legislate: Motion Adopted Voice Vote; House Journal  22, PG. 566 "
666272,2015-01-07,"Introduced and Referred to Commerce and Consumer Affairs; House Journal  7, PG. 118 "
666272,2015-01-07,"Public Hearing: 1/15/2015 1:15 PM Legislative Office Building 302 "
666272,2015-01-22,"Subcommittee Work Session: 1/29/2015 11:00 Amendment Legislative Office Building 302 "
666272,2015-02-04,"Subcommittee Work Session: 2/12/2015 2:40 PM Legislative Office Building 302 "
666272,2015-02-04,"===CANCELLED=== Work Session: 2/12/2015 2:40 PM Legislative Office Building 302 "
666272,2015-02-04,"Executive Session: 2/4/2015 1:00 PM Legislative Office Building 302 "
666272,2015-03-06,"Retained in Committee "
666272,2015-09-01,"Retained Bill - Subcommittee Work Session: 9/8/2015 1:00 PM Legislative Office Building 302 "
666272,2015-09-29,"Executive Session: 10/27/2015 1:15 PM Legislative Office Building 302 "
666272,2015-11-12,"Committee Report: Inexpedient to Legislate for Jan 6 (Vote 19-1; Regular Calendar); House Calendar 67, PG. 13 "
666273,2015-01-07,"Introduced and Referred to Legislative Administration; House Journal  7, PG. 118 "
666273,2015-02-04,"Public Hearing: 2/12/2015 9:30 Amendment Legislative Office Building 203 "
666273,2015-02-23,"Executive Session: 3/3/2015 8:15 Amendment Legislative Office Building 104 "
666273,2015-03-05,"Committee Report: Inexpedient to Legislate for Mar 11 (Vote 7-3; Regular Calendar); House Calendar19, PG. 433 "
666273,2015-03-12,"Inexpedient to Legislate: Motion Adopted Regular Calendar 262-75; House Journal  26, PG. 1249-1251 "
666274,2015-01-07,"Introduced and Referred to Commerce and Consumer Affairs; House Journal  7, PG. 118 "
666274,2015-01-07,"Public Hearing: 1/15/2015 2:00 PM Legislative Office Building 302 "
666274,2015-02-03,"Subcommittee Work Session: 2/12/2015 8:30 Amendment Legislative Office Building 302 "
666274,2015-02-20,"Executive Seesion: 3/3/2015 1:00 PM Legislative Office Building 302 "
666274,2015-03-05,"Majority Committee Report: Inexpedient to Legislate for Mar 11 (Vote 12-8; Regular Calendar); House Calendar19, PG. 413 "
666274,2015-03-05,"Minority Committee Report: Ought to Pass "
666274,2015-03-11,"Inexpedient to Legislate: Motion Adopted Voice Vote; House Journal  24, PG. 833 "
666275,2015-01-07,"Introduced and Referred to Judiciary; House Journal  7, PG. 118 "
666275,2015-01-07,"Public Hearing: 1/15/2015 10:00 Amendment Legislative Office Building 208 "
666275,2015-02-04,"Executive Session: 2/4/2015 12:45 PM Legislative Office Building 208 ==RECESSED== "
666275,2015-02-25,"Continued Executive Session: 2/19/2015 Legislative Office Building 208 "
666275,2015-02-25,"Committee Report: Inexpedient to Legislate for Mar 11 (Vote 15-0; Consent Calendar); House Calendar19, PG. 403 "
666275,2015-03-11,"Inexpedient to Legislate: Motion Adopted Voice Vote; House Journal  24, PG. 793 "
666276,2015-01-07,"Introduced and referred to Health, Human Services and Elderly Affairs; House Journal  7, PG. 117 "
666276,2015-01-14,"Public Hearing: 1/20/2015 11:15 Amendment Legislative Office Building 205 "
666276,2015-01-28,"Executive Session: 2/3/2015 10:00 Amendment Legislative Office Building 205 "
666276,2015-02-05,"Committee Report: Inexpedient to Legislate for Feb 11 (Vote 14-0; Consent Calendar); House Calendar11, PG. 173 "
666276,2015-02-11,"Removed from Consent Calendar (Rep D. McGuire); House Journal  16, PG. 298 "
666276,2015-02-11,"Inexpedient to Legislate: Motion Adopted Regular Calendar 191-151; House Journal  16, PG. 322-324 "
666277,2015-01-07,"Introduced and Referred to Education; House Journal  7, PG. 117 "
666277,2015-01-14,"Public Hearing: 1/20/2015 10:00 Amendment Legislative Office Building 207 "
666277,2015-02-11,"Executive Session: 2/17/2015 10:00 Amendment Legislative Office Building 207 "
666277,2015-02-20,"Majority Committee Report: Inexpedient to Legislate for Mar 4 (Vote 14-7; Regular Calendar); House Calendar18, PG. 356 "
666277,2015-02-20,"Minority Committee Report: Ought to Pass "
666277,2015-03-04,"Inexpedient to Legislate: Motion Adopted Regular Calendar 218-145; House Journal  22, PG. 575-577 "
666279,2015-01-07,"Introduced and Referred to Judiciary; House Journal  7, PG. 117 "
666279,2015-01-07,"Public Hearing: 1/15/2015 11:00 Amendment Legislative Office Building 208 "
666279,2015-02-04,"Executive Session: 2/4/2015 12:45 PM Legislative Office Building 208 ==RECESSED== "
666279,2015-02-25,"Continued Executive Session: 3/3/2015 10:30 Amendment Legislative Office Building 208 "
666279,2015-03-05,"Committee Report: Ought to Pass with Amendment #2015-0684h (NT) for Mar 11 (Vote 17-0; Consent Calendar); House Calendar19, PG. 403 "
666279,2015-03-11,"Amendment #0684h: Amendment Adopted Voice Vote; House Journal  24, PG. 792-793 "
666279,2015-03-11,"Ought to Pass with Amendment #0684h: Motion Adopted Voice Vote; House Journal  24, PG. 792-793 "
666279,2015-03-19,"Introduced and Referred to Judiciary; Senate Journal 10 "
666279,2015-04-15,"Hearing: 4/21/15, Room 100, State House, 9:00 a.m.; Senate Calendar 18 "
666279,2015-04-22,"Committee Report: Ought to Pass, 4/30/15; Vote 5-0; Consent Calendar; Senate Calendar 19 "
666279,2015-04-30,"Ought to Pass: Motion Adopted, Voice Vote; OT3rdg; Senate Journal 12 "
666279,2015-05-13,"Enrolled (In recess 5/7/2015); Senate Journal 14 "
666279,2015-05-13,"Enrolled (in recess of 5/6/2015); House Journal  41, PG. 1779 "
666279,2015-06-03,"Signed by the Governor on 6/2/2015; Chapter 49; Effective Date 1/1/2016 "
666280,2015-01-07,"Introduced and Referred to Public Works and Highways; House Journal  7, PG. 117 "
666280,2015-01-13,"Public Hearing: 1/20/2015 10:15 Amendment Legislative Office Building 201 "
666280,2015-01-20,"==POSTPONED== Executive Session: 1/27/2015 11:00 Amendment Legislative Office Building 201 "
666280,2015-01-26,"==RESCHEDULED== Executive Session: 1/28/2015 11:00 Amendment Legislative Office Building 201 "
666280,2015-01-29,"Committee Report: Ought to Pass with Amendment #2015-0057h(NT) for Feb 4 (Vote 15-0; Regular Calendar); House Calendar10, PG. 153 "
666280,2015-02-04,"Proposed Committee Amendment #2015-0057h (New Title); House Calendar10 "
666280,2015-02-04,"Adopt Amendment 0057h Amendment Adopted Voice Vote; House Journal  14, PG. 276 "
666280,2015-02-04,"Ought to Pass with Amendment #0057h Motion Adopted Voice Vote; House Journal  14, PG. 275-276 "
666280,2015-03-05,"Introduced and Referred to Transportation; Senate Journal 8  "
666280,2015-04-15,"Hearing: 4/21/15, Room 103, Legislative Office Building, 1:15 p.m.; Senate Calendar 18 "
666280,2015-05-19,"Hearing: 5/26/15, Room 103, Legislative Office Building, 1:00 p.m., on proposed amendment #2015-1840s - relative to reports on gross appropriations from the highway fund in the tentative state budget and defining autocycle and making provisions for the operation and inspection to HB 115, relative to reports on gross appropriations from the highway fund in the tentative state budget; Senate Calendar 23 "
666280,2015-05-27,"Committee Report: Ought to Pass with Amendment #2015-1955s, New Title, 6/4/15; Senate Calendar 24 "
666280,2015-06-04,"Committee Amendment 1955s, New Title, Amendment Adopted, Voice Vote "
666280,2015-06-04,"Sen. Daniels Floor Amendment #2015-2006s, Amendment Adopted, Voice Vote; Senate Journal 17 "
666280,2015-06-04,"Ought to Pass with Amendments 1955s, New Title, and 2006s, Motion Adopted, Voice Vote; OT3rdg; Senate Journal 17 "
666280,2015-06-05,"House Non-Concurs and Requests Committee of Conference (Rep Hinch): Motion Adopted Voice Vote (in recess of 6/3/2015); House Journal  44, PG. 1951 "
666280,2015-06-05,"Speaker Appoints: Reps Chandler, Cloutier, Packard, McConkey (in recess of 6/3/2015); House Journal  44, PG. 1951 "
666280,2015-06-11,"Sen. Stiles accedes to House Request for Committee of Conference, Motion Adopted, Voice Vote; Senate Journal 18 "
666280,2015-06-11,"President Appoints: Senators Stiles, Birdsell and Feltes "
666280,2015-06-11,"Conference Committee Meeting: 6/16/2015 1:00 PM Legislative Office Building 201==Recessed== "
666280,2015-06-16,"==Continued==Conference Committee Meeting: 6/16/2015 3:30 PM Legislative Office Building 201 "
666280,2015-06-18,"Conference Committee Report #2015-2777c; Senate Amendment + New Amendment, Filed "
666280,2015-06-24,"Conference Committee Report 2777c; Adopted, Voice Vote; Senate Journal 19 "
666280,2015-06-24,"Conference Committee Report 2777c: Adopted, Voice Vote; House Journal  54, PG. 2122 "
666280,2015-07-02,"Enrolled (In recess 6/24/2015); Senate Journal 19 "
666280,2015-07-02,"Enrolled (In recess of 6/24/2015); House Journal  54, PG. 2141 "
666280,2015-07-15,"Signed by the Governor on 7/13/2015; Chapter 222; Effective Date 7/1/2015 "
666281,2015-01-07,"Introduced and Referred to Municipal and County Government; House Journal  7, PG. 117 "
666281,2015-01-14,"Public Hearing: 1/20/2015 10:20 Amendment Legislative Office Building 301 "
666281,2015-01-21,"Executive Session: 1/29/2015 Legislative Office Building 301 "
666281,2015-02-03,"Committee Report: Ought to Pass with Amendment #2015-0052h for Feb 11 (Vote 20-0; Consent Calendar); House Calendar11, PG. 175 "
666281,2015-02-11,"Adopt Amendment #0052h: Amendment Adopted Voice Vote; House Journal  16, PG. 303-304 "
666281,2015-02-11,"Ought to Pass with Amendment #0052h: Motion Adopted Voice Vote; House Journal  16, PG. 303 "
666281,2015-03-05,"Introduced and Referred to Public and Municipal Affairs; Senate Journal 8  "
666281,2015-03-26,"Hearing: 4/1/15, Room 102, Legislative Office Building, 9:00 a.m.; Senate Calendar 15 "
666281,2015-04-01,"Committee Report: Ought to Pass, 4/9/15; Vote 5-0; Consent Calendar; Senate Calendar 16 "
666281,2015-04-09,"Ought to Pass: Motion Adopted, Voice Vote; OT3rdg; Senate Journal 11 "
666281,2015-04-21,"Enrolled (In recess 4/9/2015); Senate Journal 12 "
666281,2015-04-22,"Enrolled (in recess of 4/15/2015); House Journal  34, PG. 1564 "
666281,2015-05-07,"Signed by the Governor on 5/5/2015; Chapter 04; Effective Date 7/4/2015 "
666282,2015-01-07,"Introduced and Referred to Judiciary; House Journal  7, PG. 117 "
666282,2015-01-14,"Public Hearing: 1/20/2015 2:00 PM Legislative Office Building 208 "
666282,2015-01-29,"Executive Session: 1/22/2015 Legislative Office Building 208 "
666282,2015-01-29,"Committee Report: Inexpedient to Legislate for Feb 4 (Vote 17-0; Consent Calendar); House Calendar10, PG. 150 "
666282,2015-02-04,"Inexpedient to Legislate: Motion Adopted Voice Vote; House Journal  14, PG. 274 "
666283,2015-01-07,"Introduced and Referred to Transportation; House Journal  7, PG. 118 "
666283,2015-01-14,"Public Hearing: 1/20/2015 10:30 Amendment Legislative Office Building 203 "
666283,2015-01-21,"==POSTPONED== Executive Session: 1/27/2015 2:30 PM Legislative Office Building 203 "
666283,2015-01-26,"==RESCHEDULED== Executive Session: 1/28/2015 2:30 PM Legislative Office Building 203 "
666283,2015-01-29,"Committee Report: Ought to Pass for Feb 4 (Vote 14-0; Consent Calendar); House Calendar10, PG. 152 "
666283,2015-02-04,"Ought to Pass: Motion Adopted Voice Vote; House Journal  14, PG. 275 "
666283,2015-02-04,"Referred to Criminal Justice and Public Safety "
666283,2015-03-09,"Public Hearing: 3/17/2015 11:30 Amendment Legislative Office Building 204 "
666283,2015-03-19,"Committee Report: Ought to Pass for Mar 25 (Vote 17-0; Consent Calendar); House Calendar 23, PG. 632 "
666283,2015-03-25,"Ought to Pass: Motion Adopted Voice Vote; House Journal  28, PG. 1289 "
666283,2015-03-26,"Introduced and Referred to Transportation; Senate Journal 11 "
666283,2015-04-07,"Hearing: 4/14/15, Room 103, Legislative Office Building, 1:00 p.m.; Senate Calendar 17 "
666283,2015-04-23,"Committee Report: Ought to Pass, 4/30/15; Vote 5-0; Consent Calendar; Senate Calendar 19 "
666283,2015-04-30,"Ought to Pass: Motion Adopted, Voice Vote; OT3rdg; Senate Journal 12 "
666283,2015-05-13,"Enrolled (In recess 5/7/2015); Senate Journal 14 "
666283,2015-05-13,"Enrolled (in recess of 5/6/2015); House Journal  41, PG. 1779 "
666283,2015-06-03,"Signed by the Governor on 6/2/2015; Chapter 52; Effective Date 6/2/2015 "
666284,2014-12-03,"Introduced and Adopted, Voice Vote; House Journal  4, PG. 47 "
666285,2015-01-07,"Introduced and Referred to Science, Technology and Energy; House Journal  7, PG. 118 "
666285,2015-01-07,"Public Hearing: 1/14/2015 11:00 Amendment Legislative Office Building 304 "
666285,2015-01-14,"Full Committee Work Session: 1/21/2015 11:00 Amendment Legislative Office Building 304 "
666285,2015-01-22,"==POSTPONED== Executive Session: 1/27/2015 12:45 PM Legislative Office Building 304 "
666285,2015-01-26,"==RESCHEDULED== Executive Session: 1/28/2015 12:45 PM Legislative Office Building 304 "
666285,2015-01-29,"Committee Report: Inexpedient to Legislate for Feb 4 (Vote 17-0; Consent Calendar); House Calendar10, PG. 152 "
666285,2015-02-04,"Inexpedient to Legislate: Motion Adopted Voice Vote; House Journal  14, PG. 275 "
666603,2015-01-05,"Introduced and Referred to Judiciary; Senate Journal 2  "
666603,2015-01-08,"Hearing: 1/13/15, Room 100, State House, 9:45 a.m.; Senate Calendar 5 "
666603,2015-01-22,"Committee Report: Ought to Pass with Amendment #2015-0005s, 1/29/15; Vote 5-0; Consent Calendar; Senate Calendar 7 "
666603,2015-01-29,"Committee Amendment 0005s, Amendment Adopted, Voice Vote "
666603,2015-01-29,"Ought to Pass with Amendment 0005s, Motion Adopted, Voice Vote; OT3rdg; Senate Journal 4  "
666603,2015-03-04,"Introduced and Referred to Judiciary; House Journal  22, PG. 628 "
666603,2015-03-24,"Public Hearing: 3/31/2015 1:00 PM Legislative Office Building 208 "
666603,2015-04-01,"Executive Session: 4/7/2015 10:00 Amendment Legislative Office Building 208 "
666603,2015-04-08,"Committee Report: Ought to Pass with Amendment #2015-1242h for Apr 15 (Vote 16-1; Consent Calendar); House Calendar 29, PG. 1305 "
666603,2015-04-15,"Amendment #1242h: Amendment Adopted Voice Vote; House Journal  34, PG. 1545-1546 "
666603,2015-04-15,"Ought to Pass with Amendment #1242h: Motion Adopted Voice Vote; House Journal  34, PG. 1545-1546 "
666603,2015-04-30,"Sen. Carson Concurs with House Amendment #1242h, Motion Adopted, Voice Vote; Senate Journal 12 "
666603,2015-05-06,"Enrolled Bill Amendment #2015-1603-EBA: Amendment Adopted Voice Vote; House Journal  41, PG. 1778 "
666603,2015-05-21,"Enrolled Bill Amendment #2015-1603e Adopted, Voice Vote, (In recess of 5/14/2015); Senate Journal 15 "
666603,2015-05-21,"Enrolled (in recess of 5/6/2015); House Journal  41, PG. 1782 "
666603,2015-05-21,"Enrolled (In recess 5/21/2015); Senate Journal 16 "
666603,2015-06-11,"Signed by the Governor on 06/08/2015; Chapter 0114; Effective 08/07/2015 "
666914,2015-01-07,"Introduced and Referred to Transportation; Senate Journal 2  "
666914,2015-01-22,"Hearing:=== CANCELLED === 1/27/15, Room 103, Legislative Office Building, 1:30 p.m.; Senate Calendar 7 "
666914,2015-01-26,"Hearing:=== RESCHEDULED === 2/5/15, Room 103, Legislative Office Building, 1:30 p.m.; Senate Calendar 8 "
666914,2015-02-12,"Committee Report: Ought to Pass, 2/19/15; Vote 5-0; Consent Calendar; Senate Calendar 10 "
666914,2015-02-19,"Ought to Pass: Motion Adopted, Voice Vote; OT3rdg; Senate Journal 6  "
666914,2015-03-04,"Introduced and Referred to Resources, Recreation and Development; House Journal  22, PG. 628 "
666914,2015-03-11,"Public Hearing: 3/18/2015 10:00 Amendment Legislative Office Building 305 "
666914,2015-04-09,"Executive Session: 4/7/2015 Legislative Office Building 305 "
666914,2015-04-09,"Committee Report: Ought to Pass for Apr 15 (Vote 14-5; Regular Calendar); House Calendar 29, PG. 1309-1310 "
666914,2015-04-15,"Ought to Pass: Motion Adopted Voice Vote; House Journal  34, PG. 1559 "
666914,2015-04-29,"Enrolled; House Journal  36, PG. 1597 "
666914,2015-04-29,"Enrolled (In recess 4/9/2015); Senate Journal 12 "
666914,2015-05-08,"Signed by the Governor on 05/07/2015; Chapter 0026; Effective 07/06/2015 "
667269,2015-01-07,"Introduced and Referred to Public and Municipal Affairs; Senate Journal 2  "
667269,2015-01-15,"Hearing: 1/21/15, Room 102, Legislative Office Building, 9:15 a.m.; Senate Calendar 6 "
667269,2015-01-30,"Committee Report: Inexpedient to Legislate, 2/12/15; Senate Calendar 9 "
667269,2015-02-12,"Inexpedient to Legislate, Motion Adopted, Voice Vote === BILL KILLED ===; Senate Journal 5 "
667429,2015-01-07,"Introduced Referred to Judiciary; Senate Journal 2  "
667429,2015-01-08,"Hearing: 1/13/15, Room 100, State House, 9:15 a.m.; Senate Calendar 5 "
667429,2015-03-12,"Committee Report: Ought to Pass with Amendment #2015-0811s, 3/19/15; Vote 5-0; Consent Calendar; Senate Calendar 13 "
667429,2015-03-19,"Committee Amendment 0811s, Amendment Adopted, Voice Vote "
667429,2015-03-19,"Ought to Pass with Amendment 0811s, Motion Adopted, Voice Vote; OT3rdg; Senate Journal 9  "
667429,2015-03-24,"Introduced and Referred to Judiciary (in recess of 3/12/2015); House Journal  26, PG. 1276 "
667429,2015-04-08,"Public Hearing: 4/14/2015 10:00 Amendment Legislative Office Building 208 "
667429,2015-04-15,"Executive Session: 4/21/2015 10:00 Amendment Legislative Office Building 208 "
667429,2015-04-22,"Committee Report: Inexpedient to Legislate for Apr 29 (Vote 16-1; Consent Calendar); House Calendar 32, PG. 1483 "
667429,2015-04-29,"Inexpedient to Legislate: Motion Adopted Voice Vote; House Journal  36, PG. 1578 "
667588,2015-01-07,"Introduced and Referred to Commerce; Senate Journal 2  "
667588,2015-01-15,"Hearing: 1/22/15, Room 101, Legislative Office Building, 9:00 a.m.; Senate Calendar 6 "
667588,2015-02-05,"Committee Report: Rereferred to Committee, 2/12/15; Vote 5-0; Consent Calendar; Senate Calendar 9 "
667588,2015-02-12,"Rereferred to Committee, Motion Adopted, Voice Vote, Senate Journal 5  "
667588,2015-11-25,"Committee Report: Referred to Interim Study; 1/6/16; Vote 5-0; Consent Calendar; Senate Calendar 49 "
668819,2015-01-07,"Introduced and Adopted, Voice Vote; Senate Journal 2  "
670846,2015-01-08,"Introduced and Referred to Commerce and Consumer Affairs; House Journal  12, PG. 210 "
670846,2015-01-14,"Public Hearing: 1/21/2015 1:30 PM Legislative Office Building 302 "
670846,2015-02-04,"Subcommittee Work Session: 2/12/2015 3:00 PM Legislative Office Building 302 "
670846,2015-02-20,"Executive Seesion: 3/3/2015 1:00 PM Legislative Office Building 302 "
670846,2015-03-05,"Committee Report: Ought to Pass with Amendment #2015-0374h (NT) for Mar 11 (Vote 20-0; Consent Calendar); House Calendar19, PG. 390-391 "
670846,2015-03-11,"Amendment #0374h: Amendment Adopted Voice Vote; House Journal  24, PG. 768 "
670846,2015-03-11,"Ought to Pass with Amendment #0374h: Motion Adopted Voice Vote; House Journal  24, PG. 768 "
670846,2015-03-19,"Introduced and Referred to Executive Departments and Administration; Senate Journal 10 "
670846,2015-03-25,"Hearing: 4/2/15, Room 101, Legislative Office Building, 2:00 p.m.; Senate Calendar 15 "
670846,2015-04-02,"Committee Report: Ought to Pass, 4/9/15; Senate Calendar 16 "
670846,2015-04-09,"Ought to Pass: Motion Adopted, Voice Vote; OT3rdg; Senate Journal 11 "
670846,2015-04-21,"Enrolled Bill Amendment #1358e Adopted, Voice Vote, (In recess of 4/9/2015); Senate Journal 12 "
670846,2015-04-22,"Enrolled Bill Amendment #2015-1358EBA: Amendment Adopted Voice Vote (in recess of 4/15/2015); House Journal  34, PG. 1564 "
670846,2015-04-29,"Enrolled (In recess 4/9/2015); Senate Journal 12 "
670846,2015-04-29,"Enrolled; House Journal  36, PG. 1597 "
670846,2015-05-07,"Signed by the Governor on 5/5/2015; Chapter 08; Effective Date 5/5/2015 "
670857,2015-01-08,"Introduced and Referred to Ways and Means; House Journal  12, PG. 210 "
670857,2015-01-21,"Public Hearing: 2/3/2015 11:30 Amendment Legislative Office Building 202 "
670857,2015-01-29,"==RESCHEDULED== Public Hearing: 2/9/2015 11:30 Amendment Legislative Office Building 202=RECESSED= "
670857,2015-02-09,"Continued Public Hearing: 2/13/2015 11:30 Amendment Legislative Office Building 202 "
670857,2015-02-18,"Executive Session: 2/18/2015 12:30 PM Legislative Office Building 202 "
670857,2015-02-25,"Committee Report: Inexpedient to Legislate for Mar 11 (Vote 14-5; Regular Calendar); House Calendar19, PG. 409 "
670857,2015-03-11,"Inexpedient to Legislate: Motion Failed DV 157-204; House Journal  24, PG. 808 "
670857,2015-03-11,"Ought to Pass: Motion Adopted Voice Vote; House Journal  24, PG. 808 "
670857,2015-03-19,"Introduced and Referred to Ways and Means; Senate Journal 10 "
670857,2015-04-08,"Hearing: 4/14/15, Room 103, State House, 9:30 a.m.; Senate Calendar 17 "
670857,2015-04-14,"=== CANCELLED SESSION === Committee Report: Rereferred to Committee, 4/23/15; Senate Calendar 18 "
670857,2015-04-17,"=== RESCHEDULED === Committee Report: Rereferred to Committee, 4/30/15; Senate Calendar 19 "
670857,2015-04-30,"Rereferred to Committee, Regular Calendar 13Y-11N, Motion Adopted; Senate Journal 12 "
670857,2015-05-20,"Committee Report: Ought to Pass, 5/28/15; Senate Calendar 23 "
670857,2015-05-28,"Ought to Pass: Motion Adopted, Voice Vote; OT3rdg; Senate Journal 16 "
670857,2015-06-10,"Enrolled (In recess 6/4/2015); Senate Journal 18 "
670857,2015-06-11,"Enrolled; House Journal  46, PG. 1989 "
670857,2015-06-30,"Signed by the Governor on 6/26/2015; Chapter 160; Effective Date 7/1/2015 "
670870,2015-01-08,"Introduced and Adopted, Voice Vote; Senate Journal 3  "
670885,2015-01-08,"Introduced and Referred to Public Works and Highways; House Journal  12, PG. 209 "
670885,2015-01-13,"Public Hearing: 1/20/2015 11:00 Amendment Legislative Office Building 201 "
670885,2015-01-20,"==POSTPONED== Executive Session: 1/27/2015 11:00 Amendment Legislative Office Building 201 "
670885,2015-01-26,"==RESCHEDULED== Executive Session: 1/28/2015 11:00 Amendment Legislative Office Building 201 "
670885,2015-01-29,"Committee Report: Inexpedient to Legislate for Feb 4 (Vote 15-0; Regular Calendar); House Calendar10, PG. 153 "
670885,2015-02-04,"Inexpedient to Legislate: Motion Adopted Voice Vote; House Journal  14, PG. 276 "
670893,2015-01-08,"Introduced and Referred to Municipal and County Government; House Journal  12, PG. 210 "
670893,2015-01-14,"Public Hearing: 1/20/2015 11:00 Amendment Legislative Office Building 301 "
670893,2015-01-21,"Executive Session: 1/29/2015 Legislative Office Building 301 "
670893,2015-02-05,"Committee Report: Ought to Pass for Feb 11 (Vote 20-0; Consent Calendar); House Calendar11, PG. 176 "
670893,2015-02-11,"Ought to Pass: Motion Adopted Voice Vote; House Journal  16, PG. 304 "
670893,2015-03-12,"Introduced and Referred to Public and Municipal Affairs; Senate Journal 9  "
670893,2015-03-26,"Hearing: 4/1/15, Room 102, Legislative Office Building, 9:30 a.m.; Senate Calendar 15 "
670893,2015-04-01,"Committee Report: Ought to Pass, 4/9/15; Vote 5-0; Consent Calendar; Senate Calendar 16 "
670893,2015-04-09,"Ought to Pass: Motion Adopted, Voice Vote; OT3rdg; Senate Journal 11 "
670893,2015-04-21,"Enrolled (In recess 4/9/2015); Senate Journal 12 "
670893,2015-04-22,"Enrolled (in recess of 4/15/2015); House Journal  34, PG. 1564 "
670893,2015-05-07,"Signed by the Governor on 5/5/2015; Chapter 06; Effective Date 7/4/2015 "
670903,2015-01-08,"Introduced and Referred to Resources, Recreation and Development; House Journal  12, PG. 210 "
670903,2015-01-14,"Public Hearing: 1/20/2015 11:30 Amendment Legislative Office Building 305 "
670903,2015-01-21,"==POSTPONED== Full Committee Work Session: 1/27/2015 11:30 Amendment Legislative Office Building 305 "
670903,2015-01-26,"==RESCHEDULED== Full Committee Work Session: 1/28/2015 11:30 Amendment Legislative Office Building 305 "
670903,2015-01-28,"Executive Session: 1/28/2015 Legislative Office Building 305 "
670903,2015-01-29,"Committee Report: Inexpedient to Legislate for Feb 4 (Vote 18-0; Consent Calendar); House Calendar10, PG. 151 "
670903,2015-02-04,"Inexpedient to Legislate: Motion Adopted Voice Vote; House Journal  14, PG. 275 "
670963,2015-01-08,"Introduced and Referred to Health, Human Services and Elderly Affairs; House Journal  12, PG. 210 "
670963,2015-01-14,"Public Hearing: 1/22/2015 1:00 PM Legislative Office Building 305-307 "
670963,2015-01-28,"Executive Session: 2/3/2015 10:00 Amendment Legislative Office Building 205 "
670963,2015-02-05,"Committee Report: Inexpedient to Legislate for Feb 11 (Vote 17-1; Consent Calendar); House Calendar11, PG. 174 "
670963,2015-02-11,"Inexpedient to Legislate: Motion Adopted Voice Vote; House Journal  16, PG. 301-302 "
671003,2015-01-08,"Introduced and Referred to Health, Human Services and Elderly Affairs; House Journal  12, PG. 210 "
671003,2015-01-14,"Public Hearing: 1/22/2015 11:00 Amendment Legislative Office Building 305-307 "
671003,2015-01-28,"Executive Session: 2/3/2015 10:00 Amendment Legislative Office Building 205 "
671003,2015-02-05,"Committee Report: Inexpedient to Legislate for Feb 11 (Vote 18-0; Consent Calendar); House Calendar11, PG. 174 "
671003,2015-02-11,"Inexpedient to Legislate: Motion Adopted Voice Vote; House Journal  16, PG. 301 "
671015,2015-01-08,"Introduced and Referred to Executive Departments and Administration; House Journal  12, PG. 209 "
671015,2015-01-14,"Public Hearing: 1/22/2015 11:00 Amendment Legislative Office Building 306 "
671015,2015-01-29,"Executive Session: 2/3/2015 2:30 PM Legislative Office Building 306 "
671015,2015-02-05,"Committee Report: Inexpedient to Legislate for Feb 11 (Vote 15-0; Consent Calendar); House Calendar11, PG. 172 "
671015,2015-02-11,"Inexpedient to Legislate: Motion Adopted Voice Vote; House Journal  16, PG. 299 "
671025,2015-01-08,"Introduced and Referred to Election Law; House Journal  12, PG. 209 "
671025,2015-01-14,"Public Hearing: 1/20/2015 1:15 PM Legislative Office Building 308 "
671025,2015-02-11,"Executive Session: 2/12/2015 10:00 Amendment Legislative Office Building 308 "
671025,2015-02-20,"Committee Report: Ought to Pass for Mar 4 (Vote 18-0; Consent Calendar); House Calendar18, PG. 345 "
671025,2015-03-04,"Ought to Pass: Motion Adopted Voice Vote; House Journal  22, PG. 560 "
671025,2015-03-05,"Introduced and Referred to Public and Municipal Affairs; Senate Journal 8  "
671025,2015-03-26,"Hearing: 4/2/15, Room 102, Legislative Office Building, 1:00 p.m.; Senate Calendar 15 "
671025,2015-04-13,"=== CANCELLED SESSION === Committee Report: Ought to Pass, 4/23/15; Vote 5-0; Consent Calendar; Senate Calendar 18 "
671025,2015-04-17,"=== RESCHEDULED === Committee Report: Ought to Pass, 4/30/15; Vote 5-0; Consent Calendar; Senate Calendar 19 "
671025,2015-04-30,"Ought to Pass: Motion Adopted, Voice Vote; OT3rdg; Senate Journal 12 "
671025,2015-05-13,"Enrolled (In recess 5/7/2015); Senate Journal 14 "
671025,2015-05-13,"Enrolled (in recess of 5/6/2015); House Journal  41, PG. 1779 "
671025,2015-06-03,"Signed by the Governor on 6/2/2015; Chapter 58; Effective Date 8/1/2015 "
671041,2015-01-08,"Introduced and Referred to Judiciary; House Journal  12, PG. 210 "
671041,2015-01-14,"Public Hearing: 1/20/2015 1:00 PM Legislative Office Building 208 "
671041,2015-01-29,"Executive Session: 1/20/2015 Legislative Office Building 208 "
671041,2015-01-29,"Committee Report: Inexpedient to Legislate for Feb 4 (Vote 16-0; Consent Calendar); House Calendar10, PG. 151 "
671041,2015-02-04,"Inexpedient to Legislate: Motion Adopted Voice Vote; House Journal  14, PG. 274 "
671050,2015-01-08,"Introduced and Referred to Commerce and Consumer Affairs; House Journal  12, PG. 210 "
671050,2015-01-14,"Public Hearing: 1/21/2015 11:30 Amendment Legislative Office Building 302 "
671050,2015-02-04,"Subcommittee Work Session: 2/12/2015 3:00 PM Legislative Office Building 302 "
671050,2015-02-20,"Executive Seesion: 3/3/2015 1:00 PM Legislative Office Building 302 "
671050,2015-03-05,"Committee Report: Inexpedient to Legislate for Mar 11 (Vote 20-0; Consent Calendar); House Calendar19, PG. 390 "
671050,2015-03-11,"Inexpedient to Legislate: Motion Adopted Voice Vote; House Journal  24, PG. 767 "
671074,2015-01-08,"Introduced and Referred to Commerce and Consumer Affairs; House Journal  12, PG. 210 "
671074,2015-01-14,"Public Hearing: 1/20/2015 10:00 Amendment Legislative Office Building 302 "
671074,2015-02-04,"Executive Session: 2/4/2015 1:00 PM Legislative Office Building 302 "
671074,2015-02-11,"Committee Report: Ought to Pass for Feb 18 (Vote 19-0; Consent Calendar); House Calendar13, PG. 237 "
671074,2015-02-18,"Ought to Pass: Motion Adopted Voice Vote; House Journal  20, PG. 497 "
671074,2015-03-12,"Introduced and Referred to Commerce; Senate Journal 9  "
671074,2015-03-19,"Hearing: 3/24/15, Room 100, State House, 1:00 p.m.; Senate Calendar 14 "
671074,2015-03-24,"Committee Report: Ought to Pass, 4/9/15; Senate Calendar 16 "
671074,2015-04-09,"Ought to Pass: Motion Adopted, Voice Vote; OT3rdg; Senate Journal 11 "
671074,2015-04-21,"Enrolled (In recess 4/9/2015); Senate Journal 12 "
671074,2015-04-22,"Enrolled (in recess of 4/15/2015); House Journal  34, PG. 1564 "
671074,2015-05-07,"Signed by the Governor on 5/5/2015; Chapter 07; Effective Date 7/4/2015 "
671083,2015-01-08,"Introduced and Referred to Judiciary; House Journal  12, PG. 209 "
671083,2015-01-14,"Public Hearing: 1/20/2015 10:45 Amendment Legislative Office Building 208 "
671083,2015-02-04,"Executive Session: 2/4/2015 12:45 PM Legislative Office Building 208 ==RECESSED== "
671083,2015-02-11,"==CANCELED== Continued Executive Session: 2/17/2015 10:00 Amendment Legislative Office Building 208 "
671083,2015-02-12,"==RESCHEDULED== Continued Executive Session: 2/12/2015 Legislative Office Building 208 "
671083,2015-02-20,"Majority Committee Report: Ought to Pass for Mar 4 (Vote 9-7; Regular Calendar); House Calendar18, PG. 359 "
671083,2015-02-20,"Minority Committee Report: Inexpedient to Legislate "
671083,2015-03-04,"Ought to Pass: Motion Adopted DV 189-161; House Journal  22, PG. 595 "
671083,2015-03-05,"Introduced and Referred to Health and Human Services; Senate Journal 8  "
671083,2015-03-19,"Hearing: 3/24/15, Room 101, Legislative Office Building, 1:00 p.m.; Senate Calendar 14 "
671083,2015-04-15,"=== CANCELLED SESSION === Committee Report: Ought to Pass, 4/23/15; Senate Calendar 18 "
671083,2015-04-17,"=== RESCHEDULED === Committee Report: Ought to Pass, 4/30/15; Senate Calendar 19 "
671083,2015-04-30,"Ought to Pass: Motion Adopted, Voice Vote; OT3rdg; Senate Journal 12 "
671083,2015-05-13,"Enrolled (In recess 5/7/2015); Senate Journal 14 "
671083,2015-05-13,"Enrolled (in recess of 5/6/2015); House Journal  41, PG. 1779 "
671083,2015-06-03,"Vetoed by the Governor on 6/2/2015; House Journal  46, PG. 1985 "
671083,2015-06-11,"Veto Sustained: Regular Calendar 184-154 Lacking the Necessary Two-Thirds Vote; House Journal  46, PG. 1985-1987 "
671095,2015-01-08,"Introduced and Referred to Criminal Justice and Public Safety; House Journal  12, PG. 209 "
671095,2015-01-13,"Public Hearing: 1/20/2015 1:00 PM Legislative Office Building 204 "
671095,2015-02-04,"==CANCELED== Executive Session: 2/4/2015 1:00 PM Legislative Office Building 204 "
671095,2015-02-25,"Executive Session: 3/3/2015 10:30 Amendment Legislative Office Building 204 "
671095,2015-03-05,"Committee Report: Ought to Pass with Amendment #2015-0347h (NT) for Mar 11 (Vote 13-4; Regular Calendar); House Calendar19, PG. 416 "
671095,2015-03-11,"Amendment #0347h: Amendment Adopted Voice Vote; House Journal  24, PG. 842-843 "
671095,2015-03-11,"Ought to Pass with Amendment #0347h: Motion Adopted Voice Vote; House Journal  24, PG. 842-843 "
671095,2015-03-19,"Introduced and Referred to Health and Human Services; Senate Journal 10 "
671095,2015-03-26,"Hearing: 3/31/15, Room 101, Legislative Office Building, 1:00 p.m.; Senate Calendar 15 "
671095,2015-04-16,"=== CANCELLED SESSION === Committee Report: Inexpedient to Legislate, 4/23/15; Vote 5-0; Consent Calendar; Senate Calendar 18 "
671095,2015-04-17,"=== RESCHEDULED === Committee Report: Inexpedient to Legislate, 4/30/15; Vote 5-0; Consent Calendar; Senate Calendar 19 "
671095,2015-04-30,"Inexpedient to Legislate, Motion Adopted, Voice Vote === BILL KILLED ===; Senate Journal 12 "
671108,2015-01-08,"Introduced and Referred to Municipal and County Government; House Journal  12, PG. 209 "
671108,2015-01-28,"Public Hearing: 2/3/2015 10:30 Amendment Legislative Office Building 301 "
671108,2015-01-28,"Executive Session: 2/3/2015 2:15 PM Legislative Office Building 301 "
671108,2015-02-05,"Committee Report: Ought to Pass for Feb 11 (Vote 18-0; Consent Calendar); House Calendar11, PG. 176 "
671108,2015-02-11,"Ought to Pass: Motion Adopted Voice Vote; House Journal  16, PG. 304 "
671108,2015-03-12,"Introduced and Referred to Public and Municipal Affairs; Senate Journal 9  "
671108,2015-03-26,"Hearing: 4/1/15, Room 102, Legislative Office Building, 9:15 a.m.; Senate Calendar 15 "
671108,2015-04-13,"=== CANCELLED SESSION === Committee Report: Ought to Pass, 4/23/15; Senate Calendar 18 "
671108,2015-04-17,"=== RESCHEDULED === Committee Report: Ought to Pass, 4/30/15; Senate Calendar 19 "
671108,2015-04-30,"Ought to Pass: Motion Adopted, Voice Vote; OT3rdg; Senate Journal 12 "
671108,2015-05-13,"Enrolled (In recess 5/7/2015); Senate Journal 14 "
671108,2015-05-13,"Enrolled (in recess of 5/6/2015); House Journal  41, PG. 1779 "
671108,2015-06-03,"Signed by the Governor on 6/2/2015; Chapter 59; Effective Date 8/1/2015 "
671119,2015-01-08,"Introduced and Referred to Legislative Administration; House Journal  12, PG. 210 "
671119,2015-01-21,"Public Hearing: 1/29/2015 10:00 Amendment Legislative Office Building 104 "
671119,2015-02-05,"Executive Session: 2/4/2015 2:00 PM Legislative Office Building 104 "
671119,2015-02-05,"Committee Report: Inexpedient to Legislate for Feb 11 (Vote 8-0; Consent Calendar); House Calendar11, PG. 175 "
671119,2015-02-11,"Removed from Consent Calendar (Rep Tucker); House Journal  16, PG. 298 "
671119,2015-02-11,"Lay on Table (Rep Hinch): Motion Adopted Voice Vote; House Journal  16, PG. 330 "
671130,2015-01-08,"Introduced and Referred to Children and Family Law; House Journal  12, PG. 210 "
671130,2015-01-14,"Public Hearing: 1/20/2015 10:00 Amendment Legislative Office Building 206 "
671130,2015-01-15,"===CANCELLED=== Public Hearing: 1/20/2015 10:00 Amendment Legislative Office Building 206 "
671130,2015-01-21,"==POSTPONED= Public Hearing: 1/27/2015 2:00 PM Legislative Office Building 206 "
671130,2015-01-26,"=RESCHEDDULED= Public Hearing: 1/28/2015 2:00 PM Legislative Office Building 206 "
671130,2015-02-04,"Executive Session: 2/4/2015 12:00 PM Legislative Office Building 206 "
671130,2015-02-06,"Committee Report: Inexpedient to Legislate for Feb 11 (Vote 13-4; Regular Calendar); House Calendar11, PG. 179 "
671130,2015-02-11,"Inexpedient to Legislate: Motion Adopted Voice Vote; House Journal  16, PG. 307 "
671143,2015-01-08,"Introduced and Referred to Science, Technology and Energy; House Journal  12, PG. 209 "
671143,2015-01-14,"Public Hearing: 1/21/2015 2:30 PM Legislative Office Building 304 "
671143,2015-02-04,"Executive Session: 2/4/2015 1:00 PM Legislative Office Building 304 "
671143,2015-02-05,"Majority Committee Report: Ought to Pass for Feb 11 (Vote 12-9; Regular Calendar); House Calendar11, PG. 182 "
671143,2015-02-05,"Minority Committee Report: Inexpedient to Legislate "
671143,2015-02-11,"Ought to Pass: Motion Adopted Voice Vote; House Journal  16, PG. 318 "
671143,2015-03-12,"Introduced and Referred to Energy and Natural Resources; Senate Journal 9  "
671143,2015-03-25,"Hearing: 4/1/15, Room 100, State House, 9:00 a.m.; Senate Calendar 15 "
671143,2015-04-15,"=== CANCELLED SESSION === Committee Report: Ought to Pass with Amendment 1345s, 4/23/15; Senate Calendar 18 "
671143,2015-04-17,"=== RESCHEDULED === Committee Report: Ought to Pass with Amendment #2015-1345s, 4/30/15; Senate Calendar 19 "
671143,2015-04-30,"Committee Amendment 1345s, Amendment Adopted, Voice Vote "
671143,2015-04-30,"Ought to Pass with Amendment 1345s, Motion Adopted, Voice Vote; OT3rdg; Senate Journal 12 "
671143,2015-06-03,"House Concurs with Senate Amendment #1345s (Rep Introne): Motion Adopted Voice Vote; House Journal  44, PG. 1814 "
671143,2015-06-17,"Enrolled Bill Amendment #2129e Adopted, Voice Vote, (In recess of 6/11/2015); Senate Journal 19 "
671143,2015-06-17,"Enrolled Bill Amendment #2015-2129EBA: Amendment Adopted Voice Vote (in recess of 6/11/2015); House Journal  46, PG. 1991 "
671143,2015-06-24,"Enrolled (In recess 6/24/2015); Senate Journal 19 "
671143,2015-06-24,"Enrolled; House Journal  54, PG. 2135 "
671143,2015-07-07,"Signed by the Governor on 7/6/2015; Chapter 189; Effective 7/6/2015 "
671155,2015-01-08,"Introduced and Referred to Executive Departments and Administration; House Journal  12, PG. 209 "
671155,2015-01-14,"Public Hearing: 1/22/2015 1:45 PM Legislative Office Building 306 "
671155,2015-02-24,"Executive Session: 3/2/2015 12:30 PM Legislative Office Building 306 "
671155,2015-03-05,"Committee Report: Ought to Pass with Amendment #2015-0048h (NT) for Mar 11 (Vote 10-5; Regular Calendar); House Calendar19, PG. 423-424 "
671155,2015-03-11,"Amendment #0048h: Amendment Adopted Voice Vote; House Journal  24, PG. 884-885 "
671155,2015-03-11,"Ought to Pass with Amendment #0048h: Motion Adopted Voice Vote; House Journal  24, PG. 884-885 "
671155,2015-03-19,"Introduced and Referred to Executive Departments and Administration; Senate Journal 10 "
671155,2015-04-08,"Hearing: 4/22/15, Room 101, Legislative Office Building, 9:00 a.m.; Senate Calendar 17 "
671155,2015-05-20,"Committee Report: Rereferred to Committee, 5/28/15; Senate Calendar 23 "
671155,2015-05-28,"Rereferred to Committee, Motion Adopted, Voice Vote, Senate Journal 16 "
671166,2015-01-08,"Introduced and Referred to Executive Departments and Administration; House Journal  12, PG. 209 "
671166,2015-01-14,"Public Hearing: 1/22/2015 10:00 Amendment Legislative Office Building 306 "
671166,2015-01-29,"Executive Session: 2/3/2015 2:30 PM Legislative Office Building 306 "
671166,2015-02-11,"Committee Report: Ought to Pass with Amendment #2015-0062h for Feb 18 (Vote 15-0; Consent Calendar); House Calendar13, PG. 239 "
671166,2015-02-18,"Amendment #0062h (Rep P. Schmidt): Amendment Adopted Voice Vote; House Journal  20, PG. 499 "
671166,2015-02-18,"Ought to Pass with Amendment #0062h: Motion Adopted Voice Vote; House Journal  20, PG. 498-499 "
671166,2015-03-12,"Introduced and Referred to Executive Departments and Administration; Senate Journal 9  "
671166,2015-04-08,"Hearing: 4/15/15, Room 101, Legislative Office Building, 9:45 a.m.; Senate Calendar 17 "
671166,2015-04-15,"=== CANCELLED SESSION === Committee Report: Ought to Pass, 4/23/15; Vote 5-0; Consent Calendar; Senate Calendar 18 "
671166,2015-04-17,"=== RESCHEDULED === Committee Report: Ought to Pass, 4/30/15; Vote 5-0; Consent Calendar; Senate Calendar 19 "
671166,2015-04-30,"Ought to Pass: Motion Adopted, Voice Vote; OT3rdg; Senate Journal 12 "
671166,2015-05-13,"Enrolled (In recess 5/7/2015); Senate Journal 14 "
671166,2015-05-13,"Enrolled (in recess of 5/6/2015); House Journal  41, PG. 1779 "
671166,2015-06-03,"Signed by the Governor on 6/2/2015; Chapter 56; Effective Date 8/1/2015 "
671182,2015-01-08,"Introduced and Referred to Municipal and County Government; House Journal  12, PG. 209 "
671182,2015-01-14,"Public Hearing: 1/20/2015 10:40 Amendment Legislative Office Building 301 "
671182,2015-01-21,"Executive Session: 1/29/2015 Legislative Office Building 301 "
671182,2015-02-03,"Committee Report: Ought to Pass with Amendment #2015-0119h for Feb 11 (Vote 14-5; Regular Calendar); House Calendar11, PG. 182 "
671182,2015-02-11,"Amendment #0119h: Amendment Adopted Voice Vote; House Journal  16, PG. 318 "
671182,2015-02-11,"Ought to Pass with Amendment #0119h: Motion Adopted Voice Vote; House Journal  16, PG. 318 "
671182,2015-03-12,"Introduced and Referred to Ways and Means; Senate Journal 9  "
671182,2015-03-18,"Hearing: 3/24/15, Room 103, State House, 9:00 a.m.; Senate Calendar 14 "
671182,2015-04-14,"=== CANCELLED SESSION === Committee Report: Ought to Pass, 4/23/15; Senate Calendar 18 "
671182,2015-04-17,"=== RESCHEDULED === Committee Report: Ought to Pass, 4/30/15; Senate Calendar 19 "
671182,2015-04-30,"Ought to Pass: Motion Adopted, Voice Vote; OT3rdg; Senate Journal 12 "
671182,2015-05-13,"Enrolled (In recess 5/7/2015); Senate Journal 14 "
671182,2015-05-13,"Enrolled (in recess of 5/6/2015); House Journal  41, PG. 1779 "
671182,2015-06-03,"Signed by the Governor on 6/2/2015; Chapter 57; Effective Date 1/1/2016 "
671194,2015-01-08,"Introduced and Referred to Commerce and Consumer Affairs; House Journal  12, PG. 210 "
671194,2015-01-14,"Public Hearing: 1/21/2015 10:30 Amendment Legislative Office Building 302 "
671194,2015-02-04,"Subcommittee Work Session: 2/12/2015 3:00 PM Legislative Office Building 302 "
671194,2015-02-20,"Executive Session: 3/3/2015 1:00 PM Legislative Office Building 302 "
671194,2015-03-05,"Committee Report: Inexpedient to Legislate for Mar 11 (Vote 20-0; Consent Calendar); House Calendar19, PG. 390 "
671194,2015-03-11,"Inexpedient to Legislate: Motion Adopted Voice Vote; House Journal  24, PG. 767 "
671205,2015-01-08,"Introduced and Referred to Municipal and County Government; House Journal  12, PG. 209 "
671205,2015-01-14,"Public Hearing: 1/20/2015 1:45 PM Legislative Office Building 301 "
671205,2015-01-28,"Executive Session: 2/3/2015 2:15 PM Legislative Office Building 301 "
671205,2015-02-05,"Committee Report: Inexpedient to Legislate for Feb 11 (Vote 18-0; Consent Calendar); House Calendar11, PG. 175-176 "
671205,2015-02-11,"Inexpedient to Legislate: Motion Adopted Voice Vote; House Journal  16, PG. 304 "
671226,2015-01-08,"Introduced and referred to Election Law; House Journal  12, PG. 209 "
671226,2015-01-14,"Public Hearing: 1/20/2015 1:00 PM Legislative Office Building 308 "
671226,2015-01-21,"Subcommittee Work Session: 1/29/2015 10:00 Amendment Legislative Office Building 308 "
671226,2015-02-11,"Executive Session: 2/17/2015 11:00 Amendment Legislative Office Building 308 "
671226,2015-02-20,"Committee Report: Ought to Pass with Amendment #2015-0355h for Mar 4 (Vote 17-0; Consent Calendar); House Calendar18, PG. 344-345 "
671226,2015-03-04,"Amendment #0355h: Amendment Adopted Voice Vote; House Journal  22, PG. 559-560 "
671226,2015-03-04,"Ought to Pass with Amendment #0355h: Motion Adopted Voice Vote; House Journal  22, PG. 559-560 "
671226,2015-03-05,"Introduced and Referred to Public and Municipal Affairs; Senate Journal 8  "
671226,2015-03-17,"Hearing: 3/25/15, Room 102, Legislative Office Building, 9:45 a.m.; Senate Calendar 14 "
671226,2015-04-01,"Committee Report: Ought to Pass with Amendment #2015-1197s, 4/9/15; Vote 5-0; Consent Calendar; Senate Calendar 16 "
671226,2015-04-09,"Committee Amendment 1197s, Amendment Adopted, Voice Vote "
671226,2015-04-09,"Ought to Pass with Amendment 1197s, Motion Adopted, Voice Vote; OT3rdg; Senate Journal 11 "
671226,2015-05-06,"House Concurs with Senate Amendment #1197s (Rep Hoelzel): Motion Adopted Voice Vote; House Journal  41, PG. 1747 "
671226,2015-05-19,"Enrolled (In recess 5/14/2015); Senate Journal 15 "
671226,2015-05-19,"Enrolled (in recess of 5/6/2015); House Journal  41, PG. 1781 "
671226,2015-06-03,"Signed by the Governor on 6/2/2015; Chapter 55; Effective Date 8/1/2015 "
671241,2015-01-08,"Introduced and Referred to Transportation; House Journal  12, PG. 209 "
671241,2015-01-14,"Public Hearing: 1/20/2015 1:30 PM Legislative Office Building 203 "
671241,2015-01-21,"==POSTPONED== Executive Session: 1/27/2015 2:30 PM Legislative Office Building 203 "
671241,2015-01-26,"==RESCHEDULED== Executive Session: 1/28/2015 2:30 PM Legislative Office Building 203 "
671241,2015-01-29,"Executive Session: 2/3/2015 1:30 PM Legislative Office Building 203 "
671241,2015-02-05,"Committee Report: Inexpedient to Legislate for Feb 11 (Vote 17-1; Consent Calendar); House Calendar11, PG. 177 "
671241,2015-02-11,"Inexpedient to Legislate: Motion Adopted Voice Vote; House Journal  16, PG. 306 "
671295,2015-01-08,"Introduced and Referred to Election Law; House Journal  12, PG. 210 "
671295,2015-01-14,"Public Hearing: 1/20/2015 10:00 Amendment Legislative Office Building 308 "
671295,2015-01-21,"==POSTPONED== Executive Session: 1/27/2015 2:30 PM Legislative Office Building 308 "
671295,2015-01-26,"==RESCHEDULED== Executive Session: 1/28/2015 2:30 PM Legislative Office Building 308 "
671295,2015-01-29,"Committee Report: Inexpedient to Legislate for Feb 4 (Vote 11-0; Consent Calendar); House Calendar10, PG. 150 "
671295,2015-02-04,"Inexpedient to Legislate: Motion Adopted Voice Vote; House Journal  14, PG. 274 "
671303,2015-01-08,"Introduced and Referred to Commerce and Consumer Affairs; House Journal  12, PG. 210 "
671303,2015-01-15,"Public Hearing: 1/21/2015 2:00 PM Legislative Office Building 302 "
671303,2015-02-04,"Subcommittee Work Session: 2/12/2015 3:00 PM Legislative Office Building 302 "
671303,2015-02-04,"===CANCELLED=== Work Session: 2/12/2015 3:00 PM Legislative Office Building 302 "
671303,2015-02-05,"Executive Session: 2/4/2015 1:00 PM Legislative Office Building 302 "
671303,2015-02-11,"Committee Report: Inexpedient to Legislate for Feb 18 (Vote 17-0; Consent Calendar); House Calendar13, PG. 237 "
671303,2015-02-18,"Inexpedient to Legislate: Motion Adopted Voice Vote; House Journal  20, PG. 497 "
671312,2015-01-08,"Introduced and Referred to Executive Departments and Administration; House Journal  12, PG. 210 "
671312,2015-01-14,"Public Hearing: 1/22/2015 10:15 Amendment Legislative Office Building 306 "
671312,2015-01-29,"Executive Session: 2/3/2015 2:30 PM Legislative Office Building 306 "
671312,2015-02-05,"Committee Report: Ought to Pass with Amendment #2015-0067h for Feb 11 (Vote 15-0; Consent Calendar); House Calendar11, PG. 172 "
671312,2015-02-11,"Adopt Amendment #0067h: Amendment Adopted Voice Vote; House Journal  16, PG. 299 "
671312,2015-02-11,"Ought to Pass with Amendment #0067h: Motion Adopted Voice Vote; House Journal  16, PG. 299 "
671312,2015-03-12,"Introduced and Referred to Executive Departments and Administration; Senate Journal 9  "
671312,2015-04-01,"Hearing: 4/8/15, Room 101, Legislative Office Building, 9:30 a.m.; Senate Calendar 16 "
671312,2015-04-13,"=== CANCELLED SESSION === Committee Report: Ought to Pass, 4/23/15; Senate Calendar 18 "
671312,2015-04-17,"=== RESCHEDULED === Committee Report: Ought to Pass, 4/30/15; Senate Calendar 19 "
671312,2015-04-30,"Ought to Pass: Motion Adopted, Voice Vote; OT3rdg; Senate Journal 12 "
671312,2015-05-13,"Enrolled (In recess 5/7/2015); Senate Journal 14 "
671312,2015-05-13,"Enrolled (in recess of 5/6/2015); House Journal  41, PG. 1779 "
671312,2015-06-03,"Signed by the Governor on 6/2/2015; Chapter 60; Effective Date 8/1/2015 "
671322,2015-01-08,"Introduced and Referred to Labor, Industrial and Rehabilitative Services; House Journal  12, PG. 210 "
671322,2015-01-28,"Public Hearing: 2/10/2015 1:00 PM Representatives Hall "
671322,2015-02-18,"Executive Session: 2/17/2015 Legislative Office Building 307 "
671322,2015-03-05,"Committee Report: Inexpedient to Legislate for Mar 11 (Vote 17-2; Consent Calendar); House Calendar19, PG. 404 "
671322,2015-03-11,"Inexpedient to Legislate: Motion Adopted Voice Vote; House Journal  24, PG. 795 "
671336,2015-01-08,"Introduced and Referred to Commerce and Consumer Affairs; House Journal  12, PG. 210 "
671336,2015-01-14,"Public Hearing: 1/20/2015 1:15 PM Legislative Office Building 302 "
671336,2015-02-03,"Subcommittee Work Session: 2/12/2015 8:30 Amendment Legislative Office Building 302 "
671336,2015-02-20,"Executive Seesion: 3/3/2015 1:00 PM Legislative Office Building 302 "
671336,2015-03-05,"Committee Report: Ought to Pass for Mar 11 (Vote 20-0; Consent Calendar); House Calendar19, PG. 390 "
671336,2015-03-11,"Ought to Pass: Motion Adopted Voice Vote; House Journal  24, PG. 768 "
671336,2015-03-19,"Introduced and Referred to Ways and Means; Senate Journal 10 "
671336,2015-04-08,"Hearing: 4/14/15, Room 103, State House, 9:00 a.m.; Senate Calendar 17 "
671336,2015-05-05,"Committee Report: Ought to Pass, 5/14/15; Senate Calendar 21 "
671336,2015-05-14,"Ought to Pass: Motion Adopted, Voice Vote; OT3rdg; Senate Journal 14 "
671336,2015-06-03,"Enrolled (In recess 5/28/2015); Senate Journal 17 "
671336,2015-06-03,"Enrolled "
671336,2015-06-16,"Signed by the Governor on 6/12/2015; Chapter 132; Effective Date 1/1/2016 "
671342,2015-01-08,"Introduced and Referred to Commerce and Consumer Affairs; House Journal  12, PG. 210 "
671342,2015-01-14,"Public Hearing: 1/21/2015 1:15 PM Legislative Office Building 302 "
671342,2015-02-04,"Subcommittee Work Session: 2/12/2015 3:00 PM Legislative Office Building 302 "
671342,2015-02-20,"Executive Seesion: 3/3/2015 1:00 PM Legislative Office Building 302 "
671342,2015-03-05,"Committee Report: Inexpedient to Legislate for Mar 11 (Vote 20-0; Consent Calendar); House Calendar19, PG. 390 "
671342,2015-03-11,"Inexpedient to Legislate: Motion Adopted Voice Vote; House Journal  24, PG. 767 "
671349,2015-01-08,"Introduced and Referred to Resources, Recreation and Development; House Journal  12, PG. 210 "
671349,2015-01-14,"Public Hearing: 1/20/2015 11:00 Amendment Legislative Office Building 305 "
671349,2015-01-21,"==POSTPONED== Full Committee Work Session: 1/27/2015 11:30 Amendment Legislative Office Building 305 "
671349,2015-01-26,"==RESCHEDULED== Full Committee Work Session: 1/27/2015 11:30 Amendment Legislative Office Building 305 "
671349,2015-01-28,"Executive Session: 1/28/2015 Legislative Office Building 305 "
671349,2015-01-29,"Committee Report: Inexpedient to Legislate for Feb 4 (Vote 17-0; Consent Calendar); House Calendar10, PG. 151 "
671349,2015-02-04,"Inexpedient to Legislate: Motion Adopted Voice Vote; House Journal  14, PG. 275 "
671357,2015-01-08,"Introduced and Referred to Municipal and County Government; House Journal  12, PG. 209 "
671357,2015-01-14,"Public Hearing: 1/20/2015 1:00 PM Legislative Office Building 301 "
671357,2015-01-21,"Executive Session: 1/29/2015 Legislative Office Building 301 "
671357,2015-01-29,"==RESCHEDULED== Public Hearing: 2/3/2015 1:45 PM Legislative Office Building 301 "
671357,2015-01-29,"===CANCELLED=== Public Hearing: 2/3/2015 1:45 PM Legislative Office Building 301 "
671357,2015-02-05,"Committee Report: Inexpedient to Legislate for Feb 11 (Vote 16-2; Consent Calendar); House Calendar11, PG. 175 "
671357,2015-02-11,"Removed from Consent Calendar (Rep Porter); House Journal  16, PG. 298 "
671357,2015-02-11,"Inexpedient to Legislate: Motion Adopted Voice Vote; House Journal  16, PG. 330-331 "
671364,2015-01-08,"Introduced and Referred to Commerce and Consumer Affairs; House Journal  12, PG. 210 "
671364,2015-01-14,"Public Hearing: 1/21/2015 10:00 Amendment Legislative Office Building 302 "
671364,2015-02-04,"Subcommittee Work Session: 2/12/2015 3:00 PM Legislative Office Building 302 "
671364,2015-02-04,"===CANCELLED=== Work Session: 2/12/2015 3:00 PM Legislative Office Building 302 "
671364,2015-02-05,"Executive Session: 2/4/2015 1:00 PM Legislative Office Building 302 ==RECESSED== "
671364,2015-02-26,"Continued Executive Session: 3/3/2015 1:00 PM Legislative Office Building 206 "
671364,2015-03-05,"Majority Committee Report: Ought to Pass with Amendment #2015-0049h for Mar 11 (Vote 15-5; Regular Calendar); House Calendar19, PG. 413-414 "
671364,2015-03-05,"Minority Committee Report: Inexpedient to Legislate "
671364,2015-03-11,"Amendment #0049h: Amendment Adopted Voice Vote; House Journal  24, PG. 834 "
671364,2015-03-11,"Ought to Pass with Amendment #0049h: Motion Adopted DV 245-119; House Journal  24, PG. 834 "
671364,2015-03-19,"Introduced and Referred to Commerce; Senate Journal 10 "
671364,2015-04-08,"Hearing: 4/14/15, Room 100, State House, 1:00 p.m.; Senate Calendar 17 "
671364,2015-04-16,"=== CANCELLED SESSION === Committee Report: Ought to Pass, 4/23/15; Vote 5-0; Consent Calendar; Senate Calendar 18 "
671364,2015-04-17,"=== RESCHEDULED === Committee Report: Ought to Pass, 4/30/15; Vote 5-0; Consent Calendar; Senate Calendar 19 "
671364,2015-04-30,"Ought to Pass: Motion Adopted, Voice Vote; OT3rdg; Senate Journal 12 "
671364,2015-05-14,"Enrolled Bill Amendment #1592e Adopted, Voice Vote, (In recess of 5/14/2015); Senate Journal 15 "
671364,2015-05-19,"Enrolled Bill Amendment #2015-1592EBA: Amendment Adopted Voice Vote (in recess of 5/6/2015); House Journal  41, PG. 1780 "
671364,2015-05-21,"Enrolled (In recess 5/21/2015); Senate Journal 16 "
671364,2015-05-21,"Enrolled (in recess of 5/6/2015); House Journal  41, PG. 1782 "
671364,2015-06-16,"Signed by the Governor on 6/12/2015; Chapter 131; Effective Date 1/1/2016 "
671370,2015-01-08,"Introduced and Referred to Science, Technology and Energy; House Journal  12, PG. 209 "
671370,2015-01-14,"==POSTPONED== Public Hearing: 1/27/2015 10:00 Amendment Legislative Office Building 304 "
671370,2015-01-22,"==POSTPONED== Public Hearing: 1/27/2015 10:00 Amendment Representatives Hall "
671370,2015-01-26,"==RESCHEDULED== Public Hearing: 1/28/2015 10:00 Amendment Representatives Hall "
671370,2015-02-11,"Executive Session: 2/17/2015 1:15 PM Legislative Office Building 304 "
671370,2015-02-17,"Retained in Committee "
671370,2015-05-26,"==CANCELED==Retained Bill - Full Committee Work Session: 5/2/2015 1:00 PM Legislative Office Building 304 "
671370,2015-05-26,"==RESCHEDULED==Retained Bill - Full Committee Work Session: 6/2/2015 1:00 PM Legislative Office Building 304 "
671370,2015-06-16,"Retained Bill - Full Committee Work Session: 6/30/2015 10:00 Amendment Legislative Office Building 304 "
671370,2015-06-24,"Executive Session: 6/30/2015 11:00 Amendment Legislative Office Building 304 "
671370,2015-07-08,"Committee Report: Inexpedient to Legislate for Jan 6 (Vote 20-0; Consent Calendar); House Calendar 67, PG. 10 "
671421,2015-01-08,"Introduced and Referred to Education; House Journal  12, PG. 209 "
671421,2015-01-21,"Public Hearing: 2/3/2015 10:00 Amendment Legislative Office Building 207 "
671421,2015-01-29,"===CANCELLED=== Public Hearing: 2/3/2015 10:00 Amendment Legislative Office Building 207 "
671421,2015-01-29,"Public Hearing: 2/12/2015 1:00 PM Legislative Office Building 207 "
671421,2015-02-04,"===CANCELLED=== Public Hearing: 2/12/2015 1:00 PM Legislative Office Building 207 "
671421,2015-02-04,"Public Hearing: 2/12/2015 10:00 Amendment Legislative Office Building 207 "
671421,2015-02-11,"Executive Session: 2/17/2015 10:00 Amendment Legislative Office Building 207 "
671421,2015-02-20,"Committee Report: Ought to Pass with Amendment #2015-0424h for Mar 4 (Vote 16-4; Regular Calendar); House Calendar18, PG. 356 "
671421,2015-03-04,"Amendment #0424h: Amendment Adopted Voice Vote; House Journal  22, PG. 578 "
671421,2015-03-04,"Floor Amendment #0597h (Rep Hill): Amendment Failed Voice Vote; House Journal  22, PG. 578 "
671421,2015-03-04,"Reconsider Floor Amendment #0597h (Rep W. O'Brien): Motion Adopted DV 196-165; House Journal  22, PG. 578 "
671421,2015-03-04,"Floor Amendment #0597h: Amendment Failed DV 112-249; House Journal  22, PG. 579 "
671421,2015-03-04,"Ought to Pass with Amendment #0424h: Motion Adopted Voice Vote; House Journal  22, PG. 578-579 "
671421,2015-03-05,"Introduced and Referred to Education; Senate Journal 8  "
671421,2015-03-19,"Hearing: 3/24/15, Room 103, Legislative Office Building, 9:20 a.m.; Senate Calendar 14 "
671421,2015-04-16,"=== CANCELLED SESSION === Committee Report: Ought to Pass with Amendment 1357s, 4/23/15; Senate Calendar 18 "
671421,2015-04-17,"=== RESCHEDULED === Committee Report: Ought to Pass with Amendment #2015-1357s, 4/30/15; Senate Calendar 19 "
671421,2015-04-30,"Committee Amendment 1357s, Amendment Adopted, Voice Vote "
671421,2015-04-30,"Sen. Bradley Floor Amendment #2015-1504s, New Title, Amendment Adopted, Voice Vote; Senate Journal 12 "
671421,2015-04-30,"Sen. Watters Floor Amendment #2015-1511s, New Title, Amendment Adopted, Voice Vote; Senate Journal 12 "
671421,2015-04-30,"Ought to Pass with Amendment 1357s, 1504s, New Title, and 1511s, New Title, Motion Adopted, Voice Vote; OT3rdg; Senate Journal 12 "
671421,2015-06-05,"House Non-Concurs and Requests Committee of Conference (Rep Hinch): Motion Adopted Voice Vote (in recess of 6/3/2015); House Journal  44, PG. 1950 "
671421,2015-06-05,"Speaker Appoints: Reps Balcom, Adams, V. Sullivan, K. Rogers (in recess of 6/3/2015); House Journal  44, PG. 1950 "
671421,2015-06-11,"Sen. Reagan accedes to House Request for Committee of Conference, Motion Adopted, Voice Vote; Senate Journal 18 "
671421,2015-06-11,"President Appoints: Senators Reagan, Avard and Watters "
671421,2015-06-11,"Conference Committee Meeting: 6/15/2015 11:30 Amendment Legislative Office Building 207 "
671421,2015-06-18,"Conference Committee Report #2015-2185c; Senate Amendment + New Amendment, Filed "
671421,2015-06-24,"Conference Committee Report 2185c; Adopted, Voice Vote; Senate Journal 19 "
671421,2015-06-24,"Conference Committee Report 2185c: Adopted, Voice Vote; House Journal  54, PG. 2122 "
671421,2015-07-01,"Enrolled Bill Amendment #2355e, New Title, Adopted, Voice Vote, (In recess of 6/24/2015); Senate Journal 19 "
671421,2015-07-01,"Enrolled Bill Amendment #2015-2355EBA (NT): Amendment Adopted Voice Vote (In recess of 6/24/2015); House Journal  54, PG. 2140 "
671421,2015-07-09,"Enrolled (In recess 6/24/2015); Senate Journal 19 "
671421,2015-07-09,"Enrolled (in recess of 6/24/2015); House Journal  54, PG. 2142 "
671421,2015-07-23,"Law Without Signature on 7/21/2015; Chapter 270; Section 2 Effective 9/1/2015, Remaining Effective 9/19/2015; NH Constitution, Article 44, Part II "
671506,2015-01-08,"Introduced and Referred to State-Federal Relations and Veterans Affairs; House Journal  12, PG. 209 "
671506,2015-01-14,"Public Hearing: 1/22/2015 11:00 Amendment Legislative Office Building 203 "
671506,2015-01-28,"Executive Session: 2/5/2015 1:00 PM Legislative Office Building 303 "
671506,2015-02-05,"Executive Session: 2/12/2015 2:30 PM Legislative Office Building 303 "
671506,2015-02-23,"Committee Report: Ought to Pass with Amendment #2015-0378h for Mar 4 (Vote 12-2; Consent Calendar); House Calendar18, PG. 352 "
671506,2015-03-04,"Removed from Consent Calendar (Rep Horrigan); House Journal  22, PG. 559 "
671506,2015-03-04,"Amendment #0378h: Amendment Adopted DV 245-62; House Journal  22, PG. 622-624 "
671506,2015-03-04,"Ought to Pass with Amendment #0378h: Motion Adopted DV 233-76; House Journal  22, PG. 622-624 "
671506,2015-03-12,"Introduced and Referred to Rules, Enrolled Bills and Internal Affairs; Senate Journal 9  "
671506,2015-03-18,"Hearing: 3/24/15, Room 100, State House, 2:30 p.m.; Senate Calendar 14 "
671506,2015-04-16,"=== CANCELLED SESSION === Committee Report: Ought to Pass, 4/23/15; Senate Calendar 18 "
671506,2015-04-17,"=== RESCHEDULED === Committee Report: Ought to Pass, 4/30/15; Senate Calendar 19 "
671506,2015-04-30,"Ought to Pass: Motion Adopted, Voice Vote; OT3rdg; Senate Journal 12 "
671506,2015-05-13,"Enrolled (In recess 5/7/2015); Senate Journal 14 "
671506,2015-05-13,"Enrolled (in recess of 5/6/2015); House Journal  41, PG. 1779 "
671506,2015-06-03,"Vetoed by the Governor on 6/2/2015; House Journal  46, PG. 1983 "
671506,2015-06-11,"Veto Sustained: Regular Calendar 197-140 Lacking Required Two-Thirds Vote; House Journal  46, PG. 1983-1985 "
671617,2015-01-08,"Introduced and Referred to Executive Departments and Administration; House Journal  12, PG. 211 "
671617,2015-01-21,"==POSTPONED== Public Hearing: 1/27/2015 2:15 PM Legislative Office Building 306 "
671617,2015-01-26,"==RESCHEDULED== Public Hearing: 1/28/2015 2:15 PM Legislative Office Building 306 "
671617,2015-01-29,"Executive Session: 2/3/2015 2:30 PM Legislative Office Building 306 "
671617,2015-02-05,"Committee Report: Inexpedient to Legislate for Feb 11 (Vote 15-0; Consent Calendar); House Calendar11, PG. 172 "
671617,2015-02-11,"Inexpedient to Legislate: Motion Adopted Voice Vote; House Journal  16, PG. 299 "
671631,2015-01-08,"Introduced and Referred to Health, Human Services and Elderly Affairs; House Journal  12, PG. 211 "
671631,2015-01-14,"Public Hearing: 1/20/2015 10:00 Amendment Legislative Office Building 205 "
671631,2015-01-20,"==POSTPONED== Subcommittee Work Session: 1/27/2015 9:15 Amendment Legislative Office Building 205 "
671631,2015-01-26,"==RESCHEDULED== Subcommittee Work Session: 1/28/2015 9:15 Amendment Legislative Office Building 205 "
671631,2015-02-10,"Executive Session: 2/5/2015 3:30 PM Legislative Office Building 205 "
671631,2015-02-13,"Committee Report: Inexpedient to Legislate for Feb 18 (Vote 15-0; Consent Calendar); House Calendar13, PG. 240 "
671631,2015-02-18,"Inexpedient to Legislate: Motion Adopted Voice Vote; House Journal  20, PG. 501 "
671648,2015-01-08,"Introduced and Referred to Health, Human Services and Elderly Affairs; House Journal  12, PG. 211 "
671648,2015-01-14,"Public Hearing: 1/20/2015 10:45 Amendment Legislative Office Building 205 "
671648,2015-01-28,"Executive Session: 2/3/2015 10:00 Amendment Legislative Office Building 205 "
671648,2015-02-05,"Committee Report: Ought to Pass with Amendment #2015-0164h (NT) for Feb 11 (Vote 17-0; Consent Calendar); House Calendar11, PG. 174 "
671648,2015-02-11,"Adopt Amendment #0164h: Amendment Adopted Voice Vote; House Journal  16, PG. 302-303 "
671648,2015-02-11,"Ought to Pass with Amendment #0164h: Motion Adopted Voice Vote; House Journal  16, PG. 302 "
671648,2015-03-12,"Introduced and Referred to Health and Human Services; Senate Journal 9  "
671648,2015-03-19,"Hearing: 3/24/15, Room 101, Legislative Office Building, 1:20 p.m.; Senate Calendar 14 "
671648,2015-04-15,"=== CANCELLED SESSION === Committee Report: Ought to Pass with Amendment 1337s, 4/23/15; Vote 5-0; Consent Calendar; Senate Calendar 18 "
671648,2015-04-17,"=== RESCHEDULED === Committee Report: Ought to Pass with Amendment #2015-1337s, 4/30/15; Vote 5-0; Consent Calendar; Senate Calendar 19 "
671648,2015-04-30,"Committee Amendment 1337s, Amendment Adopted, Voice Vote "
671648,2015-04-30,"Ought to Pass with Amendment 1337s, Motion Adopted, Voice Vote; OT3rdg; Senate Journal 12 "
671648,2015-06-03,"House Concurs with Senate Amendment #1337s (Rep Kotowski): Motion Adopted Voice Vote; House Journal  44, PG. 1813 "
671648,2015-06-17,"Enrolled Bill Amendment #2103e Adopted, Voice Vote, (In recess of 6/11/2015); Senate Journal 19 "
671648,2015-06-17,"Enrolled Bill Amendment #2015-2103EBA: Amendment Adopted Voice Vote (in recess of 6/11/2015); House Journal  46, PG. 1991-1992 "
671648,2015-06-24,"Enrolled (In recess 6/24/2015); Senate Journal 19 "
671648,2015-06-24,"Enrolled; House Journal  54, PG. 2135 "
671648,2015-07-07,"Signed by the Governor on 7/6/2015; Chapter 190; Section 3 Effective 11/2/2015, Remaining Effective 7/6/2015 "
671663,2015-01-08,"Introduced and Referred to Commerce and Consumer Affairs; House Journal  12, PG. 211 "
671663,2015-01-14,"Public Hearing: 1/20/2015 11:00 Amendment Legislative Office Building 302 "
671663,2015-02-03,"Subcommittee Work Session: 2/12/2015 8:30 Amendment Legislative Office Building 302 "
671663,2015-02-20,"Executive Seesion: 3/3/2015 1:00 PM Legislative Office Building 302 "
671663,2015-03-05,"Committee Report: Ought to Pass with Amendment #2015-0111h for Mar 11 (Vote 20-0; Consent Calendar); House Calendar19, PG. 391 "
671663,2015-03-11,"Amendment #0111h: Amendment Adopted Voice Vote; House Journal  24, PG. 769-770 "
671663,2015-03-11,"Ought to Pass with Amendment #0111h: Motion Adopted Voice Vote; House Journal  24, PG. 769-770 "
671663,2015-03-19,"Introduced and Referred to Commerce; Senate Journal 10 "
671663,2015-04-08,"Hearing: 4/16/15, Room 101, Legislative Office Building, 10:30 a.m.; Senate Calendar 17 "
671663,2015-04-23,"Committee Report: Ought to Pass, 4/30/15; Vote 5-0; Consent Calendar; Senate Calendar 19 "
671663,2015-04-30,"Ought to Pass: Motion Adopted, Voice Vote; OT3rdg; Senate Journal 12 "
671663,2015-05-13,"Enrolled (In recess 5/7/2015); Senate Journal 14 "
671663,2015-05-13,"Enrolled (in recess of 5/6/2015); House Journal  41, PG. 1779 "
671663,2015-06-03,"Signed by the Governor on 6/2/2015; Chapter 62; Effective Date 8/31/2015 "
671682,2015-01-08,"Introduced and Referred to Commerce and Consumer Affairs; House Journal  12, PG. 210 "
671682,2015-01-14,"Public Hearing: 1/22/2015 10:00 Amendment Legislative Office Building 302 "
671682,2015-01-29,"Subcommittee Work Session: 2/5/2015 8:30 Amendment Legislative Office Building 302 "
671682,2015-02-12,"Subcommittee Work Session: 2/17/2015 3:00 PM Legislative Office Building 302 "
671682,2015-02-20,"Executive Seesion: 3/3/2015 1:00 PM Legislative Office Building 302 "
671682,2015-03-05,"Committee Report: Ought to Pass with Amendment #2015-0098h (NT) for Mar 11 (Vote 20-0; Consent Calendar); House Calendar19, PG. 391 "
671682,2015-03-11,"Amendment #0098h: Amendment Adopted Voice Vote; House Journal  24, PG. 768-769 "
671682,2015-03-11,"Ought to Pass with Amendment #0098h: Motion Adopted Voice Vote; House Journal  24, PG. 768-769 "
671682,2015-03-19,"Introduced and Referred to Commerce; Senate Journal 10 "
671682,2015-03-26,"Hearing: 3/31/15, Room 100, State House, 1:45 p.m.; Senate Calendar 15 "
671682,2015-04-02,"Committee Report: Ought to Pass, 4/9/15; Vote 5-0; Consent Calendar; Senate Calendar 16 "
671682,2015-04-09,"Ought to Pass: Motion Adopted, Voice Vote; OT3rdg; Senate Journal 11 "
671682,2015-04-21,"Enrolled (In recess 4/9/2015); Senate Journal 12 "
671682,2015-04-22,"Enrolled (in recess of 4/15/2015); House Journal  34, PG. 1564 "
671682,2015-05-07,"Signed by the Governor on 5/5/2015; Chapter 09; Effective Date 7/1/2015 "
671697,2015-01-08,"Introduced and Referred to Finance; House Journal  12, PG. 210 "
671697,2015-01-21,"==POSTPONED==Public Hearing: 1/27/2015 1:00 PM Legislative Office Building 210-211 "
671697,2015-01-26,"==RESCHEDULED== Public Hearing: 1/29/2015 9:30 Amendment Legislative Office Building 210-211 "
671697,2015-01-28,"Division I Work Session: 2/3/2015 9:30 Amendment Legislative Office Building 212 "
671697,2015-01-28,"Executive Session: 2/5/2015 10:00 Amendment Legislative Office Building 210-211 "
671697,2015-02-05,"Committee Report: Inexpedient to Legislate for Feb 11 (Vote 13-9; Regular Calendar); House Calendar11, PG. 180 "
671697,2015-02-11,"Inexpedient to Legislate: Motion Adopted Regular Calendar 221-127; House Journal  16, PG. 309-311 "
671714,2015-01-08,"Introduced and Referred to Municipal and County Government; House Journal  12, PG. 211 "
671714,2015-01-21,"==POSTPONED== Public Hearing: 1/27/2015 10:20 Amendment Legislative Office Building 301 "
671714,2015-01-26,"==RESCHEDULED== Public Hearing: 1/28/2015 10:20 Amendment Legislative Office Building 301 "
671714,2015-02-05,"Executive Session: 2/12/2015 12:00 PM Legislative Office Building 301 "
671714,2015-02-20,"Committee Report: Ought to Pass with Amendment #2015-0363h for Mar 4 (Vote 18-0; Consent Calendar); House Calendar18, PG. 348 "
671714,2015-03-04,"Amendment #0363h: Amendment Adopted Voice Vote; House Journal  22, PG. 563 "
671714,2015-03-04,"Ought to Pass with Amendment #0363h: Motion Adopted Voice Vote; House Journal  22, PG. 563 "
671714,2015-03-05,"Introduced and Referred to Ways & Means; Senate Journal 8  "
671714,2015-03-18,"Hearing: 3/24/15, Room 103, State House, 9:30 a.m.; Senate Calendar 14 "
671714,2015-04-14,"=== CANCELLED SESSION === Committee Report: Ought to Pass, 4/23/15; Senate Calendar 18 "
671714,2015-04-17,"=== RESCHEDULED === Committee Report: Ought to Pass, 4/30/15; Senate Calendar 19 "
671714,2015-04-30,"Ought to Pass: Motion Adopted, Voice Vote; OT3rdg; Senate Journal 12 "
671714,2015-05-13,"Enrolled (In recess 5/7/2015); Senate Journal 14 "
671714,2015-05-13,"Enrolled (in recess of 5/6/2015); House Journal  41, PG. 1779 "
671714,2015-06-11,"Signed by the Governor on 6/5/2015; Chapter 83; Effective Date 8/4/2015 "
671731,2015-01-08,"Introduced and Referred to Ways and Means; House Journal  12, PG. 210 "
671731,2015-01-21,"Public Hearing: 2/3/2015 1:00 PM Legislative Office Building 202 "
671731,2015-01-29,"==RESCHEDULED== Public Hearing: 2/9/2015 1:00 PM Legislative Office Building 202=RECESSED= "
671731,2015-02-09,"Continued Public Hearing: 2/17/2015 10:00 Amendment Legislative Office Building 202 "
671731,2015-02-25,"Executive Session: 3/3/2015 10:00 Amendment Legislative Office Building 202 "
671731,2015-03-05,"Committee Report: Ought to Pass with Amendment #2015-0113h (NT) for Mar 11 (Vote 21-0; Consent Calendar); House Calendar19, PG. 407 "
671731,2015-03-11,"Amendment #0113h: Amendment Adopted Voice Vote; House Journal  24, PG. 801 "
671731,2015-03-11,"Ought to Pass with Amendment #0113h: Motion Adopted Voice Vote; House Journal  24, PG. 801 "
671731,2015-03-19,"Introduced and Referred to Ways and Means; Senate Journal 10 "
671731,2015-04-01,"Hearing: 4/7/15, Room 103, State House, 9:30 a.m.; Senate Calendar 16 "
671731,2015-05-05,"Committee Report: Ought to Pass with Amendment #2015-1326s, New Title, 5/14/15; Senate Calendar 21 "
671731,2015-05-14,"Special Order HB 180 to 5/21/15, Without Objection, Motion Adopted; Senate Journal 14 "
671731,2015-05-14,"Committee Report: Ought to Pass with Amendment #2015-1326s, New Title, 5/21/15; Senate Calendar 22 "
671731,2015-05-21,"Committee Amendment 1326s, New Title, Amendment Failed, Voice Vote "
671731,2015-05-21,"Ought to Pass: Motion Adopted, Voice Vote; OT3rdg; Senate Journal 15 "
671731,2015-06-03,"Enrolled (In recess 5/28/2015); Senate Journal 17 "
671731,2015-06-03,"Enrolled "
671731,2015-06-16,"Signed by the Governor on 6/12/2015; Chapter 133; Effective Date 7/1/2015 "
671746,2015-01-08,"Introduced and Referred to Judiciary; House Journal  12, PG. 211 "
671746,2015-01-14,"Public Hearing: 1/22/2015 10:00 Amendment Legislative Office Building 208 "
671746,2015-02-04,"Executive Session: 2/4/2015 1:30 PM Legislative Office Building 208 "
671746,2015-02-05,"Majority Committee Report: Inexpedient to Legislate for Feb 11 (Vote 10-4; Regular Calendar); House Calendar11, PG. 180-181 "
671746,2015-02-05,"Minority Committee Report: Ought to Pass "
671746,2015-02-11,"Inexpedient to Legislate: Motion Adopted Regular Calendar 246-104; House Journal  16, PG. 311-313 "
671766,2015-01-08,"Introduced and Referred to Election Law; House Journal  12, PG. 211 "
671766,2015-01-14,"Public Hearing: 1/20/2015 10:30 Amendment Legislative Office Building 308 "
671766,2015-01-21,"==POSTPONED== Executive Session: 1/27/2015 2:30 PM Legislative Office Building 308 "
671766,2015-01-26,"==RESCHEDULED== Executive Session: 1/28/2015 2:30 PM Legislative Office Building 308=RECESSED= "
671766,2015-01-29,"Subcommittee Work Session: 2/5/2015 1:00 PM Legislative Office Building 308 "
671766,2015-02-11,"Executive Session: 2/12/2015 10:00 Amendment Legislative Office Building 308 "
671766,2015-02-20,"Majority Committee Report: Inexpedient to Legislate for Mar 4 (Vote 16-2; Regular Calendar); House Calendar18, PG. 357 "
671766,2015-02-20,"Minority Committee Report: Ought to Pass "
671766,2015-03-04,"Inexpedient to Legislate: Motion Adopted DV 335-28; House Journal  22, PG. 582 "
671781,2015-01-08,"Introduced and Referred to Election Law; House Journal  12, PG. 210 "
671781,2015-01-14,"Public Hearing: 1/20/2015 1:45 PM Legislative Office Building 308 "
671781,2015-01-21,"Subcommittee Work Session: 1/29/2015 10:00 Amendment Legislative Office Building 308 "
671781,2015-01-30,"Executive Session: 2/4/2015 2:00 PM Legislative Office Building 308 "
671781,2015-02-10,"Committee Report: Inexpedient to Legislate for Feb 18 (Vote 18-0; Consent Calendar); House Calendar13, PG. 238 "
671781,2015-02-18,"Inexpedient to Legislate: Motion Adopted Voice Vote; House Journal  20, PG. 497 "
671795,2015-01-08,"Introduced and Referred to Transportation; House Journal  12, PG. 210 "
671795,2015-01-14,"Public Hearing: 1/20/2015 2:00 PM Legislative Office Building 203 "
671795,2015-01-29,"Executive Session: 2/3/2015 1:30 PM Legislative Office Building 203 "
671795,2015-02-05,"Committee Report: Ought to Pass for Feb 11 (Vote 18-0; Consent Calendar); House Calendar11, PG. 178 "
671795,2015-02-11,"Ought to Pass: Motion Adopted Voice Vote; House Journal  16, PG. 306 "
671795,2015-03-12,"Introduced and Referred to Transportation; Senate Journal 9  "
671795,2015-04-07,"Hearing: 4/14/15, Room 103, Legislative Office Building, 1:15 p.m.; Senate Calendar 17 "
671795,2015-04-22,"Committee Report: Ought to Pass, 4/30/15; Vote 5-0; Consent Calendar; Senate Calendar 19 "
671795,2015-04-30,"Ought to Pass: Motion Adopted, Voice Vote; OT3rdg; Senate Journal 12 "
671795,2015-05-13,"Enrolled (In recess 5/7/2015); Senate Journal 14 "
671795,2015-05-13,"Enrolled (in recess of 5/6/2015); House Journal  41, PG. 1779 "
671795,2015-06-03,"Signed by the Governor on 6/2/2015; Chapter 61; Effective Date 1/1/2016 "
671812,2015-01-08,"Introduced and Referred to Municipal and County Government; House Journal  12, PG. 211 "
671812,2015-01-21,"==POSTPONED== Public Hearing: 1/27/2015 10:40 Amendment Legislative Office Building 301 "
671812,2015-01-26,"==RESCHEDULED== Public Hearing: 1/28/2015 10:40 Amendment Legislative Office Building 301 "
671812,2015-02-04,"Executive Session: 2/4/2015 12:00 PM Legislative Office Building 301 "
671812,2015-02-05,"Committee Report: Inexpedient to Legislate for Feb 11 (Vote 15-0; Consent Calendar); House Calendar11, PG. 176 "
671812,2015-02-11,"Inexpedient to Legislate: Motion Adopted Voice Vote; House Journal  16, PG. 304 "
671829,2015-01-08,"Introduced and Referred to Commerce and Consumer Affairs; House Journal  12, PG. 211 "
671829,2015-01-14,"Public Hearing: 1/20/2015 10:30 Amendment Legislative Office Building 302 "
671829,2015-02-12,"Subcommittee Work Session: 2/19/2015 8:00 PM Legislative Office Building 302 "
671829,2015-02-12,"==RESCHEDULED== Work Session: 2/19/2015 8:00 Amendment Legislative Office Building 302 "
671829,2015-02-18,"==RESCHEDULED== Work Session: 2/19/2015 8:30 Amendment Legislative Office Building 302 "
671829,2015-02-20,"Executive Seesion: 3/3/2015 1:00 PM Legislative Office Building 302 "
671829,2015-03-05,"Committee Report: Ought to Pass for Mar 11 (Vote 20-0; Consent Calendar); House Calendar19, PG. 391 "
671829,2015-03-11,"Ought to Pass: Motion Adopted Voice Vote; House Journal  24, PG. 770 "
671829,2015-03-19,"Introduced and Referred to Health and Human Services; Senate Journal 10 "
671829,2015-03-26,"Hearing: 3/31/15, Room 101, Legislative Office Building, 1:20 p.m.; Senate Calendar 15 "
671829,2015-04-15,"=== CANCELLED SESSION === Committee Report: Rereferred to Committee, 4/23/15; Senate Calendar 18 "
671829,2015-04-17,"=== RESCHEDULED === Committee Report: Rereferred to Committee, 4/30/15; Senate Calendar 19 "
671829,2015-04-30,"Rereferred to Committee, Motion Adopted, Voice Vote, Senate Journal 12 "
671848,2015-01-08,"Introduced and Referred to Municipal and County Government; House Journal  12, PG. 211 "
671848,2015-01-21,"==POSTPONED== Public Hearing: 1/27/2015 1:20 PM Legislative Office Building 301 "
671848,2015-01-26,"==RESCHEDULED== Public Hearing: 1/28/2015 1:20 PM Legislative Office Building 301 "
671848,2015-01-28,"==CANCELED== Executive Session: 2/5/2015 1:30 PM Legislative Office Building 301 "
671848,2015-01-29,"Executive Session: 2/3/2015 2:15 PM Legislative Office Building 301 "
671848,2015-02-10,"Majority Committee Report: Inexpedient to Legislate for Feb 18 (Vote 10-8; Regular Calendar); House Calendar13, PG. 248 "
671848,2015-02-10,"Minority Committee Report: Ought to Pass "
671848,2015-02-18,"Inexpedient to Legislate: Motion Adopted DV 191-168; House Journal  20, PG. 520 "
671863,2015-01-08,"Introduced and Referred to Municipal and County Government; House Journal  12, PG. 211 "
671863,2015-01-21,"==POSTPONED== Public Hearing: 1/27/2015 10:00 Amendment Legislative Office Building 301 "
671863,2015-01-26,"==RESCHEDULED== Public Hearing: 1/28/2015 10:00 Amendment Legislative Office Building 301 "
671863,2015-02-05,"Executive Session: 2/12/2015 12:00 PM Legislative Office Building 301 "
671863,2015-02-20,"Majority Committee Report: Ought to Pass for Mar 4 (Vote 11-4; Regular Calendar); House Calendar18, PG. 361 "
671863,2015-02-20,"Minority Committee Report: Inexpedient to Legislate "
671863,2015-03-04,"Ought to Pass: Motion Adopted Voice Vote; House Journal  22, PG. 599 "
671863,2015-03-05,"Introduced and Referred to Ways & Means; Senate Journal 8  "
671863,2015-03-18,"Hearing: 3/24/15, Room 103, State House, 9:15 a.m.; Senate Calendar 14 "
671863,2015-04-21,"Committee Report: Rereferred to Committee, 4/30/15; Senate Calendar 19 "
671863,2015-04-30,"Rereferred to Committee, Motion Adopted, Voice Vote, Senate Journal 12 "
671878,2015-01-08,"Introduced and Referred to Judiciary; House Journal  12, PG. 211 "
671878,2015-01-14,"Public Hearing: 1/20/2015 10:00 Amendment Legislative Office Building 208 "
671878,2015-01-29,"Executive Session: 1/22/2015 Legislative Office Building 208 "
671878,2015-01-29,"Committee Report: Inexpedient to Legislate for Feb 4 (Vote 15-2; Consent Calendar); House Calendar10, PG. 151 "
671878,2015-02-04,"Removed from Consent Calendar (Rep. Cali-Pitts); House Journal  14, PG. 174 "
671878,2015-02-04,"Inexpedient to Legislate: Motion Adopted Regular Calendar 302-52; House Journal  14, PG. 276-278 "
671895,2015-01-08,"Introduced and Referred to Municipal and County Government; House Journal  12, PG. 211 "
671895,2015-01-14,"Public Hearing: 1/20/2015 11:20 Amendment Legislative Office Building 301 "
671895,2015-01-21,"==POSTPONED== Public Hearing: 1/27/2015 1:45 PM Legislative Office Building 301 "
671895,2015-01-26,"==RESCHEDULED== Public Hearing: 1/28/2015 1:45 PM Legislative Office Building 301 "
671895,2015-02-05,"Executive Session: 2/12/2015 2:30 PM Legislative Office Building 301 "
671895,2015-02-20,"Committee Report: Ought to Pass for Mar 4 (Vote 10-5; Regular Calendar); House Calendar18, PG. 360 "
671895,2015-03-04,"Lay on Table (Rep J. Belanger): Motion Adopted Voice Vote; House Journal  22, PG. 599 "
671910,2015-01-08,"Introduced and Referred to Election Law; House Journal  12, PG. 211 "
671910,2015-01-14,"Public Hearing: 1/20/2015 10:15 Amendment Legislative Office Building 308 "
671910,2015-01-21,"==POSTPONED== Executive Session: 1/27/2015 2:30 PM Legislative Office Building 308 "
671910,2015-01-26,"==RESCHEDULED== Executive Session: 1/28/2015 2:30 PM Legislative Office Building 308 "
671910,2015-02-19,"Retained in Committee "
671910,2015-08-10,"Retained Bill - Subcommittee Work Session: 9/10/2015 9:00 Amendment Legislative Office Building 308 "
671910,2015-10-13,"Retained Bill - Subcommittee Work Session: 10/20/2015 11:30 Amendment Legislative Office Building 308 "
671910,2015-10-14,"Executive Session: 10/20/2015 1:00 PM Legislative Office Building 308 "
671910,2015-11-12,"Majority Committee Report: Ought to Pass for Jan 6 (Vote 13-6; Regular Calendar); House Calendar 67, PG. 19 "
671910,2015-11-17,"Minority Committee Report: Inexpedient to Legislate "
671924,2015-01-08,"Introduced and Referred to Ways and Means; House Journal  12, PG. 211 "
671924,2015-01-21,"Public Hearing: 2/3/2015 11:00 Amendment Legislative Office Building 202 "
671924,2015-01-29,"==RESCHEDULED== Public Hearing: 2/9/2015 11:00 Amendment Legislative Office Building 202=RECESSED= "
671924,2015-02-09,"Continued Public Hearing: 2/13/2015 11:00 Amendment Legislative Office Building 202 "
671924,2015-02-17,"Executive Session: 2/17/2015 Legislative Office Building 202 "
671924,2015-02-23,"Committee Report: Ought to Pass for Mar 4 (Vote 18-0; Consent Calendar); House Calendar18, PG. 353 "
671924,2015-03-04,"Ought to Pass: Motion Adopted Voice Vote; House Journal  22, PG. 569 "
671924,2015-03-05,"Introduced and Referred to Ways & Means; Senate Journal 8  "
671924,2015-04-08,"Hearing: 4/14/15, Room 103, State House, 9:15 a.m.; Senate Calendar 17 "
671924,2015-04-15,"=== CANCELLED SESSION === Committee Report: Ought to Pass with Amendment 1325s, 4/23/15; Senate Calendar 18 "
671924,2015-04-17,"=== RESCHEDULED === Committee Report: Ought to Pass with Amendment #2015-1325s, 4/30/15; Senate Calendar 19 "
671924,2015-04-30,"Committee Amendment 1325s, Amendment Adopted, Voice Vote "
671924,2015-04-30,"Ought to Pass with Amendment 1325s, Motion Adopted, Voice Vote; OT3rdg; Senate Journal 12 "
671924,2015-06-03,"House Concurs with Senate Amendment #1325s (Rep Major): Motion Adopted Voice Vote; House Journal  44, PG. 1814 "
671924,2015-06-18,"Enrolled (In recess 6/11/2015); Senate Journal 19 "
671924,2015-06-18,"Enrolled (in recess of 6/11/2015); House Journal  46, PG. 1993 "
671924,2015-06-30,"Signed by the Governor on 6/26/2015; Chapter 183; Effective Date 8/28/2015 "
672808,2015-01-08,"Introduced and Referred to Ways and Means; House Journal  12, PG. 212 "
672808,2015-01-21,"==POSTPONED== Public Hearing: 1/27/2015 11:30 Amendment Legislative Office Building 202 "
672808,2015-01-26,"==RESCHEDULED== Public Hearing: 1/28/2015 11:30 Amendment Legislative Office Building 202 "
672808,2015-02-17,"Executive Session: 2/17/2015 Legislative Office Building 202 "
672808,2015-02-20,"Majority Committee Report: Inexpedient to Legislate for Mar 4 (Vote 18-1; Regular Calendar); House Calendar18, PG. 355 "
672808,2015-02-20,"Minority Committee Report: Ought to Pass "
672808,2015-03-04,"Inexpedient to Legislate: Motion Adopted Regular Calendar 226-128; House Journal  22, PG. 570-572 "
672839,2015-01-08,"Introduced and Referred to Environment and Agriculture; House Journal  12, PG. 211 "
672839,2015-01-13,"Public Hearing: 1/20/2015 1:00 PM Legislative Office Building 303 "
672839,2015-01-21,"==POSTPONED==Subcommittee Work Session: 1/27/2015 1:00 PM Legislative Office Building 303 "
672839,2015-01-26,"==RESCHEDULED== Subcommittee Work Session: 1/28/2015 1:00 PM Legislative Office Building 303 "
672839,2015-02-11,"Executive Session: 3/2/2015 10:00 Amendment Legislative Office Building 303 "
672839,2015-03-05,"Committee Report: Ought to Pass with Amendment #2015-0606h (NT) for Mar 11 (Vote 17-1; Consent Calendar); House Calendar19, PG. 398 "
672839,2015-03-11,"Amendment #0606h: Amendment Adopted Voice Vote "
672839,2015-03-11,"Ought to Pass with Amendment #0606h: Motion Adopted Voice Vote "
672839,2015-03-19,"Introduced and Referred to Energy and Natural Resources; Senate Journal 10 "
672839,2015-04-08,"Hearing: 4/15/15, Room 100, State House, 9:00 a.m.; Senate Calendar 17 "
672839,2015-04-15,"=== CANCELLED SESSION === Committee Report: Ought to Pass, 4/23/15; Senate Calendar 18 "
672839,2015-04-17,"=== RESCHEDULED === Committee Report: Ought to Pass, 4/30/15; Senate Calendar 19 "
672839,2015-04-30,"Ought to Pass: Motion Adopted, Voice Vote; OT3rdg; Senate Journal 12 "
672839,2015-05-13,"Enrolled (In recess 5/7/2015); Senate Journal 14 "
672839,2015-05-13,"Enrolled (in recess of 5/6/2015); House Journal  41, PG. 1779 "
672839,2015-06-11,"Signed by the Governor on 6/5/2015; Chapter 84; Effective Date 8/4/2015 "
672872,2015-01-08,"Introduced and Referred to Resources, Recreation and Development; House Journal  12, PG. 211 "
672872,2015-01-21,"==POSTPONED== Public Hearing: 1/27/2015 10:30 Amendment Legislative Office Building 305 "
672872,2015-01-26,"==RESCHEDULED== Public Hearing: 1/28/2015 10:30 Amendment Legislative Office Building 305 "
672872,2015-02-04,"Executive Session: 2/4/2015 1:00 PM Legislative Office Building 305 "
672872,2015-02-05,"Committee Report: Ought to Pass for Feb 11 (Vote 19-0; Consent Calendar); House Calendar11, PG. 176 "
672872,2015-02-11,"Ought to Pass: Motion Adopted Voice Vote; House Journal  16, PG. 304 "
672872,2015-03-12,"Introduced and Referred to Energy and Natural Resources; Senate Journal 9  "
672872,2015-04-08,"Hearing: 4/15/15, Room 100, State House, 9:30 a.m.; Senate Calendar 17 "
672872,2015-04-15,"=== CANCELLED SESSION === Committee Report: Ought to Pass, 4/23/15; Senate Calendar 18 "
672872,2015-04-17,"=== RESCHEDULED === Committee Report: Ought to Pass, 4/30/15; Senate Calendar 19 "
672872,2015-04-30,"Ought to Pass: Motion Adopted, Voice Vote; OT3rdg; Senate Journal 12 "
672872,2015-05-13,"Enrolled (In recess 5/7/2015); Senate Journal 14 "
672872,2015-05-13,"Enrolled (in recess of 5/6/2015); House Journal  41, PG. 1779 "
672872,2015-06-11,"Signed by the Governor on 6/5/2015; Chapter 85; Effective Date 8/4/2015 "
672904,2015-01-08,"Introduced and Referred to Commerce and Consumer Affairs; House Journal  12, PG. 211 "
672904,2015-01-14,"Public Hearing: 1/22/2015 10:45 Amendment Legislative Office Building 302 "
672904,2015-01-29,"Subcommittee Work Session: 2/5/2015 8:30 Amendment Legislative Office Building 302 "
672904,2015-02-12,"Subcommittee Work Session: 2/17/2015 3:00 PM Legislative Office Building 302 "
672904,2015-02-20,"Executive Seesion: 3/3/2015 1:00 PM Legislative Office Building 302 "
672904,2015-03-03,"Retained in Committee "
672904,2015-09-29,"Retained Bill - Subcommittee Work Session: 10/6/2015 10:00 Amendment Legislative Office Building 302 "
672904,2015-09-29,"Executive Session: 10/27/2015 1:15 PM Legislative Office Building 302 "
672904,2015-10-07,"Retained Bill - Subcommittee Work Session: 10/13/2015 1:00 PM Legislative Office Building 302 "
672904,2015-10-14,"Retained Bill - Subcommittee Work Session: 10/20/2015 10:00 Amendment Legislative Office Building 302 "
672904,2015-11-12,"Committee Report: Ought to Pass with Amendment #2015-2457h for Jan 6 (Vote 15-5; Regular Calendar); House Calendar 67, PG. 13-14 "
672935,2015-01-08,"Introduced and Referred to Criminal Justice and Public Safety; House Journal  12, PG. 211 "
672935,2015-01-13,"Public Hearing: 1/20/2015 10:30 Amendment Legislative Office Building 204 "
672935,2015-02-25,"Executive Session: 3/2/2015 10:00 Amendment Legislative Office Building 204 "
672935,2015-03-04,"Committee Report: Ought to Pass with Amendment #2015-0607h for Mar 11 (Vote 15-0; Consent Calendar); House Calendar19, PG. 394 "
672935,2015-03-11,"Amendment #0607h: Amendment Adopted Voice Vote; House Journal  24, PG. 777 "
672935,2015-03-11,"Ought to Pass with Amendment #0607h: Motion Adopted Voice Vote; House Journal  24, PG. 777 "
672935,2015-03-19,"Introduced and Referred to Judiciary; Senate Journal 10 "
672935,2015-04-15,"Hearing: 4/21/15, Room 100, State House, 9:45 a.m.; Senate Calendar 18 "
672935,2015-05-06,"Committee Report: Ought to Pass, 5/14/15; Vote 5-0; Consent Calendar; Senate Calendar 21 "
672935,2015-05-14,"Ought to Pass: Motion Adopted, Voice Vote; OT3rdg; Senate Journal 14 "
672935,2015-06-03,"Enrolled (In recess 5/28/2015); Senate Journal 17 "
672935,2015-06-03,"Enrolled "
672935,2015-06-16,"Signed by the Governor on 6/12/2015; Chapter 134; Effective Date 1/1/2016 "
672967,2015-01-08,"Introduced and Referred to Judiciary; House Journal  12, PG. 212 "
672967,2015-01-14,"Public Hearing: 1/20/2015 1:30 PM Legislative Office Building 208 "
672967,2015-02-04,"Executive Session: 2/4/2015 12:45 PM Legislative Office Building 208=RECESSED= "
672967,2015-02-11,"Executive Session: 2/12/2015 10:00 Amendment Legislative Office Building 208 "
672967,2015-02-20,"Committee Report: Ought to Pass with Amendment #2015-0284h for Mar 4 (Vote 7-6; Regular Calendar); House Calendar18, PG. 359-360 "
672967,2015-03-04,"Amendment #0284h: Amendment Adopted Voice Vote; House Journal  22, PG. 595 "
672967,2015-03-04,"Ought to Pass with Amendment #0284h: Motion Adopted Voice Vote; House Journal  22, PG. 595 "
672967,2015-03-05,"Introduced and Referred to Judiciary; Senate Journal 8  "
672967,2015-04-07,"Hearing: 4/14/15, Room 100, State House, 10:00 a.m.; Senate Calendar 17 "
672967,2015-05-20,"Committee Report: Inexpedient to Legislate, 5/28/15; Senate Calendar 23 "
672967,2015-05-28,"Inexpedient to Legislate, Motion Adopted, Voice Vote === BILL KILLED ===; Senate Journal 16 "
672997,2015-01-08,"Introduced and Referred to Election Law; House Journal  12, PG. 212 "
672997,2015-01-14,"Public Hearing: 1/20/2015 2:00 PM Legislative Office Building 308 "
672997,2015-01-21,"Subcommittee Work Session: 1/29/2015 10:00 Amendment Legislative Office Building 308 "
672997,2015-02-11,"Executive Session: 2/12/2015 10:00 Amendment Legislative Office Building 308 "
672997,2015-02-20,"Committee Report: Inexpedient to Legislate for Mar 4 (Vote 18-0; Consent Calendar); House Calendar18, PG. 345 "
672997,2015-03-04,"Inexpedient to Legislate: Motion Adopted Voice Vote; House Journal  22, PG. 560 "
673031,2015-01-08,"Introduced and Referred to Health, Human Services and Elderly Affairs; House Journal  12, PG. 212 "
673031,2015-01-21,"==POSTPONED== Public Hearing: 1/27/2015 11:00 Amendment Legislative Office Building 205 "
673031,2015-01-26,"==RESCHEDULED== Public Hearing: 1/28/2015 11:00 Amendment Legislative Office Building 205 "
673031,2015-02-18,"Executive Session: 2/17/2015 Legislative Office Building 205 "
673031,2015-02-20,"Committee Report: Inexpedient to Legislate for Mar 4 (Vote 14-0; Consent Calendar); House Calendar18, PG. 347 "
673031,2015-03-04,"Removed from Consent Calendar (Rep Hoell); House Journal  22, PG. 559 "
673031,2015-03-04,"Inexpedient to Legislate: Motion Adopted Voice Vote; House Journal  22, PG. 619 "
673060,2015-01-07,"Introduced and Referred to Transportation; House Journal  7, PG. 118 "
673060,2015-01-14,"Public Hearing: 1/20/2015 11:30 Amendment Legislative Office Building 203 "
673060,2015-01-29,"Executive Session: 2/3/2015 1:30 PM Legislative Office Building 203 "
673060,2015-02-05,"Committee Report: Ought to Pass with Amendment #2015-0108h for Feb 11 (Vote 18-0; Consent Calendar); House Calendar11, PG. 177 "
673060,2015-02-11,"Adopt Amendment #0108h: Amendment Adopted Voice Vote; House Journal  16, PG. 306 "
673060,2015-02-11,"Ought to Pass with Amendment #0108h: Motion Adopted Voice Vote; House Journal  16, PG. 306 "
673060,2015-03-05,"Introduced and Referred to Transportation; Senate Journal 8  "
673060,2015-04-15,"Hearing: 4/21/15, Room 103, Legislative Office Building, 1:00 p.m.; Senate Calendar 18 "
673060,2015-04-22,"Committee Report: Ought to Pass, 4/30/15; Vote 5-0; Consent Calendar; Senate Calendar 19 "
673060,2015-04-30,"Ought to Pass: Motion Adopted, Voice Vote; OT3rdg; Senate Journal 12 "
673060,2015-05-14,"Enrolled Bill Amendment #1657e Adopted, Voice Vote, (In recess of 5/14/2015); Senate Journal 15 "
673060,2015-05-19,"Enrolled Bill Amendment #2015-1657EBA: Amendment Adopted Voice Vote (in recess of 5/6/2015); House Journal  41, PG. 1780 "
673060,2015-05-21,"Enrolled (In recess 5/21/2015); Senate Journal 16 "
673060,2015-05-21,"Enrolled (in recess of 5/6/2015); House Journal  41, PG. 1782 "
673060,2015-06-16,"Signed by the Governor on 6/12/2015; Chapter 130; Effective Date 6/12/2015 "
673092,2015-01-08,"Introduced and Referred to Ways and Means; House Journal  12, PG. 212 "
673092,2015-01-21,"Public Hearing: 2/3/2015 10:00 Amendment Legislative Office Building 202 "
673092,2015-01-29,"==RESCHEDULED== Public Hearing: 2/9/2015 10:00 Amendment Legislative Office Building 202=RECESSED= "
673092,2015-02-09,"Continued Public Hearing: 2/12/2015 9:00 Amendment Legislative Office Building 202 "
673092,2015-02-12,"Executive Session: 2/12/2015 9:20 Amendment Legislative Office Building 202 "
673092,2015-02-12,"Retained in Committee "
673092,2015-05-27,"Retained Bill - Subcommittee Work Session: 6/2/2015 1:30 PM Legislative Office Building 202 "
673092,2015-08-25,"Retained Bill - Subcommittee Work Session: 9/10/2015 10:00 Amendment Legislative Office Building 202 "
673092,2015-09-16,"==CANCELED==Executive Session: 10/29/2015 10:00 Amendment Legislative Office Building 202 "
673092,2015-09-23,"==RESCHEDULED==Executive Session: 10/14/2015 10:00 Amendment Legislative Office Building 202 "
673092,2015-11-12,"Committee Report: Inexpedient to Legislate for Jan 6 (Vote 19-0; Consent Calendar); House Calendar 67, PG. 11 "
673122,2015-01-08,"Introduced and Referred to Municipal and County Government; House Journal  12, PG. 211 "
673122,2015-01-29,"Public Hearing: 2/5/2015 10:30 Amendment Legislative Office Building 301 "
673122,2015-02-05,"Executive Session: 2/10/2015 2:00 PM Legislative Office Building 301 "
673122,2015-02-20,"Committee Report: Inexpedient to Legislate for Mar 4 (Vote 12-4; Consent Calendar); House Calendar18, PG. 348 "
673122,2015-03-04,"Inexpedient to Legislate: Motion Adopted Voice Vote; House Journal  22, PG. 563 "
673150,2015-01-08,"Introduced and Referred to Transportation; House Journal  12, PG. 211 "
673150,2015-01-14,"Public Hearing: 1/20/2015 2:30 PM Legislative Office Building 203 "
673150,2015-01-29,"Executive Session: 2/3/2015 1:30 PM Legislative Office Building 203 ==RECESSED== "
673150,2015-02-04,"Continued Executive Session: 2/10/2015 1:30 PM Legislative Office Building 203 "
673150,2015-02-20,"Majority Committee Report: Ought to Pass with Amendment #2015-0282h for Mar 4 (Vote 17-1; Regular Calendar); House Calendar18, PG. 363-364 "
673150,2015-02-20,"Minority Committee Report: Inexpedient to Legislate "
673150,2015-03-04,"Amendment #0282h: Amendment Adopted Voice Vote; House Journal  22, PG. 610 "
673150,2015-03-04,"Ought to Pass with Amendment #0282h: Motion Adopted DV 263-73; House Journal  22, PG. 610 "
673150,2015-03-05,"Introduced and Referred to Transportation; Senate Journal 8  "
673150,2015-03-19,"Hearing: 3/24/15, Room 103, Legislative Office Building, 1:00 p.m.; Senate Calendar 14 "
673150,2015-04-02,"Committee Report: Ought to Pass with Amendment #2015-1214s, 4/9/15; Vote 5-0; Consent Calendar; Senate Calendar 16 "
673150,2015-04-09,"Committee Amendment 1214s, Amendment Adopted, Voice Vote "
673150,2015-04-09,"Ought to Pass with Amendment 1214s, Motion Adopted, Voice Vote; OT3rdg; Senate Journal 11 "
673150,2015-05-06,"House Concurs with Senate Amendment #1214s (Rep Steven Smith): Motion Adopted Voice Vote; House Journal  41, PG. 1747 "
673150,2015-05-19,"Enrolled (In recess 5/14/2015); Senate Journal 15 "
673150,2015-05-19,"Enrolled (in recess of 5/6/2015); House Journal  41, PG. 1781 "
673150,2015-06-03,"Signed by the Governor on 6/2/2015; Chapter 63; Effective Date 8/1/2015 "
673162,2015-01-08,"Introduced and Referred to Executive Departments and Administration; Senate Journal 4  "
673162,2015-01-14,"Hearing: 1/21/15, Room 101, Legislative Office Building, 10:00 a.m.; Senate Calendar 6 "
673162,2015-01-30,"Committee Report: Ought to Pass, 2/12/15; Vote 5-0; Consent Calendar; Senate Calendar 9 "
673162,2015-02-12,"Special Order SB 46 to 2/19/15, Without Objection, Motion Adopted "
673162,2015-02-12,"Committee Report: Ought to Pass, 2/19/15; Vote 5-0; Consent Calendar; Senate Calendar 10 "
673162,2015-02-19,"Sen. D’Allesandro Moved to Remove SB 46 from the Consent Calendar "
673162,2015-02-19,"Sen. D'Allesandro Floor Amendment #2015-0321s, Amendment Adopted, Voice Vote; Senate Journal 6  "
673162,2015-02-19,"Ought to Pass with Amendment 0321s, Motion Adopted, Voice Vote; OT3rdg; Senate Journal 6  "
673162,2015-03-04,"Introduced and Referred to Science, Technology and Energy; House Journal  22, PG. 629 "
673162,2015-03-18,"Public Hearing: 3/24/2015 10:00 Amendment Legislative Office Building 304 "
673162,2015-04-01,"Executive Session: 4/7/2015 10:00 Amendment Legislative Office Building 304 "
673162,2015-04-09,"Majority Committee Report: Ought to Pass for Apr 15 (Vote 13-8; Regular Calendar); House Calendar 29, PG. 1310 "
673162,2015-04-09,"Minority Committee Report: Inexpedient to Legislate "
673162,2015-04-15,"Ought to Pass: Motion Adopted DV 214-124; House Journal  34, PG. 1559-1560 "
673162,2015-04-15,"Referred to Executive Departments and Administration; House Journal  34, PG. 1560 "
673162,2015-04-16,"Public Hearing: 4/28/2015 1:00 PM Legislative Office Building 306 "
673162,2015-04-29,"Executive Session: 4/29/2015 immediately after session Legislative Office Building 306 "
673162,2015-04-30,"Committee Report: Ought to Pass with Amendment #2015-1489h for May 6 (Vote 13-0; Consent Calendar); House Calendar 33, PG. 1508 "
673162,2015-05-06,"Amendment #1489h: Amendment Adopted Voice Vote; House Journal  41, PG. 1750 "
673162,2015-05-06,"Ought to Pass with Amendment #1489h: Motion Adopted Voice Vote; House Journal  41, PG. 1750 "
673162,2015-05-21,"Sen. Carson Concurs with House Amendment #1489h, Motion Adopted, Voice Vote; Senate Journal 15 "
673162,2015-06-01,"Enrolled Bill Amendment #2015-1998EBA: Amendment Adopted Voice Vote (in recess of 5/6/2015); House Journal  41, PG. 1783 "
673162,2015-06-02,"Enrolled Bill Amendment #2015-1998e Adopted, Voice Vote, (In recess of 5/28/2015); Senate Journal 17 "
673162,2015-06-10,"Enrolled (In recess 6/4/2015); Senate Journal 18 "
673162,2015-06-11,"Enrolled; House Journal  46, PG. 1989 "
673162,2015-06-30,"Signed by the Governor on 06/26/2015; Chapter 0176; Effective 06/26/2015 "
673194,2015-01-08,"Introduced and Referred to Judiciary; Senate Journal 4  "
673194,2015-01-14,"Hearing: 1/20/15, Room 100, State House, 9:40 a.m.; Senate Calendar 6 "
673194,2015-01-22,"Committee Report: Ought to Pass, 1/29/15; Vote 5-0; Consent Calendar; Senate Calendar 7 "
673194,2015-01-29,"Ought to Pass: Motion Adopted, Voice Vote; OT3rdg; Senate Journal 4  "
673194,2015-03-04,"Introduced and Referred to Judiciary; House Journal  22, PG. 629 "
673194,2015-04-28,"Public Hearing: 5/12/2015 10:00 Amendment Legislative Office Building 208 "
673194,2015-05-05,"Executive Session: 5/19/2015 10:00 Amendment Legislative Office Building 208 "
673194,2015-05-26,"Committee Report: Ought to Pass with Amendment #2015-1708h (NT) for Jun 3 (Vote 17-2; Consent Calendar); House Calendar 39, PG. 1630 "
673194,2015-06-03,"Amendment #1708h: Amendment Adopted Voice Vote; House Journal  44, PG. 1829-1830 "
673194,2015-06-03,"Ought to Pass with Amendment #1708h: Motion Adopted Voice Vote; House Journal  44, PG. 1829-1830 "
673194,2015-06-04,"Sen. Carson Concurs with House Amendment #1708h, New Title, Motion Adopted, Voice Vote; Senate Journal 17 "
673194,2015-06-18,"Enrolled (in recess of 6/11/2015); House Journal  46, PG. 1993 "
673194,2015-06-18,"Enrolled (In recess 6/11/2015); Senate Journal 19 "
673194,2015-06-30,"Signed by the Governor on 06/26/2015; Chapter 0175; Effective 06/26/2015 "
673230,2015-01-08,"Introduced and Referred to Commerce; Senate Journal 4  "
673230,2015-01-15,"Hearing: 1/20/15, Room 100, State House, 2:00 p.m.; Senate Calendar 6 "
673230,2015-02-20,"Committee Report: Ought to Pass with Amendment #2015-0505s, 3/5/15; Senate Calendar 11 "
673230,2015-03-05,"Committee Amendment 0505s, Regular Calendar 12Y-12N; Amendment Failed; Senate Journal 7  "
673230,2015-03-05,"Ought to Pass Not Voted On; Senate Journal 7  "
673230,2015-03-05,"Sen. Prescott Moved Laid on Table, Motion Adopted, Voice Vote; Senate Journal 7  "
673262,2015-01-08,"Introduced and Referred to Commerce; Senate Journal 4  "
673262,2015-01-15,"Hearing: 1/20/15, Room 100, State House, 1:30 p.m.; Senate Calendar 6 "
673262,2015-02-05,"Committee Report: Inexpedient to Legislate, 2/12/15; Vote 5-0; Consent Calendar; Senate Calendar 9 "
673262,2015-02-12,"Inexpedient to Legislate, Motion Adopted, Voice Vote === BILL KILLED ===; Senate Journal 5 "
673301,2015-01-08,"Introduced and Referred to Public and Municipal Affairs; Senate Journal 4  "
673301,2015-01-15,"Hearing: 1/21/15, Room 102, Legislative Office Building, 9:45 a.m.; Senate Calendar 6 "
673301,2015-01-21,"Hearing: ===RECESSED=== 1/21/15, Room 102, Legislative Office Building, 9:45 a.m. "
673301,2015-02-04,"Hearing:=== RECONVENE === 2/11/15, Room 102, Legislative Office Building, 9:00 a.m.; Senate Calendar 9 "
673301,2015-03-05,"Committee Report: Ought to Pass with Amendment #2015-0730s, New Title, 3/12/15; Senate Calendar 12 "
673301,2015-03-12,"Committee Amendment 0730s, New Title, Amendment Adopted, Voice Vote "
673301,2015-03-12,"Ought to Pass with Amendment 0730s, New Title, Motion Adopted, Voice Vote; Refer to Finance Rule 4-5; Senate Journal 8  "
673301,2015-03-18,"Committee Report: Ought to Pass with Amendment #2015-0997s, New Title, 3/26/15; Senate Calendar 14 "
673301,2015-03-26,"Committee Amendment 0997s, New Title, Amendment Failed, Voice Vote "
673301,2015-03-26,"Sen. Forrester Floor Amendment #2015-1094s, New Title, Amendment Adopted, Voice Vote; Senate Journal 10 "
673301,2015-03-26,"Ought to Pass with Amendment 1094s, New Title, Motion Adopted, Voice Vote; OT3rdg; Senate Journal 10 "
673301,2015-03-31,"Introduced and Referred to Municipal and County Government (in recess of 3/25/2015); House Journal  28, PG. 1298 "
673301,2015-03-31,"Public Hearing: 4/14/2015 10:00 Amendment Legislative Office Building 301 "
673301,2015-04-01,"===CANCELLED=== Public Hearing: 4/14/2015 10:00 Amendment Legislative Office Building 301 "
673301,2015-04-15,"Vacated and Referred to Finance; House Journal  34, PG. 1534 "
673301,2015-04-15,"Public Hearing: 4/21/2015 1:00 PM Representatives Hall; to include consideration of non-germane amendment #2015-1351h "
673301,2015-04-15,"Full Committee Work Session: 4/22/2015 10:00 Amendment Legislative Office Building 210-211 "
673301,2015-04-16,"Division I Work Session: 4/23/2015 1:15 PM Legislative Office Building 212 "
673301,2015-04-21,"==ROOM CHANGE== Public Hearing: 4/21/2015 1:00 PM Legislative Office Building 210-211 "
673301,2015-04-22,"Division I Work Session: 4/28/2015 11:00 Amendment Legislative Office Building 212 "
673301,2015-04-23,"Executive Session: 4/30/2015 10:00 Amendment Legislative Office Building 210-211 "
673301,2015-04-30,"Committee Report: Ought to Pass with Amendment #2015-1515h (NT) for May 6 (Vote 22-0; Regular Calendar); House Calendar 33, PG. 1512 "
673301,2015-05-06,"Amendment #1515h: Amendment Adopted Voice Vote; House Journal  41, PG. 1772-1776 "
673301,2015-05-06,"Ought to Pass with Amendment #1515h: Motion Adopted Regular Calendar 293-57; House Journal  41, PG. 1772-1776 "
673301,2015-05-06,"Reconsider (Rep Chandler): Motion Failed Voice Vote; House Journal  41, PG. 1776 "
673301,2015-05-07,"Sen. Forrester Concurs with House Amendment #1515h, Motion Adopted, Voice Vote; Senate Journal 13 "
673301,2015-05-13,"Enrolled (in recess of 5/6/2015); House Journal  41, PG. 1779 "
673301,2015-05-13,"Enrolled (In recess 5/7/2015); Senate Journal 14 "
673301,2015-05-22,"Signed by the Governor on 05/21/2015; Chapter 0047; Effective 05/21/2015 "
673335,2015-01-08,"Introduced and Referred to Public and Municipal Affairs; Senate Journal 4  "
673335,2015-01-15,"Hearing: 1/21/15, Room 102, Legislative Office Building, 9:00 a.m.; Senate Calendar 6 "
673335,2015-01-30,"Committee Report: Inexpedient to Legislate, 2/12/15; Senate Calendar 9 "
673335,2015-02-12,"Inexpedient to Legislate, Motion Adopted, Voice Vote === BILL KILLED ===; Senate Journal 5  "
673376,2015-01-08,"Introduced and Referred to Commerce; Senate Journal 4  "
673376,2015-01-22,"Hearing:=== CANCELLED === 1/27/15, Room 100, State House, 1:00 p.m.; Senate Calendar 7 "
673376,2015-01-26,"Hearing:=== RESCHEDULED === 2/3/15, Room 100, State House, 1:00 p.m.; Senate Calendar 8 "
673376,2015-03-11,"Committee Report: Ought to Pass with Amendment #2015-0819s, 3/19/15; Senate Calendar 13 "
673376,2015-03-19,"Committee Amendment 0819s, Amendment Adopted, Voice Vote "
673376,2015-03-19,"Sen. Bradley Floor Amendment #2015-0924s, Amendment Adopted, Voice Vote "
673376,2015-03-19,"Ought to Pass with Amendments 0819s and 0924s, Motion Adopted, Voice Vote; OT3rdg; Senate Journal 9  "
673376,2015-03-24,"Introduced and Referred to Labor, Industrial and Rehabilitative Services (in recess of 3/12/2015); House Journal  26, PG. 1276 "
673376,2015-03-25,"Public Hearing: 4/7/2015 11:00 Amendment Legislative Office Building 307 "
673376,2015-04-16,"Subcommittee Work Session: 4/21/2015 10:15 Amendment Legislative Office Building 307 "
673376,2015-04-29,"Subcommittee Work Session: 5/5/2015 10:15 Amendment Legislative Office Building 307 "
673376,2015-05-20,"Full Committee Work Session: 5/28/2015 9:00 Amendment Legislative Office Building 307 "
673376,2015-05-20,"Executive Session: 5/28/2015 10:00 Amendment Legislative Office Building 307 "
673376,2015-05-28,"Retained in Committee "
673376,2015-08-26,"Retained Bill - Full Committee Work Session: 9/8/2015 10:45 Amendment Legislative Office Building 307 "
673376,2015-10-14,"Retained Bill - Full Committee Work Session: 10/22/2015 1:00 PM Legislative Office Building 307 "
673376,2015-10-14,"Executive Session: 10/29/2015 1:00 PM Legislative Office Building 307 "
673376,2015-11-12,"Committee Report: Ought to Pass with Amendment #2015-2544h (NT) for Jan 6 (Vote 14-0; Consent Calendar); House Calendar 67, PG. 8-9 "
673407,2015-01-08,"Introduced and Referred to Executive Departments and Administration; Senate Journal 4  "
673407,2015-01-14,"Hearing: 1/21/15, Room 101, Legislative Office Building, 9:45 a.m.; Senate Calendar 6 "
673407,2015-01-21,"Committee Report: Ought to Pass, 1/29/15; Vote 5-0; Consent Calendar; Senate Calendar 7 "
673407,2015-01-29,"Ought to Pass: Motion Adopted, Voice Vote; OT3rdg; Senate Journal 4  "
673407,2015-03-04,"Introduced and Referred to Judiciary; House Journal  22, PG. 629 "
673407,2015-03-24,"Public Hearing: 3/31/2015 11:00 Amendment Legislative Office Building 208 "
673407,2015-04-01,"Executive Session: 4/7/2015 10:00 Amendment Legislative Office Building 208 "
673407,2015-04-08,"Committee Report: Ought to Pass for Apr 15 (Vote 18-0; Consent Calendar); House Calendar 29, PG. 1305 "
673407,2015-04-15,"Ought to Pass: Motion Adopted Voice Vote; House Journal  34, PG. 1546 "
673407,2015-04-29,"Enrolled; House Journal  36, PG. 1597 "
673407,2015-04-29,"Enrolled (In recess 4/9/2015); Senate Journal 12 "
673407,2015-05-08,"Signed by the Governor on 05/05/2015; Chapter 0019; Effective 01/01/2016 "
673444,2015-01-08,"Introduced and Referred to Health and Human Services; Senate Journal 4  "
673444,2015-01-22,"Hearing:=== CANCELLED === 1/27/15, Room 101, Legislative Office Building, 2:45 p.m.; Senate Calendar 7 "
673444,2015-01-26,"Hearing:=== RESCHEDULED === 2/5/15, Room 101, Legislative Office Building, 2:45 p.m.; Senate Calendar 8 "
673444,2015-03-03,"Committee Report: Ought to Pass, 3/12/15; Senate Calendar 12 "
673444,2015-03-12,"Ought to Pass: Motion Adopted, Voice Vote; OT3rdg; Senate Journal 8  "
673444,2015-03-12,"Introduced and Referred to Health, Human Services and Elderly Affairs; House Journal  26, PG. 1275 "
673444,2015-03-18,"Public Hearing: 3/24/2015 1:15 PM Legislative Office Building 205 "
673444,2015-03-25,"==CANCELED==Executive Session: 4/2/2015 10:30 Amendment Legislative Office Building 205 "
673444,2015-04-01,"Executive Session: 4/7/2015 10:30 Amendment Legislative Office Building 205 "
673444,2015-04-09,"Committee Report: Ought to Pass with Amendment #2015-1123h for Apr 15 (Vote 19-0; Consent Calendar); House Calendar 29, PG. 1304 "
673444,2015-04-15,"Amendment #1123h: Amendment Adopted Voice Vote; House Journal  34, PG. 1539-1540 "
673444,2015-04-15,"Ought to Pass with Amendment #1123h: Motion Adopted Voice Vote; House Journal  34, PG. 1539-1540 "
673444,2015-05-14,"Sen. Sanborn Concurs with House Amendment #1123h, Motion Adopted, Voice Vote; Senate Journal 14 "
673444,2015-06-03,"Enrolled "
673444,2015-06-03,"Enrolled (In recess 5/28/2015); Senate Journal 17 "
673444,2015-06-16,"Signed by the Governor on 06/12/2015; Chapter 0144; Effective 06/12/2015 "
673475,2015-01-08,"Introduced and Referred to Public and Municipal Affairs; Senate Journal 4  "
673475,2015-01-15,"Hearing: 1/21/15, Room 102, Legislative Office Building, 9:30 a.m.; Senate Calendar 6 "
673475,2015-02-05,"Committee Report: Ought to Pass with Amendment #2015-0106s, 2/12/15; Senate Calendar 9 "
673475,2015-02-12,"Committee Amendment 0106s, Amendment Adopted, Voice Vote "
673475,2015-02-12,"Sen. Watters Floor Amendment #2015-0249s, New Title, Amendment Adopted, Voice Vote; Senate Journal 5  "
673475,2015-02-12,"Ought to Pass with Amendment 0106s, 0249s New Title, Motion Adopted, Voice Vote; OT3rdg; Senate Journal 5  "
673475,2015-03-04,"Introduced and Referred to Municipal and County Government; House Journal  22, PG. 628 "
673475,2015-03-17,"Public Hearing: 3/24/2015 10:00 Amendment Legislative Office Building 301 "
673475,2015-03-17,"Executive Session: 3/26/2015 10:00 Amendment Legislative Office Building 301 "
673475,2015-03-27,"Committee Report: Ought to Pass with Amendment #2015-1129h for Apr 15 (Vote 15-0; Consent Calendar); House Calendar 29, PG. 1305 "
673475,2015-04-15,"Amendment #1129h: Amendment Adopted Voice Vote; House Journal  34, PG. 1546 "
673475,2015-04-15,"Ought to Pass with Amendment #1129h: Motion Adopted Voice Vote; House Journal  34, PG. 1546 "
673475,2015-04-30,"Sen. Birdsell Concurs with House Amendment #1129h, Motion Adopted, Voice Vote; Senate Journal 12 "
673475,2015-05-06,"Enrolled Bill Amendment #2015-1566-EBA: Amendment Adopted Voice Vote; House Journal  41, PG. 1778 "
673475,2015-05-14,"Enrolled Bill Amendment #2015-1566e Adopted, Voice Vote, (In recess of 5/14/2015); Senate Journal 15 "
673475,2015-05-21,"Enrolled (in recess of 5/6/2015); House Journal  41, PG. 1782 "
673475,2015-05-21,"Enrolled (In recess 5/21/2015); Senate Journal 16 "
673475,2015-06-11,"Signed by the Governor on 06/08/2015; Chapter 0115 "
673475,2015-06-11,"I. Section 2 Effective 11/01/18 "
673475,2015-06-11,"II. Remainder Effective 06/08/15 "
673519,2015-01-08,"Introduced and Referred to Public and Municipal Affairs; Senate Journal 4  "
673519,2015-01-15,"Hearing: 1/21/15, Room 102, Legislative Office Building, 10:15 a.m.; Senate Calendar 6 "
673519,2015-01-22,"Committee Report: Ought to Pass, 1/29/15; Vote 5-0; Consent Calendar; Senate Calendar 7 "
673519,2015-01-29,"Ought to Pass: Motion Adopted, Voice Vote; OT3rdg; Senate Journal 4  "
673519,2015-03-04,"Introduced and Referred to Election Law; House Journal  22, PG. 628 "
673519,2015-04-01,"Public Hearing: 4/7/2015 10:00 Amendment Legislative Office Building 308==RECESSED== "
673519,2015-04-08,"Continued Public Hearing: 4/14/2015 10:00 Amendment Legislative Office Building 308 "
673519,2015-04-15,"Public Hearing on non-germane amendment #2015-1303h: 4/21/2015 11:00 Amendment Legislative Office Building 308 "
673519,2015-04-15,"Executive Session: 4/21/2015 11:15 Amendment Legislative Office Building 308 "
673519,2015-04-23,"Majority Committee Report: Ought to Pass with Amendment #2015-1303h (NT) for Jun 3 (Vote 11-7; Regular Calendar); House Calendar 39, PG. 1635 "
673519,2015-04-23,"Minority Committee Report: Inexpedient to Legislate "
673519,2015-06-03,"Amendment #1303h: Amendment Adopted DV 202-133; House Journal  44, PG. 1906 "
673519,2015-06-03,"Ought to Pass with Amendment #1303h: Motion Adopted Regular Calendar 206-149; House Journal  44, PG. 1906-1908 "
673519,2015-06-04,"Sen. Birdsell Moved Nonconcur with House Amendment #1303h, New Title, Motion Adopted, Voice Vote; Senate Journal 17 "
673556,2015-01-08,"Introduced and Referred to Commerce; Senate Journal 4  "
673556,2015-01-15,"Hearing: 1/22/15, Room 101, Legislative Office Building, 9:15 a.m.; Senate Calendar 6 "
673556,2015-01-22,"Committee Report: Ought to Pass, 1/29/15; Senate Calendar 7 "
673556,2015-01-29,"Ought to Pass: Motion Adopted, Voice Vote; OT3rdg; Senate Journal 4  "
673556,2015-03-04,"Introduced and Referred to Commerce and Consumer Affairs; House Journal  22, PG. 628 "
673556,2015-03-18,"Public Hearing: 3/24/2015 10:00 Amendment Legislative Office Building 302 "
673556,2015-04-07,"Subcommittee Work Session: 4/14/2015 10:00 Amendment Legislative Office Building 302 "
673556,2015-05-06,"Executive Session: 5/12/2015 1:15 PM Legislative Office Building 302 "
673556,2015-05-14,"Committee Report: Ought to Pass for Jun 3 (Vote 19-0; Consent Calendar); House Calendar 39, PG. 1628 "
673556,2015-06-03,"Ought to Pass: Motion Adopted Voice Vote; House Journal  44, PG. 1816 "
673556,2015-06-18,"Enrolled (in recess of 6/11/2015); House Journal  46, PG. 1993 "
673556,2015-06-18,"Enrolled (In recess 6/11/2015); Senate Journal 19 "
673556,2015-06-30,"Signed by the Governor on 06/26/2015; Chapter 0173; Effective 08/25/2015 "
673588,2015-01-08,"Introduced and Referred to Executive Departments and Administration; Senate Journal 4  "
673588,2015-01-14,"Hearing: 1/21/15, Room 101, Legislative Office Building, 9:15 a.m.; Senate Calendar 6 "
673588,2015-01-21,"Committee Report: Ought to Pass with Amendment #2015-0045s, 1/29/15; Vote 5-0; Consent Calendar; Senate Calendar 7 "
673588,2015-01-29,"Committee Amendment 0045s, Amendment Adopted, Voice Vote "
673588,2015-01-29,"Ought to Pass with Amendment 0045s, Motion Adopted, Voice Vote; OT3rdg; Senate Journal 4  "
673588,2015-03-04,"Introduced and Referred to Executive Departments and Administration; House Journal  22, PG. 628 "
673588,2015-03-11,"Public Hearing: 3/17/2015 10:00 Amendment Legislative Office Building 306 "
673588,2015-03-18,"Executive Session: 3/24/2015 10:00 Amendment Legislative Office Building 306 "
673588,2015-04-08,"Committee Report: Ought to Pass with Amendment #2015-0973h for Apr 15 (Vote 13-0; Consent Calendar); House Calendar 29, PG. 1302 "
673588,2015-04-15,"Amendment #0973h: Amendment Adopted Voice Vote; House Journal  34, PG. 1537 "
673588,2015-04-15,"Ought to Pass with Amendment #0973h: Motion Adopted Voice Vote; House Journal  34, PG. 1537 "
673588,2015-05-07,"Sen. Carson Concurs with House Amendment #0973h, Motion Adopted, Voice Vote; Senate Journal 12 "
673588,2015-05-19,"Enrolled (in recess of 5/6/2015); House Journal  41, PG. 1781 "
673588,2015-05-19,"Enrolled (In recess 5/14/2015); Senate Journal 15 "
673588,2015-06-03,"Signed by the Governor on 06/02/15; Chapter 0076; Effective 08/01/2015 "
673628,2015-01-08,"Introduced and Referred to Judiciary; Senate Journal 4  "
673628,2015-01-14,"Hearing: 1/20/15, Room 100, State House, 9:00 a.m.; Senate Calendar 6 "
673628,2015-03-18,"Committee Report: Ought to Pass with Amendment #2015-0992s, 3/26/15; Senate Calendar 14 "
673628,2015-03-26,"Committee Amendment 0992s Not Voted On "
673628,2015-03-26,"Sen. Carson Moved Laid on Table, Motion Adopted, Voice Vote; Senate Journal 10 "
673663,2015-01-08,"Introduced and Referred to Executive Departments and Administration; Senate Journal 4  "
673663,2015-01-14,"Hearing: 1/21/15, Room 101, Legislative Office Building, 9:30 a.m.; Senate Calendar 6 "
673663,2015-01-21,"Committee Report: Ought to Pass, 1/29/15; Vote 5-0; Consent Calendar; Senate Calendar 7 "
673663,2015-01-29,"Ought to Pass: Motion Adopted, Voice Vote; OT3rdg; Senate Journal 4  "
673663,2015-03-04,"Introduced and Referred to Executive Departments and Administration; House Journal  22, PG. 629 "
673663,2015-03-11,"Public Hearing: 3/17/2015 10:40 Amendment Legislative Office Building 306 "
673663,2015-03-18,"Executive Session: 3/24/2015 10:00 Amendment Legislative Office Building 306 "
673663,2015-03-25,"Committee Report: Ought to Pass for Apr 15 (Vote 13-0; Consent Calendar); House Calendar 29, PG. 1303 "
673663,2015-04-15,"Ought to Pass: Motion Adopted Voice Vote; House Journal  34, PG. 1537 "
673663,2015-04-29,"Enrolled; House Journal  36, PG. 1597 "
673663,2015-04-29,"Enrolled (In recess 4/9/2015); Senate Journal 12 "
673663,2015-05-08,"Signed by the Governor on 05/05/2015; Chapter 0018; Effective 07/04/2015 "
673701,2015-01-08,"Introduced and Referred to Energy and Natural Resources; Senate Journal 4  "
673701,2015-01-15,"Hearing: 1/21/15, Room 100, State House, 9:00 a.m.; Senate Calendar 6 "
673701,2015-01-22,"Committee Report: Ought to Pass with Amendment #2015-0050s, 1/29/15; Senate Calendar 7 "
673701,2015-01-29,"Committee Amendment 0050s, Amendment Adopted, Voice Vote "
673701,2015-01-29,"Ought to Pass with Amendment 0050s, Motion Adopted, Voice Vote; OT3rdg; Senate Journal 4  "
673701,2015-03-04,"Introduced and Referred to Resources, Recreation and Development; House Journal  22, PG. 628 "
673701,2015-03-11,"Public Hearing: 3/18/2015 10:30 Amendment Legislative Office Building 305 "
673701,2015-03-18,"Subcommittee Work Session: 3/24/2015 10:30 Amendment Legislative Office Building 305 "
673701,2015-03-19,"===CANCELLED=== Work Session: 3/24/2015 10:30 Amendment Legislative Office Building 305 "
673701,2015-03-25,"Subcommittee Work Session: 3/31/2015 10:30 Amendment Legislative Office Building 305 "
673701,2015-03-31,"Subcommittee Work Session: 4/7/2015 10:15 Amendment Legislative Office Building 305 "
673701,2015-04-09,"Executive Session: 4/7/2015 Legislative Office Building 305 "
673701,2015-04-09,"Committee Report: Ought to Pass with Amendment #2015-1239h for Apr 15 (Vote 19-0; Consent Calendar); House Calendar 29, PG. 1306 "
673701,2015-04-15,"Amendment #1239h: Amendment Adopted Voice Vote; House Journal  34, PG. 1548 "
673701,2015-04-15,"Ought to Pass with Amendment #1239h: Motion Adopted Voice Vote; House Journal  34, PG. 1548 "
673701,2015-05-14,"Sen. Bradley Concurs with House Amendment #1239h, Motion Adopted, Voice Vote; Senate Journal 14 "
673701,2015-05-26,"Enrolled Bill Amendment #2015-1940EBA: Amendment Adopted Voice Vote (in recess of 5/6/2015); House Journal  41, PG. 1783 "
673701,2015-05-27,"Enrolled Bill Amendment #2015-1940e Adopted, Voice Vote, (In recess of 05/21/2015); Senate Journal 16 "
673701,2015-06-10,"Enrolled (In recess 6/4/2015); Senate Journal 18 "
673701,2015-06-11,"Enrolled; House Journal  46, PG. 1989 "
673701,2015-06-30,"Signed by the Governor on 06/26/2015; Chapter 0174 "
673701,2015-06-30,"I. Section 2 Effective 12/31/16 "
673701,2015-06-30,"II. Remainder Effective 06/26/15 "
673734,2015-01-08,"Introduced and Referred to Finance; Senate Journal 4  "
673734,2015-01-15,"Hearing:=== CANCELLED === 1/27/15, Room 103, State House, 2:15 p.m.; Senate Calendar 6 "
673734,2015-01-26,"Hearing:=== RESCHEDULED === 2/5/15, Room 103, State House, 2:15 p.m.; Senate Calendar 8 "
673734,2015-03-04,"Committee Report: Ought to Pass with Amendment #2015-0716s, 3/12/15; Senate Calendar 12 "
673734,2015-03-12,"Committee Amendment 0716s, Amendment Adopted, Voice Vote "
673734,2015-03-12,"Ought to Pass with Amendment 0716s, Regular Calendar 24Y-0N, Motion Adopted; OT3rdg; Senate Journal 8  "
673734,2015-03-12,"Introduced and Referred to Finance; House Journal  26, PG. 1275 "
673734,2015-04-02,"Public Hearing: 4/8/2015 1:00 PM Legislative Office Building 210-211 "
673734,2015-04-02,"Full Committee Work Session: 4/9/2015 1:00 PM Legislative Office Building 210-211 "
673734,2015-04-08,"==CANCELED==Executive Session: 4/16/2015 9:30 Amendment Legislative Office Building 210-211 "
673734,2015-04-10,"Division I Work Session: 4/21/2015 10:00 Amendment Legislative Office Building 212 "
673734,2015-04-21,"Division I Work Session: 4/28/2015 10:00 Amendment Legislative Office Building 212 "
673734,2015-04-29,"Division I Work Session: 5/12/2015 10:00 Amendment Legislative Office Building 212 "
673734,2015-05-20,"Executive Session: 5/26/2015 10:00 Amendment Legislative Office Building 201 "
673734,2015-05-28,"Committee Report: Ought to Pass with Amendment #2015-1900h for Jun 3 (Vote 20-0; Consent Calendar); House Calendar 39, PG. 1629 "
673734,2015-06-03,"Amendment #1900h: Amendment Adopted Voice Vote; House Journal  44, PG. 1826-1827 "
673734,2015-06-03,"Ought to Pass with Amendment #1900h: Motion Adopted Voice Vote; House Journal  44, PG. 1826-1827 "
673734,2015-06-04,"Sen. Forrester Moved Nonconcur with House Amendment #1900h; Requests C of C, Motion Adopted, Voice Vote; Senate Journal 17 "
673734,2015-06-04,"President Appoints: Senators Bradley, Little, and D'Allesandro "
673734,2015-06-09,"House Accedes to Senate Request for Committee of Conference (Rep Hinch): Motion Adopted Voice Vote (in recess of 6/3/2015); House Journal  44, PG. 1953 "
673734,2015-06-09,"Speaker Appoints: Reps L. Ober, Twombly, Spanos, Leishman (in recess of 6/3/2015); House Journal  44, PG. 1953 "
673734,2015-06-09,"Committee of Conference Meeting: 6/10/2015, 2:30 p.m., Room 100, State House "
673734,2015-06-11,"Conferee Change: Rep Kurk Replaces Rep Twombly; House Journal  46, PG. 1990 "
673734,2015-06-15,"Conference Committee Report #2015-2127CofC Filed; House Amendment "
673734,2015-06-24,"Conference Committee Report 2127c: Adopted, Voice Vote; House Journal  54, PG. 2102 "
673734,2015-06-24,"Conference Committee Report 2127c; Adopted, Voice Vote; Senate Journal 19 "
673734,2015-07-02,"Enrolled (In recess of 6/24/2015); House Journal  54, PG. 2141 "
673734,2015-07-02,"Enrolled (In recess 6/24/2015); Senate Journal 19 "
673734,2015-07-15,"Signed by the Governor on 07/13/2015; Chapter 0245; Effective 12/31/2015 "
673769,2015-01-08,"Introduced and Referred to Executive Departments and Administration; Senate Journal 4  "
673769,2015-01-14,"Hearing: 1/21/15, Room 101, Legislative Office Building, 9:00 a.m.; Senate Calendar 6 "
673769,2015-01-22,"Committee Report: Ought to Pass with Amendment #2015-0044s, 1/29/15; Vote 5-0; Consent Calendar; Senate Calendar 7 "
673769,2015-01-29,"Committee Amendment 0044s, Amendment Adopted, Voice Vote "
673769,2015-01-29,"Ought to Pass with Amendment 0044s, Motion Adopted, Voice Vote; OT3rdg; Senate Journal 4  "
673769,2015-03-04,"Introduced and Referred to Executive Departments and Administration; House Journal  22, PG. 628 "
673769,2015-03-11,"Public Hearing: 3/17/2015 10:20 Amendment Legislative Office Building 306 "
673769,2015-03-18,"Executive Session: 3/24/2015 10:00 Amendment Legislative Office Building 306 "
673769,2015-04-08,"Committee Report: Ought to Pass for Apr 15 (Vote 11-2; Consent Calendar); House Calendar 29, PG. 1302-1303 "
673769,2015-04-15,"Ought to Pass: Motion Adopted Voice Vote; House Journal  34, PG. 1537 "
673769,2015-04-29,"Enrolled; House Journal  36, PG. 1597 "
673769,2015-04-29,"Enrolled (In recess 4/9/2015); Senate Journal 12 "
673769,2015-05-08,"Signed by the Governor on 05/07/2015; Chapter 0027; Effective 07/06/2015 "
674639,2015-01-08,"Introduced and Referred to Science, Technology and Energy; House Journal  12, PG. 212 "
674639,2015-01-14,"Public Hearing: 1/22/2015 10:00 Amendment Representatives Hall "
674639,2015-01-26,"Full Committee Work Session: 1/29/2015 10:00 Amendment Legislative Office Building 304 "
674639,2015-01-28,"Executive Session: 2/5/2015 1:00 PM Legislative Office Building 304 "
674639,2015-02-12,"Majority Committee Report: Ought to Pass with Amendment #2015-0139h (NT) for Feb 18 (Vote 12-8; Regular Calendar); House Calendar13, PG. 249-250 "
674639,2015-02-12,"Minority Committee Report: Inexpedient to Legislate "
674639,2015-02-18,"Amendment #0139h: Amendment Adopted Regular Calendar 197-158; House Journal  20, PG. 524-528 "
674639,2015-02-18,"Ought to Pass with Amendment #0139h: Motion Adopted Regular Calendar 201-154; House Journal  20, PG. 524-528 "
674639,2015-02-19,"Referred to Finance "
674639,2015-03-02,"Second Committee Referral Waived by Committee Chair "
674639,2015-03-04,"Third Reading: Motion Adopted Voice Vote "
674639,2015-03-05,"Introduced and Referred to Energy and Natural Resources; Senate Journal 8  "
674639,2015-04-01,"Hearing: 4/8/15, Room 100, State House, 9:45 a.m.; Senate Calendar 16 "
674639,2015-05-27,"Committee Report: Ought to Pass with Amendment #2015-1970s, 6/4/15; Senate Calendar 24 "
674639,2015-06-04,"Committee Amendment 1970s, Regular Calendar 14Y-10N, Amendment Adopted "
674639,2015-06-04,"Ought to Pass with Amendment 1970s, Regular Calendar 13Y-11N, Motion Adopted; OT3rdg; Senate Journal 17 "
674639,2015-06-05,"House Non-Concurs and Requests Committee of Conference (Rep Hinch): Motion Adopted Voice Vote (in recess of 6/3/2015); House Journal  44, PG. 1951 "
674639,2015-06-05,"Speaker Appoints: Reps Vose, Vadney, Aldrich, Barry (in recess of 6/3/2015); House Journal  44, PG. 1951 "
674639,2015-06-11,"Sen. Bradley accedes to House Request for Committee of Conference, Motion Adopted, Voice Vote; Senate Journal 18 "
674639,2015-06-11,"President Appoints: Senators Bradley, Stiles and Feltes "
674639,2015-06-12,"Conference Committee Meeting: 6/16/2015 10:00 Amendment Legislative Office Building 304 "
674639,2015-06-18,"Conference Committee Report; Not Signed Off; Senate Journal 19 "
674655,2015-01-08,"Introduced and Referred to Commerce and Consumer Affairs; House Journal  12, PG. 213 "
674655,2015-02-04,"Public Hearing: 2/10/2015 2:30 PM Legislative Office Building 302 "
674655,2015-02-18,"Subcommittee Work Session: 2/19/2015 1:45 PM Legislative Office Building 302 "
674655,2015-02-20,"Executive Seesion: 3/3/2015 1:00 PM Legislative Office Building 302 "
674655,2015-03-05,"Majority Committee Report: Inexpedient to Legislate for Mar 11 (Vote 13-7; Regular Calendar); House Calendar19, PG. 414 "
674655,2015-03-05,"Minority Committee Report: Ought to Pass "
674655,2015-03-11,"Inexpedient to Legislate: Motion Adopted DV 239-117; House Journal  24, PG. 834-835 "
674678,2015-01-08,"Introduced and Referred to Education; House Journal  12, PG. 213 "
674678,2015-01-14,"Public Hearing: 1/20/2015 11:30 Amendment Legislative Office Building 207 "
674678,2015-01-14,"==RESCHEDULED== Public Hearing: 1/20/2015 11:00 Amendment Legislative Office Building 207 "
674678,2015-01-29,"Executive Session: 2/10/2015 10:00 Amendment Legislative Office Building 207 "
674678,2015-02-11,"Retained in Committee "
674678,2015-04-21,"Retained Bill - Subcommittee Work Session: 4/30/2015 10:00 Amendment Legislative Office Building 207 "
674678,2015-05-05,"Retained Bill - Subcommittee Work Session: 5/19/2015 10:00 Amendment Legislative Office Building 207 "
674678,2015-05-12,"Retained Bill - Subcommittee Work Session: 5/26/2015 1:00 PM Legislative Office Building 207 "
674678,2015-08-17,"Retained Bill - Subcommittee Work Session: 8/27/2015 9:30 Amendment Legislative Office Building 207 "
674678,2015-08-17,"Retained Bill - Subcommittee Work Session: 9/1/2015 9:30 Amendment Legislative Office Building 207 "
674678,2015-09-09,"Executive Session: 10/27/2015 10:00 Amendment Legislative Office Building 207 "
674678,2015-11-12,"Majority Committee Report: Ought to Pass with Amendment #2015-2441h (NT) for Jan 6 (Vote 14-6; Regular Calendar); House Calendar 67, PG. 17 "
674678,2015-11-17,"Minority Committee Report: Inexpedient to Legislate "
674696,2015-01-08,"Introduced and Referred to Science, Technology and Energy; House Journal  12, PG. 212 "
674696,2015-01-14,"Public Hearing: 1/21/2015 1:00 PM Legislative Office Building 304 "
674696,2015-01-21,"Full Committee Work Session: 2/5/2015 10:45 Amendment Legislative Office Building 304 "
674696,2015-02-23,"Executive Session: 2/11/2015 Legislative Office Building 304 "
674696,2015-02-23,"Committee Report: Inexpedient to Legislate for Mar 4 (Vote 20-0; Consent Calendar); House Calendar18, PG. 351 "
674696,2015-03-04,"Inexpedient to Legislate: Motion Adopted Voice Vote; House Journal  22, PG. 567-568 "
674719,2015-01-08,"Introduced and Referred to Commerce and Consumer Affairs; House Journal  12, PG. 212 "
674719,2015-02-04,"Public Hearing: 2/10/2015 3:00 PM Legislative Office Building 302 "
674719,2015-02-20,"Executive Seesion: 3/3/2015 1:00 PM Legislative Office Building 302 "
674719,2015-03-05,"Committee Report: Inexpedient to Legislate for Mar 11 (Vote 12-7; Regular Calendar); House Calendar19, PG. 414 "
674719,2015-03-11,"Inexpedient to Legislate: Motion Adopted Voice Vote; House Journal  24, PG. 834 "
674736,2015-01-08,"Introduced and Referred to Education; House Journal  12, PG. 213 "
674736,2015-01-14,"Public Hearing: 1/20/2015 1:00 PM Legislative Office Building 207 "
674736,2015-01-14,"==RESCHEDULED== Public Hearing: 1/20/2015 11:30 Amendment Legislative Office Building 207 "
674736,2015-01-29,"Executive Session: 2/5/2015 11:30 Amendment Legislative Office Building 207 "
674736,2015-02-12,"Committee Report: Ought to Pass with Amendment #2015-0218h for Feb 18 (Vote 19-0; Regular Calendar); House Calendar13, PG. 245 "
674736,2015-02-18,"Amendment #0218h: Amendment Adopted Voice Vote; House Journal  20, PG. 510 "
674736,2015-02-18,"Ought to Pass with Amendment #0218h: Motion Adopted Voice Vote; House Journal  20, PG. 509-510 "
674736,2015-02-19,"Referred to Finance "
674736,2015-02-25,"Division II Work Session: 3/2/2015 4:30 PM Legislative Office Building 209 "
674736,2015-03-10,"Division II Work Session: 3/12/2015 1:00 PM State House 103 "
674736,2015-03-12,"Executive Session: 3/18/2015 9:00 Amendment Legislative Office Building 210-211 "
674736,2015-03-19,"Committee Report: Inexpedient to Legislate for Mar 25 (Vote 20-2; Regular Calendar); House Calendar 23, PG. 633 "
674736,2015-03-25,"Inexpedient to Legislate: Motion Adopted Voice Vote; House Journal  28, PG. 1290-1291 "
674755,2015-01-08,"Introduced and Referred to Health, Human Services and Elderly Affairs; House Journal  12, PG. 213 "
674755,2015-01-21,"==POSTPONED== Public Hearing: 1/27/2015 2:15 PM Legislative Office Building 205 "
674755,2015-01-26,"==RESCHEDULED== Public Hearing: 1/28/2015 2:15 PM Legislative Office Building 205 "
674755,2015-01-28,"Executive Session: 2/3/2015 10:00 Amendment Legislative Office Building 205 "
674755,2015-02-05,"Committee Report: Ought to Pass for Feb 11 (Vote 17-0; Consent Calendar); House Calendar11, PG. 174 "
674755,2015-02-11,"Ought to Pass: Motion Adopted Voice Vote; House Journal  16, PG. 303 "
674755,2015-03-12,"Introduced and Referred to Health and Human Services; Senate Journal 9  "
674755,2015-04-02,"Hearing: 4/7/15, Room 101, Legislative Office Building, 1:00 p.m.; Senate Calendar 16 "
674755,2015-05-06,"Committee Report: Ought to Pass with Amendment #2015-1569s, 5/14/15; Senate Calendar 21 "
674755,2015-05-14,"Committee Amendment 1569s, Regular Calendar 16Y-8N, Amendment Adopted "
674755,2015-05-14,"Ought to Pass with Amendment 1569s, Motion Adopted, Voice Vote; OT3rdg; Senate Journal 14 "
674755,2015-06-03,"House Non-Concurs with Senate Amendment #1569s and Requests Committee of Conference (Rep Kotowski): Motion Adopted Voice Vote; House Journal  44, PG. 1815 "
674755,2015-06-03,"Speaker Appoints: Reps McMahon, Kotowski, Stephen Schmidt, LeBrun; House Journal  44, PG. 1815 "
674755,2015-06-04,"Sen. Sanborn Accedes to House Request for Committee of Conference, Motion Adopted, Voice Vote; Senate Journal 17 "
674755,2015-06-04,"President Appoints: Senators Sanborn, Carson, and Fuller Clark "
674755,2015-06-08,"Conferee Change: Rep MacKay Replaces Rep Stephen Schmidt; House Journal  44, PG. 1950 "
674755,2015-06-11,"==NOTE TIME CHANGE==Conference Committee Meeting: 6/17/2015 2:30 PM Legislative Office Building 205==Recessed== "
674755,2015-06-15,"Conferee Change; Senator Kelly Replaces Senator Fuller Clark "
674755,2015-06-18,"Conferee Change: Rep Hinch Replaces Rep McMahon "
674755,2015-06-18,"Conferee Change: Rep Fields Replaces Rep MacKay "
674755,2015-06-18,"==Continued==Conference Committee Meeting: 6/18/2015 9:30 Legislative Office Building 205 "
674755,2015-06-18,"Conferee Change: Rep McMahon Replaces Rep Hinch; House Journal  46, PG. 1992 "
674755,2015-06-18,"Rep McMahon Becomes Chair; House Journal  46, PG. 1992 "
674755,2015-06-18,"Conferee Change: Rep MacKay Replaces Rep Fields; House Journal  46, PG. 1992 "
674755,2015-06-18,"Conferee Change; Senator Bradley Replaces Senator Kelly "
674755,2015-06-18,"Conferee Change; Senator Avard Replaces Senator Carson "
674755,2015-06-18,"==Continued=== Conference Committee Meeting: 6/18/2015 1:00 PM Legislative Office Building 205 "
674755,2015-06-18,"Conferee Change: Rep Hinch replaces Rep McMahon; House Journal  46, PG. 1992 "
674755,2015-06-18,"Conferee Change: Rep McMahon replaces Rep Hinch; House Journal  46, PG. 1992 "
674755,2015-06-18,"Conference Committee Report #2015-2309c; Senate Amendment + New Amendment, Filed "
674755,2015-06-24,"Conference Committee Report 2309c; Adopted, Voice Vote; Senate Journal 19 "
674755,2015-06-24,"Conference Committee Report 2309c: Adopted, Voice Vote; House Journal  54, PG. 2122 "
674755,2015-07-01,"Enrolled Bill Amendment #2349e, New Title, Adopted, Voice Vote, (In recess of 6/24/2015); Senate Journal 19 "
674755,2015-07-01,"Enrolled Bill Amendment #2015-2349EBA (NT): Amendment Adopted Voice Vote (In recess of 6/24/2015); House Journal  54, PG. 2140 "
674755,2015-07-09,"Enrolled (In recess 6/24/2015); Senate Journal 19 "
674755,2015-07-09,"Enrolled (in recess of 6/24/2015); House Journal  54, PG. 2142 "
674755,2015-07-21,"Signed by the Governor on 7/20/2015; Chapter 269; Effective 9/18/2015 "
674774,2015-01-08,"Introduced and Referred to Criminal Justice and Public Safety; House Journal  12, PG. 213 "
674774,2015-01-13,"==POSTPONED==Public Hearing: 1/27/2015 10:00 Amendment Legislative Office Building 204 "
674774,2015-01-26,"==RESCHEDULED==Public Hearing: 1/28/2015 10:00 Amendment Legislative Office Building 204 "
674774,2015-02-25,"Executive Session: 3/2/2015 10:00 Amendment Legislative Office Building 204 "
674774,2015-03-03,"Committee Report: Inexpedient to Legislate for Mar 11 (Vote 13-3; Regular Calendar); House Calendar19, PG. 416 "
674774,2015-03-11,"Inexpedient to Legislate: Motion Adopted Regular Calendar 233-122; House Journal  24, PG. 843-845 "
674796,2015-01-08,"Introduced and Referred to Children and Family Law; House Journal  12, PG. 212 "
674796,2015-01-28,"Public Hearing: 2/3/2015 1:00 PM Legislative Office Building 206 "
674796,2015-02-24,"Executive Session: 3/3/2015 10:00 Amendment Legislative Office Building 206 "
674796,2015-03-06,"Retained in Committee "
674796,2015-03-10,"Full Committee Work Session: 3/17/2015 10:00 Amendment Legislative Office Building 206 "
674796,2015-05-13,"Retained Bill - Full Committee Work Session: 5/19/2015 1:15 PM Legislative Office Building 206 "
674796,2015-05-27,"Retained Bill - Full Committee Work Session: 6/2/2015 10:00 Amendment Legislative Office Building 206 "
674796,2015-08-24,"Retained Bill - Full Committee Work Session: 9/16/2015 10:00 Amendment Legislative Office Building 206 "
674796,2015-09-16,"Executive Session: 9/29/2015 10:00 Amendment Legislative Office Building 206 "
674796,2015-11-12,"Committee Report: Inexpedient to Legislate for Jan 6 (Vote 14-1; Consent Calendar); House Calendar 67, PG. 3 "
674814,2015-01-08,"Introduced and Referred to Executive Departments and Administration; House Journal  12, PG. 213 "
674814,2015-01-14,"Public Hearing: 1/22/2015 1:15 PM Legislative Office Building 306 "
674814,2015-01-29,"Executive Session: 2/3/2015 2:30 PM Legislative Office Building 306 "
674814,2015-02-05,"Committee Report: Ought to Pass for Feb 11 (Vote 15-0; Consent Calendar); House Calendar11, PG. 172 "
674814,2015-02-11,"Ought to Pass: Motion Adopted Voice Vote; House Journal  16, PG. 299 "
674814,2015-03-12,"Introduced and Referred to Executive Departments and Administration; Senate Journal 9  "
674814,2015-03-25,"Hearing: 4/1/15, Room 101, Legislative Office Building, 9:15 a.m.; Senate Calendar 15 "
674814,2015-04-01,"Committee Report: Ought to Pass, 4/9/15; Senate Calendar 16 "
674814,2015-04-09,"Ought to Pass: Motion Adopted, Voice Vote; OT3rdg; Senate Journal 11 "
674814,2015-04-21,"Enrolled (In recess 4/9/2015); Senate Journal 12 "
674814,2015-04-22,"Enrolled (in recess of 4/15/2015); House Journal  34, PG. 1564 "
674814,2015-05-07,"Signed by the Governor on 5/5/2015; Chapter 10; Effective Date 7/4/2015 "
674836,2015-01-08,"Introduced and Referred to Ways and Means; House Journal  12, PG. 213 "
674836,2015-01-21,"Public Hearing: 2/3/2015 2:00 PM Legislative Office Building 202 "
674836,2015-01-29,"==RESCHEDULED== Public Hearing: 2/9/2015 2:00 PM Legislative Office Building 202=RECESSED= "
674836,2015-02-09,"Continued Public Hearing: 2/13/2015 10:30 Amendment Legislative Office Building 202 "
674836,2015-02-17,"Executive Session: 2/17/2015 Legislative Office Building 202 "
674836,2015-02-23,"Committee Report: Inexpedient to Legislate for Mar 4 (Vote 19-0; Consent Calendar); House Calendar18, PG. 354 "
674836,2015-03-04,"Inexpedient to Legislate: Motion Adopted Voice Vote; House Journal  22, PG. 569 "
674857,2015-01-08,"Introduced and Referred to Science, Technology and Energy; House Journal  12, PG. 212 "
674857,2015-01-14,"Public Hearing: 1/21/2015 1:45 PM Legislative Office Building 304=RECESSED= "
674857,2015-01-21,"Continued Public Hearing: 2/5/2015 10:00 Amendment Legislative Office Building 304 "
674857,2015-02-11,"Executive Session: 2/10/2015 Legislative Office Building 304 "
674857,2015-02-20,"Committee Report: Inexpedient to Legislate for Mar 4 (Vote 15-3; Regular Calendar); House Calendar18, PG. 362 "
674857,2015-03-04,"Inexpedient to Legislate: Motion Adopted Voice Vote; House Journal  22, PG. 604 "
674874,2015-01-08,"Introduced and Referred to Criminal Justice and Public Safety; House Journal  12, PG. 212 "
674874,2015-01-13,"Public Hearing: 1/22/2015 10:00 Amendment Legislative Office Building 204 "
674874,2015-02-25,"Executive Session: 3/2/2015 10:00 Amendment Legislative Office Building 204 "
674874,2015-03-04,"Committee Report: Inexpedient to Legislate for Mar 11 (Vote 15-1; Consent Calendar); House Calendar19, PG. 394 "
674874,2015-03-11,"Inexpedient to Legislate: Motion Adopted Voice Vote; House Journal  24, PG. 777 "
674895,2015-01-08,"Introduced and Referred to Education; House Journal  12, PG. 213 "
674895,2015-01-14,"Public Hearing: 1/20/2015 11:00 Amendment Legislative Office Building 207 "
674895,2015-01-14,"==RESCHEDULED== Public Hearing: 1/20/2015 1:00 PM Legislative Office Building 207 "
674895,2015-01-29,"Executive Session: 2/5/2015 11:30 Amendment Legislative Office Building 207 "
674895,2015-02-13,"Committee Report: Inexpedient to Legislate for Feb 18 (Vote 19-0; Consent Calendar); House Calendar13, PG. 237 "
674895,2015-02-18,"Inexpedient to Legislate: Motion Adopted Voice Vote; House Journal  20, PG. 497 "
674912,2015-01-08,"Introduced and Referred to Fish and Game and Marine Resources; House Journal  12, PG. 212 "
674912,2015-01-20,"Public Hearing: 1/29/2015 1:00 PM Legislative Office Building 307 "
674912,2015-01-29,"Subcommittee Work Session: 2/5/2015 9:00 Amendment Legislative Office Building 307 "
674912,2015-02-23,"Executive Session: 3/3/2015 10:15 Amendment Legislative Office Building 308 "
674912,2015-03-03,"Committee Report: Ought to Pass with Amendment #2015-0229h (NT) for Mar 11 (Vote 14-0; Consent Calendar); House Calendar19, PG. 402 "
674912,2015-03-11,"Amendment #0229h: Amendment Adopted Voice Vote; House Journal  24, PG. 789 "
674912,2015-03-11,"Ought to Pass with Amendment #0229h: Motion Adopted Voice Vote; House Journal  24, PG. 789 "
674912,2015-03-19,"Introduced and Referred to Energy and Natural Resources; Senate Journal 10 "
674912,2015-04-15,"Hearing: 4/22/15, Room 100, State House, 9:00 a.m.; Senate Calendar 18 "
674912,2015-05-07,"Committee Report: Ought to Pass with Amendment #2015-1586s, 5/14/15; Vote 5-0; Consent Calendar; Senate Calendar 21 "
674912,2015-05-14,"Sen. Bradley Moved to Remove HB 212 from the Consent Calendar "
674912,2015-05-14,"Committee Amendment 1586s, Amendment Adopted, Voice Vote "
674912,2015-05-14,"Sen. Bradley Floor Amendment #2015-1748s, New Title, Amendment Adopted, Voice Vote; Senate Journal 14 "
674912,2015-05-14,"Sen. Daniels Moved to Divide the Question Sections 1 and 34 and 2-34; Senate Journal 14 "
674912,2015-05-14,"The Chair ruled the Question Divisible "
674912,2015-05-14,"Sec. 1 and 34, Regular Calendar 24Y-0N, Motion Adopted "
674912,2015-05-14,"Sec. 2-34, Regular Calendar 20Y-4N, Motion Adopted "
674912,2015-05-14,"Ought to Pass with Amendments 1586s and 1748s, New Title, Motion Adopted, Voice Vote; OT3rdg; Senate Journal 14 "
674912,2015-06-03,"House Concurs with Senate Amendments #1586s and #1748s (Rep Kidder): Motion Adopted DV 226-90; House Journal  44, PG. 1813 "
674912,2015-06-17,"Enrolled Bill Amendment #2162e Adopted, Voice Vote, (In recess of 6/11/2015); Senate Journal 19 "
674912,2015-06-17,"Enrolled Bill Amendment #2015-2162EBA: Amendment Adopted Voice Vote (in recess of 6/11/2015); House Journal  46, PG. 1992 "
674912,2015-06-24,"Enrolled (In recess 6/24/2015); Senate Journal 19 "
674912,2015-06-24,"Enrolled; House Journal  54, PG. 2135 "
674912,2015-06-30,"Signed by the Governor on 6/30/2015; Chapter 186; Section 1 Effective Date 1/1/2016, Remainder Effective 7/1/2015 "
674933,2015-01-08,"Introduced and Referred to Election Law; House Journal  12, PG. 213 "
674933,2015-01-21,"==POSTPONED== Public Hearing: 1/27/2015 10:00 Amendment Legislative Office Building 308 "
674933,2015-01-26,"==RESCHEDULED== Public Hearing: 1/28/2015 10:00 Amendment Legislative Office Building 308 "
674933,2015-01-29,"Subcommittee Work Session: 2/5/2015 1:00 PM Legislative Office Building 308 "
674933,2015-02-05,"Executive Session: 2/10/2015 10:00 Amendment Legislative Office Building 308 "
674933,2015-02-20,"Majority Committee Report: Inexpedient to Legislate for Mar 4 (Vote 10-7; Regular Calendar); House Calendar18, PG. 357 "
674933,2015-02-20,"Minority Committee Report: Ought to Pass "
674933,2015-03-04,"Inexpedient to Legislate: Motion Adopted DV 263-93; House Journal  22, PG. 581-582 "
674955,2015-01-08,"Introduced and Referred to Municipal and County Government; House Journal  12, PG. 212 "
674955,2015-01-29,"Public Hearing: 2/5/2015 11:00 Amendment Legislative Office Building 301 "
674955,2015-02-05,"Executive Session: 2/10/2015 2:00 PM Legislative Office Building 301 "
674955,2015-02-13,"Committee Report: Inexpedient to Legislate for Feb 18 (Vote 12-4; Regular Calendar); House Calendar13, PG. 248 "
674955,2015-02-18,"Recommit (Rep J. Belanger): Motion Adopted Voice Vote; House Journal  20, PG. 520-521 "
674955,2015-03-03,"Majority Committee Report: Ought to Pass with Amendment #2015-0675h for Mar 11 (Vote 14-3; Regular Calendar); House Calendar19, PG. 434 "
674955,2015-03-03,"Minority Committee Report: Inexpedient to Legislate "
674955,2015-03-12,"Amendment #0675h: Amendment Adopted Voice Vote; House Journal  26, PG. 1254-1256 "
674955,2015-03-12,"Ought to Pass with Amendment #0675h: Motion Adopted Voice Vote; House Journal  26, PG. 1254-1256 "
674955,2015-03-19,"Introduced and Referred to Energy and Natural Resources; Senate Journal 10 "
674955,2015-04-01,"Hearing: 4/8/15, Room 100, State House, 9:00 a.m.; Senate Calendar 16 "
674955,2015-04-15,"=== CANCELLED SESSION === Committee Report: Ought to Pass, 4/23/15; Senate Calendar 18 "
674955,2015-04-17,"=== RESCHEDULED === Committee Report: Ought to Pass, 4/30/15; Senate Calendar 19 "
674955,2015-04-30,"Ought to Pass: Motion Adopted, Voice Vote; OT3rdg; Senate Journal 12 "
674955,2015-05-12,"Enrolled (In recess 5/7/2015); Senate Journal 14 "
674955,2015-05-13,"Enrolled (in recess of 5/6/2015); House Journal  41, PG. 1779 "
674955,2015-06-11,"Signed by the Governor on 6/8/2015; Chapter 121; Effective Date 6/8/2015 "
674976,2015-01-08,"Introduced and Referred to Commerce and Consumer Affairs; House Journal  12, PG. 213 "
674976,2015-02-04,"Public Hearing: 2/12/2015 11:45 Amendment Legislative Office Building 302 "
674976,2015-02-12,"Subcommittee Work Session: 2/19/2015 8:00 PM Legislative Office Building 302 "
674976,2015-02-12,"==RESCHEDULED== Work Session: 2/19/2015 8:00 Amendment Legislative Office Building 302 "
674976,2015-02-18,"==RESCHEDULED== Work Session: 2/19/2015 8:30 Amendment Legislative Office Building 302 "
674976,2015-02-20,"Executive Seesion: 3/3/2015 1:00 PM Legislative Office Building 302 "
674976,2015-03-05,"Committee Report: Ought to Pass for Mar 11 (Vote 20-0; Consent Calendar); House Calendar19, PG. 391 "
674976,2015-03-11,"Ought to Pass: Motion Adopted Voice Vote; House Journal  24, PG. 770 "
674976,2015-03-19,"Introduced and Referred to Health and Human Services; Senate Journal 10 "
674976,2015-04-02,"Hearing: 4/7/15, Room 101, Legislative Office Building, 1:20 p.m.; Senate Calendar 16 "
674976,2015-04-29,"Committee Report: Ought to Pass, 5/7/15; Senate Calendar 20 "
674976,2015-05-07,"Ought to Pass: Motion Adopted, Voice Vote; OT3rdg; Senate Journal 13 "
674976,2015-05-19,"Enrolled (In recess 5/14/2015); Senate Journal 15 "
674976,2015-05-19,"Enrolled (in recess of 5/6/2015); House Journal  41, PG. 1781 "
674976,2015-06-03,"Signed by the Governor on 6/2/2015; Chapter 64; Effective Date 8/1/2015 "
674991,2015-01-08,"Introduced and Referred to Education; House Journal  12, PG. 212 "
674991,2015-01-21,"Public Hearing: 2/3/2015 10:30 Amendment Legislative Office Building 207 "
674991,2015-01-29,"===CANCELLED=== Public Hearing: 2/3/2015 10:30 Amendment Legislative Office Building 207 "
674991,2015-01-29,"Public Hearing: 2/12/2015 1:30 PM Legislative Office Building 207 "
674991,2015-02-04,"===CANCELLED=== Public Hearing: 2/12/2015 1:30 PM Legislative Office Building 207 "
674991,2015-02-04,"Public Hearing: 2/12/2015 10:30 Amendment Legislative Office Building 207 "
674991,2015-02-11,"Executive Session: 2/17/2015 10:00 Amendment Legislative Office Building 207 "
674991,2015-02-20,"Majority Committee Report: Ought to Pass with Amendment #2015-0410h for Mar 4 (Vote 17-4; Regular Calendar); House Calendar18, PG. 356-357 "
674991,2015-02-20,"Minority Committee Report: Inexpedient to Legislate "
674991,2015-03-04,"Amendment #0410h: Amendment Adopted Regular Calendar 246-114; House Journal  22, PG. 579-581 "
674991,2015-03-04,"Ought to Pass with Amendment #0410h: Motion Adopted Voice Vote; House Journal  22, PG. 579-581 "
674991,2015-03-05,"Introduced and Referred to Education; Senate Journal 8  "
674991,2015-03-19,"Hearing: 3/24/15, Room 103, Legislative Office Building, 9:40 a.m.; Senate Calendar 14 "
674991,2015-04-16,"=== CANCELLED SESSION === Committee Report: Ought to Pass with Amendment 1180s, New Title, 4/23/15; Senate Calendar 18 "
674991,2015-04-17,"=== RESCHEDULED === Committee Report: Ought to Pass with Amendment #2015-1180s, New Title, 4/30/15; Senate Calendar 19 "
674991,2015-04-30,"Special Order HB 206 to 5/14/15, Without Objection, Motion Adopted; Senate Journal 12 "
674991,2015-05-04,"Committee Report: Ought to Pass with Amendment #2015-1180s, New Title, 5/14/15; Senate Calendar 21 "
674991,2015-05-14,"Committee Amendment 1180s, New Title, Amendment Adopted, Voice Vote "
674991,2015-05-14,"Sen. Kelly Floor Amendment #2015-1741s, Amendment Adopted, Voice Vote; Senate Journal 14 "
674991,2015-05-14,"Sen. Bradley Floor Amendment #2015-1711s, New Title, Amendment Adopted, Voice Vote; Senate Journal 14 "
674991,2015-05-14,"Ought to Pass with Amendments 1180s, 1741, and 1711, New Title, Motion Adopted, Voice Vote; OT3rdg; Senate Journal 14 "
674991,2015-06-03,"House Concurs with Senate Amendments #1180s, #1741s, and #1711s (Rep Ladd): Motion Adopted Voice Vote; House Journal  44, PG. 1812 "
674991,2015-06-18,"Enrolled (In recess 6/11/2015); Senate Journal 19 "
674991,2015-06-18,"Enrolled (in recess of 6/11/2015); House Journal  46, PG. 1993 "
674991,2015-06-30,"Signed by the Governor on 6/26/2015; Chapter 161; Section 6 Effective Date 8/25/2015, Remainder Effective 6/26/2015 "
675005,2015-01-08,"Introduced and Referred to Executive Departments and Administration; House Journal  12, PG. 213 "
675005,2015-01-21,"==POSTPONED== Public Hearing: 1/27/2015 11:00 Amendment Legislative Office Building 306 "
675005,2015-01-26,"==RESCHEDULED== Public Hearing: 1/28/2015 11:00 Amendment Legislative Office Building 306 "
675005,2015-01-29,"Executive Session: 2/3/2015 2:30 PM Legislative Office Building 306 "
675005,2015-02-11,"Committee Report: Ought to Pass for Feb 18 (Vote 15-0; Regular Calendar); House Calendar13, PG. 246 "
675005,2015-02-18,"Ought to Pass: Motion Adopted Voice Vote; House Journal  20, PG. 513 "
675005,2015-02-18,"Referred to Finance "
675005,2015-02-20,"Division I Work Session: 3/2/2015 3:30 PM Legislative Office Building 212 "
675005,2015-03-03,"Executive Session: 3/5/2015 11:00 Amendment Legislative Office Building 210-211 "
675005,2015-03-05,"Committee Report: Ought to Pass for Mar 11 (Vote 23-0; Consent Calendar); House Calendar19, PG. 401 "
675005,2015-03-11,"Ought to Pass: Motion Adopted Voice Vote; House Journal  24, PG. 788 "
675005,2015-03-19,"Introduced and Referred to Executive Departments and Administration; Senate Journal 10 "
675005,2015-03-25,"Hearing: 4/1/15, Room 101, Legislative Office Building, 9:00 a.m.; Senate Calendar 15 "
675005,2015-04-01,"Committee Report: Ought to Pass, 4/9/15; Senate Calendar 16 "
675005,2015-04-09,"Sen. Sanborn Moved Laid on Table, Motion Failed, Voice Vote; Senate Journal 11 "
675005,2015-04-09,"Sen. Bradley moved Rerefer to Committee, Motion Adopted, Voice Vote, Senate Journal 11 "
675005,2015-05-07,"Committee Report: Ought to Pass with Amendment #2015-1600s, New Title, 5/14/15; Senate Calendar 21 "
675005,2015-05-14,"Committee Amendment 1600s, New Title, Amendment Adopted, Voice Vote "
675005,2015-05-14,"Ought to Pass with Amendment 1600s, New Title, Regular Calendar 16Y-8N, Motion Adopted; Refer to Finance Rule 4-5; Senate Journal 14 "
675005,2015-05-14,"Sen. Bradley Moved to Reconsider the following actions taken by this body: Rescind Order to the Committee on Finance, Vote on Ought to Pass with Amendment 1600s, Motion Adopted, Voice Vote; Senate Journal 14 "
675005,2015-05-14,"Ought to Pass with Amendment 1600s, New Title, Regular Calendar 17Y-7N, Motion Adopted; Refer to Finance Rule 4-5; Senate Journal 14 "
675005,2015-05-21,"Committee Report: Rereferred to Committee, 5/28/15; Senate Calendar 23 "
675005,2015-05-28,"Rereferred to Committee, Motion Failed, Voice Vote, Senate Journal 16 "
675005,2015-05-28,"Sen. D'Allesandro Moved Ought to Pass "
675005,2015-05-28,"Sen. D'Allesandro Floor Amendment #2015-1967s, New Title, Amendment Failed, Voice Vote; Senate Journal 16 "
675005,2015-05-28,"Sen. Bradley moved to Rerefer to Committee, Regular Calendar 14Y-7N, Motion Adopted; Senate Journal 16 "
675881,2015-01-08,"Introduced and Referred to Education; Senate Journal 4  "
675881,2015-01-15,"Hearing:=== CANCELLED === 1/27/15, Room 103, Legislative Office Building, 9:00 a.m.; Senate Calendar 6 "
675881,2015-01-26,"Hearing:=== RESCHEDULED === 2/5/15, Room 103, Legislative Office Building, 9:00 a.m.; Senate Calendar 8 "
675881,2015-02-05,"Committee Report: Inexpedient to Legislate, 2/12/15; Senate Calendar 9 "
675881,2015-02-12,"Inexpedient to Legislate, Motion Adopted, Voice Vote === BILL KILLED ===; Senate Journal 5 "
675892,2015-01-08,"Introduced and Referred to Public and Municipal Affairs; Senate Journal 4  "
675892,2015-01-20,"Hearing:=== TIME CHANGE === 1/28/15, Room 102, Legislative Office Building, 12:45 p.m.; Senate Calendar 7 "
675892,2015-03-05,"Committee Report: Ought to Pass with Amendment #2015-0739s, 3/12/15; Senate Calendar 12 "
675892,2015-03-12,"Committee Amendment 0739s, Amendment Adopted, Voice Vote "
675892,2015-03-12,"Ought to Pass with Amendment 0739s, Motion Adopted, Voice Vote; OT3rdg; Senate Journal 8  "
675892,2015-03-12,"Introduced and Referred to Municipal and County Government; House Journal  26, PG. 1275 "
675892,2015-03-31,"Public Hearing: 4/14/2015 10:45 Amendment Legislative Office Building 301 "
675892,2015-03-31,"==CANCELED==Executive Session: 4/16/2015 10:00 Amendment Legislative Office Building 301 "
675892,2015-04-15,"==CANCELLED==Executive Session: 4/23/2015 10:00 Amendment Legislative Office Building 301 "
675892,2015-04-28,"Executive Session: 5/12/2015 10:00 Amendment Legislative Office Building 301 "
675892,2015-05-12,"Committee Report: Inexpedient to Legislate for Jun 3 (Vote 14-1; Consent Calendar); House Calendar 39, PG. 1630-1631 "
675892,2015-06-03,"Inexpedient to Legislate: Motion Adopted Voice Vote; House Journal  44, PG. 1830 "
675907,2015-01-08,"Introduced and Referred to Judiciary; Senate Journal 4  "
675907,2015-01-14,"Hearing: 1/20/15, Room 100, State House, 10:00 a.m.; Senate Calendar 6 "
675907,2015-03-18,"Committee Report: Inexpedient to Legislate, 3/26/15; Senate Calendar 14 "
675907,2015-03-26,"Inexpedient to Legislate, Motion Adopted, Voice Vote === BILL KILLED ===; Senate Journal 10 "
675920,2015-01-08,"Introduced and Referred to Transportation; Senate Journal 4  "
675920,2015-01-15,"Hearing: 1/20/15, Room 103, Legislative Office Building, 1:15 p.m.; Senate Calendar 6 "
675920,2015-02-05,"Committee Report: Ought to Pass with Amendment #2015-0225s, 2/12/15; Senate Calendar 9 "
675920,2015-02-12,"Committee Amendment 0225s, Amendment Adopted, Voice Vote "
675920,2015-02-12,"Ought to Pass with Amendment 0225s, Motion Adopted, Voice Vote; OT3rdg; Senate Journal 5  "
675920,2015-03-04,"Introduced and Referred to Transportation; House Journal  22, PG. 629 "
675920,2015-03-26,"Public Hearing: 4/7/2015 11:00 Amendment Legislative Office Building 203 "
675920,2015-04-08,"Subcommittee Work Session: 4/14/2015 11:00 Amendment Legislative Office Building 203 "
675920,2015-04-14,"Executive Session: 4/21/2015 1:00 PM Legislative Office Building 203==RECESSED== "
675920,2015-04-22,"Continued Executive Session: 4/28/2015 11:00 Amendment Legislative Office Building 203 "
675920,2015-04-29,"Committee Report: Inexpedient to Legislate for May 6 (Vote 15-0; Consent Calendar); House Calendar 33, PG. 1509 "
675920,2015-05-06,"Remove from Consent Calendar (Rep Steven Smith); House Journal  41, PG. 1748 "
675920,2015-05-06,"Recommit (Rep Steven Smith): Motion Adopted Voice Vote; House Journal  41, PG. 1776 "
675920,2015-05-13,"Executive Session: 5/20/2015 1:00 PM Legislative Office Building 203 "
675920,2015-05-21,"Committee Report: Ought to Pass with Amendment #2015-1457h for Jun 3 (Vote 10-5; Regular Calendar); House Calendar 39, PG. 1640 "
675920,2015-06-03,"Amendment #1457h: Amendment Adopted Voice Vote; House Journal  44, PG. 1947-1948 "
675920,2015-06-03,"Ought to Pass with Amendment #1457h: Motion Adopted Voice Vote; House Journal  44, PG. 1947-1948 "
675920,2015-06-04,"Sen. Stiles Concurs with House Amendments #1457h, Motion Adopted, Voice Vote; Senate Journal 17 "
675920,2015-06-18,"Enrolled (in recess of 6/11/2015); House Journal  46, PG. 1993 "
675920,2015-06-18,"Enrolled (In recess 6/11/2015); Senate Journal 19 "
675920,2015-06-30,"Signed by the Governor on 06/26/2015; Chapter 0178; Effective 08/25/2015 "
675937,2015-01-08,"Introduced and Referred to Executive Departments and Administration; Senate Journal 4  "
675937,2015-01-14,"Hearing:=== TIME CHANGE === 1/28/15, Room 101, Legislative Office Building, 12:00 p.m.; Senate Calendar 6 "
675937,2015-02-05,"Committee Report: Inexpedient to Legislate, 2/12/15; Vote 5-0; Consent Calendar; Senate Calendar 9 "
675937,2015-02-12,"Inexpedient to Legislate, Motion Adopted, Voice Vote === BILL KILLED ===; Senate Journal 5 "
675953,2015-01-08,"Introduced and Referred to Commerce; Senate Journal 4  "
675953,2015-01-29,"Hearing:===CANCELLED=== 2/17/15, Room 100, State House, 2:00 p.m.; Senate Calendar 8 "
675953,2015-02-20,"Hearing: === RESCHEDULED === 3/2/15, Room 100, State House, 1:00 p.m.; Senate Calendar 11 "
675953,2015-03-04,"Committee Report: Ought to Pass with Amendment #2015-0704s, 3/12/15; Vote 5-0; Consent Calendar; Senate Calendar 12 "
675953,2015-03-12,"Committee Amendment 0704s, Amendment Adopted, Voice Vote "
675953,2015-03-12,"Ought to Pass with Amendment 0704s, Motion Adopted, Voice Vote; OT3rdg; Senate Journal 8  "
675953,2015-03-12,"Introduced and Referred to Commerce and Consumer Affairs; House Journal  26, PG. 1275 "
675953,2015-03-19,"Public Hearing: 3/24/2015 2:00 PM Legislative Office Building 302 "
675953,2015-04-07,"Subcommittee Work Session: 4/28/2015 1:15 PM Legislative Office Building 302 "
675953,2015-05-06,"Executive Session: 5/12/2015 1:15 PM Legislative Office Building 302 "
675953,2015-05-26,"Majority Committee Report: Inexpedient to Legislate for Jun 3 (Vote 11-8; Regular Calendar); House Calendar 39, PG. 1633 "
675953,2015-05-26,"Minority Committee Report: Ought to Pass "
675953,2015-06-03,"Inexpedient to Legislate: Motion Adopted DV 188-127; House Journal  44, PG. 1833 "
675967,2015-01-08,"Introduced and Referred to Energy and Natural Resources; Senate Journal 4  "
675967,2015-01-15,"Hearing: 1/21/15, Room 100, State House, 9:15 a.m.; Senate Calendar 6 "
675967,2015-02-04,"Committee Report: Ought to Pass with Amendment #2015-0192s, 2/12/15; Senate Calendar 9 "
675967,2015-02-12,"Committee Amendment 0192s, Amendment Adopted, Voice Vote "
675967,2015-02-12,"Ought to Pass with Amendment 0192s, Motion Adopted, Voice Vote; OT3rdg; Senate Journal 5  "
675967,2015-03-04,"Introduced and Referred to Science, Technology and Energy; House Journal  22, PG. 629 "
675967,2015-03-18,"Public Hearing: 3/24/2015 1:00 PM Legislative Office Building 304 "
675967,2015-04-01,"Executive Session: 4/7/2015 10:00 Amendment Legislative Office Building 304 "
675967,2015-04-09,"Committee Report: Ought to Pass with Amendment #2015-1259h for Apr 15 (Vote 13-8; Regular Calendar); House Calendar 29, PG. 1310 "
675967,2015-04-15,"Amendment #1259h: Amendment Adopted Voice Vote; House Journal  34, PG. 1559 "
675967,2015-04-15,"Ought to Pass with Amendment #1259h: Motion Adopted DV 218-125; House Journal  34, PG. 1559 "
675967,2015-05-14,"Sen. Bradley Concurs with House Amendment #1259h, Motion Adopted, Voice Vote; Senate Journal 14 "
675967,2015-05-21,"Enrolled Bill Amendment #2015-1842EBA: Amendment Adopted Voice Vote (in recess of 5/6/2015); House Journal  41, PG. 1782 "
675967,2015-05-26,"Enrolled Bill Amendment #2015-1842e Adopted, Voice Vote, (In recess of 5/21/2015); Senate Journal 16 "
675967,2015-06-03,"Enrolled "
675967,2015-06-03,"Enrolled (In recess 5/28/2015); Senate Journal 17 "
675967,2015-06-16,"Signed by the Governor on 06/12/15; Chapter 0148 "
675967,2015-06-16,"I. Section 2 Effective 11/01/15 "
675967,2015-06-16,"II. Remainder Effective 06/12/15 "
675981,2015-01-08,"Introduced and Referred to Finance; Senate Journal 4  "
675981,2015-01-20,"Hearing: 2/3/15, Room 103, State House, 2:20 p.m.; Senate Calendar 7 "
675981,2015-02-05,"Committee Report: Rereferred to Committee, 2/12/15; Senate Calendar 9 "
675981,2015-02-12,"Rereferred to Committee, Motion Adopted, Voice Vote, Senate Journal 5  "
675996,2015-01-08,"Introduced and Referred to Public and Municipal Affairs; Senate Journal 4  "
675996,2015-03-04,"Hearing: 3/11/15, Room 102, Legislative Office Building, 9:00 a.m.; Senate Calendar 12 "
675996,2015-03-18,"Committee Report: Ought to Pass, 3/26/15; Senate Calendar 14 "
675996,2015-03-26,"Sen. Birdsell moved to Rerefer to Committee, Motion Adopted, Voice Vote; Senate Journal 10 "
676013,2015-01-08,"Introduced and Referred to Judiciary; Senate Journal 4  "
676013,2015-01-14,"Hearing: 1/22/15, Room 100, State House, 9:40 a.m.; Senate Calendar 6 "
676013,2015-03-18,"Committee Report: Rereferred to Committee, 3/26/15; Vote 5-0; Consent Calendar; Senate Calendar 14 "
676013,2015-03-26,"Rereferred to Committee, Motion Adopted, Voice Vote, Senate Journal 10 "
676026,2015-01-08,"Introduced and Referred to Public and Municipal Affairs; Senate Journal 4  "
676026,2015-01-20,"Hearing:=== TIME CHANGE === 1/28/15, Room 102, Legislative Office Building, 1:00 p.m.; Senate Calendar 7 "
676026,2015-02-05,"Committee Report: Ought to Pass with Amendment #2015-0107s, 2/12/15; Senate Calendar 9 "
676026,2015-02-12,"Committee Amendment 0107s, Not Voted On; Senate Journal 5  "
676026,2015-02-12,"Sen. Boutin Moved Laid On Table, Motion Adopted, Voice Vote: Senate Journal 5  "
676044,2015-01-08,"Introduced and Referred to Transportation; Senate Journal 4  "
676044,2015-01-15,"Hearing: 1/20/15, Room 103, Legislative Office Building, 1:00 p.m.; Senate Calendar 6 "
676044,2015-01-22,"Committee Report: Ought to Pass with Amendment #2015-0040s, 1/29/15; Vote 5-0; Consent Calendar; Senate Calendar 7 "
676044,2015-01-29,"Committee Amendment 0040s, Amendment Adopted, Voice Vote "
676044,2015-01-29,"Ought to Pass with Amendment 0040s, Motion Adopted, Voice Vote; OT3rdg; Senate Journal 4  "
676044,2015-03-04,"Introduced and Referred to Resources, Recreation and Development; House Journal  22, PG. 629 "
676044,2015-03-11,"Public Hearing: 3/18/2015 11:30 Amendment Legislative Office Building 305 "
676044,2015-03-18,"Subcommittee Work Session: 3/24/2015 11:15 Amendment Legislative Office Building 305 "
676044,2015-03-19,"===CANCELLED=== Work Session: 3/24/2015 11:15 Amendment Legislative Office Building 305 "
676044,2015-03-25,"Subcommittee Work Session: 3/31/2015 11:15 Amendment Legislative Office Building 305 "
676044,2015-04-01,"Subcommittee Work Session: 4/7/2015 10:30 Amendment Legislative Office Building 305 "
676044,2015-04-09,"Executive Session: 4/7/2015 Legislative Office Building 305 "
676044,2015-04-09,"Committee Report: Ought to Pass with Amendment #2015-1217h for Apr 15 (Vote 19-0; Consent Calendar); House Calendar 29, PG. 1306 "
676044,2015-04-15,"Amendment #1217h: Amendment Adopted Voice Vote; House Journal  34, PG. 1548-1549 "
676044,2015-04-15,"Ought to Pass with Amendment #1217h: Motion Adopted Voice Vote; House Journal  34, PG. 1548-1549 "
676044,2015-04-30,"Sen. Stiles Concurs with House Amendment #1217h, Motion Adopted, Voice Vote; Senate Journal 12 "
676044,2015-05-06,"Enrolled Bill Amendment #2015-1635-EBA: Amendment Adopted Voice Vote; House Journal  41, PG. 1778 "
676044,2015-05-14,"Enrolled Bill Amendment #2015-1635e Adopted, Voice Vote, New Title, (In recess of 5/14/2015); Senate Journal 15 "
676044,2015-05-21,"Enrolled (in recess of 5/6/2015); House Journal  41, PG. 1782 "
676044,2015-05-21,"Enrolled (In recess 5/21/2015); Senate Journal 16 "
676044,2015-06-11,"Signed by the Governor on 06/08/2015; Chapter 0116; Effective 06/08/2015 "
676060,2015-01-08,"Introduced and Referred to Commerce; Senate Journal 4  "
676060,2015-01-29,"Hearing:===CANCELLED=== 2/17/15, Room 100, State House, 1:20 p.m.; Senate Calendar 8 "
676060,2015-02-20,"Hearing: === RESCHEDULED === 3/3/15, Room 100, State House, 1:20 p.m.; Senate Calendar 11 "
676060,2015-03-04,"Committee Report: Ought to Pass, 3/12/15; Senate Calendar 12 "
676060,2015-03-12,"Ought to Pass: Motion Adopted, Voice Vote; OT3rdg; Senate Journal 8  "
676060,2015-03-12,"The Chair Recinded OT3rdg; Senate Journal 8  "
676060,2015-03-12,"Sen. Bradley Moved Reconsideration on Ought to Pass, Motion Adopted, Voice Vote; Senate Journal 8  "
676060,2015-03-12,"Ought to Pass: Regular Calendar 24Y-0N, Motion Adopted; OT3rdg; Senate Journal 8  "
676060,2015-03-12,"Introduced and Referred to Commerce and Consumer Affairs; House Journal  26, PG. 1275 "
676060,2015-03-25,"Public Hearing: 4/2/2015 11:00 Amendment Legislative Office Building 302 "
676060,2015-04-29,"Subcommittee Work Session: 5/7/2015 10:00 Amendment Legislative Office Building 302 "
676060,2015-05-07,"Subcommittee Work Session: 5/12/2015 10:30 Amendment Legislative Office Building 302 "
676060,2015-05-13,"Executive Session: 5/19/2015 1:15 PM Legislative Office Building 302 "
676060,2015-05-19,"Retained in Committee "
676060,2015-09-28,"Retained Bill - Subcommittee Work Session: 10/27/2015 10:00 Amendment Legislative Office Building 302 "
676060,2015-09-29,"Executive Session: 10/27/2015 1:15 PM Legislative Office Building 302 "
676060,2015-11-12,"Committee report: Refer to Interim Study for Jan 6 (Vote 13-4; Regular Calendar); House Calendar 67, PG. 14 "
676074,2015-01-08,"Introduced and Referred to Education; Senate Journal 4  "
676074,2015-01-14,"Hearing: 1/20/15, Room 103, Legislative Office Building, 9:00 a.m.; Senate Calendar 6 "
676074,2015-02-04,"Committee Report: Ought to Pass, 2/12/15; Vote 5-0; Consent Calendar; Senate Calendar 9 "
676074,2015-02-12,"Ought to Pass: Motion Adopted, Voice Vote; OT3rdg; Senate Journal 5  "
676074,2015-03-04,"Introduced and Referred to Education; House Journal  22, PG. 629 "
676074,2015-03-17,"Public Hearing: 3/24/2015 9:50 Amendment Legislative Office Building 207 "
676074,2015-03-24,"Executive Session: 3/31/2015 11:15 Amendment Legislative Office Building 207 "
676074,2015-04-08,"Committee Report: Ought to Pass for Apr 15 (Vote 21-0; Consent Calendar); House Calendar 29, PG. 1301 "
676074,2015-04-15,"Ought to Pass: Motion Adopted Voice Vote; House Journal  34, PG. 1534 "
676074,2015-04-29,"Enrolled; House Journal  36, PG. 1597 "
676074,2015-04-29,"Enrolled (In recess 4/9/2015); Senate Journal 12 "
676074,2015-05-08,"Signed by the Governor on 05/05/2015; Chapter 0020; Effective 07/04/2015 "
676089,2015-01-08,"Introduced and Referred to Health and Human Services; Senate Journal 4  "
676089,2015-01-15,"Hearing: 1/20/15, Room 101, Legislative Office Building, 1:00 p.m.; Senate Calendar 6 "
676089,2015-02-05,"Committee Report: Ought to Pass, 2/12/15; Senate Calendar 9 "
676089,2015-02-12,"Ought to Pass: Motion Adopted, Voice Vote; OT3rdg; Senate Journal 5  "
676089,2015-03-04,"Introduced and Referred to Health, Human Services and Elderly Affairs; House Journal  22, PG. 629 "
676089,2015-03-18,"Public Hearing: 3/24/2015 11:00 Amendment Legislative Office Building 205 "
676089,2015-03-24,"Subcommittee Work Session: 3/31/2015 9:00 Amendment Legislative Office Building 205 "
676089,2015-03-25,"==CANCELED==Executive Session: 4/2/2015 10:30 Amendment Legislative Office Building 205 "
676089,2015-04-01,"Executive Session: 4/7/2015 10:30 Amendment Legislative Office Building 205 "
676089,2015-04-09,"Committee Report: Ought to Pass with Amendment #2015-1227h (NT) for Apr 15 (Vote 19-0; Consent Calendar); House Calendar 29, PG. 1304 "
676089,2015-04-15,"Amendment #1227h: Amendment Adopted Voice Vote; House Journal  34, PG. 1540-1541 "
676089,2015-04-15,"Ought to Pass with Amendment #1227h: Motion Adopted Voice Vote; House Journal  34, PG. 1540-1541 "
676089,2015-05-14,"Sen. Sanborn Concurs with House Amendment #1227h, New Title, Motion Adopted, Voice Vote; Senate Journal 14 "
676089,2015-05-21,"Enrolled Bill Amendment #2015-1839EBA: Amendment Adopted Voice Vote (in recess of 5/6/2015); House Journal  41, PG. 1782 "
676089,2015-05-26,"Enrolled Bill Amendment #2015-1839e Adopted, Voice Vote, (In recess of 5/21/2015); Senate Journal 16 "
676089,2015-06-03,"Enrolled "
676089,2015-06-03,"Enrolled (In recess 5/28/2015); Senate Journal 17 "
676089,2015-06-16,"Signed by the Governor on 06/12/2015; Chapter 0147 "
676089,2015-06-16,"I. Section 3 Effective 11/01/15 "
676089,2015-06-16,"II. Remainder Effective 06/12/15 "
676104,2015-01-08,"Introduced and Referred to Commerce; Senate Journal 4  "
676104,2015-01-22,"Hearing:=== CANCELLED === 1/27/15, Room 100, State House, 2:00 p.m.; Senate Calendar 7 "
676104,2015-01-26,"Hearing:=== RESCHEDULED === 2/3/15, Room 100, State House, 2:00 p.m.; Senate Calendar 8 "
676104,2015-02-20,"Committee Report: Ought to Pass with Amendment #2015-0507s, 3/5/15; Vote 5-0; Consent Calendar; Senate Calendar 11 "
676104,2015-03-05,"Committee Amendment 0507s, Amendment Adopted, Voice Vote "
676104,2015-03-05,"Ought to Pass with Amendment 0507s, Motion Adopted, Voice Vote; OT3rdg; Senate Journal 7  "
676104,2015-03-11,"Introduced and Referred to Commerce and Consumer Affairs; House Journal  26, PG. 1274 "
676104,2015-03-25,"Public Hearing: 4/2/2015 10:30 Amendment Legislative Office Building 302 "
676104,2015-04-07,"Subcommittee Work Session: 4/28/2015 1:15 PM Legislative Office Building 302 "
676104,2015-05-06,"Executive Session: 5/12/2015 1:15 PM Legislative Office Building 302 "
676104,2015-05-20,"Committee Report: Ought to Pass with Amendment #2015-1366h (NT) for Jun 3 (Vote 19-0; Consent Calendar); House Calendar 39, PG. 1628 "
676104,2015-06-03,"Amendment #1366h: Amendment Adopted Voice Vote; House Journal  44, PG. 1816-1817 "
676104,2015-06-03,"Ought to Pass with Amendment #1366h: Motion Adopted Voice Vote; House Journal  44, PG. 1816-1817 "
676104,2015-06-04,"Sen. Prescott Concurs with House Amendment #1366h, Motion Adopted, Voice Vote; Senate Journal 17 "
676104,2015-06-18,"Enrolled (in recess of 6/11/2015); House Journal  46, PG. 1993 "
676104,2015-06-18,"Enrolled (In recess 6/11/2015); Senate Journal 19 "
676104,2015-06-30,"Signed by the Governor on 06/26/2015; Chapter 0177; Effective 01/01/2016 "
676120,2015-01-08,"Introduced and Referred to Executive Departments and Administration; Senate Journal 4  "
676120,2015-01-14,"Hearing:=== TIME CHANGE === 1/28/15, Room 101, Legislative Office Building, 12:15 p.m.; Senate Calendar 6 "
676120,2015-02-05,"Committee Report: Ought to Pass with Amendment #2015-0102s, New Title, 2/12/15; Vote 5-0; Consent Calendar; Senate Calendar 9 "
676120,2015-02-12,"Committee Amendment 0102s, New Title, Amendment Adopted, Voice Vote "
676120,2015-02-12,"Ought to Pass with Amendment 0102s, New Title, Motion Adopted, Voice Vote; OT3rdg; Senate Journal 5  "
676120,2015-03-04,"Introduced and Referred to Commerce and Consumer Affairs; House Journal  22, PG. 629 "
676120,2015-03-18,"Public Hearing: 3/24/2015 10:30 Amendment Legislative Office Building 302 "
676120,2015-04-07,"Subcommittee Work Session: 4/14/2015 10:00 Amendment Legislative Office Building 302 "
676120,2015-05-06,"Executive Session: 5/12/2015 1:15 PM Legislative Office Building 302 "
676120,2015-05-20,"Committee Report: Ought to Pass for Jun 3 (Vote 19-0; Consent Calendar); House Calendar 39, PG. 1628 "
676120,2015-06-03,"Ought to Pass: Motion Adopted Voice Vote; House Journal  44, PG. 1822 "
676120,2015-06-18,"Enrolled (in recess of 6/11/2015); House Journal  46, PG. 1993 "
676120,2015-06-18,"Enrolled (In recess 6/11/2015); Senate Journal 19 "
676120,2015-06-30,"Signed by the Governor on 06/26/2015; Chapter 0179; Effective 06/26/2015 "
676135,2015-01-08,"Introduced and Referred to Transportation; Senate Journal 4  "
676135,2015-01-22,"Hearing:=== CANCELLED === 1/27/15, Room 103, Legislative Office Building, 1:45 p.m.; Senate Calendar 7 "
676135,2015-01-26,"Hearing:=== RESCHEDULED === 2/5/15, Room 103, Legislative Office Building, 1:45 p.m.; Senate Calendar 8 "
676135,2015-02-18,"Committee Report: Ought to Pass, 3/5/15; Senate Calendar 11 "
676135,2015-03-05,"Ought to Pass: Motion Adopted, Voice Vote; OT3rdg; Senate Journal 7  "
676135,2015-03-11,"Introduced and Referred to Transportation; House Journal  26, PG. 1274 "
676135,2015-03-26,"Public Hearing: 4/7/2015 2:30 PM Legislative Office Building 203 "
676135,2015-04-14,"Executive Session: 4/21/2015 1:00 PM Legislative Office Building 203==RECESSED== "
676135,2015-04-22,"Continued Executive Session: 4/28/2015 11:00 Amendment Legislative Office Building 203 "
676135,2015-04-29,"Committee Report: Ought to Pass with Amendment #2015-1353h for May 6 (Vote 13-1; Consent Calendar); House Calendar 33, PG. 1509 "
676135,2015-05-06,"Amendment #1353h: Amendment Adopted Voice Vote; House Journal  41, PG. 1757 "
676135,2015-05-06,"Ought to Pass with Amendment #1353h: Motion Adopted Voice Vote; House Journal  41, PG. 1757 "
676135,2015-05-14,"Sen. Stiles Concurs with House Amendment #1353h, Motion Adopted, Voice Vote; Senate Journal 14 "
676135,2015-06-03,"Enrolled "
676135,2015-06-03,"Enrolled (In recess 5/28/2015); Senate Journal 17 "
676135,2015-06-16,"Signed by the Governor on 06/12/2015; Chapter 0149; Effective 08/11/2015 "
676150,2015-01-08,"Introduced and Referred to Public and Municipal Affairs; Senate Journal 4  "
676150,2015-02-04,"Hearing: 2/11/15, Room 102, Legislative Office Building, 11:15 a.m.; Senate Calendar 9 "
676150,2015-02-11,"Committee Report: Ought to Pass with Amendment #2015-0338s, 2/19/15; Vote 5-0; Consent Calendar; Senate Calendar 10 "
676150,2015-02-19,"Sen. Fuller Clark Moved to Remove SB 74 from the Consent Calendar "
676150,2015-02-19,"Committee Amendment 0338s, Amendment Adopted, Voice Vote "
676150,2015-02-19,"Ought to Pass with Amendment 0338s, Regular Calendar 24Y-0N, Motion Adopted; OT3rdg; Senate Journal 6  "
676150,2015-03-04,"Introduced and Referred to Municipal and County Government; House Journal  22, PG. 629 "
676150,2015-03-17,"Public Hearing: 3/24/2015 10:45 Amendment Legislative Office Building 301 "
676150,2015-03-17,"Executive Session: 3/26/2015 10:00 Amendment Legislative Office Building 301 "
676150,2015-03-27,"Committee Report: Inexpedient to Legislate for Apr 15 (Vote 11-4; Regular Calendar); House Calendar 29, PG. 1309 "
676150,2015-04-15,"Inexpedient to Legislate: Motion Adopted Voice Vote; House Journal  34, PG. 1559 "
676165,2015-01-08,"Introduced and Referred to Health and Human Services; Senate Journal 4  "
676165,2015-01-15,"Hearing: 1/20/15, Room 101, Legislative Office Building, 1:40 p.m.; Senate Calendar 6 "
676165,2015-02-05,"Committee Report: Rereferred to Committee, 2/12/15; Senate Calendar 9 "
676165,2015-02-12,"Special Order SB 67 to 2/19/15, Without Objection, Motion Adopted "
676165,2015-02-12,"Committee Report: Rereferred to Committee, 2/19/15; Senate Calendar 10 "
676165,2015-02-19,"Rereferred to Committee Not Voted On; Senate Journal 6  "
676165,2015-02-19,"Sen. Sanborn Moved Laid On Table, Motion Adopted, Voice Vote: Senate Journal 6  "
676165,2015-03-19,"Sen. Bradley Moved Remove From Table, Motion Adopted, Voice Vote; Senate Journal 9  "
676165,2015-03-19,"Rereferred to Committee, Motion Failed, Voice Vote "
676165,2015-03-19,"Sen. Carson moved Ought to Pass; Senate Journal 9  "
676165,2015-03-19,"Sen. Carson Floor Amendment #2015-1034s, New Title, Amendment Adopted, Voice Vote "
676165,2015-03-19,"Ought to Pass with Amendment 1034s, New Title, Motion Adopted, Voice Vote; OT3rdg; Senate Journal 9  "
676165,2015-03-24,"Introduced and Referred to Health, Human Services and Elderly Affairs (in recess of 3/12/2015); House Journal  26, PG. 1276 "
676165,2015-03-24,"Public Hearing: 3/31/2015 10:30 Amendment Legislative Office Building 205 "
676165,2015-03-25,"==CANCELED==Executive Session: 4/2/2015 10:30 Amendment Legislative Office Building 205 "
676165,2015-04-01,"Executive Session: 4/7/2015 10:30 Amendment Legislative Office Building 205 "
676165,2015-04-07,"Retained in Committee "
676165,2015-05-12,"Retained Bill - Full Committee Work Session: 5/19/2015 10:30 Amendment Legislative Office Building 205 "
676165,2015-09-09,"Retained Bill - Subcommittee Work Session: 9/17/2015 10:00 Amendment Legislative Office Building 205 "
676165,2015-09-29,"Retained Bill - Full Committee Work Session: 11/5/2015 10:00 Amendment Legislative Office Building 205 "
676165,2015-09-29,"Executive Session: 11/5/2015 1:00 PM Legislative Office Building 205 "
676165,2015-11-12,"Committee Report: Inexpedient to Legislate for Jan 6 (Vote 13-0; Consent Calendar); House Calendar 67, PG. 8 "
676176,2015-01-08,"Introduced and Referred to Executive Departments and Administration; Senate Journal 4  "
676176,2015-01-14,"Hearing: 1/22/15, Room 100, State House, 1:00 p.m.; Senate Calendar 6 "
676176,2015-03-11,"Committee Report: Inexpedient to Legislate, 3/19/15; Vote 5-0; Consent Calendar; Senate Calendar 13 "
676176,2015-03-19,"Inexpedient to Legislate, Motion Adopted, Voice Vote === BILL KILLED ===; Senate Journal 9  "
676199,2015-01-08,"Introduced and Referred to Public and Municipal Affairs; Senate Journal 4  "
676199,2015-02-11,"Hearing: 2/18/15, Room 102, Legislative Office Building, 9:45 a.m.; Senate Calendar 10 "
676199,2015-03-04,"Committee Report: Ought to Pass, 3/12/15; Senate Calendar 12 "
676199,2015-03-12,"Ought to Pass Not Voted On "
676199,2015-03-12,"Sen. Stiles Moved Laid on Table, Motion Adopted, Voice Vote; Senate Journal 8  "
676199,2015-03-26,"Sen. Bradley Moved Remove From Table, Motion Adopted, Voice Vote; Senate Journal 10 "
676199,2015-03-26,"Sen. Birdsell Floor Amendment #2015-1119s, Amendment Adopted, Voice Vote; Senate Journal 10 "
676199,2015-03-26,"Ought to Pass with Amendment 1119s, Motion Adopted, Voice Vote; OT3rdg; Senate Journal 10 "
676199,2015-03-31,"Introduced and Referred to Executive Departments and Administration (in recess of 3/25/2015); House Journal  28, PG. 1299 "
676199,2015-04-01,"Public Hearing: 4/7/2015 10:30 Amendment Legislative Office Building 306 "
676199,2015-04-01,"Executive Session: 4/7/2015 1:00 PM Legislative Office Building 306 "
676199,2015-04-07,"Retained in Committee "
676199,2015-05-05,"Retained Bill - Full Committee Work Session: 5/12/2015 10:00 Amendment Legislative Office Building 306 "
676199,2015-05-12,"Retained Bill - Subcommittee Work Session: 5/19/2015 10:00 Amendment Legislative Office Building 308 "
676199,2015-09-08,"Executive Session: 10/21/2015 10:00 Amendment Legislative Office Building 306 "
676199,2015-10-07,"Retained Bill - Full Committee Work Session: 10/21/2015 10:00 Amendment Legislative Office Building 306 "
676199,2015-10-07,"Executive Session: 10/21/2015 11:00 Amendment Legislative Office Building 306 "
676199,2015-11-12,"Majority Committee Report: Inexpedient to Legislate for Jan 6 (Vote 8-3; Regular Calendar); House Calendar 67, PG. 22 "
676199,2015-11-17,"Minority Committee Report: Ought to Pass "
676214,2015-01-08,"Introduced and Referred to Executive Departments and Administration; Senate Journal 4  "
676214,2015-01-14,"Hearing: 1/22/15, Room 100, State House, 2:05 p.m.; Senate Calendar 6 "
676214,2015-02-05,"Committee Report: Rereferred to Committee, 2/12/15; Vote 5-0; Consent Calendar; Senate Calendar 9 "
676214,2015-02-12,"Special Order SB 66 to 2/19/15, Without Objection, Motion Adopted "
676214,2015-02-12,"Committee Report: Rereferred to Committee, 2/19/15; Vote 5-0; Consent Calendar; Senate Calendar 10 "
676214,2015-02-19,"Sen. D’Allesandro Moved to Remove SB 66 from the Consent Calendar "
676214,2015-02-19,"Rereferred to Committee, Motion Adopted, Voice Vote, Senate Journal 6  "
676214,2015-11-19,"Committee Report: Ought to Pass with Amendment #2015-3020s, New Title, 1/6/16; Senate Calendar 49 "
676229,2015-01-08,"Introduced and Referred to Transportation; Senate Journal 4  "
676229,2015-01-22,"Hearing:=== CANCELLED === 1/27/15, Room 103, Legislative Office Building, 2:00 p.m.; Senate Calendar 7 "
676229,2015-01-26,"Hearing:=== RESCHEDULED === 2/5/15, Room 103, Legislative Office Building, 2:00 p.m.; Senate Calendar 8 "
676229,2015-02-10,"Committee Report: Ought to Pass, 2/19/15; Vote 5-0; Consent Calendar; Senate Calendar 10 "
676229,2015-02-19,"Ought to Pass: Motion Adopted, Voice Vote; OT3rdg; Senate Journal 6  "
676229,2015-03-04,"Introduced and Referred to Transportation; House Journal  22, PG. 629 "
676229,2015-03-26,"Public Hearing: 4/7/2015 1:30 PM Legislative Office Building 203 "
676229,2015-04-14,"Executive Session: 4/21/2015 1:00 PM Legislative Office Building 203 "
676229,2015-04-22,"Committee Report: Ought to Pass for Apr 29 (Vote 14-0; Consent Calendar); House Calendar 32, PG. 1484 "
676229,2015-04-29,"Ought to Pass: Motion Adopted Voice Vote; House Journal  36, PG. 1579 "
676229,2015-05-06,"Enrolled; House Journal  41, PG. 1779 "
676229,2015-05-13,"Enrolled (In recess 5/7/2015); Senate Journal 14 "
676229,2015-06-11,"Signed by the Governor on 06/08/2015; Chapter 0113; Effective 08/07/2015 "
676246,2015-01-08,"Introduced and Referred to Public and Municipal Affairs; Senate Journal 4  "
676246,2015-02-11,"Hearing: 2/18/15, Room 102, Legislative Office Building, 10:45 a.m.; Senate Calendar 10 "
676246,2015-03-05,"Committee Report: Inexpedient to Legislate, 3/12/15; Vote 5-0; Consent Calendar; Senate Calendar 12 "
676246,2015-03-12,"Inexpedient to Legislate, Motion Adopted, Voice Vote === BILL KILLED ===; Senate Journal 8  "
676261,2015-01-08,"Introduced and Referred to Judiciary; Senate Journal 4  "
676261,2015-01-14,"Hearing: 1/22/15, Room 100, State House, 10:00 a.m.; Senate Calendar 6 "
676261,2015-03-04,"Committee Report: Ought to Pass with Amendment #2015-0709s, New Title, 3/12/15; Vote 5-0; Consent Calendar; Senate Calendar 12 "
676261,2015-03-12,"Sen. Carson Moved to Remove SB 72 from the Consent Calendar "
676261,2015-03-12,"Committee Amendment 0709s, New Title, Not Voted On; Senate Journal 8  "
676261,2015-03-12,"Sen. Bradley Moved Laid on Table, Motion Adopted, Voice Vote; Senate Journal 8  "
676261,2015-03-26,"Sen. Bradley Moved Remove From Table, Motion Adopted, Voice Vote; Senate Journal 10 "
676261,2015-03-26,"Committee Amendment 0709s, Amendment Failed, Voice Vote "
676261,2015-03-26,"Sen. Carson Floor Amendment #2015-1110s, New Title, Amendment Adopted, Voice Vote; Senate Journal 10 "
676261,2015-03-26,"Ought to Pass with Amendment 1110s, New Title, Motion Adopted, Voice Vote; OT3rdg; Senate Journal 5  "
676261,2015-03-31,"Introduced and Referred to Criminal Justice and Public Safety (in recess of 3/25/2015); House Journal  28, PG. 1299 "
676261,2015-04-07,"Public Hearing: 4/14/2015 10:00 Amendment Legislative Office Building 204 "
676261,2015-04-14,"Executive Session: 4/21/2015 10:00 Amendment Legislative Office Building 204 "
676261,2015-04-23,"Committee Report: Ought to Pass with Amendment #2015-1336h (NT) for Apr 29 (Vote 11-0; Consent Calendar); House Calendar 32, PG. 1482 "
676261,2015-04-29,"Amendment #1336h: Amendment Adopted Voice Vote; House Journal  36, PG. 1576-1577 "
676261,2015-04-29,"Ought to Pass with Amendment #1336h: Motion Adopted Voice Vote; House Journal  36, PG. 1576-1577 "
676261,2015-05-21,"Sen. Carson Concurs with House Amendment #1336h, Motion Adopted, Voice Vote; Senate Journal 15 "
676261,2015-06-03,"Enrolled "
676261,2015-06-03,"Enrolled (In recess 5/28/2015); Senate Journal 17 "
676261,2015-06-16,"Signed by the Governor on 06/12/15; Chapter 0150 "
676261,2015-06-16,"I. Section 2 Effective 11/01/15 "
676261,2015-06-16,"II. Remainder Effective 06/12/15 "
676277,2015-01-08,"Introduced and Referred to Finance; Senate Journal 4  "
676277,2015-01-15,"Hearing:=== CANCELLED === 1/27/15, Room 103, State House, 2:00 p.m.; Senate Calendar 6 "
676277,2015-01-26,"Hearing:=== RESCHEDULED === 2/5/15, Room 103, State House, 2:00 p.m.; Senate Calendar 8 "
676277,2015-02-05,"Committee Report: Ought to Pass, 2/12/15; Senate Calendar 9 "
676277,2015-02-12,"Ought to Pass: Motion Adopted, Regular Calendar 18Y-5N; OT3rdg; Senate Journal 5  "
676277,2015-03-04,"Introduced and Referred to Finance; House Journal  22, PG. 628 "
676277,2015-04-02,"Public Hearing: 4/8/2015 11:00 Amendment Legislative Office Building 210-211 "
676277,2015-04-02,"Full Committee Work Session: 4/9/2015 11:00 Amendment Legislative Office Building 210-211 "
676277,2015-04-08,"Executive Session: 4/16/2015 9:30 Amendment Legislative Office Building 210-211 "
676277,2015-04-16,"Committee Report: Inexpedient to Legislate for Apr 29 (Vote 22-0; Consent Calendar); House Calendar 32, PG. 1483 "
676277,2015-04-29,"Removed from Consent Calendar (Rep Bixby); House Journal  36, PG. 1576 "
676277,2015-04-29,"Inexpedient to Legislate: Motion Adopted DV 289-51; House Journal  36, PG. 1595-1596 "
676292,2015-01-08,"Introduced and Referred to Executive Departments and Administration; Senate Journal 4  "
676292,2015-01-14,"Hearing: 1/22/15, Room 100, State House, 1:15 p.m.; Senate Calendar 6 "
676292,2015-03-04,"Committee Report: Ought to Pass with Amendment #2015-0741s, 3/12/15; Senate Calendar 12 "
676292,2015-03-12,"Committee Amendment 0741s, Amendment Adopted, Voice Vote "
676292,2015-03-12,"Ought to Pass with Amendment 0741s, Motion Adopted, Voice Vote; OT3rdg; Senate Journal 8  "
676292,2015-03-12,"Introduced and Referred to Executive Departments and Adminstration; House Journal  26, PG. 1275 "
676292,2015-03-18,"Public Hearing: 3/24/2015 2:00 PM Legislative Office Building 306 "
676292,2015-04-08,"Executive Session: 4/28/2015 10:00 Amendment Legislative Office Building 306 "
676292,2015-04-30,"Committee Report: Ought to Pass with Amendment #2015-1207h for May 6 (Vote 14-0; Consent Calendar); House Calendar 33, PG. 1508 "
676292,2015-05-06,"Amendment #1207h: Amendment Adopted Voice Vote; House Journal  41, PG. 1750 "
676292,2015-05-06,"Ought to Pass with Amendment #1207h: Motion Adopted Voice Vote; House Journal  41, PG. 1750 "
676292,2015-05-21,"Sen. Carson Concurs with House Amendment #1207h, Motion Adopted, Voice Vote; Senate Journal 15 "
676292,2015-06-01,"Enrolled Bill Amendment #2015-1996EBA: Amendment Adopted Voice Vote (in recess of 5/6/2015); House Journal  41, PG. 1783 "
676292,2015-06-02,"Enrolled Bill Amendment #2015-1996e Adopted, Voice Vote, (In recess of 5/28/2015); Senate Journal 17 "
676292,2015-06-10,"Enrolled (In recess 6/4/2015); Senate Journal 18 "
676292,2015-06-11,"Enrolled; House Journal  46, PG. 1989 "
676292,2015-06-30,"Law without Signature 06/30/15; Chapter 0185; Art 44, Pt II, NH Constitution "
676292,2015-06-30,"I. Section 3 Effective 06/30/15 "
676292,2015-06-30,"II. Remainder Effective 01/01/16 "
676306,2015-01-08,"Introduced and Referred to Public and Municipal Affairs; Senate Journal 4  "
676306,2015-01-20,"Hearing:=== TIME CHANGE === 1/28/15, Room 102, Legislative Office Building, 1:30 p.m.; Senate Calendar 7 "
676306,2015-02-11,"Committee Report: Ought to Pass, 2/19/15; Senate Calendar 10 "
676306,2015-02-19,"Ought to Pass: Motion Adopted, Voice Vote; OT3rdg; Senate Journal 6  "
676306,2015-03-04,"Introduced and Referred to Municipal and County Government; House Journal  22, PG. 629 "
676306,2015-03-17,"Public Hearing: 3/24/2015 10:30 Amendment Legislative Office Building 301 "
676306,2015-03-17,"Executive Session: 3/26/2015 10:00 Amendment Legislative Office Building 301 "
676306,2015-04-08,"Committee Report: Ought to Pass for Apr 15 (Vote 15-0; Consent Calendar); House Calendar 29, PG. 1306 "
676306,2015-04-15,"Ought to Pass: Motion Adopted Voice Vote; House Journal  34, PG. 1546 "
676306,2015-04-29,"Enrolled; House Journal  36, PG. 1597 "
676306,2015-04-29,"Enrolled (In recess 4/9/2015); Senate Journal 12 "
676306,2015-05-08,"Signed by the Governor on 05/07/2015; Chapter 0029; Effective 04/01/2015 "
676321,2015-01-08,"Introduced and Referred to Health and Human Services; Senate Journal 4  "
676321,2015-01-22,"Hearing:=== CANCELLED === 1/27/15, Room 101, Legislative Office Building, 2:00 p.m.; Senate Calendar 7 "
676321,2015-01-26,"Hearing:=== RESCHEDULED === 2/5/15, Room 101, Legislative Office Building, 2:00 p.m.; Senate Calendar 8 "
676321,2015-03-04,"Committee Report: Ought to Pass, 3/12/15; Vote 5-0; Consent Calendar; Senate Calendar 12 "
676321,2015-03-12,"Ought to Pass: Motion Adopted, Voice Vote; OT3rdg; Senate Journal 8  "
676321,2015-03-12,"Introduced and Referred to Health, Human Services and Elderly Affairs; House Journal  26, PG. 1275 "
676321,2015-03-18,"Public Hearing: 3/24/2015 2:15 PM Legislative Office Building 205 "
676321,2015-03-24,"Subcommittee Work Session: 4/2/2015 9:00 Amendment Legislative Office Building 205 "
676321,2015-03-25,"==CANCELED==Executive Session: 4/2/2015 10:30 Amendment Legislative Office Building 205 "
676321,2015-04-01,"===CANCELLED=== Work Session: 4/2/2015 9:00 Amendment Legislative Office Building 205 "
676321,2015-04-01,"Subcommittee Work Session: 4/7/2015 9:00 Amendment Legislative Office Building 205 "
676321,2015-04-01,"Executive Session: 4/7/2015 10:30 Amendment Legislative Office Building 205 "
676321,2015-04-09,"Committee Report: Ought to Pass with Amendment #2015-1185h for Apr 15 (Vote 19-0; Consent Calendar); House Calendar 29, PG. 1304 "
676321,2015-04-15,"Amendment #1185h: Amendment Adopted Voice Vote; House Journal  34, PG. 1540 "
676321,2015-04-15,"Ought to Pass with Amendment #1185h: Motion Adopted Voice Vote; House Journal  34, PG. 1540 "
676321,2015-05-14,"Sen. Sanborn Concurs with House Amendment #1185h, Motion Adopted, Voice Vote; Senate Journal 14 "
676321,2015-06-03,"Enrolled "
676321,2015-06-03,"Enrolled (In recess 5/28/2015); Senate Journal 17 "
676321,2015-06-16,"Signed by the Governor on 06/12/2015; Chapter 0145; Effective 08/11/2015 "
676335,2015-01-08,"Introduced and Referred to Public and Municipal Affairs; Senate Journal 4  "
676335,2015-01-20,"Hearing:=== TIME CHANGE === 1/28/15, Room 102, Legislative Office Building, 12:00 p.m.; Senate Calendar 7 "
676335,2015-01-30,"Committee Report: Ought to Pass, 2/12/15; Senate Calendar 9 "
676335,2015-02-12,"Ought to Pass: Motion Adopted, Voice Vote; OT3rdg; Senate Journal 5  "
676335,2015-03-04,"Introduced and Referred to Fish and Game and Marine Resources; House Journal  22, PG. 629 "
676335,2015-03-11,"Public Hearing: 3/19/2015 10:00 Amendment Legislative Office Building 307 "
676335,2015-03-26,"Subcommittee Work Session: 3/31/2015 10:15 Amendment Legislative Office Building 307 "
676335,2015-03-26,"Executive Session: 3/31/2015 11:00 Amendment Legislative Office Building 307 "
676335,2015-04-08,"Committee Report: Ought to Pass with Amendment #2015-1206h for Apr 15 (Vote 11-0; Consent Calendar); House Calendar 29, PG. 1303 "
676335,2015-04-15,"Amendment #1206h: Amendment Adopted Voice Vote; House Journal  34, PG. 1539 "
676335,2015-04-15,"Ought to Pass with Amendment #1206h: Motion Adopted Voice Vote; House Journal  34, PG. 1539 "
676335,2015-04-30,"Sen. Birdsell Concurs with House Amendment #1206h, Motion Adopted, Voice Vote; Senate Journal 12 "
676335,2015-05-06,"Enrolled; House Journal  41, PG. 1779 "
676335,2015-05-13,"Enrolled (In recess 5/7/2015); Senate Journal 14 "
676335,2015-06-11,"Signed by the Governor on 06/05/2015; Chapter 0101; Effective 01/01/2016 "
676352,2015-01-08,"Introduced and Referred to Judiciary; Senate Journal 4  "
676352,2015-01-14,"Hearing:=== CANCELLED === 1/27/15, Room 100, State House, 9:30 a.m.; Senate Calendar 6 "
676352,2015-01-26,"Hearing:=== RESCHEDULED === 2/3/15, Room 100, State House, 9:30 a.m.; Senate Calendar 8 "
676352,2015-02-20,"Committee Report: Ought to Pass with Amendment #2015-0498s, New Title, 3/5/15; Vote 5-0; Consent Calendar; Senate Calendar 11 "
676352,2015-03-05,"Committee Amendment 0498s, New Title, Amendment Adopted, Voice Vote "
676352,2015-03-05,"Ought to Pass with Amendment 0498s, New Title, Motion Adopted, Voice Vote; OT3rdg; Senate Journal 7  "
676352,2015-03-11,"Introduced and Referred to Judiciary; House Journal  26, PG. 1274 "
676352,2015-03-25,"Vacated and Referred to Criminal Justice and Public Safety; House Journal  28, PG. 1289 "
676352,2015-03-31,"Public Hearing: 4/9/2015 11:00 Amendment Legislative Office Building 204 "
676352,2015-04-14,"Executive Session: 4/21/2015 10:00 Amendment Legislative Office Building 204 "
676352,2015-04-23,"Committee Report: Ought to Pass with Amendment #2015-1213h (NT) for Apr 29 (Vote 16-0; Consent Calendar); House Calendar 32, PG. 1482 "
676352,2015-04-29,"Amendment #1213h: Amendment Adopted Voice Vote; House Journal  36, PG. 1576 "
676352,2015-04-29,"Ought to Pass with Amendment #1213h: Motion Adopted Voice Vote; House Journal  36, PG. 1576 "
676352,2015-05-21,"Sen. Carson Concurs with House Amendment #1213h, Motion Adopted, Voice Vote; Senate Journal 15 "
676352,2015-06-03,"Enrolled "
676352,2015-06-03,"Enrolled (In recess 5/28/2015); Senate Journal 17 "
676352,2015-06-16,"Signed by the Governor on 06/12/2015; Chapter 0146; Effective 08/11/2015 "
676369,2015-01-08,"Introduced and Referred to Commerce; Senate Journal 4  "
676369,2015-01-29,"Hearing:===CANCELLED=== 2/17/15, Room 100, State House, 1:40 p.m.; Senate Calendar 8 "
676369,2015-02-20,"Hearing: === RESCHEDULED === 3/2/15, Room 100, State House, 1:20 p.m.; Senate Calendar 11 "
676369,2015-03-19,"Committee Report: Ought to Pass with Amendment #2015-1011s, 3/26/15; Vote 5-0; Consent Calendar; Senate Calendar 14 "
676369,2015-03-26,"Committee Amendment 1011s, Amendment Adopted, Voice Vote "
676369,2015-03-26,"Ought to Pass with Amendment 1011s, Motion Adopted, Voice Vote; OT3rdg; Senate Journal 10 "
676369,2015-03-31,"Introduced and Referred to Commerce and Consumer Affairs (in recess of 3/25/2015); House Journal  28, PG. 1298 "
676369,2015-04-01,"Public Hearing: 4/8/2015 10:00 Amendment Legislative Office Building 302 "
676369,2015-04-29,"Subcommittee Work Session: 5/7/2015 10:00 Amendment Legislative Office Building 302 "
676369,2015-05-13,"Executive Session: 5/19/2015 1:15 PM Legislative Office Building 302 "
676369,2015-05-27,"Committee Report: Ought to Pass with Amendment #2015-1644h (NT) for Jun 3 (Vote 21-0; Consent Calendar); House Journal  39, PG. 1628 "
676369,2015-06-03,"Amendment #1644h: Amendment Adopted Voice Vote; House Journal  44, PG. 1817-1822 "
676369,2015-06-03,"Ought to Pass with Amendment #1644h: Motion Adopted Voice Vote; House Journal  44, PG. 1817-1822 "
676369,2015-06-04,"Sen. Prescott Moved Nonconcur with House Amendment #1644h, New Title; Requests C of C, Motion Adopted, Voice Vote; Senate Journal 17 "
676369,2015-06-04,"President Appoints: Senators Stiles, Prescott, Soucy "
676369,2015-06-10,"House Accedes to Senate Request for Committee of Conference (Rep Major): Motion Adopted Voice Vote (in recess of 6/3/2015); House Journal  44, PG. 1954 "
676369,2015-06-10,"Speaker Appoints: Reps Hunt, Williams, French, Hurt (in recess of 6/3/2015); House Journal  44, PG. 1954 "
676369,2015-06-11,"Committee of Conference Meeting: 6/16/2015, 1:45 p.m., Room 103, Legislative Office Building === RECESSED === "
676369,2015-06-11,"Conferee Change: Rep Jones Replaces Rep Hurt; House Journal  46, PG. 1990 "
676369,2015-06-16,"Committee of Conference Meeting: === RECONVENE === 6/17/2015, 10:00 a.m., Room 103, Legislative Office Building "
676369,2015-06-18,"Conference Committee Report; Not Signed Off "
676385,2015-01-08,"Introduced and Referred to Education; Senate Journal 4  "
676385,2015-01-15,"Hearing:=== CANCELLED === 1/27/15, Room 103, Legislative Office Building, 9:20 a.m.; Senate Calendar 6 "
676385,2015-01-26,"Hearing:=== RESCHEDULED === 2/5/15, Room 103, Legislative Office Building, 9:20 a.m.; Senate Calendar 8 "
676385,2015-02-05,"Committee Report: Inexpedient to Legislate, 2/12/15; Senate Calendar 9 "
676385,2015-02-12,"Inexpedient to Legislate, Motion Adopted, Voice Vote === BILL KILLED ===; Senate Journal 5 "
676399,2015-01-13,"Introduced and Referred to Education; Senate Journal 4  "
676399,2015-01-14,"Hearing: 1/20/15, Room 103, Legislative Office Building, 9:20 a.m.; Senate Calendar 6 "
676399,2015-02-04,"Committee Report: Ought to Pass, 2/12/15; Senate Calendar 9 "
676399,2015-02-12,"Ought to Pass: Motion Adopted, Voice Vote; OT3rdg; Senate Journal 5  "
676399,2015-03-04,"Introduced and Referred to Education; House Journal  22, PG. 629 "
676399,2015-03-17,"Public Hearing: 3/24/2015 10:40 Amendment Legislative Office Building 207 "
676399,2015-03-24,"Executive Session: 3/31/2015 1:00 PM Legislative Office Building 207 "
676399,2015-04-08,"Committee Report: Ought to Pass for Apr 15 (Vote 15-6; Regular Calendar); House Calendar 29, PG. 1308 "
676399,2015-04-15,"Ought to Pass: Motion Failed Regular Calendar 164-168; House Journal  34, PG. 1550-1551 "
676399,2015-04-15,"Inexpedient to Legislate (Rep Boehm): Motion Adopted DV 186-146; House Journal  34, PG. 1552 "
676399,2015-04-21,"Notice of Reconsideration (Rep A. Schmidt) for Apr 29 "
676399,2015-04-29,"Reconsider (Rep A. Schmidt): Motion Failed DV 144-189; House Journal  36, PG. 1596 "
676413,2015-01-08,"Introduced and Referred to Rules, Enrolled Bills and Internal Affairs; Senate Journal 4  "
676413,2015-01-22,"Hearing: 1/29/15, Room 100, State House, 12:45 p.m.; Senate Calendar 7 "
676413,2015-03-19,"Committee Report: Ought to Pass, 3/26/15; Vote 5-0; Consent Calendar; Senate Calendar 14 "
676413,2015-03-26,"Ought to Pass: Motion Adopted, Voice Vote; OT3rdg; Senate Journal 10 "
676413,2015-03-31,"Introduced and Referred to Executive Departments and Administration (in recess of 3/25/2015); House Journal  28, PG. 1298 "
676413,2015-04-01,"Public Hearing: 4/7/2015 11:00 Amendment Legislative Office Building 306 "
676413,2015-04-01,"Executive Session: 4/7/2015 1:00 PM Legislative Office Building 306 "
676413,2015-04-09,"Committee Report: Ought to Pass for Apr 15 (Vote 11-3; Regular Calendar); House Calendar 29, PG. 1308 "
676413,2015-04-15,"Ought to Pass: Motion Adopted Voice Vote; House Journal  34, PG. 1554 "
676413,2015-04-29,"Enrolled; House Journal  36, PG. 1597 "
676413,2015-04-29,"Enrolled (In recess 4/9/2015); Senate Journal 12 "
676413,2015-05-08,"Signed by the Governor on 05/07/2015; Chapter 0028; Effective 07/06/2015 "
676429,2015-01-08,"Introduced and Referred to Ways and Means; Senate Journal 4  "
676429,2015-01-15,"Hearing: 1/20/15, Room 103, State House, 9:00 a.m.; Senate Calendar 6 "
676429,2015-02-19,"Committee Report: Ought to Pass with Amendment #2015-0495s, 3/5/15; Senate Calendar 11 "
676429,2015-03-05,"Committee Amendment 0495s, Amendment Adopted, Voice Vote "
676429,2015-03-05,"Ought to Pass with Amendment 0495s, Regular Calendar 14Y-10N, Motion Adopted; Refer to Finance Rule 4-5; Senate Journal 7  "
676429,2015-03-11,"Committee Report: Ought to Pass, 3/19/15; Senate Calendar 13 "
676429,2015-03-19,"Ought to Pass: Regular Calendar 14Y-10N, Motion Adopted; Senate Journal 9  "
676429,2015-03-19,"Pending Motion OT3rdg; Senate Journal 9  "
676429,2015-03-19,"Sen. Bradley Moved Laid on Table, Motion Adopted, Voice Vote; Senate Journal 9  "
676445,2015-01-08,"Introduced and Referred to Health and Human Services; Senate Journal 4  "
676445,2015-01-15,"Hearing: 1/20/15, Room 101, Legislative Office Building, 2:10 p.m.; Senate Calendar 6 "
676445,2015-02-05,"Committee Report: Ought to Pass, 2/12/15; Senate Calendar 9 "
676445,2015-02-12,"Ought to Pass Not Voted On; Senate Journal 5  "
676445,2015-02-12,"Sen. Sanborn Moved Laid On Table, Motion Adopted, Voice Vote: Senate Journal 5  "
676445,2015-03-12,"Sen. Bradley Moved Remove From Table, Motion Adopted, Voice Vote; Senate Journal 8  "
676445,2015-03-12,"Ought to Pass: Motion Adopted, Voice Vote; OT3rdg; Senate Journal 8  "
676445,2015-03-12,"Introduced and Referred to Health, Human Services and Elderly Affairs; House Journal  26, PG. 1275 "
676445,2015-03-19,"Public Hearing: 3/26/2015 1:15 PM Legislative Office Building 205 "
676445,2015-03-25,"==CANCELED==Executive Session: 4/2/2015 10:30 Amendment Legislative Office Building 205 "
676445,2015-04-01,"Subcommittee Work Session: 4/9/2015 9:00 Amendment Legislative Office Building 205 "
676445,2015-04-09,"Subcommittee Work Session: 4/14/2015 10:00 Amendment Legislative Office Building 205 "
676445,2015-04-14,"Subcommittee Work Session: 4/16/2015 9:00 Amendment Legislative Office Building 205 "
676445,2015-04-14,"Executive Session: 4/28/2015 10:00 Amendment Legislative Office Building 205 "
676445,2015-04-29,"Committee Report: Ought to Pass with Amendment #2015-1332h for May 6 (Vote 21-0; Consent Calendar); House Calendar 33, PG. 1508 "
676445,2015-05-06,"Amendment #1332h: Amendment Adopted Voice Vote; House Journal  1751-1753 "
676445,2015-05-06,"Ought to Pass with Amendment #1332h: Motion Adopted Voice Vote; House Journal  41, PG. 1751-1753 "
676445,2015-05-14,"Sen. Sanborn Moved Nonconcur with House Amendment #1332h; Requests C of C, Motion Adopted, Voice Vote; Senate Journal 14 "
676445,2015-05-14,"President Appoints: Senators Sanborn, Stiles, and Kelly "
676445,2015-06-03,"House Accedes to Senate Request for Committee of Conference (Rep Kotowski): Motion Adopted Voice Vote; House Journal  44, PG. 1816 "
676445,2015-06-03,"Speaker Appoints: Reps Fothergill, Kotowski, Martel, Ticehurst; House Journal  44, PG. 1816 "
676445,2015-06-04,"Committee of Conference Meeting: 6/9/2015, 10:30 a.m., Room 101, Legislative Office Building === RECESSED === "
676445,2015-06-09,"Committee of Conference Meeting: === RECONVENE === 6/9/2015, 3:00 p.m., Room 101, Legislative Office Building "
676445,2015-06-17,"Conference Committee Report #2015-2107CofC Filed; House Amendment + New Amendment "
676445,2015-06-24,"Conference Committee Report 2107c: Adopted, Voice Vote; House Journal  54, PG. 2102-2104 "
676445,2015-06-24,"Conference Committee Report 2107c; Adopted, Voice Vote; Senate Journal 19 "
676445,2015-07-02,"Enrolled (In recess of 6/24/2015); House Journal  54, PG. 2141 "
676445,2015-07-02,"Enrolled (In recess 6/24/2015); Senate Journal 19 "
676445,2015-07-15,"Signed by the Governor on 07/13/14; Chapter 0246 "
676445,2015-07-15,"I. Section 2, paragraph VI of Section 6, and subparagraph XII(f) of Section 8 Effective as provided in Section 9 "
676445,2015-07-15,"II. Remainder Effective 09/11/15 "
676459,2015-01-08,"Introduced and Referred to Commerce; Senate Journal 4  "
676459,2015-01-29,"Hearing: 2/10/15, Room 100, State House, 1:15 p.m.; Senate Calendar 8 "
676459,2015-02-20,"Committee Report: Ought to Pass, 3/5/15; Senate Calendar 11 "
676459,2015-03-05,"Ought to Pass: Regular Calendar 24Y-0N, Motion Adopted; OT3rdg; Senate Journal 7  "
676459,2015-03-11,"Introduced and Referred to Labor, Industrial and Rehabilitative Services; House Journal  26, PG. 1274 "
676459,2015-03-19,"Public Hearing: 3/24/2015 11:30 Amendment Legislative Office Building 307 "
676459,2015-03-19,"Executive Session: 3/25/2015 12:00 PM Legislative Office Building 307 "
676459,2015-03-26,"Committee Report: Ought to Pass for Apr 15 (Vote 16-0; Regular Calendar); House Calendar 29, PG. 1309 "
676459,2015-04-15,"Ought to Pass: Motion Adopted Voice Vote; House Journal  34, PG. 1559 "
676459,2015-04-29,"Enrolled; House Journal  36, PG. 1597 "
676459,2015-04-29,"Enrolled (In recess 4/9/2015); Senate Journal 12 "
676459,2015-05-11,"Signed by the Governor on 05/07/2015; Chapter 0040 Effective 07/06/2015 "
676473,2015-01-08,"Introduced and Referred to Commerce; Senate Journal 4  "
676473,2015-01-29,"Hearing:===CANCELLED=== 2/17/15, Room 100, State House, 1:00 p.m.; Senate Calendar 8 "
676473,2015-02-20,"Hearing: === RESCHEDULED === 3/3/15, Room 100, State House, 1:00 p.m.; Senate Calendar 11 "
676473,2015-03-04,"Committee Report: Ought to Pass, 3/12/15; Senate Calendar 12 "
676473,2015-03-12,"Ought to Pass: Motion Adopted, Voice Vote; OT3rdg; Senate Journal 8  "
676473,2015-03-12,"Introduced and Referred to Commerce and Consumer Affairs; House Journal  26, PG. 1275 "
676473,2015-03-25,"Public Hearing: 4/2/2015 10:00 Amendment Legislative Office Building 302 "
676473,2015-04-07,"Subcommittee Work Session: 4/28/2015 1:15 PM Legislative Office Building 302 "
676473,2015-05-06,"Executive Session: 5/12/2015 1:15 PM Legislative Office Building 302 "
676473,2015-05-07,"Subcommittee Work Session: 5/12/2015 10:15 Amendment Legislative Office Building 302 "
676473,2015-05-21,"Majority Committee Report: Ought to Pass with Amendment #2015-1605h for Jun 3 (Vote 12-7; Regular Calendar); House Calendar 39, PG. 1633 "
676473,2015-05-21,"Minority Committee Report: Inexpedient to Legislate "
676473,2015-06-03,"Amendment #1605h: Amendment Adopted Voice Vote; House Journal  44, PG. 1834 "
676473,2015-06-03,"Ought to Pass with Amendment #1605h: Motion Adopted Regular Calendar 331-37; House Journal  44, PG. 1834-1836 "
676473,2015-06-04,"Sen. Prescott Concurs with House Amendment #1605h, Motion Adopted, Voice Vote; Senate Journal 17 "
676473,2015-06-16,"Enrolled Bill Amendment #2015-2108-EBA: Amendment Adopted Voice Vote (in recess of 6/11/2015); House Journal  46, PG. 1991 "
676473,2015-06-17,"Enrolled Bill Amendment #2015-2108e Adopted, Voice Vote, (In recess of 6/11/2015); Senate Journal 19 "
676473,2015-06-24,"Enrolled; House Journal  54, PG. 2102 "
676473,2015-06-24,"Enrolled (In recess 6/24/2015); Senate Journal 19 "
676473,2015-07-07,"Signed by the Governor on 07/06/2015; Chapter 0187; Effective 07/01/2015 "
678283,2015-01-08,"Introduced and Referred to Commerce; Senate Journal 4  "
678283,2015-01-15,"Hearing: 1/22/15, Room 101, Legislative Office Building, 9:30 a.m.; Senate Calendar 6 "
678283,2015-02-05,"Committee Report: Ought to Pass with Amendment #2015-0231s, New Title, 2/12/15; Senate Calendar 9 "
678283,2015-02-12,"Committee Amendment 0231s, New Title, Amendment Adopted, Voice Vote "
678283,2015-02-12,"Ought to Pass with Amendment 0231s, New Title, Motion Adopted, Voice Vote; OT3rdg; Senate Journal 5  "
678283,2015-03-04,"Introduced and Referred to Commerce and Consumer Affairs; House Journal  22, PG. 629 "
678283,2015-03-18,"Public Hearing: 3/24/2015 10:45 Amendment Legislative Office Building 302 "
678283,2015-04-07,"Subcommittee Work Session: 4/14/2015 10:00 Amendment Legislative Office Building 302 "
678283,2015-04-15,"Subcommittee Work Session: 5/5/2015 10:00 Amendment Legislative Office Building 302 "
678283,2015-05-06,"Executive Session: 5/12/2015 1:15 PM Legislative Office Building 302 "
678283,2015-05-14,"Committee Report: Ought to Pass with Amendment #2015-1232h for Jun 3 (Vote 19-0; Consent Calendar); House Calendar 39, PG. 1628 "
678283,2015-06-03,"Amendment #1232h: Amendment Adopted Voice Vote; House Journal  44, PG. 1822 "
678283,2015-06-03,"Ought to Pass with Amendment #1232h: Motion Adopted Voice Vote; House Journal  44, PG. 1822 "
678283,2015-06-04,"Sen. Prescott Moved Nonconcur with House Amendment #1232h; Requests C of C, Motion Adopted, Voice Vote; Senate Journal 17 "
678283,2015-06-04,"President Appoints: Senators Prescott, Sanborn, and Pierce "
678283,2015-06-09,"House Accedes to Senate Request for Committee of Conference (Rep Gorman): Motion Adopted Voice Vote (in recess of 6/3/2015); House Journal  44, PG. 1953 "
678283,2015-06-09,"Speaker Appoints: Reps Hunt, Tucker, Jones, Abel (in recess of 6/3/2015); House Journal  44, PG. 1953 "
678283,2015-06-09,"Committee of Conference Meeting: 6/10/2015, 1:30 p.m., Room 102, Legislative Office Building "
678283,2015-06-11,"Conference Committee Report #2015-2115c; House Amendment, Filed "
678283,2015-06-11,"Conference Committee Report #2015-2115CofC: Adopted Voice Vote; House Journal  46, PG. 1989 "
678283,2015-06-11,"Conference Committee Report 2115c; Adopted, Voice Vote; Senate Journal 18 "
678283,2015-06-18,"Enrolled (in recess of 6/11/2015); House Journal  46, PG. 1993 "
678283,2015-06-18,"Enrolled (In recess 6/11/2015); Senate Journal 19 "
678283,2015-06-23,"Signed by the Governor on 06/19/2015; Chapter 0156; Effective 06/19/2015 "
678303,2015-01-08,"Introduced and Referred to Public and Municipal Affairs; Senate Journal 4  "
678303,2015-01-20,"Hearing:=== TIME CHANGE === 1/28/15, Room 102, Legislative Office Building, 1:15 p.m.; Senate Calendar 7 "
678303,2015-02-05,"Committee Report: Ought to Pass with Amendment #2015-0201s, 2/12/15; Senate Calendar 9 "
678303,2015-02-12,"Committee Amendment 0201s, Amendment Adopted, Voice Vote "
678303,2015-02-12,"Ought to Pass with Amendment 0201s, Motion Adopted, Voice Vote; OT3rdg; Senate Journal 5  "
678303,2015-03-04,"Introduced and Referred to Municipal and County Government; House Journal  22, PG. 629 "
678303,2015-03-17,"Public Hearing: 3/24/2015 11:20 Amendment Legislative Office Building 301 "
678303,2015-03-17,"Executive Session: 3/26/2015 10:00 Amendment Legislative Office Building 301 "
678303,2015-04-08,"Committee Report: Ought to Pass with Amendment #2015-1113h for Apr 15 (Vote 15-0; Consent Calendar); House Calendar 29, PG. 1306 "
678303,2015-04-15,"Amendment #1113h: Amendment Adopted Voice Vote; House Journal  34, PG. 1547-1548 "
678303,2015-04-15,"Ought to Pass with Amendment #1113h: Motion Adopted Voice Vote; House Journal  34, PG. 1547-1548 "
678303,2015-04-30,"Sen. Birdsell Concurs with House Amendment #1113h, Motion Adopted, Voice Vote; Senate Journal 12 "
678303,2015-05-06,"Enrolled; House Journal  41, PG. 1779 "
678303,2015-05-13,"Enrolled (In recess 5/7/2015); Senate Journal 14 "
678303,2015-06-11,"Law Without Signature 06/09/15; Eff. Date 08/08/15, Chapter 0126; Art 44, Pt II, NH Constitution "
678328,2015-01-08,"Introduced and Referred to Commerce; Senate Journal 4  "
678328,2015-01-15,"Hearing: 1/20/15, Room 100, State House, 1:45 p.m.; Senate Calendar 6 "
678328,2015-03-04,"Committee Report: Rereferred to Committee, 3/12/15; Senate Calendar 12 "
678328,2015-03-12,"Rereferred to Committee, Motion Adopted, Voice Vote, Senate Journal 8  "
678328,2015-10-29,"Committee Report: Inexpedient to Legislate, 1/6/16; Senate Calendar 49 "
678356,2015-01-08,"Introduced and Referred to Judiciary; Senate Journal 4  "
678356,2015-01-14,"Hearing: 1/22/15, Room 100, State House, 9:00 a.m.; Senate Calendar 6 "
678356,2015-03-11,"Committee Report: Ought to Pass with Amendment #2015-0810s, 3/19/15; Senate Calendar 13 "
678356,2015-03-19,"Committee Amendment 0810s, Amendment Adopted, Voice Vote "
678356,2015-03-19,"Ought to Pass with Amendment 0810s, 3/5 necessary, Regular Calendar 24Y-0N, Motion Adopted; OT3rdg; Senate Journal 9  "
678356,2015-03-24,"Introduced and Referred to Judiciary (in recess of 3/12/2015); House Journal  26, PG. 1276 "
678356,2015-04-28,"Public Hearing: 5/12/2015 1:00 PM Legislative Office Building 208==RECESSED== "
678356,2015-05-05,"==CANCELED==Executive Session: 5/19/2015 10:00 Amendment Legislative Office Building 208 "
678356,2015-05-12,"Continued Public Hearing: 5/21/2015 10:00 Amendment Legislative Office Building 208 "
678356,2015-05-21,"Retained in Committee "
678356,2015-08-18,"Retained Bill - Subcommittee Work Session: 8/8/2015 10:00 Amendment Legislative Office Building 208 "
678356,2015-08-18,"===CANCELLED=== Work Session: 8/8/2015 10:00 Amendment Legislative Office Building 208 "
678356,2015-08-18,"Retained Bill - Subcommittee Work Session: 9/8/2015 10:00 Amendment Legislative Office Building 208 "
678356,2015-08-18,"Retained Bill - Subcommittee Work Session: 9/15/2015 10:00 Amendment Legislative Office Building 208 "
678356,2015-09-08,"==TIME CHANGE==Executive Session: 10/27/2015 10:00 Amendment Legislative Office Building 208 "
678356,2015-09-15,"Retained Bill - Subcommittee Work Session: 10/27/2015 10:00 Amendment Legislative Office Building 208 "
678356,2015-09-15,"==RESCHEDULED==Executive Session: 10/27/2015 1:00 PM Legislative Office Building 208 "
678356,2015-10-13,"Retained Bill - Subcommittee Work Session: 10/21/2015 2:30 PM Legislative Office Building 208 "
678356,2015-10-27,"Retained Bill - Subcommittee Work Session: 10/29/2015 11:00 Amendment Legislative Office Building 208 "
678356,2015-10-29,"Retained Bill - Subcommittee Work Session: 11/10/2015 10:00 Amendment Legislative Office Building 208 "
678356,2015-10-29,"Executive Session: 11/10/2015 11:00 Amendment Legislative Office Building 208 "
678356,2015-11-12,"Majority Committee Report: Inexpedient to Legislate for Jan 6 (Vote 16-2; Regular Calendar); House Calendar 67, PG. 23-24 "
678356,2015-11-17,"Minority Committee Report: Ought to Pass "
678383,2015-01-08,"Introduced and Referred to Finance; Senate Journal 4  "
678383,2015-01-15,"Hearing:=== CANCELLED === 1/27/15, Room 103, State House, 2:30 p.m.; Senate Calendar 6 "
678383,2015-01-26,"Hearing:=== RESCHEDULED === 2/5/15, Room 103, State House, 2:30 p.m.; Senate Calendar 8 "
678383,2015-02-05,"Committee Report: Ought to Pass, 2/12/15; Senate Calendar 9 "
678383,2015-02-12,"Ought to Pass: Motion Adopted, Voice Vote; OT3rdg; Senate Journal 5  "
678383,2015-03-04,"Introduced and Referred to Finance; House Journal  22, PG. 629 "
678383,2015-04-02,"Public Hearing: 4/8/2015 2:45 PM Legislative Office Building 210-211 "
678383,2015-04-02,"Division I Work Session: 4/9/2015 2:00 PM Legislative Office Building 212 "
678383,2015-04-08,"Executive Session: 4/16/2015 9:30 Amendment Legislative Office Building 210-211 "
678383,2015-04-16,"Committee Report: Ought to Pass for Apr 29 (Vote 23-0; Consent Calendar); House Calendar 32, PG. 1483 "
678383,2015-04-29,"Ought to Pass: Motion Adopted Voice Vote; House Journal  36, PG. 1578 "
678383,2015-05-06,"Enrolled; House Journal  41, PG. 1779 "
678383,2015-05-13,"Enrolled (In recess 5/7/2015); Senate Journal 14 "
678383,2015-06-11,"Signed by the Governor on 06/05/2015; Chapter 0102; Effective 01/01/2016 "
678414,2015-01-08,"Introduced and Referred to Commerce; Senate Journal 4  "
678414,2015-03-04,"Hearing: 3/17/15, Room 100, State House, 2:20 p.m.; Senate Calendar 12 "
678414,2015-03-19,"Committee Report: Ought to Pass with Amendment #2015-1045s, New Title, 3/26/15; Senate Calendar 14 "
678414,2015-03-26,"Sen. Prescott moved to Rerefer to Committee, Motion Adopted, Voice Vote; Senate Journal 10 "
678442,2015-01-08,"Introduced and Referred to Judiciary; Senate Journal 4  "
678442,2015-01-14,"Hearing:=== CANCELLED === 1/27/15, Room 100, State House, 9:00 a.m.; Senate Calendar 6 "
678442,2015-01-26,"Hearing:=== RESCHEDULED === 2/3/15, Room 100, State House, 9:00 a.m.; Senate Calendar 8 "
678442,2015-02-20,"Committee Report: Inexpedient to Legislate, 3/5/15; Vote 5-0; Consent Calendar; Senate Calendar 11 "
678442,2015-03-05,"Inexpedient to Legislate, Motion Adopted, Voice Vote === BILL KILLED ===; Senate Journal 7  "
678464,2015-01-08,"Introduced and Referred to Judiciary; Senate Journal 4  "
678464,2015-01-14,"Hearing: 1/20/15, Room 100, State House, 9:20 a.m.; Senate Calendar 6 "
678464,2015-01-22,"Committee Report: Ought to Pass, 1/29/15; Vote 5-0; Consent Calendar; Senate Calendar 7 "
678464,2015-01-29,"Ought to Pass: Motion Adopted, Voice Vote; OT3rdg; Senate Journal 4  "
678464,2015-03-04,"Introduced and Referred to Judiciary; House Journal  22, PG. 629 "
678464,2015-03-24,"Public Hearing: 3/31/2015 2:00 PM Legislative Office Building 208 "
678464,2015-04-01,"Executive Session: 4/7/2015 10:00 Amendment Legislative Office Building 208 "
678464,2015-04-08,"Committee Report: Ought to Pass for Apr 15 (Vote 15-0; Consent Calendar); House Calendar 29, PG. 1305 "
678464,2015-04-15,"Ought to Pass: Motion Adopted Voice Vote; House Journal  34, PG. 1546 "
678464,2015-04-29,"Enrolled; House Journal  36, PG. 1597 "
678464,2015-04-29,"Enrolled (In recess 4/9/2015); Senate Journal 12 "
678464,2015-05-08,"Signed by the Governor on 05/05/2015; Chapter 0022; Effective 05/05/2015 "
678498,2015-01-08,"Introduced and Referred to Health and Human Services; Senate Journal 4  "
678498,2015-01-15,"Hearing: 1/20/15, Room 101, Legislative Office Building, 1:20 p.m.; Senate Calendar 6 "
678498,2015-03-18,"Committee Report: Ought to Pass with Amendment #2015-0977s, New Title, 3/26/15; Senate Calendar 14 "
678498,2015-03-26,"Committee Amendment 0977s, New Title, Amendment Adopted, Voice Vote "
678498,2015-03-26,"Sen. Sanborn Floor Amendment #2015-1107s, Amendment Adopted, Voice Vote; Senate Journal 10 "
678498,2015-03-26,"Ought to Pass with Amendment 0977s, New Title, and 1107s, Motion Adopted, Voice Vote; OT3rdg; Senate Journal 10 "
678498,2015-03-31,"Introduced and Referred to Health, Human Services and Elderly Affairs (in recess of 3/25/2015); House Journal  28, PG. 1299 "
678498,2015-04-01,"Vacate (Rep Kotowski): Motion Adopted Voice Vote; House Journal  31, PG. 1477 "
678498,2015-04-01,"Referred to Commerce and Consumer Affairs; House Journal  31, PG. 1477 "
678498,2015-04-02,"Public Hearing: 4/8/2015 11:30 Amendment Legislative Office Building 302 "
678498,2015-04-07,"Subcommittee Work Session: 4/8/2015 2:00 PM Legislative Office Building 302 "
678498,2015-04-28,"Subcommittee Work Session: 5/5/2015 1:15 PM Legislative Office Building 302 "
678498,2015-05-12,"Subcommittee Work Session: 5/19/2015 10:00 Amendment Legislative Office Building 302 "
678498,2015-05-13,"Executive Session: 5/19/2015 1:15 PM Legislative Office Building 302 "
678498,2015-05-13,"==RESCHEDULED== Work Session: 5/19/2015 10:00 Amendment Legislative Office Building 301 "
678498,2015-05-13,"==RESCHEDULED== Work Session: 5/19/2015 10:00 Amendment Legislative Office Building 302-304 "
678498,2015-05-19,"Retained in Committee "
678498,2015-09-29,"Retained Bill - Subcommittee Work Session: 10/13/2015 10:00 Amendment Legislative Office Building 302 "
678498,2015-09-29,"Executive Session: 10/27/2015 1:15 PM Legislative Office Building 302 "
678498,2015-11-12,"Committee Report: Ought to Pass with Amendment #2015-1308h (NT) for Jan 6 (Vote 19-0; Consent Calendar); House Calendar 67, PG. 4-5 "
678520,2015-01-08,"Introduced and Referred to Finance; Senate Journal 4  "
678520,2015-01-20,"Hearing: 2/3/15, Room 103, State House, 2:40 p.m.; Senate Calendar 7 "
678520,2015-02-18,"Committee Report: Rereferred to Committee, 3/5/15; Senate Calendar 11 "
678520,2015-03-05,"Rereferred to Committee Not Voted On; Senate Journal 7  "
678520,2015-03-05,"Sen. Little Moved Laid on Table, Motion Adopted, Voice Vote; Senate Journal 7  "
678544,2015-01-08,"Introduced and Referred to Commerce; Senate Journal 4  "
678544,2015-03-04,"Hearing: 3/10/15, Room 100, State House, 1:40 p.m.; Senate Calendar 12 "
678544,2015-03-11,"Committee Report: Ought to Pass with Amendment #2015-0821s, 3/19/15; Senate Calendar 13 "
678544,2015-03-19,"Committee Amendment 0821s, Amendment Adopted, Voice Vote "
678544,2015-03-19,"Ought to Pass with Amendment 0821s, Regular Calendar 23Y-0N, Motion Adopted; OT3rdg; Senate Journal 9  "
678544,2015-03-24,"Introduced and Referred to Commerce and Consumer Affairs (in recess of 3/12/2015); House Journal  26, PG. 1276 "
678544,2015-03-25,"Public Hearing: 4/2/2015 2:00 PM Legislative Office Building 302 "
678544,2015-04-02,"Subcommittee Work Session: 4/8/2015 2:00 PM Legislative Office Building 302 "
678544,2015-04-28,"Subcommittee Work Session: 5/5/2015 1:15 PM Legislative Office Building 302 "
678544,2015-05-12,"Subcommittee Work Session: 5/19/2015 10:00 Amendment Legislative Office Building 302 "
678544,2015-05-13,"Executive Session: 5/19/2015 1:15 PM Legislative Office Building 302 "
678544,2015-05-13,"==RESCHEDULED== Work Session: 5/19/2015 10:00 Amendment Legislative Office Building 302-304 "
678544,2015-05-19,"Retained in Committee "
678544,2015-06-02,"Retained Bill - Full Committee Work Session: 6/9/2015 2:00 PM Legislative Office Building 302 "
678544,2015-06-02,"Retained Bill - Full Committee Work Session: 6/9/2015 2:00 PM Legislative Office Building 302 "
678544,2015-06-02,"Retained Bill - Full Committee Work Session: 6/9/2015 2:00 PM Legislative Office Building 302 "
678544,2015-09-29,"Executive Session: 10/27/2015 1:15 PM Legislative Office Building 302 "
678544,2015-11-12,"Committee Report: Inexpedient to Legislate for Jan 6 (Vote 19-0; Consent Calendar); House Calendar 67, PG. 5 "
678567,2015-01-08,"Introduced and Referred to Commerce; Senate Journal 4  "
678567,2015-01-15,"Hearing: 1/22/15, Room 101, Legislative Office Building, 9:45 a.m.; Senate Calendar 6 "
678567,2015-01-22,"Committee Report: Ought to Pass with Amendment #2015-0055s, 1/29/15; Senate Calendar 7 "
678567,2015-01-29,"Committee Amendment 0055s, Amendment Adopted, Voice Vote "
678567,2015-01-29,"Ought to Pass with Amendment 0055s, Motion Adopted, Voice Vote; OT3rdg; Senate Journal 4  "
678567,2015-03-04,"Introduced and Referred to Commerce and Consumer Affairs; House Journal  22, PG. 629 "
678567,2015-03-18,"Public Hearing: 3/24/2015 11:00 Amendment Legislative Office Building 302 "
678567,2015-04-02,"Public Hearing on non-germane amendment #1235h: 4/8/2015 1:30 PM Legislative Office Building 302 "
678567,2015-04-07,"Subcommittee Work Session: 4/14/2015 10:00 Amendment Legislative Office Building 302 "
678567,2015-04-14,"Subcommittee Work Session: 4/21/2015 10:00 Amendment Legislative Office Building 302 "
678567,2015-04-15,"===CANCELLED=== Work Session: 4/21/2015 10:00 Amendment Legislative Office Building 302 "
678567,2015-04-15,"Subcommittee Work Session: 5/5/2015 10:00 Amendment Legislative Office Building 302 "
678567,2015-05-05,"Subcommittee Work Session: 5/12/2015 10:00 Amendment Legislative Office Building 302 "
678567,2015-05-13,"Executive Session: 5/19/2015 1:15 PM Legislative Office Building 302 "
678567,2015-05-28,"Committee Report: Ought to Pass with Amendment #2015-1683h (NT) for Jun 3 (Vote 21-0; Consent Calendar); House Calendar 39, PG. 1628 "
678567,2015-06-03,"Amendment #1683h: Amendment Adopted Voice Vote; House Journal  44, PG. 1822-1823 "
678567,2015-06-03,"Ought to Pass with Amendment #1683h: Motion Adopted Voice Vote; House Journal  44, PG. 1822-1823 "
678567,2015-06-04,"Sen. Prescott Moved Nonconcur with House Amendment #1683h, New Title; Requests C of C, Motion Adopted, Voice Vote; Senate Journal 17 "
678567,2015-06-04,"President Appoints: Senators Prescott, Bradley, and Pierce "
678567,2015-06-10,"House Accedes to Senate Request for Committee of Conference (Rep Major): Motion Adopted Voice Vote (in recess of 6/3/2015); House Journal  44, PG. 1954 "
678567,2015-06-10,"Speaker Appoints: Reps Hunt, Tucker, Abel, Biggie (in recess of 6/3/2015); House Journal  44, PG. 1954 "
678567,2015-06-10,"Committee of Conference Meeting: === CANCELLED === 6/11/2015, 10:45 a.m., Room 100, State House "
678567,2015-06-10,"Committee of Conference Meeting: === RESCHEDULED === 6/16/2015, 2:00 p.m., Room 103, State House "
678567,2015-06-11,"Conferee Change: Rep Jones Replaces Rep Tucker; House Journal  46, PG. 1990 "
678567,2015-06-15,"Conferee Change; Senator Feltes Replaces Senator Pierce "
678567,2015-06-16,"Conference Committee Report #2015-2238c; House Amendment; Filed "
678567,2015-06-24,"Conference Committee Report 2238c: Adopted, Voice Vote; House Journal  54, PG. 2105 "
678567,2015-06-24,"Conference Committee Report 2238c; Adopted, Voice Vote; Senate Journal 19 "
678567,2015-06-30,"Enrolled Bill Amendment #2341e: Amendment Adopted Voice Vote (In recess of 6/24/2015); House Journal  54, PG. 2140 "
678567,2015-07-01,"Enrolled Bill Amendment #2015-2341e Adopted, Voice Vote, (In recess of 6/24/2015); Senate Journal 19 "
678567,2015-07-09,"Enrolled (in recess of 6/24/2015); House Journal  54, PG. 2142 "
678567,2015-07-09,"Enrolled (In recess 6/24/2015); Senate Journal 19 "
678567,2015-07-21,"Signed by the Governor on 07/20/2015; Chapter 0267; Effective 07/20/2015 "
678592,2015-01-08,"Introduced and Referred to Education; Senate Journal 4  "
678592,2015-01-14,"Hearing: 1/20/15, Room 103, Legislative Office Building, 9:50 a.m.; Senate Calendar 6 "
678592,2015-02-05,"Committee Report: Inexpedient to Legislate, 2/12/15; Senate Calendar 9 "
678592,2015-02-12,"Inexpedient to Legislate, Motion Failed, Voice Vote; Senate Journal 5  "
678592,2015-02-12,"Sen. Bradley moved Ought to Pass; Senate Journal 5  "
678592,2015-02-12,"Ought to Pass: Motion Adopted, Voice Vote; OT3rdg; Senate Journal 5  "
678592,2015-03-04,"Introduced and Referred to Education; House Journal  22, PG. 629 "
678592,2015-03-17,"Public Hearing: 3/24/2015 11:15 Amendment Legislative Office Building 207 "
678592,2015-03-24,"Executive Session: 3/31/2015 1:00 PM Legislative Office Building 207 "
678592,2015-04-08,"Majority Committee Report: Ought to Pass for Apr 15 (Vote 11-9; Regular Calendar); House Calendar 29, PG. 1308 "
678592,2015-04-08,"Minority Committee Report: Inexpedient to Legislate "
678592,2015-04-15,"Ought to Pass: Motion Adopted Regular Calendar 202-138; House Journal  34, PG. 1552-1554 "
678592,2015-04-29,"Enrolled; House Journal  36, PG. 1597 "
678592,2015-04-29,"Enrolled (In recess 4/9/2015); Senate Journal 12 "
678592,2015-05-08,"Vetoed by Governor 05/08/2015 "
678592,2015-09-16,"Notwithstanding the Governor’s Veto, Shall SB 101 Become Law: Regular Calendar 13Y-11N, Veto Sustained, lacking the necessary two-thirds vote; Senate Journal 20 "
678620,2015-01-08,"Introduced and Referred to Commerce; Senate Journal 4  "
678620,2015-01-22,"Hearing:=== CANCELLED === 1/27/15, Room 100, State House, 2:20 p.m.; Senate Calendar 7 "
678620,2015-01-26,"Hearing:=== RESCHEDULED === 2/3/15, Room 100, State House, 2:20 p.m.; Senate Calendar 8 "
678620,2015-02-20,"Committee Report: Ought to Pass, 3/5/15; Senate Calendar 11 "
678620,2015-03-05,"Ought to Pass: Motion Adopted, Voice Vote; OT3rdg; Senate Journal 7  "
678620,2015-03-11,"Introduced and Referred to Commerce and Consumer Affairs; House Journal  26, PG. 1274 "
678620,2015-03-18,"Public Hearing: 3/24/2015 1:15 PM Legislative Office Building 302 "
678620,2015-03-25,"Subcommittee Work Session: 3/31/2015 2:45 PM Legislative Office Building 302 "
678620,2015-04-02,"Subcommittee Work Session: 4/8/2015 2:00 PM Legislative Office Building 302 "
678620,2015-05-06,"Executive Session: 5/12/2015 1:15 PM Legislative Office Building 302 "
678620,2015-05-12,"Retained in Committee "
678620,2015-09-08,"Retained Bill - Subcommittee Work Session: 9/22/2015 11:15 Amendment Legislative Office Building 302 "
678620,2015-09-29,"Executive Session: 10/27/2015 1:15 PM Legislative Office Building 302 "
678620,2015-11-12,"Committee Report: Ought to Pass with Amendment #2015-1241h for Jan 6 (Vote 13-6; Regular Calendar); House Calendar 67, PG. 14 "
678645,2015-01-08,"Introduced and Referred to Public and Municipal Affairs; Senate Journal 4  "
678645,2015-02-11,"Hearing: 2/18/15, Room 102, Legislative Office Building, 10:15 a.m.; Senate Calendar 10 "
678645,2015-03-04,"Committee Report: Ought to Pass, 3/12/15; Senate Calendar 12 "
678645,2015-03-12,"Ought to Pass: Motion Adopted, Voice Vote; OT3rdg; Senate Journal 8  "
678645,2015-03-12,"Introduced and Referred to Election Law; House Journal  26, PG. 1275 "
678645,2015-04-01,"Public Hearing: 4/7/2015 10:15 Amendment Legislative Office Building 308 "
678645,2015-04-15,"Executive Session: 4/21/2015 11:15 Amendment Legislative Office Building 308 "
678645,2015-04-23,"Committee Report: Ought to Pass with Amendment #2015-1298h for Apr 29 (Vote 18-0; Consent Calendar); House Calendar 32, PG. 1482 "
678645,2015-04-29,"Amendment #1298h: Amendment Adopted Voice Vote; House Journal  36, PG. 1577 "
678645,2015-04-29,"Ought to Pass with Amendment #1298h: Motion Adopted Voice Vote; House Journal  36, PG. 1577 "
678645,2015-05-21,"Sen. Birdsell Concurs with House Amendment #1298h, Motion Adopted, Voice Vote; Senate Journal 15 "
678645,2015-06-03,"Enrolled "
678645,2015-06-03,"Enrolled (In recess 5/28/2015); Senate Journal 17 "
678645,2015-06-16,"Signed by the Governor on 06/12/2015; Chapter 0151; Effective 06/12/2015 "
678675,2015-01-08,"Introduced and Referred to Judiciary; Senate Journal 4  "
678675,2015-01-14,"Hearing: 1/22/15, Room 100, State House, 9:20 a.m.; Senate Calendar 6 "
678675,2015-02-20,"Committee Report: Inexpedient to Legislate, 3/5/15; Vote 5-0; Consent Calendar; Senate Calendar 11 "
678675,2015-03-05,"Inexpedient to Legislate, Motion Adopted, Voice Vote === BILL KILLED ===; Senate Journal 7  "
678704,2015-01-08,"Introduced and Referred to Commerce; Senate Journal 4  "
678704,2015-01-15,"Hearing: 1/20/15, Room 100, State House, 1:00 p.m.; Senate Calendar 6 "
678704,2015-02-05,"Committee Report: Inexpedient to Legislate, 2/12/15; Senate Calendar 9 "
678704,2015-02-12,"Inexpedient to Legislate, Motion Adopted, Voice Vote === BILL KILLED ===; Senate Journal 5  "
678732,2015-01-08,"Introduced and Referred to Education; Senate Journal 4  "
678732,2015-01-15,"Hearing:=== CANCELLED === 1/27/15, Room 103, Legislative Office Building, 9:40 a.m.; Senate Calendar 6 "
678732,2015-01-26,"Hearing:=== RESCHEDULED === 2/5/15, Room 103, Legislative Office Building, 9:40 a.m.; Senate Calendar 8 "
678732,2015-02-05,"Committee Report: Inexpedient to Legislate, 2/12/15; Senate Calendar 9 "
678732,2015-02-12,"Inexpedient to Legislate, Motion Adopted, Voice Vote === BILL KILLED ===; Senate Journal 5 "
678756,2015-01-08,"Introduced and Referred to Transportation; Senate Journal 4  "
678756,2015-01-22,"Hearing:=== CANCELLED === 1/27/15, Room 103, Legislative Office Building, 1:15 p.m.; Senate Calendar 7 "
678756,2015-01-26,"Hearing:=== RESCHEDULED === 2/5/15, Room 103, Legislative Office Building, 1:15 p.m.; Senate Calendar 8 "
678756,2015-02-10,"Committee Report: Inexpedient to Legislate, 2/19/15; Vote 5-0; Consent Calendar; Senate Calendar 10 "
678756,2015-02-19,"Sen. Fuller Clark Moved to Remove SB 87 from the Consent Calendar "
678756,2015-02-19,"Inexpedient to Legislate Not Voted On; Senate Journal 6  "
678756,2015-02-19,"Sen. Fuller Clark Moved Laid on Table, Motion Adopted, Voice Vote; Senate Journal 6  "
678783,2015-01-08,"Introduced and Referred to Transportation; Senate Journal 4  "
678783,2015-01-15,"Hearing: 1/20/15, Room 103, Legislative Office Building, 1:30 p.m.; Senate Calendar 6 "
678783,2015-01-22,"Committee Report: Ought to Pass with Amendment #2015-0036s, 1/29/15; Vote 5-0; Consent Calendar; Senate Calendar 7 "
678783,2015-01-29,"Committee Amendment 0036s, Amendment Adopted, Voice Vote "
678783,2015-01-29,"Ought to Pass with Amendment 0036s, Motion Adopted, Voice Vote; OT3rdg; Senate Journal 4  "
678783,2015-03-04,"Introduced and Referred to Public Works and Highways; House Journal  22, PG. 629 "
678783,2015-03-31,"Public Hearing: 4/8/2015 11:15 Amendment Legislative Office Building 201 "
678783,2015-05-12,"Executive Session: 5/20/2015 10:00 Amendment Legislative Office Building 201 "
678783,2015-05-21,"Committee Report: Ought to Pass for Jun 3 (Vote 14-1; Consent Calendar); House Calendar 39, PG. 1631 "
678783,2015-06-03,"Ought to Pass: Motion Adopted Voice Vote; House Journal  44, PG. 1832 "
678783,2015-06-18,"Enrolled (in recess of 6/11/2015); House Journal  46, PG. 1993 "
678783,2015-06-18,"Enrolled (In recess 6/11/2015); Senate Journal 19 "
678783,2015-06-30,"Signed by the Governor on 06/29/15; Chapter 0184; Effective 06/29/2015 "
678804,2015-01-08,"Introduced and Referred to Executive Departments and Administration; Senate Journal 4  "
678804,2015-01-14,"Hearing:=== TIME CHANGE === 1/28/15, Room 101, Legislative Office Building, 12:30 p.m.; Senate Calendar 6 "
678804,2015-01-30,"Committee Report: Ought to Pass, 2/12/15; Vote 5-0; Consent Calendar; Senate Calendar 9 "
678804,2015-02-12,"Ought to Pass: Motion Adopted, Voice Vote; OT3rdg; Senate Journal 5  "
678804,2015-03-04,"Introduced and Referred to Judiciary; House Journal  22, PG. 629 "
678804,2015-03-24,"Public Hearing: 3/31/2015 1:30 PM Legislative Office Building 208 "
678804,2015-04-01,"Executive Session: 4/7/2015 10:00 Amendment Legislative Office Building 208 "
678804,2015-04-08,"Committee Report: Ought to Pass for Apr 15 (Vote 18-0; Consent Calendar); House Calendar 29, PG. 1305 "
678804,2015-04-15,"Ought to Pass: Motion Adopted Voice Vote; House Journal  34, PG. 1546 "
678804,2015-04-29,"Enrolled; House Journal  36, PG. 1597 "
678804,2015-04-29,"Enrolled (In recess 4/9/2015); Senate Journal 12 "
678804,2015-05-08,"Signed by the Governor on 05/05/2015; Chapter 0021; Effective 05/05/2015 "
678833,2015-01-08,"Introduced and Referred to Commerce; Senate Journal 4  "
678833,2015-01-15,"Hearing: 1/20/15, Room 100, State House, 1:15 p.m.; Senate Calendar 6 "
678833,2015-03-04,"Committee Report: Ought to Pass with Amendment #2015-0706s, New Title, 3/12/15; Senate Calendar 12 "
678833,2015-03-12,"Committee Amendment 0706s, New Title, Amendment Adopted, Voice Vote "
678833,2015-03-12,"Ought to Pass with Amendment 0706s, New Title, Motion Adopted, Voice Vote; OT3rdg; Senate Journal 8  "
678833,2015-03-12,"Introduced and Referred to Commerce and Consumer Affairs; House Journal  26, PG. 1275 "
678833,2015-03-18,"Public Hearing: 3/24/2015 2:00 PM Legislative Office Building 302 "
678833,2015-03-19,"===CANCELLED=== Public Hearing: 3/24/2015 2:00 PM Legislative Office Building 302 "
678833,2015-04-01,"Public Hearing: 4/7/2015 1:45 PM Legislative Office Building 302 "
678833,2015-04-07,"Subcommittee Work Session: 4/8/2015 2:00 PM Legislative Office Building 302 "
678833,2015-04-28,"Subcommittee Work Session: 5/5/2015 1:15 PM Legislative Office Building 302 "
678833,2015-05-06,"Executive Session: 5/12/2015 1:15 PM Legislative Office Building 302 "
678833,2015-05-13,"Committee Report: Ought to Pass with Amendment #2015-1343h (NT) for Jun 3 (Vote 19-0; Consent Calendar); House Calendar 39, PG. 1628-1629 "
678833,2015-06-03,"Amendment #1343h: Amendment Adopted Voice Vote; House Journal  44, PG. 1823-1825 "
678833,2015-06-03,"Ought to Pass with Amendment #1343h: Motion Adopted Voice Vote; House Journal  44, PG. 1823-1825 "
678833,2015-06-04,"Sen. Prescott Concurs with House Amendment #1343h, New Title, Motion Adopted Voice Vote; Senate Journal 17 "
678833,2015-06-16,"Enrolled Bill Amendment #2015-2126-EBA: Amendment Adopted Voice Vote (in recess of 6/11/2015); House Journal  46, PG. 1991 "
678833,2015-06-17,"Enrolled Bill Amendment #2015-2126e Adopted, Voice Vote, (In recess of 6/11/2015); Senate Journal 19 "
678833,2015-06-24,"Enrolled; House Journal  54, PG. 2102 "
678833,2015-06-24,"Enrolled (In recess 6/24/2015); Senate Journal 19 "
678833,2015-07-07,"Signed by the Governor on 07/06/2015; Chapter 0207; Effective 09/04/2015 "
678858,2015-01-08,"Introduced and Referred to Executive Departments and Administration; Senate Journal 4  "
678858,2015-01-14,"Hearing: 1/22/15, Room 100, State House, 2:20 p.m.; Senate Calendar 6 "
678858,2015-01-30,"Committee Report: Ought to Pass, 2/12/15; Senate Calendar 9 "
678858,2015-02-12,"Ought to Pass: Motion Adopted, Voice Vote; OT3rdg; Senate Journal 5  "
678858,2015-03-04,"Introduced and Referred to Executive Departments and Administration; House Journal  22, PG. 629 "
678858,2015-03-11,"Public Hearing: 3/17/2015 11:00 Amendment Legislative Office Building 306 "
678858,2015-03-18,"Executive Session: 3/24/2015 10:00 Amendment Legislative Office Building 306 "
678858,2015-04-08,"Committee Report: Ought to Pass for Apr 15 (Vote 13-0; Consent Calendar); House Calendar 29, PG. 1303 "
678858,2015-04-15,"Ought to Pass: Motion Adopted Voice Vote; House Journal  34, PG. 1538 "
678858,2015-04-29,"Enrolled; House Journal  36, PG. 1597 "
678858,2015-04-29,"Enrolled (In recess 4/9/2015); Senate Journal 12 "
678858,2015-05-08,"Signed by the Governor on 05/07/2015; Chapter 0030; Effective 07/06/2015 "
678882,2015-01-08,"Introduced and Referred to Judiciary; Senate Journal 4  "
678882,2015-01-14,"Hearing:=== CANCELLED === 1/27/15, Room 100, State House, 9:15 a.m.; Senate Calendar 6 "
678882,2015-01-26,"Hearing:=== RESCHEDULED === 2/3/15, Room 100, State House, 9:15 a.m.; Senate Calendar 8 "
678882,2015-02-20,"Committee Report: Ought to Pass with Amendment #2015-0499s, New Title, 3/5/15; Senate Calendar 11 "
678882,2015-03-05,"Committee Amendment 0499s, New Title, Amendment Adopted, Voice Vote "
678882,2015-03-05,"Ought to Pass with Amendment 0499s, New Title, Motion Adopted, Voice Vote; OT3rdg; Senate Journal 7  "
678882,2015-03-11,"Introduced and Referred to Children and Family Law; House Journal  26, PG. 1274 "
678882,2015-03-17,"Public Hearing: 3/24/2015 11:00 Amendment Legislative Office Building 204 "
678882,2015-04-01,"Executive Session: 4/7/2015 1:00 PM Legislative Office Building 206 "
678882,2015-04-08,"Committee Report: Ought to Pass for Apr 15 (Vote 12-0; Consent Calendar); House Calendar 29, PG. 1301 "
678882,2015-04-15,"Ought to Pass: Motion Adopted Voice Vote; House Journal  34, PG. 1534 "
678882,2015-04-29,"Enrolled; House Journal  36, PG. 1597 "
678882,2015-04-29,"Enrolled (In recess 4/9/2015); Senate Journal 12 "
678882,2015-05-08,"Signed by the Governor on 05/05/2015; Chapter 0023; Effective 05/05/2015 "
678906,2015-01-08,"Introduced and Referred to Health and Human Services; Senate Journal 4  "
678906,2015-01-28,"Hearing: 2/3/15, Room 101, Legislative Office Building, 2:30 p.m.; Senate Calendar 8 "
678906,2015-03-03,"Committee Report: Ought to Pass with Amendment #2015-0640s, 3/12/15; Senate Calendar 12 "
678906,2015-03-12,"Committee Amendment 0640s, Amendment Adopted, Voice Vote "
678906,2015-03-12,"Ought to Pass with Amendment 0640s, Motion Adopted, Voice Vote; OT3rdg; Senate Journal 8  "
678906,2015-03-12,"Introduced and Referred to Health, Human Services and Elderly Affairs; House Journal  26, PG. 1274 "
678906,2015-03-18,"Public Hearing: 3/24/2015 10:00 Amendment Legislative Office Building 205 "
678906,2015-03-25,"==CANCELED==Executive Session: 4/2/2015 10:30 Amendment Legislative Office Building 205 "
678906,2015-04-01,"Executive Session: 4/7/2015 10:30 Amendment Legislative Office Building 205 "
678906,2015-04-09,"Committee Report: Ought to Pass with Amendment #2015-1251h for Apr 15 (Vote 17-1; Consent Calendar); House Calendar 29, PG. 1304 "
678906,2015-04-15,"Removed from Consent (Rep Kotowski); House Journal  34, PG. 1534 "
678906,2015-04-15,"Amendment #1251h: Amendment Adopted Voice Vote; House Journal  34, PG. 1560 "
678906,2015-04-15,"Ought to Pass with Amendment #1251h: Motion Adopted Voice Vote; House Journal  34, PG. 1560 "
678906,2015-05-14,"Sen. Sanborn Concurs with House Amendment #1251h, Motion Adopted, Voice Vote; Senate Journal 14 "
678906,2015-06-03,"Enrolled "
678906,2015-06-03,"Enrolled (In recess 5/28/2015); Senate Journal 17 "
678906,2015-06-16,"Signed by the Governor on 06/12/2015; Chapter 0143; Effective 08/11/2015 "
678933,2015-01-08,"Introduced and Referred to Public and Municipal Affairs; Senate Journal 4  "
678933,2015-01-15,"Hearing: 1/21/15, Room 102, Legislative Office Building, 10:00 a.m.; Senate Calendar 6 "
678933,2015-01-22,"Committee Report: Ought to Pass, 1/29/15; Vote 5-0; Consent Calendar; Senate Calendar 7 "
678933,2015-01-29,"Ought to Pass: Motion Adopted, Voice Vote; OT3rdg; Senate Journal 4  "
678933,2015-03-04,"Introduced and Referred to Municipal and County Government; House Journal  22, PG. 629 "
678933,2015-03-17,"Public Hearing: 3/24/2015 11:00 Amendment Legislative Office Building 301 "
678933,2015-03-17,"Executive Session: 3/26/2015 10:00 Amendment Legislative Office Building 301 "
678933,2015-03-27,"Committee Report: Ought to Pass with Amendment #2015-1118h for Apr 15 (Vote 15-0; Consent Calendar); House Calendar 29, PG. 1306 "
678933,2015-04-15,"Amendment #1118h: Amendment Adopted Voice Vote; House Journal  34, PG. 1546-1547 "
678933,2015-04-15,"Ought to Pass with Amendment #1118h: Motion Adopted Voice Vote; House Journal  34, PG. 1546-1547 "
678933,2015-04-30,"Sen. Birdsell Moved Nonconcur with House Amendment #1118h; Requests C of C, Motion Adopted, Voice Vote; Senate Journal 12 "
678933,2015-04-30,"President Appoints: Senators Birdsell, Boutin and Lasky "
678933,2015-06-03,"House Accedes to Senate Request for Committee of Conference (Rep J. Belanger): Motion Adopted Voice Vote; House Journal  44, PG. 1816 "
678933,2015-06-03,"Speaker Appoints: Reps J. Belanger, Coffey, Porter, Sterling; House Journal  44, PG. 1816 "
678933,2015-06-08,"Committee of Conference Meeting: 6/9/2015, 11:00 a.m., Room 103, State House === RECESSED === "
678933,2015-06-09,"Committee of Conference Meeting: === RECONVENE === 6/9/2015, 1:00 p.m., Room 100, State House "
678933,2015-06-11,"Conference Committee Report #2015-2100c, House Amendment + New Amendment, Filed "
678933,2015-06-24,"Conference Committee Report 2100c: Adopted, Voice Vote; House Journal  54, PG. 2104-2105 "
678933,2015-06-24,"Conference Committee Report 2100c; Adopted, Voice Vote; Senate Journal 19 "
678933,2015-07-02,"Enrolled (In recess of 6/24/2015); House Journal  54, PG. 2141 "
678933,2015-07-02,"Enrolled (In recess 6/24/2015); Senate Journal 19 "
678933,2015-07-15,"Signed by the Governor on 07/13/2015; Chapter 0247; Effective 09/11/2015 "
678957,2015-01-08,"Introduced and Referred to Executive Departments and Administration; Senate Journal 4  "
678957,2015-01-14,"Hearing: 1/22/15, Room 100, State House, 1:45 p.m.; Senate Calendar 6 "
678957,2015-01-30,"Committee Report: Ought to Pass with Amendment #2015-0061s, 2/12/15; Vote 5-0; Consent Calendar; Senate Calendar 9 "
678957,2015-02-12,"Committee Amendment 0061s, Amendment Adopted, Voice Vote "
678957,2015-02-12,"Ought to Pass with Amendment 0061s, Motion Adopted, Voice Vote; OT3rdg; Senate Journal 5  "
678957,2015-03-04,"Introduced and Referred to Executive Departments and Administration; House Journal  22, PG. 629 "
678957,2015-03-11,"Public Hearing: 3/17/2015 11:30 Amendment Legislative Office Building 306 "
678957,2015-04-08,"Executive Session: 4/28/2015 10:00 Amendment Legislative Office Building 306 "
678957,2015-04-30,"Committee Report: Ought to Pass for May 6 (Vote 11-1; Consent Calendar); House Calendar 33, PG. 1508 "
678957,2015-05-06,"Ought to Pass: Motion Adopted Voice Vote; House Journal  41, PG. 1750 "
678957,2015-05-19,"Enrolled (in recess of 5/6/2015); House Journal  41, PG. 1781 "
678957,2015-05-19,"Enrolled (In recess 5/14/2015); Senate Journal 15 "
678957,2015-06-03,"Signed by the Governor on 06/02/15; Chapter 0077; Effective 06/02/2015 "
678981,2015-01-08,"Introduced and Referred to Ways and Means; Senate Journal 4  "
678981,2015-02-18,"Hearing: 3/3/15, Room 103, State House, 9:30 a.m.; Senate Calendar 11 "
678981,2015-03-03,"Committee Report: Rereferred to Committee, 3/12/15; Senate Calendar 12 "
678981,2015-03-12,"Rereferred to Committee, Motion Adopted, Voice Vote, Senate Journal 8  "
678981,2015-10-14,"Committee Report: Inexpedient to Legislate, 1/6/16; Senate Calendar 49 "
679039,2015-01-08,"Introduced and Referred to Finance; House Journal  12, PG. 214 "
679039,2015-01-21,"==POSTPONED== Public Hearing: 1/27/2015 1:45 PM Legislative Office Building 210-211 "
679039,2015-01-26,"==RESCHEDULED== Public Hearing: 1/29/2015 10:30 Amendment Legislative Office Building 210-211 "
679039,2015-01-28,"Division II Work Session: 2/3/2015 10:00 Amendment Legislative Office Building 209 "
679039,2015-01-28,"Executive Session: 2/5/2015 10:00 Amendment Legislative Office Building 210-211 "
679039,2015-02-10,"Majority Committee Report: Inexpedient to Legislate for Feb 18 (Vote 14-9; Regular Calendar); House Calendar13, PG. 247 "
679039,2015-02-10,"Minority Committee Report: Ought to Pass "
679039,2015-02-18,"Inexpedient to Legislate: Motion Adopted Regular Calendar 226-135; House Journal  20, PG. 514-516 "
679046,2015-01-08,"Introduced and Referred to Education; House Journal  12, PG. 214 "
679046,2015-01-21,"Public Hearing: 2/3/2015 1:00 PM Legislative Office Building 207 "
679046,2015-01-29,"===CANCELLED=== Public Hearing: 2/3/2015 1:00 PM Legislative Office Building 207 "
679046,2015-02-04,"Public Hearing: 2/12/2015 2:55 PM Legislative Office Building 207 "
679046,2015-02-11,"Executive Session: 2/17/2015 10:00 Amendment Legislative Office Building 207 "
679046,2015-02-20,"Committee Report: Inexpedient to Legislate for Mar 4 (Vote 21-0; Consent Calendar); House Calendar18, PG. 344 "
679046,2015-03-04,"Inexpedient to Legislate: Motion Adopted Voice Vote; House Journal  22, PG. 559 "
679057,2015-01-08,"Introduced and Referred to Environment and Agriculture; House Journal  12, PG. 214 "
679057,2015-01-28,"Public Hearing: 2/10/2015 1:00 PM Legislative Office Building 303 "
679057,2015-02-11,"Executive Session: 3/3/2015 10:00 Amendment Legislative Office Building 303 "
679057,2015-03-05,"Committee Report: Inexpedient to Legislate for Mar 11 (Vote 19-0; Consent Calendar); House Calendar19, PG. 398-399 "
679057,2015-03-11,"Inexpedient to Legislate: Motion Adopted Voice Vote; House Journal  24, PG. 783 "
679068,2015-01-08,"Introduced and Referred to Commerce and Consumer Affairs; House Journal  12, PG. 215 "
679068,2015-01-20,"Public Hearing: 2/5/2015 10:00 Amendment Legislative Office Building 302 "
679068,2015-02-20,"Executive Seesion: 3/3/2015 1:00 PM Legislative Office Building 302 "
679068,2015-03-05,"Committee Report: Inexpedient to Legislate for Mar 11 (Vote 20-0; Consent Calendar); House Calendar19, PG. 391 "
679068,2015-03-11,"Inexpedient to Legislate: Motion Adopted Voice Vote; House Journal  24, PG. 770 "
679080,2015-01-08,"Introduced and Referred to Criminal Justice and Public Safety; House Journal  12, PG. 214 "
679080,2015-01-21,"==POSTPONED==Public Hearing: 1/27/2015 11:00 Amendment Legislative Office Building 204 "
679080,2015-01-26,"==RESCHEDULED==Public Hearing: 1/28/2015 11:00 Amendment Legislative Office Building 204 "
679080,2015-02-04,"Executive Session: 2/4/2015 1:00 PM Legislative Office Building 204 "
679080,2015-02-05,"Majority Committee Report: Inexpedient to Legislate for Feb 11 (Vote 10-6; Regular Calendar); House Calendar11, PG. 179 "
679080,2015-02-05,"Minority Committee Report: Ought to Pass "
679080,2015-02-11,"Inexpedient to Legislate: Motion Adopted Voice Vote; House Journal  16, PG. 307 "
679095,2015-01-08,"Introduced and Referred to Commerce and Consumer Affairs; House Journal  12, PG. 213 "
679095,2015-01-20,"==POSTPONED==Public Hearing: 1/27/2015 11:00 Amendment Legislative Office Building 302 "
679095,2015-01-20,"==RESCHEDULED== Public Hearing: 1/28/2015 11:00 Amendment Legislative Office Building 302 "
679095,2015-01-20,"==CANCELED== Executive Session: 2/3/2015 Legislative Office Building 302 "
679095,2015-01-29,"Subcommittee Work Session: 2/5/2015 1:15 PM Legislative Office Building 302 "
679095,2015-02-06,"Executive Session: 2/10/2015 11:30 Amendment Legislative Office Building 302 "
679095,2015-02-12,"Majority Committee Report: Ought to Pass for Feb 18 (Vote 12-7; Regular Calendar); House Calendar13, PG. 244 "
679095,2015-02-12,"Minority Committee Report: Inexpedient to Legislate "
679095,2015-02-18,"Ought to Pass: Motion Adopted Voice Vote; House Journal  20, PG. 506 "
679095,2015-02-18,"Referred to Criminal Justice and Public Safety "
679095,2015-03-09,"Public Hearing: 3/17/2015 11:00 Amendment Legislative Office Building 204 "
679095,2015-03-19,"Committee Report: Ought to Pass with Amendment #2015-0966h for Mar 25 (Vote 16-0; Consent Calendar); House Calendar 23, PG. 632 "
679095,2015-03-25,"Amendment #0966h: Amendment Adopted Voice Vote; House Journal  28, PG. 1289-1290 "
679095,2015-03-25,"Ought to Pass with Amendment #0966h: Motion Adopted Voice Vote; House Journal  28, PG. 1289-1290 "
679095,2015-03-26,"Introduced and Referred to Commerce; Senate Journal 11 "
679095,2015-04-16,"Hearing: 4/21/15, Room 100, State House, 1:00 p.m.; Senate Calendar 18 "
679095,2015-05-20,"Committee Report: Ought to Pass with Amendment #2015-1838s, New Title, 5/28/15; Vote 5-0; Consent Calendar; Senate Calendar 23 "
679095,2015-05-28,"Committee Amendment 1838s, New Title, Amendment Adopted, Voice Vote "
679095,2015-05-28,"Ought to Pass with Amendment 1838s, New Title, Motion Adopted, Voice Vote; OT3rdg; Senate Journal 16 "
679095,2015-06-11,"House Concurs with Senate Amendment #1838s (Reps Hunt, Tholl): Motion Adopted Voice Vote; House Journal  46, PG. 1988 "
679095,2015-06-29,"Enrolled (In recess 6/24/2015); Senate Journal 19 "
679095,2015-06-29,"Enrolled (In recess of 6/24/2015); House Journal  54, PG. 2139 "
679095,2015-07-15,"Signed by the Governor on 7/13/2015; Chapter 224; Effective Date 1/1/2016 "
679106,2015-01-08,"Introduced and Referred to Municipal and County Government; House Journal  12, PG. 214 "
679106,2015-01-21,"==POSTPONED== Public Hearing: 1/27/2015 1:00 PM Legislative Office Building 301 "
679106,2015-01-26,"==RESCHEDULED== Public Hearing: 1/28/2015 1:00 PM Legislative Office Building 301 "
679106,2015-02-05,"Executive Session: 2/12/2015 12:00 PM Legislative Office Building 301 "
679106,2015-02-12,"Committee Report: Inexpedient to Legislate for Feb 18 (Vote 13-0; Consent Calendar); House Calendar13, PG. 241 "
679106,2015-02-18,"Inexpedient to Legislate: Motion Adopted Voice Vote; House Journal  20, PG. 503 "
679117,2015-01-08,"Introduced and Referred to Transportation; House Journal  12, PG. 214 "
679117,2015-01-21,"==POSTPONED== Public Hearing: 1/27/2015 2:00 PM Legislative Office Building 203 "
679117,2015-01-26,"==RESCHEDULED== Public Hearing: 1/28/2015 2:00 PM Legislative Office Building 203 "
679117,2015-01-29,"Executive Session: 2/3/2015 1:30 PM Legislative Office Building 203 ==RECESSED== "
679117,2015-02-04,"Continued Executive Session: 2/10/2015 1:30 PM Legislative Office Building 203 "
679117,2015-02-13,"Committee Report: Ought to Pass for Feb 18 (Vote 17-0; Consent Calendar); House Calendar13, PG. 243 "
679117,2015-02-18,"Ought to Pass: Motion Adopted Voice Vote; House Journal  20, PG. 505 "
679117,2015-03-12,"Introduced and Referred to Transportation; Senate Journal 9  "
679117,2015-03-26,"Hearing: 3/31/15, Room 103, Legislative Office Building, 1:30 p.m.; Senate Calendar 15 "
679117,2015-04-01,"Committee Report: Ought to Pass, 4/9/15; Senate Calendar 16 "
679117,2015-04-09,"Ought to Pass: Motion Adopted, Voice Vote; OT3rdg; Senate Journal 11 "
679117,2015-04-21,"Enrolled (In recess 4/9/2015); Senate Journal 12 "
679117,2015-04-22,"Enrolled (in recess of 4/15/2015); House Journal  34, PG. 1564 "
679117,2015-05-07,"Signed by the Governor on 5/5/2015; Chapter 12; Effective Date 7/4/2015 "
679130,2015-01-08,"Introduced and Referred to Municipal and County Government; House Journal  12, PG. 213 "
679130,2015-01-28,"Public Hearing: 2/3/2015 11:00 Amendment Legislative Office Building 301 "
679130,2015-02-04,"Subcommittee Work Session: 2/10/2015 9:00 Amendment Legislative Office Building 301 "
679130,2015-02-05,"Executive Session: 2/12/2015 2:30 PM Legislative Office Building 301 "
679130,2015-02-20,"Committee Report: Inexpedient to Legislate for Mar 4 (Vote 15-1; Consent Calendar); House Calendar18, PG. 348 "
679130,2015-03-04,"Removed from Consent Calendar (Rep Cushing); House Journal  22, PG. 559 "
679130,2015-03-04,"Inexpedient to Legislate: Motion Adopted DV 249-77; House Journal  22, PG. 620 "
679140,2015-01-08,"Introduced and Referred to Children and Family Law; House Journal  12, PG. 214 "
679140,2015-01-28,"Public Hearing: 2/3/2015 10:00 Amendment Legislative Office Building 206 "
679140,2015-02-17,"Subcommittee Work Session: 2/19/2015 1:00 PM Legislative Office Building 206 "
679140,2015-02-24,"Executive Session: 3/3/2015 10:00 Amendment Legislative Office Building 206 "
679140,2015-03-06,"Retained in Committee "
679140,2015-03-10,"Full Committee Work Session: 3/17/2015 10:00 Amendment Legislative Office Building 206 "
679140,2015-05-13,"Subcommittee Work Session: 5/19/2015 10:00 Amendment Legislative Office Building 206 "
679140,2015-06-09,"Retained Bill - Full Committee Work Session: 6/23/2015 10:00 Amendment Legislative Office Building 206 "
679140,2015-08-24,"Retained Bill - Full Committee Work Session: 9/16/2015 10:00 Amendment Legislative Office Building 206 "
679140,2015-09-16,"Retained Bill - Subcommittee Work Session: 9/22/2015 10:00 Amendment Legislative Office Building 206 "
679140,2015-09-16,"Executive Session: 9/29/2015 10:00 Amendment Legislative Office Building 206 "
679140,2015-11-12,"Committee Report: Refer to Interim Study for Jan 6 (Vote 16-0; Consent Calendar); House Calendar 67, PG. 3 "
679155,2015-01-08,"Introduced and Referred to Criminal Justice and Public Safety; House Journal  12, PG. 214 "
679155,2015-01-21,"Public Hearing: 1/29/2015 1:30 PM Legislative Office Building 204 "
679155,2015-01-21,"===CANCELLED=== Public Hearing: 1/29/2015 1:30 PM Legislative Office Building 204 "
679155,2015-01-28,"Public Hearing: 2/3/2015 2:30 PM Legislative Office Building 204 "
679155,2015-02-25,"Executive Session: 3/3/2015 10:30 Amendment Legislative Office Building 204 "
679155,2015-03-05,"Committee Report: Ought to Pass with Amendment #2015-0161h for Mar 11 (Vote 17-0; Regular Calendar); House Calendar19, PG. 416-417 "
679155,2015-03-11,"Amendment #0161h: Amendment Adopted Voice Vote; House Journal  24, PG. 845-846 "
679155,2015-03-11,"Ought to Pass with Amendment #0161h: Motion Adopted Voice Vote "
679155,2015-03-19,"Introduced and Referred to Judiciary; Senate Journal 10 "
679155,2015-03-25,"Hearing: 4/2/15, Room 100, State House, 9:00 a.m.; Senate Calendar 15 "
679155,2015-05-06,"Committee Report: Ought to Pass, 5/14/15; Vote 5-0; Consent Calendar; Senate Calendar 21 "
679155,2015-05-14,"Ought to Pass: Motion Adopted, Voice Vote; OT3rdg; Senate Journal 14 "
679155,2015-06-03,"Enrolled (In recess 5/28/2015); Senate Journal 17 "
679155,2015-06-03,"Enrolled "
679155,2015-06-16,"Signed by the Governor on 6/12/2015; Chapter 135; Effective Date 1/1/2016 "
679168,2015-01-08,"Introduced and Referred to Education; House Journal  12, PG. 214 "
679168,2015-01-21,"Public Hearing: 2/3/2015 11:00 Amendment Legislative Office Building 207 "
679168,2015-01-29,"===CANCELLED=== Public Hearing: 2/3/2015 11:00 Amendment Legislative Office Building 207 "
679168,2015-01-29,"Public Hearing: 2/12/2015 2:00 PM Legislative Office Building 207 "
679168,2015-02-04,"===CANCELLED=== Public Hearing: 2/12/2015 2:00 PM Legislative Office Building 207 "
679168,2015-02-04,"Public Hearing: 2/12/2015 11:00 Amendment Legislative Office Building 207 "
679168,2015-02-11,"Executive Session: 2/17/2015 10:00 Amendment Legislative Office Building 207 "
679168,2015-02-17,"Retained in Committee "
679168,2015-05-12,"Retained Bill - Subcommittee Work Session: 5/26/2015 10:00 Amendment Legislative Office Building 207 "
679168,2015-05-26,"Retained Bill - Subcommittee Work Session: 6/9/2015 10:00 Amendment Legislative Office Building 207 "
679168,2015-08-13,"Retained Bill - Subcommittee Work Session: 9/9/2015 10:00 Amendment Legislative Office Building 207 "
679168,2015-09-09,"Executive Session: 10/27/2015 10:00 Amendment Legislative Office Building 207 "
679168,2015-11-12,"Committee Report: Inexpedient to Legislate for Jan 6 (Vote 20-0; Consent Calendar); House Calendar 67, PG. 5 "
679181,2015-01-08,"Introduced and Referred to Science, Technology and Energy; House Journal  12, PG. 214 "
679181,2015-01-21,"==POSTPONED==Public Hearing: 1/27/2015 11:15 Amendment Legislative Office Building 304 "
679181,2015-01-22,"==POSTPONED== Public Hearing: 1/27/2015 11:15 Amendment Representatives Hall "
679181,2015-01-26,"==RESCHEDULED== Public Hearing: 1/28/2015 11:15 Amendment Representatives Hall "
679181,2015-01-28,"Public Hearing: 2/5/2015 2:00 PM Legislative Office Building 304 "
679181,2015-02-11,"Executive Session: 2/17/2015 1:15 PM Legislative Office Building 304 "
679181,2015-02-23,"Committee Report: Inexpedient to Legislate for Mar 4 (Vote 19-0; Consent Calendar); House Calendar18, PG. 351 "
679181,2015-03-04,"Inexpedient to Legislate: Motion Adopted Voice Vote; House Journal  22, PG. 568 "
679192,2015-01-08,"Introduced and Referred to Transportation; House Journal  12, PG. 214 "
679192,2015-01-21,"==POSTPONED== Public Hearing: 1/27/2015 11:30 Amendment Legislative Office Building 203 "
679192,2015-01-26,"==RESCHEDULED== Public Hearing: 1/28/2015 11:30 Amendment Legislative Office Building 203 "
679192,2015-01-29,"Public Hearing: 2/3/2015 10:00 Amendment Legislative Office Building 203 "
679192,2015-02-04,"Executive Session: 2/10/2015 1:30 PM Legislative Office Building 203 "
679192,2015-02-12,"Majority Committee Report: Ought to Pass for Feb 18 (Vote 10-8; Regular Calendar); House Calendar13, PG. 250-251 "
679192,2015-02-12,"Minority Committee Report: Inexpedient to Legislate "
679192,2015-02-18,"Lay on Table (Rep S. Smith): Motion Adopted Regular Calendar 296-56; House Journal  20, PG. 533-535 "
679205,2015-01-08,"Introduced and Referred to Judiciary; House Journal  12, PG. 214 "
679205,2015-01-21,"Public Hearing: 1/29/2015 3:00 PM Legislative Office Building 207 "
679205,2015-02-04,"Executive Session: 2/4/2015 1:30 PM Legislative Office Building 208 "
679205,2015-02-05,"Committee Report: Inexpedient to Legislate for Feb 11 (Vote 14-1; Consent Calendar); House Calendar11, PG. 174-175 "
679205,2015-02-11,"Removed from Consent Calendar (Rep Hoell); House Journal  16, PG. 298 "
679205,2015-02-11,"Inexpedient to Legislate: Motion Adopted Regular Calendar 225-115; House Journal  16, PG. 326-328 "
679216,2015-01-08,"Introduced and Referred to Commerce and Consumer Affairs; House Journal  12, PG. 214 "
679216,2015-01-20,"Public Hearing: 1/29/2015 11:00 Amendment Legislative Office Building 302 "
679216,2015-01-21,"===CANCELLED=== Public Hearing: 1/29/2015 11:00 Amendment Legislative Office Building 302 "
679216,2015-02-04,"Vacated from Commerce and Consumer Affairs and Referred to Health, Human Services and Elderly Affairs; House Journal  14, PG. 273 "
679216,2015-02-12,"Public Hearing: 2/17/2015 10:00 Amendment Legislative Office Building 205 "
679216,2015-02-26,"Executive Session: 3/3/2015 Legislative Office Building 205 "
679216,2015-03-05,"Committee Report: Inexpedient to Legislate for Mar 11 (Vote 16-1; Consent Calendar); House Calendar19, PG. 402 "
679216,2015-03-11,"Inexpedient to Legislate: Motion Adopted Voice Vote; House Journal  24, PG. 789 "
679227,2015-01-08,"Introduced and Referred to Education; House Journal  12, PG. 213 "
679227,2015-01-21,"Public Hearing: 1/29/2015 10:00 Amendment Legislative Office Building 206-208 "
679227,2015-01-29,"Executive Session: 2/5/2015 11:30 Amendment Legislative Office Building 207 "
679227,2015-02-05,"Retained in Committee "
679227,2015-05-06,"Retained Bill - Subcommittee Work Session: 5/19/2015 10:00 Amendment Legislative Office Building 207 "
679227,2015-05-12,"Retained Bill - Subcommittee Work Session: 5/26/2015 1:00 PM Legislative Office Building 207 "
679227,2015-08-17,"Retained Bill - Subcommittee Work Session: 8/25/2015 1:00 PM Legislative Office Building 207 "
679227,2015-08-25,"Retained Bill - Subcommittee Work Session: 9/8/2015 9:30 Amendment Legislative Office Building 207 "
679227,2015-09-09,"Retained Bill - Subcommittee Work Session: 10/6/2015 10:00 Amendment Legislative Office Building 207 "
679227,2015-10-07,"Retained Bill - Subcommittee Work Session: 10/20/2015 1:00 PM Legislative Office Building 207 "
679227,2015-10-08,"Executive Session: 10/27/2015 10:00 Amendment Legislative Office Building 207 "
679227,2015-11-12,"Majority Committee Report: Ought to Pass with Amendment #2015-2509h for Jan 6 (Vote 13-7; Regular Calendar); House Calendar 67, PG. 17 "
679227,2015-11-17,"Minority Committee Report: Inexpedient to Legislate "
679240,2015-01-08,"Introduced and Referred to Election Law; House Journal  12, PG. 213 "
679240,2015-01-21,"==POSTPONED== Public Hearing: 1/27/2015 1:45 PM Legislative Office Building 308 "
679240,2015-01-26,"==RESCHEDULED== Public Hearing: 1/28/2015 1:45 PM Legislative Office Building 308 "
679240,2015-01-29,"Subcommittee Work Session: 2/5/2015 1:00 PM Legislative Office Building 308 "
679240,2015-02-11,"Executive Session: 2/17/2015 11:00 Amendment Legislative Office Building 308 "
679240,2015-02-20,"Committee Report: Inexpedient to Legislate for Mar 4 (Vote 16-0; Consent Calendar); House Calendar18, PG. 345 "
679240,2015-03-04,"Removed from Consent Calendar (Rep Rideout); House Journal  22, PG. 588 "
679240,2015-03-04,"Lay on Table (Rep Rideout): Motion Failed DV 149-184; House Journal  22, PG. 613 "
679240,2015-03-04,"Inexpedient to Legislate: Motion Adopted Regular Calendar 253-89; House Journal  22, PG. 613-615 "
679253,2015-01-08,"Introduced and Referred to Municipal and County Government; House Journal  12, PG. 213 "
679253,2015-01-28,"Public Hearing: 2/5/2015 10:00 Amendment Legislative Office Building 301 "
679253,2015-01-29,"==RESCHEDULED== Public Hearing: 2/5/2015 8:30 Amendment Legislative Office Building 301 "
679253,2015-02-04,"Subcommittee Work Session: 2/10/2015 9:30 Amendment Legislative Office Building 301 "
679253,2015-02-05,"Executive Session: 2/10/2015 2:00 PM Legislative Office Building 301 ==RECESSED== "
679253,2015-02-10,"Subcommittee Work Session: 2/12/2015 11:30 Amendment Legislative Office Building 301 "
679253,2015-02-11,"Continued Executive Session: 2/17/2015 4:00 PM Legislative Office Building 301 "
679253,2015-02-17,"Retained in Committee "
679253,2015-04-28,"Subcommittee Work Session: 5/5/2015 10:00 Amendment Legislative Office Building 301 "
679253,2015-08-03,"Retained Bill - Subcommittee Work Session: 9/8/2015 11:00 Amendment Legislative Office Building 301 "
679253,2015-09-16,"Executive Session: 10/6/2015 2:00 PM Legislative Office Building 301 "
679253,2015-11-12,"Committee Report: Inexpedient to Legislate (Vote 13-0; Consent Calendar) "
679264,2015-01-08,"Introduced and Referred to Environment and Agriculture; House Journal  12, PG. 214 "
679264,2015-01-28,"Public Hearing: 2/10/2015 10:30 Amendment Legislative Office Building 303 "
679264,2015-02-11,"Executive Session: 3/3/2015 10:00 Amendment Legislative Office Building 303 "
679264,2015-03-05,"Committee Report: Inexpedient to Legislate for Mar 11 (Vote 17-0; Consent Calendar); House Calendar19, PG. 398 "
679264,2015-03-12,"Removed from Consent (Rep McConnell); House Journal  24, PG. 766 "
679264,2015-03-12,"Inexpedient to Legislate: Motion Adopted DV 242-32; House Journal  26, PG. 1270 "
679278,2015-01-08,"Introduced and Referred to Ways and Means; House Journal  12, PG. 214 "
679278,2015-01-21,"==POSTPONED== Public Hearing: 1/27/2015 10:00 Amendment Legislative Office Building 202 "
679278,2015-01-26,"==RESCHEDULED== Public Hearing: 1/28/2015 10:00 Amendment Legislative Office Building 202=POSTPONED= "
679278,2015-01-29,"Public Hearing: 2/9/2015 9:30 Amendment Legislative Office Building 202=RECESSED= "
679278,2015-02-09,"Continued Public Hearing: 2/10/2015 11:15 Amendment Legislative Office Building 202 "
679278,2015-02-12,"Committee Report: Ought to Pass for Feb 18 (Vote 13-5; Regular Calendar); House Calendar13, PG. 251 "
679278,2015-02-18,"Ought to Pass: Motion Adopted Voice Vote; House Journal  20, PG. 537 "
679278,2015-02-18,"Referred to Finance "
679278,2015-02-18,"Second Committee Referral Waived by Committee Chair per House Rule 46(f); House Journal  20, PG. 544 "
679278,2015-03-12,"Introduced and Referred to Transportation; Senate Journal 9  "
679278,2015-04-01,"Hearing: 4/7/15, Room 103, Legislative Office Building, 1:15 p.m.; Senate Calendar 16 "
679278,2015-04-13,"=== CANCELLED SESSION === Committee Report: Ought to Pass with Amendment 1267s, 4/23/15; Senate Calendar 18 "
679278,2015-04-17,"=== RESCHEDULED === Committee Report: Ought to Pass with Amendment #2015-1267s, 4/30/15; Senate Calendar 19 "
679278,2015-04-30,"Committee Amendment 1267s, Amendment Adopted, Voice Vote "
679278,2015-04-30,"Ought to Pass with Amendment 1267s, Regular Calendar 17Y-7N, Motion Adopted; Refer to Finance Rule 4-5; Senate Journal 12 "
679278,2015-05-20,"Committee Report: Ought to Pass, 5/28/15; Senate Calendar 23 "
679278,2015-05-28,"Ought to Pass: Regular Calendar 14Y-7N, Motion Adopted; OT3rdg; Senate Journal 16 "
679278,2015-06-03,"House Concurs with Senate Amendment #1267s (Rep Major): Motion Adopted Voice Vote; House Journal  44, PG. 1814 "
679278,2015-06-18,"Enrolled (In recess 6/11/2015); Senate Journal 19 "
679278,2015-06-18,"Enrolled (in recess of 6/11/2015); House Journal  46, PG. 1993 "
679278,2015-06-30,"Signed by the Governor on 6/26/2015; Chapter 163; Effective Date 7/1/2015 "
679294,2015-01-08,"Introduced and Referred to Municipal and County Government; House Journal  12, PG. 214 "
679294,2015-02-11,"Public Hearing: 2/17/2015 10:20 Amendment Legislative Office Building 301 "
679294,2015-02-11,"Executive Session: 2/17/2015 10:30 Amendment Legislative Office Building 301 "
679294,2015-02-20,"Committee Report: Ought to Pass for Mar 4 (Vote 18-0; Consent Calendar); House Calendar18, PG. 348 "
679294,2015-03-04,"Ought to Pass: Motion Adopted Voice Vote; House Journal  22, PG. 564 "
679294,2015-03-12,"Introduced and Referred to Energy and Natural Resources; Senate Journal 9  "
679294,2015-04-30,"Hearing: 5/6/15, Room 100, State House, 9:00 a.m.; Senate Calendar 20 "
679294,2015-05-13,"Committee Report: Ought to Pass with Amendment #2015-1734s, 5/21/15; Senate Calendar 22 "
679294,2015-05-21,"Committee Amendment 1734s, Amendment Adopted, Voice Vote "
679294,2015-05-21,"Ought to Pass with Amendment 1734s, Motion Adopted, Voice Vote; OT3rdg; Senate Journal 15 "
679294,2015-06-03,"House Concurs with Senate Amendment #1734s (Rep J. Belanger): Motion Adopted Voice Vote; House Journal  44, PG. 1813 "
679294,2015-06-18,"Enrolled (In recess 6/11/2015); Senate Journal 19 "
679294,2015-06-18,"Enrolled (in recess of 6/11/2015); House Journal  46, PG. 1993 "
679294,2015-06-30,"Signed by the Governor on 6/26/2015; Chapter 162; Effective Date 8/25/2015 "
679305,2015-01-08,"Introduced and Referred to Criminal Justice and Public Safety; House Journal  12, PG. 214 "
679305,2015-01-21,"==POSTPONED==Public Hearing: 1/27/2015 1:45 PM Legislative Office Building 204 "
679305,2015-01-26,"==RESCHEDULED==Public Hearing: 1/28/2015 1:45 PM Legislative Office Building 204 "
679305,2015-02-25,"Executive Session: 3/3/2015 10:30 Amendment Legislative Office Building 204 "
679305,2015-03-04,"Retained in Committee "
679305,2015-08-04,"Retained Bill - Full Committee Work Session: 8/20/2015 10:00 Amendment Legislative Office Building 204 "
679305,2015-08-24,"Retained Bill - Subcommittee Work Session: 9/15/2015 10:00 Amendment Legislative Office Building 204 "
679305,2015-09-16,"Retained Bill - Subcommittee Work Session: 9/22/2015 10:00 Amendment Legislative Office Building 306 "
679305,2015-09-23,"Retained Bill - Subcommittee Work Session: 10/6/2015 10:00 Amendment Legislative Office Building 306 "
679305,2015-10-07,"Retained Bill - Subcommittee Work Session: 10/14/2015 10:00 Amendment Legislative Office Building 306 "
679305,2015-10-07,"Executive Session: 10/28/2015 10:00 Amendment Legislative Office Building 204 "
679305,2015-11-12,"Committee Report: Ought to Pass for Jan 6 (Vote 15-2; Regular Calendar); House Calendar 67, PG. 15 "
679317,2015-01-08,"Introduced and Referred to Finance; House Journal  12, PG. 214 "
679317,2015-01-21,"Public Hearing: 1/29/2015 3:00 PM Legislative Office Building 210-211 "
679317,2015-01-28,"Division I Work Session: 2/3/2015 2:30 PM Legislative Office Building 212 "
679317,2015-01-28,"Executive Session: 2/5/2015 10:00 Amendment Legislative Office Building 210-211 "
679317,2015-02-05,"Committee Report: Inexpedient to Legislate for Feb 11 (Vote 22-0; Consent Calendar); House Calendar11, PG. 173 "
679317,2015-02-11,"Inexpedient to Legislate: Motion Adopted Voice Vote; House Journal  16, PG. 299-300 "
679329,2015-01-08,"Introduced and Referred to Education; House Journal  12, PG. 214 "
679329,2015-01-21,"==POSTPONED==Public Hearing: 1/27/2015 1:00 PM Legislative Office Building 207 "
679329,2015-01-26,"==RESCHEDULED==Public Hearing: 1/28/2015 1:00 PM Legislative Office Building 207 "
679329,2015-02-11,"Executive Session: 3/3/2015 10:30 Amendment Legislative Office Building 207 "
679329,2015-03-06,"Retained in Committee "
679329,2015-04-21,"Retained Bill - Subcommittee Work Session: 4/30/2015 10:00 Amendment Legislative Office Building 207 "
679329,2015-05-05,"Retained Bill - Subcommittee Work Session: 5/19/2015 10:00 Amendment Legislative Office Building 207 "
679329,2015-05-12,"Retained Bill - Subcommittee Work Session: 5/26/2015 1:00 PM Legislative Office Building 207 "
679329,2015-08-17,"Retained Bill - Subcommittee Work Session: 8/27/2015 9:30 Amendment Legislative Office Building 207 "
679329,2015-08-17,"Retained Bill - Subcommittee Work Session: 9/1/2015 9:30 Amendment Legislative Office Building 207 "
679329,2015-09-09,"Executive Session: 10/27/2015 10:00 Amendment Legislative Office Building 207 "
679329,2015-11-12,"Committee Report: Ought to Pass with Amendment #2015-2455h for Jan 6 (Vote 17-3; Regular Calendar); House Calendar 67, PG. 17 "
679342,2015-01-08,"Introduced and Referred to Municipal and County Government; House Journal  12, PG. 214 "
679342,2015-01-29,"Public Hearing: 2/5/2015 1:20 PM Legislative Office Building 301 "
679342,2015-02-05,"Executive Session: 2/12/2015 2:30 PM Legislative Office Building 301 "
679342,2015-02-20,"Committee Report: Inexpedient to Legislate for Mar 4 (Vote 14-2; Consent Calendar); House Calendar18, PG. 348 "
679342,2015-03-04,"Inexpedient to Legislate: Motion Adopted Voice Vote; House Journal  22, PG. 564 "
679354,2015-01-08,"Introduced and Referred to Criminal Justice and Public Safety; House Journal  12, PG. 215 "
679354,2015-01-21,"Public Hearing: 1/29/2015 10:00 Amendment Legislative Office Building 204 "
679354,2015-02-25,"Executive Session: 3/2/2015 10:00 Amendment Legislative Office Building 204 "
679354,2015-03-04,"Committee Report: Inexpedient to Legislate for Mar 11 (Vote 16-0; Consent Calendar); House Calendar19, PG. 395 "
679354,2015-03-11,"Inexpedient to Legislate: Motion Adopted Voice Vote; House Journal  24, PG. 777 "
679365,2015-01-08,"Introduced and Referred to Criminal Justice and Public Safety; House Journal  12, PG. 215 "
679365,2015-01-21,"Public Hearing: 1/29/2015 11:00 Amendment Legislative Office Building 204 "
679365,2015-02-25,"Executive Session: 3/3/2015 10:30 Amendment Legislative Office Building 204 "
679365,2015-03-05,"Committee Report: Ought to Pass for Mar 11 (Vote 17-0; Consent Calendar); House Calendar19, PG. 395 "
679365,2015-03-12,"Removed from Consent (Rep Webb); House Journal  24, PG. 766 "
679365,2015-03-12,"Lay on Table (Rep Webb): Motion Adopted DV 203-106; House Journal  26, PG. 1264 "
679378,2015-01-08,"Introduced and Referred to Children and Family Law; House Journal  12, PG. 214 "
679378,2015-02-04,"Public Hearing: 2/17/2015 10:45 Amendment Legislative Office Building 206 "
679378,2015-02-24,"Executive Session: 3/3/2015 10:00 Amendment Legislative Office Building 206 "
679378,2015-03-05,"Majority Committee Report: Ought to Pass with Amendment #2015-0618h for Mar 11 (Vote 11-8; Regular Calendar); House Calendar19, PG. 412 "
679378,2015-03-05,"Minority Committee Report: Inexpedient to Legislate "
679378,2015-03-11,"Amendment #0618h: Amendment Adopted Voice Vote; House Journal  24, PG. 822 "
679378,2015-03-11,"Ought to Pass with Amendment #0618h: Motion Adopted Regular Calendar 191-174; House Journal  24, PG. 822-825 "
679378,2015-03-19,"Introduced and Referred to Judiciary; Senate Journal 10 "
679378,2015-04-21,"Hearing: 5/5/15, Room 100, State House, 9:15 a.m.; Senate Calendar 19 "
679378,2015-05-20,"Committee Report: Inexpedient to Legislate, 5/28/15; Vote 5-0; Consent Calendar; Senate Calendar 23 "
679378,2015-05-28,"Inexpedient to Legislate, Motion Adopted, Voice Vote === BILL KILLED ===; Senate Journal 16 "
679390,2015-01-08,"Introduced and Referred to Municipal and County Government; House Journal  12, PG. 213 "
679390,2015-02-04,"Public Hearing: 2/12/2015 9:15 Amendment Legislative Office Building 301 "
679390,2015-02-11,"Executive Session: 2/17/2015 10:30 Amendment Legislative Office Building 301 "
679390,2015-02-20,"Committee Report: Ought to Pass with Amendment #2015-0362h for Mar 4 (Vote 18-0; Consent Calendar); House Calendar18, PG. 348 "
679390,2015-03-04,"Amendment #0362h: Amendment Adopted Voice Vote; House Journal  22, PG. 563 "
679390,2015-03-04,"Ought to Pass with Amendment #0362h: Motion Adopted Voice Vote; House Journal  22. PG. 563 "
679390,2015-03-05,"Introduced and Referred to Public and Municipal Affairs; Senate Journal 8  "
679390,2015-04-01,"Hearing: 4/8/15, Room 102, Legislative Office Building, 10:00 a.m.; Senate Calendar 16 "
679390,2015-04-22,"Committee Report: Inexpedient to Legislate, 4/30/15; Senate Calendar 19 "
679390,2015-04-30,"Sen. Little Moved Laid on Table, Motion Adopted, Voice Vote; Senate Journal 12 "
679390,2015-04-30,"Inexpedient to Legislate Not Voted On "
679401,2015-01-08,"Introduced and Referred to Science, Technology and Energy; House Journal  12, PG. 214 "
679401,2015-01-21,"Public Hearing: 2/3/2015 2:00 PM Legislative Office Building 304 ==RECESSED== "
679401,2015-02-04,"Continued Public Hearing: 2/10/2015 3:00 PM Legislative Office Building 304 "
679401,2015-02-23,"Executive Session: 2/11/2015 Legislative Office Building 304 "
679401,2015-02-23,"Committee Report: Inexpedient to Legislate for Mar 4 (Vote 20-0; Consent Calendar); House Calendar18, PG. 352 "
679401,2015-03-04,"Inexpedient to Legislate: Motion Adopted Voice Vote; House Journal  22, PG. 568 "
679416,2015-01-08,"Introduced and Referred to Health, Human Services and Elderly Affairs; House Journal  12, PG. 213 "
679416,2015-01-21,"==POSTPONED== Public Hearing: 1/27/2015 1:15 PM Legislative Office Building 205 "
679416,2015-01-26,"==RESCHEDULED== Public Hearing: 1/28/2015 1:15 PM Legislative Office Building 205 "
679416,2015-02-18,"Executive Session: 2/17/2015 Legislative Office Building 205 "
679416,2015-02-20,"Committee Report: Inexpedient to Legislate for Mar 4 (Vote 15-0; Consent Calendar); House Calendar18, PG. 347 "
679416,2015-03-04,"Inexpedient to Legislate: Motion Adopted Voice Vote; House Journal  22, PG. 561 "
679429,2015-01-08,"Introduced and Referred to Resources, Recreation and Development; House Journal  12, PG. 214 "
679429,2015-01-21,"==POSTPONED== Public Hearing: 1/27/2015 11:00 Amendment Legislative Office Building 305 "
679429,2015-01-26,"==RESCHEDULED== Public Hearing: 1/28/2015 11:00 Amendment Legislative Office Building 305 "
679429,2015-02-04,"Executive Session: 2/4/2015 1:00 PM Legislative Office Building 305 "
679429,2015-02-05,"Committee Report: Ought to Pass with Amendment #2015-0180h for Feb 11 (Vote 19-0; Consent Calendar); House Calendar11, PG. 176 "
679429,2015-02-11,"Adopt Amendment #0180h: Amendment Adopted Voice Vote; House Journal  16, PG. 305 "
679429,2015-02-11,"Ought to Pass with Amendment #0180h: Motion Adopted Voice Vote; House Journal  16, PG. 305 "
679429,2015-03-12,"Introduced and Referred to Public and Municipal Affairs; Senate Journal 9  "
679429,2015-04-01,"Hearing: 4/8/15, Room 102, Legislative Office Building, 9:00 a.m.; Senate Calendar 16 "
679429,2015-04-22,"Committee Report: Ought to Pass, 4/30/15; Vote 5-0; Consent Calendar; Senate Calendar 19 "
679429,2015-04-30,"Ought to Pass: Motion Adopted, Voice Vote; OT3rdg; Senate Journal 12 "
679429,2015-05-13,"Enrolled (In recess 5/7/2015); Senate Journal 14 "
679429,2015-05-13,"Enrolled (in recess of 5/6/2015); House Journal  41, PG. 1779 "
679429,2015-06-11,"Signed by the Governor on 6/5/2015; Chapter 86; Effective Date 1/1/2016 "
679437,2015-01-08,"Introduced and Referred to Judiciary; House Journal  12, PG. 214 "
679437,2015-01-21,"Public Hearing: 1/29/2015 2:00 PM Legislative Office Building 207 "
679437,2015-02-04,"Executive Session: 2/4/2015 1:30 PM Legislative Office Building 208 "
679437,2015-02-05,"Committee Report: Inexpedient to Legislate for Feb 11 (Vote 14-0; Consent Calendar); House Calendar11, PG. 175 "
679437,2015-02-11,"Inexpedient to Legislate: Motion Adopted Voice Vote; House Journal  16, PG. 303 "
679453,2015-01-08,"Introduced and Referred to Resources, Recreation and Development; House Journal  12, PG. 214 "
679453,2015-01-21,"==POSTPONED== Public Hearing: 1/27/2015 1:15 PM Legislative Office Building 305 "
679453,2015-01-26,"==RESCHEDULED== Public Hearing: 1/28/2015 1:15 PM Legislative Office Building 305 "
679453,2015-02-04,"Executive Session: 2/4/2015 1:00 PM Legislative Office Building 305 "
679453,2015-02-05,"Committee Report: Ought to Pass for Feb 11 (Vote 19-0; Consent Calendar); House Calendar11, PG. 177 "
679453,2015-02-11,"Ought to Pass: Motion Adopted Voice Vote; House Journal  16, PG. 305 "
679453,2015-03-12,"Introduced and Referred to Executive Departments and Administration; Senate Journal 9  "
679453,2015-03-25,"Hearing: 4/2/15, Room 101, Legislative Office Building, 1:45 p.m.; Senate Calendar 15 "
679453,2015-04-02,"Committee Report: Ought to Pass, 4/9/15; Senate Calendar 16 "
679453,2015-04-09,"Ought to Pass: Motion Adopted, Voice Vote; OT3rdg; Senate Journal 11 "
679453,2015-04-21,"Enrolled (In recess 4/9/2015); Senate Journal 12 "
679453,2015-04-22,"Enrolled (in recess of 4/15/2015); House Journal  34, PG. 1564 "
679453,2015-05-07,"Signed by the Governor on 5/5/2015; Chapter 11; Effective Date 7/4/2015 "
679465,2015-01-08,"Introduced and Referred to Judiciary; House Journal  12, PG. 213 "
679465,2015-01-21,"Public Hearing: 2/3/2015 10:00 Amendment Legislative Office Building 208 "
679465,2015-02-04,"Executive Session: 2/4/2015 12:45 PM Legislative Office Building 208=RECESSED= "
679465,2015-02-11,"Executive Session: 2/17/2015 10:00 Amendment Legislative Office Building 208 "
679465,2015-02-20,"Committee Report: Ought to Pass with Amendment #2015-0205h for Mar 4 (Vote 16-1; Consent Calendar); House Calendar18, PG. 347 "
679465,2015-03-04,"Amendment #0205h: Amendment Adopted Voice Vote "
679465,2015-03-04,"Ought to Pass with Amendment #0205h: Motion Adopted Voice Vote "
679465,2015-03-05,"Introduced and Referred to Judiciary; Senate Journal 8  "
679465,2015-04-21,"Hearing: 5/5/15, Room 100, State House, 9:00 a.m.; Senate Calendar 19 "
679465,2015-05-27,"Committee Report: Ought to Pass, 6/4/15; Vote 5-0; Consent Calendar; Senate Calendar 24 "
679465,2015-06-04,"Ought to Pass: Motion Adopted, Voice Vote; OT3rdg; Senate Journal 17 "
679465,2015-06-18,"Enrolled Bill Amendment #2219e Adopted, Voice Vote, (In recess of 6/11/2015); Senate Journal 19 "
679465,2015-06-23,"Enrolled Bill Amendment #2015-2219EBA: Amendment Adopted Voice Vote (In recess of 6/11/2015); House Journal  46, PG. 1993 "
679465,2015-06-29,"Enrolled (In recess 6/24/2015); Senate Journal 19 "
679465,2015-06-29,"Enrolled (In recess of 6/24/2015); House Journal  54, PG. 2139 "
679465,2015-07-15,"Signed by the Governor on 7/13/2015; Chapter 223; Effective Date 1/1/2016 "
679476,2015-01-08,"Introduced and Referred to Municipal and County Government; House Journal  12 PG. 214 "
679476,2015-01-29,"Public Hearing: 2/5/2015 11:15 Amendment Legislative Office Building 301 "
679476,2015-02-05,"Executive Session: 2/10/2015 2:00 PM Legislative Office Building 301 "
679476,2015-02-20,"Committee Report: Inexpedient to Legislate for Mar 4 (Vote 14-0; Consent Calendar); House Calendar18, PG. 349 "
679476,2015-03-04,"Inexpedient to Legislate: Motion Adopted Voice Vote; House Journal  22, PG. 564 "
679488,2015-01-08,"Introduced and Referred to Commerce and Consumer Affairs; House Journal  12, PG. 214 "
679488,2015-01-20,"Public Hearing: 1/29/2015 2:00 PM Legislative Office Building 302 "
679488,2015-02-03,"Subcommittee Work Session: 2/12/2015 8:30 Amendment Legislative Office Building 302 "
679488,2015-02-20,"Executive Session: 3/3/2015 1:00 PM Legislative Office Building 302 "
679488,2015-03-05,"Committee Report: Inexpedient to Legislate for Mar 11 (Vote 19-1; Consent Calendar); House Calendar19, PG. 391 "
679488,2015-03-11,"Inexpedient to Legislate: Motion Adopted Voice Vote; House Journal  24, PG. 770 "
679502,2015-01-08,"Introduced and Referred to Municipal and County Government; House Journal  12, PG. 213 "
679502,2015-02-04,"Public Hearing: 2/12/2015 10:00 Amendment Legislative Office Building 301 "
679502,2015-02-11,"Executive Session: 2/17/2015 10:30 Amendment Legislative Office Building 301 "
679502,2015-02-17,"Retained in Committee "
679502,2015-08-03,"Retained Bill - Subcommittee Work Session: 9/8/2015 10:00 Amendment Legislative Office Building 301 "
679502,2015-09-15,"Retained Bill - Subcommittee Work Session: 10/6/2015 1:00 PM Legislative Office Building 301 "
679502,2015-09-16,"Executive Session: 10/6/2015 2:00 PM Legislative Office Building 301 "
679502,2015-11-12,"Committee Report: Inexpedient to Legislate for Jan 6 (Vote 10-3; Regular Calendar); House Calendar 67, PG. 25 "
679513,2015-01-08,"Introduced and Referred to Education; House Journal  12, PG. 214 "
679513,2015-01-21,"==POSTPONED==Public Hearing: 1/27/2015 10:45 Amendment Legislative Office Building 207 "
679513,2015-01-26,"==RESCHEDULED===Public Hearing: 1/28/2015 10:45 Amendment Legislative Office Building 207 "
679513,2015-02-11,"Executive Session: 2/17/2015 10:00 Amendment Legislative Office Building 207 "
679513,2015-02-17,"Retained in Committee "
679513,2015-04-22,"Retained Bill - Subcommittee Work Session: 4/30/2015 1:00 PM Legislative Office Building 207 "
679513,2015-05-27,"Retained Bill - Subcommittee Work Session: 6/2/2015 9:30 Amendment Legislative Office Building 207 "
679513,2015-09-09,"Retained Bill - Full Committee Work Session: 9/22/2015 10:00 Amendment Legislative Office Building 207 "
679513,2015-09-09,"Executive Session: 10/27/2015 10:00 Amendment Legislative Office Building 207 "
679513,2015-11-12,"Committee Report: Inexpedient to Legislate for Jan 6 (Vote 14-6; Regular Calendar); House Calendar 67, PG. 17 "
679524,2015-01-08,"Introduced and Referred to Science, Technology and Energy; House Journal  12, PG. 214 "
679524,2015-01-21,"Public Hearing: 2/3/2015 10:00 Amendment Legislative Office Building 304 "
679524,2015-02-04,"Executive Session: 2/4/2015 1:00 PM Legislative Office Building 304 "
679524,2015-02-05,"Committee Report: Inexpedient to Legislate for Feb 11 (Vote 21-0; Consent Calendar); House Calendar11, PG. 177 "
679524,2015-02-11,"Inexpedient to Legislate: Motion Adopted Voice Vote; House Journal  16, PG. 305 "
679852,2015-01-08,"Introduced and Referred to Transportation; House Journal  12, PG. 215 "
679852,2015-02-10,"Public Hearing: 2/17/2015 10:00 Amendment Legislative Office Building 203 "
679852,2015-02-11,"Executive Session: 2/17/2015 3:00 PM Legislative Office Building 203 "
679852,2015-02-18,"Retained in Committee "
679852,2015-05-13,"Full Committee Work Session: 5/20/2015 1:30 PM Legislative Office Building 203 "
679852,2015-09-21,"Retained Bill - Subcommittee Work Session: 9/29/2015 10:30 Amendment Legislative Office Building 203 "
679852,2015-09-29,"Retained Bill - Subcommittee Work Session: 10/15/2015 9:00 Amendment Legislative Office Building 203 "
679852,2015-10-29,"Retained Bill - Subcommittee Work Session: 11/4/2015 9:00 Amendment Legislative Office Building 203 "
679852,2015-10-30,"Executive Session: 11/4/2015 11:00 Amendment Legislative Office Building 203 "
679852,2015-11-12,"Committee Report: Ought to Pass with Amendment #2015-2556h (NT) for Jan 6 (Vote 15-0; Regular Calendar); House Calendar 67, PG. 27 "
679885,2015-01-08,"Introduced and Referred to Ways and Means; House Journal  12, PG. 215 "
679885,2015-01-21,"==POSTPONED== Public Hearing: 1/27/2015 10:30 Amendment Legislative Office Building 202 "
679885,2015-01-26,"==RESCHEDULED== Public Hearing: 1/28/2015 10:30 Amendment Legislative Office Building 202 "
679885,2015-02-04,"Subcommittee Work Session: 2/17/2015 9:00 Amendment Legislative Office Building 104 "
679885,2015-02-18,"Subcommittee Work Session: 3/3/2015 9:00 Amendment Legislative Office Building 104 "
679885,2015-02-25,"==RESCHEDULED== Work Session: 3/3/2015 9:00 Amendment Legislative Office Building 202 "
679885,2015-02-25,"Executive Session: 3/3/2015 10:00 Amendment Legislative Office Building 202 "
679885,2015-03-05,"Committee Report: Inexpedient to Legislate for Mar 11 (Vote 21-0; Consent Calendar); House Calendar19, PG. 407 "
679885,2015-03-11,"Inexpedient to Legislate: Motion Adopted Voice Vote; House Journal  24, PG. 801 "
679924,2015-01-08,"Introduced and Referred to State-Federal Relations and Veterans Affairs; House Journal  12, PG. 215 "
679924,2015-01-21,"Public Hearing: 1/29/2015 10:00 Amendment Legislative Office Building 303 "
679924,2015-01-28,"Executive Session: 2/5/2015 1:00 PM Legislative Office Building 303 "
679924,2015-02-13,"Committee Report: Inexpedient to Legislate for Feb 18 (Vote 8-5; Regular Calendar); House Calendar13, PG. 250 "
679924,2015-02-18,"Inexpedient to Legislate: Motion Adopted Voice Vote; House Journal  20, PG. 531 "
679963,2015-01-08,"Introduced and Referred to Criminal Justice and Public Safety; House Journal  12, PG. 215 "
679963,2015-01-21,"Public Hearing: 1/29/2015 1:00 PM Legislative Office Building 204 "
679963,2015-02-04,"Executive Session: 2/4/2015 1:00 PM Legislative Office Building 204 "
679963,2015-02-05,"Committee Report: Inexpedient to Legislate for Feb 11 (Vote 13-3; Consent Calendar); House Calendar11, PG. 171 "
679963,2015-02-11,"Inexpedient to Legislate: Motion Adopted Voice Vote; House Journal  16, PG. 298 "
679998,2015-01-08,"Introduced and Referred to State-Federal Relations and Veterans Affairs; House Journal  12, PG. 215 "
679998,2015-01-21,"Public Hearing: 1/29/2015 11:00 Amendment Legislative Office Building 303 "
679998,2015-01-28,"Executive Session: 2/5/2015 1:00 PM Legislative Office Building 303 "
679998,2015-02-10,"Committee Report: Inexpedient to Legislate for Feb 18 (Vote 11-1; Consent Calendar); House Calendar13, PG. 243 "
679998,2015-02-18,"Inexpedient to Legislate: Motion Adopted Voice Vote; House Journal  20, PG. 505 "
680040,2015-01-08,"Introduced and Referred to Municipal and County Government; House Journal  12, PG. 215 "
680040,2015-01-21,"==POSTPONED== Public Hearing: 1/27/2015 11:00 Amendment Legislative Office Building 301 "
680040,2015-01-26,"==RESCHEDULED== Public Hearing: 1/28/2015 11:00 Amendment Legislative Office Building 301 "
680040,2015-02-04,"Executive Session: 2/4/2015 12:00 PM Legislative Office Building 301 "
680040,2015-02-05,"Committee Report: Ought to Pass for Feb 11 (Vote 15-0; Consent Calendar); House Calendar11, PG. 176 "
680040,2015-02-11,"Ought to Pass: Motion Adopted Voice Vote; House Journal  16, PG. 304 "
680040,2015-03-12,"Introduced and Referred to Public and Municipal Affairs; Senate Journal 9  "
680040,2015-03-26,"Hearing: 4/1/15, Room 102, Legislative Office Building, 9:45 a.m.; Senate Calendar 15 "
680040,2015-04-01,"Committee Report: Ought to Pass, 4/9/15; Vote 5-0; Consent Calendar; Senate Calendar 16 "
680040,2015-04-09,"Ought to Pass: Motion Adopted, Voice Vote; OT3rdg; Senate Journal 11 "
680040,2015-04-21,"Enrolled Bill Amendment #1315e Adopted, Voice Vote, (In recess of 4/9/2015); Senate Journal 12 "
680040,2015-04-22,"Enrolled Bill Amendment #2015-1315EBA: Amendment Adopted Voice Vote (in recess of 4/15/2015); House Journal  34, PG. 1564 "
680040,2015-04-29,"Enrolled (In recess 4/9/2015); Senate Journal 12 "
680040,2015-04-29,"Enrolled; House Journal  36, PG. 1597 "
680040,2015-05-07,"Signed by the Governor on 5/5/2015; Chapter 13; Effective Date 5/5/2015 "
680076,2015-01-08,"Introduced and Referred to Education; House Journal  12, PG. 215 "
680076,2015-01-21,"Public Hearing: 1/29/2015 1:00 PM Legislative Office Building 206-208 "
680076,2015-02-11,"Executive Session: 3/3/2015 10:30 Amendment Legislative Office Building 207 "
680076,2015-03-05,"Majority Committee Report: Ought to Pass with Amendment #2015-0474h for Mar 11 (Vote 12-9; Regular Calendar); House Calendar19, PG. 420 "
680076,2015-03-05,"Minority Committee Report: Inexpedient to Legislate "
680076,2015-03-11,"Amendment #0474h: Amendment Adopted Voice Vote; House Journal  24, PG. 864-867 "
680076,2015-03-11,"Ought to Pass with Amendment #0474h: Motion Adopted Regular Calendar 225-130; House Journal  24, PG. 864-867 "
680076,2015-03-19,"Introduced and Referred to Education; Senate Journal 10 "
680076,2015-03-26,"Hearing: 3/31/15, Room 103, Legislative Office Building, 9:40 a.m.; Senate Calendar 15 "
680076,2015-04-29,"Committee Report: Inexpedient to Legislate, 5/7/15; Vote 5-0; Consent Calendar; Senate Calendar 20 "
680076,2015-05-07,"Sen. Bradley Moved to Remove HB 276 from the Consent Calendar "
680076,2015-05-07,"Sen. Bradley Moved Laid on Table, Motion Adopted, Voice Vote; Senate Journal 13 "
680076,2015-05-07,"Inexpedient to Legislate Not Voted On "
680116,2015-01-08,"Introduced and Referred to Education; House Journal  12, PG. 216 "
680116,2015-01-21,"==POSTPONED==Public Hearing: 1/27/2015 2:15 PM Legislative Office Building 207 "
680116,2015-01-26,"==RESCHEDULED==Public Hearing: 1/28/2015 2:15 PM Legislative Office Building 207 "
680116,2015-02-11,"Executive Session: 2/17/2015 10:00 Amendment Legislative Office Building 207 "
680116,2015-02-20,"Committee Report: Inexpedient to Legislate for Mar 4 (Vote 16-4; Regular Calendar); House Calendar18, PG. 357 "
680116,2015-03-04,"Inexpedient to Legislate: Motion Adopted Voice Vote; House Journal  22, PG. 581 "
680116,2015-03-11,"Reconsider (Rep Comeau): Motion Failed Voice Vote; House Journal  24, PG. 825 "
680155,2015-01-08,"Introduced and Referred to Health, Human Services and Elderly Affairs; House Journal  12, PG. 215 "
680155,2015-01-21,"Public Hearing: 1/29/2015 10:30 Amendment Legislative Office Building 205 "
680155,2015-02-10,"Executive Session: 2/5/2015 3:30 PM Legislative Office Building 205 "
680155,2015-02-10,"Committee Report: Ought to Pass with Amendment #2015-0112h for Feb 18 (Vote 15-0; Consent Calendar); House Calendar13, PG. 240 "
680155,2015-02-18,"Amendment #0112h: Amendment Adopted Voice Vote; House Journal  20, PG. 501 "
680155,2015-02-18,"Ought to Pass with Amendment #0112h: Motion Adopted Voice Vote; House Journal  20, PG. 501 "
680155,2015-03-12,"Introduced and Referred to Health and Human Services; Senate Journal 9  "
680155,2015-04-15,"Hearing: 4/21/15, Room 101, Legislative Office Building, 1:00 p.m.; Senate Calendar 18 "
680155,2015-04-29,"Committee Report: Ought to Pass, 5/7/15; Senate Calendar 20 "
680155,2015-05-07,"Ought to Pass: Motion Adopted, Voice Vote; OT3rdg; Senate Journal 13 "
680155,2015-05-19,"Enrolled (In recess 5/14/2015); Senate Journal 15 "
680155,2015-05-19,"Enrolled (in recess of 5/6/2015); House Journal  41, PG. 1781 "
680155,2015-06-03,"Signed by the Governor on 6/2/2015; Chapter 65; Effective Date 6/2/2015 "
680194,2015-01-08,"Introduced and Referred to Resources, Recreation and Development; House Journal  12, PG. 215 "
680194,2015-01-21,"Public Hearing: 1/29/2015 10:00 Amendment Legislative Office Building 305 "
680194,2015-01-28,"Executive Session: 2/5/2015 10:00 Amendment Legislative Office Building 305 "
680194,2015-02-05,"Committee Report: Ought to Pass with Amendment #2015-0135h for Feb 11 (Vote 12-0; Consent Calendar); House Calendar11, PG. 177 "
680194,2015-02-11,"Adopt Amendment #0135h: Amendment Adopted Voice Vote; House Journal  16, PG. 305 "
680194,2015-02-11,"Ought to Pass with Amendment #0135h: Motion Adopted Voice Vote; House Journal  16, PG. 305 "
680194,2015-03-12,"Introduced and Referred to Energy and Natural Resources; Senate Journal 9  "
680194,2015-03-25,"Hearing: 4/1/15, Room 100, State House, 9:15 a.m.; Senate Calendar 15 "
680194,2015-04-15,"=== CANCELLED SESSION === Committee Report: Ought to Pass with Amendment"
680194,2015-04-17,"=== RESCHEDULED === Committee Report: Ought to Pass with Amendment #2015-1346s, 4/30/15; Senate Calendar 19 "
680194,2015-04-30,"Committee Amendment 1346s, Amendment Adopted, Voice Vote "
680194,2015-04-30,"Ought to Pass with Amendment 1346s, Motion Adopted, Voice Vote; OT3rdg; Senate Journal 12 "
680194,2015-06-03,"House Concurs with Senate Amendment #1346s (Rep C. Christensen): Motion Adopted Voice Vote; House Journal  44, PG. 1814 "
680194,2015-06-18,"Enrolled (In recess 6/11/2015); Senate Journal 19 "
680194,2015-06-18,"Enrolled (in recess of 6/11/2015); House Journal  46, PG. 1993 "
680194,2015-06-30,"Signed by the Governor on 6/26/2015; Chapter 164; Effective Date 8/25/2015 "
680235,2015-01-08,"Introduced and Referred to Municipal and County Government; House Journal  12, PG. 215 "
680235,2015-01-21,"Public Hearing: 1/29/2015 1:20 PM Legislative Office Building 301 "
680235,2015-02-05,"Executive Session: 2/12/2015 2:30 PM Legislative Office Building 301 "
680235,2015-02-20,"Committee Report: Inexpedient to Legislate for Mar 4 (Vote 16-0; Consent Calendar); House Calendar18, PG. 349 "
680235,2015-03-04,"Inexpedient to Legislate: Motion Adopted Voice Vote; House Journal  22, PG. 564 "
680271,2015-01-08,"Introduced and Referred to Commerce and Consumer Affairs; House Journal  12, PG. 216 "
680271,2015-01-20,"Public Hearing: 2/10/2015 1:15 PM Legislative Office Building 302 "
680271,2015-02-20,"Executive Seesion: 3/3/2015 1:00 PM Legislative Office Building 302 "
680271,2015-03-05,"Committee Report: Inexpedient to Legislate for Mar 11 (Vote 19-1; Consent Calendar); House Calendar19, PG. 391-392 "
680271,2015-03-11,"Inexpedient to Legislate: Motion Adopted Voice Vote; House Journal  24, PG. 770 "
680310,2015-01-08,"Introduced and Referred to Executive Departments and Administration; House Journal  12, PG. 215 "
680310,2015-01-21,"==POSTPONED== Public Hearing: 1/27/2015 1:00 PM Legislative Office Building 306 "
680310,2015-01-26,"==RESCHEDULED==Public Hearing: 1/28/2015 1:00 PM Legislative Office Building 306 "
680310,2015-02-24,"Executive Session: 3/2/2015 12:30 PM Legislative Office Building 306 "
680310,2015-03-05,"Committee Report: Ought to Pass with Amendment #2015-0650h for Mar 11 (Vote 12-4; Regular Calendar); House Calendar19, PG. 424 "
680310,2015-03-11,"Amendment #0650h: Amendment Adopted Voice Vote; House Journal  24, PG. 885 "
680310,2015-03-11,"Ought to Pass with Amendment #0650h: Motion Adopted Regular Calendar 174-121; House Journal  24, PG. 885-557 "
680310,2015-03-19,"Introduced and Referred to Ways and Means; Senate Journal 10 "
680310,2015-03-25,"Hearing: 3/31/15, Room 103, State House, 9:00 a.m.; Senate Calendar 15 "
680310,2015-03-31,"Committee Report: Ought to Pass, 4/9/15; Senate Calendar 16 "
680310,2015-04-09,"Sen. Fuller Clark Floor Amendment #2015-1285s, Amendment Adopted, Voice Vote; Senate Journal 11 "
680310,2015-04-09,"Ought to Pass with Amendment 1285s, Motion Adopted, Voice Vote; OT3rdg; Senate Journal 11 "
680310,2015-05-06,"House Concurs with Senate Amendment #1285s (Rep A. Christie): Motion Adopted Voice Vote; House Journal  41, PG. 1747 "
680310,2015-05-14,"Enrolled Bill Amendment #1707e Adopted, Voice Vote, (In recess of 5/14/2015); Senate Journal 15 "
680310,2015-05-19,"Enrolled Bill Amendment #2015-1707EBA: Amendment Adopted Voice Vote (in recess of 5/6/2015); House Journal  41, PG. 1780 "
680310,2015-05-21,"Enrolled (In recess 5/21/2015); Senate Journal 16 "
680310,2015-05-21,"Enrolled (in recess of 5/6/2015); House Journal  41, PG. 1782 "
680310,2015-06-11,"Signed by the Governor on 6/8/2015; Chapter 122; Section 2 Effective Date 11/1/2016, Remaining Effective Date 6/8/2015 "
680349,2015-01-08,"Introduced and Referred to Criminal Justice and Public Safety; House Journal  12, PG. 215 "
680349,2015-01-21,"Public Hearing: 1/29/2015 2:00 PM Legislative Office Building 204 "
680349,2015-01-21,"==RESCHEDULED== Public Hearing: 1/29/2015 1:30 PM Legislative Office Building 204 "
680349,2015-02-04,"==CANCELED== Executive Session: 2/4/2015 1:00 PM Legislative Office Building 204 "
680349,2015-02-04,"Subcommittee Work Session: 2/9/2015 3:30 PM Legislative Office Building 204 "
680349,2015-02-06,"===CANCELLED=== Work Session: 2/9/2015 3:30 PM Legislative Office Building 204 "
680349,2015-02-06,"Subcommittee Work Session: 2/11/2015 1:00 PM Legislative Office Building 204 "
680349,2015-02-12,"Subcommittee Work Session: 2/17/2015 8:30 Amendment Legislative Office Building 204 "
680349,2015-02-25,"Executive Session: 3/3/2015 10:30 Amendment Legislative Office Building 204 "
680349,2015-03-05,"Committee Report: Ought to Pass with Amendment #2015-0488h (NT) for Mar 11 (Vote 16-0; Consent Calendar); House Calendar19, PG. 395 "
680349,2015-03-11,"Amendment #0488h: Amendment Adopted Voice Vote; House Journal  24, PG. 777-778 "
680349,2015-03-11,"Ought to Pass with Amendment #0488h: Motion Adopted Voice Vote; House Journal  24, PG. 777-778 "
680349,2015-03-19,"Introduced and Referred to Judiciary; Senate Journal 10 "
680349,2015-04-02,"Hearing: 4/7/15, Room 100, State House, 9:20 a.m.; Senate Calendar 16 "
680349,2015-05-27,"Committee Report: Ought to Pass with Amendment #2015-1950s, New Title, 6/4/15; Senate Calendar 24 "
680349,2015-06-04,"Special Order HB 270 to after HB 2-FN-A-L, Without Objection, Motion Adopted; Senate Journal 17 "
680349,2015-06-04,"Committee Amendment 1950s, New Title, Amendment Failed, Voice Vote "
680349,2015-06-04,"Sen. Kelly Floor Amendment #2015-2083s, New Title, Amendment Adopted, Voice Vote; Senate Journal 17 "
680349,2015-06-04,"Ought to Pass with Amendment 2083s, New Title, Motion Adopted, Voice Vote; OT3rdg; Senate Journal 17 "
680349,2015-06-11,"House Concurs with Senate Amendment #2083s (Rep Tholl): Motion Adopted Voice Vote; House Journal  46, PG. 1988 "
680349,2015-06-29,"Enrolled (In recess 6/24/2015); Senate Journal 19 "
680349,2015-06-29,"Enrolled (In recess of 6/24/2015); House Journal  54, PG. 2139 "
680349,2015-07-13,"Signed by the Governor on 7/8/2015; Chapter 218; Section 4 Effective 9/1/2018, Remaining Effective 9/6/2015 "
680389,2015-01-08,"Introduced and Referred to Judiciary; House Journal  12, PG. 215 "
680389,2015-01-21,"==POSTPONED== Public Hearing: 1/27/2015 2:30 PM Legislative Office Building 208 "
680389,2015-01-26,"==RESCHEDULED== Public Hearing: 1/28/2015 2:30 PM Legislative Office Building 208 "
680389,2015-02-04,"Executive Session: 2/4/2015 1:30 PM Legislative Office Building 208 "
680389,2015-02-05,"Majority Committee Report: Inexpedient to Legislate for Feb 11 (Vote 13-2; Regular Calendar); House Calendar11, PG. 181 "
680389,2015-02-05,"Minority Committee Report: Ought to Pass "
680389,2015-02-11,"Inexpedient to Legislate: Motion Adopted DV 187-167; House Journal  16, PG. 313-314 "
680389,2015-02-11,"Reconsideration (Rep Horn): Motion Failed Regular Calendar 145-204; House Journal  16, PG. 319-321 "
680426,2015-01-08,"Introduced and Referred to Children and Family Law; House Journal  12, PG. 215 "
680426,2015-01-28,"Public Hearing: 2/3/2015 1:45 PM Legislative Office Building 206 "
680426,2015-02-24,"Executive Session: 3/3/2015 10:00 Amendment Legislative Office Building 206 "
680426,2015-03-06,"Retained in Committee "
680426,2015-03-10,"Full Committee Work Session: 3/17/2015 10:00 Amendment Legislative Office Building 206 "
680426,2015-05-13,"Retained Bill - Full Committee Work Session: 5/19/2015 1:15 PM Legislative Office Building 206 "
680426,2015-05-27,"Retained Bill - Full Committee Work Session: 6/2/2015 10:00 Amendment Legislative Office Building 206 "
680426,2015-08-24,"Retained Bill - Full Committee Work Session: 9/16/2015 10:00 Amendment Legislative Office Building 206 "
680426,2015-09-16,"Executive Session: 9/29/2015 10:00 Amendment Legislative Office Building 206 "
680426,2015-11-12,"Committee Report: Inexpedient to Legislate for Jan 6 (Vote 13-2; Regular Calendar); House Calendar 67, PG. 12 "
680467,2015-01-08,"Introduced and Referred to Municipal and County Government; House Journal  12, PG. 215 "
680467,2015-02-04,"Public Hearing: 2/12/2015 9:30 Amendment Legislative Office Building 301 "
680467,2015-02-11,"Executive Session: 2/17/2015 10:30 Amendment Legislative Office Building 301 "
680467,2015-02-20,"Committee Report: Ought to Pass for Mar 4 (Vote 15-3; Consent Calendar); House Calendar18, PG. 268 "
680467,2015-03-04,"Ought to Pass: Motion Adopted Voice Vote; House Journal  22, PG. 564 "
680467,2015-03-12,"Introduced and Referred to Commerce; Senate Journal 9  "
680467,2015-03-19,"Hearing: 3/24/15, Room 100, State House, 1:15 p.m.; Senate Calendar 14 "
680467,2015-03-24,"Committee Report: Ought to Pass, 4/9/15; Senate Calendar 16 "
680467,2015-04-09,"Ought to Pass: Motion Adopted, Voice Vote; OT3rdg; Senate Journal 11 "
680467,2015-04-16,"Enrolled (In recess 4/9/2015); Senate Journal 12 "
680467,2015-04-16,"Enrolled (in recess of 4/15/2015); House Journal  34, PG. 1563 "
680467,2015-04-27,"Signed by the Governor on 4/27/2015; Chapter 03; Effective Date 4/27/2015 "
680503,2015-01-08,"Introduced and Referred to Labor, Industrial and Rehabilitative Services; House Journal  12, PG. 215 "
680503,2015-01-20,"==POSTPONED== Public Hearing: 1/27/2015 11:00 Amendment Legislative Office Building 307 "
680503,2015-01-26,"==RESCHEDULED== Public Hearing: 1/28/2015 11:00 Amendment Legislative Office Building 307 "
680503,2015-02-18,"Executive Session: 2/17/2015 Legislative Office Building 307 "
680503,2015-03-05,"Majority Committee Report: Inexpedient to Legislate for Mar 11 (Vote 14-6; Regular Calendar); House Calendar19, PG. 430 "
680503,2015-03-05,"Minority Committee Report: Ought to Pass "
680503,2015-03-12,"Inexpedient to Legislate: Motion Adopted DV 271-64; House Journal  26, PG. 1229-1230 "
680541,2015-01-08,"Introduced and Referred to Children and Family Law; House Journal  12, PG. 215 "
680541,2015-02-04,"Public Hearing: 2/17/2015 11:30 Amendment Legislative Office Building 206 "
680541,2015-02-24,"Executive Session: 3/3/2015 10:00 Amendment Legislative Office Building 206 "
680541,2015-03-05,"Committee Report: Inexpedient to Legislate for Mar 11 (Vote 18-1; Consent Calendar); House Calendar19, PG. 389 "
680541,2015-03-11,"Inexpedient to Legislate: Motion Adopted Voice Vote; House Journal  24, PG. 766 "
680580,2015-01-08,"Introduced and Referred to Resources, Recreation and Development; House Journal  12, PG. 215 "
680580,2015-01-21,"==POSTPONED== Public Hearing: 1/27/2015 1:45 PM Legislative Office Building 305 "
680580,2015-01-26,"==RESCHEDULED== Public Hearing: 1/28/2015 1:45 PM Legislative Office Building 305 "
680580,2015-01-30,"Subcommittee Work Session: 2/4/2015 1:00 PM Legislative Office Building 303 "
680580,2015-02-04,"Subcommittee Work Session: 3/3/2015 10:00 Amendment Legislative Office Building 104 "
680580,2015-02-18,"Subcommittee Work Session: 3/3/2015 9:00 Amendment Legislative Office Building 308 "
680580,2015-02-18,"===CANCELLED=== Work Session: 3/3/2015 10:00 Amendment Legislative Office Building 104 "
680580,2015-02-18,"Executive Session: 3/3/2015 10:30 Amendment Legislative Office Building 305 "
680580,2015-03-05,"Committee Report: Ought to Pass with Amendment #2015-0530h (NT) for Mar 11 (Vote 14-5; Regular Calendar); House Calendar19, PG. 434 "
680580,2015-03-12,"Amendment #0530h: Amendment Adopted Voice Vote; House Journal  26, PG. 1256-1258 "
680580,2015-03-12,"Ought to Pass with Amendment #0530h: Motion Adopted Voice Vote; House Journal  26, PG. 1256-1258 "
680580,2015-03-19,"Introduced and Referred to Energy and Natural Resources; Senate Journal 10 "
680580,2015-04-08,"Hearing: 4/15/15, Room 100, State House, 9:45 a.m.; Senate Calendar 17 "
680580,2015-04-15,"=== CANCELLED SESSION === Committee Report: Inexpedient to Legislate, 4/23/15; Senate Calendar 18 "
680580,2015-04-17,"=== RESCHEDULED === Committee Report: Inexpedient to Legislate, 4/30/15; Senate Calendar 19 "
680580,2015-04-30,"Inexpedient to Legislate, Motion Adopted, Voice Vote === BILL KILLED ===; Senate Journal 12 "
680766,2015-01-08,"Introduced and Referred to Science, Technology and Energy; House Journal  12, PG. 217 "
680766,2015-02-04,"Public Hearing: 2/12/2015 11:30 Amendment Legislative Office Building 304 "
680766,2015-02-23,"Executive Session: 2/17/2015 Legislative Office Building 304 "
680766,2015-02-23,"Majority Committee Report: Inexpedient to Legislate for Mar 4 (Vote 11-7; Regular Calendar); House Calendar18, PG. 362 "
680766,2015-02-23,"Minority Committee Report: Ought to Pass "
680766,2015-03-04,"Inexpedient to Legislate: Motion Adopted Voice Vote; House Journal  22, PG. 604 "
680768,2015-01-08,"Introduced and Referred to Election Law; House Journal  12, PG. 217 "
680768,2015-01-21,"Public Hearing: 1/27/2015 10:15 Amendment Legislative Office Building 308 "
680768,2015-01-21,"===CANCELLED=== Public Hearing: 1/27/2015 10:15 Amendment Legislative Office Building 308 "
680768,2015-01-28,"Public Hearing: 2/3/2015 10:40 Amendment Legislative Office Building 308 "
680768,2015-02-04,"Subcommittee Work Session: 2/10/2015 1:00 PM Legislative Office Building 308 "
680768,2015-02-05,"Executive Session: 2/12/2015 10:00 Amendment Legislative Office Building 308 "
680768,2015-02-20,"Committee Report: Inexpedient to Legislate for Mar 4 (Vote 18-0; Consent Calendar); House Calendar18, PG. 345 "
680768,2015-03-04,"Inexpedient to Legislate: Motion Adopted Voice Vote; House Journal  22, PG. 560 "
680771,2015-01-08,"Introduced and Referred to Science, Technology and Energy; House Journal  12, PG. 216 "
680771,2015-01-28,"Public Hearing: 2/10/2015 10:00 Amendment Legislative Office Building 304 "
680771,2015-02-12,"Executive Session: 2/12/2015 12:00 PM Legislative Office Building 304 "
680771,2015-02-12,"Retained in Committee "
680771,2015-06-16,"Retained Bill - Full Committee Work Session: 6/23/2015 11:00 Amendment Legislative Office Building 304 "
680771,2015-06-24,"Executive Session: 6/30/2015 1:00 PM Legislative Office Building 304 "
680771,2015-07-08,"Majority Committee Report: Inexpedient to Legislate for Jan 6 (Vote 12-8; Regular Calendar); House Calendar 67, PG. 26 "
680771,2015-07-08,"Minority Committee Report: Ought to Pass with Amendment #2015-2360h (NT) "
680774,2015-01-08,"Introduced and Referred to Education; Senate Journal 4  "
680774,2015-02-11,"Hearing: 2/17/15, Room 103, Legislative Office Building, 9:30 a.m.; Senate Calendar 10 "
680774,2015-03-04,"Committee Report: Rereferred to Committee, 3/12/15; Vote 5-0; Consent Calendar; Senate Calendar 12 "
680774,2015-03-12,"Rereferred to Committee, Motion Adopted, Voice Vote, Senate Journal 8  "
680774,2015-09-01,"Hearing: 9/22/15, Room 103, Legislative Office Building, 10:25 a.m.; Senate Calendar 34 "
680774,2015-10-14,"Committee Report: Ought to Pass with Amendment #2015-2412s, 1/6/16; Senate Calendar 49 "
680782,2015-01-08,"Introduced and Referred to Public and Municipal Affairs; Senate Journal 4  "
680782,2015-01-29,"Hearing: 2/4/15, Room 102, Legislative Office Building, 10:50 a.m.; Senate Calendar 8 "
680782,2015-02-11,"Committee Report: Ought to Pass, 2/19/15; Senate Calendar 10 "
680782,2015-02-19,"Ought to Pass: Motion Adopted, Voice Vote; OT3rdg; Senate Journal 6  "
680782,2015-03-04,"Introduced and Referred to Executive Departments and Administration; House Journal  22, PG. 629 "
680782,2015-03-11,"Public Hearing: 3/17/2015 11:15 Amendment Legislative Office Building 306 "
680782,2015-03-18,"Executive Session: 3/24/2015 10:00 Amendment Legislative Office Building 306 "
680782,2015-03-25,"Committee Report: Inexpedient to Legislate for Apr 15 (Vote 8-5; Regular Calendar); House Calendar 29, PG. 1308 "
680782,2015-04-15,"Inexpedient to Legislate: Motion Adopted Voice Vote; House Journal  34, PG. 1555 "
680785,2015-01-08,"Introduced and Referred to Education; House Journal  12, PG. 216 "
680785,2015-01-21,"Public Hearing: 2/3/2015 11:30 Amendment Legislative Office Building 207 "
680785,2015-01-29,"===CANCELLED=== Public Hearing: 2/3/2015 11:30 Amendment Legislative Office Building 207 "
680785,2015-01-29,"Public Hearing: 2/12/2015 2:30 PM Legislative Office Building 207 "
680785,2015-02-04,"===CANCELLED=== Public Hearing: 2/12/2015 2:30 PM Legislative Office Building 207 "
680785,2015-02-04,"Public Hearing: 2/12/2015 11:30 Amendment Legislative Office Building 207 "
680785,2015-02-11,"Executive Session: 2/17/2015 10:00 Amendment Legislative Office Building 207 "
680785,2015-02-20,"Committee Report: Inexpedient to Legislate for Mar 4 (Vote 18-2; Consent Calendar); House Calendar18, PG. 344 "
680785,2015-03-04,"Removed from Consent Calendar (Rep Hoell); House Journal  22, PG. 558 "
680785,2015-03-04,"Inexpedient to Legislate: Motion Adopted Regular Calendar 260-77; House Journal  22, PG. 611-613 "
680795,2015-01-08,"Introduced and Referred to Commerce and Consumer Affairs; House Journal  12, PG. 217 "
680795,2015-01-20,"Public Hearing: 2/5/2015 2:00 PM Legislative Office Building 302 "
680795,2015-02-20,"Executive Seesion: 3/3/2015 1:00 PM Legislative Office Building 302 "
680795,2015-03-03,"Retained in Committee "
680795,2015-09-29,"Executive Session: 10/27/2015 1:15 PM Legislative Office Building 302 "
680795,2015-11-12,"Committee report: Refer to Interim Study for Jan 6 (Vote 19-0; Consent Calendar); House Calendar 67, PG. 4 "
680797,2015-01-08,"Introduced and Referred to Judiciary; House Journal  12, PG. 216 "
680797,2015-01-21,"==POSTPONED== Public Hearing: 1/27/2015 11:00 Amendment Legislative Office Building 208 "
680797,2015-01-26,"==RESCHEDULED== Public Hearing: 1/28/2015 11:00 Amendment Legislative Office Building 208 "
680797,2015-02-04,"Executive Session: 2/4/2015 12:45 PM Legislative Office Building 208 ==RECESSED== "
680797,2015-02-11,"Continued Executive Session: 2/17/2015 10:00 Amendment Legislative Office Building 208 ==RECESSED== "
680797,2015-02-25,"Continued Executive Session: 2/19/2015 Legislative Office Building 208 "
680797,2015-02-26,"Majority Committee Report: Ought to Pass with Amendment #2015-0210h for Mar 11 (Vote 13-2; Regular Calendar); House Calendar19, PG. 427 "
680797,2015-02-26,"Minority Committee Report: Inexpedient to Legislate "
680797,2015-03-12,"Amendment #0210h: Amendment Adopted Voice Vote; House Journal  26, PG. 1214-1215 "
680797,2015-03-12,"Lay on Table (Rep Ammon): Motion Failed DV 119-206; House Journal  26, PG. 1215 "
680797,2015-03-12,"Ought to Pass with Amendment #0210h: Motion Adopted Regular Calendar 235-105; House Journal  26, PG. 1215-1217 "
680797,2015-03-19,"Introduced and Referred to Judiciary; Senate Journal 10 "
680797,2015-04-21,"Hearing: 4/28/15, Room 100, State House, 9:20 a.m.; Senate Calendar 19 "
680797,2015-05-21,"Committee Report: Ought to Pass with Amendment #2015-1861s, 5/28/15; Vote 5-0; Consent Calendar; Senate Calendar 23 "
680797,2015-05-28,"Committee Amendment 1861s, Amendment Adopted, Voice Vote "
680797,2015-05-28,"Ought to Pass with Amendment 1861s, Motion Adopted, Voice Vote; OT3rdg; Senate Journal 16 "
680797,2015-06-03,"House Concurs with Senate Amendment #1861s (Rep Rowe): Motion Adopted DV 248-112; House Journal  44, PG. 1813 "
680797,2015-06-17,"Enrolled Bill Amendment #2106e Adopted, Voice Vote, (In recess of 6/11/2015); Senate Journal 19 "
680797,2015-06-17,"Enrolled Bill Amendment #2015-2106EBA: Amendment Adopted Voice Vote (in recess of 6/11/2015); House Journal  46, PG. 1992 "
680797,2015-06-24,"Enrolled (In recess 6/24/2015); Senate Journal 19 "
680797,2015-06-24,"Enrolled; House Journal  54, PG. 2135 "
680797,2015-07-07,"Signed by the Governor on 7/6/2015; Chapter 191; Effective 7/6/2015 "
680802,2015-01-08,"Introduced and Referred to Education; House Journal  12, PG. 217 "
680802,2015-01-21,"Public Hearing: 2/3/2015 2:00 PM Legislative Office Building 207 "
680802,2015-01-29,"===CANCELLED=== Public Hearing: 2/3/2015 2:00 PM Legislative Office Building 207 "
680802,2015-02-04,"Public Hearing: 2/12/2015 2:30 PM Legislative Office Building 207 "
680802,2015-02-11,"Executive Session: 3/3/2015 10:30 Amendment Legislative Office Building 207 "
680802,2015-03-05,"Committee Report: Inexpedient to Legislate for Mar 11 (Vote 18-2; Consent Calendar); House Calendar19, PG. 397 "
680802,2015-03-12,"Removed from Consent (Rep Ladd); House Journal  24, PG. 766 "
680802,2015-03-12,"Inexpedient to Legislate: Motion Adopted DV 246-39; House Journal  26, PG. 1269 "
680810,2015-01-08,"Introduced and Referred to Education; Senate Journal 4  "
680810,2015-01-21,"Hearing: 2/3/15, Room 103, Legislative Office Building, 9:30 a.m.; Senate Calendar 7 "
680810,2015-02-04,"Committee Report: Ought to Pass, 2/12/15; Vote 5-0; Consent Calendar; Senate Calendar 9 "
680810,2015-02-12,"Ought to Pass: Motion Adopted, Voice Vote; Refer to Finance Rule 4-5; Senate Journal 5  "
680810,2015-03-04,"Committee Report: Ought to Pass, 3/12/15; Senate Calendar 12 "
680810,2015-03-12,"Ought to Pass: Motion Adopted, Voice Vote; OT3rdg; Senate Journal 8  "
680810,2015-03-12,"Introduced and Referred to Education; House Journal  26, PG. 1275 "
680810,2015-03-24,"Public Hearing: 3/31/2015 10:00 Amendment Legislative Office Building 207 "
680810,2015-03-24,"Executive Session: 3/31/2015 1:00 PM Legislative Office Building 207==RECESSED== "
680810,2015-04-01,"Continued Executive Session: 4/7/2015 1:00 PM Legislative Office Building 207 "
680810,2015-04-09,"Committee Report: Ought to Pass with Amendment #2015-1263h for Apr 15 (Vote 19-0; Consent Calendar); House Calendar 29, PG. 1301-1302 "
680810,2015-04-15,"Amendment #1263h: Amendment Adopted Voice Vote; House Journal  34, PG. 1534 "
680810,2015-04-15,"Ought to Pass with Amendment #1263h: Motion Adopted Voice Vote; House Journal  34, PG. 1534 "
680810,2015-04-15,"Referred to Finance; House Journal  34, PG. 1534 "
680810,2015-04-15,"Division II Work Session: 4/22/2015 1:00 PM Legislative Office Building 209 "
680810,2015-05-07,"Division II Work Session: 5/19/2015 1:00 PM Legislative Office Building 209 "
680810,2015-05-20,"Executive Session: 5/26/2015 10:00 Amendment Legislative Office Building 201 "
680810,2015-05-28,"Majority Committee Report: Ought to Pass with Amendment #2015-1948h for Jun 3 (Vote 13-10; Regular Calendar); House Calendar 39, PG. 1636 "
680810,2015-05-28,"Minority Committee Report: Inexpedient to Legislate "
680810,2015-06-03,"Amendment #1948h: Amendment Adopted Voice Vote; House Journal  44, PG. 1927 "
680810,2015-06-03,"Ought to Pass with Amendment #1948h: Motion Adopted Voice Vote; House Journal  44, PG. 1927 "
680810,2015-06-04,"Sen. Reagan Moved Nonconcur with House Amendments #1263h and #1948h; Requests C of C, Motion Adopted, Voice Vote; Senate Journal 17 "
680810,2015-06-04,"President Appoints: Senators Reagan, Avard, and Kelly "
680810,2015-06-09,"House Accedes to Senate Request for Committee of Conference (Rep Hinch): Motion Adopted Voice Vote (in recess of 6/3/2015); House Journal  44, PG. 1954 "
680810,2015-06-09,"Speaker Appoints: Reps Ladd, Balcom, Umberger, Shaw (in recess of 6/3/2015); House Journal  44, PG. 1954 "
680810,2015-06-09,"Committee of Conference Meeting: 6/10/2015, 12:30 p.m., Room 102, Legislative Office Building "
680810,2015-06-10,"Conferee Change; Senator Watters Replaces Senator Kelly "
680810,2015-06-11,"Conference Committee Report #2015-2119c, House Amendment, Filed "
680810,2015-06-24,"Conference Committee Report 2119c: Adopted, DV 322-26; House Journal  54, PG. 2108 "
680810,2015-06-24,"Conference Committee Report 2119c; Adopted, Voice Vote; Senate Journal 19 "
680810,2015-07-02,"Enrolled (In recess of 6/24/2015); House Journal  54, PG. 2141 "
680810,2015-07-02,"Enrolled (In recess 6/24/2015); Senate Journal 19 "
680810,2015-07-15,"Signed by the Governor on 07/13/2015; Chapter 0251; Effective 09/11/2015 "
680815,2015-01-08,"Introduced and Referred to Executive Departments and Administration; House Journal  12, PG. 217 "
680815,2015-01-21,"Public Hearing: 1/29/2015 10:30 Amendment Legislative Office Building 306 "
680815,2015-02-24,"Executive Session: 3/2/2015 12:30 PM Legislative Office Building 306 "
680815,2015-03-05,"Committee Report: Ought to Pass with Amendment #2015-0343h (NT) for Mar 11 (Vote 15-1; Consent Calendar); House Calendar19, PG. 399 "
680815,2015-03-11,"Amendment #0343h: Amendment Adopted Voice Vote; House Journal  24, PG. 784-785 "
680815,2015-03-11,"Ought to Pass with Amendment #0343h: Motion Adopted Voice Vote; House Journal  24, PG. 784-785 "
680815,2015-03-19,"Introduced and Referred to Executive Departments and Administration; Senate Journal 10 "
680815,2015-04-08,"Hearing: 4/15/15, Room 101, Legislative Office Building, 9:00 a.m.; Senate Calendar 17 "
680815,2015-04-16,"=== CANCELLED SESSION === Committee Report: Ought to Pass, 4/23/15; Vote 5-0; Consent Calendar; Senate Calendar 18 "
680815,2015-04-17,"=== RESCHEDULED === Committee Report: Ought to Pass, 4/30/15; Vote 5-0; Consent Calendar; Senate Calendar 19 "
680815,2015-04-30,"Ought to Pass: Motion Adopted, Voice Vote; OT3rdg; Senate Journal 12 "
680815,2015-05-13,"Enrolled (In recess 5/7/2015); Senate Journal 14 "
680815,2015-05-13,"Enrolled (in recess of 5/6/2015); House Journal  41, PG. 1779 "
680815,2015-06-11,"Signed by the Governor on 6/5/2015; Chapter 88; Effective Date 1/1/2016 "
680816,2015-01-08,"Introduced and Referred to Election Law; House Journal  12, PG. 217 "
680816,2015-01-21,"==POSTPONED== Public Hearing: 1/27/2015 10:30 Amendment Legislative Office Building 308 "
680816,2015-01-26,"==RESCHEDULED== Public Hearing: 1/28/2015 10:30 Amendment Legislative Office Building 308 "
680816,2015-01-29,"Subcommittee Work Session: 2/5/2015 1:00 PM Legislative Office Building 308 "
680816,2015-02-11,"Executive Session: 2/12/2015 10:00 Amendment Legislative Office Building 308 "
680816,2015-02-25,"Committee Report: Ought to Pass for Mar 11 (Vote 12-6; Regular Calendar); House Calendar19, PG. 422 "
680816,2015-03-11,"Ought to Pass: Motion Adopted DV 206-129; House Journal  24, PG. 879-880 "
680816,2015-03-19,"Introduced and Referred to Public and Municipal Affairs; Senate Journal 10 "
680816,2015-03-26,"Hearing: 4/2/15, Room 102, Legislative Office Building, 1:15 p.m.; Senate Calendar 15 "
680816,2015-04-13,"=== CANCELLED SESSION === Committee Report: Ought to Pass, 4/23/15; Senate Calendar 18 "
680816,2015-04-17,"=== RESCHEDULED === Committee Report: Ought to Pass, 4/30/15; Senate Calendar 19 "
680816,2015-04-30,"Special Order HB 328 to 5/14/15, Without Objection, Motion Adopted; Senate Journal 12 "
680816,2015-05-04,"Committee Report: Ought to Pass, 5/14/15; Senate Calendar 21 "
680816,2015-05-14,"Special Order HB 328 to 5/21/15, Without Objection, Motion Adopted; Senate Journal 14 "
680816,2015-05-14,"Committee Report: Ought to Pass, 5/21/15; Senate Calendar 22 "
680816,2015-05-21,"Special Order HB 328 to the Next Session, Without Objection, Motion Adopted; Senate Journal 15 "
680816,2015-05-21,"Committee Report: Ought to Pass, 5/28/15; Senate Calendar 23 "
680816,2015-05-28,"Sen. Stiles Floor Amendment #2015-1908s, Amendment Adopted, Voice Vote; Senate Journal 16 "
680816,2015-05-28,"Sen. Pierce moved to Rerefer to Committee, Motion Failed, Voice Vote; Senate Journal 16 "
680816,2015-05-28,"Sen. Bradley Moved Ought to Pass with Amendment "
680816,2015-05-28,"Ought to Pass with Amendment 1908s, Motion Adopted, Voice Vote; OT3rdg; Senate Journal 16 "
680816,2015-06-03,"House Concurs with Senate Amendment #1908s (Rep Hoelzel): Motion Adopted Voice Vote; House Journal  44, PG. 1812 "
680816,2015-06-18,"Enrolled (In recess 6/11/2015); Senate Journal 19 "
680816,2015-06-18,"Enrolled (in recess of 6/11/2015); House Journal  46, PG. 1993 "
680816,2015-06-30,"Signed by the Governor on 6/26/2015; Chapter 166; Effective Date 8/25/2015 "
680827,2015-01-08,"Introduced and Referred to Education; House Journal  12, PG. 216 "
680827,2015-01-21,"==POSTPONED==Public Hearing: 1/27/2015 10:00 Amendment Legislative Office Building 207 "
680827,2015-01-26,"==RESCHEDULED== Public Hearing: 1/28/2015 10:00 Amendment Legislative Office Building 207 "
680827,2015-01-29,"Executive Session: 2/10/2015 10:00 Amendment Legislative Office Building 207 "
680827,2015-02-11,"Retained in Committee "
680827,2015-09-18,"Retained Bill - Subcommittee Work Session: 10/7/2015 10:00 Amendment Legislative Office Building 207 "
680827,2015-09-18,"Retained Bill - Subcommittee Work Session: 10/14/2015 1:00 PM Legislative Office Building 207 "
680827,2015-10-19,"Retained Bill - Subcommittee Work Session: 10/27/2015 8:30 Amendment Legislative Office Building 207 "
680827,2015-10-20,"Executive Session: 10/27/2015 10:00 Amendment Legislative Office Building 207 "
680827,2015-11-13,"Majority Committee Report: Ought to Pass with Amendment #2015-2538h (NT) for Jan 6 (Vote 12-7; Regular Calendar); House Calendar 67, PG. 17-18 "
680827,2015-11-17,"Minority Committee Report: Inexpedient to Legislate "
680831,2015-01-08,"Introduced and Referred to Election Law; House Journal  12, PG. 217 "
680831,2015-01-21,"Public Hearing: 1/29/2015 10:45 Amendment Legislative Office Building 104 "
680831,2015-01-29,"Executive Session: 2/4/2015 2:00 PM Legislative Office Building 104 "
680831,2015-02-05,"Committee Report: Inexpedient to Legislate for Feb 11 (Vote 9-0; Consent Calendar); House Calendar11, PG. 175 "
680831,2015-02-11,"Removed from Consent Calendar (Rep Hoell); House Journal  16, PG. 298 "
680831,2015-02-11,"Inexpedient to Legislate: Motion Adopted Regular Calendar 252-75; House Journal  16, PG. 328-330 "
680842,2015-01-08,"Introduced and Referred to Commerce and Consumer Affairs; House Journal  12, PG. 218 "
680842,2015-01-20,"Public Hearing: 1/29/2015 10:00 Amendment Legislative Office Building 302 "
680842,2015-02-03,"Subcommittee Work Session: 2/4/2015 2:05 PM Legislative Office Building 302 "
680842,2015-02-18,"Subcommittee Work Session: 3/3/2015 10:00 Amendment Legislative Office Building 302 "
680842,2015-02-20,"Executive Seesion: 3/3/2015 1:00 PM Legislative Office Building 302 "
680842,2015-03-05,"Majority Committee Report: Inexpedient to Legislate for Mar 11 (Vote 13-6; Regular Calendar); House Calendar19, PG. 414 "
680842,2015-03-05,"Minority Committee Report: Ought to Pass "
680842,2015-03-11,"Inexpedient to Legislate: Motion Adopted Voice Vote; House Journal  24, PG. 835 "
680844,2015-01-08,"Introduced and Referred to Election Law; House Journal  12, PG. 216 "
680844,2015-01-21,"==POSTPONED== Public Hearing: 1/27/2015 1:30 PM Legislative Office Building 308 "
680844,2015-01-26,"==RESCHEDULED== Public Hearing: 1/28/2015 1:30 PM Legislative Office Building 308 "
680844,2015-01-30,"==CANCELED== Executive Session: 2/4/2015 2:00 PM Legislative Office Building 308 "
680844,2015-02-11,"Executive Session: 2/17/2015 11:00 Amendment Legislative Office Building 308 "
680844,2015-02-20,"Committee Report: Ought to Pass with Amendment #2015-0359h for Mar 4 (Vote 15-1; Consent Calendar); House Calendar18, PG. 345 "
680844,2015-03-04,"Amendment #0359h: Amendment Adopted Voice Vote; House Journal  22, PG. 560 "
680844,2015-03-04,"Ought to Pass with Amendment #0359h: Motion Adopted Voice Vote; House Journal  22, PG. 560 "
680844,2015-03-05,"Introduced and Referred to Public and Municipal Affairs; Senate Journal 8  "
680844,2015-03-17,"Hearing: 3/25/15, Room 102, Legislative Office Building, 10:00 a.m.; Senate Calendar 14 "
680844,2015-04-29,"Committee Report: Ought to Pass, 5/7/15; Senate Calendar 20 "
680844,2015-05-07,"Ought to Pass: Motion Adopted, Voice Vote; OT3rdg; Senate Journal 13 "
680844,2015-05-19,"Enrolled (In recess 5/14/2015); Senate Journal 15 "
680844,2015-05-19,"Enrolled (in recess of 5/6/2015); House Journal  41, PG. 1781 "
680844,2015-06-03,"Signed by the Governor on 6/2/2015; Chapter 66; Effective Date 6/2/2015 "
680851,2015-01-08,"Introduced and Referred to Science, Technology and Energy; House Journal  12, PG. 216 "
680851,2015-01-21,"Public Hearing: 2/3/2015 11:00 Amendment Legislative Office Building 304 "
680851,2015-02-04,"Executive Session: 2/4/2015 1:00 PM Legislative Office Building 304 "
680851,2015-02-05,"Committee Report: Inexpedient to Legislate for Feb 11 (Vote 21-0; Consent Calendar); House Calendar11, PG. 177 "
680851,2015-02-11,"Inexpedient to Legislate: Motion Adopted Voice Vote; House Journal  16, PG. 305-306 "
680859,2015-01-08,"Introduced and Referred to Municipal and County Government; House Journal  12, PG. 217 "
680859,2015-02-11,"Public Hearing: 2/17/2015 10:00 Amendment Legislative Office Building 301 "
680859,2015-02-11,"Executive Session: 2/17/2015 10:30 Amendment Legislative Office Building 301 "
680859,2015-02-20,"Committee Report: Inexpedient to Legislate for Mar 4 (Vote 18-0; Consent Calendar); House Calendar18, PG. 349 "
680859,2015-03-04,"Inexpedient to Legislate: Motion Adopted Voice Vote; House Journal  22, PG. 565 "
680865,2015-01-08,"Introduced and Referred to Election Law; House Journal  12, PG. 217 "
680865,2015-01-21,"==POSTPONED==Public Hearing: 1/27/2015 1:00 PM Legislative Office Building 308 "
680865,2015-01-26,"==RESCHEDULED== Public Hearing: 1/28/2015 1:00 PM Legislative Office Building 308 "
680865,2015-02-05,"Executive Session: 2/10/2015 10:00 Amendment Legislative Office Building 308 "
680865,2015-02-10,"Committee Report: Inexpedient to Legislate for Feb 18 (Vote 17-0; Consent Calendar); House Calendar13, PG. 238 "
680865,2015-02-18,"Inexpedient to Legislate: Motion Adopted Voice Vote; House Journal  20, PG. 498 "
680868,2015-01-08,"Introduced and Referred to Executive Departments and Administration; House Journal  12, PG. 216 "
680868,2015-01-21,"Public Hearing: 1/29/2015 2:00 PM Legislative Office Building 306 "
680868,2015-02-26,"Executive Session: 2/19/2015 Legislative Office Building 306 "
680868,2015-03-02,"Committee Report: Ought to Pass with Amendment #2015-0216h for Mar 11 (Vote 12-2; Regular Calendar); House Calendar19, PG. 424 "
680868,2015-03-11,"Amendment #0216h: Amendment Adopted Voice Vote; House Journal  24, PG. 887 "
680868,2015-03-11,"Ought to Pass with Amendment #0216h: Motion Adopted Voice Vote; House Journal  24, PG. 887 "
680868,2015-03-19,"Introduced and Referred to Public and Municipal Affairs; Senate Journal 10 "
680868,2015-04-01,"Hearing: 4/8/15, Room 102, Legislative Office Building, 9:15 a.m.; Senate Calendar 16 "
680868,2015-04-29,"Committee Report: Inexpedient to Legislate, 5/7/15; Senate Calendar 20 "
680868,2015-05-07,"Inexpedient to Legislate, Motion Adopted, Voice Vote === BILL KILLED ===; Senate Journal 13 "
680875,2015-01-08,"Introduced and Referred to Education; House Journal  12, PG. 217 "
680875,2015-01-21,"Public Hearing: 2/3/2015 1:30 PM Legislative Office Building 207 "
680875,2015-01-29,"===CANCELLED=== Public Hearing: 2/3/2015 1:30 PM Legislative Office Building 207 "
680875,2015-02-04,"Public Hearing: 2/12/2015 3:20 PM Legislative Office Building 207 "
680875,2015-02-11,"Executive Session: 2/20/2015 1:00 PM Legislative Office Building 207 "
680875,2015-02-25,"Majority Committee Report: Ought to Pass for Mar 11 (Vote 10-9; Regular Calendar); House Calendar19, PG. 420-421 "
680875,2015-02-25,"Minority Committee Report: Inexpedient to Legislate "
680875,2015-03-11,"Ought to Pass: Motion Adopted Regular Calendar 217-136; House Journal  24, PG. 872-874 "
680875,2015-03-19,"Introduced and Referred to Education; Senate Journal 10 "
680875,2015-03-26,"Hearing: 4/1/15, Room 103, Legislative Office Building, 2:00 p.m.; Senate Calendar 15 "
680875,2015-04-13,"=== CANCELLED SESSION === Committee Report: Ought to Pass with Amendment 1261s, 4/23/15; Senate Calendar 18 "
680875,2015-04-17,"=== RESCHEDULED === Committee Report: Ought to Pass with Amendment #2015-1261s, 4/30/15; Senate Calendar 19 "
680875,2015-04-30,"Special Order HB 332 to 5/14/15, Without Objection, Motion Adopted; Senate Journal 12 "
680875,2015-05-04,"Committee Report: Ought to Pass with Amendment #2015-1261s, 5/14/15; Senate Calendar 21 "
680875,2015-05-14,"Committee Amendment 1261s, Amendment Failed, Voice Vote "
680875,2015-05-14,"Sen. Stiles Floor Amendment #2015-1559s, Amendment Adopted, Voice Vote; Senate Journal 14 "
680875,2015-05-14,"Sen. Sanborn moved to call the question, Motion Adopted, Voice Vote; Senate Journal 14 "
680875,2015-05-14,"Ought to Pass with Amendment 1559s, Regular Calendar 14Y-10N, Motion Adopted; OT3rdg; Senate Journal 14 "
680875,2015-06-03,"House Concurs with Senate Amendment #1559s (Rep Ladd): Motion Adopted Voice Vote; House Journal  44, PG. 1812 "
680875,2015-06-18,"Enrolled (In recess 6/11/2015); Senate Journal 19 "
680875,2015-06-18,"Enrolled (in recess of 6/11/2015); House Journal  46, PG. 1993 "
680875,2015-06-30,"Vetoed by Governor, 6/26/2015 "
680875,2015-09-16,"Veto Sustained: Regular Calendar 226-148 Lacking Required Two-Thirds Vote; House Journal  57, PG. 2171-2173 "
680881,2015-01-08,"Introduced and Referred to Executive Departments and Administration; Senate Journal 4  "
680881,2015-02-11,"Hearing: 2/18/15, Room 101, Legislative Office Building, 9:00 a.m.; Senate Calendar 10 "
680881,2015-02-18,"Committee Report: Ought to Pass, 3/5/15; Senate Calendar 11 "
680881,2015-03-05,"Ought to Pass: Motion Adopted, Voice Vote; Refer to Finance Rule 4-5; Senate Journal 7  "
680881,2015-03-11,"Committee Report: Ought to Pass with Amendment #2015-0805s, 3/19/15; Senate Calendar 13 "
680881,2015-03-19,"Committee Amendment 0805s, Amendment Adopted, Voice Vote "
680881,2015-03-19,"Ought to Pass with Amendment 0805s, Motion Adopted, Voice Vote; OT3rdg; Senate Journal 9  "
680881,2015-03-24,"Introduced and Referred to Commerce and Consumer Affairs (in recess of 3/12/2015); House Journal  26, PG. 1276 "
680881,2015-03-25,"Public Hearing: 3/31/2015 11:00 Amendment Legislative Office Building 302 "
680881,2015-04-01,"Subcommittee Work Session: 4/21/2015 11:00 Amendment Legislative Office Building 302 "
680881,2015-04-01,"Executive Session: 4/28/2015 10:00 Amendment Legislative Office Building 302 "
680881,2015-04-14,"===CANCELLED=== Work Session: 4/21/2015 11:00 Amendment Legislative Office Building 302 "
680881,2015-04-28,"Retained in Committee "
680881,2015-06-02,"Retained Bill - Full Committee Work Session: 6/9/2015 1:15 PM Legislative Office Building 302 "
680881,2015-06-02,"Retained Bill - Full Committee Work Session: 6/9/2015 1:15 PM Legislative Office Building 302 "
680881,2015-06-02,"Retained Bill - Full Committee Work Session: 6/9/2015 1:15 PM Legislative Office Building 302 "
680881,2015-06-12,"Retained Bill - Full Committee Work Session: 6/23/2015 10:00 Amendment Legislative Office Building 302 "
680881,2015-08-24,"Retained Bill - Full Committee Work Session: 9/1/2015 11:00 Amendment Legislative Office Building 302 "
680881,2015-09-01,"Retained Bill - Full Committee Work Session: 9/15/2015 11:00 Amendment Legislative Office Building 302 "
680881,2015-09-15,"Retained Bill - Full Committee Work Session: 9/29/2015 11:00 Amendment Legislative Office Building 302 "
680881,2015-09-29,"Retained Bill - Full Committee Work Session: 10/13/2015 11:00 Amendment Legislative Office Building 302 "
680881,2015-10-13,"Retained Bill - Subcommittee Work Session: 10/20/2015 11:00 Amendment Legislative Office Building 302 "
680881,2015-10-14,"Executive Session: 10/27/2015 1:15 PM Legislative Office Building 302 "
680881,2015-11-12,"Committee Report: Ought to Pass with Amendment #2015-2504h (NT) for Jan 6 (Vote 16-3; Regular Calendar); House Calendar 67, PG. 14-15 "
680886,2015-01-08,"Introduced and Referred to Municipal and County Government; House Journal  12, PG. 218 "
680886,2015-01-28,"Public Hearing: 2/5/2015 1:00 PM Legislative Office Building 301 "
680886,2015-02-05,"Executive Session: 2/12/2015 2:30 PM Legislative Office Building 301 "
680886,2015-02-20,"Committee Report: Inexpedient to Legislate for Mar 4 (Vote 16-0; Consent Calendar); House Calendar18, PG. 349 "
680886,2015-03-04,"Inexpedient to Legislate: Motion Adopted Voice Vote; House Journal  22, PG. 565 "
680893,2015-01-08,"Introduced and Referred to Resources, Recreation and Development; House Journal  12, PG. 218 "
680893,2015-01-21,"Public Hearing: 1/29/2015 1:00 PM Legislative Office Building 305 "
680893,2015-01-22,"===CANCELLED=== Public Hearing: 1/29/2015 1:00 PM Legislative Office Building 305 "
680893,2015-01-28,"Public Hearing: 2/5/2015 1:00 PM Legislative Office Building 305-307 "
680893,2015-01-29,"===CANCELLED=== Public Hearing: 2/5/2015 1:00 PM Legislative Office Building 305-307 "
680893,2015-01-29,"Public Hearing: 2/10/2015 1:00 PM Legislative Office Building 305-307 "
680893,2015-02-11,"Subcommittee Work Session: 2/17/2015 2:30 PM Legislative Office Building 305 "
680893,2015-02-18,"Executive Session: 3/3/2015 10:30 Amendment Legislative Office Building 305 "
680893,2015-03-05,"Majority Committee Report: Inexpedient to Legislate for Mar 11 (Vote 12-8; Regular Calendar); House Calendar19, PG. 434 "
680893,2015-03-05,"Minority Committee Report: Ought to Pass "
680893,2015-03-12,"Lay on Table (Rep C. Christiensen): Motion Adopted Voice Vote; House Journal  26, PG. 1258 "
680895,2015-01-08,"Introduced and Referred to Labor, Industrial and Rehabilitative Services; House Journal  12, PG. 218 "
680895,2015-01-20,"==POSTPONED== Public Hearing: 1/27/2015 1:00 PM Legislative Office Building 307 "
680895,2015-01-26,"==RESCHEDULED== Public Hearing: 1/28/2015 1:00 PM Legislative Office Building 307 "
680895,2015-02-23,"Executive Session: 3/3/2015 10:15 Amendment Legislative Office Building 307 "
680895,2015-03-05,"Committee Report: Ought to Pass with Amendment #2015-0426h for Mar 11 (Vote 19-0; Consent Calendar); House Calendar19, PG. 404 "
680895,2015-03-11,"Amendment #0426h: Amendment Adopted Voice Vote; House Journal  24, PG. 795 "
680895,2015-03-11,"Ought to Pass with Amendment #0426h: Motion Adopted Voice Vote; House Journal  24, PG. 795 "
680895,2015-03-19,"Introduced and Referred to Education; Senate Journal 10 "
680895,2015-04-16,"Hearing: 4/21/15, Room 103, Legislative Office Building, 9:00 a.m.; Senate Calendar 18 "
680895,2015-04-23,"Committee Report: Ought to Pass with Amendment #2015-1393s, 4/30/15; Vote 5-0; Consent Calendar; Senate Calendar 19 "
680895,2015-04-30,"Special Order HB 347 to 5/14/15, Without Objection, Motion Adopted; Senate Journal 12 "
680895,2015-05-04,"Committee Report: Ought to Pass with Amendment #2015-1393s, 5/14/15; Vote 5-0; Consent Calendar; Senate Calendar 21 "
680895,2015-05-14,"Committee Amendment 1393s, Amendment Adopted, Voice Vote "
680895,2015-05-14,"Ought to Pass with Amendment 1393s, Motion Adopted, Voice Vote; OT3rdg; Senate Journal 14 "
680895,2015-06-03,"House Concurs with Senate Amendment #1393s (Rep Infantine): Motion Adopted Voice Vote; House Journal  44, PG. 1813 "
680895,2015-06-18,"Enrolled (In recess 6/11/2015); Senate Journal 19 "
680895,2015-06-18,"Enrolled (in recess of 6/11/2015); House Journal  46, PG. 1993 "
680895,2015-06-30,"Signed by the Governor on 6/26/2015; Chapter 168; Effective Date 8/25/2015 "
680905,2015-01-08,"Introduced and Referred to Transportation; House Journal  12, PG. 217 "
680905,2015-01-21,"==POSTPONED== Public Hearing: 1/27/2015 1:00 PM Legislative Office Building 203 "
680905,2015-01-26,"==RESCHEDULED== Public Hearing: 1/28/2015 1:00 PM Legislative Office Building 203 "
680905,2015-02-10,"Executive Session: 2/17/2015 3:00 PM Legislative Office Building 203 "
680905,2015-02-23,"Committee Report: Ought to Pass for Mar 4 (Vote 15-0; Consent Calendar); House Calendar18, PG. 353 "
680905,2015-03-04,"Ought to Pass: Motion Adopted Voice Vote; House Journal  22, PG. 569 "
680905,2015-03-05,"Introduced and Referred to Transportation; Senate Journal 8  "
680905,2015-03-19,"Hearing: 3/24/15, Room 103, Legislative Office Building, 1:45 p.m.; Senate Calendar 14 "
680905,2015-03-27,"Committee Report: Ought to Pass, 4/9/15; Vote 5-0; Consent Calendar; Senate Calendar 16 "
680905,2015-04-09,"Ought to Pass: Motion Adopted, Voice Vote; OT3rdg; Senate Journal 11 "
680905,2015-04-21,"Enrolled Bill Amendment #1316e Adopted, Voice Vote, (In recess of 4/9/2015); Senate Journal 12 "
680905,2015-04-22,"Enrolled Bill Amendment #2015-1316EBA: Amendment Adopted Voice Vote (in recess of 4/15/2015); House Journal  34, PG. 1564 "
680905,2015-04-29,"Enrolled (In recess 4/9/2015); Senate Journal 12 "
680905,2015-04-29,"Enrolled; House Journal  36, PG. 1597 "
680905,2015-05-07,"Signed by the Governor 5/7/2015; Chapter 25; Effective Date 1/1/2016 "
680906,2015-01-08,"Introduced and Referred to Election Law; House Journal  12, PG. 218 "
680906,2015-01-21,"==POSTPONED==Public Hearing: 1/27/2015 11:00 Amendment Legislative Office Building 308 "
680906,2015-01-26,"==RESCHEDULED== Public Hearing: 1/28/2015 11:00 Amendment Legislative Office Building 308 "
680906,2015-01-30,"Executive Session: 2/4/2015 2:00 PM Legislative Office Building 308 "
680906,2015-02-13,"Committee Report: Inexpedient to Legislate for Feb 18 (Vote 18-0; Consent Calendar); House Calendar13, PG. 238 "
680906,2015-02-18,"Inexpedient to Legislate: Motion Adopted Voice Vote; House Journal  20, PG. 498 "
680917,2015-01-08,"Introduced and Referred to Science, Technology and Energy; House Journal  12, PG. 218 "
680917,2015-01-28,"Public Hearing: 2/10/2015 2:00 PM Legislative Office Building 304 "
680917,2015-02-23,"Executive Session: 2/11/2015 Legislative Office Building 304 "
680917,2015-02-23,"Committee Report: Inexpedient to Legislate for Mar 4 (Vote 20-0; Consent Calendar); House Calendar18, PG. 352 "
680917,2015-03-04,"Inexpedient to Legislate: Motion Adopted Voice Vote; House Journal  22, PG. 568 "
680919,2015-01-08,"Introduced and Referred to Commerce and Consumer Affairs; House Journal  12, PG. 217 "
680919,2015-01-20,"Public Hearing: 2/5/2015 1:15 PM Legislative Office Building 302 "
680919,2015-01-21,"===CANCELLED=== Public Hearing: 2/5/2015 1:15 PM Legislative Office Building 302 "
680919,2015-02-04,"Vacated from Commerce and Consumer Affairs and Referred to Executive Departments and Administration; House Journal  14, PG. 273 "
680919,2015-02-11,"Public Hearing: 2/19/2015 11:00 Amendment Legislative Office Building 306 "
680919,2015-02-24,"Executive Session: 3/2/2015 12:30 PM Legislative Office Building 306 "
680919,2015-03-05,"Committee Report: Inexpedient to Legislate for Mar 11 (Vote 12-4; Regular Calendar); House Calendar19, PG. 424 "
680919,2015-03-11,"Inexpedient to Legislate: Motion Adopted Voice Vote; House Journal  24, PG. 888 "
680930,2015-01-08,"Introduced and Referred to Children and Family Law; House Journal  12, PG. 217 "
680930,2015-01-21,"==POSTPONED==Public Hearing: 1/27/2015 11:00 Amendment Legislative Office Building 206 "
680930,2015-01-26,"==RESCHEDULED==Public Hearing: 1/28/2015 11:00 Amendment Legislative Office Building 206 "
680930,2015-02-04,"Executive Session: 2/4/2015 12:00 PM Legislative Office Building 206 ==RECESSED== "
680930,2015-02-26,"Continued Executive Session: 3/3/2015 Legislative Office Building 206 "
680930,2015-03-05,"Committee Report: Inexpedient to Legislate for Mar 11 (Vote 19-0; Consent Calendar); House Calendar19, PG. 390 "
680930,2015-03-11,"Inexpedient to Legislate: Motion Adopted Voice Vote; House Journal  24, PG. 767 "
680934,2015-01-08,"Introduced and Referred to Labor, Industrial and Rehabilitative Services; House Journal  12, PG. 219 "
680934,2015-01-20,"==POSTPONED== Public Hearing: 1/27/2015 2:30 PM Legislative Office Building 307 "
680934,2015-01-26,"==RESCHEDULED== Public Hearing: 1/28/2015 2:30 PM Legislative Office Building 307 "
680934,2015-02-23,"Executive Session: 3/3/2015 10:15 Amendment Legislative Office Building 307 "
680934,2015-03-05,"Committee Report: Ought to Pass with Amendment #2015-0132h (NT) for Mar 11 (Vote 19-0; Consent Calendar); House Calendar19, PG. 404 "
680934,2015-03-11,"Amendment #0132h: Amendment Adopted Voice Vote; House Journal  24, PG. 795-796 "
680934,2015-03-11,"Ought to Pass with Amendment #0132h: Motion Adopted Voice Vote; House Journal  24, PG. 795-796 "
680934,2015-03-19,"Introduced and Referred to Commerce; Senate Journal 10 "
680934,2015-04-02,"Hearing: 4/7/15, Room 100, State House, 1:15 p.m.; Senate Calendar 16 "
680934,2015-04-29,"Committee Report: Ought to Pass, 5/7/15; Senate Calendar 20 "
680934,2015-05-07,"Ought to Pass: Motion Adopted, Voice Vote; OT3rdg; Senate Journal 13 "
680934,2015-05-14,"Enrolled Bill Amendment #1726e Adopted, Voice Vote, (In recess of 5/14/2015); Senate Journal 15 "
680934,2015-05-19,"Enrolled Bill Amendment #2015-1726EBA: Amendment Adopted Voice Vote (in recess of 5/6/2015); House Journal  41, PG. 1780 "
680934,2015-05-21,"Enrolled (In recess 5/21/2015); Senate Journal 16 "
680934,2015-05-21,"Enrolled (in recess of 5/6/2015); House Journal  41, PG. 1782 "
680934,2015-06-16,"Signed by the Governor on 6/12/2015; Chapter 138; Effective Date 6/12/2015 "
680942,2015-01-08,"Introduced and Referred to Science, Technology and Energy; House Journal  12, PG. 218 "
680942,2015-01-28,"Public Hearing: 2/10/2015 1:00 PM Legislative Office Building 304 "
680942,2015-02-23,"Executive Session: 2/11/2015 Legislative Office Building 304 "
680942,2015-02-23,"Committee Report: Inexpedient to Legislate for Mar 4 (Vote 20-0; Consent Calendar); House Calendar18, PG. 352 "
680942,2015-03-04,"Inexpedient to Legislate: Motion Adopted Voice Vote; House Journal  22, PG. 568 "
680945,2015-01-08,"Introduced and Referred to Education; House Journal  12, PG. 217 "
680945,2015-01-21,"==POSTPONED== Public Hearing: 1/27/2015 1:30 PM Legislative Office Building 207 "
680945,2015-01-26,"==RESCHEDULED== Public Hearing: 1/28/2015 1:30 PM Legislative Office Building 207 "
680945,2015-02-11,"Executive Session: 2/20/2015 1:00 PM Legislative Office Building 207 ==RECESSED== "
680945,2015-03-05,"Continued Executive Session: 3/3/2015 10:30 Amendment Legislative Office Building 207 "
680945,2015-03-05,"Committee Report: Ought to Pass with Amendment #2015-0612h for Mar 11 (Vote 20-1; Consent Calendar); House Calendar19, PG. 397 "
680945,2015-03-12,"Removed from Consent (Rep Ladd); House Journal  24, PG. 766 "
680945,2015-03-12,"Amendment #0612h: Amendment Failed Voice Vote; House Journal  26, PG. 1269-1270 "
680945,2015-03-12,"Floor Amendment #2015-0806h (Rep Ladd): Amendment Adopted Voice Vote; House Journal  26, PG. 1269-1270 "
680945,2015-03-12,"Ought to Pass with Amendment #0806h: Motion Adopted Voice Vote; House Journal  26, PG. 1269-1270 "
680945,2015-03-19,"Introduced and Referred to Education; Senate Journal 10 "
680945,2015-04-08,"Hearing: 4/14/15, Room 103, Legislative Office Building, 9:00 a.m.; Senate Calendar 17 "
680945,2015-04-14,"Hearing: === RECESSED === 4/14/15, Room 103, Legislative Office Building, 9:00 a.m. "
680945,2015-04-14,"Hearing: === RECONVENE === 4/16/15, Room 103, Legislative Office Building, 1:00 p.m. "
680945,2015-04-29,"Committee Report: Ought to Pass with Amendment #2015-1465s, 5/7/15; Senate Calendar 20 "
680945,2015-05-07,"Special Order HB 323 to 5/14/15, Without Objection, Motion Adopted; Senate Journal 13 "
680945,2015-05-07,"Committee Report: Ought to Pass with Amendment #2015-1465s, 5/14/15; Senate Calendar 21 "
680945,2015-05-14,"Special Order HB 323 to 5/21/15, Without Objection, Motion Adopted; Senate Journal 14 "
680945,2015-05-14,"Committee Report: Ought to Pass with Amendment #2015-1465s, 5/21/15; Senate Calendar 22 "
680945,2015-05-21,"Committee Amendment 1465s, Amendment Failed, Voice Vote "
680945,2015-05-21,"Sen. Bradley Floor Amendment #2015-1863s, Amendment Adopted, Voice Vote; Senate Journal 15 "
680945,2015-05-21,"Ought to Pass with Amendment 1863s, Motion Adopted, Voice Vote; OT3rdg; Senate Journal 15 "
680945,2015-06-05,"House Non-Concurs and Requests Committee of Conference (Rep Hinch): Motion Adopted Voice Vote (in recess of 6/3/2015); House Journal  44, PG. 1950 "
680945,2015-06-05,"Speaker Appoints: Reps Ladd, Cordelli, Wolf, Shaw (in recess of 6/3/2015); House Journal  44, PG. 1950 "
680945,2015-06-11,"Sen. Reagan accedes to House Request for Committee of Conference, Motion Adopted, Voice Vote; Senate Journal 18 "
680945,2015-06-11,"President Appoints: Senators Reagan, Bradley and Watters "
680945,2015-06-11,"Conference Committee Meeting: 6/15/2015 9:30 Amendment Legislative Office Building 207==Recessed== "
680945,2015-06-16,"Conferee Change; Senator Avard Replaces Senator Watters "
680945,2015-06-17,"==Continued==Conference Committee Meeting: 6/18/2015 11:30 Amendment Legislative Office Building 207 "
680945,2015-06-18,"Conference Committee Report #2015-2314c; Senate Amendment + New Amendment, Filed "
680945,2015-06-24,"Conference Committee Report 2314c; Adopted, Voice Vote; Senate Journal 19 "
680945,2015-06-24,"Conference Committee Report 2314c: Adopted, Voice Vote; House Journal  54, PG. 2122 "
680945,2015-07-02,"Enrolled (In recess 6/24/2015); Senate Journal 19 "
680945,2015-07-02,"Enrolled (In recess of 6/24/2015); House Journal  54, PG. 2141 "
680945,2015-07-15,"Signed by the Governor on 7/13/2015; Chapter 226; Effective Date 9/11/2015 "
680954,2015-01-08,"Introduced and Referred to Ways and Means. "
680954,2015-01-21,"==POSTPONED== Public Hearing: 1/27/2015 11:00 Amendment Legislative Office Building 202 "
680954,2015-01-26,"==RESCHEDULED== Public Hearing: 1/28/2015 11:00 Amendment Legislative Office Building 202 "
680954,2015-02-04,"Subcommittee Work Session: 2/17/2015 9:30 Amendment Legislative Office Building 104 "
680954,2015-02-18,"Subcommittee Work Session: 3/3/2015 9:30 Amendment Legislative Office Building 104 "
680954,2015-02-25,"==RESCHEDULED== Work Session: 3/3/2015 9:30 Amendment Legislative Office Building 202 "
680954,2015-02-25,"Executive Session: 3/3/2015 10:00 Amendment Legislative Office Building 202 "
680954,2015-03-04,"Retained in Committee "
680954,2015-09-08,"Retained Bill - Subcommittee Work Session: 9/17/2015 10:00 Amendment Legislative Office Building 202 "
680954,2015-09-16,"==CANCELED==Executive Session: 10/29/2015 10:00 Amendment Legislative Office Building 202 "
680954,2015-09-23,"==RESCHEDULED==Executive Session: 10/14/2015 10:00 Amendment Legislative Office Building 202 "
680954,2015-11-12,"Committee Report: Ought to Pass with Amendment #2015-2408h (NT) for Jan 6 (Vote 17-2; Regular Calendar); House Calendar 67, PG. 28 "
680956,2015-01-08,"Introduced and Referred to Municipal and County Government; House Journal  12, PG. 218 "
680956,2015-01-21,"Public Hearing: 1/29/2015 11:00 Amendment Legislative Office Building 301 "
680956,2015-01-28,"==CANCELED== Executive Session: 2/5/2015 1:30 PM Legislative Office Building 301 "
680956,2015-01-29,"Executive Session: 2/3/2015 2:15 PM Legislative Office Building 301 "
680956,2015-02-10,"Committee Report: Inexpedient to Legislate for Feb 18 (Vote 18-0; Consent Calendar); House Calendar13, PG. 241-242 "
680956,2015-02-18,"Inexpedient to Legislate: Motion Adopted Voice Vote; House Journal  20, PG. 503 "
680964,2015-01-08,"Introduced and Referred to Ways and Means; House Journal  12, PG. 217 "
680964,2015-01-21,"==POSTPONED== Public Hearing: 1/27/2015 1:00 PM Legislative Office Building 202 "
680964,2015-01-26,"==RESCHEDULED== Public Hearing: 1/28/2015 1:00 PM Legislative Office Building 202 "
680964,2015-02-05,"Executive Session: 2/5/2015 10:45 Amendment Legislative Office Building 202 "
680964,2015-02-05,"Committee Report: Inexpedient to Legislate for Feb 11 (Vote 19-0; Consent Calendar); House Calendar11, PG. 178 "
680964,2015-02-11,"Inexpedient to Legislate: Motion Adopted Voice Vote; House Journal  16, PG. 307 "
680969,2015-01-08,"Introduced and Referred Criminal Justice and Public Safety; House Journal  12, PG. 216 "
680969,2015-01-21,"==POSTPONED==Public Hearing: 1/27/2015 2:30 PM Legislative Office Building 204 "
680969,2015-01-26,"==RESCHEDULED==Public Hearing: 1/28/2015 2:30 PM Legislative Office Building 204 "
680969,2015-02-25,"Executive Session: 3/3/2015 10:30 Amendment Legislative Office Building 204 "
680969,2015-03-05,"Committee Report: Ought to Pass with Amendment #2015-0114h for Mar 11 (Vote 17-0; Consent Calendar); House Calendar19, PG. 395 "
680969,2015-03-11,"Amendment #0114h: Amendment Adopted Voice Vote; House Journal  24, PG. 778-779 "
680969,2015-03-11,"Ought to Pass with Amendment #0114h: Motion Adopted Voice Vote; House Journal  24, PG. 778-779 "
680969,2015-03-19,"Introduced and Referred to Judiciary; Senate Journal 10 "
680969,2015-04-21,"Hearing: 5/12/15, Room 100, State House, 10:20 a.m.; Senate Calendar 19 "
680969,2015-05-27,"Committee Report: Inexpedient to Legislate, 6/4/15; Vote 5-0; Consent Calendar; Senate Calendar 24 "
680969,2015-06-04,"Inexpedient to Legislate, Motion Adopted, Voice Vote === BILL KILLED ===; Senate Journal 17 "
680976,2015-01-08,"Introduced and Referred to Resources, Recreation and Development; House Journal  12, PG. 217 "
680976,2015-01-21,"Public Hearing: 1/29/2015 10:30 Amendment Legislative Office Building 305 "
680976,2015-01-28,"Executive Session: 2/5/2015 10:00 Amendment Legislative Office Building 305 "
680976,2015-02-23,"Ought to Pass with Amendment #2015-0133h for Mar 4 (Vote 13-0; Consent Calendar); House Calendar18, PG. 351 "
680976,2015-03-04,"Amendment #0133h: Amendment Adopted Voice Vote; House Journal  22, PG. 566-567 "
680976,2015-03-04,"Ought to Pass with Amendment #0133h: Motion Adopted Voice Vote; House Journal  22, PG. 566-567 "
680976,2015-03-05,"Introduced and Referred to Energy and Natural Resources; Senate Journal 8  "
680976,2015-03-25,"Hearing: 4/1/15, Room 100, State House, 9:30 a.m.; Senate Calendar 15 "
680976,2015-04-02,"Committee Report: Ought to Pass with Amendment #2015-1231s, 4/9/15; Vote 5-0; Consent Calendar; Senate Calendar 16 "
680976,2015-04-09,"Committee Amendment 1231s, Amendment Adopted, Voice Vote "
680976,2015-04-09,"Ought to Pass with Amendment 1231s, Motion Adopted, Voice Vote; OT3rdg; Senate Journal 11 "
680976,2015-05-06,"House Concurs with Senate Amendment #1231s (Rep C. Christiensen): Motion Adopted Voice Vote; House Journal  41, PG. 1747 "
680976,2015-05-19,"Enrolled (In recess 5/14/2015); Senate Journal 15 "
680976,2015-05-19,"Enrolled (in recess of 5/6/2015); House Journal  41, PG. 1781 "
680976,2015-06-03,"Signed by the Governor on 6/2/2015; Chapter 67; Effective Date 8/1/2015 "
680982,2015-01-08,"Introduced and Referred to Commerce and Consumer Affairs; House Journal  12, PG. 217 "
680982,2015-01-20,"Public Hearing: 2/5/2015 10:30 Amendment Legislative Office Building 302 "
680982,2015-02-20,"Executive Session: 3/3/2015 1:00 PM Legislative Office Building 302 "
680982,2015-03-05,"Committee Report: Inexpedient to Legislate for Mar 11 (Vote 20-0; Consent Calendar); House Calendar19, PG. 392 "
680982,2015-03-11,"Inexpedient to Legislate: Motion Adopted Voice Vote; House Journal  24, PG. 771 "
680985,2015-01-08,"Introduced and Referred to Commerce and Consumer Affairs; House Journal  12, PG. 217 "
680985,2015-01-20,"=POSTPONED=Public Hearing: 1/27/2015 10:00 Amendment Legislative Office Building 302 "
680985,2015-01-26,"==RESCHEDULED==Public Hearing: 1/28/2015 10:00 Amendment Legislative Office Building 302 "
680985,2015-02-03,"Subcommittee Work Session: 2/4/2015 2:05 PM Legislative Office Building 302 "
680985,2015-02-20,"Executive Seesion: 3/3/2015 1:00 PM Legislative Office Building 302 "
680985,2015-03-05,"Committee Report: Ought to Pass for Mar 11 (Vote 19-1; Consent Calendar); House Calendar19, PG. 392 "
680985,2015-03-11,"Ought to Pass: Motion Adopted Voice Vote; House Journal  24, PG. 771 "
680985,2015-03-19,"Introduced and Referred to Commerce; Senate Journal 10 "
680985,2015-03-26,"Hearing: 4/1/15, Room 100, State House, 2:30 p.m.; Senate Calendar 15 "
680985,2015-04-13,"=== CANCELLED SESSION === Committee Report: Ought to Pass, 4/23/15; Vote 5-0; Consent Calendar; Senate Calendar 18 "
680985,2015-04-17,"=== RESCHEDULED === Committee Report: Ought to Pass, 4/30/15; Vote 5-0; Consent Calendar; Senate Calendar 19 "
680985,2015-04-30,"Ought to Pass: Motion Adopted, Voice Vote; OT3rdg; Senate Journal 12 "
680985,2015-05-13,"Enrolled (In recess 5/7/2015); Senate Journal 14 "
680985,2015-05-13,"Enrolled (in recess of 5/6/2015); House Journal  41, PG. 1779 "
680985,2015-06-11,"Signed by the Governor on 6/5/2015; Chapter 87; Effective Date 8/4/2015 "
680993,2015-01-08,"Introduced and Referred to Transportation; House Journal  12, PG. 218 "
680993,2015-02-10,"Public Hearing: 2/17/2015 10:15 Amendment Legislative Office Building 203 "
680993,2015-02-11,"Executive Session: 3/3/2015 1:00 PM Legislative Office Building 203 "
680993,2015-03-03,"Retained in Committee "
680993,2015-10-14,"Executive Session: 10/20/2015 2:00 PM Legislative Office Building 203 "
680993,2015-11-12,"Committee Report: Ought to Pass for Jan 6 (Vote 11-0; Consent Calendar); House Calendar 67, PG. 10 "
680995,2015-01-08,"Introduced and Referred to Ways and Means; House Journal  12, PG. 218 "
680995,2015-01-21,"==CANCELED== Public Hearing: 1/27/2015 2:00 PM Legislative Office Building 202 "
680995,2015-01-26,"==RESCHEDULED== Public Hearing: 1/28/2015 2:00 PM Legislative Office Building 202 "
680995,2015-02-20,"Executive Session: 2/10/2015 Legislative Office Building 202 "
680995,2015-02-20,"Majority Committee Report: Inexpedient to Legislate for Mar 4 (Vote 13-6; Regular Calendar); House Calendar18, PG. 355 "
680995,2015-02-20,"Minority Committee Report: Ought to Pass "
680995,2015-03-04,"Inexpedient to Legislate: Motion Adopted Regular Calendar 213-143; House Journal  22, PG. 572-574 "
681008,2015-01-08,"Introduced and Referred to Transportation; Senate Journal 4  "
681008,2015-01-29,"Hearing: 2/10/15, Room 103, Legislative Office Building, 1:00 p.m.; Senate Calendar 8 "
681008,2015-02-18,"Committee Report: Inexpedient to Legislate, 3/5/15; Senate Calendar 11 "
681008,2015-03-05,"Inexpedient to Legislate, Motion Adopted, Voice Vote === BILL KILLED ===; Senate Journal 7  "
681013,2015-01-08,"Introduced and Referred to Science, Technology and Energy; House Journal  12, PG. 219 "
681013,2015-01-21,"Public Hearing: 2/3/2015 1:00 PM Legislative Office Building 304 "
681013,2015-02-04,"Executive Session: 2/4/2015 1:00 PM Legislative Office Building 304 "
681013,2015-02-05,"Committee Report: Ought to Pass with Amendment #2015-0183h for Feb 11 (Vote 18-3; Regular Calendar); House Calendar11, PG. 182 "
681013,2015-02-11,"Amendment #0183h: Amendment Adopted Voice Vote; House Journal  16, PG. 319 "
681013,2015-02-11,"Ought to Pass with Amendment #0183h: Motion Adopted Voice Vote; House Journal  16, PG. 318-319 "
681013,2015-03-12,"Introduced and Referred to Energy and Natural Resources; Senate Journal 9  "
681013,2015-04-01,"Hearing: 4/8/15, Room 100, State House, 9:15 a.m.; Senate Calendar 16 "
681013,2015-04-15,"=== CANCELLED SESSION === Committee Report: Ought to Pass, 4/23/15; Senate Calendar 18 "
681013,2015-04-17,"=== RESCHEDULED === Committee Report: Ought to Pass, 4/30/15; Senate Calendar 19 "
681013,2015-04-30,"Ought to Pass: Motion Adopted, Voice Vote; OT3rdg; Senate Journal 12 "
681013,2015-05-13,"Enrolled (In recess 5/7/2015); Senate Journal 14 "
681013,2015-05-13,"Enrolled (in recess of 5/6/2015); House Journal  41, PG. 1779 "
681013,2015-06-11,"Signed by the Governor on 6/5/2015; Chapter 89; Effective Date 8/4/2015 "
681018,2015-01-08,"Introduced and Referred to Ways and Means; Senate Journal 4  "
681018,2015-01-15,"Hearing: 1/20/15, Room 103, State House, 9:30 a.m.; Senate Calendar 6 "
681018,2015-02-19,"Committee Report: Ought to Pass with Amendment #2015-0493s 3/5/15; Senate Calendar 11 "
681018,2015-03-05,"Committee Amendment 0493s, Amendment Adopted, Voice Vote "
681018,2015-03-05,"Ought to Pass with Amendment 0493s, Regular Calendar 14Y-10N, Motion Adopted; Senate Journal 7  "
681018,2015-03-05,"Sen. Feltes Moved Laid On Table, Regular Calendar 10Y-14N, Motion Failed; Senate Journal 7  "
681018,2015-03-05,"Refer to Finance Rule 4-5; Senate Journal 7  "
681018,2015-03-11,"Committee Report: Ought to Pass, 3/19/15; Senate Calendar 13 "
681018,2015-03-19,"Ought to Pass: Regular Calendar 14Y-10N, Motion Adopted; Senate Journal 9  "
681018,2015-03-19,"Pending Motion OT3rdg; Senate Journal 9  "
681018,2015-03-19,"Sen. Bradley Moved Laid on Table, Motion Adopted, Voice Vote; Senate Journal 9  "
681020,2015-01-08,"Introduced and Referred to Education; Senate Journal 4  "
681020,2015-01-21,"Hearing: 2/3/15, Room 103, Legislative Office Building, 9:00 a.m.; Senate Calendar 7 "
681020,2015-02-04,"Committee Report: Ought to Pass with Amendment #2015-0179s, 2/12/15; Vote 5-0; Consent Calendar; Senate Calendar 9 "
681020,2015-02-12,"Committee Amendment 0179s, Amendment Adopted, Voice Vote "
681020,2015-02-12,"Ought to Pass with Amendment 0179s, Motion Adopted, Voice Vote; OT3rdg; Senate Journal 5  "
681020,2015-03-04,"Introduced and Referred to Judiciary; House Journal  22, PG. 629 "
681020,2015-03-24,"Public Hearing: 3/31/2015 10:00 Amendment Legislative Office Building 208 "
681020,2015-04-01,"Executive Session: 4/7/2015 10:00 Amendment Legislative Office Building 208 "
681020,2015-04-09,"Majority Committee Report: Inexpedient to Legislate for Apr 15 (Vote 13-4; Regular Calendar); House Calendar 29, PG. 1309 "
681020,2015-04-09,"Minority Committee Report: Ought to Pass "
681020,2015-04-15,"Lay on Table (Rep Horrigan): Motion Failed DV 125-217; House Journal  34, PG. 1558-1559 "
681020,2015-04-15,"Inexpedient to Legislate: Motion Adopted Voice Vote; House Journal  34, PG. 1559 "
681034,2015-01-08,"Introduced and Referred to Fish and Game and Marine Resources; House Journal  12, PG. 216 "
681034,2015-01-28,"Public Hearing: 2/12/2015 10:30 Amendment Legislative Office Building 307 "
681034,2015-02-13,"Subcommittee Work Session: 2/17/2015 9:00 Amendment Legislative Office Building 303 "
681034,2015-02-26,"Executive Session: 2/19/2015 Legislative Office Building 303 "
681034,2015-03-03,"Majority Committee Report: Inexpedient to Legislate for Mar 11 (Vote 12-2; Regular Calendar); House Calendar19, PG. 426 "
681034,2015-03-03,"Minority Committee Report: Ought to Pass with Amendment #2015-0415h (NT) "
681034,2015-03-12,"Inexpedient to Legislate: Motion Adopted Regular Calendar 222-95; House Journal  26, PG. 1204-1206 "
681036,2015-01-08,"Introduced and Referred to Education; House Journal  12, PG. 217 "
681036,2015-01-21,"Public Hearing: 1/29/2015 10:45 Amendment Legislative Office Building 206-208 "
681036,2015-02-11,"Executive Session: 2/20/2015 1:00 PM Legislative Office Building 207 "
681036,2015-02-25,"Committee Report: Ought to Pass for Mar 11 (Vote 18-1; Consent Calendar); House Calendar19, PG. 397 "
681036,2015-03-11,"Ought to Pass: Motion Adopted Voice Vote; House Journal  24, PG. 780 "
681036,2015-03-19,"Introduced and Referred to Education; Senate Journal 10 "
681036,2015-03-26,"Hearing: 3/31/15, Room 103, Legislative Office Building, 10:20 a.m.; Senate Calendar 15 "
681036,2015-05-05,"Committee Report: Ought to Pass, 5/14/15; Senate Calendar 21 "
681036,2015-05-14,"Ought to Pass: Motion Adopted, Voice Vote; OT3rdg; Senate Journal 14 "
681036,2015-06-03,"Enrolled (In recess 5/28/2015); Senate Journal 17 "
681036,2015-06-03,"Enrolled "
681036,2015-06-16,"Signed by the Governor on 6/12/2015; Chapter 136; Effective Date 8/11/2015 "
681042,2015-01-08,"Introduced and Referred to Science, Technology and Energy; House Journal  12, PG. 219 "
681042,2015-01-28,"Public Hearing: 2/10/2015 11:00 Amendment Legislative Office Building 304 "
681042,2015-02-23,"Executive Session: 2/11/2015 Legislative Office Building 304 "
681042,2015-02-23,"Committee Report: Inexpedient to Legislate for Mar 4 (Vote 20-0; Consent Calendar); House Calendar18, PG. 352 "
681042,2015-03-04,"Inexpedient to Legislate: Motion Adopted Voice Vote; House Journal  22, PG. 568 "
681051,2015-01-08,"Introduced and Referred to Ways and Means; House Journal  12, PG. 217 "
681051,2015-01-21,"==POSTPONED== Public Hearing: 1/27/2015 1:30 PM Legislative Office Building 202 "
681051,2015-01-26,"==RESCHEDULED== Public Hearing: 1/28/2015 1:30 PM Legislative Office Building 202 "
681051,2015-02-13,"Executive Session: 2/6/2015 Legislative Office Building 202 "
681051,2015-02-13,"Committee Report: Inexpedient to Legislate for Feb 18 (Vote 19-0; Consent Calendar); House Calendar13, PG. 243 "
681051,2015-02-18,"Inexpedient to Legislate: Motion Adopted Voice Vote; House Journal  20, PG. 506 "
681055,2015-01-08,"Introduced and Referred to Public Works and Highways; House Journal  12, PG. 217 "
681055,2015-01-20,"==POSTPONED== Public Hearing: 1/27/2015 11:00 Amendment Legislative Office Building 201 "
681055,2015-01-20,"==RESCHEDULED== Public Hearing: 1/28/2015 11:00 Amendment Legislative Office Building 201 "
681055,2015-01-20,"Executive Session: 2/10/2015 10:15 Amendment Legislative Office Building 201 "
681055,2015-03-03,"Committee Report: Inexpedient to Legislate for Mar 11 (Vote 17-0; Consent Calendar); House Calendar19, PG. 406 "
681055,2015-03-11,"Inexpedient to Legislate: Motion Adopted Voice Vote; House Journal  24, PG. 798 "
681060,2015-01-08,"Introduced and Referred to Commerce and Consumer Affairs; House Journal  12, PG. 218 "
681060,2015-01-20,"Public Hearing: 2/3/2015 10:00 Amendment Legislative Office Building 302 "
681060,2015-02-04,"Subcommittee Work Session: 2/12/2015 3:00 PM Legislative Office Building 302 "
681060,2015-02-18,"Subcommittee Work Session: 2/19/2015 1:45 PM Legislative Office Building 302 "
681060,2015-02-20,"Executive Seesion: 3/3/2015 1:00 PM Legislative Office Building 302 "
681060,2015-03-05,"Committee Report: Ought to Pass with Amendment #2015-0489h for Mar 11 (Vote 20-0; Consent Calendar); House Calendar19, PG. 392 "
681060,2015-03-11,"Amendment #0489h: Amendment Adopted Voice Vote; House Journal  24, PG. 771-772 "
681060,2015-03-11,"Ought to Pass with Amendment #0489h: Motion Adopted Voice Vote; House Journal  24, PG. 771-772 "
681060,2015-03-19,"Introduced and Referred to Commerce; Senate Journal 10 "
681060,2015-03-26,"Hearing: 4/1/15, Room 100, State House, 2:15 p.m.; Senate Calendar 15 "
681060,2015-04-16,"=== CANCELLED SESSION === Committee Report: Ought to Pass with Amendment 1344s, New Title, 4/23/15; Vote 5-0; Consent Calendar; Senate Calendar 18 "
681060,2015-04-17,"=== RESCHEDULED === Committee Report: Ought to Pass with Amendment #2015-1344s, New Title, 4/30/15; Vote 5-0; Consent Calendar; Senate Calendar 19 "
681060,2015-04-30,"Sen. Bradley Moved to Remove HB 353 from the Consent Calendar "
681060,2015-04-30,"Sen. Bradley moved to Rerefer to Committee, Motion Adopted, Voice Vote; Senate Journal 12 "
681060,2015-10-29,"Committee Report: Ought to Pass with Amendment #2015-2540s, 1/6/16; Senate Calendar 49 "
681066,2015-01-08,"Introduced and Referred to Labor, Industrial and Rehabilitative Services; House Journal  12, PG. 217 "
681066,2015-01-20,"==POSTPONED== Public Hearing: 1/27/2015 10:15 Amendment Legislative Office Building 307 "
681066,2015-01-26,"==RESCHEDULED== Public Hearing: 1/28/2015 10:15 Amendment Legislative Office Building 307 "
681066,2015-02-23,"Executive Session: 3/3/2015 10:15 Amendment Legislative Office Building 307 "
681066,2015-03-04,"Retained in Committee "
681066,2015-08-26,"Retained Bill - Full Committee Work Session: 9/8/2015 10:00 Amendment Legislative Office Building 307 "
681066,2015-10-14,"Retained Bill - Full Committee Work Session: 10/22/2015 11:00 Amendment Legislative Office Building 307 "
681066,2015-10-14,"Executive Session: 10/29/2015 11:30 Amendment Legislative Office Building 307 "
681066,2015-11-12,"Committee Report: Inexpedient to Legislate for Jan 6 (Vote 14-0; Consent Calendar); House Calendar 67, PG. 8 "
681070,2015-01-08,"Introduced and Referred to Judiciary; House Journal  12, PG. 218 "
681070,2015-01-21,"Public Hearing: 2/5/2015 10:00 Amendment Legislative Office Building 208 "
681070,2015-02-11,"Executive Session: 2/10/2015 3:00 PM Legislative Office Building 208 "
681070,2015-02-13,"Committee Report: Inexpedient to Legislate for Feb 18 (Vote 15-0; Consent Calendar); House Calendar13, PG. 240 "
681070,2015-02-18,"Removed from Consent Calendar (Rep Marple); House Journal  20, PG. 496 "
681070,2015-02-18,"Inexpedient to Legislate: Motion Adopted Voice Vote; House Journal  20, PG. 543 "
681079,2015-01-08,"Introduced and Referred to Education; Senate Journal 4  "
681079,2015-01-28,"Hearing: 2/10/15, Room 103, Legislative Office Building, 9:00 a.m.; Senate Calendar 8 "
681079,2015-03-04,"Committee Report: Ought to Pass with Amendment #2015-0677s, New Title, 3/12/15; Senate Calendar 12 "
681079,2015-03-12,"Committee Amendment 0677s, New Title, Amendment Adopted, Voice Vote "
681079,2015-03-12,"Sen. Kelly Floor Amendment #2015-0840s, Amendment Adopted, Voice Vote; Senate Journal 8  "
681079,2015-03-12,"Ought to Pass with Amendments 0677s New Title, 0840s, Motion Adopted, Voice Vote; Refer to Finance Rule 4-5; Senate Journal 8  "
681079,2015-03-18,"Committee Report: Ought to Pass, 3/26/15; Senate Calendar 14 "
681079,2015-03-26,"Ought to Pass: Motion Adopted, Voice Vote; OT3rdg; Senate Journal 10 "
681079,2015-03-31,"Introduced and Referred to Education (in recess of 3/25/2015); House Journal  28, PG. 1299 "
681079,2015-04-01,"Public Hearing: 4/7/2015 9:30 Amendment Legislative Office Building 207 "
681079,2015-04-01,"Executive Session: 4/9/2015 10:00 Amendment Legislative Office Building 207 "
681079,2015-04-09,"Retained in Committee "
681079,2015-04-30,"Retained Bill - Subcommittee Work Session: 5/12/2015 1:00 PM Legislative Office Building 207 "
681079,2015-05-27,"==CANCELED==Retained Bill - Subcommittee Work Session: 6/9/2015 1:00 PM Legislative Office Building 207 "
681079,2015-06-04,"===CANCELLED=== Work Session: 6/9/2015 1:00 PM Legislative Office Building 207 "
681079,2015-09-09,"Retained Bill - Subcommittee Work Session: 10/1/2015 10:00 Amendment Legislative Office Building 207 "
681079,2015-09-09,"Executive Session: 10/27/2015 10:00 Amendment Legislative Office Building 207 "
681079,2015-11-12,"Committee Report: Ought to Pass with Amendment #2015-2498h (NT) for Jan 6 (Vote 14-5; Regular Calendar); House Calendar 67, PG. 19 "
681082,2015-01-08,"Introduced and Referred to Judiciary; House Journal  12, PG. 217 "
681082,2015-01-21,"==POSTPONED== Public Hearing: 1/27/2015 1:00 PM Legislative Office Building 208 "
681082,2015-01-26,"==RESCHEDULED== Public Hearing: 1/28/2015 1:00 PM Legislative Office Building 208 "
681082,2015-02-04,"Executive Session: 2/4/2015 12:45 PM Legislative Office Building 208=RECESSED= "
681082,2015-02-11,"Executive Session: 2/17/2015 10:00 Amendment Legislative Office Building 208 "
681082,2015-02-20,"Majority Committee Report: Ought to Pass with Amendment #2015-0298h for Mar 4 (Vote 11-7; Regular Calendar); House Calendar18, PG. 360 "
681082,2015-02-20,"Minority Committee Report: Inexpedient to Legislate "
681082,2015-03-04,"Amendment #0298h: Amendment Adopted Voice Vote; House Journal  22, PG. 596 "
681082,2015-03-04,"Ought to Pass with Amendment #0298h: Motion Adopted Regular Calendar 263-95; House Journal  22, PG. 596-598 "
681082,2015-03-05,"Introduced and Referred to Judiciary; Senate Journal 8  "
681082,2015-04-21,"Hearing: 5/12/15, Room 100, State House, 10:05 a.m.; Senate Calendar 19 "
681082,2015-05-20,"Committee Report: Inexpedient to Legislate, 5/28/15; Senate Calendar 23 "
681082,2015-05-28,"Inexpedient to Legislate, Motion Adopted, Voice Vote === BILL KILLED ===; Senate Journal 16 "
681097,2015-01-08,"Introduced and Referred to Health, Human Services and Elderly Affairs; House Journal  12, PG. 217 "
681097,2015-01-21,"Public Hearing: 1/29/2015 2:30 PM Legislative Office Building 205 "
681097,2015-02-18,"Executive Session: 2/17/2015 Legislative Office Building 205 "
681097,2015-02-20,"Committee Report: Inexpedient to Legislate for Mar 4 (Vote 14-0; Consent Calendar); House Calendar18, PG. 347 "
681097,2015-03-04,"Inexpedient to Legislate: Motion Adopted Voice Vote; House Journal  22, PG. 562 "
681098,2015-01-08,"Introduced and Referred to Education; House Journal  12, PG. 218 "
681098,2015-01-21,"==POSTPONED== Public Hearing: 1/27/2015 11:30 Amendment Legislative Office Building 207 "
681098,2015-01-26,"==RESCHEDULED== Public Hearing: 1/28/2015 11:30 Amendment Legislative Office Building 207 "
681098,2015-02-11,"Executive Session: 2/20/2015 1:00 PM Legislative Office Building 207 "
681098,2015-02-25,"Committee Report: Ought to Pass with Amendment #2015-0101h for Mar 11 (Vote 19-0; Consent Calendar); House Calendar19, PG. 397 "
681098,2015-03-11,"Amendment #0101h: Amendment Adopted Voice Vote; House Journal  24, PG. 780-781 "
681098,2015-03-11,"Ought to Pass with Amendment #0101h: Motion Adopted Voice Vote; House Journal  24, PG. 780-781 "
681098,2015-03-19,"Introduced and Referred to Education; Senate Journal 10 "
681098,2015-03-26,"Hearing: 4/1/15, Room 103, Legislative Office Building, 2:20 p.m.; Senate Calendar 15 "
681098,2015-04-29,"Committee Report: Ought to Pass, 5/7/15; Vote 5-0; Consent Calendar; Senate Calendar 20 "
681098,2015-05-07,"Special Order HB 346 to 5/14/15, Without Objection, Motion Adopted; Senate Journal 13 "
681098,2015-05-07,"Committee Report: Ought to Pass, 5/14/15; Vote 5-0; Consent Calendar; Senate Calendar 21 "
681098,2015-05-14,"Sen. Reagan Moved to Remove HB 346 from the Consent Calendar "
681098,2015-05-14,"Sen. Kelly moved to Rerefer to Committee, Motion Adopted, Voice Vote; Senate Journal 14 "
681098,2015-09-01,"Hearing: 9/22/15, Room 103, Legislative Office Building, 10:15 a.m.; Senate Calendar 34 "
681098,2015-10-14,"Committee Report: Inexpedient to Legislate, 1/6/16; Senate Calendar 49 "
681105,2015-01-08,"Introduced and Referred to Municipal and County Government; House Journal  12, PG. 218 "
681105,2015-01-21,"Public Hearing: 1/29/2015 11:20 Amendment Legislative Office Building 301 "
681105,2015-01-28,"==CANCELED== Executive Session: 2/5/2015 1:30 PM Legislative Office Building 301 "
681105,2015-01-29,"Executive Session: 2/3/2015 2:15 PM Legislative Office Building 301 "
681105,2015-02-05,"Committee Report: Ought to Pass for Feb 11 (Vote 16-2; Consent Calendar); House Calendar11, PG. 176 "
681105,2015-02-11,"Ought to Pass: Motion Adopted Voice Vote; House Journal  16, PG. 304 "
681105,2015-02-11,"Referred to Ways and Means "
681105,2015-02-17,"Second Committee Referral Waived by Committee Chair "
681105,2015-03-12,"Introduced and Referred to Ways and Means; Senate Journal 9  "
681105,2015-03-18,"Hearing: 3/24/15, Room 103, State House, 9:45 a.m.; Senate Calendar 14 "
681105,2015-04-15,"=== CANCELLED SESSION === Committee Report: Ought to Pass with Amendment 1320s, New Title, 4/23/15; Senate Calendar 18 "
681105,2015-04-17,"=== RESCHEDULED === Committee Report: Ought to Pass with Amendment #2015-1320s, New Title, 4/30/15; Senate Calendar 19 "
681105,2015-04-30,"Committee Amendment 1320s, New Title, Amendment Adopted, Voice Vote "
681105,2015-04-30,"Ought to Pass with Amendment 1320s, New Title, Motion Adopted, Voice Vote; OT3rdg; Senate Journal 12 "
681105,2015-06-03,"House Concurs with Senate Amendment #1320s (Rep J. Belanger): Motion Adopted Voice Vote; House Journal  44, PG. 1813 "
681105,2015-06-18,"Enrolled (In recess 6/11/2015); Senate Journal 19 "
681105,2015-06-18,"Enrolled (in recess of 6/11/2015); House Journal  46, PG. 1993 "
681105,2015-06-30,"Signed by the Governor on 6/26/2015; Chapter 167; Effective Date 8/25/2015 "
681111,2015-01-08,"Introduced and Referred to Commerce; Senate Journal 4  "
681111,2015-03-04,"Hearing: 3/17/15, Room 100, State House, 1:00 p.m.; Senate Calendar 12 "
681111,2015-03-19,"Committee Report: Ought to Pass, 3/26/15; Vote 5-0; Consent Calendar; Senate Calendar 14 "
681111,2015-03-26,"Ought to Pass: Motion Adopted, Voice Vote; OT3rdg; Senate Journal 10 "
681111,2015-03-31,"Introduced and Referred to Commerce and Consumer Affairs (in recess of 3/25/2015); House Journal  28, PG. 1299 "
681111,2015-04-01,"Public Hearing: 4/7/2015 11:30 Amendment Legislative Office Building 302 "
681111,2015-04-07,"Subcommittee Work Session: 4/14/2015 10:00 Amendment Legislative Office Building 302 "
681111,2015-05-06,"Executive Session: 5/12/2015 1:15 PM Legislative Office Building 302 "
681111,2015-05-14,"Committee Report: Ought to Pass for Jun 3 (Vote 19-0; Consent Calendar); House Calendar 39, PG. 1629 "
681111,2015-06-03,"Ought to Pass: Motion Adopted Voice Vote; House Journal  44, PG. 1826 "
681111,2015-06-24,"Enrolled; House Journal  54, PG. 2102 "
681111,2015-06-24,"Enrolled (In recess 6/24/2015); Senate Journal 19 "
681111,2015-07-07,"Signed by the Governor on 07/06/2015; Chapter 0211; Effective 09/04/2015 "
681113,2015-01-08,"Introduced and Referred to Election Law; House Journal  12, PG. 218 "
681113,2015-01-21,"==POSTPONED==Public Hearing: 1/27/2015 10:45 Amendment Legislative Office Building 308 "
681113,2015-01-26,"==RESCHEDULED== Public Hearing: 1/28/2015 10:45 Amendment Legislative Office Building 308 "
681113,2015-01-30,"Executive Session: 2/4/2015 2:00 PM Legislative Office Building 308 "
681113,2015-02-13,"Committee Report: Inexpedient to Legislate for Feb 18 (Vote 18-0; Consent Calendar); House Calendar13, PG. 238 "
681113,2015-02-18,"Inexpedient to Legislate: Motion Adopted Voice Vote; House Journal  20, PG. 498 "
681124,2015-01-08,"Introduced and Referred to Executive Departments and Administration; House Journal  12, PG. 216 "
681124,2015-01-21,"Public Hearing: 1/29/2015 11:30 Amendment Legislative Office Building 306 "
681124,2015-02-24,"Executive Session: 3/2/2015 12:30 PM Legislative Office Building 306 "
681124,2015-03-02,"Retained in Committee "
681124,2015-05-05,"Retained Bill - Full Committee Work Session: 5/12/2015 10:00 Amendment Legislative Office Building 306 "
681124,2015-05-12,"Retained Bill - Subcommittee Work Session: 5/19/2015 10:00 Amendment Legislative Office Building 306 "
681124,2015-05-19,"Retained Bill - Subcommittee Work Session: 5/27/2015 1:00 PM Legislative Office Building 306 "
681124,2015-05-21,"===CANCELLED=== Work Session: 5/27/2015 1:00 PM Legislative Office Building 306 "
681124,2015-08-31,"Retained Bill - Subcommittee Work Session: 9/15/2015 1:00 PM Legislative Office Building 306 "
681124,2015-09-08,"Executive Session: 10/21/2015 10:00 Amendment Legislative Office Building 306 "
681124,2015-10-07,"Retained Bill - Full Committee Work Session: 10/21/2015 10:00 Amendment Legislative Office Building 306 "
681124,2015-10-07,"Executive Session: 10/21/2015 11:00 Amendment Legislative Office Building 306 "
681124,2015-11-12,"Committee Report: Inexpedient to Legislate for Jan 6 (Vote 11-0; Consent Calendar); House Calendar 67, PG. 7 "
681129,2015-01-08,"Introduced and Referred to Finance; House Journal  12, PG. 217 "
681129,2015-01-21,"Public Hearing: 1/29/2015 3:30 PM Legislative Office Building 210-211 "
681129,2015-01-28,"Full Committee Work Session: 2/3/2015 11:00 Amendment Legislative Office Building 210-211 "
681129,2015-01-28,"Executive Session: 2/5/2015 10:00 Amendment Legislative Office Building 210-211 "
681129,2015-02-05,"Committee Report: Ought to Pass with Amendment #2015-0185h for Feb 11 (Vote 24-1; Consent Calendar); House Calendar11, PG. 173 "
681129,2015-02-11,"Adopt Amendment #0185h: Amendment Adopted Voice Vote; House Journal  16, PG. 300-301 "
681129,2015-02-11,"Ought to Pass with Amendment #0185h: Motion Adopted Voice Vote; House Journal  16, PG. 300 "
681129,2015-03-12,"Introduced and Referred to Finance; Senate Journal 9  "
681129,2015-03-25,"Hearing: 3/31/15, Room 103, State House, 1:00 p.m.; Senate Calendar 15 "
681129,2015-04-22,"Committee Report: Ought to Pass with Amendment #2015-1404s, 4/30/15; Senate Calendar 19 "
681129,2015-04-30,"Committee Amendment 1404s, Amendment Adopted, Voice Vote "
681129,2015-04-30,"Ought to Pass with Amendment 1404s, Motion Adopted, Voice Vote; OT3rdg; Senate Journal 12 "
681129,2015-06-03,"House Concurs with Senate Amendment #1404s (Rep Kurk): Motion Adopted Voice Vote; House Journal  44, PG. 1813 "
681129,2015-06-17,"Enrolled Bill Amendment #2120e Adopted, Voice Vote, (In recess of 6/11/2015); Senate Journal 19 "
681129,2015-06-17,"Enrolled Bill Amendment #2015-2120EBA: Amendment Adopted Voice Vote (in recess of 6/11/2015); House Journal  46, PG. 1992 "
681129,2015-06-24,"Enrolled (In recess 6/24/2015); Senate Journal 19 "
681129,2015-06-24,"Enrolled; House Journal  54, PG. 2135 "
681129,2015-07-07,"Signed by the Governor on 7/6/2015; Chapter 192; Effective 9/4/2015 "
681133,2015-01-08,"Introduced and Referred to Public and Municipal Affairs; Senate Journal 4  "
681133,2015-01-29,"Hearing: 2/4/15, Room 102, Legislative Office Building, 9:00 a.m.; Senate Calendar 8 "
681133,2015-03-05,"Committee Report: Ought to Pass with Amendment #2015-0740s, 3/12/15; Senate Calendar 12 "
681133,2015-03-12,"Committee Amendment 0740s, Division 13Y-9N, Amendment Adopted "
681133,2015-03-12,"Sen. Boutin Floor Amendment #2015-0832s, Amendment Adopted, Voice Vote "
681133,2015-03-12,"Ought to Pass with Amendments 0740s and 0832s, Motion Adopted, Voice Vote; OT3rdg; Senate Journal 8  "
681133,2015-03-12,"Introduced and Referred to Municipal and County Government; House Journal  26, PG. 1275 "
681133,2015-03-31,"Public Hearing: 4/21/2015 10:30 Amendment Legislative Office Building 301 "
681133,2015-03-31,"==CANCELLED==Executive Session: 4/23/2015 10:00 Amendment Legislative Office Building 301 "
681133,2015-04-28,"Full Committee Work Session: 5/5/2015 1:00 PM Legislative Office Building 301 "
681133,2015-04-28,"Executive Session: 5/12/2015 10:00 Amendment Legislative Office Building 301 "
681133,2015-05-12,"Retained in Committee "
681133,2015-08-03,"Retained Bill - Subcommittee Work Session: 9/9/2015 10:00 Amendment Legislative Office Building 301 "
681133,2015-09-16,"Executive Session: 10/6/2015 2:00 PM Legislative Office Building 301 "
681133,2015-11-12,"Committee Report: Ought to Pass with Amendment #2015-2424h for Jan 6 (Vote 11-2; Regular Calendar); House Calendar 67, PG. 25-26 "
681138,2015-01-08,"Introduced and Referred to Municipal and County Government; House Journal  12, PG. 216 "
681138,2015-01-21,"Public Hearing: 1/29/2015 11:40 Amendment Legislative Office Building 301 "
681138,2015-01-28,"Executive Session: 2/3/2015 2:15 PM Legislative Office Building 301 "
681138,2015-02-03,"Retained in Committee "
681138,2015-04-28,"Retained Bill - Subcommittee Work Session: 5/7/2015 11:00 Amendment Legislative Office Building 301 "
681138,2015-08-03,"Retained Bill - Subcommittee Work Session: 9/17/2015 10:00 Amendment Legislative Office Building 301 "
681138,2015-09-16,"Executive Session: 10/6/2015 2:00 PM Legislative Office Building 301 "
681138,2015-11-12,"Committee Report: Inexpedient to Legislate for Jan 6 (Vote 13-0; Consent Calendar); House Calendar 67, PG. 9 "
681141,2015-01-08,"Introduced and Referred to Executive Departments and Administration; Senate Journal 4  "
681141,2015-02-19,"Hearing: 3/4/15, Room 101, Legislative Office Building, 9:15 a.m.; Senate Calendar 11 "
681141,2015-03-04,"Committee Report: Rereferred to Committee, 3/12/15; Vote 5-0; Consent Calendar; Senate Calendar 12 "
681141,2015-03-12,"Rereferred to Committee, Motion Adopted, Voice Vote, Senate Journal 8  "
681141,2015-11-19,"Committee Report: Inexpedient to Legislate, 1/6/16; Senate Calendar 49 "
681147,2015-01-08,"Introduced and Referred to Fish and Game and Marine Resources; House Journal  12, PG. 217 "
681147,2015-01-20,"Public Hearing: 1/29/2015 11:00 Amendment Legislative Office Building 307 "
681147,2015-02-26,"Executive Session: 2/19/2015 Legislative Office Building 303 "
681147,2015-03-03,"Majority Committee Report: Ought to Pass with Amendment #2015-0084h for Mar 11 (Vote 10-3; Regular Calendar); House Calendar19, PG. 426 "
681147,2015-03-03,"Minority Committee Report: Inexpedient to Legislate "
681147,2015-03-12,"Amendment #0084h: Amendment Adopted Voice Vote; House Journal  26, PG. 1209-1210 "
681147,2015-03-12,"Ought to Pass with Amendment #0084h: Motion Adopted Voice Vote; House Journal  26, PG. 1209-1210 "
681147,2015-03-19,"Introduced and Referred to Energy and Natural Resources; Senate Journal 10 "
681147,2015-04-08,"Hearing: 4/15/15, Room 100, State House, 10:00 a.m.; Senate Calendar 17 "
681147,2015-04-15,"=== CANCELLED SESSION === Committee Report: Ought to Pass, 4/23/15; Senate Calendar 18 "
681147,2015-04-17,"=== RESCHEDULED === Committee Report: Ought to Pass, 4/30/15; Senate Calendar 19 "
681147,2015-04-30,"Ought to Pass: Motion Adopted, Voice Vote; OT3rdg; Senate Journal 12 "
681147,2015-05-14,"Enrolled Bill Amendment #1676e Adopted, Voice Vote, (In recess of 5/14/2015); Senate Journal 15 "
681147,2015-05-19,"Enrolled Bill Amendment #2015-1676EBA: Amendment Adopted Voice Vote (in recess of 5/6/2015); House Journal  41, PG. 1780 "
681147,2015-05-21,"Enrolled (In recess 5/21/2015); Senate Journal 16 "
681147,2015-05-21,"Enrolled (in recess of 5/6/2015); House Journal  41, PG. 1782 "
681147,2015-06-11,"Signed by the Governor on 6/8/2015; Chapter 123; Effective Date 8/7/2015 "
681156,2015-01-08,"Introduced and Referred to Municipal and County Government; House Journal  12, PG. 216 "
681156,2015-02-04,"Public Hearing: 2/10/2015 11:45 Amendment Legislative Office Building 301 "
681156,2015-02-05,"Executive Session: 2/12/2015 2:30 PM Legislative Office Building 301 "
681156,2015-02-20,"Committee Report: Inexpedient to Legislate for Mar 4 (Vote 13-2; Consent Calendar); House Calendar18, PG. 349 "
681156,2015-03-04,"Inexpedient to Legislate: Motion Adopted Voice Vote; House Journal  22, PG. 564 "
681161,2015-01-08,"Introduced and Referred to Ways and Means; Senate Journal 4  "
681161,2015-01-15,"Hearing: 1/20/15, Room 103, State House, 10:00 a.m.; Senate Calendar 6 "
681161,2015-02-05,"Committee Report: Ought to Pass, 2/12/15; Senate Calendar 9 "
681161,2015-02-12,"Ought to Pass: Motion Adopted, Voice Vote; Refer to Finance Rule 4-5; Senate Journal 5  "
681161,2015-03-04,"Committee Report: Ought to Pass, 3/12/15; Senate Calendar 12 "
681161,2015-03-12,"Ought to Pass: Regular Calendar 20Y-4N, Motion Adopted; OT3rdg; Senate Journal 8  "
681161,2015-03-12,"Introduced and Referred to Ways and Means; House Journal  26, PG. 1275 "
681161,2015-03-19,"Public Hearing: 3/24/2015 10:30 Amendment Legislative Office Building 202 "
681161,2015-04-02,"Executive Session: 4/9/2015 11:30 Amendment Legislative Office Building 202 "
681161,2015-04-17,"Committee Report: Ought to Pass for Apr 29 (Vote 19-0; Regular Calendar); House Calendar 32, PG. 1489 "
681161,2015-04-29,"Ought to Pass: Motion Adopted Voice Vote; House Journal  36, PG. 1594 "
681161,2015-05-06,"Enrolled; House Journal  41, PG. 1779 "
681161,2015-05-13,"Enrolled (In recess 5/7/2015); Senate Journal 14 "
681161,2015-06-11,"Signed by the Governor on 06/05/2015; Chapter 0104; Effective 08/04/2015 "
681173,2015-01-08,"Introduced and Referred to Judiciary; Senate Journal 4  "
681173,2015-03-03,"Hearing: 3/10/15, Room 100, State House, 9:15 a.m.; Senate Calendar 12 "
681173,2015-03-18,"Committee Report: Ought to Pass with Amendment #2015-0984s, 3/26/15; Senate Calendar 14 "
681173,2015-03-26,"Committee Amendment 0984s, Amendment Adopted, Voice Vote "
681173,2015-03-26,"Ought to Pass with Amendment 0984s, Motion Adopted, Voice Vote; OT3rdg; Senate Journal 10 "
681173,2015-03-31,"Introduced and Referred to Criminal Justice and Public Safety (in recess of 3/25/2015); House Journal  28, PG. 1299 "
681173,2015-04-07,"Public Hearing: 4/14/2015 11:00 Amendment Legislative Office Building 204 "
681173,2015-04-14,"==CANCELED==Executive Session: 4/21/2015 10:00 Amendment Legislative Office Building 204 "
681173,2015-04-15,"Subcommittee Work Session: 4/23/2015 10:00 Amendment Legislative Office Building 204 "
681173,2015-04-22,"Executive Session: 4/30/2015 10:00 Amendment Legislative Office Building 202-204 "
681173,2015-04-30,"Committee Report: Ought to Pass with Amendment #2015-1341h for May 6 (Vote 17-0; Consent Calendar); House Calendar 33, PG. 1508 "
681173,2015-05-06,"Amendment #1341h: Amendment Adopted Voice Vote; House Journal  41, PG. 1749-1750 "
681173,2015-05-06,"Ought to Pass with Amendment #1341h: Motion Adopted Voice Vote; House Journal  41, PG. 1749-1750 "
681173,2015-05-21,"Sen. Carson Concurs with House Amendment #1341h, Motion Adopted, Voice Vote; Senate Journal 15 "
681173,2015-06-03,"Enrolled "
681173,2015-06-03,"Enrolled (In recess 5/28/2015); Senate Journal 17 "
681173,2015-06-16,"Signed by the Governor on 06/12/2015; Chapter 0153; Effective 09/10/2015 "
681175,2015-01-08,"Introduced and Referred to Legislative Administration; House Journal  12, PG. 216 "
681175,2015-02-04,"Public Hearing: 2/12/2015 9:00 Amendment Legislative Office Building 203 "
681175,2015-02-23,"Executive Session: 3/3/2015 8:15 Amendment Legislative Office Building 104 "
681175,2015-03-05,"Committee Report: Inexpedient to Legislate for Mar 11 (Vote 8-0; Consent Calendar); House Calendar19, PG. 405 "
681175,2015-03-11,"Inexpedient to Legislate: Motion Adopted Voice Vote; House Journal  24, PG. 797 "
681177,2015-01-08,"Introduced and Referred to Commerce and Consumer Affairs; House Journal  12, PG. 216 "
681177,2015-01-20,"Public Hearing: 1/29/2015 1:15 PM Legislative Office Building 302 "
681177,2015-02-03,"Subcommittee Work Session: 2/12/2015 8:30 Amendment Legislative Office Building 302 "
681177,2015-02-20,"Executive Session: 3/3/2015 1:00 PM Legislative Office Building 302 "
681177,2015-03-05,"Committee Report: Inexpedient to Legislate for Mar 11 (Vote 20-0; Consent Calendar); House Calendar19, PG. 392 "
681177,2015-03-11,"Inexpedient to Legislate: Motion Adopted Voice Vote; House Journal  24, PG. 770 "
681187,2015-01-08,"Introduced and Referred to Education; House Journal  12, PG. 216 "
681187,2015-01-21,"==POSTPONED== Public Hearing: 1/27/2015 3:00 PM Legislative Office Building 207 "
681187,2015-01-26,"==RESCHEDULED== Public Hearing: 1/28/2015 3:00 PM Legislative Office Building 207 "
681187,2015-02-11,"Executive Session: 3/3/2015 10:30 Amendment Legislative Office Building 207 "
681187,2015-03-05,"Majority Committee Report: Inexpedient to Legislate for Mar 11 (Vote 12-9; Regular Calendar); House Calendar19, PG. 420 "
681187,2015-03-05,"Minority Committee Report: Ought to Pass with Amendment #2015-0622h "
681187,2015-03-11,"Inexpedient to Legislate: Motion Failed DV 166-169; House Journal  24, PG. 867 "
681187,2015-03-11,"Amendment #0622h: Amendment Failed Regular Calendar 129-227; House Journal  24, PG. 867-869 "
681187,2015-03-11,"Lay on Table (Rep Hinch): Motion Adopted Regular Calendar 230-127; House Journal  24, PG. 869-871 "
681195,2015-01-08,"Introduced and Referred to Commerce and Consumer Affairs; House Journal  12, PG. 219 "
681195,2015-01-20,"==POSTPONED==Public Hearing: 1/27/2015 1:15 PM Legislative Office Building 302 "
681195,2015-01-26,"==RESCHEDULED==Public Hearing: 1/28/2015 1:15 PM Legislative Office Building 302 "
681195,2015-02-03,"Subcommittee Work Session: 2/4/2015 2:05 PM Legislative Office Building 302 "
681195,2015-02-18,"Subcommittee Work Session: 3/3/2015 10:00 Amendment Legislative Office Building 302 "
681195,2015-02-20,"Executive Session: 3/3/2015 1:00 PM Legislative Office Building 302 "
681195,2015-03-03,"Retained in Committee "
681195,2015-09-08,"Retained Bill - Subcommittee Work Session: 9/22/2015 10:00 Amendment Legislative Office Building 302 "
681195,2015-09-28,"Subcommittee Work Session: 10/27/2015 10:30 Amendment Legislative Office Building 305 "
681195,2015-09-29,"Executive Session: 10/27/2015 1:15 PM Legislative Office Building 302 "
681195,2015-11-12,"Committee report: Ought to Pass with Amendment #2015-2534h (NT) for Jan 6 (Vote 18-2; Consent Calendar); House Calendar 67, PG. 4 "
681196,2015-01-08,"Introduced and Referred to Municipal and County Government; House Journal  12, PG. 216 "
681196,2015-02-04,"Public Hearing: 2/12/2015 9:45 Amendment Legislative Office Building 301 "
681196,2015-02-11,"Executive Session: 2/17/2015 10:30 Amendment Legislative Office Building 301 "
681196,2015-02-17,"Retained in Committee "
681196,2015-04-28,"Retained Bill - Subcommittee Work Session: 5/7/2015 10:00 Amendment Legislative Office Building 301 "
681196,2015-05-12,"Subcommittee Work Session: 5/21/2015 10:00 Amendment Legislative Office Building 301 "
681196,2015-08-03,"Retained Bill - Subcommittee Work Session: 9/8/2015 1:00 PM Legislative Office Building 301 "
681196,2015-09-16,"Executive Session: 10/6/2015 2:00 PM Legislative Office Building 301 "
681196,2015-11-12,"Committee Report: Ought to Pass with Amendment #2015-2387h (NT) for Jan 6 (Vote 13-0; Consent Calendar); House Calendar 67, PG. 9 "
681205,2015-01-08,"Introduced and Referred to Children and Family Law; House Journal  12, PG. 216 "
681205,2015-01-28,"Public Hearing: 2/3/2015 11:00 Amendment Legislative Office Building 206 "
681205,2015-02-17,"Subcommittee Work Session: 2/19/2015 1:00 PM Legislative Office Building 206 "
681205,2015-02-24,"Executive Session: 3/3/2015 10:00 Amendment Legislative Office Building 206 "
681205,2015-03-05,"Committee Report: Inexpedient to Legislate for Mar 11 (Vote 19-0; Consent Calendar); House Calendar19, PG. 390 "
681205,2015-03-11,"Inexpedient to Legislate: Motion Adopted Voice Vote; House Journal  24, PG. 766 "
681207,2015-01-08,"Introduced and Referred to Municipal and County Government; House Journal  12, PG. 217 "
681207,2015-02-04,"Public Hearing: 2/10/2015 11:15 Amendment Legislative Office Building 301 "
681207,2015-02-05,"Executive Session: 2/12/2015 2:30 PM Legislative Office Building 301 "
681207,2015-02-20,"Committee Report: Ought to Pass for Mar 4 (Vote 16-0; Consent Calendar); House Calendar18, PG. 349 "
681207,2015-03-04,"Ought to Pass: Motion Adopted Voice Vote; House Journal  22, PG. 565 "
681207,2015-03-12,"Introduced and Referred to Public and Municipal Affairs; Senate Journal 9  "
681207,2015-03-26,"Hearing: 4/2/15, Room 102, Legislative Office Building, 1:30 p.m.; Senate Calendar 15 "
681207,2015-04-13,"=== CANCELLED SESSION === Committee Report: Rereferred to Committee, 4/23/15; Vote 5-0; Consent Calendar; Senate Calendar 18 "
681207,2015-04-17,"=== RESCHEDULED === Committee Report: Rereferred to Committee, 4/30/15; Vote 5-0; Consent Calendar; Senate Calendar 19 "
681207,2015-04-30,"Rereferred to Committee, Motion Adopted, Voice Vote, Senate Journal 12 "
681207,2015-11-03,"Committee Report: Ought to Pass, 1/6/16; Senate Calendar 49 "
681216,2015-01-08,"Introduced and Referred to Legislative Administration; House Journal  12, PG. 216 "
681216,2015-02-04,"Public Hearing: 2/12/2015 10:15 Amendment Legislative Office Building 203 "
681216,2015-02-05,"==RESCHEDULED== Public Hearing: 2/12/2015 11:00 Amendment Legislative Office Building 203 "
681216,2015-02-23,"Executive Session: 3/3/2015 8:15 Amendment Legislative Office Building 104 "
681216,2015-03-05,"Majority Committee Report: Inexpedient to Legislate for Mar 11 (Vote 8-1; Regular Calendar); House Calendar19, PG. 432-433 "
681216,2015-03-05,"Minority Committee Report: Ought to Pass "
681216,2015-03-12,"Inexpedient to Legislate: Motion Adopted Regular Calendar 271-69; House Journal  26, PG. 1245-1247 "
681221,2015-01-08,"Introduced and Referred to Judiciary; Senate Journal 4  "
681221,2015-03-03,"Hearing: 3/17/15, Room 100, State House, 9:30 a.m.; Senate Calendar 12 "
681221,2015-03-18,"Committee Report: Rereferred to Committee, 3/26/15; Senate Calendar 14 "
681221,2015-03-26,"Rereferred to Committee, Motion Adopted, Voice Vote, Senate Journal 10 "
681224,2015-01-08,"Introduced and Referred to Public and Municipal Affairs; Senate Journal 4  "
681224,2015-01-29,"Hearing: 2/4/15, Room 102, Legislative Office Building, 10:35 a.m.; Senate Calendar 8 "
681224,2015-02-05,"Committee Report: Ought to Pass, 2/12/15; Senate Calendar 9 "
681224,2015-02-12,"Ought to Pass: Motion Adopted, Voice Vote; OT3rdg; Senate Journal 5  "
681224,2015-03-04,"Introduced and Referred to Municipal and County Government; House Journal  22, PG. 629 "
681224,2015-03-31,"Public Hearing: 4/14/2015 10:30 Amendment Legislative Office Building 301 "
681224,2015-03-31,"Executive Session: 4/16/2015 10:00 Amendment Legislative Office Building 301 "
681224,2015-04-16,"Committee Report: Inexpedient to Legislate for Apr 29 (Vote 16-0; Consent Calendar); House Calendar 32, PG. 1484 "
681224,2015-04-29,"Inexpedient to Legislate: Motion Adopted Voice Vote; House Journal  36, PG. 1579 "
681233,2015-01-08,"Introduced and Referred to Public and Municipal Affairs; Senate Journal 4  "
681233,2015-03-04,"Hearing: 3/11/15, Room 102, Legislative Office Building, 10:00 a.m.; Senate Calendar 12 "
681233,2015-03-11,"Committee Report: Ought to Pass, 3/19/15; Vote 5-0; Consent Calendar; Senate Calendar 13 "
681233,2015-03-19,"Ought to Pass: Motion Adopted, Voice Vote; OT3rdg; Senate Journal 9  "
681233,2015-03-24,"Introduced and Referred to Environment and Agriculture (in recess of 3/12/2015); House Journal  26, PG. 1276 "
681233,2015-03-25,"Public Hearing: 3/31/2015 10:00 Amendment Legislative Office Building 303 "
681233,2015-03-31,"Executive Session: 4/7/2015 11:00 Amendment Legislative Office Building 303 "
681233,2015-04-09,"Committee Report: Ought to Pass with Amendment #2015-1226h for Apr 15 (Vote 15-0; Consent Calendar); House Calendar 29, PG. 1302 "
681233,2015-04-15,"Amendment #1226h: Amendment Adopted Voice Vote; House Journal  34, PG. 1537 "
681233,2015-04-15,"Ought to Pass with Amendment #1226h: Motion Adopted Voice Vote; House Journal  34, PG. 1537 "
681233,2015-04-30,"Sen. Birdsell Concurs with House Amendment #1226h, Motion Adopted, Voice Vote; Senate Journal 12 "
681233,2015-05-06,"Enrolled; House Journal  41, PG. 1779 "
681233,2015-05-13,"Enrolled (In recess 5/7/2015); Senate Journal 14 "
681233,2015-06-11,"Signed by the Governor on 06/05/2015; Chapter 0103; Effective 01/01/2016 "
681237,2015-01-08,"Introduced and Referred to Commerce; Senate Journal 4  "
681237,2015-01-29,"Hearing: 2/5/15, Room 100, State House, 2:00 p.m.; Senate Calendar 8 "
681237,2015-02-05,"Committee Report: Ought to Pass, 2/12/15; Senate Calendar 9 "
681237,2015-02-12,"Special Order SB 156 to 2/19/15, Without Objection, Motion Adopted "
681237,2015-02-12,"Committee Report: Ought to Pass, 2/19/15; Senate Calendar 10 "
681237,2015-02-19,"Special Order SB 156 to 3/5/15, Without Objection, Motion Adopted "
681237,2015-02-19,"Committee Report: Ought to Pass, 3/5/15; Senate Calendar 11 "
681237,2015-03-05,"Ought to Pass Not Voted On; Senate Journal 7  "
681237,2015-03-05,"Sen. Bradley Moved Laid on Table, Motion Adopted, Voice Vote; Senate Journal 7  "
681250,2015-01-08,"Introduced and Referred to Judiciary; House Journal  12, PG. 217 "
681250,2015-01-21,"==POSTPONED== Public Hearing: 1/27/2015 1:45 PM Legislative Office Building 208 "
681250,2015-01-26,"==RESCHEDULED== Public Hearing: 1/28/2015 1:45 PM Legislative Office Building 208 "
681250,2015-02-04,"Executive Session: 2/4/2015 12:45 PM Legislative Office Building 208 ==RECESSED== "
681250,2015-02-11,"Continued Executive Session: 2/17/2015 10:00 Amendment Legislative Office Building 208 ==RECESSED== "
681250,2015-02-25,"Continued Executive Session: 3/3/2015 10:30 Amendment Legislative Office Building 208 "
681250,2015-03-05,"Committee Report: Ought to Pass with Amendment #2015-0429h for Mar 11 (Vote 17-1; Consent Calendar); House Calendar19, PG. 403 "
681250,2015-03-11,"Amendment #0429h: Amendment Adopted Voice Vote; House Journal  24, PG. 793-794 "
681250,2015-03-11,"Ought to Pass with Amendment #0429h: Motion Adopted Voice Vote; House Journal  24, PG. 793-794 "
681250,2015-03-19,"Introduced and Referred to Judiciary; Senate Journal 10 "
681250,2015-04-21,"Hearing: 5/12/15, Room 100, State House, 9:50 a.m.; Senate Calendar 19 "
681250,2015-05-28,"Committee Report: Ought to Pass with Amendment #2015-1952s, 6/4/15; Vote 5-0; Consent Calendar; Senate Calendar 24 "
681250,2015-06-04,"Sen. Stiles Moved to Remove HB 309 from the Consent Calendar "
681250,2015-06-04,"Committee Amendment 1952s, Amendment Adopted, Voice Vote "
681250,2015-06-04,"Sen. Stiles Floor Amendment #2015-2003s, New Title, Amendment Adopted, Voice Vote; Senate Journal 17 "
681250,2015-06-04,"Ought to Pass with Amendment 1952s, and 2003s, New Title, Motion Adopted, Voice Vote; OT3rdg; Senate Journal 17 "
681250,2015-06-11,"House Concurs with Senate Amendments #1952s and #2003s (Rep Rowe): Motion Adopted Voice Vote; House Journal  46, PG. 1988 "
681250,2015-06-29,"Enrolled (In recess 6/24/2015); Senate Journal 19 "
681250,2015-06-29,"Enrolled (In recess of 6/24/2015); House Journal  54, PG. 2139 "
681250,2015-07-15,"Signed by the Governor on 7/13/2015; Chapter 225; Section 1 Effective 1/1/2016, Section 2 Effective as Provided in Section 3, Remaining Effective 7/13/2015 "
681252,2015-01-08,"Introduced and Referred to Public Works and Highways; House Journal  12, PG. 217 "
681252,2015-01-20,"Public Hearing: 2/5/2015 11:15 Amendment Legislative Office Building 201 "
681252,2015-01-20,"Executive Session: 2/10/2015 10:15 Amendment Legislative Office Building 201 "
681252,2015-02-12,"Committee Report: Ought to Pass with Amendment #2015-0304h for Feb 18 (Vote 17-0; Consent Calendar); House Calendar13, PG. 242 "
681252,2015-02-18,"Amendment #0304h: Amendment Adopted Voice Vote; House Journal  20, PG. 505 "
681252,2015-02-18,"Ought to Pass with Amendment #0304h: Motion Adopted Voice Vote; House Journal  20, PG. 505 "
681252,2015-02-18,"Referred to Finance "
681252,2015-03-03,"Division I Work Session: 3/16/2015 11:30 Amendment Legislative Office Building 212 "
681252,2015-03-12,"Executive Session: 3/18/2015 9:00 Amendment Legislative Office Building 210-211 "
681252,2015-03-19,"Committee Report: Ought to Pass for Mar 25 (Vote 21-0; Consent Calendar); House Calendar 23, PG. 632 "
681252,2015-03-25,"Ought to Pass: Motion Adopted Voice Vote; House Journal  28, PG. 1290 "
681252,2015-03-26,"Introduced and Referred to Capital Budget; Senate Journal 11 "
681252,2015-04-08,"Hearing: 4/15/15, Room 100, State House, 2:00 p.m.; Senate Calendar 17 "
681252,2015-05-14,"Committee Report: Ought to Pass, 5/21/15; Senate Calendar 22 "
681252,2015-05-21,"Ought to Pass: Motion Adopted, Voice Vote; OT3rdg; Senate Journal 15 "
681252,2015-06-03,"Enrolled (In recess 5/28/2015); Senate Journal 17 "
681252,2015-06-03,"Enrolled "
681252,2015-06-16,"Signed by the Governor on 6/12/2015; Chapter 137; Effective Date 6/12/2015 "
681259,2015-01-08,"Introduced and Referred to Judiciary; House Journal  12, PG. 216 "
681259,2015-01-21,"==POSTPONED== Public Hearing: 1/27/2015 10:00 Amendment Legislative Office Building 208 "
681259,2015-01-26,"==RESCHEDULED== Public Hearing: 1/28/2015 10:00 Amendment Legislative Office Building 208 "
681259,2015-02-04,"Executive Session: 2/4/2015 12:45 PM Legislative Office Building 208=RECESSED= "
681259,2015-02-11,"Executive Session: 2/17/2015 10:00 Amendment Legislative Office Building 208 "
681259,2015-02-20,"Committee Report: Ought to Pass for Mar 4 (Vote 13-4; Regular Calendar); House Calendar18, PG. 360 "
681259,2015-03-04,"Ought to Pass: Motion Adopted Voice Vote; House Journal  22, PG. 595-596 "
681259,2015-03-05,"Introduced and Referred to Judiciary; Senate Journal 8  "
681259,2015-04-21,"Hearing: 4/28/15, Room 100, State House, 9:00 a.m.; Senate Calendar 19 "
681259,2015-05-20,"Committee Report: Ought to Pass, 5/28/15; Senate Calendar 23 "
681259,2015-05-28,"Special Order HB 290 to after Capital Budget, Without Objection, Motion Adopted; Senate Journal 16 "
681259,2015-05-28,"Ought to Pass: Regular Calendar 18Y-4N, Motion Adopted; OT3rdg; Senate Journal 16 "
681259,2015-06-10,"Enrolled (In recess 6/4/2015); Senate Journal 18 "
681259,2015-06-11,"Enrolled; House Journal  46, PG. 1989 "
681259,2015-06-30,"Signed by the Governor on 6/26/2015; Chapter 165; Effective Date 1/1/2016 "
681267,2015-01-08,"Introduced and Referred to Fish and Game and Marine Resources; House Journal  12, PG. 218 "
681267,2015-01-20,"Public Hearing: 1/29/2015 10:15 Amendment Legislative Office Building 307 "
681267,2015-02-04,"Subcommittee Work Session: 2/12/2015 9:00 Amendment Legislative Office Building 307 "
681267,2015-02-12,"Executive Session 2/12/2015 "
681267,2015-02-12,"Committee Report: Ought to Pass with Amendment #2015-0368h for Feb 18 (Vote 13-0; Consent Calendar); House Calendar13, PG. 239 "
681267,2015-02-18,"Amendment #0368h: Amendment Adopted Voice Vote; House Journal  20, PG. 500-501 "
681267,2015-02-18,"Ought to Pass with Amendment #0368h: Motion Adopted Voice Vote; House Journal  20, PG. 500-501 "
681267,2015-02-18,"Referred to Finance "
681267,2015-02-25,"Division II Work Session: 3/3/2015 2:30 PM Legislative Office Building 209 "
681267,2015-03-10,"Division II Work Session: 3/12/2015 1:10 PM State House 103 "
681267,2015-03-12,"Executive Session: 3/18/2015 9:00 Amendment Legislative Office Building 210-211 "
681267,2015-03-19,"Committee Report: Ought to Pass for Mar 25 (Vote 22-0; Consent Calendar); House Calendar 23, PG. 632 "
681267,2015-03-25,"Ought to Pass: Motion Adopted Voice Vote; House Journal  28, PG. 1290 "
681267,2015-03-26,"Introduced and Referred to Energy and Natural Resources; Senate Journal 11 "
681267,2015-04-08,"Hearing: 4/15/15, Room 100, State House, 9:15 a.m.; Senate Calendar 17 "
681267,2015-04-15,"=== CANCELLED SESSION === Committee Report: Ought to Pass, 4/23/15; Senate Calendar 18 "
681267,2015-04-17,"=== RESCHEDULED === Committee Report: Ought to Pass, 4/30/15; Senate Calendar 19 "
681267,2015-04-30,"Ought to Pass: Motion Adopted, Voice Vote; OT3rdg; Senate Journal 12 "
681267,2015-05-13,"Enrolled (In recess 5/7/2015); Senate Journal 14 "
681267,2015-05-13,"Enrolled (in recess of 5/6/2015); House Journal  41, PG. 1779 "
681267,2015-06-11,"Signed by the Governor on 6/8/2015; Chapter 110; Effective Date 8/7/2015 "
681273,2015-01-08,"Introduced and Referred to Judiciary; House Journal  12, PG. 216 "
681273,2015-01-21,"Public Hearing: 2/3/2015 11:00 Amendment Legislative Office Building 208 "
681273,2015-02-04,"Executive Session: 2/4/2015 12:45 PM Legislative Office Building 208 ==RECESSED== "
681273,2015-02-25,"Continued Executive Session: 3/3/2015 10:30 Amendment Legislative Office Building 208 "
681273,2015-03-05,"Committee Report: Ought to Pass with Amendment #2015-0237h for Mar 11 (Vote 18-0; Consent Calendar); House Calendar19, PG. 403 "
681273,2015-03-11,"Amendment #0237h: Amendment Adopted Voice Vote; House Journal  24, PG. 793 "
681273,2015-03-11,"Ought to Pass with Amendment #0237h: Motion Adopted Voice Vote; House Journal  24, PG. 793 "
681273,2015-03-19,"Introduced and Referred to Judiciary; Senate Journal 10 "
681273,2015-04-15,"Hearing: 4/21/15, Room 100, State House, 9:15 a.m.; Senate Calendar 18 "
681273,2015-05-27,"Committee Report: Rereferred to Committee, 6/4/15; Vote 5-0; Consent Calendar; Senate Calendar 24 "
681273,2015-06-04,"Rereferred to Committee, Motion Adopted, Voice Vote, Senate Journal 17 "
681275,2015-01-08,"Introduced and Referred to Election Law; House Journal  12, PG. 217 "
681275,2015-01-21,"==POSTPONED==Public Hearing: 1/27/2015 1:15 PM Legislative Office Building 308 "
681275,2015-01-26,"==RESCHEDULED== Public Hearing: 1/28/2015 1:15 PM Legislative Office Building 308 "
681275,2015-02-11,"Executive Session: 2/17/2015 11:00 Amendment Legislative Office Building 308 "
681275,2015-02-17,"Retained in Committee "
681275,2015-08-05,"Retained Bill - Subcommittee Work Session: 8/25/2015 10:30 Amendment Legislative Office Building 308 "
681275,2015-08-05,"Retained Bill - Subcommittee Work Session: 9/1/2015 10:30 Amendment Legislative Office Building 308 "
681275,2015-08-31,"===CANCELLED=== Work Session: 9/1/2015 10:30 Amendment Legislative Office Building 308 "
681275,2015-09-15,"Executive Session: 10/20/2015 1:00 PM Legislative Office Building 308 "
681275,2015-11-12,"Committee Report: Inexpedient to Legislate for Jan 6 (Vote 19-0; Consent Calendar); House Calendar 67, PG. 6 "
681283,2015-01-08,"Introduced and Referred to Municipal and County Government; House Journal  12, PG. 217 "
681283,2015-01-28,"Public Hearing: 2/3/2015 10:00 Amendment Legislative Office Building 301 "
681283,2015-01-30,"Executive Session: 2/4/2015 12:00 PM Legislative Office Building 301 "
681283,2015-02-20,"Committee Report: Inexpedient to Legislate for Mar 4 (Vote 16-1; Consent Calendar); House Calendar18, PG. 349 "
681283,2015-03-04,"Inexpedient to Legislate: Motion Adopted Voice Vote; House Journal  22, PG. 564 "
681286,2015-01-08,"Introduced and Referred to Municipal and County Government; House Journal  12, PG. 218 "
681286,2015-01-28,"Public Hearing: 2/5/2015 11:00 Amendment Legislative Office Building 301 "
681286,2015-01-29,"==RESCHEDULED== Public Hearing: 2/5/2015 9:30 Amendment Legislative Office Building 301 "
681286,2015-02-05,"Executive Session: 2/12/2015 12:00 PM Legislative Office Building 301 "
681286,2015-02-20,"Committee Report: Inexpedient to Legislate for Mar 4 (Vote 17-0; Consent Calendar); House Calendar18, PG. 349-350 "
681286,2015-03-04,"Inexpedient to Legislate: Motion Adopted Voice Vote; House Journal  22, PG. 565 "
681297,2015-01-08,"Introduced and Referred to Transportation; House Journal  12, PG. 219 "
681297,2015-01-21,"==POSTPONED== Public Hearing: 1/27/2015 11:00 Amendment Legislative Office Building 203 "
681297,2015-01-26,"==RESCHEDULED== Public Hearing: 1/28/2015 11:00 Amendment Legislative Office Building 203 "
681297,2015-02-04,"Executive Session: 2/10/2015 1:30 PM Legislative Office Building 203 "
681297,2015-02-12,"Committee Report: Ought to Pass with Amendment #2015-0268h (NT) for Feb 18 (Vote 19-0; Consent Calendar); House Calendar13, PG. 243 "
681297,2015-02-18,"Amendment #0268h: Amendment Adopted Voice Vote; House Journal  20, PG. 506 "
681297,2015-02-18,"Ought to Pass with Amendment #0268h: Motion Adopted Voice Vote; House Journal  20, PG. 505-506 "
681297,2015-02-18,"Referred to Finance "
681297,2015-02-25,"Division II Work Session: 3/3/2015 4:00 PM Legislative Office Building 209 "
681297,2015-03-11,"Public Hearing: 3/16/2015 9:00 Amendment Legislative Office Building 210-211 "
681297,2015-03-11,"Division II Work Session: 3/16/2015 1:00 PM Legislative Office Building 210-211 "
681297,2015-03-12,"Division II Work Session: 3/18/2015 8:30 Amendment Legislative Office Building 210-211 "
681297,2015-03-12,"Executive Session: 3/18/2015 9:00 Amendment Legislative Office Building 210-211 ==RECESSED== "
681297,2015-03-18,"Continued Executive Session: 3/19/2015 10:00 Amendment Legislative Office Building 210-211 "
681297,2015-03-19,"Majority Committee Report: Ought to Pass with Amendment #2015-1015h (NT) for Mar 25 (Vote 15-11; Regular Calendar); House Calendar 23, PG. 633-634 "
681297,2015-03-19,"Minority Committee Report: Inexpedient to Legislate "
681297,2015-03-25,"Amendment #1015h: Amendment Failed Regular Calendar 3-365; House Journal  28, PG. 1291-1293 "
681297,2015-03-25,"Ought to Pass: Motion Adopted Voice Vote; House Journal  28, PG. 1291-1293 "
681297,2015-03-26,"Introduced and Referred to Transportation; Senate Journal 11 "
681297,2015-04-21,"Hearing: 4/28/15, Room 103, Legislative Office Building, 1:00 p.m.; Senate Calendar 19 "
681297,2015-04-30,"Committee Report: Inexpedient to Legislate, 5/7/15; Vote 5-0; Consent Calendar; Senate Calendar 19 "
681297,2015-05-07,"Inexpedient to Legislate, Motion Adopted, Voice Vote === BILL KILLED ===; Senate Journal 13 "
681299,2015-01-08,"Introduced and Referred to Science, Technology and Energy; House Journal  12, PG. 217 "
681299,2015-02-04,"Public Hearing: 2/17/2015 11:00 Amendment Legislative Office Building 304 "
681299,2015-02-23,"Executive Session: 3/3/2015 10:00 Amendment Legislative Office Building 304 "
681299,2015-03-03,"Retained in Committee "
681299,2015-05-26,"==CANCELED==Retained Bill - Full Committee Work Session: 5/2/2015 10:00 Amendment Legislative Office Building 304 "
681299,2015-05-26,"==RESCHEDULED==Retained Bill - Full Committee Work Session: 6/2/2015 10:00 Amendment Legislative Office Building 304 "
681299,2015-06-16,"Retained Bill - Full Committee Work Session: 6/23/2015 10:00 Amendment Legislative Office Building 304 "
681299,2015-06-24,"Retained Bill - Full Committee Work Session: 6/30/2015 10:00 Amendment Legislative Office Building 304 "
681299,2015-06-24,"Executive Session: 6/30/2015 11:00 Amendment Legislative Office Building 304 "
681299,2015-07-08,"Committee Report: Ought to Pass with Amendment #2015-2359h (NT) for Jan 6 (Vote 14-6; Regular Calendar); House Calendar 67, PG. 26 "
681304,2015-01-08,"Introduced and Referred to Commerce and Consumer Affairs; House Journal  12, PG. 219 "
681304,2015-01-20,"==POSTPONED==Public Hearing: 1/27/2015 10:30 Amendment Legislative Office Building 302 "
681304,2015-01-26,"==RESCHEDULED== Public Hearing: 1/28/2015 10:30 Amendment Legislative Office Building 302 "
681304,2015-02-03,"Subcommittee Work Session: 2/4/2015 2:05 PM Legislative Office Building 302 "
681304,2015-02-18,"Subcommittee Work Session: 3/3/2015 10:00 Amendment Legislative Office Building 302 "
681304,2015-02-20,"Executive Seesion: 3/3/2015 1:00 PM Legislative Office Building 302 "
681304,2015-03-05,"Committee Report: Ought to Pass for Mar 11 (Vote 15-5; Regular Calendar); House Calendar19, PG. 414 "
681304,2015-03-11,"Ought to Pass: Motion Adopted Voice Vote; House Journal  24, PG. 835 "
681304,2015-03-19,"Introduced and Referred to Commerce; Senate Journal 10 "
681304,2015-04-08,"Hearing: 4/14/15, Room 100, State House, 1:15 p.m.; Senate Calendar 17 "
681304,2015-04-16,"=== CANCELLED SESSION === Committee Report: Ought to Pass with Amendment 1349s, 4/23/15; Vote 5-0; Consent Calendar; Senate Calendar 18 "
681304,2015-04-17,"=== RESCHEDULED === Committee Report: Ought to Pass with Amendment #2015-1349s, 4/30/15; Vote 5-0; Consent Calendar; Senate Calendar 19 "
681304,2015-04-30,"Committee Amendment 1349s, Amendment Adopted, Voice Vote "
681304,2015-04-30,"Ought to Pass with Amendment 1349s, Motion Adopted, Voice Vote; OT3rdg; Senate Journal 12 "
681304,2015-06-11,"House Concurs with Senate Amendment #1349s (Rep Hunt): Motion Adopted Voice Vote; House Journal  46, PG. 1988 "
681304,2015-06-25,"Enrolled Bill Amendment #2327e Adopted, Voice Vote, (In recess of 6/24/2015); Senate Journal 19 "
681304,2015-06-26,"Enrolled Bill Amendment #2015-2327e: Amendment Adopted Voice Vote (in recess of 6/24/2015); House Journal  54, PG. 2138 "
681304,2015-07-02,"Enrolled (In recess 6/24/2015); Senate Journal 19 "
681304,2015-07-02,"Enrolled (In recess of 6/24/2015); House Journal  54, PG. 2141 "
681304,2015-07-15,"Signed by the Governor on 7/13/2015; Chapter 228; Effective Date 9/11/2015 "
681310,2015-01-08,"Introduced and Referred to Public and Municipal Affairs; Senate Journal 4  "
681310,2015-01-29,"Hearing: 2/4/15, Room 102, Legislative Office Building, 9:45 a.m.; Senate Calendar 8 "
681310,2015-02-05,"Committee Report: Ought to Pass, 2/12/15; Senate Calendar 9 "
681310,2015-02-12,"Ought to Pass: Motion Adopted, Voice Vote; OT3rdg; Senate Journal 5  "
681310,2015-03-04,"Introduced and Referred to Municipal and County Government; House Journal  22, PG. 629 "
681310,2015-03-17,"Public Hearing: 3/24/2015 11:40 Amendment Legislative Office Building 301 "
681310,2015-03-17,"Executive Session: 3/26/2015 10:00 Amendment Legislative Office Building 301 "
681310,2015-03-27,"Committee Report: Ought to Pass for Apr 15 (Vote 15-0; Consent Calendar); House Calendar 29, PG. 1306 "
681310,2015-04-15,"Ought to Pass: Motion Adopted Voice Vote; House Journal  34, PG. 1548 "
681310,2015-04-29,"Enrolled; House Journal  36, PG. 1597 "
681310,2015-04-29,"Enrolled (In recess 4/9/2015); Senate Journal 12 "
681310,2015-05-08,"Signed by the Governor on 05/07/2015; Chapter 0031; Effective 07/06/2015 "
681317,2015-01-08,"Introduced and Referred to Ways and Means; Senate Journal 4  "
681317,2015-01-21,"Hearing:=== CANCELLED === 1/27/15, Room 103, State House, 9:15 a.m.; Senate Calendar 7 "
681317,2015-01-26,"Hearing:=== RESCHEDULED === 2/5/15, Room 103, State House, 9:15 a.m.; Senate Calendar 8 "
681317,2015-02-05,"Committee Report: Ought to Pass, 2/12/15; Senate Calendar 9 "
681317,2015-02-12,"Ought to Pass: Motion Adopted, Voice Vote; Senate Journal 5  "
681317,2015-02-12,"Pending Motion OT3rdg; Senate Journal 5  "
681317,2015-02-12,"Sen. Sanborn Moved Laid On Table, Motion Adopted, Voice Vote: Senate Journal 5  "
681317,2015-03-26,"Sen. Boutin Moved Remove From Table, Motion Adopted, Voice Vote; Senate Journal 10 "
681317,2015-03-26,"OT3rdg; Senate Journal 10 "
681317,2015-03-31,"Introduced and Referred to Ways and Means (in recess of 3/25/2015); House Journal  28, PG. 1299 "
681317,2015-03-31,"Public Hearing: 4/9/2015 10:00 Amendment Legislative Office Building 202 "
681317,2015-04-14,"Subcommittee Work Session: 4/23/2015 10:00 Amendment Legislative Office Building 202 "
681317,2015-04-23,"Subcommittee Work Session: 4/28/2015 1:30 PM Legislative Office Building 202 "
681317,2015-05-04,"Subcommittee Work Session: 5/5/2015 10:00 Amendment Legislative Office Building 202 "
681317,2015-05-05,"Subcommittee Work Session: 5/12/2015 10:00 Amendment Legislative Office Building 202 "
681317,2015-05-12,"Subcommittee Work Session: 5/19/2015 10:00 Amendment Legislative Office Building 202 "
681317,2015-05-12,"Executive Session: 5/21/2015 10:00 Amendment Legislative Office Building 202 "
681317,2015-05-21,"Retained in Committee "
681317,2015-07-29,"Subcommittee Work Session: 9/10/2015 1:00 PM Legislative Office Building 202 "
681317,2015-08-31,"===CANCELLED=== Work Session: 9/10/2015 1:00 PM Legislative Office Building 202 "
681317,2015-08-31,"==RESCHEDULED== Work Session: 9/15/2015 9:00 Amendment Legislative Office Building 202 "
681317,2015-09-15,"Retained Bill - Subcommittee Work Session: 9/22/2015 1:00 PM Legislative Office Building 204 "
681317,2015-09-16,"==CANCELED==Executive Session: 10/29/2015 10:00 Amendment Legislative Office Building 202 "
681317,2015-09-22,"Subcommittee Work Session: 9/29/2015 9:00 Amendment Legislative Office Building 202 "
681317,2015-09-29,"Subcommittee Work Session: 10/8/2015 1:00 PM Legislative Office Building 202 "
681317,2015-10-05,"Subcommittee Work Session: 10/13/2015 1:00 PM Legislative Office Building 202 "
681317,2015-10-06,"==RESCHEDULED==Executive Session: 10/14/2015 10:00 Amendment Legislative Office Building 202 "
681317,2015-11-12,"Committee Report: Ought to Pass with Amendment #2015-2484h (NT) for Jan 6 (Vote 18-0; Consent Calendar); House Calendar 67, PG. 12 "
681319,2015-01-08,"Introduced and Referred to Children and Family Law; House Journal  12, PG. 216 "
681319,2015-01-21,"==POSTPONED==Public Hearing: 1/27/2015 10:00 Amendment Legislative Office Building 206 "
681319,2015-01-26,"==RESCHEDULED== Public Hearing: 1/28/2015 10:00 Amendment Legislative Office Building 206 "
681319,2015-01-29,"Subcommittee Work Session: 2/3/2015 9:00 Amendment Legislative Office Building 206 "
681319,2015-02-04,"Subcommittee Work Session: 2/10/2015 9:00 Amendment Legislative Office Building 206 "
681319,2015-02-04,"Subcommittee Work Session: 2/12/2015 9:00 Amendment Legislative Office Building 206 "
681319,2015-02-13,"Subcommittee Work Session: 2/17/2015 9:00 Amendment Legislative Office Building 206 "
681319,2015-02-24,"Executive Session: 3/3/2015 10:00 Amendment Legislative Office Building 206 "
681319,2015-03-05,"Committee Report: Ought to Pass with Amendment #2015-0693h for Mar 11 (Vote 18-0; Consent Calendar); House Calendar19, PG. 390 "
681319,2015-03-11,"Amendment #0693h: Amendment Adopted Voice Vote; House Journal  24, PG. 766-767 "
681319,2015-03-11,"Ought to Pass with Amendment #0693h: Motion Adopted Voice Vote; House Journal  24, PG. 766-767 "
681319,2015-03-19,"Introduced and Referred to Judiciary; Senate Journal 10 "
681319,2015-04-21,"Hearing: 5/5/15, Room 100, State House, 10:00 a.m.; Senate Calendar 19 "
681319,2015-05-21,"Committee Report: Ought to Pass with Amendment #2015-1875s, 5/28/15; Vote 5-0; Consent Calendar; Senate Calendar 23 "
681319,2015-05-28,"Committee Amendment 1875s, Amendment Adopted, Voice Vote "
681319,2015-05-28,"Ought to Pass with Amendment 1875s, Motion Adopted, Voice Vote; OT3rdg; Senate Journal 16 "
681319,2015-06-03,"House Non-Concurs with Senate Amendment #1875s and Requests Committee of Conference (Rep Gargasz): Motion Adopted Voice Vote; House Journal  44, PG. 1814 "
681319,2015-06-03,"Speaker Appoints: Reps Itse, P. Long, Berrien, Edelblut; House Journal  44, PG. 1814 "
681319,2015-06-04,"Sen. Carson Accedes to House Request for Committee of Conference, Motion Adopted, Voice Vote; Senate Journal 17 "
681319,2015-06-04,"President Appoints: Senators Carson, Lasky, and Cataldo "
681319,2015-06-11,"Conference Committee Meeting: 6/16/2015 1:00 PM Legislative Office Building 206 "
681319,2015-06-11,"Conferee Change: Rep Ferreira Replaces Rep Edelblut; House Journal  46, PG. 1990 "
681319,2015-06-18,"Conferee Change: Rep Gargasz Replaces Rep Ferreira; House Journal  46, PG. 1992 "
681319,2015-06-18,"Conferee Change: Rep Ferreira Replaces Rep Gargasz; House Journal  46, PG. 1993 "
681319,2015-06-18,"Conference Committee Report #2015-2235c; Senate Amendment + New Amendment, Filed "
681319,2015-06-24,"Conference Committee Report 2235c; Adopted, Voice Vote; Senate Journal 19 "
681319,2015-06-24,"Conference Committee Report 2235c: Adopted, Voice Vote; House Journal  54, PG. 2122 "
681319,2015-07-09,"Enrolled (In recess 6/24/2015); Senate Journal 19 "
681319,2015-07-09,"Enrolled (in recess of 6/24/2015); House Journal  54, PG. 2142 "
681319,2015-07-21,"Signed by the Governor on 7/20/2015; Chapter 260; Sections 1, 4, 5, 6 Effective 7/1/2015 at 12:01 a.m., Remainder Effective 9/18/2015 "
681325,2015-01-08,"Introduced and Referred to Health, Human Services and Elderly Affairs; House Journal  12, PG. 217 "
681325,2015-01-21,"==POSTPONED== Public Hearing: 1/27/2015 10:15 Amendment Legislative Office Building 205 "
681325,2015-01-26,"==RESCHEDULED== Public Hearing: 1/28/2015 10:15 Amendment Legislative Office Building 205 "
681325,2015-01-28,"Executive Session: 2/3/2015 10:00 Amendment Legislative Office Building 205 "
681325,2015-02-05,"Committee Report: Ought to Pass with Amendment #2015-0158h for Feb 11 (Vote 18-0; Consent Calendar); House Calendar11, PG. 174 "
681325,2015-02-11,"Adopt Amendment #0158h: Amendment Adopted Voice Vote; House Journal  16, PG. 303 "
681325,2015-02-11,"Ought to Pass with Amendment #0158h: Motion Adopted Voice Vote; House Journal  16, PG. 303 "
681325,2015-02-11,"Refer to Finance "
681325,2015-02-11,"Second Committee Referral Waived by Committee Chair per House Rule 46(f); House Journal  16, PG. 317 "
681325,2015-03-12,"Introduced and Referred to Health and Human Services; Senate Journal 9  "
681325,2015-03-19,"Hearing: 3/24/15, Room 101, Legislative Office Building, 1:40 p.m.; Senate Calendar 14 "
681325,2015-05-27,"Committee Report: Ought to Pass with Amendment #2015-1949s, 6/4/15; Senate Calendar 24 "
681325,2015-06-04,"Committee Amendment 1949s, Amendment Adopted, Voice Vote "
681325,2015-06-04,"Ought to Pass with Amendment 1949s, Motion Adopted, Voice Vote; OT3rdg; Senate Journal 17 "
681325,2015-06-11,"House Concurs with Senate Amendment #1949s (Rep Kotowski): Motion Adopted Voice Vote; House Journal  46, PG. 1988 "
681325,2015-06-29,"Enrolled (In recess 6/24/2015); Senate Journal 19 "
681325,2015-06-29,"Enrolled (In recess of 6/24/2015); House Journal  54, PG. 2139 "
681325,2015-07-15,"Signed by the Governor on 7/13/2015; Chapter 227; Section 2 Effective 11/1/2016, Remaining Effective 7/13/2015 "
681364,2015-01-08,"Introduced and Referred to Public and Municipal Affairs; Senate Journal 4  "
681364,2015-03-11,"Hearing: 3/18/15, Room 102, Legislative Office Building, 9:00 a.m.; Senate Calendar 13 "
681364,2015-03-18,"Committee Report: Ought to Pass with Amendment #2015-1025s, 3/26/15; Senate Calendar 14 "
681364,2015-03-26,"Committee Amendment 1025s, Regular Calendar 13Y-10N, Amendment Adopted "
681364,2015-03-26,"Ought to Pass with Amendment 1025s, Regular Calendar 13Y-10N, Motion Adopted; OT3rdg; Senate Journal 10 "
681364,2015-03-31,"Introduced and Referred to Election Law (in recess of 3/25/2015); House Journal  28, PG. 1299 "
681364,2015-04-01,"Public Hearing: 4/7/2015 10:30 Amendment Legislative Office Building 308 "
681364,2015-04-15,"Executive Session: 4/21/2015 11:15 Amendment Legislative Office Building 308==RECESSED== "
681364,2015-04-21,"Continued Executive Session: 4/29/2015 1:55 PM Legislative Office Building 308 "
681364,2015-05-20,"Continued Executive Session: 5/27/2015 9:30 Amendment Legislative Office Building 308 "
681364,2015-05-28,"Majority Committee Report: Ought to Pass with Amendment #2015-1944h (NT) for Jun 3 (Vote 9-8; Regular Calendar); House Calendar 39, PG. 1635-1636 "
681364,2015-05-28,"Minority Committee Report: Inexpedient to Legislate "
681364,2015-06-03,"Amendment #1944h: Amendment Adopted Voice Vote; House Journal  44, PG. 1908-1913 "
681364,2015-06-03,"Ought to Pass with Amendment #1944h: Motion Adopted Regular Calendar 211-145; House Journal  44, PG. 1908-1915 "
681364,2015-06-04,"Sen. Birdsell Concurs with House Amendment #1944h, New Title, Motion Adopted, Voice Vote; Senate Journal 17 "
681364,2015-06-18,"Enrolled Bill Amendment #2015-2293EBA: Amendment Adopted Voice Vote (in recess of 6/11/2015); House Journal  46, PG. 1993 "
681364,2015-06-24,"Enrolled Bill Amendment #2015-2293e Adopted, Voice Vote, (In recess of 6/24/2015); Senate Journal 19 "
681364,2015-06-29,"Enrolled (In recess of 6/24/2015); House Journal  54, PG. 2139 "
681364,2015-06-29,"Enrolled (In recess 6/24/2015); Senate Journal 19 "
681364,2015-07-13,"Vetoed by Governor 07/10/2015 "
681364,2015-09-16,"Notwithstanding the Governor’s Veto, Shall SB 179 Become Law: Regular Calendar 13Y-11N, Veto Sustained, lacking the necessary two-thirds vote; Senate Journal 20 "
681383,2015-01-08,"Introduced and Referred to Executive Departments and Administration; Senate Journal 4  "
681383,2015-01-28,"Hearing: 2/4/15, Room 101, Legislative Office Building, 9:40 a.m.; Senate Calendar 8 "
681383,2015-03-04,"Committee Report: Ought to Pass with Amendment #2015-0733s, 3/12/15; Senate Calendar 12 "
681383,2015-03-12,"Committee Amendment 0733s, Amendment Adopted, Voice Vote "
681383,2015-03-12,"Ought to Pass with Amendment 0733s, Motion Adopted, Voice Vote; Refer to Finance Rule 4-5; Senate Journal 8  "
681383,2015-03-18,"Committee Report: Ought to Pass, 3/26/15; Senate Calendar 14 "
681383,2015-03-26,"Ought to Pass: Motion Adopted, Voice Vote; OT3rdg; Senate Journal 10 "
681383,2015-03-31,"Introduced and Referred to Executive Departments and Administration (in recess of 3/25/2015); House Journal  28, PG. 1299 "
681383,2015-04-01,"Public Hearing: 4/7/2015 10:00 Amendment Legislative Office Building 306 "
681383,2015-04-01,"Executive Session: 4/7/2015 1:00 PM Legislative Office Building 306 "
681383,2015-04-09,"Committee Report: Ought to Pass for Apr 15 (Vote 11-3; Regular Calendar); House Calendar 29, PG. 1308-1309 "
681383,2015-04-15,"Ought to Pass: Motion Adopted Voice Vote; House Journal  34, PG. 1555-1556 "
681383,2015-04-15,"Referred to Finance; House Journal  34, PG. 1556 "
681383,2015-04-16,"Division I Work Session: 4/23/2015 11:00 Amendment Legislative Office Building 212 "
681383,2015-04-23,"Division I Work Session: 4/30/2015 11:00 Amendment Legislative Office Building 212 "
681383,2015-04-29,"Division I Work Session: 5/5/2015 11:00 Amendment Legislative Office Building 212 "
681383,2015-05-05,"Division I Work Session: 5/14/2015 10:00 Amendment Legislative Office Building 212 "
681383,2015-05-20,"Executive Session: 5/26/2015 10:00 Amendment Legislative Office Building 201 "
681383,2015-05-28,"Committee Report: Ought to Pass with Amendment #2015-1899h (Vote 21-0; Regular Calendar); House Calendar 39, PG. 1637 "
681383,2015-06-03,"Amendment #1899h: Amendment Adopted Voice Vote; House Journal  44, PG. 1930 "
681383,2015-06-03,"Ought to Pass with Amendment #1899h: Motion Adopted Voice Vote; House Journal  44, PG. 1930 "
681383,2015-06-04,"Sen. Carson Concurs with House Amendment #1899h, Motion Adopted, Voice Vote; Senate Journal 17 "
681383,2015-06-18,"Enrolled Bill Amendment #2015-2221EBA (in recess of 6/11/2015); House Journal  46, PG. 1993 "
681383,2015-06-24,"Enrolled Bill Amendment #2015-2221e Adopted, Voice Vote, (In recess of 6/24/2015); Senate Journal 19 "
681383,2015-06-29,"Enrolled (In recess of 6/24/2015); House Journal  54, PG. 2139 "
681383,2015-06-29,"Enrolled (In recess 6/24/2015); Senate Journal 19 "
681383,2015-07-15,"Signed by the Governor on 07/13/2015; Chapter 0253; Effective 09/11/2015 "
681406,2015-01-08,"Introduced and Referred to Commerce; Senate Journal 4  "
681406,2015-02-20,"Hearing: 3/2/15, Room 100, State House, 1:40 p.m.; Senate Calendar 11 "
681406,2015-03-04,"Committee Report: Ought to Pass, 3/12/15; Senate Calendar 12 "
681406,2015-03-12,"Ought to Pass: Motion Adopted, Voice Vote; OT3rdg; Senate Journal 8  "
681406,2015-03-12,"Introduced and Referred to Commerce and Consumer Affairs; House Journal  26, PG. 1275 "
681406,2015-03-25,"Public Hearing: 4/2/2015 1:15 PM Legislative Office Building 302 "
681406,2015-04-02,"Subcommittee Work Session: 4/8/2015 2:00 PM Legislative Office Building 302 "
681406,2015-05-06,"Executive Session: 5/12/2015 1:15 PM Legislative Office Building 302 "
681406,2015-05-21,"Committee Report: Ought to Pass for Jun 3 (Vote 19-0; Consent Calendar); House Calendar 39, PG. 1629 "
681406,2015-06-03,"Ought to Pass: Motion Adopted Voice Vote; House Journal  44, PG. 1826 "
681406,2015-06-24,"Enrolled; House Journal  54, PG. 2102 "
681406,2015-06-24,"Enrolled (In recess 6/24/2015); Senate Journal 19 "
681406,2015-07-07,"Signed by the Governor on 07/06/2015; Chapter 0213; Effective 07/06/2015 "
681430,2015-01-08,"Introduced and Referred to Executive Departments and Administration; Senate Journal 4  "
681430,2015-02-04,"Hearing: 2/11/15, Room 101, Legislative Office Building, 9:30 a.m.; Senate Calendar 9 "
681430,2015-03-04,"Committee Report: Rereferred to Committee, 3/12/15; Senate Calendar 12 "
681430,2015-03-12,"Rereferred to Committee, Motion Adopted, Voice Vote, Senate Journal 8  "
681430,2015-11-19,"Committee Report: Inexpedient to Legislate, 1/6/16; Senate Calendar 49 "
681451,2015-01-08,"Introduced and Referred to Education; Senate Journal 4  "
681451,2015-01-28,"Hearing: 2/10/15, Room 103, Legislative Office Building, 10:00 a.m.; Senate Calendar 8 "
681451,2015-02-11,"Committee Report: Inexpedient to Legislate, 2/19/15; Senate Calendar 10 "
681451,2015-02-19,"Inexpedient to Legislate, Regular Calendar 14Y-10N, Motion Adopted === BILL KILLED ===; Senate Journal 6  "
681470,2015-01-08,"Introduced and Referred to Health and Human Services; Senate Journal 4  "
681470,2015-02-20,"Hearing: 3/3/15, Room 101, Legislative Office Building, 1:40 p.m.; Senate Calendar 11 "
681470,2015-03-11,"Committee Report: Inexpedient to Legislate, 3/19/15; Senate Calendar 13 "
681470,2015-03-19,"Inexpedient to Legislate, Motion Adopted, Voice Vote === BILL KILLED ===; Senate Journal 9  "
681489,2015-01-08,"Introduced and Referred to Judiciary; House Journal  12, PG. 218 "
681489,2015-01-21,"Public Hearing: 1/29/2015 11:15 Amendment Legislative Office Building 207 "
681489,2015-02-04,"Executive Session: 2/4/2015 1:30 PM Legislative Office Building 208 "
681489,2015-02-05,"Majority Committee Report: Inexpedient to Legislate for Mar 4 (Vote 14-1; Regular Calendar); House Calendar18, PG. 359 "
681489,2015-02-05,"Minority Committee Report: Ought to Pass "
681489,2015-03-04,"Inexpedient to Legislate: Motion Adopted Regular Calendar 235-121; House Journal  22, PG. 593-595 "
681514,2015-01-08,"Introduced and Referred to Commerce; Senate Journal 4  "
681514,2015-03-04,"Hearing: 3/17/15, Room 100, State House, 2:00 p.m.; Senate Calendar 12 "
681514,2015-03-19,"Committee Report: Ought to Pass with Amendment #2015-1008s, 3/26/15; Vote 5-0; Consent Calendar; Senate Calendar 14 "
681514,2015-03-26,"Committee Amendment 1008s, Amendment Adopted, Voice Vote "
681514,2015-03-26,"Ought to Pass with Amendment 1008s, Motion Adopted, Voice Vote; OT3rdg; Senate Journal 10 "
681514,2015-03-31,"Introduced and Referred to Commerce and Consumer Affairs (in recess of 3/25/2015); House Journal  28, PG. 1299 "
681514,2015-04-01,"Public Hearing: 4/8/2015 10:30 Amendment Legislative Office Building 302 "
681514,2015-04-02,"Subcommittee Work Session: 4/8/2015 2:00 PM Legislative Office Building 302 "
681514,2015-05-06,"Executive Session: 5/12/2015 1:15 PM Legislative Office Building 302 "
681514,2015-05-13,"Committee Report: Ought to Pass for Jun 3 (Vote 17-2; Consent Calendar); House Calendar 39, PG. 1628 "
681514,2015-06-03,"Ought to Pass: Motion Adopted Voice Vote; House Journal  44, PG. 1823 "
681514,2015-06-16,"Enrolled Bill Amendment #2015-2133-EBA: Amendment Adopted Voice Vote (in recess of 6/11/2015); House Journal  46, PG. 1991 "
681514,2015-06-17,"Enrolled Bill Amendment #2015-2133e Adopted, Voice Vote, (In recess of 6/11/2015); Senate Journal 19 "
681514,2015-06-24,"Enrolled; House Journal  54, PG. 2102 "
681514,2015-06-24,"Enrolled (In recess 6/24/2015); Senate Journal 19 "
681514,2015-07-07,"Signed by the Governor on 07/06/2015; Chapter 0205; Effective 09/04/2015 "
681534,2015-01-08,"Introduced and Referred to Ways and Means; Senate Journal 4  "
681534,2015-01-29,"Hearing: 2/10/15, Room 103, State House, 9:00 a.m.; Senate Calendar 8 "
681534,2015-02-10,"Committee Report: Ought to Pass, 2/19/15; Senate Calendar 10 "
681534,2015-02-19,"Ought to Pass: Regular Calendar 24Y-0N, Motion Adopted; Senate Journal 6  "
681534,2015-02-19,"Pending Motion OT3rdg; Senate Journal 6  "
681534,2015-02-19,"Sen. Bradley Moved Laid On Table, Motion Adopted, Voice Vote: Senate Journal 6  "
681555,2015-01-08,"Introduced and Referred to Finance; Senate Journal 4  "
681555,2015-01-20,"Hearing: 2/3/15, Room 103, State House, 2:00 p.m.; Senate Calendar 7 "
681555,2015-02-05,"Committee Report: Inexpedient to Legislate, 2/12/15; Senate Calendar 9 "
681555,2015-02-12,"Inexpedient to Legislate, Motion Adopted, Voice Vote === BILL KILLED ===; Senate Journal 5 "
681579,2015-01-08,"Introduced and Referred to Energy and Natural Resources; Senate Journal 4  "
681579,2015-01-29,"Hearing: 2/4/15, Room 100, State House, 9:45 a.m.; Senate Calendar 8 "
681579,2015-02-05,"Committee Report: Ought to Pass, 2/12/15; Vote 5-0; Consent Calendar; Senate Calendar 9 "
681579,2015-02-12,"Ought to Pass: Motion Adopted, Voice Vote; OT3rdg; Senate Journal 5  "
681579,2015-03-04,"Introduced and Referred to Fish and Game and Marine Resources; House Journal  22, PG. 629 "
681579,2015-03-11,"Public Hearing: 3/19/2015 10:30 Amendment Legislative Office Building 307 "
681579,2015-03-26,"Executive Session: 3/26/2015 Legislative Office Building 307 "
681579,2015-03-26,"Committee Report: Ought to Pass for Apr 15 (Vote 12-0; Consent Calendar); House Calendar 29, PG. 1303 "
681579,2015-04-15,"Ought to Pass: Motion Adopted Voice Vote; House Journal  34, PG. 1539 "
681579,2015-04-29,"Enrolled; House Journal  36, PG. 1597 "
681579,2015-04-29,"Enrolled (In recess 4/9/2015); Senate Journal 12 "
681579,2015-05-08,"Signed by the Governor on 05/07/2015; Chapter 0035; Effective 07/01/2015 "
681600,2015-01-08,"Introduced and Referred to Finance; Senate Journal 4  "
681600,2015-01-20,"Hearing: 2/3/15, Room 103, State House, 3:00 p.m.; Senate Calendar 7 "
681600,2015-02-05,"Committee Report: Ought to Pass, 2/12/15; Senate Calendar 9 "
681600,2015-02-12,"Ought to Pass: Motion Adopted, Regular Calendar 14Y-9N; OT3rdg; Senate Journal 5  "
681600,2015-03-04,"Introduced and Referred to Finance; House Journal  22, PG. 628 "
681600,2015-04-02,"Public Hearing: 4/8/2015 9:30 Amendment Legislative Office Building 210-211 "
681600,2015-04-02,"Full Committee Work Session: 4/9/2015 10:00 Amendment Legislative Office Building 210-211 "
681600,2015-04-08,"Executive Session: 4/16/2015 9:30 Amendment Legislative Office Building 210-211 "
681600,2015-04-16,"Committee Report: Inexpedient to Legislate for Apr 29 (Vote 21-0; Consent Calendar); House Calendar 32, PG. 1483 "
681600,2015-04-29,"Inexpedient to Legislate: Motion Adopted Voice Vote; House Journal  36, PG. 1578 "
681617,2015-01-08,"Introduced and Referred to Education; Senate Journal 4  "
681617,2015-01-21,"Hearing: 2/3/15, Room 103, Legislative Office Building, 10:00 a.m.; Senate Calendar 7 "
681617,2015-02-04,"Committee Report: Ought to Pass, 2/12/15; Vote 5-0; Consent Calendar; Senate Calendar 9 "
681617,2015-02-12,"Ought to Pass: Motion Adopted, Voice Vote; OT3rdg; Senate Journal 5  "
681617,2015-03-04,"Introduced and Referred to Education; House Journal  22, PG. 629 "
681617,2015-03-17,"Public Hearing: 3/24/2015 9:30 Amendment Legislative Office Building 207 "
681617,2015-03-24,"Executive Session: 3/31/2015 11:15 Amendment Legislative Office Building 207 "
681617,2015-04-08,"Committee Report: Ought to Pass for Apr 15 (Vote 21-0; Consent Calendar); House Calendar 29, PG. 1302 "
681617,2015-04-15,"Ought to Pass: Motion Adopted Voice Vote; House Journal  34, PG. 1535 "
681617,2015-04-29,"Enrolled; House Journal  36, PG. 1597 "
681617,2015-04-29,"Enrolled (In recess 4/9/2015); Senate Journal 12 "
681617,2015-05-08,"Signed by the Governor on 05/05/2015; Chapter 0024; Effective 07/04/2015 "
681637,2015-01-08,"Introduced and Referred to Public and Municipal Affairs; Senate Journal 4  "
681637,2015-01-29,"Hearing: 2/4/15, Room 102, Legislative Office Building, 10:15 a.m.; Senate Calendar 8 "
681637,2015-02-12,"Committee Report: Rereferred to Committee, 2/19/15; Vote 5-0; Consent Calendar; Senate Calendar 10 "
681637,2015-02-19,"Rereferred to Committee, Motion Adopted, Voice Vote, Senate Journal 6  "
681637,2015-11-19,"Committee Report: Inexpedient to Legislate; 1/6/16; Vote 5-0; Consent Calendar; Senate Calendar 49 "
681660,2015-01-08,"Introduced and Referred to Children and Family Law; House Journal  12, PG. 219 "
681660,2015-02-04,"Public Hearing: 2/17/2015 1:30 PM Legislative Office Building 206 "
681660,2015-02-24,"Executive Session: 3/3/2015 10:00 Amendment Legislative Office Building 206 "
681660,2015-03-06,"Retained in Committee "
681660,2015-03-10,"Full Committee Work Session: 3/17/2015 10:00 Amendment Legislative Office Building 206 "
681660,2015-05-13,"Retained Bill - Full Committee Work Session: 5/19/2015 1:15 PM Legislative Office Building 206 "
681660,2015-05-27,"Retained Bill - Full Committee Work Session: 6/2/2015 10:00 Amendment Legislative Office Building 206 "
681660,2015-08-24,"Retained Bill - Full Committee Work Session: 9/16/2015 10:00 Amendment Legislative Office Building 206 "
681660,2015-09-16,"Executive Session: 9/29/2015 10:00 Amendment Legislative Office Building 206 "
681660,2015-11-12,"Committee Report: Ought to Pass with Amendment #2015-2405h (NT) for Jan 6 (Vote 15-0; Consent Calendar); House Calendar 67, PG. 3 "
681684,2015-01-08,"Introduced and Referred to Finance; House Journal  12, PG. 218 "
681684,2015-01-21,"Public Hearing: 1/29/2015 2:30 PM Legislative Office Building 210-211 "
681684,2015-01-28,"Division III Work Session: 2/3/2015 9:30 Amendment Legislative Office Building 210-211 "
681684,2015-01-28,"Executive Session: 2/5/2015 10:00 Amendment Legislative Office Building 210-211 "
681684,2015-02-05,"Committee Report: Inexpedient to Legislate for Feb 11 (Vote 23-1; Consent Calendar); House Calendar11, PG. 172-173 "
681684,2015-02-11,"Inexpedient to Legislate: Motion Adopted Voice Vote; House Journal  16, PG. 299 "
681703,2015-01-08,"Introduced and Referred to Executive Departments and Administration; House Journal  12, PG. 219 "
681703,2015-01-21,"===CANCELED===Public Hearing: 1/29/2015 11:00 Amendment Legislative Office Building 306 "
681703,2015-02-04,"Public Hearing: 2/17/2015 10:00 Amendment Legislative Office Building 306 "
681703,2015-02-24,"Executive Session: 3/2/2015 12:30 PM Legislative Office Building 306 "
681703,2015-03-02,"Retained in Committee "
681703,2015-05-05,"Retained Bill - Full Committee Work Session: 5/12/2015 10:00 Amendment Legislative Office Building 306 "
681703,2015-05-12,"Retained Bill - Subcommittee Work Session: 6/9/2015 1:00 PM Legislative Office Building 306 "
681703,2015-10-07,"Retained Bill - Full Committee Work Session: 10/21/2015 10:00 Amendment Legislative Office Building 306 "
681703,2015-10-07,"Executive Session: 10/21/2015 11:00 Amendment Legislative Office Building 306==RECESSED== "
681703,2015-10-21,"==RESCHEDULED== Work Session: 10/29/2015 11:00 Amendment Legislative Office Building 306 "
681703,2015-10-21,"==CONTINUED== Executive Session: 10/29/2015 1:30 PM Legislative Office Building 306 "
681703,2015-11-12,"Committee Report: Ought to Pass with Amendment #2015-2506h (NT) for Jan 6 (Vote 11-0; Consent Calendar); House Calendar 67, PG. 7 "
681727,2015-01-08,"Introduced and Referred to Science, Technology and Energy; House Journal  12, PG. 219 "
681727,2015-02-04,"Public Hearing: 2/12/2015 10:00 Amendment Legislative Office Building 304 "
681727,2015-02-23,"Executive Session: 2/17/2015 Legislative Office Building 304 "
681727,2015-02-23,"Majority Committee Report: Inexpedient to Legislate for Mar 4 (Vote 10-9; Regular Calendar); House Calendar18, PG. 362-363 "
681727,2015-02-23,"Minority Committee Report: Ought to Pass "
681727,2015-03-04,"Lay on Table (Rep Borden): Motion Adopted DV 218-121; House Journal  22, PG. 606-607 "
681745,2015-01-08,"Introduced and Referred to Commerce; Senate Journal 4  "
681745,2015-01-22,"Hearing:=== CANCELLED === 1/27/15, Room 100, State House, 1:20 p.m.; Senate Calendar 7 "
681745,2015-01-26,"Hearing:=== RESCHEDULED === 2/3/15, Room 100, State House, 1:20 p.m.; Senate Calendar 8 "
681745,2015-03-04,"Committee Report: Ought to Pass with Amendment #2015-0705s, 3/12/15; Senate Calendar 12 "
681745,2015-03-12,"Committee Amendment 0705s, Amendment Adopted, Voice Vote "
681745,2015-03-12,"Ought to Pass with Amendment 0705s, Motion Adopted, Voice Vote; Refer to Finance Rule 4-5; Senate Journal 8  "
681745,2015-03-18,"Committee Report: Ought to Pass, 3/26/15; Senate Calendar 14 "
681745,2015-03-26,"Ought to Pass: Motion Adopted, Voice Vote; OT3rdg; Senate Journal 10 "
681745,2015-03-31,"Introduced and Referred to Labor, Industrial and Rehabilitative Services (in recess of 3/25/2015); House Journal  28, PG. 1299 "
681745,2015-04-01,"Public Hearing: 4/7/2015 1:15 PM Legislative Office Building 307 "
681745,2015-04-29,"Subcommittee Work Session: 5/5/2015 11:15 Amendment Legislative Office Building 307 "
681745,2015-05-20,"Full Committee Work Session: 5/28/2015 9:00 Amendment Legislative Office Building 307 "
681745,2015-05-20,"Executive Session: 5/28/2015 10:00 Amendment Legislative Office Building 307 "
681745,2015-05-28,"Retained in Committee "
681745,2015-08-26,"Retained Bill - Full Committee Work Session: 9/17/2015 11:30 Amendment Legislative Office Building 303 "
681745,2015-09-10,"===CANCELLED=== Work Session: 9/17/2015 11:30 Amendment Legislative Office Building 303 "
681745,2015-09-10,"Retained Bill - Full Committee Work Session: 9/24/2015 11:30 Amendment Legislative Office Building 307 "
681745,2015-10-14,"Retained Bill - Full Committee Work Session: 10/22/2015 10:30 Amendment Legislative Office Building 307 "
681745,2015-10-14,"Executive Session: 10/29/2015 11:00 Amendment Legislative Office Building 307 "
681745,2015-11-12,"Committee Report: Ought to Pass with Amendment #2015-2543h for Jan 6 (Vote 14-0; Regular Calendar); House Calendar 67, PG. 24 "
681768,2015-01-08,"Introduced and Referred to Energy and Natural Resources; Senate Journal 4  "
681768,2015-01-29,"Hearing: 2/4/15, Room 100, State House, 10:00 a.m.; Senate Calendar 8 "
681768,2015-02-19,"Committee Report: Ought to Pass with Amendment #2015-0456s, 3/5/15; Senate Calendar 11 "
681768,2015-03-05,"Committee Amendment 0456s, Amendment Adopted, Voice Vote "
681768,2015-03-05,"Ought to Pass with Amendment 0456s, Motion Adopted, Voice Vote; OT3rdg; Senate Journal 7  "
681768,2015-03-11,"Introduced and Referred to Fish and Game and Marine Resources; House Journal  26, PG. 1274 "
681768,2015-03-18,"Public Hearing: 3/26/2015 10:00 Amendment Legislative Office Building 307 "
681768,2015-03-26,"Executive Session: 3/31/2015 11:00 Amendment Legislative Office Building 307 "
681768,2015-04-08,"Committee Report: Ought to Pass for Apr 15 (Vote 11-0; Consent Calendar); House Calendar 29, PG. 1303 "
681768,2015-04-15,"Ought to Pass: Motion Adopted Voice Vote; House Journal  34, PG. 1539 "
681768,2015-04-29,"Enrolled; House Journal  36, PG. 1597 "
681768,2015-04-29,"Enrolled (In recess 4/9/2015); Senate Journal 12 "
681768,2015-05-08,"Signed by the Governor on 05/07/2015; Chapter 0036; Effective 07/01/2015 "
681787,2015-01-08,"Introduced and Referred to Commerce; Senate Journal 4  "
681787,2015-02-20,"Hearing: 3/2/15, Room 100, State House, 2:20 p.m.; Senate Calendar 11 "
681787,2015-03-04,"Committee Report: Rereferred to Committee, 3/12/15; Senate Calendar 12 "
681787,2015-03-12,"Rereferred to Committee, Motion Adopted, Voice Vote, Senate Journal 8  "
681787,2015-11-25,"Committee Report: Referred to Interim Study; 1/6/16; Vote 5-0; Consent Calendar; Senate Calendar 49 "
681817,2015-01-08,"Introduced and Referred to Energy and Natural Resources; Senate Journal 4  "
681817,2015-01-15,"Hearing: 1/21/15, Room 100, State House, 9:30 a.m.; Senate Calendar 6 "
681817,2015-03-04,"Committee Report: Ought to Pass with Amendment #2015-0731s, 3/12/15; Senate Calendar 12 "
681817,2015-03-12,"Special Order SB 170 to 3/19/15, Without Objection, Motion Adopted "
681817,2015-03-12,"Committee Report: Ought to Pass with Amendment #2015-0731s, 3/19/15; Senate Calendar 12 "
681817,2015-03-19,"Special Order SB 170 to the end of the Calendar, Without Objection, Motion Adopted "
681817,2015-03-19,"Committee Amendment 0731s, Amendment Adopted, Voice Vote "
681817,2015-03-19,"Sen. Prescott Offered Floor Amendment #2015-1056s, New Title "
681817,2015-03-19,"Chair Ruled Floor Amendment Non-Germane "
681817,2015-03-19,"Without Objection Rule 3-17 is Suspended to Allow Non-Germane Amendment 1056s, New Title, 2/3 Necessary, Motion Adopted; Senate Journal 9  "
681817,2015-03-19,"Sen. Prescott Floor Amendment #2015-1056s, New Title, Amendment Adopted, Voice Vote "
681817,2015-03-19,"Ought to Pass with Amendments 0731s and 1056s, New Title, Motion Adopted, Voice Vote; OT3rdg; Senate Journal 9  "
681817,2015-03-24,"Introduced and Referred to Science, Technology and Energy (in recess of 3/12/2015); House Journal  26, PG. 1276 "
681817,2015-04-01,"Public Hearing: 4/9/2015 10:00 Amendment Legislative Office Building 304 "
681817,2015-04-01,"Executive Session: 4/9/2015 11:00 Amendment Legislative Office Building 304 "
681817,2015-04-21,"Committee Report: Ought to Pass with Amendment #2015-1286h for Apr 29 (Vote 13-2; Consent Calendar); House Calendar 32, PG. 1484 "
681817,2015-04-29,"Amendment #1286h: Amendment Adopted Voice Vote; House Journal  36, PG. 1579 "
681817,2015-04-29,"Ought to Pass with Amendment #1286h: Motion Adopted Voice Vote; House Journal  36, PG. 1579 "
681817,2015-06-04,"Sen. Bradley Moved Nonconcur with House Amendment #1286h; Requests C of C, Motion Adopted, Voice Vote; Senate Journal 17 "
681817,2015-06-04,"President Appoints: Senators Bradley, Prescott, and Feltes "
681817,2015-06-09,"House Accedes to Senate Request for Committee of Conference (Rep Gorman): Motion Adopted Voice Vote (in recess of 6/3/2015); House Journal  44, PG. 1953 "
681817,2015-06-09,"Speaker Appoints: Reps D. Thomas, Baber, Richardson, Devine (in recess of 6/3/2015); House Journal  44, PG. 1953 "
681817,2015-06-09,"Committee of Conference Meeting: 6/10/2015, 1:00 p.m., Room 101, Legislative Office Building "
681817,2015-06-15,"Conference Committee Report #2015-2125CofC Filed; House Amendment + New Amendment "
681817,2015-06-24,"Conference Committee Report 2125c: Adopted, Voice Vote; House Journal  54, PG. 2110-2111 "
681817,2015-06-24,"Conference Committee Report 2125c; Adopted, Voice Vote; Senate Journal 19 "
681817,2015-06-30,"Enrolled Bill Amendment #2342e: Amendment Adopted Voice Vote (In recess of 6/24/2015); House Journal  54, PG. 2140 "
681817,2015-07-01,"Enrolled Bill Amendment #2015-2342e Adopted, Voice Vote, (In recess of 6/24/2015); Senate Journal 19 "
681817,2015-07-09,"Enrolled (in recess of 6/24/2015); House Journal  54, PG. 2142 "
681817,2015-07-09,"Enrolled (In recess 6/24/2015); Senate Journal 19 "
681817,2015-07-21,"Signed by the Governor on 07/20/2015; Chapter 0268; Effective 07/20/2015 "
681834,2015-01-08,"Introduced and Referred to Ways and Means; Senate Journal 4  "
681834,2015-01-21,"Hearing:=== CANCELLED === 1/27/15, Room 103, State House, 9:30 a.m.; Senate Calendar 7 "
681834,2015-01-26,"Hearing:=== RESCHEDULED === 2/5/15, Room 103, State House, 9:30 a.m.; Senate Calendar 8 "
681834,2015-02-05,"Committee Report: Inexpedient to Legislate, 2/12/15; Senate Calendar 9 "
681834,2015-02-12,"Inexpedient to Legislate, Motion Adopted, Voice Vote === BILL KILLED ===; Senate Journal 5  "
681858,2015-01-08,"Introduced and Referred to Judiciary; Senate Journal 4  "
681858,2015-03-03,"Hearing: 3/10/15, Room 100, State House, 9:45 a.m.; Senate Calendar 12 "
681858,2015-03-11,"Committee Report: Rereferred to Committee, 3/19/15; Senate Calendar 13 "
681858,2015-03-19,"Rereferred to Committee, Motion Adopted, Voice Vote, Senate Journal 9  "
681877,2015-01-08,"Introduced and Referred to Health and Human Services; Senate Journal 4  "
681877,2015-01-22,"Hearing:=== CANCELLED === 1/27/15, Room 101, Legislative Office Building, 1:00 p.m.; Senate Calendar 7 "
681877,2015-01-26,"Hearing:=== RESCHEDULED === 2/5/15, Room 101, Legislative Office Building, 1:00 p.m.; Senate Calendar 8 "
681877,2015-03-18,"Committee Report: Ought to Pass with Amendment #2015-0989s, 3/26/15; Senate Calendar 14 "
681877,2015-03-26,"Committee Amendment 0989s, Amendment Adopted, Voice Vote "
681877,2015-03-26,"Ought to Pass with Amendment 0989s, Motion Adopted, Voice Vote; OT3rdg; Senate Journal 10 "
681877,2015-03-31,"Introduced and Referred to Health, Human Services and Elderly Affairs (in recess of 3/25/2015); House Journal  28, PG. 1298 "
681877,2015-04-02,"Public Hearing: 4/9/2015 10:30 Amendment Legislative Office Building 205==RECESSED== "
681877,2015-04-09,"Continued Public Hearing: 4/16/2015 10:00 Amendment Legislative Office Building 205 "
681877,2015-04-14,"Executive Session: 4/28/2015 10:00 Amendment Legislative Office Building 205 "
681877,2015-04-28,"Retained in Committee "
681877,2015-05-12,"Retained Bill - Full Committee Work Session: 5/19/2015 10:30 Amendment Legislative Office Building 205 "
681877,2015-08-13,"Retained Bill - Subcommittee Work Session: 9/8/2015 9:00 Amendment Legislative Office Building 205 "
681877,2015-09-29,"Retained Bill - Full Committee Work Session: 11/5/2015 10:00 Amendment Legislative Office Building 205 "
681877,2015-09-29,"Executive Session: 11/5/2015 1:00 PM Legislative Office Building 205 "
681877,2015-11-12,"Committee Report: Inexpedient to Legislate for Jan 6 (Vote 13-0; Consent Calendar); House Calendar 67, PG. 8 "
681896,2015-01-08,"Introduced and Referred to Transportation; Senate Journal 4  "
681896,2015-01-29,"Hearing: 2/10/15, Room 103, Legislative Office Building, 1:30 p.m.; Senate Calendar 8 "
681896,2015-02-18,"Committee Report: Ought to Pass with Amendment #2015-0480s, New Title, 3/5/15; Vote 5-0; Consent Calendar; Senate Calendar 11 "
681896,2015-03-05,"Committee Amendment 0480s, New Title, Amendment Adopted, Voice Vote "
681896,2015-03-05,"Ought to Pass with Amendment 0480s, New Title, Motion Adopted, Voice Vote; OT3rdg; Senate Journal 7  "
681896,2015-03-11,"Introduced and Referred to Transportation; House Journal  26, PG. 1274 "
681896,2015-03-26,"Public Hearing: 4/7/2015 1:00 PM Legislative Office Building 203 "
681896,2015-04-14,"Executive Session: 4/21/2015 1:00 PM Legislative Office Building 203 "
681896,2015-04-22,"Committee Report: Ought to Pass with Amendment #2015-1276h for Apr 29 (Vote 14-0; Consent Calendar); House Calendar 32, PG. 1484 "
681896,2015-04-29,"Amendment #1276h: Amendment Adopted Voice Vote; House Journal  36, PG. 1579 "
681896,2015-04-29,"Ought to Pass with Amendment #1276h: Motion Adopted Voice Vote; House Journal  36, PG. 1579 "
681896,2015-05-07,"Sen. Stiles Concurs with House Amendment #1276h, Motion Adopted, Voice Vote; Senate Journal 13 "
681896,2015-05-19,"Enrolled Bill Amendment #2015-1737EBA: Amendment Adopted Voice Vote (in recess of 5/6/2015) "
681896,2015-05-22,"Enrolled Bill Amendment #2015-1737e Adopted, Voice Vote, (In recess of 5/21/2015); Senate Journal 16 "
681896,2015-06-03,"Enrolled; House Journal  41, PG. 1781 "
681896,2015-06-03,"Enrolled (In recess 5/28/2015); Senate Journal 17 "
681896,2015-06-16,"Signed by the Governor on 06/12/2015; Chapter 0155; Effective 06/12/2015 "
681919,2015-01-08,"Introduced and Referred to Commerce; Senate Journal 4  "
681919,2015-03-04,"Hearing: 3/17/15, Room 100, State House, 1:40 p.m.; Senate Calendar 12 "
681919,2015-03-19,"Committee Report: Ought to Pass, 3/26/15; Senate Calendar 14 "
681919,2015-03-26,"Sen. Feltes Floor Amendment #2015-1158s, Regular Calendar 23Y-0N, Amendment Adopted; Senate Journal 10 "
681919,2015-03-26,"Sen. Bradley moved Rerefer to Committee, Regular Calendar 13Y-10N, Motion Adopted; Senate Journal 10 "
681919,2015-10-14,"Committee Report: Inexpedient to Legislate, 1/6/16; Senate Calendar 49 "
681941,2015-01-08,"Introduced and Referred to Children and Family Law; House Journal  12, PG. 219 "
681941,2015-01-21,"==POSTPONED==Public Hearing: 1/27/2015 1:15 PM Legislative Office Building 206 "
681941,2015-01-26,"==RESCHEDULED==Public Hearing: 1/28/2015 1:15 PM Legislative Office Building 206 "
681941,2015-02-04,"Executive Session: 2/4/2015 12:00 PM Legislative Office Building 206 "
681941,2015-02-05,"Majority Committee Report: Inexpedient to Legislate for Mar 11 (Vote 9-8; Regular Calendar); House Calendar19, PG. 412 "
681941,2015-02-05,"Minority Committee Report: Ought to Pass "
681941,2015-03-11,"Inexpedient to Legislate: Motion Failed Regular Calendar 154-217; House Journal  24, PG. 825-827 "
681941,2015-03-11,"Floor Amendment #2015-0234h (Rep Oligny): Amendment Adopted Regular Calendar 213-157; House Journal  24, PG. 827-830 "
681941,2015-03-11,"Ought to Pass with Amendment #0234h: Motion Adopted Regular Calendar 214-157; House Journal  24, PG. 830-832 "
681941,2015-03-19,"Introduced and Referred to Health and Human Services; Senate Journal 10 "
681941,2015-03-26,"Hearing: 3/31/15, Room 101, Legislative Office Building, 1:40 p.m.; Senate Calendar 15 "
681941,2015-05-13,"Committee Report: Rereferred to Committee, 5/21/15; Senate Calendar 22 "
681941,2015-05-21,"Rereferred to Committee, Motion Adopted, Voice Vote, Senate Journal 15 "
681962,2015-01-08,"Introduced and Referred to Executive Departments and Administration; Senate Journal 4  "
681962,2015-02-04,"Hearing: 2/11/15, Room 101, Legislative Office Building, 9:45 a.m.; Senate Calendar 9 "
681962,2015-02-19,"Committee Report: Ought to Pass with Amendment #2015-0454s, 3/3/15; Vote 5-0; Consent Calendar; Senate Calendar 11 "
681962,2015-03-05,"Committee Amendment 0454s, Amendment Adopted, Voice Vote "
681962,2015-03-05,"Ought to Pass with Amendment 0454s, Motion Adopted, Voice Vote; OT3rdg; Senate Journal 7  "
681962,2015-03-11,"Introduced and Referred to Resources, Recreation and Development; House Journal  26, PG. 1274 "
681962,2015-03-18,"Public Hearing: 3/24/2015 1:00 PM Legislative Office Building 305 "
681962,2015-03-19,"===CANCELLED=== Public Hearing: 3/24/2015 1:00 PM Legislative Office Building 305 "
681962,2015-03-25,"Public Hearing: 3/31/2015 1:00 PM Legislative Office Building 305 "
681962,2015-04-01,"Public Hearing: 4/7/2015 11:00 Amendment Legislative Office Building 305 "
681962,2015-04-09,"Executive Session: 4/7/2015 Legislative Office Building 305 "
681962,2015-04-09,"Committee Report: Ought to Pass for Apr 15 (Vote 19-0; Consent Calendar); House Calendar 29, PG. 1306 "
681962,2015-04-15,"Ought to Pass: Motion Adopted Voice Vote; House Journal  34, PG. 1549 "
681962,2015-04-29,"Enrolled; House Journal  36, PG. 1597 "
681962,2015-04-29,"Enrolled (In recess 4/9/2015); Senate Journal 12 "
681962,2015-05-08,"Signed by the Governor on 05/07/2015; Chapter 0032; Effective 07/06/2015 "
681985,2015-01-08,"Introduced and Referred to Executive Departments and Administration; Senate Journal 4  "
681985,2015-02-04,"Hearing: 2/11/15, Room 101, Legislative Office Building, 9:00 a.m.; Senate Calendar 9 "
681985,2015-02-18,"Committee Report: Ought to Pass with Amendment #2015-0549s, 3/5/15; Vote 5-0; Consent Calendar; Senate Calendar 11 "
681985,2015-03-05,"Committee Amendment 0549s, Amendment Adopted, Voice Vote "
681985,2015-03-05,"Ought to Pass with Amendment 0549s, Motion Adopted, Voice Vote; OT3rdg; Senate Journal 7  "
681985,2015-03-11,"Introduced and Referred to Commerce and Consumer Affairs "
681985,2015-03-25,"Vacated and Referred to Executive Departments and Administration; House Journal  28, PG. 1289 "
681985,2015-04-01,"Public Hearing: 4/7/2015 11:20 Amendment Legislative Office Building 306 "
681985,2015-04-08,"Executive Session: 4/28/2015 10:00 Amendment Legislative Office Building 306 "
681985,2015-04-30,"Committee Report: Ought to Pass with Amendment #2015-1474h for May 6 (Vote 11-0; Consent Calendar); House Calendar 33, PG. 1508 "
681985,2015-05-06,"Amendment #1474h: Amendment Adopted Voice Vote; House Journal  41, PG. 1750-1751 "
681985,2015-05-06,"Ought to Pass with Amendment #1474h: Motion Adopted Voice Vote; House Journal  41, PG. 1750-1751 "
681985,2015-05-21,"Sen. Carson Concurs with House Amendment #1474h, Motion Adopted, Voice Vote; Senate Journal 15 "
681985,2015-06-01,"Enrolled Bill Amendment #2015-1997EBA: Amendment Adopted Voice Vote (in recess of 5/6/2015); House Journal  41, PG. 1783 "
681985,2015-06-02,"Enrolled Bill Amendment #2015-1997e Adopted, Voice Vote, (In recess of 5/28/2015); Senate Journal 17 "
681985,2015-06-11,"Enrolled; House Journal  46, PG. 1989 "
681985,2015-06-11,"Enrolled (In recess 6/4/2015); Senate Journal 18 "
681985,2015-06-30,"Signed by the Governor on 06/26/2015; Chapter 0180 "
681985,2015-06-30,"I. Section 4 of this act shall take effect as provided in section 5 of this act. "
681985,2015-06-30,"II. Remainder Effective 07/01/15 "
682005,2015-01-08,"Introduced and Referred to Health and Human Services; Senate Journal 4  "
682005,2015-03-04,"Hearing: 3/10/15, Room 101, Legislative Office Building, 1:20 p.m.; Senate Calendar 12 "
682005,2015-03-18,"Committee Report: Ought to Pass, 3/26/15; Senate Calendar 14 "
682005,2015-03-26,"Sen. Fuller Clark Floor Amendment #2015-1137s, Regular Calendar 10Y-13N, Amendment Failed; Senate Journal 10 "
682005,2015-03-26,"Sen. Feltes Floor Amendment #2015-1148s, Regular Calendar 10Y-13N, Amendment Failed; Senate Journal 10 "
682005,2015-03-26,"Sen. Bradley Moved Reconsideration of vote on Floor Amendment 1148s, Motion Adopted, Voice Vote; Senate Journal 10 "
682005,2015-03-26,"Sen. Feltes Floor Amendment #2015-1148s, Regular Calendar 9Y-14N, Amendment Failed; Senate Journal 10 "
682005,2015-03-26,"Ought to Pass: Regular Calendar 19Y-4N, Motion Adopted; OT3rdg; Senate Journal 10 "
682005,2015-03-31,"Introduced and Referred to Health, Human Services and Elderly Affairs (in recess of 3/25/2015); House Journal  28, PG. 1299 "
682005,2015-04-02,"Public Hearing: 4/8/2015 11:00 Amendment Legislative Office Building 205 "
682005,2015-04-14,"Executive Session: 4/28/2015 10:00 Amendment Legislative Office Building 205==RECESSED== "
682005,2015-05-12,"Continued Executive Session: 5/19/2015 10:00 Amendment Legislative Office Building 205 "
682005,2015-05-20,"Committee Report: Ought to Pass with Amendment #2015-1724h (NT) for Jun 3 (Vote 17-0; Consent Calendar); House Calendar 39, PG. 1630 "
682005,2015-06-03,"Amendment #1724h: Amendment Adopted Voice Vote; House Journal  44, PG. 1829 "
682005,2015-06-03,"Ought to Pass with Amendment #1724h: Motion Adopted Voice Vote; House Journal  44, PG. 1829 "
682005,2015-06-04,"Sen. Sanborn Moved Nonconcur with House Amendment #1724h, New Title; Requests C of C, Motion Adopted, Voice Vote; Senate Journal 17 "
682005,2015-06-04,"President Appoints: Senators Sanborn, Avard, and Kelly "
682005,2015-06-09,"House Accedes to Senate Request for Committee of Conference (Rep Hinch): Motion Adopted Voice Vote (in recess of 6/3/2015); House Journal  44, PG. 1954 "
682005,2015-06-09,"Speaker Appoints: Reps McMahon, Kotowski, LeBrun, MacKay (in recess of 6/3/2015); House Journal  44, PG. 1954 "
682005,2015-06-10,"Committee of Conference Meeting: 6/17/2015, 11:00 a.m., Room 101, Legislative Office Building === RECESSED === "
682005,2015-06-17,"Committee of Conference Meeting: === RECONVENE === 6/17/2015, 3:30 p.m., Room 101, Legislative Office Building "
682005,2015-06-18,"Conferee Change: Rep Hinch Replaces Rep McMahon; House Journal  46, PG. 1992 "
682005,2015-06-18,"Rep Kotowski becomes first named House member; House Journal  46, PG. 1992 "
682005,2015-06-18,"Conferee Change: Rep Fields Replaces Rep MacKay; House Journal  46, PG. 1992 "
682005,2015-06-18,"Conferee Change; Senator Bradley Replaces Senator Kelly "
682005,2015-06-18,"Conference Committee Report #2015-2310c Filed; As Passed by the Senate "
682005,2015-06-24,"Conference Committee Report 2310c: Adopted, Regular Calendar 213-143; House Journal  54, PG. 2108-2110 "
682005,2015-06-24,"Conference Committee Report 2310c; Adopted, Voice Vote; Senate Journal 19 "
682005,2015-07-02,"Enrolled (In recess of 6/24/2015); House Journal  54, PG. 2141 "
682005,2015-07-02,"Enrolled (In recess 6/24/2015); Senate Journal 19 "
682005,2015-07-13,"Vetoed by Governor 07/10/2015 "
682005,2015-09-16,"Notwithstanding the Governor’s Veto, Shall SB 169 Become Law: Regular Calendar 14Y-10N, Veto Sustained, lacking the necessary two-thirds vote; Senate Journal 20 "
682028,2015-01-08,"Introduced and Referred to Transportation; Senate Journal 4  "
682028,2015-01-29,"Hearing: 2/3/15, Room 103, Legislative Office Building, 1:45 p.m.; Senate Calendar 8 "
682028,2015-02-05,"Committee Report: Ought to Pass with Amendment #2015-0177s, New Title, 2/12/15; Vote 5-0; Consent Calendar; Senate Calendar 9 "
682028,2015-02-12,"Committee Amendment 0177s, New Title, Amendment Adopted, Voice Vote "
682028,2015-02-12,"Ought to Pass with Amendment 0177s, New Title, Motion Adopted, Voice Vote; OT3rdg; Senate Journal 5  "
682028,2015-03-04,"Introduced and Referred to Resources, Recreation and Development; House Journal  22, PG. 629 "
682028,2015-03-11,"Public Hearing: 3/18/2015 11:00 Amendment Legislative Office Building 305 "
682028,2015-04-09,"Executive Session: 4/7/2015 Legislative Office Building 305 "
682028,2015-04-09,"Committee Report: Ought to Pass for Apr 15 (Vote 17-0; Consent Calendar); House Calendar 29, PG. 1307 "
682028,2015-04-15,"Ought to Pass: Motion Adopted Voice Vote; House Journal  34, PG. 1549 "
682028,2015-04-29,"Enrolled; House Journal  36, PG. 1597 "
682028,2015-04-29,"Enrolled (In recess 4/9/2015); Senate Journal 12 "
682028,2015-05-08,"Signed by the Governor on 05/07/2015; Chapter 0034; Effective 05/07/2015 "
682043,2015-01-08,"Introduced and Referred to Executive Departments and Administration; Senate Journal 4  "
682043,2015-02-04,"Hearing: 2/11/15, Room 101, Legislative Office Building, 9:15 a.m.; Senate Calendar 9 "
682043,2015-03-04,"Committee Report: Rereferred to Committee, 3/12/15; Senate Calendar 12 "
682043,2015-03-12,"Rereferred to Committee, Motion Failed, Voice Vote, Senate Journal 8  "
682043,2015-03-12,"Sen. Carson moved Ought to Pass; Senate Journal 8  "
682043,2015-03-12,"Sen. Watters Floor Amendment #2015-0797s, Amendment Adopted, Voice Vote; Senate Journal 8  "
682043,2015-03-12,"Ought to Pass with Amendment 0797s, Motion Adopted, Voice Vote; OT3rdg; Senate Journal 8  "
682043,2015-03-12,"Introduced and Referred to Executive Departments and Administration; House Journal  26, PG. 1275 "
682043,2015-03-18,"Public Hearing: 3/24/2015 1:00 PM Legislative Office Building 306 "
682043,2015-03-25,"Executive Session: 3/31/2015 1:00 PM Legislative Office Building 306 "
682043,2015-04-09,"Committee Report: Ought to Pass with Amendment #2015-1179h for Apr 15 (Vote 12-2; Consent Calendar); House Calendar 29, PG. 1303 "
682043,2015-04-15,"Amendment #1179h: Amendment Adopted Voice Vote; House Journal  34, PG. 1538 "
682043,2015-04-15,"Ought to Pass with Amendment #1179h: Motion Adopted Voice Vote; House Journal  34, PG. 1538 "
682043,2015-05-07,"Sen. Carson Concurs with House Amendment #1179h, Motion Adopted, Voice Vote; Senate Journal 12 "
682043,2015-05-13,"Enrolled Bill Amendment #2015-1730-EBA: Amendment Adopted Voice Vote (in recess of 5/6/2015); House Journal  41, PG. 1779 "
682043,2015-05-14,"Enrolled Bill Amendment #2015-1730e Adopted, Voice Vote, (In recess of 5/14/2015); Senate Journal 15 "
682043,2015-05-21,"Enrolled (in recess of 5/6/2015); House Journal  41, PG. 1782 "
682043,2015-05-21,"Enrolled (In recess 5/21/2015); Senate Journal 16 "
682043,2015-06-11,"Signed by the Governor on 06/08/2015; Chapter 0117; Effective 08/07/2015 "
682066,2015-01-08,"Introduced and Referred to Energy and Natural Resources; Senate Journal 4  "
682066,2015-01-29,"Hearing: 2/4/15, Room 100, State House, 9:30 a.m.; Senate Calendar 8 "
682066,2015-02-04,"Committee Report: Ought to Pass, 2/12/15; Vote 5-0; Consent Calendar; Senate Calendar 9 "
682066,2015-02-12,"Ought to Pass: Motion Adopted, Voice Vote; Refer to Finance Rule 4-5; Senate Journal 5  "
682066,2015-03-04,"Committee Report: Ought to Pass, 3/12/15; Senate Calendar 12 "
682066,2015-03-12,"Ought to Pass: Regular Calendar 13Y-11N, Motion Adopted; OT3rdg; Senate Journal 8  "
682066,2015-03-12,"Introduced and Referred to Fish and Game and Marine Resources; House Journal  26, PG. 1275 "
682066,2015-03-18,"Public Hearing: 3/26/2015 10:30 Amendment Legislative Office Building 307 "
682066,2015-03-26,"Executive Session: 3/31/2015 11:00 Amendment Legislative Office Building 307 "
682066,2015-04-08,"Majority Committee Report: Ought to Pass for Apr 15 (Vote 9-2; Regular Calendar); House Calendar 29, PG. 1309 "
682066,2015-04-08,"Minority Committee Report: Inexpedient to Legislate "
682066,2015-04-15,"Floor Amendment #1318h (Reps C. McGuire, Spillane): Amendment Adopted DV 183-162; House Journal  34, PG. 1556 "
682066,2015-04-15,"Lay on Table (Rep Kidder): Motion Adopted Regular Calendar 188-158; House Journal  34, PG. 1556-1558 "
682087,2015-01-08,"Introduced and Referred to Rules, Enrolled Bills and Internal Affairs; Senate Journal 4  "
682087,2015-01-22,"Hearing: 1/29/15, Room 100, State House, 1:00 p.m.; Senate Calendar 7 "
682087,2015-03-19,"Committee Report: Ought to Pass with Amendment #2015-1038s, New Title, 3/26/15; Senate Calendar 14 "
682087,2015-03-26,"Committee Amendment 1038s, New Title, Amendment Adopted, Voice Vote "
682087,2015-03-26,"Sen. Fuller Clark Floor Amendment #2015-1138s, New Title, Amendment Adopted, Voice Vote; Senate Journal 10 "
682087,2015-03-26,"Ought to Pass with Amendment 1038s New Title, and 1138s New Title, Motion Adopted, Voice Vote; OT3rdg; Senate Journal 10 "
682087,2015-03-31,"Introduced and Referred to Legislative Administration (in recess of 3/25/2015); House Journal  28, PG. 1299 "
682087,2015-04-01,"Public Hearing: 4/7/2015 10:15 Amendment Legislative Office Building 104 "
682087,2015-05-06,"Executive Session: 5/6/2015 12:30 PM Legislative Office Building 104 "
682087,2015-05-06,"Retained in Committee "
682087,2015-10-07,"Retained Bill - Full Committee Work Session: 10/13/2015 10:00 Amendment Legislative Office Building 104 "
682087,2015-10-07,"Executive Session: 10/13/2015 10:30 Amendment Legislative Office Building 104 "
682087,2015-11-12,"Majority Committee Report: Refer to Interim Study for Jan 6 (Vote 7-3; Regular Calendar); House Calendar 67, PG. 25 "
682087,2015-11-17,"Minority Committee Report: Ought to Pass "
682110,2015-01-08,"Introduced and Referred to Commerce; Senate Journal 4  "
682110,2015-03-04,"Hearing: 3/17/15, Room 100, State House, 1:20 p.m.; Senate Calendar 12 "
682110,2015-03-19,"Committee Report: Ought to Pass, 3/26/15; Senate Calendar 14 "
682110,2015-03-26,"Ought to Pass: Motion Adopted, Voice Vote; OT3rdg; Senate Journal 10 "
682110,2015-03-31,"Introduced and Referred to Commerce and Consumer Affairs (in recess of 3/25/2015); House Journal  28, PG. 1299 "
682110,2015-04-01,"Public Hearing: 4/7/2015 10:45 Amendment Legislative Office Building 302 "
682110,2015-04-07,"Subcommittee Work Session: 4/14/2015 10:00 Amendment Legislative Office Building 302 "
682110,2015-04-15,"Subcommittee Work Session: 5/5/2015 10:00 Amendment Legislative Office Building 302 "
682110,2015-05-06,"Executive Session: 5/12/2015 1:15 PM Legislative Office Building 302 "
682110,2015-05-20,"Committee Report: Ought to Pass for Jun 3 (Vote 19-0; Consent Calendar); House Calendar 39, PG. 1629 "
682110,2015-06-03,"Ought to Pass: Motion Adopted Voice Vote; House Journal  44, PG. 1826 "
682110,2015-06-24,"Enrolled; House Journal  54, PG. 2102 "
682110,2015-06-24,"Enrolled (In recess 6/24/2015); Senate Journal 19 "
682110,2015-07-07,"Signed by the Governor on 07/06/2015; Chapter 0215; Effective 09/04/2015 "
682132,2015-01-08,"Introduced and Referred to Transportation; Senate Journal 4  "
682132,2015-01-29,"Hearing: 2/3/15, Room 103, Legislative Office Building, 1:30 p.m.; Senate Calendar 8 "
682132,2015-02-05,"Committee Report: Ought to Pass with Amendment #2015-0175s, 2/12/15; Vote 5-0; Consent Calendar; Senate Calendar 9 "
682132,2015-02-12,"Committee Amendment 0175s, Amendment Adopted, Voice Vote "
682132,2015-02-12,"Ought to Pass with Amendment 0175s, Motion Adopted, Voice Vote; OT3rdg; Senate Journal 5  "
682132,2015-03-11,"Introduced and Referred to Resources, Recreation and Development; House Journal  26, PG. 1274 "
682132,2015-03-25,"Public Hearing: 3/31/2015 1:30 PM Legislative Office Building 305 "
682132,2015-04-09,"Executive Session: 4/7/2015 Legislative Office Building 305 "
682132,2015-04-09,"Committee Report: Ought to Pass for Apr 15 (Vote 17-2; Consent Calendar); House Calendar 29, PG. 1307 "
682132,2015-04-15,"Ought to Pass: Motion Adopted Voice Vote; House Journal  34, PG. 1549 "
682132,2015-04-29,"Enrolled; House Journal  36, PG. 1597 "
682132,2015-04-29,"Enrolled (In recess 4/9/2015); Senate Journal 12 "
682132,2015-05-08,"Signed by the Governor on 05/07/15; Chapter 0033 "
682132,2015-05-08,"I. Section 5 Effective 01/01/16 at 12:01 a.m. "
682132,2015-05-08,"II. Remainder Effective 05/07/15 "
682151,2015-01-08,"Introduced and Referred to Judiciary; Senate Journal 4  "
682151,2015-03-03,"Hearing: 3/10/15, Room 100, State House, 9:30 a.m.; Senate Calendar 12 "
682151,2015-03-18,"Committee Report: Ought to Pass with Amendment #2015-0994s, 3/26/15; Vote 5-0; Consent Calendar; Senate Calendar 14 "
682151,2015-03-26,"Committee Amendment 0994s, Amendment Adopted, Voice Vote "
682151,2015-03-26,"Ought to Pass with Amendment 0994s, Motion Adopted, Voice Vote; OT3rdg; Senate Journal 10 "
682151,2015-03-31,"Introduced and Referred to Judiciary (in recess of 3/25/2015); House Journal  28, PG. 1299 "
682151,2015-04-01,"Public Hearing: 4/7/2015 1:00 PM Legislative Office Building 208 "
682151,2015-04-15,"Executive Session: 4/21/2015 10:00 Amendment Legislative Office Building 208 "
682151,2015-04-22,"Committee Report: Inexpedient to Legislate for Apr 29 (Vote 17-0; Consent Calendar); House Calendar 32, PG. 1483 "
682151,2015-04-29,"Inexpedient to Legislate: Motion Adopted Voice Vote; House Journal  36, PG. 1578 "
682170,2015-01-08,"Introduced and Referred to Judiciary; House Journal  12, PG. 218 "
682170,2015-01-21,"Public Hearing: 1/29/2015 1:00 PM Legislative Office Building 207 "
682170,2015-02-04,"Executive Session: 2/4/2015 1:30 PM Legislative Office Building 208 "
682170,2015-02-05,"Committee Report: Inexpedient to Legislate for Feb 11 (Vote 13-2; Consent Calendar); House Calendar11, PG. 174 "
682170,2015-02-11,"Removed from Consent Calendar (Rep Hoell); House Journal  16, PG. 298 "
682170,2015-02-11,"Inexpedient to Legislate: Motion Adopted Regular Calendar 242-101; House Journal  16, PG. 324-326 "
682195,2015-01-08,"Introduced and Referred to Transportation; Senate Journal 4  "
682195,2015-01-29,"Hearing: 2/3/15, Room 103, Legislative Office Building, 1:00 p.m.; Senate Calendar 8 "
682195,2015-02-03,"Committee Report: Ought to Pass, 2/12/15; Senate Calendar 9 "
682195,2015-02-12,"Ought to Pass: Motion Adopted, Voice Vote; Refer to Finance Rule 4-5; Senate Journal 5  "
682195,2015-03-04,"Committee Report: Ought to Pass, 3/12/15; Senate Calendar 12 "
682195,2015-03-12,"Ought to Pass: Motion Adopted, Voice Vote; OT3rdg; Senate Journal 8  "
682195,2015-03-12,"Introduced and Referred to Transportation; House Journal  26, PG. 1275 "
682195,2015-03-26,"Public Hearing: 4/7/2015 10:00 Amendment Legislative Office Building 203 "
682195,2015-04-14,"Executive Session: 4/21/2015 1:00 PM Legislative Office Building 203 "
