bill_number,bill_id,title
SB667,793610,"Teachers; modifying Teacher and Leader Effectiveness Evaluation System criteria. Effective date."
SB668,795435,"Retirement boards; Oklahoma State Pension Commission; adding certain person; OPERS Board; adding certain person. Effective date. Emergency"
SB669,794548,"Declaration of marriage; establishing procedures for recording and filing of certain declaration. Effective date."
SB670,793470,"District court judgment dockets; prohibiting fee for certain certification and entry. Effective date."
SB671,795188,"Violent sex offenders; authorizing certain chemical treatment for certain offenders. Effective date."
SB672,793823,"Telecommunications; assessment of a universal service fee; modifying Telecommunications Act of 1997; Universal Service Fund."
SB673,795319,"County sheriffs; modifying certain peace officer requirements. Effective date."
SB674,795576,"Schools; creating the 24/7 Tobacco-free Schools Act. Effective date. Emergency."
SB675,794183,"Schools; allowing certain statement on an individualized education program regarding assessments. Effective date."
SB676,795567,"Oklahoma Clean Air Act; requiring additional procedures necessary to obtain state authority governing certain federal clean air standards."
SB677,793652,"Teachers; delaying implementation of certain Teacher and Leader Effectiveness Evaluation System components. Effective date."
SB678,794670,"Certified registered nurse anesthetists; modifying definitions; broadening certain authority. Effective date."
SB679,793450,"Students; directing the State Board of Education to establish a process to track certain expenditures. Effective date."
SB680,794437,"Teachers; creating the Oklahoma Teacher Loan Repayment Program Act; establishing eligibility criteria. Effective date."
SB681,794102,"Teachers; establishing minimum salary schedule for teachers. Effective date."
SB682,794427,"Schools; modifying requirements for school district discipline policies. Effective date."
SB683,794465,"Driver licenses; modifying constraints on implementation of certain licensing provisions; repealing."
SB684,793368,"Prisons; capacity; notification procedure; transmission of certain notice. Effective date."
SB685,793875,"State task force on Women; redirecting the task force to include certain areas of focus. Effective date."
SB686,793870,"Sentencing; Creating the Oklahoma Sentencing Policy, Accountability and Review Council. Effective date."
SB687,794001,"Professions and occupations; creating the Massage Therapy Practice Act; licenses; creating the Advisory Board on Massage Therapy. Effective date."
SB688,794597,"Low-point beer; manufacturer; termination agreements; unreasonable withholding of consent to transfer. Effective date."
SB689,794517,"Motor vehicles; modifying apportionment to certain funds. Effective date."
SB690,793843,"Intoxicating liquors; brewer; distribution agreements; terms, definitions, successor business. Effective date. Emergency."
SB691,794180,"Intoxicating liquors; low-point beer; agreements; disputes. Effective date."
SB692,794530,"Penal institutions; amending requirements of the Director. Effective date."
SB693,794729,"Anti-Drug Diversion Act; permitting access to certain information by certain persons. Effective date."
SB694,795305,"Department of Human Services; requiring certain appropriated funds to be used for Pinnacle Plan. Effective date. Emergency."
SB695,795367,"Cities and towns; authorizing collection of unpaid solid waste accounts. Effective date."
SB696,794086,"Home Food Manufacturing Act; expanding the types of home produced foods that can be sold commercially."
SB697,793840,"Home visiting programs; directing certain Departments to provide certain services. Effective date."
SB698,794591,"Autopsy reports; requiring redaction of certain information prior to release of autopsy report. Effective date."
SB699,794428,"Anti-Drug Diversion Act; permitting access to certain information by certain persons. Effective date."
SB700,793469,"Licensed alcohol and drug counselors; broadening certain exemption. Effective date."
SB701,794467,"Mental health; removing certain specialization criteria for certain persons. Effective date."
SB702,795575,"Mental health; removing references to certain facilities. Effective date."
SB703,794861,"Children and youth; transferring certain authorities to the Oklahoma Commission on Children and Youth. Effective date."
SB704,794095,"Oklahoma Health Care Authority; permitting Authority to file liens for certain purposes. Effective date."
SB705,794190,"Oklahoma Commission on Children and Youth; authorizing requests for certain transfers. Effective date."
SB706,793483,"Teachers; relating to evaluation policies; implementation of the Teacher and Leader Effectiveness Evaluation System. Effective date. Emergency."
SB707,795497,"Schools; directing the State Board of Education to adopt requirements for high school graduation."
SB708,795328,"Student testing; removing requirement for testing certain subjects and grades. Effective date. Emergency."
SB709,795249,"Teacher recruitment; creating the Oklahoma Teacher Recruitment Act; establishing eligibility. Effective date."
SB710,793739,"Employee information; allowing a public school to disclose certain employee information. Effective date. Emergency."
SB711,795340,"Teachers; directing certain teacher employment decisions to be forwarded to the State Board of Education. Effective date. Emergency."
SB712,793571,"Physician licensure; permitting issuance of certain license under certain circumstances. Effective date."
SB713,794687,"Department of Mental Health and Substance Abuse Services; directing development of certain facilities. Effective date. Emergency."
SB714,793877,"Stroke prevention; broadening scope of issues to be addressed by certain statewide system. Effective date."
SB715,794121,"Determinations of competency; authorizing examinations; directing courts to issue certain order relating to custody and competency restoration services. Emergency."
SB716,793317,"Health care services; providing exemption to certain entities; providing definitions. Effective date."
SB717,794920,"Oklahoma Health Care Authority; authorizing certain actions under certain circumstances. Effective date."
SB718,794265,"Firearms; modifying where firearms may be carried. Effective date."
SB719,795036,"Substate planning districts; leadership and support of rural fire coordinators. Effective date."
SB720,794421,"Intoxicating liquors; definitions; prohibiting powdered alcohol; setting penalties. Effective date."
SB721,793411,"Trafficking in children; adding definition. Effective date."
SB722,795203,"Crimes and punishments; repealing sections. Effective date."
SB723,793412,"Oklahoma Religious Freedom Act; authorizing certain actions and relief. Effective date."
SB724,795279,"Covenant marriage; establishing procedures for certain marriage. Effective date."
SB725,794414,"Wills and succession; expanding offenses. Effective date."
SB726,795558,"Domestic violence; authorizing creation of certain pilot programs. Effective date."
SB727,794599,"Oklahoma Nursing Practice Act; permitting nurse practitioners to dispense certain drugs. Effective date."
SB728,793304,"Attorney General; adding certain duty. Effective date."
SB729,793511,"Corporations; creating the Oklahoma Religious-Based Entity Act. Effective date."
SB730,794614,"Special judges; removing certain authority. Effective date."
SB731,795573,"Judicial term limits; limiting certain terms. Effective date."
SB732,793926,"Special judges; modifying election and vacancy procedures. Effective date."
SB733,795202,"Infectious diseases; requiring submission of certain documents prior to issuance of marriage license. Effective date."
SB734,795098,"Administrative Procedures Act; removing exception for the Oklahoma Health Care Authority Board and Administrator. Effective date."
SB735,795512,"Authority to carry firearms; authorizing certain persons to able to use identification for certain purpose. Effective date."
SB736,794352,"Restricted bullets; providing certain exception for certain bullets used for certain purposes. Effective date."
SB737,795569,"Opioids; requiring use of certain drug products in certain circumstances. Effective date."
SB738,795396,"Income tax; modifying apportionment of income tax revenue under specified circumstances."
SB739,794871,"Ad valorem tax; modifying requirements for certain applicants for an exemption. Effective date."
SB740,795147,"Income tax; creating ""Oklahoma Stay-At-Home Parent Tax Relief Act""; providing refundable credit for certain purpose. Effective date."
SB741,794781,"Ad valorem tax; modifying procedures related to disbursement of ad valorem revenue and monies from Ad Valorem Reimbursement Fund."
SB742,794450,"Public finance; modifying dates and procedures relating to state budget. Effective date. Emergency."
SB743,793792,"Motor vehicles; requiring notification to railroad companies for certain oversize permit routes. Effective Date."
SB744,794895,"Oil and gas; authorizing Corporation Commission to establish program to land apply oil and gas drilling wastes. Effective date."
SB745,794277,"Transfer-on-death deeds; clarifying application of certain recording requirement. Emergency."
SB746,795294,"Motor vehicle passengers; modifying conditions and exclusions. Effective date."
SB747,795327,"Motor vehicles; making it unlawful to smoke in a vehicle with a minor."
SB748,793582,"Wireless communication while driving; prohibiting the use under certain circumstances; providing penalties and exceptions. Effective date."
SB749,794655,"Child passenger restraint system; modifying requirements; increasing penalties. Effective date."
SB750,794443,"Oklahoma Medicaid Program; providing standards for certain payments. Effective date."
SB751,795355,"Mental health; relating to transportation of persons for mental health services; providing certain construction. Effective date."
SB752,793794,"Oklahoma Health Care Authority; directing Authority to initiate certain procedures. Effective date."
SB753,794710,"Physician Assistant Act; amending definitions; modifying composition of Physician Assistant Committee. Effective date."
SB754,793690,"Commitment to Care for People with Complex Physical Disabilities Act; requiring certain considerations. Effective date."
SB755,794364,"State Department of Health; requiring submission of certain report. Effective date."
SB756,795442,"Behavior analysts; broadening certain definitions. Effective date."
SB757,794588,"Public health; requiring State Department of Health to examine certain issues in certain report; directing promulgation of rules. Effective date."
SB758,794928,"Telemedicine; requiring certain reimbursement rate for services in certain areas. Effective date."
SB759,794592,"Department of Mental Health and Substance Abuse Services; requiring certain documents be subject to certain Acts. Effective date."
SB760,795295,"Oklahoma Water Use Working Group; creating working group; stating purpose. Emergency."
SB761,793933,"Hospitals; requiring hospitals to provide certain care as condition of tax status. Effective date."
SB762,795126,"Department of Human Services; providing certain limitation on issuance of credit reports. Effective date."
SB763,793782,"Independent Living Act; requiring Department of Human Services to provide certain information. Effective date."
SB764,793332,"Oklahoma Community Sentencing Act; authorizing certain employment and contracting. Effective date."
SB765,795102,"Statutes of limitation; establishing statutes of limitation for certain actions. Effective date."
SB766,793749,"Judicial conduct; stating duties and obligations. Effective date."
SB767,793637,"Administrative Workers' Compensation Act; modifying provisions. Effective date."
SB768,793890,"Uniform state laws; repealing provisions. Effective date."
SB769,794114,"Oklahoma Employee Injury Benefit Act; modifying provisions. Effective date."
SB770,793568,"Open Meeting Act; modifying certain definition. Effective date."
SB771,794789,"Workers' Compensation Arbitration Act; modifying requirements for validity of certain agreements. Effective date."
SB772,794406,"Judicial Districts; modifying composition of judges in certain districts. Effective date."
SB773,793946,"Workers' compensation administrative hearings; modifying certain recording and reporting requirements. Effective date."
SB774,795452,"Trust property; clarifying that certain power not suspended under certain circumstances. Effective date."
SB775,795303,"Elections; modifying period of ineligibility for filing for office after conviction. Effective date."
SB776,794174,"Wildlife; modifying provisions relating to keeping or exhibiting native cats or bears. Effective date."
SB777,794767,"Elections; modifying procedures relating to absentee voting applications. Effective date."
SB778,794754,"Elections; providing for system of electronic voter registration. Effective date."
SB779,793394,"Lobbying; prohibiting certain former members of Legislature from registering as lobbyist or liaison for certain period. Effective date."
SB780,793515,"Elections; requiring preparation of voter information pamphlet. Effective date."
SB781,794156,"State Dental Act; modifying definitions; amending provisions relating to licensure of dentists. Effective date. Emergency."
SB782,793364,"Charter schools; modifying criteria for sponsors; directing sponsors to establish certain policies."
SB783,794841,"Charter schools; providing for calculation of state aid for certain purpose."
SB784,794676,"Schools; directing the State Board of Education to consider certain system of assessments. Emergency."
SB785,794197,"Schools; providing for development of remediation plan for students with certain scores on reading test."
SB786,795035,"School funding; providing for calculation of certain State Aid portions."
SB787,793963,"Oklahoma Pharmacy Act; modifying definitions; clarifying language. Effective date."
SB788,793563,"Marriage; establishing exception to certain requirements. Effective date."
SB789,795216,"Civil procedure; admissibility of medical bills; clarifying admissibility of certain amounts. Effective date."
SB790,793948,"Fees; Sheriff's Jail Fund; modifying certain remittance requirements. Effective date."
SB791,793345,"Liability insurance policies; modifying applicability of certain provisions. Effective date."
SB792,794090,"Medical liability actions; prohibiting admissibility of certain action. Effective date."
SB793,794391,"Justices and judges; establishing mandatory retirement age for certain judicial officers. Effective date."
SB794,794260,"Capital punishment; adding method of execution. Effective date."
SB795,794657,"Judicial Nominating Commission; modifying certain appointing authority and requirements. Effective date."
SB796,793424,"Liens on personal property; permitting same-day, separate mailing of notices if denial; fees. Emergency."
SB797,793473,"Grand River Dam Authority; authorizing the district to sell certain property. Effective date."
SB798,793389,"Firearm rights; authorizing certain persons to petition governor for restoration of certain rights. Effective date."
SB799,794996,"Uniform State Code of Military Justice; modifying provisions related to jurisdiction, offenses and punishments. Effective date."
SB800,794640,"Extension of protective orders; permitting electronic filing of certain motions under certain circumstances. Effective date."
SB801,794742,"Adult guardianship; requiring immediate filing of certain petition under certain circumstances. Effective date."
SB802,794948,"Court filings; authorizing appointment of discovery master; requiring acceptance of filings by certain method. Effective date."
SB803,793937,"Homeowner's Insurance; prohibiting cancellation for certain claims. Effective date."
SB804,793386,"Vision plans; modifying provisions relating to plans to state employees and retirees."
SB805,795341,"Marriage; creating the Preservation of Sovereignty and Marriage Act; marriage licensing."
SB806,794305,"Economic incentives; requiring certain provisions to include specified element. Effective date."
SB807,794382,"Oil and gas; modifying the 2011 Shale Reservoir Development Act; modifying well spacing."
SB808,793729,"Wind energy facilities; requiring evidence of financial security prior to construction of new facilities."
SB809,793806,"Oil and gas; authorizing regulation by municipalities, counties and other political subdivisions; prohibiting certain regulations."
SB810,795346,"Covenant marriage; establishing procedures for certain marriage. Effective date."
SB811,794167,"Marriage requirements; creating exception to certain licensing requirement. Effective date."
SB812,795191,"Tax administration; modifying requirements related to extension of filing and remittance deadlines. Effective date."
SB813,793495,"Ad valorem exemption; requiring certain applicants for exemption to provide specified information. Effective date."
SB814,795530,"Tax incentives; requiring certain report by Oklahoma Tax Commission related to incentives for specified entities. Effective date."
SB815,795507,"Economic incentives; modifying duties and makeup of certain entity; requiring certain evaluation process and specifying procedures. Effective date."
SB816,794078,"Architects; code use groups; Uniform Building Code. Effective date."
SB817,795519,"Consumer credit code; authorizing municipalities to charge credit card convenience fees. Emergency."
SB818,794946,"Insurance; modifying various provisions relating to the Oklahoma Captive Insurance Company Act. Effective date."
SB819,794721,"Construction Industries Board; providing for poultry house contractor licenses. Effective date. Emergency."
SB820,793297,"Office of the Attorney General; reappropriating certain funds for certain purpose. Emergency."
SB821,794543,"Electronic communication devices; relating to texting while driving; making certain acts unlawful; providing penalty and exceptions. Effective date."
SB822,795516,"Water Resources Board; authorizing the board to employ seasonal employees. Emergency"
SB823,793530,"Service warranties; modifying service contract information; defining unfair or deceptive acts or practices. Effective date."
SB824,794677,"Gross production taxes; modifying procedures for collection and distribution of tax revenue; repealing certain requirement. Effective date."
SB825,793758,"Oklahoma Vehicle License and Registration Act; modifying apportionment of certain motor vehicle taxes and fees."
SB826,795536,"Motor Vehicles; adding certain highway to certain speed limitation. Effective Date."
SB827,795217,"Highway right-of-way; modifying definition of public utility. Effective Date."
SB828,793341,"9-1-1 emergency services; creating the Oklahoma 9-1-1 Management Authority Act; codification. Effective date."
SB829,794704,"Appointment of certain employees; providing for appointment by the Governor; requiring Senate confirmation; Effective date."
SB830,795277,"Schools; removing certain exemption. Effective date."
SB831,795108,"Multiple versions of statutes; amending, merging, consolidation, and repealing multiple versions. Emergency."
SB832,794813,"Water Resources Board; authorizing the board to employ seasonal employees. Emergency."
SB833,794565,"Payroll deductions; removing authorization for Oklahoma Today magazine deduction. Effective date."
SB834,795389,"Payroll deductions; removing authorization for deductions to certain financial institutions. Effective date."
SB835,794932,"Seasonal employees; stating certain seasonal employees are temporary and unclassified. Emergency"
SB836,795500,"Executive appointments; requiring certain executive nominees be registered voters for certain time period. Effective date."
SB837,793587,"Corporation Commission; setting budget limits."
SB838,794635,"Asset forfeiture; creating the Personal Asset Protection Act; modifying procedures for forfeiture of certain property. Effective date."
SB839,793299,"Public finance; creating Oklahoma Museum of Popular Culture under Oklahoma Historical Society. Effective date."
SB840,794665,"State Department of Education; providing budgetary limitations; lapse dates. Effective date."
SB841,794762,"Oklahoma Department of Transportation; providing budget limits."
SB842,795052,"State Department of Rehabilitation; providing budgetary limitations; lapse dates. Effective date. Emergency."
SB843,794326,"Department of Human Services; providing budgetary limitations; lapse dates."
SB844,795541,"State Department of Health; providing budgetary limitations; lapse dates. Effective date."
SB845,794374,"Oklahoma Health Care Authority; providing budgetary limitations; lapse dates. Effective date. Emergency."
SB846,795261,"General Appropriations; making appropriations; stating purpose. Effective dates. Emergency."
SB847,793404,"General Appropriations; making appropriations; stating purpose. Effective dates. Emergency."
SB848,794891,"Oklahoma Board of Dentistry; providing for classification and unclassification of certain positions."
SB849,795408,"State Election Board; providing for classification and unclassification of certain positions."
SB850,794922,"State Department of Health; providing for classification and unclassification of certain positions. Effective date. Emergency."
SB851,794985,"Office of Juvenile Affairs; providing for classification and unclassification of certain positions. Effective date. Emergency."
SB852,793710,"Department of Transportation; providing for classification and unclassification of certain positions. Effective date. Emergency."
SB853,793883,"Department of Human Services; providing for classification and unclassification of certain positions. Effective date. Emergency."
SB854,794521,"Motor vehicle taxes and fees; updating apportionment schedule. Effective date."
SB855,794327,"Motor vehicle taxes and fees; deleting certain apportionment. Effective date."
SB856,794099,"Sales and use tax; deleting obsolete apportionment schedules. Effective date."
SB857,793997,"Gross production tax; clarifying time period for certain apportionment. Effective date."
SB858,793851,"Health Care Authority; providing budgetary limitations; providing lapse dates; effective date."
SB859,793664,"State Department of Health; providing budgetary limitations; lapse dates; effective date."
SB860,794008,"Education; making appropriation to the Oklahoma State Regents for Higher Education; effective date."
SB861,794060,"General Appropriations; making appropriations; stating purpose; effective dates."
SB862,793649,"General Appropriations; making appropriations; stating purpose; effective dates."
SB863,793713,"General Appropriations; making appropriations; stating purpose; effective dates."
SB864,793430,"General Appropriations; making appropriations; stating purpose; effective dates."
SB865,792688,"Driver licenses; repealer relating to Oklahoma Nonparticipation in Implementation of Real ID Act of 2005. Effective date."
SB866,792689,"Office of the State Medical Examiner; authorizing relocation to location determined by Board of Medicolegal Investigations. Emergency."
SB867,794937,"Barbers; reducing certain fee. Effective date."
SB868,795641,"Recreational vehicles; lemon law; adding definition; including certain recreational vehicles. Effective date."
SB869,796860,"Two-year colleges; prohibiting the offering of certain scholarships. Effective date."
SB870,797081,"Schools; directing boards of education to adopt certain social media policies. Effective date."
SB871,797130,"Motor vehicle registration; eliminating certification requirement for certain vehicles owned by members of Armed Forces. Effective date."
SB872,797123,"Higher education; directing certain scholarships to be revoked upon certain conviction or plea. Effective date."
SB873,797418,"State government; providing for consolidation of Merit Protection Commission with Office of Management and Enterprise Services. Effective date. Emergency."
SB874,797547,"Probate procedure; increasing limitation on valuation of certain property. Effective date."
SB875,797814,"Protective orders; permitting electronic filing of certain motions under certain circumstances. Effective date."
SB876,797819,"Covenant marriage; establishing procedures for certain marriage. Effective date."
SB877,797821,"Oklahoma Department of Veterans Affairs; expanding certain exception. Effective date."
SB878,797872,"Waters and water rights; creating the Oklahoma Water Sustainability Act."
SB879,797871,"Motor vehicles; amending costs for texting violations."
SB880,797873,"Obscene material and child pornography; including law enforcement agency. Effective date."
SB881,797961,"Article V of U.S. Constitution; specifying procedure relating to delegates to Article V convention. Effective date."
SB882,797967,"Ethics Commission; modifying amount which lobbyist principal, legislative liaison or lobbyist may spend for certain purposes. Effective date."
SB883,798054,"Income tax credits; modifying amount of credit for production and sale of electricity after specified date. Effective date."
SB884,798113,"Hospitals; including Department of Corrections in exemption. Effective date."
SB885,798104,"Sales tax; providing exemption for sales to organization which provides certain support for members and veterans. Effective date."
SB886,798191,"Firearm application; modifying application fees and renewal fees. Effective date."
SB887,798380,"Schools; directing the Legislature to approve certain measures if appropriated funds decrease. Effective date."
SB888,798374,"Municipal audits; providing exception for certain grant funding relating to required audit."
SB889,798367,"Temporary Assistance for Needy Families; requiring Department of Human Services to conduct public service for certain purpose. Effective date."
SB890,798381,"Motor vehicle registration; expanding eligibility for Armed Forces special license plates. Effective date."
