bill_number,bill_id,title
HB2097,795239,"Insurance; contracts for health care services; authorizing a member to request a printed contract; effective date."
HB2098,795374,"Public finance; creating the Budget Accuracy and Transparency Act of 2015; effective date."
HB2099,795073,"Public finance; creating the True Cost of Government Act of 2015; effective date."
HB2100,793964,"Public finance; creating the Federal Receipts Reporting Act of 2015; effective date."
HB2101,795097,"Public finance; Whistleblower Liberty Fund Act; immunity; award of funds; effective date."
HB2102,793456,"Property; creating the Oklahoma Community Protection Act; effective date."
HB2103,793387,"Property; creating the Private Property Rights Act; effective date."
HB2104,793807,"Memorial highway designation; designating the Veterans Memorial Drive; codification; effective date."
HB2105,793914,"Mental health; clarifying language; effective date."
HB2106,795027,"Children; creating the Oklahoma Children's Act; effective date."
HB2107,793557,"Children; creating the Children's Act of 2015; effective date."
HB2108,793591,"Liens; creating the Lien Act of 2015; effective date."
HB2109,794430,"Revenue and taxation; referendum; sales tax increase; creating Healthcare Oklahoma Plan Revolving Fund; codification; effective date; ballot title; filing."
HB2110,793676,"Revenue and taxation; enacting the Retailer-Wholesaler Beer Tax Collection Reform Act of 2015; effective date."
HB2111,794896,"Schools; clarifying statutory language relating to the school district definition; effective date."
HB2112,794560,"Schools; clarifying statutory language relating to conflicting provisions of the school code; effective date."
HB2113,793864,"Higher education; clarifying language relating to the Oklahoma Higher Education Code; effective date."
HB2114,793431,"Utilities; clarifying statutory language relating to the records of public utility business; effective date."
HB2115,794314,"Waters and water rights; creating the Oklahoma Water Reclamation Study Act; creating the Oklahoma Water Reclamation Study Task Force; effective date."
HB2116,794404,"County and municipal government; creating the County and Municipal Government Repealer Act of 2015; effective date."
HB2117,794848,"CompSource Mutual Insurance Company Act; requiring payment of certain commissions; effective date."
HB2118,793520,"State government; creating the Ethics Act of 2015; effective date."
HB2119,794081,"Public buildings and public works; bidding contracts; extend contract award period; effective date."
HB2120,793998,"Revenue and taxation; enacting the Wind Taxation Policy Act of 2015; effective date."
HB2121,794250,"Oil and gas; modifying statutory language relating to the waste of natural gas; effective date."
HB2122,793830,"Professions and occupations; creating the Professions and Occupations Registration Act of 2015; effective date."
HB2123,795283,"Professions and occupations; creating the Building Codes Act of 2015; effective date."
HB2124,794862,"Oil and gas; changing the powers of cities and towns to regulate oil and gas drilling or production; emergency."
HB2125,794436,"Torts; clarifying language related to certain volunteer services; effective date."
HB2126,794016,"Waters and water rights; directing the Oklahoma Water Resources Board to not take action which would affect certain permits; prohibiting certain evaluations and considerations; emergency."
HB2127,794582,"Waters and water rights; clarifying language relating to the diversion of water; effective date."
HB2128,794868,"Professions and occupation; relating to roofing contractor registration; requirements; modifying refusal of registration."
HB2129,794347,"Public finance; fee revenues; General Revenue Fund; effective date; emergency."
HB2130,795468,"Schools; repealer; calculation of instruction costs and total compensation to certified personnel for certain school year; effective date."
HB2131,794226,"Revenue and taxation; repealer; effective date."
HB2132,795476,"Schools; creating the Parent Empowerment Act; effective date."
HB2133,794605,"Schools; clarifying language; effective date."
HB2134,795335,"Schools; curricular standards for instruction of public school students; School Testing Program; requirements."
HB2135,794225,"Children; creating the Oklahoma Emancipation Act; effective date."
HB2136,795083,"Juvenile justice; creating the 2015 Juvenile Justice Act; effective date."
HB2137,794360,"Juveniles; creating the Juvenile Offender Competency Act; effective date."
HB2138,793542,"Schools; clarifying statutory language relating to the apportionment of funds appropriated for school districts; effective date."
HB2139,795534,"Schools; clarifying statutory language relating to the Oklahoma Teacher and Leader Effectiveness Evaluation System; emergency."
HB2140,795490,"Schools; clarifying statutory language relating to payment or acceptance of bribes by school officers or employees; effective date."
HB2141,795493,"Revenue and taxation; enacting the Tax Credit Education Scholarship Act of 2015; effective date."
HB2142,794506,"Department of Human Services; creating the Citizens Advisory Panels Act; effective date."
HB2143,795053,"Child welfare; creating the Child Welfare Act; effective date."
HB2144,795124,"Foster care; creating the Foster Care Education Act; effective date."
HB2145,793731,"Foster care; creating the Foster Care Caseworker Act; effective date."
HB2146,794925,"Crimes and punishments; creating the Crimes and Punishments Act of 2015; effective date."
HB2147,794515,"Criminal procedure; creating the Criminal Procedure Act of 2015; effective date."
HB2148,795434,"Occupations; creating the Occupations and Employers Act of 2015; effective date."
HB2149,794198,"Elections; creating the Election Reform Act of 2015; effective date."
HB2150,794773,"Marriage; requiring completion of educational program prior to final divorce decree; effective date."
HB2151,794625,"Revenue and taxation; sales tax exemptions; organizations providing computer technology education for older adults; effective date."
HB2152,794435,"Property; clarifying power of alienation of trust property; effective date."
HB2153,793506,"Driver licenses; directing the Department of Public Safety to include certain exemption provision on driver license and identification card applications; repealer; effective date."
HB2154,795105,"Public health and safety; creating Katie and Cayman's Law; providing for the establishment of statewide investigational new drug applications for certain clinical trials; emergency."
HB2155,793367,"State government; enacting Transparency in Private Attorney Contingency-Fee Contracts Act; effective date."
HB2156,795561,"Workers' Compensation; Oklahoma Employee Injury Benefit Act; clarifying language; effective date."
HB2157,793316,"Children; enacting the Family Support Accountability Act; effective date."
HB2158,794106,"Public health and safety; permitting advanced practice nurse to prescribe Schedule II controlled dangerous substances; effective date."
HB2159,794831,"Courts; modifying various sections related to certification standards for courtroom interpreters; effective date."
HB2160,793539,"Product liability; creating the Rational Use of a Product Act; effective date."
HB2161,794438,"Workers' compensation; Workers' Compensation Commission; Court of Existing Claims; revolving fund."
HB2162,793625,"Oklahoma Court Information System; requiring audit of Oklahoma Court Information System Revolving Fund; providing end date for assessment; emergency."
HB2163,794910,"Public retirement systems; Teachers Retirement System of Oklahoma; death benefit; effective date; emergency."
HB2164,795140,"Civil procedure; admitting statement of amount paid instead of amount billed in certain cases; effective date."
HB2165,794504,"Condemnation; mandating award of costs and attorney fees; adding the right to demand a jury trial in certain proceedings; effective date."
HB2166,795363,"Oklahoma Commission on Children and Youth; permitting Commission to maintain certain information as confidential; effective date."
HB2167,793380,"State employee benefits; requiring the Oklahoma Employees Insurance and Benefits Board to exclusively offer health savings accounts with a high-deductible health plan for purposes of health care insurance; emergency."
HB2168,794063,"Professions and occupations; modifying various license and certificate qualifications; effective date."
HB2169,793865,"Labor; enacting the Civil Liability for Employers Hiring Ex-Offenders Act; effective date."
HB2170,795515,"Schools; requiring risk assessment be available to certain students; effective date."
HB2171,795101,"Oklahoma Open Meeting Act; authorizing certain executive sessions; emergency."
HB2172,795326,"Lotteries; requiring Oklahoma Lottery Commission to notify Oklahoma Health Care Authority of certain individuals; effective date."
HB2173,793492,"Receivership; creating the Oklahoma Receivership Act; effective date."
HB2174,794169,"Conveyances; creating the Oklahoma Conveyances Act; effective date."
HB2175,793678,"Game and fish; creating the Gold Star Recipient Hunting and Fishing License Discount Act; effective date."
HB2176,793958,"Motor vehicles; creating the Oklahoma Motor Vehicles Act; effective date."
HB2177,793576,"Oil and gas; 2011 Shale Reservoir Development Act; changing name of act; modifying certain development requirements; emergency."
HB2178,794750,"Oil and gas; modifying powers of cities and towns to regulate oil and gas drilling or production; repealer. Emergency."
HB2179,794449,"Motor vehicles; modifying certain provisional driver license requirements; effective date."
HB2180,793961,"Higher education; modifying eligibility requirements for the Oklahoma Higher Learning Access Program."
HB2181,794685,"Elections; modifying requirements for formation of a recognized political party; effective date."
HB2182,795162,"Public finance; Incentive Evaluation Act; Incentive Evaluation Commission; tax preferences; procedures; reports; effective date."
HB2183,795527,"Public finance; incentives; measurements; effective date."
HB2184,795312,"Public health and safety; permitted Chief Medical Examiner to equip certain vehicles with flashing lights and sirens and to permit certain vehicles to exceed maximum speed limits; effective date."
HB2185,794424,"Tobacco Settlement Endowment Trust Fund; requiring unsolicited proposals to be subject to certain acts; effective date."
HB2186,794088,"Revenue and taxation; Tax Credit Evaluation and Review Act of 2015; effective date."
HB2187,794328,"Corrections; electronic monitoring of inmates; authorizing Pardon and Parole Board to use for parolees; effective date."
HB2188,794712,"Schools; creating the Public School Reform Act of 2015; effective date."
HB2189,793715,"Oil and gas; modifying statutory language relating to the waste of natural gas; effective date."
HB2190,793594,"State-tribal relations; creating the Native American Cultural Center Act; effective date."
HB2191,794222,"Corporation Commission; clarifying statutory language relating to proceeding when no quorum is present; effective date."
HB2192,795400,"State employees; creating the State Employee Remuneration Reform Act; effective date."
HB2193,793349,"Statutes and reports; creating the Administrative Rules Reform Act of 2015; effective date."
HB2194,794900,"Roads and bridges; enacting the State Transportation Act of 2015; effective date."
HB2195,794143,"Motor Vehicles; enacting the Oklahoma License Plate Act of 2015; effective date."
HB2196,794053,"Roads and bridges; Highway and Bridge Naming Act of 2015; effective date."
HB2197,793835,"Public health and safety; creating the Rural Healthcare Improvement Act of 2015; effective date."
HB2198,793653,"Fees, fines and court costs; creating the Fees, Fines and Court Costs Reform Act; effective date."
HB2199,795063,"Attorneys; making Oklahoma Bar Association dues optional; effective date."
HB2200,793661,"Public finance; Oklahoma Pension Benefits Analysis Act of 2015; effective date."
HB2201,793310,"Initiative and referendum; creating the Initiative Petition Reform Act of 2015; effective date."
HB2202,795144,"Revolving funds; Revolving Fund Technical Amendments Act of 2015; effective date; emergency."
HB2203,794029,"State government buildings; State Government Buildings Act of 2015; effective date; emergency."
HB2204,794701,"Public health and safety; creating the Public Health and Safety Act of 2015; effective date."
HB2205,795318,"Workers' Compensation; Administrative Workers' Compensation Act; Employee Injury Benefit Act; violations; disability; effective date."
HB2206,793370,"Criminal procedure; granting exclusive jurisdiction to Attorney General for certain prosecutions; effective date."
HB2207,795498,"Public health and safety; prohibiting the practice of surgical technology in a health care facility unless certain requirements are met; effective date."
HB2208,795317,"Poultry; updating references; repealer; effective date; emergency."
HB2209,794760,"Schools; independent districts; dependent districts; elections; millage; voting procedures; effective date."
HB2210,793650,"Motor vehicles; modifying certain penalty; effective date."
HB2211,795141,"Motor vehicles; lowering certain age limitation; effective date."
HB2212,794652,"Public health and safety; prohibiting harassment of mother who is breast-feeding; effective date."
HB2213,793819,"Schools; clarifying statutory language relating to the Oklahoma Teacher and Leader Effectiveness Evaluation System; emergency."
HB2214,794248,"Judicial Nominating Commission; modifying composition; effective date."
HB2215,794470,"Marriage; requiring marriage applicant to report if they have undergone sex reassignment surgery; effective date."
HB2216,793951,"Students; creating the Chase Morris Sudden Cardiac Arrest Prevention Act; effective date; emergency."
HB2217,793298,"Insurance; requiring a health benefit plan to consider the provider in-network for purposes of reimbursement within certain time period; effective date."
HB2218,793991,"Professions and occupations; Precious Metal and Gem Dealer Licensing Act; authorizing law enforcement to place hold order on certain property; effective date."
HB2219,794780,"Schools; creating the School Administrative Restructuring Act; effective date; emergency."
HB2220,795311,"Surrogacy and adoption; creating the Surrogacy and Adoption Act of 2015; effective date."
HB2221,794951,"Motor vehicles; temporary license plates; display certain date; effective date."
HB2222,793814,"Abortion; creating the Oklahoma Antiabortion Act of 2015; effective date."
HB2223,795369,"Children; stating that child support obligation terminates upon decree; effective date."
HB2224,794488,"Civil procedure; costs; excepting actions by the Department of Human Services to enforce a debt; effective date."
HB2225,794023,"Poor persons; child support liens on insurance proceeds; extending applicability to life insurance; effective date."
HB2226,794875,"Motor vehicles; transfer of ownership; exempting from notary public acknowledgment; effective date."
HB2227,793537,"Counties and county officers; creating the County Burial Act of 2015; effective date."
HB2228,793842,"Counties and county officers; creating the County Assessor Act of 2015; effective date."
HB2229,794682,"Revenue and taxation; ad valorem taxation; personal property tax liens; priority; effective date."
HB2230,794763,"Energy; Energy Cost Analysis Act of 2015; effective date."
HB2231,794458,"Liens; creating the Oklahoma Construction Registry Act; effective date."
HB2232,793876,"Supreme Court; authorization; modification; emergency."
HB2233,793882,"Supreme Court; revolving funds; authorization; transfer of monies; emergency."
HB2234,793295,"Oil and gas; modifying definition of seeping natural gas; changing funds and expenditure authorizations; effective date; emergency."
HB2235,793359,"Revenue and taxation; contracts and information; expenditures; release of information; confidentiality; violations."
HB2236,794833,"Revenue and taxation; Voluntary Compliance Initiative; reinstituting for certain period; emergency."
HB2237,794702,"Native American Cultural and Educational Authority; property transfers; agreements; Oklahoma Capitol Improvement Authority; obligations; revolving funds; codification; effective date."
HB2238,795533,"Workers' Compensation; Workers' Compensation funds; effective date; emergency."
HB2239,795081,"Office of Juvenile Affairs; requiring budgeting in certain categories and amounts; budgetary limitations."
HB2240,794986,"Department of Mental Health and Substance Abuse Services; authorizing transfers, exempting certain funds from expenditure and budgetary limitations."
HB2241,795478,"Revenue and taxation; aircraft excise tax; modifying distribution of revenue; effective date."
HB2242,793820,"Appropriations; general appropriations; purposes; effective dates."
HB2243,795093,"Revenue and taxation; sales and use tax; apportionment; effective date; emergency."
HB2244,794410,"Motor vehicles; apportionment; effective date; emergency."
HB2245,795365,"Oklahoma Arts Council; modifying authorized uses of incentive grant funding; effective date; emergency."
HB2246,793738,"State government; authorizing the Office of Educational Quality and Accountability to pay for certain expenses."
HB2247,796532,"Public retirement systems; Experienced Teacher Support Act; Teachers' Retirement System of Oklahoma; postretirement earnings limit; effective date."
HB2248,801878,"Public finance; sales tax levy ballots; prohibiting certain interpretation; effective date."
HB2249,837498,"Motor vehicles; maintenance and construction zones; making certain acts unlawful; emergency."
HB2250,807866,"Animal rights charitable organizations; prohibiting the solicitation of contributions intended for out-of-state or for political purposes."
HB2251,807717,"Public health and safety; modifying certain definition; effective date."
HB2252,810304,"Civil procedure; declaring legislative intent; prohibiting renewal of license for certain persons; effective date."
HB2253,810284,"Labor; modifying various provisions of the Employment Security Act of 1980; effective date."
HB2254,810632,"Administrative rules; Administrative Procedures Act; modifying legislative approval and disapproval of rules; requiring approval of certain rules; effective date."
HB2255,811136,"State government; creating the State Bidding Requirements Act of 2016; effective date."
HB2256,811219,"Professions and occupations; creating the Building Codes Act of 2016; effective date."
HB2257,811239,"Professions and occupations; Construction Industries Board Act; modifying powers and duties of the Construction Industries Board; effective date."
HB2258,811107,"State government; Oklahoma State Pension Commission; reports; effective date."
HB2259,811291,"Criminal procedure; insane persons; defining term."
HB2260,811207,"Motor vehicles; motorcycles; driver licenses; motorcycle safety course."
HB2261,811199,"American Indian Arts and Crafts Sales Act of 1974; modifying definitions."
HB2262,811125,"Property; creating the Freedom to Display the American Flag Act."
HB2263,811270,"Public retirement systems; Teachers' Retirement System; administration; effective date."
HB2264,811155,"Retirement Freedom Act; employee contribution rate; effective date."
HB2265,811251,"Schools; modifying components of the Oklahoma Teacher and Leader Effectiveness Evaluation System; effective date; emergency."
HB2266,811746,"Firearms; authorizing handgun licensees to carry on certain school property; effective date."
HB2267,812169,"Public health and safety; extending termination date of supplemental hospital offset payment program fee; effective date."
HB2268,811943,"Memorial highway designations; designating various memorial highways; effective date."
HB2269,814602,"Schools; prohibiting value-added modeling in measuring student academic growth for quantitative components; effective date."
HB2270,814651,"Revenue and taxation; Oklahoma Revenue and Taxation Analysis Act of 2016; effective date."
HB2271,816455,"Elections; creating the Military Privacy Protection Act; adding military to protected class status; effective date."
HB2272,816336,"Intoxicating liquors; prohibiting television and radio advertising of vapor products; effective date."
HB2273,816844,"Police Pension and Retirement System; definitions; disposition of certain contributions; modifying references to certain individual retirement accounts; effective date; emergency."
HB2274,816648,"State Architectural and Registered Interior Designers Act; requiring architects to follow certain plans and specifications; providing exemptions; effective date."
HB2275,816697,"DNA testing; requiring submission of DNA samples from persons arrested for felony crimes; effective date."
HB2276,816918,"Eminent domain; authorizing property owner to file request for judicial location exception in certain actions; effective date."
HB2277,817310,"Elections; voter registration; clarifying conditions for voter eligibility; effective date."
HB2278,817520,"Consumer protection; creating the Oklahoma Fantasy Contests Act; effective date."
HB2279,817560,"Public health and safety; providing immunity from prosecution for drug-related offenses under certain circumstances; effective date."
HB2280,817687,"Public health and safety; Continuum of Care and Assisted Living Act; requiring Department of Health to develop a classification system of violations; effective date."
HB2281,817755,"Open records; providing that public body which makes the requested records available on the Internet shall meet obligation of providing prompt, reasonable access to its records; effective date."
HB2282,817818,"Public health and safety; requiring State Board of Examiners for Long-Term Care Administrators to promulgate certain rules for examination; effective date."
HB2283,817694,"Labor; creating the Administrative Unification, Efficiency and Modernization Act; effective date."
HB2284,817765,"State government; creating the State Government Operations Ethics in Contracting Reform Act of 2016; effective date."
HB2285,817843,"Poor persons; repealing act creating the Oklahoma Pharmacy Connection Council; effective date."
HB2286,817776,"Crimes and punishments; emergency telephone calls on party lines; repealers; effective date."
HB2287,817836,"State government; repealing section relating to federal granted funds; effective date."
HB2288,817729,"State government; repealing sections relating to world trade development; effective date."
HB2289,817854,"Roads and Bridges; Department of Transportation; surveys and examinations; landowner notice requirements; effective date."
HB2290,817719,"Counties; creating the County and County Officers Advancement Act; effective date."
HB2291,817936,"Counties; creating the County Government Improvement Act of 2016; effective date."
HB2292,817905,"Criminal procedure; increasing statute of limitations for child victims of specified crimes; effective date."
HB2293,817933,"Motor vehicles; license plates; creating various specialty license plates; effective date."
HB2294,817915,"Motor vehicles; specialty license plates; Prisoner of War and Missing in Action license plate; revolving fund; effective date."
HB2295,817922,"Labor; employer access to online social media accounts of employees; providing exception; effective date."
HB2296,817909,"Firearms; authorizing municipal employees to carry firearms under certain circumstances; effective date."
HB2297,817928,"Visitation; grandparental visitation rights; deleting and updating statutory references; effective date."
HB2298,818533,"Motor vehicles; creating the Safe Driving Act; requiring driver education courses to include certain education components; effective date."
HB2299,818554,"Counties and county officers; creating the Oklahoma Counties and County Officers Advancement Act of 2016; effective date."
HB2300,818359,"Public health and safety; creating the Public Health and Safety Act of 2016; effective date."
HB2301,818373,"Public meetings; modifying certain Oklahoma Open Meeting Act definition; effective date."
HB2302,818496,"Firearms; modifying statutory references; recodification; effective date."
HB2303,818513,"Corporation Commission; modifying termination date for certain well plugging fund. Effective dagte. Emergency."
HB2304,818438,"Property; Residential Property Condition Disclosure Act; modifying property disclosure statement; effective date."
HB2305,818545,"Civil procedure; requiring affidavits of merit in negligence counterclaims and cross-claims; effective date."
HB2306,818452,"Firearms; authorizing Oklahoma Army and Air National Guard personnel to carry firearms under certain circumstances; effective date."
HB2307,818812,"Open records; increasing copying fee for public records; effective date."
HB2308,818785,"Public health and safety; extending period in which care coordination models are to be phased in after initial enrollment period; effective date."
HB2309,818622,"Crimes and punishments; providing additional method to keep trespassers off property; effective date."
HB2310,818759,"Revenue and taxation; county sales tax; maximum levy; emergency."
HB2311,818627,"Memorial bridge designations; designating the James L. ""Jimbo"" Jones Memorial Bridge; providing an effective date."
HB2312,818975,"Civil procedure; service of process; deleting acceptance or refusal by a person other than the restricted delivery addressee in service by mail; effective date."
HB2313,818908,"Schools; student testing performance levels and cut scores and accountability system; requirements; effective date; emergency."
HB2314,818891,"Schools; modifying type of retention pay that is not included in total compensation of teachers."
HB2315,818601,"Schools; authorizing certain instruction to count toward school district treasurers' and encumbrance clerks' continuing education requirement; emergency."
