bill_number,bill_id,title
HB3185,824236,"Criminal justice; creating the Responsible Criminal Justice Reform Act; effective date."
HB3186,824149,"Mental health; clarifying language; effective date."
HB3187,823950,"Mental health; creating the Mental Health Alternatives Act of 2016; effective date."
HB3188,823777,"Prisons and reformatories; creating the Prisons and Reformatories Modernization Act; effective date."
HB3189,823727,"Prisons and reformatories; creating the Prisons and Reformatories Reform Act; effective date."
HB3190,824253,"Public health and safety; creating the Public Health and Safety Act of 2016; effective date."
HB3191,823890,"Public finance; Oklahoma Budget Act of 2016; effective date."
HB3192,825268,"Motor vehicles; vehicle registration; military personnel; effective date."
HB3193,825288,"Elections; modifying felony conviction exception; effective date."
HB3194,825249,"Labor; creating the Equal Pay for Equal Work Task Force; requiring study of pay disparity; effective date."
HB3195,825214,"Revenue and taxation; income tax credit; small business; veterans; start-up expenses; effective date."
HB3196,825229,"Elections; authorizing Secretary of the State Election Board to create pilot program for certain elections; effective date."
HB3197,859479,"Appropriations; Constitutional Reserve Fund; amount; purpose; emergency."
HB3198,859290,"Appropriations; purpose; effective date."
HB3199,859385,"Appropriations; Constitutional Reserve Fund; amount; purpose; emergency."
HB3200,859191,"Appropriations; purpose; effective date."
HB3201,860352,"Multiple versions of statutes; amending, merging, consolidating and repealing multiple versions of statutes; emergency."
HB3202,869842,"Courts; extending date for transfer of monies from specified court revolving funds to the Supreme Court Administrative Revolving Fund. Emergency."
HB3203,869839,"Courts; renaming Court Information System Revolving Fund; authorizing certain expenditures from fund. Emergency."
HB3204,875933,"Revenue and taxation; railroad rehabilitation tax credits; effective date."
HB3205,875949,"Revenue and taxation; refund claims; sales and use tax; limitation."
HB3206,875965,"Public finance; Cash-flow Reserve Fund; reporting procedure; effective date."
HB3207,877200,"Water and water rights; Grand River Dam Authority; payment of certain revenues; effective date; emergency."
HB3208,877253,"Motor vehicles; license plate reissuance; registration fees; apportionment of certain funds."
HB3209,877630,"Public finance; reduction of apportionments; effective date; emergency."
HB3210,877705,"Health care funding; cigarette excise tax; apportionment; sale of excise tax stamps; effective date."
HB3211,877615,"Revenue and taxation; Oklahoma Revenue and Taxation Act of 2016; effective date."
HB3212,877690,"Revenue and taxation; Oklahoma Revenue and Taxation Act of 2016; effective date."
HB3213,877659,"Revenue and taxation; Oklahoma Revenue and Taxation Act of 2016; effective date."
HB3214,877676,"Revenue and taxation; Oklahoma Revenue and Taxation Act of 2016; effective date."
HB3215,877644,"Revenue and taxation; Oklahoma Revenue and Taxation Act of 2016; effective date."
HB3216,877601,"Revenue and taxation; Oklahoma Revenue and Taxation Act of 2016; effective date."
HB3217,877939,"Revenue and taxation; computer-assisted mass appraisal; documentary stamps; fees; effective date; emergency."
HB3218,878606,"Schools; modifying school testing requirements; effective date; emergency."
HB3219,878783,"Courts; authorizing expenditures from the Oklahoma Court Information System Revolving Fund; emergency."
HB3220,878805,"Court fees; modifying court fees and costs; creating a District Court Revolving Fund; effective date; emergency."
HB3221,879112,"Corporation Commission; setting certain budget limits."
HB3222,879110,"Appropriations; purpose; effective date."
HB3223,879114,"Appropriations; purpose; effective date."
HB3224,879111,"Appropriations; purpose; effective date."
HB3225,879116,"Appropriations; purpose; effective date."
HB3226,879106,"Appropriations; purpose; effective date."
HB3227,879105,"Appropriations; purpose; effective date."
HB3228,879108,"Appropriations; purpose; effective date."
HB3229,879107,"Appropriations; purpose; effective date."
HB3230,879115,"Appropriations; purpose; effective date."
HB3231,879273,"Public finance; authorizing issuance of certain obligations by the Capitol Improvement Authority."
HB9998,794656,"This is a test bill."
HR1001,793397,"Early warning system; Inmate Alert; directing distribution."
HR1002,794113,"Rose Day; recognizing February 4, 2015, as Rose Day."
HR1003,793644,"Proclamation; Wear Red Day; distribution."
HR1004,794803,"House Rules"
HR1005,794171,"Expressing appreciation to Mark Vaughan; distribution."
HR1006,794526,"Expressing appreciation to Mark Vaughan; distribution."
HR1007,794200,"A Resolution congratulating the Class 5A State Football Champions, the Lawton MacArthur Highlanders; distribution."
HR1008,794045,"Proclaiming February 22-28, 2015 as ""Emergency Management Week"" in the State of Oklahoma."
HR1009,795024,"Disabilities; directing Disabilities Issues Citizens Advisory Panel develop recommendations; distribution."
HR1010,794616,"Recognizing the third week in March as TBI Raiders Week."
HR1011,795373,"Congratulating and honoring Alexandria (Lexie) Lerblance as a recipient of a Prudential Spirit of Community Award; distribution."
HR1012,794953,"Proclaiming April 2015 as National Poetry Month; distribution."
HR1013,794815,"Commending Boys & Girls Clubs across Oklahoma for their outstanding service; distribution."
HR1014,795113,"Sending heartfelt remembrances to families of those killed in terrorist bombing of the Alfred P. Murrah Federal Building; distribution."
HR1015,795123,"Proclaiming April 2, 2015, as FCA Day in Oklahoma; commending certain individuals; distribution."
HR1016,795528,"Proclamation; Type 1 Diabetes Awareness Day."
HR1017,794397,"Declaring County Government Week in Oklahoma."
HR1018,793679,"Proclaiming April 7, 2015, as the 19th Annual 4-H Day at the State Capitol."
HR1019,793714,"Designation; Chief Standing Bear Trail."
HR1020,794997,"A Resolution commemorating the signing of House Bill No. 1017 of the 1st Extraordinary Session of the 42nd Oklahoma Legislature; distribution."
HR1021,795012,"Observing May 7, 2015, as the National Day of Prayer."
HR1022,793718,"Memorializing President Obama and Congress to reaffirm our nation's commitments to promoting and protecting religious freedom and to condemn increasing number of Christians who are killed; directing distribution."
HR1023,794601,"Declaring May 2015 as Ehlers-Danlos Syndrome Awareness Month; distribution."
HR1024,793621,"Urging the Oklahoma Congressional Delegation to resist passage and implementation of the Trans-Pacific Partnership; directing distribution."
HR1025,794732,"Resolution; proclaiming May 10-16, 2015, as Police Week in Oklahoma."
HR1026,794003,"Resolution directing the University of Oklahoma and the Fred Jones Jr. Museum of Art to conduct provenance research on certain objects; distribution."
HR1027,793769,"Declaring May 13, 2015, as Lupus Advocacy Day; distribution."
HR1028,795551,"Celebrating thirty-fifth anniversary of the Sister-State relationship between the State of Oklahoma and Taiwan; distribution."
HR1029,794499,"Urging public schools, universities and state agencies to cease displaying certain flag and fly certain flag instead; distribution."
HR1030,794487,"Celebrating thirty-fifth anniversary of the Sister-State relationship between the State of Oklahoma and Taiwan; distribution."
HR1031,793331,"Urging the Oklahoma Congressional Delegation to resist passage and implementation of the Trans-Pacific Partnership; directing distribution."
HR1032,822744,"A resolution expressing disapproval of the United States Supreme Court decision in Obergefell v. Hodges."
HR1033,826439,"Proclamation; Wear Red Day; distribution."
HR1034,833298,"Rules of the Oklahoma House of Representatives; modifying daily order of business."
HR1035,834945,"Condemning the international Boycott, Divestment and Sanctions Movement; reaffirming support of Israel; distribution"
HR1036,836339,"Rose Day; recognizing February 3, 2016, as Rose Day."
HR1037,836942,"Condemning the international Boycott, Divestment and Sanctions Movement; reaffirming support of Israel; distribution."
HR1038,846646,"Resolution; commending Clyde McMasters and Don McMasters for their extraordinary service to our country; distribution."
HR1039,854791,"A resolution expressing support for natural marriage."
HR1040,855721,"Proclaiming February 27, 2016, as Dan Hays Day; directing distribution."
HR1041,855873,"A Resolution urging the United States Congress to resist implementation of any changes to the Aid and Attendance Pension that would have a negative impact on Oklahoma veterans."
HR1042,860545,"Resolution commemorating 60th anniversary of adoption of national motto."
HR1043,861672,"Childhood cancer; encouraging partnerships for the treatment of childhood cancer; distribution."
HR1044,866785,"Proclaiming March 22, 2016, as General Stafford Day in Oklahoma; distribution."
HR1045,866873,"Proclaiming March 24, 2016, as Oklahoma Nonprofit Day."
HR1046,866788,"Secretary of Finance, Administration, and Information Technology; creating Resolution of No Confidence; distribution."
HR1047,867787,"Resolution commending Wayne Cooper for his painting of Dale, Oklahoma; distribution."
HR1048,868837,"Observing May 5, 2016, as the National Day of Prayer."
HR1049,868844,"Sending heartfelt remembrances to families of those killed in terrorist bombing of the Alfred P. Murrah Federal Building; distribution."
HR1050,868846,"Proclamation; proclaiming Nurse Practitioner Day."
HR1051,869169,"Expressing appreciation to the Oklahoma Osteopathic Association; directing distribution."
HR1052,869359,"Proclaiming April 5, 2016, as National Service Recognition Day."
HR1053,869558,"Proclamation; Type 1 Diabetes Awareness Day."
HR1054,869638,"Proclamation; Type 1 Diabetes Awareness Day."
HR1055,869936,"Proclaiming April 2016 as National Poetry Month."
HR1056,869940,"Resolution; supporting proposed rule of Federal Railroad Administration; distribution."
HR1057,870504,"Counties; declaring County Government Week."
HR1058,870436,"Resolution proclaiming April 6, 2016, as the 20th Annual 4-H Day at the Capitol in Oklahoma."
HR1059,871459,"A Resolution recognizing and declaring April 10 - 16, 2016, as National Library Week; distribution."
HR1060,871914,"Commending Steven Williamson, President of the Oklahoma Elks Association; offering congratulations and best wishes; and directing distribution."
HR1061,871942,"Commending Ronald L. Hicks for an outstanding year as Grand Exalted Ruler of the Benevolent and Protective Order of Elks of the U.S.A.; distribution."
HR1062,871966,"A Resolution encouraging support for the Holocaust Expropriated Art Recovery (HEAR) Act; distribution."
HR1063,872018,"Resolution commemorating 60th anniversary of adoption of national motto."
HR1064,873336,"Presenting congratulations to President-elect Tsai and expressing admiration to the Taiwanese people; encouraging closer economic relationships between Taiwan and the United States; distribution."
HR1065,873659,"Resolution; supporting development of education programs for students with intellectual and developmental disabilities; distribution."
HR1066,875376,"Resolution; proclaiming May 15-21, 2016, as Police Week in Oklahoma."
HR1067,875656,"Resolution; declaring Correctional Officers Week."
HR1068,875797,"Recognizing the Oklahoma Arts Institute for forty years of exceptional service; distribution."
HR1069,876257,"Resolution declaring May as Ehlers-Danlos Syndrome Awareness Month; distribution."
HR1070,876694,"Supporting the Nation of Israel; congratulating Israel on the sixty-eighth anniversary of her founding; distribution."
HR1071,876852,"Resolution urging the Oklahoma Attorney General to order an investigation by the Oklahoma State Bureau of Investigation of Oklahoma veteran centers; distribution."
HR1072,876795,"Resolution recognizing and commending Farm Credit and certain local offices for 100 years of support and service to the agricultural community."
HR1073,877134,"A Resolution recognizing and commending Farm Credit for 100 years of service to the agricultural community."
HR1074,877234,"Urging certain groups to work together to increase education and awareness of meningococcal disease."
HR1075,877349,"Instructing the Office of Management and Enterprise Services to follow terms of contract and provide MedEncentive certain data; distribution."
HR1076,878710,"A Resolution recognizing chronic pain and abuse of pain medicine as serious health problems; recognizing September as Pain Awareness Month."
HR1077,879299,"Instructing the Office of Management and Enterprise Services to follow terms of contract and provide MedEncentive certain data."
HR1078,879627,"A Resolution supporting certain services, treatment, training and increased public awareness of Dyslexia; distribution."
HR1079,879720,"Resolution urging the Attorney General to investigate veterans centers; distribution."
HCR1001,793906,"Insurance; creating the Catastrophic Health Insurance Task Force."
HCR1002,793752,"A Concurrent Resolution urging the College Board to change the Advanced Placement United States History course framework and examination; directing certain actions by the State Board of Education; distribution."
HCR1003,795263,"A Concurrent Resolution proclaiming February 8 to February 14 as Oklahoma Homeschool Week; recognizing event; distribution."
HCR1004,793326,"Recognizing March 2015 as American Red Cross month."
HCR1005,794077,"Magna Carta; commemorating the 800th anniversary of the signing of Magna Carta."
HCR1006,793586,"Commending Susan Tallchief Vrana; offering congratulations and best wishes; distribution."
HCR1007,794301,"Concurrent Resolution; recall of Enrolled House Bill No. 1405."
HCR1008,793448,"Designation; Chief Standing Bear Trail."
HCR1009,794187,"Concurrent Resolution; recall of Enrolled House Bill No. 1047."
HCR1010,793611,"Concurrent Resolution; economic development incentives; performance audits; distribution."
HCR1011,793340,"Celebrating thirty-fifth anniversary of the Sister-State relationship between the State of Oklahoma and Taiwan; distribution."
HCR1012,794244,"Concurrent Resolution; Trans-Pacific Partnership; Congress; distribution."
HCR1013,794464,"Concurrent resolution; Developmental Disabilities Services Division; waiver services waiting list; distribution."
HCR1014,828604,"A Concurrent Resolution condemning Planned Parenthood; creating the Truth About Planned Parenthood Resolution of 2016."
HCR1015,842395,"Concurrent Resolution designating February 16, 2016, Water Appreciation Day at the State Capitol; directing distribution."
HCR1016,851337,"United States Senators; providing for office space within the State Capitol Building for United States Senators representing the State of Oklahoma; requesting Senators to be available for certain duties; providing for action by the State Legislature; distribution."
HCR1017,853880,"Legislature and Governor; calling for a reduction in salaries for the Legislature and the Governor."
HCR1018,855413,"Recognizing March as American Red Cross Month; distribution."
HCR1019,871724,"Concurrent Resolution; FY 17 Budget; findings; disaster declaration; elections; voting; distribution."
HCR1020,873469,"A Concurrent Resolution requesting the Corporation Commission to refrain from disrupting certain funding for technology center schools; distribution."
HCR1021,879796,"A Concurrent Resolution supporting certain actions relating to federal guidance on transgender students; distribution."
HJR1001,793627,"Oklahoma Constitution; legislative sessions; appropriations; ballot title; filing."
HJR1002,793756,"Oklahoma Constitution; allowing direct shipment of wine to certain individuals; ballot title; filing."
HJR1003,793798,"Constitutional amendment; providing definition; ballot title; filing."
HJR1004,794311,"Constitutional amendment; State Board of Equalization; membership; ballot title"
HJR1005,793760,"Oklahoma Constitution; allowing direct shipment of wine to certain individuals; ballot title; filing."
HJR1006,795166,"Constitutional amendment; modifying selection process for Supreme Court Justices; ballot title; filing."
HJR1007,793598,"Constitutional amendment; modifying legislative term limits for future Legislatures; ballot title; filing."
HJR1008,794398,"Constitutional amendment; changing method for apportionment of the Legislature; ballot title; filing"
HJR1009,795555,"Constitutional amendment; clarifying manner in which citizens may keep and bear arms; ballot title; filing."
HJR1010,795273,"Constitutional amendment; Board on Legislative Compensation; abolishing Board; ballot title; filing."
HJR1011,794087,"Constitutional convention; Article V of the United States Constitution; Citizens United decision; dispatch."
HJR1012,794011,"Constitutional amendment; guaranteeing the right to engage in certain farming and ranching practices; ballot title; filing."
HJR1013,795525,"Joint Resolution opposing the proposed Environmental Protection Agency and Army Corps of Engineers rule defining waters of the United States; distribution."
HJR1014,795231,"Oklahoma Constitution; ad valorem taxation; qualifying manufacturing concerns; ballot title; filing."
HJR1015,793981,"Oklahoma Constitution; homesteads; fair cash value; gross household income; ballot title; filing."
HJR1016,794101,"Oklahoma Constitution; lease revenue obligations; revenues; ballot title; filing."
HJR1017,793560,"A resolution creating the Water Reclamation Study Task Force; effective date."
HJR1018,794636,"Article V Convention for proposing a balanced budget amendment; distribution."
HJR1019,794734,"Constitutional amendment; providing for Governor and Lt. Governor to be elected jointly; ballot title; filing."
HJR1020,794343,"State Constitution; calling for a state constitutional convention; ballot title; filing."
HJR1021,794791,"Oklahoma Constitution; homestead; ad valorem exemption; ballot title; filing."
HJR1022,794843,"Constitutional amendment; giving newly created Court of Capital Appeals jurisdiction over capital murder appeals; ballot title; filing."
HJR1023,794972,"Oklahoma Constitution; income tax rates; individuals; corporations; exemptions, deductions and credits; legislative measures; supermajority approval; ballot title; filing."
HJR1024,794228,"Oklahoma Constitution; modifying provisions for exempt treatment of manufacturing facilities; ballot title; filing."
HJR1025,795179,"Oklahoma Constitution; modifying provisions related to certain activity of legislators; providing exception; ballot title; filing."
HJR1026,795022,"Constitutional amendment; modifying date for organizational day of the Legislature; ballot title; filing."
HJR1027,794032,"Disapproving proposed permanent rule of the Alcoholic Beverage Laws Enforcement Commission; stating legislative intent; distribution."
HJR1028,793336,"Disapproving proposed permanent rule of the Oklahoma State Board of Education; stating legislative intent; distribution."
HJR1029,795221,"Approving and disapproving certain proposed permanent rules of Oklahoma state agencies; distribution."
HJR1030,795550,"Approving and disapproving certain proposed permanent rules of state agencies; distribution."
HJR1031,794798,"Disapproving proposed permanent rule of the Statewide Virtual Charter School Board; distribution."
HJR1032,795225,"Disapproving in part proposed permanent rules of the Virtual Charter School Board; directing distribution."
HJR1033,794845,"Disapproving proposed permanent rules of the Department of Environmental Quality; stating legislative intent; directing distribution."
HJR1034,794570,"Disapproving proposed permanent rules of the Oklahoma Department of Agriculture, Food, and Forestry; stating legislative intent; directing distribution."
HJR1035,794944,"Expressing the legislative intent of House Joint Resolution No. 1012; emergency."
HJR1036,794939,"Oklahoma Constitution; public monies or property; sectarian purposes; repeal; ballot title; filing."
HJR1037,798981,"Constitutional amendments; selection of appellate judges; ballot title; filing."
HJR1038,812057,"Medicaid; declaring all services provided to certain Medicaid recipients be considered as acute, inpatient hospital services."
HJR1039,814700,"Resolution; prohibiting the sale or exportation of surface water and groundwater outside this state until certain conditions are met; ballot title; filing."
HJR1040,817707,"Constitutional amendment; providing term limits for Supreme Court Justices; ballot title; filing."
HJR1041,817809,"State government; prohibiting certain contracts and investments; publication."
HJR1042,819631,"Constitutional amendment; modifying method for selection of appointments for judicial office; ballot title; filing."
HJR1043,820913,"Oklahoma Constitution; investment of state funds; procedures; ballot title; filing."
HJR1044,820955,"Constitutional amendment; creating the Nonpartisan Commission on Legislative Apportionment; ballot title; filing."
HJR1045,821896,"Constitutional amendment; tobacco settlement; requiring certain percentage of earnings directed for certain purpose be made available for pediatric cancer research; ballot title; filing."
HJR1046,822435,"Joint Resolution removing names from State Capitol rotunda; effective date."
HJR1047,821713,"Oklahoma Constitution; appropriations; limits; ballot title; filing."
HJR1048,823255,"U.S. Constitutional convention; calling for a convention pursuant to Article V of the U.S. Constitution; distribution."
HJR1049,822499,"Oklahoma Constitution; Oklahoma Education Lottery Trust Fund; ballot title; filing."
HJR1050,823182,"Oklahoma Constitution; sales tax; Oklahoma Department of Wildlife Conservation; fees; lands; ballot title; filing."
HJR1051,822841,"Oklahoma Constitution; ad valorem millage rates; legislation; ballot title; filing."
HJR1052,823406,"Constitutional amendment; vote of the people; alcoholic beverages; modifying regulation of sales and distribution; ballot title; filing."
HJR1053,823053,"A Joint Resolution eliminating the Oklahoma State Regents for Higher Education; ballot title; filing."
HJR1054,822421,"A Joint Resolution deleting language stating institutions of higher education receive direct legislative appropriations; repealer; ballot title; filing."
HJR1055,822686,"Oklahoma Constitution; Constitutional Reserve Fund; appropriations; ballot title; filing."
HJR1056,822492,"Constitutional amendment; requiring suspension of certain judges; ballot title; filing."
HJR1057,822652,"Constitutional amendment; tobacco settlement; requiring certain percentage of earnings directed for certain purpose be made available for pediatric cancer research; ballot title; filing."
HJR1058,823320,"Revenue and taxation; imposing additional tax levy upon cigarettes; effective date; emergency."
HJR1059,823393,"Constitutional amendment; providing protections for entities and individuals that refuse certain acts which violate a sincerely held religious belief; ballot title; filing."
HJR1060,822921,"Oklahoma Constitution; consumer sales tax; corporate income tax; flat rate; ballot title; filing."
HJR1061,824312,"Constitutional amendment; modifying method for selection of candidates for judicial office; ballot title; filing."
HJR1062,823758,"Constitutional amendment; repealing section prohibiting the use of public monies or property for sectarian or religious purposes; ballot title; filing."
HJR1063,823725,"Constitutional amendment; modifying authority of the Supreme Court; ballot title; filing."
HJR1064,824311,"Constitutional amendment; providing method for establishing rules of conduct for judges and attorneys; ballot title; filing."
HJR1065,824011,"Constitutional amendment; modifying method for selection of candidates for judicial office; ballot title; filing."
HJR1066,823761,"Constitutional amendment; creating the Judicial Reform Amendment; ballot title; filing."
HJR1067,824010,"Oklahoma Constitution; obligations; State Capitol; ballot title; filing."
HJR1068,823839,"Constitutional amendment; clarifying language; ballot title; filing."
HJR1069,862022,"Constitutional amendment; modifying jurisdiction of the Supreme Court; ballot title; filing."
HJR1070,864440,"Approving certain subject matter standards adopted by the State Board of Education with instruction; distribution; emergency."
HJR1071,864464,"Disapproving certain subject matter standards adopted by the State Board of Education with instruction; distribution; emergency."
HJR1072,868840,"Approving and disapproving certain proposed permanent rules of Oklahoma state agencies; distribution."
HJR1073,877304,"Disapproving proposed permanent rules of the Oklahoma Department of Human Services; stating legislative intent; directing distribution."
SB1,795308,"State government; creating Elimination of Non-Essential Governmental Spending Act; abolishing agencies; repealer. Effective date."
SB2,795243,"Alzheimer's disease; creating Advisory Council on the Effect of Alzheimer's Disease in Oklahoma."
SB3,794006,"Native American Cultural Center and Museum; modifying fund to which certain revenues deposited."
SB4,793905,"Education; creating Teaching Professional Compensation Act. Effective date."
SB5,793987,"Schools; providing immunity from liability for education employees for use of reasonable force."
SB6,794251,"Public safety; authorizing OSBI clothing allowance. Effective date."
SB7,794105,"Social work; narrowing scope of certain exemption. Effective date."
SB8,793692,"OLERS Board; amending membership; making language gender neutral. Effective date."
SB9,795067,"Genetic counseling; permitting certain entities to provide certain information to parents; providing standards for information. Effective date."
