bill_number,bill_id,title
HB1224,611926,"Create a Legislative Economic Development Investigative and Oversight Committee, to provide for its composition and duties, to make an appropriation therefor, and to declare an emergency."
HB1225,611872,"Establish a special order shipping license and to provide for the direct shipment of wine to consumers."
HB1226,611885,"Create a work-share program available to employers during times of economic distress."
HB1227,612008,"Reduce state government reliance on video lottery proceeds, to revise the distribution of video lottery proceeds, and to dedicate certain deposits and income from the education enhancement trust fund."
HB1228,611917,"Repeal the prohibition against carrying permitted concealed weapons in the state capitol."
HB1229,611908,"Provide for the reporting of certain person's names to the National Instant Criminal Background Check System."
HB1230,611956,"Revise certain provisions concerning the county tax levy for highways and bridges and to permit counties to levy the existing highway and bridge reserve fund tax to make necessary road and bridge improvements."
HB1231,611834,"Require the Board of Finance to consider an increase in the state mileage rate under certain circumstances."
HB1232,611982,"Clarify certain provisions relating to the issuance of permits for outdoor advertising signs, displays, or devices."
HB1233,612012,"Provide for the recall of certain state and local elected officials."
HB1234,611928,"Require notice to property owners in certain eminent domain cases."
HB1235,611898,"Revise the state aid to education formula for school fiscal years 2015 and 2016."
HB1236,611918,"Establish the school innovation and emergency fund."
HB1237,612068,"Establish a comprehensive evaluation of the Common Core State Standards."
HB1238,611802,"Provide for the impoundment of license plates after multiple driving under the influence offenses."
HB1239,611856,"Revise the financial eligibility requirements to obtain certain medical assistance."
HB1240,611939,"Prohibit the performance of abortions due to Down syndrome and to provide a penalty therefor."
HB1241,611931,"Prohibit the dismemberment or decapitation of certain living unborn children and to provide penalties therefore."
HB1242,611820,"Revise certain provisions concerning the township snow removal reserve fund."
HB1243,612062,"Supplant the Common Core Standards."
HB1244,611975,"Assist certain qualified employees with health insurance and to make an appropriation therefor."
HB1245,611955,"Provide for certain exceptions from the assisted living center regulations."
HB1246,612058,"Increase the maximum bet limit and to eliminate the award limit on video lottery games."
HB1247,612084,"Revise certain provisions for the economic development partnership fund."
HB1248,611805,"Regulate the state of South Dakota's relationship to certain presidential executive orders and decrees."
HB1249,612075,"Revise the required hours in a school term for certain grade levels."
HB1250,612069,"Provide for a coordinated effort to assist victims of human trafficking."
HB1251,611850,"Protect the citizens, businesses, clergy, and other persons of South Dakota regarding actions pertaining to views on sexual orientation or preference and to provide for their defense."
HB1252,612023,"Improve the work force development in South Dakota."
HB1253,611977,"Ensure the rights of gun owners statewide and protect the residents of South Dakota from federal gun regulations."
HB1254,611854,"Provide for producer payback for distributed generation to small-scale renewable energy systems."
HB1255,612479,"Provide for regulation of certain short-term, small dollar consumer loans and to provide a penalty therefor."
HB1256,612290,"Increase opportunities and funding for school districts to apply for jobs for America's graduates programs and to make an appropriation therefor."
HB1257,612242,"Clarify certain autism spectrum disorders insurance coverage."
HB1258,612385,"Allow for an affirmative defense of driving under the influence of prescription drugs in certain cases."
HB1259,612144,"Specify certain requirements relating to temporary child custody hearings."
HB1260,612433,"Extend the time period for a party to object to a written confirmation of certain grain contracts before the written confirmation is sufficient to indicate a contract for sale has been made between the parties."
HB1261,612192,"Authorize the Transportation Commission to award grants to replace, repair, and renovate county and township bridges and to make an appropriation therefor."
HCR1001,582775,"Encouraging school districts to build on their individual strengths by working together with other school districts to provide a rich educational opportunity for all students."
HCR1002,582798,"Recognizing the teacher shortage in this state and the difficulties school districts in South Dakota face in attracting and retaining qualified teachers."
HCR1003,598767,"Recognizing the outstanding public service of President Calvin Coolidge and his support of Mount Rushmore."
HCR1004,602940,"Recognizing Hot Springs as ""The Veterans Town."""
HCR1005,602753,"Urging Congress and the President to secure the blessings of life and liberty for our posterity."
HCR1006,604744,"Recognizing the anniversary of the addition of the words ""under God"" to the United States Pledge of Allegiance."
HCR1007,604752,"Petitioning Congress to provide for an audit of the Federal Reserve Bank."
HCR1008,606462,"Urging the South Dakota Board of Education to refrain from any efforts to further expand the Common Core State Standards or any other multistate educational standards in the state and to establish a plan to end the state's involvement with such current standards by June 30, 2017."
HCR1009,607558,"Urging the federal government to enforce United States immigration laws and not grant amnesty to those who have entered the United States illegally."
HCR1010,610006,"Requesting the Committee on Government Operations and Audit to conduct hearings relating to the operations of the Governor's Office of Economic Development."
HCR1011,611949,"Endorsing Taiwan's participation as an observer in the International Civil Aviation Organization (ICAO) and the thirtieth anniversary of sister state relations with the Province of Taiwan in the Republic of China (Taiwan) and Taiwan's inclusion in the Trans Pacific Partnership (TPP)."
HCR1012,613558,"Recognizing the honor and remember flag as the designated symbol of South Dakota's concern and commitment to honoring and remembering all members of the United States Armed Forces who have lost their lives while serving, or as a result of service, and their families."
HCR1013,614629,"Commemorating the 200th anniversary of the War of 1812 and ""The Star Spangled Banner"", and recognizing the historical significance, heroic human endeavor, and sacrifices of members of the United States Army, Marine Corps, Navy, Revenue Marine Service, and state militias, during and since the War of 1812."
HCR1014,614599,"Demanding the end of federal deficit spending, the repayment of national debt, and the beginning of balanced budgets and sound U.S. fiscal policy."
HCR1015,614718,"In support of protecting American sovereignty and defending individual second amendment rights from United Nations interference."
HCR1016,614686,"Urging the federal government to enforce United States immigration laws and not grant amnesty to those who have entered the United States illegally."
HCR1017,616322,"Urging Congress, the White House Office of National Drug Control Policy (ONDCP), the United States Department of Justice, and the United States Drug Enforcement Administration (DEA) to recognize industrial hemp as a valuable agricultural commodity."
HCR1018,619110,"Recognizing Chronic Obstructive Pulmonary Disease (COPD) as a serious and chronic disease in South Dakota."
HCR1019,619025,"Petitioning Congress to reauthorize federally provided terrorism reinsurance for insurers."
HCR1020,625045,"Recognizing the 22nd anniversary of the Khojaly tragedy which resulted in the loss of over six hundred lives."
HCR1021,624931,"Urging the United States Department of Agriculture to withdraw certain rules imperiling the South Dakota livestock industry."
HCR1022,626253,"Concerning U.S. EPA-proposed greenhouse gas emission standards for new and existing fossil-fueled power plants."
HCR1023,626289,"Rejecting the Common Core State Standards plan."
HCR1024,626323,"Petitioning President Obama to publicly condemn China for its aggressive program of cyber warfare and espionage against the United States of America."
HCR1025,627028,"Reaffirming the value of South Dakota's groundwater resources and recognizing the need for ongoing evaluation of our groundwater management."
HCR1026,627095,"Urging restoration of funding to the railroad trust fund."
HCR1027,627153,"Commending, honoring, and thanking each of the current and former Congressmen and Congresswomen who have served South Dakota."
HCR1028,627254,"Urging Congress to repeal and defund the Patient Protection and Affordable Care Act."
HCR1029,627002,"Honoring World Champion Saddle Bronc Champion Chad Ferley of Oelrichs, South Dakota."
HCR1030,627246,"Honoring National Finals Rodeo Barrel Racing Champion Lisa Lockhart of Oelrichs, South Dakota."
HCR1031,627318,"Urging Congress to provide federal funding in lieu of property taxes on Indian trust lands."
HCR1032,627393,"Expressing support for the people of the Red Shirt community on the Pine Ridge Reservation."
HJR1001,602711,"Proposing and submitting to the electors at the next general election an amendment to Article III, section 25 of the Constitution of the State of South Dakota, relating to the authorization of roulette, keno, and craps in the City of Deadwood."
HJR1002,604647,"Proposing and submitting to the electors at the next general election an amendment to Article III, section 6 of the Constitution of the State of South Dakota, relating to legislative term limits."
HJR1003,607570,"Proposing and submitting to the electors at the next general election an amendment to Article III, section 6 of the Constitution of the State of South Dakota, to revise term limits for legislators."
HJR1004,607660,"Making formal application to Congress to call an Article V convention of the states for the sole purpose of proposing a federal balanced budget amendment."
HJR1005,612043,"To apply for a Convention of the States under Article V of the Constitution of the United States."
HJR1006,611951,"Proposing and submitting to the electors at the next general election an amendment to Article XI of the Constitution of the State of South Dakota, relating to revenue and expenditure limits for the State of South Dakota."
HJR1007,612522,"To refer to the voters the question of whether the state should expand Medicaid pursuant to the Affordable Care Act."
HC1001,598820,"Honoring the 2013 Dakota Valley High School Panthers Volleyball Team."
HC1002,598785,"Honoring the 2013 Canton High School football team."
HC1003,599134,"Honoring South Dakota's Army and Air National Guard outstanding personnel award winners."
HC1004,602975,"Honoring, commending, and thanking South Dakota Highway Patrol Major Randy Hartley upon his retirement, for his many dedicated years of service to South Dakotans as a highway patrolman."
HC1005,602482,"Honoring, commending, and thanking South Dakota Highway Patrol Port Manager Larry Bryant, upon his retirement, for his many dedicated years of service to South Dakotans."
HC1006,602790,"Honoring, commending, and thanking South Dakota Highway Patrol Inspector Galen Roark upon his retirement, for his many dedicated years of service to South Dakotans."
HC1007,602330,"Honoring, commending, and thanking South Dakota Highway Patrol Trooper Larry Englund upon his retirement for his many dedicated years of service to South Dakotans as a highway patrolman."
HC1008,602641,"Honoring, commending, and thanking South Dakota Highway Patrol Sergeant Scott Knisley, upon his retirement, for his many dedicated years of service to South Dakotans as a highway patrolman."
HC1009,606647,"Commending and honoring Staff Sergeant Sam Schaefers for his selection as the South Dakota Army National Guard Noncommissioned Officer of the Year."
HC1010,606591,"Commending and honoring Specialist Dalton Deboer for his selection as the South Dakota Army National Guard Soldier of the Year."
HC1011,606318,"Commending and honoring Senior Master Sergeant Zona Hornstra for her selection as the South Dakota Air National Guard Senior Noncommissioned Officer of the Year."
HC1012,606863,"Commending and honoring Chief Warrant Officer Two Benjamin Smetana for his selection as the South Dakota Army National Guard Warrant Officer of the Year."
HC1013,606770,"Commending and honoring First Lieutenant Richard Bauman for his selection as South Dakota Army National Guard Officer of the Year."
HC1014,606924,"Commending and honoring Technical Sergeant Christopher Wilsey for his selection as the South Dakota Air National Guard Noncommissioned Officer of the Year."
HC1015,606741,"Commending and honoring Senior Airman Kammi Fiegen for her selection as the South Dakota Air National Guard Airman of the Year."
HC1016,606709,"Commending and honoring Chief Master Sergeant Randy Wingen for his selection as the South Dakota Air National Guard Outstanding First Sergeant of the Year."
HC1017,606803,"Honoring, commending, and thanking South Dakota Highway Patrol Trooper Shane Severyn upon his retirement, for his many dedicated years of service to South Dakotans as a highway patrolman."
HC1018,608783,"Recognizing the outstanding players from the West Central High School Football Team who were named to the Class 11A All-State Football Team."
HC1019,608547,"Congratulating and commending the West Central High School Football Team for winning the 2013 Class 11A State Football Championship."
HC1020,608928,"Commending and honoring Ms. Bethany Buell Firsick, 2013 National Champion Pole Vaulter."
HC1021,608978,"Commending and honoring Alexa Duling, a 2013 Walter Byers Postgraduate Scholarship recipient."
HC1022,610237,"Congratulating and celebrating the FIRST LEGO League (FLL) championship teams of South Dakota."
HC1023,613287,"Commending and honoring the 2013 Habitat for Humanity--South Dakota Habitat Supporters of the Year."
HC1024,613352,"Commending and honoring Ben Halbkat, of Huron, South Dakota, for receiving the rank of the Eagle Scout in the Boys Scouts of America."
HC1025,614773,"Honoring Chief Warrant Officer Two Benjamin J. Smetana for his service as a member of the South Dakota Army National Guard."
HC1026,616481,"Commending and honoring the Community Bank in Avon, South Dakota, for their continued entrepreneurial spirit, hard work, and dedication to the community for the past 100 years."
HC1027,616166,"Commending several of Lincoln High School's athletic programs whose participants, through hard work and devotion, excelled on the field and in the classroom, never took their eyes off the prize, and as a result, were rewarded with state championships."
HC1028,617985,"Commending and honoring Ann Anderson, fifth grade science teacher at Belle Fourche Middle School."
HC1029,618120,"Commending and honoring Erin Marsh, second and third grade teacher at the Pierre Indian Learning Center."
HC1030,619744,"Commending and honoring Robert (Bob) Graff, a member of the Agar-Blunt-Onida School District Board of Education, on his selection as the Associated School Boards of South Dakota Outstanding School Board Member of South Dakota for 2013."
HC1031,619645,"Congratulating and commending the White River High School Boys Basketball Team for its State B Championship and successful 2012-2013 season."
HC1032,619842,"Honoring the 2013 Todd County Boys Cross Country Team."
HC1033,624291,"Honoring Kerri Young of Mitchell, South Dakota, on her outstanding achievement in Mitchell High School girls basketball."
HC1034,627148,"Honoring and commending the 2013 Avon High School Football Team."
HC1035,627234,"Commending and honoring the 2014 National Merit Semifinalists Jessica Daniels, Angela Liu, Kyle McKee, Zachary Person, Emma Ward, and Tyler Wilson, of Sioux Falls Washington High School for their outstanding academic achievements."
HC1036,627123,"Commending and honoring the 2013 Boys Track 4x200 and the 4x400 meter relay teams from Washington High School for their outstanding athletic performances at the 2013 State AA Track Meet."
HC1037,627224,"Commending and honoring the 2013 Boys State AA Track Champions of Washington High School of Sioux Falls, South Dakota, for their outstanding athletic performance."
HC1038,627068,"Commending and honoring the 2013 South Dakota Girls AA Softball Champions of Sioux Falls Washington High School for their outstanding athletic performance."
HC1039,627206,"Commending and honoring the 2013-2014 Competitive Dance State AA Champions from Sioux Falls Washington High School for their outstanding performance."
HC1040,627083,"Honoring the Sioux Falls Washington High School Girls Bowling Team for its outstanding athletic performance and 2013 state championship."
HC1041,627240,"Honoring Nathan Gerry, Jonah Warwick, Christian Parker, and Michaela Mayer from Washington High School for their first place finishes at the 2013 Boys and Girls State Class AA Track Meet."
HC1042,627185,"Congratulating and honoring the 2014 South Dakota First Tech Challenge (FTC) Robotics Team ""Loading…""."
HC1043,627219,"Commending Mabel Dubbelde Heinemann on her 100th birthday."
HC1044,627169,"Commending and honoring National Merit Semifinalists Hannah Asfeldt, Sean Calhoun, Pranam Dey, Shelley Feng, Colten Fisher, and Jeremy Mettler of Sioux Falls Lincoln High School for their outstanding academic achievements."
HC1045,627074,"Commending and honoring the 2013 Lincoln High School State Tennis Tournament Flight Three Individual Champion Austin Noldner and the Flight Two Doubles Champions Austin Noldner and Brent Heflin for their outstanding athletic performances."
HC1046,627196,"Congratulating and commending the Lincoln High School Football Team for winning the 2013 State AAA Football Championship."
HC1047,627140,"Commending and honoring Tom Vining of Sioux Falls Lincoln High School for winning the individual South Dakota 2013 Boys State AA High School Golf Championship with his outstanding athletic performance."
HC1048,627114,"Commending and honoring the 2013 Girls AA Lincoln High School Basketball Team for winning the State AA Girls Basketball Championship."
HC1049,627179,"Commending and honoring the 2013 Boys Cross Country State Class AA Champions of Sioux Falls Lincoln High School for their outstanding athletic performance."
HC1050,627040,"Honoring the Madison High School Boys Basketball Team for its 2013 Boys State A Basketball Championship."
HC1051,627098,"Commending and honoring the West Central High School Band for its accomplishments."
HC1052,627019,"Commending and honoring the West Central High School FFA chapter."
HC1053,627045,"Congratulating and recognizing the football team from Arlington High School for their runner-up finish in the 2013 Class 9AA Football Playoffs."
HC1054,627163,"Congratulating and recognizing Anita Boeck from Arlington High School as the Region 3 volleyball coach of the year."
HC1055,627200,"Commending and honoring St. Joseph Elementary School in Pierre, South Dakota, for receiving the National Blue Ribbon Award."
HC1056,627107,"Recognizing the commemoration of the 25th anniversary of the location filming of Dances With Wolves in South Dakota."
HC1057,627127,"Recognizing and honoring the American Association of State Troopers 2013 Trooper of the Year recipient, Trooper Andrew Steen."
HC1058,626999,"Honoring Sonyah Shae Clifford of Rockyford, South Dakota, for her outstanding job representing Indian rodeo and being named Miss Indian Rodeo 2013 at the Indian National Finals Rodeo."
HC1059,627024,"Honoring and commending Shelby Specht of Sioux Falls, South Dakota, for receiving a 2014 Prudential Spirit of Community Award."
HC1060,627467,"Commending the West Central High School Girls Soccer Team for its 2013 State Soccer Championship."
HC1061,627429,"Honoring Gavin Brucklacher as the recipient of a Prudential Spirit of Community Award for 2014."
SB1,582856,"Provide for the selection of the chair and vice chair of the Executive Board of the Legislative Research Council, to revise the membership of the Executive Board, to provide for the term of each constituted Executive Board, to provide for the year-round governance of the Legislative Research Council by the Executive Board, and to provide for continuity of board membership."
SB2,582756,"Provide for the delayed arrest, under certain circumstances, in regard to certain outstanding warrants for victims of domestic abuse with minor children."
SB3,582871,"Provide for continuity in the judicial review of certain lawsuits, complaints, and petitions between parties to a petition for certain protection orders."
SB4,582869,"Ensure notice to the respondent and opportunity for the respondent to be heard prior to enforcement of certain foreign domestic protection orders."
SB5,582824,"Permit the court reciprocal discretion to hear certain petitions for protection orders due to domestic abuse and for protection orders due to stalking or physical injury."
SB6,582759,"Establish the crime of committing certain acts of domestic abuse in the presence of a minor child."
SB7,582808,"Modify the persons eligible for protection from domestic abuse and to revise certain terminology."
SB8,582795,"Revise certain provisions concerning the assessment and taxation of real property."
SB9,582838,"Revise provisions related to the Interim Appropriations Committee."
SB10,582864,"Revise certain provisions related to the annual budget report submission."
SB11,582792,"Require the submission to the Legislature of a financial plan that assesses the long-term financial implications of current and proposed policies, programs, and assumptions."
SB12,582794,"Update references to certain federal motor carrier regulations."
SB13,582821,"Make use of hand-held mobile telephones while driving a commercial motor vehicle a serious traffic violation and to update certain references to federal regulations regarding the issuance of commercial driver licenses."
SB14,582837,"Revise certain provisions pertaining to the Board of Examiners of Counselors and Marriage and Family Therapists."
SB15,582816,"Authorize the South Dakota Building Authority and the Board of Regents to finance, design, construct, furnish, and equip a football stadium facility at South Dakota State University, to make an appropriation therefor, and to declare an emergency."
SB16,582796,"Authorize the Board of Regents to purchase improved real property in Brookings County and to make an appropriation therefor."
SB17,582772,"Authorize the Board of Regents to purchase improved real property in the city of Brookings and to make an appropriation therefor."
SB18,582854,"Authorize the Board of Regents to contract for the construction of a greenhouse on the campus of Northern State University and to make an appropriation therefor."
SB19,582802,"Increase expenditure authority to accommodate donations to projects at Black Hills State University and Northern State University, to authorize the acquisition and renovation of improved real property for a project at Dakota State University, and to declare an emergency."
SB20,582817,"Authorize the Board of Regents to demolish buildings on the campus of South Dakota State University and to make an appropriation therefor."
SB21,582832,"Revise certain provisions regarding the collection and setting of 24/7 sobriety program fees and regarding the monitoring of ignition interlock testing."
SB22,582761,"Authorize the issuance of citations for certain livestock inspection violations."
SB23,582809,"Revise certain provisions relating to deceptive trade practices, including unordered property or services, lodging reservation and cancellation, violation penalties, attorney's fees, entry rights for landlords and tenants, debit card theft, and organized retail crime."
SB24,582786,"Revise certain provisions relating to pseudoephedrine, ephedrine, or phenylpropanolamine sales."
SB25,582819,"Establish the procedure to forfeit personal property in child pornography, human trafficking, child solicitation or exploitation cases, and to direct money from the forfeitures."
SB26,582787,"Establish certain electronic crime victim notification procedures."
SB27,582826,"Make an appropriation from the coordinated natural resources conservation fund to the State Conservation Commission and to declare an emergency."
SB28,582842,"Make an appropriation for certain costs related to mountain pine beetle suppression and to declare an emergency."
SB29,582791,"Revise certain provisions in statute and administrative rules regarding the regulation of campgrounds and the license fee for campgrounds and to repeal administrative rules regulating primitive campgrounds, full-service campgrounds, limited service campgrounds, and temporary campgrounds."
SB30,582834,"Provide for the definition of an advanced practice registered nurse, to remove certification as a function of the Board of Nursing in issuing a license to a certified registered nurse anesthetist, and to change the nurses' education loan assistance program to a scholarship program."
SB31,582774,"Make an appropriation to reimburse certain family physicians who have complied with the requirements of the recruitment assistance program and to declare an emergency."
SB32,582779,"Revise previous appropriations for National Guard armory construction, to make an appropriation for a land purchase adjacent to the Watertown armory, and to declare an emergency."
