bill_id,date,action
214631,2010-12-30,"House Introduced 1/5/2011 and Referred to Election Law; House Journal  8, PG.131 "
214631,2011-01-13,"House Public Hearing: 1/18/2011 2:00 PM Legislative Office Building 308 "
214631,2011-01-26,"House Executive Session: 2/1/2011 10:30 Amendment Legislative Office Building 308 "
214631,2011-02-03,"House Committee Report: Inexpedient to Legislate for Feb 9 (Vote 18-0; Consent Calendar); House Calendar 12, PG.201 "
214631,2011-02-09,"House Inexpedient to Legislate: Motion Adopted Voice Vote; House Journal  16, PG.311 "
214632,2010-12-30,"House Introduced 1/5/2011 and Referred to Judiciary; House Journal  8, PG.131 "
214632,2011-01-05,"House Public Hearing: 1/11/2011 2:30 PM Legislative Office Building 208 "
214632,2011-01-19,"House Division II Work Session: 1/27/2011 1:30 PM Legislative Office Building 208 "
214632,2011-02-02,"House Division II Work Session: 2/10/2011 Legislative Office Building 208 3:00 PM or Following Public Hearing "
214632,2011-02-15,"House Executive Session: 2/15/2011 Legislative Office Building 208 Following House Session "
214632,2011-02-16,"House Committee Report: Inexpedient to Legislate for Feb 23 (Vote 15-0; Consent Calendar); House Calendar 15, PG.270 "
214632,2011-02-23,"House Inexpedient to Legislate: Motion Adopted Voice Vote; House Journal  21, PG.461 "
214633,2011-01-03,"House Introduced 1/5/2011 and Referred to Election Law; House Journal  8, PG.131 "
214633,2011-01-13,"House Public Hearing: 1/18/2011 11:00 Amendment Legislative Office Building 308 "
214633,2011-01-26,"House Executive Session: 2/1/2011 10:30 Amendment Legislative Office Building 308 "
214633,2011-02-03,"House Committee Report: Inexpedient to Legislate for Feb 9 (Vote 18-0; Consent Calendar); House Calendar 12, PG.201 "
214633,2011-02-09,"House Inexpedient to Legislate: Motion Adopted Voice Vote; House Journal  16, PG.311 "
214634,2011-01-03,"House Introduced 1/5/2011 and Referred to State-Federal Relations and Veterans Affairs; House Journal  8, PG.131 "
214634,2011-01-18,"House Public Hearing: 1/27/2011 9:30 Amendment Legislative Office Building 203 ==Executive Session to Follow== "
214634,2011-02-09,"House Retained in Committee; House Calendar 27, PG.825 "
214634,2011-05-10,"House Retained Bill - Subcommittee Work Session: 5/19/2011 9:30 Amendment Legislative Office Building 203 "
214634,2011-09-14,"House ==CANCELLED== Retained Bill - Full Committee Work Session: 10/6/2011 9:30 Amendment Legislative Office Building 203 "
214634,2011-09-27,"House Retained Bill - Executive Session: 10/6/2011 9:30 Amendment Legislative Office Building 203 "
214634,2011-10-06,"House Committee Report: Inexpedient to Legislate for Jan 4 (Vote 9-1; Consent Calendar) "
214635,2010-12-22,"House Introduced 1/5/2011 and Referred to Labor, Industrial and Rehabilitative Services; House Journal  8, PG.128 "
214635,2011-01-10,"House ==CANCELLED== Public Hearing: 1/13/2011 2:00 PM Legislative Office Building 307 "
214635,2011-01-13,"House Public Hearing: 1/18/2011 1:45 PM Legislative Office Building 307 "
214635,2011-02-02,"House Subcommittee Work Session: 2/16/2011 9:00 Amendment Legislative Office Building 303 "
214635,2011-02-16,"House Subcommittee Work Session: 3/1/2011 9:30 Amendment Legislative Office Building 303 "
214635,2011-02-23,"House Executive Session: 3/1/2011 1:00 PM Legislative Office Building 307 "
214635,2011-03-03,"House Committee Report: Ought to Pass with Amendment #0567h for Mar 15 (Vote 15-0; Consent Calendar); House Calendar 22, PG.535-536 "
214635,2011-03-03,"House Proposed Committee Amendment #2011-0567h; House Calendar 23, PG.581 "
214635,2011-03-15,"House Removed from Consent Calendar (Rep Giuda); House Journal  26, PG.694 "
214635,2011-03-17,"House Amendment #0567h Failed, Regular Calendar 122-152; House Journal  30, PG.1026-1028 "
214635,2011-03-17,"House Floor Amendment #2011-0917h (New Title) (Rep Infantine) Adopted, Regular Calendar 134-133; House Journal  30, PG.1028-1030 "
214635,2011-03-17,"House Call on Speaker to Vote (Rep Soltani): Motion Failed Division Vote 56-209; House Journal  30, PG.1030 "
214635,2011-03-17,"House Ought to Pass with Amendment #0917h(NT): Motion Adopted Regular Calendar 216-51; House Journal  30, PG.1026-1032 "
214635,2011-03-23,"Senate Introduced and Referred to Commerce; Senate Journal 11, Pg.190 "
214635,2011-03-24,"Senate Hearing: 3/29/11, Room 102, Legislative Office Building, 10:00 a.m.; Senate Calendar 17 "
214635,2011-04-27,"Senate Committee Report: Ought to Pass with Amendment #2011-1581s, 5/4/11; Senate Calendar 22 "
214635,2011-05-04,"Senate Committee Amendment 1581s, Amendment Adopted, Voice Vote; Senate Journal 15, Pg.294 "
214635,2011-05-04,"Senate Sen. Houde Floor Amendment #2011-1713s, Amendment Failed, Voice Vote; Senate Journal 15, Pg.294 "
214635,2011-05-04,"Senate Ought to Pass with Amendment 1581s, Motion Adopted, Voice Vote; OT3rdg; Senate Journal 15, Pg.294 "
214635,2011-05-04,"Senate Passed by Third Reading Resolution; Senate Journal 15, Pg.311 "
214635,2011-05-18,"House House Non-Concurs with Senate Amendment #1581s and Requests C of C (Rep Daniels): Motion Adopted Voice Vote; House Journal  44, PG.1531 "
214635,2011-05-18,"House Speaker Appoints: Reps Daniels, Infantine, Laware, and Goley; House Journal  44, PG.1531 "
214635,2011-05-25,"Senate Sen. Prescott Accedes to House Request for Committee of Conference, Motion Adopted, Voice Vote; Senate Journal 18, Pg.388 "
214635,2011-05-25,"Senate President Appoints: Senators White, Sanborn and Houde; Senate Journal 18, Pg.388 "
214635,2011-06-06,"House Conference Committee Meeting: 6/8/2011 9:00 Amendment Legislative Office Building 307 ==RECESSED== "
214635,2011-06-13,"House Conference Committee Meeting: 6/14/2011 9:00 Amendment Legislative Office Building 307 "
214635,2011-06-14,"Senate Conferee Change; Senator Carson Replaces Senator Sanborn "
214635,2011-06-15,"Senate Conferee Change; Senator Barnes Replaces Senator White "
214635,2011-06-16,"Senate Conference Committee Report #2011-2380c; Senate Amendment + New Amendment, Filed "
214635,2011-06-22,"Senate Conference Committee Report 2380c; Adopted, Voice Vote "
214635,2011-06-22,"House Conference Committee Report #2380c Adopted, Voice Vote; House Journal  57, PG.1840 "
214635,2011-06-22,"Senate Enrolled Bill Amendment #2531e Adopted "
214635,2011-06-22,"House Enrolled Bill Amendment #2011-2531e(NT) Adopted; House Journal  57, PG.1859 "
214635,2011-06-22,"Senate Enrolled "
214635,2011-06-22,"House Enrolled; House Journal  57, PG.1860 "
214635,2011-07-18,"House Signed By Governor 07/13/2011; Effective 09/11/2011; Chapter 0254 "
214636,2010-12-22,"House Introduced 1/5/2011 and Referred to Resources, Recreation and Development; House Journal  8, PG.128 "
214636,2011-01-06,"House Public Hearing: 1/25/2011 10:45 Amendment Legislative Office Building 305 "
214636,2011-01-26,"House Subcommittee Work Session: 2/1/2011 3:00 PM Legislative Office Building 305 "
214636,2011-02-01,"House Subcommittee Work Session: 2/8/2011 3:15 PM Legislative Office Building 305 "
214636,2011-02-17,"House Subcommittee Work Session: 2/23/2011 Legislative Office Building 305 3:00 PM or Immediately Following House Session "
214636,2011-02-22,"House Executive Session: 3/1/2011 1:00 PM Legislative Office Building 305 "
214636,2011-03-03,"House Committee Report: Ought to Pass with Amendment #0532h(NT) for Mar 15 (Vote 13-1; Consent Calendar); House Calendar 22, PG.539 "
214636,2011-03-03,"House Proposed Committee Amendment #2011-0532h (New Title); House Calendar 23, PG.581-582 "
214636,2011-03-15,"House Amendment #0532h (New Title) Adopted, Voice Vote; House Journal  26, PG.735-736 "
214636,2011-03-15,"House Ought to Pass with Amendment #0532h(NT): Motion Adopted Voice Vote; House Journal  26, PG.735-736 "
214636,2011-03-23,"Senate Introduced and Referred to Energy and Natural Resources; Senate Journal 11, Pg.190 "
214636,2011-03-31,"Senate Hearing: 4/7/11, Room 102, Legislative Office Building, 9:00 a.m.; Senate Calendar 18 "
214636,2011-04-07,"Senate Committee Report: Ought to Pass, 4/13/11; Senate Calendar 19 "
214636,2011-04-13,"Senate Ought to Pass, Motion Adopted, Voice Vote; OT3rdg; Senate Journal 12, Pg.247 "
214636,2011-04-13,"Senate Passed by Third Reading Resolution; Senate Journal 12, Pg.254 "
214636,2011-04-27,"House Enrolled; House Journal  40, PG.1386 "
214636,2011-04-27,"Senate Enrolled; Senate Journal 15, Pg.292 "
214636,2011-05-11,"House Signed by Governor 05/09/2011; Effective 05/09/2011; Chapter 0032 "
214637,2010-12-22,"House Introduced 1/5/2011 and Referred to Transportation; House Journal  8, PG.128 "
214637,2011-01-05,"House Public Hearing: 1/18/2011 10:00 Amendment Legislative Office Building 203 "
214637,2011-01-25,"House Executive Session: 1/26/2011 Legislative Office Building 203 Following Session "
214637,2011-01-26,"House Committee Report: Inexpedient to Legislate for Feb 9 (Vote 11-0; Consent Calendar); House Calendar 10, PG.148 "
214637,2011-02-09,"House Inexpedient to Legislate: Motion Adopted Voice Vote; House Journal  16, PG.316 "
214638,2010-12-22,"House Introduced 1/5/2011 and Referred to Criminal Justice and Public Safety; House Journal  8, PG.128 "
214638,2011-01-04,"House Public Hearing: 1/13/2011 10:00 Amendment Legislative Office Building 204 "
214638,2011-01-13,"House Subcommittee Work Session: 1/18/2011 9:00 Amendment Legislative Office Building 204 "
214638,2011-01-13,"House ==CANCELLED== Executive Session: 1/18/2011 1:00 PM Legislative Office Building 204 "
214638,2011-01-26,"House ==CANCELLED== Continued Executive Session: 2/3/2011 10:00 Amendment Legislative Office Building 204 "
214638,2011-02-03,"House Subcommittee Work Session: 2/8/2011 8:30 Amendment Legislative Office Building 204 "
214638,2011-02-16,"House Executive Session: 2/22/2011 10:00 Amendment Legislative Office Building 204 "
214638,2011-02-22,"House Majority Committee Report: Inexpedient to Legislate for Mar 2 (Vote 11-6; Regular Calendar); House Calendar 18, PG.391 "
214638,2011-02-22,"House Minority Committee Report: Ought to Pass; House Calendar 18, PG.391 "
214638,2011-03-02,"House Inexpedient to Legislate: Motion Failed Regular Calendar 167-168, Speaker Votes Yea; House Journal  25, PG.677-679 "
214638,2011-03-02,"House Recommit (Rep Bettencourt): Motion Adopted Voice Vote; House Journal  25, PG.679 "
214638,2011-03-02,"House Executive Session: 3/9/2011 10:00 Amendment Legislative Office Building 204 "
214638,2011-03-09,"House Retained in Committee; House Calendar 27, PG.823 "
214638,2011-08-18,"House Retained Bill - Subcommittee Work Session: 9/6/2011 11:00 Amendment Legislative Office Building 204 "
214638,2011-09-27,"House Retained Bill - Executive Session: 10/20/2011 10:00 Amendment Legislative Office Building 204 "
214638,2011-10-25,"House Committee Report: Inexpedient to Legislate for Jan 4 (Vote 11-6; Regular Calendar) "
214639,2010-12-22,"House Introduced 1/5/2011 and Referred to Environment and Agriculture; House Journal  8, PG.128  "
214639,2011-01-04,"House Public Hearing: 1/18/2011 1:00 PM Legislative Office Building 303 "
214639,2011-01-18,"House Executive Session: 1/25/2011 1:00 PM Legislative Office Building 308 "
214639,2011-01-25,"House Committee Report: Ought to Pass for Feb 9 (Vote 17-0; Consent Calendar); House Calendar 10, PG.146 "
214639,2011-02-09,"House Ought to Pass: Motion Adopted Voice Vote; House Journal  16, PG.311 "
214639,2011-02-09,"House Referred to Executive Departments and Administration; House Journal  16, PG.311 "
214639,2011-02-15,"House Public Hearing: 3/1/2011 1:00 PM Legislative Office Building 306 ==Executive Session To Follow== "
214639,2011-03-03,"House Committee Report: Ought to Pass for Mar 15 (Vote 12-0; Consent Calendar); House Calendar 22, PG.529 "
214639,2011-03-15,"House Ought to Pass: Motion Adopted Voice Vote; House Journal  26, PG.709 "
214639,2011-03-30,"Senate Introduced and Referred to Executive Departments and Administration; Senate Journal 12, Pg.243 "
214639,2011-04-20,"Senate Hearing: 4/28/11, Room 100, State House, 9:00 a.m.; Senate Calendar 21 "
214639,2011-04-28,"Senate Committee Report: Ought to Pass with Amendment #2011-1635s, New Title, 5/4/11; Senate Calendar 22 "
214639,2011-05-04,"Senate Committee Amendment 1635s, New Title, Amendment Adopted, Voice Vote; Senate Journal 15, Pg.303 "
214639,2011-05-04,"Senate Ought to Pass with Amendment 1635s, New Title, Motion Adopted, Voice Vote; OT3rdg; Senate Journal 15, Pg.303 "
214639,2011-05-04,"Senate Passed by Third Reading Resolution; Senate Journal 15, Pg.311 "
214639,2011-05-18,"House House Concurs with Senate Amendment #1635s(NT)(Reps Haefner and C.McGuire): Motion Adopted Voice Vote; House Journal  44, PG.1531 "
214639,2011-06-01,"Senate Enrolled; Senate Journal 20, Pg.546 "
214639,2011-06-01,"House Enrolled; House Journal  48, PG.1669 "
214639,2011-06-09,"House Signed By Governor 06/07/2011; Effective 08/06/2011; Chapter 0132 "
214640,2010-12-22,"House Introduced 1/5/2011 and Referred to Commerce and Consumer Affairs; House Journal  8, PG.128 "
214640,2011-01-05,"House Public Hearing: 1/13/2011 11:15 Amendment Legislative Office Building 302 Insurance/Consumer Regulation Div "
214640,2011-01-19,"House Subcommittee Work Session: 1/27/2011 10:00 Amendment Legislative Office Building 302 "
214640,2011-01-27,"House Subcommittee Work Session: 2/10/2011 9:00 Amendment Legislative Office Building 302 "
214640,2011-02-15,"House Subcommittee Work Session: 2/28/2011 10:00 Amendment Legislative Office Building 302 "
214640,2011-02-28,"House Subcommittee Work Session: 3/3/2011 2:40 PM Legislative Office Building 302 "
214640,2011-03-01,"House Executive Session: 3/9/2011 9:00 Amendment Legislative Office Building 302 "
214640,2011-03-09,"House Committee Report: Ought to Pass with Amendment #0554h for Mar 15 (Vote 17-0; Consent Calendar); House Calendar 22, PG.523 "
214640,2011-03-09,"House Proposed Committee Amendment #2011-0554h; House Calendar 23, PG.582-583 "
214640,2011-03-15,"House Amendment #0554h Adopted, Voice Vote; House Journal  26, PG.695 "
214640,2011-03-15,"House Ought to Pass with Amendment #0554h: Motion Adopted Voice Vote; House Journal  26, PG.695 "
214640,2011-03-23,"Senate Introduced and Referred to Commerce; Senate Journal 11, Pg.190 "
214640,2011-04-14,"Senate Hearing: 4/19/11, Room 102, Legislative Office Building, 9:40 a.m.; Senate Calendar 20 "
214640,2011-04-27,"Senate Committee Report: Ought to Pass with Amendment #2011-1584s, New Title, 5/4/11; Senate Calendar 22 "
214640,2011-05-04,"Senate Committee Amendment 1584s, New Title, Amendment Adopted, Voice Vote; Senate Journal 15, Pg.296 "
214640,2011-05-04,"Senate Ought to Pass with Amendment 1584s, New Title, Motion Adopted, Voice Vote; OT3rdg; Senate Journal 15, Pg.296 "
214640,2011-05-04,"Senate Passed by Third Reading Resolution; Senate Journal 15, Pg.311 "
214640,2011-05-18,"House House Concurs with Senate Amendment #1584s(NT) (Rep Hunt): Motion Adopted Voice Vote; House Journal  44, PG.1531 "
214640,2011-06-01,"Senate Enrolled; Senate Journal 20, Pg.546 "
214640,2011-06-01,"House Enrolled; House Journal  48, PG.1669 "
214640,2011-06-09,"House Signed By Governor 06/07/2011; Effective 01/01/2012; Chapter 0133 "
214641,2010-12-22,"House Introduced 1/5/2011 and Referred to Municipal and County Government; House Journal  8, PG.128 "
214641,2011-01-11,"House ===CANCELLED=== Public Hearing: 1/12/2011 1:00 PM Legislative Office Building 301 "
214641,2011-01-11,"House Public Hearing: 1/18/2011 10:00 Amendment Legislative Office Building 301 "
214641,2011-01-11,"House Executive Session: 1/18/2011 1:30 PM Legislative Office Building 301 ==TIME CHANGE (Orig 11:00 Amendment)== "
214641,2011-01-19,"House Committee Report: Ought to Pass for Jan 26 (Vote 12-0; Consent Calendar); House Calendar 9, PG.133 "
214641,2011-01-26,"House Ought to Pass: Motion Adopted Voice Vote; House Journal  14, PG.262 "
214641,2011-03-16,"Senate Introduced and Referred to Public and Municipal Affairs; Senate Journal 10, Pg.168 "
214641,2011-03-17,"Senate Hearing: 3/22/11, Room 101, Legislative Office Building, 10:20 a.m.; Senate Calendar 16 "
214641,2011-03-22,"Senate Committee Report: Ought to Pass, 3/30/11; Senate Calendar 17 "
214641,2011-03-30,"Senate Ought to Pass, Motion Adopted, Voice Vote; OT3rdg; Senate Journal 11, Pg.232 "
214641,2011-03-30,"Senate Passed by Third Reading Resolution; Senate Journal 11, Pg.240 "
214641,2011-04-13,"Senate Enrolled; Senate Journal 13, Pg.259 "
214641,2011-04-13,"House Enrolled; House Journal  37, Pg.1304 "
214641,2011-04-28,"House Signed by the Governor 04/25/2011; Effective 04/25/2011; Chapter 0004 "
214642,2010-12-22,"House Introduced 1/5/2011 and Referred to Resources, Recreation and Development; House Journal  8, PG.128 "
214642,2011-01-05,"House Public Hearing: 1/18/2011 1:30 PM Legislative Office Building 305 "
214642,2011-01-05,"House ==CANCELLED== Executive Session: 1/20/2011 1:00 PM Legislative Office Building 305 "
214642,2011-01-26,"House Subcommittee Work Session: 2/3/2011 9:00 Amendment Legislative Office Building 305 "
214642,2011-02-03,"House Subcommittee Work Session: 2/10/2011 3:00 PM Legislative Office Building 305 "
214642,2011-02-22,"House Executive Session: 3/1/2011 1:00 PM Legislative Office Building 305 "
214642,2011-03-03,"House Committee Report: Ought to Pass with Amendment #0563h(NT) for Mar 15 (Vote 14-0; Consent Calendar); House Calendar 22, PG.539 "
214642,2011-03-03,"House Proposed Committee Amendment #2011-0563h (New Title); House Calendar 23, PG.583 "
214642,2011-03-15,"House Amendment #0563h (New Title) Adopted, Voice Vote; House Journal  26, PG.736-737 "
214642,2011-03-15,"House Ought to Pass with Amendment #0563h(NT): Motion Adopted Voice Vote; House Journal  26, PG.736-737 "
214642,2011-03-23,"Senate Introduced and Referred to Energy and Natural Resources; Senate Journal 11, Pg.190 "
214642,2011-03-24,"Senate Hearing: 3/31/11, Room 102, Legislative Office Building, 9:30 a.m.; Senate Calendar 17 "
214642,2011-04-14,"Senate Committee Report: Ought to Pass with Amendment #2011-1440s, New Title, 4/20/11; Senate Calendar 20 "
214642,2011-04-20,"Senate Committee Amendment 1440s, New Title, Amendment Adopted, Voice Vote; Senate Journal 13, Pg.264 "
214642,2011-04-20,"Senate Ought to Pass with Amendment 1440s, New Title, Motion Adopted, Voice Vote; OT3rdg; Senate Journal 13, Pg.264 "
214642,2011-04-20,"Senate Passed by Third Reading Resolution; Senate Journal 13, Pg.270 "
214642,2011-05-04,"House House Non-Concurs with Senate Amendment #1440s(NT) and Rquests C of C (Rep Renzullo): Motion Adopted Voice Vote; House Journal  42, PG.1448 "
214642,2011-05-04,"House Speaker Appoints: Reps Baldasaro, Swinford, Bolster, and Parkhurst; House Journal  42, PG.1448 "
214642,2011-05-25,"Senate Sen. Odell Accedes to House Request for Committee of Conference, Motion Adopted, Voice Vote; Senate Journal 18, Pg.388 "
214642,2011-05-25,"Senate President Appoints: Senators Gallus, Barnes and Merrill; Senate Journal 18, Pg.388 "
214642,2011-06-01,"House Conference Committee Meeting: 6/7/2011 10:00 Amendment Legislative Office Building 203 "
214642,2011-06-16,"Senate Conference Committee Report; Not Signed Off "
214643,2010-12-22,"House Introduced 1/5/2011 and Referred to Education; House Journal  8, PG.128  "
214643,2011-01-11,"House Public Hearing: 1/18/2011 10:30 Amendment Legislative Office Building 207 "
214643,2011-01-19,"House ==CANCELLED== Executive Session: 1/25/2011 2:00 PM Legislative Office Building 207 "
214643,2011-01-26,"House Executive Session: 2/1/2011 2:00 PM Legislative Office Building 207 "
214643,2011-02-01,"House Retained in Committee; House Calendar 27, PG.823 "
214643,2011-09-09,"House Retained Bill - Subcommittee Work Session: 9/20/2011 1:00 PM Legislative Office Building 207 "
214643,2011-10-04,"House Retained Bill - Executive Session: 10/18/2011 10:00 Amendment Legislative Office Building 207 (If Necessary Continued 10/25/2011 10:00 Amendment Legislative Office Building 207) "
214644,2010-12-22,"House Introduced 1/5/2011 and Referred to Resources, Recreation and Development; House Journal  8, PG.128 "
214644,2011-01-05,"House Public Hearing: 1/18/2011 11:00 Amendment Legislative Office Building 305 "
214644,2011-01-05,"House Executive Session: 1/20/2011 1:00 PM Legislative Office Building 305 "
214644,2011-01-21,"House Committee Report: Ought to Pass with Amendment #0047h for Feb 9 (Vote 16-1; Consent Calendar); House Calendar 10, PG.147 "
214644,2011-01-21,"House Proposed Committee Amendment #2011-0047h; House Calendar 10, PG.1; House Calendar 10, PG.163 "
214644,2011-02-09,"House Amendment #0047h Adopted, Voice Vote; House Journal  16, PG.314 "
214644,2011-02-09,"House Ought to Pass with Amendment #0047h: Motion Adopted Voice Vote; House Journal  16, PG.314 "
214644,2011-03-16,"Senate Introduced and Referred to Energy and Natural Resources; Senate Journal 10, Pg.168 "
214644,2011-03-17,"Senate Hearing: 3/24/11, Room 102, Legislative Office Building, 9:45 a.m.; Senate Calendar 16 "
214644,2011-03-24,"Senate Committee Report: Ought to Pass, 3/30/11; Senate Calendar 17 "
214644,2011-03-30,"Senate Ought to Pass, Motion Adopted, Voice Vote; Refer to Finance Rule 4-3; Senate Journal 11, Pg.211 "
214644,2011-04-13,"Senate Committee Report: Ought to Pass, 4/20/11; Senate Calendar 20 "
214644,2011-04-20,"Senate Ought to Pass, Motion Adopted, Voice Vote; OT3rdg; Senate Journal 13, Pg.265 "
214644,2011-04-20,"Senate Passed by Third Reading Resolution; Senate Journal 13, Pg.270 "
214644,2011-05-04,"Senate Enrolled Bill Amendment #1570 Adopted; Senate Journal 16, Pg.316 "
214644,2011-05-04,"House Enrolled Bill Amendment #2011-1570e Adopted; House Journal  42, PG.1490 "
214644,2011-05-04,"House Enrolled; House Journal  42, PG.1492 "
214644,2011-05-11,"Senate Enrolled; Senate Journal 17, Pg.344 "
214644,2011-06-01,"House Signed By Governor 05/31/2011; Effective 07/30/2011; Chapter 0102 "
214645,2010-12-22,"House Introduced 1/5/2011 and Referred to Ways and Means; House Journal  8, PG.128 "
214645,2011-01-26,"House Public Hearing: 2/3/2011 10:00 Amendment Legislative Office Building 202 "
214645,2011-02-15,"House Executive Session: 2/16/2011 Legislative Office Building 202 Following House Session "
214645,2011-02-16,"House Committee Report: Ought to Pass for Feb 23 (Vote 19-0; Regular Calendar); House Calendar 15, PG.281 "
214645,2011-02-23,"House Ought to Pass: Motion Adopted Voice Vote; House Journal  21, PG.511 "
214645,2011-03-09,"Senate Introduced and Referred to Ways & Means; Senate Journal 9, Pg.102 "
214645,2011-03-24,"Senate Hearing: 3/29/11, Room 100, State House, 1:15 p.m.; Senate Calendar 17 "
214645,2011-03-29,"Senate Committee Report: Ought to Pass, 4/13/11; Senate Calendar 19 "
214645,2011-04-13,"Senate Ought to Pass, Motion Adopted, Voice Vote; Senate Journal 12, Pg.253 "
214645,2011-04-13,"Senate Pending Motion OT3rdg "
214645,2011-04-13,"Senate Sen. Morse Moved Laid on Table, Motion Adopted, Voice Vote; Senate Journal 12, Pg.253 "
214646,2010-12-22,"House Introduced 1/5/2011 and Referred to Ways and Means; House Journal  8, PG.128  "
214646,2011-01-26,"House Public Hearing: 2/1/2011 10:00 Amendment Legislative Office Building 202 "
214646,2011-02-01,"House Executive Session: 2/8/2011 11:15 Amendment Legislative Office Building 202 "
214646,2011-02-08,"House Majority Committee Report: Ought to Pass for Feb 15 (Vote 14-5; Regular Calendar); House Calendar 13, PG.237-238 "
214646,2011-02-08,"House Minority Committee Report: Inexpedient to Legislate; House Calendar 13, PG.237-238 "
214646,2011-02-15,"House Special Order to Feb 16: Motion Adopted Without Objection; House Journal  17, PG.378 "
214646,2011-02-16,"House Lay on the Table (Rep Brunelle): Motion Failed Regular Calendar 97-265; House Journal  19, PG.425-428 "
214646,2011-02-16,"House Ought to Pass: Motion Adopted Regular Calendar 277-82; House Journal  19, PG.425-430 "
214646,2011-02-16,"House Uphold Rule of the Chair (Rep G.Richardson): Motion Adopted Division Vote 274-89; House Journal  19, PG.430 "
214646,2011-02-16,"House Lay on the Table (Rep Stepanek): Motion Adopted Regular Calendar 275-89; House Journal  19, PG.430-432 "
214647,2010-12-22,"House Introduced 1/5/2011 and Referred to Municipal and County Government; House Journal  8, PG.128 "
214647,2011-01-11,"House ==CANCELLED== Public Hearing: 1/12/2011 1:15 PM Legislative Office Building 301 "
214647,2011-01-11,"House Public Hearing: 1/18/2011 10:15 Amendment Legislative Office Building 301 "
214647,2011-01-11,"House ==CANCELLED==Executive Session: 1/18/2011 1:30 PM Legislative Office Building 301 ==TIME CHANGE (Orig 11:00 Amendment)== "
214647,2011-01-19,"House Executive Session: 1/27/2011 1:00 PM Legislative Office Building 301 "
214647,2011-02-01,"House Committee Report: Inexpedient to Legislate for Feb 9 (Vote 16-0; Consent Calendar); House Calendar 12, PG.203 "
214647,2011-02-09,"House Inexpedient to Legislate: Motion Adopted Voice Vote; House Journal  16, PG.313 "
214648,2010-12-22,"House Introduced 1/5/2011 and Referred to Education; House Journal  8, PG.128 "
214648,2011-01-11,"House Public Hearing: 1/25/2011 10:30 Amendment Legislative Office Building 207 "
214648,2011-02-18,"House Executive Session: 2/24/2011 1:00 PM Legislative Office Building 207 "
214648,2011-02-25,"House Committee Report: Inexpedient to Legislate for Mar 15 (Vote 15-0; Consent Calendar); House Calendar 22, PG.527 "
214648,2011-03-15,"House Inexpedient to Legislate: Motion Adopted Voice Vote; House Journal  26, PG.706 "
214649,2010-12-22,"House Introduced 1/5/2011 and Referred to Children and Family Law; House Journal  8, PG.128 "
214649,2011-01-05,"House Public Hearing: 1/13/2011 2:15 PM Legislative Office Building 206 ==RECESSED== "
214649,2011-01-19,"House Continued Public Hearing: 2/3/2011 9:30 Amendment Legislative Office Building 206 "
214649,2011-02-09,"House Executive Session: 2/10/2011 Legislative Office Building 206 "
214649,2011-02-14,"House Committee Report: Inexpedient to Legislate for Feb 23 (Vote 14-0; Consent Calendar); House Calendar 15, PG.267 "
214649,2011-02-23,"House Inexpedient to Legislate: Motion Adopted Voice Vote; House Journal  21, PG.456 "
214650,2010-12-22,"House Introduced 1/5/2011 and Referred to Legislative Administration; House Journal  8, PG.128 "
214650,2011-01-13,"House Public Hearing: 1/18/2011 1:00 PM Legislative Office Building 104 "
214650,2011-01-26,"House Executive Session: 2/1/2011 11:30 Amendment Legislative Office Building 104 "
214650,2011-02-01,"House Committee Report: Inexpedient to Legislate for Feb 9 (Vote 13-1; Consent Calendar); House Calendar 12, PG.203 "
214650,2011-02-09,"House Inexpedient to Legislate: Motion Adopted Voice Vote; House Journal  16, PG.312 "
214651,2010-12-22,"House Introduced 1/5/2011 and Referred to Election Law; House Journal  8, PG.128 "
214651,2011-01-13,"House Public Hearing: 1/18/2011 10:30 Amendment Legislative Office Building 308 "
214651,2011-01-26,"House Executive Session: 2/1/2011 10:30 Amendment Legislative Office Building 308 "
214651,2011-02-03,"House Committee Report: Ought to Pass for Feb 9 (Vote 18-0; Consent Calendar); House Calendar 12, PG.201 "
214651,2011-02-09,"House Ought to Pass: Motion Adopted Voice Vote; House Journal  16, PG.311 "
214651,2011-03-16,"Senate Introduced and Referred to Public and Municipal Affairs; Senate Journal 10, Pg.169 "
214651,2011-03-17,"Senate Hearing: 3/22/11, Room 101, Legislative Office Building, 10:00 a.m.; Senate Calendar 16 "
214651,2011-03-22,"Senate Committee Report: Ought to Pass, 3/30/11; Senate Calendar 17 "
214651,2011-03-30,"Senate Ought to Pass Not Voted On "
214651,2011-03-30,"Senate Sen. Barnes Moved Laid on Table, Motion Adopted, Voice Vote; Senate Journal 11, Pg.232 "
214652,2010-12-22,"House Introduced 1/5/2011 and Referred to Legislative Administration; House Journal  8, PG.128 "
214652,2011-01-26,"House Vacated from Legislative Administration: Motion Adopted Voice Vote; House Journal  14, PG.261 "
214652,2011-01-26,"House Referred to Executive Departments and Administration; House Journal  14, PG.261 "
214652,2011-02-02,"House Public Hearing: 2/22/2011 10:30 Amendment Legislative Office Building 306 "
214652,2011-02-24,"House Subcommittee Work Session: 3/1/2011 2:00 PM Legislative Office Building 306 "
214652,2011-02-24,"House Executive Session: 3/2/2011 2:00 PM Legislative Office Building 306 "
214652,2011-03-03,"House Committee Report: Ought to Pass for Mar 15 (Vote 16-0; Consent Calendar); House Calendar 22, PG.530 "
214652,2011-03-15,"House Ought to Pass: Motion Adopted Voice Vote; House Journal  26, PG.709 "
214652,2011-03-23,"Senate Introduced and Referred to Executive Departments and Administration; Senate Journal 11, Pg.190 "
214652,2011-04-07,"Senate Hearing: 4/14/11, Room 100, State House, 9:00 a.m.; Senate Calendar 19 "
214652,2011-04-28,"Senate Committee Report: Ought to Pass, 5/4/11; Senate Calendar 22 "
214652,2011-05-04,"Senate Ought to Pass, Motion Adopted, Voice Vote; OT3rdg; Senate Journal 15, Pg.303 "
214652,2011-05-04,"Senate Passed by Third Reading Resolution; Senate Journal 15, Pg.311 "
214652,2011-05-18,"Senate Enrolled; Senate Journal 18, Pg.363 "
214652,2011-05-18,"House Enrolled; House Journal  44, PG.1564 "
214652,2011-06-01,"House Signed By Governor 05/27/2011; Effective 07/26/2011; Chapter 0089 "
214653,2010-12-22,"House Introduced 1/5/2011 and Referred to Resources, Recreation and Development; House Journal  8, PG.128 "
214653,2011-01-04,"House Public Hearing: 1/13/2011 11:00 Amendment Legislative Office Building 305 "
214653,2011-01-05,"House ==CANCELLED== Executive Session: 1/20/2011 1:00 PM Legislative Office Building 305 "
214653,2011-01-26,"House Subcommittee Work Session: 2/1/2011 3:00 PM Legislative Office Building 305 "
214653,2011-02-01,"House Subcommittee Work Session: 2/8/2011 3:15 PM Legislative Office Building 305 "
214653,2011-02-15,"House Executive Session: 1/15/2011 Legislative Office Building 305 3:00 PM or Following House Session "
214653,2011-02-16,"House Committee Report: Ought to Pass with Amendment #0120h(NT) for Feb 23 (Vote 16-0; Consent Calendar); House Calendar 15, PG.272 "
214653,2011-02-16,"House Proposed Committee Amendment #2011-0120h (New Title); House Calendar 15, PG.298 "
214653,2011-02-23,"House Amendment #0120h (New Title) Adopted, Voice Vote; House Journal  21, PG.462-463 "
214653,2011-02-23,"House Ought to Pass with Amendment #0120h(NT): Motion Adopted Voice Vote; House Journal  21, PG.462-463 "
214653,2011-03-16,"Senate Introduced and Referred to Energy and Natural Resources; Senate Journal 10, Pg.169 "
214653,2011-03-31,"Senate Hearing: 4/7/11, Room 102, Legislative Office Building, 9:10 a.m.; Senate Calendar 18 "
214653,2011-04-28,"Senate Committee Report: Ought to Pass, 5/4/11; Senate Calendar 22 "
214653,2011-05-04,"Senate Ought to Pass, Motion Adopted, Voice Vote; OT3rdg; Senate Journal 15, Pg.300 "
214653,2011-05-04,"Senate Passed by Third Reading Resolution; Senate Journal 15, Pg.311 "
214653,2011-05-18,"Senate Enrolled Bill Amendment #1804e Adopted; Senate Journal 18, Pg.361 "
214653,2011-05-18,"House Enrolled Bill Amendment #2011-1804e Adopted; House Journal  44, PG.1565-1566 "
214653,2011-05-25,"Senate Enrolled; Senate Journal 19, Pg.395 "
214653,2011-05-25,"House Enrolled; House Journal  46, PG.1609 "
214653,2011-06-08,"House Signed by Governor 06/02/2011; Effective 06/02/2011; Chapter 0118 "
214654,2010-12-22,"House Introduced 1/5/2011 and Referred to Resources, Recreation and Development; House Journal  8, PG.128 "
214654,2011-01-05,"House Public Hearing: 1/18/2011 10:30 Amendment Legislative Office Building 305 "
214654,2011-01-05,"House Executive Session: 1/20/2011 1:00 PM Legislative Office Building 305 "
214654,2011-01-21,"House Committee Report: Ought to Pass for Feb 9 (Vote 16-0; Consent Calendar); House Calendar 10, PG.147 "
214654,2011-02-09,"House Ought to Pass: Motion Adopted Voice Vote; House Journal  16, PG.314 "
214654,2011-03-16,"Senate Introduced and Referred to Energy and Natural Resources; Senate Journal 10, Pg.169 "
214654,2011-03-17,"Senate Hearing: 3/24/11, Room 102, Legislative Office Building, 10:00 a.m.; Senate Calendar 16 "
214654,2011-03-24,"Senate Committee Report: Ought to Pass, 3/30/11; Senate Calendar 17 "
214654,2011-03-30,"Senate Ought to Pass, Motion Adopted, Voice Vote; OT3rdg; Senate Journal 11, Pg.211 "
214654,2011-03-30,"Senate Passed by Third Reading Resolution; Senate Journal 11, Pg.240 "
214654,2011-04-13,"Senate Enrolled; Senate Journal 13, Pg.259 "
214654,2011-04-13,"House Enrolled; House Journal  37, Pg.1304 "
214654,2011-04-28,"House Signed by the Governor 04/25/2011; Effective 04/25/2011; Chapter 0005 "
214655,2010-12-22,"House Introduced 1/5/2011 and Referred to Environment and Agriculture; House Journal  8, PG.128 "
214655,2011-01-11,"House Public Hearing: 1/25/2011 10:00 Amendment Legislative Office Building 303 "
214655,2011-02-01,"House Subcommittee Work Session: 2/8/2011 9:30 Amendment Legislative Office Building 303 "
214655,2011-02-22,"House Subcommittee Work Session: 3/1/2011 11:00 Amendment Legislative Office Building 303 "
214655,2011-02-23,"House Executive Session: 3/1/2011 1:00 PM Legislative Office Building 303 "
214655,2011-03-03,"House Committee Report: Ought to Pass with Amendment #0573h for Mar 15 (Vote 16-0; Consent Calendar); House Calendar 22, PG.529 "
214655,2011-03-03,"House Proposed Committee Amendment #2011-0573h; House Calendar 23, PG.583-584 "
214655,2011-03-15,"House Amendment #0573h Adopted, Voice Vote; House Journal  26, PG.709 "
214655,2011-03-15,"House Ought to Pass with Amendment #0573h: Motion Adopted Voice Vote; House Journal  26, PG.709 "
214655,2011-03-23,"Senate Introduced and Referred to Energy and Natural Resources; Senate Journal 11, Pg.190 "
214655,2011-03-24,"Senate Hearing: 3/31/11, Room 102, Legislative Office Building, 9:40 a.m.; Senate Calendar 17 "
214655,2011-03-31,"Senate Committee Report: Ought to Pass, 4/13/11; Senate Calendar 19 "
214655,2011-04-13,"Senate Ought to Pass, Motion Adopted, Voice Vote; OT3rdg; Senate Journal 12, Pg.247 "
214655,2011-04-13,"Senate Passed by Third Reading Resolution; Senate Journal 12, Pg.254 "
214655,2011-04-27,"House Enrolled; House Journal  40, PG.1386 "
214655,2011-04-27,"Senate Enrolled; Senate Journal 15, Pg.292 "
214655,2011-05-11,"House Signed by Governor 05/09/2011; Effective 07/08/2011; Chapter 0033 "
214656,2010-12-22,"House Introduced 1/5/2011 and Referred to Commerce and Consumer Affairs; House Journal  8, PG.128 "
214656,2011-01-05,"House Public Hearing: 1/18/2011 10:00 Amendment Legislative Office Building 302 Banking/Business Div "
214656,2011-01-18,"House Subcommittee Work Session: 1/27/2011 9:00 Amendment Legislative Office Building 304 "
214656,2011-02-09,"House Executive Session: 2/9/2011 Legislative Office Building 302 Following House Session "
214656,2011-02-10,"House Committee Report: Ought to Pass for Feb 15 (Vote 13-0; Consent Calendar); House Calendar 13, PG.229 "
214656,2011-02-15,"House Ought to Pass: Motion Adopted Voice Vote; House Journal  17, PG.356 "
214656,2011-03-16,"Senate Introduced and Referred to Executive Departments and Administration; Senate Journal 10, Pg.169 "
214656,2011-04-07,"Senate Hearing: 4/14/11, Room 100, State House, 9:10 a.m.; Senate Calendar 19 "
214656,2011-04-14,"Senate Committee Report: Ought to Pass with Amendment #2011-1441s, New Title, 4/20/11; Senate Calendar 20 "
214656,2011-04-20,"Senate Committee Amendment 1441s, New Title, Amendment Adopted, Voice Vote; Senate Journal 13, Pg.265 "
214656,2011-04-20,"Senate Ought to Pass with Amendment 1441s, New Title, Motion Adopted, Voice Vote; OT3rdg; Senate Journal 13, Pg.265 "
214656,2011-04-20,"Senate Passed by Third Reading Resolution; Senate Journal 13, Pg.270 "
214656,2011-05-18,"House House Concurs with Senate Amendment #1441s(NT) (Rep Hunt): Motion Adopted Voice Vote; House Journal  44, PG.1531 "
214656,2011-06-01,"Senate Enrolled; Senate Journal 20, Pg.546 "
214656,2011-06-01,"House Enrolled; House Journal  48, PG.1669 "
214656,2011-06-09,"House Signed By Governor 06/07/2011; Effective 08/06/2011; Chapter 0134 "
214657,2010-12-22,"House Introduced 1/5/2011 and Referred to Municipal and County Government; House Journal  8, PG.128 "
214657,2011-01-11,"House ===CANCELLED=== Public Hearing: 1/12/2011 1:30 PM Legislative Office Building 301 "
214657,2011-01-11,"House Public Hearing: 1/18/2011 10:30 Amendment Legislative Office Building 301 "
214657,2011-01-11,"House Executive Session: 1/18/2011 1:30 PM Legislative Office Building 301 ==TIME CHANGE (Orig 11:00 Amendment)== "
214657,2011-01-19,"House Committee Report: Inexpedient to Legislate for Jan 26 (Vote 10-2; Regular Calendar); House Calendar 9, PG.135 "
214657,2011-01-26,"House Inexpedient to Legislate: Motion Adopted Division Vote 300-36; House Journal  14, PG.262 "
214658,2010-12-22,"House Introduced 1/5/2011 and Referred to Public Works and Highways; House Journal  8, PG.128  "
214658,2011-01-04,"House Public Hearing: 1/11/2011 1:15 PM Legislative Office Building 201 "
214658,2011-01-11,"House DOT Briefing: 1/18/2011 10:15 Amendment Legislative Office Building 201 "
214658,2011-01-11,"House Executive Session: 1/18/2011 11:00 Amendment Legislative Office Building 201 "
214658,2011-01-19,"House Committee Report: Inexpedient to Legislate for Jan 26 (Vote 12-1; Regular Calendar); House Calendar 9, PG.135 "
214658,2011-01-26,"House Inexpedient to Legislate: Motion Adopted Voice Vote; House Journal  14, PG.262 "
214659,2010-12-22,"House Introduced 1/5/2011 and Referred to Judiciary; House Journal  8, PG.128 "
214659,2011-01-05,"House Public Hearing: 1/11/2011 2:00 PM Legislative Office Building 208 "
214659,2011-01-13,"House Division I Work Session: 1/18/2011 1:30 PM Legislative Office Building 208 "
214659,2011-01-13,"House Division I Work Session: 1/20/2011 1:30 PM Legislative Office Building 208 "
214659,2011-01-26,"House Executive Session: 2/1/2011 11:00 Amendment Legislative Office Building 208 "
214659,2011-02-03,"House Committee Report: Ought to Pass for Feb 9 (Vote 17-0; Consent Calendar); House Calendar 12, PG.202 "
214659,2011-02-09,"House Ought to Pass: Motion Adopted Voice Vote; House Journal  16, PG.312 "
214659,2011-03-16,"Senate Introduced and Referred to Judiciary; Senate Journal 10, Pg.169 "
214659,2011-05-04,"Senate Hearing: 5/12/11, Room 101, Legislative Office Building, 1:45 p.m.; Senate Calendar 23 "
214659,2011-05-26,"Senate Committee Report: Ought to Pass, 6/1/11; Senate Calendar 26 "
214659,2011-06-01,"Senate Ought to Pass, Motion Adopted, Voice Vote; OT3rdg; Senate Journal 19, Pg.518 "
214659,2011-06-01,"Senate Passed by Third Reading Resolution; Senate Journal 19, Pg.539 "
214659,2011-06-08,"Senate Enrolled "
214659,2011-06-08,"House Enrolled; House Journal  51, PG.1726 "
214659,2011-06-14,"House Signed By Governor 06/14/2011; Effective 01/01/2012; Chapter 0161 "
214660,2010-12-22,"House Introduced 1/5/2011 and Referred to Children and Family Law; House Journal  8, PG.128 "
214660,2011-01-05,"House Public Hearing: 1/13/2011 1:15 PM Legislative Office Building 206 "
214660,2011-01-14,"House Subcommittee Work Session: 1/18/2011 10:00 Amendment Legislative Office Building 206 "
214660,2011-01-20,"House Subcommittee Work Session: 1/27/2011 10:00 Amendment Legislative Office Building 206 "
214660,2011-01-27,"House Subcommittee Work Session: 2/8/2011 2:00 PM Legislative Office Building 206 "
214660,2011-02-11,"House Subcommittee Work Session: 3/3/2011 12:00 PM Legislative Office Building 206 "
214660,2011-03-01,"House Executive Session: 3/7/2011 10:00 Amendment Legislative Office Building 206 "
214660,2011-03-08,"House Committee Report: Ought to Pass with Amendment #0480h for Mar 15 (Vote 10-2; Regular Calendar); House Calendar 22, PG.545 "
214660,2011-03-08,"House Proposed Committee Amendment #2011-0480h; House Calendar 23, PG.584 "
214660,2011-03-15,"House Amendment #0480h Adopted, Voice Vote; House Journal  26, PG.748 "
214660,2011-03-15,"House Ought to Pass with Amendment #0480h: Motion Adopted Voice Vote; House Journal  26, PG.748 "
214660,2011-03-23,"Senate Introduced and Referred to Judiciary; Senate Journal 11, Pg.190 "
214660,2011-04-13,"Senate Hearing: 4/21/11, Room 100, State House, 1:15 p.m.; Senate Calendar 20 "
214660,2011-05-03,"Senate Committee Report: Ought to Pass with Amendment #2011-1678s, 5/11/11; Senate Calendar 23 "
214660,2011-05-11,"Senate Committee Amendment 1678s, Amendment Adopted, Voice Vote; Senate Journal 16, Pg.332 "
214660,2011-05-11,"Senate Ought to Pass with Amendment 1678s, Motion Adopted, Voice Vote; OT3rdg; Senate Journal 16, Pg.332 "
214660,2011-05-11,"Senate Passed by Third Reading Resolution; Senate Journal 16 "
214660,2011-06-01,"House House Concurs with Senate Amendment #1678s (Rep Moran): Motion Adopted Voice Vote; House Journal  48, PG.1624 "
214660,2011-06-08,"Senate Enrolled "
214660,2011-06-08,"House Enrolled; House Journal  51, PG.1726 "
214660,2011-06-14,"House Signed By Governor 06/14/2011; Effective 08/13/2011; Chapter 0162 "
214661,2010-12-22,"House Introduced 1/5/2011 and Referred to Criminal Justice and Public Safety; House Journal  8, PG.128 "
214661,2011-01-11,"House Public Hearing: 1/18/2011 10:00 Amendment Legislative Office Building 204 "
214661,2011-01-26,"House Executive Session: 2/3/2011 10:00 Amendment Legislative Office Building 204 "
214661,2011-02-03,"House Committee Report: Inexpedient to Legislate for Feb 15 (Vote 14-2; Consent Calendar); House Calendar 13, PG.230 "
214661,2011-02-15,"House Inexpedient to Legislate: Motion Adopted Voice Vote; House Journal  17, PG.358 "
214662,2010-12-22,"House Introduced 1/5/2011 and Referred to Municipal and County Government; House Journal  8, PG.128 "
214662,2011-01-04,"House Public Hearing: 1/20/2011 1:00 PM Legislative Office Building 301 "
214662,2011-02-01,"House Executive Session: 2/8/2011 1:00 PM Legislative Office Building 301 "
214662,2011-02-09,"House Committee Report: Inexpedient to Legislate for Feb 15 (Vote 15-0; Consent Calendar); House Calendar 13, PG.231 "
214662,2011-02-15,"House Inexpedient to Legislate: Motion Adopted Voice Vote; House Journal  17, PG.359 "
214663,2010-12-22,"House Introduced 1/5/2011 and Referred to Resources, Recreation and Development; House Journal  8, PG.128 "
214663,2011-01-05,"House Public Hearing: 1/18/2011 1:00 PM Legislative Office Building 305 "
214663,2011-01-05,"House Executive Session: 1/20/2011 1:00 PM Legislative Office Building 305 "
214663,2011-01-21,"House Committee Report: Ought to Pass for Feb 9 (Vote 16-0; Consent Calendar); House Calendar 10, PG.147 "
214663,2011-02-09,"House Ought to Pass: Motion Adopted Voice Vote; House Journal  16, PG.314 "
214663,2011-03-16,"Senate Introduced and Referred to Energy and Natural Resources; Senate Journal 10, Pg.169 "
214663,2011-03-17,"Senate Hearing: 3/24/11, Room 102, Legislative Office Building, 10:15 a.m.; Senate Calendar 16 "
214663,2011-03-29,"Senate Committee Report: Ought to Pass with Amendment 1225s, New Title, 4/13/11; Senate Calendar 19 "
214663,2011-04-13,"Senate Committee Amendment 1225s, New Title, Amendment Adopted, Voice Vote; Senate Journal 12, Pg.247 "
214663,2011-04-13,"Senate Ought to Pass with Amendment #2011-1225s, New Title, Motion Adopted, Voice Vote; OT3rdg; Senate Journal 12, Pg.247 "
214663,2011-04-13,"Senate Passed by Third Reading Resolution; Senate Journal 12, Pg.254 "
214663,2011-05-04,"House House Concurs with Senate Amendment #1225s(NT) (Rep Renzullo): Motion Adopted Voice Vote; House Journal  42, PG.1448 "
214663,2011-05-04,"House Enrolled Bill Amendment #2011-1807e Adopted; House Journal  42, PG.1492 "
214663,2011-05-11,"Senate Enrolled Bill Amendment #1807 Adopted; Senate Journal 17, Pg.344 "
214663,2011-05-18,"Senate Enrolled; Senate Journal 18, Pg.363 "
214663,2011-05-18,"House Enrolled; House Journal  44, PG.1564 "
214663,2011-06-01,"House Signed By Governor 05/27/2011; Effective 05/27/2011; Chapter 0090 "
214664,2010-12-22,"House Introduced 1/5/2011 and Referred to State-Federal Relations and Veterans Affairs "
214664,2011-01-05,"House Public Hearing: 1/13/2011 9:30 Amendment Legislative Office Building 203 "
214664,2011-01-14,"House Executive Session: 1/20/2011 9:30 Amendment Legislative Office Building 203 "
214664,2011-01-20,"House Committee Report: Ought to Pass with Amendment #0029h for Feb 9 (Vote 13-0; Consent Calendar); House Calendar 10, PG.148 "
214664,2011-01-20,"House Proposed Committee Amendment #2011-0029h; House Calendar 10, PG.164 "
214664,2011-02-09,"House Amendment #0029h Adopted, Voice Vote; House Journal  16, PG.316 "
214664,2011-02-09,"House Ought to Pass with Amendment #0029h: Motion Adopted Voice Vote; House Journal  16, PG.316 "
214664,2011-03-16,"Senate Introduced and Referred to Public and Municipal Affairs; Senate Journal 10, Pg.169 "
214664,2011-04-14,"Senate Hearing: 4/19/11, Room 101, Legislative Office Building, 9:00 a.m.; Senate Calendar 20 "
214664,2011-04-20,"Senate Committee Report: Ought to Pass, 4/27/11; Senate Calendar 21 "
214664,2011-04-27,"Senate Ought to Pass, Motion Adopted, Voice Vote; OT3rdg; Senate Journal 14 "
214664,2011-04-27,"Senate Passed by Third Reading Resolution; Senate Journal 14 "
214664,2011-05-04,"Senate Enrolled; Senate Journal 16, Pg.318 "
214664,2011-05-04,"House Enrolled; House Journal  42, PG.1490 "
214664,2011-05-19,"House Signed by Governor 05/16/2011; Effective 07/15/2011; Chapter 0061 "
214665,2010-12-22,"House Introduced 1/5/2011 and Referred to Criminal Justice and Public Safety; House Journal  8, PG.129 "
214665,2011-01-04,"House Public Hearing: 1/13/2011 10:30 Amendment Legislative Office Building 204 "
214665,2011-01-11,"House ==CANCELLED== Executive Session: 1/18/2011 1:00 PM Legislative Office Building 204 "
214665,2011-01-20,"House Subcommittee Work Session: 1/25/2011 11:30 Amendment Legislative Office Building 204 "
214665,2011-01-26,"House Executive Session: 2/3/2011 10:00 Amendment Legislative Office Building 204 "
214665,2011-02-22,"House Committee Report: Inexpedient to Legislate for Mar 2 (Vote 16-0; Consent Calendar); House Calendar 18, PG.385 "
214665,2011-03-02,"House Inexpedient to Legislate: Motion Adopted Voice Vote; House Journal  25, PG.672 "
214666,2010-12-22,"House Introduced 1/5/2011 and Referred to Health, Human Services and Elderly Affairs; House Journal  8, PG.129 "
214666,2011-01-04,"House Public Hearing: 1/11/2011 11:00 Amendment Legislative Office Building 205 "
214666,2011-01-13,"House Subcommittee Work Session: 1/19/2011 2:30 PM Legislative Office Building 207 "
214666,2011-02-17,"House Subcommittee Work Session: 2/22/2011 9:00 Amendment Legislative Office Building 205 "
214666,2011-02-23,"House Executive Session: 3/1/2011 9:00 Amendment Legislative Office Building 205 "
214666,2011-03-02,"House Committee Report: Ought to Pass for Mar 15 (Vote 14-2; Regular Calendar); House Calendar 22, PG.555 "
214666,2011-03-16,"House Ought to Pass: Motion Adopted Voice Vote; House Journal  28, PG.858 "
214666,2011-03-23,"Senate Introduced and Referred to Health and Human Services; Senate Journal 11, Pg.190 "
214666,2011-03-24,"Senate Hearing: 4/7/11, Room 102, Legislative Office Building, 1:00 p.m.; Senate Calendar 17 "
214666,2011-04-08,"Senate Committee Report: Ought to Pass, 4/20/11; Senate Calendar 20 "
214666,2011-04-20,"Senate Ought to Pass, Motion Adopted, Voice Vote; OT3rdg; Senate Journal 13, Pg.265 "
214666,2011-04-20,"Senate Passed by Third Reading Resolution; Senate Journal 13, Pg.270 "
214666,2011-05-04,"Senate Enrolled; Senate Journal 16, Pg.318 "
214666,2011-05-04,"House Enrolled; House Journal  42, PG.1490 "
214666,2011-05-19,"House Signed by Governor 05/16/2011; Effective 07/15/2011; Chapter 0062 "
214667,2010-12-22,"House Introduced 1/5/2011 and Referred to Education; House Journal  8, PG.129 "
214667,2011-01-11,"House Public Hearing: 1/18/2011 3:00 PM Legislative Office Building 207 ==RECESSED== "
214667,2011-01-19,"House Continued Public Hearing: 1/27/2011 10:00 Amendment Legislative Office Building 207 "
214667,2011-02-02,"House Executive Session: 2/10/2011 1:00 PM Legislative Office Building 207 "
214667,2011-02-15,"House Committee Report: Inexpedient to Legislate for Feb 23 (Vote 15-2; Consent Calendar); House Calendar 15, PG.267 "
214667,2011-02-23,"House Inexpedient to Legislate: Motion Adopted Voice Vote; House Journal  21, PG.458 "
214668,2010-12-22,"House Introduced 1/5/2011 and Referred to Finance; House Journal  8, PG.129 "
214668,2011-01-11,"House ===CANCELLED=== Public Hearing: 1/12/2011 10:00 Amendment Legislative Office Building 210-211 "
214668,2011-01-11,"House Public Hearing: 1/19/2011 1:00 PM Legislative Office Building 210-211 "
214668,2011-01-25,"House Division II Work Session: 1/28/2011 12:30 PM Legislative Office Building 210-211 "
214668,2011-01-25,"House ==RESCHEDULED== Work Session: 2/1/2011 10:30 Amendment Legislative Office Building 210-211 "
214668,2011-01-30,"House Executive Session Following House Session: Feb 9 Legislative Office Building 210-211 "
214668,2011-01-31,"House ==CANCELLED== Executive Session: 2/14/2011 2:00 PM Legislative Office Building 210-211 "
214668,2011-02-10,"House Committee Report: Inexpedient to Legislate for Feb 15 (Vote 25-0; Regular Calendar); House Calendar 13, PG.235 "
214668,2011-02-15,"House Inexpedient to Legislate: Motion Adopted Voice Vote; House Journal  17, PG.367 "
214669,2010-12-22,"House Introduced 1/5/2011 and Referred to Commerce and Consumer Affairs; House Journal  8, PG.129 "
214669,2011-01-05,"House Public Hearing: 1/18/2011 2:00 PM Legislative Office Building 302 Banking/Business Div "
214669,2011-01-19,"House Subcommittee Work Session: 1/25/2011 11:00 Amendment Legislative Office Building 302 "
214669,2011-01-25,"House Subcommittee Work Session: 2/1/2011 9:45 Amendment Legislative Office Building 302 "
214669,2011-01-26,"House Executive Session: 2/1/2011 10:00 Amendment Legislative Office Building 302 "
214669,2011-02-09,"House Committee Report: Ought to Pass for Feb 15 (Vote 14-0; Consent Calendar); House Calendar 13, PG.229 "
214669,2011-02-15,"House Ought to Pass: Motion Adopted Voice Vote; House Journal  17, PG.356 "
214669,2011-04-20,"Senate Introduced and Referred to Public and Municipal Affairs; Senate Journal 14, Pg.272 "
214669,2011-04-28,"Senate Hearing: 5/3/11, Room 101, Legislative Office Building, 9:00 a.m.; Senate Calendar 22 "
214669,2011-05-04,"Senate Committee Report: Ought to Pass, 5/11/11; Senate Calendar 23 "
214669,2011-05-11,"Senate Ought to Pass, Motion Adopted, Voice Vote; OT3rdg; Senate Journal 16 "
214669,2011-05-11,"Senate Passed by Third Reading Resolution; Senate Journal 16 "
214669,2011-05-18,"Senate Enrolled; Senate Journal 18, Pg.363 "
214669,2011-05-18,"House Enrolled; House Journal  44, PG.1564 "
214669,2011-06-01,"House Signed By Governor 05/31/2011; Effective 07/30/2011; Chapter 0103 "
214670,2010-12-22,"House Introduced 1/5/2011 and Referred to Executive Departments and Administration; House Journal  8, PG.129 "
214670,2011-01-19,"House Public Hearing: 1/25/2011 1:00 PM Legislative Office Building 306 "
214670,2011-02-03,"House Subcommittee Work Session: 2/10/2011 3:00 PM Legislative Office Building 306 "
214670,2011-03-02,"House Executive Session: 3/9/2011 1:00 PM Legislative Office Building 306 "
214670,2011-03-10,"House Committee Report: Inexpedient to Legislate for Mar 15 (Vote 17-0; Consent Calendar); House Calendar 22, PG.530 "
214670,2011-03-15,"House Inexpedient to Legislate: Motion Adopted Voice Vote; House Journal  26, PG.709 "
214671,2010-12-22,"House Introduced 1/5/2011 and Referred to Resources, Recreation and Development; House Journal  8, PG.129 "
214671,2011-01-05,"House Public Hearing: 1/18/2011 10:00 Amendment Legislative Office Building 305 "
214671,2011-01-05,"House Executive Session: 1/20/2011 1:00 PM Legislative Office Building 305 "
214671,2011-01-21,"House Committee Report: Ought to Pass with Amendment #0038h for Feb 9 (Vote 17-0; Consent Calendar); House Calendar 10, PG.147 "
214671,2011-01-21,"House Proposed Committee Amendment #2011-0038h; House Calendar 10, PG.164 "
214671,2011-02-09,"House Amendment #0038h Adopted, Voice Vote; House Journal  16, PG.314 "
214671,2011-02-09,"House Ought to Pass with Amendment #0038h: Motion Adopted Voice Vote; House Journal  16, PG.314 "
214671,2011-03-16,"Senate Introduced and Referred to Energy and Natural Resources; Senate Journal 10, Pg.169 "
214671,2011-03-24,"Senate Hearing: 3/31/11, Room 102, Legislative Office Building, 9:50 a.m.; Senate Calendar 17 "
214671,2011-03-31,"Senate Committee Report: Ought to Pass, 4/13/11; Senate Calendar 19 "
214671,2011-04-13,"Senate Ought to Pass, Motion Adopted, Voice Vote; OT3rdg; Senate Journal 12, Pg.248 "
214671,2011-04-13,"Senate Passed by Third Reading Resolution; Senate Journal 12, Pg.254 "
214671,2011-04-27,"House Enrolled; House Journal  40, PG.1386 "
214671,2011-04-27,"Senate Enrolled; Senate Journal 15, Pg.292 "
214671,2011-05-11,"House Signed by Governor 05/09/2011; Effective 05/09/2011; Chapter 0034 "
214672,2010-12-30,"House Introduced 1/5/2011 and Referred to Transportation; House Journal  8, PG.129 "
214672,2011-01-05,"House Public Hearing: 1/18/2011 10:30 Amendment Legislative Office Building 203 "
214672,2011-02-16,"House Executive Session: 2/16/2011 1:45 PM Legislative Office Building 203 "
214672,2011-02-17,"House Committee Report: Inexpedient to Legislate for Mar 2 (Vote 14-0; Regular Calendar); House Calendar 18, PG.392 "
214672,2011-03-02,"House Inexpedient to Legislate: Motion Adopted Voice Vote; House Journal  25, PG.687 "
214673,2010-12-30,"House Introduced 1/5/2011 and Referred to Criminal Justice and Public Safety; House Journal  8, PG.129 "
214673,2011-01-04,"House Public Hearing: 1/13/2011 11:00 Amendment Legislative Office Building 204 "
214673,2011-01-11,"House ==CANCELLED== Executive Session: 1/18/2011 1:00 PM Legislative Office Building 204 "
214673,2011-01-25,"House ==CANCELLED== Work Session: 1/27/2011 9:00 Amendment Legislative Office Building 204 "
214673,2011-01-25,"House ==RESCHEDULED== Work Session: 2/1/2011 9:15 Amendment Legislative Office Building 204 "
214673,2011-01-26,"House Executive Session: 2/3/2011 10:00 Amendment Legislative Office Building 204 "
214673,2011-02-03,"House Committee Report: Inexpedient to Legislate for Feb 15 (Vote 16-0; Consent Calendar); House Calendar 13, PG.230 "
214673,2011-02-15,"House Removed from Consent Calendar (Rep Ulery); House Journal  17, PG.356 "
214673,2011-02-15,"House Special Order to Feb 16: Motion Adopted Without Objection; House Journal  17, PG.378 "
214673,2011-02-16,"House Inexpedient to Legislate: Motion Adopted Voice Vote; House Journal  19, PG.436-437 "
214674,2010-12-30,"House Introduced 1/5/2011 and Referred to Municipal and County Government; House Journal  8, PG.129 "
214674,2011-01-11,"House Public Hearing: 1/20/2011 10:30 Amendment Legislative Office Building 301 "
214674,2011-02-23,"House Executive Session: 2/28/2011 10:30 Amendment Legislative Office Building 301 "
214674,2011-03-03,"House Committee Report: Inexpedient to Legislate for Mar 15 (Vote 16-0; Consent Calendar); House Calendar 22, PG.536 "
214674,2011-03-15,"House Inexpedient to Legislate: Motion Adopted Voice Vote; House Journal  26, PG.729 "
214675,2010-12-30,"House Introduced 1/5/2011 and Referred to Education; House Journal  8, PG.129 "
214675,2011-01-11,"House Public Hearing: 1/18/2011 2:30 PM Legislative Office Building 207 "
214675,2011-01-19,"House ==CANCELLED== Executive Session: 1/25/2011 2:00 PM Legislative Office Building 207 "
214675,2011-01-26,"House Executive Session: 2/1/2011 2:00 PM Legislative Office Building 207 "
214675,2011-02-02,"House Committee Report: Ought to Pass for Feb 9 (Vote 16-0; Consent Calendar); House Calendar 12, PG.200 "
214675,2011-02-09,"House Ought to Pass: Motion Adopted Voice Vote; House Journal  16, PG.310 "
214675,2011-02-23,"Senate Introduced and Referred to Education; Senate Journal 8, Pg.81 "
214675,2011-03-09,"Senate Hearing: 3/22/11, Room 103, Legislative Office Building, 1:10 p.m.; Senate Calendar 15 "
214675,2011-03-31,"Senate Committee Report: Ought to Pass with Amendment #2011-1312s, New Title, 4/13/11; Senate Calendar 19 "
214675,2011-04-13,"Senate Committee Amendment 1312s, New Title, Amendment Adopted, Voice Vote; Senate Journal 12, Pg.246 "
214675,2011-04-13,"Senate Ought to Pass with Amendment 1312s, New Title, Motion Adopted, Voice Vote; OT3rdg; Senate Journal 12, Pg.246 "
214675,2011-04-13,"Senate Passed by Third Reading Resolution; Senate Journal 12, Pg.254 "
214675,2011-06-08,"House House Non-Concurs with Senate Amendment 1312s(NT) (Rep Balboni): Motion Adopted Voice Vote; House Journal  51, PG.1720 "
214676,2010-12-30,"House Introduced 1/5/2011 and Referred to Ways and Means; House Journal  8, PG.129  "
214676,2011-01-26,"House Public Hearing: 2/1/2011 11:00 Amendment Legislative Office Building 202 "
214676,2011-02-01,"House Executive Session: 2/8/2011 11:15 Amendment Legislative Office Building 202 "
214676,2011-02-08,"House Committee Report: Inexpedient to Legislate for Feb 15 (Vote 20-0; Consent Calendar); House Calendar 13, PG.233 "
214676,2011-02-15,"House Inexpedient to Legislate: Motion Adopted Voice Vote; House Journal  17, PG.361 "
214677,2010-12-30,"House Introduced 1/5/2011 and Referred to Education; House Journal  8, PG.129 "
214677,2011-01-11,"House Public Hearing: 1/18/2011 2:00 PM Legislative Office Building 207 "
214677,2011-01-19,"House ==CANCELLED== Executive Session: 1/25/2011 2:00 PM Legislative Office Building 207 "
214677,2011-01-26,"House Executive Session: 2/1/2011 2:00 PM Legislative Office Building 207 "
214677,2011-02-02,"House Committee Report: Ought to Pass with Amendment #0030h(NT) for Feb 9 (Vote 16-0; Consent Calendar); House Calendar 12, PG.200-201 "
214677,2011-02-02,"House Proposed Committee Amendment #2011-0030h (New Title); House Calendar 12, PG.225 "
214677,2011-02-09,"House Amendment #0030h(New Title) Adopted, Voice Vote; House Journal  16, PG.310 "
214677,2011-02-09,"House Ought to Pass with Amendment #0030h(NT): Motion Adopted Voice Vote; House Journal  16, PG.310 "
214677,2011-02-23,"Senate Introduced and Referred to Education; Senate Journal 8, Pg.81 "
214677,2011-03-24,"Senate Hearing: 3/29/11, Room 103, Legislative Office Building, 1:30 p.m.; Senate Calendar 17 "
214677,2011-04-06,"Senate Committee Report: Ought to Pass, 4/13/11; Senate Calendar 19 "
214677,2011-04-13,"Senate Ought to Pass, Motion Adopted, Voice Vote; OT3rdg; Senate Journal 12, Pg.246 "
214677,2011-04-13,"Senate Passed by Third Reading Resolution; Senate Journal 12, Pg.254 "
214677,2011-04-27,"House Enrolled; House Journal  40, PG.1386 "
214677,2011-04-27,"Senate Enrolled; Senate Journal 15, Pg.292 "
214677,2011-05-11,"House Signed by Governor 05/09/2011; Effective 07/08/2011; Chapter 0035 "
214678,2010-12-30,"House Introduced 1/5/2011 and Referred to Municipal and County Government; House Journal  8, PG.129 "
214678,2011-01-11,"House ===CANCELLED=== Public Hearing: 1/12/2011 1:45 PM Legislative Office Building 301 "
214678,2011-01-11,"House Public Hearing: 1/18/2011 10:45 Amendment Legislative Office Building 301 "
214678,2011-01-11,"House ==CANCELLED==Executive Session: 1/18/2011 1:30 PM Legislative Office Building 301 ==TIME CHANGE (Orig 11:00 Amendment)== "
214678,2011-01-19,"House Executive Session: 1/27/2011 1:00 PM Legislative Office Building 301 "
214678,2011-02-01,"House Committee Report: Ought to Pass with Amendment #0046h for Feb 9 (Vote 14-0; Consent Calendar); House Calendar 12, PG.203 "
214678,2011-02-01,"House Proposed Committee Amendment #2011-0046h; House Calendar 12, PG.225 "
214678,2011-02-09,"House Amendment #0046h Adopted, Voice Vote; House Journal  16, PG.313 "
214678,2011-02-09,"House Ought to Pass with Amendment #0046h: Motion Adopted Voice Vote; House Journal  16, PG.313 "
214678,2011-03-16,"Senate Introduced and Referred to Public and Municipal Affairs; Senate Journal 10, Pg.169 "
214678,2011-03-24,"Senate Hearing: 3/29/11, Room 101, Legislative Office Building, 10:00 a.m.; Senate Calendar 17 "
214678,2011-03-29,"Senate Committee Report: Ought to Pass with Amendment #2011-1265s, 4/13/11; Senate Calendar 19 "
214678,2011-04-13,"Senate Committee Amendment 1265s, Amendment Adopted, Voice Vote; Senate Journal 12, Pg.250 "
214678,2011-04-13,"Senate Ought to Pass with Amendment 1265s, Motion Adopted, Voice Vote; OT3rdg; Senate Journal 12, Pg.250 "
214678,2011-04-13,"Senate Passed by Third Reading Resolution; Senate Journal 12, Pg.254 "
214678,2011-05-04,"House House Concurs with Senate Amendment #1265s (Rep Ferrante): Motion Adopted Voice Vote; House Journal  42, PG.1448 "
214678,2011-05-18,"Senate Enrolled; Senate Journal 18, Pg.363 "
214678,2011-05-18,"House Enrolled; House Journal  44, PG.1564 "
214678,2011-06-01,"House Signed By Governor 05/27/2011; Effective 07/26/2011; Chapter 0091 "
214679,2010-12-30,"House Introduced 1/5/2011 and Referred to Health, Human Services and Elderly Affairs; House Journal  8, PG.129 "
214679,2011-01-04,"House Public Hearing: 1/11/2011 10:00 Amendment Legislative Office Building 205 "
214679,2011-01-11,"House Subcommittee Work Session: 1/19/2011 2:30 PM Legislative Office Building 205 "
214679,2011-01-20,"House Executive Session: 1/25/2011 1:30 PM Legislative Office Building 205 "
214679,2011-01-26,"House Committee Report: Ought to Pass for Feb 9 (Vote 17-0; Regular Calendar); House Calendar 10, PG.150 "
214679,2011-02-09,"House Recommit (Rep Reagan): Motion Adopted Voice Vote; House Journal  16, PG.323-324 "
214679,2011-02-22,"House ==CANCELLED== Public Hearing: 3/3/2011 9:00 Amendment Legislative Office Building 205 "
214679,2011-02-24,"House Full Committee Work Session: 3/3/2011 9:00 Amendment Legislative Office Building 205 ==Executive Session To Follow== "
214679,2011-03-04,"House Committee Report: Ought to Pass for Mar 15 (Vote 11-0; Consent Calendar); House Calendar 22, PG.531 "
214679,2011-03-15,"House Ought to Pass: Motion Adopted Voice Vote; House Journal  26, PG.715 "
214679,2011-03-23,"Senate Introduced and Referred to Health and Human Services; Senate Journal 11, Pg.190 "
214679,2011-03-24,"Senate Hearing: 4/7/11, Room 102, Legislative Office Building, 1:20 p.m.; Senate Calendar 17 "
214679,2011-04-08,"Senate Committee Report: Ought to Pass with Amendment #2011-1374s, 4/20/11; Senate Calendar 20 "
214679,2011-04-20,"Senate Committee Amendment 1374s, Amendment Adopted, Voice Vote; Senate Journal 13, Pg.265 "
214679,2011-04-20,"Senate Ought to Pass with Amendment 1374s, Motion Adopted, Voice Vote; OT3rdg; Senate Journal 13, Pg.265 "
214679,2011-04-20,"Senate Passed by Third Reading Resolution; Senate Journal 13, Pg.270 "
214679,2011-04-27,"House House Concurs with Senate Amendment #1374s (Rep Reagan): Motion Adopted Voice Vote; House Journal  40, PG.1352 "
214679,2011-05-04,"Senate Enrolled; Senate Journal 16, Pg.318 "
214679,2011-05-04,"House Enrolled; House Journal  42, PG.1490 "
214679,2011-05-19,"House Signed by Governor 05/16/2011; Effective 07/01/2011; Chapter 0063 "
214680,2010-12-30,"House Introduced 1/5/2011 and Referred to Ways and Means; House Journal  8, PG.129 "
214680,2011-01-26,"House Public Hearing: 2/3/2011 11:00 Amendment Legislative Office Building 202 "
214680,2011-02-15,"House Executive Session: 2/16/2011 Legislative Office Building 202 Following House Session "
214680,2011-02-16,"House Committee Report: Ought to Pass for Feb 23 (Vote 18-1; Consent Calendar); House Calendar 15, PG.274 "
214680,2011-02-23,"House Ought to Pass: Motion Adopted Voice Vote; House Journal  21, PG.465 "
214680,2011-03-16,"Senate Introduced and Referred to Transportation; Senate Journal 10, Pg.169 "
214680,2011-03-24,"Senate Hearing: 3/31/11, Room 103, Legislative Office Building, 9:00 a.m.; Senate Calendar 17 "
214680,2011-04-14,"Senate Committee Report: Ought to Pass with Amendment #2011-1439s, 4/20/11; Senate Calendar 20 "
214680,2011-04-20,"Senate Committee Amendment 1439s, Amendment Adopted, Voice Vote; Senate Journal 13, Pg.268 "
214680,2011-04-20,"Senate Ought to Pass with Amendment 1439s, Motion Adopted, Voice Vote; Refer to Finance Rule 4-3; Senate Journal 13, Pg.268 "
214680,2011-04-28,"Senate Committee Report: Rereferred to Committee, 5/4/11; Senate Calendar 22 "
214680,2011-05-04,"Senate Rereferred to Committee, Motion Adopted, Voice Vote; Senate Journal 15, Pg.304 "
214681,2010-12-30,"House Introduced 1/5/2011 and Referred to Election Law; House Journal  8, PG.129 "
214681,2011-01-13,"House Public Hearing: 1/18/2011 2:30 PM Legislative Office Building 308 "
214681,2011-01-26,"House Executive Session: 2/1/2011 10:30 Amendment Legislative Office Building 308 "
214681,2011-02-03,"House Committee Report: Inexpedient to Legislate for Feb 9 (Vote 18-0; Consent Calendar); House Calendar 12, PG.201 "
214681,2011-02-09,"House Inexpedient to Legislate: Motion Adopted Voice Vote; House Journal  16, PG.311 "
214682,2010-12-30,"House Introduced 1/5/2011 and Referred to Resources, Recreation and Development; House Journal  8, PG.129 "
214682,2011-01-05,"House Public Hearing: 1/20/2011 11:00 Amendment Legislative Office Building 305 ==Executive Session to Follow== "
214682,2011-01-26,"House Committee Report: Ought to Pass with Amendment #0058h for Feb 9 (Vote 15-0; Consent Calendar); House Calendar 10, PG.147 "
214682,2011-01-26,"House Proposed Committee Amendment #2011-0058h; House Calendar 10, PG.164 "
214682,2011-02-09,"House Amendment #0058h Adopted, Voice Vote; House Journal  16, PG.315 "
214682,2011-02-09,"House Ought to Pass with Amendment #0058h: Motion Adopted Voice Vote; House Journal  16, PG.315 "
214682,2011-03-16,"Senate Introduced and Referred to Energy and Natural Resources; Senate Journal 10, Pg.169 "
214682,2011-03-24,"Senate Hearing: 3/31/11, Room 102, Legislative Office Building, 10:00 a.m.; Senate Calendar 17 "
214682,2011-04-14,"Senate Committee Report: Ought to Pass, 4/20/11; Senate Calendar 20 "
214682,2011-04-20,"Senate Ought to Pass, Motion Adopted, Voice Vote; Refer to Finance Rule 4-3; Senate Journal 13, Pg.264 "
214682,2011-04-20,"Senate Hearing: 4/28/11, Room 103, State House, 2:30 p.m.; Senate Calendar 21 "
214682,2011-05-19,"Senate Committee Report: Ought to Pass, 5/25/11; Senate Calendar 25 "
214682,2011-05-25,"Senate Ought to Pass, Motion Adopted, Voice Vote; OT3rdg; Senate Journal 18, Pg.379 "
214682,2011-05-25,"Senate Passed by Third Reading Resolution; Senate Journal 18, Pg.391 "
214682,2011-06-08,"Senate Enrolled "
214682,2011-06-08,"House Enrolled; House Journal  51, PG.1724 "
214682,2011-06-15,"House Signed By Governor 06/14/2011; Effective 06/14/2011; Chapter 0188 "
214683,2010-12-30,"House Introduced 1/5/2011 and Referred to Health, Human Services and Elderly Affairs; House Journal  8, PG.129 "
214683,2011-01-04,"House Public Hearing: 1/11/2011 11:40 Amendment Legislative Office Building 205 ==Recessed== "
214683,2011-01-11,"House Continued Public Hearing: 1/18/2011 10:00 Amendment Legislative Office Building 205 "
214683,2011-01-11,"House Subcommittee Work Session: 1/18/2011 11:15 Amendment Legislative Office Building 205 "
214683,2011-02-09,"House Subcommittee Work Session: 2/15/2011 2:30 PM Legislative Office Building 205 "
214683,2011-02-15,"House Subcommittee Work Session: 2/16/2011 2:30 PM Legislative Office Building 205 "
214683,2011-02-23,"House Executive Session: 3/1/2011 9:00 Amendment Legislative Office Building 205 "
214683,2011-03-02,"House Committee Report: Inexpedient to Legislate for Mar 15 (Vote 16-0; Consent Calendar); House Calendar 22, PG.531 "
214683,2011-03-15,"House Inexpedient to Legislate: Motion Adopted Voice Vote; House Journal  26, PG.715 "
214684,2010-12-30,"House Introduced 1/5/2011 and Referred to Science, Technology and Energy; House Journal  8, PG.129 "
214684,2011-01-04,"House Public Hearing: 1/11/2011 2:30 PM Legislative Office Building 304 "
214684,2011-01-13,"House Executive Session: 1/25/2011 1:15 PM Legislative Office Building 304 "
214684,2011-01-25,"House Committee Report: Inexpedient to Legislate for Feb 9 (Vote 16-0; Consent Calendar); House Calendar 10, PG.148 "
214684,2011-02-09,"House Inexpedient to Legislate: Motion Adopted Voice Vote; House Journal  16, PG.315-316 "
214685,2010-12-30,"House Introduced 1/5/2011 and Referred to Municipal and County Government; House Journal  8, PG.129 "
214685,2011-01-11,"House ==CANCELLED== Public Hearing: 1/12/2011 2:00 PM Legislative Office Building 301 "
214685,2011-01-11,"House Public Hearing: 1/18/2011 11:00 Amendment Legislative Office Building 301 "
214685,2011-01-11,"House Executive Session: 1/18/2011 1:30 PM Legislative Office Building 301 ==TIME CHANGE (Orig 11:00 Amendment)== "
214685,2011-01-19,"House Committee Report: Ought to Pass with Amendment #0021h for Jan 26 (Vote 12-0; Consent Calendar); House Calendar 9, PG.133 "
214685,2011-01-19,"House Proposed Committee Amendment #2011-0021h; House Calendar 9, PG.143-144 "
214685,2011-01-26,"House Amendment #0021h Adopted, Voice Vote; House Journal  14, PG.262 "
214685,2011-01-26,"House Ought to Pass with Amendment #0021h: Motion Adopted Voice Vote; House Journal  14, PG.262 "
214685,2011-01-26,"Senate Introduced 1/19/11 and Referred to Public and Municipal Affairs, Senate Journal 3, Pg.40 "
214685,2011-01-27,"Senate Hearing: 2/1/11, Room 100 State House, 9:15 a.m.; Senate Calendar 9 "
214685,2011-02-03,"Senate Sen. Bradley Moved to suspend rules to dispense with notice of committee report in Senate Calendar on HB77, Motion Adopted, Voice Vote; 2/3 nec.; Senate Journal 4, Pg.40 "
214685,2011-02-03,"Senate Committee Report: Ought to Pass, 2/3/11; Senate Journal 4, Pg.41 "
214685,2011-02-03,"Senate Ought to Pass, Motion Adopted, Voice Vote; OT3rdg; Senate Journal 4, Pg.41 "
214685,2011-02-03,"Senate Passed by Third Reading Resolution; Senate Journal 4, Pg.42 "
214685,2011-02-03,"Senate Enrolled, Senate Journal 5, Pg.47 "
214685,2011-02-03,"House Enrolled; House Journal  14, PG.265 "
214685,2011-02-07,"House Signed by the Governor 02/04/2011; Effective 02/04/2011; Chapter 0001 "
214686,2010-12-30,"House Introduced 1/5/2011 and Referred to Transportation; House Journal  8, PG.129 "
214686,2011-01-05,"House Public Hearing: 1/18/2011 11:15 Amendment Legislative Office Building 203 "
214686,2011-01-25,"House Executive Session: 1/26/2011 Legislative Office Building 203 Following Session "
214686,2011-01-26,"House Committee Report: Inexpedient to Legislate for Feb 9 (Vote 11-0; Consent Calendar); House Calendar 10, PG.148 "
214686,2011-02-09,"House Inexpedient to Legislate: Motion Adopted Voice Vote; House Journal  16, PG.316 "
214687,2010-12-30,"House Introduced 1/5/2011 and Referred to Criminal Justice and Public Safety; House Journal  8, PG.129 "
214687,2011-01-04,"House Public Hearing: 1/13/2011 11:30 Amendment Legislative Office Building 204 "
214687,2011-01-13,"House Subcommittee Work Session: 1/18/2011 9:30 Amendment Legislative Office Building 204 "
214687,2011-01-13,"House Executive Session: 1/18/2011 1:00 PM Legislative Office Building 204 "
214687,2011-01-20,"House Committee Report: Ought to Pass with Amendment #0019h for Feb 9 (Vote 11-0; Consent Calendar); House Calendar 10, PG.146 "
214687,2011-01-20,"House Proposed Committee Amendment #2011-0019h; House Calendar 10, PG.164 "
214687,2011-02-09,"House Amendment #0019h Adopted, Voice Vote; House Journal  16, PG.310 "
214687,2011-02-09,"House Ought to Pass with Amendment #0019h: Motion Adopted Voice Vote; House Journal  16, PG.310 "
214687,2011-03-16,"Senate Introduced and Referred to Judiciary; Senate Journal 10, Pg.169 "
214687,2011-03-17,"Senate Hearing: 3/24/11, Room 101, Legislative Office Building, 1:15 p.m.; Senate Calendar 16 "
214687,2011-03-29,"Senate Committee Report: Ought to Pass, 4/13/11; Senate Calendar 19 "
214687,2011-04-13,"Senate Ought to Pass, Motion Adopted, Voice Vote; OT3rdg; Senate Journal 12, Pg.250 "
214687,2011-04-13,"Senate Passed by Third Reading Resolution; Senate Journal 12, Pg.254 "
214687,2011-04-27,"House Enrolled; House Journal  40, PG.1386 "
214687,2011-04-27,"Senate Enrolled; Senate Journal 15, Pg.292 "
214687,2011-05-11,"House Signed by Governor 05/09/2011; Effective 05/09/2011; Chapter 0036 "
214688,2010-12-30,"House Introduced 1/5/2011 and Referred to Criminal Justice and Public Safety; House Journal  8, PG.129 "
214688,2011-01-11,"House Public Hearing: 1/18/2011 10:30 Amendment Legislative Office Building 204 "
214688,2011-01-26,"House Executive Session: 2/3/2011 10:00 Amendment Legislative Office Building 204 "
214688,2011-02-03,"House Committee Report: Ought to Pass with Amendment #0034h(NT) for Feb 15 (Vote 16-0; Consent Calendar); House Calendar 13, PG.230 "
214688,2011-02-03,"House Proposed Committee Amendment #2011-0034h (New Title); House Calendar 13, PG.255-256 "
214688,2011-02-15,"House Amendment #0034h (New Title) Adopted, Voice Vote; House Journal  17, PG.358 "
214688,2011-02-15,"House Ought to Pass with Amendment #0034h(NT): Motion Adopted Voice Vote; House Journal  17, PG.358 "
214688,2011-03-16,"Senate Introduced and Referred to Executive Departments and Administration; Senate Journal 10, Pg.169 "
214688,2011-03-31,"Senate Hearing: 4/7/11, Room 100, State House, 9:10 a.m.; Senate Calendar 18 "
214688,2011-04-07,"Senate Committee Report: Ought to Pass, 4/13/11; Senate Calendar 19 "
214688,2011-04-13,"Senate Ought to Pass, Motion Adopted, Voice Vote; OT3rdg; Senate Journal 12, Pg.249 "
214688,2011-04-13,"Senate Passed by Third Reading Resolution; Senate Journal 12, Pg.254 "
214688,2011-04-27,"House Enrolled; House Journal  40, PG.1386 "
214688,2011-04-27,"Senate Enrolled; Senate Journal 15, Pg.292 "
214688,2011-05-11,"House Signed by Governor 05/09/2011; Effective 05/09/2011; Chapter 0037 "
214689,2010-12-30,"House Introduced 1/5/2011 and Referred to Children and Family Law; House Journal  8, PG.129 "
214689,2011-01-05,"House Public Hearing: 1/13/2011 11:00 Amendment Legislative Office Building 206 "
214689,2011-02-10,"House Subcommittee Work Session: 2/17/2011 2:45 PM Legislative Office Building 206 "
214689,2011-03-01,"House Executive Session: 3/7/2011 10:00 Amendment Legislative Office Building 206 "
214689,2011-03-08,"House Committee Report: Inexpedient to Legislate for Mar 15 (Vote 9-2; Regular Calendar); House Calendar 22, PG.545 "
214689,2011-03-15,"House Inexpedient to Legislate: Motion Adopted Voice Vote; House Journal  26, PG.748-749 "
214690,2010-12-30,"House Introduced 1/5/2011 and Referred to Criminal Justice and Public Safety "
214690,2011-01-11,"House Public Hearing: 1/18/2011 10:45 Amendment Legislative Office Building 204 "
214690,2011-01-18,"House Subcommittee Work Session: 1/20/2011 1:00 PM Legislative Office Building 204 "
214690,2011-01-26,"House Executive Session: 2/3/2011 10:00 Amendment Legislative Office Building 204 "
214690,2011-02-03,"House Committee Report: Ought to Pass for Feb 15 (Vote 16-0; Consent Calendar); House Calendar 13, PG.230 "
214690,2011-02-15,"House Ought to Pass: Motion Adopted Voice Vote; House Journal  17, PG.358 "
214690,2011-03-16,"Senate Introduced and Referred to Judiciary; Senate Journal 10, Pg.169 "
214690,2011-05-04,"Senate Hearing: 5/12/11, Room 101, Legislative Office Building, 1:30 p.m.; Senate Calendar 23 "
214690,2011-05-26,"Senate Committee Report: Ought to Pass with Amendment #2011-2195s, 6/1/11; Senate Calendar 26 "
214690,2011-06-01,"Senate Committee Amendment 2195s, Amendment Adopted, Voice Vote; Senate Journal 19, Pg.518 "
214690,2011-06-01,"Senate Ought to Pass with Amendment 2195s, Motion Adopted, Voice Vote; OT3rdg; Senate Journal 19, Pg.518 "
214690,2011-06-01,"Senate Passed by Third Reading Resolution; Senate Journal 19, Pg.539 "
214690,2011-06-08,"House House Concurs with Senate Amendment #2195s (Rep Swinford): Motion Adopted Voice Vote; House Journal  51, PG.1712 "
214690,2011-06-08,"Senate Enrolled "
214690,2011-06-08,"House Enrolled; House Journal  51, PG.1728 "
214690,2011-06-28,"House Signed By Governor 06/28/2011; Effective 06/28/2011; Chapter 0219 "
214691,2010-12-30,"House Introduced 1/5/2011 and Referred to Transportation; House Journal  8, PG.129  "
214691,2011-01-05,"House Public Hearing: 1/18/2011 11:30 Amendment Legislative Office Building 203 "
214691,2011-01-25,"House Executive Session: 1/26/2011 Legislative Office Building 203 Following Session "
214691,2011-01-26,"House Committee Report: Ought to Pass for Feb 15 (Vote 10-1); House Calendar 13, PG.233 "
214691,2011-02-15,"House Ought to Pass: Motion Adopted Voice Vote; House Journal  17, PG.361 "
214691,2011-02-15,"House Referred to Ways and Means; House Journal  17, PG.361 "
214691,2011-03-01,"House Public Hearing: 3/9/2011 11:00 Amendment Legislative Office Building 202 "
214691,2011-03-10,"House Executive Session: 3/22/2011 1:00 PM Legislative Office Building 202 "
214691,2011-03-22,"House Majority Committee Report: Inexpedient to Legislate for Mar 30 (Vote 14-7; Regular Calendar); House Calendar 27, PG.821-822 "
214691,2011-03-22,"House Minority Committee Report: Ought to Pass; House Calendar 27, PG.821-822 "
214691,2011-03-30,"House Inexpedient to Legislate: Motion Adopted Division Vote 230-111; House Journal  34, PG.1159 "
214692,2010-12-30,"House Introduced 1/5/2011 and Referred to Environment and Agriculture; House Journal  8, PG.129 "
214692,2011-01-11,"House Public Hearing: 1/25/2011 11:00 Amendment Legislative Office Building 303 "
214692,2011-01-26,"House Executive Session: 2/1/2011 11:00 Amendment Legislative Office Building 303 "
214692,2011-02-08,"House Majority Committee Report: Ought to Pass with Amendment #0113h for Feb 15 (Vote 10-7; Regular Calendar); House Calendar 13, PG.234 "
214692,2011-02-08,"House Proposed Majority Committee Amendment #2011-0113h; House Calendar 13, PG.256 "
214692,2011-02-08,"House Minority Committee Report: Inexpedient to Legislate; House Calendar 13, PG.234 "
214692,2011-02-15,"House Amendment #0113h Adopted, Voice Vote; House Journal  17, PG.365 "
214692,2011-02-15,"House Ought to Pass with Amendment #0113h: Motion Failed Regular Calendar 121-237; House Journal  17, PG.365-367 "
214692,2011-02-15,"House Inexpedient to Legislate (Rep Jasper): Motion Adopted Division Vote 260-101; House Journal  17, PG.367 "
214693,2010-12-30,"House Introduced 1/5/2011 and Referred to Municipal and County Government; House Journal  8, PG.129 "
214693,2011-01-11,"House Public Hearing: 1/18/2011 11:15 Amendment Legislative Office Building 301 "
214693,2011-01-11,"House ==CANCELLED==Executive Session: 1/18/2011 1:30 PM Legislative Office Building 301 "
214693,2011-01-19,"House Executive Session: 1/27/2011 1:00 PM Legislative Office Building 301 "
214693,2011-02-01,"House Committee Report: Inexpedient to Legislate for Feb 9 (Vote 14-2; Regular Calendar); House Calendar 12, PG.208 "
214693,2011-02-09,"House Inexpedient to Legislate: Motion Adopted Voice Vote; House Journal  16, PG.324 "
214694,2010-12-30,"House Introduced 1/5/2011 and Referred to Municipal and County Government; House Journal  8, PG.129 "
214694,2011-01-11,"House ==CANCELLED== Public Hearing: 1/20/2011 10:00 Amendment Legislative Office Building 301 "
214694,2011-01-19,"House Public Hearing: 1/27/2011 10:00 Amendment Legislative Office Building 301 "
214694,2011-01-19,"House Executive Session: 1/27/2011 1:00 PM Legislative Office Building 301 "
214694,2011-02-01,"House Committee Report: Ought to Pass with Amendment #0093h for Feb 9 (Vote 16-0; Consent Calendar); House Calendar 12, PG.203 "
214694,2011-02-01,"House Proposed Committee Amendment #2011-0093h; House Calendar 12, PG.226 "
214694,2011-02-09,"House Amendment #0093h Adopted, Voice Vote; House Journal  16, PG.313 "
214694,2011-02-09,"House Ought to Pass with Amendment #0093h: Motion Adopted Voice Vote; House Journal  16, PG.313 "
214694,2011-03-16,"Senate Introduced and Referred to Public and Municipal Affairs; Senate Journal 10, Pg.169 "
214694,2011-04-07,"Senate Hearing: 4/12/11, Room 101, Legislative Office Building, 9:00 a.m.; Senate Calendar 19 "
214694,2011-04-13,"Senate Committee Report: Ought to Pass, 4/20/11; Senate Calendar 20 "
214694,2011-04-20,"Senate Ought to Pass, Motion Adopted, Voice Vote; OT3rdg; Senate Journal 13, Pg.266 "
214694,2011-04-20,"Senate Passed by Third Reading Resolution; Senate Journal 13, Pg.270 "
214694,2011-05-04,"Senate Enrolled Bill Amendment #1571 Adopted; Senate Journal 16, Pg.316 "
214694,2011-05-04,"House Enrolled Bill Amendment #2011-1571e Adopted; House Journal  42, PG.1490 "
214694,2011-05-04,"House Enrolled; House Journal  42, PG.1492 "
214694,2011-05-11,"Senate Enrolled; Senate Journal 17, Pg.344 "
214694,2011-06-01,"House Signed By Governor 05/27/2011; Effective 05/27/2011; Chapter 0092 "
214695,2010-12-30,"House Introduced 1/5/2011 and Referred to Election Law; House Journal  8, PG.129 "
214695,2011-01-13,"House Public Hearing: 1/18/2011 10:45 Amendment Legislative Office Building 308 "
214695,2011-01-26,"House Executive Session: 2/1/2011 10:30 Amendment Legislative Office Building 308 "
214695,2011-02-03,"House Committee Report: Inexpedient to Legislate for Feb 9 (Vote 18-0; Consent Calendar); House Calendar 12, PG.201 "
214695,2011-02-09,"House Removed from Consent Calendar (Rep Drisko); House Journal  16, PG.309 "
214695,2011-02-09,"House Inexpedient to Legislate: Motion Adopted Voice Vote; House Journal  16, PG.330 "
214696,2010-12-30,"House Introduced 1/5/2011 and Referred to Executive Departments and Administration; House Journal  8, PG.130 "
214696,2011-01-06,"House ===CANCELLED=== Public Hearing: 1/13/2011 10:30 Amendment Legislative Office Building 306 "
214696,2011-01-13,"House Public Hearing: 1/18/2011 10:30 Amendment Legislative Office Building 306 "
214696,2011-01-13,"House Executive Session: 1/18/2011 11:00 Amendment Legislative Office Building 306 "
214696,2011-01-19,"House Committee Report: Ought to Pass for Jan 26 (Vote 12-0; Consent Calendar); House Calendar 9, PG.133 "
214696,2011-01-26,"House Ought to Pass: Motion Adopted Voice Vote; House Journal  14, PG.261 "
214696,2011-03-16,"Senate Introduced and Referred to Executive Departments and Administration; Senate Journal 10, Pg.169 "
214696,2011-03-31,"Senate Hearing: 4/7/11, Room 100, State House, 9:25 a.m.; Senate Calendar 18 "
214696,2011-04-07,"Senate Committee Report: Ought to Pass, 4/13/11; Senate Calendar 19 "
214696,2011-04-13,"Senate Ought to Pass, Motion Adopted, Voice Vote; OT3rdg; Senate Journal 12, Pg.249 "
214696,2011-04-13,"Senate Passed by Third Reading Resolution; Senate Journal 12, Pg.254 "
214696,2011-04-27,"House Enrolled; House Journal  40, PG.1386 "
214696,2011-04-27,"Senate Enrolled; Senate Journal 15, Pg.293 "
214696,2011-05-11,"House Signed by Governor 05/09/2011; Effective 05/09/2011; Chapter 0038 "
214697,2010-12-30,"House Introduced and Referred 1/5/11 to State-Federal Relations and Veterans Affairs; House Journal  8, PG.130  "
214697,2011-01-05,"House Public Hearing: 1/13/2011 1:00 PM Legislative Office Building 203 "
214697,2011-01-13,"House Subcommittee Work Session: 1/19/2011 10:30 Amendment Legislative Office Building 203 "
214697,2011-01-14,"House Executive Session: 1/20/2011 9:30 Amendment Legislative Office Building 203 "
214697,2011-01-20,"House Majority Committee Report: Ought to Pass with Amendment #0037h(NT) for Feb 9 (Vote 11-3; Regular Calendar); House Calendar 10, PG.150-151 "
214697,2011-01-20,"House Proposed Majority Committee Amendment #2011-0037h (New Title); House Calendar 10, PG.165 "
214697,2011-01-24,"House Minority Committee Report: Inexpedient to Legislate; House Calendar 10, PG.150-151 "
214697,2011-02-09,"House Amendment #0037h (New Title) Adopted, Voice Vote; House Journal  16, PG.325 "
214697,2011-02-09,"House Ought to Pass with Amendment #0037h(NT): Motion Adopted Regular Calendar 267-103; House Journal  16, PG.325-328 "
214697,2011-02-09,"House Referred to Constitutional Review and Statutory Recodification; House Journal  16, PG.328 "
214697,2011-02-10,"House Public Hearing: 2/22/2011 10:00 Amendment Legislative Office Building 206 "
214697,2011-02-23,"House Executive Session: 3/1/2011 10:00 Amendment Legislative Office Building 206 ==RECESSED== "
214697,2011-03-01,"House Continued Executive Session: 3/3/2011 10:00 Amendment Legislative Office Building 303 "
214697,2011-03-08,"House Majority Committee Report: Ought to Pass for Mar 15 (Vote 12-5; Regular Calendar); House Calendar 22, PG.547-548 "
214697,2011-03-08,"House Minority Committee Report: Inexpedient to Legislate; House Calendar 22, PG.547-548 "
214697,2011-03-15,"House Ought to Pass: Motion Adopted Regular Calendar 259-107; House Journal  26, PG.756-759 "
214697,2011-04-20,"Senate Introduced and Referred to Commerce; Senate Journal 14, Pg.272 "
214697,2011-04-21,"Senate Hearing: 4/26/11, Room 102, Legislative Office Building, 10:00 a.m.; Senate Calendar 21 "
214697,2011-04-27,"Senate Committee Report: Ought to Pass with Amendment #2011-1585s, New Title, 5/4/11; Senate Calendar 22 "
214697,2011-05-04,"Senate Committee Amendment 1585s Not Voted On; Senate Journal 15 "
214697,2011-05-04,"Senate Sen. White Moved Laid on Table, Motion Adopted, Voice Vote; Senate Journal 15, Pg.297 "
214698,2010-12-30,"House Introduced 1/5/2011 and Referred to Transportation; House Journal  8, PG.130 "
214698,2011-01-05,"House Public Hearing: 1/18/2011 1:00 PM Legislative Office Building 203 "
214698,2011-01-25,"House ==CANCELLED== Executive Session: 1/26/2011 Legislative Office Building 203 Following Session "
214698,2011-02-16,"House Executive Session: 2/16/2011 1:45 PM Legislative Office Building 203 "
214698,2011-02-17,"House Committee Report: Ought to Pass with Amendment #0084h for Mar 2 (Vote 12-3; Regular Calendar); House Calendar 18, PG.392 "
214698,2011-02-17,"House Proposed Committee Amendment #2011-0084h; House Calendar 18, PG.409 "
214698,2011-03-02,"House Amendment #0084h Adopted, Voice Vote; House Journal  25, PG.687 "
214698,2011-03-02,"House Ought to Pass with Amendment #0084h: Motion Adopted Voice Vote; House Journal  25, PG.687 "
214698,2011-03-09,"Senate Introduced and Referred to Transportation; Senate Journal 9, Pg.102 "
214698,2011-03-16,"Senate Hearing: 3/24/11, Room 103, Legislative Office Building, 10:00 a.m.; Senate Calendar 16 "
214698,2011-04-14,"Senate Committee Report: Ought to Pass with Amendment #2011-1437s, 4/20/11; Senate Calendar 20 "
214698,2011-04-20,"Senate Committee Amendment 1437s, Amendment Adopted, Voice Vote; Senate Journal 13, Pg.268 "
214698,2011-04-20,"Senate Ought to Pass with Amendment 1437s, Motion Adopted, Voice Vote; OT3rdg; Senate Journal 13, Pg.268 "
214698,2011-04-20,"Senate Passed by Third Reading Resolution; Senate Journal 13, Pg.270 "
214698,2011-05-18,"House House Concurs with Senate Amendment #1437s (Rep Packard): Motion Adopted Voice Vote; House Journal  44, PG.1532 "
214698,2011-06-01,"Senate Enrolled; Senate Journal 20, Pg.546 "
214698,2011-06-01,"House Enrolled; House Journal  48, PG.1669 "
214698,2011-06-09,"House Signed By Governor 06/08/2011; Effective 01/01/2012; Chapter 0149 "
214699,2010-12-30,"House Introduced 1/5/2011 and Referred to Public Works and Highways; House Journal  8, PG.130 "
214699,2011-01-04,"House Public Hearing: 1/11/2011 2:15 PM Legislative Office Building 201 "
214699,2011-01-11,"House DOT Briefing: 1/18/2011 10:15 Amendment Legislative Office Building 201 "
214699,2011-01-11,"House Executive Session: 1/18/2011 11:00 Amendment Legislative Office Building 201 "
214699,2011-01-20,"House Committee Report: Ought to Pass with Amendment #0008h for Jan 26 (Vote 13-0; Consent Calendar); House Calendar 9, PG.134 "
214699,2011-01-20,"House Proposed Committee Amendment #2011-0008h; House Calendar 9, PG.144 "
214699,2011-01-26,"House Amendment #0008h Adopted, Voice Vote; House Journal  14, PG.262 "
214699,2011-01-26,"House Ought to Pass with Amendment #0008h: Motion Adopted Voice Vote; House Journal  14, PG.262 "
214699,2011-03-09,"Senate Introduced and Referred to Capital Budget; Senate Journal 9, Pg.102 "
214699,2011-03-17,"Senate Hearing: 3/22/11, Room 100, State House, 1:15 p.m.; Senate Calendar 16 "
214699,2011-03-22,"Senate Committee Report: Ought to Pass, 3/30/11; Senate Calendar 17 "
214699,2011-03-30,"Senate Ought to Pass, Motion Adopted, Voice Vote; OT3rdg; Senate Journal 11, Pg.195 "
214699,2011-03-30,"Senate Passed by Third Reading Resolution; Senate Journal 11, Pg.240 "
214699,2011-04-13,"Senate Enrolled; Senate Journal 13, Pg.259 "
214699,2011-04-13,"House Enrolled; House Journal  37, Pg.1304 "
214699,2011-04-28,"House Signed by the Governor 04/25/2011; Effective 06/24/2011; Chapter 0006 "
214700,2010-12-30,"House Introduced 1/5/2011 and Referred to Executive Departments and Administration; House Journal  8, PG.130 "
214700,2011-01-04,"House Public Hearing: 1/13/2011 10:00 Amendment Legislative Office Building 306 "
214700,2011-01-13,"House Executive Session: 1/18/2011 11:00 Amendment Legislative Office Building 306 "
214700,2011-01-19,"House Committee Report: Ought to Pass for Jan 26 (Vote 12-0; Consent Calendar); House Calendar 9, PG.133 "
214700,2011-01-26,"House Ought to Pass: Motion Adopted Voice Vote; House Journal  14, PG.261 "
214700,2011-03-16,"Senate Introduced and Referred to Executive Departments and Administration; Senate Journal 10, Pg.169 "
214700,2011-04-07,"Senate Hearing: 4/14/11, Room 100, State House, 9:20 a.m.; Senate Calendar 19 "
214700,2011-04-14,"Senate Committee Report: Ought to Pass, 4/20/11; Senate Calendar 20 "
214700,2011-04-20,"Senate Ought to Pass, Motion Adopted, Voice Vote; OT3rdg; Senate Journal 13, Pg.265 "
214700,2011-04-20,"Senate Passed by Third Reading Resolution; Senate Journal 13, Pg.270 "
214700,2011-05-04,"Senate Enrolled; Senate Journal 16, Pg.318 "
214700,2011-05-04,"House Enrolled; House Journal  42, PG.1490 "
214700,2011-05-19,"House Signed by Governor 05/16/2011; Effective 07/01/2011; Chapter 0064 "
214701,2010-12-30,"House Introduced 1/5/2011 and Referred to Fish and Game and Marine Resources; House Journal  8, PG.130 "
214701,2011-01-19,"House Public Hearing: 1/25/2011 10:30 Amendment Legislative Office Building 307 ==Executive Session to Follow== "
214701,2011-01-25,"House Committee Report: Ought to Pass for Feb 9 (Vote 13-0; Consent Calendar); House Calendar 10, PG.146 "
214701,2011-02-09,"House Ought to Pass: Motion Adopted Voice Vote; House Journal  16, PG.311 "
214701,2011-03-16,"Senate Introduced and Referred to Energy and Natural Resources; Senate Journal 10, Pg.169 "
214701,2011-03-17,"Senate Hearing: 3/24/11, Room 102, Legislative Office Building, 10:30 a.m.; Senate Calendar 16 "
214701,2011-03-24,"Senate Committee Report: Ought to Pass, 3/30/11; Senate Calendar 17 "
214701,2011-03-30,"Senate Ought to Pass, Motion Adopted, Voice Vote; OT3rdg; Senate Journal 11, Pg.211 "
214701,2011-03-30,"Senate Passed by Third Reading Resolution; Senate Journal 11, Pg.240 "
214701,2011-04-13,"Senate Enrolled; Senate Journal 13, Pg.259 "
214701,2011-04-13,"House Enrolled; House Journal  37, Pg.1304 "
214701,2011-04-28,"House Signed by the Governor 04/25/2011; Effective 06/24/2011; Chapter 0007 "
214702,2010-12-30,"House Introduced 1/5/2011 and Referred to Judiciary; House Journal  8, PG.130 "
214702,2011-01-05,"House Public Hearing: 1/11/2011 1:30 PM Legislative Office Building 208 "
214702,2011-01-13,"House Division I Work Session: 1/18/2011 1:30 PM Legislative Office Building 208 "
214702,2011-01-13,"House Division I Work Session: 1/20/2011 1:30 PM Legislative Office Building 208 "
214702,2011-01-26,"House Executive Session: 2/1/2011 11:00 Amendment Legislative Office Building 208 "
214702,2011-02-03,"House Majority Committee Report: Inexpedient to Legislate for Feb 9 (Vote 16-1; Regular Calendar); House Calendar 12, PG.207-208 "
214702,2011-02-03,"House Minority Committee Report: Ought to Pass; House Calendar 12, PG.207-208 "
214702,2011-02-09,"House Inexpedient to Legislate: Motion Adopted Voice Vote; House Journal  16, PG.324 "
214703,2010-12-30,"House Introduced 1/5/2011 and Referred to Commerce and Consumer Affairs; House Journal  8, PG.130 "
214703,2011-01-05,"House Public Hearing: 1/13/2011 10:45 Amendment Legislative Office Building 302 Insurance/Consumer Regulation Div "
214703,2011-01-26,"House Executive Session: 2/1/2011 10:00 Amendment Legislative Office Building 302 "
214703,2011-02-03,"House Committee Report: Ought to Pass for Feb 9 (Vote 14-0; Consent Calendar); House Calendar 12, PG.200 "
214703,2011-02-09,"House Ought to Pass: Motion Adopted Voice Vote; House Journal  16, PG.309 "
214703,2011-03-16,"Senate Introduced and Referred to Commerce; Senate Journal 10, Pg.169 "
214703,2011-03-31,"Senate Hearing: 4/6/11, Room 102, Legislative Office Building, 10:00 a.m.; Senate Calendar 18 "
214703,2011-04-06,"Senate Committee Report: Ought to Pass, 4/13/11; Senate Calendar 19 "
214703,2011-04-13,"Senate Ought to Pass, Motion Adopted, Voice Vote; OT3rdg; Senate Journal 12, Pg.245 "
214703,2011-04-13,"Senate Passed by Third Reading Resolution; Senate Journal 12, Pg.254 "
214703,2011-04-27,"House Enrolled; House Journal  40, PG.1386 "
214703,2011-04-27,"Senate Enrolled; Senate Journal 15, Pg.293 "
214703,2011-05-11,"House Signed by Governor 05/09/2011; Effective 07/08/2011; Chapter 0039 "
214704,2010-12-30,"House Introduced 1/5/2011 and Referred to Commerce and Consumer Affairs; House Journal  8, PG.130 "
214704,2011-01-05,"House Public Hearing: 1/13/2011 10:00 Amendment Legislative Office Building 302 Insurance/Consumer Regulation Div "
214704,2011-01-18,"House Subcommittee Work Session: 1/27/2011 9:00 Amendment Legislative Office Building 302 "
214704,2011-01-27,"House Subcommittee Work Session: 2/3/2011 9:30 Amendment Legislative Office Building 302 "
214704,2011-02-03,"House Subcommittee Work Session: 2/17/2011 9:00 Amendment Legislative Office Building 302 "
214704,2011-02-16,"House ==CANCELLED== Executive Session: 2/25/2011 10:00 Amendment Legislative Office Building 302 "
214704,2011-02-23,"House Executive Session: 3/1/2011 3:00 PM Legislative Office Building 302 "
214704,2011-03-09,"House Retained in Committee; House Calendar 27, PG.822 "
214704,2011-08-23,"House Retained Bill - Insurance/Consumer Div Subcom Work Session: 10/11/2011 1:15 PM Legislative Office Building 302 "
214704,2011-10-19,"House Retained Bill - Executive Session: 10/25/2011 1:15 PM Legislative Office Building 301-303 (If Necessary Continued 10/27/2011 1:15 PM Legislative Office Building 302) "
214705,2010-12-30,"House Introduced 1/5/2011 and Referred to Transportation; House Journal  8, PG.130 "
214705,2011-01-05,"House Public Hearing: 1/18/2011 1:30 PM Legislative Office Building 203 "
214705,2011-01-25,"House Executive Session: 1/26/2011 Legislative Office Building 203 Following Session "
214705,2011-01-26,"House Committee Report: Inexpedient to Legislate for Feb 9 (Vote 11-0; Consent Calendar); House Calendar 10, PG.149 "
214705,2011-02-09,"House Inexpedient to Legislate: Motion Adopted Voice Vote; House Journal  16, PG.316 "
214706,2010-12-30,"House Introduced 1/5/2011 and Referred to Transportation; House Journal  8, PG.130 "
214706,2011-01-05,"House Public Hearing: 1/18/2011 2:00 PM Legislative Office Building 203 "
214706,2011-01-25,"House Executive Session: 1/26/2011 Legislative Office Building 203 Following Session "
214706,2011-01-26,"House Committee Report: Inexpedient to Legislate for Feb 9 (Vote 10-1; Consent Calendar); House Calendar 10, PG.149 "
214706,2011-02-09,"House Inexpedient to Legislate: Motion Adopted Voice Vote; House Journal  16, PG.316 "
214707,2010-12-30,"House Introduced 1/5/2011 and Referred to Election Law; House Journal  8, PG.130 "
214707,2011-01-13,"House Public Hearing: 1/18/2011 1:15 PM Legislative Office Building 308 "
214707,2011-03-02,"House Executive Session: 3/9/2011 10:30 Amendment Legislative Office Building 308 "
214707,2011-03-10,"House Committee Report: Inexpedient to Legislate for Mar 15 (Vote 16-0; Consent Calendar); House Calendar 22, PG.528 "
214707,2011-03-15,"House Inexpedient to Legislate: Motion Adopted Voice Vote; House Journal  26, PG.707 "
214708,2010-12-30,"House Introduced 1/5/2011 and Referred to Environment and Agriculture; House Journal  8, PG.130  "
214708,2011-01-04,"House Public Hearing: 1/18/2011 2:00 PM Legislative Office Building 303 "
214708,2011-01-18,"House Executive Session: 1/25/2011 1:00 PM Legislative Office Building 308 "
214708,2011-01-25,"House Committee Report: Inexpedient to Legislate for Feb 9 (Vote 11-7; Regular Calendar); House Calendar 10, PG.150 "
214708,2011-02-09,"House Inexpedient to Legislate: Motion Adopted Regular Calendar 304-51; House Journal  16, PG.317-319 "
214709,2010-12-30,"House Introduced 1/5/2011 and Referred to Commerce and Consumer Affairs "
214709,2011-01-05,"House Public Hearing: 1/18/2011 1:15 PM Legislative Office Building 302 Banking/Business Div "
214709,2011-01-19,"House Subcommittee Work Session: 1/25/2011 11:00 Amendment Legislative Office Building 302 "
214709,2011-02-10,"House Executive Session: 2/15/2011 Legislative Office Building 302 3:00 PM or Immediately Following House Session "
214709,2011-03-02,"House Committee Report: Ought to Pass with Amendment #0266h(NT) for Mar 15 (Vote 16-0; Consent Calendar); House Calendar 22, PG.523 "
214709,2011-03-02,"House Proposed Committee Amendment #2011-0266h (New Title); House Calendar 23, PG.584 "
214709,2011-03-15,"House Amendment #0266h (New Title) Adopted, Voice Vote; House Journal  26, PG.695 "
214709,2011-03-15,"House Ought to Pass with Amendment #0266h(NT): Motion Adopted Voice Vote; House Journal  26, PG.695 "
214709,2011-03-30,"Senate Introduced and Referred to Executive Departments and Administration; Senate Journal 12, Pg.243 "
214709,2011-04-20,"Senate Hearing: 4/28/11, Room 100, State House, 9:10 a.m.; Senate Calendar 21 "
214709,2011-04-28,"Senate Committee Report: Rereferred to Committee, 5/4/11; Senate Calendar 22 "
214709,2011-05-04,"Senate Rereferred to Committee, Motion Adopted, Voice Vote; Senate Journal 15, Pg.303 "
214709,2011-09-01,"Senate Work Session on Re-referred Bill: 9/8/11, Room 100, State House, 10:00 a.m.; Senate Calendar 36 "
214709,2011-10-20,"Senate Work Session on Re-referred Bill: 11/8/11, Room 100, State House, 1:00 p.m.; Senate Calendar 43 "
214710,2010-12-30,"House Introduced 1/5/2011 and Referred to Criminal Justice and Public Safety; House Journal  8, PG.130 "
214710,2011-01-11,"House Public Hearing: 1/18/2011 11:00 Amendment Legislative Office Building 204 "
214710,2011-01-18,"House Subcommittee Work Session: 1/20/2011 1:00 PM Legislative Office Building 204 "
214710,2011-01-26,"House Executive Session: 2/3/2011 10:00 Amendment Legislative Office Building 204 "
214710,2011-02-03,"House Committee Report: Inexpedient to Legislate for Feb 15 (Vote 16-0; Consent Calendar); House Calendar 13, PG.230 "
214710,2011-02-15,"House Inexpedient to Legislate: Motion Adopted Voice Vote; House Journal  17, PG.358 "
214711,2010-12-30,"House Introduced 1/5/2011 and Referred to Election Law; House Journal  8, PG.130 "
214711,2011-01-13,"House Public Hearing: 1/18/2011 1:30 PM Legislative Office Building 308 "
214711,2011-01-26,"House Executive Session: 2/1/2011 10:30 Amendment Legislative Office Building 308 "
214711,2011-02-03,"House Committee Report: Inexpedient to Legislate for Feb 9 (Vote 18-0; Consent Calendar); House Calendar 12, PG.201 "
214711,2011-02-09,"House Inexpedient to Legislate: Motion Adopted Voice Vote; House Journal  16, PG.311 "
214712,2010-12-30,"House Introduced 1/5/2011 and Referred to Education; House Journal  8, PG.130 "
214712,2011-02-02,"House Public Hearing: 2/10/2011 11:00 Amendment Legislative Office Building 207 "
214712,2011-02-02,"House Executive Session: 2/10/2011 1:00 PM Legislative Office Building 207 "
214712,2011-02-23,"House Committee Report: Inexpedient to Legislate for Mar 2 (Vote 15-0; Consent Calendar); House Calendar 18, PG.387 "
214712,2011-03-02,"House Inexpedient to Legislate: Motion Adopted Voice Vote; House Journal  25, PG.673 "
214713,2010-12-30,"House Introduced 1/5/2011 and Referred to Election Law; House Journal  8, PG.130 "
214713,2011-01-13,"House Public Hearing: 1/18/2011 1:00 PM Legislative Office Building 308 "
214713,2011-02-16,"House Executive Session: 2/22/2011 10:30 Amendment Legislative Office Building 308 "
214713,2011-02-23,"House Committee Report: Ought to Pass with Amendment #0241h for Mar 2 (Vote 17-0; Consent Calendar); House Calendar 18, PG.387 "
214713,2011-02-23,"House Proposed Committee Amendment #2011-0241h; House Calendar 18, PG.409 "
214713,2011-03-02,"House Amendment #0241h Adopted, Voice Vote; House Journal  25, PG.673 "
214713,2011-03-02,"House Ought to Pass with Amendment #0241h: Motion Adopted Voice Vote; House Journal  25, PG.673 "
214713,2011-03-16,"Senate Introduced and Referred to Public and Municipal Affairs "
214713,2011-03-24,"Senate Hearing: 3/29/11, Room 101, Legislative Office Building, 10:15 a.m.; Senate Calendar 17 "
214713,2011-03-29,"Senate Committee Report: Ought to Pass, 4/13/11; Senate Calendar 19 "
214713,2011-04-13,"Senate Ought to Pass, Motion Adopted, Voice Vote; OT3rdg; Senate Journal 12, Pg.251 "
214713,2011-04-13,"Senate Passed by Third Reading Resolution; Senate Journal 12, Pg.254 "
214713,2011-04-27,"House Enrolled; House Journal  40, PG.1386 "
214713,2011-04-27,"Senate Enrolled; Senate Journal 15, Pg.293 "
214713,2011-05-11,"House Signed by Governor 05/09/2011; Effective 07/08/2011; Chapter 0040 "
214714,2010-12-30,"House Introduced 1/5/2011 and Referred to Commerce and Consumer Affairs; House Journal  8, PG.130 "
214714,2011-01-05,"House Public Hearing: 1/25/2011 10:00 Amendment Legislative Office Building 302 "
214714,2011-01-25,"House Subcommittee Work Session: 2/8/2011 3:00 PM Legislative Office Building 302 "
214714,2011-02-09,"House Executive Session: 2/9/2011 Legislative Office Building 302 Following House Session "
214714,2011-02-10,"House Committee Report: Inexpedient to Legislate for Feb 15 (Vote 12-1; Consent Calendar); House Calendar 13, PG.229 "
214714,2011-02-15,"House Inexpedient to Legislate: Motion Adopted Voice Vote; House Journal  17, PG.357 "
214715,2010-12-30,"House Introduced 1/5/2011 and Referred to Municipal and County Government; House Journal  8, PG.130 "
214715,2011-01-11,"House ==RESCHEDULED== Public Hearing: 1/20/2011 10:00 Amendment Legislative Office Building 301 "
214715,2011-02-01,"House ==CANCELLED== Executive Session: 2/8/2011 1:00 PM Legislative Office Building 301 "
214715,2011-02-10,"House Subcommittee Work Session: 2/22/2011 9:00 Amendment Legislative Office Building 301 "
214715,2011-02-23,"House Executive Session: 2/24/2011 1:00 PM Legislative Office Building 301 "
214715,2011-02-28,"House Retained in Committee; House Calendar 27, PG.824 "
214715,2011-04-12,"House ==CANCELLED== Retained Bill - Subcommittee Work Session: 4/20/2011 1:00 PM Legislative Office Building 301 "
214715,2011-04-20,"House Retained Bill - Subcommittee Work Session: 4/28/2011 10:00 Amendment Legislative Office Building 301 "
214715,2011-05-10,"House Retained Bill - Subcommittee Work Session: 5/17/2011 1:30 PM Legislative Office Building 301 "
214715,2011-05-10,"House Retained Bill - Subcommittee Work Session: 5/19/2011 10:15 Amendment Legislative Office Building 301 "
214715,2011-05-18,"House Retained Bill - Subcommittee Work Session: 5/24/2011 11:30 Amendment Legislative Office Building 301 "
214715,2011-09-14,"House Retained Bill - Executive Session: 10/11/2011 10:00 Amendment Legislative Office Building 301 "
214715,2011-10-14,"House Committee Report: Ought to Pass with Amendment #2090h(NT) for Jan 4 (Vote 16-0; Consent Calendar) "
214715,2011-10-14,"House Proposed Committee Amendment #2011-2090h (New Title) "
214716,2010-12-30,"House Introduced 1/5/2011 and Referred to Municipal and County Government; House Journal  8, PG.130 "
214716,2011-01-04,"House Public Hearing: 1/20/2011 1:30 PM Legislative Office Building 301 "
214716,2011-02-01,"House Executive Session: 2/8/2011 1:00 PM Legislative Office Building 301 "
214716,2011-02-09,"House Committee Report: Inexpedient to Legislate for Feb 15 (Vote 16-0; Consent Calendar); House Calendar 13, PG.232 "
214716,2011-02-15,"House Removed from Consent Calendar (Rep Ferrante); House Journal  17, PG.356 "
214716,2011-02-15,"House Special Order to Feb 16: Motion Adopted Without Objection; House Journal  17, PG.378 "
214716,2011-02-16,"House Recommit (Rep Ferrante): Motion Adopted Voice Vote; House Journal  19, PG.437 "
214716,2011-02-23,"House Executive Session: 3/1/2011 11:00 Amendment Legislative Office Building 301 "
214716,2011-03-02,"House Committee Report: Ought to Pass with Amendment #0267h for Mar 15 (Vote 13-3; Regular Calendar); House Calendar 22, PG.561 "
214716,2011-03-02,"House Proposed Committee Amendment #2011-0267h; House Calendar 23, PG.584-585 "
214716,2011-03-16,"House Amendment #0267h Adopted, Voice Vote; House Journal  28, PG.908-909 "
214716,2011-03-16,"House Ought to Pass with Amendment #0267h: Motion Adopted Voice Vote; House Journal  28, PG.908-909 "
214716,2011-03-23,"Senate Introduced and Referred to Public and Municipal Affairs; Senate Journal 11, Pg.190 "
214716,2011-04-07,"Senate Hearing: 4/12/11, Room 101, Legislative Office Building, 9:55 a.m.; Senate Calendar 19 "
214716,2011-05-05,"Senate Committee Report: Ought to Pass with Amendment #2011-1749s, 5/11/11; Senate Calendar 23 "
214716,2011-05-11,"Senate Committee Amendment 1749s, Amendment Adopted, Voice Vote; Senate Journal 16 "
214716,2011-05-11,"Senate Ought to Pass with Amendment 1749s, Motion Adopted, Voice Vote; OT3rdg; Senate Journal 16 "
214716,2011-05-11,"Senate Passed by Third Reading Resolution; Senate Journal 16 "
214716,2011-05-25,"House House Concurs with Senate Amendment #1749s (Rep Ferrante): Motion Adopted Voice Vote; House Journal  46, PG.1582 "
214716,2011-06-08,"Senate Enrolled "
214716,2011-06-08,"House Enrolled; House Journal  51, PG.1724 "
214716,2011-06-16,"House Vetoed By Governor 06/15/2011; House Calendar 49, PG.1680 "
214716,2011-06-22,"House Veto Overridden: Regular Calendar 294-72 By Required Two-Thirds; House Journal  57, PG.1825-1828 "
214716,2011-06-22,"Senate Notwithstanding the Governors Veto, Shall HB 109 Become Law: Regular Calendar 17Y-6N, Veto Overridden by required two-thirds "
214716,2011-06-23,"House Veto Override 06/22/2011; Effective 07/01/2011; Chapter 0203 "
214717,2011-01-03,"House Introduced 1/5/2011 and Referred to Criminal Justice and Public Safety; House Journal  8, PG.130 "
214717,2011-01-11,"House Public Hearing: 1/20/2011 10:00 Amendment Legislative Office Building 204 "
214717,2011-01-25,"House Subcommittee Work Session: 2/1/2011 12:00 PM Legislative Office Building 204 "
214717,2011-01-26,"House Executive Session: 2/3/2011 10:00 Amendment Legislative Office Building 204 "
214717,2011-02-03,"House Majority Committee Report: Ought to Pass with Amendment #0133h for Feb 15 (Vote 14-2; Regular Calendar); House Calendar 13, PG.234 "
214717,2011-02-03,"House Proposed Majority Committee Amendment #2011-0133h; House Calendar 13, PG.256 "
214717,2011-02-03,"House Minority Committee Report: Inexpedient to Legislate; House Calendar 13, PG.234 "
214717,2011-02-15,"House Amendment #0133h Adopted, Voice Vote; House Journal  17, PG.364-365 "
214717,2011-02-15,"House Ought to Pass with Amendment #0133h: Motion Adopted Voice Vote; House Journal  17, PG.364-365 "
214717,2011-04-13,"Senate Introduced and Referred to Judiciary; Senate Journal 13, Pg.258 "
214717,2011-05-05,"Senate Hearing: 5/26/11, Room 101, Legislative Office Building, 1:00 p.m.; Senate Calendar 23 "
214717,2011-05-26,"Senate Committee Report: Rereferred to Committee, 6/1/11; Senate Calendar 26 "
214717,2011-06-01,"Senate Rereferred to Committee, Motion Adopted, Voice Vote; Senate Journal 19, Pg.518 "
214718,2011-01-03,"House Introduced 1/5/2011 and Referred to Health, Human Services and Elderly Affairs; House Journal  8, PG.130 "
214718,2011-01-11,"House Public Hearing: 1/19/2011 2:00 PM Legislative Office Building 205 "
214718,2011-01-20,"House Executive Session: 1/25/2011 1:30 PM Legislative Office Building 205 "
214718,2011-01-25,"House Committee Report: Ought to Pass for Feb 9 (Vote 17-0; Consent Calendar); House Calendar 10, PG.147 "
214718,2011-02-09,"House Ought to Pass: Motion Adopted Voice Vote; House Journal  16, PG.312 "
214718,2011-03-09,"Senate Introduced and Referred to Health and Human Services; Senate Journal 9, Pg.102 "
214718,2011-03-15,"Senate Hearing: 3/24/11, Room 102, Legislative Office Building, 1:00 p.m.; Senate Calendar 16 "
214718,2011-04-01,"Senate Committee Report: Ought to Pass, 4/13/11; Senate Calendar 19 "
214718,2011-04-13,"Senate Ought to Pass, Motion Adopted, Voice Vote; OT3rdg; Senate Journal 12, Pg.250 "
214718,2011-04-13,"Senate Passed by Third Reading Resolution; Senate Journal 12, Pg.254 "
214718,2011-04-27,"House Enrolled; House Journal  40, PG.1386 "
214718,2011-04-27,"Senate Enrolled; Senate Journal 15, Pg.293 "
214718,2011-05-11,"House Signed by Governor 05/09/2011; Effective 07/08/2011; Chapter 0041 "
214719,2011-01-03,"House Introduced 1/5/2011 and Referred to Education; House Journal  8, PG.130 "
214719,2011-01-11,"House Public Hearing: 1/18/2011 1:30 PM Legislative Office Building 207 "
214719,2011-01-19,"House ==CANCELLED== Executive Session: 1/25/2011 2:00 PM Legislative Office Building 207 "
214719,2011-01-26,"House Executive Session: 2/1/2011 2:00 PM Legislative Office Building 207 "
214719,2011-02-02,"House Committee Report: Ought to Pass for Feb 9 (Vote 16-0; Consent Calendar); House Calendar 12, PG.201 "
214719,2011-02-09,"House Ought to Pass: Motion Adopted Voice Vote; House Journal  16, PG.310 "
214719,2011-02-23,"Senate Introduced and Referred to Education; Senate Journal 8, Pg.81 "
214719,2011-03-09,"Senate Hearing: 3/22/11, Room 103, Legislative Office Building, 1:00 p.m.; Senate Calendar 15 "
214719,2011-03-31,"Senate Committee Report: Ought to Pass, 4/13/11; Senate Calendar 19 "
214719,2011-04-13,"Senate Ought to Pass, Motion Adopted, Voice Vote; OT3rdg; Senate Journal 12, Pg.246 "
214719,2011-04-13,"Senate Passed by Third Reading Resolution; Senate Journal 12, Pg.254 "
214719,2011-04-27,"House Enrolled; House Journal  40, PG.1386 "
214719,2011-04-27,"Senate Enrolled; Senate Journal 15, Pg.293 "
214719,2011-05-11,"House Signed by Governor 05/09/2011; Effective 07/08/2011; Chapter 0042 "
214720,2011-01-03,"House Introduced 1/5/2011 and Referred to Finance; House Journal  8, PG.130 "
214720,2011-01-11,"House ==CANCELLED== Public Hearing: 1/12/2011 11:00 Amendment Legislative Office Building 210-211 "
214720,2011-01-11,"House Public Hearing: 1/19/2011 2:00 PM Legislative Office Building 210-211 "
214720,2011-01-25,"House Division II Work Session: 1/28/2011 12:30 PM Legislative Office Building 210-211 "
214720,2011-01-25,"House ==RESCHEDULED== Work Session: 2/1/2011 10:00 Amendment Legislative Office Building 210-211 "
214720,2011-01-30,"House Executive Session Following House Session: Feb 9 Legislative Office Building 210-211 "
214720,2011-01-31,"House ==CANCELLED== Executive Session: 2/14/2011 2:00 PM Legislative Office Building 210-211 "
214720,2011-02-10,"House Committee Report: Ought to Pass with Amendment #0243h(NT) for Feb 15 (Vote 19-6; Regular Calendar); House Calendar 13, PG.235 "
214720,2011-02-10,"House Proposed Committee Amendment #2011-0243h (New Title); House Calendar 13, PG.256-257 "
214720,2011-02-15,"House Amendment #0243h (New Title) Adopted, Voice Vote; House Journal  17, PG.368 "
214720,2011-02-15,"House Ought to Pass with Amendment #0243h(NT): Motion Adopted Regular Calendar 263-102; House Journal  17, PG.368-370 "
214720,2011-02-15,"House Reconsideration (Rep Vaillancourt): Motion Failed Division Vote 94-273; House Journal  17, PG.375 "
214720,2011-03-09,"Senate Introduced and Referred to Finance; Senate Journal 9, Pg.102 "
214720,2011-03-24,"Senate Hearing: 3/31/11, Room 103, State House, 1:00 p.m.; Senate Calendar 17 "
214720,2011-05-05,"Senate Committee Report: Inexpedient to Legislate, 5/11/11; Senate Calendar 23 "
214720,2011-05-11,"Senate Inexpedient to Legislate Not Voted On; Senate Journal 16 "
214720,2011-05-11,"Senate Sen. Bradley Moved Laid on Table, Regular Calendar 19Y-5N, Motion Adopted; Senate Journal 16, Pg.328 "
214721,2011-01-03,"House Introduced 1/5/2011 and Referred to Legislative Administration; House Journal  8, PG.130 "
214721,2011-01-13,"House Public Hearing: 1/18/2011 10:30 Amendment Legislative Office Building 104 "
214721,2011-01-25,"House Subcommittee Work Session: 2/1/2011 1:30 PM Legislative Office Building 104 "
214721,2011-02-01,"House Subcommittee Work Session: 2/8/2011 1:00 PM Legislative Office Building 104 "
214721,2011-02-09,"House Subcommittee Work Session: 2/22/2011 1:00 PM Legislative Office Building 104 "
214721,2011-02-23,"House Executive Session: 3/1/2011 10:00 Amendment Legislative Office Building 104 "
214721,2011-03-01,"House Committee Report: Ought to Pass with Amendment #0455h(NT) for Mar 15 (Vote 14-0; Consent Calendar); House Calendar 22, PG.536 "
214721,2011-03-01,"House Proposed Committee Amendment #2011-0455h (New Title); House Calendar 23, PG.585 "
214721,2011-03-15,"House Amendment #0455h (New Title) Adopted, Voice Vote; House Journal  26, PG.728-729 "
214721,2011-03-15,"House Ought to Pass with Amendment #0455h(NT): Motion Adopted Voice Vote; House Journal  26, PG.728-729 "
214721,2011-04-27,"Senate Introduced and Referred to Internal Affairs; Senate Journal 15, Pg.291 "
214721,2011-04-28,"Senate Hearing: 5/4/11, Room 100, State House, 1:30 p.m.; Senate Calendar 22 "
214721,2011-05-05,"Senate Committee Report: Ought to Pass, 5/11/11; Senate Calendar 23 "
214721,2011-05-11,"Senate Ought to Pass, Motion Adopted, Voice Vote; OT3rdg; Senate Journal 16, Pg.331 "
214721,2011-05-11,"Senate Passed by Third Reading Resolution; Senate Journal 16 "
214721,2011-05-18,"Senate Enrolled; Senate Journal 18, Pg.364 "
214721,2011-05-18,"House Enrolled; House Journal  44, PG.1564 "
214721,2011-06-01,"House Signed By Governor 05/31/2011; Effective 05/31/2011; Chapter 0104 "
214722,2011-01-03,"House Introduced 1/5/2011 and Referred to Municipal and County Government; House Journal  8, PG.130 "
214722,2011-01-11,"House Public Hearing: 1/20/2011 2:00 PM Legislative Office Building 301 "
214722,2011-01-27,"House Full Committee Work Session: 2/1/2011 11:30 Amendment Legislative Office Building 301 "
214722,2011-02-01,"House Executive Session: 2/8/2011 1:00 PM Legislative Office Building 301 "
214722,2011-02-09,"House Committee Report: Ought to Pass with Amendment #0148h for Feb 15 (Vote 16-0; Consent Calendar); House Calendar 13, PG.232 "
214722,2011-02-09,"House Proposed Committee Amendment #2011-0148h; House Calendar 13, PG.257 "
214722,2011-02-15,"House Amendment #0148h Adopted, Voice Vote; House Journal  17, PG.359-360 "
214722,2011-02-15,"House Ought to Pass with Amendment #0148h: Motion Adopted Voice Vote; House Journal  17, PG.359-360 "
214722,2011-03-16,"Senate Introduced and Referred to Public and Municipal Affairs "
214722,2011-04-07,"Senate Hearing: 4/12/11, Room 101, Legislative Office Building, 9:20 a.m.; Senate Calendar 19 "
214722,2011-04-13,"Senate Committee Report: Ought to Pass, 4/20/11; Senate Calendar 20 "
214722,2011-04-20,"Senate Ought to Pass, Motion Adopted, Voice Vote; OT3rdg; Senate Journal 13, Pg.267 "
214722,2011-04-20,"Senate Passed by Third Reading Resolution; Senate Journal 13, Pg.270 "
214722,2011-05-04,"Senate Enrolled; Senate Journal 16, Pg.318 "
214722,2011-05-04,"House Enrolled; House Journal  42, PG.1490 "
214722,2011-05-19,"House Signed by Governor 05/16/2011; Effective 07/15/2011; Chapter 0065 "
214723,2011-01-03,"House Introduced 1/5/2011 and Referred to Transportation; House Journal  8, PG.130 "
214723,2011-01-11,"House Public Hearing: 1/18/2011 2:30 PM Legislative Office Building 203 "
214723,2011-01-25,"House Executive Session: 1/26/2011 Legislative Office Building 203 Following Session "
214723,2011-01-26,"House Committee Report: Ought to Pass for Feb 9 (Vote 11-0; Consent Calendar); House Calendar 10, PG.149 "
214723,2011-02-09,"House Ought to Pass: Motion Adopted Voice Vote; House Journal  16, PG.316 "
214723,2011-02-23,"Senate Introduced and Referred to Transportation; Senate Journal 8, Pg.81 "
214723,2011-03-03,"Senate Hearing: 3/10/11, Room 103, Legislative Office Building, 9:15 a.m.; Senate Calendar 14 "
214723,2011-03-17,"Senate Committee Report: Ought to Pass, 3/23/11; Senate Calendar 16 "
214723,2011-03-23,"Senate Ought to Pass, Motion Adopted, Voice Vote; OT3rdg; Senate Journal 10, Pg.186 "
214723,2011-03-23,"Senate Passed by Third Reading Resolution; Senate Journal 10, Pg.187 "
214723,2011-04-13,"Senate Enrolled; Senate Journal 13, Pg.259 "
214723,2011-04-13,"House Enrolled; House Journal  37, Pg.1304 "
214723,2011-04-28,"House Signed by the Governor 04/25/2011; Effective 06/24/2011; Chapter 0008 "
214724,2011-01-03,"House Introduced 1/5/2011 and Referred to Transportation; House Journal  8, PG.130 "
214724,2011-01-11,"House Public Hearing: 1/18/2011 3:00 PM Legislative Office Building 203 "
214724,2011-01-25,"House Executive Session: 1/26/2011 Legislative Office Building 203 Following Session "
214724,2011-01-26,"House Committee Report: Ought to Pass for Feb 9 (Vote 11-0; Consent Calendar); House Calendar 10, PG.149 "
214724,2011-02-09,"House Ought to Pass: Motion Adopted Voice Vote; House Journal  16, PG.316-317 "
214724,2011-02-23,"Senate Introduced and Referred to Transportation; Senate Journal 8, Pg.81 "
214724,2011-03-03,"Senate Hearing: 3/10/11, Room 103, Legislative Office Building, 9:30 a.m.; Senate Calendar 14 "
214724,2011-03-17,"Senate Committee Report: Ought to Pass, 3/23/11; Senate Calendar 16 "
214724,2011-03-23,"Senate Ought to Pass, Motion Adopted, Voice Vote; OT3rdg; Senate Journal 10, Pg.186 "
214724,2011-03-23,"Senate Passed by Third Reading Resolution; Senate Journal 10, Pg.187 "
214724,2011-04-13,"Senate Enrolled; Senate Journal 13, Pg.259 "
214724,2011-04-13,"House Enrolled; House Journal  37, Pg.1304 "
214724,2011-04-28,"House Signed by the Governor 04/25/2011; Effective 01/01/2012; Chapter 0009 "
214725,2011-01-03,"House Introduced 1/5/2011 and Referred to Judiciary; House Journal  8, PG.130 "
214725,2011-01-13,"House Public Hearing: 1/18/2011 10:00 Amendment Legislative Office Building 208 "
214725,2011-01-13,"House Division I Work Session: 1/18/2011 1:30 PM Legislative Office Building 208 "
214725,2011-01-13,"House Division I Work Session: 1/20/2011 1:30 PM Legislative Office Building 208 "
214725,2011-01-19,"House Division I Work Session: 1/25/2011 1:30 PM Legislative Office Building 208 "
214725,2011-01-26,"House Executive Session: 2/1/2011 11:00 Amendment Legislative Office Building 208 "
214725,2011-02-03,"House Committee Report: Inexpedient to Legislate for Feb 9 (Vote 16-0; Consent Calendar); House Calendar 12, PG.202 "
214725,2011-02-09,"House Inexpedient to Legislate: Motion Adopted Voice Vote; House Journal  16, PG.312 "
214726,2011-01-03,"House Introduced 1/5/2011 and Referred to Executive Departments and Administration; House Journal  8, PG.130 "
214726,2011-01-06,"House Public Hearing: 1/13/2011 10:15 Amendment Legislative Office Building 306 "
214726,2011-01-13,"House Executive Session: 1/18/2011 11:00 Amendment Legislative Office Building 306 "
214726,2011-01-19,"House Committee Report: Ought to Pass with Amendment #0025h for Jan 26 (Vote 12-0; Consent Calendar); House Calendar 9, PG.133 "
214726,2011-01-19,"House Proposed Committee Amendment #2011-0025h; House Calendar 9, PG.144 "
214726,2011-01-26,"House Amendment #0025h Adopted, Voice Vote; House Journal  14, PG.261 "
214726,2011-01-26,"House Ought to Pass with Amendment #0025h: Motion Adopted Voice Vote; House Journal  14, PG.261 "
214726,2011-03-16,"Senate Introduced and Referred to Executive Departments and Administration "
214726,2011-03-31,"Senate Hearing: 4/7/11, Room 100, State House, 9:00 a.m.; Senate Calendar 18 "
214726,2011-05-19,"Senate Committee Report: Ought to Pass with Amendment #2011-2038s, New Title, 5/25/11; Senate Calendar 25 "
214726,2011-05-25,"Senate Committee Amendment 2038s, New Title, Amendment Adopted, Voice Vote; Senate Journal 18, Pg.378 "
214726,2011-05-25,"Senate Ought to Pass with Amendment 2038s, New Title, Motion Adopted, Voice Vote; OT3rdg; Senate Journal 18, Pg.379 "
214726,2011-05-25,"Senate Passed by Third Reading Resolution; Senate Journal 18, Pg.391 "
214726,2011-06-08,"House House Non-Concurs with Senate Amendment 2038s(NT) (Rep C.McGuire): Motion Adopted Voice Vote; House Journal  51, PG.1714 "
214727,2011-01-03,"House Introduced 1/5/2011 and Referred to Health, Human Services and Elderly Affairs; House Journal  8, PG.131 "
214727,2011-01-11,"House Public Hearing: 1/19/2011 1:30 PM Legislative Office Building 205 "
214727,2011-01-19,"House Subcommittee Work Session: 1/25/2011 2:00 PM Legislative Office Building 205 "
214727,2011-02-08,"House Executive Session: 2/17/2011 10:00 Amendment Legislative Office Building 205 "
214727,2011-02-23,"House Committee Report: Inexpedient to Legislate for Mar 2 (Vote 15-0; Consent Calendar); House Calendar 18, PG.387 "
214727,2011-03-02,"House Inexpedient to Legislate: Motion Adopted Voice Vote; House Journal  25, PG.673 "
214728,2011-01-03,"House Introduced 1/5/2011 and Referred to Municipal and County Government; House Journal  8, PG.131 "
214728,2011-01-11,"House Public Hearing: 1/20/2011 11:00 Amendment Legislative Office Building 301 "
214728,2011-02-01,"House Executive Session: 2/8/2011 1:00 PM Legislative Office Building 301 "
214728,2011-02-08,"House Retained in Committee; House Calendar 27, PG.824 "
214728,2011-04-20,"House Retained Bill - Subcommittee Work Session: 4/21/2011 2:30 PM Legislative Office Building 301 "
214728,2011-09-14,"House Retained Bill - Executive Session: 10/11/2011 10:00 Amendment Legislative Office Building 301 "
214728,2011-10-14,"House Committee Report: Ought to Pass with Amendment #1540h(NT) for Jan 4 (Vote 16-0; Consent Calendar) "
214728,2011-10-14,"House Proposed Committee Amendment #2011-1540h (New Title) "
214729,2011-01-03,"House Introduced 1/5/2011 and Referred to Criminal Justice and Public Safety; House Journal  8, PG.131 "
214729,2011-01-11,"House Public Hearing: 1/18/2011 11:30 Amendment Legislative Office Building 204 "
214729,2011-01-18,"House Subcommittee Work Session: 1/25/2011 9:00 Amendment Legislative Office Building 204 "
214729,2011-01-26,"House Executive Session: 2/3/2011 10:00 Amendment Legislative Office Building 204 "
214729,2011-02-03,"House Committee Report: Inexpedient to Legislate for Feb 15 (Vote 14-0; Consent Calendar); House Calendar 13, PG.230 "
214729,2011-02-15,"House Inexpedient to Legislate: Motion Adopted Voice Vote; House Journal  17, PG.358 "
214730,2011-01-03,"House Introduced 1/5/2011 and Referred to Science, Technology and Energy; House Journal  8, PG.131 "
214730,2011-01-11,"House ===CANCELLED=== Public Hearing: 1/12/2011 1:00 PM Legislative Office Building 304 "
214730,2011-01-11,"House ==RESCHEDULED== Public Hearing: 1/25/2011 1:00 PM Legislative Office Building 304 "
214730,2011-03-02,"House Executive Session: 3/2/2011 Legislative Office Building 304 Following House Session "
214730,2011-03-02,"House Retained in Committee; House Calendar 27, PG.825 "
214730,2011-08-18,"House Retained Bill - Full Committee Work Session: 9/13/2011 10:15 Amendment Legislative Office Building 301-303 "
214730,2011-10-11,"House Retained Bill - Executive Session: 10/25/2011 10:00 Amendment Legislative Office Building 304 "
214731,2011-01-03,"House Introduced 1/5/2011 and Referred to Criminal Justice and Public Safety; House Journal  8, PG.131 "
214731,2011-01-11,"House Public Hearing: 1/20/2011 10:20 Amendment Legislative Office Building 204 "
214731,2011-01-26,"House Executive Session: 2/3/2011 10:00 Amendment Legislative Office Building 204 "
214731,2011-02-03,"House Committee Report: Inexpedient to Legislate for Feb 15 (Vote 14-0; Consent Calendar); House Calendar 13, PG.231 "
214731,2011-02-15,"House Removed from Consent Calendar (Rep Ulery); House Journal  17, PG.356 "
214731,2011-02-15,"House Special Order to Feb 16: Motion Adopted Without Objection; House Journal  17, PG.378 "
214731,2011-02-16,"House Inexpedient to Legislate: Motion Adopted Voice Vote; House Journal  19, PG.437 "
214732,2010-12-22,"House Introduced 1/5/2011 and Referred to State-Federal Relations and Veterans Affairs; House Journal  8, PG.131 "
214732,2011-01-05,"House Public Hearing: 1/13/2011 2:00 PM Legislative Office Building 203 "
214732,2011-01-14,"House Executive Session: 1/20/2011 9:30 Amendment Legislative Office Building 203 "
214732,2011-01-20,"House Committee Report: Inexpedient to Legislate for Feb 9 (Vote 8-5; Regular Calendar); House Calendar 10, PG.151 "
214732,2011-02-09,"House Inexpedient to Legislate: Motion Adopted Regular Calendar 280-93; House Journal  16, PG.328-330 "
214733,2010-12-30,"House Introduced 1/5/2011 and Referred to State-Federal Relations and Veterans Affairs; House Journal  8, PG.131 "
214733,2011-01-05,"House Public Hearing: 1/13/2011 10:00 Amendment Legislative Office Building 203 "
214733,2011-01-13,"House Subcommittee Work Session: 1/19/2011 8:30 Amendment Legislative Office Building 203 "
214733,2011-01-14,"House Executive Session: 1/20/2011 9:30 Amendment Legislative Office Building 203 "
214733,2011-01-20,"House Retained in Committee; House Calendar 27, PG.825 "
214733,2011-05-10,"House Retained Bill - Subcommittee Work Session: 5/19/2011 10:00 Amendment Legislative Office Building 203 "
214733,2011-09-14,"House ==CANCELLED== Retained Bill - Full Committee Work Session: 10/6/2011 9:30 Amendment Legislative Office Building 203 "
214733,2011-09-27,"House Retained Bill - Executive Session: 10/6/2011 9:30 Amendment Legislative Office Building 203 "
214733,2011-10-06,"House Committee Report: Ought to Pass with Amendment #2270h for Jan 4 (Vote 10-0; Consent Calendar) "
214733,2011-10-06,"House Proposed Committee Amendment #2011-2270h "
214734,2011-01-03,"House Introduced 1/5/2011 and Referred to State-Federal Relations and Veterans Affairs; House Journal  8, PG.131 "
214734,2011-01-11,"House Public Hearing: 1/20/2011 11:30 Amendment Legislative Office Building 203 "
214734,2011-01-25,"House Executive Session: 1/27/2011 9:00 Amendment Legislative Office Building 203 "
214734,2011-01-27,"House Committee Report: Inexpedient to Legislate for Feb 9 (Vote 10-0; Consent Calendar); House Calendar 10, PG.148 "
214734,2011-02-09,"House Removed from Consent Calendar (Rep Weed); House Journal  16, PG.309 "
214734,2011-02-09,"House Inexpedient to Legislate: Motion Adopted Voice Vote; House Journal  16, PG.333 "
214735,2011-01-03,"House Introduced 1/5/2011 and Referred to State-Federal Relations and Veterans Affairs; House Journal  8, PG.131 "
214735,2011-01-11,"House Public Hearing: 1/20/2011 11:00 Amendment Legislative Office Building 203 "
214735,2011-01-20,"House Executive Session: 1/20/2011 After Public Hearing Legislative Office Building 203 "
214735,2011-01-21,"House Committee Report: Inexpedient to Legislate for Feb 9 (Vote 13-0; Consent Calendar); House Calendar 10, PG.148 "
214735,2011-02-09,"House Removed from Consent Calendar (Rep Manuse); House Journal  16, PG.309 "
214735,2011-02-09,"House Inexpedient to Legislate: Motion Adopted Regular Calendar 310-59; House Journal  16, PG.333-335 "
214736,2010-12-22,"House Introduced 1/5/2011 and Referred to Resources, Recreation and Development; House Journal  8, PG.131 "
214736,2011-01-10,"House ==CANCELLED== Public Hearing: 1/20/2011 10:00 Amendment Legislative Office Building 305 "
214736,2011-01-18,"House Public Hearing: 1/25/2011 1:30 PM Legislative Office Building 305 ==RECESSED== "
214736,2011-01-26,"House Continued Public Hearing: 2/1/2011 11:15 Amendment Legislative Office Building 305 "
214736,2011-01-26,"House Executive Session: 2/8/2011 1:00 PM Legislative Office Building 305 "
214736,2011-02-10,"House Committee Report: Inexpedient to Legislate for Feb 15 (Vote 15-0; Consent Calendar); House Calendar 13, PG.232 "
214736,2011-02-15,"House Inexpedient to Legislate: Motion Adopted Voice Vote; House Journal  17, PG.360-361 "
214737,2010-12-01,"House Introduced and Adopted, Voice Vote; House Journal  5, PG.70 "
214738,2010-12-01,"House Introduced and Adopted, Voice Vote; House Journal  5, PG.70 "
214739,2010-12-01,"House Introduced and Adopted, Voice Vote; House Journal  5, PG.70 "
214740,2010-12-01,"House Introduced and Adopted, Voice Vote; House Journal  5, PG.70 "
214741,2010-12-01,"House Introduced and Adopted, Voice Vote; House Journal  5, PG.70 "
214742,2010-12-30,"House Introduced 1/5/2011 and Referred to State-Federal Relations and Veterans Affairs; House Journal  8, PG.131 "
214742,2011-01-05,"House Public Hearing: 1/13/2011 11:00 Amendment Legislative Office Building 203 "
214742,2011-01-14,"House Executive Session: 1/20/2011 9:30 Amendment Legislative Office Building 203 "
214742,2011-01-20,"House Committee Report: Ought to Pass for Feb 9 (Vote 13-0; Consent Calendar); House Calendar 10, PG.148 "
214742,2011-02-09,"House Removed from Consent Calendar (Rep Gagnon); House Journal  16, PG.309 "
214742,2011-02-09,"House Indefinite Postponement (Rep Cali-Pitts): Motion Failed Division Vote 115-248; House Journal  16, PG.335 "
214742,2011-02-09,"House Ought to Pass: Motion Adopted Regular Calendar 254-115; House Journal  16, PG.335-337 "
214743,2011-01-01,"Senate Introduced 1/5/2011 and Referred to Public and Municipal Affairs, Senate Journal 1, Pg.19 "
214743,2011-01-05,"Senate Hearing: 1/11/2011, Room 100, State House, 10:00 a.m.; Senate Calendar 6 "
214743,2011-01-13,"Senate Committee Report: Ought to Pass, 1/19/2011; Senate Calendar 7 "
214743,2011-01-19,"Senate Ought to Pass, Regular Calendar 19Y-5N, Motion Adopted; OT3rdg; Senate Journal 3, Pg.26 "
214743,2011-01-19,"Senate Passed by Third Reading Resolution; Senate Journal 3, Pg.29 "
214743,2011-01-20,"House Introduced (in Recess from 1/6/2011) and Referred to Labor, Industrial and Rehabilitative Services; House Journal  11, PG.178 "
214743,2011-01-25,"House Public Hearing: 2/1/2011 3:00 PM Legislative Office Building 307 "
214743,2011-02-02,"House Executive Session: 2/8/2011 2:00 PM Legislative Office Building 307 "
214743,2011-02-10,"House Majority Committee Report: Ought to Pass for Feb 15 (Vote 13-4; Regular Calendar); House Calendar 13, PG.235 "
214743,2011-02-10,"House Minority Committee Report: Inexpedient to Legislate; House Calendar 13, PG.235 "
214743,2011-02-15,"House Special Order to Feb 16: Motion Adopted Without Objection; House Journal  17, PG.378 "
214743,2011-02-16,"House Ought to Pass: Motion Adopted Regular Calendar 282-70; House Journal  19, PG.412-415 "
214743,2011-02-16,"Senate Enrolled; Senate Journal 7, Pg.65 "
214743,2011-02-16,"House Enrolled; House Journal  19, PG.439 "
214743,2011-03-01,"Senate Law Without Signature 3/1/11; Eff. Date 3/1/11, Chapter 0003; Art 44, Pt II, NH Constitution "
214744,2011-01-01,"Senate Introduced 1/5/2011 and Referred to Public and Municipal Affairs, Senate Journal 1, Pg.19 "
214744,2011-01-05,"Senate Hearing: 1/11/2011, Room 100, State House, 9:00 a.m.; Senate Calendar 6 "
214744,2011-01-13,"Senate Committee Report: Ought to Pass, 1/19/2011; Senate Calendar 7 "
214744,2011-01-19,"Senate Ought to Pass, Motion Adopted, Voice Vote; OT3rdg; Senate Journal 3, Pg.26 "
214744,2011-01-19,"Senate Passed by Third Reading Resolution; Senate Journal 3, Pg.29 "
214744,2011-01-26,"House Introduced (in Recess from 1/6/2011) and Referred to Municipal and County Government; House Journal  11, PG.181 "
214744,2011-01-26,"House Public Hearing: 2/1/2011 10:30 Amendment Legislative Office Building 301 "
214744,2011-02-03,"House Committee Report: Ought to Pass for Feb 9 (Vote 13-0; Consent Calendar); House Calendar 12, PG.204 "
214744,2011-02-09,"House Ought to Pass: Motion Adopted Voice Vote; House Journal  16, PG.313-314 "
214744,2011-02-15,"Senate Enrolled, Senate Journal 5, Pg.52 "
214744,2011-02-15,"House Enrolled; House Journal  17, PG.364 "
214744,2011-02-16,"Senate Signed by the Governor on 02/15/2011; Effective 02/15/2011; Chapter 0002 "
214745,2011-01-03,"Senate Introduced 1/5/2011 and Referred to Public and Municipal Affairs, Senate Journal 1, Pg.19 "
214745,2011-01-05,"Senate Hearing: 1/11/2011, Room 100, State House, 9:45 a.m.; Senate Calendar 6 "
214745,2011-01-13,"Senate Committee Report: Ought to Pass, 1/19/2011; Senate Calendar 7 "
214745,2011-01-19,"Senate Ought to Pass, Motion Adopted, Voice Vote; OT3rdg; Senate Journal 3, Pg.26 "
214745,2011-01-19,"Senate Passed by Third Reading Resolution; Senate Journal 3, Pg.29 "
214745,2011-01-26,"House Introduced (in Recess from 1/6/2011) and Referred to Municipal and County Government; House Journal  11, PG.181 "
214745,2011-02-09,"House Public Hearing: 2/17/2011 10:45 Amendment Legislative Office Building 301 "
214745,2011-02-23,"House Executive Session: 3/3/2011 10:30 Amendment Legislative Office Building 301 "
214745,2011-03-08,"House Committee Report: Ought to Pass for Mar 30 (Vote 16-0; Consent Calendar); House Calendar 27, PG.814 "
214745,2011-03-30,"House Ought to Pass: Motion Adopted Voice Vote; House Journal  34, PG.1091 "
214745,2011-04-13,"House Enrolled; House Journal  37, Pg.1304 "
214745,2011-04-13,"Senate Enrolled; Senate Journal 13, Pg.260 "
214745,2011-04-28,"Senate Signed by the Governor on 04/25/2011; Effective 06/24/2011; Chapter 0019 "
214746,2011-01-04,"Senate Introduced 1/5/2011 and Referred to Public & Municipal Affairs, Senate Journal 1, Pg.19 "
214746,2011-01-05,"Senate Hearing: 1/11/2011, Room 100, State House, 9:20 a.m.; Senate Calendar 6 "
214746,2011-01-13,"Senate Committee Report: Ought to Pass with Amendment #2011-0014s, 1/19/2011; Senate Calendar 7 "
214746,2011-01-19,"Senate Committee Amendment 0014s, Amendment Adopted, Voice Vote "
214746,2011-01-19,"Senate Ought to Pass with Amendment 0014s, Motion Adopted, Voice Vote; OT3rdg; Senate Journal 3, Pg.27 "
214746,2011-01-19,"Senate Passed by Third Reading Resolution; Senate Journal 3, Pg.29 "
214746,2011-01-26,"House Introduced (in Recess from 1/6/2011) and Referred to Municipal and County Government; House Journal  11, PG.181 "
214746,2011-02-09,"House Public Hearing: 2/17/2011 10:15 Amendment Legislative Office Building 301 "
214746,2011-02-23,"House Executive Session: 3/3/2011 10:30 Amendment Legislative Office Building 301 "
214746,2011-03-03,"House Committee Report: Ought to Pass with Amendment #0561h(NT) for Mar 30 (Vote 16-0; Consent Calendar); House Calendar 27, PG.814 "
214746,2011-03-03,"House Proposed Committee Amendment #2011-0561h (New Title); House Calendar 27, PG.854 "
214746,2011-03-30,"House Amendment #0561h (New Title) Adopted, Voice Vote; House Journal  34, PG.1091 "
214746,2011-03-30,"House Ought to Pass with Amendment #0561h(NT): Motion Adopted Voice Vote; House Journal  34, PG.1091 "
214746,2011-04-13,"Senate Sen. Barnes Concurs with House Amendment 0561h, New Title, Motion Adopted, Voice Vote; Senate Journal 12, Pg.254 "
214746,2011-04-27,"House Enrolled; House Journal  40, PG.1386 "
214746,2011-04-27,"Senate Enrolled; Senate Journal 15, Pg.293 "
214746,2011-05-11,"Senate Signed by the Governor on 05/9/2011; Effective 05/9/2011; Chapter 0057 "
214747,2011-01-04,"Senate Introduced 1/5/2011 and Referred to Health & Human Services, Senate Journal 1, Pg.20 "
214747,2011-01-19,"Senate Sen. Bradley Moved to Vacate SB 17 from Health & Human Services to Judiciary, Motion Adopted, Voice Vote; Senate Journal 3, Pg.27 "
214747,2011-01-31,"Senate Hearing: 2/10/2011, Room 101, Legislative Office Building, 1:45 p.m.; Senate Calendar 10 "
214747,2011-03-17,"Senate Committee Report: Rereferred to Committee, 3/23/11; Senate Calendar 16 "
214747,2011-03-23,"Senate Rereferred to Committee, Motion Adopted, Voice Vote; Senate Journal 10, Pg.184 "
214748,2011-01-04,"Senate Introduced 1/5/2011 and Referred to Ways & Means, Senate Journal 1, Pg.20 "
214748,2011-02-03,"Senate Hearing: 2/8/11, Room 100 State House, 1:05 p.m.; Senate Calendar 10 "
214748,2011-02-09,"Senate Committee Report: Ought to Pass, 2/16/2011; Senate Calendar 11 "
214748,2011-02-16,"Senate Ought to Pass, Motion Adopted, Voice Vote; OT3rdg, Senate Journal 6, Pg.59 "
214748,2011-02-16,"Senate Passed by Third Reading Resolution, Senate Journal 6, Pg.61 "
214748,2011-02-16,"House Introduced and Referred to Ways and Means; House Journal  19, Pg. 438 "
214748,2011-03-10,"House Public Hearing: 3/22/2011 10:00 Amendment Legislative Office Building 202 "
214748,2011-03-30,"House Executive Session: 4/5/2011 1:00 PM Legislative Office Building 202 "
214748,2011-04-05,"House Committee Report: Ought to Pass for April 13 (Vote 20-0; Consent Calendar); House Calendar 31, PG.1040 "
214748,2011-04-13,"House Ought to Pass: Motion Adopted Voice Vote; House Journal  37, Pg.1296 "
214748,2011-04-13,"House Enrolled ; House Journal  37, PG.1305 "
214748,2011-04-20,"Senate Enrolled; Senate Journal 14, Pg.273 "
214748,2011-04-28,"Senate Signed by the Governor on 04/28/2011; Effective 06/27/2011; Chapter 0023 "
214749,2011-01-04,"Senate Introduced 1/5/2011 and Referred to Energy and Natural Resources, Senate Journal 1, Pg.20 "
214749,2011-01-05,"Senate Hearing: 1/13/2011, Room 102, Legislative Office Building, 10:15 a.m.; Senate Calendar 6 "
214749,2011-01-27,"Senate Committee Report: Ought to Pass with Amendment #2011-0092s, 2/3/2011; Senate Calendar 9 "
214749,2011-02-03,"Senate Committee Amendment 0092s, Amendment Adopted, Voice Vote; Senate Journal 4, Pg.41 "
214749,2011-02-03,"Senate Ought to Pass with Amendment 0092s, Motion Adopted, Voice Vote; OT3rdg; Senate Journal 4, Pg.41 "
214749,2011-02-03,"Senate Passed by Third Reading Resolution; Senate Journal 4, Pg.42 "
214749,2011-02-07,"House Introduced (in Recess from 1/26/2011) and Referred to Resources, Recreation and Development; House Journal  14, PG.265 "
214749,2011-02-09,"House Public Hearing: 2/17/2011 1:00 PM Legislative Office Building 305 "
214749,2011-04-04,"House Subcommittee Work Session: 4/6/2011 1:00 PM Legislative Office Building 305 "
214749,2011-05-04,"House Subcommittee Work Session: 5/10/2011 1:00 PM Legislative Office Building 305 "
214749,2011-05-10,"House Subcommittee Work Session: 5/17/2011 10:30 Amendment Legislative Office Building 305 "
214749,2011-05-18,"House Subcommittee Work Session: 5/23/2011 9:30 Amendment Legislative Office Building 307 "
214749,2011-05-18,"House Full Committee Work Session: 5/23/2011 10:00 Amendment Legislative Office Building 307 "
214749,2011-05-19,"House Executive Session: 5/24/2011 11:15 PM Legislative Office Building 305 "
214749,2011-05-24,"House Retained in Committee "
214749,2011-07-26,"House Retained Bill - Full Committee Work Session: 8/9/2011 10:00 Amendment Legislative Office Building 305 "
214749,2011-09-09,"House Retained Bill - Subcommittee Work Session: 9/27/2011 10:00 Amendment Legislative Office Building 305 "
214749,2011-09-13,"House Retained Bill - Executive Session: 10/25/2011 10:00 Amendment Legislative Office Building 305 "
214750,2011-01-04,"Senate Introduced 1/5/2011 and Referred to Energy and Natural Resources, Senate Journal 1, Pg.20 "
214750,2011-01-05,"Senate Hearing: 1/13/2011, Room 102, Legislative Office Building, 10:30 a.m.; Senate Calendar 6 "
214750,2011-01-14,"Senate Hearing: === RECESSED === 1/13/11, Room 102, Legislative Office Building, 10:30 a.m. "
214750,2011-02-10,"Senate Hearing: === RECONVENE === 2/17/11, Room 102, Legislative Office Building, 9:00 a.m.; Senate Calendar 11 "
214750,2011-02-17,"Senate Committee Report: Ought to Pass with Amendment #2011-0399s, 2/23/11; Senate Calendar 12 "
214750,2011-02-23,"Senate Committee Amendment 0399s, Amendment Adopted, Voice Vote; Senate Journal 7, Pg.68 "
214750,2011-02-23,"Senate Ought to Pass with Amendment 0399s, Motion Adopted, Voice Vote; OT3rdg; Senate Journal 7, Pg.68 "
214750,2011-02-23,"Senate Passed by Third Reading Resolution; Senate Journal 7, Pg.77 "
214750,2011-03-16,"House Introduced and Referred to Resources, Recreation and Development; House Journal  28, Pg.882 "
214750,2011-03-29,"House Public Hearing: 4/6/2011 10:00 Amendment Legislative Office Building 305 "
214750,2011-04-26,"House Executive Session: 5/3/2011 1:00 PM Legislative Office Building 305 "
214750,2011-05-04,"House Committee Report: Ought to Pass for May 18 (Vote 15-0; Consent Calendar); House Calendar 39, PG.1321 "
214750,2011-05-18,"House Ought to Pass: Motion Adopted Voice Vote; House Journal  44, PG.1535 "
214750,2011-06-01,"House Enrolled; House Journal  48, PG.1669 "
214750,2011-06-01,"Senate Enrolled; Senate Journal 20, Pg.547 "
214750,2011-06-07,"Senate Signed by the Governor on 06/07/2011; Effective 08/06/2011; Chapter 0141 "
214751,2011-01-04,"Senate Introduced 1/5/2011 and Referred to Energy and Natural Resources, Senate Journal 1, Pg.20 "
214751,2011-01-05,"Senate Hearing: 1/13/2011, Room 102, Legislative Office Building, 10:45 a.m.; Senate Calendar 6 "
214751,2011-02-08,"Senate Committee Report: Ought to Pass with Amendment #2011-0176s, New Title, 2/16/2011; Senate Calendar 11 "
214751,2011-02-16,"Senate Committee Amendment 0176s, New Title, Amendment Adopted, Voice Vote, Senate Journal 5, Pg.56 "
214751,2011-02-16,"Senate Ought to Pass with Amendment 0176s, New Title, Motion Adopted, Voice Vote; OT3rdg, Senate Journal 5, Pg.56 "
214751,2011-02-16,"Senate Passed by Third Reading Resolution, Senate Journal 6, Pg.61 "
214751,2011-02-16,"House Introduced and Referred to Resources, Recreation and Development; House Journal  19, Pg. 438 "
214751,2011-03-22,"House ==CANCELLED== Public Hearing: 3/29/2011 2:30 PM Legislative Office Building 305 "
214751,2011-03-23,"House ==RESCHEDULED== Public Hearing: 4/5/2011 2:30 PM Legislative Office Building 305 "
214751,2011-04-26,"House =CANCELLED= Executive Session: 5/3/2011 1:00 PM Legislative Office Building 305 "
214751,2011-05-04,"House Executive Session: 5/10/2011 10:30 Amendment Legislative Office Building 305 "
214751,2011-05-12,"House Committee Report: Ought to Pass with Amendment #1845h for May 18 (Vote 13-0; Consent Calendar); House Calendar 39, PG.1321 "
214751,2011-05-12,"House Proposed Committee Amendment #2011-1845h; House Calendar 39, PG.1338-1339 "
214751,2011-05-18,"House Amendment #1845h Adopted, Voice Vote; House Journal  44, PG.1535-1536 "
214751,2011-05-18,"House Ought to Pass with Amendment #1845h: Motion Adopted Voice Vote; House Journal  44, PG.1535-1536 "
214751,2011-06-01,"Senate Sen. Odell Concurs with House Amendment #1845h, Motion Adopted, Voice Vote; Senate Journal 19, Pg.536 "
214751,2011-06-08,"House Enrolled; House Journal  51, PG.1726 "
214751,2011-06-08,"Senate Enrolled "
214751,2011-06-14,"Senate Signed by the Governor on 06/14/10; Chapter 0195"
214752,2011-01-04,"Senate Introduced 1/5/2011 and Referred to Energy and Natural Resources, Senate Journal 1, Pg.20 "
214752,2011-01-21,"Senate Hearing: === TIME CHANGE === 2/03/11, Room 102, Legislative Office Building, 9:30 a.m.; Senate Calendar 9 "
214752,2011-02-03,"Senate Hearing: === RECESSED === 2/03/11, Room 102, Legislative Office Building, 9:30 a.m.; Senate Calendar 10 "
214752,2011-03-03,"Senate Hearing: === RECONVENE === 3/17/11, Room 102, Legislative Office Building, 9:00 a.m.; Senate Calendar 14 "
214752,2011-03-24,"Senate Committee Report: Ought to Pass with Amendment #2011-1197s, 3/30/11; Senate Calendar 17 "
214752,2011-03-30,"Senate Committee Amendment 1197s, Amendment Adopted, Voice Vote; Senate Journal 11, Pg.210 "
214752,2011-03-30,"Senate Ought to Pass with Amendment 1197s, Motion Adopted, Voice Vote; OT3rdg; Senate Journal 11, Pg.211 "
214752,2011-03-30,"Senate Passed by Third Reading Resolution; Senate Journal 11, Pg.239 "
214752,2011-03-31,"House Introduced and Referred to Science, Technology and Energy; House Journal  35, PG.1240 "
214752,2011-04-12,"House ==CANCELLED== Public Hearing: 5/3/2011 1:15 PM Legislative Office Building 304 "
214752,2011-04-15,"House Public Hearing: 5/10/2011 1:15 PM Legislative Office Building 304 "
214752,2011-05-04,"House Executive Session: 5/17/2011 1:00 PM Legislative Office Building 304 "
214752,2011-05-18,"House Committee Report: Ought to Pass for May 25 (Vote 15-0; Consent Calendar); House Calendar 41, PG.1392 "
214752,2011-05-25,"House Ought to Pass: Motion Adopted Voice Vote; House Journal  46, PG.1582 "
214752,2011-06-08,"House Enrolled; House Journal  51, PG.1724 "
214752,2011-06-08,"Senate Enrolled "
214752,2011-06-14,"Senate Signed by the Governor on 06/14/2011; Effective 06/14/2011; Chapter 0175 "
225837,2011-01-06,"Senate Introduced and Referred to Internal Affairs, Senate Journal 2, Pg.25 "
225837,2011-03-10,"Senate Hearing: 3/15/11, Room 103, State House, 1:30 p.m.; Senate Calendar 15 "
225837,2011-03-15,"Senate Committee Report: Ought to Pass, 3/23/11; Senate Calendar 16 "
225837,2011-03-23,"Senate Ought to Pass, 3/5 necessary, Regular Calendar 19Y-5N, Motion Adopted; OT3rdg; Senate Journal 10, Pg.184 "
225837,2011-03-23,"Senate Passed by Third Reading Resolution; Senate Journal 10, Pg.187 "
225837,2011-03-31,"House Introduced and Referred to Ways and Means; House Journal  35, PG.1241  "
225837,2011-04-06,"House Public Hearing: 4/12/2011 10:00 Amendment Legislative Office Building 202 "
225837,2011-04-13,"House Executive Session: 4/26/2011 10:00 Amendment Legislative Office Building 202 "
225837,2011-04-26,"House Majority Committee Report: Ought to Pass for May 4 (Vote 14-5; Regular Calendar); House Calendar 36, PG.1250 "
225837,2011-04-26,"House Minority Committee Report: Inexpedient to Legislate; House Calendar 36, PG.1250 "
225837,2011-05-04,"House Lay on the Table (Rep Stepanek): Motion Adopted Division Vote 293-33 by Required Three-Fifths; House Journal  42, PG.1482 "
225838,2011-01-07,"House Introduced 1/6/2011 and Referred to Constitutional Review & Statutory Recodification; House Journal  11, PG. 172  "
225838,2011-01-13,"House Public Hearing: 1/18/2011 10:30 Amendment Legislative Office Building 206 "
225838,2011-01-19,"House Subcommittee Work Session: 1/25/2011 1:00 PM Legislative Office Building 206 "
225838,2011-01-26,"House Subcommittee Work Session: 2/1/2011 10:00 Amendment Legislative Office Building 206 "
225838,2011-02-01,"House Executive Session: 2/8/2011 10:00 Amendment Legislative Office Building 206 "
225838,2011-02-09,"House Majority Committee Report: Ought to Pass for Feb 15 (Vote 8-4; Regular Calendar); House Calendar 13, PG.234 "
225838,2011-02-09,"House Minority Committee Report: Inexpedient to Legislate; House Calendar 13, PG.234 "
225838,2011-02-15,"House Ought to Pass: Motion Adopted Regular Calendar 240-120; House Journal  17, PG.361-364 "
225838,2011-02-15,"House Referred to Commerce and Consumer Affairs; House Journal  17, PG.364 "
225838,2011-02-23,"House Public Hearing: 3/10/2011 1:15 PM Legislative Office Building 302 ==Executive Session to Follow== "
225838,2011-03-10,"House Retained in Committee "
225838,2011-06-22,"House Retained Bill - Banking/Business Div Subcom Work Session: 9/13/2011 11:15 Amendment Legislative Office Building 302 "
225838,2011-09-27,"House Retained Bill - Executive Session: 10/6/2011 10:00 Amendment Legislative Office Building 302 "
225838,2011-10-14,"House Committee Report: Refer to Interim Study for Jan 4 (Vote 12-0; Consent Calendar) "
225839,2011-01-07,"House Introduced 1/6/2011 and Referred to Commerce and Consumer Affairs; House Journal  11, PG. 172 "
225839,2011-02-09,"House Public Hearing: 2/17/2011 10:30 Amendment Legislative Office Building 302 "
225839,2011-02-16,"House ==CANCELLED== Executive Session: 2/25/2011 10:00 Amendment Legislative Office Building 302 "
225839,2011-02-23,"House Executive Session: 3/1/2011 3:00 PM Legislative Office Building 302 "
225839,2011-03-01,"House Retained in Committee; House Calendar 27, PG.822 "
225839,2011-08-23,"House Retained Bill - Insurance/Consumer Div Subcom Work Session: 9/13/2011 1:15 PM Legislative Office Building 302 "
225839,2011-09-27,"House Retained Bill - Executive Session: 10/6/2011 10:00 Amendment Legislative Office Building 302 "
225839,2011-10-14,"House Committee Report: Inexpedient to Legislate for Jan 4 (Vote 12-0; Consent Calendar) "
225840,2011-01-07,"House Introduced 1/6/2011 and Referred to Criminal Justice and Public Safety; House Journal  11, PG. 172 "
225840,2011-01-11,"House Public Hearing: 1/20/2011 11:00 Amendment Legislative Office Building 204 "
225840,2011-01-26,"House ==CANCELLED== Executive Session: 2/3/2011 10:00 Amendment Legislative Office Building 204 "
225840,2011-02-03,"House Subcommittee Work Session: 2/8/2011 9:15 Amendment Legislative Office Building 204 "
225840,2011-02-10,"House ==RESCHEDULED== Work Session: 2/15/2011 8:30 Amendment Legislative Office Building 204 (Orig 8:00 Amendment) "
225840,2011-02-16,"House Subcommittee Work Session: 2/22/2011 8:30 Amendment Legislative Office Building 204 "
225840,2011-03-02,"House Subcommittee Work Session: 3/9/2011 9:00 Amendment Legislative Office Building 204 "
225840,2011-03-02,"House Executive Session: 3/9/2011 10:00 Amendment Legislative Office Building 204 "
225840,2011-03-09,"House Retained in Committee; House Calendar 27, PG.823 "
225840,2011-09-13,"House Retained Bill - Subcommittee Work Session: 9/27/2011 11:00 Amendment Legislative Office Building 204 "
225840,2011-09-27,"House Retained Bill - Subcommittee Work Session: 10/5/2011 10:00 Amendment Legislative Office Building 204 "
225840,2011-10-05,"House Retained Bill - Subcommittee Work Session: 10/20/2011 9:45 Amendment Legislative Office Building 204 "
225840,2011-10-05,"House Retained Bill - Executive Session: 10/20/2011 10:00 Amendment Legislative Office Building 204 "
225840,2011-10-25,"House Committee Report: Ought to Pass with Amendment #2702h for Jan 4 (Vote 17-0; Consent Calendar) "
225840,2011-10-25,"House Proposed Committee Amendment #2011-2702h "
225841,2011-01-07,"House Introduced 1/6/2011 and Referred to Judiciary; House Journal  11, PG. 172 "
225841,2011-01-13,"House Public Hearing: 1/18/2011 11:00 Amendment Legislative Office Building 208 "
225841,2011-01-13,"House Division I Work Session: 1/18/2011 1:30 PM Legislative Office Building 208 "
225841,2011-01-13,"House Division I Work Session: 1/20/2011 1:30 PM Legislative Office Building 208 "
225841,2011-01-26,"House Executive Session: 2/1/2011 11:00 Amendment Legislative Office Building 208 "
225841,2011-02-14,"House Committee Report: Inexpedient to Legislate for Feb 23 (Vote 17-0; Consent Calendar); House Calendar 15, PG.270 "
225841,2011-02-23,"House Inexpedient to Legislate: Motion Adopted Voice Vote; House Journal  21, PG.461 "
225842,2011-01-07,"House Introduced 1/6/2011 and Referred to Commerce and Consumer Affairs; House Journal  11, PG. 172 "
225842,2011-01-11,"House Public Hearing: 1/18/2011 11:00 Amendment Legislative Office Building 302 "
225842,2011-01-19,"House Subcommittee Work Session: 1/25/2011 11:00 Amendment Legislative Office Building 302 "
225842,2011-01-26,"House Executive Session: 2/1/2011 10:00 Amendment Legislative Office Building 302 "
225842,2011-02-01,"House Committee Report: Inexpedient to Legislate for Feb 9 (Vote 14-0; Consent Calendar); House Calendar 12, PG.200 "
225842,2011-02-09,"House Inexpedient to Legislate: Motion Adopted Voice Vote; House Journal  16, PG.309 "
225843,2011-01-07,"House Introduced 1/6/2011 and Referred to Education; House Journal  11, PG. 172 "
225843,2011-01-11,"House Public Hearing: 1/18/2011 3:30 PM Legislative Office Building 207 "
225843,2011-01-19,"House ==CANCELLED== Executive Session: 1/25/2011 2:00 PM Legislative Office Building 207 "
225843,2011-01-26,"House Executive Session: 2/1/2011 2:00 PM Legislative Office Building 207 "
225843,2011-02-02,"House Committee Report: Ought to Pass for Feb 9 (Vote 16-0; Consent Calendar); House Calendar 12, PG.201 "
225843,2011-02-09,"House Removed from Consent Calendar (Rep LaCasse); House Journal  16, PG.309 "
225843,2011-02-09,"House Ought to Pass: Motion Adopted Division Vote 349-21; House Journal  16, PG.330 "
225843,2011-02-23,"Senate Introduced and Referred to Education; Senate Journal 8, Pg.81 "
225843,2011-03-24,"Senate Hearing: 3/29/11, Room 103, Legislative Office Building, 1:00 p.m.; Senate Calendar 17 "
225843,2011-05-26,"Senate Committee Report: Ought to Pass with Amendment #2011-2162s, New Title, 6/1/11; Senate Calendar 26 "
225843,2011-06-01,"Senate Committee Amendment 2162s, New Title, Amendment Adopted, Voice Vote; Senate Journal 19, Pg.512 "
225843,2011-06-01,"Senate Chair Ruled Non-Germane Amendment; Senate Journal 19, Pg.512 "
225843,2011-06-01,"Senate Sen. Larsen Moved to Suspend Rule 3-7 to Allow Non-Germane Amendment 2232s, 2/3 necessary, Motion Adopted, Voice Vote; Senate Journal 19, Pg.512 "
225843,2011-06-01,"Senate Sen. Larsen Floor Amendment #2011-2232s, New Title, Amendment Adopted, Voice Vote; Senate Journal 19, Pg.512 "
225843,2011-06-01,"Senate Ought to Pass with Amendments 2162s, New Title, 2232s, New Title, Motion Adopted, Voice Vote; OT3rdg; Senate Journal 19, Pg.512 "
225843,2011-06-02,"Senate Passed by Third Reading Resolution; Senate Journal 19, Pg.539 "
225843,2011-06-08,"House House Concurs with Senate Amendment 2162s(NT), 2232s(NT) (Rep Balboni): Motion Adopted Voice Vote; House Journal  51, PG.1720 "
225843,2011-06-22,"House Enrolled Bill Amendment #2011-2517e Adopted; House Journal  57, PG.1857 "
225843,2011-06-22,"Senate Enrolled Bill Amendment #2517e Adopted "
225843,2011-06-22,"Senate Enrolled "
225843,2011-06-22,"House Enrolled; House Journal  57, PG.1859 "
225843,2011-07-18,"House Signed By Governor 07/13/2011; Effective 09/11/2011; Chapter 0255 "
225844,2011-01-07,"House Introduced 1/6/2011 and Referred to Resources, Recreation and Development; House Journal  11, PG. 172  "
225844,2011-01-18,"House Public Hearing: 1/25/2011 11:15 Amendment Legislative Office Building 305 "
225844,2011-01-26,"House Executive Session: 2/1/2011 10:45 Amendment Legislative Office Building 305 "
225844,2011-02-03,"House Committee Report: Ought to Pass with Amendment #0150h for Feb 9 (Vote 13-0; Consent Calendar); House Calendar 12, PG.204 "
225844,2011-02-03,"House Proposed Committee Amendment #2011-0150h; House Calendar 12, PG.226-227 "
225844,2011-02-09,"House Amendment #0150h Adopted, Voice Vote; House Journal  16, PG.315 "
225844,2011-02-09,"House Ought to Pass with Amendment #0150h: Motion Adopted Voice Vote; House Journal  16, PG.315 "
225844,2011-02-09,"House Referred to Judiciary; House Journal  16, PG.315 "
225844,2011-03-15,"House Public Hearing: 3/22/2011 1:00 PM Legislative Office Building 208 ==Executive Session To Follow== "
225844,2011-03-24,"House Committee Report: Ought to Pass with Amendment #1151h for Mar 30 (Vote 14-0; Consent Calendar); House Calendar 27, PG.814 "
225844,2011-03-24,"House Proposed Committee Amendment #2011-1151h; House Calendar 27, PG.842-843 "
225844,2011-03-30,"House Amendment #1151h Adopted, Voice Vote; House Journal  34, PG.1090 "
225844,2011-03-30,"House Ought to Pass with Amendment #1151h: Motion Adopted Voice Vote; House Journal  34, PG.1090 "
225844,2011-04-13,"Senate Introduced and Referred to Judiciary; Senate Journal 13, Pg.258 "
225844,2011-04-27,"Senate Hearing: 5/5/11, Room 101, Legislative Office Building, 1:15 p.m.; Senate Calendar 22 "
225844,2011-05-05,"Senate Committee Report: Ought to Pass with Amendment #2011-1782s, 5/11/11; Senate Calendar 23 "
225844,2011-05-11,"Senate Committee Amendment 1782s, Amendment Adopted, Voice Vote; Senate Journal 16, Pg.332 "
225844,2011-05-11,"Senate Ought to Pass with Amendment 1782s, Motion Adopted, Voice Vote; OT3rdg; Senate Journal 16, Pg.332 "
225844,2011-05-11,"Senate Passed by Third Reading Resolution; Senate Journal 16 "
225844,2011-05-25,"House House Non-Concurs with Senate Amendment #1782s and Requests C of C (Reps Renzullo and Rowe): Motion Adopted Voice Vote; House Journal  46, PG.1582 "
225844,2011-05-25,"House Speaker Appoints: Reps Renzullo, Kappler, Spang, and Tregenza; House Journal  46, PG.1582 "
225844,2011-06-08,"Senate Sen. Houde Accedes to House Request for Committee of Conference; Senate Journal 20, Pg.567 "
225844,2011-06-08,"Senate President Appoints: Senators Forrester, Gallus and Merrill; Senate Journal 20, Pg.567 "
225844,2011-06-09,"House Conference Committee Meeting: 6/14/2011 10:00 Amendment Legislative Office Building 305 "
225844,2011-06-15,"Senate Conference Committee Report #2011-2389c; House Amendment, Filed "
225844,2011-06-22,"Senate Conference Committee Report 2389c; Adopted, Voice Vote "
225844,2011-06-22,"House Conference Committee Report #2389c Adopted, Voice Vote; House Journal  57, PG.1840 "
225844,2011-06-22,"Senate Enrolled "
225844,2011-06-22,"House Enrolled; House Journal  57, PG.1859 "
225844,2011-07-18,"House Signed By Governor 07/13/2011; Effective 07/13/2011; Chapter 0256 "
225845,2011-01-10,"House Introduced 1/6/2011 and Referred to State-Federal Relations and Veterans Affairs; House Journal  11, PG. 173 "
225845,2011-01-18,"House Public Hearing: 1/27/2011 10:30 Amendment Legislative Office Building 203 "
225845,2011-01-27,"House Subcommittee Work Session: 2/2/2011 2:00 PM Legislative Office Building 203 "
225845,2011-02-03,"House Subcommittee Work Session: 2/9/2011 Legislative Office Building 203 2:00 PM or 15 Minutes Following House Session "
225845,2011-02-09,"House Executive Session: 2/15/2011 Legislative Office Building 203 3:00 PM or Immediately Following House Session "
225845,2011-02-16,"House Committee Report: Ought to Pass with Amendment #0260h for Feb 23 (Vote 11-0; Consent Calendar); House Calendar 15, PG.273 "
225845,2011-02-16,"House Proposed Committee Amendment #2011-0260h; House Calendar 15, PG.298 "
225845,2011-02-23,"House Amendment #0260h Adopted, Voice Vote; House Journal  21, PG.464 "
225845,2011-02-23,"House Ought to Pass with Amendment #0260h: Motion Adopted Voice Vote; House Journal  21, PG.464 "
225845,2011-03-16,"Senate Introduced and Referred to Public and Municipal Affairs "
225845,2011-04-07,"Senate Hearing: 4/12/11, Room 101, Legislative Office Building, 9:35 a.m.; Senate Calendar 19 "
225845,2011-04-13,"Senate Committee Report: Ought to Pass with Amendment #2011-1416s, 4/20/11; Senate Calendar 20 "
225845,2011-04-20,"Senate Committee Amendment 1416s, Amendment Adopted, Voice Vote; Senate Journal 13, Pg.267 "
225845,2011-04-20,"Senate Ought to Pass with Amendment 1416s, Motion Adopted, Voice Vote; OT3rdg; Senate Journal 13, Pg.267 "
225845,2011-04-20,"Senate Passed by Third Reading Resolution; Senate Journal 13, Pg.270 "
225845,2011-05-04,"House House Concurs with Senate Amendment #1416s (Rep Baldasaro): Motion Adopted Voice Vote; House Journal  42, PG.1450 "
225845,2011-05-18,"Senate Enrolled Bill Amendment #1794e Adopted; Senate Journal 18, Pg.361 "
225845,2011-05-18,"House Enrolled Bill Amendment #2011-1794e Adopted; House Journal  44, PG.1566 "
225845,2011-05-25,"Senate Enrolled; Senate Journal 19, Pg.395 "
225845,2011-05-25,"House Enrolled; House Journal  46, PG.1609 "
225845,2011-06-08,"House Signed by Governor 06/06/2011; Effective 06/06/2011; Chapter 0127 "
225846,2011-01-10,"House Introduced 1/6/2011 and Referred to Labor, Industrial and Rehabilitative Services; House Journal  11, PG. 173 "
225846,2011-01-13,"House Public Hearing: 1/18/2011 2:15 PM Legislative Office Building 307 "
225846,2011-02-09,"House Executive Session: 3/1/2011 1:00 PM Legislative Office Building 307 "
225846,2011-03-03,"House Majority Committee Report: Ought to Pass for Mar 15 (Vote 8-7; Regular Calendar); House Calendar 22, PG.559-560 "
225846,2011-03-03,"House Minority Committee Report: Inexpedient to Legislate; House Calendar 22, PG.559-560 "
225846,2011-03-16,"House Ought to Pass: Motion Adopted Regular Calendar 239-106; House Journal  28, PG.897-899 "
225846,2011-03-23,"Senate Introduced and Referred to Commerce; Senate Journal 11, Pg.190 "
225846,2011-05-05,"Senate Hearing: 5/10/11, Room 102, Legislative Office Building, 9:45 a.m.; Senate Calendar 23 "
225846,2011-05-11,"Senate Committee Report: Ought to Pass, 5/18/11; Senate Calendar 24 "
225846,2011-05-18,"Senate Ought to Pass, Regular Calendar 19Y-5N, Motion Adopted; OT3rdg; Senate Journal 17, Pg.345 "
225846,2011-05-18,"Senate Passed by Third Reading Resolution; Senate Journal 17, Pg.357 "
225846,2011-06-01,"Senate Enrolled; Senate Journal 20, Pg.546 "
225846,2011-06-01,"House Enrolled; House Journal  48, PG.1669 "
225846,2011-06-09,"House Vetoed By Governor 06/08/2011; House Calendar 47, PG.1612 "
225846,2011-06-22,"House Veto Overridden: Regular Calendar 261-110 By Required Two-Thirds; House Journal  57, PG.1828-1830 "
225846,2011-06-22,"Senate Notwithstanding the Governors Veto, Shall HB 133 Become Law: Regular Calendar 19Y-5N, Veto Overridden by required two-thirds "
225846,2011-06-23,"House Veto Override 06/22/2011; I. Section 2 Effective 12/31/2011 at 12:01 a.m.; II. Remainder Effective 08/21/2011; Chapter 0204 "
225847,2011-01-10,"House Introduced 1/6/2011 and Referred to Transportation; House Journal  11, PG. 173 "
225847,2011-01-11,"House Public Hearing: 1/18/2011 3:30 PM Legislative Office Building 203 "
225847,2011-01-25,"House ==CANCELLED== Executive Session: 1/26/2011 Legislative Office Building 203 Following Session "
225847,2011-02-23,"House =RESCHEDULED=Executive Session: 3/2/2011 Legislative Office Building 203 3:00 PM or immediately after House session "
225847,2011-03-03,"House Committee Report: Ought to Pass with Amendment #0137h for Mar 15 (Vote 13-0; Consent Calendar); House Calendar 22, PG.542 "
225847,2011-03-03,"House Proposed Committee Amendment #2011-0137h; House Calendar 23, PG.585 "
225847,2011-03-15,"House Amendment #0137h Adopted, Voice Vote; House Journal  26, PG.740-741 "
225847,2011-03-15,"House Ought to Pass with Amendment #0137h: Motion Adopted Voice Vote; House Journal  26, PG.740-741 "
225847,2011-03-23,"Senate Introduced and Referred to Transportation; Senate Journal 11, Pg.190 "
225847,2011-03-24,"Senate Hearing: 3/31/11, Room 103, Legislative Office Building, 9:15 a.m.; Senate Calendar 17 "
225847,2011-04-28,"Senate Committee Report: Inexpedient to Legislate, 5/4/11; Senate Calendar 22 "
225847,2011-05-04,"Senate Inexpedient to Legislate, Motion Adopted, Voice Vote === BILL KILLED ===; Senate Journal 15, Pg.308 "
225848,2011-01-10,"House Introduced 1/6/2011 and Referred to Legislative Administration; House Journal  11, PG. 173 "
225848,2011-01-13,"House Public Hearing: 1/18/2011 10:00 Amendment Legislative Office Building 104 "
225848,2011-01-26,"House ==CANCELLED== Executive Session: 2/1/2011 11:30 Amendment Legislative Office Building 104 "
225848,2011-02-01,"House Subcommittee Work Session: 2/8/2011 11:30 Amendment Legislative Office Building 104 "
225848,2011-02-08,"House Subcommittee Work Session: 2/9/2011 1:00 PM Legislative Office Building 104 "
225848,2011-02-09,"House Subcommittee Work Session: 2/15/2011 12:00 PM Legislative Office Building 104 "
225848,2011-02-09,"House Subcommittee Work Session: 2/17/2011 1:30 PM Legislative Office Building 104 "
225848,2011-02-09,"House Executive Session: 2/22/2011 11:00 Amendment Legislative Office Building 104 "
225848,2011-02-22,"House Committee Report: Inexpedient to Legislate for Mar 2 (Vote 12-0; Consent Calendar); House Calendar 18, PG.388 "
225848,2011-03-02,"House Inexpedient to Legislate: Motion Adopted Voice Vote; House Journal  25, PG.674-675 "
225849,2011-01-10,"House Introduced 1/6/2011 and Referred to Executive Departments and Administration; House Journal  11, PG. 173 "
225849,2011-01-13,"House Public Hearing: 1/18/2011 10:15 Amendment Legislative Office Building 306 "
225849,2011-01-13,"House Executive Session: 1/18/2011 11:00 Amendment Legislative Office Building 306 "
225849,2011-01-26,"House Committee Report: Ought to Pass for Feb 9 (Vote 7-5; Regular Calendar); House Calendar 10, PG.150 "
225849,2011-02-09,"House Ought to Pass: Motion Adopted Regular Calendar 264-103; House Journal  16, PG.319-321 "
225849,2011-03-16,"Senate Introduced and Referred to Executive Departments and Administration "
225849,2011-03-24,"Senate Hearing: 3/31/11, Room 100, State House, 9:00 a.m.; Senate Calendar 17 "
225849,2011-03-31,"Senate Committee Report: Ought to Pass, 4/13/11; Senate Calendar 19 "
225849,2011-04-13,"Senate Ought to Pass Not Voted On "
225849,2011-04-13,"Senate Sen. Prescott Moved Laid on Table, Motion Adopted, Voice Vote; Senate Journal 12, Pg.249 "
225849,2011-06-01,"Senate Sen. Boutin Moved Remove From Table, Motion Adopted, Voice Vote; Senate Journal 19, Pg.524 "
225849,2011-06-01,"Senate Chair Ruled Non-Germane Amendment; Senate Journal 19, Pg.524 "
225849,2011-06-01,"Senate Sen. Houde Floor Amendment #2011-2239s, Not Voted On; Senate Journal 19, Pg.525 "
225849,2011-06-01,"Senate Sen. Boutin Moved Laid on Table, Motion Adopted, Voice Vote; Senate Journal 19, Pg.526 "
225849,2011-06-01,"Senate Sen. Houde Moved Remove From Table, Motion Adopted, Voice Vote; Senate Journal 19, Pg.537 "
225849,2011-06-01,"Senate Sen. Houde Withdrew Floor Amendment 2239s; Senate Journal 19, Pg.537 "
225849,2011-06-01,"Senate Chair Ruled Non-Germane Amendment; Senate Journal 19, Pg.537 "
225849,2011-06-01,"Senate Sen. Houde Moved to Suspend Rule 3-7 to Allow Non-Germane Amendment 2280s, 2/3 necessary, Motion Adopted, Voice Vote; Senate Journal 19, Pg.537 "
225849,2011-06-01,"Senate Sen. Houde Floor Amendment #2011-2280s, New Title, Amendment Adopted, Voice Vote; Senate Journal 19, Pg.538 "
225849,2011-06-01,"Senate Ought to Pass with Amendment 2280s, New Title, Motion Adopted, Voice Vote; OT3rdg; Senate Journal 19, Pg.538 "
225849,2011-06-01,"Senate Passed by Third Reading Resolution; Senate Journal 19, Pg.539 "
225849,2011-06-08,"House House Non-Concurs with Senate Amendment 2280s(NT) (Rep C.McGuire): Motion Adopted Voice Vote; House Journal  51, PG.1720 "
225850,2011-01-10,"House Introduced 1/6/2011 and Referred to Executive Departments and Administration; House Journal  11, PG. 173 "
225850,2011-01-19,"House Public Hearing: 1/25/2011 1:30 PM Legislative Office Building 306 "
225850,2011-02-03,"House Subcommittee Work Session: 2/10/2011 3:00 PM Legislative Office Building 306 "
225850,2011-02-17,"House Subcommittee Work Session: 3/1/2011 2:00 PM Legislative Office Building 306 "
225850,2011-03-02,"House Subcommittee Work Session: 3/3/2011 4:00 PM Legislative Office Building 306 "
225850,2011-03-02,"House Executive Session: 3/9/2011 1:00 PM Legislative Office Building 306 "
225850,2011-03-09,"House Retained in Committee; House Calendar 27, PG.823 "
225850,2011-04-05,"House Retained Bill - Subcommittee Work Session: 4/14/2011 2:00 PM Legislative Office Building 306 "
225850,2011-08-24,"House Retained Bill - Subcommittee Work Session: 8/30/2011 11:30 Amendment Legislative Office Building 306 "
225850,2011-08-30,"House Retained Bill - Subcommittee Work Session: 9/20/2011 11:30 Amendment Legislative Office Building 306 "
225850,2011-09-27,"House Retained Bill - Subcommittee Work Session: 10/4/2011 3:00 PM Legislative Office Building 306 "
225850,2011-10-12,"House Retained Bill - Subcommittee Work Session: 10/20/2011 2:30 PM Legislative Office Building 306 "
225850,2011-10-12,"House Retained Bill - Executive Session: 10/27/2011 10:00 Amendment Legislative Office Building 306 (If Necessary Continued 11/1/2011 10:30 Amendment Legislative Office Building 306) "
225851,2011-01-10,"House Introduced 1/6/2011 and Referred to Criminal Justice and Public Safety; House Journal  11, PG. 173 "
225851,2011-01-18,"House Public Hearing: 1/25/2011 10:00 Amendment Legislative Office Building 204 "
225851,2011-01-26,"House Executive Session: 2/3/2011 10:00 Amendment Legislative Office Building 204 "
225851,2011-02-03,"House Retained in Committee; House Calendar 27, PG.823 "
225851,2011-08-30,"House Retained Bill - Subcommittee Work Session: 9/15/2011 10:00 Amendment Legislative Office Building 204 "
225851,2011-09-19,"House Retained Bill - Subcommittee Work Session: 9/29/2011 1:00 PM Legislative Office Building 204 "
225851,2011-09-27,"House Retained Bill - Executive Session: 10/20/2011 10:00 Amendment Legislative Office Building 204 "
225852,2011-01-10,"House Introduced 1/6/2011 and Referred to Public Works and Highways; House Journal  11, PG. 173 "
225852,2011-01-27,"House ==RESCHEDULED== Public Hearing: 2/8/2011 1:15 PM Legislative Office Building 201 (Orig 1:00 PM) "
225852,2011-02-02,"House Executive Session: 2/16/2011 Legislative Office Building 201 1:00 PM or Immediately Following House Session"
225852,2011-02-17,"House Committee Report: Inexpedient to Legislate for Mar 2 (Vote 15-1; Consent Calendar); House Calendar 18, PG.389 "
225852,2011-03-02,"House Inexpedient to Legislate: Motion Adopted Voice Vote; House Journal  25, PG.675 "
225853,2011-01-10,"House Introduced 1/6/2011 and Referred to Judiciary "
225853,2011-01-13,"House Public Hearing: 1/20/2011 11:00 Amendment Legislative Office Building 208; House Journal  11, PG. 173 "
225853,2011-01-13,"House ===CANCELLED=== Work Session: 1/20/2011 1:30 PM Legislative Office Building 208 "
225853,2011-01-19,"House Division II Work Session: 1/27/2011 1:30 PM Legislative Office Building 208 "
225853,2011-01-26,"House Executive Session: 2/1/2011 11:00 Amendment Legislative Office Building 208 "
225853,2011-02-03,"House Committee Report: Inexpedient to Legislate for Feb 9 (Vote 16-0; Consent Calendar); House Calendar 12, PG.202 "
225853,2011-02-09,"House Removed from Consent Calendar (Rep Horrigan); House Journal  16, PG.309 "
225853,2011-02-09,"House Inexpedient to Legislate: Motion Adopted Voice Vote; House Journal  16, PG.330 "
225854,2011-01-10,"House Introduced 1/6/2011 and Referred to Judiciary "
225854,2011-01-13,"House Public Hearing: 1/20/2011 10:00 Amendment Legislative Office Building 208; House Journal  11, PG. 173 "
225854,2011-01-13,"House Division I Work Session: 1/20/2011 1:30 PM Legislative Office Building 208 "
225854,2011-01-19,"House Division I Work Session: 1/25/2011 1:30 PM Legislative Office Building 208 "
225854,2011-01-26,"House ==CANCELLED== Executive Session: 2/1/2011 11:00 Amendment Legislative Office Building 208 "
225854,2011-02-02,"House Division I Work Session: 2/8/2011 Legislative Office Building 208 3:00 PM "
225854,2011-02-16,"House ==CANCELLED== Executive Session: 3/1/2011 1:00 PM Legislative Office Building 208 (If Necessary Continued 3/3/2011 10:00 Amendment Legislative Office Building 208) "
225854,2011-03-02,"House Executive Session: 3/9/2011 10:00 Amendment Legislative Office Building 208 "
225854,2011-03-09,"House Majority Committee Report: Ought to Pass with Amendment #0125h(NT) for Mar 15 (Vote 11-4; Regular Calendar); House Calendar 22, PG.556 "
225854,2011-03-09,"House Proposed Majority Committee Amendment #2011-0125h (New Title); House Calendar 23, PG.585-586 "
225854,2011-03-09,"House Minority Committee Report: Inexpedient to Legislate; House Calendar 22, PG.556 "
225854,2011-03-16,"House Amendment #0125h (New Title) Adopted, Voice Vote; House Journal  28, PG.872-873 "
225854,2011-03-16,"House Ought to Pass with Amendment #0125h(NT): Motion Adopted Division Vote 224-65; House Journal  28, PG.872-873 "
225854,2011-04-13,"Senate Introduced and Referred to Judiciary; Senate Journal 13, Pg.258 "
225854,2011-05-05,"Senate Hearing: 5/19/11, Representatives' Hall, 1:00 p.m.; Senate Calendar 23 "
225854,2011-05-26,"Senate Committee Report: Ought to Pass with Amendment #2011-2189s, New Title, 6/1/11; Senate Calendar 26 "
225854,2011-06-01,"Senate Committee Amendment 2189s, New Title, Amendment Adopted, Voice Vote; Senate Journal 19, Pg.519 "
225854,2011-06-01,"Senate Ought to Pass with Amendment 2189s, New Title, Motion Adopted, Voice Vote; OT3rdg; Senate Journal 19, Pg.519 "
225854,2011-06-01,"Senate Passed by Third Reading Resolution; Senate Journal 19, Pg.539 "
225854,2011-06-08,"House House Non-Concurs with Senate Amendment 2189s(NT) and Requests C of C (Rep Rowe): Motion Adopted Voice Vote; House Journal  51, PG.1715 "
225854,2011-06-08,"House Speaker Appoints: Reps Sorg, McClarren, Giuda, and LaCasse; House Journal  51, PG.1715 "
225854,2011-06-08,"Senate Sen. Houde Accedes to House Request for Committee of Conference, Motion Adopted, Voice Vote "
225854,2011-06-08,"Senate President Appoints: Senators Carson, Forsythe and Kelly "
225854,2011-06-10,"House Conference Committee Meeting: 6/15/2011 1:00 PM Legislative Office Building 208 "
225854,2011-06-16,"Senate Conference Committee Report; Not Signed Off "
225855,2011-01-11,"House Introduced 1/6/2011 and Referred to Commerce and Consumer Affairs; House Journal  11, PG. 174 "
225855,2011-01-13,"House Public Hearing: 1/19/2011 10:00 Amendment Legislative Office Building 302 "
225855,2011-01-19,"House Subcommittee Work Session: 1/25/2011 11:0 Amendment Legislative Office Building 302 "
225855,2011-01-26,"House Executive Session: 2/1/2011 10:00 Amendment Legislative Office Building 302 "
225855,2011-02-03,"House Committee Report: Ought to Pass for Feb 9 (Vote 14-0; Consent Calendar); House Calendar 12, PG.200 "
225855,2011-02-09,"House Ought to Pass: Motion Adopted Voice Vote; House Journal  16, PG.309 "
225855,2011-03-16,"Senate Introduced and Referred to Commerce "
225855,2011-03-24,"Senate Hearing: 3/29/11, Room 102, Legislative Office Building, 9:10 a.m.; Senate Calendar 17 "
225855,2011-03-30,"Senate Committee Report: Ought to Pass, 4/13/11; Senate Calendar 19 "
225855,2011-04-13,"Senate Ought to Pass, Motion Adopted, Voice Vote; OT3rdg; Senate Journal 12, Pg.245 "
225855,2011-04-13,"Senate Passed by Third Reading Resolution; Senate Journal 12, Pg.254 "
225855,2011-04-27,"House Enrolled Bill Amendment #2011-1469e Adopted; House Journal  40, PG.1388 "
225855,2011-04-27,"Senate Enrolled Bill Amendment #1469 Adopted; Senate Journal 15, Pg.292 "
225855,2011-05-04,"Senate Enrolled; Senate Journal 16, Pg.318 "
225855,2011-05-04,"House Enrolled; House Journal  42, PG.1490 "
225855,2011-05-19,"House Signed by Governor 05/16/2011; Effective 01/01/2012; Chapter 0066 "
225856,2011-01-11,"House Introduced 1/6/2011 and Referred to Commerce and Consumer Affairs; House Journal  11, PG. 174 "
225856,2011-01-13,"House Public Hearing: 1/19/2011 10:30 Amendment Legislative Office Building 302 "
225856,2011-01-25,"House Subcommittee Work Session: 2/1/2011 9:00 Amendment Legislative Office Building 302 "
225856,2011-01-26,"House Executive Session: 2/1/2011 10:00 Amendment Legislative Office Building 302 "
225856,2011-02-03,"House Committee Report: Ought to Pass with Amendment #0139h for Feb 9 (Vote 14-0; Consent Calendar); House Calendar 12, PG.200 "
225856,2011-02-03,"House Proposed Committee Amendment #2011-0139h; House Calendar 12, PG.227 "
225856,2011-02-09,"House Amendment #0139h Adopted, Voice Vote; House Journal  16, PG.310 "
225856,2011-02-09,"House Ought to Pass with Amendment #0139h: Motion Adopted Voice Vote; House Journal  16, PG.310 "
225856,2011-03-16,"Senate Introduced and Referred to Commerce "
225856,2011-04-07,"Senate Hearing: 4/12/11, Room 102, Legislative Office Building, 9:00 a.m.; Senate Calendar 19 "
225856,2011-04-13,"Senate Committee Report: Ought to Pass, 4/20/11; Senate Calendar 20 "
225856,2011-04-20,"Senate Ought to Pass, Motion Adopted, Voice Vote; OT3rdg; Senate Journal 13, Pg.261 "
225856,2011-04-20,"Senate Passed by Third Reading Resolution; Senate Journal 13, Pg.270 "
225856,2011-05-04,"Senate Enrolled; Senate Journal 16, Pg.318 "
225856,2011-05-04,"House Enrolled; House Journal  42, PG.1490 "
225856,2011-05-19,"House Signed by Governor 05/16/2011; Effective 01/01/2012; Chapter 0067 "
225857,2011-01-11,"House Introduced 1/6/2011 and Referred to Municipal and County Government; House Journal  11, PG. 174 "
225857,2011-01-19,"House Public Hearing: 1/25/2011 11:15 Amendment Legislative Office Building 301 "
225857,2011-01-19,"House Executive Session: 2/24/2011 1:00 PM Legislative Office Building 301 "
225857,2011-03-01,"House Committee Report: Ought to Pass with Amendment #0528h(NT) for Mar 15 (Vote 15-0; Consent Calendar); House Calendar 22, PG.536 "
225857,2011-03-01,"House Proposed Committee Amendment #2011-0528h (New Title); House Calendar 23, PG.586-587 "
225857,2011-03-15,"House Amendment #0528h (New Title) Adopted, Voice Vote; House Journal  26, PG.729-731 "
225857,2011-03-15,"House Ought to Pass with Amendment #0528h(NT): Motion Adopted Voice Vote; House Journal  26, PG.729-731 "
225857,2011-03-23,"Senate Introduced and Referred to Energy and Natural Resources; Senate Journal 11, Pg.190 "
225857,2011-04-06,"Senate Hearing: 4/14/11, Room 102, Legislative Office Building, 9:30 a.m.; Senate Calendar 19 "
225857,2011-04-14,"Senate Committee Report: Ought to Pass, 4/20/11; Senate Calendar 20 "
225857,2011-04-20,"Senate Ought to Pass, Motion Adopted, Voice Vote; OT3rdg; Senate Journal 13, Pg.264 "
225857,2011-04-20,"Senate Passed by Third Reading Resolution; Senate Journal 13, Pg.270 "
225857,2011-05-04,"Senate Enrolled; Senate Journal 16, Pg.318 "
225857,2011-05-04,"House Enrolled; House Journal  42, PG.1490 "
225857,2011-05-20,"House Signed by Governor 05/16/2011; Effective 07/15/2011; Chapter 0068 "
225858,2011-01-11,"House Introduced 1/6/2011 and Referred to Criminal Justice and Public Safety; House Journal  11, PG. 174 "
225858,2011-01-18,"House Public Hearing: 1/25/2011 10:30 Amendment Legislative Office Building 204 "
225858,2011-01-25,"House ==CANCELLED== Executive Session: 2/3/2011 10:00 Amendment Legislative Office Building 204 "
225858,2011-02-03,"House Subcommittee Work Session: 2/8/2011 9:15 Amendment Legislative Office Building 204 "
225858,2011-02-10,"House ==RESCHEDULED== Work Session: 2/15/2011 8:30 Amendment Legislative Office Building 204 (Orig 8:00 Amendment) "
225858,2011-02-16,"House Subcommittee Work Session: 2/22/2011 8:31 Amendment Legislative Office Building 204 "
225858,2011-03-02,"House Subcommittee Work Session: 3/9/2011 9:00 Amendment Legislative Office Building 204 "
225858,2011-03-02,"House Executive Session: 3/9/2011 10:00 Amendment Legislative Office Building 204 "
225858,2011-03-10,"House Committee Report: Ought to Pass with Amendment #0766h(NT) for Mar 15 (Vote 13-4; Regular Calendar); House Calendar 22, PG.548 "
225858,2011-03-10,"House Proposed Committee Amendment #2011-0766h (New Title); House Calendar 23, PG.587 "
225858,2011-03-15,"House Amendment #0766h (New Title) Adopted, Regular Calendar 215-151; House Journal  26, PG.759-761 "
225858,2011-03-15,"House Ought to Pass with Amendment #0766h(NT): Motion Adopted Division Vote 296-70; House Journal  26, PG.759-761 "
225858,2011-03-23,"Senate Introduced and Referred to Judiciary; Senate Journal 11, Pg.190 "
225858,2011-05-05,"Senate Hearing: 5/26/11, Room 101, Legislative Office Building, 1:15 p.m.; Senate Calendar 23 "
225858,2011-05-26,"Senate Committee Report: Rereferred to Committee, 6/1/11; Senate Calendar 26 "
225858,2011-06-01,"Senate Rereferred to Committee, Motion Adopted, Voice Vote; Senate Journal 19, Pg.519 "
225859,2011-01-11,"House Introduced 1/6/2011 and Referred to Judiciary; House Journal  11, PG. 174 "
225859,2011-01-19,"House Public Hearing: 1/27/2011 11:00 Amendment Legislative Office Building 208 "
225859,2011-01-19,"House Division II Work Session: 1/27/2011 1:30 PM Legislative Office Building 208 "
225859,2011-02-02,"House Division II Work Session: 2/10/2011 Legislative Office Building 208 3:00 PM or Following Public Hearing "
225859,2011-02-15,"House Executive Session: 2/15/2011 Legislative Office Building 208 Following House Session "
225859,2011-02-16,"House Committee Report: Inexpedient to Legislate for Feb 23 (Vote 15-0; Consent Calendar); House Calendar 15, PG.270-271 "
225859,2011-02-23,"House Removed from Consent Calendar (Rep Itse); House Journal  21, PG.456 "
225859,2011-02-23,"House Recommit (Rep Rowe): Motion Adopted Division Vote 208-71; House Journal  21, PG.518 "
225859,2011-03-02,"House Executive Session: 3/9/2011 10:00 Amendment Legislative Office Building 208 "
225859,2011-03-09,"House Committee Report: Ought to Pass with Amendment #0591h(NT) for Mar 15 (Vote 17-1; Consent Calendar); House Calendar 22, PG.533 "
225859,2011-03-09,"House Proposed Committee Amendment #2011-0591h (New Title); House Calendar 23, PG.587 "
225859,2011-03-15,"House Amendment #0591h (New Title) Adopted, Voice Vote; House Journal  26, PG.718 "
225859,2011-03-15,"House Ought to Pass with Amendment #0591h(NT): Motion Adopted Voice Vote; House Journal  26, PG.718 "
225859,2011-03-23,"Senate Introduced and Referred to Judiciary; Senate Journal 11, Pg.190 "
225859,2011-04-06,"Senate Hearing: 4/14/11, Room 101, Legislative Office Building, 1:00 p.m.; Senate Calendar 19 "
225859,2011-05-26,"Senate Committee Report: Inexpedient to Legislate, 6/1/11; Senate Calendar 26 "
225859,2011-06-01,"Senate Without Objection, President Bragdon moved to Special Order HB 146 to the end of the Calendar; Senate Journal 19, Pg.517 "
225859,2011-06-01,"Senate Committee Report: Inexpedient to Legislate, 6/1/11; Senate Calendar 26 "
225859,2011-06-01,"Senate Inexpedient to Legislate, Division 8Y-12N, Motion Failed; Senate Journal 19, Pg.520 "
225859,2011-06-01,"Senate Sen. Carson moved to Rereferred to Committee, Motion Adopted, Voice Vote; Senate Journal 19, Pg.520 "
225860,2011-01-11,"House Introduced 1/6/2011 and Referred to Criminal Justice and Public Safety; House Journal  11, PG. 174 "
225860,2011-01-18,"House ==CANCELLED== Public Hearing: 1/27/2011 10:00 Amendment Legislative Office Building 204 "
225860,2011-01-20,"House ==RESCHEDULED== Public Hearing: 2/1/2011 10:00 Amendment RepresentativeS HALL "
225860,2011-03-02,"House Executive Session: 3/9/2011 10:00 Amendment Legislative Office Building 204 "
225860,2011-03-09,"House Committee Report: Ought to Pass for Mar 15 (Vote 14-2; Regular Calendar); House Calendar 22, PG.548 "
225860,2011-03-15,"House Ought to Pass: Motion Adopted Voice Vote; House Journal  26, PG.761-762 "
225860,2011-03-16,"House Reconsideration (Rep P.Garrity): Motion Failed Regular Calendar 104-247; House Journal  28, PG.888-890 "
225860,2011-03-16,"House Print Debate in Permanent Journal (Rep G.Richardson): Motion Failed Regular Calendar 93-259; House Journal  28, PG.890-892 "
225860,2011-04-13,"Senate Introduced and Referred to Judiciary; Senate Journal 13, Pg.258 "
225860,2011-05-05,"Senate Hearing: 5/18/11, Room 305-307, Legislative Office Building, 1:30 p.m.; Senate Calendar 23 "
225860,2011-05-26,"Senate Committee Report: Ought to Pass with Amendment #2011-2191s, 6/1/11; Senate Calendar 26 "
225860,2011-06-01,"Senate Without Objection, President Bragdon moved to Special Order HB 147 to the end of the Calendar; Senate Journal 19, Pg.517 "
225860,2011-06-01,"Senate Committee Report: Ought to Pass with Amendment #2011-2191s, 6/1/11; Senate Calendar 26 "
225860,2011-06-01,"Senate Committee Amendment 2191s, Amendment Adopted, Voice Vote; Senate Journal 19, Pg.520 "
225860,2011-06-01,"Senate Ought to Pass with Amendment 2191s, Motion Adopted, Voice Vote; OT3rdg; Senate Journal 19, Pg.520 "
225860,2011-06-01,"Senate Passed by Third Reading Resolution; Senate Journal 19, Pg.539 "
225860,2011-06-08,"House House Concurs with Senate Amendment #2191s (Rep Swinford): Motion Adopted Regular Calendar 211-153; House Journal  51, PG.1712-1714 "
225860,2011-06-08,"Senate Enrolled "
225860,2011-06-08,"House Enrolled; House Journal  51, PG.1728 "
225860,2011-06-30,"House Signed By Governor 06/28/2011; Effective 07/01/2011; Chapter 0222 "
225861,2011-01-11,"House Introduced 1/6/2011 and Referred to Transportation; House Journal  11, PG. 174 "
225861,2011-01-18,"House Public Hearing: 1/25/2011 10:00 Amendment Legislative Office Building 203 "
225861,2011-01-26,"House Executive Session: 2/1/2011 11:30 Amendment Legislative Office Building 203 "
225861,2011-02-01,"House Committee Report: Ought to Pass for Feb 9 (Vote 13-0; Consent Calendar); House Calendar 12, PG.206 "
225861,2011-02-09,"House Ought to Pass: Motion Adopted Voice Vote; House Journal  16, PG.317 "
225861,2011-03-09,"Senate Introduced and Referred to Transportation; Senate Journal 9, Pg.102 "
225861,2011-03-16,"Senate Hearing: 3/24/11, Room 103, Legislative Office Building, 10:15 a.m.; Senate Calendar 16 "
225861,2011-04-14,"Senate Committee Report: Ought to Pass, 4/20/11; Senate Calendar 20 "
225861,2011-04-20,"Senate Ought to Pass, Motion Adopted, Voice Vote; OT3rdg; Senate Journal 13, Pg.268 "
225861,2011-04-20,"Senate Passed by Third Reading Resolution; Senate Journal 13, Pg.270 "
225861,2011-05-04,"Senate Enrolled; Senate Journal 16, Pg.318 "
225861,2011-05-04,"House Enrolled; House Journal  42, PG.1490 "
225861,2011-05-20,"House Signed by Governor 05/16/2011; Effective 07/15/2011; Chapter 0069 "
225862,2011-01-11,"House Introduced 1/6/2011 and Referred to Resources, Recreation and Development; House Journal  11, PG. 174 "
225862,2011-01-18,"House Public Hearing: 1/25/2011 2:15 PM Legislative Office Building 305 "
225862,2011-01-26,"House Subcommittee Work Session: 2/1/2011 3:00 PM Legislative Office Building 305 "
225862,2011-02-01,"House Subcommittee Work Session: 2/8/2011 3:15 PM Legislative Office Building 305 "
225862,2011-02-15,"House ==CANCELLED== Executive Session: 2/15/2011 Legislative Office Building 305 3:00 PM or Following House Session "
225862,2011-02-22,"House Executive Session: 3/1/2011 1:00 PM Legislative Office Building 305 "
225862,2011-03-03,"House Committee Report: Ought to Pass with Amendment #0126h(NT) for Mar 15 (Vote 14-0; Consent Calendar); House Calendar 22, PG.539 "
225862,2011-03-03,"House Proposed Committee Amendment #2011-0126h (New Title); House Calendar 23, PG.587-588 "
225862,2011-03-15,"House Amendment #0126h (New Title) Adopted, Voice Vote; House Journal  26, PG.737-738 "
225862,2011-03-15,"House Ought to Pass with Amendment #0126h(NT): Motion Adopted Voice Vote; House Journal  26, PG.737-738 "
225862,2011-03-23,"Senate Introduced and Referred to Energy and Natural Resources; Senate Journal 11, Pg.190 "
225862,2011-03-31,"Senate Hearing: 4/7/11, Room 102, Legislative Office Building, 9:20 a.m.; Senate Calendar 18 "
225862,2011-04-28,"Senate Committee Report: Ought to Pass with Amendment #2011-1367s, 5/4/11; Senate Calendar 22 "
225862,2011-05-04,"Senate Committee Amendment 1367s, Amendment Adopted, Voice Vote; Senate Journal 15, Pg.301 "
225862,2011-05-04,"Senate Ought to Pass with Amendment 1367s, Motion Adopted, Voice Vote; OT3rdg; Senate Journal 15, Pg.301 "
225862,2011-05-04,"Senate Passed by Third Reading Resolution; Senate Journal 15, Pg.311 "
225862,2011-05-18,"House House Concurs with Senate Amendment #1367s (Rep Renzullo): Motion Adopted Voice Vote; House Journal  44, PG.1531 "
225862,2011-06-01,"Senate Enrolled; Senate Journal 20, Pg.546 "
225862,2011-06-01,"House Enrolled; House Journal  48, PG.1669 "
225862,2011-06-09,"House Signed By Governor 06/07/2011; Effective 06/07/2011; Chapter 0135 "
225863,2011-01-11,"House Introduced 1/6/2011 and Referred to Executive Departments and Administration; House Journal  11, PG. 174 "
225863,2011-01-13,"House Public Hearing: 1/18/2011 1:00 PM Legislative Office Building 306 "
225863,2011-01-25,"House Executive Session: 2/16/2011 Legislative Office Building 306 1:30 PM or 45 Minutes After Session "
225863,2011-02-17,"House Committee Report: Ought to Pass with Amendment #0049h for Feb 23 (Vote 16-0; Consent Calendar); House Calendar 15, PG.268 "
225863,2011-02-17,"House Proposed Committee Amendment #2011-0049h; House Calendar 15, PG.298-299 "
225863,2011-02-23,"House Amendment #0049h Adopted, Voice Vote; House Journal  21, PG.459 "
225863,2011-02-23,"House Ought to Pass with Amendment #0049h: Motion Adopted Voice Vote; House Journal  21, PG.459 "
225863,2011-03-16,"Senate Introduced and Referred to Executive Departments and Administration "
225863,2011-04-07,"Senate Hearing: 4/14/11, Room 100, State House, 9:50 a.m.; Senate Calendar 19 "
225863,2011-04-28,"Senate Committee Report: Ought to Pass, 5/4/11; Senate Calendar 22 "
225863,2011-05-04,"Senate Ought to Pass, Motion Adopted, Voice Vote; OT3rdg; Senate Journal 15, Pg.303 "
225863,2011-05-04,"Senate Passed by Third Reading Resolution; Senate Journal 15, Pg.312 "
225863,2011-05-18,"Senate Enrolled; Senate Journal 18, Pg.364 "
225863,2011-05-18,"House Enrolled; House Journal  44, PG.1564 "
225863,2011-06-01,"House Signed By Governor 05/27/2011; Effective 07/26/2011; Chapter 0093 "
225864,2011-01-11,"House Introduced 1/6/2011 and Referred to Judiciary; House Journal  11, PG. 174 "
225864,2011-01-19,"House Public Hearing: 1/27/2011 10:00 Amendment Legislative Office Building 208 "
225864,2011-01-19,"House Division II Work Session: 1/27/2011 1:30 PM Legislative Office Building 208 "
225864,2011-02-02,"House Division II Work Session: 2/10/2011 Legislative Office Building 208 3:00 PM "
225864,2011-02-15,"House Executive Session: 2/15/2011 Legislative Office Building 208 Following House Session "
225864,2011-02-15,"House Retained in Committee; House Calendar 27, PG.824 "
225864,2011-08-09,"House Retained Bill - Subcommittee Work Session: 9/13/2011 11:00 Amendment Legislative Office Building 208 "
225864,2011-09-14,"House Retained Bill - Executive Session: 10/25/2011 11:00 Amendment Legislative Office Building 208 "
225865,2011-01-11,"House Introduced 1/6/2011 and Referred to Election Law; House Journal  11, PG. 174 "
225865,2011-01-26,"House Public Hearing: 2/1/2011 3:00 PM Legislative Office Building 308 "
225865,2011-02-16,"House Executive Session: 2/22/2011 10:30 Amendment Legislative Office Building 308 "
225865,2011-02-22,"House Retained in Committee; House Calendar 27, PG.823 "
225865,2011-05-11,"House Retained Bill - Ballot Access and Election Procedures Subcommittee Work Session: 5/17/2011 2:00 PM Legislative Office Building 308 "
225865,2011-10-03,"House ==CANCELLED== Retained Bill - Subcommittee Work Session: 10/12/2011 Legislative Office Building 308 2:00 PM or Immediately Following House Session "
225865,2011-10-13,"House Retained Bill - Subcommittee Work Session: 10/18/2011 12:30 PM Legislative Office Building 308 "
225865,2011-10-19,"House Retained Bill - Executive Session: 10/27/2011 Legislative Office Building 308 1:00 PM or Immediately Following Public Hearing "
225866,2011-01-11,"House Introduced 1/6/2011 and Referred to Election Law; House Journal  11, PG. 174 "
225866,2011-01-26,"House Public Hearing: 2/1/2011 3:30 PM Legislative Office Building 308 "
225866,2011-02-16,"House Executive Session: 2/22/2011 10:30 Amendment Legislative Office Building 308 "
225866,2011-02-22,"House Retained in Committee; House Calendar 27, PG.823 "
225866,2011-05-11,"House Retained Bill - Ballot Access and Election Procedures Subcommittee Work Session: 5/17/2011 2:30 PM Legislative Office Building 308 "
225866,2011-10-03,"House ==CANCELLED== Retained Bill - Subcommittee Work Session: 10/12/2011 Legislative Office Building 308 2:00 PM or Immediately Following House Session "
225866,2011-10-13,"House Retained Bill - Subcommittee Work Session: 10/18/2011 12:30 PM Legislative Office Building 308 "
225866,2011-10-19,"House Retained Bill - Executive Session: 10/27/2011 Legislative Office Building 308 1:00 PM or Immediately Following Public Hearing "
225867,2011-01-11,"House Introduced 1/6/2011 and Referred to Ways and Means; House Journal  11, PG. 174  "
225867,2011-01-26,"House Public Hearing: 2/1/2011 1:00 PM Legislative Office Building 202 "
225867,2011-02-01,"House Executive Session: 2/8/2011 11:15 Amendment Legislative Office Building 202 "
225867,2011-02-09,"House Continued Executive Session Following House Session: Feb 9 Legislative Office Building 202 "
225867,2011-02-10,"House Majority Committee Report: Ought to Pass with Amendment #0153h(NT) for Feb 23 (Vote 15-5; Regular Calendar); House Calendar 15, PG.281 "
225867,2011-02-10,"House Proposed Majority Committee Amendment #2011-0153h (New Title); House Calendar 15, PG.299 "
225867,2011-02-10,"House Minority Committee Report: Inexpedient to Legislate; House Calendar 15, PG.281 "
225867,2011-02-23,"House Amendment #0153h (New Title) Adopted, Voice Vote; House Journal  21, PG.511 "
225867,2011-02-23,"House Ought to Pass with Amendment #0153h(NT): Motion Adopted Regular Calendar 235-54; House Journal  21, PG.511-513 "
225867,2011-02-23,"House Lay on the Table (Rep Stepanek): Motion Adopted Regular Calendar 212-86; House Journal  21, PG.513-515 "
225868,2011-01-11,"House Introduced 1/6/2011 and Referred to Municipal and County Government "
225868,2011-01-19,"House ==RESCHEDULED== Public Hearing: 1/25/2011 1:00 PM Legislative Office Building 301 (Orig 11:00 Amendment) "
225868,2011-01-19,"House Executive Session: 1/27/2011 1:00 PM Legislative Office Building 301 "
225868,2011-02-01,"House Majority Committee Report: Ought to Pass for Feb 9 (Vote 12-4; Regular Calendar); House Calendar 12, PG.208 "
225868,2011-02-01,"House Minority Committee Report: Inexpedient to Legislate; House Calendar 12, PG.208 "
225868,2011-02-09,"House Ought to Pass: Motion Adopted Voice Vote; House Journal  16, PG.324 "
225868,2011-03-16,"Senate Introduced and Referred to Public and Municipal Affairs "
225868,2011-03-17,"Senate Hearing: 3/22/11, Room 101, Legislative Office Building, 9:45 a.m.; Senate Calendar 16 "
225868,2011-03-24,"Senate Hearing: === RECESSED === 3/22/11, Room 101, Legislative Office Building, 9:15 a.m. "
225868,2011-03-24,"Senate Hearing: === RECONVENE === 3/29/11, Room 101, Legislative Office Building, 9:15 a.m.; Senate Calendar 17 "
225868,2011-03-29,"Senate Committee Report: Ought to Pass with Amendment #2011-1266s, 4/13/11; Senate Calendar 19 "
225868,2011-04-13,"Senate Committee Amendment 1266s, Amendment Adopted, Voice Vote; Senate Journal 12, Pg.251 "
225868,2011-04-13,"Senate Ought to Pass with Amendment 1266s, Motion Adopted, Voice Vote; OT3rdg; Senate Journal 12, Pg.251 "
225868,2011-04-13,"Senate Passed by Third Reading Resolution; Senate Journal 12, Pg.254 "
225868,2011-05-04,"House House Concurs with Senate Amendment #1266s (Rep Ferrante): Motion Adopted Voice Vote; House Journal  42, PG.1448 "
225868,2011-05-18,"Senate Enrolled; Senate Journal 18, Pg.364 "
225868,2011-05-18,"House Enrolled; House Journal  44, PG.1564 "
225868,2011-06-01,"House Signed By Governor 05/27/2011; Effective 07/01/2011; Chapter 0094 "
225869,2011-01-11,"House Introduced 1/6/2011 and Referred to Ways and Means; House Journal  11, PG. 175 "
225869,2011-01-26,"House Public Hearing: 2/8/2011 10:00 Amendment Legislative Office Building 202 "
225869,2011-02-23,"House Subcommittee Work Session: 2/24/2011 9:00 Amendment Legislative Office Building 202 "
225869,2011-02-23,"House Executive Session: 2/24/2011 12:30 PM Legislative Office Building 202 "
225869,2011-02-24,"House Majority Committee Report: Ought to Pass for Mar 15 (Vote 14-5; Regular Calendar); House Calendar 22, PG.570 "
225869,2011-02-24,"House Minority Committee Report: Inexpedient to Legislate; House Calendar 22, PG.570 "
225869,2011-03-17,"House Ought to Pass: Motion Adopted Regular Calendar 236-93; House Journal  30, PG.1002-1005 "
225869,2011-03-17,"House Reconsideration (Rep Bettencourt): Motion Failed Division Vote 77-251; House Journal  30, PG.1005 "
225869,2011-03-23,"Senate Introduced and Referred to Ways & Means; Senate Journal 11, Pg.190 "
225869,2011-04-06,"Senate Hearing: 4/12/11, Room 100, State House, 2:00 p.m.; Senate Calendar 19 "
225869,2011-04-20,"Senate Committee Report: Inexpedient to Legislate, 4/27/11; Senate Calendar 21 "
225869,2011-04-27,"Senate Inexpedient to Legislate Not Voted On; Senate Journal 14 "
225869,2011-04-27,"Senate Sen. Odell Moved Laid on Table, Motion Adopted, Voice Vote; Senate Journal 14 "
225870,2011-01-11,"House Introduced 1/6/2011 and Referred to Ways and Means; House Journal  11, PG. 175 "
225870,2011-02-09,"House Public Hearing: 2/17/2011 10:00 Amendment Legislative Office Building 202 "
225870,2011-02-23,"House Executive Session: 2/24/2011 12:30 PM Legislative Office Building 202 "
225870,2011-02-24,"House Committee Report: Inexpedient to Legislate for Mar 15 (Vote 19-0; Consent Calendar); House Calendar 22, PG.543 "
225870,2011-03-15,"House Inexpedient to Legislate: Motion Adopted Voice Vote; House Journal  26, PG.741 "
225871,2011-01-11,"House Introduced 1/6/2011 and Referred to Criminal Justice and Public Safety; House Journal  11, PG. 175 "
225871,2011-02-09,"House Vacated from Criminal Justice and Public Safety and Referred to Judiciary; House Journal  16, PG.308 "
225871,2011-02-16,"House Public Hearing: 2/24/2011 10:00 Amendment Legislative Office Building 208 "
225871,2011-02-23,"House ==CANCELLED== Executive Session: 3/1/2011 1:00 PM Legislative Office Building (If Necessary Continued 3/3/2011 10:00 Amendment Legislative Office Building 208) "
225871,2011-03-02,"House Executive Session: 3/9/2011 10:00 Amendment Legislative Office Building 208 "
225871,2011-03-10,"House Majority Committee Report: Ought to Pass with Amendment #0643h for Mar 15 (Vote 15-2; Regular Calendar); House Calendar 22, PG.557 "
225871,2011-03-10,"House Proposed Majority Committee Amendment #2011-0643h; House Calendar 23, PG.588 "
225871,2011-03-10,"House Minority Committee Report: Inexpedient to Legislate; House Calendar 22, PG.557 "
225871,2011-03-16,"House Amendment #0643h Adopted, Voice Vote; House Journal  28, PG.873-874 "
225871,2011-03-16,"House Ought to Pass with Amendment #0643h: Motion Adopted Voice Vote; House Journal  28, PG.873-874 "
225871,2011-03-23,"Senate Introduced and Referred to Judiciary; Senate Journal 11, Pg.190 "
225871,2011-05-04,"Senate Hearing: 5/12/11, Room 101, Legislative Office Building, 1:00 p.m.; Senate Calendar 23 "
225871,2011-05-26,"Senate Committee Report: Rereferred to Committee, 6/1/11; Senate Calendar 26 "
225871,2011-06-01,"Senate Rereferred to Committee, Motion Adopted, Voice Vote; Senate Journal 19, Pg.519 "
225872,2011-01-11,"House Introduced 1/6/2011 and Referred to Legislative Administration; House Journal  11, PG. 175 "
225872,2011-01-19,"House Public Hearing: 1/25/2011 1:30 PM Legislative Office Building 104 "
225872,2011-01-26,"House ==CANCELLED== Executive Session: 2/1/2011 11:30 Amendment Legislative Office Building 104 "
225872,2011-02-01,"House Subcommittee Work Session: 2/8/2011 9:30 Amendment Legislative Office Building 104 "
225872,2011-02-09,"House Executive Session: 2/22/2011 11:00 Amendment Legislative Office Building 104 "
225872,2011-02-22,"House Committee Report: Inexpedient to Legislate for Mar 2 (Vote 12-0; Consent Calendar); House Calendar 18, PG.389 "
225872,2011-03-02,"House Inexpedient to Legislate: Motion Adopted Voice Vote; House Journal  25, PG.675 "
225873,2011-01-11,"House Introduced 1/6/2011 and Referred to Legislative Administration; House Journal  11, PG. 175 "
225873,2011-01-19,"House Public Hearing: 1/25/2011 1:00 PM Legislative Office Building 104 "
225873,2011-01-26,"House ==CANCELLED== Executive Session: 2/1/2011 11:30 Amendment Legislative Office Building 104 "
225873,2011-02-01,"House Subcommittee Work Session: 2/8/2011 11:45 Amendment Legislative Office Building 104 "
225873,2011-02-09,"House Executive Session: 2/22/2011 11:00 Amendment Legislative Office Building 104 "
225873,2011-02-22,"House Committee Report: Ought to Pass with Amendment #0063h(NT) for Mar 2 (Vote 12-0; Consent Calendar); House Calendar 18, PG.389 "
225873,2011-02-22,"House Proposed Committee Amendment #2011-0063h (New Title); House Calendar 18, PG.409-410 "
225873,2011-03-02,"House Removed from Consent Calendar (Rep Weber); House Journal  25, PG.671 "
225873,2011-03-02,"House Amendment #0063h(NT) Adopted, Voice Vote; House Journal  25, PG.690-691 "
225873,2011-03-02,"House Ought to Pass with Amendment #0063h(NT): Motion Adopted Voice Vote; House Journal  25, PG.690-691 "
225873,2011-03-02,"House Referred to Finance; House Journal  25, PG.691 "
225873,2011-03-02,"House Full Committee Work Session: 3/9/2011 5:00 PM Legislative Office Building 210-211 ==Executive Session to Follow== "
225873,2011-03-11,"House Committee Report: Inexpedient to Legislate for Mar 30 (Vote 17-3; Regular Calendar); House Calendar 27, PG.818 "
225873,2011-03-30,"House Inexpedient to Legislate: Motion Failed Voice Vote; House Journal  34, PG.1095 "
225873,2011-03-30,"House Ought to Pass with Amendment (Rep Renzullo); House Journal  34, PG.1095 "
225873,2011-03-30,"House Floor Amendment #2011-1236h (New Title) (Rep Renzullo) Adopted, Voice Vote; House Journal  34, PG.1095-1096 "
225873,2011-03-30,"House Ought to Pass with Amendment #1236h(NT): Motion Adopted Regular Calendar 255-95; House Journal  34, PG.1095-1098 "
225873,2011-04-20,"Senate Introduced and Referred to Internal Affairs; Senate Journal 14, Pg.272 "
225873,2011-04-28,"Senate Hearing: 5/4/11, Room 100, State House, 1:45 p.m.; Senate Calendar 22 "
225873,2011-05-05,"Senate Committee Report: Inexpedient to Legislate, 5/11/11; Senate Calendar 23 "
225873,2011-05-11,"Senate Inexpedient to Legislate, Motion Adopted, Voice Vote === BILL KILLED ===; Senate Journal 16, Pg.331 "
225874,2011-01-11,"House Introduced 1/6/2011 and Referred to Judiciary; House Journal  11, PG. 175 "
225874,2011-01-19,"House Public Hearing: 1/25/2011 10:30 Amendment Legislative Office Building 208 "
225874,2011-01-19,"House Division I Work Session: 1/25/2011 1:30 PM Legislative Office Building 208 "
225874,2011-01-26,"House Executive Session: 2/1/2011 11:00 Amendment Legislative Office Building 208 "
225874,2011-02-03,"House Committee Report: Inexpedient to Legislate for Feb 9 (Vote 16-0; Consent Calendar); House Calendar 12, PG.202-203 "
225874,2011-02-09,"House Inexpedient to Legislate: Motion Adopted Voice Vote; House Journal  16, PG.312 "
225875,2011-01-11,"House Introduced 1/6/2011 and Referred to Criminal Justice and Public Safety; House Journal  11, PG. 175 "
225875,2011-01-18,"House ==CANCELLED== Public Hearing: 1/27/2011 1:00 PM Legislative Office Building 204 "
225875,2011-01-20,"House ==RESCHEDULED== Public Hearing: 2/1/2011 1:00 PM RepresentativeS HALL "
225875,2011-03-02,"House Executive Session: 3/9/2011 10:00 Amendment Legislative Office Building 204 "
225875,2011-03-09,"House Retained in Committee; House Calendar 27, PG.823 "
225875,2011-09-26,"House Retained Bill - Subcommittee Work Session: 10/6/2011 10:00 Amendment Legislative Office Building 204 "
225875,2011-09-27,"House Retained Bill - Executive Session: 10/20/2011 10:00 Amendment Legislative Office Building 204 "
225876,2011-01-11,"House Introduced 1/6/2011 and Referred to Health, Human Services and Elderly Affairs; House Journal  11, PG. 175 "
225876,2011-01-18,"House Public Hearing: 1/25/2011 10:00 Amendment Legislative Office Building 205 "
225876,2011-01-25,"House Subcommittee Work Session: 2/1/2011 3:30 PM Legislative Office Building 205 "
225876,2011-02-23,"House Executive Session: 3/1/2011 9:00 Amendment Legislative Office Building 205 "
225876,2011-03-02,"House Committee Report: Inexpedient to Legislate for Mar 15 (Vote 17-0; Consent Calendar); House Calendar 22, PG.531 "
225876,2011-03-15,"House Inexpedient to Legislate: Motion Adopted Voice Vote; House Journal  26, PG.715 "
225877,2011-01-11,"House Introduced 1/6/2011 and Referred to Education; House Journal  11, PG. 175 "
225877,2011-01-18,"House Public Hearing: 1/25/2011 11:00 Amendment Legislative Office Building 207 "
225877,2011-02-02,"House Executive Session: 2/10/2011 1:00 PM Legislative Office Building 207 "
225877,2011-02-15,"House Committee Report: Ought to Pass for Feb 23 (Vote 17-0; Consent Calendar); House Calendar 15, PG.267 "
225877,2011-02-23,"House Ought to Pass: Motion Adopted Voice Vote; House Journal  21, PG.458 "
225877,2011-02-23,"Senate Introduced and Referred to Education; Senate Journal 8, Pg.81 "
225877,2011-03-24,"Senate Hearing: 3/29/11, Room 103, Legislative Office Building, 1:50 p.m.; Senate Calendar 17 "
225877,2011-05-26,"Senate Committee Report: Ought to Pass with Amendment #2011-2160s, 6/1/11; Senate Calendar 26 "
225877,2011-06-01,"Senate Committee Amendment 2160s, Not Voted On; Senate Journal 19, Pg.513 "
225877,2011-06-01,"Senate Sen. Stiles Moved Laid on Table, Regular Calendar 14Y-10N, Motion Adopted; Senate Journal 19, Pg.513 "
225878,2011-01-11,"House Introduced 1/6/2011 and Referred to Commerce and Consumer Affairs; House Journal  11, PG. 175 "
225878,2011-01-13,"House Public Hearing: 1/20/2011 10:00 Amendment Legislative Office Building 302 "
225878,2011-03-01,"House Executive Session: 3/9/2011 9:00 Amendment Legislative Office Building 302 "
225878,2011-03-09,"House Retained in Committee; House Calendar 27, PG.822 "
225878,2011-08-23,"House Retained Bill - Insurance/Consumer Div Subcom Work Session: 10/4/2011 1:15 PM Legislative Office Building 302 "
225878,2011-10-11,"House Retained Bill - Executive Session: 10/20/2011 1:15 PM Legislative Office Building 302 "
225879,2011-01-11,"House Introduced 1/6/2011 and Referred to Ways and Means; House Journal  11, PG. 175  "
225879,2011-01-26,"House Public Hearing: 2/1/2011 2:00 PM Legislative Office Building 202 "
225879,2011-02-01,"House Executive Session: 2/8/2011 11:15 Amendment Legislative Office Building 202 "
225879,2011-02-08,"House Majority Committee Report: Ought to Pass for Feb 15 (Vote 16-5; Regular Calendar); House Calendar 13, PG.238 "
225879,2011-02-08,"House Minority Committee Report: Inexpedient to Legislate; House Calendar 13, PG.238 "
225879,2011-02-15,"House Special Order to Feb 16: Motion Adopted Without Objection; House Journal  17, PG.378 "
225879,2011-02-16,"House Ought to Pass: Motion Adopted Regular Calendar 285-78; House Journal  19, PG.432-434 "
225879,2011-02-16,"House Lay on the Table (Rep Stepanek): Motion Adopted Regular Calendar 254-109; House Journal  19, PG.434-436 "
225880,2011-01-11,"House Introduced 1/6/2011 and Referred to Fish and Game and Marine Resources; House Journal  11, PG. 175 "
225880,2011-01-19,"House Public Hearing: 1/25/2011 12:00 PM Legislative Office Building 307 ==Executive Session to Follow== "
225880,2011-01-25,"House Committee Report: Ought to Pass for Feb 9 (Vote 15-0; Regular Calendar); House Calendar 10, PG.150 "
225880,2011-02-09,"House Ought to Pass: Motion Adopted Voice Vote; House Journal  16, PG.321-322 "
225880,2011-03-16,"Senate Introduced and Referred to Energy and Natural Resources "
225880,2011-03-17,"Senate Hearing: 3/24/11, Room 102, Legislative Office Building, 10:45 a.m.; Senate Calendar 16 "
225880,2011-03-24,"Senate Committee Report: Ought to Pass, 3/30/11; Senate Calendar 17 "
225880,2011-03-30,"Senate Ought to Pass, Motion Adopted, Voice Vote; OT3rdg; Senate Journal 11, Pg.211 "
225880,2011-03-30,"Senate Passed by Third Reading Resolution; Senate Journal 11, Pg.240 "
225880,2011-04-13,"Senate Enrolled; Senate Journal 13, Pg.259 "
225880,2011-04-13,"House Enrolled; House Journal  37, Pg.1304 "
225880,2011-04-28,"House Signed by the Governor 04/25/2011; Effective 06/24/2011; Chapter 0010 "
225881,2011-01-11,"House Introduced 1/6/2011 and Referred to Children and Family Law "
225881,2011-01-13,"House Public Hearing: 1/20/2011 10:00 Amendment Legislative Office Building 206 ==Executive Session to Follow== "
225881,2011-01-21,"House Committee Report: Ought to Pass for Feb 9 (Vote 16-0; Consent Calendar); House Calendar 10, PG.146 "
225881,2011-02-09,"House Ought to Pass: Motion Adopted Voice Vote; House Journal  16, PG.309 "
225881,2011-04-20,"Senate Introduced and Referred to Health and Human Services; Senate Journal 14, Pg.272 "
225881,2011-04-21,"Senate Hearing: 4/28/11, Room 102, Legislative Office Building, 1:00 p.m.; Senate Calendar 21 "
225881,2011-04-28,"Senate Committee Report: Ought to Pass, 5/4/11; Senate Calendar 22 "
225881,2011-05-04,"Senate Ought to Pass, Motion Adopted, Voice Vote; OT3rdg; Senate Journal 15, Pg.306 "
225881,2011-05-04,"Senate Passed by Third Reading Resolution; Senate Journal 15, Pg.312 "
225881,2011-05-04,"House Enrolled; House Journal  42, PG.1492 "
225881,2011-05-11,"Senate Enrolled; Senate Journal 17, Pg.344 "
225881,2011-06-01,"House Signed By Governor 05/31/2011; Effective 05/31/2011; Chapter 0105 "
225882,2011-01-11,"House Introduced 1/6/2011 and Referred to Commerce and Consumer Affairs; House Journal  11, PG. 175 "
225882,2011-01-13,"House Public Hearing: 1/25/2011 1:15 PM Legislative Office Building 302 "
225882,2011-01-25,"House Subcommittee Work Session: 2/1/2011 9:35 Amendment Legislative Office Building 302 "
225882,2011-01-26,"House Executive Session: 2/1/2011 10:00 Amendment Legislative Office Building 302 ==RECESSED== "
225882,2011-02-01,"House Continued Executive Session: 2/9/2011 Legislative Office Building 302 Following House Session "
225882,2011-02-10,"House Committee Report: Inexpedient to Legislate for Feb 15 (Vote 13-0; Consent Calendar); House Calendar 13, PG.229 "
225882,2011-02-15,"House Inexpedient to Legislate: Motion Adopted Voice Vote; House Journal  17, PG.357 "
225883,2011-01-11,"House Introduced 1/6/2011 and Referred to Education; House Journal  11, PG. 175 "
225883,2011-01-19,"House Public Hearing: 1/27/2011 10:30 Amendment Legislative Office Building 207 "
225883,2011-02-02,"House Executive Session: 2/10/2011 1:00 PM Legislative Office Building 207 "
225883,2011-02-15,"House Committee Report: Ought to Pass for Feb 23 (Vote 17-0; Consent Calendar); House Calendar 15, PG.268 "
225883,2011-02-23,"House Ought to Pass: Motion Adopted Voice Vote; House Journal  21, PG.458 "
225883,2011-02-23,"Senate Introduced and Referred to Education; Senate Journal 8, Pg.81 "
225883,2011-03-24,"Senate Hearing: 3/29/11, Room 103, Legislative Office Building, 1:15 p.m.; Senate Calendar 17 "
225883,2011-03-31,"Senate Committee Report: Ought to Pass, 4/13/11; Senate Calendar 19 "
225883,2011-04-13,"Senate Ought to Pass, Motion Adopted, Voice Vote; OT3rdg; Senate Journal 12, Pg.246 "
225883,2011-04-13,"Senate Passed by Third Reading Resolution; Senate Journal 12, Pg.254 "
225883,2011-04-27,"House Enrolled; House Journal  40, PG.1386 "
225883,2011-04-27,"Senate Enrolled; Senate Journal 15, Pg.293 "
225883,2011-05-11,"House Signed by Governor 05/09/2011; Effective 05/09/2011; Chapter 0043 "
225884,2011-01-11,"House Introduced 1/6/2011 and Referred to Commerce and Consumer Affairs; House Journal  11, PG. 175 "
225884,2011-01-13,"House Public Hearing: 1/19/2011 11:00 Amendment Legislative Office Building 302 ==RECESSED== "
225884,2011-01-25,"House Continued Public Hearing: 2/1/2011 1:15 PM Legislative Office Building 302 "
225884,2011-02-08,"House Subcommittee Work Session: 2/22/2011 9:00 Amendment Legislative Office Building 302 "
225884,2011-02-16,"House ==CANCELLED== Executive Session: 2/25/2011 10:00 Amendment Legislative Office Building 302 "
225884,2011-02-23,"House Executive Session: 3/1/2011 3:00 PM Legislative Office Building 302 "
225884,2011-03-09,"House Retained in Committee; House Calendar 27, PG.822 "
225884,2011-05-03,"House ==CANCELLED== Retained Bill - Subcommittee Work Session: 5/5/2011 10:00 Amendment Legislative Office Building 302 Insurance Div "
225884,2011-06-22,"House Retained Bill - Banking/Business Div Subcom Work Session: 9/6/2011 10:30 Amendment Legislative Office Building 302 "
225884,2011-09-06,"House Retained Bill - Banking/Busniess Div Subcom Work Session: 9/20/2011 10:15 Amendment Legislative Office Building 302 "
225884,2011-09-27,"House Retained Bill - Executive Session: 10/6/2011 10:00 Amendment Legislative Office Building 302 "
225884,2011-10-14,"House Committee Report: Ought to Pass with Amendment #2613h for Jan 4 (Vote 12-0; Consent Calendar) "
225884,2011-10-17,"House Proposed Committee Amendment #2011-2613h "
225885,2011-01-11,"House Introduced 1/6/2011 and Referred to Education; House Journal  11, PG. 175 "
225885,2011-01-19,"House Public Hearing: 1/27/2011 11:00 Amendment Legislative Office Building 207 "
225885,2011-02-02,"House Executive Session: 2/10/2011 1:00 PM Legislative Office Building 207 "
225885,2011-02-15,"House Committee Report: Ought to Pass with Amendment #0094h for Feb 23 (Vote 16-1; Regular Calendar); House Calendar 15, PG.275 "
225885,2011-02-15,"House Proposed Committee Amendment #2011-0094h; House Calendar 15, PG.299 "
225885,2011-02-23,"House Amendment #0094h Adopted, Voice Vote; House Journal  21, PG.465-466 "
225885,2011-02-23,"House Ought to Pass with Amendment #0094h: Motion Adopted Voice Vote; House Journal  21, PG.465-466 "
225885,2011-02-23,"Senate Introduced and Referred to Education; Senate Journal 8, Pg.81 "
225885,2011-03-09,"Senate Hearing: 3/22/11, Room 103, Legislative Office Building, 1:20 p.m.; Senate Calendar 15 "
225885,2011-03-31,"Senate Committee Report: Ought to Pass, 4/13/11; Senate Calendar 19 "
225885,2011-04-13,"Senate Ought to Pass, Motion Adopted, Voice Vote; OT3rdg; Senate Journal 12, Pg.246 "
225885,2011-04-13,"Senate Passed by Third Reading Resolution; Senate Journal 12, Pg.254 "
225885,2011-04-27,"House Enrolled; House Journal  40, PG.1386 "
225885,2011-04-27,"Senate Enrolled; Senate Journal 15, Pg.293 "
225885,2011-05-11,"House Signed by Governor 05/09/2011; Effective 07/08/2011; Chapter 0044 "
225886,2011-01-11,"House Introduced 1/6/2011 and Referred to Judiciary; House Journal  11, PG. 175 "
225886,2011-01-19,"House Public Hearing: 1/25/2011 10:00 Amendment Legislative Office Building 208 "
225886,2011-01-19,"House Division I Work Session: 1/25/2011 1:30 PM Legislative Office Building 208 "
225886,2011-01-26,"House Executive Session: 2/1/2011 11:00 Amendment Legislative Office Building 208 "
225886,2011-02-03,"House Committee Report: Ought to Pass for Feb 9 (Vote 17-0; Consent Calendar); House Calendar 12, PG.203 "
225886,2011-02-09,"House Ought to Pass: Motion Adopted Voice Vote; House Journal  16, PG.312 "
225886,2011-03-16,"Senate Introduced and Referred to Commerce "
225886,2011-04-21,"Senate Hearing: 4/26/11, Room 102, Legislative Office Building, 9:15 a.m.; Senate Calendar 21 "
225886,2011-05-17,"Senate Committee Report: Ought to Pass with Amendment #2011-1979s, 5/25/11; Senate Calendar 25 "
225886,2011-05-25,"Senate Committee Amendment 1979s, Amendment Adopted, Voice Vote; Senate Journal 18, Pg.377 "
225886,2011-05-25,"Senate Ought to Pass with Amendment 1979s, Motion Adopted, Voice Vote; OT3rdg; Senate Journal 18, Pg.377 "
225886,2011-05-25,"Senate Passed by Third Reading Resolution; Senate Journal 18, Pg.391 "
225886,2011-06-08,"House House Concurs with Senate Amendment 1979s (Rep Rowe): Motion Adopted Voice Vote; House Journal  51, PG.1715 "
225886,2011-06-08,"Senate Enrolled "
225886,2011-06-08,"House Enrolled; House Journal  51, PG.1728 "
225886,2011-06-27,"House Signed By Governor 06/27/2011; Effective 01/01/2012; Chapter 0208 "
225887,2011-01-11,"House Introduced 1/6/2011 and Referred to Commerce and Consumer Affairs; House Journal  11, PG. 175 "
225887,2011-01-13,"House Public Hearing: 1/20/2011 1:00 PM Legislative Office Building 302 "
225887,2011-01-20,"House Subcommittee Work Session: 1/27/2011 11:00 Amendment Legislative Office Building 302 "
225887,2011-02-01,"House Subcommittee Work Session: 2/3/2011 9:45 Amendment Legislative Office Building 302 "
225887,2011-02-09,"House Executive Session: 2/9/2011 Legislative Office Building 302 Following House Session "
225887,2011-02-10,"House Committee Report: Ought to Pass with Amendment #0109h for Feb 15 (Vote 13-0; Consent Calendar); House Calendar 13, PG.229 "
225887,2011-02-10,"House Proposed Committee Amendment #2011-0109h; House Calendar 13, PG.257-258 "
225887,2011-02-15,"House Amendment #0109h Adopted, Voice Vote; House Journal  17, PG.357 "
225887,2011-02-15,"House Ought to Pass with Amendment #0109h: Motion Adopted Voice Vote; House Journal  17, PG.357 "
225887,2011-03-16,"Senate Introduced and Referred to Judiciary "
225887,2011-04-06,"Senate Hearing: 4/14/11, Room 101, Legislative Office Building, 1:15 p.m.; Senate Calendar 19 "
225887,2011-05-05,"Senate Committee Report: Ought to Pass, 5/11/11; Senate Calendar 23 "
225887,2011-05-11,"Senate Ought to Pass, Motion Adopted, Voice Vote; OT3rdg; Senate Journal 16, Pg.332 "
225887,2011-05-11,"Senate Passed by Third Reading Resolution; Senate Journal 16 "
225887,2011-05-18,"Senate Enrolled; Senate Journal 18, Pg.364 "
225887,2011-05-18,"House Enrolled; House Journal  44, PG.1564 "
225887,2011-06-01,"House Signed By Governor 05/31/2011; Effective 07/30/2011; Chapter 0106 "
225888,2011-01-11,"House Introduced 1/6/2011 and Referred to Commerce and Consumer Affairs; House Journal  11, PG. 175 "
225888,2011-01-13,"House Public Hearing: 1/20/2011 11:00 Amendment Legislative Office Building 302 "
225888,2011-01-20,"House Subcommittee Work Session: 2/3/2011 9:00 Amendment Legislative Office Building 302 "
225888,2011-02-03,"House Subcommittee Work Session: 2/17/2011 9:30 Amendment Legislative Office Building 302 "
225888,2011-02-16,"House ==CANCELLED== Executive Session: 2/25/2011 10:00 Amendment Legislative Office Building 302 "
225888,2011-02-23,"House Executive Session: 3/1/2011 3:00 PM Legislative Office Building 302 "
225888,2011-03-09,"House Committee Report: Ought to Pass with Amendment #0742h for Mar 15 (Vote 16-0; Consent Calendar); House Calendar 22, PG.523 "
225888,2011-03-09,"House Proposed Committee Amendment #2011-0742h; House Calendar 23, PG.588 "
225888,2011-03-15,"House Amendment #0742h Adopted, Voice Vote; House Journal  26, PG.696 "
225888,2011-03-15,"House Ought to Pass with Amendment #0742h: Motion Adopted Voice Vote; House Journal  26, PG.696 "
225888,2011-03-23,"Senate Introduced and Referred to Commerce; Senate Journal 11, Pg.190 "
225888,2011-04-14,"Senate Hearing: 4/19/11, Room 102, Legislative Office Building, 9:20 a.m.; Senate Calendar 20 "
225888,2011-04-20,"Senate Committee Report: Ought to Pass with Amendment #2011-1492s, 4/27/11; Senate Calendar 21 "
225888,2011-04-27,"Senate Committee Amendment 1492s, Amendment Adopted, Voice Vote; Senate Journal 14, Pg.275 "
225888,2011-04-27,"Senate Ought to Pass with Amendment 1492s, Motion Adopted, Voice Vote; OT3rdg; Senate Journal 14, Pg.275 "
225888,2011-04-27,"Senate Passed by Third Reading Resolution; Senate Journal 14 "
225888,2011-05-18,"House House Concurs with Senate Amendment #1492s (Rep Hunt): Motion Adopted Voice Vote; House Journal  44, PG.1531 "
225888,2011-06-01,"Senate Enrolled Bill Amendment #2286e Adopted; Senate Journal 20, Pg.545 "
225888,2011-06-01,"House Enrolled Bill Amendment #2011-2286e Adopted; House Journal  48, PG.1671 "
225888,2011-06-08,"Senate Enrolled "
225888,2011-06-08,"House Enrolled; House Journal  51, PG.1726 "
225888,2011-06-15,"House Signed By Governor 06/14/2011; I. Section 8 & 9 Effective 06/14/2011; II. Section 10 & 11 Effective as Provided in Section 12; III. Remainder Effective 08/13/2011; Chapter 0189 "
225889,2011-01-11,"House Introduced 1/6/2011 and Referred to Election Law; House Journal  11, PG. 175 "
225889,2011-02-09,"House Public Hearing: 2/24/2011 2:00 PM Representative's Hall "
225889,2011-03-02,"House Executive Session: 3/9/2011 10:30 Amendment Legislative Office Building 308 "
225889,2011-03-10,"House Majority Committee Report: Inexpedient to Legislate for Mar 15 (Vote 13-5; Regular Calendar); House Calendar 22, PG.551 "
225889,2011-03-10,"House Minority Committee Report: Ought to Pass; House Calendar 22, PG.551 "
225889,2011-03-15,"House Inexpedient to Legislate: Motion Adopted Regular Calendar 267-72; House Journal  26, PG.793-795 "
225890,2011-01-11,"House Introduced 1/6/2011 and Referred to Criminal Justice and Public Safety; House Journal  11, PG. 175 "
225890,2011-01-18,"House Public Hearing: 1/25/2011 11:00 Amendment Legislative Office Building 204 "
225890,2011-01-25,"House Executive Session: 2/3/2011 10:00 Amendment Legislative Office Building 204 "
225890,2011-02-03,"House Committee Report: Inexpedient to Legislate for Feb 15 (Vote 14-0; Consent Calendar); House Calendar 13, PG.231 "
225890,2011-02-15,"House Inexpedient to Legislate: Motion Adopted Voice Vote; House Journal  17, PG.358 "
225891,2011-01-11,"House Introduced 1/6/2011 and Referred to Commerce and Consumer Affairs; House Journal  11, PG. 175 "
225891,2011-01-13,"House Public Hearing: 1/19/2011 1:00 PM Legislative Office Building 302 "
225891,2011-03-01,"House Executive Session: 3/9/2011 9:00 Amendment Legislative Office Building 302 "
225891,2011-03-10,"House Committee Report: Ought to Pass for Mar 15 (Vote 13-4; Regular Calendar); House Calendar 22, PG.546 "
225891,2011-03-15,"House Ought to Pass: Motion Adopted Voice Vote; House Journal  26, PG.752 "
225891,2011-03-30,"Senate Introduced and Referred to Executive Departments and Administration; Senate Journal 12, Pg.243 "
225891,2011-04-20,"Senate Hearing: 4/28/11, Room 100, State House, 9:20 a.m.; Senate Calendar 21 "
225891,2011-04-28,"Senate Committee Report: Ought to Pass with Amendment #2011-1634s, 5/4/11; Senate Calendar 22 "
225891,2011-05-04,"Senate Committee Amendment 1634s, Amendment Adopted, Voice Vote; Senate Journal 15, Pg.304 "
225891,2011-05-04,"Senate Ought to Pass with Amendment 1634s, Motion Adopted, Voice Vote; OT3rdg; Senate Journal 15, Pg.304 "
225891,2011-05-04,"Senate Passed by Third Reading Resolution; Senate Journal 15, Pg.312 "
225891,2011-05-18,"House House Concurs with Senate Amendment #1634s (Rep Hunt): Motion Adopted Voice Vote; House Journal  44, PG.1531 "
225891,2011-05-25,"Senate Enrolled; Senate Journal 19, Pg.395 "
225891,2011-05-25,"House Enrolled; House Journal  46, PG.1609 "
225891,2011-06-08,"House Signed by Governor 06/02/2011; Effective 06/02/2011; Chapter 0119 "
225892,2011-01-11,"House Introduced 1/6/2011 and Referred to Education; House Journal  11, PG. 175 "
225892,2011-01-19,"House Public Hearing: 1/27/2011 11:30 Amendment Legislative Office Building 207 "
225892,2011-02-18,"House Executive Session: 2/24/2011 1:00 PM Legislative Office Building 207 "
225892,2011-02-24,"House Retained in Committee; House Calendar 27, PG.823 "
225892,2011-09-09,"House Retained Bill - Subcommittee Work Session: 9/20/2011 1:00 PM Legislative Office Building 207 "
225892,2011-10-04,"House Retained Bill - Executive Session: 10/18/2011 10:00 Amendment Legislative Office Building 207 "
225892,2011-10-21,"House Committee Report: Inexpedient to Legislate for Jan 4 (Vote 13-0; Consent Calendar) "
225893,2011-01-11,"House Introduced 1/6/2011 and Referred to Legislative Administration; House Journal  11, PG. 175 "
225893,2011-01-19,"House Public Hearing: 1/25/2011 11:00 Amendment Legislative Office Building 104 "
225893,2011-01-26,"House Executive Session: 2/1/2011 11:30 Amendment Legislative Office Building 104 "
225893,2011-02-01,"House Committee Report: Inexpedient to Legislate for Feb 9 (Vote 13-2; Consent Calendar); House Calendar 12, PG.203 "
225893,2011-02-09,"House Removed from Consent Calendar (Rep Watrous); House Journal  16, PG.309 "
225893,2011-02-09,"House Inexpedient to Legislate: Motion Adopted Regular Calendar 278-95; House Journal  16, PG.330-333 "
225894,2011-01-11,"House Introduced 1/6/2011 and Referred to Municipal and County Government; House Journal  11, PG. 175 "
225894,2011-01-19,"House Public Hearing: 1/25/2011 10:00 Amendment Legislative Office Building 301 "
225894,2011-01-19,"House Executive Session: 1/27/2011 1:00 PM Legislative Office Building 301 "
225894,2011-02-01,"House Committee Report: Ought to Pass with Amendment #0104h for Feb 9 (Vote 16-0; Consent Calendar); House Calendar 12, PG.203-204 "
225894,2011-02-01,"House Proposed Committee Amendment #2011-0104h; House Calendar 12, PG.227 "
225894,2011-02-09,"House Amendment #0104h Adopted, Voice Vote; House Journal  16, PG.313 "
225894,2011-02-09,"House Ought to Pass with Amendment #0104h: Motion Adopted Voice Vote; House Journal  16, PG.313 "
225894,2011-03-16,"Senate Introduced and Referred to Public and Municipal Affairs "
225894,2011-04-14,"Senate Hearing: 4/19/11, Room 101, Legislative Office Building, 9:15 a.m.; Senate Calendar 20 "
225894,2011-04-27,"Senate Committee Report: Inexpedient to Legislate, 5/4/11; Senate Calendar 22 "
225894,2011-05-04,"Senate Inexpedient to Legislate, Motion Adopted, Voice Vote === BILL KILLED ===; Senate Journal 15, Pg.307 "
225895,2011-01-11,"House Introduced 1/6/2011 and Referred to Children and Family Law; House Journal  11, PG. 175 "
225895,2011-01-13,"House Public Hearing: 1/20/2011 11:00 Amendment Legislative Office Building 206 ==Executive Session to Follow== "
225895,2011-01-21,"House Committee Report: Inexpedient to Legislate for Feb 9 (Vote 16-0; Consent Calendar); House Calendar 10, PG.146 "
225895,2011-02-09,"House Inexpedient to Legislate: Motion Adopted Voice Vote; House Journal  16, PG.309 "
225896,2011-01-11,"House Introduced 1/6/2011 and Referred to Resources, Recreation and Development; House Journal  11, PG. 175 "
225896,2011-01-18,"House Public Hearing: 1/25/2011 1:00 PM Legislative Office Building 305 ==Executive Session to Follow== "
225896,2011-01-25,"House Committee Report: Inexpedient to Legislate for Feb 9 (Vote 12-0; Consent Calendar); House Calendar 10, PG.147 "
225896,2011-02-09,"House Inexpedient to Legislate: Motion Adopted Voice Vote; House Journal  16, PG.315 "
225897,2011-01-11,"House Introduced 1/6/2011 and Referred to Legislative Administration; House Journal  11, PG. 175 "
225897,2011-01-19,"House Public Hearing: 1/25/2011 10:00 Amendment Legislative Office Building 104 "
225897,2011-01-26,"House Executive Session: 2/1/2011 11:30 Amendment Legislative Office Building 104 "
225897,2011-02-01,"House Committee Report: Inexpedient to Legislate for Feb 9 (Vote 15-0; Consent Calendar); House Calendar 12, PG.203 "
225897,2011-02-09,"House Inexpedient to Legislate: Motion Adopted Voice Vote; House Journal  16, PG.312 "
225898,2011-01-11,"House Introduced 1/6/2011 and Referred to Labor, Industrial and Rehabilitative Services; House Journal  11, PG. 175 "
225898,2011-01-19,"House Public Hearing: 2/1/2011 10:00 Amendment Legislative Office Building 307 "
225898,2011-02-02,"House Executive Session: 2/8/2011 2:00 PM Legislative Office Building 307 "
225898,2011-02-10,"House Majority Committee Report: Ought to Pass for Feb 15 (Vote 13-4; Regular Calendar); House Calendar 13, PG.235 "
225898,2011-02-10,"House Minority Committee Report: Inexpedient to Legislate; House Calendar 13, PG.235 "
225898,2011-02-15,"House Floor Amendment #2011-0325h (Rep Goley) Adopted, Regular Calendar 314-52; House Journal  17, PG.370-372 "
225898,2011-02-15,"House Reconsideration (Rep Daniels): Motion Adopted Division Vote 250-116; House Journal  17, PG.373 "
225898,2011-02-15,"House Floor Amendment #0325h (Rep Goley) Failed, Regular Calendar 118-251; House Journal  17, PG.373-375 "
225898,2011-02-15,"House Ought to Pass: Motion Adopted Voice Vote; House Journal  17, PG.370-375 "
225898,2011-03-16,"Senate Introduced and Referred to Public and Municipal Affairs "
225898,2011-03-24,"Senate Hearing: 3/29/11, Room 101, Legislative Office Building, 9:30 a.m.; Senate Calendar 17 "
225898,2011-04-07,"Senate Committee Report: Ought to Pass with Amendment #2011-1360s, 4/13/11; Senate Calendar 19 "
225898,2011-04-13,"Senate Committee Amendment 1360s, Regular Calendar 7Y-17N, Amendment Failed; Senate Journal 12, Pg.252 "
225898,2011-04-13,"Senate Ought to Pass, Motion Adopted, Voice Vote; OT3rdg; Senate Journal 12, Pg.252 "
225898,2011-04-13,"Senate Passed by Third Reading Resolution; Senate Journal 12, Pg.254 "
225898,2011-04-27,"House Enrolled; House Journal  40, PG.1386 "
225898,2011-04-27,"Senate Enrolled; Senate Journal 15, Pg.293 "
225898,2011-05-11,"House Signed by Governor 05/09/2011; Effective 07/08/2011; Chapter 0045 "
225899,2011-01-11,"House Introduced 1/6/2011 and Referred to Election Law; House Journal  11, PG.176 "
225899,2011-01-26,"House Public Hearing: 2/1/2011 1:30 PM Legislative Office Building 308 "
225899,2011-02-23,"House Executive Session: 3/1/2011 10:30 Amendment Legislative Office Building 308 "
225899,2011-03-09,"House Majority Committee Report: Ought to Pass with Amendment #0551h(NT) for Mar 15 (Vote 13-2; Regular Calendar); House Calendar 22, PG.551-552 "
225899,2011-03-09,"House Proposed Majority Committee Amendment #2011-0551h (New Title); House Calendar 23, PG.589 "
225899,2011-03-09,"House Minority Committee Report: Inexpedient to Legislate; House Calendar 22, PG.551-552 "
225899,2011-03-15,"House Amendment #0551h (New Title) Adopted, Voice Vote; House Journal  26, PG.795 "
225899,2011-03-15,"House Ought to Pass with Amendment #0551h(NT): Motion Adopted Voice Vote; House Journal  26, PG.795 "
225899,2011-03-23,"Senate Introduced and Referred to Public and Municipal Affairs; Senate Journal 11, Pg.190 "
225899,2011-03-29,"Senate Hearing: 4/5/11, Room 101, Legislative Office Building, 9:00 a.m.; Senate Calendar 18 "
225899,2011-04-06,"Senate Committee Report: Rereferred to Committee, 4/13/11; Senate Calendar 19 "
225899,2011-04-13,"Senate Rereferred to Committee, Motion Adopted, Voice Vote; Senate Journal 12, Pg.252 "
225900,2011-01-07,"House Introduced 1/6/2011 and Referred to Legislative Administration; House Journal  11, PG. 172 "
225900,2011-01-13,"House Public Hearing: 1/18/2011 11:00 Amendment Legislative Office Building 104 "
225900,2011-01-26,"House Executive Session: 2/1/2011 11:30 Amendment Legislative Office Building 104 "
225900,2011-02-01,"House Committee Report: Inexpedient to Legislate for Feb 9 (Vote 12-2; Consent Calendar); House Calendar 12, PG.203 "
225900,2011-02-09,"House Inexpedient to Legislate: Motion Adopted Voice Vote; House Journal  16, PG.312 "
225901,2011-01-06,"Senate Introduced and Referred to Education, Senate Journal 2, Pg.25 "
225901,2011-01-13,"Senate Hearing: 1/18/2011, Room 103, Legislative Office Building, 1:00 p.m.; Senate Calendar 7 "
225901,2011-01-18,"Senate Hearing: === RECESSED === 1/18/11, Room 103, Legislative Office Building, 1:00 p.m. "
225901,2011-01-18,"Senate Hearing: === RECONVENE === 1/25/2011, Room 103, Legislative Office Building, 1:00 p.m. "
225901,2011-01-26,"Senate Committee Report: Ought to Pass, 2/3/2011; Senate Calendar 9 "
225901,2011-02-03,"Senate Ought to Pass, Motion Adopted, Voice Vote; Refer to Finance Rule 4-3; Senate Journal 4, Pg.41 "
225901,2011-02-09,"Senate Hearing: 2/17/11, Room 103, State House, 1:00 p.m.; Senate Calendar 11 "
225901,2011-02-22,"Senate Committee Report: Ought to Pass, 3/9/11; Senate Calendar 14 "
225901,2011-03-09,"Senate Ought to Pass Not Voted On "
225901,2011-03-09,"Senate Sen. Bradley Moved Laid on Table, Motion Adopted, Regular Calendar 18Y-5N; Senate Journal 8, Pg.89 "
225902,2011-01-06,"Senate Introduced and Referred to Executive Departments and Administration, Senate Journal 2, Pg.25 "
225902,2011-01-27,"Senate Hearing: 2/3/11, Room 100 State House, 9:00 a.m.; Senate Calendar 9 "
225902,2011-02-08,"Senate Committee Report: Ought to Pass, 2/16/2011; Senate Calendar 11 "
225902,2011-02-16,"Senate Ought to Pass, Motion Adopted, Voice Vote; OT3rdg, Senate Journal 5, Pg.56 "
225902,2011-02-16,"Senate Passed by Third Reading Resolution, Senate Journal 6, Pg.61 "
225902,2011-02-16,"House Introduced and Referred to Executive Departments and Administration; House Journal  19, Pg. 438 "
225902,2011-03-15,"House Public Hearing: 3/22/2011 10:00 Amendment Legislative Office Building 306 ==Executive Session To Follow== "
225902,2011-03-30,"House Committee Report: Ought to Pass for April 13 (Vote 11-0; Consent Calendar); House Calendar 31, PG.1039 "
225902,2011-04-13,"House Ought to Pass: Motion Adopted Voice Vote; House Journal  37, Pg.1296 "
225902,2011-04-13,"House Enrolled; House Journal  37, PG.1305 "
225902,2011-04-20,"Senate Enrolled; Senate Journal 14, Pg.273 "
225902,2011-04-28,"Senate Signed by the Governor on 04/28/2011; Effective 07/1/2011; Chapter 0024 "
225903,2011-01-06,"Senate Introduced and Referred to Transportation, Senate Journal 2, Pg.25 "
225903,2011-01-19,"Senate Hearing: 1/27/2011, Room 103, Legislative Office Building, 9:00 a.m.; Senate Calendar 8 "
225903,2011-01-27,"Senate Committee Report: Ought to Pass with Amendment #2011-0095s, 2/3/2011; Senate Calendar 9 "
225903,2011-02-03,"Senate Committee Amendment 0095s, Amendment Adopted, Voice Vote; Senate Journal 4, Pg.42 "
225903,2011-02-03,"Senate Ought to Pass with Amendment 0095s, Motion Adopted, Voice Vote; OT3rdg; Senate Journal 4, Pg.42 "
225903,2011-02-03,"Senate Passed by Third Reading Resolution; Senate Journal 4, Pg.42 "
225903,2011-02-07,"House Introduced (in Recess from 1/26/2011) and Referred to Transportation; House Journal  14, PG.265 "
225903,2011-03-22,"House Public Hearing: 4/5/2011 10:00 Amendment Legislative Office Building 203 ==Executive Session To Follow== "
225903,2011-04-06,"House Committee Report: Ought to Pass for April 13 (Vote 12-0; Consent Calendar); House Calendar 31, PG.1039 "
225903,2011-04-13,"House Ought to Pass: Motion Adopted Voice Vote; House Journal  37, Pg.1296 "
225903,2011-04-13,"House Enrolled Bill Amendment #1446e Adopted; House Journal  37, PG.1305 "
225903,2011-04-20,"Senate Enrolled Bill Amendment #2011-1446e Adopted; Senate Journal 14, Pg.273 "
225903,2011-04-27,"House Enrolled; House Journal  40, PG.1386 "
225903,2011-04-27,"Senate Enrolled; Senate Journal 15, Pg.293 "
225903,2011-05-11,"Senate Signed by the Governor on 05/9/2011; Effective 05/9/2011; Chapter 0058 "
225904,2011-01-06,"Senate Introduced and Referred to Commerce, Senate Journal 2, Pg.25 "
225904,2011-01-19,"Senate Hearing: 1/25/2011, Room 102, Legislative Office Building, 10:00 a.m.; Senate Calendar 8 "
225904,2011-02-15,"Senate Committee Report: Ought to Pass with Amendment #2011-0343s, 2/23/11; Senate Calendar 12 "
225904,2011-02-23,"Senate Committee Amendment 0343s, Amendment Adopted, Voice Vote; Senate Journal 7, Pg.66 "
225904,2011-02-23,"Senate Ought to Pass with Amendment 0343s, Motion Adopted, Voice Vote; OT3rdg; Senate Journal 7, Pg.67 "
225904,2011-02-23,"Senate Passed by Third Reading Resolution; Senate Journal 7, Pg.77 "
225904,2011-03-16,"House Introduced and Referred to Commerce and Consumer Affairs; House Journal  28, Pg.882 "
225904,2011-03-22,"House Public Hearing: 4/12/2011 10:00 Amendment Legislative Office Building 302 ==Work Session May Follow== "
225904,2011-04-12,"House Subcommittee Work Session: 4/21/2011 10:00 Amendment Legislative Office Building 302 Banking/Business Div "
225904,2011-04-12,"House ==CANCELLED== Executive Session: 4/21/2011 1:15 PM Legislative Office Building 302 "
225904,2011-05-03,"House Subcommittee Work Session: 5/10/2011 10:00 Amendment Legislative Office Building 302 Banking/Business Div "
225904,2011-05-03,"House ==CANCELLED== Executive Session: 5/10/2011 11:30 Amendment Legislative Office Building 302 ==TIME CHANGE (Orig 1:30 PM)== "
225904,2011-05-11,"House Subcommittee Work Session: 5/17/2011 10:00 Amendment Legislative Office Building 302 Banking/Business Div "
225904,2011-05-11,"House Executive Session: 5/17/2011 1:30 PM Legislative Office Building 302 "
225904,2011-05-18,"House Committee Report: Ought to Pass with Amendment #1977h for May 25 (Vote 17-0; Consent Calendar); House Calendar 41, PG.1390-1391 "
225904,2011-05-18,"House Proposed Committee Amendment #2011-1977h; House Calendar 41, PG.1405-1406 "
225904,2011-05-25,"House Amendment #1977h Adopted, Voice Vote; House Journal  46, PG.1579 "
225904,2011-05-25,"House Ought to Pass with Amendment #1977h: Motion Adopted Voice Vote; House Journal  46, PG.1579 "
225904,2011-06-08,"Senate Sen. Prescott Concurs with House Amendment #1977h, Motion Adopted, Voice Vote; Senate Journal 20, Pg.550 "
225904,2011-06-08,"House Enrolled; House Journal  51, PG.1728 "
225904,2011-06-08,"Senate Enrolled "
225904,2011-06-27,"Senate Signed by the Governor on 06/27/2011; Effective 07/01/2011; Chapter 0212 "
225905,2011-01-06,"Senate Introduced and Referred to Transportation, Senate Journal 2, Pg.25 "
225905,2011-01-19,"Senate Hearing: 1/27/2011, Room 103, Legislative Office Building, 9:30 a.m.; Senate Calendar 8 "
225905,2011-02-08,"Senate Committee Report: Ought to Pass with Amendment #2011-0183s, New Title, 2/16/2011; Senate Calendar 11 "
225905,2011-02-16,"Senate Committee Amendment 0183s, New Title, Amendment Adopted, Voice Vote, Senate Journal 6, Pg.58 "
225905,2011-02-16,"Senate Ought to Pass with Amendment 0183s, New Title, Motion Adopted, Voice Vote; OT3rdg, Senate Journal 6, Pg.58 "
225905,2011-02-16,"Senate Passed by Third Reading Resolution, Senate Journal 6, Pg.61 "
225905,2011-02-16,"House Introduced and Referred to Transportation; House Journal  19, Pg. 438 "
225905,2011-03-22,"House Public Hearing: 4/5/2011 10:20 Amendment Legislative Office Building 203 ==Executive Session To Follow== "
225905,2011-04-06,"House Committee Report: Ought to Pass for April 13 (Vote 12-1; Consent Calendar) "
225905,2011-04-13,"House Ought to Pass: Motion Adopted Voice Vote; House Journal  37, Pg.1296 "
225905,2011-04-13,"House Enrolled; House Journal  37, PG.1305 "
225905,2011-04-20,"Senate Enrolled; Senate Journal 14, Pg.273 "
225905,2011-04-28,"Senate Signed by the Governor on 04/28/2011; Effective 04/28/2011; Chapter 0025 "
225906,2011-01-06,"Senate Introduced and Referred to Judiciary, Senate Journal 2, Pg.25 "
225906,2011-01-31,"Senate Hearing: 2/10/2011, Room 101, Legislative Office Building, 1:15 p.m.; Senate Calendar 10 "
225906,2011-02-23,"Senate Committee Report: Ought to Pass with Amendment #2011-0409s, 3/9/11; Senate Calendar 14 "
225906,2011-03-09,"Senate Committee Amendment 0409s, Amendment Adopted, Voice Vote; Senate Journal 8, Pg.91 "
225906,2011-03-09,"Senate Ought to Pass with Amendment 0409s, Motion Adopted, Voice Vote; OT3rdg; Senate Journal 8, Pg.91 "
225906,2011-03-09,"Senate Passed by Third Reading Resolution; Senate Journal 8, Pg.99 "
225906,2011-03-16,"House Introduced and Referred to Children and Family Law; House Journal  28, Pg.882 "
225906,2011-04-06,"House Public Hearing: 4/13/2011 1:00 PM Legislative Office Building 206 ==Executive Session To Follow== "
225906,2011-05-12,"House Committee Report: Ought to Pass for May 18 (Vote 10-5; Regular Calendar); House Calendar 39, PG.1323 "
225906,2011-05-18,"House Ought to Pass: Motion Adopted Voice Vote; House Journal  44, PG.1538 "
225906,2011-05-25,"House Enrolled Bill Amendment #2182e Adopted; House Journal  46, PG.1609 "
225906,2011-06-01,"Senate Enrolled Bill Amendment #2011-2182e Adopted; Senate Journal 20, Pg.543 "
225906,2011-06-08,"House Enrolled; House Journal  51, PG.1724 "
225906,2011-06-08,"Senate Enrolled "
225906,2011-06-14,"Senate Signed by the Governor on 06/14/2011; Effective 01/01/2012; Chapter 0176 "
225907,2011-01-06,"Senate Introduced and Referred to Transportation, Senate Journal 2, Pg.25 "
225907,2011-01-19,"Senate Hearing: 1/27/2011, Room 103, Legislative Office Building, 10:00 a.m.; Senate Calendar 8 "
225907,2011-01-27,"Senate Committee Report: Ought to Pass with Amendment #2011-0096s, 2/3/2011; Senate Calendar 9 "
225907,2011-02-03,"Senate Committee Amendment 0096s, Amendment Adopted, Voice Vote; Senate Journal 4, Pg.42 "
225907,2011-02-03,"Senate Ought to Pass with Amendment 0096s, Motion Adopted, Voice Vote; OT3rdg; Senate Journal 4, Pg.42 "
225907,2011-02-03,"Senate Passed by Third Reading Resolution; Senate Journal 4, Pg.42 "
225907,2011-02-07,"House Introduced (in Recess from 1/26/2011) and Referred to Transportation; House Journal  14, PG.265 "
225907,2011-03-22,"House Public Hearing: 4/5/2011 1:30 PM Legislative Office Building 203 ==Executive Session To Follow== "
225907,2011-04-06,"House Committee Report: Ought to Pass for April 13 (Vote 14-0; Consent Calendar); House Calendar 31, PG.1039 "
225907,2011-04-13,"House Ought to Pass: Motion Adopted Voice Vote; House Journal  37, Pg.1296 "
225907,2011-04-13,"House Enrolled; House Journal  37, PG.1305 "
225907,2011-04-20,"Senate Enrolled; Senate Journal 14, Pg.273 "
225907,2011-04-28,"Senate Signed by the Governor on 04/28/2011; Effective 04/28/2011; Chapter 0026 "
225908,2011-01-06,"Senate Introduced and Referred to Energy and Natural Resources, Senate Journal 2, Pg.25 "
225908,2011-01-19,"Senate Hearing: 1/27/2011, Room 102, Legislative Office Building, 9:30 a.m.; Senate Calendar 8 "
225908,2011-01-27,"Senate Hearing: === RECONVENE === 2/3/2011, Room 102, Legislative Office Building, 9:00 a.m.; Senate Calendar 9 "
225908,2011-02-17,"Senate Committee Report: Ought to Pass with Amendment #2011-0398s, 2/23/11; Senate Calendar 12 "
225908,2011-02-23,"Senate Committee Amendment 0398s, Amendment Adopted, Voice Vote; Senate Journal 7, Pg.68 "
225908,2011-02-23,"Senate Ought to Pass with Amendment 0398s, Motion Adopted, Voice Vote; OT3rdg; Senate Journal 7, Pg.68 "
225908,2011-02-23,"Senate Passed by Third Reading Resolution; Senate Journal 7, Pg.77 "
225908,2011-03-16,"House Introduced and Referred to Resources, Recreation and Development; House Journal  28, Pg.882 "
225908,2011-03-22,"House ==CANCELLED== Public Hearing: 3/29/2011 1:45 PM Legislative Office Building 305 "
225908,2011-03-23,"House ==RESCHEDULED== Public Hearing: 4/5/2011 1:45 PM Legislative Office Building 305 "
225908,2011-04-26,"House Executive Session: 5/3/2011 1:00 PM Legislative Office Building 305 "
225908,2011-05-04,"House Committee Report: Ought to Pass for May 18 (Vote 15-0; Consent Calendar); House Calendar 39, PG.1321 "
225908,2011-05-18,"House Ought to Pass: Motion Adopted Voice Vote; House Journal  44, PG.1536 "
225908,2011-06-01,"House Enrolled; House Journal  48, PG.1669 "
225908,2011-06-01,"Senate Enrolled; Senate Journal 20, Pg.547 "
225908,2011-06-07,"Senate Signed by the Governor on 06/07/2011; Effective 08/06/2011; Chapter 0142 "
230603,2011-01-13,"House Introduced 1/6/2011 and Referred to Ways and Means; House Journal  11, PG. 176 "
230603,2011-01-26,"House Public Hearing: 2/3/2011 1:45 PM Legislative Office Building 202 "
230603,2011-02-15,"House Executive Session: 2/16/2011 Legislative Office Building 202 Following House Session "
230603,2011-02-16,"House Majority Committee Report: Ought to Pass for Feb 23 (Vote 14-4; Regular Calendar); House Calendar 15, PG.281-282 "
230603,2011-02-16,"House Minority Committee Report: Inexpedient to Legislate; House Calendar 15, PG.281-282 "
230603,2011-02-23,"House Ought to Pass: Motion Adopted Regular Calendar 231-60; House Journal  21, PG.515-517 "
230603,2011-03-09,"Senate Introduced and Referred to Ways & Means; Senate Journal 9, Pg.102 "
230603,2011-03-31,"Senate Hearing: 4/5/11, Room 100, State House, 2:30 p.m.; Senate Calendar 18 "
230603,2011-04-20,"Senate Committee Report: Ought to Pass, 4/27/11; Senate Calendar 21 "
230603,2011-04-27,"Senate Ought to Pass, Motion Adopted, Voice Vote; Refer to Finance Rule 4-3; Senate Journal 14 "
230603,2011-05-12,"Senate Committee Report: Ought to Pass, 5/18/11; Senate Calendar 24 "
230603,2011-05-18,"Senate Ought to Pass, Motion Adopted, Voice Vote; OT3rdg; Senate Journal 17, Pg.347 "
230603,2011-05-18,"Senate Sen. Bragdon Moved to Rescind OT3rdg; Senate Journal 17, Pg.347 "
230603,2011-05-18,"Senate Pending Motion OT3rdg; Senate Journal 17 "
230603,2011-05-18,"Senate Sen. Morse Moved Laid on Table, Motion Adopted, Voice Vote; Senate Journal 17, Pg.347 "
230603,2011-06-01,"Senate Sen. White Moved Remove From Table, Motion Adopted, Voice Vote; Senate Journal 19, Pg.526 "
230603,2011-06-01,"Senate Sen. Sanborn Moved Reconsideration, Motion Adopted, Voice Vote; Senate Journal 19, Pg.526 "
230603,2011-06-01,"Senate Sen. Sanborn Floor Amendment #2011-2267s, Regular Calendar 24Y-0N, Amendment Adopted; Senate Journal 19, Pg.526 "
230603,2011-06-01,"Senate Ought to Pass with Amendment 2267s, Motion Adopted, Voice Vote; OT3rdg; Senate Journal 19, Pg.527 "
230603,2011-06-01,"Senate Passed by Third Reading Resolution; Senate Journal 19, Pg.539 "
230603,2011-06-08,"House House Concurs with Senate Amendment 2267s (Rep Stepanek): Motion Adopted Regular Calendar 265-94; House Journal  51, PG.1715-1717 "
230603,2011-06-08,"Senate Enrolled "
230603,2011-06-08,"House Enrolled; House Journal  51, PG.1728 "
230603,2011-06-30,"House Law Without Signature 06/29/2011; Effective 07/01/2014; Chapter 0225; NH Constitution, Art.44, Pt.II "
230604,2011-01-13,"House Introduced 1/6/2011 and Referred to Transportation; House Journal  11, PG. 176 "
230604,2011-01-18,"House Public Hearing: 1/25/2011 10:30 Amendment Legislative Office Building 203 "
230604,2011-01-26,"House Executive Session: 2/1/2011 11:30 Amendment Legislative Office Building 203 "
230604,2011-02-08,"House Committee Report: Ought to Pass with Amendment #0071h for Feb 15 (Vote 12-0; Consent Calendar); House Calendar 13, PG.233 "
230604,2011-02-08,"House Proposed Committee Amendment #2011-0071h; House Calendar 13, PG.258 "
230604,2011-02-15,"House Amendment #0071h Adopted, Voice Vote; House Journal  17, PG.361 "
230604,2011-02-15,"House Ought to Pass with Amendment #0071h: Motion Adopted Voice Vote; House Journal  17, PG.361 "
230604,2011-02-23,"Senate Introduced and Referred to Transportation; Senate Journal 8, Pg.81 "
230604,2011-03-03,"Senate Hearing: 3/10/11, Room 103, Legislative Office Building, 9:45 a.m.; Senate Calendar 14 "
230604,2011-03-17,"Senate Committee Report: Ought to Pass, 3/23/11; Senate Calendar 16 "
230604,2011-03-23,"Senate Ought to Pass, Motion Adopted, Voice Vote; OT3rdg; Senate Journal 10, Pg.186 "
230604,2011-03-23,"Senate Passed by Third Reading Resolution; Senate Journal 10, Pg.188 "
230604,2011-04-13,"Senate Enrolled; Senate Journal 13, Pg.259 "
230604,2011-04-13,"House Enrolled; House Journal  37, Pg.1304 "
230604,2011-04-28,"House Signed by the Governor 04/25/2011; Effective 04/25/2011; Chapter 0011 "
230605,2011-01-13,"House Introduced 1/6/2011 and Referred to Health, Human Services and Elderly Affairs; House Journal  11, PG. 176 "
230605,2011-01-18,"House Public Hearing: 1/25/2011 11:00 Amendment Legislative Office Building 205 "
230605,2011-02-01,"House Subcommittee Work Session: 2/3/2011 2:00 PM Legislative Office Building 205 "
230605,2011-02-08,"House Executive Session: 2/17/2011 10:00 Amendment Legislative Office Building 205 "
230605,2011-02-23,"House Committee Report: Inexpedient to Legislate for Mar 2 (Vote 15-1; Consent Calendar); House Calendar 18, PG.387 "
230605,2011-03-02,"House Inexpedient to Legislate: Motion Adopted Voice Vote; House Journal  25, PG.673 "
230606,2011-01-13,"House Introduced 1/6/2011 and Referred to Legislative Administration; House Journal  11, PG. 176 "
230606,2011-01-19,"House Public Hearing: 1/25/2011 10:30 Amendment Legislative Office Building 104 "
230606,2011-01-26,"House Executive Session: 2/1/2011 11:30 Amendment Legislative Office Building 104 "
230606,2011-02-01,"House Committee Report: Ought to Pass for Feb 9 (Vote 10-5; Regular Calendar); House Calendar 12, PG.208 "
230606,2011-02-09,"House Recommit (Rep Mirski): Motion Adopted Voice Vote; House Journal  16, PG.324 "
230606,2011-02-10,"House Executive Session: 3/1/2011 10:00 Amendment Legislative Office Building 104 "
230606,2011-03-01,"House Committee Report: Ought to Pass with Amendment #0460h for Mar 15 (Vote 12-2; Consent Calendar); House Calendar 22, PG.536 "
230606,2011-03-01,"House Proposed Committee Amendment #2011-0460h; House Calendar 23, PG.589 "
230606,2011-03-15,"House Amendment #0460h Adopted, Voice Vote; House Journal  26, PG.729 "
230606,2011-03-15,"House Ought to Pass with Amendment #0460h: Motion Adopted Voice Vote; House Journal  26, PG.729 "
230606,2011-04-27,"Senate Introduced and Referred to Internal Affairs; Senate Journal 15, Pg.291 "
230606,2011-04-28,"Senate Hearing: 5/4/11, Room 100, State House, 2:00 p.m.; Senate Calendar 22 "
230606,2011-05-05,"Senate Committee Report: Ought to Pass with Amendment #2011-1759s, 5/11/11; Senate Calendar 23 "
230606,2011-05-11,"Senate Committee Amendment 1759s, Amendment Adopted, Voice Vote; Senate Journal 16, Pg.331 "
230606,2011-05-11,"Senate Ought to Pass with Amendment 1759s, Motion Adopted, Voice Vote; OT3rdg; Senate Journal 16, Pg.331 "
230606,2011-05-11,"Senate Passed by Third Reading Resolution; Senate Journal 16 "
230606,2011-05-25,"House House Concurs with Senate Amendment #1759s (Rep Mirski): Motion Adopted Voice Vote; House Journal  46, PG.1582 "
230606,2011-06-08,"Senate Enrolled "
230606,2011-06-08,"House Enrolled; House Journal  51, PG.1724 "
230606,2011-06-14,"House Signed By Governor 06/14/2011; Effective 08/13/2011; Chapter 0163 "
230607,2011-01-13,"House Introduced 1/6/2011 and Referred to Health, Human Services and Elderly Affairs; House Journal  11, PG. 176 "
230607,2011-01-18,"House Public Hearing: 1/25/2011 1:00 PM Legislative Office Building 205 "
230607,2011-02-02,"House Subcommittee Work Session: 2/8/2011 3:15 PM Legislative Office Building 205 "
230607,2011-02-09,"House Subcommittee Work Session: 2/15/2011 2:00 PM Legislative Office Building 205 "
230607,2011-02-15,"House Subcommittee Work Session: 2/16/2011 2:00 PM Legislative Office Building 205 "
230607,2011-02-23,"House Executive Session: 3/1/2011 9:00 Amendment Legislative Office Building 205 "
230607,2011-03-02,"House Committee Report: Ought to Pass with Amendment #0505h for Mar 15 (Vote 16-0; Consent Calendar); House Calendar 22, PG.531 "
230607,2011-03-02,"House Proposed Committee Amendment #2011-0505h; House Calendar 23, PG.589-590 "
230607,2011-03-15,"House Amendment #0505h Adopted, Voice Vote; House Journal  26, PG.715-716 "
230607,2011-03-15,"House Ought to Pass with Amendment #0505h: Motion Adopted Voice Vote; House Journal  26, PG.715-716 "
230607,2011-03-23,"Senate Introduced and Referred to Health and Human Services; Senate Journal 11, Pg.190 "
230607,2011-03-24,"Senate Hearing: 3/31/11, Room 102, Legislative Office Building, 2:00 p.m.; Senate Calendar 17 "
230607,2011-04-01,"Senate Committee Report: Ought to Pass, 4/13/11; Senate Calendar 19 "
230607,2011-04-13,"Senate Ought to Pass, Motion Adopted, Voice Vote; Refer to Finance Rule 4-3; Senate Journal 12, Pg.250 "
230607,2011-05-19,"Senate Committee Report: Ought to Pass with Amendment #2011-2042s, 5/25/11; Senate Calendar 25 "
230607,2011-05-25,"Senate Committee Amendment 2042s, Amendment Adopted, Voice Vote; Senate Journal 18, Pg.380 "
230607,2011-05-25,"Senate Ought to Pass with Amendment 2042s, Motion Adopted, Voice Vote; OT3rdg; Senate Journal 18, Pg.380 "
230607,2011-05-25,"Senate Passed by Third Reading Resolution; Senate Journal 18, Pg.391 "
230607,2011-06-01,"House House Concurs with Senate Amendment 2042s (Rep Reagan): Motion Adopted Voice Vote; House Journal  48, PG.1646 "
230607,2011-06-08,"House Enrolled Bill Amendment #2011-2304e Adopted; House Journal  51, PG.1727 "
230607,2011-06-08,"Senate Enrolled Bill Amendment #2304e Adopted "
230607,2011-06-08,"Senate Enrolled "
230607,2011-06-08,"House Enrolled; House Journal  51, PG.1728 "
230607,2011-06-27,"House Signed By Governor 06/27/2011; I. Section 5 Effective 07/01/2013; II. Remainder Effective 07/01/2011; Chapter 0209 "
230608,2011-01-13,"House Introduced 1/6/2011 and Referred to Transportation; House Journal  11, PG. 176 "
230608,2011-01-18,"House Public Hearing: 1/25/2011 11:00 Amendment Legislative Office Building 203 "
230608,2011-01-26,"House Executive Session: 2/1/2011 11:30 Amendment Legislative Office Building 203 "
230608,2011-02-01,"House Committee Report: Ought to Pass for Feb 9 (Vote 12-1; Consent Calendar); House Calendar 12, PG.206 "
230608,2011-02-09,"House Ought to Pass: Motion Adopted Voice Vote; House Journal  16, PG.317 "
230608,2011-02-23,"Senate Introduced and Referred to Transportation; Senate Journal 8, Pg.81 "
230608,2011-03-03,"Senate Hearing: 3/10/11, Room 103, Legislative Office Building, 10:15 a.m.; Senate Calendar 14 "
230608,2011-03-17,"Senate Committee Report: Ought to Pass, 3/23/11; Senate Calendar 16 "
230608,2011-03-23,"Senate Ought to Pass, Motion Adopted, Voice Vote; OT3rdg; Senate Journal 10, Pg.186 "
230608,2011-03-23,"Senate Passed by Third Reading Resolution; Senate Journal 10, Pg.188 "
230608,2011-04-13,"Senate Enrolled; Senate Journal 13, Pg.259 "
230608,2011-04-13,"House Enrolled; House Journal  37, Pg.1304 "
230608,2011-04-28,"House Signed by the Governor 04/25/2011; Effective 01/01/2012; Chapter 0012 "
230609,2011-01-13,"House Introduced 1/6/2011 and Referred to Executive Departments and Administration; House Journal  11, PG. 176 "
230609,2011-01-19,"House Public Hearing: 1/25/2011 11:00 Amendment Legislative Office Building 306 "
230609,2011-02-14,"House ==CANCELLED== Executive Session: 2/16/2011 Legislative Office Building 306 1:30 PM or 45 minutes after House session "
230609,2011-03-01,"House Subcommittee Work Session: 3/9/2011 9:00 Amendment Legislative Office Building 306 "
230609,2011-03-02,"House Executive Session: 3/9/2011 1:00 PM Legislative Office Building 306 "
230609,2011-03-09,"House Retained in Committee; House Calendar 27, PG.823 "
230609,2011-09-20,"House Retained Bill - Subcommittee Work Session: 10/6/2011 10:00 Amendment Legislative Office Building 306 "
230609,2011-09-27,"House Retained Bill - Executive Session: 10/27/2011 10:00 Amendment Legislative Office Building 306 (If Necessary Continued 11/1/2011 10:30 Amendment Legislative Office Building 306) "
230610,2011-01-13,"House Introduced 1/6/2011 and Referred to Fish and Game and Marine Resources; House Journal  11, PG. 176 "
230610,2011-01-19,"House Public Hearing: 1/25/2011 2:00 PM Legislative Office Building 307 "
230610,2011-02-01,"House Executive Session: 2/10/2011 2:00 PM Legislative Office Building 307 "
230610,2011-02-24,"House Committee Report: Inexpedient to Legislate for Mar 2 (Vote 12-4; Regular Calendar); House Calendar 18, PG.391-392 "
230610,2011-03-02,"House Recommit (Rep G.Hopper): Motion Adopted Regular Calendar 241-108; House Journal  25, PG.684-686 "
230610,2011-03-02,"House Executive Session: 3/3/2011 10:00 Amendment Legislative Office Building 307 "
230610,2011-03-03,"House Retained in Committee; House Calendar 27, PG.824 "
230610,2011-09-15,"House Retained Bill - Subcommittee Work Session: 9/28/2011 9:00 Amendment Legislative Office Building 307 "
230610,2011-10-07,"House Retained Bill - Subcommittee Work Session: 10/12/2011 Legislative Office Building 307 1:00 PM Or Immediately Following House Session "
230610,2011-10-07,"House Retained Bill - Executive Session: 10/18/2011 10:00 Amendment Legislative Office Building 307 "
230611,2011-01-13,"House Introduced 1/6/2011 and Referred to Fish and Game and Marine Resources; House Journal  11, PG. 176 "
230611,2011-01-19,"House Public Hearing: 1/25/2011 11:00 Amendment Legislative Office Building 307 ==Executive Session to Follow== "
230611,2011-01-25,"House Committee Report: Ought to Pass for Feb 9 (Vote 15-0; Consent Calendar); House Calendar 10, PG.146 "
230611,2011-02-09,"House Ought to Pass: Motion Adopted Voice Vote; House Journal  16, PG.311 "
230611,2011-03-16,"Senate Introduced and Referred to Energy and Natural Resources "
230611,2011-03-17,"Senate Hearing: 3/24/11, Room 102, Legislative Office Building, 11:00 a.m.; Senate Calendar 16 "
230611,2011-03-24,"Senate Committee Report: Ought to Pass, 3/30/11; Senate Calendar 17 "
230611,2011-03-30,"Senate Ought to Pass, Motion Adopted, Voice Vote; OT3rdg; Senate Journal 11, Pg.211 "
230611,2011-03-30,"Senate Passed by Third Reading Resolution; Senate Journal 11, Pg.240 "
230611,2011-04-13,"Senate Enrolled; Senate Journal 13, Pg.259 "
230611,2011-04-13,"House Enrolled; House Journal  37, Pg.1304 "
230611,2011-04-28,"House Signed by the Governor 04/25/2011; Effective 06/24/2011; Chapter 0013 "
230612,2011-01-13,"House Introduced 1/6/2011 and Referred to Fish and Game and Marine Resources; House Journal  11, PG. 176 "
230612,2011-01-19,"House Public Hearing: 1/25/2011 11:30 Amendment Legislative Office Building 307 ==Executive Session to Follow== "
230612,2011-03-03,"House Committee Report: Ought to Pass for Mar 15 (Vote 9-0; Consent Calendar); House Calendar 22, PG.531 "
230612,2011-03-15,"House Ought to Pass: Motion Adopted Voice Vote; House Journal  26, PG.715 "
230612,2011-03-23,"Senate Introduced and Referred to Energy and Natural Resources; Senate Journal 11, Pg.190 "
230612,2011-04-06,"Senate Hearing: 4/14/11, Room 102, Legislative Office Building, 9:45 a.m.; Senate Calendar 19 "
230612,2011-04-14,"Senate Committee Report: Ought to Pass, 4/20/11; Senate Calendar 20 "
230612,2011-04-20,"Senate Ought to Pass, Motion Adopted, Voice Vote; OT3rdg; Senate Journal 13, Pg.264 "
230612,2011-04-20,"Senate Passed by Third Reading Resolution; Senate Journal 13, Pg.270 "
230612,2011-05-04,"Senate Enrolled; Senate Journal 16, Pg.318 "
230612,2011-05-04,"House Enrolled; House Journal  42, PG.1490 "
230612,2011-05-20,"House Signed by Governor 05/16/2011; Effective 07/15/2011; Chapter 0070 "
230613,2011-01-13,"House Introduced 1/6/2011 and Referred to Election Law; House Journal  11, PG. 176 "
230613,2011-01-26,"House Public Hearing: 2/1/2011 11:30 Amendment Legislative Office Building 308 "
230613,2011-02-16,"House Executive Session: 2/22/2011 10:30 Amendment Legislative Office Building 308 "
230613,2011-02-23,"House Committee Report: Inexpedient to Legislate for Mar 2 (Vote 17-1; Consent Calendar); House Calendar 18, PG.387 "
230613,2011-03-02,"House Inexpedient to Legislate: Motion Adopted Voice Vote; House Journal  25, PG.673 "
230614,2011-01-13,"House Introduced 1/6/2011 and Referred to Municipal and County Government; House Journal  11, PG. 176 "
230614,2011-01-19,"House ==RESCHEDULED== Public Hearing: 1/25/2011 11:00 Amendment Legislative Office Building 301 (Orig 1:00 PM) ==Executive Session to Follow== "
230614,2011-02-01,"House Committee Report: Ought to Pass for Feb 9 (Vote 14-2; Regular Calendar); House Calendar 12, PG.208 "
230614,2011-02-09,"House Ought to Pass: Motion Adopted Voice Vote; House Journal  16, PG.325 "
230614,2011-03-16,"Senate Introduced and Referred to Public and Municipal Affairs "
230614,2011-04-14,"Senate Hearing: 4/19/11, Room 101, Legislative Office Building, 9:35 a.m.; Senate Calendar 20 "
230614,2011-04-20,"Senate Committee Report: Ought to Pass, 4/27/11; Senate Calendar 21 "
230614,2011-04-27,"Senate Ought to Pass, Motion Adopted, Voice Vote; OT3rdg; Senate Journal 14 "
230614,2011-04-27,"Senate Passed by Third Reading Resolution; Senate Journal 14 "
230614,2011-05-04,"Senate Enrolled; Senate Journal 16, Pg.318 "
230614,2011-05-04,"House Enrolled; House Journal  42, PG.1490 "
230614,2011-05-20,"House Signed by Governor 05/16/2011; Effective 07/15/2011; Chapter 0071 "
230615,2011-01-13,"House Introduced 1/6/2011 and Referred to Judiciary; House Journal  11, PG. 176 "
230615,2011-01-19,"House Public Hearing: 1/25/2011 11:00 Amendment Legislative Office Building 208 "
230615,2011-01-19,"House Division I Work Session: 1/25/2011 1:30 PM Legislative Office Building 208 "
230615,2011-01-26,"House Executive Session: 2/1/2011 11:00 Amendment Legislative Office Building 208 ==RECESSED== "
230615,2011-02-09,"House Continued Executive Session: 2/14/2011 10:00 Amendment Legislative Office Building 208 "
230615,2011-02-14,"House Retained in Committee; House Calendar 27, PG.824 "
230615,2011-09-15,"House Retained Bill - Subcommittee Work Session: 10/4/2011 10:00 Amendment Legislative Office Building 208 "
230615,2011-09-15,"House Retained Bill - Executive Session: 10/25/2011 11:00 Amendment Legislative Office Building 208 "
230616,2011-01-13,"House Introduced 1/6/2011 and Referred to Commerce and Consumer Affairs; House Journal  11, PG. 176 "
230616,2011-02-09,"House Public Hearing: 2/17/2011 10:00 Amendment Legislative Office Building 302 "
230616,2011-02-16,"House ==CANCELLED== Executive Session: 2/25/2011 10:00 Amendment Legislative Office Building 302 "
230616,2011-02-23,"House Executive Session: 3/1/2011 3:00 PM Legislative Office Building 302 "
230616,2011-03-01,"House Retained in Committee; House Calendar 27, PG.822 "
230616,2011-08-23,"House Retained Bill - Insurance/Consumer Div Subcom Work Session: 9/20/2011 2:45 PM Legislative Office Building 302 "
230616,2011-09-27,"House Retained Bill - Executive Session: 10/6/2011 10:00 Amendment Legislative Office Building 302 "
230616,2011-10-17,"House Committee Report: Refer to Interim Study for Jan 4 (Vote 13-0; Consent Calendar) "
233533,2011-01-19,"Senate Introduced and Referred to Ways & Means, Senate Journal 3, Pg.32 "
233533,2011-02-17,"Senate Hearing: 2/23/11, Room 100, State House, 1:00 p.m.; Senate Calendar 12 "
233533,2011-03-08,"Senate Committee Report: Rereferred to Committee, 3/16/11; Senate Calendar 15 "
233533,2011-03-16,"Senate Rereferred to Committee, Motion Adopted, Voice Vote; Senate Journal 9, Pg.139 "
233534,2011-01-19,"Senate Introduced and Referred to Transportation, Senate Journal 3, Pg.32 "
233534,2011-02-10,"Senate Hearing: 2/24/11, Room 305-307, Legislative Office Building, 9:00 a.m.; Senate Calendar 11 "
233534,2011-03-17,"Senate Committee Report: Ought to Pass with Amendment #2011-0989s, 3/23/11; Senate Calendar 16 "
233534,2011-03-23,"Senate Committee Amendment 0989s, Amendment Adopted, Voice Vote; Senate Journal 10, Pg.186 "
233534,2011-03-23,"Senate Ought to Pass with Amendment 0989s, Regular Calendar 13Y-11N, Motion Adopted; OT3rdg; Senate Journal 10, Pg.186 "
233534,2011-03-23,"Senate Passed by Third Reading Resolution; Senate Journal 10, Pg.187 "
233534,2011-03-28,"House Introduced and Referred to Resources, Recreation and Development; House Journal  30, PG.1036 "
233534,2011-03-30,"House ==CANCELLED== Public Hearing: 4/6/2011 1:00 PM Legislative Office Building 305-307 "
233534,2011-03-31,"House Vacated from Resources, Recreation and Development and Referred to Transportation: Motion Adopted Voice Vote; House Journal  35, PG.1193 "
233534,2011-04-06,"House Public Hearing: 4/19/2011 10:00 Amendment Legislative Office Building 201-203 "
233534,2011-04-26,"House Executive Session: 5/3/2011 10:00 Amendment Legislative Office Building 203 "
233534,2011-05-03,"House Majority Committee Report: Inexpedient to Legislate for May 18 (Vote 11-6; Regular Calendar); House Calendar 39, PG.1325 "
233534,2011-05-03,"House Minority Committee Report: Ought to Pass; House Calendar 39, PG.1325 "
233534,2011-05-18,"House Inexpedient to Legislate: Motion Adopted Regular Calendar 276-75; House Journal  44, PG.1552-1555 "
233535,2011-01-19,"Senate Introduced and Referred to Judiciary, Senate Journal 3, Pg.32 "
233535,2011-01-26,"Senate Hearing: 2/3/2011, Room 101, Legislative Office Building, 1:00 p.m.; Senate Calendar 9 "
233535,2011-02-08,"Senate Committee Report: Ought to Pass, 2/16/2011; Senate Calendar 11 "
233535,2011-02-16,"Senate Ought to Pass, Motion Adopted, Voice Vote; OT3rdg, Senate Journal 5, Pg.56 "
233535,2011-02-16,"Senate Passed by Third Reading Resolution, Senate Journal 6, Pg.61 "
233535,2011-02-16,"House Introduced and Referred to Judiciary; House Journal  19, Pg. 438 "
233535,2011-03-29,"House Public Hearing: 4/14/2011 11:00 Amendment Legislative Office Building 208 "
233535,2011-04-14,"House Full Committee Work Session: 4/26/2011 10:00 Amendment Legislative Office Building 208 "
233535,2011-04-27,"House Executive Session: 5/3/2011 10:00 Amendment Legislative Office Building 208 "
233535,2011-05-11,"House Committee Report: Ought to Pass for May 18 (Vote 15-1; Consent Calendar); House Calendar 39, PG.1320 "
233535,2011-05-18,"House Ought to Pass: Motion Adopted Voice Vote; House Journal  44, PG.1534 "
233535,2011-05-25,"House Enrolled; House Journal  46, PG.1609 "
233535,2011-05-25,"Senate Enrolled; Senate Journal 19, Pg.395 "
233535,2011-06-08,"Senate Signed by the Governor on 06/02/2011; Effective 06/02/2011; Chapter 0122 "
233536,2011-01-19,"Senate Introduced and Referred to Education, Senate Journal 3, Pg.32 "
233536,2011-01-21,"Senate Hearing: 2/01/11, Room 103, Legislative Office Building, 1:00 p.m. "
233536,2011-02-09,"Senate Committee Report: Ought to Pass, 2/16/2011; Senate Calendar 11 "
233536,2011-02-16,"Senate Ought to Pass, Motion Adopted, Voice Vote; OT3rdg, Senate Journal 6, Pg.54 "
233536,2011-02-16,"Senate Passed by Third Reading Resolution, Senate Journal 6, Pg.61 "
233536,2011-02-16,"House Introduced and Referred to Education; House Journal  19, Pg. 438 "
233536,2011-04-05,"House Public Hearing: 4/14/2011 10:00 Amendment Legislative Office Building 207 "
233536,2011-04-27,"House Executive Session: 5/10/2011 1:30 PM Legislative Office Building 207 "
233536,2011-05-12,"House Committee Report: Ought to Pass with Amendment #1808h for May 18 (Vote 17-0; Consent Calendar); House Calendar 39, PG.1320 "
233536,2011-05-12,"House Proposed Committee Amendment #2011-1808h; House Calendar 39, PG.1339 "
233536,2011-05-18,"House Amendment #1808h Adopted, Voice Vote; House Journal  44, PG.1533 "
233536,2011-05-18,"House Ought to Pass with Amendment #1808h: Motion Adopted Voice Vote; House Journal  44, PG.1533 "
233536,2011-06-01,"Senate Sen. Stiles Concurs with House Amendment #1808h, Motion Adopted, Voice Vote; Senate Journal 19, Pg.536 "
233536,2011-06-08,"House Enrolled; House Journal  51, PG.1726 "
233536,2011-06-08,"Senate Enrolled "
233536,2011-06-14,"Senate Signed by the Governor on 06/14/2011; Effective 08/13/2011; Chapter 0178 "
233537,2011-01-19,"Senate Introduced and Referred to Energy and Natural Resources, Senate Journal 3, Pg.32 "
233537,2011-02-10,"Senate Hearing: 2/17/11, Room 102, Legislative Office Building, 9:15 a.m.; Senate Calendar 11 "
233537,2011-02-17,"Senate Committee Report: Ought to Pass, 2/23/11; Senate Calendar 12 "
233537,2011-02-23,"Senate Ought to Pass, Motion Adopted, Voice Vote; OT3rdg; Senate Journal 7, Pg.68 "
233537,2011-02-23,"Senate Passed by Third Reading Resolution; Senate Journal 7, Pg.77 "
233537,2011-03-16,"House Introduced and Referred to Resources, Recreation and Development; House Journal  28, Pg.882 "
233537,2011-03-29,"House Public Hearing: 4/6/2011 10:45 Amendment Legislative Office Building 305 "
233537,2011-04-26,"House Executive Session: 5/3/2011 1:00 PM Legislative Office Building 305 "
233537,2011-05-04,"House Committee Report: Ought to Pass for May 18 (Vote 15-0; Consent Calendar); House Calendar 39, PG.1321 "
233537,2011-05-18,"House Ought to Pass: Motion Adopted Voice Vote; House Journal  44, PG.1536-1537 "
233537,2011-06-01,"House Enrolled; House Journal  48, PG.1669 "
233537,2011-06-01,"Senate Enrolled; Senate Journal 20, Pg.547 "
233537,2011-06-07,"Senate Signed by the Governor on 06/07/2011; Effective 08/06/2011; Chapter 0143 "
233538,2011-01-19,"Senate Introduced and Referred to Ways & Means, Senate Journal 3, Pg.32 "
233538,2011-02-03,"Senate Hearing: 2/8/11, Room 100 State House, 1:10 p.m.; Senate Calendar 10 "
233538,2011-02-09,"Senate Committee Report: Ought to Pass, 2/16/2011; Senate Calendar 11 "
233538,2011-02-16,"Senate Ought to Pass, Motion Adopted, Voice Vote; Refer to Finance Rule 4-3, Senate Journal 6, Pg.60 "
233538,2011-02-25,"Senate Committee Report: Inexpedient to Legislate, 3/9/11; Senate Calendar 14 "
233538,2011-03-09,"Senate Inexpedient to Legislate, Motion Adopted, Voice Vote === BILL KILLED ===; Senate Journal 8, Pg.90 "
233539,2011-01-19,"Senate Introduced and Referred to Ways & Means, Senate Journal 3, Pg.32 "
233539,2011-02-03,"Senate Hearing: 2/8/11, Room 100 State House, 1:25 p.m.; Senate Calendar 10 "
233539,2011-02-16,"Senate Committee Report: Ought to Pass with Amendment #2011-0362s, 2/23/11; Senate Calendar 12 "
233539,2011-02-23,"Senate Committee Amendment 0362s, Not Voted On; Senate Journal 7, Pg.77 "
233539,2011-02-23,"Senate Sen. Bradley Moved Laid on Table, Motion Adopted, Voice Vote; Senate Journal 7, Pg.77 "
233539,2011-03-30,"Senate Sen. Odell Moved Remove From Table, Motion Adopted, Voice Vote; Senate Journal 11, Pg.233 "
233539,2011-03-30,"Senate Committee Amendment 0362s, Amendment Adopted, Voice Vote; Senate Journal 11, Pg.233 "
233539,2011-03-30,"Senate Sen. Odell Floor Amendment #2011-1308s, Amendment Adopted, Voice Vote; Senate Journal 11, Pg.234 "
233539,2011-03-30,"Senate Ought to Pass with Amendment 0362s, 1308s, Motion Adopted, Voice Vote; OT3rdg; Senate Journal 11, Pg.234 "
233539,2011-03-30,"Senate Passed by Third Reading Resolution; Senate Journal 11, Pg.239 "
233539,2011-03-31,"House Introduced and Referred to Executive Departments and Administration; House Journal  35, PG.1240  "
233539,2011-04-05,"House Public Hearing: 4/14/2011 10:00 Amendment Legislative Office Building 306 "
233539,2011-04-05,"House Executive Session: 4/19/2011 1:15 PM Legislative Office Building 306 "
233539,2011-04-19,"House Committee Report: Ought to Pass for April 27 (Vote 10-0; Consent Calendar); House Calendar 33, PG.1066 "
233539,2011-04-27,"House Ought to Pass: Motion Adopted Voice Vote; House Journal  40, PG.1352-1353 "
233539,2011-04-27,"House Referred to Ways and Means; House Journal  40, PG.1353 "
233539,2011-05-03,"House Public Hearing: 5/10/2011 10:00 Amendment Legislative Office Building 202 "
233539,2011-05-10,"House Executive Session: 5/17/2011 1:00 PM Legislative Office Building 202 "
233539,2011-05-17,"House Committee Report: Ought to Pass for May 25 (Vote 17-0; Consent Calendar); House Calendar 41, PG.1392 "
233539,2011-05-25,"House Removed from Consent Calendar (Rep Weyler); House Journal  46, PG.1579 "
233539,2011-05-25,"House Floor Amendment #2011-2163h(New Title) (Rep Weyler) Adopted, Regular Calendar 272-108; House Journal  46, PG.1601-1603 "
233539,2011-05-25,"House Ought to Pass with Amendment #2163h(NT): Motion Adopted Voice Vote; House Journal  46, PG.1601-1603 "
233539,2011-06-01,"Senate Sen. Odell Moved Nonconcur with House Amendment 2163h; New Title, Regular Calendar 13Y-11N, Motion Adopted; Senate Journal 19, Pg.537 "
233540,2011-01-19,"Senate Introduced and Referred to Judiciary, Senate Journal 3, Pg.33 "
233540,2011-03-10,"Senate Hearing: 3/17/11, Room 101, Legislative Office Building, 1:00 p.m.; Senate Calendar 15 "
233540,2011-03-17,"Senate Committee Report: Rereferred to Committee, 3/23/11; Senate Calendar 16 "
233540,2011-03-23,"Senate Rereferred to Committee, Motion Adopted, Voice Vote; Senate Journal 10, Pg.184 "
233541,2011-01-19,"Senate Introduced and Referred to Ways & Means, Senate Journal 3, Pg.33 "
233541,2011-02-03,"Senate Hearing: 2/8/11, Room 100 State House, 1:15 p.m.; Senate Calendar 10 "
233541,2011-02-09,"Senate Committee Report: Ought to Pass, 2/16/2011; Senate Calendar 11 "
233541,2011-02-16,"Senate Ought to Pass, Motion Adopted, Voice Vote; OT3rdg, Senate Journal 6, Pg.60 "
233541,2011-02-16,"Senate Passed by Third Reading Resolution, Senate Journal 6, Pg.61 "
233541,2011-02-16,"House Introduced and Referred to Ways and Means; House Journal  19, Pg. 438 "
233541,2011-03-10,"House Public Hearing: 3/22/2011 10:30 Amendment Legislative Office Building 202 "
233541,2011-03-30,"House ==CANCELLED== Executive Session: 4/5/2011 1:00 PM Legislative Office Building 202 "
233541,2011-04-13,"House Executive Session: 4/21/2011 12:30 PM Legislative Office Building 202 "
233541,2011-04-21,"House Committee Report: Ought to Pass with Amendment #1350h for April 27 (Vote 18-0; Consent Calendar); House Calendar 33, PG.1068 "
233541,2011-04-21,"House Proposed Committee Amendment #2011-1350h; House Calendar 33, PG.1081 "
233541,2011-04-27,"House Amendment #1350h Adopted, Voice Vote; House Journal  40, PG.1355 "
233541,2011-04-27,"House Ought to Pass with Amendment #1350h: Motion Adopted Voice Vote; House Journal  40, PG.1355 "
233541,2011-05-25,"Senate Sen. Odell Concurs with House Amendment #1350h, Motion Adopted, Voice Vote; Senate Journal 18, Pg.390 "
233541,2011-06-08,"House Enrolled; House Journal  51, PG.1724 "
233541,2011-06-08,"Senate Enrolled "
233541,2011-06-14,"Senate Signed by the Governor on 06/14/2011; Effective 08/13/2011; Chapter 0179 "
236418,2011-01-19,"Senate Introduced and Referred to Ways & Means, Senate Journal 3, Pg.33 "
236418,2011-02-03,"Senate Hearing: 2/8/11, Room 100 State House, 1:20 p.m.; Senate Calendar 10 "
236418,2011-02-09,"Senate Committee Report: Ought to Pass, 2/16/2011; Senate Calendar 11 "
236418,2011-02-16,"Senate Ought to Pass, Motion Adopted, Voice Vote; OT3rdg, Senate Journal 6, Pg.60 "
236418,2011-02-16,"Senate Passed by Third Reading Resolution, Senate Journal 6, Pg.61 "
236418,2011-02-16,"House Introduced and Referred to Ways and Means; House Journal  19, Pg. 438 "
236418,2011-03-10,"House Public Hearing: 3/22/2011 11:00 Amendment Legislative Office Building 202 "
236418,2011-03-30,"House Executive Session: 4/5/2011 1:00 PM Legislative Office Building 202 "
236418,2011-04-05,"House Committee Report: Ought to Pass for April 13 (Vote 20-0; Consent Calendar); House Calendar 31, PG.1040 "
236418,2011-04-13,"House Ought to Pass: Motion Adopted Voice Vote; House Journal  37, Pg.1297 "
236418,2011-04-13,"House Enrolled; House Journal  37, PG.1305 "
236418,2011-04-20,"Senate Enrolled; Senate Journal 14, Pg.273 "
236418,2011-04-28,"Senate Signed by the Governor on 04/28/2011; Effective 06/27/2011; Chapter 0027 "
236419,2011-01-19,"Senate Introduced and Referred to Judiciary, Senate Journal 3, Pg.33 "
236419,2011-03-10,"Senate Hearing: 3/17/11, Room 101, Legislative Office Building, 1:30 p.m.; Senate Calendar 15 "
236419,2011-03-22,"Senate Committee Report: Rereferred to Committee, 3/30/11; Senate Calendar 17 "
236419,2011-03-30,"Senate Rereferred to Committee, Motion Adopted, Voice Vote; Senate Journal 11, Pg.229 "
236420,2011-01-19,"Senate Introduced and Referred to Education, Senate Journal 3, Pg.33 "
236420,2011-01-21,"Senate Hearing: 2/01/11, Room 103, Legislative Office Building, 1:30 p.m. "
236420,2011-02-08,"Senate Committee Report: Ought to Pass, 2/16/2011; Senate Calendar 11 "
236420,2011-02-16,"Senate Ought to Pass, Motion Adopted, Voice Vote; OT3rdg, Senate Journal 6, Pg.54 "
236420,2011-02-16,"Senate Passed by Third Reading Resolution, Senate Journal 6, Pg.61 "
236420,2011-02-16,"House Introduced and Referred to Education; House Journal  19, Pg. 438 "
236420,2011-04-05,"House Public Hearing: 4/14/2011 10:30 Amendment Legislative Office Building 207 "
236420,2011-04-27,"House Executive Session: 5/3/2011 1:00 PM Legislative Office Building 205-207 "
236420,2011-05-04,"House Committee Report: Ought to Pass with Amendment #1500h for May 18 (Vote 17-0; Consent Calendar); House Calendar 39, PG.1320 "
236420,2011-05-04,"House Proposed Committee Amendment #2011-1500h; House Calendar 39, PG.1340 "
236420,2011-05-18,"House Amendment #1500h Adopted, Voice Vote; House Journal  44, PG.1534 "
236420,2011-05-18,"House Ought to Pass with Amendment #1500h: Motion Adopted Voice Vote; House Journal  44, PG.1534 "
236420,2011-06-01,"Senate Sen. Stiles Moved Nonconcur with House Amendment 1500h; Requests C of C, Motion Adopted, Voice Vote; Senate Journal 19, Pg.536 "
236420,2011-06-01,"Senate President Appoints: Senators Stiles, Forsythe and DAllesandro; Senate Journal 19, Pg.536 "
236420,2011-06-08,"House House Accedes to Senate Request for C of C (Rep Balboni): Motion Adopted Voice Vote; House Journal  51, PG.1723 "
236420,2011-06-08,"House Speaker Appoints: Reps Balboni, Ladd, Boehm, and Gile; House Journal  51, PG.1723 "
236420,2011-06-09,"Senate Committee of Conference Meeting: 6/13/2011, 9:00 a.m., Room 103, Legislative Office Building "
236420,2011-06-15,"House Conference Committee Report #2011-2367c, House Amendment + New Amendment, Filed; House Calendar 49, PG.1673-1674 "
236420,2011-06-22,"House Conference Committee Report #2367c Adopted, Voice Vote; House Journal  57, PG.1804 "
236420,2011-06-22,"Senate Conference Committee Report 2367c; Adopted, Voice Vote "
236420,2011-06-22,"House Enrolled; House Journal  57, PG.1859 "
236420,2011-06-22,"Senate Enrolled "
236420,2011-07-14,"Senate Law Without Signature 7/14/11; Eff. Date 09/12/11, Chapter 0265; Art 44, Pt II, NH Constitution "
236421,2011-01-19,"Senate Introduced and Referred to Energy and Natural Resources, Senate Journal 3, Pg.33 "
236421,2011-01-27,"Senate Hearing: 2/10/2011, Room 102, Legislative Office Building, 10:00 a.m.; Senate Calendar 9 "
236421,2011-02-28,"Senate Committee Report: Ought to Pass with Amendment #2011-0517s, 3/9/11; Senate Calendar 14 "
236421,2011-03-09,"Senate Committee Amendment 0517s, Amendment Adopted, Voice Vote; Senate Journal 8, Pg.88 "
236421,2011-03-09,"Senate Ought to Pass with Amendment 0517s, Motion Adopted, Voice Vote; OT3rdg; Senate Journal 8, Pg.88 "
236421,2011-03-09,"Senate Passed by Third Reading Resolution; Senate Journal 8, Pg.99 "
236421,2011-03-16,"House Introduced and Referred to Science, Technology and Energy; House Journal  28, Pg.882 "
236421,2011-05-04,"House Public Hearing: 5/17/2011 10:15 Amendment Legislative Office Building 304 "
236421,2011-05-04,"House Executive Session: 5/17/2011 1:00 PM Legislative Office Building 304 "
236421,2011-05-18,"House Committee Report: Inexpedient to Legislate for May 25 (Vote 10-6; Regular Calendar); House Calendar 41, PG.1395 "
236421,2011-05-25,"House Inexpedient to Legislate: Motion Adopted Voice Vote; House Journal  46, PG.1597 "
236422,2011-01-19,"Senate Introduced and Referred to Energy and Natural Resources, Senate Journal 3, Pg.33 "
236422,2011-02-17,"Senate Hearing: 2/24/11, Room 102, Legislative Office Building, 9:00 a.m.; Senate Calendar 12 "
236422,2011-02-24,"Senate Committee Report: Ought to Pass, 3/9/11; Senate Calendar 14 "
236422,2011-03-09,"Senate Ought to Pass, Motion Adopted, Voice Vote; OT3rdg; Senate Journal 8, Pg.88 "
236422,2011-03-09,"Senate Passed by Third Reading Resolution; Senate Journal 8, Pg.99 "
236422,2011-03-16,"House Introduced and Referred to Resources, Recreation and Development; House Journal  28, Pg.882 "
236422,2011-03-22,"House ==CANCELLED== Public Hearing: 3/29/2011 11:00 Amendment Legislative Office Building 305 "
236422,2011-03-23,"House ==RESCHEDULED== Public Hearing: 4/5/2011 11:00 Amendment Legislative Office Building 305 "
236422,2011-04-26,"House Executive Session: 5/3/2011 1:00 PM Legislative Office Building 305 "
236422,2011-05-04,"House Committee Report: Ought to Pass for May 18 (Vote 15-0; Consent Calendar); House Calendar 39, PG.1322 "
236422,2011-05-18,"House Ought to Pass: Motion Adopted Voice Vote; House Journal  44, PG.1537 "
236422,2011-06-01,"House Enrolled; House Journal  48, PG.1669 "
236422,2011-06-01,"Senate Enrolled; Senate Journal 20, Pg.547 "
236422,2011-06-07,"Senate Signed by the Governor on 06/07/2011; Effective 06/07/2011; Chapter 0144 "
236423,2011-01-19,"Senate Introduced and Referred to Energy and Natural Resources, Senate Journal 3, Pg.33 "
236423,2011-01-21,"Senate Hearing: === TIME CHANGE === 2/03/11, Room 102, Legislative Office Building, 9:45 a.m.; Senate Calendar 9 "
236423,2011-02-08,"Senate Committee Report: Rereferred to Committee, 2/16/2011; Senate Calendar 11 "
236423,2011-02-16,"Senate Rereferred to Committee, Motion Adopted, Voice Vote, Senate Journal 5, Pg.56 "
236424,2011-01-19,"Senate Introduced and Referred to Commerce, Senate Journal 3, Pg.33 "
236424,2011-01-26,"Senate Hearing: 2/1/2011, Room 102, Legislative Office Building, 9:00 a.m.; Senate Calendar 9 "
236424,2011-02-08,"Senate Committee Report: Ought to Pass, 2/16/2011; Senate Calendar 11 "
236424,2011-02-16,"Senate Ought to Pass Not Voted On, Senate Journal 6, Pg.53 "
236424,2011-02-16,"Senate Sen. Sanborn Moved Laid on Table, Motion Adopted, Voice Vote, Senate Journal 6, Pg.53 "
236424,2011-02-23,"Senate Sen. Sanborn Moved Remove From Table, Motion Adopted, Voice Vote; Senate Journal 7, Pg.66 "
236424,2011-02-23,"Senate Sen. Sanborn Floor Amendment #2011-0472s, Amendment Adopted, Voice Vote; Senate Journal 7, Pg.66 "
236424,2011-02-23,"Senate Ought to Pass with Amendment 0472s, Motion Adopted, Voice Vote; OT3rdg; Senate Journal 7, Pg.66 "
236424,2011-02-23,"Senate Passed by Third Reading Resolution; Senate Journal 7, Pg.77 "
236424,2011-03-16,"House Introduced and Referred to Labor, Industrial and Rehabilitative Services; House Journal  28, Pg.882 "
236424,2011-04-05,"House Public Hearing: 4/12/2011 10:15 Amendment Legislative Office Building 307 "
236424,2011-04-26,"House Full Committee Work Session: 5/3/2011 10:15 Amendment Legislative Office Building 307 "
236424,2011-05-04,"House Full Committee Work Session: 5/10/2011 1:00 PM Legislative Office Building 307 "
236424,2011-05-04,"House ==CANCELLED== Executive Session: 5/10/2011 1:30 PM Legislative Office Building 307 "
236424,2011-05-10,"House Executive Session: 5/24/2011 10:15 Amendment Legislative Office Building 307 "
236424,2011-05-24,"House Retained in Committee "
236424,2011-09-12,"House ==CANCELLED== Retained Bill - Full Committee Work Session: 9/20/2011 2:00 PM Legislative Office Building 307 "
236424,2011-09-13,"House Retained Bill - Full Committee Work Session: 9/21/2011 2:00 PM Legislative Office Building 307 "
236424,2011-09-27,"House Retained Bill - Full Committee Work Session: 10/4/2011 1:00 PM Legislative Office Building 307 "
236424,2011-10-14,"House Retained Bill - Subcommittee Work Session: 10/18/2011 11:00 Amendment Legislative Office Building 304 "
236424,2011-10-14,"House Retained Bill - Executive Session: 10/18/2011 1:00 PM Legislative Office Building 307 ==RECESSED== "
236424,2011-10-18,"House Retained Bill - Subcommittee Work Session: 10/27/2011 11:00 Amendment Legislative Office Building 307 "
236424,2011-10-18,"House ==RECONVENE== Retained Bill - Executive Session: 10/27/2011 1:00 PM Legislative Office Building 307 "
236425,2011-01-19,"Senate Introduced and Referred to Commerce, Senate Journal 3, Pg.33 "
236425,2011-01-26,"Senate Hearing: 2/1/2011, Room 102, Legislative Office Building, 9:25 a.m.; Senate Calendar 9 "
236425,2011-02-02,"Senate Hearing: === RECESSED === 2/1/11, Room 102, Legislative Office Building, 9:25 a.m. "
236425,2011-02-02,"Senate Hearing: === RECONVENE === 2/22/11, Room 102, Legislative Office Building, 9:00 a.m.; Senate Calendar 10 "
236425,2011-02-10,"Senate Hearing: === CANCELLED === 2/22/11, Room 102, Legislative Office Building, 9:00 a.m.; Senate Calendar 11 "
236425,2011-03-10,"Senate Hearing: === RESCHEDULED === 3/22/11, Room 102, Legislative Office Building, 9:00 a.m.; Senate Calendar 15 "
236425,2011-03-17,"Senate Hearing: === ROOM CHANGE === 3/22/11, Room 100, State House, 9:00 a.m.; Senate Calendar 16 "
236425,2011-03-24,"Senate Committee Report: Ought to Pass with Amendment #2011-1183s, 3/30/11; Senate Calendar 17 "
236425,2011-03-30,"Senate Committee Amendment 1183s, Amendment Adopted, Voice Vote; Senate Journal 11, Pg.202 "
236425,2011-03-30,"Senate Ought to Pass with Amendment 1183s, Motion Adopted, Voice Vote; OT3rdg; Senate Journal 11, Pg.202 "
236425,2011-03-30,"Senate Passed by Third Reading Resolution; Senate Journal 11, Pg.239 "
236425,2011-03-31,"House Introduced and Referred to Commerce and Consumer Affairs; House Journal  35, PG.1240  "
236425,2011-04-05,"House Public Hearing: 4/19/2011 2:00 PM Legislative Office Building 302 Banking/Business Div ==Work Session May Follow== "
236425,2011-04-12,"House Executive Session: 4/21/2011 1:15 PM Legislative Office Building 302 "
236425,2011-04-26,"House Committee Report: Ought to Pass with Amendment #1533h for May 4 (Vote 18-0; Consent Calendar); House Calendar 36, PG.1244 "
236425,2011-04-26,"House Proposed Committee Amendment #2011-1533h; House Calendar 36, PG.1270-1274 "
236425,2011-05-04,"House Amendment #1533h Adopted, Voice Vote; House Journal  42, PG.1413-1417 "
236425,2011-05-04,"House Ought to Pass with Amendment #1533h: Motion Adopted Voice Vote; House Journal  42, PG.1413-1417 "
236425,2011-05-04,"House Referred to Judiciary; House Journal  42, PG.1417 "
236425,2011-05-10,"House Public Hearing: 5/17/2011 10:00 Amendment Legislative Office Building 208 "
236425,2011-05-10,"House Executive Session: 5/24/2011 11:00 Amendment Legislative Office Building 208 ==TIME CHANGE (Orig 10:00 Amendment)== "
236425,2011-05-24,"House Committee Report: Ought to Pass with Amendment #1999h for June 1 (Vote 15-0; Consent Calendar); House Calendar 43, PG.1497 "
236425,2011-05-24,"House Proposed Committee Amendment #2011-1999h; House Calendar 43, PG.1513 "
236425,2011-06-01,"House Amendment #1999h Adopted, Voice Vote; House Journal  48, PG.1630-1631 "
236425,2011-06-01,"House Ought to Pass with Amendment #1999h: Motion Adopted Voice Vote; House Journal  48, PG.1630-1631 "
236425,2011-06-08,"Senate Sen. Prescott Moved Nonconcur with House Amendment #1533, 1999h; Requests C of C, Motion Adopted, Voice Vote; Senate Journal 20, Pg.548 "
236425,2011-06-08,"Senate President Appoints: Senators Bradley, White and DAllesandro; Senate Journal 20, Pg.548 "
236425,2011-06-08,"House House Accedes to Senate Request for C of C (Reps Hunt and Rowe): Motion Adopted Voice Vote; House Journal  51, PG.1723 "
236425,2011-06-08,"House Speaker Appoints: Reps Hunt, Jennifer Coffey, McClarren, and Schlachman; House Journal  51, PG.1723 "
236425,2011-06-09,"Senate Committee of Conference Meeting: 6/13/2011, 10:00 a.m., Room 102, Legislative Office Building "
236425,2011-06-15,"House Conference Committee Report #2011-2376c, House Amendment + New Amendment, Filed; House Calendar 49, PG.1674 "
236425,2011-06-22,"House Conference Committee Report #2376c Adopted, Voice Vote; House Journal  57, PG.1805 "
236425,2011-06-22,"Senate Conference Committee Report 2376c; Adopted, Voice Vote "
236425,2011-06-22,"House Enrolled Bill Amendment #2530e Adopted; House Journal  57, PG.1859 "
236425,2011-06-22,"Senate Enrolled Bill Amendment #2011-2530e Adopted, Voice Vote "
236425,2011-06-22,"House Enrolled; House Journal  57, PG.1860 "
236425,2011-06-22,"Senate Enrolled "
236425,2011-07-13,"Senate Signed by the Governor on 07/13/2011; Effective 09/11/2011; Chapter 0243 "
236426,2011-01-19,"Senate Introduced and Referred to Health and Human Services, Senate Journal 3, Pg.33 "
236426,2011-01-21,"Senate Hearing: 2/03/11, Room 102, Legislative Office Building, 1:00 p.m. "
236426,2011-03-11,"Senate Committee Report: Ought to Pass with Amendment #2011-0793s, New Title, 3/23/11; Senate Calendar 16 "
236426,2011-03-23,"Senate Committee Amendment 0793s, New Title, Amendment Adopted, Voice Vote; Senate Journal 10, Pg.182 "
236426,2011-03-23,"Senate Ought to Pass with Amendment 0793s, New Title, Motion Adopted, Voice Vote; OT3rdg; Senate Journal 10, Pg.182 "
236426,2011-03-23,"Senate Passed by Third Reading Resolution; Senate Journal 10, Pg.187 "
236426,2011-03-28,"House Introduced and Referred to Health, Human Services and Elderly Affairs; House Journal  30, PG.1036  "
236426,2011-03-29,"House Public Hearing: 4/5/2011 9:30 Amendment Legislative Office Building 205 "
236426,2011-04-05,"House Subcommittee Work Session: 4/12/2011 10:00 Amendment Legislative Office Building 205 "
236426,2011-04-14,"House Subcommittee Work Session: 4/19/2011 11:30 Amendment Legislative Office Building 205 "
236426,2011-04-14,"House Executive Session: 4/26/2011 10:30 Amendment Legislative Office Building 205 "
236426,2011-04-26,"House Committee Report: Ought to Pass with Amendment #1452h(NT) for May 4 (Vote 16-0; Consent Calendar); House Calendar 36, PG.1245 "
236426,2011-04-26,"House Proposed Committee Amendment #2011-1452h (New Title); House Calendar 36, PG.1274-1275 "
236426,2011-05-04,"House Amendment #1452h(NT) Adopted, Voice Vote; House Journal  42, PG.1419 "
236426,2011-05-04,"House Ought to Pass with Amendment #1452h(NT): Motion Adopted Voice Vote; House Journal  42, PG.1419 "
236426,2011-05-04,"House Referred to Criminal Justice and Public Safety; House Journal  42, PG.1419 "
236426,2011-05-10,"House Public Hearing: 5/17/2011 10:00 Amendment Legislative Office Building 204 "
236426,2011-05-10,"House Executive Session: 5/17/2011 1:00 PM Legislative Office Building 204 "
236426,2011-05-17,"House Committee Report: Ought to Pass for May 25 (Vote 14-0; Consent Calendar); House Calendar 41, PG.1391 "
236426,2011-05-25,"House Removed from Consent Calendar (Rep Blankenbeker); House Journal  46, PG.1579 "
236426,2011-05-25,"House Ought to Pass: Motion Adopted Regular Calendar 350-28; House Journal  46, PG.1598-1600 "
236426,2011-06-08,"Senate Sen. Bradley Concurs with House Amendment #1452h, New Title, Motion Adopted, Voice Vote; Senate Journal 20, Pg.551 "
236426,2011-06-08,"House Enrolled Bill Amendment #2516e Adopted; House Journal  51, PG.1728 "
236426,2011-06-22,"Senate Enrolled Bill Amendment #2011-2516e Adopted "
236426,2011-06-22,"House Enrolled; House Journal  57, PG.1859 "
236426,2011-06-22,"Senate Enrolled "
236426,2011-07-05,"Senate Signed by the Governor on 07/05/2011; Effective 09/03/2011; Chapter 0235 "
236427,2011-01-19,"Senate Introduced and Referred to Judiciary, Senate Journal 3, Pg.33 "
236427,2011-02-15,"Senate Hearing: 2/24/11, Room 101, Legislative Office Building, 2:30 p.m.; Senate Calendar 12 "
236427,2011-03-11,"Senate Committee Report: Ought to Pass with Amendment #2011-0804s, 3/16/2011; Senate Calendar 15A "
236427,2011-03-16,"Senate Committee Amendment 0804s, Amendment Adopted, Voice Vote; Senate Journal 9, Pg.138 "
236427,2011-03-16,"Senate Ought to Pass with Amendment 0804s, Motion Adopted, Voice Vote; Refer to Finance Rule 4-3; Senate Journal 9, Pg.138 "
236427,2011-03-24,"Senate Committee Report: Ought to Pass with Amendment #2011-1177s, 3/30/11; Senate Calendar 17 "
236427,2011-03-30,"Senate Committee Amendment 1177s, Amendment Adopted, Voice Vote; Senate Journal 11, Pg.222 "
236427,2011-03-30,"Senate Ought to Pass with Amendment 1177s, Regular Calendar 24Y-0N, Motion Adopted; OT3rdg; Senate Journal 11, Pg.222 "
236427,2011-03-30,"Senate Passed by Third Reading Resolution; Senate Journal 11, Pg.239 "
236427,2011-03-31,"House Introduced and Referred to Criminal Justice and Public Safety; House Journal  35, PG.1240 "
236427,2011-04-05,"House Public Hearing: 4/12/2011 10:00 Amendment Legislative Office Building 204 "
236427,2011-04-07,"House ==CANCELLED== Executive Session: 4/14/2011 1:00 PM Legislative Office Building 204 "
236427,2011-04-15,"House Full Committee Work Session: 4/26/2011 1:00 PM Legislative Office Building 204 "
236427,2011-04-26,"House Subcommittee Work Session: 5/3/2011 1:00 PM Legislative Office Building 204 "
236427,2011-05-10,"House Subcommittee Work Session: 5/17/2011 12:45 PM Legislative Office Building 204 "
236427,2011-05-10,"House Executive Session: 5/17/2011 1:00 PM Legislative Office Building 204 "
236427,2011-05-17,"House Committee Report: Ought to Pass with Amendment #1722h(NT) for May 25 (Vote 14-0; Regular Calendar); House Calendar 41, PG.1394 "
236427,2011-05-17,"House Proposed Committee Amendment #2011-1722h (New Title); House Calendar 41, PG.1406-1407 "
236427,2011-05-25,"House Amendment #1722h(NT) Adopted, Voice Vote; House Journal  46, PG.1590-1591 "
236427,2011-05-25,"House Ought to Pass with Amendment #1722h(New Title): Motion Adopted Voice Vote; House Journal  46, PG.1590-1591 "
236427,2011-06-08,"Senate Sen. Houde Moved Nonconcur with House Amendment 1722h; New Title, Requests C of C, Motion Adopted, Voice Vote; Senate Journal 20, Pg.549 "
236427,2011-06-08,"Senate President Appoints: Senators Groen, Luther and Houde; Senate Journal 20, Pg.549 "
236427,2011-06-08,"House House Accedes to Senate Request for C of C (Rep Swinford): Motion Adopted Voice Vote; House Journal  51, PG.1723 "
236427,2011-06-08,"House Speaker Appoints: Reps Welch, Kreis, Gagne, and Shurtleff; House Journal  51, PG.1723 "
236427,2011-06-09,"Senate Committee of Conference Meeting: == RECESSED === 6/14/2011, 1:00 p.m., Room 101, Legislative Office Building "
236427,2011-06-14,"Senate C of C Meeting: == RECONVENE === 6/15/2011, 2:30 p.m., Room 101, Legislative Office Building "
236427,2011-06-15,"House Conferee Change: Rep Bettencourt Replaces Rep Welch; House Journal  51, PG.1727 "
236427,2011-06-16,"House Conferee Change: Rep Swinford Replaces Rep Shurtleff; House Journal  51, PG.1727 "
236427,2011-06-16,"House Conference Committee Report #2011-2486c, Senate Amendment, Filed; House Calendar 49, PG.1674 "
236427,2011-06-22,"House Conference Committee Report #2486c Adopted, Regular Calendar 270-100; House Journal  57, PG.1805-1807 "
236427,2011-06-22,"Senate Conference Committee Report 2486c; Adopted, Voice Vote "
236427,2011-06-22,"Senate Enrolled Bill Amendment #2011-2526e Adopted, Voice Vote "
236427,2011-06-22,"House Enrolled Bill Amendment #2526e Adopted; House Journal  57, PG.1858 "
236427,2011-06-22,"House Enrolled; House Journal  57, PG.1860 "
236427,2011-06-22,"Senate Enrolled "
236427,2011-07-13,"Senate Signed by the Governor on 07/13/2011; Effective 07/13/2011; Chapter 0244 "
236428,2011-01-19,"Senate Introduced and Referred to Commerce, Senate Journal 3, Pg.33 "
236428,2011-01-26,"Senate Hearing: 2/1/2011, Room 102, Legislative Office Building, 9:50 a.m.; Senate Calendar 9 "
236428,2011-03-24,"Senate Committee Report: Rereferred to Committee, 3/30/11; Senate Calendar 17 "
236428,2011-03-30,"Senate Without Objection, President Bragdon moved to Special Order SB 54 to after lunch; Senate Journal 11, Pg.195 "
236428,2011-03-30,"Senate Committee Report: Rereferred to Committee, 3/30/11 "
236428,2011-03-30,"Senate Rereferred to Committee, Motion Failed, Voice Vote; Senate Journal 11, Pg.234 "
236428,2011-03-30,"Senate Sen. De Blois moved Ought to Pass; Senate Journal 11, Pg.234 "
236428,2011-03-30,"Senate Sen. De Blois Floor Amendment #2011-1311s, New Title, Amendment Adopted, Voice Vote; Senate Journal 11, Pg.235 "
236428,2011-03-30,"Senate Ought to Pass with Amendment 1311s, New Title, Motion Adopted, Voice Vote; OT3rdg; Senate Journal 11, Pg.235 "
236428,2011-03-30,"Senate Passed by Third Reading Resolution; Senate Journal 11, Pg.239 "
236428,2011-03-31,"House Introduced and Referred to Commerce and Consumer Affairs; House Journal  35, PG.1240  "
236428,2011-04-05,"House Public Hearing: 4/19/2011 10:45 Amendment Legislative Office Building 302 Banking/Business Div ==Work Session May Follow== "
236428,2011-04-12,"House Executive Session: 4/21/2011 1:15 PM Legislative Office Building 302 "
236428,2011-04-21,"House Committee Report: Ought to Pass for April 27 (Vote 17-0; Consent Calendar); House Calendar 33, PG.1066 "
236428,2011-04-27,"House Ought to Pass: Motion Adopted Voice Vote; House Journal  40, PG.1352 "
236428,2011-04-27,"House Referred to Judiciary; House Journal  40, PG.1352 "
236428,2011-05-03,"House Public Hearing: 5/10/2011 11:00 Amendment Legislative Office Building 208 ==Executive Session To Follow== "
236428,2011-05-11,"House Committee Report: Ought to Pass for May 18 (Vote 13-0; Consent Calendar); House Calendar 39, PG.1320-1321 "
236428,2011-05-18,"House Ought to Pass: Motion Adopted Voice Vote; House Journal  44, PG.1534 "
236428,2011-06-01,"House Enrolled; House Journal  48, PG.1669 "
236428,2011-06-01,"Senate Enrolled; Senate Journal 20, Pg.547 "
236428,2011-06-08,"Senate Signed by the Governor on 06/08/11; Chapter 0156"
236429,2011-01-19,"Senate Introduced and Referred to Energy and Natural Resources, Senate Journal 3, Pg.33 "
236429,2011-01-27,"Senate Hearing: 2/10/2011, Room 102, Legislative Office Building, 10:15 a.m.; Senate Calendar 9 "
236429,2011-02-17,"Senate Committee Report: Ought to Pass, 2/23/11; Senate Calendar 12 "
236429,2011-02-23,"Senate Ought to Pass, Motion Adopted, Voice Vote; OT3rdg; Senate Journal 7, Pg.69 "
236429,2011-02-23,"Senate Passed by Third Reading Resolution; Senate Journal 7, Pg.77 "
236429,2011-03-16,"House Introduced and Referred to Science, Technology and Energy; House Journal  28, Pg.882 "
236429,2011-03-29,"House Public Hearing: 4/5/2011 1:00 PM Legislative Office Building 304 "
236429,2011-05-04,"House Executive Session: 5/17/2011 1:00 PM Legislative Office Building 304 "
236429,2011-05-18,"House Committee Report: Inexpedient to Legislate for May 25 (Vote 8-7; Regular Calendar); House Calendar 41, PG.1395 "
236429,2011-05-25,"House Lay on the Table (Rep Cali-Pitts): Motion Adopted Division Vote 303-70; House Journal  46, PG.1597-1598 "
236430,2011-01-19,"Senate Introduced and Referred to Commerce, Senate Journal 3, Pg.33 "
236430,2011-01-26,"Senate Hearing: 2/1/2011, Room 102, Legislative Office Building, 10:15 a.m.; Senate Calendar 9 "
236430,2011-02-23,"Senate Committee Report: Ought to Pass with Amendment #2011-0451s, 3/9/11; Senate Calendar 14 "
236430,2011-03-09,"Senate Committee Amendment 0451s, Amendment Adopted, Voice Vote; Senate Journal 8, Pg.84 "
236430,2011-03-09,"Senate Ought to Pass with Amendment 0451s, Regular Calendar 17Y-6N, Motion Adopted; OT3rdg; Senate Journal 8, Pg.84 "
236430,2011-03-09,"Senate Passed by Third Reading Resolution; Senate Journal 8, Pg.99 "
236430,2011-03-16,"House Introduced and Referred to Commerce and Consumer Affairs; House Journal  28, Pg.882 "
236430,2011-03-22,"House Public Hearing: 4/12/2011 10:30 Amendment Legislative Office Building 302 ==Work Session May Follow== "
236430,2011-04-12,"House Subcommittee Work Session: 4/21/2011 10:00 Amendment Legislative Office Building 302 Banking/Business Div "
236430,2011-04-12,"House Executive Session: 4/21/2011 1:15 PM Legislative Office Building 302 "
236430,2011-04-21,"House Majority Committee Report: Ought to Pass for April 27 (Vote 16-2; Regular Calendar); House Calendar 33, PG.1069 "
236430,2011-04-21,"House Minority Committee Report: Inexpedient to Legislate; House Calendar 33, PG.1069 "
236430,2011-04-27,"House Floor Amendment #2011-1549h(NT) (Rep Vaillancourt) Failed, Regular Calendar 134-213; House Journal  40, PG.1355-1359 "
236430,2011-04-27,"House Ought to Pass: Motion Adopted Regular Calendar 180-171; House Journal  40, PG.1355-1361 "
236430,2011-04-27,"House Reconsideration (Rep Hunt): Motion Failed Voice Vote; House Journal  40, PG.1372 "
236430,2011-05-04,"House Enrolled; House Journal  42, PG.1490 "
236430,2011-05-04,"Senate Enrolled; Senate Journal 16, Pg.318 "
236430,2011-07-06,"Senate Vetoed by Governor 07/06/2011, Senate Calendar 32 "
236430,2011-09-07,"Senate Notwithstanding the Governors Veto, Shall SB 57 Become Law: Regular Calendar 17Y-7N, Veto Overridden by required two-thirds vote; Senate Journal 22, Pg.737 "
236431,2011-01-19,"Senate Introduced and Referred to Ways & Means, Senate Journal 3, Pg.33 "
236431,2011-01-26,"Senate Hearing: 2/1/2011, Room 100, State House, 1:15 p.m.; Senate Calendar 9 "
236431,2011-02-01,"Senate Hearing: === RECESSED === 2/1/11, Room 100, State House, 1:15 p.m. "
236431,2011-02-03,"Senate Hearing: === RECONVENE === 2/8/11, Room 100 State House, 1:00 p.m.; Senate Calendar 10 "
236431,2011-02-09,"Senate Committee Report: Inexpedient to Legislate, 2/16/2011; Senate Calendar 11 "
236431,2011-02-16,"Senate Inexpedient to Legislate, Motion Adopted, Voice Vote === BILL KILLED ===, Senate Journal 6, Pg.60 "
236859,2011-01-19,"House Introduced 1/6/2011 and Referred to Ways and Means; House Journal  11, PG. 177 "
236859,2011-02-01,"House Public Hearing: 2/8/2011 2:00 PM Legislative Office Building 202 "
236859,2011-02-23,"House Executive Session: 2/24/2011 12:30 PM Legislative Office Building 202 "
236859,2011-02-24,"House Committee Report: Inexpedient to Legislate for Mar 15 (Vote 19-0; Consent Calendar); House Calendar 22, PG.543 "
236859,2011-03-15,"House Inexpedient to Legislate: Motion Adopted Voice Vote; House Journal  26, PG.741 "
236860,2011-01-19,"House Introduced 1/6/2011 and Referred to Resources, Recreation and Development; House Journal  11, PG. 177  "
236860,2011-01-26,"House Public Hearing: 2/1/2011 1:00 PM Legislative Office Building 305 "
236860,2011-01-26,"House Executive Session: 2/8/2011 1:00 PM Legislative Office Building 305 "
236860,2011-02-10,"House Majority Committee Report: Inexpedient to Legislate for Feb 15 (Vote 10-5; Regular Calendar); House Calendar 13, PG.236 "
236860,2011-02-10,"House Minority Committee Report: Ought to Pass; House Calendar 13, PG.236 "
236860,2011-02-15,"House Special Order to Feb 16: Motion Adopted Without Objection; House Journal  17, PG.378 "
236860,2011-02-16,"House Inexpedient to Legislate: Motion Adopted Regular Calendar 302-53; House Journal  19, PG.415-418 "
236861,2011-01-19,"House Introduced 1/6/2011 and Referred to Commerce and Consumer Affairs; House Journal  11, PG. 177 "
236861,2011-01-26,"House Public Hearing: 2/3/2011 10:00 Amendment Legislative Office Building 302 "
236861,2011-02-09,"House Executive Session: 2/9/2011 Legislative Office Building 302 Following House Session "
236861,2011-02-10,"House Committee Report: Inexpedient to Legislate for Feb 15 (Vote 13-0; Consent Calendar); House Calendar 13, PG.230 "
236861,2011-02-15,"House Inexpedient to Legislate: Motion Adopted Voice Vote; House Journal  17, PG.357 "
236862,2011-01-19,"House Introduced 1/6/2011 and Referred to Public Works and Highways; House Journal  11, PG. 177 "
236862,2011-01-25,"House Public Hearing: 2/8/2011 11:00 Amendment Legislative Office Building 201 ==Executive Session to Follow== "
236862,2011-02-08,"House Committee Report: Inexpedient to Legislate for Feb 15 (Vote 15-0; Consent Calendar); House Calendar 13, PG.232 "
236862,2011-02-15,"House Inexpedient to Legislate: Motion Adopted Voice Vote; House Journal  17, PG.360 "
236863,2011-01-19,"House Introduced 1/6/2011 and Referred to Municipal and County Government; House Journal  11, PG. 177 "
236863,2011-01-26,"House Public Hearing: 2/3/2011 10:00 Amendment Legislative Office Building 301 "
236863,2011-02-23,"House Executive Session: 2/28/2011 10:30 Amendment Legislative Office Building 301 "
236863,2011-03-02,"House Committee Report: Ought to Pass with Amendment #0521h for Mar 15 (Vote 15-0; Consent Calendar); House Calendar 22, PG.537 "
236863,2011-03-03,"House Proposed Committee Amendment #2011-0521h; House Calendar 23, PG.590 "
236863,2011-03-15,"House Amendment #0521h Adopted, Voice Vote; House Journal  26, PG.731 "
236863,2011-03-15,"House Ought to Pass with Amendment #0521h: Motion Adopted Voice Vote; House Journal  26, PG.731 "
236863,2011-03-30,"Senate Introduced and Referred to Energy and Natural Resources; Senate Journal 12, Pg.243 "
236863,2011-04-14,"Senate Hearing: 4/28/11, Room 102, Legislative Office Building, 9:00 a.m.; Senate Calendar 20 "
236863,2011-04-21,"Senate Hearing: === ROOM CHANGE === 4/28/11, Room 201-203, Legislative Office Building, 9:00 a.m.; Senate Calendar 21 "
236863,2011-05-05,"Senate Committee Report: Ought to Pass with Amendment #2011-1770s, 5/11/11; Senate Calendar 23 "
236863,2011-05-11,"Senate Committee Amendment 1770s, Amendment Adopted, Voice Vote; Senate Journal 16, Pg.322 "
236863,2011-05-11,"Senate Ought to Pass with Amendment 1770s, Motion Adopted, Voice Vote; OT3rdg; Senate Journal 16, Pg.322 "
236863,2011-05-11,"Senate Passed by Third Reading Resolution "
236863,2011-05-25,"House House Concurs with Senate Amendment #1770s (Rep Ferrante): Motion Adopted Voice Vote; House Journal  46, PG.1582 "
236863,2011-06-08,"Senate Enrolled "
236863,2011-06-08,"House Enrolled; House Journal  51, PG.1724 "
236863,2011-06-14,"House Signed By Governor 06/14/2011; Effective 08/13/2011; Chapter 0164 "
236864,2011-01-19,"House Introduced 1/6/2011 and Referred to Fish and Game and Marine Resources; House Journal  11, PG. 177 "
236864,2011-02-01,"House Public Hearing: 2/10/2011 10:00 Amendment Legislative Office Building 307 "
236864,2011-02-22,"House Executive Session: 3/3/2011 10:00 Amendment Legislative Office Building 307 "
236864,2011-03-03,"House Committee Report: Ought to Pass with Amendment #0389h for Mar 15 (Vote 9-0; Regular Calendar); House Calendar 22, PG.555 "
236864,2011-03-03,"House Proposed Committee Amendment #2011-0389h; House Calendar 23, PG.590-591 "
236864,2011-03-16,"House Amendment #0389h Adopted, Voice Vote; House Journal  28, PG.857 "
236864,2011-03-16,"House Ought to Pass with Amendment #0389h: Motion Adopted Voice Vote; House Journal  28, PG.857 "
236864,2011-03-23,"Senate Introduced and Referred to Energy and Natural Resources; Senate Journal 11, Pg.191 "
236864,2011-03-24,"Senate Hearing: 3/31/11, Room 102, Legislative Office Building, 9:00 a.m.; Senate Calendar 17 "
236864,2011-03-31,"Senate Committee Report: Ought to Pass, 4/13/11; Senate Calendar 19 "
236864,2011-04-13,"Senate Ought to Pass, Motion Adopted, Voice Vote; OT3rdg; Senate Journal 12, Pg.248 "
236864,2011-04-13,"Senate Passed by Third Reading Resolution; Senate Journal 12, Pg.254 "
236864,2011-04-27,"House Enrolled; House Journal  40, PG.1386 "
236864,2011-04-27,"Senate Enrolled; Senate Journal 15, Pg.293 "
236864,2011-05-11,"House Signed by Governor 05/09/2011; Effective 01/01/2012; Chapter 0046 "
236865,2011-01-19,"House Introduced 1/6/2011 and Referred to Criminal Justice and Public Safety; House Journal  11, PG. 177 "
236865,2011-02-16,"House Public Hearing: 3/3/2011 10:00 Amendment Legislative Office Building 204 "
236865,2011-03-02,"House Executive Session: 3/9/2011 10:00 Amendment Legislative Office Building 204 "
236865,2011-03-09,"House Committee Report: Inexpedient to Legislate for Mar 15 (Vote 11-6; Regular Calendar); House Calendar 22, PG.548 "
236865,2011-03-15,"House Inexpedient to Legislate: Motion Adopted Voice Vote; House Journal  26, PG.762 "
236866,2011-01-19,"House Introduced 1/6/2011 and Referred to Special Committee on Education Funding Reform; House Journal  11, PG. 177  "
236866,2011-01-25,"House Public Hearing: 2/4/2011 11:45 Amendment Legislative Office Building 207 "
236866,2011-02-01,"House Executive Session: 2/11/2011 9:00 Amendment Legislative Office Building 207 "
236866,2011-02-16,"House Committee Report: Inexpedient to Legislate for Feb 23 (Vote 11-2; Regular Calendar); House Calendar 15, PG.278 "
236866,2011-02-23,"House Inexpedient to Legislate: Motion Adopted Voice Vote; House Journal  21, PG.494 "
236867,2011-01-19,"House Introduced 1/6/2011 and Referred to Ways and Means; House Journal  11, PG. 177 "
236867,2011-01-26,"House Public Hearing: 2/3/2011 1:00 PM Legislative Office Building 202 "
236867,2011-02-15,"House Executive Session: 2/16/2011 Legislative Office Building 202 Following House Session "
236867,2011-02-16,"House Committee Report: Ought to Pass with Amendment #0379h for Feb 23 (Vote 18-0; Consent Calendar); House Calendar 15, PG.274 "
236867,2011-02-16,"House Proposed Committee Amendment #2011-0379h; House Calendar 15, PG.299 "
236867,2011-02-23,"House Amendment #0379h Adopted, Voice Vote; House Journal  21, PG.465 "
236867,2011-02-23,"House Ought to Pass with Amendment #0379h: Motion Adopted Voice Vote; House Journal  21, PG.465 "
236867,2011-03-09,"Senate Introduced and Referred to Ways & Means; Senate Journal 9, Pg.102 "
236867,2011-04-14,"Senate Hearing: 4/19/11, Room 100, State House, 1:30 p.m.; Senate Calendar 20 "
236867,2011-04-26,"Senate Committee Report: Inexpedient to Legislate, 5/4/11; Senate Calendar 22 "
236867,2011-05-04,"Senate Inexpedient to Legislate, Motion Adopted, Voice Vote === BILL KILLED ===; Senate Journal 15, Pg.310 "
236868,2011-01-19,"House Introduced 1/6/2011 and Referred to Criminal Justice and Public Safety; House Journal  11, PG. 177 "
236868,2011-02-16,"House Public Hearing: 3/3/2011 10:01 Amendment Legislative Office Building 204 "
236868,2011-03-02,"House Executive Session: 3/9/2011 10:00 Amendment Legislative Office Building 204 "
236868,2011-03-10,"House Committee Report: Ought to Pass for Mar 15 (Vote 9-8; Regular Calendar); House Calendar 22, PG.548 "
236868,2011-03-15,"House Ought to Pass: Motion Adopted Regular Calendar 270-92; House Journal  26, PG.762-764 "
236868,2011-03-23,"Senate Introduced and Referred to Judiciary; Senate Journal 11, Pg.191 "
236868,2011-03-31,"Senate Hearing: 4/7/11, Room 101, Legislative Office Building, 1:15 p.m.; Senate Calendar 18 "
236868,2011-05-05,"Senate Committee Report: Ought to Pass with Amendment #2011-1780s, 5/11/11; Senate Calendar 23 "
236868,2011-05-11,"Senate Committee Amendment 1780s, Amendment Adopted, Voice Vote; Senate Journal 16, Pg.333 "
236868,2011-05-11,"Senate Ought to Pass with Amendment 1780s, Motion Failed, Voice Vote; Senate Journal 16, Pg.333 "
236868,2011-05-11,"Senate Sen. Luther moved to Rereferred to Committee, Motion Adopted, Voice Vote; Senate Journal 16, Pg.333 "
236869,2011-01-19,"House Introduced 1/6/2011 and Referred to Executive Departments and Administration; House Journal  11, PG. 177 "
236869,2011-01-25,"House Public Hearing: 2/1/2011 10:30 Amendment Legislative Office Building 306 "
236869,2011-02-03,"House Subcommittee Work Session: 2/8/2011 2:30 PM Legislative Office Building 306 "
236869,2011-02-23,"House Executive Session: 3/2/2011 2:00 PM or 45 mins after House session Legislative Office Building 306 "
236869,2011-03-10,"House Committee Report: Ought to Pass with Amendment #0611h for Mar 15 (Vote 16-0; Consent Calendar); House Calendar 22, PG.530 "
236869,2011-03-10,"House Proposed Committee Amendment #2011-0611h; House Calendar 23, PG.591 "
236869,2011-03-15,"House Amendment #0611h Adopted, Voice Vote; House Journal  26, PG.710 "
236869,2011-03-15,"House Ought to Pass with Amendment #0611h: Motion Adopted Voice Vote; House Journal  26, PG.710 "
236869,2011-03-23,"Senate Introduced and Referred to Executive Departments and Administration; Senate Journal 11, Pg.191 "
236869,2011-04-27,"Senate Hearing: 5/5/11, Room 100, State House, 9:00 a.m.; Senate Calendar 22 "
236869,2011-05-05,"Senate Committee Report: Ought to Pass, 5/11/11; Senate Calendar 23 "
236869,2011-05-11,"Senate Ought to Pass, Motion Adopted, Voice Vote; OT3rdg; Senate Journal 16, Pg.326 "
236869,2011-05-11,"Senate Passed by Third Reading Resolution "
236869,2011-05-18,"Senate Enrolled; Senate Journal 18, Pg.364 "
236869,2011-05-18,"House Enrolled; House Journal  44, PG.1564 "
236869,2011-06-01,"House Signed By Governor 05/31/2011; Effective 07/30/2011; Chapter 0107 "
236870,2011-01-19,"House Introduced 1/6/2011 and Referred to Election Law; House Journal  11, PG.177 "
236870,2011-01-26,"House Public Hearing: 2/1/2011 1:00 PM Legislative Office Building 308 "
236870,2011-03-02,"House Executive Session: 3/9/2011 10:30 Amendment Legislative Office Building 308 "
236870,2011-03-09,"House Retained in Committee; House Calendar 27, PG.823 "
236870,2011-09-27,"House Retained Bill - Subcommittee Work Session: 10/6/2011 1:00 PM Legislative Office Building 308 "
236870,2011-10-19,"House Retained Bill - Executive Session: 10/27/2011 Legislative Office Building 308 1:00 PM or Immediately Following Public Hearing "
236871,2011-01-19,"House Introduced 1/6/2011 and Referred to Ways and Means; House Journal  11, PG. 177 "
236871,2011-02-01,"House Public Hearing: 2/10/2011 10:00 Amendment Legislative Office Building 202 "
236871,2011-02-23,"House Executive Session: 2/24/2011 12:30 PM Legislative Office Building 202 "
236871,2011-02-24,"House Majority Committee Report: Ought to Pass with Amendment #0355h for Mar 15 (Vote 14-5; Regular Calendar); House Calendar 22, PG.571 "
236871,2011-02-24,"House Proposed Majority Committee Amendment #2011-0355h; House Calendar 23, PG.591-592 "
236871,2011-02-24,"House Minority Committee Report: Inexpedient to Legislate; House Calendar 22, PG.571 "
236871,2011-03-17,"House Amendment #0355h Adopted, Voice Vote; House Journal  30, PG.1005-1006 "
236871,2011-03-17,"House Ought to Pass with Amendment #0355h: Motion Adopted Regular Calendar 233-75; House Journal  30, PG.1005-1008 "
236871,2011-03-17,"House Lay on the Table (Rep Stepanek): Motion Adopted Regular Calendar 194-118; House Journal  30, PG.1008-1010 "
236872,2011-01-19,"House Introduced 1/6/2011 and Referred to Health, Human Services and Elderly Affairs; House Journal  11, PG. 177 "
236872,2011-01-25,"House Public Hearing: 2/1/2011 2:45 PM Legislative Office Building 205 "
236872,2011-01-26,"House ===CANCELLED=== Public Hearing: 2/8/2011 2:45 PM Legislative Office Building 205 "
236872,2011-03-01,"House Executive Session: 3/9/2011 10:00 Amendment Legislative Office Building 205 "
236872,2011-03-09,"House Committee Report: Inexpedient to Legislate for Mar 15 (Vote 17-0; Consent Calendar); House Calendar 22, PG.532 "
236872,2011-03-15,"House Inexpedient to Legislate: Motion Adopted Voice Vote; House Journal  26, PG.716 "
236873,2011-01-19,"House Introduced 1/6/2011 and Referred to Ways and Means; House Journal  11, PG. 177 "
236873,2011-02-01,"House Public Hearing: 2/8/2011 2:30 PM Legislative Office Building 202 ==Executive Session to Follow== "
236873,2011-02-08,"House Committee Report: Inexpedient to Legislate for Feb 15 (Vote 18-0; Consent Calendar); House Calendar 13, PG.233 "
236873,2011-02-15,"House Inexpedient to Legislate: Motion Adopted Voice Vote; House Journal  17, PG.361 "
236874,2011-01-19,"House Introduced 1/6/2011 and Referred to Special Committee on Education Funding Reform; House Journal  11, PG. 177 "
236874,2011-01-25,"House Public Hearing: 2/4/2011 9:15 Amendment Legislative Office Building 207 "
236874,2011-02-01,"House Executive Session: 2/11/2011 9:00 Amendment Legislative Office Building 207 "
236874,2011-02-16,"House Committee Report: Ought to Pass with Amendment #0207h for Feb 23 (Vote 13-0; Consent Calendar); House Calendar 15, PG.273 "
236874,2011-02-16,"House Proposed Committee Amendment #2011-0207h; House Calendar 15, PG.299-300 "
236874,2011-02-23,"House Amendment #0207h Adopted, Voice Vote; House Journal  21, PG.463-464 "
236874,2011-02-23,"House Ought to Pass with Amendment #0207h: Motion Adopted Voice Vote; House Journal  21, PG.463-464 "
236874,2011-02-23,"Senate Introduced and Referred to Education; Senate Journal 8, Pg.81 "
236874,2011-03-09,"Senate Hearing: 3/22/11, Room 103, Legislative Office Building, 1:40 p.m.; Senate Calendar 15 "
236874,2011-03-17,"Senate Hearing: === CANCELLED === 3/22/11, Room 103, Legislative Office Building, 1:40 p.m.; Senate Calendar 16 "
236874,2011-04-22,"Senate Hearing: === RESCHEDULED === 4/26/11, Room 103, Legislative Office Building, 1:20 p.m.; Senate Calendar 21 "
236874,2011-04-28,"Senate Committee Report: Ought to Pass, 5/4/11; Senate Calendar 22 "
236874,2011-05-04,"Senate Ought to Pass, Motion Adopted, Voice Vote; OT3rdg; Senate Journal 15, Pg.299 "
236874,2011-05-04,"Senate Passed by Third Reading Resolution; Senate Journal 15, Pg.312 "
236874,2011-05-18,"Senate Enrolled; Senate Journal 18, Pg.364 "
236874,2011-05-18,"House Enrolled; House Journal  44, PG.1564 "
236874,2011-06-01,"House Signed By Governor 05/31/2011; Effective 07/30/2011; Chapter 0108 "
236875,2011-01-19,"House Introduced 1/6/2011 and Referred to Criminal Justice and Public Safety; House Journal  11, PG. 177 "
236875,2011-02-09,"House Public Hearing: 2/17/2011 2:00 PM Legislative Office Building 204 "
236875,2011-02-16,"House Executive Session: 2/22/2011 10:00 Amendment Legislative Office Building 204 "
236875,2011-02-23,"House Retained in Committee; House Calendar 27, PG.823 "
236875,2011-09-07,"House Retained Bill - Subcommittee Work Session: 9/20/2011 10:00 Amendment Legislative Office Building 204 "
236875,2011-09-27,"House Retained Bill - Executive Session: 10/20/2011 10:00 Amendment Legislative Office Building 204 ==RECESSED== "
236875,2011-10-20,"House Retained Bill - Continued Executive Session: 10/25/2011 10:00 Amendment Legislative Office Building 204 "
236875,2011-10-26,"House Committee Report: Ought to Pass with Amendment #2781h(NT) for Jan 4 (Vote 12-4; Regular Calendar) "
236875,2011-10-26,"House Proposed Committee Amendment #2011-2781h (New Title) "
236876,2011-01-19,"House Introduced 1/6/2011 and Referred to Transportation; House Journal  11, PG. 177 "
236876,2011-01-25,"House Public Hearing: 2/1/2011 1:00 PM Legislative Office Building 203 "
236876,2011-02-16,"House Executive Session: 2/16/2011 1:45 PM Legislative Office Building 203 "
236876,2011-02-22,"House Majority Committee Report: Ought to Pass for Mar 15 (Vote 11-5; Regular Calendar); House Calendar 22, PG.569 "
236876,2011-02-22,"House Minority Committee Report: Inexpedient to Legislate; House Calendar 22, PG.569 "
236876,2011-03-17,"House Ought to Pass: Motion Adopted Regular Calendar 190-119; House Journal  30, PG.989-991 "
236876,2011-03-23,"Senate Introduced and Referred to Transportation; Senate Journal 11, Pg.191 "
236876,2011-03-24,"Senate Hearing: 3/31/11, Room 103, Legislative Office Building, 11:00 a.m.; Senate Calendar 17 "
236876,2011-05-05,"Senate Committee Report: Ought to Pass with Amendment #2011-1773s, New Title, 5/11/11; Senate Calendar 23 "
236876,2011-05-11,"Senate Committee Amendment 1773s, New Title, Regular Calendar 15Y-9N, Amendment Adopted; Senate Journal 16 "
236876,2011-05-11,"Senate Sen. Lambert Floor Amendment #2011-1856s, Regular Calendar 9Y-15N, Amendment Failed; Senate Journal 16 "
236876,2011-05-11,"Senate Ought to Pass with Amendment 1773s, New Title, Regular Calendar 16Y-8N, Motion Adopted; OT3rdg; Senate Journal 16 "
236876,2011-05-11,"Senate Passed by Third Reading Resolution; Senate Journal 16 "
236876,2011-06-01,"House House Concurs with Senate Amendment #1773s(NT) (Rep Packard): Motion Adopted Voice Vote; House Journal  48, PG.1641 "
236876,2011-06-08,"Senate Enrolled "
236876,2011-06-08,"House Enrolled; House Journal  51, PG.1726 "
236876,2011-06-16,"House Vetoed By Governor 06/15/2011; House Calendar 49, PG.1681 "
236877,2011-01-19,"House Introduced 1/6/2011 and Referred to Education; House Journal  11, PG. 177 "
236877,2011-02-09,"House Public Hearing: 2/22/2011 10:30 Amendment Legislative Office Building 207 "
236877,2011-02-18,"House Executive Session: 3/3/2011 10:00 Amendment Legislative Office Building 207 "
236877,2011-03-04,"House Retained in Committee; House Calendar 27, PG.823 "
236877,2011-06-21,"House Retained Bill - Subcommittee Work Session: 6/22/2011 Legislative Office Building 207 During Session Lunch Break "
236877,2011-08-24,"House Retained Bill - Subcommittee Work Session: 9/6/2011 9:00 Amendment Legislative Office Building 207 "
236877,2011-08-24,"House Retained Bill - Subcommittee Work Session: 9/13/2011 9:00 Amendment Legislative Office Building 207 "
236877,2011-09-14,"House Retained Bill - Subcommittee Work Session: 9/20/2011 9:00 Amendment Legislative Office Building 205 "
236877,2011-09-20,"House Retained Bill - Subcommittee Work Session: 10/4/2011 9:00 Amendment Legislative Office Building 207 "
236877,2011-10-05,"House Retained Bill - Subcommittee Work Session: 10/11/2011 9:00 Amendment Legislative Office Building 207 "
236877,2011-10-11,"House Retained Bill - Subcommittee Work Session: 10/18/2011 8:30 Amendment Legislative Office Building 207 "
236877,2011-10-11,"House Retained Bill - Executive Session: 10/18/2011 10:00 Amendment Legislative Office Building 207 (If Necessary Continued 10/25/2011 10:00 Amendment Legislative Office Building 207) "
236878,2011-01-19,"House Introduced 1/6/2011 and Referred to Education; House Journal  11, PG. 177 "
236878,2011-02-09,"House Public Hearing: 2/15/2011 3:00 PM Legislative Office Building 207 "
236878,2011-02-18,"House Executive Session: 3/3/2011 10:00 Amendment Legislative Office Building 207 "
236878,2011-03-08,"House Committee Report: Inexpedient to Legislate for Mar 15 (Vote 16-0; Consent Calendar); House Calendar 22, PG.527 "
236878,2011-03-15,"House Inexpedient to Legislate: Motion Adopted Voice Vote; House Journal  26, PG.706 "
236879,2011-01-19,"House Introduced 1/6/2011 and Referred to Resources, Recreation and Development; House Journal  11, PG. 177 "
236879,2011-01-26,"House Public Hearing: 2/1/2011 2:00 PM Legislative Office Building 305 "
236879,2011-01-26,"House Executive Session: 2/8/2011 1:00 PM Legislative Office Building 305 "
236879,2011-02-09,"House Retained in Committee; House Calendar 27, PG.825 "
236879,2011-07-26,"House Retained Bill - Full Committee Work Session: 8/9/2011 10:00 Amendment Legislative Office Building 305 "
236879,2011-09-13,"House Retained Bill - Subcommittee Work Session: 10/4/2011 10:30 Amendment Legislative Office Building 305 "
236879,2011-09-13,"House Retained Bill - Executive Session: 10/25/2011 10:00 Amendment Legislative Office Building 305 "
236880,2011-01-19,"House Introduced 1/6/2011 and Referred to Executive Departments and Administration; House Journal  11, PG. 177 "
236880,2011-01-25,"House Public Hearing: 2/1/2011 1:00 PM Legislative Office Building 306 "
236880,2011-02-03,"House Subcommittee Work Session: 2/8/2011 2:30 PM Legislative Office Building 306 "
236880,2011-02-14,"House Executive Session: 2/16/2011 Legislative Office Building 306 1:30 PM or 45 minutes following House session "
236880,2011-02-17,"House Committee Report: Inexpedient to Legislate for Feb 23 (Vote 16-0; Consent Calendar); House Calendar 15, PG.268 "
236880,2011-02-23,"House Removed from Consent Calendar (Rep C.McGuire); House Journal  21, PG.456 "
236880,2011-02-23,"House Recommit (Rep C.McGuire): Motion Adopted Voice Vote; House Journal  21, PG.517-518 "
236880,2011-02-24,"House Executive Session: 3/2/2011 Legislative Office Building 306 2:00 PM or 45 Minutes Following House Session "
236880,2011-03-02,"House Retained in Committee; House Calendar 27, PG.823 "
236880,2011-04-20,"House Retained Bill - Subcommittee Work Session: 4/26/2011 10:00 Amendment Legislative Office Building 307 "
236880,2011-06-03,"House Retained Bill - Subcommittee Work Session: 8/2/2011 10:30 Amendment Legislative Office Building 306 "
236880,2011-08-02,"House Retained Bill - Subcommittee Work Session: 9/27/2011 10:30 Amendment Legislative Office Building 306 "
236880,2011-09-27,"House Retained Bill - Subcommittee Work Session: 10/4/2011 10:30 Amendment Legislative Office Building 306 "
236880,2011-09-27,"House Retained Bill - Subcommittee Work Session: 10/18/2011 10:30 Amendment Legislative Office Building 306 "
236880,2011-09-27,"House Retained Bill - Executive Session: 10/27/2011 10:00 Amendment Legislative Office Building 306 (If Necessary Continued 11/1/2011 10:30 Amendment Legislative Office Building 306) "
236881,2011-01-19,"House Introduced 1/6/2011 and Referred to Election Law; House Journal  11, PG.178 "
236881,2011-02-09,"House Public Hearing: 2/24/2011 1:00 PM Representative's Hall "
236881,2011-03-02,"House Executive Session: 3/9/2011 10:30 Amendment Legislative Office Building 308 "
236881,2011-03-10,"House Committee Report: Inexpedient to Legislate for Mar 15 (Vote 18-0; Consent Calendar); House Calendar 22, PG.528 "
236881,2011-03-15,"House Inexpedient to Legislate: Motion Adopted Voice Vote; House Journal  26, PG.707 "
236882,2011-01-19,"House Introduced 1/6/2011 and Referred to Special Committee on Redistricting; House Journal  11, PG.178 "
236882,2011-02-16,"House ==CANCELLED== Public Hearing: 2/25/2011 3:00 PM Legislative Office Building 308 "
236882,2011-03-01,"House Public Hearing: 3/4/2011 3:00 PM Legislative Office Building 308 "
236882,2011-03-10,"House Majority Committee Report: Inexpedient to Legislate for Mar 15 (Vote 11-4; Regular Calendar); House Calendar 22, PG.567-568 "
236882,2011-03-10,"House Minority Committee Report: Ought to Pass; House Calendar 22, PG.567-568 "
236882,2011-03-16,"House Inexpedient to Legislate: Motion Adopted Voice Vote; House Journal  28, PG.948-949 "
236883,2011-01-19,"House Introduced 1/6/2011 and Referred to Criminal Justice and Public Safety; House Journal  11, PG.178 "
236883,2011-02-09,"House Public Hearing: 2/17/2011 10:00 Amendment Legislative Office Building 204 "
236883,2011-02-16,"House Executive Session: 2/22/2011 10:00 Amendment Legislative Office Building 204 "
236883,2011-02-22,"House Committee Report: Inexpedient to Legislate for Mar 2 (Vote 14-2; Consent Calendar); House Calendar 18, PG.386 "
236883,2011-03-02,"House Removed from Consent Calendar (Rep Giuda); House Journal  25, PG.671 "
236883,2011-03-02,"House Recommit (Rep Jasper): Motion Adopted Voice Vote; House Journal  25, PG.688 "
236883,2011-03-02,"House Executive Session: 3/9/2011 10:00 Amendment Legislative Office Building 204 "
236883,2011-03-09,"House Committee Report: Ought to Pass with Amendment #0541h for Mar 15 (Vote 11-5; Regular Calendar); House Calendar 22, PG.548 "
236883,2011-03-09,"House Proposed Committee Amendment #2011-0541h; House Calendar 23, PG.593 "
236883,2011-03-15,"House Amendment #0541h Adopted, Voice Vote; House Journal  26, PG.764 "
236883,2011-03-15,"House Ought to Pass with Amendment #0541h: Motion Adopted Regular Calendar 295-69; House Journal  26, PG.764-766 "
236883,2011-03-30,"Senate Introduced and Referred to Judiciary; Senate Journal 12, Pg.243 "
236883,2011-04-13,"Senate Hearing: 4/28/11, Room 101, Legislative Office Building, 2:00 p.m.; Senate Calendar 20 "
236883,2011-05-03,"Senate Committee Report: Rereferred to Committee, 5/11/11; Senate Calendar 23 "
236883,2011-05-11,"Senate Rereferred to Committee, Motion Adopted, Voice Vote; Senate Journal 16 "
236884,2011-01-19,"House Introduced 1/6/2011 and Referred to Municipal and County Government; House Journal  11, PG.178  "
236884,2011-01-26,"House Public Hearing: 2/1/2011 10:00 Amendment Legislative Office Building 301 "
236884,2011-02-01,"House Executive Session: 2/8/2011 1:00 PM Legislative Office Building 301 "
236884,2011-02-09,"House Committee Report: Inexpedient to Legislate for Feb 15 (Vote 16-0; Consent Calendar); House Calendar 13, PG.232 "
236884,2011-02-15,"House Inexpedient to Legislate: Motion Adopted Voice Vote; House Journal  17, PG.360 "
236885,2011-01-20,"House Introduced 1/6/2011 and Referred to Resources, Recreation and Development; House Journal  11, PG. 178 "
236885,2011-01-26,"House Public Hearing: 2/3/2011 10:00 Amendment Legislative Office Building 305 "
236885,2011-01-26,"House Executive Session: 2/8/2011 1:00 PM Legislative Office Building 305 "
236885,2011-02-10,"House Majority Committee Report: Ought to Pass for Feb 15 (Vote 11-4; Regular Calendar); House Calendar 13, PG.236 "
236885,2011-02-10,"House Minority Committee Report: Inexpedient to Legislate; House Calendar 13, PG.236 "
236885,2011-02-15,"House Special Order to Feb 16: Motion Adopted Without Objection; House Journal  17, PG.378 "
236885,2011-02-16,"House Ought to Pass: Motion Adopted Voice Vote; House Journal  19, PG.418 "
236885,2011-03-16,"Senate Introduced and Referred to Energy and Natural Resources "
236885,2011-04-06,"Senate Hearing: 4/14/11, Room 102, Legislative Office Building, 10:00 a.m.; Senate Calendar 19 "
236885,2011-04-14,"Senate Committee Report: Inexpedient to Legislate, 4/20/11; Senate Calendar 20 "
236885,2011-04-20,"Senate Inexpedient to Legislate, Motion Adopted, Voice Vote === BILL KILLED ===; Senate Journal 13, Pg.264 "
236886,2011-01-20,"House Introduced 1/6/2011 and Referred to Labor, Industrial and Rehabilitative Services; House Journal  11, PG. 178 "
236886,2011-01-25,"House Public Hearing: 2/1/2011 2:00 PM Legislative Office Building 307 "
236886,2011-02-23,"House Executive Session: 3/1/2011 1:00 PM Legislative Office Building 307 "
236886,2011-03-01,"House Retained in Committee; House Calendar 27, PG.824 "
236886,2011-09-12,"House ==CANCELLED== Retained Bill - Full Committee Work Session: 9/20/2011 10:00 Amendment Legislative Office Building 307 "
236886,2011-09-13,"House Retained Bill - Full Committee Work Session: 9/21/2011 10:00 Amendment Legislative Office Building 307 "
236886,2011-09-27,"House Retained Bill - Full Committee Work Session: 10/4/2011 1:00 PM Legislative Office Building 307 "
236886,2011-09-27,"House ==CANCELLED== Retained Bill - Executive Session: 10/18/2011 1:00 PM Legislative Office Building 307 "
236886,2011-10-19,"House Retained Bill - Executive Session: 10/27/2011 1:00 PM Legislative Office Building 307 "
236887,2011-01-20,"House Introduced 1/6/2011 and Referred to Commerce and Consumer Affairs; House Journal  11, PG. 179 "
236887,2011-01-26,"House Public Hearing: 2/3/2011 2:00 PM Legislative Office Building 302 "
236887,2011-03-01,"House Executive Session: 3/9/2011 9:00 Amendment Legislative Office Building 302 "
236887,2011-03-09,"House Committee Report: Inexpedient to Legislate for Mar 15 (Vote 17-0; Consent Calendar); House Calendar 22, PG.523 "
236887,2011-03-15,"House Inexpedient to Legislate: Motion Adopted Voice Vote; House Journal  26, PG.696 "
236888,2011-01-20,"House Introduced 1/6/2011 and Referred to Executive Departments and Administration; House Journal  11, PG. 179  "
236888,2011-02-02,"House Public Hearing: 2/8/2011 11:00 Amendment Legislative Office Building 306 "
236888,2011-02-14,"House Executive Session: 2/16/2011 Legislative Office Building 306 1:30 PM or 45 minutes after House session "
236888,2011-02-17,"House Committee Report: Inexpedient to Legislate for Feb 23 (Vote 16-0; Consent Calendar); House Calendar 15, PG.268 "
236888,2011-02-23,"House Inexpedient to Legislate: Motion Adopted Voice Vote; House Journal  21, PG.459 "
236889,2011-01-20,"House Introduced 1/6/2011 and Referred to Commerce and Consumer Affairs; House Journal  11, PG. 179 "
236889,2011-01-26,"House Public Hearing: 2/3/2011 1:15 PM Legislative Office Building 302 "
236889,2011-03-01,"House Executive Session: 3/9/2011 9:00 Amendment Legislative Office Building 302 "
236889,2011-03-09,"House Retained in Committee; House Calendar 27, PG.822 "
236889,2011-08-23,"House Retained Bill - Insurance/Consumer Div Subcom Work Session: 9/13/2011 2:00 PM Legislative Office Building 302 "
236889,2011-09-27,"House Retained Bill - Executive Session: 10/6/2011 10:00 Amendment Legislative Office Building 302 "
236889,2011-10-17,"House Committee Report: Refer to Interim Study for Jan 4 (Vote 13-0; Consent Calendar) "
236890,2011-01-20,"House Introduced 1/6/2011 and Referred to Executive Departments and Administration; House Journal  11, PG. 179 "
236890,2011-01-25,"House Public Hearing: 2/3/2011 1:00 PM Legislative Office Building 306 "
236890,2011-02-14,"House Executive Session: 2/16/2011 Legislative Office Building 306 1:30 PM or 45 minutes after House session "
236890,2011-02-17,"House Committee Report: Inexpedient to Legislate for Feb 23 (Vote 16-0; Consent Calendar); House Calendar 15, PG.268 "
236890,2011-02-23,"House Inexpedient to Legislate: Motion Adopted Voice Vote; House Journal  21, PG.459 "
236891,2011-01-20,"House Introduced 1/6/2011 and Referred to Municipal and County Government; House Journal  11, PG.179 "
236891,2011-01-26,"House Public Hearing: 2/3/2011 11:00 Amendment Legislative Office Building 301 "
236891,2011-02-01,"House Executive Session: 2/8/2011 1:00 PM Legislative Office Building 301 "
236891,2011-02-10,"House Majority Committee Report: Inexpedient to Legislate for Feb 15 (Vote 15-1; Regular Calendar); House Calendar 13, PG.235-236 "
236891,2011-02-10,"House Minority Committee Report: Ought to Pass; House Calendar 13, PG.235-236 "
236891,2011-02-15,"House Special Order to Feb 16: Motion Adopted Without Objection; House Journal  17, PG.378 "
236891,2011-02-16,"House Inexpedient to Legislate: Motion Adopted Voice Vote; House Journal  19, PG.415 "
236892,2011-01-20,"House Introduced 1/6/2011 and Referred to Municipal and County Government; House Journal  11, PG. 179 "
236892,2011-02-01,"House Public Hearing: 2/10/2011 2:00 PM Legislative Office Building 301 ==Executive Session to Follow== "
236892,2011-02-10,"House Retained in Committee; House Calendar 27, PG.825 "
236892,2011-04-19,"House Retained Bill - Subcommittee Work Session: 4/21/2011 9:00 Amendment Legislative Office Building 301 "
236892,2011-04-21,"House Retained Bill - Subcommittee Work Session: 4/28/2011 11:30 Amendment Legislative Office Building 301 "
236892,2011-09-14,"House Retained Bill - Executive Session: 10/11/2011 10:00 Amendment Legislative Office Building 301 "
236892,2011-10-14,"House Committee Report: Inexpedient to Legislate for Jan 4 (Vote 16-0; Consent Calendar) "
236893,2011-01-20,"House Introduced 1/6/2011 and Referred to Executive Departments and Administration; House Journal  11, PG. 179 "
236893,2011-01-25,"House Public Hearing: 2/3/2011 10:30 Amendment Legislative Office Building 306 "
236893,2011-02-03,"House Subcommittee Work Session: 2/8/2011 3:00 PM Legislative Office Building 306 "
236893,2011-02-14,"House Executive Session: 2/16/2011 Legislative Office Building 306 1:30 PM or 45 minutes after House session "
236893,2011-02-17,"House Committee Report: Inexpedient to Legislate for Feb 23 (Vote 16-0; Consent Calendar); House Calendar 15, PG.268 "
236893,2011-02-23,"House Inexpedient to Legislate: Motion Adopted Voice Vote; House Journal  21, PG.459 "
236894,2011-01-20,"House Introduced 1/6/2011 and Referred to Judiciary; House Journal  11, PG. 179 "
236894,2011-01-26,"House Public Hearing: 2/3/2011 2:00 PM Legislative Office Building 208 "
236894,2011-02-16,"House ==CANCELLED== Executive Session: 3/1/2011 1:00 PM Legislative Office Building 208 (If Necessary Continued 3/3/2011 10:00 Amendment Legislative Office Building 208) "
236894,2011-03-02,"House Executive Session: 3/9/2011 10:00 Amendment Legislative Office Building 208 (If Necessary Continued 3/10/2011 10:00 Amendment Legislative Office Building 208) "
236894,2011-03-10,"House Majority Committee Report: Ought to Pass with Amendment #0747h for Mar 15 (Vote 13-4; Regular Calendar); House Calendar 22, PG.557 "
236894,2011-03-10,"House Proposed Majority Committee Amendment #2011-0747h; House Calendar 23, PG.595 "
236894,2011-03-10,"House Minority Committee Report: Inexpedient to Legislate; House Calendar 22, PG.557 "
236894,2011-03-16,"House Amendment #0747h Adopted, Voice Vote; House Journal  28, PG.874 "
236894,2011-03-16,"House Suspend House Rules as to Allow Referral to Committee on Constitutional Review and Statutory Recodification, Beyond Deadline (Rep Itse): Motion Failed Division Vote 155-194; House Journal  28, PG.874 "
236894,2011-03-16,"House Ought to Pass with Amendment #0747h: Motion Adopted Voice Vote; House Journal  28, PG.874 "
236894,2011-03-23,"Senate Introduced and Referred to Judiciary; Senate Journal 11, Pg.191 "
236894,2011-04-06,"Senate Hearing: 4/14/11, Room 101, Legislative Office Building, 1:30 p.m.; Senate Calendar 19 "
236894,2011-05-13,"Senate Committee Report: Inexpedient to Legislate, 5/25/11; Senate Calendar 25 "
236894,2011-05-25,"Senate Inexpedient to Legislate, Motion Adopted, Voice Vote === BILL KILLED ===; Senate Journal 18, Pg.385 "
236895,2011-01-20,"House Introduced 1/6/2011 and Referred to Commerce and Consumer Affairs; House Journal  11, PG. 179 "
236895,2011-01-26,"House Public Hearing: 2/3/2011 2:30 PM Legislative Office Building 302 "
236895,2011-02-08,"House Subcommittee Work Session: 2/24/2011 9:00 Amendment Legislative Office Building 302 "
236895,2011-02-16,"House ==CANCELLED== Executive Session: 2/25/2011 10:00 Amendment Legislative Office Building 302 "
236895,2011-02-23,"House Executive Session: 3/1/2011 3:00 PM Legislative Office Building 302 "
236895,2011-03-02,"House Committee Report: Inexpedient to Legislate for Mar 15 (Vote 12-0; Consent Calendar); House Calendar 22, PG.523-524 "
236895,2011-03-15,"House Inexpedient to Legislate: Motion Adopted Voice Vote; House Journal  26, PG.698 "
236896,2011-01-20,"House Introduced 1/6/2011 and Referred to Election Law; House Journal  11, PG. 179 "
236896,2011-01-26,"House Public Hearing: 2/1/2011 1:45 PM Legislative Office Building 308 "
236896,2011-02-23,"House Executive Session: 3/1/2011 10:30 Amendment Legislative Office Building 308 "
236896,2011-03-09,"House Committee Report: Ought to Pass for Mar 15 (Vote 13-0; Consent Calendar); House Calendar 22, PG.528 "
236896,2011-03-15,"House Ought to Pass: Motion Adopted Voice Vote; House Journal  26, PG.707 "
236896,2011-03-23,"Senate Introduced and Referred to Public and Municipal Affairs; Senate Journal 11, Pg.191 "
236896,2011-04-20,"Senate Hearing: 4/26/11, Room 101, Legislative Office Building, 9:00 a.m.; Senate Calendar 21 "
236896,2011-05-04,"Senate Committee Report: Inexpedient to Legislate, 5/11/11; Senate Calendar 23 "
236896,2011-05-11,"Senate Inexpedient to Legislate, Motion Adopted, Voice Vote === BILL KILLED ===; Senate Journal 16 "
236897,2011-01-20,"House Introduced 1/6/2011 and Referred to Judiciary; House Journal  11, PG. 179 "
236897,2011-01-26,"House Public Hearing: 2/3/2011 11:00 Amendment Legislative Office Building 208 "
236897,2011-02-16,"House Executive Session: 2/16/2011 1:45 PM Legislative Office Building 208 "
236897,2011-02-22,"House Committee Report: Ought to Pass for Mar 2 (Vote 10-5; Regular Calendar); House Calendar 18, PG.392 "
236897,2011-03-02,"House Ought to Pass: Motion Adopted Voice Vote; House Journal  25, PG.686-687 "
236897,2011-03-16,"Senate Introduced and Referred to Judiciary "
236897,2011-04-06,"Senate Hearing: 4/14/11, Room 101, Legislative Office Building, 1:45 p.m.; Senate Calendar 19 "
236897,2011-05-26,"Senate Committee Report: Inexpedient to Legislate, 6/1/11; Senate Calendar 26 "
236897,2011-06-01,"Senate Inexpedient to Legislate, Motion Adopted, Voice Vote === BILL KILLED ===; Senate Journal 19, Pg.519 "
236898,2011-01-19,"House Introduced 1/6/2011 and Referred to State-Federal Relations and Veterans Affairs; House Journal  11, PG.178 "
236898,2011-01-25,"House Public Hearing: 2/3/2011 9:30 Amendment Legislative Office Building 203 ==Executive Session to Follow== "
236898,2011-02-04,"House Majority Committee Report: Ought to Pass with Amendment #0180h for Feb 15 (Vote 8-2; Regular Calendar); House Calendar 13, PG.237 "
236898,2011-02-04,"House Proposed Majority Committee Amendment #2011-0180h; House Calendar 13, PG.258-259 "
236898,2011-02-07,"House Minority Committee Report: Inexpedient to Legislate; House Calendar 13, PG.237 "
236898,2011-02-15,"House Special Order to Feb 16: Motion Adopted Without Objection; House Journal  17, PG.378 "
236898,2011-02-16,"House Amendment #0180h Adopted, Voice Vote; House Journal  19, PG.420-421 "
236898,2011-02-16,"House Ought to Pass with Amendment #0180h: Motion Adopted Regular Calendar 215-140; House Journal  19, PG.420-423 "
236898,2011-02-16,"House Referred to Finance; House Journal  19, PG.423 "
236898,2011-02-22,"House Full Committee Work Session: 3/1/2011 10:30 Amendment Legislative Office Building 210-211 "
236898,2011-03-03,"House Executive Session: 3/17/2011 Legislative Office Building 210-211 1:00 PM or Immediately Following House Session "
236898,2011-03-21,"House Committee Report: Ought to Pass with Amendment #1025h for Mar 30 (Vote 16-8; Regular Calendar); House Calendar 27, PG.819 "
236898,2011-03-21,"House Proposed Committee Amendment #2011-1025h; House Calendar 27, PG.854 "
236898,2011-03-30,"House Amendment #1025h Adopted, Voice Vote; House Journal  34, PG.1101 "
236898,2011-03-30,"House Ought to Pass with Amendment #1025h: Motion Adopted Division Vote 213-132; House Journal  34, PG.1101 "
236898,2011-04-20,"Senate Introduced and Referred to Internal Affairs; Senate Journal 14, Pg.272 "
236898,2011-04-21,"Senate Hearing: 4/27/11, Room 100, State House, 1:00 p.m.; Senate Calendar 21 "
236898,2011-05-12,"Senate Committee Report: Ought to Pass with Amendment #2011-1885s, New Title, 5/18/11; Senate Calendar 24 "
236898,2011-05-18,"Senate Committee Amendment 1885s, New Title, Not Voted On; Senate Journal 17, Pg.352 "
236898,2011-05-18,"Senate Sen. Bradley Moved Laid on Table, Motion Adopted, Voice Vote; Senate Journal 17, Pg.352 "
236899,2011-01-19,"House Introduced 1/6/2011 and Referred to State-Federal Relations and Veterans Affairs; House Journal  11, PG.178 "
236899,2011-01-25,"House Public Hearing: 2/3/2011 10:30 Amendment Legislative Office Building 203 ==RECESSED== "
236899,2011-02-03,"House Continued Public Hearing: 2/10/2011 9:00 Amendment Legislative Office Building 203 ==Executive Session to Follow== "
236899,2011-02-10,"House Committee Report: Inexpedient to Legislate for Feb 15 (Vote 10-1; Consent Calendar); House Calendar 13, PG.233 "
236899,2011-02-15,"House Inexpedient to Legislate: Motion Adopted Voice Vote; House Journal  17, PG.361 "
236900,2011-01-19,"House Introduced 1/6/2011 and Referred to Executive Departments and Administration; House Journal  11, PG.176 "
236900,2011-01-25,"House Public Hearing: 2/1/2011 10:00 Amendment Legislative Office Building 306 "
236900,2011-01-25,"House Executive Session: 2/2/2011 Legislative Office Building 306 1:00 PM or 45 Minutes After Session "
236900,2011-02-03,"House Committee Report: Ought to Pass for Feb 9 (Vote 11-0; Regular Calendar); House Calendar 12, PG.207 "
236900,2011-02-09,"House Ought to Pass: Motion Adopted Voice Vote; House Journal  16, PG.321 "
236900,2011-03-16,"Senate Introduced and Referred to Health and Human Services "
236900,2011-03-24,"Senate Hearing: 3/31/11, Room 102, Legislative Office Building, 1:00 p.m.; Senate Calendar 17 "
236900,2011-04-01,"Senate Committee Report: Ought to Pass, 4/13/11; Senate Calendar 19 "
236900,2011-04-13,"Senate Ought to Pass, Motion Adopted, Voice Vote; OT3rdg; Senate Journal 12, Pg.250 "
236900,2011-04-13,"Senate Passed by Third Reading Resolution; Senate Journal 12, Pg.255 "
236900,2011-04-27,"House Enrolled; House Journal  40, PG.1386 "
236900,2011-04-27,"Senate Enrolled; Senate Journal 15, Pg.293 "
236900,2011-05-11,"House Signed by Governor 05/09/2011; Effective 05/09/2011; Chapter 0056 "
241208,2011-01-20,"House Introduced 1/6/2011 and Referred to Special Committee on Public Employee Pensions Reform; House Journal  11, PG. 178 "
241208,2011-01-25,"House Public Hearing: 2/11/2011 10:00 Amendment Legislative Office Building 201-203 ==ROOM CHANGE (Orig Legislative Office Building 205)== "
241208,2011-02-08,"House ==CANCELLED==Full Committee Work Session: 2/18/2011 2:00 PM Legislative Office Building 201-203 "
241208,2011-02-09,"House ==CANCELLED==Executive Session: 2/18/2011 3:00 PM Legislative Office Building 201-203 "
241208,2011-03-02,"House ==RESCHEDULED== Full Committee Work Session: 3/4/2011 2:00 PM Legislative Office Building 305-307 (Orig Legislative Office Building 201-203) "
241208,2011-03-02,"House Executive Session: 3/4/2011 3:00 PM Legislative Office Building 201-203 "
241208,2011-03-04,"House Retained in Committee; House Calendar 27, PG.825 "
241208,2011-09-21,"House Retained Bill - Executive Session: 9/29/2011 1:30 PM Legislative Office Building 305-307 "
241208,2011-10-04,"House Committee Report: Inexpedient to Legislate for Jan 4 (Vote 11-0; Consent Calendar) "
241209,2011-01-20,"House Introduced 1/6/2011 and Referred to Health, Human Services and Elderly Affairs; House Journal  11, PG. 178 "
241209,2011-01-25,"House Public Hearing: 2/8/2011 1:30 PM Legislative Office Building 205 "
241209,2011-02-09,"House Subcommittee Work Session: 2/17/2011 2:30 PM Legislative Office Building 205 "
241209,2011-02-17,"House Subcommittee Work Session: 2/24/2011 1:00 PM Legislative Office Building 205 "
241209,2011-02-25,"House Subcommittee Work Session: 3/3/2011 2:00 PM Legislative Office Building 205 "
241209,2011-03-01,"House Executive Session: 3/9/2011 10:00 Amendment Legislative Office Building 205 "
241209,2011-03-09,"House Retained in Committee; House Calendar 27, PG.824 "
241209,2011-10-04,"House Retained Bill - Subcommittee Work Session: 10/10/2011 1:00 PM Legislative Office Building 205 "
241209,2011-10-05,"House ==CANCELLED== Retained Bill - Executive Session: 10/12/2011 Legislative Office Building 205 1:00 PM or Immediately Following House Session "
241209,2011-10-12,"House Executive Session: 10/20/2011 2:00 PM Legislative Office Building 205 "
241210,2011-01-20,"House Introduced 1/6/2011 and Referred to Ways and Means; House Journal  11, PG. 178 "
241210,2011-02-01,"House Public Hearing: 2/8/2011 1:00 PM Legislative Office Building 202 "
241210,2011-02-23,"House Executive Session: 2/24/2011 12:30 PM Legislative Office Building 202 "
241210,2011-02-24,"House Committee Report: Ought to Pass with Amendment #0515h for Mar 15 (Vote 19-0; Regular Calendar); House Calendar 22, PG.571 "
241210,2011-02-24,"House Proposed Committee Amendment #2011-0515h; House Calendar 23, PG.593 "
241210,2011-03-17,"House Amendment #0515h Adopted, Voice Vote; House Journal  30, PG.1010 "
241210,2011-03-17,"House Ought to Pass with Amendment #0515h: Motion Adopted Voice Vote; House Journal  30, PG.1010 "
241210,2011-03-23,"Senate Introduced and Referred to Ways & Means; Senate Journal 11, Pg.191 "
241210,2011-03-24,"Senate Hearing: 3/29/11, Room 100, State House, 1:00 p.m.; Senate Calendar 17 "
241210,2011-03-29,"Senate Committee Report: Ought to Pass, 4/13/11; Senate Calendar 19 "
241210,2011-04-13,"Senate Ought to Pass, Motion Adopted, Voice Vote; OT3rdg; Senate Journal 12, Pg.254 "
241210,2011-04-13,"Senate Passed by Third Reading Resolution; Senate Journal 12, Pg.254 "
241210,2011-04-27,"House Enrolled; House Journal  40, PG.1386 "
241210,2011-04-27,"Senate Enrolled; Senate Journal 15, Pg.293 "
241210,2011-05-11,"House Signed by Governor 05/09/2011; Effective 05/23/2011; Chapter 0047 "
241211,2011-01-20,"House Introduced 1/6/2011 and Referred to Special Committee on Public Employee Pensions Reform; House Journal  11, PG. 178  "
241211,2011-01-25,"House Public Hearing: 2/4/2011 10:45 Amendment Legislative Office Building 201-203 ==ROOM CHANGE (Orig Legislative Office Building 205)== "
241211,2011-02-08,"House Executive Session: 2/11/2011 2:00 PM Legislative Office Building 201-203 "
241211,2011-02-16,"House Committee Report: Ought to Pass with Amendment #0317h(NT) for Feb 23 (Vote 9-4; Regular Calendar); House Calendar 15, PG.279 "
241211,2011-02-16,"House Proposed Committee Amendment #2011-0317h (New Title); House Calendar 15, PG.300-301 "
241211,2011-02-23,"House Recommit (Rep Sedensky): Motion Adopted Voice Vote; House Journal  21, PG.497-498 "
241211,2011-02-23,"House Public Hearing on Non-Germane Amendment #2011-0484h(NT): 2/28/2011 10:00 Amendment Legislative Office Building 307 "
241211,2011-02-23,"House Full Committee Work Session: 2/28/2011 11:00 Amendment Legislative Office Building 307 "
241211,2011-02-23,"House ==CANCELLED== Executive Session: 2/28/2011 12:30 PM Legislative Office Building 307 "
241211,2011-02-24,"House =RESCHEDULED= Executive Session: 3/4/2011 9:30 Amendment Legislative Office Building 201-203 "
241211,2011-03-10,"House Majority Committee Report: Ought to Pass with Amendment #0642h(NT) for Mar 15 (Vote 8-4; Regular Calendar); House Calendar 22, PG.566-567 "
241211,2011-03-10,"House Proposed Majority Committee Amendment #2011-0642h (New Title); House Calendar 23, PG.593-594 "
241211,2011-03-10,"House Minority Committee Report: Inexpedient to Legislate; House Calendar 22, PG.566-567 "
241211,2011-03-16,"House Amendment #0642h (New Title) Adopted, Voice Vote; House Journal  28, PG.937-938 "
241211,2011-03-16,"House Ought to Pass with Amendment #0642h(NT): Motion Adopted Regular Calendar 188-120; House Journal  28, PG.937-940 "
241211,2011-03-16,"House Print Debate in Permanent Journal (Rep P.Garrity): Motion Failed Voice Vote; House Journal  28, PG.940 "
241211,2011-03-16,"House Reconsideration (Rep C.McGuire): Motion Failed Division Vote 93-215; House Journal  28, PG.940 "
241211,2011-03-23,"Senate Introduced and Referred to Executive Departments and Administration; Senate Journal 11, Pg.191 "
241211,2011-03-24,"Senate Hearing: 3/31/11, Room 100, State House, 10:20 a.m.; Senate Calendar 17 "
241211,2011-04-07,"Senate Committee Report: Inexpedient to Legislate, 4/13/11; Senate Calendar 19 "
241211,2011-04-13,"Senate Inexpedient to Legislate, Motion Adopted, Regular Calendar 24Y-0N === BILL KILLED ===; Senate Journal 12, Pg.249 "
241212,2011-01-20,"House Introduced 1/6/2011 and Referred to Municipal and County Government; House Journal  11, PG. 178 "
241212,2011-01-26,"House Public Hearing: 2/3/2011 10:30 Amendment Legislative Office Building 301 "
241212,2011-02-01,"House Executive Session: 2/8/2011 1:00 PM Legislative Office Building 301 "
241212,2011-02-10,"House Subcommittee Work Session: 2/23/2011 8:30 Amendment Legislative Office Building 301 "
241212,2011-02-10,"House ==CANCELLED== Subcommittee Work Session: 3/1/2011 8:30 Amendment Legislative Office Building 301 "
241212,2011-02-23,"House Executive Session: 3/1/2011 11:00 Amendment Legislative Office Building 301 "
241212,2011-03-01,"House Retained in Committee; House Calendar 27, PG.824 "
241212,2011-05-17,"House Retained Bill - Subcommittee Work Session: 5/24/2011 10:00 Amendment Legislative Office Building 301 "
241212,2011-05-25,"House Retained Bill - Subcommittee Work Session: 6/21/2011 10:00 Amendment Legislative Office Building 301 "
241212,2011-06-21,"House Retained Bill - Subcommittee Work Session: 9/20/2011 10:00 Amendment Legislative Office Building 301 "
241212,2011-09-14,"House Retained Bill - Executive Session: 10/11/2011 10:00 Amendment Legislative Office Building 301 "
241212,2011-10-14,"House Committee Report: Inexpedient to Legislate for Jan 4 (Vote 16-0; Consent Calendar) "
241213,2011-01-20,"House Introduced 1/6/2011 and Referred to Special Committee on Education Funding Reform; House Journal  11, PG. 178 "
241213,2011-01-25,"House Public Hearing: 2/4/2011 9:45 Amendment Legislative Office Building 207 "
241213,2011-02-01,"House Executive Session: 2/11/2011 9:00 Amendment Legislative Office Building 207 "
241213,2011-02-11,"House Retained in Committee; House Calendar 27, PG.825 "
241213,2011-09-14,"House Retained Bill - Full Committee Work Session: 9/27/2011 10:15 Amendment Legislative Office Building 210-211 "
241213,2011-09-14,"House Retained Bill - Executive Session: 9/27/2011 11:00 Amendment or Immediately Following Work Session Legislative Office Building 210-211 "
241214,2011-01-20,"House Introduced 1/6/2011 and Referred to Commerce and Consumer Affairs; House Journal  11, PG. 178  "
241214,2011-01-25,"House Public Hearing: 2/1/2011 11:00 Amendment Legislative Office Building 302 "
241214,2011-02-02,"House Executive Session: 2/15/2011 Legislative Office Building 302 3:00 PM or Immediately Following House Session "
241214,2011-02-15,"House Retained in Committee; House Calendar 27, PG.822 "
241214,2011-06-22,"House Retained Bill - Banking/Business Div Subcom Work Session: 9/20/2011 10:30 Amendment Legislative Office Building 302 "
241214,2011-09-20,"House Retained Bill - Banking/Business Div Subcom Work Session: 9/27/2011 10:00 Amendment Legislative Office Building 302 "
241214,2011-09-27,"House Retained Bill - Banking/Business Div Subcom Work Session: 10/18/2011 10:00 Amendment Legislative Office Building 302 "
241214,2011-10-19,"House Retained Bill - Banking/Business Div Subcom Work Session: 10/25/2011 10:00 Amendment Legislative Office Building 302 "
241214,2011-10-19,"House Retained Bill - Executive Session: 10/25/2011 1:15 PM Legislative Office Building 301-303 (If Necessary Continued 10/27/2011 1:15 PM Legislative Office Building 302) "
241215,2011-01-20,"House Introduced 1/6/2011 and Referred to Criminal Justice and Public Safety; House Journal  11, PG. 178 "
241215,2011-02-09,"House Public Hearing: 2/24/2011 1:45 PM Legislative Office Building 204 ==TIME CHANGE (Orig 11:30 Amendment)== "
241215,2011-03-01,"House Subcommittee Work Session: 3/3/2011 9:05 Amendment Legislative Office Building 204 "
241215,2011-03-02,"House Executive Session: 3/9/2011 10:00 Amendment Legislative Office Building 204 "
241215,2011-03-10,"House Committee Report: Inexpedient to Legislate for Mar 15 (Vote 9-8; Regular Calendar); House Calendar 22, PG.548 "
241215,2011-03-15,"House Inexpedient to Legislate: Motion Adopted Division Vote 183-29 by Required Two-Thirds; House Journal  26, PG.767 "
241216,2011-01-20,"House Introduced 1/6/2011 and Referred to Special Committee on Education Funding Reform; House Journal  11, PG. 179 "
241216,2011-01-25,"House Public Hearing: 2/4/2011 10:30 Amendment Legislative Office Building 207 "
241216,2011-02-01,"House Executive Session: 2/11/2011 9:00 Amendment Legislative Office Building 207 "
241216,2011-02-17,"House Majority Committee Report: Inexpedient to Legislate for Feb 23 (Vote 10-3; Regular Calendar); House Calendar 15A, PG.344 "
241216,2011-02-17,"House Minority Committee Report: Ought to Pass; House Calendar 15A, PG.344 "
241216,2011-02-23,"House Inexpedient to Legislate: Motion Adopted Regular Calendar 255-91; House Journal  21, PG.494-497 "
241217,2011-01-20,"House Introduced 1/6/2011 and Referred to Election Law; House Journal  11, PG. 179 "
241217,2011-01-26,"House Public Hearing: 2/1/2011 2:15 PM Legislative Office Building 308 "
241217,2011-02-16,"House Executive Session: 2/22/2011 10:30 Amendment Legislative Office Building 308 "
241217,2011-02-23,"House Majority Committee Report: Inexpedient to Legislate for Mar 2 (Vote 15-3; Regular Calendar); House Calendar 18, PG.391 "
241217,2011-02-23,"House Minority Committee Report: Ought to Pass; House Calendar 18, PG.391 "
241217,2011-03-02,"House Recommit (Rep D.McGuire): Motion Failed Regular Calendar 68-272; House Journal  25, PG.680-682 "
241217,2011-03-02,"House Inexpedient to Legislate: Motion Adopted Regular Calendar 303-44; House Journal  25, PG.680-684 "
241217,2011-03-02,"House Print Debate in Permanent Journal (Rep Manuse): Motion Failed Division Vote 60-283; House Journal  25, PG.684 "
241218,2011-01-20,"House Introduced 1/6/2011 and Referred to Ways and Means; House Journal  11, PG. 179 "
241218,2011-02-01,"House Public Hearing: 2/10/2011 11:00 Amendment Legislative Office Building 202 "
241218,2011-02-23,"House Executive Session: 2/24/2011 12:30 PM Legislative Office Building 202 "
241218,2011-02-24,"House Retained in Committee; House Calendar 27, PG.826 "
241218,2011-06-02,"House Retained Bill - Full Committee Work Session: 6/7/2011 10:00 Amendment Legislative Office Building 202 "
241218,2011-08-04,"House Retained Bill - Subcommittee Work Session: 8/18/2011 10:00 Amendment Legislative Office Building 202 "
241218,2011-08-18,"House Retained Bill - Subcommittee Work Session: 9/1/2011 10:00 Amendment Legislative Office Building 202 "
241218,2011-09-01,"House Retained Bill - Subcommittee Work Session: 9/8/2011 10:30 Amendment Legislative Office Building 202 "
241218,2011-10-03,"House Retained Bill - Executive Session: 10/26/2011 1:00 PM Legislative Office Building 202 "
241218,2011-10-20,"House Retained Bill - Rescheduled Executive Session 10/27/2011 1:00 PM Legislative Office Building 202 "
241219,2011-01-20,"House Introduced 1/6/2011 and Referred to Ways and Means; House Journal  11, PG. 179 "
241219,2011-02-09,"House Public Hearing: 2/17/2011 1:30 PM Legislative Office Building 202 "
241219,2011-02-23,"House Executive Session: 2/24/2011 12:30 PM Legislative Office Building 202 "
241219,2011-02-24,"House Committee Report: Inexpedient to Legislate for Mar 15 (Vote 19-0; Consent Calendar); House Calendar 22, PG.543 "
241219,2011-03-15,"House Inexpedient to Legislate: Motion Adopted Voice Vote; House Journal  26, PG.742 "
241220,2011-01-20,"House Introduced 1/6/2011 and Referred to Commerce and Consumer Affairs; House Journal  11, PG. 179 "
241220,2011-01-26,"House ==CANCELLED== Public Hearing: 2/15/2011 1:15 PM Legislative Office Building 302 "
241220,2011-02-01,"House Public Hearing: 2/22/2011 1:15 PM Legislative Office Building 302 "
241220,2011-02-16,"House ==CANCELLED== Executive Session: 2/25/2011 10:00 Amendment Legislative Office Building 302 "
241220,2011-03-01,"House Executive Session: 3/9/2011 9:00 Amendment Legislative Office Building 302 "
241220,2011-03-09,"House Retained in Committee; House Calendar 27, PG.822 "
241220,2011-06-22,"House Retained Bill - Banking/Business Div Subcom Work Session: 9/27/2011 10:30 Amendment Legislative Office Building 302 "
241220,2011-09-27,"House Retained Bill - Banking/Business Div Subcom Work Session: 10/18/2011 10:30 Amendment Legislative Office Building 302 "
241220,2011-10-19,"House Retained Bill - Banking/Business Div Subcom Work Session: 10/25/2011 10:30 Amendment Legislative Office Building 302 "
241220,2011-10-19,"House Retained Bill - Executive Session: 10/25/2011 1:15 PM Legislative Office Building 301-303 (If Necessary Continued 10/27/2011 1:15 PM Legislative Office Building 302) "
241221,2011-01-20,"House Introduced 1/6/2011 and Referred to Commerce and Consumer Affairs; House Journal  11, PG. 179 "
241221,2011-01-26,"House Public Hearing: 2/10/2011 11:00 Amendment Legislative Office Building 302 "
241221,2011-02-15,"House Executive Session: 2/15/2011 Legislative Office Building 302 3:00 PM or Immediately Following House Session "
241221,2011-03-02,"House Committee Report: Ought to Pass with Amendment #0281h for Mar 15 (Vote 15-1; Consent Calendar); House Calendar 22, PG.523 "
241221,2011-03-02,"House Proposed Committee Amendment #2011-0281h; House Calendar 23, PG.594-595 "
241221,2011-03-15,"House Amendment #0281h Adopted, Voice Vote; House Journal  26, PG.696-697 "
241221,2011-03-15,"House Ought to Pass with Amendment #0281h: Motion Adopted Voice Vote; House Journal  26, PG.696-697 "
241221,2011-03-23,"Senate Introduced and Referred to Commerce; Senate Journal 11, Pg.191 "
241221,2011-04-21,"Senate Hearing: 4/26/11, Room 102, Legislative Office Building, 9:45 a.m.; Senate Calendar 21 "
241221,2011-04-26,"Senate Committee Report: Ought to Pass, 5/4/11; Senate Calendar 22 "
241221,2011-05-04,"Senate Ought to Pass, Motion Adopted, Voice Vote; OT3rdg; Senate Journal 15, Pg.297 "
241221,2011-05-04,"Senate Passed by Third Reading Resolution; Senate Journal 15, Pg.312 "
241221,2011-05-18,"Senate Enrolled Bill Amendment #1874e Adopted; Senate Journal 18, Pg.362 "
241221,2011-05-18,"House Enrolled Bill Amendment #2011-1874e Adopted; House Journal  44, PG.1566 "
241221,2011-05-25,"Senate Enrolled; Senate Journal 19, Pg.395 "
241221,2011-05-25,"House Enrolled; House Journal  46, PG.1609 "
241221,2011-06-08,"House Signed by Governor 06/02/2011; Effective 01/01/2012; Chapter 0120 "
241222,2011-01-20,"House Introduced 1/6/2011 and Referred to Commerce and Consumer Affairs; House Journal  11, PG. 179 "
241222,2011-01-26,"House Public Hearing: 2/8/2011 1:15 PM Legislative Office Building 302 "
241222,2011-02-15,"House Subcommittee Work Session: 2/16/2011 9:01 Amendment Legislative Office Building 302 "
241222,2011-02-16,"House ==CANCELLED== Executive Session: 2/25/2011 10:00 Amendment Legislative Office Building 302 "
241222,2011-02-23,"House Executive Session: 3/1/2011 3:00 PM Legislative Office Building 302 "
241222,2011-03-01,"House Retained in Committee; House Calendar 27, PG.822 "
241222,2011-06-22,"House Retained Bill - Banking/Business Div Subcom Work Session: 9/20/2011 11:15 Amendment Legislative Office Building 302 "
241222,2011-09-20,"House Retained Bill - Banking/Business Div Subcom Work Session: 10/11/2011 11:45 Amendment Legislative Office Building 302 "
241222,2011-10-11,"House Retained Bill - Banking/Business Div Subcom Work Session: 10/20/2011 10:45 Amendment Legislative Office Building 302 "
241222,2011-10-11,"House Retained Bill - Executive Session: 10/20/2011 1:15 PM Legislative Office Building 302 ==RECESSED== "
241222,2011-10-20,"House Retained Bill - Subcommittee Work Session: 10/25/2011 11:00 Amendment Legislative Office Building 302 "
241222,2011-10-20,"House Retained Bill - Continued Executive Session: 10/25/2011 1:15 PM Legislative Office Building 301-303 "
241223,2011-01-20,"House Introduced 1/6/2011 and Referred to Commerce and Consumer Affairs; House Journal  11, PG. 179 "
241223,2011-01-26,"House ==CANCELLED== Public Hearing: 2/15/2011 10:00 Amendment Legislative Office Building 302 "
241223,2011-02-01,"House ==RESCHEDULED== Public Hearing: 2/22/2011 10:00 Amendment Legislative Office Building 302 "
241223,2011-02-16,"House ==CANCELLED== Executive Session: 2/25/2011 10:00 Amendment Legislative Office Building 302 "
241223,2011-02-24,"House Subcommittee Work Session: 2/28/2011 9:00 Amendment Legislative Office Building 302 "
241223,2011-02-24,"House ==CANCELLED== Executive Session: 3/1/2011 3:00 PM Legislative Office Building 302 "
241223,2011-03-02,"House Executive Session: 3/9/2011 9:00 Amendment Legislative Office Building 302 "
241223,2011-03-09,"House Committee Report: Ought to Pass with Amendment #0738h for Mar 15 (Vote 15-2; Consent Calendar); House Calendar 22, PG.523 "
241223,2011-03-09,"House Proposed Committee Amendment #2011-0738h; House Calendar 23, PG.595 "
241223,2011-03-15,"House Amendment #0738h Adopted, Voice Vote; House Journal  26, PG.697-698 "
241223,2011-03-15,"House Ought to Pass with Amendment #0738h: Motion Adopted Voice Vote; House Journal  26, PG.697-698 "
241223,2011-04-20,"Senate Introduced and Referred to Commerce; Senate Journal 14, Pg.272 "
241223,2011-04-28,"Senate Hearing: 5/3/11, Room 102, Legislative Office Building, 9:30 a.m.; Senate Calendar 22 "
241223,2011-05-11,"Senate Committee Report: Ought to Pass with Amendment #2011-1834s, 5/18/11; Senate Calendar 24 "
241223,2011-05-18,"Senate Committee Amendment 1834s, Amendment Adopted, Voice Vote; Senate Journal 17, Pg.346 "
241223,2011-05-18,"Senate Sen. Houde Floor Amendment #2011-1914s, Regular Calendar 20Y-4N, Amendment Adopted; Senate Journal 17, Pg.346 "
241223,2011-05-18,"Senate Sen. Merrill Floor Amendment #2011-2000s, Regular Calendar 17Y-7N, Amendment Adopted; Senate Journal 17, Pg.347 "
241223,2011-05-18,"Senate Ought to Pass with Amendments 1834s, 1914s, 2000s, Motion Adopted, Voice Vote; OT3rdg; Senate Journal 17, Pg.347 "
241223,2011-05-18,"Senate Passed by Third Reading Resolution; Senate Journal 17, Pg.357 "
241223,2011-06-01,"House House Non-Concurs with Senate Amendment #1834s, #1914s, and #2000s and Req C of C (Rep Hunt): Motion Adopted Voice Vote; House Journal  48, PG.1624 "
241223,2011-06-01,"House Speaker Appoints: Reps Hunt, Jennifer Coffey, Mirski, and Schlachman; House Journal  48, PG.1624 "
241223,2011-06-08,"Senate Sen. Prescott Accedes to House Request for Committee of Conference; Senate Journal 20, Pg.567 "
241223,2011-06-08,"Senate President Appoints: Senators Sanborn, De Blois and Kelly; Senate Journal 20, Pg.567 "
241223,2011-06-10,"House Conference Committee Meeting: 6/13/2011 11:30 Amendment Legislative Office Building 302 ==RECESSED== "
241223,2011-06-14,"House ==RECONVENE== Conference Committee Meeting: 6/15/2011 12:00 PM Legislative Office Building 302 "
241223,2011-06-16,"Senate Conference Committee Report #2011-2475c; Senate Amendment + New Amendment, Filed "
241223,2011-06-22,"Senate Conference Committee Report 2475c; Adopted, Voice Vote "
241223,2011-06-22,"House Conference Committee Report #2475c Adopted, Voice Vote; House Journal  57, PG.1840 "
241223,2011-06-22,"Senate Enrolled Bill Amendment #2528e Adopted, Voice Vote "
241223,2011-06-22,"House Enrolled Bill Amendment #2011-2528e Adopted; House Journal  57, PG.1859 "
241223,2011-06-22,"Senate Enrolled "
241223,2011-06-22,"House Enrolled; House Journal  57, PG.1860 "
241223,2011-07-18,"House Law Without Signature 07/14/2011; Chapter 0263; NH Constitution, Art.44, Pt.II "
241223,2011-07-18,"House I. Section 2 Effective 10/31/2012 "
241223,2011-07-18,"House II. Remainder Effective 07/14/2011 "
241224,2011-01-20,"House Introduced 1/6/2011 and Referred to Election Law; House Journal  11, PG. 179 "
241224,2011-02-08,"House Public Hearing: 2/22/2011 11:30 Amendment Legislative Office Building 308 "
241224,2011-02-23,"House Executive Session: 3/1/2011 10:30 Amendment Legislative Office Building 308 "
241224,2011-03-02,"House Committee Report: Ought to Pass for Mar 15 (Vote 15-0; Consent Calendar); House Calendar 22, PG.528 "
241224,2011-03-15,"House Ought to Pass: Motion Adopted Voice Vote; House Journal  26, PG.707 "
241224,2011-03-23,"Senate Introduced and Referred to Public and Municipal Affairs; Senate Journal 11, Pg.191 "
241224,2011-04-14,"Senate Hearing: 4/19/11, Room 101, Legislative Office Building, 9:55 a.m.; Senate Calendar 20 "
241224,2011-04-20,"Senate Committee Report: Ought to Pass, 4/27/11; Senate Calendar 21 "
241224,2011-04-27,"Senate Ought to Pass, Motion Adopted, Voice Vote; OT3rdg; Senate Journal 14 "
241224,2011-04-27,"Senate Passed by Third Reading Resolution; Senate Journal 14 "
241224,2011-05-04,"Senate Enrolled; Senate Journal 16, Pg.318 "
241224,2011-05-04,"House Enrolled; House Journal  42, PG.1490 "
241224,2011-05-20,"House Signed by Governor 05/16/2011; Effective 07/15/2011; Chapter 0072 "
241225,2011-01-20,"House Introduced 1/6/2011 and Referred to Executive Departments and Administration; House Journal  11, PG. 179 "
241225,2011-01-25,"House Public Hearing: 2/3/2011 11:00 Amendment Legislative Office Building 306 "
241225,2011-02-03,"House Subcommittee Work Session: 2/8/2011 2:30 PM Legislative Office Building 306 "
241225,2011-02-14,"House Executive Session: 2/16/2011 Legislative Office Building 306 1:30 PM or 45 minutes after House session "
241225,2011-02-17,"House Committee Report: Inexpedient to Legislate for Feb 23 (Vote 14-1; Consent Calendar); House Calendar 15, PG.268 "
241225,2011-02-23,"House Inexpedient to Legislate: Motion Adopted Voice Vote; House Journal  21, PG.459 "
241226,2011-01-20,"House Introduced 1/6/2011 and Referred to Resources, Recreation and Development; House Journal  11, PG. 179 "
241226,2011-01-26,"House Public Hearing: 2/3/2011 11:15 Amendment Legislative Office Building 305 "
241226,2011-01-26,"House Executive Session: 2/8/2011 1:00 PM Legislative Office Building 305 "
241226,2011-02-09,"House Retained in Committee; House Calendar 27, PG.825 "
241226,2011-07-26,"House Retained Bill - Full Committee Work Session: 8/9/2011 10:00 Amendment Legislative Office Building 305 "
241226,2011-09-07,"House Retained Bill - Subcommittee Work Session: 9/20/2011 1:00 PM Legislative Office Building 305 "
241226,2011-09-20,"House Retained Bill - Subcommittee Work Session: 10/4/2011 1:00 PM Legislative Office Building 305 "
241226,2011-10-07,"House Retained Bill - Subcommittee Work Session: 10/18/2011 10:00 Amendment Legislative Office Building 305 "
241226,2011-10-07,"House Retained Bill - Executive Session: 10/25/2011 10:00 Amendment Legislative Office Building 305 "
241227,2011-01-20,"House Introduced 1/6/2011 and Referred to Election Law; House Journal  11, PG. 179 "
241227,2011-01-26,"House Public Hearing: 2/1/2011 2:00 PM Legislative Office Building 308 "
241227,2011-02-16,"House =RESCHEDULED-Executive Session: 3/1/2011 10:30 Amendment Legislative Office Building 308 "
241227,2011-03-02,"House Committee Report: Ought to Pass for Mar 15 (Vote 11-2; Consent Calendar); House Calendar 22, PG.528 "
241227,2011-03-15,"House Ought to Pass: Motion Adopted Voice Vote; House Journal  26, PG.707 "
241227,2011-03-23,"Senate Introduced and Referred to Public and Municipal Affairs; Senate Journal 11, Pg.191 "
241227,2011-04-20,"Senate Hearing: 4/26/11, Room 101, Legislative Office Building, 9:30 a.m.; Senate Calendar 21 "
241227,2011-05-11,"Senate Committee Report: Ought to Pass, 5/18/11; Senate Calendar 24 "
241227,2011-05-18,"Senate Ought to Pass, Motion Adopted, Voice Vote; OT3rdg; Senate Journal 17, Pg.353 "
241227,2011-05-18,"Senate Passed by Third Reading Resolution; Senate Journal 17, Pg.357 "
241227,2011-06-01,"Senate Enrolled; Senate Journal 20, Pg.546 "
241227,2011-06-01,"House Enrolled; House Journal  48, PG.1669 "
241227,2011-06-09,"House Signed By Governor 06/08/2011; Effective 08/07/2011; Chapter 0150 "
241228,2011-01-20,"House Introduced 1/6/2011 and Referred to Executive Departments and Administration; House Journal  11, PG. 179 "
241228,2011-01-25,"House Public Hearing: 2/1/2011 11:00 Amendment Legislative Office Building 306 "
241228,2011-02-03,"House Subcommittee Work Session: 2/10/2011 3:00 PM Legislative Office Building 306 "
241228,2011-02-17,"House Subcommittee Work Session: 3/1/2011 2:00 PM Legislative Office Building 306 "
241228,2011-03-02,"House Subcommittee Work Session: 3/3/2011 4:15 PM Legislative Office Building 306 "
241228,2011-03-02,"House Executive Session: 3/9/2011 1:00 PM Legislative Office Building 306 "
241228,2011-03-09,"House Retained in Committee; House Calendar 27, PG.823 "
241228,2011-06-09,"House Retained Bill - Subcommittee Work Session: 6/28/2011 10:00 Amendment Legislative Office Building 306 "
241228,2011-09-27,"House Retained Bill - Executive Session: 10/11/2011 10:30 Amendment Legislative Office Building 306 "
241228,2011-10-21,"House Committee Report: Inexpedient to Legislate for Jan 4 (Vote 12-0; Consent Calendar) "
241229,2011-01-20,"House Introduced 1/6/2011 and Referred to Judiciary; House Journal  11, PG. 179 "
241229,2011-02-01,"House Public Hearing: 2/8/2011 10:00 Amendment Legislative Office Building 208 "
241229,2011-02-09,"House Executive Session: 2/14/2011 10:00 Amendment Legislative Office Building 208 "
241229,2011-02-14,"House Retained in Committee; House Calendar 27, PG.824 "
241229,2011-09-15,"House Retained Bill - Subcommittee Work Session: 10/4/2011 10:00 Amendment Legislative Office Building 208 "
241229,2011-09-15,"House Retained Bill - Executive Session: 10/25/2011 11:00 Amendment Legislative Office Building 208 "
241230,2011-01-20,"House Introduced 1/6/2011 and Referred to Commerce and Consumer Affairs; House Journal  11, PG. 179 "
241230,2011-01-25,"House Public Hearing: 2/1/2011 2:00 PM Legislative Office Building 302 ==RECESSED== "
241230,2011-02-09,"House Continued Public Hearing: 2/22/2011 3:15 PM Legislative Office Building 302 "
241230,2011-02-16,"House ==CANCELLED== Executive Session: 2/25/2011 10:00 Amendment Legislative Office Building 302 "
241230,2011-02-24,"House Subcommittee Work Session: 2/28/2011 1:00 PM Legislative Office Building 302 "
241230,2011-02-24,"House Executive Session: 3/1/2011 3:00 PM Legislative Office Building 302 "
241230,2011-03-10,"House Committee Report: Ought to Pass with Amendment #0711h for Mar 15 (Vote 16-0; Regular Calendar); House Calendar 22, PG.546-547 "
241230,2011-03-10,"House Proposed Committee Amendment #2011-0711h; House Calendar 23, PG.596-597 "
241230,2011-03-15,"House Amendment #0711h Adopted, Voice Vote; House Journal  26, PG.752-753 "
241230,2011-03-15,"House Ought to Pass with Amendment #0711h: Motion Adopted Voice Vote; House Journal  26, PG.752-753 "
241230,2011-03-23,"Senate Introduced and Referred to Commerce; Senate Journal 11, Pg.191 "
241230,2011-03-24,"Senate Hearing: 3/29/11, Room 102, Legislative Office Building, 9:40 a.m.; Senate Calendar 17 "
241230,2011-04-13,"Senate Committee Report: Ought to Pass, 4/20/11; Senate Calendar 20 "
241230,2011-04-20,"Senate Ought to Pass, Motion Adopted, Voice Vote; OT3rdg; Senate Journal 13, Pg.261 "
241230,2011-04-20,"Senate Passed by Third Reading Resolution; Senate Journal 13, Pg.270 "
241230,2011-05-18,"Senate Enrolled Bill Amendment #1861e Adopted; Senate Journal 18, Pg.362 "
241230,2011-05-18,"House Enrolled Bill Amendment #2011-1861e Adopted; House Journal  44, PG.1566 "
241230,2011-05-25,"Senate Enrolled; Senate Journal 19, Pg.395 "
241230,2011-05-25,"House Enrolled; House Journal  46, PG.1609 "
241230,2011-06-08,"House Signed by Governor 06/06/2011; Effective 07/01/2011 at 12:01 A.M.; Chapter 0128 "
241231,2011-01-20,"House Introduced 1/6/2011 and Referred to Commerce and Consumer Affairs; House Journal  11, PG. 179 "
241231,2011-01-26,"House Public Hearing: 2/3/2011 11:30 Amendment Legislative Office Building 302 "
241231,2011-03-01,"House Executive Session: 3/9/2011 9:00 Amendment Legislative Office Building 302 "
241231,2011-03-09,"House Retained in Committee; House Calendar 27, PG.822 "
241231,2011-08-23,"House Retained Bill - Insurance/Consumer Div Subcom Work Session: 9/27/2011 1:15 PM Legislative Office Building 302 "
241231,2011-09-27,"House Retained Bill - Insurance/Consumer Div Subcom Work Session: 10/6/2011 2:00 PM Legislative Office Building 302 "
241231,2011-10-11,"House Retained Bill - Executive Session: 10/20/2011 1:15 PM Legislative Office Building 302 ==RECESSED== "
241231,2011-10-26,"House Retained Bill - Subcommittee Work Session: 11/1/2011 9:30 Amendment Legislative Office Building 302 "
241231,2011-10-26,"House Retained Bill - Executive Session: 11/1/2011 10:00 Amendment Legislative Office Building 302 "
241232,2011-01-20,"House Introduced 1/6/2011 and Referred to Labor, Industrial and Rehabilitative Services; House Journal  11, PG. 180 "
241232,2011-01-25,"House Public Hearing: 2/8/2011 10:15 Amendment Legislative Office Building 307 "
241232,2011-02-09,"House Executive Session: 3/1/2011 1:00 PM Legislative Office Building 307 "
241232,2011-03-03,"House Committee Report: Inexpedient to Legislate for Mar 15 (Vote 11-4; Regular Calendar); House Calendar 22, PG.560 "
241232,2011-03-16,"House Inexpedient to Legislate: Motion Adopted Division Vote 256-82; House Journal  28, PG.899 "
241233,2011-01-20,"House Introduced 1/6/2011 and Referred to Resources, Recreation and Development; House Journal  11, PG. 180 "
241233,2011-01-26,"House Public Hearing: 2/8/2011 2:30 PM Legislative Office Building 305 "
241233,2011-02-15,"House Executive Session: 2/15/2011 Legislative Office Building 305 3:00 PM or Following House Session "
241233,2011-02-17,"House Committee Report: Ought to Pass with Amendment #0297h for Feb 23 (Vote 15-0; Consent Calendar); House Calendar 15, PG.272 "
241233,2011-02-17,"House Proposed Committee Amendment #2011-0297h; House Calendar 15, PG.301 "
241233,2011-02-23,"House Amendment #0297h Adopted, Voice Vote; House Journal  21, PG.463 "
241233,2011-02-23,"House Ought to Pass with Amendment #0297h: Motion Adopted Voice Vote; House Journal  21, PG.463 "
241233,2011-03-16,"Senate Introduced and Referred to Energy and Natural Resources "
241233,2011-03-17,"Senate Hearing: 3/24/11, Room 102, Legislative Office Building, 11:15 a.m.; Senate Calendar 16 "
241233,2011-03-29,"Senate Committee Report: Ought to Pass with Amendment #2011-1224s, New Title, 4/13/11; Senate Calendar 19 "
241233,2011-04-13,"Senate Committee Amendment 1224s, New Title, Amendment Adopted, Voice Vote; Senate Journal 12, Pg.248 "
241233,2011-04-13,"Senate Ought to Pass with Amendment 1224s, New Title, Motion Adopted, Voice Vote; OT3rdg; Senate Journal 12, Pg.248 "
241233,2011-04-13,"Senate Passed by Third Reading Resolution; Senate Journal 12, Pg.255 "
241233,2011-05-04,"House House Concurs with Senate Amendment #1224s(NT) (Rep Renzullo): Motion Adopted Voice Vote; House Journal  42, PG.1448 "
241233,2011-05-18,"Senate Enrolled; Senate Journal 18, Pg.364 "
241233,2011-05-18,"House Enrolled; House Journal  44, PG.1564 "
241233,2011-06-01,"House Signed By Governor 05/27/2011; Effective 07/26/2011; Chapter 0095 "
241234,2011-01-20,"House Introduced 1/6/2011 and Referred to Executive Departments and Administration; House Journal  11, PG. 180  "
241234,2011-01-25,"House Public Hearing: 2/3/2011 10:00 Amendment Legislative Office Building 306 "
241234,2011-02-03,"House Executive Session: 2/16/2011 Legislative Office Building 306 1:30 PM or 45 minutes after House Session "
241234,2011-02-17,"House Committee Report: Inexpedient to Legislate for Feb 23 (Vote 15-0; Consent Calendar); House Calendar 15, PG.269 "
241234,2011-02-23,"House Inexpedient to Legislate: Motion Adopted Voice Vote; House Journal  21, PG.460 "
241235,2011-01-20,"House Introduced 1/6/2011 and Referred to Commerce and Consumer Affairs; House Journal  11, PG. 180 "
241235,2011-01-26,"House Public Hearing: 2/8/2011 2:30 PM Legislative Office Building 302 "
241235,2011-03-01,"House Executive Session: 3/9/2011 9:00 Amendment Legislative Office Building 302 "
241235,2011-03-09,"House Committee Report: Inexpedient to Legislate for Mar 15 (Vote 17-0; Consent Calendar); House Calendar 23A; PG.656 "
241235,2011-03-15,"House Inexpedient to Legislate: Motion Adopted Voice Vote; House Journal  26, PG.698 "
241236,2011-01-20,"House Introduced 1/6/2011 and Referred to Children and Family Law; House Journal  11, PG. 180 "
241236,2011-02-01,"House Public Hearing: 2/10/2011 10:00 Amendment Legislative Office Building 206 ==Executive Session to Follow== "
241236,2011-02-15,"House Committee Report: Inexpedient to Legislate for Feb 23 (Vote 14-0; Consent Calendar); House Calendar 15, PG.267 "
241236,2011-02-23,"House Inexpedient to Legislate: Motion Adopted Voice Vote; House Journal  21, PG.456 "
241237,2011-01-20,"House Introduced 1/6/2011 and Referred to Health, Human Services and Elderly Affairs; House Journal  11, PG. 180 "
241237,2011-01-25,"House Public Hearing: 2/1/2011 10:00 Amendment Legislative Office Building 205 "
241237,2011-02-08,"House Executive Session: 2/17/2011 10:00 Amendment Legislative Office Building 205 "
241237,2011-02-23,"House Committee Report: Ought to Pass with Amendment #0132h for Mar 2 (Vote 16-0; Consent Calendar); House Calendar 18, PG.387 "
241237,2011-02-23,"House Proposed Committee Amendment #2011-0132h; House Calendar 18, PG.410 "
241237,2011-03-02,"House Amendment #0132h Adopted, Voice Vote; House Journal  25, PG.673-674 "
241237,2011-03-02,"House Ought to Pass with Amendment #0132h: Motion Adopted Voice Vote; House Journal  25, PG.673-674 "
241237,2011-03-09,"Senate Introduced and Referred to Health and Human Services; Senate Journal 9, Pg.102 "
241237,2011-03-15,"Senate Hearing: 3/24/11, Room 102, Legislative Office Building, 1:15 p.m.; Senate Calendar 16 "
241237,2011-03-29,"Senate Committee Report: Ought to Pass, 4/13/11; Senate Calendar 19 "
241237,2011-04-13,"Senate Ought to Pass, Motion Adopted, Voice Vote; OT3rdg; Senate Journal 12, Pg.250"
241237,2011-04-13,"Senate Passed by Third Reading Resolution; Senate Journal 12, Pg.255 "
241237,2011-04-27,"House Enrolled; House Journal  40, PG.1386 "
241237,2011-04-27,"Senate Enrolled; Senate Journal 15, Pg.293 "
241237,2011-05-11,"House Signed by Governor 05/09/2011; Effective 07/08/2011; Chapter 0048 "
241238,2011-01-20,"House Introduced 1/6/2011 and Referred to Education; House Journal  11, PG. 180 "
241238,2011-02-09,"House Public Hearing: 2/17/2011 10:30 Amendment Legislative Office Building 207 "
241238,2011-02-18,"House Executive Session: 3/3/2011 10:00 Amendment Legislative Office Building 207 "
241238,2011-03-08,"House Committee Report: Ought to Pass for Mar 15 (Vote 16-0; Consent Calendar); House Calendar 22, PG.527 "
241238,2011-03-15,"House Ought to Pass: Motion Adopted Voice Vote; House Journal  26, PG.706 "
241238,2011-03-23,"Senate Introduced and Referred to Education; Senate Journal 11, Pg.191 "
241238,2011-04-06,"Senate Hearing: 4/12/11, Room 103, Legislative Office Building, 1:20 p.m.; Senate Calendar 19 "
241238,2011-05-03,"Senate Committee Report: Inexpedient to Legislate, 5/11/11; Senate Calendar 23 "
241238,2011-05-11,"Senate Inexpedient to Legislate, Motion Adopted, Voice Vote === BILL KILLED ===; Senate Journal 16, Pg.321 "
241239,2011-01-20,"House Introduced 1/6/2011 and Referred to Commerce and Consumer Affairs; House Journal  11, PG. 180 "
241239,2011-01-26,"House Public Hearing: 2/8/2011 10:00 Amendment Legislative Office Building 302 "
241239,2011-02-15,"House Subcommittee Work Session: 2/24/2011 12:00 PM Legislative Office Building 302 "
241239,2011-02-16,"House ==CANCELLED== Executive Session: 2/25/2011 10:00 Amendment Legislative Office Building 302 "
241239,2011-02-24,"House Subcommittee Work Session: 2/28/2011 11:00 Amendment Legislative Office Building 302 "
241239,2011-02-24,"House Executive Session: 3/1/2011 3:00 PM Legislative Office Building 302 "
241239,2011-03-09,"House Committee Report: Ought to Pass with Amendment #0675h for Mar 15 (Vote 17-0; Consent Calendar); House Calendar 22, PG.524 "
241239,2011-03-09,"House Proposed Committee Amendment #2011-0675h; House Calendar 23, PG.598-599 "
241239,2011-03-15,"House Amendment #0675h Adopted, Voice Vote; House Journal  26, PG.698-699 "
241239,2011-03-15,"House Ought to Pass with Amendment #0675h: Motion Adopted Voice Vote; House Journal  26, PG.698-699 "
241239,2011-04-20,"Senate Introduced and Referred to Commerce; Senate Journal 14, Pg.272 "
241239,2011-04-28,"Senate Hearing: 5/3/11, Room 102, Legislative Office Building, 9:00 a.m.; Senate Calendar 22 "
241239,2011-05-04,"Senate Committee Report: Ought to Pass, 5/11/11; Senate Calendar 23 "
241239,2011-05-11,"Senate Ought to Pass, Motion Adopted, Voice Vote; OT3rdg; Senate Journal 16, Pg.319 "
241239,2011-05-11,"Senate Passed by Third Reading Resolution "
241239,2011-05-25,"Senate Enrolled Bill Amendment #1986e Adopted; Senate Journal 19, Pg.394 "
241239,2011-05-25,"House Enrolled Bill Amendment #2011-1986e Adopted; House Journal  46, PG.1609 "
241239,2011-06-01,"Senate Enrolled; Senate Journal 20, Pg.546 "
241239,2011-06-01,"House Enrolled; House Journal  48, PG.1670 "
241239,2011-06-14,"House Law Without Signature 06/14/2011; Effective 06/14/2011; Chapter 0160; NH Constitution, Art.44, Pt.II "
241240,2011-01-20,"House Introduced 1/6/2011 and Referred to Fish and Game and Marine Resources; House Journal  11, PG. 181 "
241240,2011-02-01,"House Public Hearing: 2/10/2011 10:30 Amendment Legislative Office Building 307 "
241240,2011-02-16,"House Subcommittee Work Session: 2/23/2011 3:00 PM or immediately following House session Legislative Office Building 307 "
241240,2011-02-23,"House Subcommittee Work Session: 2/24/2011 1:30 PM Legislative Office Building 303 "
241240,2011-02-23,"House Executive Session: 3/3/2011 10:00 Amendment Legislative Office Building 307 "
241240,2011-03-03,"House Retained in Committee; House Calendar 27, PG.824 "
241240,2011-09-15,"House Retained Bill - Subcommittee Work Session: 10/5/2011 9:00 Amendment Legislative Office Building 307 "
241240,2011-09-15,"House Retained Bill - Executive Session: 10/18/2011 10:00 Amendment Legislative Office Building 307 "
241240,2011-10-21,"House Committee Report: Inexpedient to Legislate for Jan 4 (Vote 10-0; Consent Calendar) "
241241,2011-01-20,"House Introduced 1/6/2011 and Referred to Health, Human Services and Elderly Affairs; House Journal  11, PG. 181 "
241241,2011-01-25,"House Public Hearing: 2/3/2011 9:00 Amendment Legislative Office Building 205-207 "
241241,2011-02-09,"House Subcommittee Work Session: 2/15/2011 3:00 PM Legislative Office Building 205 "
241241,2011-02-15,"House Subcommittee Work Session: 2/16/2011 3:00 PM Legislative Office Building 205 "
241241,2011-03-01,"House Subcommittee Work Session: 3/3/2011 9:15 Amendment Legislative Office Building 205 "
241241,2011-03-01,"House Executive Session: 3/9/2011 10:00 Amendment Legislative Office Building 205 "
241241,2011-03-09,"House Committee Report: Ought to Pass with Amendment #0748h for Mar 15 (Vote 18-0; Regular Calendar); House Calendar 22, PG.555 "
241241,2011-03-09,"House Proposed Committee Amendment #2011-0748h; House Calendar 23, PG.599 "
241241,2011-03-16,"House Amendment #0748h Adopted, Voice Vote; House Journal  28, PG.858 "
241241,2011-03-16,"House Ought to Pass with Amendment #0748h: Motion Adopted Voice Vote; House Journal  28, PG.858 "
241241,2011-03-30,"Senate Introduced and Referred to Health and Human Services; Senate Journal 12, Pg.243 "
241241,2011-03-31,"Senate Hearing: 4/14/11, Room 100, State House, 2:00 p.m.; Senate Calendar 18 "
241241,2011-04-25,"Senate Committee Report: Ought to Pass with Amendment #2011-1539s, 5/4/11; Senate Calendar 22 "
241241,2011-05-04,"Senate Committee Amendment 1539s, Amendment Adopted, Voice Vote; Senate Journal 15, Pg.306 "
241241,2011-05-04,"Senate Sen. Bradley Floor Amendment #2011-1743s, Amendment Adopted, Voice Vote; Senate Journal 15, Pg.306 "
241241,2011-05-04,"Senate Ought to Pass with Amendments 1539s, 1743s, Motion Adopted, Voice Vote; OT3rdg; Senate Journal 15, Pg.307 "
241241,2011-05-04,"Senate Passed by Third Reading Resolution; Senate Journal 15, Pg.312 "
241241,2011-05-18,"House House Concurs with Senate Amendment #1539s (Rep Reagan): Motion Adopted Voice Vote; House Journal  44, PG.1531 "
241241,2011-06-01,"Senate Enrolled; Senate Journal 20, Pg.546 "
241241,2011-06-01,"House Enrolled; House Journal  48, PG.1669 "
241241,2011-06-09,"House Law Without Signature 06/09/2011; Effective 06/09/2011; Chapter 0157; NH Constitution, Art.44, Pt.II "
241242,2011-01-20,"House Introduced 1/6/2011 and Referred to Education; House Journal  11, PG. 181 "
241242,2011-02-09,"House Public Hearing: 3/1/2011 10:30 Amendment Legislative Office Building 205-207 "
241242,2011-02-18,"House Executive Session: 3/3/2011 10:00 Amendment Legislative Office Building 207 "
241242,2011-03-04,"House Retained in Committee; House Calendar 27, PG.823 "
241242,2011-09-21,"House Retained Bill - Subcommittee Work Session: 9/29/2011 11:00 Amendment Legislative Office Building 207 "
241242,2011-09-29,"House Retained Bill - Subcommittee Work Session: 10/4/2011 11:00 Amendment Legislative Office Building 207 "
241242,2011-10-04,"House Retained Bill - Subcommittee Work Session: 10/12/2011 Legislative Office Building 207 1:00 PM Or Immediately Following House Session "
241242,2011-10-13,"House Retained Bill - Subcommittee Work Session: 10/18/2011 9:50 Amendment Legislative Office Building 207 "
241242,2011-10-13,"House Retained Bill - Executive Session: 10/18/2011 10:00 Amendment Legislative Office Building 207 (If Necessary Continued 10/25/2011 10:00 Amendment Legislative Office Building 207) "
241243,2011-01-20,"House Introduced 1/6/2011 and Referred to Commerce and Consumer Affairs; House Journal  11, PG. 181 "
241243,2011-01-26,"House Public Hearing: 2/17/2011 1:15 PM Legislative Office Building 302 "
241243,2011-02-16,"House ==CANCELLED== Executive Session: 2/25/2011 10:00 Amendment Legislative Office Building 302 "
241243,2011-02-23,"House Executive Session: 3/1/2011 3:00 PM Legislative Office Building 302 "
241243,2011-03-02,"House Committee Report: Ought to Pass with Amendment #0404h for Mar 15 (Vote 12-0; Consent Calendar); House Calendar 22, PG.524 "
241243,2011-03-02,"House Proposed Committee Amendment #2011-0404h; House Calendar 23, PG.599 "
241243,2011-03-15,"House Amendment #0404h Adopted, Voice Vote; House Journal  26, PG.699 "
241243,2011-03-15,"House Ought to Pass with Amendment #0404h: Motion Adopted Voice Vote; House Journal  26, PG.699 "
241243,2011-03-23,"Senate Introduced and Referred to Commerce; Senate Journal 11, Pg.191 "
241243,2011-04-21,"Senate Hearing: 4/26/11, Room 102, Legislative Office Building, 9:00 a.m.; Senate Calendar 21 "
241243,2011-04-26,"Senate Committee Report: Ought to Pass, 5/4/11; Senate Calendar 22 "
241243,2011-05-04,"Senate Ought to Pass, Motion Adopted, Voice Vote; OT3rdg; Senate Journal 15, Pg.297 "
241243,2011-05-04,"Senate Passed by Third Reading Resolution; Senate Journal 15, Pg.312 "
241243,2011-05-18,"Senate Enrolled; Senate Journal 18, Pg.364 "
241243,2011-05-18,"House Enrolled; House Journal  44, PG.1564 "
241243,2011-06-01,"House Signed By Governor 05/27/2011; Effective 01/01/2012; Chapter 0096 "
241244,2011-01-20,"House Introduced 1/6/2011 and Referred to Criminal Justice and Public Safety; House Journal  11, PG. 181 "
241244,2011-02-01,"House Public Hearing: 2/10/2011 2:30 PM Legislative Office Building 204 "
241244,2011-02-16,"House Executive Session: 2/22/2011 10:00 Amendment Legislative Office Building 204 "
241244,2011-02-22,"House Committee Report: Inexpedient to Legislate for Mar 2 (Vote 15-0; Consent Calendar); House Calendar 18, PG.386 "
241244,2011-03-02,"House Inexpedient to Legislate: Motion Adopted Voice Vote; House Journal  25, PG.672 "
241245,2011-01-20,"House Introduced 1/6/2011 and Referred to Judiciary; House Journal  11, PG. 181 "
241245,2011-02-16,"House Public Hearing: 2/24/2011 3:00 PM Legislative Office Building 208 "
241245,2011-02-23,"House Executive Session: 3/1/2011 1:00 PM Legislative Office Building 208 "
241245,2011-03-02,"House Committee Report: Ought to Pass for Mar 15 (Vote 16-0; Consent Calendar); House Calendar 22, PG.533 "
241245,2011-03-15,"House Ought to Pass: Motion Adopted Voice Vote; House Journal  26, PG.718-719 "
241245,2011-03-23,"Senate Introduced and Referred to Judiciary; Senate Journal 11, Pg.191 "
241245,2011-05-04,"Senate Hearing: 5/12/11, Room 101, Legislative Office Building, 1:15 p.m.; Senate Calendar 23 "
241245,2011-05-13,"Senate Committee Report: Inexpedient to Legislate, 5/25/11; Senate Calendar 25 "
241245,2011-05-25,"Senate Inexpedient to Legislate Not Voted On; Senate Journal 18, Pg.385 "
241245,2011-05-25,"Senate Sen. Luther Moved Laid on Table, Motion Adopted, Voice Vote; Senate Journal 18, Pg.385 "
241246,2011-01-20,"House Introduced 1/6/2011 and Referred to Health, Human Services and Elderly Affairs; House Journal  11, PG. 181 "
241246,2011-01-25,"House Public Hearing: 2/1/2011 10:45 Amendment Legislative Office Building 205 "
241246,2011-02-08,"House Executive Session: 2/17/2011 10:00 Amendment Legislative Office Building 205 "
241246,2011-02-23,"House Committee Report: Inexpedient to Legislate for Mar 2 (Vote 15-0; Consent Calendar); House Calendar 18, PG.388 "
241246,2011-03-02,"House Inexpedient to Legislate: Motion Adopted Voice Vote; House Journal  25, PG.674 "
241247,2011-01-20,"House Introduced 1/6/2011 and Referred to Criminal Justice and Public Safety; House Journal  11, PG. 181 "
241247,2011-02-01,"House Public Hearing: 2/8/2011 10:00 Amendment Legislative Office Building 204 ==Executive Session to Follow== "
241247,2011-02-08,"House Committee Report: Ought to Pass with Amendment #0188h for Feb 15 (Vote 14-0; Consent Calendar); House Calendar 13, PG.231 "
241247,2011-02-08,"House Proposed Committee Amendment #2011-0188h; House Calendar 13, PG.258 "
241247,2011-02-15,"House Amendment #0188h Adopted, Voice Vote; House Journal  17, PG.359 "
241247,2011-02-15,"House Ought to Pass with Amendment #0188h: Motion Adopted Voice Vote; House Journal  17, PG.359 "
241247,2011-03-16,"Senate Introduced and Referred to Judiciary "
241247,2011-03-17,"Senate Hearing: 3/24/11, Room 101, Legislative Office Building, 1:45 p.m.; Senate Calendar 16 "
241247,2011-05-11,"Senate Committee Report: Inexpedient to Legislate, 5/18/11; Senate Calendar 24 "
241247,2011-05-18,"Senate Inexpedient to Legislate, Motion Adopted, Voice Vote === BILL KILLED ===; Senate Journal 17, Pg.353 "
241248,2011-01-21,"House Introduced 1/6/2011 and Referred to Criminal Justice and Public Safety; House Journal  11, PG. 181 "
241248,2011-02-01,"House Public Hearing: 2/8/2011 10:30 Amendment Legislative Office Building 204 ==Executive Session to Follow= "
241248,2011-02-08,"House Committee Report: Inexpedient to Legislate for Feb 15 (Vote 14-0; Consent Calendar); House Calendar 13, PG.231 "
241248,2011-02-15,"House Inexpedient to Legislate: Motion Adopted Voice Vote; House Journal  17, PG.359 "
241249,2011-01-21,"House Introduced 1/6/2011 and Referred to Health, Human Services and Elderly Affairs; House Journal  11, PG. 182 "
241249,2011-01-25,"House Public Hearing: 2/1/2011 1:00 PM Legislative Office Building 205 "
241249,2011-02-02,"House Subcommittee Work Session: 2/8/2011 2:30 PM Legislative Office Building 205 "
241249,2011-02-09,"House Subcommittee Work Session: 2/15/2011 1:30 PM Legislative Office Building 205 "
241249,2011-02-15,"House Subcommittee Work Session: 2/16/2011 1:30 PM Legislative Office Building 205 "
241249,2011-02-23,"House Executive Session: 3/1/2011 9:00 Amendment Legislative Office Building 205 "
241249,2011-03-02,"House Committee Report: Inexpedient to Legislate for Mar 15 (Vote 16-0; Consent Calendar); House Calendar 22, PG.532 "
241249,2011-03-15,"House Inexpedient to Legislate: Motion Adopted Voice Vote; House Journal  26, PG.717 "
241250,2011-01-21,"House Introduced 1/6/2011 and Referred to Children and Family Law "
241250,2011-02-01,"House Public Hearing: 2/10/2011 11:00 Amendment Legislative Office Building 206 "
241250,2011-02-15,"House Executive Session: 2/16/2011 Legislative Office Building 206 Following House Session "
241250,2011-02-17,"House Committee Report: Ought to Pass with Amendment #0354h for Mar 2 (Vote 16-0; Consent Calendar); House Calendar 18, PG.385 "
241250,2011-02-17,"House Proposed Committee Amendment #2011-0354h; House Calendar 18, PG.410 "
241250,2011-03-02,"House Amendment #0354h Adopted, Voice Vote; House Journal  25, PG.671 "
241250,2011-03-02,"House Ought to Pass with Amendment #0354h: Motion Adopted Voice Vote; House Journal  25, PG.671 "
241250,2011-03-16,"Senate Introduced and Referred to Judiciary "
241250,2011-04-13,"Senate Hearing: 4/21/11, Room 100, State House, 1:30 p.m.; Senate Calendar 20 "
241250,2011-04-22,"Senate Hearing: === RECESSED === 4/21/11, Room 100, State House, 1:30 p.m. "
241250,2011-04-27,"Senate Hearing: 5/5/11, Room 101, Legislative Office Building, 1:45 p.m.; Senate Calendar 22 "
241250,2011-05-05,"Senate Committee Report: Ought to Pass, 5/11/11; Senate Calendar 23 "
241250,2011-05-11,"Senate Ought to Pass, Motion Adopted, Voice Vote; OT3rdg; Senate Journal 16 "
241250,2011-05-11,"Senate Passed by Third Reading Resolution; Senate Journal 16 "
241250,2011-05-25,"Senate Enrolled Bill Amendment #1955e Adopted; Senate Journal 19, Pg.394 "
241250,2011-05-25,"House Enrolled Bill Amendment #2011-1955e Adopted; House Journal  46, PG.1609 "
241250,2011-06-01,"Senate Enrolled; Senate Journal 20, Pg.546 "
241250,2011-06-01,"House Enrolled; House Journal  48, PG.1669 "
241250,2011-06-09,"House Signed By Governor 06/08/2011; Effective 01/01/2012; Chapter 0151 "
241251,2011-01-21,"House Introduced 1/6/2011 and Referred to Judiciary; House Journal  11, PG. 182 "
241251,2011-01-26,"House Public Hearing: 2/3/2011 1:30 PM Legislative Office Building 208 "
241251,2011-02-16,"House ==CANCELLED== Executive Session: 3/1/2011 1:00 PM Legislative Office Building 208 "
241251,2011-03-02,"House Executive Session: 3/3/2011 10:00 Amendment Legislative Office Building 208 "
241251,2011-03-03,"House Retained in Committee; House Calendar 27, PG.824 "
241251,2011-09-15,"House Retained Bill - Subcommittee Work Session: 10/4/2011 11:00 Amendment Legislative Office Building 208 "
241251,2011-09-15,"House Retained Bill - Executive Session: 10/25/2011 11:00 Amendment Legislative Office Building 208 "
241252,2011-01-21,"House Introduced 1/6/2011 and Referred to Commerce and Consumer Affairs; House Journal  11, PG. 182 "
241252,2011-01-26,"House ==CANCELLED== Public Hearing: 2/15/2011 2:00 PM Legislative Office Building 302 "
241252,2011-02-01,"House Public Hearing: 2/22/2011 2:00 PM Legislative Office Building 302 "
241252,2011-02-16,"House ==CANCELLED== Executive Session: 2/25/2011 10:00 Amendment Legislative Office Building 302 "
241252,2011-02-23,"House Executive Session: 3/1/2011 3:00 PM Legislative Office Building 302 "
241252,2011-03-09,"House Committee Report: Ought to Pass with Amendment #0377h for Mar 15 (Vote 16-0; Consent Calendar); House Calendar 22, PG.524 "
241252,2011-03-09,"House Proposed Committee Amendment #2011-0377h; House Calendar 23, PG.600 "
241252,2011-03-15,"House Amendment #0377h Adopted, Voice Vote; House Journal  26, PG.699 "
241252,2011-03-15,"House Ought to Pass with Amendment #0377h: Motion Adopted Voice Vote; House Journal  26, PG.699 "
241252,2011-03-23,"Senate Introduced and Referred to Commerce; Senate Journal 11, Pg.191 "
241252,2011-04-28,"Senate Hearing: 5/3/11, Room 102, Legislative Office Building, 9:15 a.m.; Senate Calendar 22 "
241252,2011-05-04,"Senate Committee Report: Ought to Pass, 5/11/11; Senate Calendar 23 "
241252,2011-05-11,"Senate Ought to Pass, Motion Adopted, Voice Vote; OT3rdg; Senate Journal 16, Pg.320 "
241252,2011-05-11,"Senate Passed by Third Reading Resolution "
241252,2011-05-25,"Senate Enrolled; Senate Journal 19, Pg.395 "
241252,2011-05-25,"House Enrolled; House Journal  46, PG.1609 "
241252,2011-06-08,"House Signed by Governor 06/06/2011; Effective 07/01/2011; Chapter 0129 "
241253,2011-01-21,"House Introduced 1/6/2011 and Referred to Municipal and County Government; House Journal  11, PG. 182 "
241253,2011-01-26,"House Public Hearing: 2/1/2011 11:00 Amendment Legislative Office Building 301 ==RECESSED== "
241253,2011-02-01,"House Continued Public Hearing: 2/10/2011 2:45 PM Legislative Office Building 301 ==Executive Session to Follow== "
241253,2011-02-16,"House Committee Report: Inexpedient to Legislate for Feb 23 (Vote 13-0; Consent Calendar); House Calendar 15, PG.272 "
241253,2011-02-23,"House Inexpedient to Legislate: Motion Adopted Voice Vote; House Journal  21, PG.462 "
241254,2011-01-21,"House Introduced 1/6/2011 and Referred to Finance; House Journal  11, PG. 182 "
241254,2011-01-31,"House Public Hearing: 2/14/2011 10:00 Amendment Legislative Office Building 210-211 "
241254,2011-02-16,"House Executive Session: 2/16/2011 2:00 PM Legislative Office Building 210-211 "
241254,2011-02-17,"House Committee Report: Inexpedient to Legislate for Feb 23 (Vote 16-0; Consent Calendar); House Calendar 15, PG.269 "
241254,2011-02-23,"House Inexpedient to Legislate: Motion Adopted Voice Vote; House Journal  21, PG.460-461 "
241255,2011-01-21,"House Introduced 1/6/2011 and Referred to Commerce and Consumer Affairs; House Journal  11, PG. 182 "
241255,2011-01-26,"House Public Hearing: 2/17/2011 2:00 PM Legislative Office Building 302 "
241255,2011-02-16,"House ==CANCELLED== Executive Session: 2/25/2011 10:00 Amendment Legislative Office Building 302 "
241255,2011-02-23,"House Executive Session: 3/1/2011 3:00 PM Legislative Office Building 302 "
241255,2011-03-02,"House Committee Report: Ought to Pass for Mar 15 (Vote 11-1; Consent Calendar); House Calendar 22, PG.524 "
241255,2011-03-15,"House Ought to Pass: Motion Adopted Voice Vote; House Journal  26, PG.700 "
241255,2011-03-23,"Senate Introduced and Referred to Commerce; Senate Journal 11, Pg.191 "
241255,2011-04-21,"Senate Hearing: 4/26/11, Room 102, Legislative Office Building, 9:30 a.m.; Senate Calendar 21 "
241255,2011-05-17,"Senate Committee Report: Ought to Pass with Amendment #2011-1980s, 5/25/11; Senate Calendar 25 "
241255,2011-05-25,"Senate Committee Amendment 1980s, Amendment Adopted, Voice Vote; Senate Journal 18, Pg.378 "
241255,2011-05-25,"Senate Ought to Pass with Amendment 1980s, Motion Adopted, Voice Vote; OT3rdg; Senate Journal 18, Pg.378 "
241255,2011-05-25,"Senate Passed by Third Reading Resolution; Senate Journal 18, Pg.391 "
241255,2011-06-01,"House House Concurs with Senate Amendment #1980s (Rep Hunt): Motion Adopted Voice Vote; House Journal  48, PG.1624 "
241255,2011-06-08,"Senate Enrolled "
241255,2011-06-08,"House Enrolled; House Journal  51, PG.1726 "
241255,2011-06-14,"House Signed By Governor 06/14/2011; Effective 08/13/2011; Chapter 0166 "
241256,2011-01-19,"Senate Introduced and Referred to Transportation, Senate Journal 3, Pg.34 "
241256,2011-01-26,"Senate Hearing: 2/3/2011, Room 103, Legislative Office Building, 9:30 a.m.; Senate Calendar 9 "
241256,2011-02-08,"Senate Committee Report: Ought to Pass, 2/16/2011; Senate Calendar 11 "
241256,2011-02-16,"Senate Ought to Pass, Motion Adopted, Voice Vote; OT3rdg, Senate Journal 6, Pg.57 "
241256,2011-02-16,"Senate Passed by Third Reading Resolution, Senate Journal 6, Pg.61 "
241256,2011-02-16,"House Introduced and Referred to Transportation; House Journal  19, Pg. 438 "
241256,2011-03-22,"House Public Hearing: 4/5/2011 10:50 Amendment Legislative Office Building 203 ==Executive Session To Follow== "
241256,2011-04-06,"House Committee Report: Ought to Pass for April 13 (Vote 11-2; Consent Calendar); House Calendar 31, PG.1039 "
241256,2011-04-13,"House Ought to Pass: Motion Adopted Voice Vote; House Journal  37, Pg.1296 "
241256,2011-04-13,"House Enrolled; House Journal  37, PG.1305 "
241256,2011-04-20,"Senate Enrolled; Senate Journal 14, Pg.273 "
241256,2011-04-28,"Senate Signed by the Governor on 04/28/2011; Effective 01/01/2012; Chapter 0028 "
241257,2011-01-19,"Senate Introduced and Referred to Capital Budget, Senate Journal 3, Pg.34 "
241257,2011-03-07,"Senate Hearing: 3/22/11, Room 100, State House, 1:00 p.m.; Senate Calendar 15 "
241257,2011-03-22,"Senate Committee Report: Ought to Pass, 3/30/11; Senate Calendar 17 "
241257,2011-03-30,"Senate Ought to Pass, Motion Adopted, Voice Vote; Senate Journal 11, Pg.195 "
241257,2011-03-30,"Senate Pending Motion OT3rdg "
241257,2011-03-30,"Senate Sen. Odell Moved Laid on Table, Motion Adopted, Voice Vote; Senate Journal 11, Pg.195 "
241258,2011-01-19,"Senate Introduced and Referred to Judiciary, Senate Journal 3, Pg.34 "
241258,2011-01-26,"Senate Hearing: 2/3/2011, Room 101, Legislative Office Building, 1:45 p.m.; Senate Calendar 9 "
241258,2011-03-11,"Senate Committee Report: Ought to Pass with Amendment #2011-0799s, 3/23/11; Senate Calendar 16 "
241258,2011-03-23,"Senate Committee Amendment 0799s, Amendment Adopted, Voice Vote; Senate Journal 10, Pg.185 "
241258,2011-03-23,"Senate Ought to Pass with Amendment 0799s, Motion Adopted, Voice Vote; OT3rdg; Senate Journal 10, Pg.185 "
241258,2011-03-23,"Senate Passed by Third Reading Resolution; Senate Journal 10, Pg.187 "
241258,2011-03-28,"House Introduced and Referred to Judiciary; House Journal  30, PG.1037 "
241258,2011-04-12,"House Public Hearing: 4/19/2011 10:30 Amendment Legislative Office Building 208 "
241258,2011-04-19,"House Subcommittee Work Session: 4/26/2011 2:00 PM Legislative Office Building 208 "
241258,2011-04-26,"House Subcommittee Work Session: 5/3/2011 8:30 Amendment Legislative Office Building 208 "
241258,2011-05-10,"House Executive Session: 5/17/2011 11:00 Amendment Legislative Office Building 208 "
241258,2011-05-18,"House Committee Report: Ought to Pass with Amendment #1600h for May 25 (Vote 16-0; Consent Calendar); House Calendar 41, PG.1392 "
241258,2011-05-18,"House Proposed Committee Amendment #2011-1600h; House Calendar 41, PG.1407 "
241258,2011-05-25,"House Amendment #1600h Adopted, Voice Vote; House Journal  46, PG.1580 "
241258,2011-05-25,"House Ought to Pass with Amendment #1600h: Motion Adopted Voice Vote; House Journal  46, PG.1580 "
241258,2011-06-08,"Senate Sen. Houde Concurs with House Amendment #1600h, Motion Adopted, Voice Vote; Senate Journal 20, Pg.551 "
241258,2011-06-08,"House Enrolled Bill Amendment #2514e(NT) Adopted; House Journal  51, PG.1728 "
241258,2011-06-22,"Senate Enrolled Bill Amendment #2011-2514e, New Title, Adopted "
241258,2011-06-22,"House Enrolled; House Journal  57, PG.1859 "
241258,2011-06-22,"Senate Enrolled "
241258,2011-07-05,"Senate Signed by the Governor on 07/05/2011; Effective 09/03/2011; Chapter 0236 "
241259,2011-01-19,"Senate Introduced and Referred to Judiciary, Senate Journal 3, Pg.34 "
241259,2011-01-26,"Senate Hearing: 2/3/2011, Room 101, Legislative Office Building, 1:30 p.m.; Senate Calendar 9 "
241259,2011-02-15,"Senate Committee Report: Ought to Pass with Amendment #2011-0300s, 2/23/11; Senate Calendar 12 "
241259,2011-02-23,"Senate Committee Amendment 0300s, Amendment Adopted, Voice Vote; Senate Journal 7, Pg.75 "
241259,2011-02-23,"Senate Ought to Pass with Amendment 0300s, Motion Adopted, Voice Vote; OT3rdg; Senate Journal 7, Pg.75 "
241259,2011-02-23,"Senate Passed by Third Reading Resolution; Senate Journal 7, Pg.77 "
241259,2011-03-16,"House Introduced and Referred to Judiciary; House Journal  28, Pg.882 "
241259,2011-03-29,"House Public Hearing: 4/5/2011 10:30 Amendment Legislative Office Building 208 "
241259,2011-04-14,"House Subcommittee Work Session: 4/26/2011 1:00 PM Legislative Office Building 208 "
241259,2011-04-27,"House Executive Session: 5/3/2011 10:00 Amendment Legislative Office Building 208 "
241259,2011-05-11,"House Committee Report: Ought to Pass with Amendment #1696h(NT) for May 18 (Vote 16-0; Consent Calendar); House Calendar 39, PG.1321 "
241259,2011-05-11,"House Proposed Committee Amendment #2011-1696h (New Title); House Calendar 39, PG.1341-1342 "
241259,2011-05-18,"House Amendment #1696h(NT) Adopted, Voice Vote; House Journal  44, PG.1534-1535 "
241259,2011-05-18,"House Ought to Pass with Amendment #1696h(NT): Motion Adopted Voice Vote; House Journal  44, PG.1534-1535 "
241259,2011-06-08,"Senate Sen. Houde Concurs with House Amendment #1696h, New Title, Motion Adopted, Voice Vote; Senate Journal 20, Pg.551 "
241259,2011-06-08,"House Enrolled; House Journal  51, PG.1728 "
241259,2011-06-08,"Senate Enrolled "
241259,2011-06-28,"Senate Signed by the Governor on 06/28/2011; Effective 01/01/2012; Chapter 0217 "
241260,2011-01-19,"Senate Introduced and Referred to Judiciary, Senate Journal 3, Pg.34 "
241260,2011-01-26,"Senate Hearing: 2/3/2011, Room 101, Legislative Office Building, 1:15 p.m.; Senate Calendar 9 "
241260,2011-02-08,"Senate Committee Report: Ought to Pass, 2/16/2011; Senate Calendar 11 "
241260,2011-02-16,"Senate Ought to Pass, Motion Adopted, Voice Vote; OT3rdg, Senate Journal 5, Pg.56 "
241260,2011-02-16,"Senate Passed by Third Reading Resolution, Senate Journal 6, Pg.61 "
241260,2011-02-16,"House Introduced and Referred to Judiciary; House Journal  19, Pg. 438 "
241260,2011-03-29,"House Public Hearing: 4/5/2011 10:00 Amendment Legislative Office Building 208 "
241260,2011-05-10,"House Executive Session: 5/17/2011 11:00 Amendment Legislative Office Building 208 "
241260,2011-05-18,"House Committee Report: Ought to Pass for May 25 (Vote 14-0; Consent Calendar); House Calendar 41, PG.1392 "
241260,2011-05-25,"House Ought to Pass: Motion Adopted Voice Vote; House Journal  46, PG.1580 "
241260,2011-06-08,"House Enrolled; House Journal  51, PG.1724 "
241260,2011-06-08,"Senate Enrolled "
241260,2011-06-14,"Senate Signed by the Governor on 06/14/2011; Effective 06/14/2011; Chapter 0196 "
241261,2011-01-19,"Senate Introduced and Referred to Transportation, Senate Journal 3, Pg.34 "
241261,2011-01-26,"Senate Hearing: 2/3/2011, Room 103, Legislative Office Building, 9:00 a.m.; Senate Calendar 9 "
241261,2011-02-10,"Senate Committee Report: Ought to Pass, 2/16/2011; Senate Calendar 11 "
241261,2011-02-16,"Senate Ought to Pass, Motion Adopted, Voice Vote; OT3rdg, Senate Journal 5, Pg.59 "
241261,2011-02-16,"Senate Passed by Third Reading Resolution, Senate Journal 6, Pg.61 "
241261,2011-02-16,"House Introduced and Referred to Transportation; House Journal  19, Pg. 438 "
241261,2011-03-22,"House Public Hearing: 4/5/2011 11:15 Amendment Legislative Office Building 203 ==Executive Session To Follow== "
241261,2011-04-06,"House Committee Report: Ought to Pass for April 13 (Vote 12-1; Consent Calendar); House Calendar 31, PG.1040 "
241261,2011-04-13,"House Removed from Consent Calendar (Rep Packard); House Journal  37, PG.1296 "
241261,2011-04-13,"House Floor Amendment #2011-1399h (New Title) (Rep Packard) Adopted, Division Vote 258-90; House Journal  37, PG.1302-1303 "
241261,2011-04-13,"House Ought to Pass with Amendment #1399h(NT): Motion Adopted Voice Vote; House Journal  37, PG.1302-1303 "
241261,2011-04-20,"Senate Sen. Rausch Concurs with House Amendment 1399h, New Title, Motion Adopted, Voice Vote; Senate Journal 13, Pg.269 "
241261,2011-05-04,"House Enrolled; House Journal  42, PG.1490 "
241261,2011-05-04,"Senate Enrolled; Senate Journal 16, Pg.318 "
241261,2011-05-19,"Senate Signed by the Governor on 05/16/2011; Effective 07/15/2011; Chapter 0083 "
241262,2011-01-19,"Senate Introduced and Referred to Education, Senate Journal 3, Pg.34 "
241262,2011-01-27,"Senate Hearing: 2/8/2011, Room 103, Legislative Office Building, 2:00 p.m.; Senate Calendar 9 "
241262,2011-02-09,"Senate Committee Report: Ought to Pass with Amendment #2011-0246s, 2/16/2011; Senate Calendar 11 "
241262,2011-02-16,"Senate Committee Amendment 0246s, Amendment Adopted, Voice Vote, Senate Journal 6, Pg.54 "
241262,2011-02-16,"Senate Ought to Pass with Amendment 0246s, Motion Adopted, Voice Vote; OT3rdg, Senate Journal 6, Pg.54 "
241262,2011-02-16,"Senate Passed by Third Reading Resolution, Senate Journal 6, Pg.61 "
241262,2011-02-16,"House Introduced and Referred to Education; House Journal  19, Pg.439 "
241262,2011-04-05,"House Public Hearing: 4/21/2011 1:30 PM Legislative Office Building 207 "
241262,2011-04-27,"House Executive Session: 5/17/2011 1:00 PM Legislative Office Building 205-207 "
241262,2011-05-18,"House Majority Committee Report: Ought to Pass with Amendment #1962h(NT) for May 25 (Vote 12-4; Regular Calendar); House Calendar 41, PG.1394 "
241262,2011-05-18,"House Proposed Majority Committee Amendment #2011-1962h (New Title); House Calendar 41, PG.1407-1408 "
241262,2011-05-18,"House Minority Committee Report: Inexpedient to Legislate; House Calendar 41, PG.1394 "
241262,2011-05-25,"House Amendment #1962h(NT) Adopted, Voice Vote; House Journal  46, PG.1591-1592 "
241262,2011-05-25,"House Ought to Pass with Amendment #1962h(NT): Motion Adopted Regular Calendar 273-100; House Journal  46, PG.1591-1594 "
241262,2011-06-08,"Senate Sen. Stiles Concurs with House Amendment #1962h, New Title, Motion Adopted, Voice Vote; Senate Journal 20, Pg.550 "
241262,2011-06-08,"Senate Enrolled "
241262,2011-06-08,"House Enrolled; House Journal  51, PG.1727 "
241262,2011-06-28,"Senate Signed by the Governor on 06/28/2011; Effective 06/28/2011; Chapter 0218 "
241263,2011-01-19,"Senate Introduced and Referred to Executive Departments and Administration, Senate Journal 3, Pg.34 "
241263,2011-01-27,"Senate Hearing: 2/3/11, Room 100 State House, 9:15 a.m.; Senate Calendar 9 "
241263,2011-02-08,"Senate Committee Report: Ought to Pass, 2/16/2011; Senate Calendar 11 "
241263,2011-02-16,"Senate Ought to Pass, Motion Adopted, Voice Vote; OT3rdg, Senate Journal 5, Pg.56"
241263,2011-02-16,"Senate Passed by Third Reading Resolution, Senate Journal 6, Pg.61"
241263,2011-02-16,"House Introduced and Referred to Executive Departments and Administration; House Journal  19, Pg.439 "
241263,2011-03-15,"House Public Hearing: 3/22/2011 10:45 Amendment Legislative Office Building 306 "
241263,2011-04-05,"House ==CANCELLED== Executive Session: 4/19/2011 1:15 PM Legislative Office Building 306 "
241263,2011-04-20,"House ==CANCELLED== Executive Session: 4/26/2011 1:15 PM Legislative Office Building 307 "
241263,2011-05-06,"House Executive Session: 5/17/2011 10:30 Amendment Legislative Office Building 306 "
241263,2011-05-19,"House Committee Report: Ought to Pass with Amendment #1844h for May 25 (Vote 14-0; Consent Calendar); House Calendar 41, PG.1391 "
241263,2011-05-19,"House Proposed Committee Amendment #2011-1844h; House Calendar 41, PG.1408 "
241263,2011-05-25,"House Amendment #1844h Adopted, Voice Vote; House Journal  46, PG.1580 "
241263,2011-05-25,"House Ought to Pass with Amendment #1844h: Motion Adopted Voice Vote; House Journal  46, PG.1580 "
241263,2011-06-08,"Senate Sen. Carson Moved Nonconcur with House Amendment 1844h; Requests C of C, Motion Adopted, Voice Vote; Senate Journal 20 "
241263,2011-06-08,"Senate President Appoints: Senators Gallus, Luther and Larsen "
241263,2011-06-08,"House House Accedes to Senate Request for C of C (Rep McGuire): Motion Adopted Voice Vote; House Journal  51, PG.1723 "
241263,2011-06-08,"House Speaker Appoints: Reps Hawkins, Sytek, Hansen, and Bowers; House Journal  51, PG.1723 "
241263,2011-06-09,"Senate Committee of Conference Meeting: 6/14/2011, 11:00 a.m., Room 100, State House "
241263,2011-06-16,"House Conference Committee Report #2011-2395c, House Amendment + New Amendment, Filed; House Calendar 49, PG.1674 "
241263,2011-06-22,"House Conference Committee Report #2395c Adopted, Voice Vote; House Journal  57, PG.1807-1808 "
241263,2011-06-22,"Senate Conference Committee Report 2395c; Adopted, Voice Vote "
241263,2011-06-22,"House Enrolled; House Journal  57, PG.1859 "
241263,2011-06-22,"Senate Enrolled "
241263,2011-07-13,"Senate Signed by the Governor on 07/13/2011; Effective 09/11/2011; Chapter 0246 "
241264,2011-01-19,"Senate Introduced and Referred to Transportation, Senate Journal 3, Pg.34 "
241264,2011-01-26,"Senate Hearing: 2/3/2011, Room 103, Legislative Office Building, 10:00 a.m.; Senate Calendar 9 "
241264,2011-02-08,"Senate Committee Report: Inexpedient to Legislate, 2/16/2011; Senate Calendar 11 "
241264,2011-02-16,"Senate Inexpedient to Legislate, Motion Adopted, Voice Vote === BILL KILLED ===, Senate Journal 6, Pg.59 "
241265,2011-01-19,"Senate Introduced and Referred to Public and Municipal Affairs, Senate Journal 3, Pg.34 "
241265,2011-01-27,"Senate Hearing: 2/1/11, Room 100 State House, 10:30 a.m.; Senate Calendar 9 "
241265,2011-02-08,"Senate Committee Report: Inexpedient to Legislate, 2/16/2011; Senate Calendar 11 "
241265,2011-02-16,"Senate Inexpedient to Legislate, Motion Adopted, Voice Vote === BILL KILLED ===, Senate Journal 6, Pg.57 "
242730,2011-01-20,"House Introduced 1/6/2011 and Referred to Election Law; House Journal  11, PG. 179 "
242730,2011-02-08,"House Public Hearing: 2/22/2011 11:00 Amendment Legislative Office Building 308 "
242730,2011-03-02,"House Executive Session: 3/9/2011 10:30 Amendment Legislative Office Building 308 "
242730,2011-03-10,"House Majority Committee Report: Inexpedient to Legislate for Mar 15 (Vote 13-5; Regular Calendar); House Calendar 22, PG.552 "
242730,2011-03-10,"House Minority Committee Report: Ought to Pass; House Calendar 22, PG.552 "
242730,2011-03-15,"House Inexpedient to Legislate: Motion Adopted Voice Vote; House Journal  26, PG.796 "
242731,2011-01-20,"House Introduced 1/6/2011 and Referred to Special Committee on Public Employee Pensions Reform; House Journal  11, PG. 179 "
242731,2011-01-25,"House Public Hearing: 2/18/2011 10:00 Amendment RepresentativeS HALL ==ROOM CHANGE (Orig Legislative Office Building 201-203)== "
242731,2011-02-08,"House ==CANCELLED==Full Committee Work Session: 2/18/2011 2:00 PM Legislative Office Building 201-203 "
242731,2011-02-09,"House ==CANCELLED==Executive Session: 2/18/2011 3:00 PM Legislative Office Building 201-203 "
242731,2011-03-02,"House ==RESCHEDULED== Full Committee Work Session: 3/4/2011 2:00 PM Legislative Office Building 305-307 (Orig Legislative Office Building 201-203) "
242731,2011-03-02,"House Executive Session: 3/4/2011 3:00 PM Legislative Office Building 201-203 "
242731,2011-03-04,"House Retained in Committee; House Calendar 27, PG.825 "
242731,2011-09-21,"House Retained Bill - Executive Session: 9/29/2011 1:30 PM Legislative Office Building 305-307 "
242731,2011-10-04,"House Committee Report: Inexpedient to Legislate for Jan 4 (Vote 11-0; Consent Calendar) "
242732,2011-01-20,"House Introduced 1/6/2011 and Referred to Resources, Recreation and Development; House Journal  11, PG. 179 "
242732,2011-01-26,"House Public Hearing: 2/3/2011 10:30 Amendment Legislative Office Building 305 "
242732,2011-01-26,"House Executive Session: 2/8/2011 1:00 PM Legislative Office Building 305 "
242732,2011-02-10,"House Committee Report: Inexpedient to Legislate for Feb 15 (Vote 15-0; Consent Calendar); House Calendar 13, PG.232 "
242732,2011-02-15,"House Inexpedient to Legislate: Motion Adopted Voice Vote; House Journal  17, PG.360 "
242733,2011-01-20,"House Introduced 1/6/2011 and Referred to Municipal and County Government; House Journal  11, PG. 180  "
242733,2011-01-26,"House Public Hearing: 2/1/2011 1:00 PM Legislative Office Building 301 "
242733,2011-01-30,"House Executive Session: 2/9/2011 Legislative Office Building 301 Following House Session "
242733,2011-02-09,"House Committee Report: Inexpedient to Legislate for Feb 15 (Vote 16-0; Regular Calendar); House Calendar 13, PG.236 "
242733,2011-02-15,"House Special Order to Feb 16: Motion Adopted Without Objection; House Journal  17, PG.378 "
242733,2011-02-16,"House Inexpedient to Legislate: Motion Adopted Voice Vote; House Journal  19, PG.415 "
242734,2011-01-20,"House Introduced 1/6/2011 and Referred to Public Works and Highways; House Journal  11, PG.180  "
242734,2011-01-25,"House Public Hearing: 2/10/2011 9:30 Amendment Legislative Office Building 201 "
242734,2011-02-02,"House Executive Session: 2/16/2011 Legislative Office Building 201 1:00 PM or Immediately Following House Session "
242734,2011-02-16,"House Retained in Committee; House Calendar 27, PG.825 "
242734,2011-08-24,"House Retained Bill - Executive Session: 9/27/2011 10:00 Amendment Legislative Office Building 201 "
242734,2011-09-28,"House Committee Report: Inexpedient to Legislate for Jan 4 (Vote 12-0; Consent Calendar) "
242735,2011-01-20,"House Introduced 1/6/2011 and Referred to Finance; House Journal  11, PG. 180 "
242735,2011-01-31,"House ==CANCELLED== Public Hearing: 2/14/2011 10:30 Amendment Legislative Office Building 210-211 "
242735,2011-01-31,"House Public Hearing: 2/10/2011 10:00 Amendment Legislative Office Building 210-211 "
242735,2011-02-23,"House Executive Session: 3/1/2011 10:00 Amendment Legislative Office Building 210-211 "
242735,2011-03-01,"House Retained in Committee; House Calendar 27, PG.824 "
242735,2011-08-18,"House Retained Bill - Subcommittee Work Session: 9/8/2011 10:00 Amendment Legislative Office Building 210-211 "
242735,2011-08-18,"House Retained Bill - Subcommittee Work Session: 9/15/2011 10:00 Amendment Legislative Office Building 210-211 "
242735,2011-09-08,"House Retained Bill - Subcommittee Work Session: 9/22/2011 9:00 Amendment Legislative Office Building 210-211 ==TIME CHANGE (Orig 10:00 Amendment)== "
242735,2011-09-08,"House Retained Bill - Subcommittee Work Session: 9/29/2011 10:00 Amendment Legislative Office Building 210-211 "
242735,2011-09-14,"House Retained Bill - Subcommittee Work Session: 10/6/2011 10:00 Amendment Legislative Office Building 210-211 "
242735,2011-09-14,"House Retained Bill - Subcommittee Work Session: 10/13/2011 10:00 Amendment Legislative Office Building 210-211 "
242735,2011-10-13,"House ==CANCELLED== Retained Bill - Subcommittee Work Session: 10/20/2011 10:00 Amendment Legislative Office Building 210-211 "
242735,2011-10-13,"House ==CANCELLED== Retained Bill - Subcommittee Work Session: 10/27/2011 10:00 Amendment Legislative Office Building 210-211 "
242735,2011-10-13,"House Retained Bill - Executive Session: 10/25/2011 10:00 Amendment Legislative Office Building 210-211 "
242735,2011-10-26,"House Committee Report: Ought to Pass with Amendment #2714h(NT) for Jan 4 (Vote 17-4; Regular Calendar) "
242735,2011-10-26,"House Proposed Committee Amendment #2011-2714h (New Title) "
242736,2011-01-21,"House Introduced 1/6/2011 and Referred to Municipal and County Government; House Journal  11, PG. 180 "
242736,2011-01-26,"House Public Hearing: 2/3/2011 1:00 PM Legislative Office Building 301 "
242736,2011-02-16,"House Executive Session: 2/16/2011 Legislative Office Building 301 Following House Session "
242736,2011-02-17,"House Committee Report: Inexpedient to Legislate for Feb 23 (Vote 15-0; Consent Calendar); House Calendar 15, PG.271-272 "
242736,2011-02-23,"House Inexpedient to Legislate: Motion Adopted Voice Vote; House Journal  21, PG.462 "
242737,2011-01-20,"House Introduced 1/6/2011 and Referred to Transportation; House Journal  11, PG. 180 "
242737,2011-01-25,"House Public Hearing: 2/1/2011 10:45 Amendment Legislative Office Building 203 "
242737,2011-02-16,"House Executive Session: 3/2/2011 Legislative Office Building 203 3:00 PM or Immediately Following House Session "
242737,2011-03-03,"House Committee Report: Inexpedient to Legislate for Mar 15 (Vote 13-0; Consent Calendar); House Calendar 22, PG.542 "
242737,2011-03-15,"House Inexpedient to Legislate: Motion Adopted Voice Vote; House Journal  26, PG.741 "
242738,2011-01-20,"House Introduced 1/6/2011 and Referred to Executive Departments and Administration; House Journal  11, PG. 180 "
242738,2011-01-26,"House Public Hearing: 2/8/2011 10:00 Amendment Legislative Office Building 306 "
242738,2011-02-14,"House Executive Session: 2/16/2011 Legislative Office Building 306 1:30 PM or 45 minutes after House session "
242738,2011-02-17,"House Committee Report: Inexpedient to Legislate for Feb 23 (Vote 16-0; Consent Calendar); House Calendar 15, PG.269 "
242738,2011-02-23,"House Inexpedient to Legislate: Motion Adopted Voice Vote; House Journal  21, PG.460 "
242739,2011-01-20,"House Introduced 1/6/2011 and Referred to Election Law; House Journal  11, PG. 180 "
242739,2011-02-08,"House Public Hearing: 2/22/2011 11:45 Amendment Legislative Office Building 308 "
242739,2011-03-02,"House Executive Session: 3/9/2011 10:30 Amendment Legislative Office Building 308 "
242739,2011-03-10,"House Committee Report: Ought to Pass with Amendment #0544h for Mar 15 (Vote 18-0; Consent Calendar); House Calendar 22, PG.528 "
242739,2011-03-10,"House Proposed Committee Amendment #2011-0544h; House Calendar 23, PG.597 "
242739,2011-03-15,"House Amendment #0544h Adopted, Voice Vote; House Journal  26, PG.707-708 "
242739,2011-03-15,"House Ought to Pass with Amendment #0544h: Motion Adopted Voice Vote; House Journal  26, PG.707-708 "
242739,2011-03-30,"Senate Introduced and Referred to Public and Municipal Affairs; Senate Journal 12, Pg.243 "
242739,2011-04-14,"Senate Hearing: 4/19/11, Room 101, Legislative Office Building, 10:30 a.m.; Senate Calendar 20 "
242739,2011-04-20,"Senate Committee Report: Ought to Pass, 4/27/11; Senate Calendar 21 "
242739,2011-04-27,"Senate Ought to Pass, Motion Adopted, Voice Vote; OT3rdg; Senate Journal 14 "
242739,2011-04-27,"Senate Passed by Third Reading Resolution; Senate Journal 14 "
242739,2011-05-04,"Senate Enrolled; Senate Journal 16, Pg.318 "
242739,2011-05-04,"House Enrolled; House Journal  42, PG.1490 "
242739,2011-05-20,"House Signed by Governor 05/16/2011; Effective 07/15/2011; Chapter 0073 "
242740,2011-01-20,"House Introduced 1/6/2011 and Referred to Labor, Industrial and Rehabilitative Services; House Journal  11, PG. 180 "
242740,2011-01-25,"House Public Hearing: 2/1/2011 11:15 Amendment Legislative Office Building 307 "
242740,2011-02-09,"House Executive Session: 3/1/2011 1:00 PM Legislative Office Building 307 "
242740,2011-03-03,"House Majority Committee Report: Inexpedient to Legislate for Mar 15 (Vote 11-4; Regular Calendar); House Calendar 22, PG.560 "
242740,2011-03-03,"House Minority Committee Report: Ought to Pass; House Calendar 22, PG.560 "
242740,2011-03-16,"House Inexpedient to Legislate: Motion Adopted Division Vote 267-62; House Journal  28, PG.899-900 "
242741,2011-01-20,"House Introduced 1/6/2011 and Referred to Commerce and Consumer Affairs; House Journal  11, PG. 180 "
242741,2011-01-25,"House Public Hearing: 2/1/2011 2:30 PM Legislative Office Building 302 ==RECESSED== "
242741,2011-02-09,"House Continued Public Hearing: 2/22/2011 3:45 PM Legislative Office Building 302 "
242741,2011-02-16,"House ==CANCELLED== Executive Session: 2/25/2011 10:00 Amendment Legislative Office Building 302 "
242741,2011-02-24,"House Subcommittee Work Session: 2/28/2011 1:00 PM Legislative Office Building 302 "
242741,2011-02-24,"House Executive Session: 3/1/2011 3:00 PM Legislative Office Building 302 "
242741,2011-03-09,"House Committee Report: Ought to Pass for Mar 15 (Vote 16-0; Regular Calendar); House Calendar 22, PG.547 "
242741,2011-03-15,"House Ought to Pass: Motion Adopted Voice Vote; House Journal  26, PG.754 "
242741,2011-03-23,"Senate Introduced and Referred to Commerce; Senate Journal 11, Pg.191 "
242741,2011-04-07,"Senate Hearing: 4/12/11, Room 102, Legislative Office Building, 9:20 a.m.; Senate Calendar 19 "
242741,2011-05-04,"Senate Committee Report: Ought to Pass, 5/11/11; Senate Calendar 23 "
242741,2011-05-11,"Senate Ought to Pass Not Voted On "
242741,2011-05-11,"Senate Sen. De Blois Moved Recommit to Committee, Motion Adopted, Voice Vote; Senate Journal 16 "
242741,2011-05-12,"Senate Hearing on proposed amendment #1888s to HB 276 "
242741,2011-05-26,"Senate Committee Report: Ought to Pass, 6/1/11; Senate Calendar 26 "
242741,2011-06-01,"Senate Sen. DAllesandro Floor Amendment #2011-2254s, Amendment Failed, Voice Vote; Senate Journal 19, Pg.510 "
242741,2011-06-01,"Senate Ought to Pass, Motion Adopted, Voice Vote; OT3rdg; Senate Journal 19, Pg.510 "
242741,2011-06-01,"Senate Passed by Third Reading Resolution; Senate Journal 19, Pg.539 "
242741,2011-06-08,"Senate Enrolled "
242741,2011-06-08,"House Enrolled; House Journal  51, PG.1726 "
242741,2011-06-14,"House Signed By Governor 06/14/2011; Effective 08/13/2011; Chapter 0165 "
242742,2011-01-20,"House Introduced 1/6/2011 and Referred to Ways and Means; House Journal  11, PG. 180 "
242742,2011-02-09,"House Public Hearing: 2/17/2011 2:15 PM Legislative Office Building 202 "
242742,2011-02-23,"House Executive Session: 2/24/2011 12:30 PM Legislative Office Building 202 "
242742,2011-02-24,"House Committee Report: Ought to Pass for Mar 15 (Vote 19-0; Regular Calendar); House Calendar 22, PG.571 "
242742,2011-03-17,"House Ought to Pass: Motion Adopted Voice Vote; House Journal  30, PG.1010 "
242742,2011-03-23,"Senate Introduced and Referred to Ways & Means; Senate Journal 11, Pg.191 "
242742,2011-03-24,"Senate Hearing: 3/29/11, Room 100, State House, 1:30 p.m.; Senate Calendar 17 "
242742,2011-04-20,"Senate Committee Report: Ought to Pass, 4/27/11; Senate Calendar 21 "
242742,2011-04-27,"Senate Ought to Pass, Motion Adopted, Voice Vote; OT3rdg; Senate Journal 14 "
242742,2011-04-27,"Senate Passed by Third Reading Resolution; Senate Journal 14 "
242742,2011-05-04,"Senate Enrolled; Senate Journal 16, Pg.318 "
242742,2011-05-04,"House Enrolled; House Journal  42, PG.1490 "
242742,2011-05-20,"House Signed by Governor 05/16/2011; Effective 07/01/2011; Chapter 0074 "
242743,2011-01-20,"House Introduced 1/6/2011 and Referred to Criminal Justice and Public Safety; House Journal  11, PG. 180 "
242743,2011-02-01,"House Public Hearing: 2/8/2011 11:00 Amendment Legislative Office Building 204 "
242743,2011-02-16,"House Executive Session: 2/22/2011 10:00 Amendment Legislative Office Building 204 "
242743,2011-02-22,"House Committee Report: Inexpedient to Legislate for Mar 2 (Vote 15-0; Consent Calendar); House Calendar 18, PG.386 "
242743,2011-03-02,"House Inexpedient to Legislate: Motion Adopted Voice Vote; House Journal  25, PG.672 "
242744,2011-01-20,"House Introduced 1/6/2011 and Referred to Criminal Justice and Public Safety; House Journal  11, PG. 180 "
242744,2011-02-16,"House Public Hearing: 3/1/2011 10:00 Amendment Legislative Office Building 204 "
242744,2011-03-02,"House Executive Session: 3/9/2011 10:00 Amendment Legislative Office Building 204 "
242744,2011-03-09,"House Retained in Committee; House Calendar 27, PG.823 "
242744,2011-08-10,"House Retained Bill - Subcommittee Work Session: 8/18/2011 10:00 Amendment Legislative Office Building 204 "
242744,2011-08-18,"House Retained Bill - Subcommittee Work Session: 9/1/2011 1:00 PM Legislative Office Building 204 "
242744,2011-09-06,"House Retained Bill - Subcommittee Work Session: 9/7/2011 1:00 PM Legislative Office Building 204 "
242744,2011-09-07,"House Retained Bill - Subcommittee Work Session: 9/27/2011 10:00 Amendment Legislative Office Building 204 "
242744,2011-09-27,"House Retained Bill - Subcommittee Work Session: 10/4/2011 1:00 PM Legislative Office Building 204 "
242744,2011-09-27,"House Retained Bill - Subcommittee Work Session: 10/6/2011 11:00 Amendment Legislative Office Building 204 "
242744,2011-09-27,"House Retained Bill - Executive Session: 10/20/2011 10:00 Amendment Legislative Office Building 204 "
242744,2011-10-25,"House Committee Report: Ought to Pass with Amendment #2682h for Jan 4 (Vote 17-0; Consent Calendar) "
242744,2011-10-25,"House Proposed Committee Amendment #2011-2682h "
242745,2011-01-20,"House Introduced 1/6/2011 and Referred to Health, Human Services and Elderly Affairs; House Journal  11, PG. 180 "
242745,2011-01-25,"House Public Hearing: 2/1/2011 1:50 PM Legislative Office Building 205 "
242745,2011-02-08,"House Executive Session: 2/17/2011 10:00 Amendment Legislative Office Building 205 "
242745,2011-03-02,"House Committee Report: Ought to Pass with Amendment #0322h for Mar 15 (Vote 15-0; Consent Calendar); House Calendar 22, PG.532 "
242745,2011-03-02,"House Proposed Committee Amendment #2011-0322h; House Calendar 23, PG.597-598 "
242745,2011-03-15,"House Amendment #0322h Adopted, Voice Vote; House Journal  26, PG.716-717 "
242745,2011-03-15,"House Ought to Pass with Amendment #0322h: Motion Adopted Voice Vote; House Journal  26, PG.716-717 "
242745,2011-03-30,"Senate Introduced and Referred to Health and Human Services; Senate Journal 12, Pg.243 "
242745,2011-04-14,"Senate Hearing: 4/21/11, Room 102, Legislative Office Building, 1:00 p.m.; Senate Calendar 20 "
242745,2011-04-25,"Senate Committee Report: Ought to Pass, 5/4/11; Senate Calendar 22 "
242745,2011-05-04,"Senate Ought to Pass, Motion Adopted, Voice Vote; OT3rdg; Senate Journal 15, Pg.306 "
242745,2011-05-04,"Senate Passed by Third Reading Resolution; Senate Journal 15, Pg.312 "
242745,2011-05-18,"Senate Enrolled Bill Amendment #1820e Adopted; Senate Journal 18, Pg.363 "
242745,2011-05-18,"House Enrolled Bill Amendment #2011-1820e Adopted; House Journal  44, PG.1566 "
242745,2011-05-25,"Senate Enrolled; Senate Journal 19, Pg.395 "
242745,2011-05-25,"House Enrolled; House Journal  46, PG.1609 "
242745,2011-06-08,"House Signed by Governor 06/02/2011; Effective 08/01/2011; Chapter 0121 "
242746,2011-01-20,"House Introduced 1/6/2011 and Referred to Transportation; House Journal  11, PG. 180 "
242746,2011-01-25,"House Public Hearing: 2/1/2011 10:00 Amendment Legislative Office Building 203 "
242746,2011-02-16,"House Executive Session: 2/16/2011 1:45 PM Legislative Office Building 203 "
242746,2011-02-17,"House Committee Report: Inexpedient to Legislate for Feb 23 (Vote 14-1; Consent Calendar); House Calendar 15, PG.273 "
242746,2011-02-23,"House Inexpedient to Legislate: Motion Adopted Voice Vote; House Journal  21, PG.464 "
242747,2011-01-20,"House Introduced 1/6/2011 and Referred to Judiciary; House Journal  11, PG. 180 "
242747,2011-01-26,"House Public Hearing: 2/3/2011 10:00 Amendment Legislative Office Building 208 "
242747,2011-02-09,"House Executive Session: 2/14/2011 10:00 Amendment Legislative Office Building 208 "
242747,2011-02-15,"House Committee Report: Inexpedient to Legislate for Feb 23 (Vote 15-0; Consent Calendar); House Calendar 15, PG.271 "
242747,2011-02-23,"House Inexpedient to Legislate: Motion Adopted Voice Vote; House Journal  21, PG.461 "
242748,2011-01-20,"House Introduced 1/6/2011 and Referred to Finance; House Journal  11, PG. 180 "
242748,2011-01-31,"House ==CANCELLED== Public Hearing: 2/14/2011 11:00 Amendment Legislative Office Building 210-211 "
242748,2011-02-09,"House Vacated from Finance and Referred to Public Works and Highways; House Journal  16, PG.308 "
242748,2011-02-09,"House Public Hearing: 3/1/2011 10:00 Amendment Legislative Office Building 201 "
242748,2011-03-02,"House Executive Session: 3/2/2011 Legislative Office Building 201 Following House Session "
242748,2011-03-02,"House Retained in Committee; House Calendar 27, PG.825 "
242748,2011-08-24,"House Retained Bill - Executive Session: 9/27/2011 10:00 Amendment Legislative Office Building 201 "
242748,2011-09-28,"House Committee Report: Inexpedient to Legislate for Jan 4 (Vote 12-0; Consent Calendar) "
242749,2011-01-20,"House Introduced 1/6/2011 and Referred to Municipal and County Government; House Journal  11, PG. 180 "
242749,2011-01-26,"House Public Hearing: 2/3/2011 1:30 PM Legislative Office Building 301 "
242749,2011-02-16,"House Executive Session: 2/16/2011 Legislative Office Building 301 Following House Session "
242749,2011-02-17,"House Committee Report: Ought to Pass for Feb 23 (Vote 15-0; Consent Calendar); House Calendar 15, PG.272 "
242749,2011-02-23,"House Ought to Pass: Motion Adopted Voice Vote; House Journal  21, PG.462 "
242749,2011-03-16,"Senate Introduced and Referred to Public and Municipal Affairs "
242749,2011-03-17,"Senate Hearing: 3/22/11, Room 101, Legislative Office Building, 9:20 a.m.; Senate Calendar 16 "
242749,2011-03-22,"Senate Committee Report: Ought to Pass, 3/30/11; Senate Calendar 17 "
242749,2011-03-30,"Senate Ought to Pass, Motion Adopted, Voice Vote; OT3rdg; Senate Journal 11, Pg.232 "
242749,2011-03-30,"Senate Passed by Third Reading Resolution; Senate Journal 11, Pg.240 "
242749,2011-04-13,"House Enrolled Bill Amendment #2011-1332e(NT) Adopted; House Journal  37, Pg.1304 "
242749,2011-04-13,"Senate Enrolled Bill Amendment #1332 Adopted; Senate Journal 13, Pg.259 "
242749,2011-04-13,"House Enrolled; House Journal  37, PG.1305 "
242749,2011-04-20,"Senate Enrolled; Senate Journal 14, Pg.273 "
242749,2011-04-28,"House Signed by the Governor 04/28/2011; Effective 06/27/2011; Chapter 0022 "
242750,2011-01-20,"House Introduced 1/6/2011 and Referred to Commerce and Consumer Affairs; House Journal  11, PG. 180  "
242750,2011-01-25,"House Public Hearing: 2/1/2011 10:30 Amendment Legislative Office Building 302 "
242750,2011-02-01,"House Subcommittee Work Session: 2/10/2011 9:00 Amendment Legislative Office Building 302 "
242750,2011-02-02,"House Executive Session: 2/15/2011 Legislative Office Building 302 3:00 PM or Immediately Following House Session "
242750,2011-02-17,"House Committee Report: Ought to Pass with Amendment #0196h for Feb 23 (Vote 16-0; Consent Calendar); House Calendar 15, PG.267 "
242750,2011-02-17,"House Proposed Committee Amendment #2011-0196h; House Calendar 15, PG.301-303 "
242750,2011-02-23,"House Amendment #0196h Adopted, Voice Vote; House Journal  21, PG.456-458 "
242750,2011-02-23,"House Ought to Pass with Amendment #0196h: Motion Adopted Voice Vote; House Journal  21, PG.456-458 "
242750,2011-02-23,"House Referred to Criminal Justice and Public Safety; House Journal  21, PG.458 "
242750,2011-03-15,"House Public Hearing: 3/22/2011 10:00 Amendment Legislative Office Building 204 ==Executive Session to Follow== "
242750,2011-03-22,"House Majority Committee Report: Ought to Pass with Amendment #1126h for Mar 30 (Vote 10-6; Regular Calendar); House Calendar 27, PG.815-816 "
242750,2011-03-22,"House Proposed Majority Committee Amendment #2011-1126h; House Calendar 27, PG.843 "
242750,2011-03-22,"House Minority Committee Report: Inexpedient to Legislate; House Calendar 27, PG.815-816 "
242750,2011-03-30,"House Lay on the Table (Rep Swinford): Motion Adopted Division Vote 331-17; House Journal  34, PG.1094 "
242751,2011-01-20,"House Introduced 1/6/2011 and Referred to Municipal and County Government; House Journal  11, PG. 181 "
242751,2011-01-26,"House Public Hearing: 2/3/2011 2:00 PM Legislative Office Building 301 ==RECESSED== "
242751,2011-02-09,"House Continued Public Hearing: 2/17/2011 10:00 Amendment Legislative Office Building 301 "
242751,2011-02-23,"House Executive Session: 3/1/2011 11:00 Amendment Legislative Office Building 301 "
242751,2011-03-01,"House Retained in Committee; House Calendar 27, PG.825 "
242751,2011-04-20,"House Retained Bill - Subcommittee Work Session: 4/28/2011 1:00 PM Legislative Office Building 301 "
242751,2011-05-25,"House Retained Bill - Subcommittee Work Session: 5/31/2011 1:30 PM Legislative Office Building 301 "
242751,2011-08-30,"House Retained Bill - Subcommittee Work Session: 9/27/2011 10:00 Amendment Legislative Office Building 301 "
242751,2011-09-14,"House Retained Bill - Executive Session: 10/11/2011 10:00 Amendment Legislative Office Building 301 "
242751,2011-10-14,"House Majority Committee Report: Inexpedient to Legislate for Jan 4 (Vote 9-7; Regular Calendar) "
242751,2011-10-14,"House Minority Committee Report: Ought to Pass with Amendment #2685h(NT) "
242751,2011-10-14,"House Proposed Minority Committee Amendment #2011-2685h (New Title) "
242752,2011-01-20,"House Introduced 1/6/2011 and Referred to Judiciary; House Journal  11, PG. 181 "
242752,2011-01-26,"House Public Hearing: 2/3/2011 10:30 Amendment Legislative Office Building 208 "
242752,2011-02-09,"House Executive Session: 2/14/2011 10:00 Amendment Legislative Office Building 208 "
242752,2011-02-15,"House Committee Report: Inexpedient to Legislate for Feb 23 (Vote 16-0; Consent Calendar); House Calendar 15, PG.271 "
242752,2011-02-23,"House Inexpedient to Legislate: Motion Adopted Voice Vote; House Journal  21, PG.461 "
242753,2011-01-20,"House Introduced 1/6/2011 and Referred to Special Committee on Public Employee Pensions Reform; House Journal  11, PG. 181 "
242753,2011-01-25,"House Public Hearing: 2/4/2011 10:00 Amendment Legislative Office Building 201-203 ==ROOM CHANGE (Orig Legislative Office Building 205)== "
242753,2011-02-09,"House Executive Session: 2/11/2011 2:00 PM Legislative Office Building 201-203 "
242753,2011-02-16,"House Committee Report: Ought to Pass with Amendment #0140h for Feb 23 (Vote 11-0; Consent Calendar); House Calendar 15, PG.273 "
242753,2011-02-16,"House Proposed Committee Amendment #2011-0140h; House Calendar 15, PG.303 "
242753,2011-02-23,"House Amendment #0140h Adopted, Voice Vote; House Journal  21, PG.464 "
242753,2011-02-23,"House Ought to Pass with Amendment #0140h: Motion Adopted Voice Vote; House Journal  21, PG.464 "
242753,2011-03-16,"Senate Introduced and Referred to Executive Departments and Administration "
242753,2011-03-31,"Senate Hearing: 4/7/11, Room 100, State House, 10:00 a.m.; Senate Calendar 18 "
242753,2011-05-05,"Senate Committee Report: Ought to Pass with Amendment #2011-1774s, 5/11/11; Senate Calendar 23 "
242753,2011-05-11,"Senate Committee Amendment 1774s, Amendment Adopted, Voice Vote; Senate Journal 16, Pg.326 "
242753,2011-05-11,"Senate Ought to Pass with Amendment 1774s, Motion Adopted, Voice Vote; OT3rdg; Senate Journal 16, Pg.327 "
242753,2011-05-11,"Senate Passed by Third Reading Resolution "
242753,2011-05-18,"House House Non-Concurs with Senate Amendment #1774s and Requests C of C (Rep Hawkins): Motion Adopted Voice Vote; House Journal  44, PG.1532 "
242753,2011-05-18,"House Speaker Appoints: Reps Hawkins, Cohn, Winter, and Sanborn; House Journal  44, PG.1532 "
242753,2011-05-25,"Senate Sen. Carson Accedes to House Request for Committee of Conference, Motion Adopted, Voice Vote; Senate Journal 18, Pg.388 "
242753,2011-05-25,"Senate President Appoints: Senators Carson, Luther and Larsen; Senate Journal 18, Pg.389 "
242753,2011-06-03,"House Conference Committee Meeting: 6/7/2011 10:15 Amendment Legislative Office Building 306 "
242753,2011-06-16,"Senate Conference Committee Report #2011-2261c; Senate Amendment + New Amendment, Filed "
242753,2011-06-22,"Senate Conference Committee Report 2261c; Adopted, Voice Vote "
242753,2011-06-22,"House Conference Committee Report #2261c Adopted, Voice Vote; House Journal  57, PG.1840 "
242753,2011-06-22,"Senate Enrolled "
242753,2011-06-22,"House Enrolled; House Journal  57, PG.1859 "
242753,2011-07-18,"House Signed By Governor 07/13/2011; Effective 07/13/2011; Chapter 0257 "
242754,2011-01-20,"House Introduced 1/6/2011 and Referred to Education; House Journal  11, PG. 181 "
242754,2011-02-02,"House Public Hearing: 2/8/2011 1:00 PM Representative's Hall "
242754,2011-02-09,"House Subcommittee Work Session: 2/15/2011 8:00 Amendment Legislative Office Building 207 "
242754,2011-02-09,"House Subcommittee Work Session: 2/17/2011 8:00 Amendment Legislative Office Building 207 "
242754,2011-02-09,"House ==CANCELLED== Subcommittee Work Session: 2/22/2011 8:00 Amendment Legislative Office Building 207 "
242754,2011-02-10,"House ==CANCELLED== Subcommittee Work Session: 2/24/2011 9:00 Amendment Legislative Office Building 207 "
242754,2011-02-10,"House Executive Session: 2/24/2011 1:00 PM Legislative Office Building 207 "
242754,2011-02-24,"House Retained in Committee; House Calendar 27, PG.823 "
242754,2011-08-17,"House Retained Bill - Subcommittee Work Session: 9/6/2011 10:00 Amendment Legislative Office Building 207 "
242754,2011-08-17,"House Retained Bill - Subcommittee Work Session: 9/13/2011 10:00 Amendment Legislative Office Building 207 "
242754,2011-10-04,"House Retained Bill - Executive Session: 10/18/2011 10:00 Amendment Legislative Office Building 207 "
242754,2011-10-21,"House Committee Report: Inexpedient to Legislate for Jan 4 (Vote 14-0; Consent Calendar) "
242755,2011-01-20,"House Introduced 1/6/2011 and Referred to Science, Technology and Energy; House Journal  11, PG. 181 "
242755,2011-01-26,"House Public Hearing: 2/8/2011 1:00 PM Legislative Office Building 304 "
242755,2011-02-09,"House Committee Report: Inexpedient to Legislate for Feb 15 (Vote 15-0; Consent Calendar); House Calendar 13, PG.233 "
242755,2011-02-15,"House Inexpedient to Legislate: Motion Adopted Voice Vote; House Journal  17, PG.361 "
242756,2011-01-20,"House Introduced 1/6/2011 and Referred to Municipal and County Government; House Journal  11, PG. 181 "
242756,2011-02-01,"House Public Hearing: 2/10/2011 10:00 Amendment Legislative Office Building 301 ==Executive Session to Follow== "
242756,2011-02-15,"House Committee Report: Inexpedient to Legislate for Feb 23 (Vote 15-0; Consent Calendar); House Calendar 15, PG.272 "
242756,2011-02-23,"House Inexpedient to Legislate: Motion Adopted Voice Vote; House Journal  21, PG.462 "
242757,2011-01-21,"House Introduced 1/6/2011 and Referred to Commerce and Consumer Affairs; House Journal  11, PG. 182 "
242757,2011-01-26,"House ==CANCELLED== Public Hearing: 2/10/2011 1:15 PM Legislative Office Building 302 "
242757,2011-02-01,"House Public Hearing: 2/24/2011 1:15 PM Legislative Office Building 302 "
242757,2011-03-01,"House Executive Session: 3/9/2011 9:00 Amendment Legislative Office Building 302 "
242757,2011-03-09,"House Retained in Committee; House Calendar 27, PG.822 "
242757,2011-08-23,"House Retained Bill - Insurance/Consumer Div Subcom Work Session: 10/18/2011 1:15 PM Legislative Office Building 302 "
242757,2011-10-19,"House Retained Bill - Insurance/Consumer Div Subcom Work Session: 10/25/2011 2:00 PM Legislative Office Building 301-303 "
242757,2011-10-19,"House ==CANCELLED== Retained Bill - Executive Session: 10/27/2011 1:15 PM Legislative Office Building 302 "
242757,2011-10-20,"House Retained Bill - Executive Session: 11/01/2011 10:00 Amendment Legislative Office Building 302 ==TIME CHANGE (Orig 11:00 Amendment)== "
242758,2011-01-21,"House Introduced 1/6/2011 and Referred to Executive Departments and Administration; House Journal  11, PG. 182 "
242758,2011-01-26,"House Public Hearing: 2/10/2011 11:00 Amendment Legislative Office Building 306 "
242758,2011-02-22,"House Subcommittee Work Session: 2/24/2011 2:30 PM Legislative Office Building 306 "
242758,2011-02-23,"House ==CANCELLED== Executive Session: 3/2/2011 2:00 PM or 45 mins after House session Legislative Office Building 306 "
242758,2011-03-02,"House Subcommittee Work Session: 3/3/2011 4:30 PM Legislative Office Building 306 "
242758,2011-03-02,"House Executive Session: 3/9/2011 1:00 PM Legislative Office Building 306 "
242758,2011-03-09,"House Retained in Committee; House Calendar 27, PG.823 "
242758,2011-09-27,"House Retained Bill - Executive Session: 10/27/2011 10:00 Amendment Legislative Office Building 306 (If Necessary Continued 11/1/2011 10:30 Amendment Legislative Office Building 306) "
242759,2011-01-21,"House Introduced 1/6/2011 and Referred to Science, Technology and Energy; House Journal  11, PG. 182 "
242759,2011-01-26,"House ==CANCELLED== Public Hearing: 2/2/2011 2:00 PM Legislative Office Building 304 "
242759,2011-01-27,"House ==RESCHEDULED== Public Hearing: 2/1/2011 3:30 PM Legislative Office Building 304 ==RECESSED== "
242759,2011-02-16,"House Continued Public Hearing: 3/1/2011 1:00 PM Legislative Office Building 304 ==Executive Session To Follow== "
242759,2011-03-02,"House Retained in Committee; House Calendar 27, PG.825 "
242759,2011-04-12,"House Retained Bill - Full Committee Work Session: 4/26/2011 10:15 Amendment Legislative Office Building 302-304 "
242759,2011-08-18,"House Retained Bill - Full Committee Work Session: 9/13/2011 10:15 Amendment Legislative Office Building 301-303 "
242759,2011-10-11,"House Retained Bill - Full Committee Work Session: 10/25/2011 11:30 Amendment Legislative Office Building 304 "
242759,2011-10-11,"House Retained Bill - Executive Session: 10/25/2011 3:00 PM Legislative Office Building 304 ==RECESSED== "
242759,2011-10-26,"House Retained Bill - Continued Executive Session: 11/1/2011 10:00 Amendment Legislative Office Building 304 "
242760,2011-01-21,"House Introduced 1/6/2011 and Referred to Judiciary; House Journal  11, PG. 182 "
242760,2011-01-26,"House Public Hearing: 2/3/2011 1:00 PM Legislative Office Building 208 "
242760,2011-02-16,"House ==CANCELLED== Executive Session: 3/1/2011 1:00 PM Legislative Office Building 208 (If Necessary Continued 3/3/2011 10:00 Amendment Legislative Office Building 208) "
242760,2011-03-02,"House Executive Session: 3/9/2011 10:00 Amendment Legislative Office Building 208 "
242760,2011-03-09,"House Committee Report: Inexpedient to Legislate for Mar 15 (Vote 11-5; Regular Calendar); House Calendar 22, PG.557 "
242760,2011-03-16,"House Inexpedient to Legislate: Motion Adopted Division Vote 303-42; House Journal  28, PG.874-875 "
242761,2011-01-21,"House Introduced 1/6/2011 and Referred to Municipal and County Government; House Journal  11, PG. 182 "
242761,2011-01-26,"House Public Hearing: 2/3/2011 11:30 Amendment Legislative Office Building 301 "
242761,2011-02-23,"House Executive Session: 2/24/2011 1:00 PM Legislative Office Building 301 "
242761,2011-03-02,"House Committee Report: Ought to Pass with Amendment #0533h(NT) for Mar 15 (Vote 14-1; Regular Calendar); House Calendar 22, PG.561 "
242761,2011-03-02,"House Proposed Committee Amendment #2011-0533h (New Title); House Calendar 23, PG.599-600 "
242761,2011-03-16,"House Amendment #0533h (New Title) Adopted, Voice Vote; House Journal  28, PG.909-910 "
242761,2011-03-16,"House Ought to Pass with Amendment #0533h(NT): Motion Adopted Voice Vote; House Journal  28, PG.909-910 "
242761,2011-03-23,"Senate Introduced and Referred to Public and Municipal Affairs; Senate Journal 11, Pg.191 "
242761,2011-04-07,"Senate Hearing: 4/12/11, Room 101, Legislative Office Building, 10:30 a.m.; Senate Calendar 19 "
242761,2011-04-14,"Senate Hearing: === RECESSED === 4/12/11, Room 101, Legislative Office Building, 10:30 a.m.; Senate Calendar 20 "
242761,2011-04-14,"Senate Hearing: === RECONVENE === 4/19/11, Room 101, Legislative Office Building, 10:45 a.m.; Senate Calendar 20 "
242761,2011-05-11,"Senate Committee Report: Ought to Pass with Amendment #2011-1855s, New Title, 5/18/11; Senate Calendar 24 "
242761,2011-05-18,"Senate Chair Ruled Non-Germane Amendment "
242761,2011-05-18,"Senate Sen. Forsythe Moved to Suspend Rule 3-7 to Allow Non-Germane Amendment 1855s, 2/3 necessary, Motion Adopted, Voice Vote; Senate Journal 17, Pg.354 "
242761,2011-05-18,"Senate Committee Amendment 1855s, New Title, Amendment Adopted, Voice Vote; Senate Journal 17, Pg.354 "
242761,2011-05-18,"Senate Ought to Pass with Amendment 1855s, New Title, Motion Adopted, Voice Vote; OT3rdg; Senate Journal 17, Pg.354 "
242761,2011-05-18,"Senate Passed by Third Reading Resolution; Senate Journal 17, Pg.357 "
242761,2011-05-25,"House House Concurs with Senate Amendment #1855s(NT) (Rep Ferrante): Motion Adopted Voice Vote; House Journal  46, PG.1582 "
242761,2011-06-08,"Senate Enrolled "
242761,2011-06-08,"House Enrolled; House Journal  51, PG.1724 "
242761,2011-06-27,"House Signed By Governor 06/24/2011; Effective 07/24/2011; Chapter 0206 "
242762,2011-01-21,"House Introduced 1/6/2011 and Referred to Education; House Journal  11, PG.182  "
242762,2011-01-26,"House Public Hearing: 2/1/2011 10:30 Amendment Legislative Office Building 207 "
242762,2011-02-02,"House Executive Session: 2/10/2011 1:00 PM Legislative Office Building 207 "
242762,2011-02-15,"House Retained in Committee; House Calendar 27, PG.823 "
242762,2011-09-13,"House Retained Bill - Subcommittee Work Session: 9/20/2011 10:00 Amendment Legislative Office Building 207 "
242762,2011-09-20,"House Retained Bill - Subcommittee Work Session: 9/28/2011 10:00 Amendment Legislative Office Building 207 "
242762,2011-09-28,"House Retained Bill - Subcommittee Work Session: 10/4/2011 10:00 Amendment Legislative Office Building 207 "
242762,2011-10-04,"House Retained Bill - Subcommittee Work Session: 10/11/2011 10:00 Amendment Legislative Office Building 207 "
242762,2011-10-04,"House Retained Bill - Executive Session: 10/18/2011 10:00 Amendment Legislative Office Building 207 (If Necessary Continued 10/25/2011 10:00 Amendment Legislative Office Building 207) "
242763,2011-01-21,"House Introduced 1/6/2011 and Referred to Resources, Recreation and Development; House Journal  11, PG.182 "
242763,2011-01-26,"House Public Hearing: 2/3/2011 1:45 PM Legislative Office Building 305 "
242763,2011-01-28,"House Executive Session: 2/8/2011 1:00 PM Legislative Office Building 305 "
242763,2011-02-09,"House Retained in Committee; House Calendar 27, PG.825 "
242763,2011-07-26,"House Retained Bill - Full Committee Work Session: 8/9/2011 10:00 Amendment Legislative Office Building 305 "
242763,2011-09-09,"House Retained Bill - Subcommittee Work Session: 9/27/2011 10:00 Amendment Legislative Office Building 305 "
242763,2011-09-13,"House Retained Bill - Executive Session: 10/25/2011 10:00 Amendment Legislative Office Building 305 "
242764,2011-01-19,"Senate Introduced and Referred to Judiciary, Senate Journal 3, Pg.32 "
242764,2011-03-03,"Senate Hearing: 3/10/11, Room 101, Legislative Office Building, 1:00 p.m.; Senate Calendar 14 "
242764,2011-03-11,"Senate Committee Report: Rereferred to Committee, 3/16/2011; Senate Calendar 15A "
242764,2011-03-16,"Senate Rereferred to Committee Not Voted On "
242764,2011-03-16,"Senate Sen. Carson Moved Laid on Table, Motion Adopted, Voice Vote; Senate Journal 9, Pg.136 "
242765,2011-01-19,"Senate Introduced and Referred to Executive Departments and Administration, Senate Journal 3, Pg.32 "
242765,2011-01-27,"Senate Hearing: 2/3/11, Room 100 State House, 9:30 a.m.; Senate Calendar 9 "
242765,2011-02-08,"Senate Committee Report: Ought to Pass, 2/16/2011; Senate Calendar 11 "
242765,2011-02-16,"Senate Ought to Pass, Motion Adopted, Voice Vote; Refer to Finance Rule 4-3, Senate Journal 5, Pg.56 "
242765,2011-02-25,"Senate Committee Report: Ought to Pass, 3/9/11; Senate Calendar 14 "
242765,2011-03-09,"Senate Ought to Pass, Motion Adopted, Voice Vote; OT3rdg; Senate Journal 8, Pg.89 "
242765,2011-03-09,"Senate Passed by Third Reading Resolution; Senate Journal 8, Pg.99 "
242765,2011-03-16,"House Introduced and Referred to Executive Departments and Administration; House Journal  28, Pg.882  "
242765,2011-03-29,"House Public Hearing: 4/12/2011 10:00 Amendment Legislative Office Building 306 "
242765,2011-04-05,"House ==CANCELLED== Executive Session: 4/19/2011 1:15 PM Legislative Office Building 306 "
242765,2011-04-20,"House Executive Session: 4/26/2011 1:15 PM Legislative Office Building 307 "
242765,2011-04-27,"House Committee Report: Ought to Pass with Amendment #1505h for May 4 (Vote 15-1; Consent Calendar); House Calendar 36, PG.1245 "
242765,2011-04-27,"House Proposed Committee Amendment #2011-1505h; House Calendar 36, PG.1269-1270 "
242765,2011-05-04,"House Amendment #1505h Adopted, Voice Vote; House Journal  42, PG.1418 "
242765,2011-05-04,"House Ought to Pass with Amendment #1505h: Motion Adopted Voice Vote; House Journal  42, PG.1418 "
242765,2011-05-25,"Senate Sen. Carson Moved Nonconcur with House Amendment 1505h; Requests C of C, Motion Adopted, Voice Vote; Senate Journal 18, Pg.390 "
242765,2011-05-25,"Senate President Appoints: Senators Carson, Groen and D'Allesandro; Senate Journal 18, Pg.390 "
242765,2011-06-01,"House House Accedes to Senate Request for C of C (Rep C.McGuire): Motion Adopted Voice Vote; House Journal  48, PG.1641 "
242765,2011-06-01,"House Speaker Appoints: Reps C.McGuire, Pilotte, Winter, and Bowers; House Journal  48, PG.1641 "
242765,2011-06-02,"Senate Committee of Conference Meeting: 6/7/2011, 1:00 p.m., Room 100, State House "
242765,2011-06-15,"House Conference Committee Report #2011-2290c, House Amendment, Filed; House Calendar 49, PG.1673 "
242765,2011-06-22,"House Conference Committee Report #2290c Failed, Voice Vote; House Journal  57, PG.1804 "
242765,2011-06-22,"House Suspend House Rules to Allow Formation of New C of C and Further Consideration (Rep C.McGuire): Motion Adopted Division Vote 258-97 by Required Two-Thirds; House Journal  57, PG.1804 "
242765,2011-06-22,"House Speaker Appoints: Reps C.McGuire, Pilotte, Winter, and Bowers; House Journal  57, PG.1804 "
242765,2011-06-22,"Senate Sen. Bradley Moved that the Senate Rules be Suspended to allow after the Deadlines the formation of new committee of conference, sign-off on new committee of conference report, and reporting of new committee of conference on SB 33, 2/3 necessary, Motion Adopted, Voice Vote "
242765,2011-06-22,"Senate Sen. Bradley Moved the Senate discharge the members and Accedes to House Request for New Committee of Conference, Motion Adopted, Voice Vote "
242765,2011-06-22,"Senate President Appoints: Senators Carson, Groen and DAllesandro "
242765,2011-06-22,"House Suspend House Rules to Allow Consideration of C of C Report #2011-2520c (Rep C.McGuire): Motion Adopted Division Vote 280-98 by Required Two-Thirds; House Journal  57, PG.1822 "
242765,2011-06-22,"House Committee of Conference Report #2520c Adopted, Regular Calendar 278-99; House Journal  57, PG.1822-1825 "
242765,2011-06-22,"Senate Conference Committee Report #2011-2520c; Adopted, Voice Vote "
242765,2011-06-22,"House Enrolled; House Journal  57, PG.1859 "
242765,2011-06-22,"Senate Enrolled "
242765,2011-07-13,"Senate Signed by the Governor on 07/13/2011; Effective 07/01/2011 @ 12:01am; Chapter 0242 "
242766,2011-01-19,"Senate Introduced and Referred to Judiciary, Senate Journal 3, Pg.32 "
242766,2011-01-31,"Senate Hearing: 2/10/2011, Room 101, Legislative Office Building, 1:00 p.m.; Senate Calendar 10 "
242766,2011-02-15,"Senate Committee Report: Ought to Pass with Amendment #2011-0301s, New Title, 2/23/11; Senate Calendar 12 "
242766,2011-02-23,"Senate Committee Amendment 0301s, New Title, Amendment Adopted, Voice Vote; Senate Journal 7, Pg.75 "
242766,2011-02-23,"Senate Ought to Pass with Amendment 0301s, New Title, Motion Adopted, Voice Vote; Refer to Finance Rule 4-3; Senate Journal 7, Pg.75 "
242766,2011-02-25,"Senate Committee Report: Ought to Pass, 3/9/11; Senate Calendar 14 "
242766,2011-03-09,"Senate Ought to Pass, Motion Adopted, Voice Vote; OT3rdg; Senate Journal 8, Pg.89 "
242766,2011-03-09,"Senate Passed by Third Reading Resolution; Senate Journal 8, Pg.99 "
242766,2011-03-16,"House Introduced and Referred to Judiciary; House Journal  28, Pg.882 "
242766,2011-03-29,"House Public Hearing: 4/5/2011 11:00 Amendment Legislative Office Building 208 "
242766,2011-05-10,"House Executive Session: 5/17/2011 11:00 Amendment Legislative Office Building 208 "
242766,2011-05-18,"House Committee Report: Ought to Pass for May 25 (Vote 16-0; Consent Calendar); House Calendar 41, PG.1391 "
242766,2011-05-25,"House Ought to Pass: Motion Adopted Voice Vote; House Journal  46, PG.1580 "
242766,2011-06-08,"House Enrolled; House Journal  51, PG.1724 "
242766,2011-06-08,"Senate Enrolled "
242766,2011-06-14,"Senate Signed by the Governor on 06/14/11; Chapter 0177"
243482,2011-01-21,"House Introduced 1/6/2011 and Referred to Public Works and Highways; House Journal  11, PG. 182 "
243482,2011-01-25,"House Public Hearing: 2/8/2011 10:00 Amendment Legislative Office Building 201 "
243482,2011-02-02,"House Executive Session: 2/16/2011 Legislative Office Building 201 1:00 PM or Immediately Following House Session "
243482,2011-02-17,"House Committee Report: Inexpedient to Legislate for Mar 2 (Vote 16-0; Consent Calendar); House Calendar 18, PG.389-390 "
243482,2011-03-02,"House Inexpedient to Legislate: Motion Adopted Voice Vote; House Journal  25, PG.675 "
243483,2011-01-21,"House Introduced 1/6/2011 and Referred to Commerce and Consumer Affairs; House Journal  11, PG. 182 "
243483,2011-01-26,"House Public Hearing: 2/8/2011 11:00 Amendment Legislative Office Building 302 "
243483,2011-03-01,"House Executive Session: 3/9/2011 9:00 Amendment Legislative Office Building 302 "
243483,2011-03-09,"House Retained in Committee; House Calendar 27, PG.822 "
243483,2011-06-22,"House Retained Bill - Banking/Business Div Subcom Work Session: 9/13/2011 10:30 Amendment Legislative Office Building 302 "
243483,2011-09-27,"House Retained Bill - Executive Session: 10/6/2011 10:00 Amendment Legislative Office Building 302 "
243483,2011-10-17,"House Committee Report: Refer to Interim Study for Jan 4 (Vote 13-0; Consent Calendar) "
243484,2011-01-21,"House Introduced 1/6/2011 and Referred to Environment and Agriculture; House Journal  11, PG. 182 "
243484,2011-01-25,"House Public Hearing: 2/1/2011 10:00 Amendment Legislative Office Building 303 "
243484,2011-02-01,"House Subcommittee Work Session: 2/8/2011 3:00 PM Legislative Office Building 303 "
243484,2011-02-09,"House Subcommittee Work Session: 2/22/2011 10:00 Amendment Legislative Office Building 303 "
243484,2011-02-23,"House Executive Session: 3/1/2011 1:00 PM Legislative Office Building 303 "
243484,2011-03-01,"House Retained in Committee; House Calendar 27, PG.823 "
243484,2011-06-08,"House Retained Bill - Subcommittee Work Session: 8/16/2011 10:00 Amendment Legislative Office Building 303 "
243484,2011-08-24,"House Retained Bill - Subcommittee Work Session: 9/14/2011 10:00 Amendment Legislative Office Building 303 "
243484,2011-09-14,"House Retained Bill - Subcommittee Work Session: 10/11/2011 10:30 Amendment Legislative Office Building 303 "
243484,2011-10-11,"House Retained Bill - Executive Session: 10/25/2011 10:00 Amendment Legislative Office Building 303 "
243485,2011-01-21,"House Introduced 1/6/2011 and Referred to Labor, Industrial and Rehabilitative Services; House Journal  11, PG. 182 "
243485,2011-01-26,"House Public Hearing: 2/1/2011 3:00 PM Legislative Office Building 307 "
243485,2011-02-02,"House Executive Session: 2/8/2011 2:00 PM Legislative Office Building 307 "
243485,2011-02-10,"House Committee Report: Inexpedient to Legislate for Feb 15 (Vote 17-0; Consent Calendar); House Calendar 13, PG.231 "
243485,2011-02-15,"House Inexpedient to Legislate: Motion Adopted Voice Vote; House Journal  17, PG.359 "
243486,2011-01-21,"House Introduced 1/6/2011 and Referred to Commerce and Consumer Affairs; House Journal  11, PG. 182 "
243486,2011-01-26,"House Public Hearing: 2/10/2011 10:00 Amendment Legislative Office Building 302 "
243486,2011-03-01,"House Executive Session: 3/9/2011 9:00 Amendment Legislative Office Building 302 "
243486,2011-03-09,"House Retained in Committee; House Calendar 27, PG.822 "
243486,2011-08-23,"House Retained Bill - Insurance/Consumer Div Subcom Work Session: 10/11/2011 2:45 PM Legislative Office Building 302 "
243486,2011-10-19,"House Retained Bill - Executive Session: 10/25/2011 1:15 PM Legislative Office Building 301-303 (If Necessary Continued 10/27/2011 1:15 PM Legislative Office Building 302) "
243487,2011-01-21,"House Introduced 1/6/2011 and referred to Commerce & Consumer Affairs; House Journal  11, PG. 182 "
243487,2011-01-25,"House Public Hearing: 2/1/2011 3:00 PM Legislative Office Building 302 ==RECESSED== "
243487,2011-02-09,"House Continued Public Hearing: 2/22/2011 4:15 PM Legislative Office Building 302 "
243487,2011-02-16,"House ==CANCELLED== Executive Session: 2/25/2011 10:00 Amendment Legislative Office Building 302 "
243487,2011-02-24,"House Subcommittee Work Session: 2/28/2011 1:00 PM Legislative Office Building 302 "
243487,2011-02-24,"House Executive Session: 3/1/2011 3:00 PM Legislative Office Building 302 "
243487,2011-03-09,"House Retained in Committee; House Calendar 27, PG.822 "
243487,2011-06-22,"House Retained Bill - Banking/Business Div Subcom Work Session: 9/6/2011 11:15 Amendment Legislative Office Building 302 "
243487,2011-09-06,"House Retained Bill - Banking/Business Div Subcom Work Session: 10/11/2011 10:00 Amendment Legislative Office Building 302 "
243487,2011-10-11,"House Retained Bill - Executive Session: 10/20/2011 1:15 PM Legislative Office Building 302 "
243488,2011-01-21,"House Introduced 1/6/2011 and referred to Judiciary; House Journal  11, PG. 182 "
243488,2011-02-16,"House Public Hearing: 2/28/2011 10:00 Amendment Legislative Office Building 208 "
243488,2011-02-23,"House Executive Session: 3/1/2011 1:00 PM Legislative Office Building 208 "
243488,2011-03-09,"House Majority Committee Report: Ought to Pass with Amendment #0531h for Mar 15 (Vote 12-4; Regular Calendar); House Calendar 22, PG.557-558 "
243488,2011-03-09,"House Proposed Majority Committee Amendment #2011-0531h; House Calendar 23, PG.600-601 "
243488,2011-03-09,"House Minority Committee Report: Inexpedient to Legislate; House Calendar 22, PG.557-558 "
243488,2011-03-16,"House Amendment #0531h Adopted, Voice Vote; House Journal  28, PG.875-876 "
243488,2011-03-16,"House Ought to Pass with Amendment #0531h: Motion Adopted Regular Calendar 256-102; House Journal  28, PG.875-878 "
243488,2011-03-16,"House Reconsideration (Rep Bettencourt): Motion Failed Voice Vote; House Journal  28, PG.949 "
243488,2011-03-23,"Senate Introduced and Referred to Judiciary; Senate Journal 11, Pg.191 "
243488,2011-04-13,"Senate Hearing: 4/21/11, Room 100, State House, 1:45 p.m.; Senate Calendar 20 "
243488,2011-05-13,"Senate Committee Report: Ought to Pass, 5/25/11; Senate Calendar 25 "
243488,2011-05-25,"Senate Sen. Houde Floor Amendment #2011-2052s, New Title, Regular Calendar 8Y-16N, Amendment Failed; Senate Journal 18, Pg.386 "
243488,2011-05-25,"Senate Sen. Houde Floor Amendment #2011-2170s, Regular Calendar 9Y-15N, Amendment Failed; Senate Journal 18, Pg.387 "
243488,2011-05-25,"Senate Ought to Pass, Regular Calendar 17Y-7N, Motion Adopted; OT3rdg; Senate Journal 18, Pg.387 "
243488,2011-05-25,"Senate Passed by Third Reading Resolution; Senate Journal 18, Pg.391 "
243488,2011-06-08,"Senate Enrolled "
243488,2011-06-08,"House Enrolled; House Journal  51, PG.1724 "
243488,2011-06-16,"House Vetoed By Governor 06/15/2011; House Calendar 49, PG.1681-1682 "
243488,2011-06-22,"House Veto Overridden: Regular Calendar 266-102 By Required Two-Thirds; House Journal  57, PG.1830-1833 "
243488,2011-06-22,"Senate Notwithstanding the Governors Veto, Shall HB 329 Become Law: Regular Calendar 17Y-7N, Veto Overridden by required two-thirds "
243488,2011-06-23,"House Veto Override 06/22/2011; Effective 01/01/2012; Chapter 0205 "
243489,2011-01-21,"House Introduced 1/6/2011 and referred to Criminal Justice and Public Safety; House Journal  11, PG. 182 "
243489,2011-02-16,"House ==RESCHEDULED== Public Hearing: 2/24/2011 10:00 Amendment Legislative Office Building 204 (Orig 1:30 PM) "
243489,2011-03-01,"House Subcommittee Work Session: 3/2/2011 Legislative Office Building 204 3:00 PM or Immediately Following House Session "
243489,2011-03-02,"House Executive Session: 3/9/2011 10:00 Amendment Legislative Office Building 204 "
243489,2011-03-09,"House Committee Report: Ought to Pass with Amendment #0637h for Mar 15 (Vote 11-6; Regular Calendar); House Calendar 22, PG.548-549 "
243489,2011-03-09,"House Proposed Committee Amendment #2011-0637h; House Calendar 23, PG.601-602 "
243489,2011-03-15,"House Amendment #0637h Adopted, Voice Vote; House Journal  26, PG.767-768 "
243489,2011-03-15,"House Floor Amendment #2011-0775h (New Title) (Rep Burt) Failed, Division Vote 41-261; House Journal  26, PG.768-769 "
243489,2011-03-15,"House Floor Amendment #2011-0811h (Rep Welch) Adopted, Voice Vote; House Journal  26, PG.769 "
243489,2011-03-15,"House Ought to Pass with Amendments #0637h and #0811h: Motion Adopted Regular Calendar 244-109; House Journal  26, PG.767-771 "
243489,2011-03-30,"Senate Introduced and Referred to Judiciary; Senate Journal 12, Pg.243 "
243489,2011-04-14,"Senate Hearing: 4/20/11, Room 100, State House, 1:15 p.m.; Senate Calendar 20 "
243489,2011-05-05,"Senate Committee Report: Rereferred to Committee, 5/11/11; Senate Calendar 23 "
243489,2011-05-11,"Senate Rereferred to Committee, Motion Adopted, Voice Vote; Senate Journal 16 "
243490,2011-01-21,"House Introduced 1/6/2011 and referred to Executive Departments and Administration; House Journal  11, PG. 182 "
243490,2011-01-26,"House Public Hearing: 2/10/2011 10:30 Amendment Legislative Office Building 306 "
243490,2011-02-24,"House Subcommittee Work Session: 3/1/2011 2:00 PM Legislative Office Building 306 "
243490,2011-02-24,"House Executive Session: 3/2/2011 2:00 PM or 45 mins after House session Legislative Office Building 306 "
243490,2011-03-03,"House Committee Report: Ought to Pass with Amendment #0110h for Mar 15 (Vote 11-0; Regular Calendar); House Calendar 22, PG.553 "
243490,2011-03-03,"House Proposed Committee Amendment #2011-0110h; House Calendar 23, PG.602-603 "
243490,2011-03-15,"House Amendment #0110h Adopted, Voice Vote; House Journal  26, PG.798 "
243490,2011-03-15,"House Ought to Pass with Amendment #0110h: Motion Adopted Voice Vote; House Journal  26, PG.798 "
243490,2011-03-30,"Senate Introduced and Referred to Executive Departments and Administration; Senate Journal 12, Pg.243 "
243490,2011-04-14,"Senate Hearing: 4/21/11, Room 100, State House, 9:00 a.m.; Senate Calendar 20 "
243490,2011-04-21,"Senate Committee Report: Ought to Pass, 4/27/11; Senate Calendar 21 "
243490,2011-04-27,"Senate Ought to Pass, Motion Adopted, Voice Vote; OT3rdg; Senate Journal 14, Pg.277 "
243490,2011-04-27,"Senate Passed by Third Reading Resolution; Senate Journal 14 "
243490,2011-05-04,"Senate Enrolled; Senate Journal 16, Pg.318 "
243490,2011-05-04,"House Enrolled; House Journal  42, PG.1490 "
243490,2011-05-20,"House Signed by Governor 05/16/2011; Effective 09/13/2011; Chapter 0075 "
243491,2011-01-21,"House Introduced 1/6/2011 and referred to Criminal Justice & Public Safety; House Journal  11, PG. 182 "
243491,2011-02-16,"House Public Hearing: 2/24/2011 3:15 PM Legislative Office Building 204 "
243491,2011-03-02,"House Executive Session: 3/9/2011 10:00 Amendment Legislative Office Building 204 "
243491,2011-03-09,"House Retained in Committee; House Calendar 27, PG.823 "
243491,2011-06-08,"House Retained Bill - Subcommittee Work Session: 8/2/2011 1:00 PM Legislative Office Building 204 "
243491,2011-09-27,"House Retained Bill - Executive Session: 10/20/2011 10:00 Amendment Legislative Office Building 204 "
243491,2011-10-25,"House Majority Committee Report: Ought to Pass with Amendment #2563h(NT) for Jan 4 (Vote 11-6; Regular Calendar) "
243491,2011-10-25,"House Proposed Majority Committee Amendment #2011-2563h (New Title) "
243491,2011-10-25,"House Minority Committee Report: Ought to Pass "
243492,2011-01-21,"House Introduced 1/6/2011 and referred to Resources, Recreation and Development; House Journal  11, PG. 183 "
243492,2011-01-26,"House Public Hearing: 2/3/2011 2:30 PM Legislative Office Building 305 "
243492,2011-01-26,"House ==CANCELLED== Executive Session: 2/8/2011 1:00 PM Legislative Office Building 305 "
243492,2011-02-15,"House Executive Session: 2/15/2011 Legislative Office Building 305 3:00 PM or Following House Session "
243492,2011-02-16,"House Committee Report: Ought to Pass for Feb 23 (Vote 15-0; Consent Calendar); House Calendar 15, PG.272 "
243492,2011-02-23,"House Ought to Pass: Motion Adopted Voice Vote; House Journal  21, PG.463 "
243492,2011-03-16,"Senate Introduced and Referred to Energy and Natural Resources "
243492,2011-03-31,"Senate Hearing: 4/7/11, Room 102, Legislative Office Building, 9:30 a.m.; Senate Calendar 18 "
243492,2011-04-07,"Senate Committee Report: Ought to Pass, 4/13/11; Senate Calendar 19 "
243492,2011-04-13,"Senate Ought to Pass, Motion Adopted, Voice Vote; OT3rdg; Senate Journal 12, Pg.248 "
243492,2011-04-13,"Senate Passed by Third Reading Resolution; Senate Journal 12, Pg.255 "
243492,2011-04-27,"House Enrolled; House Journal  40, PG.1386 "
243492,2011-04-27,"Senate Enrolled; Senate Journal 15, Pg.293 "
243492,2011-05-11,"House Signed by Governor 05/09/2011; Effective 05/09/2011; Chapter 0050 "
243493,2011-01-21,"House Introduced 1/6/2011 and referred to Transportation; House Journal  11, PG. 183 "
243493,2011-02-01,"House Public Hearing: 2/8/2011 11:45 Amendment Legislative Office Building 203 "
243493,2011-02-16,"House ==CANCELLED== Executive Session: 2/16/2011 1:45 PM Legislative Office Building 203 "
243493,2011-02-23,"House Subcommittee Work Session: 3/1/2011 9:45 Amendment Legislative Office Building 203 "
243493,2011-02-23,"House Executive Session: 3/2/2011 Legislative Office Building 203 3:00 PM or Immediately After House Session "
243493,2011-03-02,"House Retained in Committee; House Calendar 27, PG.826 "
243493,2011-10-18,"House Retained Bill - Executive Session: 10/25/2011 8:30 Amendment Legislative Office Building 203 "
243494,2011-01-21,"House Introduced 1/6/2011 and referred to Judiciary; House Journal  11, PG. 183 "
243494,2011-02-01,"House Public Hearing: 2/8/2011 2:30 PM Legislative Office Building 208 "
243494,2011-02-15,"House Executive Session: 2/15/2011 Legislative Office Building 208 Following House Session "
243494,2011-02-16,"House Committee Report: Inexpedient to Legislate for Feb 23 (Vote 13-1; Consent Calendar); House Calendar 15, PG.271 "
243494,2011-02-23,"House Inexpedient to Legislate: Motion Adopted Voice Vote; House Journal  21, PG.461 "
243495,2011-01-21,"House Introduced 1/6/2011 and referred to Judiciary; House Journal  11, PG. 183 "
243495,2011-02-16,"House Public Hearing: 3/1/2011 10:00 Amendment Legislative Office Building 208 "
243495,2011-02-24,"House Executive Session: 3/3/2011 10:00 Amendment Legislative Office Building 208 "
243495,2011-03-03,"House Committee Report: Ought to Pass with Amendment #0547h for Mar 15 (Vote 14-0; Consent Calendar); House Calendar 22, PG.533 "
243495,2011-03-03,"House Proposed Committee Amendment #2011-0547h; House Calendar 23, PG.347-348 "
243495,2011-03-15,"House Amendment #0547h Adopted, Voice Vote; House Journal  26, PG.719 "
243495,2011-03-15,"House Ought to Pass with Amendment #0547h: Motion Adopted Voice Vote; House Journal  26, PG.719 "
243495,2011-03-23,"Senate Introduced and Referred to Transportation; Senate Journal 11, Pg.191 "
243495,2011-03-24,"Senate Hearing: 3/31/11, Room 103, Legislative Office Building, 10:00 a.m.; Senate Calendar 17 "
243495,2011-04-28,"Senate Committee Report: Ought to Pass with Amendment #2011-1650s, 5/4/11; Senate Calendar 22 "
243495,2011-05-04,"Senate Committee Amendment 1650s, Amendment Adopted, Voice Vote; Senate Journal 15, Pg.310 "
243495,2011-05-04,"Senate Ought to Pass with Amendment 1650s, Motion Adopted, Voice Vote; OT3rdg; Senate Journal 15, Pg.310 "
243495,2011-05-04,"Senate Passed by Third Reading Resolution; Senate Journal 15, Pg.312 "
243495,2011-05-25,"House House Concurs with Senate Amendment #1650s (Rep Rowe): Motion Adopted Voice Vote; House Journal  46, PG.1582 "
243495,2011-06-08,"Senate Enrolled "
243495,2011-06-08,"House Enrolled; House Journal  51, PG.1724 "
243495,2011-06-14,"House Signed By Governor 06/14/2011; Effective 08/13/2011; Chapter 0167 "
243496,2011-01-21,"House Introduced 1/6/2011 and referred to Municipal & County Government; House Journal  11, PG. 183 "
243496,2011-02-01,"House Public Hearing: 2/10/2011 10:30 Amendment Legislative Office Building 301 "
243496,2011-02-23,"House Executive Session: 3/3/2011 10:30 Amendment Legislative Office Building 301 "
243496,2011-03-03,"House Retained in Committee; House Calendar 27, PG.825 "
243496,2011-04-19,"House Retained Bill - Subcommittee Work Session: 4/21/2011 1:30 PM Legislative Office Building 301 "
243496,2011-04-21,"House Retained Bill - Subcommittee Work Session: 4/27/2011 9:00 Amendment Legislative Office Building 301 "
243496,2011-09-14,"House Retained Bill - Executive Session: 10/11/2011 10:00 Amendment Legislative Office Building 301 "
243496,2011-10-14,"House Committee Report: Inexpedient to Legislate for Jan 4 (Vote 16-0; Consent Calendar) "
243497,2011-01-21,"House Introduced 1/6/2011 and Referred to Transportation; House Journal  11, PG. 183 "
243497,2011-02-01,"House Public Hearing: 2/8/2011 1:15 PM Legislative Office Building 203 "
243497,2011-02-23,"House Executive Session: 3/2/2011 Legislative Office Building 203 3:00 PM or immediately after House session "
243497,2011-03-02,"House Retained in Committee; House Calendar 27, PG.826 "
243497,2011-04-26,"House Retained Bill - Full Committee Work Session: 5/3/2011 11:15 Amendment Legislative Office Building 203 "
243497,2011-10-18,"House Retained Bill - Executive Session: 10/25/2011 8:30 Amendment Legislative Office Building 203 "
243498,2011-01-21,"House Introduced 1/6/2011 and Referred to Executive Departments and Administration; House Journal  11, PG. 183 "
243498,2011-01-26,"House Public Hearing: 2/10/2011 9:00 Amendment Legislative Office Building 306 "
243498,2011-02-03,"House Subcommittee Work Session: 2/10/2011 3:00 PM Legislative Office Building 306 "
243498,2011-02-17,"House Subcommittee Work Session: 2/24/2011 2:01 PM Legislative Office Building 306 "
243498,2011-03-02,"House Executive Session: 3/9/2011 1:00 PM Legislative Office Building 306 "
243498,2011-03-10,"House Committee Report: Ought to Pass with Amendment #0761h for Mar 15 (Vote 12-3; Regular Calendar); House Calendar 22, PG.554 "
243498,2011-03-10,"House Proposed Committee Amendment #2011-0761h; House Calendar 23, PG.609 "
243498,2011-03-15,"House Amendment #0761h Adopted, Voice Vote; House Journal  26, PG.801 "
243498,2011-03-15,"House Ought to Pass with Amendment #0761h: Motion Adopted Voice Vote; House Journal  26, PG.801 "
243498,2011-03-23,"Senate Introduced and Referred to Executive Departments and Administration; Senate Journal 11, Pg.191 "
243498,2011-05-05,"Senate Hearing: 5/12/11, Room 100, State House, 9:00 a.m.; Senate Calendar 23 "
243498,2011-05-19,"Senate Committee Report: Ought to Pass with Amendment #2011-2040s, New Title, 5/25/11; Senate Calendar 25 "
243498,2011-05-25,"Senate Committee Amendment 2040s, New Title, Amendment Adopted, Voice Vote; Senate Journal 18, Pg.379 "
243498,2011-05-25,"Senate Ought to Pass with Amendment 2040s, New Title, Motion Adopted, Voice Vote; OT3rdg; Senate Journal 18, Pg.379 "
243498,2011-05-25,"Senate Passed by Third Reading Resolution; Senate Journal 18, Pg.391 "
243498,2011-06-08,"House House Concurs with Senate Amendment 2040s(NT) (Rep C.McGuire): Motion Adopted Voice Vote; House Journal  51, PG.1714 "
243498,2011-06-08,"Senate Enrolled "
243498,2011-06-08,"House Enrolled; House Journal  51, PG.1728 "
243498,2011-06-27,"House Signed By Governor 06/27/2011; Effective 01/01/2012; Chapter 0210 "
243499,2011-01-21,"House Introduced 1/6/2011 and Referred to Labor Industrial and Rehabilitative Services; House Journal  11, PG. 184 "
243499,2011-01-26,"House Public Hearing: 2/8/2011 11:00 Amendment Legislative Office Building 307 "
243499,2011-02-23,"House Executive Session: 3/1/2011 1:00 PM Legislative Office Building 307 "
243499,2011-03-03,"House Majority Committee Report: Inexpedient to Legislate for Mar 15 (Vote 12-3; Regular Calendar); House Calendar 22, PG.560 "
243499,2011-03-03,"House Minority Committee Report: Ought to Pass; House Calendar 22, PG.560 "
243499,2011-03-16,"House Inexpedient to Legislate: Motion Adopted Regular Calendar 258-83; House Journal  28, PG.900-902 "
243500,2011-01-21,"House Introduced 1/6/2011 and Referred to Public Works and Highways; House Journal  11, PG. 184 "
243500,2011-01-25,"House Public Hearing: 2/8/2011 10:30 Amendment Legislative Office Building 201 ==Executive Session to Follow== "
243500,2011-02-08,"House Committee Report: Ought to Pass for Feb 15 (Vote 14-0; Consent Calendar); House Calendar 13, PG.232 "
243500,2011-02-15,"House Ought to Pass: Motion Adopted Voice Vote; House Journal  17, PG.360 "
243500,2011-02-23,"Senate Introduced and Referred to Transportation; Senate Journal 8, Pg.81 "
243500,2011-03-03,"Senate Hearing: 3/10/11, Room 103, Legislative Office Building, 10:30 a.m.; Senate Calendar 14 "
243500,2011-03-17,"Senate Committee Report: Ought to Pass, 3/23/11; Senate Calendar 16 "
243500,2011-03-23,"Senate Ought to Pass, Motion Adopted, Voice Vote; OT3rdg; Senate Journal 10, Pg.186 "
243500,2011-03-23,"Senate Passed by Third Reading Resolution; Senate Journal 10, Pg.188 "
243500,2011-04-13,"Senate Enrolled; Senate Journal 13, Pg.259 "
243500,2011-04-13,"House Enrolled; House Journal  37, Pg.1304 "
243500,2011-04-28,"House Signed by the Governor 04/25/2011; Effective 04/25/2011; Chapter 0015 "
243501,2011-01-21,"House Introduced 1/6/2011 and Referred to Executive Departments and Administration; House Journal  11, PG. 184 "
243501,2011-01-26,"House Public Hearing: 2/8/2011 11:30 Amendment Legislative Office Building 306 "
243501,2011-02-14,"House Executive Session: 2/16/2011 Legislative Office Building 306 1:30 PM or 45 minutes after House session "
243501,2011-02-17,"House Committee Report: Ought to Pass with Amendment #0318h for Feb 23 (Vote 16-0; Consent Calendar); House Calendar 15, PG.269 "
243501,2011-02-17,"House Proposed Committee Amendment #2011-0318h; House Calendar 15, PG.303 "
243501,2011-02-23,"House Amendment #0318h Adopted, Voice Vote; House Journal  21, PG.460 "
243501,2011-02-23,"House Ought to Pass with Amendment #0318h: Motion Adopted Voice Vote; House Journal  21, PG.460 "
243501,2011-03-09,"Senate Introduced and Referred to Health and Human Services; Senate Journal 9, Pg.102 "
243501,2011-03-15,"Senate Hearing: 3/24/11, Room 102, Legislative Office Building, 1:30 p.m.; Senate Calendar 16 "
243501,2011-03-29,"Senate Committee Report: Ought to Pass, 4/13/11; Senate Calendar 19 "
243501,2011-04-13,"Senate Ought to Pass, Motion Adopted, Voice Vote; OT3rdg; Senate Journal 12, Pg.250"
243501,2011-04-13,"Senate Passed by Third Reading Resolution; Senate Journal 12, Pg.255 "
243501,2011-04-27,"House Enrolled; House Journal  40, PG.1386 "
243501,2011-04-27,"Senate Enrolled; Senate Journal 15, Pg.293 "
243501,2011-05-11,"House Signed by Governor 05/09/2011; Effective 07/08/2011; Chapter 0051 "
243502,2011-01-21,"House Introduced 1/6/2011 and Referred to Municipal and County Government; House Journal  11, PG. 184 "
243502,2011-02-01,"House Public Hearing: 2/10/2011 11:00 Amendment Legislative Office Building 301 "
243502,2011-02-15,"House Executive Session: 2/24/2011 1:00 PM Legislative Office Building 301 "
243502,2011-02-28,"House Committee Report: Inexpedient to Legislate for Mar 15 (Vote 15-0; Consent Calendar); House Calendar 22, PG.537 "
243502,2011-03-15,"House Inexpedient to Legislate: Motion Adopted Voice Vote; House Journal  26, PG.732 "
243503,2011-01-21,"House Introduced 1/6/2011 and Referred to Municipal and County Government; House Journal  11, PG. 184 "
243503,2011-02-01,"House Public Hearing: 2/8/2011 10:00 Amendment Legislative Office Building 301 "
243503,2011-02-15,"House Executive Session: 2/24/2011 1:00 PM Legislative Office Building 301 "
243503,2011-03-01,"House Committee Report: Inexpedient to Legislate for Mar 15 (Vote 16-0; Consent Calendar); House Calendar 22, PG.537 "
243503,2011-03-15,"House Inexpedient to Legislate: Motion Adopted Voice Vote; House Journal  26, PG.732 "
243504,2011-01-21,"House Introduced 1/6/2011 and referred to Criminal Justice & Public Safety; House Journal  11, PG. 184 "
243504,2011-02-01,"House Public Hearing: 2/10/2011 10:30 Amendment Legislative Office Building 204 "
243504,2011-02-16,"House Executive Session: 2/22/2011 10:00 Amendment Legislative Office Building 204 "
243504,2011-02-22,"House Committee Report: Inexpedient to Legislate for Mar 2 (Vote 15-0; Consent Calendar); House Calendar 18, PG.386 "
243504,2011-03-02,"House Inexpedient to Legislate: Motion Adopted Voice Vote; House Journal  25, PG.672 "
243505,2011-01-21,"House Introduced 1/6/2011 and referred to Executive Departments & Administration; House Journal  11, PG. 184 "
243505,2011-01-26,"House Public Hearing: 2/8/2011 10:30 Amendment Legislative Office Building 306 "
243505,2011-02-14,"House Executive Session: 2/16/2011 Legislative Office Building 306 1:30 PM or 45 minutes after House session "
243505,2011-02-17,"House Committee Report: Inexpedient to Legislate for Feb 23 (Vote 10-3; Regular Calendar); House Calendar 15, PG.275 "
243505,2011-02-23,"House Inexpedient to Legislate: Motion Adopted Regular Calendar 219-133; House Journal  21, PG.470-473 "
243506,2011-01-21,"House Introduced 1/6/2011 and Referred to Commerce and Consumer Affairs; House Journal  11, PG. 184 "
243506,2011-02-09,"House Vacated from Commerce and Consumer Affairs and Referred to Science, Technology and Energy; House Journal  16, PG.308 "
243506,2011-02-15,"House Public Hearing: 2/22/2011 11:25 Amendment Legislative Office Building 304 "
243506,2011-03-02,"House Executive Session: 3/2/2011 1:30 PM Legislative Office Building 304 "
243506,2011-03-02,"House Majority Committee Report: Inexpedient to Legislate for Mar 15 (Vote 10-4; Regular Calendar); House Calendar 22, PG.564 "
243506,2011-03-02,"House Minority Committee Report: Ought to Pass; House Calendar 22, PG.564 "
243506,2011-03-16,"House Inexpedient to Legislate: Motion Failed Regular Calendar 87-237; House Journal  28, PG.923-926 "
243506,2011-03-16,"House Ought to Pass (Rep Bettencourt): Motion Adopted Voice Vote; House Journal  28, PG.923-926 "
243506,2011-03-30,"Senate Introduced and Referred to Transportation; Senate Journal 12, Pg.243 "
243506,2011-04-20,"Senate Hearing: 4/28/11, Room 103, Legislative Office Building, 9:30 a.m.; Senate Calendar 21 "
243506,2011-04-28,"Senate Committee Report: Inexpedient to Legislate, 5/4/11; Senate Calendar 22 "
243506,2011-05-04,"Senate Inexpedient to Legislate, Motion Adopted, Voice Vote === BILL KILLED ===; Senate Journal 15, Pg.310 "
243507,2011-01-21,"House Introduced 1/6/2011 and referred to Judiciary; House Journal  11, PG. 184  "
243507,2011-01-26,"House Public Hearing: 2/1/2011 1:30 PM Legislative Office Building 208 "
243507,2011-02-02,"House Subcommittee Work Session: 2/8/2011 Legislative Office Building 208 3:00 PM "
243507,2011-02-09,"House Executive Session: 2/14/2011 10:00 Amendment Legislative Office Building 208 "
243507,2011-02-15,"House Committee Report: Ought to Pass with Amendment #0157h(NT) for Feb 23 (Vote 17-0; Consent Calendar); House Calendar 15, PG.271 "
243507,2011-02-15,"House Proposed Committee Amendment #2011-0157h (New Title); House Calendar 15, PG.304 "
243507,2011-02-23,"House Removed from Consent Calendar (Rep P.Schmidt); House Journal  21, PG.456 "
243507,2011-02-23,"House Amendment #0157h (New Title) Adopted, Voice Vote; House Journal  21, PG.518-519 "
243507,2011-02-23,"House Ought to Pass with Amendment #0157h(NT): Motion Adopted Voice Vote; House Journal  21, PG.518-519 "
243507,2011-02-23,"House Referred to Education; House Journal  21, PG.519 "
243507,2011-03-16,"House Public Hearing: 3/22/2011 10:00 Amendment Legislative Office Building 207 ==Executive Session Will Follow== "
243507,2011-03-24,"House Committee Report: Ought to Pass with Amendment #1128h(NT) for Mar 30 (Vote 12-0; Regular Calendar); House Calendar 27, PG.816 "
243507,2011-03-24,"House Proposed Committee Amendment #2011-1128h (New Title); House Calendar 27, PG.843 "
243507,2011-03-30,"House Amendment #1128h (New Title) Adopted, Voice Vote; House Journal  34, PG.1094-1095 "
243507,2011-03-30,"House Ought to Pass with Amendment #1128h(NT): Motion Adopted Voice Vote; House Journal  34, PG.1094-1095 "
243507,2011-04-13,"Senate Introduced and Referred to Judiciary; Senate Journal 13, Pg.258 "
243507,2011-04-27,"Senate Hearing: 5/5/11, Room 101, Legislative Office Building, 1:00 p.m.; Senate Calendar 22 "
243507,2011-05-26,"Senate Committee Report: Ought to Pass with Amendment #2011-2218s, 6/1/11; Senate Calendar 26 "
243507,2011-06-01,"Senate Without Objection, President Bragdon moved to Special Order HB 375 to the end of the Calendar; Senate Journal 19, Pg.517 "
243507,2011-06-01,"Senate Committee Report: Ought to Pass with Amendment #2011-2218s, 6/1/11; Senate Calendar 26 "
243507,2011-06-01,"Senate Committee Amendment 2218s, Amendment Adopted, Voice Vote; Senate Journal 19, Pg.521 "
243507,2011-06-01,"Senate Sen. Stiles Floor Amendment #2011-2271s, Regular Calendar 19Y-5N, Amendment Adopted; Senate Journal 19, Pg.521 "
243507,2011-06-01,"Senate Ought to Pass with Amendments 2218s, 2271s, Motion Adopted, Voice Vote; OT3rdg; Senate Journal 19, Pg.521 "
243507,2011-06-01,"Senate Passed by Third Reading Resolution; Senate Journal 19, Pg.539 "
243507,2011-06-08,"House House Non-Concurs with Senate Amendment 2218s and 2271s and Requests C of C (Reps Rowe and Balboni): Motion Adopted Voice Vote; House Journal  51, PG.1717 "
243507,2011-06-08,"House Speaker Appoints: Reps Sorg, Giuda, Weber, and Boehm; House Journal  51, PG.1717 "
243507,2011-06-08,"Senate Sen. Houde Accedes to House Request for Committee of Conference, Motion Adopted, Voice Vote "
243507,2011-06-08,"Senate President Appoints: Senators Stiles, Groen and Kelly "
243507,2011-06-10,"House Conference Committee Meeting: 6/15/2011 11:00 Amendment Legislative Office Building 208 "
243507,2011-06-16,"Senate Conference Committee Report; Not Signed Off "
243508,2011-01-21,"House Introduced 1/6/2011 and Referred to Commerce and Consumer Affairs; House Journal  11, PG. 184 "
243508,2011-02-09,"House Vacated from Commerce and Consumer Affairs and Referred to Science, Technology and Energy; House Journal  16, PG.308 "
243508,2011-02-15,"House Public Hearing: 2/22/2011 10:15 Amendment Legislative Office Building 304 "
243508,2011-03-01,"House Subcommittee Work Session: 3/3/2011 9:00 Amendment Legislative Office Building 304 "
243508,2011-03-01,"House Executive Session: 3/10/2011 9:00 Amendment Legislative Office Building 304 "
243508,2011-03-10,"House Committee Report: Inexpedient to Legislate for Mar 15 (Vote 17-0; Consent Calendar); House Calendar 22, PG.540 "
243508,2011-03-15,"House Inexpedient to Legislate: Motion Adopted Voice Vote; House Journal  26, PG.738 "
243509,2011-01-21,"House Introduced 1/6/2011 and Referred to Executive Departments and Administration; House Journal  11, PG. 184 "
243509,2011-01-26,"House Public Hearing: 2/8/2011 1:00 PM Legislative Office Building 306 "
243509,2011-02-14,"House Executive Session: 2/16/2011 Legislative Office Building 306 1:30 PM or 45 Minutes Following House Session "
243509,2011-02-17,"House Committee Report: Ought to Pass for Feb 23 (Vote 13-2; Regular Calendar); House Calendar 15, PG.275 "
243509,2011-02-23,"House Ought to Pass: Motion Adopted Voice Vote; House Journal  21, PG.473 "
243509,2011-03-16,"Senate Introduced and Referred to Executive Departments and Administration "
243509,2011-04-07,"Senate Hearing: 4/14/11, Room 100, State House, 9:30 a.m.; Senate Calendar 19 "
243509,2011-04-28,"Senate Committee Report: Ought to Pass with Amendment #2011-1656s, 5/4/11; Senate Calendar 22 "
243509,2011-05-04,"Senate Committee Amendment 1656s, Amendment Adopted, Voice Vote; Senate Journal 15, Pg.304"
243509,2011-05-04,"Senate Ought to Pass with Amendment 1656s, Motion Adopted, Voice Vote; OT3rdg; Senate Journal 15, Pg.304 "
243509,2011-05-04,"Senate Passed by Third Reading Resolution; Senate Journal 15, Pg.312 "
243509,2011-05-18,"House House Non-Concurs with Senate Amendment #1656s and Requests C of C (Rep C.McGuire): Motion Adopted Voice Vote; House Journal  44, PG.1531 "
243509,2011-05-18,"House Speaker Appoints: Reps Winter, Hansen, Whitehead, and Bowers; House Journal  44, PG.1531 "
243509,2011-05-25,"Senate Sen. Carson Accedes to House Request for Committee of Conference, Motion Adopted, Voice Vote; Senate Journal 18, Pg.389 "
243509,2011-05-25,"Senate President Appoints: Senators Carson, Groen and Larsen; Senate Journal 18, Pg.389 "
243509,2011-06-06,"House Conference Committee Meeting: 6/9/2011 10:00 Amendment Legislative Office Building 306 "
243509,2011-06-15,"Senate Conference Committee Report #2011-2313c; Senate Amendment + New Amendment, Filed "
243509,2011-06-22,"Senate Conference Committee Report 2313c; Adopted, Voice Vote "
243509,2011-06-22,"House Conference Committee Report #2313c Adopted, Voice Vote; House Journal  57, PG.1845 "
243509,2011-06-22,"Senate Enrolled "
243509,2011-06-22,"House Enrolled; House Journal  57, PG.1859 "
243509,2011-07-18,"House Vetoed By Governor 07/13/2011 "
243510,2011-01-21,"House Introduced 1/6/2011 and referred to Science, Technology & Energy; House Journal  11, PG. 184 "
243510,2011-01-26,"House Public Hearing: 2/1/2011 2:30 PM Legislative Office Building 304 ==RECESSED== "
243510,2011-02-15,"House Continued Public Hearing: 2/22/2011 1:30 PM Legislative Office Building 304 "
243510,2011-03-01,"House Subcommittee Work Session: 3/3/2011 2:30 PM Legislative Office Building 304 "
243510,2011-03-01,"House Executive Session: 3/10/2011 9:00 Amendment Legislative Office Building 304 "
243510,2011-03-10,"House Committee Report: Ought to Pass with Amendment #0740h for Mar 15 (Vote 17-0; Consent Calendar); House Calendar 22, PG.540 "
243510,2011-03-10,"House Proposed Committee Amendment #2011-0740h; House Calendar 23, PG.610 "
243510,2011-03-15,"House Amendment #0740h Adopted, Voice Vote; House Journal  26, PG.738-739 "
243510,2011-03-15,"House Ought to Pass with Amendment #0740h: Motion Adopted Voice Vote; House Journal  26, PG.738-739 "
243510,2011-03-23,"Senate Introduced and Referred to Energy and Natural Resources; Senate Journal 11, Pg.192 "
243510,2011-04-06,"Senate Hearing: 4/14/11, Room 102, Legislative Office Building, 10:15 a.m.; Senate Calendar 19 "
243510,2011-04-28,"Senate Committee Report: Ought to Pass with Amendment #2011-1660s, 5/4/11; Senate Calendar 22 "
243510,2011-05-04,"Senate Committee Amendment 1660s, Amendment Adopted, Voice Vote; Senate Journal 15, Pg.302 "
243510,2011-05-04,"Senate Ought to Pass with Amendment 1660s, Motion Adopted, Voice Vote; OT3rdg; Senate Journal 15, Pg.302 "
243510,2011-05-04,"Senate Passed by Third Reading Resolution; Senate Journal 15, Pg.312 "
243510,2011-05-18,"House House Concurs with Senate Amendment #1660s (Rep J.Garrity): Motion Adopted Voice Vote; House Journal  44, PG.1532 "
243510,2011-06-01,"House Enrolled Bill Amendment #2011-2120e Adopted; House Journal  48, PG.1670 "
243510,2011-06-01,"Senate Enrolled Bill Amendment #2120e Adopted; Senate Journal 20, Pg.546 "
243510,2011-06-08,"Senate Enrolled "
243510,2011-06-08,"House Enrolled; House Journal  51, PG.1726 "
243510,2011-06-14,"House Signed By Governor 06/14/2011; Effective 07/01/2011; Chapter 0168 "
243511,2011-01-21,"House Introduced 1/6/2011 and referred to Municipal & County Government; House Journal  11, PG. 184 "
243511,2011-02-01,"House Public Hearing: 2/10/2011 11:30 Amendment Legislative Office Building 301 "
243511,2011-02-15,"House Executive Session: 2/24/2011 1:00 PM Legislative Office Building 301 "
243511,2011-02-28,"House Committee Report: Ought to Pass with Amendment #0514h(NT) for Mar 15 (Vote 15-0; Consent Calendar); House Calendar 22, PG.537 "
243511,2011-02-28,"House Proposed Committee Amendment #2011-0514h (New Title); House Calendar 23, PG.611 "
243511,2011-03-15,"House Amendment #0514h (New Title) Adopted, Voice Vote; House Journal  26, PG.732 "
243511,2011-03-15,"House Ought to Pass with Amendment #0514h(NT): Motion Adopted Voice Vote; House Journal  26, PG.732 "
243511,2011-03-23,"Senate Introduced and Referred to Public and Municipal Affairs; Senate Journal 11, Pg.192 "
243511,2011-05-05,"Senate Hearing: 5/10/11, Room 101, Legislative Office Building, 9:00 a.m.; Senate Calendar 23 "
243511,2011-05-11,"Senate Committee Report: Rereferred to Committee, 5/18/11; Senate Calendar 24 "
243511,2011-05-18,"Senate Rereferred to Committee, Motion Adopted, Voice Vote; Senate Journal 17, Pg.354 "
243512,2011-01-21,"House Introduced 1/6/2011 and referred to Executive Departments & Administration; House Journal  11, PG. 184 "
243512,2011-01-26,"House Public Hearing: 2/10/2011 1:00 PM Legislative Office Building 306 "
243512,2011-03-01,"House Subcommittee Work Session: 3/3/2011 2:20 PM Legislative Office Building 306 "
243512,2011-03-02,"House Executive Session: 3/9/2011 1:00 PM Legislative Office Building 306 "
243512,2011-03-09,"House Retained in Committee; House Calendar 27, PG.823 "
243512,2011-09-27,"House Retained Bill - Executive Session: 10/11/2011 10:30 Amendment Legislative Office Building 306 "
243512,2011-10-21,"House Committee Report: Ought to Pass with Amendment #0339h for Jan 4 (Vote 11-2; Regular Calendar) "
243512,2011-10-24,"House Proposed Committee Amendment #2011-0339h "
243513,2011-01-21,"House Introduced 1/6/2011 and referred to Executive Departments & Administration; House Journal  11, PG. 184 "
243513,2011-01-26,"House Public Hearing: 2/10/2011 10:00 Amendment Legislative Office Building 306 "
243513,2011-02-14,"House Executive Session: 2/16/2011 Legislative Office Building 306 1:30 PM or 45 minutes following House session "
243513,2011-02-17,"House Committee Report: Inexpedient to Legislate for Feb 23 (Vote 16-0; Consent Calendar); House Calendar 15, PG.269 "
243513,2011-02-23,"House Inexpedient to Legislate: Motion Adopted Voice Vote; House Journal  21, PG.460 "
243514,2011-01-21,"House Introduced 1/6/2011 and referred to Education; House Journal  11, PG. 184 "
243514,2011-02-09,"House Public Hearing: 2/22/2011 1:00 PM Legislative Office Building 207 "
243514,2011-02-18,"House Executive Session: 3/3/2011 10:00 Amendment Legislative Office Building 207 "
243514,2011-03-08,"House Committee Report: Ought to Pass for Mar 15 (Vote 15-0; Consent Calendar); House Calendar 22, PG.528 "
243514,2011-03-15,"House Ought to Pass: Motion Adopted Voice Vote; House Journal  26, PG.707 "
243514,2011-03-23,"Senate Introduced and Referred to Education; Senate Journal 11, Pg.192 "
243514,2011-04-06,"Senate Hearing: 4/12/11, Room 103, Legislative Office Building, 1:35 p.m.; Senate Calendar 19 "
243514,2011-04-14,"Senate Committee Report: Ought to Pass, 4/20/11; Senate Calendar 20 "
243514,2011-04-20,"Senate Ought to Pass, Motion Adopted, Voice Vote; OT3rdg; Senate Journal 13, Pg.263 "
243514,2011-04-20,"Senate Passed by Third Reading Resolution; Senate Journal 13, Pg.270 "
243514,2011-05-04,"Senate Enrolled; Senate Journal 16, Pg.318 "
243514,2011-05-04,"House Enrolled; House Journal  42, PG.1490 "
243514,2011-05-20,"House Signed by Governor 05/16/2011; Effective 07/01/2011; Chapter 0076 "
243515,2011-01-21,"House Introduced 1/6/2011 and referred to Science, Technology & Energy; House Journal  11, PG. 184 "
243515,2011-01-26,"House Public Hearing: 2/1/2011 11:00 Amendment Legislative Office Building 304 "
243515,2011-02-09,"House ==CANCELLED== Executive Session: 2/15/2011 Legislative Office Building 304 3:00 PM or Following House Session "
243515,2011-03-02,"House Executive Session: 3/2/2011 1:30 PM Legislative Office Building 304 "
243515,2011-03-02,"House Committee Report: Ought to Pass with Amendment #0576h for Mar 15 (Vote 8-6; Regular Calendar); House Calendar 22, PG.564 "
243515,2011-03-02,"House Proposed Committee Amendment #2011-0576h; House Calendar 23, PG.611 "
243515,2011-03-16,"House Amendment #0576h Adopted, Voice Vote; House Journal  28, PG.926 "
243515,2011-03-16,"House Ought to Pass with Amendment #0576h: Motion Adopted Regular Calendar 229-93; House Journal  28, PG.926-928 "
243515,2011-03-23,"Senate Introduced and Referred to Energy and Natural Resources; Senate Journal 11, Pg.192 "
243515,2011-04-06,"Senate Hearing: 4/14/11, Room 102, Legislative Office Building, 10:30 a.m.; Senate Calendar 19 "
243515,2011-04-28,"Senate Committee Report: Rereferred to Committee, 5/4/11; Senate Calendar 22 "
243515,2011-05-04,"Senate Rereferred to Committee, Motion Adopted, Voice Vote; Senate Journal 15, Pg.302 "
243516,2011-01-21,"House Introduced 1/6/2011 and referred to Municipal & County Government; House Journal  11, PG. 185 "
243516,2011-02-01,"House Public Hearing: 2/10/2011 1:00 PM Legislative Office Building 301 "
243516,2011-02-15,"House Executive Session: 2/24/2011 1:00 PM Legislative Office Building 301 "
243516,2011-02-28,"House Committee Report: Inexpedient to Legislate for Mar 15 (Vote 12-2; Regular Calendar); House Calendar 22, PG.562-563 "
243516,2011-03-16,"House Inexpedient to Legislate: Motion Adopted Voice Vote; House Journal  28, PG.919-920 "
243517,2011-01-21,"House Introduced 1/6/2011 and Referred to Municipal and County Government; House Journal  11, PG. 185 "
243517,2011-02-01,"House Public Hearing: 2/8/2011 10:30 Amendment Legislative Office Building 301 "
243517,2011-02-15,"House Executive Session: 2/24/2011 1:00 PM Legislative Office Building 301 "
243517,2011-03-01,"House Committee Report: Inexpedient to Legislate for Mar 15 (Vote 16-0; Consent Calendar); House Calendar 22, PG.537 "
243517,2011-03-15,"House Inexpedient to Legislate: Motion Adopted Voice Vote; House Journal  26, PG.732 "
243518,2011-01-21,"House Introduced 1/6/2011 and Referred to Municipal and County Government; House Journal  11, PG. 185 "
243518,2011-02-01,"House Public Hearing: 2/8/2011 10:45 Amendment Legislative Office Building 301 "
243518,2011-02-15,"House Executive Session: 2/24/2011 1:00 PM Legislative Office Building 301 "
243518,2011-03-02,"House Committee Report: Inexpedient to Legislate for Mar 15 (Vote 13-2; Regular Calendar); House Calendar 22, PG.563 "
243518,2011-03-16,"House Inexpedient to Legislate: Motion Adopted Voice Vote; House Journal  28, PG.920 "
243519,2011-01-21,"House Introduced 1/6/2011 and Referred to Transportation; House Journal  11, PG. 185 "
243519,2011-02-08,"House Public Hearing: 3/1/2011 1:15 PM Legislative Office Building 203 "
243519,2011-02-23,"House Executive Session: 3/2/2011 Legislative Office Building 203 3:00 PM or immediately after House session "
243519,2011-03-02,"House Committee Report: Ought to Pass for Mar 15 (Vote 13-0; Consent Calendar); House Calendar 22, PG.542 "
243519,2011-03-15,"House Ought to Pass: Motion Adopted Voice Vote; House Journal  26, PG.741 "
243519,2011-03-23,"Senate Introduced and Referred to Transportation; Senate Journal 11, Pg.192 "
243519,2011-03-24,"Senate Hearing: 3/31/11, Room 103, Legislative Office Building, 10:15 a.m.; Senate Calendar 17 "
243519,2011-04-14,"Senate Committee Report: Ought to Pass with Amendment #2011-1438s, New Title, 4/20/11; Senate Calendar 20 "
243519,2011-04-20,"Senate Committee Amendment 1438s, Not Voted On "
243519,2011-04-20,"Senate Sen. Boutin Moved Laid on Table, Motion Adopted, Voice Vote; Senate Journal 13, Pg.269 "
243519,2011-04-27,"Senate Sen. Rausch Moved Remove From Table, Motion Adopted, Voice Vote; Senate Journal 14 "
243519,2011-04-27,"Senate Committee Amendment 1438s, Amendment Failed, Voice Vote; Senate Journal 14 "
243519,2011-04-27,"Senate Sen. Rausch Floor Amendment #2011-1542s, Amendment Adopted, Voice Vote; Senate Journal 14 "
243519,2011-04-27,"Senate Ought to Pass with Amendment 1542s, Motion Adopted, Voice Vote; OT3rdg; Senate Journal 14 "
243519,2011-04-27,"Senate Passed by Third Reading Resolution; Senate Journal 14 "
243519,2011-05-18,"House House Concurs with Senate Amendment #1542s (Rep Packard): Motion Adopted Voice Vote; House Journal  44, PG.1532 "
243519,2011-06-01,"Senate Enrolled; Senate Journal 20, Pg.547 "
243519,2011-06-01,"House Enrolled; House Journal  48, PG.1669 "
243519,2011-06-09,"House Signed By Governor 06/07/2011; Effective 06/07/2011; Chapter 0136 "
243520,2011-01-21,"House Introduced 1/6/2011 and Referred to Labor, Industrial and Rehabilitative Services; House Journal  11, PG. 185 "
243520,2011-01-26,"House Public Hearing: 2/8/2011 1:00 PM Legislative Office Building 307 "
243520,2011-02-09,"House Executive Session: 3/1/2011 1:00 PM Legislative Office Building 307 "
243520,2011-03-03,"House Committee Report: Ought to Pass with Amendment #0527h for Mar 15 (Vote 15-0; Consent Calendar); House Calendar 22, PG.536 "
243520,2011-03-03,"House Proposed Committee Amendment #2011-0527h; House Calendar 23, PG.614-615 "
243520,2011-03-15,"House Amendment #0527h Adopted, Voice Vote; House Journal  26, PG.728 "
243520,2011-03-15,"House Ought to Pass with Amendment #0527h: Motion Adopted Voice Vote; House Journal  26, PG.728 "
