bill_number,bill_id,title
SB330,66659,"Insurance; prohibit insurers from rescinding/canceling policies based on misstatements/omissions except under certain circumstances"
SB331,66660,"Insurance; small businesses; providing group health insurance to employees; require insurers to issue such policies"
SB332,66661,"Public School; reporting by local boards of education regarding expulsion/disciplinary actions for students bringing weapons to school"
SB333,66662,"Property; prohibit covenants; planned subdivision/property owner's association; owner's right to display the U.S. and Georgia flags"
SB334,66663,"Crime; medical identity fraud; provide punishment"
SB335,66664,"Alcoholic Beverages; counties/municipalities with approval; prohibition against sale on the premises with 100 yards of any local housing authority"
SB336,66665,"Georgia Boxing Association; recognized as a governing body for amateur boxing, wrestling, and martial arts"
SB337,66666,"Motor Vehicle; provide driving under influence of alcohol/drugs with a child is felony"
SB338,66667,"Georgia Sports Hall of Fame Authority; designate signs commemorating significant sporting achievements"
SB339,66668,"Contractors; allow utility contractors to bid upon/perform work on any utility system in this state"
SB340,66669,"Education; require school systems to adopt a reporting system for the purpose of determining potential HOPE eligibility"
SB341,66670,"HOPE; provide person shall be legal Georgia resident to be eligible for a HOPE GED voucher"
SB342,66671,"Governor; revise powers to suspend, limit the sale, dispensing, or transportation of firearms during states of emergency"
SB343,66672,"Public Administration; offenses; clarify crime of impersonating an officer include firefighter/public safety personnel"
SB344,66673,"""'Health Share' Volunteers in Medicine Act""; provide sovereign immunity protection for physician assistants in safety net clinics"
SB345,66674,"Rules of the Road; allow races on county/municipal roads when sanctioned by the local governing authority/ road is closed to traffic"
SB346,66675,"Ad Valorem Taxes; revise comprehensive provisions"
SB347,66676,"Law Enforcement; establish reserve auxiliary police forces; require creation reserve auxiliary police forces lists by local governing authorities"
SB348,66677,"Election; permit absentee voting during a certain period preceding an election or primary"
SB349,66678,"State Election Board; increase the number of members; qualifications, appointment, vacation of office/terms of office of such new members"
SB350,66679,"Motor Vehicles; provide a limitation on the amount charged for motor vehicle registration records"
SB351,66680,"Accountants; provide reduced required hours for state employees"
SB352,66681,"Education; require State Board of Education to include growth model as a primary factor in calculation of adequate yearly growth"
SB353,66682,"Controlled Substances; Schedule I, II, IV, and V; definition of ""dangerous drug""; provisions"
SB354,66683,"Public Roads; further declare authority of counties/municipalities to remove roads from their systems when removal is in best public interest"
SB355,66684,"Health; provide that priority list of persons authorized to control the disposition of the remains of a deceased person"
SB356,66685,"Social Services; eligibility for assistance; change certain provisions"
SB357,66686,"Social Services; medical assistance; suspend, rather than terminate an individual's Medicaid benefits while incarcerated"
SB358,66687,"Education; provide tuition grant assistance for students attending Georgia Military College similar to North Georgia College and State University"
SB359,66688,"Voter Choice and Ballot Access Act; political bodies may nominate candidates for public office without necessity of a nomination petition"
SB360,66689,"Motor Vehicles; prohibit persons 18 years of age or younger from using wireless telecommunications devices; text messages"
SB361,66690,"Education; rename scholarship program to ""Georgia Early HOPE Scholarship""; expand the eligibility for the program; definitions"
SB362,66691,"Property; liens of mechanics/materialmen; waiver and release upon payment"
SB363,66692,"State Employees' Health Insurance Plan; Georgia Student Finance Authority; contract in any state health insurance plan"
SB364,66693,"Massage Therapist; conviction for sexual offense; license suspended for certain time periods; penalties"
SB365,66694,"Railroads; provide installation of active warning devices; unmarked railroad grade crossing following a collision"
SB366,66695,"Sales Tax; provide phase in on the dedication of a portion of state sales tax on motor fuels to transportation purposes"
SB367,66696,"Influenza; revise the definition of ""influenza vaccine"""
SB368,66697,"Fair Business Practices Act of 1975; deceptive representation/designations of geographic origins; provisions"
SB369,66698,"Buildings/Local Gov't; modify agencies/instrumentalities in which housing authorities/political subdivisions can invest funds"
SB370,66699,"Water; examine practices, programs, policies; develop programs for voluntary water conservation; reports of measurable progress"
SB371,66700,"Georgia Bureau of Investigation; provide with authority to investigate certain offenses involving fraudulent real estate transactions"
SB372,66701,"Transportation Dept.; prohibit entering into a public-private partnership for the construction of certain tunnels"
SB373,66702,"Peace Officers; investigation of an applicant's good moral character; applying for appointment or certification"
SB374,66703,"Legislative Economic Development Council; create"
SB375,66704,"Behavorial Health/Developmental Disabilities; revise provisions"
SB376,66705,"Covington Municipal Airport Authority Act; powers, duties, membership"
SB377,66706,"Ad Valorem Tax; County Property Tax Evaluation Committees; establish; review/evaluation of county property value assessment methods"
SB378,66707,"Insurance; provide health insurance coverage for nonformulary drug products for a limited supply under certain conditions"
SB379,66708,"Civil Practice; provide for a conference of the parties to discuss and plan for discovery"
SB380,66709,"Ga Environmental Facilities Authority; water supply division; authority to make loans/grants to local governments; expansion of existing reservoirs"
SB381,66710,"Planning and Budget Office; require tax expenditure reports/ fee reports as part of the budget report; definitions; contents, requirements"
SB382,66711,"Elections; provide for situations due to a technical/electronic equipment failure a disclosure report is not timely filed"
SB383,66712,"Public Officers; spouse of any member of armed forces who was wounded in combat/return to this state; leave of absence"
SB384,66713,"Buildings; pre-owned manufactured homes; provide Safety Fire Commissioner shall promulgate standards"
SB385,66714,"Detention; counties demonstrate use of federal Dept. of Homeland Security's Secure Communities initiative; funding for housing state inmates"
SB386,66715,"Education; establish an alternative performance-based salary schedule; evaluation instruments; effectiveness of teachers/ administrators"
SB387,69135,"Education; provide for career counseling/advisement for students in grades 6 through 12"
SB388,66716,"State Printing; any state law authorizes a state officer/agency to publish any matter such publication made in printed and electronic format"
SB389,66717,"State Auditor; website of Dept. of Audits and Accounts; applicable to public information; operation, maintenance; provisions"
SB390,69136,"Local Government; municipal corporation may determine when to establish a conservation easement"
SB391,69137,"Proceedings; provide for certain children found incompetent to stand trial"
SB392,69138,"Education; require educational institutions to verify motor common/contract carriers properly certified; transportation of students"
SB393,69139,"Governor; appoint Commissioners for Agriculture, Education, Labor, and Insurance"
SB394,69140,"State Ethics Commission; provide certain persons shall be ineligible to serve on the commission"
SB395,69141,"Courts; create mental health court divisions; provide for assignment of cases; planning groups and work plans"
SB396,69142,"Juvenile Proceedings; payment of certain medical expenses; incurred by child is in custody of the Dept. of Juvenile Justice"
SB397,69143,"""Blue Alert""; create state-wide system to speed the apprehension of violent criminals; local, state, and federal law enforcement officers"
SB398,69144,"Social Services; Dept. of Community Health website; nonaggregated information on individuals; provide manner of providing such information"
SB399,69145,"State Government; no department/agency shall implement any provision of federal health care reform legislation"
SB400,69146,"Juvenile Proceedings; clarify provisions to juveniles receiving credit for time served"
SB401,69147,"Georgia Energy Freedom Act of 2010"
SB402,69148,"Land Conservation; redefine certain terms"
SB403,69149,"""Anti-Crime and Safe Streets Act of 2010; provide a condition; Fourth Admentment rights regarding search/seizure"
SB404,69150,"Education; Board of Regents shall establish a process; veterans previous instruction received in military; granting academic credit/exemption"
SB405,69151,"Education; Board of Regents shall establish a process; veterans; may pay in installments or as funds are received from federal Veterans Admin."
SB406,69152,"Elections; provide for online voter registration; procedures"
SB407,69153,"Insurance; authorize insurers to offer individual medical/surgical health insurance that have been approved for issuance in selected states"
SB408,69154,"Insurance; provide for small employer health group cooperatives; definitions; requirements; powers, duties; restrictions"
SB409,69155,"Taxes; provide statement of intent of General Assembly; granting a tax break; raw forest products"
SB410,69156,"Motor Vehicles; designate ambulances as emergency vehicles; exclude certain ambulance providers from certain permit requirements"
SB411,69157,"""Healthy Georgians Act of 2010""; provide exemptions from certain unfair trade practices for certain wellness and health promotion programs"
SB412,69158,"Georgia eHealth Advisory Council; create; composition; powers; provide strategic plan and annual reports"
SB413,69159,"""Truth in Spending Act""; provide each budget unit shall submit a summary; previous/current fiscal years; contents of summary"
SB414,69160,"""Jarett Little Act""; Georgia State Indemnification Fund; payment shall be made to parents/siblings"
SB415,69161,"Public Utilities; provide regulation of private emergency warning point to multipoint systems by Public Service Commission"
SB416,69162,"""Sound Money In Banking Act""; require any bank serving as a depository for the state to offer/accept gold and silver coin for deposit"
SB417,69163,"Property; conveyance of real property located on residential/commercial structure; certification inspected for termites/wood destroying organisms"
SB418,69164,"Controlled Substances; establishment of a program; monitoring of prescribing/dispensing Schedule II, III, IV, or V"
SB419,69165,"Drivers' Licenses; provide for notation; post traumatic stress disorder; members of armed services/veterans"
SB420,69166,"Education; absences due to illness/injury caused by conditions which create a state-wide state of emergency; not be counted as absences"
SB421,69806,"Budget/Financial Affairs; Revenue Shortfall Reserve; not exceed 15 percent of previous year's net revenue for any fiscal year"
SB422,69380,"Porterdale, City of; provide homestead exemption; municipal purposes"
SB423,69640,"""Smash and Grab Act""; add additional offenses to the definition of ""designated felony act""; increase the penalty for burglary"
SB424,69641,"Game/Fish; provide certain licenses; exotic game; define terms"
SB425,69642,"Mental Health Admin.; revise definition of health services; community service boards; limit eligibility to be appointed; revise the min. number"
SB426,69643,"Education; prohibit per diem for at-fault board members during time local school system has its accreditation revoked or placed on probation"
SB427,69644,"Georgia Foundation for Public Education; establish; provide for membership, powers, duties, purpose"
SB428,69645,"Local Government Code Enforcement Boards; provide definitions"
SB429,69646,"Courts; increase number of judges; Supreme Court/Court of Appeals; create/provide funding of a judicial operations fund"
SB430,70410,"'Nurse Licensure Compact'; provide multistate licensures to practice telephonic nursing as a registered nurse; qualifications, sanctions"
SB431,70411,"Taxes; require a municipality which imposes occupation taxes to collect from taxpayers certain information; Dept. of Revenue"
SB432,70412,"""Advanced Broadband Collocation Act""; provide procedures; modification/collocation of wireless communication facilities"
SB433,70413,"Labor; prohibit employers from requesting credit reports on employees, prospective employees; certain exceptions"
SB434,70414,"Elections; provide municipalities shall use same precinct lines, polling places as the counties in which municipalities located"
SB435,70415,"""Diabetes and Health Improvement Act of 2010""; enact; establish Georgia Diabetes Control Office; board of trustees"
SB436,70416,"Retirement; repeal certain obsolete and inoperative provisions"
SB437,70417,"Stone Mountain Memorial Association; add an additional member"
SB438,70418,"Road Systems; definitions; provide for exclusive control of public rights of way by abutting property owners"
SB439,71029,"Offenses; provide for neutrality with regard to the offense of incest"
SB440,71030,"Georgia Firefighter Standards/Training Council; change name to Georgia Firefighter Minimum Standards Council"
SB441,71031,"Personal Fitness Trainers; provide for licensure; definitions; establish Georgia Board of Fitness Trainers; composition"
SB442,71032,"""Water System Interconnection Redundancy and Reliability Act; achieve district-wide interconnection within Metro. North Georgia Water Planning"
SB443,71033,"Medicaid Care Management Organization Legislative Oversight Committee; create"
SB444,71034,"Taxes; provide for a credit; construct, lease, or purchase clean energy properties in this state; procedures, conditions, and limitations"
SB445,71035,"Insurance; accident/sickness insurance; wellness incentive program; provide partial premium reimbursement for those insured under policy"
SB446,71036,"Subsequent Injury Trust Fund; purposes of assessments to fund; ensure claims not include losses arising from certain catastrophic events"
SB447,71037,"State; preference to in-state materialmen, contractors, builders, when preference does not impair quality and cost considerations"
SB448,71038,"State Transportation Board; provide members to serve for the same term as General Assembly members"
SB449,71039,"Georgia Golf Hall of Fame; abolish; disposition of property"
SB450,71040,"Certificates of Title; persons using a motor vehicle title to secure a loan can have access to motor vehicle records"
SB451,71041,"Early Care/Education Programs; provide for certain procedures subsequent to death occurring in a family day-care home, group-day care"
SB452,71042,"Local Government; College and University Special District Act of 2010; provide establishment"
SB453,71858,"Insurance; use of premium taxes; provisions; Georgia Individual High Risk Reinsurance Pool; creation; provide for definitions, operation, powers"
SB454,75282,"Bingo; define certain terms; provide certain veterans organizations may sell certain pull tab games of chance"
SB455,75447,"State Properties Code; modifying certain provisions; acquiring real property through commission"
SB456,75762,"Redevelopment; directors of downtown development authority designated as urban redevelopment agency; serve as commissioners"
SB457,75763,"Education; provide local board of education may act on petition for a conversion charter school for a high school cluster; referendum"
SB458,75764,"Safety Belts; eliminate certain exceptions to the required use of safety belts"
SB459,75765,"Social Services; provide for a single administrator for dental services for Medicaid recipients/PeachCare for Kids participants"
SB460,75766,"Georgia Public Works and Contractor Protection Act; clarify certain provisions; public employers' verification of employee work eligibility"
SB461,75767,"Wills, Trusts, Estate; provide for construction of wills/trust instruments referring to federal estate; provide for judicial construction of such wills"
SB462,76099,"""River Basin Protection Ac""; statement of policy; permitting of interbasin transfers of water"
SB463,76100,"Elections; provide nonpartisan election of solicitors-general; qualifying"
SB464,76101,"Elections; nonpartisan election of district attorney, solicitors-general, sheriffs, tax commissioners, clerks of superior courts; qualifying"
SB465,76102,"Elections; nonpartisan election; tax receivers, tax collectors, and tax commissioners; qualifying"
SB466,76103,"Elections; provide for nonpartisan election of county commissioners; qualifying"
SB467,76104,"Elections; nonpartisan elections; sheriffs; qualifying"
SB468,76105,"Elections; nonpartisan elections; clerks of superior courts; qualifying"
SB469,76106,"Elections; provide for nonpartisan election of district attorneys; qualifying"
SB470,76107,"Computer Security; illegal to prevent reasonable efforts to block installation or execution of a covered file-sharing program"
SB471,76108,"Adoption; require home study by evaluator prior to placement of a child; third party is neither stepparent/relative; definitions; provisions"
SB472,76109,"State Board of Pardons/Paroles; clarify meaning of 'entirely incapacitated'; granting medical reprieves authorized by Constitution of Georgia"
SB473,76110,"Wildlife; closed seasons for deer; change certain provisions"
SB474,76111,"Wildlife; possession of native wild animal killed by motor vehicle; provide exceptions and conditions"
SB475,76112,"Public Records; disclosure of certain law enforcement/emergency response records; provide exemption"
SB476,76113,"Local Government; provide plans for extension of municipal services; annexation"
SB477,76114,"Public Utilities; authority of a utility to recover from customers the costs of financing the construction of nuclear generating plant; provisions"
SB478,76115,"State Accounting Office; direct the officer to contract with a third party to audit state contracts for purpose of recovering certain funds"
SB479,76342,"Local Government; authorize county governing authorities to reapportion election districts; procedures, conditions, and limitations"
SB480,76343,"State Council of Economic Advisors; creation; provide composition, duties, and responsibilities"
SB481,76344,"Insurance; accident and sickness policies; termination of coverage of surviving spouse/break in marital relationship; revise provisions"
SB482,76345,"Insurance; life settlements; revise certain definitions"
SB483,76346,"Banking; person who originates mortgage loans for only one depository institution as independent contractor; revise the exemption"
SB484,76347,"Insurance; require certain notifications; alternative available transactions be provided to owner of individual life policy"
SB485,76348,"Superior Courts; decrease the number of superior court judges in certain circuits; provide for termination of certain judgeships"
SB486,76629,"Natural Resources, Board of; provide deference by administrative law judges on technical issues; reviewing permits"
SB487,76630,"Chattahoochee Hills Country, City of; mayor and council; change the terms; provide for elections"
SB488,76631,"Georgia Foreign Money Judgments Recognition Act; not recognize foreign judgments in defamation actions"
SB489,76632,"Georgia Lead Poisoning Prevention Act of 1994; extensively revise provisions; define terms"
SB490,76633,"Hazardous Waste; amend certain definitions; update provisions to make consistent with federal regulations"
SB491,76634,"Civil Practice; grounds of exercise; personal jurisdiction over nonresidents involved in domestic relation cases; provisions"
SB492,76635,"Natural Resources; specify level of professional registration required for reviews; permits issued by Environment Protection Division"
SB493,76636,"Vital Records; provide for execution of death certificates for burn victims"
SB494,76637,"Estates; prohibit fee for a future conveyance of residential real property; definition"
SB495,76638,"Levy and Sale; change nonbankruptcy exemptions; bankruptcy for residences and burial plots; change provisions"
SB496,76639,"Education; establish the HOPE needs based scholarship; definition; provide for eligibility requirements; scholarship amounts"
SB497,76640,"Public Order, Offenses Against; constitutional zoning authority of local governments; remove a prohibition"
SB498,76641,"Controlled Substances; add synthetic cannabinoids; ""synthetic marijuana"" or ""K2"" to Schedule I controlled substances list"
SB499,76892,"Estates; provide for a tenancy in the entirety; exceptions"
SB500,76893,"Auctioneers; provide a maximum amount for the auctioneers education, research, and recovery fund"
SB501,76894,"Transportation, Department of; modify provisions for the State Transportation Board; provide for the appointment of a treasurer"
SB502,76994,"Public Officers; provide all nonelected members of state authorities, boards or other bodies; compensated only for actual expenses"
SB503,76995,"Elections; require lobbyists to file disclosure reports of expenditures on members of State Transportation Board"
SB504,77217,"Public Property; provide limitations on structural changes to state capitol building"
SB505,76996,"State Transportation Board; limit membership on the board to one five-year term"
SB506,76997,"Public Records; disclosure; modify provisions to the exemptions for records of a pending investigation or prosecution of criminal activity"
SB507,76998,"Retail Grocery Stores; make washroom facilities available to purchasing customers if facilities are present on the premises"
SB508,76999,"Penal Institutions; allowing convicted persons to remain in local jails; provisions"
SB509,77000,"Special Advisory Commission on Mandated Health Insurance Benefits; establish; membership; terms; meetings and duties"
SB510,77001,"Georgia Youthbuild Program Act; establish program within Dept. of Human Resources; provide authority, duties, and powers"
SB511,77002,"Waste management; declaration of policy and legislative intent; provisions"
SB512,77003,"Sales/Use Taxes; provide state revenue commissioner with authority to collect sales/use taxes from businesses that may not be obligated"
SB513,77004,"Ad Valorem Tax; provide conditions; charitable institutions receiving exemption; rent for a fee without invalidating such exemption"
SB514,77005,"Appeal and Error; provide for appeals from awards of attorney's fees; general agreements of indemnity contracts litigation"
SB515,77006,"Educators' Salary Protection Act; enact; prohibit furloughs; local school system personnel when local reserve funds are available"
SB516,77218,"Property Damage/Intrusion; any person who distributes unsolicited printed material to yards; shall retrieve any such materials not picked up"
SB517,77219,"Ad Valorem Taxes; manner and time of making the state ad valorem tax levy; revise and change provisions"
SB518,77220,"Education; require study of the pledge of allegiance to the flag of United States and Georgia flag; American institutions and ideals"
SB519,77221,"Motor Vehicles; motorized cart; modify definition; change hours of operation; provide local governments decide operators be licensed"
SB520,77222,"Transportation, Dept. of; provide for an Intermodal Division within the department"
SB521,77223,"Education; provide for enrollment counts for students in certain dual enrollment programs"
SB522,77224,"Water Resources; notices to affected property owners; new elevations that are proposed for any property located in regulatory floodway"
SB523,77225,"Georgia Sports Hall Of Fame Authority; reconstitute the governance; provide for new governing body for authority and its members"
SB524,77226,"Corrections; establish a community supervision division; responsible for supervising probationers, parolees, and persons conditionally released"
SB525,77227,"Education; provide for maximum class sizes for safety purposes for classes utilizing science laboratories"
SB526,77228,"Public Roads; provide for regulation of oversize and overweight loads on streets or highway"
SB527,77229,"Election; provide for a gift disclosure report for public officers"
SB528,77230,"Education; public high schools; provide students and parents the option of not releasing their personal information to military recruiters"
SB529,77231,"Crimes and Offenses; specify certain acts that constitute criminal abortion"
SB530,77354,"Public Records; provide for relief/remedies in the case of harassing requests for public records"
SB531,77355,"Ad Valorem Taxes; provide for homestead exemption from Fulton County; county purposes; definitions; specify terms/conditions"
SB532,77356,"Crime; increase the punishment for burglary and certain theft offenses"
SB533,77562,"Lilburn, City of; change the corporate limits of the city"
SB534,77673,"Health Insurance Competition and Rate Relief Act of 2010; insurance market in this state is not functioning in a competitive manner"
SB535,77674,"Businesses; provide for regulation of secondhand dealers; definitions; licenses; reporting requirements"
SB536,77675,"Chattahoochee Hills, City of; increase the homestead exemption ad valorem taxes for municipal purposes; residents 65 years of age or older"
SB537,77676,"Civil Practice; provide for discovery and production of electronically stored information"
