bill_number,bill_id,title
HB1233,70407,"Georgia Public Service Commission; certain costs charged to involved utility; provisions"
HB1234,70408,"State Transportation Board; members term of office; limit"
HB1235,70409,"Anatomical gift; absence of intent to make gift constitutes refusal; specify"
HB1236,70998,"Court reports; reduce number of reports to distribute; change provisions"
HB1237,70999,"Retirement; Title 47; correct errors and omissions of the Official Code of Georgia Annotated"
HB1238,71000,"Georgia Firearms Freedom Act; enact"
HB1239,71001,"Georgia Tourism Job Creation Act; enact"
HB1240,71002,"Sales and use tax; determine addresses using ZIP Codes; provide"
HB1241,71003,"Income tax; order of credits applied on taxpayer's return; provisions"
HB1242,71004,"Ethics; State Transportation Board members are public officers; provide"
HB1243,71005,"Currency transactions; fee for wire transmitted money received; provisions"
HB1244,71006,"Sales and use tax; change certain definitions"
HB1245,71007,"Sales and use tax; audits of books of accounts; provide"
HB1246,71008,"Sales and use tax; tax applicability to outdoor advertising; provide"
HB1247,71009,"Income tax; film, video, or digital productions; revise credit"
HB1248,71010,"Vehicle fees; ad valorem fee payment at time of annual fee; provide"
HB1249,71011,"Ad valorem tax exemption; businesses providing new jobs; provisions"
HB1250,71012,"Registered nurses and physicians assistants; protocol agreement; provisions"
HB1251,71013,"Revenue Bond Law; undertakings include economic tourism development; define"
HB1252,71014,"Transit Governance Study Commission; create"
HB1253,71015,"Georgia Election Code; general elections held in years specified by law; provide"
HB1254,71016,"Pooler, City of; mayor and councilmembers; four-year terms; provide"
HB1255,71017,"Gainesville, City of; ad valorem taxes; educational purposes; provide homestead exemption"
HB1256,71018,"Sexual offenses; minimum age to prosecute prostitution and masturbation for hire; mandate"
HB1257,71019,"Elections; require candidates to file nomination petitions for ballot access; remove"
HB1258,71020,"State Financing and Investment Commission; powers to meet requirements; provide"
HB1259,71021,"Georgia Employer and Worker Protection Act of 2010; enact"
HB1260,71022,"Service delivery regions; applicability of regions; revise a provision"
HB1261,71023,"Hogansville, City of; levy excise tax; authorize"
HB1262,71024,"Hogansville, City of; Redevelopment Powers Law; authorize"
HB1263,71025,"Insurance; payment or reimbursement of oral chemotherapy; provide definitions"
HB1264,71026,"Juvenile Justice, Department of; collect medical insurance reimbursement; authorize"
HB1265,71027,"Penal institutions; types of insurance coverage jails may reimburse; clarify"
HB1266,71028,"Georgia Tourism Development Act; enact"
HB1267,71857,"Timber; penalty for converting timber; change"
HB1268,72233,"Insurance; time periods and eligibility for continuation coverage; revise"
HB1269,72386,"Alcoholic beverages; caffeinated alcoholic beverages; prohibit"
HB1270,72592,"Game and fish; certain licenses for exotic game; define terms"
HB1271,75061,"Georgia Commercial Mortgage Fraud Act; enact; provisions"
HB1272,75062,"Income tax returns; make contributions for lupus and kidney disease; authorize"
HB1273,75063,"Special license plates; Lupus Foundation of America; provide"
HB1274,75064,"Towing firms; only impound in facility open 24 hours a day, every day; provide"
HB1275,75065,"Wayne County Industrial Development Authority; number of board directors; increase"
HB1276,75134,"Student assessment program; temporary waiver if insufficient funds appropriated; provide"
HB1277,75135,"Labor and industrial relations; unlawful to discriminate because of credit history or report; provide"
HB1278,75281,"Revenue and tax; revenue enhancement and tax relief; comprehensive provisions"
HB1279,75446,"Legislative Counsel, Office of; softbound volumes of Georgia Laws; repeal certain requirements"
HB1280,75742,"Animals; dangerous and vicious dogs; revise provisions"
HB1281,75743,"Decatur County; board of commissioners; voting and removal from office; change provisions"
HB1282,75744,"Leary, City of; provide new charter"
HB1283,75745,"State government; budget units to review and modify user fees collected; provide"
HB1284,75746,"Planning and Budget, Office of; record of user fees collected; provide for publication"
HB1285,75747,"Bibb County; levy excise tax; provide"
HB1286,75748,"Macon, City of; levy excise tax; provide"
HB1287,75749,"Public road and street abandonment; counties and municipalities remove roads; authorize"
HB1288,75750,"Jonesboro, City of; levy excise tax; provide"
HB1289,75751,"Contractors; misdemeanor for failure to pay for services; provide"
HB1290,75752,"Electronic Security and Targeting of Online Predators Act (E-STOP); enact"
HB1291,75753,"Penal institutions; reimburse jails for medical expenses; clarify types of insurance"
HB1292,75754,"Colquitt County Family Connection Collaborative on Children and Families; change membership"
HB1293,75755,"Correctional institutions; reimbursement for psychotropic medications; provide"
HB1294,75756,"Transportation, Department of; erect memorial markers; authorize"
HB1295,75757,"Haralson, City of; mayor and councilmembers; stagger terms"
HB1296,75758,"Public employees; file yearly disclosure statements with State Ethics Commission; provide"
HB1297,75759,"Qualification fees; nominally increase; provide"
HB1298,75760,"Hazardous waste; make provisions consistent with federal regulations; provide"
HB1299,75761,"Roswell, City of; office of mayor not held more than three terms; provide"
HB1300,75880,"Lead poisoning; identification and abatement of hazards; revise provisions"
HB1301,75881,"River Basin Protection Act; enact"
HB1302,75882,"General Assembly; expense allowances reduction; provide"
HB1303,75883,"State government; notice for public meetings; clarify provisions"
HB1304,75884,"Local government; members of authorities; conflicts of interest; revise provisions"
HB1305,75885,"Local government entities; citizens have right to speak at meetings; provide"
HB1306,75886,"Municipal corporations; continue to receive services as prior to incorporation; authorize"
HB1307,75887,"Teacher certification; learning requirements for renewal; temporarily suspend"
HB1308,75888,"Minimum wage; increase to match cost of living; reform provisions"
HB1309,75889,"Controlled substances; add synthetic cannabinoids to Schedule I list; provide"
HB1310,75890,"Brain and Spinal Injury Trust Commission; may solicit funds; provide"
HB1311,75891,"Rehabilitation Services, Division of; consideration of financial need; eliminate"
HB1312,75892,"Death penalty; moratorium; provisions"
HB1313,75893,"License requirements; craft brewers; provisions"
HB1314,75894,"Georgia Council on Developmental Disabilities; regulate developmental accounts; provisions"
HB1315,75895,"Public road and street abandonment; counties and municipalities remove roads; authorize"
HB1316,75896,"Quality Basic Education Act; bill of rights for teachers; enact"
HB1317,75897,"Medicaid and PeachCare for Kids Program; contract termination; provide requirements"
HB1318,75898,"Inactive municipalities; dissolution of municipal corporation; specify burden of proof"
HB1319,75899,"Dunwoody, City of; ad valorem tax; provide homestead exemption"
HB1320,75900,"DeKalb County; ad valorem tax; provide homestead exemption"
HB1321,75901,"Emergency Telephone System Fund; additional use for moneys; provide"
HB1322,76078,"Public disclosure exemption; certain graphic image photographs; provisions"
HB1323,76079,"Local government; transfer of certain revenues; limit"
HB1324,76080,"Mental health; Department of Behavioral Health and Developmental Disabilities; revise provisions"
HB1325,76081,"Jekyll Island - State Park Authority Act; no more than 35 percent of land developed; provide"
HB1326,76082,"Dawson County; ad valorem tax; educational purposes; provide homestead exemption"
HB1327,76083,"Dawson County; ad valorem tax; educational purposes; provide homestead exemption"
HB1328,76084,"Courts; adjust certain fees for inflation; provisions"
HB1329,76085,"Insurance; insurers notify person claiming injury loss; require"
HB1330,76086,"Lower Chattahoochee Regional Airport Authority; remove Calhoun County"
HB1331,76087,"Kingsland, City of; Redevelopment Powers Law; authorize"
HB1332,76088,"Ad valorem tax; certification of assessed taxable property value; change provisions"
HB1333,76089,"Dawson County; ad valorem tax; provide homestead exemption"
HB1334,76090,"Minors; electronically furnishing obscene material; include prohibit cellular telephones"
HB1335,76091,"Voter registration; any qualified 16 year old student may preregister; provisions"
HB1336,76092,"Georgia Technology Authority; new duties and procedures; provisions"
HB1337,76093,"Holly Springs, City of; councilmembers elected from designated posts; provide"
HB1338,76094,"Disability parking laws; appointed law enforcer have disability; remove requirement"
HB1339,76095,"Fiscal bills; impact on revenues or expenditures of school system; require fiscal note"
HB1340,76096,"Local enforcement boards; unclaimed homestead exemption; name of agent responsible; provide"
HB1341,76097,"Pickens County Board of Commissioners; create"
HB1342,76098,"Advanced practice registered nurses; protocol agreement with physician; amend provisions"
HB1343,76323,"Criminal cases; fees charged to probationers; change amount; provisions"
HB1344,76324,"Certificates of title; inspect salvaged or rebuilt motor vehicles; change duty"
HB1345,76325,"Georgia Kosher Food Consumer Protection Act; enact"
HB1346,76326,"Henry County; require board member to resign if stand for other election; repeal provisions"
HB1347,76327,"Henry County; Redevelopment Powers Law; authorize"
HB1348,76328,"Georgia School Bus Safety Task Force; create"
HB1349,76329,"Roswell, City of; Redevelopment Powers Law; authorize"
HB1350,76330,"Alcoholic beverages; filing of bonds with license renewal applications; change provisions"
HB1351,76331,"Dispossessory proceedings; landlord bar tenant entry after past due rent; provide"
HB1352,76332,"University System Fiscal and Administrative Oversight Commission; provide"
HB1353,76333,"White County Building Authority Act; enact"
HB1354,76334,"Professions and businesses; electronic signature for certain professions; provide"
HB1355,76335,"East Point, City of; levy excise tax; authorize"
HB1356,76336,"Official Code of Georgia Annotated; amend several titles"
HB1357,76337,"Open and public meetings; posting and advertisement of tax assessors meetings; change requirements"
HB1358,76338,"State purchasing; price paid by state not exceed price offered to others; require"
HB1359,76339,"Best management practices; required buffer along state waters; provide exception"
HB1360,76340,"Sales and use tax; change certain definitions"
HB1361,76341,"Jekyll Island - State Park Authority; membership; prohibit conflicts of interest; provide"
HB1362,76599,"Alma, City of; change certain charter provisions"
HB1363,76600,"Georgia Building Authority; adopt master plan for Capital Square; require"
HB1364,76601,"Insurance; Georgia Insurers Insolvency Pool liable in emergency; provide"
HB1365,76602,"Law judge or hearing officer; deference on technical issues when reviewing permits; provisions"
HB1366,76603,"Elections; incumbent for reelection as independent without filing petitions; provide"
HB1367,76604,"Elections; independent candidates have additional qualifying period; provide"
HB1368,76605,"Conservation and natural resources; level of registration required for Environmental Protection Division permits; specify"
HB1369,76606,"Maps and plats; certain data shown; subdivisions; provide restrictions"
HB1370,76607,"Conservation and natural resources; certain environmental protection permits; revise provisions"
HB1371,76608,"Podiatry practice; include certain cosmetic foot and leg conditions; provide"
HB1372,76609,"Sales and use tax; point of sale data made available to counties; provide"
HB1373,76610,"Secondary metals recyclers; theft crimes; transaction records; change provisions"
HB1374,76611,"Overtaking a school bus; reporting violations; enforced by video images; define terms"
HB1375,76612,"Meetings open to public; video posting on official website satisfy requirement; provide"
HB1376,76613,"Holidays and observances; Irish Heritage and History Month; establish"
HB1377,76614,"Residential contractor; raise dollar cap of activity or work performed; change definition"
HB1378,76615,"Lumpkin County, Magistrate Court of; appoint clerk; provide"
HB1379,76616,"Snellville, City of; Redevelopment Powers Law; authorize"
HB1380,76617,"Insurance; insurable interest in retired employee; may void insurance; provisions"
HB1381,76618,"Motor vehicles and traffic; safer bicycle riding; provide definitions"
HB1382,76619,"Sales and use tax; special purpose public safety local option tax; provide"
HB1383,76620,"Unclaimed property; disposition of gift card when owner dies or is missing; provisions"
HB1384,76621,"Local governments; constitutional zoning authority; remove prohibition"
HB1385,76622,"Disability compensation; payments to law enforcement injured in line of duty; authorize"
HB1386,76623,"Meetings; service delivery agreements; not open to public; provide"
HB1387,76624,"Official Code of Georgia Annotated; correct errors and omissions"
HB1388,76625,"Development authorities; change a certain definition"
HB1389,76626,"Public assistance; random drug testing for recipients; provisions"
HB1390,76627,"Gwinnett County, Board of Commissioners; reconstitute the board; provide"
HB1391,76628,"Columbus, Municipal Court; change clerk and marshal compensation"
HB1392,76891,"Georgia Nuclear Energy Financing Act; recover generating plant costs from customers; eliminate"
HB1393,76967,"Sales and use tax; cap exemption; metropolitan public transportation purposes; provide"
HB1394,76968,"Solid waste management; scrap tires; utilize transport destination designation form; require"
HB1395,76969,"Buildings; new slab-on-grade residential structures; accessibility; provide"
HB1396,76970,"Georgia Regional Grand Jury Act; enact"
HB1397,76971,"Salary Protection Act; enact"
HB1398,76972,"Safety belts; change certain provisions"
HB1399,76973,"Insurance; payment to third parties; motor vehicle repair services; provide"
HB1400,76974,"Sasser, Town of; Terrell County; provide new charter"
HB1401,76975,"College Park, City of; Water and Sewer Authority; create"
HB1402,76976,"Georgia Student Finance Authority; engineering field loans; Peace Corps volunteers; deferred payment; provide"
HB1403,76977,"Mountain Park, City of; number of councilmen; change provisions"
HB1404,76978,"Motor vehicles; taxicab and limousine; registration and titling; provisions"
HB1405,76979,"2010 Special Council on Tax Reform and Fairness for Georgians; Special Joint Committee on Georgia Revenue Structure; create"
HB1406,76980,"Student-Athletes Right to Know Act of 2010; enact"
HB1407,76981,"Medicaid and PeachCare for Kids; single administrator for dental services; provisions"
HB1408,76982,"Sales and use tax; distribution of tax proceeds; collect data"
HB1409,76983,"Georgia Economy Investment Act; enact"
HB1410,76984,"Tolling of limitations for tort actions; while prosecutions pending; change provisions"
HB1411,76985,"Quiet reflection period; accommodate freedom of religion; clarify"
HB1412,76986,"School bus operation; establish procedures for unloading children under eight; require"
HB1413,76987,"Disciplinary tribunals; same hearing panel for incidents of two or more students; provisions"
HB1414,76988,"Sexual Offender Registration Review Board; Halloween activities; prohibit"
HB1415,76989,"Mandatory education; reimbursement to school system for parent notice; provide"
HB1416,76990,"Income tax credit; qualified broadband equipment; provide"
HB1417,76991,"Boards of education; nonbinding advisory referendum; school uniforms; provide"
HB1418,76992,"Core curriculum; students complete 40 hours service learning; require"
HB1419,76993,"Motor fuels tax; subject to 4 percent tax; provisions"
HB1420,77200,"Health; prohibition of smoking in public places; enact new provisions"
HB1421,77201,"Disposition of cremains; veterans; provide"
HB1422,77202,"Montgomery County; Board of Commissioners; terms of office; provide"
HB1423,77203,"Public health and morals; smoking in vehicles with child passenger; provide for crime"
HB1424,77204,"Insurance; Internet driver improvement programs; qualify for reduction; provide"
HB1425,77205,"Elections; candidates file nomination petitions for ballot access; remove requirement"
HB1426,77206,"Alcoholic beverages; brewpubs; change qualifications"
HB1427,77207,"Norcross, City of; mayor and city councilmembers; change terms"
HB1428,77208,"School construction; within 500 feet of freeway or traffic corridor; prohibit"
HB1429,77209,"Cartersville, City of; levy excise tax; authorize"
HB1430,77210,"Bartow County; levy excise tax; authorize"
HB1431,77211,"Georgia Services Administration; succeed Department of Administrative Services; create provisions"
HB1432,77212,"University System of Georgia; American Sign Language credit; require"
HB1433,77213,"Domestic relations; international marriage brokers; provide regulation"
HB1434,77214,"Norcross, City of; mayor and councilmembers elected by plurality; provide"
HB1435,77215,"Medical treatment; nourishment of person receiving health care; provide"
HB1436,77216,"Health care facilities; compensated officers disclose financial information; require"
HB1437,77348,"Mass transportation; MARTA board of directors; change membership"
HB1438,77349,"Health; distribute health videos to mothers of newborns; provide"
HB1439,77350,"Building codes; certain farm buildings; provide exemption"
HB1440,77351,"Minors; sale of cigarette and tobacco objects; blunt wraps; provide regulation"
HB1441,77352,"Public accommodations charges; certain levies; change procedures"
HB1442,77353,"Local Government Prepaid Wireless 9-1-1 Fee Collection Authority; create"
HB1443,77544,"State Road and Tollway Authority; abolish and transfer duties to Department of Transportation; provide"
HB1444,77545,"Social Circle, City of; certain geographical area; remove from corporate city limits"
HB1445,77546,"Boards of education; member possess high school or general educational development diploma; provisions"
HB1446,77547,"Clayton County; become participant in MARTA; hold nonbinding referendum"
HB1447,77548,"Dalton, City of; levy excise tax; authorize"
HB1448,77549,"Whitfield County; levy excise tax; authorize"
HB1449,77550,"Nursing homes; determine if new resident is registered sexual offender; require"
HB1450,77551,"State Court of DeKalb County; certain fees; change"
HB1451,77552,"Varnell, City of; change charter provisions"
HB1452,77553,"Towns County; educational purposes; ad valorem tax; homestead exemption"
HB1453,77554,"Hiawassee, City of; municipal purposes; ad valorem tax; homestead exemption"
HB1454,77555,"Georgia Board of Dentistry; independent agency; provide"
HB1455,77556,"Marietta, City of; city council meetings; modify provisions"
HB1456,77557,"Selling and trade practices; certain practices by credit card companies; prohibit"
HB1457,77558,"Public high schools; option to not release information to military recruiters; provide"
HB1458,77559,"Habersham County, State Court; judge and solicitor be full-time; provide"
HB1459,77560,"Brief period of quiet reflection; accommodate freedom of religion; clarify"
HB1460,77561,"Foreclosure; conditioning sale of foreclosed home; provisions"
HB1461,77659,"Tennille, City of; mayor's vote; provide"
HB1462,77660,"Coolidge, City of; create new charter"
HB1463,77661,"Lee County, Magistrate Court; increase law library fee; authorize"
HB1464,77662,"Insurance; purpose of a certificate of insurance; provide"
HB1465,77663,"College Park, City of; Water and Sewer Authority; create"
HB1466,77664,"Martin Luther King, Jr. Advisory Council; create"
HB1467,77665,"Cornelia, City of; levy excise tax; authorize"
HB1468,77666,"Dade County Water and Sewer Authority; composition; provide"
HB1469,77667,"Talbot County; elections; composition and appointment of board; change"
HB1470,77668,"Henry County; levy excise tax; authorize"
HB1471,77669,"Motor vehicles; applying or renewing license plate; donate to county libraries; provide"
HB1472,77670,"Gray, Town of; powers of mayor; provide"
HB1473,77671,"Georgia Government Transparency and Campaign Finance Act of 2010; enact"
HB1474,77672,"Unsolicited newspapers; create and maintain Do Not Receive Registry; require"
HB1475,77990,"Licenses; authority to discipline a physical therapist; modify provisions"
HB1476,77991,"Liberty County Industrial Authority; members vote by phone; provide"
HB1477,77992,"Attorney General; if fail to represent state in court; Governor designate counsel; provide"
HB1478,77993,"Dexter, town of; municipal corporate limits; change"
HB1479,78082,"Chattooga County; board of elections and registration; create"
HB1480,78083,"Clinch County; composition and election of governing authority; change"
HB1481,78084,"Union County; Probate Court judge; nonpartisan elections; provide"
HB1482,78129,"Stockbridge, City of; councilmember elections; advisory referendum; provide"
HB1483,78130,"Johns Creek, City of; maximum ad valorem tax levied by city; change provisions"
HB1484,78131,"Byron, City of; corporate city limits; change"
HB1485,78204,"Kingsland, City of; corporate city limits; change"
HB1486,78240,"Union County; nonpartisan elections; probate court judge; provide"
HB1487,78241,"Counties; purchasing department; change provisions"
HB1488,78536,"Distilled spirits; 33 excise tax option; provide"
HB1489,78537,"Remerton, City of; provide new charter"
HB1490,78538,"Cedartown, City of; levy excise tax; authorize"
HB1491,78539,"Dawson County; Redevelopment Powers Law; authorize"
HB1492,84905,"Bacon County; advisory referendum election; provide"
HB1493,84906,"Public Facilities Authority of Telfair County Act; enact"
HB1494,84907,"Pierce County Board of Commissioners; office of county manager; create"
HB1495,84908,"Garden City, City of; corporate city limits; extend"
HB1496,84909,"Spalding County; homestead exemption; qualifying income level; increase"
HB1497,84910,"Lavonia, City of; corporate city limits; change and extend"
HB1498,84911,"Royston, City of; ad valorem tax; municipal purposes; homestead exemption"
HB1499,84912,"Habersham County; package and sale by drink sales; advisory referendum; provide"
HB1500,84913,"Cleveland, City of; levy excise tax; authorize"
HB1501,84914,"Blasting operations; use of explosives in blasting; change provisions"
HB1502,84915,"Hinesville, City of; limit compensation increases for mayor and councilmembers; provide"
HB1503,84916,"Clayton County Civil Service Act; review and appeal decisions; change provisions"
HB1504,84917,"St. Marys Convention and Visitors Bureau Authority; two additional members; provide"
HB1505,84918,"Waco, City of; provide new charter"
HB1506,85668,"Turner County; board of elections and registration; create"
HB1507,85669,"Clarkston, City of; election and powers of the mayor; provide"
HB1508,85670,"DeKalb County; district services; change definition"
HB1509,85671,"Savannah, City of; Chatham County; board of education members; add qualifications"
HB1510,85855,"Lowndes County; Board of Commissioners; provide"
HB1511,85856,"Douglasville-Douglas County Water and Sewer Authority; board of directors; amend"
HB1512,120697,"McPherson Implementing Local Redevelopment Authority; membership; modify provisions"
HB1513,120698,"Fannin County; Magistrate Court clerk; appointed by chief magistrate; provide"
HB1514,120699,"Gilmer County; Magistrate Court clerk; appointed by chief magistrate; provide"
HB1515,120700,"Income tax; taxable income not include certain health plan premiums; provide"
HB1516,120701,"Presidential Preference Primary; establish candidate qualifications; provide"
HB1517,120702,"Insurance; federal health care plans not offer abortion coverage; provide"
HB1518,120703,"Polk County; ad valorem tax; county purposes; homestead exemption"
HB1519,120704,"Polk County; ad valorem tax; educational purposes; homestead exemption"
HB1520,120705,"Health and morals; wireless telephone sales to persons under 18; prohibit"
HB1521,120706,"Rehabilitation Services, Division of; transfer to Department of Community Affairs; repeal certain provisions"
HB1522,120707,"Georgia Tourism and Community Development Act for Natural and Cultural Resources; enact"
HB1523,130069,"Income tax; property donations for public parks; provide tax credit"
HB1524,130070,"Controlled substances; add certain drugs to Schedule V list; provisions"
HB1525,130071,"Georgia Packaged Food Origin Labeling Act; enact"
HB1526,130072,"Tax Amnesty Program Act; additional amnesty periods; provisions"
HB1527,130073,"Insurance; no state health care plan offer abortion coverage; provide"
HR1,66718,"Real property; residential and nonresidential; freeze valuation - CA"
HR2,66719,"Bringing Equity Statewide to Taxation Amendment; enact - CA"
HR3,66720,"Governor's veto; one house overrides; other house votes immediately; provide - CA"
HR4,66721,"Counties; future laws; expenditure of funds; provisions - CA"
HR5,66722,"Paramount right to life; human beings; provisions - CA"
HR6,66723,"Johnson, Randall; retirement; commend and invite to House"
HR7,66724,"General Assembly; provide homeowner tax relief grants; appropriate funds - CA"
HR8,66725,"General Assembly; law for townships; provide - CA"
HR9,66726,"Freedom of Ownership Amendment; enact - CA"
HR10,66727,"Joint Study Committee for Clean Energy Technology; create"
HR11,66728,"Taxpayer Dividend Amendment of 2010; enact - CA"
HR12,66729,"Eligibility to vote; verification of citizenship; provisions - CA"
HR13,66730,"House convened; notify Senate"
