bill_number,bill_id,title
HR1271,67988,"Holden, Samantha; commend"
HR1272,67989,"Lawrence, Belinda B.; commend"
HR1273,67990,"Lanier, Joseph M.; commend"
HR1274,67991,"Terwilliger, Toni; commend"
HR1275,67992,"Taylor, Shanna; commend"
HR1276,67993,"Moore, DeAnna T.; commend"
HR1277,67994,"Powers, Candy L.; commend"
HR1278,67995,"Ahrens, Wendy Michelle; commend"
HR1279,67996,"Cook, Heather Jones; commend"
HR1280,67997,"Craft, Tommy; commend"
HR1281,67998,"Moore, Barbara; commend"
HR1282,67999,"Carlyle, Eric, PhD; commend"
HR1283,68000,"Leach, Dr. Sonji; commend"
HR1284,68001,"Mason, Gloria W.; commend"
HR1285,68002,"Gambrell, Anna; commend"
HR1286,68003,"Phillips, Cindy; commend"
HR1287,68004,"Georgia Institute of Technology Day at the capitol; February 9, 2010; recognize"
HR1288,68005,"Ruffin, Honorable John H., Jr.; condolences"
HR1289,68006,"HomeTown Health; Georgia's rural hospitals; commend and invite to House"
HR1290,68007,"Hungary Day; Feb. 12, 2010; recognize and invite ambassador to House"
HR1291,68008,"Feng, Xie; Chinese Minister; commend and invite to House"
HR1292,68009,"Congress; pass Bridging Bank to Recovery Act; urge"
HR1293,68010,"Joint Study Committee on Licensure of Residential and General Contractors; create"
HR1294,68011,"John McHugh, Secretary of the Army; Fort Hood shootings; unborn child as victim; urge"
HR1295,68012,"Cody Warren Memorial Highway; dedicate"
HR1296,68013,"Goswick Family Bridge; Murray County; dedicate"
HR1297,68014,"Patient-Centered Physician Coalition of Georgia Day; Feb. 4, 2010; recognize"
HR1298,68015,"McMillan, Dr. Elridge W.; commend and invite to House"
HR1299,68016,"Andy Quinney Overpass; Garden City; dedicate"
HR1300,68017,"Sales and use tax; motor fuel collections; appropriated for transportation; provisions - CA"
HR1301,68018,"H.G. ""T"" Fulcher Memorial Bridge; Richmond County; dedicate"
HR1302,68019,"National Wear Red Day; Feb. 5, 2010; recognize"
HR1303,68020,"Coker, James E. &amp; Kaye Hames; 40th wedding anniversary; recognize"
HR1304,68021,"Griffin, Mrs. Vivian Hamp; condolences"
HR1305,68022,"Cummings, Mrs. Mary A. Moss; condolences"
HR1306,68023,"Howard, Mr. Robert; condolences"
HR1307,68024,"Calhoun, Mrs. Beverly W.; condolences"
HR1308,68025,"Lowe, Mrs. Narvell Glover; condolences"
HR1309,68026,"Berry, Mrs. Margaret L.; condolences"
HR1310,68027,"Bryan, Mr. James H.; commend"
HR1311,68028,"Brown, Mr. Michael; commend"
HR1312,68029,"Logue, Clara; commend"
HR1313,68030,"Sanders, Joseph; commend"
HR1314,68031,"Cuddy, Mr. Dave; commend"
HR1315,68032,"Ring, Mrs. Stephanie; commend"
HR1316,68033,"Allgood, Mr. Luke; condolences"
HR1317,68034,"2010 class of Leadership Sandy Springs; commend"
HR1318,68035,"McCollam, Dr. Stephen M.; commend"
HR1319,68036,"Thomas, Master James William ""Jamee""; high school graduation; honor"
HR1320,68037,"Peachtree Ridge High School; commend"
HR1321,68038,"Floor, Kayla; commend"
HR1322,68039,"Akande, Nicky; commend"
HR1323,68040,"Corry, Dr. Larry; commend and invite to House"
HR1324,68041,"Collins Hill High School softball team; commend and invite to House"
HR1325,68042,"Rome Judicial Circuit; commend and invite to House"
HR1326,68043,"Boyle, Dr. Stephen; commend and invite to House"
HR1327,68044,"Collins Hill High School wrestling team; commend and invite to House"
HR1328,68045,"Georgia Peach Festival; commend and invite 2010 Ga. Peach Queens to the House"
HR1329,68046,"Peach County High School football team; commend and invite to House"
HR1330,68047,"Georgia Citizens' Coalition on Hunger; Up &amp; Out of Poverty Now!; commend"
HR1331,68048,"Hankerson, Mr. David; commend"
HR1332,68049,"Partnership for Health and Accountability; commend"
HR1333,68050,"Rural Health Day at the state capitol; Feb. 17, 2010; recognize"
HR1334,68051,"Russell, James Grady; commend"
HR1335,68052,"Grits Caf; commend"
HR1336,68053,"Kupets, Ms. Courtney; Collegiate Woman Athlete of the Year; congratulate"
HR1337,68054,"English, Dr. Carolyn McAdams; commend"
HR1338,68055,"Garcia, Mr. Rob; commend"
HR1339,68056,"Clark, Mr. George; condolences"
HR1340,68057,"Jones, Mr. Marvin ""Lefty""; condolences"
HR1341,68058,"National Health Museum; recognize"
HR1342,68059,"Womack, Mr. Roy Carlton; condolences"
HR1343,68060,"Georgia Academy of Audiology Day; commend &amp; invite representatives to the House"
HR1344,68061,"Lank, Ms. Michelle Smith; commend and invite to House"
HR1345,68062,"2008 Child Fatality Review Committee of the Year; commend &amp; invite to House"
HR1346,68063,"Yoculan, Coach Suzanne; commend and invite to House"
HR1347,68064,"Portman, Mr. John Calvin; commend and invite to House"
HR1348,68065,"Eagle Scouts of Troop 47 from Newnan, Georgia; commend and invite to House"
HR1349,69167,"Honorable Hugh D. Sosebee Bridge; Monroe County; dedicate"
HR1350,69168,"Dual Broadrick Memorial Highway; Whitfield County; dedicate"
HR1351,69169,"House Study Committee on Procurement Policies of Georgia Departments and Agencies Regarding Businesses Owned by Minorities and Women; create"
HR1352,69170,"Reece, Sheriff Robert N. ""Butch""; commend"
HR1353,69171,"Richards, Coach James ""Friday""; commend"
HR1354,69172,"Alpha Kappa Alpha Day; Feb. 15, 2010; commend"
HR1355,69173,"PAGE Day on Capitol Hill; Feb. 23, 2010; recognize"
HR1356,69174,"Hasan Shriners Barbeque Festival; qualifier; recognize"
HR1357,69175,"Congress; postpone effort to regulate greenhouse gases through Clean Air Act; request"
HR1358,69176,"Sales and use tax; 25 percent to transportation; dedicate - CA"
HR1359,69177,"House Study Committee on Video Gambling Machines; create"
HR1360,69178,"Georgia Lottery Corporation; review policies to include incentive and bonus payments; urge"
HR1361,69179,"Georgia Lottery Corporation; review policies to include incentive and bonus payments; urge"
HR1362,69180,"Boy Scouts of America program; 100th anniversary; commend"
HR1363,69181,"Community Health Centers Day; Feb. 11, 2010; recognize"
HR1364,69182,"Earth Hour; Saturday, March 27, 2010, from 8:30 P.M. to 9:30 P.M.; recognize"
HR1365,69183,"Chatham Co. Commission; Savannah Econ. Dev. Authority; Imperial Sugar; commend"
HR1366,69184,"Clark, Mr. Wilson Burford, Jr.; commend"
HR1367,69185,"Jordan, Hayden; commend"
HR1368,69186,"Netherlands Day at the state capitol; Feb. 23, 2010; recognize"
HR1369,69187,"Mount Nebo United Methodist Church; 150th anniversary; commend"
HR1370,69188,"Backus, Mrs. Denise; commend"
HR1371,69189,"Kennedy, Mr. Alan; commend"
HR1372,69190,"Derochers, Luke; commend"
HR1373,69191,"Curry, McKennah; commend"
HR1374,69192,"Shults, Eddie; commend"
HR1375,69193,"Jones, Phillip Micah; commend"
HR1376,69194,"Abel, Emma; commend"
HR1377,69195,"Senior Week at the state capitol; Feb. 23, 2010; recognize"
HR1378,69196,"Shapiro, Noah William; commend"
HR1379,69197,"Rope, Evan Marshall; commend"
HR1380,69198,"Wilkins, Dominique; NBA Hall of Famer; Georgia's Diabetes Ambassador; recognize"
HR1381,69199,"Ga. Perimeter Col.; Atl. Center for Civ. Engagement; Service Learning; recognize"
HR1382,69200,"Elkins, Mr. Jack; condolences"
HR1383,69201,"Loganville High School wrestling team; commend and invite to House"
HR1384,69202,"Deputy Blake Gammill Memorial Highway; Douglas County; dedicate"
HR1385,69203,"Alpha Fowler, Jr., Memorial Bridge; Douglas County; dedicate"
HR1386,69204,"Toccoa-Stephens County Day; Feb. 10, 2010; recognize"
HR1387,69205,"Penamon, Mr. David ""Junior"", Jr.; commend"
HR1388,69206,"Miller, Lexie; commend"
HR1389,69207,"Brock, Mrs. Dawn; commend"
HR1390,69208,"Chandler, Mr. Todd; commend"
HR1391,69209,"Edwards, John; commend"
HR1392,69210,"Burn Awareness Week; Feb. 7-13, 2010; proclaim"
HR1393,69211,"Hotel Indigo; Athens; commend"
HR1394,69212,"Patriots Day; April 19, 2010; Patriots of the American Revolution; recognize"
HR1395,69213,"Hall, Dr. David; president; University of the Virgin Islands; commend"
HR1396,69214,"Ehrhart, Earl ""Quentin"" Day, V; commend"
HR1397,69215,"Warner Robins American Little League; commend and invite to House"
HR1398,69216,"Alpha Phi Alpha Fraternity, Inc.; commend and invite representatives to House"
HR1399,69217,"Waller, Mr. Ronald L.; commend and invite to House"
HR1400,69218,"Congress; not transfer Guantanamo Bay detainees within Georgia or United States; request"
HR1401,69219,"Coroner; shall be county officer; provide - CA"
HR1402,69220,"Thornell, Mr. Allen Keith; condolences"
HR1403,69221,"Winn, Ms. Margel D.; commend"
HR1404,69222,"Marchand, Mr. Doug J.; retirement; recognize"
HR1405,69223,"Strozier, Mr. William C. ""Billy""; commend"
HR1406,69224,"Waller, Mr. Ronald L.; commend"
HR1407,69225,"Ray, Mr. Michael L.; commend"
HR1408,69226,"Harris, Mr. Charlie Frank; commend"
HR1409,69227,"Boy Scouts of America Day at the state capitol; Feb. 11, 2010; recognize"
HR1410,69647,"United States President and Congress; secure borders; reject 1986 legalization program repeat; urge"
HR1411,69648,"Veazey, Chance; commend and invite to House"
HR1412,69649,"Perno, Coach David; commend and invite to House"
HR1413,69650,"Dillon, Mr. Mike; commend and invite to House"
HR1414,69651,"Reece, Sheriff Robert N. ""Butch""; commend and invite to House"
HR1415,69652,"Sandy Creek High School football team; commend and invite to House"
HR1416,69653,"""Lawmakers""; 40th season; commend and invite to House"
HR1417,69654,"Hair Loss Summit Day in Georgia; Feb. 20, 2010; recognize"
HR1418,69655,"O'Neal, Dr. Patrick; commend"
HR1419,69656,"Efird, Betty &amp; Mike; commend"
HR1420,69657,"Connally, Mrs. Elaine; condolences"
HR1421,69658,"Hill, Mr. Walter Lee, Sr.; condolences"
HR1422,69659,"Johnson, Terry Mark; TJ and Friends Foundation, Inc.; commend"
HR1423,69660,"Reid, Coach Richard; 1,000th win; commend"
HR1424,69661,"Strock, Mrs. Dori; commend"
HR1425,69662,"National Sorority of Phi Delta Kappa, Inc., Day; Feb. 17, 2010; recognize"
HR1426,69663,"DuBose, Mr. Edward O.; commend"
HR1427,69664,"Emergency Medical Services Recognition Day; Feb. 18, 2010; recognize"
HR1428,69665,"Emergency Medical Services (EMS) Week; recognize"
HR1429,69666,"Gay, Ms. Pat; retirement; recognize"
HR1430,69667,"Williams, Mr. Jeremy; commend"
HR1431,69668,"Arneson, Mr. Mark E.; National Commander; Sons of the American Legion; commend"
HR1432,69669,"Local ad valorem tax; reduce or eliminate with 1 percent sales tax; authorize - CA"
HR1433,70509,"Joint session; message from Chief Justice of Supreme Court; reschedule"
HR1434,70510,"Charles Thomas Edwards Memorial Bridge; Jasper County; dedicate"
HR1435,70511,"House Study Committee on Hotel-Motel Tax; create"
HR1436,70512,"Wayt, Mr. John Augustus, Jr.; condolences"
HR1437,70513,"Grigsby, Mr. Richard Howard; condolences"
HR1438,70514,"Police chiefs; heads of law enforcement; commend"
HR1439,70515,"Building Owners and Managers Association-Atlanta Day; Feb. 22, 2010; recognize"
HR1440,70516,"Palmer, Grace; commend"
HR1441,70517,"National Rural Electric Cooperative Association; commend"
HR1442,70518,"McAbee, Coach Clint; commend"
HR1443,70519,"Parkinson's Day at the state capitol; Feb. 18, 2010; recognize"
HR1444,70520,"Lupus Awareness Day at the state capitol; Feb. 17, 2010; declare"
HR1445,70521,"Platt, ""General"" Larry; commend and invite to House"
HR1446,70522,"State Transportation Board; members term of office; limit - CA"
HR1447,71043,"Omega Psi Phi Fraternity, Inc.; Feb. 18, 2010; commend &amp; invite members to House"
HR1448,71044,"Ad valorem tax exemption; net job producing jurisdictions; provide - CA"
HR1449,71045,"Georgia Composite Medical Board; surgery and anesthesia; establish regulations; urge"
HR1450,71046,"SFC John Beale Hero's Highway; Henry County; dedicate"
HR1451,71047,"Rogers, Kenny; commend and invite to House"
HR1452,71048,"Jones, Reverend Warren L.; commend and invite to House"
HR1453,71049,"Scott, Mrs. Ella Young; commend and invite"
HR1454,71050,"Black Doll Affair Social Movement; commend and invite to House"
HR1455,71051,"Irvin, Commissioner Tommy; commend and invite to House"
HR1456,71052,"Lane, Honorable Roger B.; commend"
HR1457,71053,"Phi Beta Sigma Fraternity, Inc.; commend"
HR1458,71054,"Zeta Phi Beta Sorority; commend"
HR1459,71055,"Smith, Chaplain Donald G.; commend"
HR1460,71056,"Tanner, Mr. Tony; commend"
HR1461,71057,"Esco, Terry; police chief of Braselton, Georgia; commend"
HR1462,71058,"Braselton, Mr. Henry Edward; condolences"
HR1463,71059,"Johnson, Mr. Cedric J.; commend"
HR1464,71060,"Phillips, Mr. Eddie; condolences"
HR1465,71061,"McCauley, Sarah; commend"
HR1466,71062,"Evans, Mrs. Willie Mae; 100th birthday; recognize"
HR1467,71063,"Ga. Council on Aging; District 44 Senior Citizens Day; Feb. 24, 2010; recognize"
HR1468,71064,"Lovett, Chief Willie C.; Chief of Police; Savannah-Chatham; commend"
HR1469,71065,"Johnson, Mr. Forest, Sr.; condolences"
HR1470,71066,"Transit Day in Georgia; Feb. 18, 2010; recognize"
HR1471,71067,"Tate, Mrs. Bettina Polite; commend"
HR1472,71068,"Geiger, Laura &amp; Walter; commend"
HR1473,71069,"Savannah Chapter #159 of the Order of the Eastern Star, Prince Hall; commend"
HR1474,71859,"T.C. Coogle Memorial Bridge; Oglethorpe County; dedicate"
HR1475,71860,"Veterans' Memorial Highway; Peach County; dedicate"
HR1476,72075,"General Assembly; veto sessions; provide - CA"
HR1477,72468,"Walter Curtis Butler, Jr. Memorial Bridge; Morgan County; near US 278; dedicate"
HR1478,72469,"Walter Curtis Butler, Jr. Memorial Bridge; Morgan County; over I-20; dedicate"
HR1479,72593,"SP-5 Harry E. Chesser Memorial Bridge; Brantley County; dedicate"
HR1480,75136,"Lottery funds; used for programs to assist learning disabled children; provide - CA"
HR1481,75448,"Murphy, Thomas B.; official portrait; provide ceremony; honor"
HR1482,75768,"Harry L. Portier Memorial Bridge; Irwin County; dedicate"
HR1483,75769,"Rev. H.G. Jarrard Memorial Intersection; Hall County; dedicate"
HR1484,75770,"United States Congress; not pass legislation preventing state from collecting third-party hotel-motel tax; request"
HR1485,75771,"Professional Standards Commission; Certification and Professional Learning Task Force; create"
HR1486,75772,"Georgia law enforcement officers; write citations legibly; urge"
HR1487,75773,"Community Health, Department of; data collection of chronic obstructive pulmonary disease; pass regulations"
HR1488,75774,"Desselle, Mrs. Gwen; 2010 Ga. Teacher of the Year; commend and invite to House"
HR1489,75775,"Junior Leagues of Georgia; commend and invite members to House"
HR1490,75776,"Houts, Ashley; commend and invite to House"
HR1491,75777,"Gatewood Lady Gators basketball team; commend and invite to House"
HR1492,75778,"St. Patrick's Day Parade Committee; commend and invite members to House"
HR1493,75779,"Peoples, Ms. Dottie; commend and invite to House"
HR1494,75780,"Peoples, Ms. Dottie; commend"
HR1495,75781,"Desselle, Gwen; commend"
HR1496,75782,"Trimm, Dr. Cindy; commend"
HR1497,75783,"Girl Scout Day at the state capitol; March 12, 2010; recognize"
HR1498,75784,"Links Day at the state capitol; March 10, 2010; recognize"
HR1499,75785,"Jones, Reverend Michael A.; 55th pastoral anniversary; recognize"
HR1500,75786,"American Legion Post 143; 75th anniversary; recognize"
HR1501,75787,"Welch, Mrs. Tina Lawson; condolences"
HR1502,75788,"Crawford, Deputy Davy Wayne ""Dave""; condolences"
HR1503,75789,"Davis, Mr. Desse Ervin; commend"
HR1504,75790,"Strayhorn, Ms. Terri; commend"
HR1505,75791,"Conner, Miss Whitney Leah; 2010 Georgia Watermelon Queen; commend"
HR1506,75792,"Barr, Sergeant Charles; commend"
HR1507,75793,"Stephens, General Robert ""Steve""; commend"
HR1508,75794,"Zellman, Mr. Anton J.; commend"
HR1509,75795,"Hale, Reverend Dr. Wimbley, Jr.; commend"
HR1510,75796,"American Red Cross Month in Georgia; March 2010; proclaim"
HR1511,75797,"Clergy Day at the state capitol; March 9, 2010; recognize"
HR1512,75798,"Dialysis Patient Citizens; Georgia Dialysis Day; March 3, 2010; recognize"
HR1513,75799,"Little's Ferry/George F. Green Memorial Bridge; Hancock and Putnam Counties; dedicate"
HR1514,76116,"Adjournment; relative to"
HR1515,76117,"Georgia Commission For Entrepreneurship Excellence; create"
HR1516,76118,"United States Congress; not decommission Coast Guard Security Team 91108; urge"
HR1517,76119,"United States Congress; fully fund Resources Conservation and Development Program; urge"
HR1518,76120,"Cox, Bobby; commend and invite to House"
HR1519,76121,"Peoples, Dottie; Clergy Day; commend"
HR1520,76122,"Lee, Pastor Eric Wendell; commend"
HR1521,76123,"Tyre, Apostle Jacquie; commend"
HR1522,76124,"Moss, Pastor Marvin; commend"
HR1523,76125,"Bronner, Pastor Nathaniel; commend"
HR1524,76126,"Alvarado, Dr. Toni; commend"
HR1525,76127,"McKenzie, Sabrina; commend"
HR1526,76128,"Harris, C.J.; commend"
HR1527,76129,"Omalami, Dr. Elizabeth; commend"
HR1528,76130,"Trimm, Dr. Cindy; commend"
HR1529,76131,"Mikkilinen, Dr. Hyma Vati; commend"
HR1530,76132,"Green, Dr. Valeria Tate; commend"
HR1531,76133,"Hawkins, Bishop Gary; commend"
HR1532,76134,"Bullock, DeeDee; commend"
HR1533,76135,"Hopkins, Dr. Jamal; commend"
HR1534,76136,"Thurmond, Michael; commend"
HR1535,76137,"DeJan, Talein; commend"
HR1536,76138,"Lapidus, Rabbi Loren Filson; commend"
HR1537,76139,"Taylor, Dr. Hope; commend"
HR1538,76140,"Wall, Russell; commend"
HR1539,76141,"Hill, Marian; commend"
HR1540,76142,"Thurston, Gene; commend"
HR1541,76143,"Restrepo, Chelsie Marie; commend"
HR1542,76144,"Barber, Lynn; commend"
HR1543,76145,"Mixon, Cynthia; commend"
HR1544,76146,"Mixon, Cynthia; commend"
HR1545,76147,"Smith, Katy; commend"
HR1546,76148,"Specht, Geni; commend"
HR1547,76149,"Andraszek, Robert; commend"
HR1548,76150,"Moore, Ginger; commend"
HR1549,76151,"Maxwell, Judy; commend"
HR1550,76152,"Shinn, Anthony; commend"
HR1551,76153,"McElhenney, Christi; commend"
HR1552,76154,"Keebler, John; commend"
HR1553,76155,"Murray, Jamie; commend"
HR1554,76156,"Maddox, Bonnie; commend"
HR1555,76157,"Dugan, Mark; commend"
HR1556,76158,"Farley, Andrea; commend"
HR1557,76159,"Marks, Reverend Jack; commend"
HR1558,76160,"Coronel, Jenny; commend"
HR1559,76161,"Crudup, Alisa; commend"
HR1560,76162,"Crawford, Nichole; commend"
HR1561,76163,"Anderson, Dinah; commend"
HR1562,76164,"Brown, Ralph; commend"
HR1563,76165,"Solomon's Porch Ministries; commend"
HR1564,76206,"Pridemore, Jamie; commend"
HR1565,76166,"Valdosta State University; commend"
HR1566,76167,"Chancy, Patrick; commend"
HR1567,76168,"Anderson, Mr. Richard A.; commend"
HR1568,76169,"Conine, Mr. James L.; commend"
HR1569,76170,"Early County 2055; Birdsong Peanut Company; commend"
HR1570,76171,"8th Global Mural Arts &amp; Cultural Tourism Assoc. Conference; commend"
HR1571,76172,"Cheely, Honorable Selma Parris; condolences"
HR1572,76173,"Stowe, Officer Scott; commend"
HR1573,76174,"Caldwell, Mr. Daniel ""Dan"" David; condolences"
HR1574,76175,"Cleveland, Mr. Alton Jerry, Sr.; condolences"
HR1575,76176,"Waggoner, Honorable John; commend"
HR1576,76177,"Turner, Mr. Cecil; condolences"
HR1577,76178,"Gilbert, Ms. Andrea Allison; commend"
HR1578,76179,"Dewberry, Mr. John K.; commend"
HR1579,76180,"DeCotis, Dr. John; commend"
HR1580,76181,"Green, Conner; commend"
HR1581,76182,"Roberts, Ms. Becky; commend"
HR1582,76183,"Monticello First United Methodist Church; commend"
HR1583,76184,"Georgia Institute of Technology; commend"
HR1584,76185,"Wilson, Mr. Michael A ""Mickey""; condolences"
HR1585,76186,"Registered Dieticians Day at the state capitol; March 10, 2010; recognize"
HR1586,76187,"Catholic Day at the state capitol; March 10, 2010; recognize"
HR1587,76188,"Council on Aging; District 44 Senior Citizens Day; March 10, 2010; recognize"
HR1588,76189,"State of Georgia property; certain counties; nonexclusive easements; authorize"
HR1589,76349,"County functions; more than 80 percent of land in one or more municipal corporations; limit - CA"
HR1590,76350,"Colleges of agriculture; Department of Agriculture jurisdiction; transfer - CA"
HR1591,76351,"Young Marines of Metro Atlanta; commend and invite to House"
HR1592,76352,"Betty, Kathy; Atlanta Dream owner; commend and invite to House"
HR1593,76353,"McCoughtry, Ms. Angel; 2009 WNBA Rookie of the Year; commend and invite to House"
HR1594,76354,"Meadors, Coach Marynell; 2009 WNBA Coach of the Year; commend &amp; invite to House"
HR1595,76355,"Perkins, Mr. Calvin Douglas; condolences"
HR1596,76356,"Butler-McIntyre, Mrs. Cynthia M.A.; commend"
HR1597,76357,"Georgia State Patrol Post 19; commend"
HR1598,76358,"Wilson, Steve; Walker County Sheriff; commend"
HR1599,76359,"Hutcheson Medical Center Laboratory; Lab Week; April 18-24, 2010; recognize"
HR1600,76360,"Richwagen, Nick; commend"
HR1601,76361,"Mishou, Tom; condolences"
HR1602,76362,"Cub Scout Pack 3052; commend"
HR1603,76363,"Keenan, Vernon; Georgia Bureau of Investigation Director; commend"
HR1604,76364,"Day, Dean Burke; birth; honor"
HR1605,76365,"Broy, Mr. Andrew; commend"
HR1606,76366,"Johnson, Mr. James S. ""Jimmy""; condolences"
HR1607,76367,"Griffin Lodge #1207; Benevolent and Protective Order of Elks; recognize"
HR1608,76368,"Rice, Mr. George Erskine; condolences"
HR1609,76369,"Shearron, Dr. Gilbert F.; commend"
HR1610,76370,"Kicklighter, Kella L.; commend"
HR1611,76371,"Parish, Katherine; commend"
HR1612,76372,"Anderson, Paul W.; commend"
HR1613,76373,"Martin, Stephanie; commend"
HR1614,76374,"Carson, Jerri R.; commend"
HR1615,76375,"Williams, Marielle; commend"
HR1616,76376,"Mock, Andrew J.; commend"
HR1617,76377,"Heath, Joshua M.; commend"
HR1618,76378,"Ford, D'aia; commend"
HR1619,76379,"Chapman, David L.; commend"
HR1620,76380,"Hennen, Laurie Ann; commend"
HR1621,76381,"Lee, Chia-chi; commend"
HR1622,76382,"Sykes, Taylor Darice; commend"
HR1623,76383,"Shelnutt, Matthew Brian; commend"
HR1624,76384,"Andrews, Rayna J.; commend"
HR1625,76385,"Timmons Kristin S.; commend"
HR1626,76386,"Taylor, Kristin N.; commend"
HR1627,76387,"Yambert, Whitney de; commend"
HR1628,76388,"Johnson, Jennifer Nichole; commend"
HR1629,76389,"Beasley, Cassie; commend"
HR1630,76390,"Blackmon, Tonya J.; commend"
HR1631,76391,"Dorner, Stephen Christopher; commend"
HR1632,76392,"Hambrick, Roxanne; commend"
HR1633,76393,"Gann, Brittany Sumner; commend"
HR1634,76394,"Hartt, Ashley; commend"
HR1635,76395,"Watkins, Vincent Y.; commend"
HR1636,76396,"Springer, Leah O.; commend"
HR1637,76397,"Ayers, David C.; commend"
HR1638,76398,"Tooley, Kate; commend"
HR1639,76399,"Arnold, Elana Eurelle; commend"
HR1640,76400,"Staskevicius, Alina; commend"
HR1641,76401,"Blum, Connie D.; commend"
HR1642,76402,"Thompson, Lemaro R.; commend"
HR1643,76403,"Morgan, Mary; commend"
HR1644,76404,"Lee, Tien; commend"
HR1645,76405,"Walker, Charles O.; commend"
HR1646,76406,"President Obama and Congress; reject legalizing illegal aliens; urge"
HR1647,76642,"Dolph Fuller, Jr. Memorial Bridge; Gordon County; dedicate"
HR1648,76643,"Public safety and transportation commissioners; increase maximum speed limit on parts of Interstate 185; urge"
HR1649,76644,"Georgia Congressional Delegation; support legislation to prevent carbon emissions regulation; urge"
HR1650,76645,"Governor and Attorney General; sue Environmental Protection Agency to prevent carbon emissions regulation; urge"
HR1651,76646,"General Assembly; local education boards pay election expenses; require - CA"
HR1652,76647,"Excise tax; cigarettes; proceeds to health care; provide - CA"
HR1653,76648,"Williams, Mr. Jeremy; Williams Family; commend and invite to House"
HR1654,76649,"Smith, Chief Hubert L. ""Frog""; commend and invite to House"
HR1655,76650,"Peebles, Captain Tim; condolences; invite family to House"
HR1656,76651,"Campbell, Mr. Larry; commend and invite to House"
HR1657,76652,"Brooks, Mr. Joseph Daniel ""Jody""; recognize fundraiser; condolences"
HR1658,76653,"Bevino, Mr. Billy L.; condolences"
HR1659,76654,"QT Kitchens; Quik Trip Corporation; commend"
HR1660,76655,"Technology Student Association &amp; Robotics Teams of Sol C. Johnson H.S.; commend"
HR1661,76656,"Benitez, Camilo; commend"
HR1662,76657,"2012 U.S. Hispanic Chamber of Commerce Nat'l. Convention/Business Expo; commend"
HR1663,76658,"Vanapalli, Dr. Tulasi R.; commend"
HR1664,76659,"Shumaker, Deputy Yolanda; commend"
HR1665,76660,"Babb, Police Sergeant Robert Joel; retirement; recognize"
HR1666,76661,"2010 Georgia Cotton Queens; commend"
HR1667,76662,"McLeod, Laura Lyn; Miss University of Georgia 2010; commend"
HR1668,76663,"Davis, Mrs. Ruby Watson; 100th birthday; celebrate"
HR1669,76664,"YMCA of Georgia's Youth Assembly; commend"
HR1670,76665,"Hayes, Mr. Abbott Swift; condolences"
HR1671,76666,"Dill, Mr. William F. ""Bill""; condolences"
HR1672,76667,"Bennett, Mr. J. Woodfin ""J.W.""; condolences"
HR1673,76668,"Barnett, Sylvester &amp; Patricia; commend; 50th anniversary; recognize"
HR1674,76669,"Erwin, R.L. &amp; Helen; 70th wedding anniversary; recognize"
HR1675,76670,"Gay, Barbara &amp; Richard; commend"
HR1676,76671,"Bryant, Mr. Harold Eugene; condolences"
HR1677,76672,"Walls, William &amp; Vera; 75th wedding anniversary; commend"
HR1678,76673,"Denmark, Dr. Leila; 112th birthday; celebrate"
HR1679,76674,"Columbus Day at the state capitol; March 18, 2010; recognize"
HR1680,76675,"Hunt, Reverend Dr. Johnny M.; commend"
HR1681,76895,"Motor fuel tax; jet and aviation gasoline; maintain public-use airports; provide - CA"
HR1682,77007,"Joint session; message from Chief Justice of Supreme Court"
HR1683,77008,"Regional grand juries; create - CA"
HR1684,77009,"Coffee County Veterans Highway; Coffee County; dedicate"
HR1685,77010,"Mark Burkhalter Parkway; Fulton County; dedicate"
HR1686,77011,"LCPC Seth Sharp Memorial Intersection; Bartow County; dedicate"
HR1687,77012,"First SGT John David Blair Memorial Intersection; Gordon County; dedicate"
HR1688,77013,"Southern Polytechnic State Univ. baseball team; commend and invite to House"
HR1689,77014,"Gilmer H.S. wrestling team; Class AAA State Championship title; congratulate"
HR1690,77015,"Georgia Rides to the Capitol Day; March 23, 2010; declare"
HR1691,77016,"Laur, Ben; commend"
