bill_number,bill_id,title
HB1,65210,"Crimes and offenses; prenatal murder; define; provisions"
HB2,65211,"Grants; recipients comply with certain provisions; require"
HB3,65212,"Veterans Day; public schools closed November 11; provide"
HB4,65213,"Income tax credit; qualified ad valorem tax expenses; provisions"
HB5,65214,"Income tax credit; qualified ad valorem tax expenses; provisions"
HB6,65215,"Sales and use tax; certain energy or water efficient products; provide exemption"
HB7,65216,"DeKalb County; governing authority officers; revisions"
HB8,65217,"DeKalb County; school district ad valorem tax; provide homestead exemption"
HB9,65218,"Habitual violators and probationary licenses; notification status; change certain provisions"
HB10,65219,"Georgia Crime Information Center; provide access to criminal history; change provisions"
HB11,65220,"Accusations; trial in all cases except serious violent felonies; allow"
HB12,65221,"Insurance; marketing and sales; unscrupulous practices; broaden prohibition"
HB13,65222,"Pedestrians; provide definitions; clarify legal activities"
HB14,65223,"Elections; nonpartisan; certain officials; provide"
HB15,65224,"Georgia Administrative Procedures Act; change certain procedures; provide proposed rules"
HB16,65225,"Electronic tracking device; location of person without consent; prohibit"
HB17,65226,"Small Business and Jobs Protection Act of 2009; enact"
HB18,65227,"Small Business and Jobs Protection Act of 2010; enact"
HB19,65228,"Motor vehicles; wireless communication devices; provisions"
HB20,65229,"Human Resources, Department of; policies or rules; loans, grants and benefits; provisions"
HB21,65230,"Drivers' licenses; instruction permit and Class D; mobile phones; prohibit use"
HB22,65231,"Safety belts; pickup trucks; rear seats of vehicles; require"
HB23,65232,"Motor vehicles; cell phones; text messaging; prohibit use"
HB24,65233,"Evidence; revise, supersede, and modernize provisions; provide definitions"
HB25,65234,"Dealers' sales and use tax returns; estimated tax liability; change provisions"
HB26,65235,"Recorded deeds; disclose inclusion or exclusion of mineral rights; require"
HB27,65236,"Kidnapping; change certain provisions"
HB28,65237,"Kidnapping; change certain provisions"
HB29,65238,"Service and filing pleadings; electronic service; provide"
HB30,65239,"Georgia Townships Act; enact"
HB31,65240,"Motor vehicles; traffic-control signal monitoring devices; repeal provisions"
HB32,65241,"Death penalty; impose with unanimous verdict; provisions"
HB33,65242,"Religious Viewpoints Antidiscrimination Act; enact"
HB34,65243,"Campaign contributions; filing campaign disclosure reports; change provisions"
HB35,65244,"Bonds; interest and dividends received on bond funds; provisions"
HB36,65245,"Georgia Bureau of Investigation; state-wide ""Blue Alert"" system; create; provisions"
HB37,65246,"Parent Protection Act; enact"
HB38,65247,"Microchip Consent Act of 2009; enact"
HB39,65248,"Excise tax; cigarettes and loose or smokeless tobacco; increase amount"
HB40,65249,"Recording of foreclosures and deeds; timely filing of deed; provisions"
HB41,65250,"Retirement and pensions; invest funds in companies producing racist or obscene lyrics; provide divestiture"
HB42,65251,"Residential mortgage fraud; the offense; modify certain provisions"
HB43,65252,"Scrap metal processors; require photo identification of nonlicensed sellers; provisions"
HB44,65253,"Budget Act; application of zero-based budgeting; provisions"
HB45,65254,"Elections and primaries; voter registration; proof of United States citizenship; provisions"
HB46,65255,"Sales and use tax; certain sales of dyed fuel oils; provide exemption"
HB47,65256,"Reckless conduct; assaults with intent to transmit HIV or hepatitis; increase penalty"
HB48,65257,"Local government; franchise fees; change provisions"
HB49,65258,"Georgia Board for Physicians Workforce; revise certain provisions"
HB50,65259,"Death investigations by coroners; notification requirements; provide"
HB51,65260,"Georgia Bureau of Investigation; bingo games; Department of Revenue; provisions"
HB52,65261,"Georgia Public Service Commission; certain costs; provisions"
HB53,65262,"Law enforcement officers; stop motorists; race or ethnicity; prohibit"
HB54,65263,"Georgia Judicial Retirement System; survivors' benefits; provisions"
HB55,65264,"Computerized record-keeping systems; clerks of superior courts; redacting social security numbers; provide"
HB56,65265,"Sales and use tax; renegotiation of distribution certificates; change certain provisions"
HB57,65266,"Motor vehicles; Department of Revenue; administer the federal Unified Carrier Registration Act of 2005; designate"
HB58,65267,"Income tax credit; certain volunteer firefighters; provide"
HB59,65268,"Sales and use tax; controlled substances and dangerous drugs; certain exemptions; provide"
HB60,65269,"Licensing requirements and exceptions; professional counseling, social work, or marriage and family therapy; provisions"
HB61,65270,"Sales and use tax; second motor fuel tax; change certain provisions"
HB62,65271,"Cancelable educational loans; State Veterinary Education Board; provisions"
HB63,65272,"Local government; redevelopment and issuance of certain bonds and obligations; change certain provisions"
HB64,65273,"Death certificate filings; cause and circumstances of death; provisions"
HB65,65274,"Weight of vehicle and load; tow vehicle; maximum weight per axle; provide"
HB66,65275,"Municipal Option Sales Tax for Water and Sewer; enact"
HB67,65276,"Sales and use tax; food and beverages; suspend exemption"
HB68,65277,"Funeral establishments and crematories; disposition of cremains; provide"
HB69,65278,"Cardiopulmonary resuscitation; nonresuscitation; provide"
HB70,65279,"Early care and learning; fingerprint records checks; require"
HB71,65280,"False identification documents; manufacturing, selling, or distributing; provisions"
HB72,65281,"Local government; county surveyors; provisions"
HB73,65282,"Civil trials; appointment of special masters; provide"
HB74,65283,"Revenue and taxation; define terms; provide"
HB75,65284,"Ad valorem tax; bona fide conservation use property; revise certain provisions"
HB76,65285,"Pedestrians; provide definitions; clarify legal activities"
HB77,65286,"Piedmont Judicial Circuit; create new superior court judgeship"
HB78,65287,"Penal institutions; Department of Probation/Parole Community Based Supervision; create"
HB79,65288,"Historical Georgia license plates; increase time period; provide"
HB80,65289,"Insurance contracts; corporations; employees covered; change minimum number"
HB81,65290,"Human Resources, Department of; duty to furnish information; prohibit"
HB82,65291,"Public officers and employees; establish Office of State Inspector General; provisions"
HB83,65292,"Abandoned motor vehicles; define terms; provisions"
HB84,65293,"Corrections, Department of; punishment for serious violent offenders; provide"
HB85,65294,"Elections; nonpartisan; certain officials; provide by local law"
HB86,65295,"Elections; absentee ballots; returns be made by precinct; provide"
HB87,65296,"Law enforcement officers; arrest; revise certain provisions"
HB88,65297,"Elections; nonpartisan; certain officials; provide"
HB89,65298,"State employees' or board of regents' health insurance plan; Medicaid; require"
HB90,65299,"General Assembly; standing and special committees; witnesses under oath; provide"
HB91,65300,"Public authorities; conflicts of interest; prohibit"
HB92,65301,"Motor vehicles; driving under the influence of alcohol; provisions"
HB93,65302,"Georgia Medical Center Authority; real property; partial and joint ownership; provide authorization"
HB94,65303,"Public utilities and transportation; electric company; provide definition"
HB95,65304,"Ad valorem tax; notice of changes made; require"
HB96,65305,"Georgia Free Enterprise and Antitrust Act of 2009; enact"
HB97,65306,"Sales and use tax exemption; certain school supplies; provide"
HB98,65307,"Athens-Clarke County Unified Government; membership; provisions"
HB99,65308,"Republic of Sudan; public retirement systems; investing funds; prohibit"
HB100,65309,"Education; student scholarship organizations; provisions"
HB101,65310,"Advertising; transit agencies' vehicles and facilities; limit prohibitions"
HB102,65311,"Alcoholic beverages; issuance of licenses; revise certain provisions"
HB103,65312,"Confederate Heritage and History Month; observe in April; annually"
HB104,65313,"Alcoholic beverages; local authorization; Sunday sales; certain public stadiums; provide"
HB105,65314,"Emergency 9-1-1 systems; redefine certain terms"
HB106,65315,"Ad valorem tax; commercial highway vehicles not registered in Georgia; provisions"
HB107,65316,"State Board of Locksmiths; create; provisions"
HB108,65317,"Ralph Mark Gilbert Civil Rights Museum; official state civil rights museum; provide"
HB109,65318,"Cockfighting; punishments; provisions"
HB110,65319,"Law enforcement officers; stop motorists; race or ethnicity; prohibit"
HB111,65320,"Sentencing and imposition of punishment; procedure; repeal certain provisions"
HB112,65321,"Ad valorem tax exemption; property; provisions"
HB113,65322,"Housing Authorities Law; certain past offenses; not disqualify applicants; provide"
HB114,65323,"Newborn, Town of; provide new charter"
HB115,65324,"Distilled spirits; state license requirements; identifying information; provide"
HB116,65325,"Sales and use tax; repair of certain aircraft; sale of parts; provide exemption"
HB117,65326,"House and Senate; certain committees; amend Official Code of Georgia Annotated references"
HB118,65327,"Supplemental appropriations; State Fiscal Year July 1, 2008 - June 30, 2009"
HB119,65328,"General appropriations; State Fiscal Year July 1, 2009 - June 30, 2010"
HB120,65329,"Sales and use tax exemption; certain school supplies; energy efficient products; provide"
HB121,65330,"Revenue and taxation; prepaid state fuel tax; provide exemption"
HB122,65331,"Counties and municipalities; budget excess; searchable website; provisions"
HB123,65332,"Sexual offenses; child molestation; define; change certain provisions"
HB124,65333,"Georgia Public Safety Training Center; training of elected members; require"
HB125,65334,"Municipal corporations; ante litem notice; change provisions"
HB126,65335,"Uniform Electronic Transactions Act; enact"
HB127,65336,"Uniform Real Property Electronic Recording Act; adopt; provisions"
HB128,65337,"Disabled veterans and blind persons; eligibility certificate; provisions"
HB129,65338,"Sales and use tax exemptions; zoological institution; provide"
HB130,65339,"Elections; nonpartisan; certain officials; provide"
HB131,65340,"Elections; nonpartisan; tax receivers; provide"
HB132,65341,"Elections; nonpartisan; solicitors-general; provide"
HB133,65342,"Elections; nonpartisan; county commissioners; provide"
HB134,65343,"Elections; nonpartisan; sheriffs; provide"
HB135,65344,"Elections; nonpartisan; clerks of superior court; provide"
HB136,65345,"Elections; nonpartisan; district attorneys; provide"
HB137,65346,"Local option sales tax proceeds; distribution; change provisions"
HB138,65347,"Alcoholic beverages; local authorization; Sunday sales; provisions"
HB139,65348,"Voter registration; proof of citizenship; provisions"
HB140,65349,"Georgia Bureau of Investigation; state-wide ""Blue Alert"" system; create"
HB141,65350,"Financial institutions; update definitions; provisions"
HB142,65351,"The Billy Foulke Seatbelt Act; enact"
HB143,65352,"Local government; homeowner tax relief grants; change certain provisions"
HB144,65353,"Tires; use of retreaded tires; change provisions"
HB145,65354,"Child Support; revise a definition; correct cross-references; provisions"
HB146,65355,"Aggressive driving; define the offense; provide"
HB147,65356,"Bonds or recognizances; forfeiture; relieve surety from liability"
HB148,65357,"Georgia Trauma Care Network Commission; certain reports; certain funds; provisions"
HB149,65358,"Move on When Ready Act; enact"
HB150,65359,"General Appropriations Act; State Fiscal Year 2008 - 2009; change certain appropriations"
HB151,65360,"General Appropriations Act; State Fiscal Year 2008 - 2009; change certain appropriations"
HB152,65361,"State Fiscal Year; July 1, 2009 - June 30, 2010; make and provide appropriations"
HB153,65362,"State Fiscal Year; July 1, 2009 - June 30, 2010; make and provide appropriations"
HB154,65363,"Speed detection devices; clarify definition; provide"
HB155,65364,"License to carry pistol or revolver; permanent license; provide"
HB156,65365,"Magistrate judges; performing military duty; eligible for reelection; provisions"
HB157,65366,"Lottery shortfall reserve subaccounts; revise trigger reductions in HOPE; provisions"
HB158,65367,"Public water systems; water usage among tenants; revise provisions"
HB159,65368,"Peace Officers; employment and training; require verification; provide"
HB160,65369,"Driver Services, Department of; increase fees; speed restrictions; provisions"
HB161,65370,"High school athletics; interscholastic competition; provisions"
HB162,65371,"Georgia Military College; eligible for HOPE grants; provide"
HB163,65372,"Limitations on prosecutions; offenses of cruelty to children; provisions"
HB164,65373,"Bremen, City of; provide new charter"
HB165,65374,"Teachers Retirement System of Georgia; creditable service in private school; provide"
HB166,65375,"Bingo; define certain terms; veterans organizations; provisions"
HB167,65376,"Cherokee County State Court; additional judge; provide"
HB168,65377,"Telecommunications; modernize competition; provisions"
HB169,65378,"Natural Resources, Department of; proposed new or revised flood elevations; require notice"
HB170,65379,"State owned marshland or water bottoms; change annual rental fees; provisions"
HB171,65380,"Public records; exemptions to requirements for disclosure; provisions"
HB172,65381,"Employees' Retirement System of Georgia; disability benefits; provisions"
HB173,65382,"Illegal or void contracts; partial restraint of trade; repeal"
HB174,65383,"Abandoned motor vehicles; possessory liens; define certain terms"
HB175,65384,"Education; student scholarship organizations; repeal"
HB176,65385,"Roswell, City of; Redevelopment Powers Law; authorize"
HB177,65386,"Secondary metals recyclers; penalties for theft crimes; change provisions"
HB178,65387,"Glynn County; ad valorem tax; county purposes; homestead exemption; provisions"
HB179,65388,"Glynn County; ad valorem tax; school district; homestead exemption; provisions"
HB180,65389,"Public health and morals; tattooing near the eye; change certain provisions"
HB181,65390,"State revenue commissioner's authority; distributions; repeal certain provisions"
HB182,65391,"Firearms; discharge; counties or municipalities; provisions"
HB183,65392,"Georgia Trauma Hospital Support Act of 2009; enact"
HB184,65393,"Marriage license; sickle cell disease information; provide"
HB185,65394,"Chief Judge of the Court of Appeals; emergency powers; provisions"
HB186,65395,"Teleworking; income tax credits; provisions"
HB187,65396,"Georgia Transportation Consolidation Act of 2009; enact"
HB188,65397,"Revenue and taxation; prepaid cigarette tax; provisions"
HB189,65398,"Child support; collection options; Department of Human Resources; provisions"
HB190,65399,"Employees' Retirement System of Georgia; death benefit; clarify provisions"
HB191,65400,"Georgia State Employees' Pension and Savings Plan; retirement computations; provisions"
HB192,65401,"Revenue and taxation; ad valorem tax; Georgia Trauma Trust Fund; provide"
HB193,65402,"Elementary and secondary education; 180 day school year; provisions"
HB194,65403,"Brand name drugs; substitute generic drugs; provisions"
HB195,65404,"Trial juries; qualification of electric membership corporation; provisions"
HB196,65405,"Georgia Service-Disabled Veteran Business Enterprise Opportunity Act; enact"
HB197,65406,"Consumer reporting agencies; identical report to consumer and creditor; require"
HB198,65407,"Elementary and secondary education; kindergarten program; 810 hours per school year; provisions"
HB199,65408,"Warrants for arrest; persons who may issue warrants; provisions"
HB200,65409,"Safety belts; failure to use; evidence of negligence; provide"
HB201,65410,"Safety belts; new school buses equipped; provide"
HB202,65411,"Retirement and pensions; computing contributions and benefits; define certain terms"
HB203,65412,"Local government; development authorities; clarify certain terms"
HB204,65413,"Sales and use tax; motor fuel sales; change certain provisions"
HB205,65414,"State purchasing; goods and services from correctional industries; revise certain provisions"
HB206,65415,"Georgia Agency Accountability Act; enact"
HB207,65416,"Off-road vehicles; operating restrictions; change certain provisions"
HB208,65417,"Educational programs; bilingual certification on high school diplomas; provide"
HB209,65418,"Vote; proof of identity; valid student identification; provide"
HB210,65419,"Georgia Judicial Retirement System; employer contributions; clarify"
HB211,65420,"Retirement and pensions; action brought against boards of trustees; Superior Court of Fulton County; provide"
HB212,65421,"Sales and use tax; jet fuel; continue exemption"
HB213,65422,"Criminal street gang activity; school safety zones; increase penalty"
HB214,65423,"Habeas corpus procedure; filing a writ; change certain provisions"
HB215,65424,"Graduating Everyone Matters Act; enact"
HB216,65425,"Cordele Judicial Circuit; superior court; change certain terms"
HB217,65426,"Physicians; influenza vaccine orders; provisions"
HB218,65427,"Fence, Automated Gate Contractors; create licensing board"
HB219,65428,"Antifreeze; include aversive agent to render it unpalatable; provisions"
HB220,65429,"Superior courts; issuing orders on motions; provisions"
HB221,65430,"Extraordinary writs; removal of superior court judge; provisions"
HB222,65431,"Homestead exemption; disabled veterans; surviving spouses or minors; provide"
HB223,65432,"Local government; public works bidding; health insurance; require"
HB224,65433,"Peace Officers' Annuity and Benefit Fund; county jail officers; provisions"
HB225,65434,"Elections; handled by state registered voters; require"
HB226,65435,"Probation detention centers; sentencing and confinement; change provisions"
HB227,65436,"Elections; address confidentiality; provisions"
HB228,65437,"State health and human services agencies; reorganize and reestablish; provisions"
HB229,65438,"Student Health and Physical Education Act; enact"
HB230,65439,"Nuisances; pentachlorophenal emission; provisions"
HB231,65440,"Practice of architecture; projects within structures; clarify"
HB232,65441,"Agriculture Commissioner; trademark; create"
HB233,65442,"Ad valorem tax; property; change certain definitions"
HB234,65443,"Educational loans; service cancelable; State Veterinary Education Board; change certain provisions"
HB235,65444,"Court reports; publishing a volume of rules from the definition of reports; remove requirement"
HB236,65445,"Georgia Government Accountability Act; enact"
HB237,65446,"Human Resources, Department of; financial assistance for adoptive parents; revise provision"
HB238,65447,"Water pollution control; sludge and water-waste systems; regulate"
HB239,65448,"Water pollution control; regulate surface water returns; county boards of health; change certain provisions"
HB240,65449,"Ad valorem tax; certain historical information; change certain provisions"
HB241,65450,"Ad valorem tax; property; change certain provisions"
HB242,65451,"Georgia Environmental Facilities Authority; change name to Georgia Environmental Finance Authority"
HB243,65452,"Elementary and secondary education; salary increase; repeal"
HB244,65453,"Georgia Environmental Facilities Authority; change name to Georgia Environmental Finance Authority"
HB245,65454,"Delinquent and unruly children; disposition; change provisions"
HB246,65455,"Juvenile proceedings; arrest and detention of accused children; risk assessment instrument; provisions"
HB247,65456,"Ad valorem tax; homestead exemption; disabled veterans; provisions"
HB248,65457,"Georgia Voluntary Remediation Program Act; enact"
HB249,65458,"Public Retirement Systems Investment Authority Law; define certain terms; provisions"
HB250,65459,"Proposing amendments to state Constitution; hold a Convention; provisions"
HB251,65460,"Quality Basic Education Act; public school student; attend any local school; provide"
HB252,65461,"Georgia Closing the Achievement Gap Commission; create"
HB253,65462,"Mechanics and materialmen; contractor sign affidavit; verify pay; provide"
HB254,65463,"Human Resources, Department of; juvenile proceedings; locate adult relatives; provisions"
HB255,65464,"Income tax credits; personal mass transportation expenses; provisions"
HB256,65465,"Safety belts; failure to use; recover costs incurred; provide"
HB257,65466,"Cremation; preneed authorization; provide"
HB258,65467,"Driver's license; minor of disabled guardian; restricted learner's permit; provisions"
HB259,65468,"Firearms; training of licensed persons; provide"
HB260,65469,"Licenses; pistol or revolver; include photograph and current address; provide"
HB261,65470,"Income tax credit; purchase of one eligible single-family residence; provide"
HB262,65471,"Property; land covenants which prohibit certain xeriscape practices; prohibit"
HB263,65472,"In-home services; employees; criminal background investigation; provide"
HB264,65473,"Conveyances; regulation of security conveyances; revise; provisions"
HB265,65474,"Rhine, Town of; provide new charter; change name to City of Rhine; provide"
HB266,65475,"Technical College System of Georgia; retirement and pensions; provisions"
HB267,65476,"Fair Business Practices Act of 1975; confidentiality of certain information; clarify certain provisions"
HB268,65477,"Elections; superintendent establish polling places outside of boundaries; authorize"
HB269,65478,"Income tax credit; caregiver expenses; revise and change"
HB270,65479,"Income tax exemptions; custodial and noncustodial parents; revise and change certain provisions"
HB271,65480,"Sales and use tax; natural or artificial gas sales; provide phased-in exemption"
HB272,65481,"Sales and use tax; joint county and municipal; change certain provisions"
HB273,65482,"Georgia Prescription Monitoring Program Act; enact"
HB274,65483,"Secondary metals recyclers; records of transactions; change certain provisions"
HB275,65484,"Telephone service; unsolicited commercial facsimile messages; change certain provisions"
HB276,65485,"Coal mining; extracted by mountain top removal; prohibit purchase; provisions"
HB277,65486,"The Georgia 2020 Transportation Act; enact"
HB278,65487,"Quality Basic Education Act; direct instructional costs; temporarily waive certain expenditure controls"
HB279,65488,"Quality Basic Education Act; guaranteed valuation school system; revise definition"
HB280,65489,"Quality Basic Education Act; mathematics or science teachers; additional compensation; provide"
HB281,65490,"Georgia Virtual School Opportunity and Enrichment Act; enact"
HB282,65491,"Georgia Master Teacher Program; provide bonus; Distinguished Teacher Leader Certification; establish"
HB283,65492,"Supreme Court and Court of Appeals; filing fees; change certain provisions"
HB284,65493,"Misdemeanor offenders; reimbursement rates; change certain provisions"
HB285,65494,"Misdemeanor offenders; reimbursement rates; change certain provisions"
HB286,65495,"Licenses; handgun safety course; provide"
HB287,65496,"Speed detection devices; school zones; certain restrictions not apply"
HB288,65497,"Self-employment Assistance Program; enact"
HB289,65498,"Courts; Georgia Courts Automation Commission; repeal"
HB290,65499,"Minimum wage; increase; provide comprehensive reform"
HB291,65500,"Georgia's Antidiscrimination Act of 2009; establish"
HB292,65501,"Gambling; nonprofit organizations; noncash prizes; provisions"
HB293,65502,"Gambling; coin operated amusement machines; revise definitions"
HB294,65503,"Technical college or institution; legislative approval for creation or discontinuation; require"
HB295,65504,"The Jail and Prison Reimbursement Act; establish"
HB296,65505,"Highway work zones; speeding; change certain provisions"
HB297,65506,"Garden City, City of; create new charter"
HB298,65507,"Income tax; change certain definitions"
HB299,65508,"Sales and use tax; change certain definitions"
HB300,65509,"Student health; school provide certain information to guardians; require"
HB301,65510,"State Board of Technical and Adult Education; change name to State Board of the Technical College System of Georgia"
HB302,65511,"Telecommunications; charge for third party service; change requirements"
HB303,65512,"Child abuse reports; access to records; solicitors-general; authorize"
HB304,65513,"County taxation; appraisers duties upon property; change certain provisions"
HB305,65514,"Insurance; group life policy coverage; remove participation requirement"
HB306,65515,"Bonds and recognizances; electronic pretrial release and monitoring; provisions"
HB307,65516,"Medicaid; federal financial participation; hospitals; impose fee"
HB308,65517,"Georgia Limited Liability Company Act; certain technical corrections; clarify provisions"
HB309,65518,"Sales and use tax; water pollution eliminating machinery exemptions; change certain provisions"
HB310,65519,"State-wide recycling program; expand; provisions"
HB311,65520,"Georgia Higher Education Assistance Corporation; guaranteed educational loans; provide"
HB312,65521,"Financial institutions; S.A.F.E. Mortgage Licensing Act of 2008; incorporate provisions"
HB313,65522,"Quality Basic Education Act; calculating grade point averages; revise certain provisions"
HB314,65523,"Palmetto, City of; ad valorem taxes; certain residents; provide homestead exemption"
HB315,65524,"Real estate brokers; certain disclosures made in writing; require"
