bill_number,bill_id,title
HB2248,265624,"Requiring school districts to finance cost of remedial college courses."
HB2249,265678,"Senate Substitute for Senate Substitute for HB 2249 by Committee on Ways and Means -- Confidentiality of health information."
HB2250,265658,"Amending the drug code to include penalties based on amount."
HB2251,265772,"Senate Substitute for HB 2251 by Committee on Education -- Continuation of statewide tax levy for public schools."
HB2252,265655,"Restoration of spouse's former name after divorce; if divorced in another state, court shall restore name if copy of authenticated divorce decree."
HB2253,265731,"Private rights of action; restrictions."
HB2254,265627,"Covenant marriages; procedures for divorce and separate maintenance."
HB2255,265774,"Council on obesity prevention and management."
HB2256,265611,"Contracts with small minority businesses."
HB2257,265621,"Determination of supplemental general state aid; creating school district enhancement fund; exemptions for statewide levy; income tax checkoff and withholding for school district contributions."
HB2258,265815,"Conveyance of land in Ellsworth County from SRS to the Lutheran Evangelical Good Samaritan Society."
HB2259,265604,"Criminal procedure and appearance bonds."
HB2260,265733,"Kansas preservation of religious freedom act."
HB2261,265727,"Enacting the revised uniform limited liability company act."
HB2262,265788,"Hiram Price Dillon House, conveyance to not-for-profit corporation for promotion of the arts."
HB2263,265757,"Increased employee contributions for KP&F members and removal of maximum retirement benefit provision."
HB2264,267447,"Property tax exemption for mineral interest in real estate."
HB2265,267491,"Redemption procedures and increased interest rates and penalties for delinquent property taxes on certain land and reduced redemption period for delinquent property taxes on vacant land in certain counties."
HB2266,267444,"Community improvement districts; notice of sales tax rate."
HB2267,267624,"Senate Subsitute for HB 2267 by Committee on Local Government -- Uniform common interest owners bill of rights act; changes."
HB2268,267296,"Collection of fees, charges, taxes and exactions by state agencies."
HB2269,267646,"School districts; finance; amendments to funding formula."
HB2270,267643,"Funding costs of nonproficient pupils not covered by general state aid from local funds."
HB2271,267549,"Amending the inspection and regulation of live plant dealers and plant pests by the department of agriculture."
HB2272,267268,"Exempting certain minor construction projects from state and federal water regulations."
HB2273,267614,"Designating a portion of K-99 as the Frankfurt Boys World War II highway."
HB2274,267637,"Designating a portion of I-70 the Eisenhower/Truman Presidential Highway."
HB2275,267529,"Health insurance; provider payments; no variation based upon the identity of the health insurer."
HB2276,267304,"Health insurance; mandate lite health benefit plans, commissions, specially designed policies."
HB2277,267557,"Third and subsequent DUI offenders following county jail sentence shall serve under local supervision for one year; supervised by community corrections or court services."
HB2278,267500,"Kansas hometown heroes fund checkoff."
HB2279,267463,"Coronal scaling by dental assistants"
HB2280,267514,"Kansas dental board; licensure of dental practitioners."
HB2281,267399,"Appropriations for autism waiver for fiscal year 2012."
HB2282,268288,"Lodging inspections and food safety fees."
HB2283,267335,"Lobbying; use of public funds."
HB2284,267621,"Public funds for lobbying for a tax increase."
HB2285,267445,"Denying highway funds to cities and counties who enact stiffer penalties for seat belt violations."
HB2286,267660,"School districts; finance; supplemental general state aid for certain districts."
HB2287,267383,"Sales tax holiday which provides sales tax exemption for certain purchases of school supplies, computers and clothing."
HB2288,267497,"Assessed valuation of certain school districts."
HB2289,267390,"Appropriations for waivers for fiscal year 2012."
HB2290,267449,"Distribution of mineral severance tax revenue to school districts."
HB2291,267332,"Requiring automobile liability insurance policies to provide uninsured and underinsured motorist coverage for any person occupying the insured motor vehicle."
HB2292,267406,"Accident and health insurance; excluding coverage for certain abortions."
HB2293,267325,"Prohibiting state employees from receiving benefits and reimbursements for abortion procedures under a state health savings account plan."
HB2294,267275,"Annexation procedures; deannexation; board of county commissioners duties; election required, when; homestead exemption; appeal process."
HB2295,268216,"Substitute HB 2295 by Committee on Agriculture and Natural Resources -- Amending hunting provisions concerning crossbows and deer hunting seasons."
HB2296,268515,"Substitute for HB 2296 by Social Services Budget Committee -- Establishing the joint committee on oversight of the closure of the Kansas neurological institute."
HB2297,268302,"Requiring courts to wait until a deployed soldier returns home before proceeding with foreclosure."
HB2298,268351,"Granting authority to the executive director of the Kansas commission on veterans affairs to transfer funds between state general fund appropriated accounts."
HB2299,268283,"Prohibiting cities and counties from issuing licenses and permits for merchant or security police."
HB2300,268314,"Legislature; job protection for persons elected or appointed to the state legislature."
HB2301,268086,"Closure of the school for the deaf and the school for the blind."
HB2302,268258,"Charter schools; appeal of charter school denials to the state board of education; finance."
HB2303,268110,"Utilities; rate-making and variable time-of-day pricing."
HB2304,268545,"Rules and regulations; nullification."
HB2305,268483,"Board of Indigents' Defense Terms and Qualifications."
HB2306,268184,"Relating to the requirements for purchase of motor vehicles by state agencies."
HB2307,268071,"The Kansas residential roofing act."
HB2308,268179,"Filing of reports by campaign treasurer."
HB2309,268553,"Allowing the transfer of campaign funds to a bona fide successor committee or candidacy."
HB2310,268325,"Working after retirement requirements for KPERS retirants."
HB2311,268028,"Enacting the Kansas public employees retirement system defined contribution act."
HB2312,268303,"Regulated scrap metal; licensing scrap metal dealers; unlawful acts; criminal penalties."
HB2313,268289,"Senate Substitute for HB 2313 by Committee on Judiciary -- Creating an out of state juvenile offender registration requirement."
HB2314,268396,"Finney county drainage district No. 2; election of directors."
HB2315,268229,"Relating to the licensure of home health agencies, home nursing agencies and home services agencies."
HB2316,268284,"Creating the bioscience investment fund."
HB2317,268111,"Authorizing expensing of investment expenditures as a deduction in calculating Kansas income tax liability and IMPACT program changes."
HB2318,268171,"Senate Substitute for Substitute HB 2318 by Committee on Judiciary --Further amendments to the recodified Kansas criminal code; creating the crime of endangerment; drug crimes; sentencing guidelines grid for drug crimes; drug treatment programs; disposition and supervision of offenders."
HB2319,267962,"Authorizing house arrest for certain misdemeanors and nongrid felonies and updating definitions."
HB2320,268233,"Oil unit ownership and operation."
HB2321,268304,"Amendments to the recodified criminal code."
HB2322,268422,"Amendments to the Kansas offender registration act."
HB2323,268260,"Abolishing the death penalty; creating the crime of aggravated murder."
HB2324,267983,"Making it unlawful to furnish electronic cigarettes to people under 18 years of age."
HB2325,268370,"Eliminating postrelease supervision periods equal to good time credit earned."
HB2326,268268,"Authorizing the use of a standardized offender assessment test to determine the placement of offenders."
HB2327,268170,"Allowing veterans with PTSD to seek mental health treatment upon certain convictions."
HB2328,268437,"Employer contributions for KPERS school participating employers."
HB2329,268484,"Senate Substitute for HB 2329 by Committee on Reapportionment -- Redistricting; Congressional districts."
HB2330,268369,"Enacting the cannabis compassion and care act."
HB2331,268516,"Creating rural opportunity zones."
HB2332,268147,"Sexual exploitation of a child: increasing the penalty for certain offenses."
HB2333,268520,"Senate Substitute for Substitute for HB 2333 by KPERS Select Committee --Enacting KPERS act of 2015 and other modifications to KPERS."
HB2334,267972,"Creating new procedures to determine a defendant's competency to stand trial."
HB2335,270914,"Kansas act against discrimination; disability amendments."
HB2336,270805,"Kansas employment first initiative act; persons with disabilities."
HB2337,270813,"Licensing of abortion clinics by department of health and environment."
HB2338,272677,"Data Centers; sales tax exemptions."
HB2339,272647,"Criminal code trailer bill."
HB2340,272803,"Substitute for HB 2340 by Committee on Health and Human Services -- Removal of the casino exemption from the smoking ban; addition of annual smoking event exemption."
HB2341,276089,"Requiring certain beverage containers to be redeemable."
HB2342,275123,"Property taxation; appraisal; mill levy adjustments."
HB2343,274980,"Relating to custody for adoption."
HB2344,276176,"Relating to permanency planning."
HB2345,275312,"Notification of parties of a temporary hearing."
HB2346,275576,"Creating the classification of ""aggravated sex offender;"" creating additional penalties and restrictions for sex offenders."
HB2347,277368,"Earned income tax credit amount decreased and made nonrefundable."
HB2348,278504,"Requiring social security numbers on Kansas income tax returns."
HB2349,277786,"Requiring social security numbers in support of dependent care expenses."
HB2350,277384,"Imposing a payment in lieu of tax on certain pipeline property exempt from property taxation."
HB2351,278572,"Requiring dynamic scoring analysis in preparation of fiscal notes for legislative bills."
HB2352,277340,"Notice and opportunity to be heard for counties in public utility exemption application process."
HB2353,277448,"Personal and family protection act; amendments."
HB2354,278346,"State owned and operated casinos; north central Kansas gaming zone, Geary County."
HB2355,277217,"Requiring social security numbers in support of claims for food sales tax refunds."
HB2356,281659,"Increasing earnings limitation for employment after retirement by a KPERS retirant with certain KPERS participating employers."
HB2357,281539,"Senate Substitute for HB 2357 by Committee on Ways and Means -- Bioscience authority; replacing the member appointed by KTEC with the secretary of commerce."
HB2358,282150,"Decreasing sales tax rate and earned income tax credit and food sales tax refund amounts."
HB2359,281492,"Adding the department of corrections to statutes regarding payment of health care expenses for people in custody."
HB2360,282143,"School districts; uniform chart of accounts."
HB2361,286009,"Sales tax exemption for sales of and purchases by Civil Air Patrol."
HB2362,285965,"Appropriations for waivers for fiscal year 2012, 2013 and 2014."
HB2363,288863,"Gubernatorial inauguration donations; disposition of residual monies."
HB2364,288901,"Relating to voter identification."
HB2365,290087,"Imposing a tax on wire transmission of moneys outside the state."
HB2366,293322,"Sales tax authority for Douglas County."
HB2367,293907,"Schools; authorizing a tax credit to be used for educational scholarships."
HB2368,294158,"Concerning appropriations; deleting the 20% credit to the state general fund."
HB2369,293892,"Implementation of state fire marshal orders by a board of education."
HB2370,294261,"Abolishing the office of the state fire marshal and transferring the duties and functions thereof to the division of facilities management, the Kansas bureau of investigation and the division of emergency management."
HB2371,293856,"Senate Substitute for HB 2371 by Committee on Reapportionment -- State redistricting."
HB2372,294896,"Requiring verification of employment eligibility and making other amendments concerning immigration."
HB2373,295993,"Combining life insurance with certain other riders such as for specific illness or disease coverage."
HB2374,295343,"Appropriations for FY 2011, FY 2012 and FY 2013 for various state agencies."
HB2375,297609,"Creating acts providing for school accountability and parental choice."
HB2376,297714,"Amending provisions of the Kansas uniform securities act relating to adoption of federal statutes and rules by reference; registration requirements; fees; securities act fee fund and investor education fund."
HB2377,297683,"Creating the no taxpayer funding for abortion act; amending laws relating to late-term abortion."
HB2378,298146,"Authorizing sales tax authority for counties to establish community children's service fund to provide services for children and youth."
HB2379,298246,"Reallocation of assessments after exemption of property and issuance of bonds in community improvement districts."
HB2380,298202,"Veterans benefit lottery game, disposition of net profits, national guard benefit lottery game fund and veterans benefit lottery game fund established."
HB2381,298088,"Reduction to state income tax rates based on selected actual state general fund receipts computations, and sales tax rates and distribution."
HB2382,298689,"Senate Substitute for HB2382 by Committee on Ways and Means - concerning economic development"
HB2383,298799,"Senate Substitute for HB 2383 by Committee on Ways and Means -- Appropriations for FY 2011 through FY 2016 for various state agencies, omnibus appropriation act and omnibus reconciliation spending limit bill."
HB2384,298692,"Kansas preservation of religious freedom act."
HB2385,298766,"Creating the relevant efficient academic learning education act."
HB2386,298788,"Veterinary school students; spaying or neutering dogs and cats; animal shelters."
HB2387,298697,"Alcoholic beverages; amendments regarding retailer's licenses; fees, term and eligibility."
HB2388,298649,"Authorizing the Kansas development finance authority to issue mortgage revenue bonds."
HB2389,302352,"Child abuse investigations; procedures."
HB2390,301033,"Senate Substitute for HB 2390 by committee on Utilities -- Amending the Kan-Ed act."
HB2391,301388,"Marking certain anemometer towers used for wind energy testing."
HB2392,315608,"Establishes a process for federal debt setoff of delinquent state debt."
HB2393,316241,"State employees; abolishing longevity bonus."
HB2394,311489,"Courts; court of appeals."
HB2395,309048,"School districts; the expenditure of moneys in school district funds for general education purposes."
HB2396,306769,"Senate Substitute for HB 2396 by Committee on Reapportionment -- State legislative redistricting; Senate and state board of education member districts."
HB2397,314041,"Adequacy of state provision for finance of educational interests of the state."
HB2398,300624,"Amending the definition of feral swine and increasing the penalty for importing, transporting, possessing or releasing feral swine."
HB2399,308315,"Relating to the amount of money the state public trust may pay for real property within the Treece community in Cherokee county."
HB2400,301156,"School districts; amendment to definition of at-risk pupil."
HB2401,308782,"Consensus revenue estimate to include full amount of nonrefundable income tax credits when earned."
HB2402,319904,"For fiscal years 2012, 2013, 2014 and 2015, five centers of excellence and three centers of innovation receive $2,000,000 from the increase in the tax base from bioscience development and investment."
HB2403,307707,"Property tax exemption and classification for property used for bed and breakfast home purposes."
HB2404,319722,"Elimination of property tax exemption for certain pipeline property."
HB2405,320401,"Converting classified attorneys in KDHE and SRS into unclassified attorneys."
HB2406,314087,"Prohibiting the injury, intimidation, interference or harassment of any member of the military or an immediate family member of such member of the military; civil cause of action."
HB2407,312340,"Distribution of sales tax revenues; income tax rate."
HB2408,326586,"Transferring the agrotourism program from the department of commerce to the department of agriculture."
HB2409,334738,"Bonds relating to national bio and agro defense facility"
HB2410,334722,"Racing and Gaming Commission; meeting and compensation of members."
HB2411,334658,"Investment standards and divestment procedures for KPERS related to Iran."
HB2412,375245,"Cities; dissolution, certain cities."
HB2413,375250,"Disclosure of tax information for defendants claiming indigency."
HB2414,375255,"Allowing legislative post audit to charge state agencies for their portion of the state wide financial audit."
HB2415,375262,"Income taxation; relating to certain sales of land devoted to agricultural use."
HB2416,375267,"Health care finance; updating references and corresponding changes due to transfer of powers and duties from the Kansas health policy authority and hospital provider assessment."
HB2417,375276,"Renewal date for driver's license expiring on license holder's 21st birthday; restricted license reciprocity with other states and District of Columbia."
HB2418,375281,"Veterans preference; notifying veterans not hired by standard or electronic mail."
HB2419,375288,"Determining defendant's indigency for purposes of appointing counsel."
HB2420,375295,"Cities; bonded debt limits."
HB2421,375299,"Kansas firearms freedom act; violations, criminal penalty"
HB2422,375309,"Personal and family protection act; licensure requirements for parole officers and state and federal corrections officers."
HB2423,375318,"Municipalities; political campaign yard signs regulation limited."
HB2424,375323,"Relating to HCBS providers; providers that develop plans of care cannot be providers on such plans of care."
HB2425,375330,"Campaign finance; local office contribution limit increased; schools; question submitted elections; ballot question explanations, municipalities."
HB2426,375334,"Utilities; relating to the renewable energy standards act."
HB2427,375344,"Substitute HB 2427 by Committee on Corrections and Juvenile Justice -- Amending the open records act to exclude personal information concerning law enforcement officers."
HB2428,375349,"Health care providers; including the university of Kansas medical center for purposes of peer review."
HB2429,375357,"Removal of expiration date for the state educational institution project delivery construction procurement act."
HB2430,375363,"Contingency reserve fund; extending the time period authorized for districts."
HB2431,375370,"Substitute HB 2431 by Committee on Transportation -- Allowing royalty fees for distinctive license plates to be paid to the county treasurer."
HB2432,375377,"Allowing royalty fees for distinctive license plates to be paid to the county treasurer."
HB2433,375385,"Income tax credit for certain tuition and related expenses paid to an educational institution located in Kansas."
HB2434,375393,"Supplemental appropriations for FY 2012 for the department of education."
HB2435,375399,"Postsecondary institutions; career technical workforce grant; state university employees and contract negotiations; Kansas private and out-of-state postsecondary institutions and state board of regents fee authority."
HB2436,375405,"Concerning public utilities and issuance of a certificate of public convenience."
HB2437,375411,"Relating to voting; proof of United States citizenship."
HB2438,375420,"County Treasurers; starting date, term of office."
HB2439,375426,"School districts; counting of certain military pupils."
HB2440,375433,"Creating the crime of failure to report the disappearance of a child."
HB2441,375439,"Floyd H. Robinson memorial highway."
HB2442,375446,"Relating to employment of disabled individuals and competitive bids for state contracts."
HB2443,375453,"Kansas income tax credit; film production."
HB2444,375460,"Grades K-12; use of seclusion and restraint of students with disabilities; reporting thereof."
HB2445,375467,"Cost recovery for energy storage devices."
HB2446,375475,"Renewable energy standards act and energy storage."
HB2447,375483,"Concerning income tax credits and plugging of abandoned wells."
HB2448,375489,"Firefighters health insurance."
HB2449,375495,"Establishing the Kansas equine education and promotion board."
HB2450,375501,"Enacting the Kansas small, minority and woman-owned business development act."
HB2451,375508,"Eliminating ""use it or lose it"" for groundwater rights in areas closed to new water right development."
HB2452,375515,"Granting the governor seven big game special hunting permits per year."
HB2453,375522,"Commission on disability concerns; changes."
HB2454,375532,"Senate Substitute for HB 2454 by Committee on Ways and Means -- Creating the creative arts industries commission; abolishing the arts commission and the film commission; creating the arts commission checkoff."
HB2455,375538,"Substitute HB 2455 by Committee on Energy and Utilities -- Motor fuel tax; long-term feasibility study."
HB2456,375544,"Prohibiting default proxy appointment to board."
HB2457,375552,"MR/DD waiver programs; exemption from the managed care system."
HB2458,375560,"Providing an exception for certain vehicles from gross weight limitations."
HB2459,375565,"Motorcycle licensure reciprocity for persons with Department of Defense motorcycle training."
HB2460,375574,"KPERS; removing first year contribution rate for affiliated employers; allowing affiliation for either prior and future service or future service only; applying certain Internal Revenue Code provisions to KPERS."
HB2461,375578,"Raising the amount of annual alternative investments within the total amount of assets of the KPERS fund."
HB2462,375585,"Allowing vehicles to proceed through red lights under certain conditions."
HB2463,375591,"Requiring employment of Kansas workers for certain state contracts and tax benefits."
HB2464,375600,"Amending criminal discovery statute to prohibit release of child pornography evidence to the defense."
HB2465,375609,"Authorizing sentencing court to order lifetime electronic monitoring for certain sex offenders."
HB2466,375614,"Providing state employees who retired on and after January 10, 2011 and before August 2, 2011 an election to either receive continued health insurance benefits or receive a one-time lump sum payment."
HB2467,375621,"Creating the crimes of unlawful dissemination and possession of a depiction of a minor."
HB2468,375625,"Requiring defense attorneys to produce reports and allow inspection prior to criminal trial."
HB2469,375637,"Requiring payment of BIDS fees for parole revocation proceedings."
HB2470,375645,"Substitute HB 2470 by Committee on Judiciary -- Relating to scrap metal dealers; unlawful acts; fees."
HB2471,375652,"Adult care homes; relating to licensure; administrators."
HB2472,375658,"Rural water districts; definitions."
HB2473,375663,"Civil procedure; pleadings and discovery."
HB2474,375671,"Alcoholic liquor; class A private clubs; veterans' organizations."
HB2475,375679,"Increasing funding for the home and community based services MR/DD waiver program."
HB2476,375685,"Prohibiting the carrying of concealed handguns on school grounds."
HB2477,375691,"Substitute HB 2477 by Committee on Education - Compulsory school attendance law; defining educational alternatives."
HB2478,375698,"City unilateral annexation; county approval."
HB2479,375705,"Fire district tax levies."
HB2480,375715,"Determination of Kansas adjusted gross income for income tax purposes related to thrift savings plan distributions and railroad retirement annuities."
HB2481,375719,"Taxation of helium and other gases under mineral severance tax and prohibition of certain refunds related thereto."
HB2482,375728,"Relating to the Kansas adoption and relinquishment act; parental rights."
HB2483,375732,"Planning and zoning; appeals to district court; jurisdiction retained on remand."
HB2484,375739,"Certified shorthand reporters; deposition in Kansas."
HB2485,375746,"Insurance ; anti-fraud plans; Insurance Commissioner access to expunged records; fingerprinting and criminal record checks for certain insurance agents and public adjusters."
HB2486,375756,"Changing the frequency of examinations for health maintenance organizations and medicare provider organizations."
HB2487,375762,"Uniform Insurance Agents Licensing Act; violations."
HB2488,375766,"Allowing insurance premium increases as restitution to crime victims."
HB2489,375772,"Deregulation of natural gas public utilities cooperatives."
HB2490,375781,"Doctor of nursing practice degrees at Washburn university."
HB2491,375788,"Lawfully possessed handguns permitted while hunting, fishing and furharvesting."
HB2492,375796,"E-verify program; use of by business and governmental entities."
HB2493,375800,"Supplemental appropriations for FY 2012 and FY 2013 for various state agencies."
HB2494,375807,"Amending provisions of the Kansas self-service storage act."
HB2495,375815,"Increasing the maximum allowable vessel registration fee charged by the department of wildlife, parks and tourism."
HB2496,375820,"Applying the Kansas law enforcement training act to investigators of the juvenile justice authority and department of corrections."
HB2497,375839,"Amending procedures concerning a defendant's competency to stand trial."
HB2498,375843,"Creating a mental health diversion option for county and district attorneys."
HB2499,375848,"Providing for the masonic lodge license plate."
