bill_number,bill_id,title
SB136,264148,"No cause of action for recovery of certain losses while operating an uninsured motor vehicle."
SB137,264538,"Employment security law; benefits for school bus drivers."
SB138,264283,"Substitute for SB 138 by Committee on Public Health and Welfare -- Pharmacy; creating the pharmacy audit integrity act."
SB139,264502,"Members of regional trauma councils and advisory committee on trauma."
SB140,264119,"Kansas small and disadvantaged business development program act."
SB141,264165,"School-located influenza vaccination programs."
SB142,264444,"House Substitute SB 142 by Committee on Judiciary -- Kansas preservation of religious freedom act."
SB143,264286,"Amendments relating to postsecondary technical education; creating the postsecondary tiered technical education state aid act."
SB144,263536,"Providing bus transportation for school children subjected to hazardous walking conditions."
SB145,264304,"House Substitute for House Substitute for SB 145 by Committee on Redistricting -- Congressional redistricting."
SB146,264206,"Amending statutes regulating late-term and partial birth abortion."
SB147,263623,"Substitute for SB 147 by Committee on Agriculture -- Funds related to interstate water litigation."
SB148,264576,"House Substitute for Substitute SB 148 by Committee on Agriculture and Natural Resources -- division of water rights and permits for gravel and sand operations."
SB149,264641,"Enacting the Kansas firearms freedom act."
SB150,264515,"Cities; incorporation; number of residents."
SB151,264489,"Highway advertising; permitting spot zoning"
SB152,265683,"Allowing lawfully-possessed concealed handguns and devices designed to suppress report of a firearm while hunting, fishing or furharvesting."
SB153,265617,"Authorizing contributions to accounts under the Kansas individual data on students program."
SB154,265685,"House Substitute for SB 154 by Committee on Appropriations -- Issuance of bonds by Kansas development finance authority, national bio and agro defense facility and university of Kansas engineering school expansion project."
SB155,265654,"Amendments regarding career technical education; at-risk pupil weightings."
SB156,265792,"Kansas arts commission, transfer of Hiram Price Dillon House, programming, donations, charitable corporation."
SB157,265628,"Enforcement of employee misclassification by the attorney general."
SB158,265616,"Full and fair noneconomic damages act."
SB159,265711,"House Substitute for Substitute SB 159 by Committee on Corrections and Juvenile Justice -- Searches of persons on probation, parolees and persons on postrelease supervision."
SB160,265700,"House Substitute for SB 160 by Committee on Judiciary -- Relating to collection of child support payments."
SB161,265579,"Racial profiling; uniform citizen contact data form filled out by law enforcement on each traffic or pedestrian stop."
SB162,265767,"Residential real estate transactions; disclosure of methamphetamine production."
SB163,265642,"Counties; county administrators; procedure for abolishing office."
SB164,265594,"Record requirements and civil penalties relating to sales of plastic bulk merchandise containers."
SB165,265697,"Licensing of abortion clinics by department of health and environment."
SB166,265673,"Prohibiting outside employment of certain state officials."
SB167,265786,"Enacting the health care freedom act."
SB168,265748,"Campaign finance; reporting requirements for electioneering communications."
SB169,265769,"County election officer, appointment by county commission."
SB170,265737,"Portable electronics insurance act."
SB171,265622,"Reinstatement of prevailing wage for state construction projects."
SB172,265754,"Governmental ethics; two years restriction certain state officers and employees becoming lobbyists."
SB173,265729,"State educational institutions; tuition and student financial aid."
SB174,267419,"Veterans service organizations, electronic gaming machines."
SB175,267317,"Videotaping felony interrogations."
SB176,267588,"House Substitute for House Substitute for SB 176 by Committee on Redistricting -- Redistricting; congressional and state representative redistricting."
SB177,267490,"House Substitute for SB 177 by Committee on Taxation -- Taxation; income and privilege tax rates; income tax deductions and credits and income determination; distribution of sales and use tax revenue; and severance tax exemptions."
SB178,267507,"Multi-State surplus lines agreement."
SB179,267408,"Kansas life and health guaranty association act."
SB180,267506,"Annexation procedures; deannexation; board of county commissioners duties; election required, when; homestead exemption; appeal process."
SB181,267542,"Requiring use of e-verify by employers in the state of Kansas."
SB182,267407,"EMS board operating fund, fire service training program fund of university of Kansas and fire marshal fee fund share administrative expense reimbursement to general fund."
SB183,267417,"Concerning motor vehicles; relating to safety belts."
SB184,267370,"Adult care home minimum nursing care requirements."
SB185,267519,"Insurance; allowing trust companies as a nominee."
SB186,267363,"Pesticides; hearing prior to denial, suspension or revocation of license, registration or certification."
SB187,267531,"Allowing a water bank charter to become permanent."
SB188,267338,"Amending the exemptions from a solid waste permit."
SB189,267556,"Kansas Bioscience Authority; additional voting members."
SB190,267929,"Telecommunications and price regulation."
SB191,267706,"House Substitute for SB 191 by Committee on Agriculture and Natural Resources Budget -- Appropriations; department of agriculture; laboratory testing."
SB192,267784,"Kansas dental board; licensure of dental practitioners."
SB193,267805,"Taxation, social security information required in support of certain credits, refunds and claims, recording of plats, PEAK, HPIP and certain sales tax exemptions."
SB194,268273,"Allowing homestead rights to continue after annexation until land is sold after annexation."
SB195,268455,"Relating to the licensure of acupuncturists."
SB196,268341,"House Substitute for SB 196 by Committee on Taxation -- Taxation, expensing of investment expenditures, IMPACT program, income tax credits, job creation fund, and Kansas hometown heroes checkoff fund."
SB197,268328,"Phase out of sales tax on food and food ingredients and food sales tax refund."
SB198,268462,"Creating rural opportunity zones."
SB199,268020,"Inmates in correctional facilities; medicaid eligibility."
SB200,268381,"Requiring certain beverage containers to be redeemable."
SB201,270889,"Bingo games; prize limits, time, location and conduct of games."
SB202,270901,"School districts; purpose of state aid to public schools."
SB203,270905,"Relating to the size of the Kansas legislature."
SB204,271024,"County consolidation commission established."
SB205,270951,"Establishing the Kansas employment initiative act and the Kansas employment first oversight commission."
SB206,273366,"Substitute for SB 206 by Committee on Financial Institutions and Insurance -- Surplus Lines Insurance; Multi-State Compliance Compact."
SB207,273439,"Municipalities; credit card payments to counties; certain recreation commissions; partial payment of personal property taxes; abandoned commercial real estate rehabilitation."
SB208,275345,"Long-term capital improvement program and facilities plans by public safety state agencies."
SB209,274676,"For fiscal years 2012, 2013, 2014 and 2015, five centers of excellence and three centers of innovation receive $2,000,000 from the increase in the tax base from bioscience development and investment."
SB210,275724,"Assessment on providers of developmental disability waiver program."
SB211,276014,"Pharmacists; dispensing prescriptions."
SB212,277733,"Annual report by secretary of revenue of abatements of tax liability."
SB213,286161,"Lightweight roadable vehicles; registration and taxation."
SB214,286418,"House Substitute for SB 214 by Committee on Agriculture and Natural Resources -- Amendments related to groundwater management districts and stream obstruction permitting."
SB215,286794,"Abolishing the liquefied petroleum gas advisory board."
SB216,286838,"House Substitute for SB 216 by Committee on Health and Human Services -- Smoking regulations, casino exemption and annual smoking events."
SB217,286811,"Civil commitment of sexually violent predators; reimbursement for costs related to habeas corpus actions to the county from the sexually violent predator expense fund."
SB218,286487,"Kansas Highway Patrol; vehicle inspection fees."
SB219,288719,"Wage payment act; additional penalties for employers who repeatedly fail to pay wages."
SB220,294233,"Abolishing the office of the state fire marshal and transferring the duties and functions thereof to the division of facilities management, the Kansas bureau of investigation and the division of emergency management."
SB221,294159,"Prohibiting local community corrections programs from using state grant moneys to supplant local moneys; allowing the secretary of corrections to make certain payments in the next fiscal year; capping the costs DOC pays to counties for inmates in county jails."
SB222,294182,"Voter identification requirements."
SB223,294198,"Public facilities; accessibility standards, disabled persons."
SB224,294002,"Utilities; report on electric supply and demand for electric utilities; gas safety and reliability surcharge, extension of time for filing rate schedule."
SB225,294047,"House Substitute for SB 225 by Committee on Transportation -- Allowing transit buses to operate on certain right shoulders."
SB226,295587,"Insurance; coverage for autism spectrum disorder."
SB227,296653,"Requiring anemometer towers to be marked or flagged so as to be identifiable in clear air during daylight hours."
SB228,296685,"Continuation of statewide tax levy for public schools."
SB229,296445,"Fee agencies; implementing a 10% transfer for FY2012 then repealing the 20% transfer requirement."
SB230,297761,"Creating the relevant efficient academic learning education act."
SB231,297487,"Establishing the new Kansas parole board and the prisoner review board and transferring powers and duties from the Kansas parole board."
SB232,297425,"Reduction to state income tax rates based on selected actual state general fund receipts computations, and sales tax rates and distribution."
SB233,298396,"Appropriations for FY2011, FY2012 & FY2013 for capital improvements for various state agencies."
SB234,298362,"Substitute for SB 234 by Committee on Ways and Means -- Appropriations for FY 2011 through FY 2016 for various state agencies, capital improvements, special claims."
SB235,321172,"University engineering initiative act."
SB236,303978,"Lodging inspection, lodging inspection fees."
SB237,320809,"Amendments to the Kansas expanded lottery act."
SB238,303015,"Vietnam war era veterans' medallions and certificates."
SB239,307353,"Abolishing the death penalty; creating the crime of aggravated murder."
SB240,301487,"Abolishing the joint committee on information technology; creating the committee on technology oversight."
SB241,304365,"Amendments to the Kansas expanded lottery act."
SB242,311746,"Interstate compact on the agreement among the states to elect the president by national popular vote act."
SB243,316184,"Establishing the joint committee on state authorities oversight."
SB244,302438,"Municipalities; power to enter into agreements for renewable energy generation facilities."
SB245,314911,"Allotments of state expenditures."
SB246,305238,"Regulation of sexually oriented business location."
SB247,334801,"Reconciling amendments"
SB248,334730,"Legislative compensation and expenses; limited to 90 days."
SB249,375932,"Relating to employees; criminal history record check."
SB250,375937,"Firefighters health insurance."
SB251,375945,"Joint committee on health policy oversight; duties; sunset."
SB252,375950,"Rules and regulations filing act; change in notice period; agency name changes."
SB253,375959,"Cancer screening; dense breast tissue reporting requirement in conjunction with mammograms."
SB254,375966,"Providing for information technology audits."
SB255,375973,"Mortgage registration fees; verification of indebtedness."
SB256,375979,"Entry of satisfaction of mortgage; duties of last mortgagee or assignee of record of mortgage."
SB257,375986,"School finance; calculation of local option budget, requiring foundation funding."
SB258,375994,"Governmental ethics law; permitting certain communications related to contract negotiations involving state university employees."
SB259,376002,"House Substitute for SB 259 by Committee on Pensions and Benefits -- KPERS; enacting KPERS Act of 2014, KPERS defined contribution act and other modifications to KPERS."
SB260,376006,"Amending minimum and maximum calculations of special education state aid by including the number of exceptional children under the age of four years."
SB261,376013,"Kansas private and out-of-state post-secondary educational institution act; state board of regents authority to fix, charge and collect fees and the expiration thereof."
SB262,376020,"Grandparent custody, visitation and residency."
SB263,376027,"Credit Unions; making use of credit committees permissive."
SB264,376039,"Allowing trust companies as a nominee for life insurance companies."
SB265,376044,"Credit Unions; Bylaw amendments concerning suspensions."
SB266,376050,"Insurance; Risk-based capital requirements."
SB267,376057,"Amendments regarding certain income tax credits."
SB268,376064,"Enacting the Kansas small and disadvantages business development act."
SB269,376073,"Alcoholic beverages; retailers licenses; tastings by manufacturer licensees."
SB270,376079,"Confidentiality and disclosure requirements of charitable gambling information."
SB271,376086,"Concerning ownership of pore space."
SB272,376090,"Multi-year flex accounts for groundwater water rights."
SB273,376099,"Fees for examination of insurance company."
SB274,376105,"Alcoholic beverages; authorizing extended temporary permits for special events."
SB275,376112,"House Substitute for SB 275 by Committee on Federal and State Affairs -- Establishing a drug screening program for cash assistance recipients."
SB276,376119,"Alcoholic beverages; amendments to law prohibiting licensee from hiring certain employees."
SB277,376125,"Liquor Control Act; licensing of microdistilleries; citizenship and residency requirements for corporate distributors of alcoholic liquor."
SB278,376130,"Amendments to school anti-bullying law."
SB279,376141,"Unlawful sexual relations, foster parents and foster children."
SB280,376147,"Sexually violent predator cases; evaluations and expert testimony."
SB281,376154,"Relating to the commission on judicial performance."
SB282,376161,"Substitute for SB 282 by Committee on Judiciary -- Forfeiture, fleeing or eluding law enforcement."
SB283,376167,"Substitute for SB 283 by Committee on Judiciary -- Sheriffs, civil process fees."
SB284,376174,"Verification of employee status by E-verify required for certain public contracts."
SB285,376179,"Mis-classification of employees; penalty."
SB286,376187,"Use of credit report for employment decisions."
SB287,376195,"House Substitute for SB 287 by Committee on Financial Institutions -- State officials who regulate financial institutions; power and duties."
SB288,376202,"Alcoholic beverages; repeal of proportionate pricing requirement; allowance of public consumption in sate parks."
SB289,376210,"Amending the veterinary practice act."
SB290,376217,"Addictions counselor licensure act."
SB291,376224,"House Substitute for SB 291 by Committee on Judiciary -- Kansas restraint of trade act; doctrine of the rule of reason."
SB292,376229,"Revoking an ex-spouse's inheritance rights upon divorce."
SB293,376237,"Filing of wills and admission to probate."
SB294,376244,"House Substitute for SB 294 by Committee on Appropriations -- Appropriations for FY 2012, FY 2013, FY 2014, FY 2015 and FY 2016 for various state agencies; capital improvement projects; claims against the state."
SB295,376253,"Discrimination based on employment status prohibited."
SB296,376259,"Income tax credit for certain tuition and related expenses paid to an educational institution located in Kansas."
SB297,376265,"Removing the gifts from a spouse exception from marital property in a divorce."
SB298,376271,"Penalties for violating size and weight laws."
SB299,376280,"Alcoholic beverages; creating a public venue license."
SB300,376287,"Motor vehicles; distinctive license plates; vehicle registration time extension."
SB301,376294,"Board of technical professions; terms of members."
SB302,376301,"Amendments to the Kansas Meat and Poultry Inspection Act."
SB303,376307,"Disposition of unclaimed cremated remains; veterans' cremated remains."
SB304,376315,"Domestic relations; certified batterer intervention program certification act; case management; recodification of the family law code."
SB305,376320,"Time for criminal trials; competency decision time not counted against the state."
SB306,376330,"Information submitted to Department of Labor for state directory of new hires."
SB307,376334,"Substitute for SB 307 by Committee on Judiciary--Statute of limitations for sexually violent crimes when the victim is a child; lesser included crimes, felony murder; intimidation of a witness; time limitations for criminal trials."
SB308,376341,"Amendments to the Kansas criminal code."
SB309,376346,"Elections; corrupt political advertising; stand by your ads requirement."
SB310,376355,"Establishing local enhanced management areas."
SB311,376365,"House Substitute for SB 311 by Committee on Appropriations -- Board of nursing; relating to assistant attorneys general."
SB312,376369,"Sales and compensating use tax; rate of taxation and distribution of revenues."
SB313,376376,"House Substitute for SB 313 by Committee on Federal and State Affairs -- Creates the no taxpayer funding for abortion act; amending various abortion statutes."
SB314,376383,"Department of wildlife, parks and tourism; hunting and fishing; licensing; use of land; penalties."
SB315,376389,"House Substitute for SB 315 by Committee on Financial Institutions - - Concerning the state bank commissioner, powers."
SB316,376398,"Updating references and corresponding changes relating to Executive Reorganization Order No. 36 and the Kansas department of wildlife, parks and tourism."
SB317,376403,"Property taxation; defining real and personal property."
SB318,376410,"Requiring employment of Kansas workers for certain state contracts and tax benefits."
SB319,376415,"Amendments to the Kansas expanded lottery act relating to racetrack gaming facilities."
SB320,378021,"Juvenile offender cases; probable cause determinations."
SB321,378058,"Appearance bond conditions; surety and bounty hunter regulation."
SB322,378094,"Court fees and costs; judicial branch surcharge fund."
SB323,378135,"Income tax credit for certain apprenticeships."
SB324,378171,"Board of pharmacy; pharmacist license and pharmacist intern registration."
SB325,378207,"House Substitute for SB 325 by Committee on Corrections and Juvenile Justice -- Distribution of controlled substances to health care providers, mammogram reporting and notice requirements."
SB326,378244,"Dental hygiene; services for school children."
SB327,378281,"Substitute for SB 327 by Committee on Public Health and Welfare -- Prescription of drugs; electronic prescription and prescription monitoring program."
SB328,378317,"Electronic prescription."
SB329,378346,"Historic properties; projects within environs; city opt out of state historic preservation officer review."
SB330,379344,"Relating to malpractice liability screening panels."
SB331,379315,"Cosmetology; salon and clinic license renewal."
SB332,379287,"Creating classes of licenses to sell alcoholic beverages at retail; fees, term and eligibility."
SB333,379260,"Substitute for SB 333 by Committee on Ethics and Elections -- Elections; petition circulators; qualifications changed."
SB334,379228,"Exempting military drivers from CDL testing requirements."
SB335,379200,"Designating the junction of I-70 and US 183 as the CW2 Bryan J. Nichols fallen veterans memorial interchange."
SB336,379171,"Adjutant general; funding for disasters; creating the disaster reimbursement fund; insurance fees and premium taxes; KUSF."
SB337,379151,"Adjutant general authority to fix, charge and collect fees; vulnerability assessments; hazardous materials; creating the Kansas emergency management and homeland security fund."
SB338,380280,"Enacting the Kansas public employees retirement system act of 2014."
SB339,381518,"Reduction of income tax rates for individuals and determination of income, income tax credits, sales tax rate of 6.3%, severance tax exemptions, homestead property tax refunds and food sales tax refunds."
SB340,381548,"Alcoholic liquor; class A private clubs; veterans organizations."
SB341,381583,"House Substitute for SB 341 by Committee on Local Government -- Consolidation of cities and counties by dual majority vote."
SB342,381613,"Establishing a safety corridor program."
SB343,381650,"Window tinting exemption for private detectives."
SB344,381684,"House Substitute for SB 344 by Committee on Redistricting -- Congressional redistricting."
SB345,381715,"Kansas Management Company Registration Act."
SB346,383968,"Sale of property for delinquent taxes; changes."
SB347,381744,"Court of tax appeals; filing fees; municipalities exemption."
SB348,381783,"Appraisal of property for taxation purposes; appeals; changes."
SB349,381813,"Securities commissioner; litigation and restitution funds created, appointment of professional staff."
SB350,381843,"Graduated increases in base state aid per pupil."
SB351,381875,"Transferring moneys to the local ad valorem tax reduction fund."
SB352,381906,"Employment Security Law."
SB353,381933,"Board of barbering; powers and duties; fees; licensure."
SB354,384023,"Enacting the cannabis compassion and care act."
SB355,384075,"Amendments to labor and employment standards pertaining to accident prevention and the powers and duties of the secretary of labor regarding wage claims, labor disputes and workplace inspection."
SB356,384128,"Amusement ride regulation; removing exception for home-owned amusement rides."
SB357,384177,"Wind erosion; duties of county commissioners, conservation districts."
SB358,385137,"Alcoholic beverages; authorizing tastings by manufacturer licensees."
SB359,385164,"Substitute for SB 359 by Committee on Judiciary -- Interest on judgments in civil actions."
SB360,385186,"Relating to the state child death review board."
SB361,385210,"Creating the excellence in education act."
SB362,385227,"Relating to certain persons making reports of abuse or neglect of children."
SB363,388523,"Amendments to laws regarding racial profiling."
SB364,386586,"Changes to the school finance formula."
SB365,386641,"Property tax exemption; health clubs."
SB366,387958,"Relating to attachment and garnishment."
SB367,387965,"Jury service; excusing pregnant woman or breastfeeding mother; jury pool list; duties of jury commissioners."
SB368,387969,"Amending provisions regarding supervision of drug offenders."
SB369,387979,"Prohibiting certain confined persons from receiving food sales tax refunds and homestead property tax refunds."
SB370,387985,"Enacting the senior citizen property tax deferral act."
SB371,387994,"Sales taxation; presumptions relating to nexus."
SB372,388001,"Kansas money transmitter act."
SB373,388009,"Interstate health care compact."
SB374,388660,"Concerning utilities; Kansas corporation commission; rules and regulations; penalties; fees."
SB375,388014,"Adding a new exemption for solid waste permit."
SB376,388017,"Comprehensive plan for reduction of sales tax rate and income tax rates, elimation of certain sales tax exemptions, imposition of sales tax on certain services and provision of sales tax exemption for certain purchases of food."
SB377,388590,"Excellence in education act; teacher certification; school employee performance and evaluation."
SB378,388651,"Kansas biosicence authority; prohibiting board members, officers and employees from receiving financial benefit."
SB379,389857,"Farm winery licenses; percentage of Kansas-grown products required to be used in production."
SB380,389892,"Allowing all hunters to use a crossbow during big game archery season."
SB381,389922,"Alcoholic beverages; authorizing sales of cereal malt beverage by a retailer licensed under the Kansas liquor control act."
SB382,389957,"Patient protection act; prohibited provisions in certain agreements."
SB383,389987,"Increasing the net metering allowance for non-residential customer generators."
SB384,390014,"Concerning the Kansas 911 act."
SB385,391453,"County commissioners; authority to determine duties of county clerks, treasurers and register of deeds."
SB386,391479,"Elimination of original business and job development income tax credit."
SB387,391502,"Qualifications of the state fire marshal."
SB388,391526,"Elections; relating to the education of election workers."
SB389,391549,"Elections; development of a voter education program by the Secretary of State."
SB390,391572,"Allowing farm wineries to sell wine by the bottle at special events and sell wine produced by farm wineries for consumption on licensed premises."
SB391,391598,"Oil and gas leases."
SB392,391623,"Community college; use of internet as official publication of required notices."
SB393,391645,"Substitute for SB 393 by Committee on Education -- Amendments regarding career technical education; certain weightings in school finance formula; capital improvement and outlay state aid; teacher evaluations; local option budget mills; local activities budget; income tax contributions to schools; tuition for military student."
