bill_number,bill_id,title
HB319,42820,To require parents of students enrolled in school districts rated continuous improvement or lower to attend a parent-teacher conference.
HB320,42821,To afford to private sector employers the option to offer and to employees the option to accrue and use compensatory time off.
HB321,42822,To designate the week in which Thanksgiving occurs as Ohio Agriculture Week.
HB322,42823,"To designate the interchange of State Route 11 with King Graves Road in Trumbull County as the ""Herman Maass Interchange."""
HB323,42824,To permit the trial of a corporation in absentia in a criminal proceeding initiated by complaint and relative to residential foreclosure actions.
HB324,42825,And to amend Section 279.10 of Am. Sub. H.B. 1 of the 128th General Assembly to eliminate the schedule in accordance with which the Environmental Review Appeals Commission must issue written orders concerning certain actions that were filed with the Commission and to make an appropriation.
HB325,42826,To repeal the Short-Term Loan Act and to prohibit payday lending by entities other than traditional financial institutions.
HB326,42827,To reduce the estate tax to authorize townships and municipal corporations or electors thereof by initiative to exempt from the estate tax any estate property located in the township or municipal corporation and to distribute all estate tax revenue originating in a township or municipal corporation that does not exempt property from the tax to the township or municipal corporation.
HB327,42828,To prohibit jury tampering to exclude jury questionnaires and similar documents from public records requests to require all attorneys and parties to legal proceedings to return all jury questionnaires and other records or notations containing jurors' names addresses and phone numbers to the court at the conclusion of a trial and to prohibit juror harassment.
HB328,42829,To authorize an income tax deduction for small business owners' reinvestment of undistributed profits in business property employee training or research and development.
HB329,42830,To provide for a six-year trial period in which taxpayers may include a limited number of a taxpayer's employees who work from home and whose rate of pay is at least three times the federal minimum wage as employees employed in the project for purposes of the job creation and retention credits if the recipient of the credit provides a specified level of capital investment and to require the Director of Development to issue a report at the end of the six-year period.
HB330,42831,To authorize the director of transportation to include school districts in purchase contracts for machinery materials supplies and other articles.
HB331,42832,Regarding annual reports about certain employers of public assistance recipients.
HB332,42833,To prohibit sickness and accident insurance policies public employee benefit plans and health insuring corporation policies contracts and agreements from limiting or excluding coverage for prescription contraceptive drugs and devices and outpatient services related to the provision of such drugs and devices.
HB333,42834,To establish the Compassionate Assistance for Rape Emergencies Act regarding emergency services provided to victims of sexual assault.
HB334,42835,To change the prison term for murder from an indefinite term of fifteen years to life to an indefinite term consisting of a minimum term of fifteen sixteen seventeen eighteen nineteen or twenty years and a maximum term of life imprisonment.
HB335,42836,Be transmitted to the treasurer of the municipal corporation and used to pay the compensation of counsel appointed to represent indigent defendants.
HB336,42837,To prohibit an elected officer of a political subdivision or a candidate for an elective office of a political subdivision from accepting contributions from an employee of that political subdivision who is or who would be supervised directly or indirectly by the public officer or candidate.
HB337,42838,To require the Department of Development annually to compile a report of companies that relocated out of this state and to attempt to determine the motivation behind the relocations.
HB338,42839,"To allow in certain circumstances all issues concerning a person's driver's license to be litigated in a single court to create the Putnam County Municipal Court in Ottawa on January 1 2011 to establish one full-time judgeship in that court to provide for the nomination of the judge by petition only to abolish the Putnam County County Court on that date to designate the Putnam County Clerk of Courts as the clerk of the Putnam County Municipal Court to provide for the election for the Putnam County Municipal Court of one full-time judge in 2011 to make deputy sheriffs and members of a township or joint township police force ex officio deputy bailiffs of municipal courts to require the Clerk of the Court of Claims to request that the Controlling Board within 60 days after the date of the entry of a court's determination that a person is a wrongfully imprisoned individual pay 50 per cent of a certain specified amount of money to that wrongfully imprisoned individual to permit a trial judge to impose a prison term or jail time to extend the duration of a community control sanction to impose a more restrictive sanction when a felony or a misdemeanant violates any condition of a community control sanction to allow a judge or magistrate to base a finding on the facts contained in a complaint to authorize judicial release of misdemeanants who are serving jail sentences to modify the conditions for increased penalties for the offenses of failure to stop after an accident and failure to stop after a nonpublic road accident to modify the penalty for repeat offenders under ""operating a motor vehicle without a valid license"" who never have held a valid driver's or commercial driver's license or permit and to clarify the manner of sentencing for that offense and three other traffic offenses when they are unclassified misdemeanors."
HB339,42840,To limit a member of the Ohio Parole Board who is not a victim representative to two six-year terms.
HB340,42841,To specify that discrimination by an employer against any person because of the person's credit history is an unlawful discriminatory practice under the Ohio Civil Rights Law.
HB341,42842,To create the Livestock Care Standards Board and to require the Board to adopt rules that establish standards of care for livestock and poultry including rules that prohibit specified practices.
HB342,42843,To limit overdraft fees chargeable by financial institutions and to establish certain requirements for overdraft protection services.
HB343,42844,To require the Director of Administrative Services to conduct a study of potential operating efficiencies in state government.
HB344,42845,To limit recovery of rate-case expenses for certain water-works and sewage disposal system companies.
HB345,42846,To allow political subdivisions to make internet web site publications in lieu of newspaper of general circulation publication requirements if the political subdivision donates all funds that would otherwise be used to provide newspaper notices to a local food bank or food drive for charitable purposes.
HB346,42847,To require the Department of Job and Family Services to submit annually to the leaders of the General Assembly a copy of the report submitted to the United States Department of Labor pursuant to the federal Workforce Investment Act.
HB347,42848,To prohibit disqualification of certain students from interscholastic athletics if a student's resident school district ceases then resumes its interscholastic athletics program.
HB348,42849,To increase the annual and aggregate limit on the amount of tax credits the Ohio Venture Capital Authority may authorize.
HB349,42850,To revise the membership staffing and duties of the Ohio Commission on Fatherhood.
HB350,42851,To modify the membership of the Veterans Advisory Committee.
HB351,42852,Regarding the criminal liability of an owner or occupant of any public or private place who allows a person under age 21 to remain in or on the place while possessing or consuming beer or intoxicating liquor.
HB352,42853,To require certain public water systems to submit technical managerial and financial capability plans under certain noncompliance or public health risk conditions to implement capability assurance plans and to add prohibitions and penalties to the Safe Drinking Water Law.
HB353,42854,To authorize school districts to sell commercial advertising space on school buses.
HB354,42855,Relative to the posting of debit card transactions against a bank account.
HB355,42856,To prohibit banks from imposing minimum balance requirements or charges for providing check cashing and bill processing services in connection with a deposit account opened by a customer for personal use.
HB356,42857,To include certain Olympic-style boxing competitions as sporting events for which state grants may be awarded to a county or municipal corporation.
HB357,42858,To modify the laws governing the Intrastate Mutual Aid Compact to authorize the Governor to declare the existence of a health exigency to permit state agencies to require their employees to leave their workplaces when they demonstrate symptoms related to a health exigency to specify that certain persons involved with infectious wastes may be exempt from regulation under the environmental protection laws to authorize certain emergency medical services personnel to deliver drugs during an emergency that affects the public health and to modify the conditions under which certain emergency medical services may be provided.
HB358,42859,To change the time by which absent voter's ballots must be ready to authorize the Secretary of State to make emergency revisions in the armed service absent voting provisions and to establish write-in absent voter's ballots for certain overseas voters who are unable to cast regular absent voter's ballots.
HB359,42860,To impose the same criminal penalties for assaulting a school security guard as are imposed for assaulting a school teacher.
HB360,42861,To grant an income tax credit eliminating tax liability for five years for individuals who obtain journeyperson status and who reside in Ohio and to prohibit the Apprenticeship Council from adopting standards for apprenticeship ratios that are stricter than those requirements specified in the federal regulations governing apprenticeship programs and from discriminating against open or merit shops.
HB361,42862,To provide that in actions for damages arising from personal injury or wrongful death evidence that certain charges and fees in a written bill or statement are not reasonable and that the provision of certain specified services are not necessary is admissible to rebut the prima-facie evidence of reasonableness and necessity and that certain evidence is not admissible to rebut the prima-facie evidence of reasonableness in those actions.
HB362,42863,To require carbon monoxide alarms and portable fire extinguishers in residential buildings to direct the Board of Building Standards to adopt rules that establish product and installation standards for carbon monoxide alarms and portable fire extinguishers and to require transferors of residential real property to disclose whether carbon monoxide alarms and portable fire extinguishers are installed in their property.
HB363,42864, and to amend Section 640.24 of Am. Sub. H.B. 1 of the 128th General Assembly and Sections 120.01 and 120.02 of Am. Sub. H.B. 119 of the 127th General Assembly as amended by Am. Sub. H.B. 1 of the 128th General Assembly to revise the Concentrated Animal Feeding Facilities Law to specify that certain provisions amended by this act do not become operative until the Administrator of the United States Environmental Protection Agency approves the National Pollutant Discharge Elimination System program submitted by the Director of Agriculture to extend from January 1 2010 to July 1 2010 the termination date of the suspension of statutes and temporary law governing sewage treatment systems that were enacted by Am. Sub. H.B. 119 of the 127th General Assembly and subsequently amended and reenacted by Am. Sub. H.B. 1 of the 128th General Assembly and to declare an emergency.
HB364,42865,Relative to the termination of franchises and prohibited acts under the Motor Vehicle Dealers Law.
HB365,42866,To eliminate an exemption from the Public Employees' Collective Bargaining Law for specified educational employees.
HB366,42867,To allow school district boards to exempt their districts from certain spending rules and the requirement to provide all-day kindergarten and to direct the duties of the Ohio School Funding Advisory Council.
HB367,42868,To require the Ohio Arts Council to receive one per cent of biennial general revenue fund appropriations.
HB368,42869,To create the Ohio Tree Fund to be used to reforest land that is owned by the state.
HB369,42870,To require that a person who registers under the Sex Offender Registration and Notification Law and who does not have a fixed residence address be monitored by an active global positioning system device until the person acquires a fixed residence address.
HB370,42871,To permit the Department of Education and the Chancellor of the Board of Regents to establish a longitudinal student data system.
HB371,45533,"To establish the category of a child in need of protective services and to generally replace the terms ""abused child"" ""neglected child"" and ""dependent child"" as they apply to civil law with the term ""child in need of protective services."""
HB372,42872,To require a secured party to convey a physical certificate of title to the owner of a watercraft outboard motor motor vehicle off-highway motorcycle or all-purpose vehicle upon discharge of all security interests.
HB373,42873,To establish nutritional standards for certain foods and beverages sold in public and chartered nonpublic schools; to require public school students to have periodic body mass index measurements; to require daily physical activity for public school students and to make other changes regarding physical education; and to establish the Healthy Choices for Healthy Children Council.
HB374,42874,To adopt the Ohio brook trout as the state fish.
HB375,42875,To require certain public utilities to provide billing and collection services to customers at no charge.
HB376,42876,To increase the penalties for the blocking of a highway railroad grade crossing by a train.
HB377,42877,To prohibit persons who have been convicted of or pleaded guilty to an offense involving identity theft forgery or fraud from witnessing or circulating election petitions to require entities that provide compensation to circulators of initiative or referendum petitions to be licensed to require such an entity's license to be revoked if it authorizes or knowingly permits violations of the law governing election petitions to require circulators of initiative or referendum petitions to register with the secretary of state to provide for public input in the determination of ballot titles and to require the title of an initiative or referendum petition to be submitted to the Attorney General for review.
HB378,42878,To eliminate authority of municipal corporations to exempt stock options and nonqualified deferred compensation from municipal income taxation.
HB379,42879,To make changes to the law governing corporations including dissenting shareholders the dissolution of a corporation rights to indemnification or advancement of expenses directors' fiduciary duties and recording of corporate mortgages.
HB380,42880,To increase the penalty for a first offense of sexual imposition to a misdemeanor of the first degree in specified circumstances.
HB381,42881,To create the Workforce Development Intermediary Committee.
HB382,42882,To provide immunity from liability for eligible landowners who provide access to abandoned mine land located on their land for purposes of acid mine drainage abatement and to provide immunity from liability for nonprofit organizations that provide funding or services for such acid mine drainage abatement and to designate that methane gas emitted from an abandoned coal mine constitutes a renewable energy resource rather than an advanced energy resource for purposes of the law governing the promotion of renewable energy usage electricity supplied from renewable energy sources and renewable energy credits.
HB383,42883,To create an online small business resource center on the Department of Development's internet web site.
HB384,42884,To use the compendia adopted by the United States Department of Health and Human Services to determine whether an insurer may exclude coverage for off-label drug usage.
HB385,42885,To create the Elevator Section of the Ohio Construction Industry Licensing Board to require licensure of elevator contractors and elevator mechanics and to make changes to the laws governing elevator servicing and inspections.
HB386,45534,"To increase from $500 to $1000 the threshold amount for determining increased penalties for theft-related offenses and for certain elements of ""vandalism"" and ""engaging in a pattern of corrupt activity""; to increase by 50% the other threshold amounts for determining increased penalties for those offenses; to provide that if ""nonsupport of dependents"" is based on an abandonment of or failure to support a child or a person to whom a court order requires support and is a felony the sentencing court generally must first consider placing the offender on one or more community control sanctions; to eliminate the difference in criminal penalties for crack cocaine and powder cocaine; to revise some of the penalties for trafficking in marihuana or hashish and for possession of marihuana cocaine or hashish; to revise procedures for notification of victims when violent offenders escape from the Department of Rehabilitation and Correction; to remove the authority of the victim-related member of the Parole Board to approve the hiring of employees of the Office of Victims' Services; to modify the number of Parole Board members required to conduct a full Board hearing; to limit a member of the Parole Board who is not the Chairperson or a victim representative to two six-year terms; to revise the eligibility criteria for and procedures governing intervention in lieu of conviction; to revise the eligibility criteria for judicial release; to remove from the offense of ""escape"" certain conduct by a person under supervised release by the Department and specify the method of sanctioning a person under Department supervision who engages in that type of conduct; to revise the procedure for prisoners in state correctional institutions to earn days of credit for productive participation in specified prison programs and the number of days of credit that may be earned; to require GPS monitoring of a prisoner placed on post-release control who was released early from prison due to earning 60 or more days of credit; to enact a new mechanism for the possible release with sentencing court approval of Department inmates who have served at least 85% of their prison term; to expand the membership of a county's local corrections planning board; to make changes regarding halfway houses and community residential centers and authorize reentry centers; to provide for the placement in a skilled nursing facility of an inmate who is in imminent danger of death medically incapacitated or terminally ill for care; to provide for the establishment and operation of community alternative sentencing centers for misdemeanants sentenced directly to the centers under a community residential sanction or an OVI term of confinement not exceeding 30 days; to change the membership of the Ex-offender Reentry Coalition by reducing the number and functions of members from the Governor's office and adding the Director of Veterans Services; to remove judges from the membership of a corrections commission and instead have them form an advisory board; to require the Department to develop a reentry plan for each inmate committed to the Department who was not sentenced to a term of life without parole or a sentence of death and who is expected to be imprisoned for more than 30 days; to revise the procedures governing the Department's issuance of an inmate identification card upon an inmate's release and the use of such a card to obtain a state identification card; to authorize instead of require the Department to discontinue subsidy payment to a political subdivision that reduces local funding for corrections by the amount of a community-based corrections subsidy or that uses a subsidy for capital improvements; and to require the Department together with the Department of Alcohol and Drug Addiction Services to develop an implementation plan related to funding through the federal Second Chance Act related to community reentry of offenders."
HB387,42886,To revise the performance ratings for school districts and buildings.
HB388,42887,To require conference committee reports of appropriations and revenue bills to be made publicly available forty-eight hours prior to consideration by either house.
HB389,42888,"To authorize county auditors and boards of township trustees to adopt a direct deposit payroll policy and to authorize counties to increase the amount credited to ""rainy day"" reserve balance accounts to one-sixth of the expenditures made in the preceding fiscal year from the fund in which the reserve balance account is established."
HB390,42889,To eliminate the maximum rate of $450 that applies when a charitable organization rents premises to conduct a bingo session from a person other than a charitable organization and instead to require that the rental rate for this purpose be customary competitive and reasonable for premises in the same geographic area.
HB391,42890,To establish an address confidentiality program for individuals who reasonably believe that they are in danger of being threatened or physically harmed by another person to exclude the residential and familial information of a federal law enforcement officer from the definition of a public record to include federal law enforcement officers among the protected individuals who are authorized to request a public office other than the county auditor to redact the person's address from any record made available to the general public on the internet and to include those officers among the protected individuals who may request the county auditor to replace the person's name with the person's initials on the general tax list and duplicate.
HB392,42891,To prohibit late charges on bills for telephone service wireless service and voice over internet protocol service.
HB393,42892, to amend Section 701.05 of Am. Sub. H.B. 1 of the 128th General Assembly and to amend Section 701.20 of Am. Sub. H.B. 562 of the 127th General Assembly as subsequently amended to revise the notice required to be provided by a board of township trustees to a landowner and any lienholder for a subsequent nuisance determination made within 12 months after a nuisance determination was made regarding the same property to authorize maintenance of a sheriff's or coroner's office outside the county seat of justice to increase the maximum portion of recording fees that may be earmarked for county recorders' equipment funds to authorize a board of county commissioners that provides financial assistance to a county agricultural society to provide such assistance from the county's permanent improvement fund to authorize a single-county solid waste management district to make a loan to a port authority in the same county for use by the authority to assist facilities that provide general health services in that county to adopt the spotted salamander as the state amphibian and the bullfrog as the state frog to change the report deadline of the Ohio Legislative Commission on the Education and Preservation of State History from July 1 2010 to September 1 2010 and to declare an emergency.
HB394,42893,To require that a member of the General Assembly in fact travel to or from the member's residence and to or from the seat of government to receive a travel reimbursement.
HB395,45535,To make changes relative to the Probate Code and the marriage license law.
HB396,42894,To prohibit the Governor from proposing and the General Assembly from enacting a state budget with aggregate general revenue fund appropriations that exceed ninety-seven per cent of the total money received in aggregate revenue for the two most recent fiscal years to prohibit the proposal and enactment of a state budget containing transfers from the Budget Stabilization Fund in excess of twenty-five per cent of the amount of the Fund and to eliminate the state appropriation limitation.
HB397,42895,"To designate the first week of April of each year as ""Ohio Coal Miners Week."""
HB398,42896,; and to amend Section 209.20 of Am. Sub. H.B. 1 of the 128th General Assembly to revise the waiting list provisions of the PASSPORT PACE and Assisted Living programs to revise the law governing the collection of long-term care facilities' Medicaid debts and to revise the law governing the reasons for denying a Certificate of Need application.
HB399,42897,"To revise the definition of ""mobility impaired person"" to include a person who is diagnosed with autism for purposes of the statutes governing assistance dogs."
HB400,42898,To phase out the personal income tax over ten years.
HB401,42899,To authorize property tax exemption for municipally owned facilities housing independent professional minor league baseball teams.
