bill_number,bill_id,title
SB95,42470,To establish licensing requirements and standards of care for certain dog breeding kennels dog intermediaries and animal rescues for dogs.
SB96,42472,"To designate May as ""ALS Awareness Month."""
SB97,42474,"To designate the interchange of Interstate Route 77 and Shuffle Street in Stark County as the ""Fred Krum Memorial Interchange."""
SB98,42476,To establish standards for physician designations by health care insurers.
SB99,42478,To permit an alternative form of county government in a county having a population of 1.2 million or more to have a county council with at-large members and members from districts and to have an elected fiscal officer and an appointed county engineer county information officer coroner and sheriff.
SB100,42480,To revise the Household Sewage and Small Flow On-Site Sewage Treatment Systems Law to establish the Household Sewage Treatment System Revolving Loan Program and the Household Sewage Treatment System Grant Program in the Department of Health to amend Section 120.05 and to repeal Sections 120.01 and 120.02 of Am. Sub. H.B. 119 of the 127th General Assembly to make appropriations and to declare an emergency.
SB101,42482,To create the Ohio Beekeepers Task Force.
SB102,42484,To require the State Board of Education to recommend performance standards for dropout programs operated by school districts.
SB103,42486,To prohibit a minor by use of a telecommunications device from recklessly creating receiving exchanging sending or possessing a photograph or other material showing a minor in a state of nudity.
SB104,42488,To grant annual military leave of up to 408 hours to firefighters and those other public employees who do not work a traditional workweek of 40 hours and to entitle firefighters and these public employees to use such leave to cover an entire work shift any part of which was used to perform military service.
SB105,42490,To prohibit broadcasting an actual 9-1-1 call that has been made available as a public record and to prescribe a penalty.
SB106,42492,To exclude from the application of the savings statute certain estate and trust proceedings that have limitation periods to raise the threshold amount for the termination or avoidance of guardianships of small estates of wards to raise the threshold amount for the avoidance of guardianship upon the settlement of claims of minors or adult incompetents to clarify that termination of marriage revokes any trust provision conferring a beneficial interest on the former spouse to modify the period within which a plaintiff in a wrongful death action may commence a new action after the reversal of a judgment for the plaintiff or the plaintiff's failure otherwise than upon the merits and to modify the residency qualifications for a person's appointment as a guardian.
SB107,42494,To specify that it is an unlawful discriminatory practice that is within the jurisdiction of the Ohio Civil Rights Commission for any law enforcement agency or officer in Ohio to engage in racial profiling; to require the Commission to compile data from law enforcement agencies regarding routine or spontaneous investigatory activities of the agencies' officers and analyze the data for significantly significant disparities related to the race ethnicity national origin or gender of the subjects of the activities; to provide for Commission access to LEADS to obtain the data and require law enforcement agencies to enter the data on LEADS; and to require law enforcement agencies to maintain a policy designed to eliminate racial profiling by the agency and its officers and to cease existing practices by the agency and its officers that permit or encourage racial profiling.
SB108,42496,To create the Hemophilia Advisory Council.
SB109,42498,To exempt from real property taxation the value of single-family residential property owned by a developer or builder until the developer or builder transfers possession or title.
SB110,42500,To revise the Household Sewage and Small Flow On-Site Sewage Treatment Systems Law and to amend Section 3 of Am. H.B. 416 of the 127th General Assembly to extend the date by which the report of the Great Lakes-St. Lawrence River Basin Water Resources Compact Advisory Board is due.
SB111,42502,To make permanent the temporary reimbursements for local government and school district tangible personal property tax losses.
SB112,42504,To include in the offense of ethnic intimidation the commission of specified offenses by reason of disability of the victim.
SB113,42506,To authorize the use of traffic signs warning of the presence of a child with a disability.
SB114,42508,"To designate August as ""Ohio Military Family Month."""
SB115,42510,To ratify the Interstate Compact on Educational Opportunity for Military Children and to establish the State Council on Educational Opportunity for Military Children and other offices to implement the state's participation in the compact.
SB116,42512,To authorize the Public Utilities Commission to hear complaints regarding a railroad's failure to properly sustain certain areas near its tracks and to authorize forfeiture for noncompliance and to update certain provisions of law governing railroads.
SB117,42514,"To designate the month of May as ""Multiple Chemical Sensitivity Awareness Month."""
SB118,42515,"To designate April 30 as ""Dia De Los Ninos"" or ""Children's Day."""
SB119,42517,To require pharmacists pharmacy interns and qualified pharmacy technicians to report suspected dispensing errors to the State Board of Pharmacy to require the Board to investigate all such reports and to pursue disciplinary action when warranted and to specify criminal penalties for failure to comply with the reporting requirements.
SB120,42519,Regarding exemptions from the smoking ban.
SB121,42521,To authorize the creation of transportation innovation authorities by specified governmental entities and to establish the powers and duties of such authorities.
SB122,42523,To authorize a board of education of a school district or governing board of an educational service center to employ public high school law enforcement officers to provide that public high school law enforcement officers are members of the Ohio Public Employees Retirement System to prohibit the impersonation of a public high school law enforcement officer and to specify the powers of arrest and citation of public high school law enforcement officers.
SB123,42525,To allow insurers to charge different rates for private passenger automobile insurance based upon the location of the residence of the insured within the limits of a municipal corporation.
SB124,42527, and to amend Section 745.60 of Am. Sub. H.B. 1 of the 128th General Assembly to change the transfer on death (TOD) designation instrument from a deed to an affidavit to allow real property owners holding title in survivorship tenancy to execute such an affidavit to clarify the status of a trustee of a trust as a TOD beneficiary and the dower rights of the spouse of the property owner to make other changes pertaining to the transfer on death of real property to modify the mortgage lending laws to temporarily authorize a treasurer or prosecuting attorney of a county with a population of more than 800000 but less than 900000 to designate that part of any surplus balance in the county's Delinquent Tax and Assessment Collection Fund be used to pay operating expenses of the respective office in lieu of county general fund money to allow a county recorder to accept for filing certain nonconforming documents without charging the fees otherwise required to be collected for nonconforming documents relative to coal mining leases at Burr Oak State Park to authorize the Governor to execute a release of reversionary interest in certain real estate located in Auglaize County and to declare an emergency.
SB125,42529,Designating January 26 as Paul Newman Day.
SB126,42531,To prohibit school administrators from knowingly failing to report to law enforcement authorities menacing by stalking or telecommunications harassment that occurs on school grounds to require a board of education to adopt a policy that prohibits bullying by electronic means to require a school district's harassment policy to address acts that occur off school property but materially disrupt the educational environment of the school to require a school district annually to provide training on the district's bullying policy for district employees and volunteers and to require a school district to notify parents or guardians of students if the annual training is not completed.
SB127,42532,To adopt the Ohio Tartan as the official tartan of the state.
SB128,42534,To permit townships to issue permits for public dances.
SB129,42536,To eliminate an exemption from the Public Employees' Collective Bargaining Law for specified educational employees.
SB130,42538,To require a long-term care facility to notify its residents when a sex offender or person who was imprisoned out-of-state for a felony offense is admitted to the facility and to establish immunity for employees of such facilities who report the facility's failure to comply with the notification requirements.
SB131,42540,To require that the Director of Administrative Services establish a program that ensures that supplies composed of biobased products are purchased by the Department of Administrative Services other state agencies and state institutions of higher education and to extend the income tax credit for retail sales of alternative fuel for two additional years.
SB132,42542,"To designate the portion of Interstate 71 located within the city of Strongsville as the ""Lance Corporal Thomas O. Keeling Memorial Highway."""
SB133,42544,Regarding health insurance coverage for orally administered cancer medications and the procedures insured persons are required or permitted to use in acquiring certain non-self-injectable and compounded medications.
SB134,45530,; to amend Section 7 of Am. Sub. H.B. 468 of the 126th General Assembly; to create the Department of Health Care Administration; to transfer the Medicaid Program Children's Health Insurance Program Children's Buy-In Program Hospital Care Assurance Program Disability Medical Assistance Program Ohio's Best Rx Program and Residential State Supplement Program to the new department; to require the new department to create a central pharmaceutical purchasing office; and to make an appropriation.
SB135,42547,To prohibit smoking in a motor vehicle in which a child under six years of age is a passenger.
SB136,42549,Regarding insurance and Medicaid coverage of telemedicine services.
SB137,42551,To specify that the Ohio prompt payment law applies to payment of claims by Medicaid managed care organizations for health care services provided to Medicaid managed care participants.
SB138,42553,To require certain insurers that provide coverage for cancer chemotherapy treatment to provide coverage for certain prescribed orally administered anticancer medication on a basis no less favorable than intravenously administered or injected cancer medications that are covered under the policy.
SB139,42555,To double the fine for a speeding violation that occurs in a school zone during restricted hours.
SB140,42557,Relative to treatment for certain drug offenders and to make an appropriation.
SB141,42559,To provide that a terminally ill individual with an anticipated life expectancy of five years or less who is on a waiting list for the PACE program or a Medicaid waiver program providing home and community-based services is to have priority over other individuals on such a waiting list.
SB142,42561,To require that any privately run non-Ohio school camp institution or other facility to which Ohio delinquent children are committed comply with the same standards that are applicable to in-state schools camps institutions or other facilities.
SB143,42563,To require an operator of a halfway house to notify the adult parole authority within twenty-four hours after a resident absconds from the halfway house.
SB144,42565,Four years after the effective date of that section.
SB145,42567,To create a tax credit for wages paid by employers to employees who have been convicted of felonies.
SB146,42569,To require community colleges state community colleges technical colleges and university branches to comply with minority business enterprise set aside requirements.
SB147,42571,To give the right of disposal to the United States Secretary of Veterans Affairs regarding unclaimed cremated remains of persons who are entitled to be buried in a national cemetery.
SB148,42573,To authorize municipal corporations to have a deficit in special funds under certain circumstances.
SB149,42575,To establish procedures for the Ohio Civil Rights Commission to extend state recognition to native American tribes native American groups and native American special interest groups and to specify the rights duties and responsibilities of any native American tribe that the Commission recognizes and to extend such state recognition to the Shawnee Nation United Remnant Band.
SB150,42577,To provide that a board of county commissioners may direct a sheriff to take custody of persons who are being detained for deportation or who are charged with civil violations of immigration law and to expressly authorize state and local employees and county sheriffs to render assistance to federal immigration officials in the investigation and enforcement of federal immigration law.
SB151,42579,To authorize a park district's board of park commissioners to create a building department for building code enforcement purposes.
SB152,42581,To modify the call before you dig notification system and to create the Underground Protection Commission of Ohio and the State Underground Protection Advisory Committee.
SB153,42583,"To change the definition of ""instant bingo ticket dispenser"" and to authorize a charitable organization to purchase lease and use instant bingo ticket dispensers."
SB154,42585,To prohibit pharmacy benefit managers that have a relationship with a retail pharmacy from using that relationship to the competitive disadvantage of other retail pharmacies.
SB155,42587,And to amend Sections 281.20 343.40 and 371.50.90 of Am. Sub. H.B. 1 of the 128th General Assembly to require that the costs of all biennial audits of state agencies be charged to the state agency being audited to alter the allocation of the proceeds of the existing fee on the sale of new tires in order to provide funding for the Soil and Water Conservation District Assistance Fund to increase the maximum amount of the annual soil and water conservation district subsidy to permit individual taxpayers to direct the state to transmit an income tax refund directly to certain accounts to allow the use of the state on and off triggers for state extended unemployment benefits using the total unemployment rate and the payment of high-unemployment period benefits if the benefits are federally funded to modify the computation of payments for career-technical education for certain school districts for fiscal years 2010 and 2011 to modify the effective date of certain changes to the Uniform Public Securities Law made in Am. Sub. H.B. 1 of the 128th General Assembly to establish that the final maturity for a port authority revenue bond must not be later than 45 years after the issuance of the bond rather than 40 years to make changes to the eTech Ohio clearinghouse to transfer the Louvee Theater Project from Rio Grande Community College to Ohio University to redirect certain capital appropriations to modify appropriation intent language and to declare an emergency.
SB156,42589,"To designate a portion of State Route 528 within Geauga County as the ""Sgt. Sean Landrus Memorial Highway."""
SB157,42591,To declare how monetary awards in class actions that are not paid over to members of the class are to be used.
SB158,42593,To require certain health care professionals to complete instruction in cultural competency.
SB159,42595,To prohibit health insurers from denying payment for a service during or after the performance of the service if the insurer provided prior written authorization for the service.
SB160,42597,To prohibit driving a vehicle while using a handheld or manually operated mobile communication device and to establish the violation as a secondary traffic offense.
SB161,42599,Designating June 15 as Elder Abuse Awareness Day.
SB162,42601,To revise state regulation of telephone companies remove telegraph companies from utility regulation and to create the Select Committee on Telecommunications Regulatory Reform.
SB163,42603,To prohibit an insurer's use of a credit score credit history or credit report in fixing a premium rate for or the terms and conditions of an insurance policy or in determining whether to issue continue or renew an insurance policy.
SB164,42605,To prohibit driving a vehicle while text messaging or typing on a mobile communication device and to establish the violation as a secondary traffic offense.
SB165,42607,To revise the Oil and Gas Law.
SB166,42609,To allow emergency personnel in public safety vehicles to report traffic law violations under certain circumstances.
SB167,42611,To revise the performance ratings for school districts and buildings.
SB168,42613,To authorize the prosecuting attorney of a county or chief legal officer of a municipal corporation to issue an investigative subpoena for any criminal offense.
SB169,42615,"To designate a portion of United States Route 250 within Ashland County as the ""Ashland County Veterans' Memorial Highway."""
SB170,42617,To limit to $500 the amount of political contributions that may be made by or accepted from the principals and key employees of an entity that is applying for a license or other authorization or that is licensed or otherwise authorized to operate video lottery terminal games in this state.
SB171,42619,To limit the amount of money that may be spent on signs that identify the American Recovery and Reinvestment Act of 2009 as the source of specific project funding.
SB172,42621,To require the Department of Education to waive fees for certain Ohio residents taking the GED test.
SB173,42623,To delay by one year the effective date of rules regarding school districts' expenditure of funds for core teachers and the requirement for districts to provide all-day kindergarten for all kindergartners.
SB174,42625,To establish a safe passing distance between a motor vehicle and a bicycle.
SB175,42627,To transfer appointment of the executive director of the Ohio School Facilities Commission from the Commission to the Governor with the advice and consent of the Senate.
SB176,42629,Regarding assistance for pregnancy prevention.
SB177,42631,That is scheduled to take effect January 1 2010 to continue the provisions of this act on and after that effective date and to make appropriations.
SB178,42633,To establish a drug testing requirement for adults who apply for need-based programs that provide cash assistance medical assistance housing assistance food assistance or energy assistance.
SB179,42635,To prohibit spending American Recovery and Reinvestment Act of 2009 funds on signs that identify the source of specific project funding and to declare an emergency.
SB180,42637,To allow new Internet- or computer-based community schools to open under certain conditions to permit the Department of Education and the Chancellor of the Board of Regents to establish a longitudinal student data system to require the use of student performance data in evaluating teachers and principals for licensure and to qualify Teach for America participants for a professional educator license.
SB181,42639,
SB182,42641,To exempt from property taxation the primary residences of military veterans who are 100% disabled from a service-connected disability.
SB183,42643,To eliminate a grandfather exemption from the requirements of the Architects Law granted to certain corporations.
SB184,42645,To authorize townships to use road equipment and labor resources available to a township to plow certain private roads and driveways either at the expense of the township or for a fee charged to specified persons.
SB185,42647, and to amend Section 512.60 of Am. Sub. H.B. 1 of the 128th General Assembly to prohibit the transfer of cash from certain non-General Revenue Funds to the General Revenue Fund.
SB186,42649,To authorize a charitable organization to purchase lease and use instant bingo ticket dispensers to specify that these dispensers are not slot machines to modify the definitions of veteran's and fraternal organizations to increase the number of times in a preceding year a veteran's or fraternal organization may lease premises to charitable organizations for festivals at which games of chance are conducted and to allow a charitable organization to spend a reasonable amount of its gross profit to pay property taxes and assessments on the premises where the organization conducts bingo.
SB187,42651,To establish the Ohio Planned Community Law.
SB188,42653,To authorize a county with a population greater than 100000 or a population between 78000 and 81000 to organize a county land reutilization corporation to authorize a county treasurer of a county with such a corporation to utilize the alternative redemption period in actions to foreclose abandoned lands and to immunize a county land reutilization corporation from liability for breach of a common law duty in connection with a parcel of land.
SB189,42655,Regarding adoption law custody of an abused neglected or dependent child and the elimination of acknowledgments of paternity.
SB190,42657,To include Junior ROTC as a permitted elective within the Ohio Core curriculum.
SB191,42659,To require each campaign committee that receives a contribution from an individual that exceeds $100 to identify the individual's employer on the campaign committee's campaign finance statements and to require an individual who makes a contribution exceeding $100 to a campaign committee to provide the name of the individual's employer to the campaign committee at the time the contribution is made.
SB192,42661,To permit non-Civil Service school district boards to terminate positions of district transportation employees for reasons of economy and efficiency and to contract with independent agents to provide transportation services as long as certain conditions are satisfied.
SB193,42663,To authorize a $2400 income tax withholding credit for an employer that hires and employs a previously unemployed individual.
SB194,42665,To permit individual taxpayers to direct the state to transmit an income tax refund directly to the taxpayer's checking savings or individual retirement account if the taxpayer files a return electronically.
SB195,42667,To create a uniform standard to determine whether an individual performing services for an employer is an employee of that employer.
SB196,42669,To revise the Oil and Gas Law.
SB197,42671,To require courts to establish and operate programs of mandatory foreclosure mediation in non-tax foreclosure actions on occupied residential properties and to establish procedures for the operation of those foreclosure mediation programs.
SB198,42673,To grant an income tax credit to individuals who earn degrees in science technology engineering or math-based fields of study and to authorize municipal corporations to grant a credit to individuals qualifying for the state credit.
SB199,42675,To define certain golf course landscape features as personal property for tax purposes and to prescribe a method of estimating the true value of golf courses for tax purposes.
SB200,42677,To authorize certified registered nurse anesthetists to issue prescriptions for the administration of drugs during certain phases of patient care.
SB201,42679,To designate October 13 as Metastatic Breast Cancer Awareness Day.
SB202,42681,To increase the penalties for certain offenses when a public utility worker is the victim and to make the killing of a public utility worker an aggravating circumstance for the imposition of the death penalty for aggravated murder.
SB203,42683,To revise the Concentrated Animal Feeding Facilities Law to specify that certain provisions amended by this act do not become operative until the Administrator of the United States Environmental Protection Agency approves the National Pollutant Discharge Elimination System program submitted by the Director of Agriculture and to declare an emergency.
SB204,42685,Relative to the termination of franchises and prohibited acts under the Motor Vehicle Dealers Law.
SB205,42687,To require applicants for the Children's Health Insurance Program Medicaid Ohio Works First and Supplemental Nutrition Assistance Program to provide information about their employers and to require quarterly reports identifying the employers.
SB206,42689,To limit to $500 the amount of political contributions that may be made by or accepted from the principals and key employees of an entity that is applying for a license or other authorization or that is licensed or otherwise authorized to operate video lottery terminal games or a casino in this state.
SB207,42691,To lift the moratorium on Internet- or computer-based community schools to require the State Board of Education to adopt by rule its recommended standards for those schools and other electronic educational courses to permit the Department of Education and the Chancellor of the Board of Regents to establish a longitudinal student data system and to declare an emergency.
SB208,42693,To require criminal records checks of certain persons involved in the operation of casino facilities or video lottery terminals and to prohibit any person convicted of a felony from being involved in these operations.
