bill_number,bill_id,title
HB1,77885,Missing
HB2,45524,Missing
HB3,42288,On that date.
HB4,42290,To establish an interactive distance learning pilot project.
HB5,42292,To permit individuals elected or appointed to state office to establish transition funds to receive donations and to make expenditures for transition activities and inaugural celebrations to permit a board of elections that conducts a special election on or before August 4 2010 for the purpose of nominating candidates for congressional office to conduct that election with a limited number of polling places and to declare an emergency.
HB6,42294,To authorize refundable nontransferable credits against the corporation franchise tax or income tax for production of motion pictures in Ohio.
HB7,42296,To require a building or structure constructed using state capital budget moneys to adhere to certain energy efficiency and building standards and to encourage the use of Ohio-produced products.
HB8,42298,To prohibit health insurers from excluding coverage for specified services for individuals diagnosed with an autism spectrum disorder.
HB9,42299,To require that notice of foreclosure and related sale of residential rental property be given to tenants at that property and to specify that a rental agreement for a residential property that is sold pursuant to a foreclosure action converts to a month-to-month rental agreement.
HB10,42301,"To allow a juvenile court to issue a protection order against a child who is alleged to have committed certain offenses or domestic violence against the person to be protected to include foster parents under the scope of the domestic violence laws to prohibit the unauthorized use of the Ohio Law Enforcement Gateway to include courts of appeals within the definition of ""state"" for the purposes of representation by the attorney general in a civil action brought against a judge that was elected or appointed to a court of appeals or a person employed by a court of appeals to give the judges of the Butler County Court of Common Pleas concurrent jurisdiction with judges of the Juvenile Division of the Butler County Court of Common Pleas with respect to certain custody and support cases and to name specified sections amended or enacted by this act the ""Shynerra Grant Law."""
HB11,42303,To provide that any person required to register under Ohio's Sex Offender Registration and Notification Law who establishes or occupies residential premises within one thousand feet of any school premises recreation center playground or other place where it is reasonable to expect children to frequent or linger is guilty of a misdemeanor of the first degree and to require a court to order a violator to vacate the premises as part of any injunctive relief granted for the violation.
HB12,42305,To require institutions of higher education to provide financial literacy education to students and adopt and adhere to policies regarding credit card marketing on campus.
HB13,42307,To prohibit Tier III sex offender/child victim offenders who have committed specified offenses against a victim under 16 years of age from knowingly being present on school premises or preschool or child day-care center premises and to increase the penalty for a first offense of sexual imposition to a misdemeanor of the first degree in specified circumstances.
HB14,42309,To require that the Governor's State of the State Address be delivered on a week night at 7 p.m.
HB15,42311,Missing
HB16,42313,To make certain reductions in state employee benefits to make changes to the Industrial Commission Law to make operating appropriations for the period beginning July 1 2009 and ending July 7 2009 to authorize transfers from the Budget Stabilization Fund in fiscal year 2009 to make certain non-General Revenue Fund appropriations for fiscal year 2010 to make debt service appropriations for the FY 2010-FY 2011 biennium to make appropriations for the Industrial Commission for the biennium beginning July 1 2009 and ending June 30 2011 and to provide authorization and conditions for the operation of Commission programs.
HB17,42315,To clarify the penalties for operating a motorcycle without having either a motorcycle endorsement or the proper restricted license.
HB18,42317,To establish nonresident college hunting and fishing licenses.
HB19,42319,"To enact the ""Tina Croucher Act"" to require public schools to incorporate dating violence into their policies prohibiting harassment intimidation or bullying; to require school districts to include dating violence prevention education in the health curriculum; to clarify the conditions under which a community school must close for poor academic performance; and to revise the criminal offenses that disqualify school bus drivers for employment."
HB20,42321,To eliminate the requirement that a veteran be a resident of Ohio to qualify to receive the veterans preference on civil service examinations.
HB21,42323,To permit a school district to surrender the transportation of its resident high school students attending community schools to those community schools.
HB22,42325,To authorize public offices to limit the number of bulk data requests impose charges to cover the actual costs associated with bulk data requests and charge for the cost of redacting certain information.
HB23,42326,To increase the minimum amounts required for valid proof of financial responsibility.
HB24,42328,To permit individuals elected or appointed to state office to establish transition funds to receive donations and to make expenditures for transition activities and inaugural celebrations.
HB25,42330,To reorganize the executive branch of state government.
HB26,42332,To prohibit corporal punishment in all public and chartered nonpublic schools.
HB27,42334,To create certain special license plates and to designate certain memorial highways and a memorial bridge.
HB28,42336,To change the education and experience requirements necessary for eligibility to be a candidate for the office of sheriff.
HB29,42338,To prohibit engaging in sexual conduct with a human corpse.
HB30,42340,To require an analysis of each proposed retirement incentive plan for Public Employees Retirement System members and to prohibit a member who participates in such a retirement incentive plan from being re-employed by the same employer.
HB31,42342,To adopt the children's book Lentil as the official children's book of the state and to designate its author Robert McCloskey as the official children's book author of the state.
HB32,42344,To increase the competitive bidding threshold for contracts entered into by a board of park trustees for certain municipal park improvements.
HB33,42346,To establish identification reporting and disclosure requirements governing illegal methamphetamine manufacturing laboratories and to name the act the Methamphetamine Awareness and Notification Act.
HB34,42348,"To designate a portion of State Route 44 as the ""Sgt. Jeremy Murray Memorial Highway."""
HB35,42350,To revise the law governing sanitary districts that are organized wholly for the reduction of populations of biting arthropods.
HB36,42352,To require expanded minutes for legislative committee meetings or a transcribed record of committee proceedings in lieu of minutes and to require sworn testimony of all witnesses testifying before legislative committees.
HB37,42354,"To require the Department of Administrative Services to maintain a web site database including apparent low bidders who failed to be awarded a contract because they were found not to be ""responsible"" and to require public entities to conduct investigations when apparent low bidders are suspected of failing or fail to meet the ""responsible"" prong of the ""responsive and responsible"" competitive bidding threshold."
HB38,42356,To create Prince Hall Freemason license plates.
HB39,42358,"To require the removal of snow or ice from special parking locations designated for persons with disabilities and to name the act ""The Thomas P. Ashbrock Memorial Act."""
HB40,42360,To require certain employers to allow a parent to exercise court-ordered parenting time without terminating employment reducing pay or taking other similar action against the parent.
HB41,42362,To require that a portion of lottery profits be distributed annually on a per pupil basis to public and chartered nonpublic schools.
HB42,42364,To establish requirements and procedures for the removal of beaver dams and beavers as ordered by boards of township trustees.
HB43,42366,To eliminate duplicative fees for inspections of the facility layout and equipment of relocated food service operations.
HB44,42368,And to repeal Section 3 of Am. Sub. S.B. 20 of the 120th General Assembly as subsequently amended to eliminate the financial responsibility random verification program of the Bureau of Motor Vehicles.
HB45,42370,To require the headlights of a vehicle to be lighted when its windshield wipers are in use.
HB46,42372,To permit persons who quit work to accompany the person's spouse on a military transfer to be eligible for unemployment compensation benefits.
HB47,42374,To require the registrar of motor vehicles and deputy registrars to inquire about an individual's veteran status and if given permission to forward the veteran's personal information to the director of veterans services.
HB48,42376,And to amend Section 409.10 of Am. Sub. H.B. 1 of the 128th General Assembly to provide up to two weeks of leave for any employee who is the spouse parent or a person who has or had legal custody of a member of the uniformed services who is called to active duty or is injured wounded or hospitalized while serving on active duty to revise the election calendar to revise the law governing absent voter's ballots for uniformed services and overseas voters to comply with federal law and to make Persian Gulf Afghanistan and Iraq Conflicts veterans' bonuses tax deductible and to make an appropriation.
HB49,42378,To authorize a board of county commissioners or a board of trustees of a regional water and sewer district to offer discounts on water and sewer rates to persons sixty-five years of age or older.
HB50,42380,To require a motor vehicle certificate of registration to have a supplemental portion that contains all the information contained in the main portion of the certificate except for the address of the person to whom the certificate is issued and to modify the prohibition against a pilot carrying passengers unless the pilot has a specified certification.
HB51,42382,To create the Triple Negative Breast Cancer Commission.
HB52,42384,To create the Ohio Beekeepers Task Force.
HB53,42386,To create an additional procedure for subdivisions to join a regional transit authority that levies a property tax and that includes a county having a population of at least 400000 and to allow a subdivision that is a member of such a regional transit authority to withdraw from the authority.
HB54,42388,To allow a board of county commissioners to adjust the permanent base of a ditch improvement that is used for maintenance fund assessments and to allow a board to use certain ditch maintenance procedures to maintain soil and water conservation district improvements.
HB55,42390,"To revise the penalties and sentencing provisions regarding violations of the cruelty to animals statutes to include the protection of companion animals in temporary protection orders domestic violence protection orders anti-stalking protection orders and related protection orders and to remove pit bulls from the definition of ""vicious dog"" in state law."
HB56,42392,To require certain health care plans to provide benefits for colorectal examinations and laboratory tests for cancer.
HB57,42394,To adopt the spotted salamander as the state amphibian.
HB58,42396,To require the Auditor of State to establish a fraud-reporting system for residents and public employees to file anonymous complaints of fraud and misuse of public funds by public offices or officials.
HB59,42398,To prohibit disqualification of certain students who live with legal or temporary custodians or with guardians from interscholastic athletics solely because their parents do not reside in the state.
HB60,42400,To establish nutritional standards for food and beverages sold in vending machines or school stores in public schools.
HB61,42402,To reduce the estate tax by increasing the credit amount to authorize townships and municipal corporations or electors thereof by initiative to exempt from the estate tax any estate property located in the township or municipal corporation and to distribute all estate tax revenue originating in a township or municipal corporation that does not exempt property from the tax to the township or municipal corporation.
HB62,42404,To require relevant military experience to be considered by state licensing boards and agencies and by private state contractors to permit state licensing entities to consider relevant military training if certain criteria are met to provide a waiver of a licensure or certification fee if a veteran is within six months of separation from active military duty and to eliminate certain exemptions to the licensure and certification requirements for counselors social workers and marriage and family therapists.
HB63,42406,To permit members of the General Assembly to perform civil marriage ceremonies in Ohio.
HB64,42408,To enable members of the armed services and the Ohio National Guard to terminate a rental agreement when the member receives military orders to deploy or for a permanent change of station.
HB65,42410,To require performance budgeting by most state agencies and to require performance audits of those agencies.
HB66,42412,To create the State Government Efficiency Commission.
HB67,42414,To permit persons who are sixteen to donate blood with parental consent.
HB68,42416,To establish the healthy farms and healthy schools grant program for the purpose of providing grants to schools to establish nutrition education and agricultural education programs for kindergarteners.
HB69,42418,"To create the ""Ohio Nature Preserves"" license plate."
HB70,42420,To specifically prohibit an owner of a kennel of dogs from committing cruel treatment of a companion animal by the animal's custodian or caretaker and to give a prosecutor who prosecutes an owner of a kennel of dogs who commits cruel treatment of a companion animal discretion in prosecuting the owner for the offense.
HB71,42422,To establish requirements for contract carriers that transport railroad employees.
HB72,42424,To provide for confidentiality of certain records maintained by the Ohio Public Employees Deferred Compensation Board to require the Treasurer of State to be the custodian of contributions into the deferred compensation program to require new employees to be notified of the deferred compensation program and provided with the opportunity to elect to participate or not participate in the program and to make other changes to the Deferred Compensation Law.
HB73,42426,To require proof of financial responsibility to be submitted as a condition of registering a motor vehicle.
HB74,42428,Regarding limits on mandatory overtime for nurses tuition reimbursement for nursing education tax credits for nursing professors and tax deductions for nurse aides.
HB75,42430,To allow taxpayers to contribute a portion of their income tax refunds to the Ohio Historical Society and the American Red Cross Ohio Disaster Readiness and Preparedness Fund to permanently authorize the Tax Commissioner to refund erroneously made commercial activity tax payments made by persons not required to pay the tax and to expressly permit consensual extensions of the four-year time limit on assessments and refund requests for the commercial activity tax.
HB76,42432,"To designate a portion of State Route 43 within Portage County as the ""Corporal Jason J. Hernandez Memorial Highway."""
HB77,42434,To exclude the residential and familial information of a federal law enforcement officer from the definition of a public record to include federal law enforcement officers among the protected individuals who are authorized to request a public office other than the county auditor to redact the person's address from any record made available to the general public on the internet and to include those officers among the protected individuals who may request the county auditor to replace the person's name with the person's initials on the general tax list and duplicate.
HB78,42436,To require first-time OVI offenders and other OVI offenders to use a certified ignition interlock device and to wear a continuous alcohol monitor if the offender tampers with or otherwise violates an ignition interlock device and to make other changes to OVI law.
HB79,42438,"To remove pit bulls from the definition of ""vicious dog"" in state law."
HB80,42439,To require that all new school buses be equipped with a single white strobe light to be activated at all times when the bus is transporting passengers.
HB81,42441,To require certain health care policies contracts agreements and plans to provide benefits for equipment supplies and medication for the diagnosis treatment and management of diabetes and for diabetes self-management education and to create the Small Business Health Care Affordability Task Force.
HB82,42443,To direct the Capitol Square Review and Advisory Board to promote erection on the capitol grounds of a monument honoring the Ohio Tuskegee Airmen.
HB83,42445,To provide for the reporting of assaults in public schools to school administrators and law enforcement authorities.
HB84,42447,To require health-trained personnel to perform a medical dental and mental health screening on each inmate upon arrival at a jail to establish procedures that health-trained personnel must follow if an inmate is taking xanax ativan valium or any other benzodiazepine and to provide that the sheriff ensure that health-trained personnel responsible for medical dental and mental health screening be trained as to symptoms and consequences of withdrawal from addictive drugs.
HB85,42449,To prohibit any person under twenty-one years of age from possessing a firearm subject to specified exceptions for lawful hunting sporting or educational purposes and for law enforcement officers; to expand the offense of failure to secure dangerous ordnance so that it also prohibits a failure to secure a firearm and increase the penalty for the offense; and to declare an emergency.
HB86,42451,To authorize in certain counties the creation of a land reutilization corporation to facilitate the reclamation rehabilitation and reutilization of vacant abandoned tax-foreclosed or other real property and to authorize in those counties the use of the expedited nonjudicial foreclosure procedure for abandoned lands.
HB87,42453,To create the Ohio Energy Resource Center at Ohio University's Voinovich School.
HB88,42455,To enable a court of common pleas to order a licensed auctioneer to conduct a sale of real property pursuant to a writ of partition.
HB89,42457,To provide that the purposeful killing of a judge or magistrate in specified circumstances is aggravated murder; to increase the penalty for felonious assault aggravated assault and assault in specified circumstances when the victim is a judge a magistrate or a law enforcement officer to change the circumstances in which the penalty for those offenses is increased when the victim is a BCII investigator and to remove the increased penalty for those offenses when the victim is a peace officer; to increase the penalty for assault when the offense is committed in a courthouse in specified circumstances and to change the circumstances in which the penalty for that offense is increased when the victim is a children services worker; to increase the penalty for aggravated menacing in specified circumstances when the victim is a law enforcement officer judge or magistrate and to change the circumstances in which the penalty for that offense is increased when the victim is a children services worker; to expand intimidation to also prohibit attempting to intimidate a public servant party official attorney or witness by making an unlawful threat of harm to an unborn of that person; to expand retaliation to also prohibit using force against or making an unlawful threat to harm an unborn of a public servant party official attorney or witness and to modify the culpable mental state for and other elements of that offense; and to make the killing of a judge or magistrate in specified circumstances an aggravating circumstance for the imposition of the death penalty for aggravated murder.
HB90,42459,To require the Governor to issue an official notice of the death of an Ohio resident killed by hostile fire as a member of the United States armed forces or the National Guard and to order the lowering of flags on the day of the person's funeral.
HB91,42461,"To designate the bridge spanning the Cuyahoga River and the Ohio Canal in Cuyahoga County and that is part of Interstate Route 480 the ""Union Workers Memorial Bridge."""
HB92,42463,To require absent voter's ballot identification envelope statements to be completed for absent voter's ballots to be counted to require boards of elections to notify absent voters that their ballots will be rejected if they do not complete the required statement to generally prohibit same day voter registration and application for absent voter's ballots to permit election observers to be appointed to serve at the board of elections or at another designated site during the time absent voter's ballots may be cast in person to revise the time period in which voters may cast absent voter's ballots in person to permit a board of elections to establish additional locations at which voters may cast absent voter's ballots in person to require the Secretary of State to notify boards of elections of mismatches between voter registration information and motor vehicle records and to revise the process for appointing members of a board of elections.
HB93,42465,To require bicycle operators and passengers under 18 years of age to wear protective helmets when the bicycle is operated on a roadway and to establish the Bicycle Safety Fund to be used by the Department of Public Safety to assist low-income families in the purchase of bicycle helmets.
HB94,42467,Regarding prescription drug marketing disclosures.
HB95,42469,To prohibit a court from ordering a statutory change of name for a person who has committed identity fraud or who must register under the SORN Law for having committed a sexually oriented offense or child-victim oriented offense.
HB96,42471,To require the inclusion of a bittering agent in engine coolant and antifreeze.
HB97,42473,Regarding temporary food service operations.
HB98,42475,To provide notice to a long-term care facility when a Tier III or similar category sex offender/child-victim offender indicates an intent to reside in the facility or registers an address within the specified geographical notification area including the facility.
HB99,42477,Relative to the expansion of DNA testing for certain convicted felons the elimination of the DNA testing mechanism for felons who pleaded guilty or no contest to the offense the collection of DNA specimens from all persons eighteen years of age or older who are arrested for a felony offense the preservation and accessibility of biological evidence in a criminal or delinquency investigation or proceeding the improvement of eyewitness identification procedures and the electronic or audio recording of custodial interrogations.
HB100,42479,To revise the laws governing coal mining with regard to the imposition of a portion of the severance tax on coal and performance security and reclamation and to declare an emergency.
HB101,42481,To create the Sickle Cell Anemia Advisory Committee.
HB102,42483,Regarding umbilical cord blood donations.
HB103,42485,To provide that residential and familial information of a probation officer is not a public record to increase the penalties for certain offenses when a judge or magistrate is the victim to prohibit a person from threatening a judge or magistrate and to make the killing of a judge or magistrate an aggravating circumstance for the imposition of the death penalty for aggravated murder.
HB104,42487,To codify federal restrictions on local zoning of the antenna structures of amateur radio stations and place the burden of proof for compliance on the zoning authority.
HB105,42489,To create the Lupus Education and Awareness Program and to make an appropriation.
HB106,42491,"To designate March as ""Macular Degeneration Awareness Month."""
HB107,42493,To create the Oil and Gas Leasing Board and to establish a procedure by which the Board may enter into leases for oil and gas production on land owned or under the control of a state agency for the purpose of providing funding for capital and operating costs for the agency.
HB108,42495,To revise the law governing cockfighting.
HB109,42497,To require the Registrar of Motor Vehicles to disqualify the holder of a commercial driver's license from operating a commercial motor vehicle upon a municipal OVI conviction and to eliminate the waiver provision for restricted commercial driver's licenses for farm-related service industries.
HB110,42499,To authorize the Director of Natural Resources to issues permits and make leases to take and remove natural gas and oil from under the bed of Lake Erie.
HB111,42501,To reduce from fifteen to ten the minimum number of days for bidding when a nonchartered municipal corporation sells personal property by Internet auction.
