bill_number,bill_id,title
HR89,210408,Honoring the Versailles FFA Chapter as the Number One chapter in Ohio.
HR90,210409,Representative Harris    BE IT RESOLVED BY THE HOUSE OF REPRESENTATIVES OF THE STATE OF OHIO:  WHEREAS The members of the House of Representatives of the 128th General Assembly of Ohio are pleased to pay tribute to C. Brent DeVore on his exemplary service as president of Otterbein College; and  WHEREAS Brent DeVore has fulfilled a multitude of responsibilities with impressive competence throughout his distinguished career in higher education. Serving as president of Davis and Elkins College vice president of Hiram College and executive director of the Kent State University Foundation before becoming president of Otterbein College in 1984 he has also been active with numerous professional groups including the Council of Independent Colleges the National Association of Independent Colleges and Universities the Ohio College Association United Methodist Higher Education Foundation Communities in Schools and the Private Industry Council of Columbus and Franklin County; and   WHEREAS Whether occupying center stage or playing a key role in the wings Brent DeVore always made his dynamic presence felt. During his tenure as president he was instrumental in developing adult continuing study and gradute programs renovating and constructing new buildings implementing 57 service learning courses and increasing the amount of community service hours completed by students and staff and he can be proud that his commitment to Otterbein College has impelled many to dedicate themselves similarly; and  WHEREAS The enthusiasm and expertise Brent DeVore has shown in his endeavors have gained him the appreciation and esteem of others. In 2007 he was presented with a Call to Service Award for Lifetime Achievement by the White House in recognition of his more than thirty-seven years of service to various non-profit organizations  and we are proud to note that it is through the unsurpassed efforts of diligent people such as he that the State of Ohio continues to grow and prosper; therefore be it  RESOLVED That we the members of the House of Representatives of the 128th General Assembly of Ohio in adopting this Resolution applaud C. Brent DeVore on his innumerable contributions to Otterbein College and extend best wishes for a happy healthy retirement; and be it further  RESOLVED That the Clerk of the House of Representatives transmit a duly authenticated copy of this Resolution to C. Brent DeVore.       Please send questions and comments to the Webmaster. &#169 2010 Legislative Information Systems | Disclaimer Index of Legislative Web Sites
HR91,210410,Honoring the Green High School Academic Challenge team as the 2009 Ohio Academic Challenge State Champion.
HR92,210411,Honoring Lloyd C. Mahaffey on his retirement from the United Autoworkers of America.
HR93,210412,In memory of the Reverend Dr. Phale D. Hale Sr.
HR96,210413,Relative to travel allowance.
HR97,210414,Honoring the Edison Academy ColdConquerors as the 2009 National eCYBERMISSION Champions.
HR98,210415,Honoring Richard J. Billak on receiving the 2009 Arthur McDonald Leadership and Service Award.
HR99,210416,Honoring the Defiance High School boys 4x800-meter relay team as the 2009 Division II State Champion.
HR100,210417,Honoring Peter Kobelt as the 2009 Division I State Singles Tennis Champion
HR101,210418,Honoring the New Albany High School girls lacrosse team as the 2009 Division II State Champion.
HR102,210419,Honoring the Halker's Gold Level 5 gymnastics team as the 2009 State Champion.
HR103,210420,Honoring the Ross High School softball team on winning the 2009 Division II State Championship.
HR104,210421,Honoring Taylor Wynne as a 2009 winner of the MLK Statewide Oratorical Contest.
HR105,210422,Honoring the Indian Valley High School baseball team as the 2009 Division III State Champion.
HR106,210423,Honoring the Worthington Kilbourne High School boys lacrosse team as the 2009 Division I State Champion.
HR107,210424,In memory of the Honorable Bob Schuler.
HR108,210425,Honoring Honoring Nichole Provonsil as a 2009 God Flag and Country Oratory Contest state winner.
HR110,210627,Honoring the Miamisburg High School Destination ImagiNation team for its exemplary performance at the 2009 state and global tournaments.
HR111,210628,Honoring LeBron James as the NBA's Most Valuable Player for 2008-2009.
HR112,210629,Recognizing the Beavercreek High School varsity Test of Engineering Aptitude Mathematics and Science team on placing first in the extra-large school division at the 2009 state competition.
HR113,210630,Honoring Tamara Brennan for her heroic actions.
HR114,210631,Honoring Jennifer Kilman as the 2009 Ms. Wheelchair Ohio USA.
HR115,210632,Honoring the Lakewood High School softball team as the 2009 Division III State Champion.
HR116,210633,Honoring the Willoughby-Eastlake Public Library on its One Hundredth Anniversary.
HR117,210634,Representatives Lundy Koziura    BE IT RESOLVED BY THE HOUSE OF REPRESENTATIVES OF THE STATE OF OHIO:  WHEREAS The members of the House of Representatives of the 128th General Assembly of Ohio are pleased to congratulate the Elyria High School softball team as the Division I State Champion; and  WHEREAS Under the capable leadership of Coach Ken Fenik the Elyria High School softball team has proven to be a talented and superbly conditioned squad and has gained the respect of fans and opponents alike for the spirited and highly motivated play of its members. Throughout the season each player worked diligently to improve her abilities and as a result the Lady Pioneers defeated a tough Hudson team by a score of 10-1 to secure this year's state championship title; and   WHEREAS Known as a driven and spirited team the Lady Pioneers have developed into a remarkably efficient group of athletes whose skill on the diamond is equaled only by their exemplary display of teamwork and sportsmanship. They are a credit not only to their families and their school but also to the superb coaching of their mentor Ken Fenik; and  WHEREAS The road to victory and a championship title is a difficult one requiring ability endurance teamwork and a positive attitude on the part of the players and coach alike. The members of the Elyria High School softball team have exemplified all of the characteristics that are essential for success both on and off the softball field including courage discipline integrity and good sportsmanship and their efforts have earned them the admiration of all those who have witnessed these outstanding athletes in action; therefore be it  RESOLVED That we the members of the House of Representatives of the 128th General Assembly of Ohio in adopting this Resolution commend the Elyria High School softball team on winning the 2009 Division I State Championship and applaud all those associated with this exceptional squad; and be it further  RESOLVED That the Clerk of the House of Representatives transmit a duly authenticated copy of this Resolution to the Elyria High School softball team.       Please send questions and comments to the Webmaster. &#169 2010 Legislative Information Systems | Disclaimer Index of Legislative Web Sites
HR118,210635,Recognizing National Visiting Nurse Association Week May 11-17 2009.
HR119,210636,Relative to travel allowance.
HR120,210637,Honoring Jonny Price as a 2009 Division I State Boys Doubles Tennis Champion.
HR121,210638,Honoring Kevin Metka as a 2009 Division I State Boys Doubles Tennis Champion.
HR122,210639,Honoring Erica Gelhaus as Miss Ohio 2009.
HR123,210640,Honoring Brad Liston as a 2009 Division II State Track and Field Champion.
HR124,210641,Honoring Ayla Eley as the 2009 Miss Teen Ohio-World.
HR125,210642,Honoring Mallory Kreider as a 2009 Division II State Track and Field Champion.
HR126,210643,Honoring Katherine Jamieson as a 2009 Division III State Track and Field Champion.
HR127,210644,Honoring the Ottawa Hills High School Quiz Bowl team as the 2009 National Champion.
HR128,210645,Representatives Slesnick Oelslager    BE IT RESOLVED BY THE HOUSE OF REPRESENTATIVES OF THE STATE OF OHIO:  WHEREAS The members of the House of Representatives of the 128th General Assembly of Ohio are pleased to extend special recognition to Kandace Thomas on winning the 2009 Division I State Track and Field Championship in the 100-meter dash; and  WHEREAS A sophomore at GlenOak High School Kandace Thomas has combined talent and competitive spirit with the highest ideals of good sportsmanship to establish herself as a truly exceptional young athlete. With admirable dedication she has worked diligently toward attaining ultimate proficiency in track and field and as a result she won first place in the 100-meter dash with a time of 12.04 seconds placed second in the 200-meter dash and helped the 400-meter relay team earn third place at this year's state meet; and
HR129,210646,Honoring the City of Lorain on the occasion of its One Hundred Seventy-fifth Anniversary.
HR130,210647,Recognizing August as Military Family Month in Ohio.
HR131,210648,Honoring the Strasburg-Franklin High School softball team on winning the 2009 Division IV State Championship.
HR132,210649,Honoring Kurt Erichsen as the recipient of the 2009 John Bosley Award.
HR133,210650,Honoring Nick Hubbell as the 2009 United States National Stock Rally Soap Box Derby Champion.
HR134,210651,Honoring Tony Ortiz as the 2009 League of United Latin American Citizens' Man of the Year.
HR135,46497,To amend House Rule 68 to require conference reports to lie over two calendar days unless the requirement is suspended by two-thirds of the members present.
HR136,210652,Honoring Kevin Leland on winning the 2009 OHSAA Division I State Championship in the pole vault.
HR137,210653,Honoring Christine Borchers on winning the 2009 Division III State Championship in the shot put.
HR138,210654,Honoring the Versailles High School boys 4x400-meter relay team on winning the 2009 Division III State Championship.
HR139,210655,In memory of Gunnery Sergeant David S. Spicer.
HR140,210656,Honoring the Versailles High School girls 4x800-meter relay team on winning the 2009 Division III State Championship.
HR141,210657,Honoring Nandini Srinivasan as the 2009 Buckeye Girls State governor.
HR142,210658,Honoring Kim Fender as the 2009 Ohio Librarian of the Year.
HR143,210659,Honoring Bethel Lutheran Church on the Fiftieth Anniversary of its sanctuary.
HR144,210660,Honoring Roger Gardner as the 2009 Marine of the Year.
HR145,210661,Honoring Aislinn McLaughlin as a 2009 U. S. Girls Wrestling Association Ohio State Champion.
HR146,210662,Representative Ruhl    BE IT RESOLVED BY THE HOUSE OF REPRESENTATIVES OF THE STATE OF OHIO:  WHEREAS The members of the House of Representatives of the 128th General Assembly of Ohio are pleased to extend special recognition to Kelly Barnhill on winning first place in the shot put at the 2009 Division II State Track and Field Championship; and  WHEREAS A junior at Ontario High School Kelly Barnhill combined talent and competitive spirit with the highest ideals of good sportsmanship to establish herself as a truly exceptional young athlete. With admirable dedication she worked diligently toward attaining ultimate proficiency in track and field and as a result she won first place in the shot put with a throw of 42 feet 11 inches at this year's Division II State Championship; and   WHEREAS Kelly Barnhill's accomplishments and leadership both in and out of athletic competition are a justifiable source of pride and an outstanding reflection not only on her but also on her family her teammates her coaches her school and her community. Her unwavering commitment to excellence has earned her the respect and esteem of many and she is certainly deserving of high praise; and  WHEREAS We are pleased to pay tribute to Kelly Barnhill on an exemplary season. Indeed the same maturity and experience she has gained through her participation in sports will greatly aid her in meeting the challenges of the future; therefore be it  RESOLVED That we the members of the House of Representatives of the 128th General Assembly of Ohio in adopting this Resolution commend Kelly Barnhill on her personal success and salute her as one of Ohio's finest young athletes; and be it further  RESOLVED That the Clerk of the House of Representatives transmit a duly authenticated copy of this Resolution to Kelly Barnhill.       Please send questions and comments to the Webmaster. &#169 2010 Legislative Information Systems | Disclaimer Index of Legislative Web Sites
HR147,210663,Honoring Knox Community Hospital on receiving a 2009 Aster Award.
HR148,210664,Honoring Silas Jolliff on winning the 2009 Division III State Championship in the 400-meter dash.
HR149,210665,Honoring Nathan Rader as a 2009 National SkillsUSA silver medalist.
HR150,210666,Relative to the election of the assistant minority whip for the 128th General Assembly of Ohio.
HR151,210667,Relative to the election of the assistant minority whip for the 128th General Assembly of Ohio.
HR152,77412,Relative to the election of Peter A. Beck to fill the vacancy in the membership of the House of Representatives created by the resignation of Shannon Jones of the 67th House District.
HR153,210668,Recognizing Domestic Violence Awareness Month October 2009.
HR154,210669,Speaker Budish Representatives Balderson Book Lundy DeGeeter Boyd    BE IT RESOLVED BY THE HOUSE OF REPRESENTATIVES OF THE STATE OF OHIO:  WHEREAS The members of the House of Representatives of the 128th General Assembly of Ohio are pleased to extend special recognition to Ellen Aiello on the memorable occasion of her retirement from state service September 30 2009; and  WHEREAS Ellen Aiello is a remarkable individual for she has combined civic concern and dedication with selfless initiative to become a dynamic member of the staff of the Ohio House of Representatives. Joining the stenography pool of the House Democratic Caucus four decades ago she served as a committee secretary and in various posts in the House Clerk's Office before transferring to the Ohio Senate staff. After a stint with the Ohio Department of Transportation she returned to the House Democratic Caucus advancing through such positions as senior policy assistant before becoming policy director in 2006; and   WHEREAS Over the years Ellen Aiello has given generously of her time energy and abilities to assist the Ohio House of Representatives and has demonstrated a praiseworthy commitment to the success of state government. She has provided a valuable service by helping to maintain the efficiency and effectiveness of the legislative process and without the efforts of individuals such as she many services that are currently available to the constituents of our state would cease to exist; and  WHEREAS Ellen Aiello's contributions to the State of Ohio have been greatly appreciated by all those who have had the pleasure of working with her. She has displayed exceptional devotion responsibility and enthusiasm in her endeavors and we extend best wishes for health and happiness in the years to come; therefore be it  RESOLVED That we the members of the House of Representatives of the 128th General Assembly of Ohio in adopting this Resolution commend Ellen Aiello on her exemplary state service and salute her as one of Ohio's finest citizens; and be it further  RESOLVED That the Clerk of the House of Representatives transmit a duly authenticated copy of this Resolution to Ellen Aiello.       Please send questions and comments to the Webmaster. &#169 2010 Legislative Information Systems | Disclaimer Index of Legislative Web Sites
HR155,210670,Honoring Elizabeth Trisler as the 2009 National Right to Life Oratory Contest winner.
HR156,210671,Honoring the Cincinnati Museum Center on receiving a 2009 National Medal for Museum and Library Service.
HR157,210672,In memory of the late Rob Stoneberger.
HR158,210673,In memory of Private First Class Zachary Taylor Myers.
HR159,210674,Relative to Travel Allowance.
HR160,210675,Relative to Travel Allowance.
HR161,210676,Relative to the election of the majority floor leader the assistant majority floor leader and the assistant majority whip for the 128th General Assembly of Ohio.
HR162,210677,To amend House Rule 28 to consolidate the standing committees of the House of Representatives.
HR163,210678,Relative to the election of the assistant majority whip for the 128th General Assembly of Ohio.
HR164,210679,Relative to the election of the assistant majority whip for the 128th General Assembly of Ohio.
HR165,210680,Honoring Dave Johnston on winning the 2009 United States Air Force Marathon.
HR166,210681,"Honoring Hugh F. ""Trey"" Daly III on receiving a 2009 Community Health Leaders Award."
HR167,210682,Honoring the Eastwood High School boys track and field team on winning the 2009 Division II OHSAA State Championship
HR168,210683,Honoring the Eastwood High School girls bowling team as the 2009 Division I State Champion.
HR169,210684,Representative Balderson  Speaker Budish Representatives Batchelder Adams J. Adams R. Amstutz Bacon Baker Beck Belcher Blair Blessing Bolon Book Boose Boyd Brown Bubp Burke Carney Celeste Chandler Coley Combs Daniels DeBose DeGeeter Derickson Dodd Dolan Domenick Driehaus Dyer Evans Fende Foley Gardner Garland Garrison Gerberry Goodwin Goyal Grossman Hackett Hagan Hall Harris Harwood Heard Hite Hollington Hottinger Huffman Jordan Koziura Lehner Letson Luckie Lundy Maag Mallory Mandel Martin McClain McGregor Mecklenborg Moran Morgan Murray Newcomb Oelslager Okey Otterman Patten Phillips Pillich Pryor Ruhl Sayre Schneider Sears Skindell Slesnick Snitchler Stautberg Stebelton Stewart Sykes Szollosi Uecker Ujvagi Wachtmann Wagner Walter Weddington Williams B. Williams S. Winburn Yates Yuko Zehringer   BE IT RESOLVED BY THE HOUSE OF REPRESENTATIVES OF THE STATE OF OHIO:  WHEREAS The members of the House of Representatives of the 128th General Assembly of Ohio were deeply saddened to learn of the death of James R. Ross and extend our heartfelt condolences to his family and friends; and  WHEREAS James Ross left an indelible impression on the people whose lives he touched and he will be remembered as a spirited individual who contributed immeasurably to the world around him. A U.S. Army veteran of World War II he was the former owner and operator of a hardware store an insurance agent a 32nd Degree Mason a commissioner for Coshocton County and a member of the Ohio House of Representatives and he served in various capacities with such organizations as the Ohio State Grange the State District Board of Selective Services the Dresden American Legion Veterans of Foreign Wars Post 2040 the Elks Lodge of Coshocton and Adams Mills Presbyterian and Grace United Methodist churches; and   WHEREAS James Ross' regard for improving the quality of life in our society was clearly evident in his personal sacrifices of time and effort to his family friends and community. Giving generously of his energy and abilities in all of his endeavors he displayed exceptional concern and insight and his absence will be keenly felt; and  WHEREAS A loving husband to his wife the late Mary a devoted father to his two children Cindy and Robert and the proud grandfather of five grandchildren and one great-grandchild James Ross always used his talents to the benefit of others and the laurels of his life stand as a tribute not only to him but also to those he left behind. Although the void his death has created can never be filled the legacy of care and commitment he established will surely live on. The world is a richer place for his having been in it and he will be sorely missed; therefore be it  RESOLVED That we the members of the House of Representatives of the 128th General Assembly of Ohio in adopting this Resolution express a profound sense of loss and sincere regret at the death of James R. Ross and in so doing pay tribute to the memory of a truly unique individual; and be it further  RESOLVED That the Clerk of the House of Representatives transmit a duly authenticated copy of this Resolution to the family of James R. Ross.       Please send questions and comments to the Webmaster. &#169 2010 Legislative Information Systems | Disclaimer Index of Legislative Web Sites
HR170,210685,Honoring Maddie Kobelt as a 2009 Division I State Girls Doubles Tennis Champion.
HR171,210686,BE IT RESOLVED BY THE HOUSE OF REPRESENTATIVES OF THE STATE OF OHIO:  WHEREAS The members of the House of Representatives of the 128th General Assembly of Ohio are pleased to congratulate Meghan Buell on winning the 2009 Division I State Championship in girls doubles tennis; and  WHEREAS A junior at New Albany High School Meghan Buell has combined talent and competitive spirit with the highest ideals of good sportsmanship to establish herself as a truly exceptional young athlete. With admirable dedication she has worked diligently toward attaining ultimate proficiency in tennis and as a result she and her partner Maddie Kobelt defeated a tough Liberty Township Lakota East pair by the score of 6-2 6-2 to win this year's Division I State Doubles Championship title; and   WHEREAS Meghan Buell's accomplishments and leadership both in and out of athletic competition are a justifiable source of pride and a fine reflection not only on her but also on her family her teammate her coach Tim O'Haver her school and her community. Her unwavering commitment to excellence has earned her this well deserved distinction and she is certainly worthy of high praise; and  WHEREAS With athletic competition playing such an important role in the total education of our young people we are extremely pleased to pay tribute to Meghan Buell on an exemplary season. Indeed the same maturity and experience she has gained through her participation in tennis will greatly aid her in meeting the challenges of the future; therefore be it  RESOLVED That we the members of the House of Representatives of the 128th General Assembly of Ohio in adopting this Resolution commend Meghan Buell on her personal success and salute her as one of Ohio's finest young athletes; and be it further  RESOLVED That the Clerk of the House of Representatives transmit a duly authenticated copy of this Resolution to Meghan Buell.       Please send questions and comments to the Webmaster. &#169 2010 Legislative Information Systems | Disclaimer Index of Legislative Web Sites
HR172,210687,Honoring Morgan Dobbins on winning the 2009 Division II State Championship in boys golf
HR173,46498,BE IT RESOLVED BY THE HOUSE OF REPRESENTATIVES OF THE STATE OF OHIO:        Please send questions and comments to the Webmaster. &#169 2010 Legislative Information Systems | Disclaimer Index of Legislative Web Sites
HR174,210688,In memory of Erich Kunzel.
HR175,210689,Recognizing National Computer Science Education Week.
HR176,210690,Honoring My Linh Li and Kim My Li as the 2009 Division II State Champions in girls doubles tennis.
HR177,210691,Honoring the St. Francis DeSales High School boys soccer team on winning the 2009 Division II State Championship.
HR178,210692,Honoring the Thomas Worthington High School girls water polo team as the 2009 State Champion.
HR179,210693,Honoring Henry L. Meyer III as a recipient of the 2009 Humanitarian Award from the American Red Cross of Greater Cleveland.
HR180,210694,Honoring Charles D. Moeller as the 2009 Entrepreneur of the Year from Ohio.
HR181,210695,Honoring Dr. E. Gordon Gee as Time magazine's Best College President.
HR182,46499,To urge the Administrator of the United States Environmental Protection Agency to grant an emergency exemption for the use of the insecticide Propoxur to control bedbugs in Ohio.
HR183,210696,Honoring Dr. John Parcell as the 2009 Ohio Professor of the Year.
HR184,210697,Honoring the Gahanna Lincoln High School boys soccer team as the 2009 Division I State Champion.
HR185,210698,Honoring Derek Edgington as a National 4-H Champion.
