bill_number,bill_id,title
HR126,863788,"Urging the Department of Transportation Services of the City and County of Honolulu to work in partnership with SSFM International to implement the traffic safety recommendations identified in the Kupuna Loop Sub-Area Corridor Study and to repave all roadways in the Kunia and Village Park area."
HR127,863893,"Urging the United States Congress to enact legislation requiring all new vehicles manufactured in the United States to be equipped with anti-crash technology."
HR128,863728,"PUEO HABITAT AREAS"
HR129,863757,Pesticides
HR130,863769,"Department of Education; Overcrowding; Public Schools; Kapolei, Ewa, and Waipahu"
HR131,863651,"University of Hawaii, West Oahu; State Procurement Office"
HR132,863799,"Intra-island Ferry; Leeward Coast Ferry; Waianae Small Boat Harbor"
HR133,863768,"Waianae Baseline Environmental Study"
HR134,863790,"Environmental Justice Guidance Document; Office of Environmental Quality Control"
HR135,863901,"Urging the State Department of Transportation, as well as the Department of Transportation Services of the City and County of Honolulu, Department of Public Works of the County of Hawaii, Department of Transportation of the County of Maui, and Department of Public Works of the County of Kauai,"
HR136,863654,"Hawaiian Language; Education"
HR137,863613,"Kama'aina Homecoming Commission"
HR138,863811,"Spitting Caves; Ban on Jumping and Diving"
HR139,863678,"Hawaiian Electric Company; Reduced Rate for Schools"
HR140,863815,"State Capitol Management Commit tee; Master Security Plan"
HR141,863698,"State Capitol Reflecting Pools; Department of Accounting and General Services; Water Fountains"
HR142,863656,"Procurement; Review"
HR143,863807,"Plant Quarantine Branch; Legislative Reference Bureau"
HR144,863617,"Plant Quarantine Branch; Office of the Auditor"
HR145,863907,"Transportation; Omaopio Road; Kula Highway; Traffic Light"
HR146,863909,"Reentry Commission Skills Training Program."
HR147,863905,"Department of Accounting and General Services; Repair and Maintenance; Priorities; Report"
HR148,863646,"Health; Pesticide Drift"
HR149,863669,"Agricultural Commerce; Enclosed Country Stores"
HR150,863737,"Native Hawaiians; Kamehameha Schools"
HR151,863715,"REDUCE STANDARDIZED TESTING IN THE PUBLIC EDUCATION SYSTEM."
HR152,863650,"REQUESTING THE BOE TO ABOLISH HIGH STAKES TEACHER EVALUATIONS"
HR153,864846,"Induction into the Bandworld Legion of Honor"
HR154,864784,"Congratulating AccesSurf, 10th Anniversary; PATH (People Advocacy for Trails Hawaii) 30th Anniversary, and Hawaii Bicycling League 40th Anniversary."
HR155,865431,"Iolani School Varsity Boys Wrestling Team 2016 State Champions"
HR156,866022,"Congratulating Winston Sakurai as the 2016 NASSP Hawaii Principal of the Year, Malaea Wetzel as the 2015 NAESP Hawaii National Distinguished Principal, Dean Cevallos as the Recipient of the 2016 Masayuki Tokioka Excellence in School Leadership Award, and Kaelepulu Elementary School, Hahaione Elementary School, and Palisades Elementary School as 2015 Hawaii Blue Ribbon Schools."
HR157,866134,"Congratulating the 'Iolani High School Team as the 2016 Lifesmarts Hawaii State Champions"
HR158,866354,"2016 State Teacher of the Year and District Teachers of the Year"
HR159,866375,"Congratulating the Winners of the Hawaii: Next 50 Contest."
HR160,866789,"Congratulating Michael Sana as the recipient of the 2015 Milken Educator Award, Wrayna Fairchild as the 2015 Voya Unsung Heroes Award Recipient, Jan Kamiya as the 2015 Public Librarian of the Year, Anna McCormick as the recipient of the 2015 Excellence in Service Award, and Orren Smith, Britnee Akau, Phillip Palmore, and Anna Kimata as recipients of the 2016 Prudential Spririt of Community Award."
HR161,867262,"Perry and Price; KKSK-FM"
HR162,867321,"Honolulu Shriners Hospital for Children; Aloha Shriners"
HR163,867786,"Teach for America-Hawaii's Tenth Anniversary in the State of Hawaii."
HR164,868749,"CONGRATULATING THE WINNERS OF THE HAWAII VENTURE CAPITAL ASSOCIATION'S 16TH ANNUAL AWARDS."
HR165,868701,"RECOGNIZING AND COMMENDING ABENEL ""TIGER"" WONG FOR HIS ACCOMPLISHMENTS AND CONTRIBUTIONS TO THE STATE OF HAWAII."
HR166,869059,"Congratulating the 2015 Hawaii Healthcare Heroes"
HR167,869031,"Nagorno-Karabakh Republic; Honor; Recognition"
HR168,869353,"RECOGNIZING AND COMMENDING DR. ROGER AMES AND DR. GEOFFREY BANNISTER FOR THEIR ACADEMIC ACHIEVEMENTS AND CONTRIBUTIONS TO THE STATE OF HAWAII AND ABROAD."
HR169,869313,"Recognizing The Honorees And Distinguished Finalists Of The Boys And Girls Clubs  State Of Hawaii's 2016 Youth Of The Year Awards."
HR170,869560,"Rockne Freitas Congratulatory Resolution"
HR171,869604,"Recognizing Miki K. Nishizawa On Being Awarded the 2016 Tomorrow's Leaders Award."
HR172,869935,"Recognizing Legacy of Life Hawaii and honoring Steven ""Steve"" Mitsuo Ginoza, Lokelani Martha Yoshimi Kruse, Jonathan Pons and his mother, Elisa Dannals, and their respective families who have selflessly given the gift of life during national donate life month."
HR173,869893,"Recognizing and Commending Waipahu High School for having the first nationally recognized model academies in the State of Hawaii."
HR174,870472,"Recognizing and congratulating the U.S. small business administration's 2016 State of Hawaii awardees"
HR175,870569,"COMMENDING THE KA IWI COALITION FOR SAVING EAST OAHU'S KA IWI COAST."
HR176,876435,"Speaker's Duties; Interim"
HR177,876445,"Adjournment Sine Die"
HCR1,820438,"Recess Days"
HCR2,820101,"State of the State Address"
HCR3,820864,"Request the Auditor to Conduct a Performance Audit of the State's Boards and Commissions and Make Recommendations"
HCR4,820918,"Auditor; Attorney General; Asset Forfeiture Program"
HCR5,825356,"Early Childhood Sexual Abuse Working Group"
HCR6,825362,"Erin's Law Task Force; sexual abuse prevention education"
HCR7,825992,"Auditor; Youth Sports Coach"
HCR8,826031,"Land Easement Resolution; State Submerged Lands"
HCR9,826070,"Certificate of Need Program; Auditor Study"
HCR10,826159,"Transit-Oriented Development; Planned Rail Stations; Community Planning"
HCR11,826748,"Early Settlers of African Ancestry; Hawaiian African Descendants"
HCR12,827038,"Assessment of Farm Worker Housing Needs Working Group"
HCR13,827440,"Sale of the leased fee interest in 41-648 Inoaole Street, Waimanalo, Hawaii, TMK No. 1-4-1-33-187"
HCR14,827523,"Sale of the leased fee interest in 47-394 Keohapa Place, Kaneohe, Hawaii, TMK No. 1-4-7-55-65"
HCR15,827335,"Sale of the leased fee interest in 95-029 Kuahelani Avenue, No. 128, Mililani, Hawaii, TMK No. 1-9-4-5-34-27"
HCR16,827415,"Sale of the leased fee interest in 94-946 Meheula Parkway, No. 264, Mililani, Hawaii, TMK No. 1-9-4-5-34-131"
HCR17,827293,"Authorized BLNR to issue a term, non-exclusive easement"
HCR18,827313,"Authorized BLNR to issue a term, non-exclusive easement"
HCR19,827480,"Authorized BLNR to issue a term, non-exclusive easement"
HCR20,827255,"Authorized BLNR to issue a term, non-exclusive easement"
HCR21,827333,"Authorized BLNR to issue a term, non-exclusive easement"
HCR22,828197,"Hunting; Fishing; Game Resources; Food Security; Sustainability"
HCR23,828318,"WWII Filipino-American Veteran; Transportation and Burial Costs in the Philippines"
HCR24,828430,"Electronic Health Records; Federal Requirements"
HCR25,828440,"Insurance; Nutrition and Lifestyle Programs"
HCR26,828477,"Sister State Relationship; Goa, India"
HCR27,828481,"BLNR; Tax Map Key: (4) 2-6-012"
HCR28,832356,"BLNR; Tax Map Key: (1) 4-6-003"
HCR29,836334,"US Constitutional Amendment; Citizens United"
HCR30,836476,"Resolution Urging the United States to Support the Republic of China's Participation in the Trans-Pacific Partnership"
HCR31,836424,"Federal Detention Center, Honolulu; Hawaii Congressional Delegation"
HCR32,836458,"Firefighters; Cancer; Task Force"
HCR33,836488,"United States Constitutional Amendment; Congressional Delegation; Citizens United"
HCR34,836598,"Animal Quarantine; Department of Agriculture; Decommission"
HCR35,836702,"Ala Wai Canal Project; Feasibility Study; EIS"
HCR36,837493,"Task Force to Recommend Uniform Practices For Body and Dash Camera Implementation within Hawaii Law Enforcement"
HCR37,837345,"Donations of Excess Energy from Photovoltaic Panels."
HCR38,837421,"The Hawaii Employer-Union Health Benefits Trust Fund is requested to review their policies for retirees and its family members."
HCR39,838936,"Task Force to Work Towards Statewide Ahupua'a Boundary Markers"
HCR40,843449,"Air Force; Veterans; Retirees; Funerals; Three-Volley Salutes"
HCR41,843478,"Diwali; Deepavali; Festival of Lights"
HCR42,852908,"Invasive and Endangered Species; Crop Degradation Study"
HCR43,852964,"High School Diploma Program for Adult Learners; State Public Charter School Commission; Working Group"
HCR44,853972,"DWI Court Program; Hawaii Island; Judiciary"
HCR45,855737,"Hawaii State Public Library System; Extended Library Hours"
HCR46,855795,"State Capitol; POW/MIA Flag; Korean War; Vietnam War"
HCR47,855725,"Financial Institutions; Marijuana-Related Businesses; State Bank"
HCR48,855994,"Requesting the Graduate Assistants at the University of Hawaii to Conduct a Confidential Vote Amongst Graduate Assistants."
HCR49,855960,"Supreme Court Justices; Limited Tenure; Constitutional Amendment"
HCR50,855971,"University of Hawaii; National Disaster Preparedness Training Center"
HCR51,857680,"Environmental Study; Safety Assessment; Lanai Airport Base Yard"
HCR52,857887,"Kaanapali Beach Restoration"
HCR53,858508,"Working Group; Retirement"
HCR54,858586,"Encouraging Kamehameha Schools to consider land swaps with DHHL."
HCR55,858618,"Designating President Barack Obama Birthplace Garden and Establishing Working Group to Identify and Dignify the Site."
HCR56,858599,"Wahiawa Center for Community Health; Primary Medical Care Services; Underserved Population"
HCR57,858574,"Body Mass Index; Asian American Residents; Diabetes"
HCR58,858625,"Authorizing term, non-exclusive easement for TMK (2) 4-8-003: Seaward of 006, Olowalu, Lahaina, Maui, Hawaii."
HCR59,859494,"Recognizing aerospace as a strategic and timely growth industry."
HCR60,860174,"Petition for Convention for Purpose of Proposing Amendments to the United States Constitution; Elections; Campaign Financing"
HCR61,860336,"Endorsing and supporting the Ala Wai watershed partnership."
HCR62,860335,"Application for Convention of the States under Article V of the Constitution of the United States."
HCR63,860650,"Requesting a Task Force to Research the Feasibility of Establishing a Mandatory Dispute Resolution Program to Handle Homeowners Associations Disputes"
HCR64,860728,"Supplemental Nutrition Assistance Program; Housing and Urban Development; Section 8"
HCR65,862096,"Sunrise analysis; regulation of certified professional midwives"
HCR66,862086,"Prevent Suicide Hawaii Task Force; Suicide Reduction"
HCR67,862036,"Native Hawaiian Health Care; Federal Funding"
HCR68,862376,"Transitional programs for incarcerated women."
HCR69,862144,"Paid Family Leave; Task Force"
HCR70,862284,"Planned Parenthood"
HCR71,862330,"Military; Child Sexual Abuse; Investigation and Prosecution"
HCR72,862210,"Fish Labeling; Violations; DOH"
HCR73,862311,"Special License Plates"
HCR74,862252,"Department of Education; Heat Abatement; Priority"
HCR75,862391,"Peace Corps Prep Program"
HCR76,862359,"Tuberculosis; Absences from the State; School Attendance"
HCR77,862227,"Resolution To Conduct A Study On The Benefits Of Employing A Luxury Tax In The State."
HCR78,862245,"Department of Education; Pilot Project; Contracts for Services; Students with Disabilities; Block Basis"
HCR79,862321,"Workers' Memorial Day; Workplace Injuries and Fatalities"
HCR80,862180,"Hawaii Emergency Management Agency; Department of Defense; Department of Health; Statewide Emergency Management Simulation Exercise"
HCR81,862199,"Department of Health; Department of Public Safety; Feasibility Study; Hawaii State Hospital's Forensic Unit"
HCR82,862237,"Hawaii State Capitol Fiftieth Anniversary; Task Force"
HCR83,862303,"Working Group on the Elderly"
HCR84,862411,"Tree Landscaping; Public Highways"
HCR85,862403,"Task Force; Legislative Reference Bureau; Study; Effective Incarceration Policies; Hawaii Correctional System"
HCR86,862417,"Constitutional Convention."
HCR87,862416,"Department of Business, Economic Development, and Tourism; Energy Cooperative"
HCR88,862400,"DOT; Designating Honolulu International Airport as Daniel K. Inouye International Airport"
HCR89,862406,"Requesting DBEDT To Analyze the Impacts of Internet Retail on Hawaii's Economy"
HCR90,862412,"Community Paramedic Program; Working Group; Emergency Medical Services"
HCR91,862918,"Tax Review Commission; Piggyback Income Tax; Study"
HCR92,862957,"Maui; Lahaina; Lahaina Bypass; Tourism; Global Positioning System; Car Rental; Road Traffic"
HCR93,862955,"Airline Passenger Seats"
HCR94,862945,"Requesting the Department of Transportation to work with the Department of Transportation Services of the City and County of Honolulu to expedite work on the Department of Transportation's H-1 Corridor Study and complete the study by June 2016, in order to develop recommendations to address the Aiea-Red Hill-Moanalua-Salt Lake congestion and to enable timely funding of critically needed projects."
HCR95,863024,"Kona Coffee; Labeling; Economic Impact Study; UHERO"
HCR96,863021,"Private Sector Retirement Plans; Task Force"
HCR97,863058,"Driving under the influence of marijuana. Testing."
HCR98,862999,"Department of Health; Science Advisory Group"
HCR99,862995,"State Archives; New Building; Department of Accounting and General Services; Comptroller; Library; Library"
HCR100,863027,"Urging DLNR to support hunting."
HCR101,862986,"Community Colleges; Sports League Working Group"
HCR102,863037,"PUC; Study"
HCR103,863018,"Department of Education; Vocational Program; Task Force; Repair and Maintenance"
HCR104,863030,"High School Athletics; Football Leagues"
HCR105,862992,"Kamehameha Highway; Study"
HCR106,862977,"Keiki and Kupuna; Intergenerational Shared Sites"
HCR107,862980,"Medical Marijuana Dispensary Employees Fair Wage"
HCR108,863014,"Keep-Right Driving Law; Enforcement; Education"
HCR109,863061,"Feasibility Study for the Creation of a Structural Licensing Board"
HCR110,863540,"Homelessness; Programs"
HCR111,863442,"Habitual offender registry"
HCR112,863423,"United Nations; Sustainability; Social Justice"
HCR113,863611,"Ewa Beach; Ambulance Station"
HCR114,863576,"Fair Labor Standards Act; Minimum Wage; Overtime Pay; Casual Babysitters; Domestic Service Workers; Essential Home Care Services; Healthcare;"
HCR115,863533,"Capitol Security Plan"
HCR116,863490,"Establishing a Mosquito Control Task Force to identify and recommend measures to control and eliminate mosquito breeding sites throughout the state, particularly with regard to water catchment systems."
HCR117,863375,"Requesting the Auditor to conduct a sunrise analysis on the statutory establishment of flagger certification and training requirements for individuals to provide temporary traffic control in a street, road, or highway."
HCR118,863387,"Governor; Legislature; Congressional Delegation; Wahiawa General Hospital; Solvency"
HCR119,863552,"Taxation; General Excise Tax; Sublease Deduction; Transient Accommodations; Tax Review Commission."
HCR120,863400,"Department of Taxation; E-fairness"
HCR121,863436,"Legacy Tree Reso"
HCR122,863558,"Statewide Rare Disease Task Force"
HCR123,863846,"Taiwan; Endorsement of Taiwan's Participation in International Organizations"
HCR124,863865,"Auditor; Study; Responsible Special Education Funding; Department of Education"
HCR125,863802,"Public Housing; Smoking; Violations"
HCR126,863872,"Public Utilities Commission; Regulatory Structure; Electric Utilities"
HCR127,863670,"Impact on State Government of Decriminalization of Illegal Possession of Drugs; Study"
HCR128,863860,"Artist Relocation Program Study; Art; Culture"
HCR129,863716,"June 27, 2016, Post-Traumatic Stress Awareness Day"
HCR130,863782,"Kauai Veterans Memorial Highway"
HCR131,863702,"Papahanaumokuakea Marine National Monument"
HCR132,863688,"State-Province Affiliation; Aklan Province"
HCR133,863777,"After-School Programs"
HCR134,863890,"Public Charter Schools; Per-Pupil Funding; Study; Legislative Reference Bureau"
HCR135,863806,"DCCA Health Care Task Force"
HCR136,863871,"Discrimination; Women; State; Counties"
HCR137,863673,"After-School Programs"
HCR138,863724,"Medical Marijuana; Administrative Rules"
HCR139,863615,"University Hospital; West Hawaii"
HCR140,863633,"Sepsis; Septicemia; Department of Health; Baseline; Report"
HCR141,863619,"Sepsis Awareness Month; Hawaii Sepsis Day"
HCR142,863683,"Sepsis; Septicemia; Sepsis Best Practice Group; Department of Health; Report"
HCR143,863642,"Transfer of the Licensing and Regulation Program for Private Trade, Vocational, and Technical Schools; Department of Education; University of Hawaii; Auditor; Sunrise Review and Feasibility Study"
HCR144,863752,"Insurance; Regulation of Insurance Appraisers; Regulation of Insurance Umpires"
HCR145,863845,"Task Force; Foster Parents"
HCR146,863753,"Keaukaha Elementary School"
HCR147,863843,"Firearm Permits and Registration; Satellite Locations"
HCR148,863671,"Education; Statewide Suicide Prevention Program"
HCR149,863809,"Sunrise Analysis; Sexually Transmitted Disease Screenings"
HCR150,863878,"Department of Education; Civil Rights Compliance Office; Audit"
HCR151,863666,"Resolution Supporting Access to Debt-Free Higher Education"
HCR152,863852,"Dispute Resolution; Condominiums; Study"
HCR153,863625,"Adult Education; Seniors; Service Delivery; Working Group"
HCR154,863812,Judges
HCR155,863663,"Business Mitigation Relief Program; Rail Construction"
HCR156,863861,"Prenatal Health Care Disclosure"
HCR157,863891,"Accountable Care Organizations; Direct Primary Care; Concierge Medicine; Insurance Division"
HCR158,863900,"Hawaii as TPP Headquarters; Trade Agreements; Asia Pacific Region; APEC"
HCR159,863881,Urging
HCR160,863727,"DLNR; DOBAR; Kailua Bay"
HCR161,863804,"Senator Gilbert Kahele Monument; DLNR"
HCR162,863835,"Waipio Valley; Collaborative Stewardship; Preservation"
HCR163,863895,"Task Force; Cesspools; Septic Systems; Graywater Systems"
HCR164,863888,"Zika Virus"
HCR165,863795,"University of Hawaii at Hilo; Daniel K. Inouye College of Pharmacy; Psychopharmacology Program"
HCR166,863725,"Department of Education; Comprehensive Report; Public School Funding"
HCR167,863634,"State Capitol; Water Dispensers"
HCR168,863798,"DOE; STEM; STEAM; Arts Education"
HCR169,863710,"Department of Transportation; Leeward Bikeway"
HCR170,863665,"ERS; Fossil Fuels; Sustainability; Renewable Energy; Investment"
HCR171,863729,"Water Taxi; Funding; Iroquois Point; Pearl Harbor Channel"
HCR172,863637,"Veterans memorial in Oneula Beach Park"
HCR173,863762,"Planning and permitting efficiency."
HCR174,863696,"Requesting The Department Of Transportation, Department Of Accounting And General Services, And The University of Hawaii To Create A Traffic Mitigation Plan For The Leeward and Central Area Of Oahu."
HCR175,863880,"Urging the Department of Transportation to consider extending the Zipperlane to Kapolei in the vicinity of Kualakai Parkway and the Makakilo on-ramp at Exit 1B and opening a shoulder lane from Kapolei to Waipahu as traffic mitigation measures for West Oahu commuters."
HCR176,863765,"Urging the Department of Transportation Services of the City and County of Honolulu to work in partnership with SSFM International to implement the traffic safety recommendations identified in the Kupuna Loop Sub-Area Corridor Study and to repave all roadways in the Kunia and Village Park area."
HCR177,863719,"Urging the United States Congress to enact legislation requiring all new vehicles manufactured in the United States to be equipped with anti-crash technology."
HCR178,863833,"PUEO HABITAT AREAS"
HCR179,863712,Pesticides
HCR180,863766,"Department of Education; Overcrowding; Public Schools; Kapolei, Ewa, and Waipahu"
HCR181,863643,"Easement; State Submerged Lands; Puamana, Lahaina, Maui"
HCR182,863638,"Chip and PIN Cards; Chip-and-PIN Cards; Electronic Payment; Credit Cards; Debit Cards; Security"
HCR183,863770,"Makua Valley; Military"
HCR184,863662,"University of Hawaii, West Oahu; State Procurement Office"
HCR185,863779,"Intra-island Ferry; Leeward Coast Ferry; Waianae Small Boat Harbor"
HCR186,863877,"Waianae Baseline Environmental Study"
HCR187,863857,"Environmental Justice Guidance Document; Office of Environmental Quality Control"
HCR188,863682,"Public Land Trust Revenues Negotiating Committee"
HCR189,863814,"Urging the State Department of Transportation, as well as the Department of Transportation Services of the City and County of Honolulu, Department of Public Works of the County of Hawaii, Department of Transportation of the County of Maui, and Department of Public Works of the County of Kauai,"
HCR190,863793,"Hawaiian Language; Education"
HCR191,863705,"Kama'aina Homecoming Commission"
HCR192,863783,"Spitting Caves; Ban on Jumping and Diving"
HCR193,863800,"Hawaiian Electric Company; Reduced Rate for Schools"
HCR194,863853,"State Capitol Management Committee; Master Security Plan"
HCR195,863736,"State Capitol Reflecting Pools; Department of Accounting and General Services; Water Fountains"
HCR196,863819,"Procurement; Review"
HCR197,863859,"Plant Quarantine Branch; Legislative Reference Bureau"
HCR198,863838,"Plant Quarantine Branch; Office of the Auditor"
HCR199,863842,"Transportation; Omaopio Road; Kula Highway; Traffic Light"
HCR200,863911,"Reentry Commission Skills Training Program."
HCR201,863912,"Department of Accounting and General Services; Repair and Maintenance; Priorities; Report"
HCR202,863748,"Health; Pesticide Drift"
HCR203,863787,"Agricultural Commerce; Enclosed Country Stores"
HCR204,863690,"Native Hawaiians; Kamehameha Schools"
HCR205,863720,"REDUCE STANDARDIZED TESTING IN PUBLIC EDUCATION SYSTEM."
HCR206,863823,"REQUESTING THE BOE TO ABOLISH HIGH STAKES TEACHER EVALUATIONS"
HCR207,873290,"Appointment of Auditor, LRB Director, Ombudsman"
SB1,805777,"Research Corporation of the University of Hawaii; Procurement Exemption"
SB3,805403,"Boards and Commissions; Absences; Vacancies"
SB4,805027,"Special Purpose Revenue Bonds; Chaminade University of Honolulu ($)"
SB5,803027,"Professions and Vocations; Licensure; Unions; Classes; Licensees"
SB6,806808,"Hawaii Public Procurement Code; Small Purchases; Construction; Drilling Work; Soil Testing"
SB7,806183,"Process Server; Assault in the Second Degree; Criminal Trespass"
SB8,803602,"Ethics; Standards of Conduct; Public Employees; Gifts"
SB9,806286,"Public Agency Meetings; Legislature"
SB10,804558,"Diamond Head Seawall; Appropriation ($)"
SB11,806349,"Firearms; Registration; Waiting Period"
SB12,806328,"Small Business Regulatory Review Board; Department of Business, Economic Development, and Tourism; Line Item; Budget"
SB13,805522,"School Psychologist; Registration; Study"
SB15,805076,"Mortgage Foreclosures; Judicial Foreclosure; Mandatory Dispute Resolution; Mediation; Appropriation ($)"
SB16,804253,"Towing; Vehicle Owner; Hooked Up; Scene; Towing Company"
SB18,805462,"Electronic Smoking Device; Smoking; Prohibition"
SB19,804611,"Public Transit; County Surcharge on State Tax"
SB20,805727,"Motor Vehicle Driver Licensing and Permitting; Limited Purpose Licensing and Permitting; REAL ID Act of 2005; Acceptable Forms of Identification and Proof of State Residency"
SB21,804235,"Campaign Spending"
SB22,807519,Courts
SB23,806252,Crime
SB24,807121,Elections
SB25,803406,"Employees Retirement System"
SB26,803111,Government
SB27,804007,"Information Practices"
SB28,807004,Judiciary
SB29,806277,Labor
SB30,805105,"Penal Code"
SB31,803613,"Sunshine Law"
SB32,803196,"Unemployment Insurance"
SB33,805836,"Workers' Compensation"
SB34,807220,"Business Regulation"
SB35,802955,Commerce
SB36,805015,Condominiums
SB37,805537,"Consumer Protection"
SB38,807363,"Financial Institutions"
SB39,805052,Insurance
SB41,803545,"Professions and Vocations"
SB42,803701,"Public Utilities"
SB43,806304,Telecommunications
SB44,806510,"Queen Liliuokalani Statue; Eternal Flame Memorial; Memorial Mall; Hawaii State Capitol; Working Group; Hawaiian Rulers"
SB45,805349,"Hawaiian Affairs"
SB46,804357,"Hawaiian Affairs"
SB47,805373,Education
SB48,805885,Libraries
SB49,806718,Teachers
SB50,803860,"Professional Medical Discretion; State Employees"
SB51,804687,"Strokes; Coalition; Database"
SB52,804747,Health
SB53,805174,Economy
SB54,803140,Economy
SB55,803533,Technology
SB56,806967,"Land Use"
SB57,803662,"Ocean Resource Management"
SB58,807500,"Water Use"
SB59,805946,"Hawaii Tourism Authority"
SB60,806798,"International Affairs"
SB61,803432,Tourism
SB62,806683,Homelessness
SB63,803540,Housing
SB65,807467,Arts
SB66,803801,"Higher Education"
SB67,805816,"University of Hawaii"
SB68,805644,Procurement
SB69,803531,"State Facilities"
SB70,805854,"State and Government Operations and Policy"
SB71,805350,"Aerospace Development"
SB72,805921,"Emergency Preparedness"
SB73,805541,"Corrections; Committed Persons; Sale of Crafts; Correctional Industries Program; Correctional Industries Revolving Fund"
SB74,806530,Energy
SB75,807112,"Hawaii Battery Storage Recycling Task Force"
SB76,807269,Environment
SB77,804272,Agriculture
SB78,806476,Agriculture
SB79,807174,Agriculture
SB80,805580,"Transportation; General Obligation Bonds; West Loch Villages; Appropriation ($)"
SB81,807418,Transportation
SB82,805748,Transportation
SB83,805044,"University of Hawaii Intercollegiate Athletics Program; Tourism Special Fund Appropriation ($)"
SB84,806739,Appropriations
SB85,802869,Appropriations
SB86,807172,Bonds
SB87,804094,Budget
SB88,803411,Finances
SB89,806916,Funds
SB90,806905,Funds
SB91,804598,Revenue
SB93,803992,Taxation
SB94,804274,Taxation
SB95,806276,"Firearms; Concealed Carry License"
