bill_id,date,action
95500,2010-01-13,"Introduced In House - Assigned to Transportation & Energy + Appropriations"
95500,2010-02-05,"House Committee on Transportation & Energy Refer Amended to Appropriations"
95500,2010-02-09,"House Committee on Appropriations Refer Amended to House Committee of the Whole"
95500,2010-02-11,"House Second Reading Passed with Amendments"
95500,2010-02-12,"House Third Reading Passed"
95500,2010-02-16,"Introduced In Senate - Assigned to Local Government and Energy + Appropriations"
95500,2010-03-02,"Senate Committee on Local Government and Energy Refer Unamended to Appropriations"
95500,2010-03-04,"Senate Committee on Appropriations Refer Amended to Senate Committee of the Whole"
95500,2010-03-04,"Senate Second Reading Special Order - Passed with Amendments"
95500,2010-03-05,"Senate Third Reading Passed"
95500,2010-03-08,"House Considered Senate Amendments - Result was to Concur - Repass"
95500,2010-03-18,"Signed by the Speaker of the House"
95500,2010-03-22,"Signed by the President of the Senate"
95500,2010-03-22,"Sent to the Governor"
95500,2010-03-22,"Governor Action - Signed"
95501,2010-01-13,"Introduced In House - Assigned to Finance + Appropriations"
95501,2010-01-20,"House Committee on Finance Refer Unamended to Appropriations"
95501,2010-02-05,"House Committee on Appropriations Refer Unamended to House Committee of the Whole"
95501,2010-02-10,"House Second Reading Passed"
95501,2010-02-11,"House Third Reading Laid Over Daily"
95501,2010-02-12,"House Third Reading Passed"
95501,2010-02-17,"Introduced In Senate - Assigned to Finance"
95501,2010-03-02,"Senate Committee on Finance Refer Unamended to Senate Committee of the Whole"
95501,2010-03-05,"Senate Second Reading Laid Over Daily"
95501,2010-03-11,"Senate Second Reading Passed"
95501,2010-03-12,"Senate Third Reading Passed"
95501,2010-03-22,"Signed by the Speaker of the House"
95501,2010-03-25,"Signed by the President of the Senate"
95501,2010-03-25,"Sent to the Governor"
95501,2010-04-05,"Governor Action - Signed"
95502,2010-01-13,"Introduced In House - Assigned to Business Affairs and Labor"
95502,2010-01-27,"House Committee on Business Affairs and Labor Refer Unamended to House Committee of the Whole"
95502,2010-02-01,"House Second Reading Laid Over to 02/03/2010"
95502,2010-02-03,"House Second Reading Passed"
95502,2010-02-04,"House Third Reading Passed"
95502,2010-02-09,"Introduced In Senate - Assigned to Business, Labor and Technology"
95502,2010-03-01,"Senate Committee on Business, Labor and Technology Refer Unamended - Consent Calendar to Senate Committee of the Whole"
95502,2010-03-05,"Senate Second Reading Laid Over Daily"
95502,2010-03-12,"Senate Second Reading Passed"
95502,2010-03-15,"Senate Third Reading Passed"
95502,2010-03-22,"Signed by the Speaker of the House"
95502,2010-03-25,"Signed by the President of the Senate"
95502,2010-03-25,"Sent to the Governor"
95502,2010-04-05,"Governor Action - Signed"
95503,2010-01-13,"Introduced In House - Assigned to Health and Human Services"
95503,2010-02-01,"House Committee on Health and Human Services Refer Amended to House Committee of the Whole"
95503,2010-02-04,"House Second Reading Passed with Amendments"
95503,2010-02-05,"House Third Reading Laid Over Daily"
95503,2010-02-08,"House Third Reading Passed"
95503,2010-02-09,"Introduced In Senate - Assigned to Health and Human Services"
95503,2010-03-17,"Senate Committee on Health and Human Services Refer Amended to Senate Committee of the Whole"
95503,2010-03-22,"Senate Second Reading Laid Over Daily"
95503,2010-03-25,"Senate Second Reading Passed with Amendments"
95503,2010-03-26,"Senate Third Reading Passed"
95503,2010-03-31,"House Considered Senate Amendments - Result was to Laid Over Daily"
95503,2010-04-01,"House Considered Senate Amendments - Result was to Concur - Repass"
95503,2010-04-16,"Signed by the Speaker of the House"
95503,2010-04-19,"Signed by the President of the Senate"
95503,2010-04-19,"Sent to the Governor"
95503,2010-04-20,"Governor Action - Signed"
95504,2010-01-13,"Introduced In House - Assigned to Health and Human Services + Appropriations"
95504,2010-02-04,"House Committee on Health and Human Services Refer Unamended to Appropriations"
95504,2010-04-09,"House Committee on Appropriations Refer Amended to House Committee of the Whole"
95504,2010-04-13,"House Second Reading Passed with Amendments"
95504,2010-04-14,"House Third Reading Passed"
95504,2010-04-19,"Introduced In Senate - Assigned to Health and Human Services + Appropriations"
95504,2010-04-22,"Senate Committee on Health and Human Services Refer Unamended to Appropriations"
95504,2010-04-30,"Senate Committee on Appropriations Refer Unamended to Senate Committee of the Whole"
95504,2010-04-30,"Senate Second Reading Special Order - Passed with Amendments"
95504,2010-05-03,"Senate Third Reading Passed"
95504,2010-05-04,"House Considered Senate Amendments - Result was to Concur - Repass"
95504,2010-05-25,"Signed by the President of the Senate"
95504,2010-05-25,"Signed by the Speaker of the House"
95504,2010-05-25,"Sent to the Governor"
95504,2010-06-07,"Governor Action - Signed"
95505,2010-01-13,"Introduced In House - Assigned to Agriculture, Livestock, & Natural Resources + Appropriations"
95505,2010-01-26,"House Committee on Agriculture, Livestock, & Natural Resources Refer Amended to Appropriations"
95505,2010-02-12,"House Committee on Appropriations Postpone Indefinitely"
95506,2010-01-13,"Introduced In House - Assigned to State, Veterans, & Military Affairs"
95506,2010-02-04,"House Committee on State, Veterans, & Military Affairs Refer Amended to House Committee of the Whole"
95506,2010-02-12,"House Second Reading Laid Over to 02/17/2010"
95506,2010-02-17,"House Second Reading Passed with Amendments"
95506,2010-02-18,"House Third Reading Passed"
95506,2010-02-19,"Introduced In Senate - Assigned to Local Government and Energy"
95506,2010-03-09,"Senate Committee on Local Government and Energy Refer Unamended - Consent Calendar to Senate Committee of the Whole"
95506,2010-03-12,"Senate Second Reading Passed"
95506,2010-03-15,"Senate Third Reading Passed"
95506,2010-03-22,"Signed by the Speaker of the House"
95506,2010-03-25,"Signed by the President of the Senate"
95506,2010-03-25,"Sent to the Governor"
95506,2010-04-05,"Governor Action - Signed"
95507,2010-01-13,"Introduced In House - Assigned to Health and Human Services"
95507,2010-02-04,"House Committee on Health and Human Services Refer Amended to House Committee of the Whole"
95507,2010-02-10,"House Second Reading Laid Over Daily"
95507,2010-02-12,"House Second Reading Special Order - Laid Over to 02/17/2010"
95507,2010-02-17,"House Second Reading Special Order - Passed with Amendments"
95507,2010-02-18,"House Third Reading Passed"
95507,2010-02-19,"Introduced In Senate - Assigned to Health and Human Services"
95507,2010-03-04,"Senate Committee on Health and Human Services Refer Amended to Senate Committee of the Whole"
95507,2010-03-09,"Senate Second Reading Laid Over Daily"
95507,2010-03-15,"Senate Second Reading Passed with Amendments"
95507,2010-03-16,"Senate Third Reading Passed"
95507,2010-03-17,"House Considered Senate Amendments - Result was to Lay Over"
95507,2010-03-19,"House Considered Senate Amendments - Result was to Concur - Repass"
95507,2010-03-25,"Signed by the President of the Senate"
95507,2010-03-25,"Signed by the Speaker of the House"
95507,2010-03-25,"Sent to the Governor"
95507,2010-03-29,"Governor Action - Signed"
95508,2010-01-13,"Introduced In House - Assigned to Judiciary"
95508,2010-02-04,"House Committee on Judiciary Refer Amended to House Committee of the Whole"
95508,2010-02-10,"House Second Reading Laid Over Daily"
95508,2010-03-08,"House Second Reading Passed with Amendments"
95508,2010-03-09,"House Third Reading Passed"
95508,2010-03-11,"Introduced In Senate - Assigned to Judiciary"
95508,2010-03-31,"Senate Committee on Judiciary Refer Unamended to Senate Committee of the Whole"
95508,2010-04-27,"Senate Second Reading Laid Over to 04/30/2010"
95508,2010-04-30,"Senate Second Reading Laid Over to 05/07/2010"
95508,2010-05-07,"Senate Second Reading Laid Over Daily"
95508,2010-05-10,"Senate Second Reading Passed with Amendments"
95508,2010-05-11,"Senate Third Reading Passed"
95508,2010-05-12,"House Considered Senate Amendments - Result was to Concur - Repass"
95508,2010-05-25,"Signed by the President of the Senate"
95508,2010-05-25,"Signed by the Speaker of the House"
95508,2010-05-25,"Sent to the Governor"
95508,2010-05-26,"Governor Action - Signed"
95509,2010-01-13,"Introduced In House - Assigned to State, Veterans, & Military Affairs"
95509,2010-01-21,"House Committee on State, Veterans, & Military Affairs Refer Amended to House Committee of the Whole"
95509,2010-01-26,"House Second Reading Laid Over Daily"
95509,2010-01-28,"House Second Reading Passed with Amendments"
95509,2010-01-29,"House Third Reading Passed"
95509,2010-02-04,"Introduced In Senate - Assigned to State, Veterans & Military Affairs + Appropriations"
95509,2010-03-01,"Senate Committee on State, Veterans & Military Affairs Refer Amended to Appropriations"
95509,2010-03-05,"Senate Committee on Appropriations Refer Unamended to Senate Committee of the Whole"
95509,2010-03-09,"Senate Second Reading Laid Over Daily"
95509,2010-03-19,"Senate Second Reading Passed with Amendments"
95509,2010-03-22,"Senate Third Reading Passed"
95509,2010-03-24,"House Considered Senate Amendments - Result was to Laid Over Daily"
95509,2010-03-26,"House Considered Senate Amendments - Result was to Concur - Repass"
95509,2010-04-08,"Signed by the President of the Senate"
95509,2010-04-08,"Signed by the Speaker of the House"
95509,2010-04-08,"Sent to the Governor"
95509,2010-04-15,"Governor Action - Signed"
95510,2010-01-13,"Introduced In House - Assigned to Finance"
95510,2010-02-03,"House Committee on Finance Refer Amended to House Committee of the Whole"
95510,2010-02-08,"House Second Reading Laid Over to 02/10/2010"
95510,2010-02-10,"House Second Reading Passed with Amendments"
95510,2010-02-11,"House Third Reading Laid Over Daily"
95510,2010-02-12,"House Third Reading Passed"
95510,2010-02-17,"Introduced In Senate - Assigned to Finance + Appropriations"
95510,2010-03-09,"Senate Committee on Finance Refer Unamended to Appropriations"
95510,2010-03-19,"Senate Committee on Appropriations Refer Unamended - Consent Calendar to Senate Committee of the Whole"
95510,2010-03-23,"Senate Second Reading Passed"
95510,2010-03-25,"Senate Third Reading Passed"
95510,2010-04-08,"Signed by the President of the Senate"
95510,2010-04-08,"Signed by the Speaker of the House"
95510,2010-04-09,"Sent to the Governor"
95510,2010-04-15,"Governor Action - Signed"
95511,2010-01-13,"Introduced In House - Assigned to Judiciary + Appropriations"
95511,2010-02-11,"House Committee on Judiciary Refer Amended to Appropriations"
95511,2010-02-26,"House Committee on Appropriations Refer Amended to House Committee of the Whole"
95511,2010-03-02,"House Second Reading Laid Over to 03/05/2010"
95511,2010-03-05,"House Second Reading Passed with Amendments"
95511,2010-03-08,"House Third Reading Passed"
95511,2010-03-11,"Introduced In Senate - Assigned to Judiciary"
95511,2010-03-31,"Senate Committee on Judiciary Witness Testimony and/or Committee Discussion Only"
95511,2010-05-05,"Senate Committee on Judiciary Postpone Indefinitely"
95512,2010-01-13,"Introduced In House - Assigned to Education + Appropriations"
95512,2010-02-04,"House Committee on Education Refer Unamended to Appropriations"
95512,2010-04-09,"House Committee on Appropriations Refer Amended to House Committee of the Whole"
95512,2010-04-13,"House Second Reading Laid Over to 04/15/2010"
95512,2010-04-15,"House Second Reading Passed with Amendments"
95512,2010-04-16,"House Third Reading Passed"
95512,2010-04-19,"Introduced In Senate - Assigned to Education + Appropriations"
95512,2010-05-05,"Senate Committee on Education Refer Unamended to Appropriations"
95512,2010-05-07,"Senate Committee on Appropriations Refer Unamended to Senate Committee of the Whole"
95512,2010-05-11,"Senate Second Reading Passed with Amendments"
95512,2010-05-12,"House Considered Senate Amendments - Result was to Concur - Repass"
95512,2010-05-12,"Senate Third Reading Passed"
95512,2010-05-27,"Signed by the Speaker of the House"
95512,2010-06-01,"Signed by the President of the Senate"
95512,2010-06-01,"Sent to the Governor"
95512,2010-06-10,"Governor Action - Signed"
95513,2010-01-13,"Introduced In House - Assigned to Transportation & Energy"
95513,2010-01-21,"House Committee on Transportation & Energy Refer Unamended to House Committee of the Whole"
95513,2010-01-26,"House Second Reading Laid Over Daily"
95513,2010-02-03,"House Second Reading Passed with Amendments"
95513,2010-02-04,"House Third Reading Passed"
95513,2010-02-09,"Introduced In Senate - Assigned to Transportation"
95513,2010-02-18,"Senate Committee on Transportation Refer Unamended - Consent Calendar to Senate Committee of the Whole"
95513,2010-02-23,"Senate Second Reading Laid Over Daily"
95513,2010-02-24,"Senate Second Reading Passed"
95513,2010-02-25,"Senate Third Reading Laid Over Daily"
95513,2010-02-26,"Senate Third Reading Passed"
95513,2010-03-05,"Signed by the Speaker of the House"
95513,2010-03-08,"Signed by the President of the Senate"
95513,2010-03-08,"Sent to the Governor"
95513,2010-03-18,"Governor Action - Signed"
95514,2010-01-13,"Introduced In House - Assigned to Education"
95514,2010-02-11,"House Committee on Education Postpone Indefinitely"
95515,2010-01-13,"Introduced In House - Assigned to Business Affairs and Labor"
95515,2010-01-27,"House Committee on Business Affairs and Labor Refer Unamended to House Committee of the Whole"
95515,2010-02-01,"House Second Reading Laid Over to 02/03/2010"
95515,2010-02-03,"House Second Reading Passed"
95515,2010-02-04,"House Third Reading Passed"
95515,2010-02-09,"Introduced In Senate - Assigned to Business, Labor and Technology"
95515,2010-03-09,"Senate Committee on Business, Labor and Technology Refer Unamended - Consent Calendar to Senate Committee of the Whole"
95515,2010-03-12,"Senate Second Reading Passed"
95515,2010-03-15,"Senate Third Reading Passed"
95515,2010-03-22,"Signed by the Speaker of the House"
95515,2010-03-25,"Signed by the President of the Senate"
95515,2010-03-25,"Sent to the Governor"
95515,2010-04-05,"Governor Action - Signed"
95516,2010-01-13,"Introduced In House - Assigned to Local Government"
95516,2010-02-23,"House Committee on Local Government Refer Amended to House Committee of the Whole"
95516,2010-02-26,"House Second Reading Passed with Amendments"
95516,2010-03-01,"House Third Reading Passed"
95516,2010-03-11,"Introduced In Senate - Assigned to Health and Human Services"
95516,2010-03-18,"Senate Committee on Health and Human Services Refer Unamended to Senate Committee of the Whole"
95516,2010-03-23,"Senate Second Reading Laid Over Daily"
95516,2010-04-01,"Senate Second Reading Passed with Amendments"
95516,2010-04-05,"Senate Third Reading Passed"
95516,2010-04-07,"House Considered Senate Amendments - Result was to Laid Over Daily"
95516,2010-04-07,"House Considered Senate Amendments - Result was to Concur - Repass"
95516,2010-04-28,"Signed by the Speaker of the House"
95516,2010-04-30,"Signed by the President of the Senate"
95516,2010-04-30,"Sent to the Governor"
95516,2010-05-06,"Governor Action - Signed"
95517,2010-01-13,"Introduced In House - Assigned to Transportation & Energy + Appropriations"
95517,2010-02-02,"House Committee on Transportation & Energy Refer Amended to Appropriations"
95517,2010-03-19,"House Committee on Appropriations Refer Amended to House Committee of the Whole"
95517,2010-03-19,"House Second Reading Special Order - Laid Over Daily"
95517,2010-03-22,"House Second Reading Special Order - Passed with Amendments"
95517,2010-03-23,"House Third Reading Passed"
95517,2010-03-26,"Introduced In Senate - Assigned to Transportation + Finance"
95517,2010-04-13,"Senate Committee on Transportation Refer Amended to Finance"
95517,2010-04-27,"Senate Committee on Finance Refer Unamended to Senate Committee of the Whole"
95517,2010-04-30,"Senate Second Reading Laid Over Daily"
95517,2010-05-03,"Senate Second Reading Passed with Amendments"
95517,2010-05-04,"Senate Third Reading Reconsidered"
95517,2010-05-04,"Senate Third Reading Passed with Amendments"
95517,2010-05-04,"Senate Third Reading Passed with Amendments"
95517,2010-05-06,"House Considered Senate Amendments - Result was to Laid Over Daily"
95517,2010-05-06,"House Considered Senate Amendments - Result was to Concur - Repass"
95517,2010-05-25,"Signed by the President of the Senate"
95517,2010-05-25,"Signed by the Speaker of the House"
95517,2010-05-25,"Sent to the Governor"
95517,2010-06-10,"Governor Action - Signed"
95518,2010-01-13,"Introduced In House - Assigned to Transportation & Energy + Appropriations"
95518,2010-02-23,"House Committee on Transportation & Energy Refer Amended to Appropriations"
95518,2010-04-16,"House Committee on Appropriations Refer Amended to House Committee of the Whole"
95518,2010-04-20,"House Second Reading Laid Over Daily"
95518,2010-04-23,"House Second Reading Passed with Amendments"
95518,2010-04-26,"House Third Reading Passed"
95518,2010-04-27,"Introduced In Senate - Assigned to Transportation + Appropriations"
95518,2010-05-04,"Senate Committee on Transportation Refer Amended to Appropriations"
95518,2010-05-06,"Senate Committee on Appropriations Refer Amended to Senate Committee of the Whole"
95518,2010-05-10,"Senate Second Reading Passed with Amendments"
95518,2010-05-11,"Senate Third Reading Passed"
95518,2010-05-12,"House Considered Senate Amendments - Result was to Concur - Repass"
95518,2010-05-27,"Signed by the Speaker of the House"
95518,2010-06-01,"Signed by the President of the Senate"
95518,2010-06-01,"Sent to the Governor"
95518,2010-06-10,"Governor Action - Signed"
95519,2010-01-13,"Introduced In House - Assigned to State, Veterans, & Military Affairs + Appropriations"
95519,2010-01-28,"House Committee on State, Veterans, & Military Affairs Refer Unamended to Appropriations"
95519,2010-03-05,"House Committee on Appropriations Refer Amended to House Committee of the Whole"
95519,2010-03-09,"House Second Reading Laid Over Daily"
95519,2010-03-10,"House Second Reading Passed with Amendments"
95519,2010-03-11,"House Third Reading Passed"
95519,2010-03-15,"Introduced In Senate - Assigned to State, Veterans & Military Affairs"
95519,2010-03-29,"Senate Committee on State, Veterans & Military Affairs Refer Unamended - Consent Calendar to Senate Committee of the Whole"
95519,2010-04-01,"Senate Second Reading Passed"
95519,2010-04-05,"Senate Third Reading Passed"
95519,2010-04-07,"Signed by the Speaker of the House"
95519,2010-04-08,"Signed by the President of the Senate"
95519,2010-04-08,"Sent to the Governor"
95519,2010-04-15,"Governor Action - Signed"
95520,2010-01-13,"Introduced In House - Assigned to Business Affairs and Labor"
95520,2010-02-03,"House Committee on Business Affairs and Labor Refer Amended to House Committee of the Whole"
95520,2010-02-19,"House Second Reading Laid Over Daily"
95520,2010-02-22,"House Second Reading Passed with Amendments"
95520,2010-02-23,"House Third Reading Passed"
95520,2010-02-26,"Introduced In Senate - Assigned to Business, Labor and Technology"
95520,2010-03-03,"Senate Committee on Business, Labor and Technology Refer Amended to Senate Committee of the Whole"
95520,2010-03-08,"Senate Second Reading Laid Over to 03/11/2010"
95520,2010-03-11,"Senate Second Reading Passed with Amendments"
95520,2010-03-12,"Senate Third Reading Passed with Amendments"
95520,2010-03-16,"House Considered Senate Amendments - Result was to Laid Over Daily"
95520,2010-03-18,"House Considered Senate Amendments - Result was to Laid Over Daily"
95520,2010-03-19,"House Considered Senate Amendments - Result was to Laid Over Daily"
95520,2010-03-26,"House Considered Senate Amendments - Result was to Not Concur - Request Conference Committee"
95520,2010-04-19,"First Conference Committee Result was to Adopt Rerevised w/ Amendments"
95520,2010-04-22,"Senate Consideration of First Conference Committee Report result was to Adopt Committee Report - Repass"
95520,2010-05-04,"House Consideration of First Conference Committee Report result was to Adopt Committee Report - Repass"
95520,2010-05-25,"Signed by the President of the Senate"
95520,2010-05-25,"Signed by the Speaker of the House"
95520,2010-05-25,"Sent to the Governor"
95520,2010-05-26,"Governor Action - Signed"
95521,2010-01-13,"Introduced In House - Assigned to Health and Human Services + Appropriations"
95521,2010-02-11,"House Committee on Health and Human Services Refer Amended to Appropriations"
95521,2010-04-16,"House Committee on Appropriations Refer Amended to House Committee of the Whole"
95521,2010-04-20,"House Second Reading Passed with Amendments"
95521,2010-04-22,"House Third Reading Passed"
95521,2010-04-23,"Introduced In Senate - Assigned to Health and Human Services + Appropriations"
95521,2010-04-28,"Senate Committee on Health and Human Services Refer Unamended to Appropriations"
95521,2010-05-04,"Senate Committee on Appropriations Refer Unamended to Senate Committee of the Whole"
95521,2010-05-06,"Senate Second Reading Laid Over Daily"
95521,2010-05-07,"Senate Second Reading Passed"
95521,2010-05-10,"Senate Third Reading Passed"
95521,2010-05-25,"Signed by the President of the Senate"
95521,2010-05-25,"Signed by the Speaker of the House"
95521,2010-05-25,"Sent to the Governor"
95521,2010-06-10,"Governor Action - Signed"
95522,2010-01-13,"Introduced In House - Assigned to Judiciary"
95522,2010-01-28,"House Committee on Judiciary Refer Amended to House Committee of the Whole"
95522,2010-02-03,"House Second Reading Laid Over Daily"
95522,2010-02-04,"House Second Reading Passed with Amendments"
95522,2010-02-05,"House Third Reading Laid Over Daily"
95522,2010-02-08,"House Third Reading Passed"
95522,2010-02-09,"Introduced In Senate - Assigned to Judiciary"
95522,2010-03-01,"Senate Committee on Judiciary Refer Unamended to Senate Committee of the Whole"
95522,2010-03-04,"Senate Second Reading Laid Over Daily"
95522,2010-03-08,"Senate Second Reading Passed"
95522,2010-03-09,"Senate Third Reading Passed"
95522,2010-03-15,"Signed by the Speaker of the House"
95522,2010-03-18,"Signed by the President of the Senate"
95522,2010-03-18,"Sent to the Governor"
95522,2010-03-29,"Governor Action - Signed"
95523,2010-01-13,"Introduced In House - Assigned to Health and Human Services"
95523,2010-02-04,"House Committee on Health and Human Services Refer Amended to House Committee of the Whole"
95523,2010-02-12,"House Second Reading Laid Over to 02/17/2010"
95523,2010-02-17,"House Second Reading Special Order - Passed with Amendments"
95523,2010-02-18,"House Third Reading Passed"
95523,2010-02-19,"Introduced In Senate - Assigned to Health and Human Services"
95523,2010-03-11,"Senate Committee on Health and Human Services Refer Amended - Consent Calendar to Senate Committee of the Whole"
95523,2010-03-16,"Senate Second Reading Passed with Amendments"
95523,2010-03-17,"Senate Third Reading Laid Over Daily"
95523,2010-03-18,"Senate Third Reading Passed"
95523,2010-03-19,"House Considered Senate Amendments - Result was to Concur - Repass"
95523,2010-04-05,"Signed by the Speaker of the House"
95523,2010-04-07,"Signed by the President of the Senate"
95523,2010-04-07,"Sent to the Governor"
95523,2010-04-15,"Governor Action - Signed"
95524,2010-01-13,"Introduced In House - Assigned to Health and Human Services"
95524,2010-02-05,"House Committee on Health and Human Services Refer Amended to House Committee of the Whole"
95524,2010-02-12,"House Second Reading Laid Over to 02/17/2010"
95524,2010-02-17,"House Second Reading Passed with Amendments"
95524,2010-02-18,"House Third Reading Passed"
95524,2010-02-19,"Introduced In Senate - Assigned to Health and Human Services"
95524,2010-03-12,"Senate Committee on Health and Human Services Refer Unamended to Senate Committee of the Whole"
95524,2010-03-17,"Senate Second Reading Laid Over Daily"
95524,2010-03-23,"Senate Second Reading Passed"
95524,2010-03-25,"Senate Third Reading Passed"
95524,2010-04-05,"Signed by the Speaker of the House"
95524,2010-04-07,"Signed by the President of the Senate"
95524,2010-04-07,"Sent to the Governor"
95524,2010-04-15,"Governor Action - Signed"
95525,2010-01-13,"Introduced In House - Assigned to Education + Appropriations"
95525,2010-02-01,"House Committee on Education Refer Amended to Appropriations"
95525,2010-02-19,"House Committee on Appropriations Refer Unamended to House Committee of the Whole"
95525,2010-02-23,"House Second Reading Laid Over Daily"
95525,2010-02-24,"House Second Reading Passed with Amendments"
95525,2010-02-25,"House Third Reading Passed"
95525,2010-03-01,"Introduced In Senate - Assigned to Education + Appropriations"
95525,2010-03-10,"Senate Committee on Education Refer Unamended to Appropriations"
95525,2010-03-19,"Senate Committee on Appropriations Refer Unamended to Senate Committee of the Whole"
95525,2010-03-23,"Senate Second Reading Laid Over Daily"
95525,2010-03-25,"Senate Second Reading Passed"
95525,2010-03-26,"Senate Third Reading Passed"
95525,2010-04-07,"Signed by the Speaker of the House"
95525,2010-04-08,"Signed by the President of the Senate"
95525,2010-04-08,"Sent to the Governor"
95525,2010-04-15,"Governor Action - Signed"
95526,2010-01-13,"Introduced In House - Assigned to Health and Human Services + Appropriations"
95526,2010-02-05,"House Committee on Health and Human Services Refer Unamended to Appropriations"
95526,2010-04-09,"House Committee on Appropriations Refer Amended to House Committee of the Whole"
95526,2010-04-13,"House Second Reading Passed with Amendments"
95526,2010-04-14,"House Third Reading Passed"
95526,2010-04-19,"Introduced In Senate - Assigned to Health and Human Services + Appropriations"
95526,2010-04-28,"Senate Committee on Health and Human Services Refer Unamended to Appropriations"
95526,2010-05-04,"Senate Committee on Appropriations Refer Unamended to Senate Committee of the Whole"
95526,2010-05-06,"Senate Second Reading Laid Over Daily"
95526,2010-05-07,"Senate Second Reading Passed"
95526,2010-05-10,"Senate Third Reading Passed"
95526,2010-05-25,"Signed by the President of the Senate"
95526,2010-05-25,"Signed by the Speaker of the House"
95526,2010-05-25,"Sent to the Governor"
95526,2010-05-26,"Governor Action - Signed"
95527,2010-01-13,"Introduced In House - Assigned to Education"
95527,2010-01-21,"House Committee on Education Refer Amended to House Committee of the Whole"
95527,2010-01-26,"House Second Reading Passed with Amendments"
95527,2010-01-27,"House Third Reading Laid Over Daily"
95527,2010-01-28,"House Third Reading Passed"
95527,2010-02-01,"Introduced In Senate - Assigned to Education"
95527,2010-03-03,"Senate Committee on Education Refer Unamended to Senate Committee of the Whole"
95527,2010-03-08,"Senate Second Reading Laid Over Daily"
95527,2010-03-12,"Senate Second Reading Passed"
95527,2010-03-15,"Senate Third Reading Passed"
95527,2010-03-22,"Signed by the Speaker of the House"
95527,2010-03-25,"Signed by the President of the Senate"
95527,2010-03-25,"Sent to the Governor"
95527,2010-04-05,"Governor Action - Signed"
95528,2010-01-13,"Introduced In House - Assigned to Health and Human Services"
95528,2010-02-11,"House Committee on Health and Human Services Refer Amended to House Committee of the Whole"
95528,2010-02-18,"House Second Reading Laid Over Daily"
95528,2010-02-19,"House Second Reading Passed with Amendments"
95528,2010-02-22,"House Third Reading Passed"
95528,2010-02-24,"Introduced In Senate - Assigned to Health and Human Services"
95528,2010-03-25,"Senate Committee on Health and Human Services Refer Amended - Consent Calendar to Senate Committee of the Whole"
95528,2010-03-31,"Senate Second Reading Laid Over Daily"
95528,2010-04-01,"Senate Second Reading Passed with Amendments"
95528,2010-04-05,"Senate Third Reading Passed"
95528,2010-04-07,"House Considered Senate Amendments - Result was to Laid Over Daily"
95528,2010-04-07,"House Considered Senate Amendments - Result was to Concur - Repass"
95528,2010-04-28,"Signed by the Speaker of the House"
95528,2010-04-30,"Signed by the President of the Senate"
95528,2010-04-30,"Sent to the Governor"
95528,2010-05-10,"Governor Action - Signed"
95529,2010-01-13,"Introduced In House - Assigned to Education + Appropriations"
95529,2010-01-25,"House Committee on Education Refer Amended to Appropriations"
95529,2010-02-05,"House Committee on Appropriations Refer Unamended to House Committee of the Whole"
95529,2010-02-10,"House Second Reading Passed with Amendments"
95529,2010-02-11,"House Third Reading Laid Over Daily"
95529,2010-02-12,"House Third Reading Passed"
95529,2010-02-17,"Introduced In Senate - Assigned to Education + Appropriations"
95529,2010-03-04,"Senate Committee on Education Refer Unamended to Appropriations"
95529,2010-03-12,"Senate Committee on Appropriations Refer Unamended to Senate Committee of the Whole"
95529,2010-03-16,"Senate Second Reading Laid Over Daily"
95529,2010-03-19,"Senate Second Reading Passed"
95529,2010-03-22,"Senate Third Reading Passed"
95529,2010-04-05,"Signed by the Speaker of the House"
95529,2010-04-07,"Signed by the President of the Senate"
95529,2010-04-07,"Sent to the Governor"
95529,2010-04-15,"Governor Action - Signed"
95530,2010-01-13,"Introduced In House - Assigned to Health and Human Services"
95530,2010-02-11,"House Committee on Health and Human Services Postpone Indefinitely"
95531,2010-01-13,"Introduced In House - Assigned to Health and Human Services + Appropriations"
95531,2010-02-18,"House Committee on Health and Human Services Refer Amended to Appropriations"
95531,2010-04-09,"House Committee on Appropriations Lay Over Unamended - Amendment(s) Failed"
95531,2010-04-16,"House Committee on Appropriations Refer Amended to House Committee of the Whole"
95531,2010-04-20,"House Second Reading Passed with Amendments"
95531,2010-04-23,"House Third Reading Laid Over Daily"
95531,2010-04-26,"House Third Reading Passed"
95531,2010-04-27,"Introduced In Senate - Assigned to Health and Human Services"
95531,2010-05-05,"Senate Committee on Health and Human Services Refer Amended to Senate Committee of the Whole"
95531,2010-05-07,"Senate Second Reading Passed with Amendments"
95531,2010-05-10,"Senate Third Reading Passed"
95531,2010-05-11,"House Considered Senate Amendments - Result was to Concur - Repass"
95531,2010-05-25,"Signed by the President of the Senate"
95531,2010-05-25,"Signed by the Speaker of the House"
95531,2010-05-25,"Sent to the Governor"
95531,2010-05-27,"Governor Action - Signed"
95532,2010-01-13,"Introduced In House - Assigned to Health and Human Services + Appropriations"
95532,2010-02-22,"House Committee on Health and Human Services Refer Unamended to Appropriations"
95532,2010-04-09,"House Committee on Appropriations Refer Amended to House Committee of the Whole"
95532,2010-04-13,"House Second Reading Passed with Amendments"
95532,2010-04-14,"House Third Reading Passed"
95532,2010-04-19,"Introduced In Senate - Assigned to Health and Human Services + Appropriations"
95532,2010-04-22,"Senate Committee on Health and Human Services Refer Unamended to Appropriations"
95532,2010-04-30,"Senate Committee on Appropriations Refer Unamended to Senate Committee of the Whole"
95532,2010-04-30,"Senate Second Reading Special Order - Passed"
95532,2010-05-03,"Senate Third Reading Passed"
95532,2010-05-20,"Signed by the Speaker of the House"
95532,2010-05-24,"Signed by the President of the Senate"
95532,2010-05-24,"Sent to the Governor"
95532,2010-06-07,"Governor Action - Signed"
95533,2010-01-13,"Introduced In House - Assigned to Education"
95533,2010-01-21,"House Committee on Education Refer Amended to House Committee of the Whole"
95533,2010-01-26,"House Second Reading Laid Over Daily"
95533,2010-01-27,"House Second Reading Passed with Amendments"
95533,2010-01-29,"House Third Reading Passed"
95533,2010-02-04,"Introduced In Senate - Assigned to Education"
95533,2010-03-11,"Senate Committee on Education Refer Amended - Consent Calendar to Senate Committee of the Whole"
95533,2010-03-16,"Senate Second Reading Passed with Amendments"
95533,2010-03-17,"Senate Third Reading Laid Over Daily"
95533,2010-03-18,"Senate Third Reading Passed"
95533,2010-03-19,"House Considered Senate Amendments - Result was to Concur - Repass"
95533,2010-04-05,"Signed by the Speaker of the House"
95533,2010-04-07,"Signed by the President of the Senate"
95533,2010-04-07,"Sent to the Governor"
95533,2010-04-15,"Governor Action - Signed"
95534,2010-01-13,"Introduced In House - Assigned to Education + Appropriations"
95534,2010-02-22,"House Committee on Education Refer Amended to Appropriations"
95534,2010-03-05,"House Committee on Appropriations Refer Amended to House Committee of the Whole"
95534,2010-03-09,"House Second Reading Laid Over Daily"
95534,2010-03-10,"House Second Reading Passed with Amendments"
95534,2010-03-11,"House Third Reading Passed"
95534,2010-03-15,"Introduced In Senate - Assigned to Education + Appropriations"
95534,2010-03-31,"Senate Committee on Education Refer Amended to Appropriations"
95534,2010-04-23,"Senate Committee on Appropriations Refer Unamended to Senate Committee of the Whole"
95534,2010-04-27,"Senate Second Reading Passed with Amendments"
95534,2010-04-28,"Senate Third Reading Passed"
95534,2010-04-30,"House Considered Senate Amendments - Result was to Laid Over Daily"
95534,2010-05-04,"House Considered Senate Amendments - Result was to Concur - Repass"
95534,2010-05-20,"Signed by the Speaker of the House"
95534,2010-05-24,"Signed by the President of the Senate"
95534,2010-05-24,"Sent to the Governor"
95534,2010-06-03,"Governor Action - Signed"
95535,2010-01-13,"Introduced In House - Assigned to Education"
95535,2010-01-21,"House Committee on Education Refer Amended to House Committee of the Whole"
95535,2010-01-26,"House Second Reading Laid Over Daily"
95535,2010-01-27,"House Second Reading Passed with Amendments"
95535,2010-01-29,"House Third Reading Passed"
95535,2010-02-04,"Introduced In Senate - Assigned to Education"
95535,2010-03-11,"Senate Committee on Education Refer Unamended - Consent Calendar to Senate Committee of the Whole"
95535,2010-03-16,"Senate Second Reading Passed"
95535,2010-03-17,"Senate Third Reading Laid Over Daily"
95535,2010-03-18,"Senate Third Reading Passed"
95535,2010-03-29,"Signed by the Speaker of the House"
95535,2010-03-30,"Signed by the President of the Senate"
95535,2010-03-31,"Sent to the Governor"
95535,2010-04-12,"Governor Action - Signed"
95536,2010-01-13,"Introduced In House - Assigned to Education"
95536,2010-01-21,"House Committee on Education Refer Unamended to House Committee of the Whole"
95536,2010-01-26,"House Second Reading Laid Over Daily"
95536,2010-01-28,"House Second Reading Passed"
95536,2010-01-29,"House Third Reading Passed"
95536,2010-02-04,"Introduced In Senate - Assigned to Education"
95536,2010-03-03,"Senate Committee on Education Refer Unamended - Consent Calendar to Senate Committee of the Whole"
95536,2010-03-08,"Senate Second Reading Passed"
95536,2010-03-09,"Senate Third Reading Passed"
95536,2010-03-15,"Signed by the Speaker of the House"
95536,2010-03-18,"Signed by the President of the Senate"
95536,2010-03-18,"Sent to the Governor"
95536,2010-03-29,"Governor Action - Signed"
95537,2010-01-13,"Introduced In House - Assigned to Business Affairs and Labor + Appropriations"
95537,2010-02-03,"House Committee on Business Affairs and Labor Refer Amended to Appropriations"
95537,2010-02-12,"House Committee on Appropriations Refer Amended to House Committee of the Whole"
95537,2010-02-18,"House Second Reading Laid Over Daily"
95537,2010-02-19,"House Second Reading Passed with Amendments"
95537,2010-02-22,"House Third Reading Passed"
95537,2010-02-24,"Introduced In Senate - Assigned to Judiciary"
95537,2010-03-31,"Senate Committee on Judiciary Refer Unamended to Senate Committee of the Whole"
95537,2010-04-22,"Senate Second Reading Laid Over Daily"
95537,2010-04-23,"Senate Second Reading Passed"
95537,2010-04-26,"Senate Third Reading Passed"
95537,2010-05-12,"Signed by the President of the Senate"
95537,2010-05-12,"Signed by the Speaker of the House"
95537,2010-05-13,"Sent to the Governor"
95537,2010-05-26,"Governor Action - Signed"
95538,2010-01-13,"Introduced In House - Assigned to Judiciary"
95538,2010-01-21,"House Committee on Judiciary Refer Unamended to House Committee of the Whole"
95538,2010-01-26,"House Second Reading Laid Over Daily"
95538,2010-01-28,"House Second Reading Passed"
95538,2010-01-29,"House Third Reading Passed"
95538,2010-02-04,"Introduced In Senate - Assigned to Judiciary"
95538,2010-02-10,"Senate Committee on Judiciary Refer Unamended - Consent Calendar to Senate Committee of the Whole"
95538,2010-02-15,"Senate Second Reading Passed"
95538,2010-02-16,"Senate Third Reading Passed"
95538,2010-02-16,"Signed by the Speaker of the House"
95538,2010-02-17,"Signed by the President of the Senate"
95538,2010-02-17,"Sent to the Governor"
95538,2010-02-24,"Governor Action - Signed"
95539,2010-01-13,"Introduced In House - Assigned to Education + Finance + Appropriations"
95539,2010-02-01,"House Committee on Education Refer Amended to Finance"
95539,2010-02-03,"House Committee on Finance Refer Unamended to Appropriations"
95539,2010-02-12,"House Committee on Appropriations Postpone Indefinitely"
95540,2010-01-13,"Introduced In House - Assigned to Health and Human Services"
95540,2010-02-05,"House Committee on Health and Human Services Refer Amended to House Committee of the Whole"
95540,2010-02-12,"House Second Reading Laid Over to 02/17/2010"
95540,2010-02-17,"House Second Reading Passed with Amendments"
95540,2010-02-18,"House Third Reading Passed"
95540,2010-02-19,"Introduced In Senate - Assigned to Health and Human Services"
95540,2010-02-25,"Senate Committee on Health and Human Services Refer Unamended to Senate Committee of the Whole"
95540,2010-03-01,"Senate Second Reading Special Order - Laid Over Daily"
95540,2010-03-02,"Senate Second Reading Passed"
95540,2010-03-03,"Senate Third Reading Passed"
95540,2010-03-05,"Signed by the Speaker of the House"
95540,2010-03-08,"Signed by the President of the Senate"
95540,2010-03-08,"Sent to the Governor"
95540,2010-03-18,"Governor Action - Signed"
95541,2010-01-13,"Introduced In House - Assigned to Health and Human Services + Finance"
95541,2010-01-28,"House Committee on Health and Human Services Refer Unamended to Finance"
95541,2010-02-10,"House Committee on Finance Refer Amended to House Committee of the Whole"
95541,2010-02-17,"House Second Reading Laid Over to 02/19/2010"
95541,2010-02-19,"House Second Reading Passed with Amendments"
95541,2010-02-22,"House Third Reading Passed"
95541,2010-02-24,"Introduced In Senate - Assigned to Health and Human Services + Finance"
95541,2010-03-25,"Senate Committee on Health and Human Services Refer Unamended to Finance"
95541,2010-04-01,"Senate Committee on Finance Refer Amended to Senate Committee of the Whole"
95541,2010-04-07,"Senate Second Reading Laid Over Daily"
95541,2010-04-13,"Senate Second Reading Passed"
95541,2010-04-14,"Senate Third Reading Passed"
95541,2010-04-29,"Signed by the Speaker of the House"
95541,2010-04-30,"Signed by the President of the Senate"
95541,2010-04-30,"Sent to the Governor"
95541,2010-05-06,"Governor Action - Signed"
95542,2010-01-13,"Introduced In House - Assigned to Health and Human Services"
95542,2010-02-01,"House Committee on Health and Human Services Refer Amended to House Committee of the Whole"
95542,2010-02-04,"House Second Reading Laid Over Daily"
95542,2010-02-05,"House Second Reading Laid Over to 02/10/2010"
95542,2010-02-10,"House Second Reading Passed with Amendments"
95542,2010-02-11,"House Third Reading Laid Over Daily"
95542,2010-02-12,"House Third Reading Passed"
95542,2010-02-17,"Introduced In Senate - Assigned to Health and Human Services"
95542,2010-03-12,"Senate Committee on Health and Human Services Refer Amended to Senate Committee of the Whole"
95542,2010-03-17,"Senate Second Reading Laid Over Daily"
95542,2010-03-23,"Senate Second Reading Passed with Amendments"
95542,2010-03-25,"Senate Third Reading Passed"
95542,2010-03-30,"House Considered Senate Amendments - Result was to Laid Over Daily"
95542,2010-03-31,"House Considered Senate Amendments - Result was to Concur - Repass"
95542,2010-04-08,"Signed by the President of the Senate"
95542,2010-04-08,"Signed by the Speaker of the House"
95542,2010-04-09,"Sent to the Governor"
95542,2010-04-15,"Governor Action - Signed"
95543,2010-01-13,"Introduced In House - Assigned to Education"
95543,2010-02-04,"House Committee on Education Refer Amended to House Committee of the Whole"
95543,2010-02-12,"House Second Reading Laid Over to 02/17/2010"
95543,2010-02-17,"House Second Reading Passed with Amendments"
95543,2010-02-18,"House Third Reading Passed"
95543,2010-02-19,"Introduced In Senate - Assigned to Education + Appropriations"
95543,2010-03-04,"Senate Committee on Education Refer Unamended to Appropriations"
95543,2010-03-12,"Senate Committee on Appropriations Refer Unamended to Senate Committee of the Whole"
95543,2010-03-16,"Senate Second Reading Laid Over Daily"
95543,2010-03-22,"Senate Second Reading Passed with Amendments"
95543,2010-03-23,"Senate Third Reading Reconsidered"
95543,2010-03-23,"Senate Third Reading Passed"
95543,2010-03-23,"Senate Third Reading Passed"
95543,2010-03-26,"House Considered Senate Amendments - Result was to Laid Over Daily"
95543,2010-03-26,"House Considered Senate Amendments - Result was to Concur - Repass"
95543,2010-04-05,"Signed by the Speaker of the House"
95543,2010-04-07,"Signed by the President of the Senate"
95543,2010-04-07,"Sent to the Governor"
95543,2010-04-14,"Governor Action - Signed"
95544,2010-01-13,"Introduced In House - Assigned to State, Veterans, & Military Affairs + Appropriations"
95544,2010-01-28,"House Committee on State, Veterans, & Military Affairs Refer Amended to Appropriations"
95544,2010-02-12,"House Committee on Appropriations Refer Amended to House Committee of the Whole"
95544,2010-02-17,"House Second Reading Laid Over Daily"
95544,2010-02-19,"House Second Reading Passed with Amendments"
95544,2010-02-22,"House Third Reading Passed"
95544,2010-02-24,"Introduced In Senate - Assigned to State, Veterans & Military Affairs + Appropriations"
95544,2010-03-22,"Senate Committee on State, Veterans & Military Affairs Refer Unamended to Appropriations"
95544,2010-04-23,"Senate Committee on Appropriations Refer Unamended - Consent Calendar to Senate Committee of the Whole"
95544,2010-04-27,"Senate Second Reading Passed"
95544,2010-04-28,"Senate Third Reading Passed"
95544,2010-05-19,"Signed by the Speaker of the House"
95544,2010-05-20,"Signed by the President of the Senate"
95544,2010-05-20,"Sent to the Governor"
95544,2010-05-27,"Governor Action - Signed"
95545,2010-01-13,"Introduced In House - Assigned to Local Government"
95545,2010-01-21,"House Committee on Local Government Refer Unamended to House Committee of the Whole"
95545,2010-01-26,"House Second Reading Passed"
95545,2010-01-27,"House Third Reading Laid Over Daily"
95545,2010-01-28,"House Third Reading Passed"
95545,2010-02-01,"Introduced In Senate - Assigned to Local Government and Energy"
95545,2010-02-09,"Senate Committee on Local Government and Energy Refer Unamended to Senate Committee of the Whole"
95545,2010-02-12,"Senate Second Reading Laid Over Daily"
95545,2010-02-15,"Senate Second Reading Passed with Amendments"
95545,2010-02-16,"Senate Third Reading Passed"
95545,2010-02-18,"House Considered Senate Amendments - Result was to Concur - Repass"
95545,2010-02-24,"Signed by the President of the Senate"
95545,2010-02-24,"Signed by the Speaker of the House"
95545,2010-02-25,"Sent to the Governor"
95545,2010-03-05,"Governor Action - Signed"
95546,2010-01-13,"Introduced In House - Assigned to State, Veterans, & Military Affairs"
95546,2010-01-26,"House Committee on State, Veterans, & Military Affairs Refer Amended to House Committee of the Whole"
95546,2010-01-29,"House Second Reading Laid Over Daily"
95546,2010-02-08,"House Second Reading Passed with Amendments"
95546,2010-02-09,"House Third Reading Passed"
95546,2010-02-17,"Introduced In Senate - Assigned to State, Veterans & Military Affairs"
95546,2010-05-03,"Senate Committee on State, Veterans & Military Affairs Postpone Indefinitely"
95547,2010-01-13,"Introduced In House - Assigned to Health and Human Services + Appropriations"
95547,2010-02-01,"House Committee on Health and Human Services Refer Unamended to Appropriations"
95547,2010-04-09,"House Committee on Appropriations Postpone Indefinitely"
95548,2010-01-13,"Introduced In House - Assigned to Business Affairs and Labor"
95548,2010-01-26,"House Committee on Business Affairs and Labor Refer Amended to House Committee of the Whole"
95548,2010-01-29,"House Second Reading Special Order - Passed with Amendments"
95548,2010-02-01,"House Third Reading Passed"
95548,2010-02-04,"Introduced In Senate - Assigned to Business, Labor and Technology"
95548,2010-03-01,"Senate Committee on Business, Labor and Technology Refer Amended to Senate Committee of the Whole"
95548,2010-03-05,"Senate Second Reading Laid Over Daily"
95548,2010-03-08,"Senate Second Reading Passed with Amendments"
95548,2010-03-09,"Senate Third Reading Laid Over Daily"
95548,2010-03-09,"Senate Third Reading Passed"
95548,2010-03-11,"House Considered Senate Amendments - Result was to Concur - Repass"
95548,2010-03-16,"Signed by the Speaker of the House"
95548,2010-03-17,"Signed by the President of the Senate"
95548,2010-03-17,"Sent to the Governor"
95548,2010-03-22,"Governor Action - Signed"
95549,2010-01-13,"Introduced In House - Assigned to Health and Human Services"
95549,2010-02-11,"House Committee on Health and Human Services Refer Amended to House Committee of the Whole"
95549,2010-02-17,"House Second Reading Laid Over Daily"
95549,2010-02-19,"House Second Reading Passed with Amendments"
95549,2010-02-22,"House Third Reading Passed"
95549,2010-02-24,"Introduced In Senate - Assigned to Health and Human Services"
95549,2010-03-11,"Senate Committee on Health and Human Services Refer Unamended - Consent Calendar to Senate Committee of the Whole"
95549,2010-03-16,"Senate Second Reading Passed"
95549,2010-03-17,"Senate Third Reading Laid Over Daily"
95549,2010-03-18,"Senate Third Reading Passed"
95549,2010-03-29,"Signed by the Speaker of the House"
95549,2010-03-30,"Signed by the President of the Senate"
95549,2010-03-31,"Sent to the Governor"
95549,2010-04-12,"Governor Action - Signed"
95550,2010-01-13,"Introduced In House - Assigned to Agriculture, Livestock, & Natural Resources"
95550,2010-04-07,"House Committee on Agriculture, Livestock, & Natural Resources Refer Amended to House Committee of the Whole"
95550,2010-04-12,"House Second Reading Passed with Amendments"
95550,2010-04-13,"House Third Reading Passed"
95550,2010-04-19,"Introduced In Senate - Assigned to Agriculture and Natural Resources"
95550,2010-04-22,"Senate Committee on Agriculture and Natural Resources Refer Unamended to Senate Committee of the Whole"
95550,2010-04-27,"Senate Second Reading Passed"
95550,2010-04-28,"Senate Third Reading Passed"
95550,2010-05-10,"Signed by the Speaker of the House"
95550,2010-05-11,"Signed by the President of the Senate"
95550,2010-05-12,"Sent to the Governor"
95550,2010-06-07,"Governor Action - Signed"
95551,2010-01-13,"Introduced In House - Assigned to Transportation & Energy"
95551,2010-01-21,"House Committee on Transportation & Energy Refer Amended to House Committee of the Whole"
95551,2010-01-26,"House Second Reading Laid Over Daily"
95551,2010-01-29,"House Second Reading Special Order - Passed with Amendments"
95551,2010-02-01,"House Third Reading Passed"
95551,2010-02-04,"Introduced In Senate - Assigned to Local Government and Energy"
95551,2010-03-16,"Senate Committee on Local Government and Energy Refer Unamended to Senate Committee of the Whole"
95551,2010-03-19,"Senate Second Reading Laid Over Daily"
95551,2010-03-23,"Senate Second Reading Passed"
95551,2010-03-25,"Senate Third Reading Passed"
95551,2010-04-08,"Signed by the President of the Senate"
95551,2010-04-08,"Signed by the Speaker of the House"
95551,2010-04-08,"Sent to the Governor"
95551,2010-04-13,"Governor Action - Signed"
95552,2010-01-13,"Introduced In House - Assigned to Health and Human Services + Appropriations"
95552,2010-02-08,"House Committee on Health and Human Services Refer Amended to Appropriations"
95552,2010-02-26,"House Committee on Appropriations Refer Amended to House Committee of the Whole"
95552,2010-03-02,"House Second Reading Passed with Amendments"
95552,2010-03-03,"House Third Reading Passed"
95552,2010-03-09,"Introduced In Senate - Assigned to Health and Human Services + Appropriations"
95552,2010-03-31,"Senate Committee on Health and Human Services Refer Amended to Appropriations"
95552,2010-04-23,"Senate Committee on Appropriations Refer Amended to Senate Committee of the Whole"
95552,2010-04-27,"Senate Second Reading Passed with Amendments"
95552,2010-04-28,"Senate Third Reading Passed"
95552,2010-04-30,"House Considered Senate Amendments - Result was to Laid Over Daily"
95552,2010-05-04,"House Considered Senate Amendments - Result was to Concur - Repass"
95552,2010-05-20,"Signed by the Speaker of the House"
95552,2010-05-24,"Signed by the President of the Senate"
95552,2010-05-24,"Sent to the Governor"
95552,2010-05-26,"Governor Action - Signed"
95553,2010-01-13,"Introduced In House - Assigned to Education"
95553,2010-01-28,"House Committee on Education Witness Testimony and/or Committee Discussion Only"
95553,2010-02-08,"House Committee on Education Refer Amended to House Committee of the Whole"
95553,2010-02-12,"House Second Reading Laid Over to 02/17/2010"
95553,2010-02-17,"House Second Reading Laid Over to 02/19/2010"
95553,2010-02-19,"House Second Reading Passed with Amendments"
95553,2010-02-22,"House Third Reading Passed"
95553,2010-02-24,"Introduced In Senate - Assigned to Education"
95553,2010-03-10,"Senate Committee on Education Refer Unamended to Senate Committee of the Whole"
95553,2010-03-15,"Senate Second Reading Laid Over Daily"
95553,2010-03-19,"Senate Second Reading Passed"
95553,2010-03-22,"Senate Third Reading Passed"
95553,2010-04-05,"Signed by the Speaker of the House"
95553,2010-04-07,"Signed by the President of the Senate"
95553,2010-04-07,"Sent to the Governor"
95553,2010-04-15,"Governor Action - Signed"
95554,2010-01-13,"Introduced In House - Assigned to Finance"
95554,2010-01-20,"House Committee on Finance Refer Unamended to House Committee of the Whole"
95554,2010-01-26,"House Second Reading Passed with Amendments"
95554,2010-01-27,"House Third Reading Laid Over Daily"
95554,2010-01-28,"House Third Reading Passed"
95554,2010-02-01,"Introduced In Senate - Assigned to Finance"
95554,2010-02-09,"Senate Committee on Finance Refer Unamended to Senate Committee of the Whole"
95554,2010-02-15,"Senate Second Reading Laid Over to 02/19/2010"
95554,2010-02-19,"Senate Second Reading Passed with Amendments"
95554,2010-02-22,"Senate Third Reading Laid Over Daily"
95554,2010-02-24,"Senate Third Reading Passed"
95554,2010-03-01,"House Considered Senate Amendments - Result was to Laid Over Daily"
95554,2010-03-03,"House Considered Senate Amendments - Result was to Concur - Repass"
95554,2010-03-10,"Signed by the Speaker of the House"
95554,2010-03-12,"Signed by the President of the Senate"
95554,2010-03-12,"Sent to the Governor"
95554,2010-03-22,"Governor Action - Signed"
95555,2010-01-13,"Introduced In House - Assigned to Judiciary"
95555,2010-02-25,"House Committee on Judiciary Postpone Indefinitely"
95556,2010-01-13,"Introduced In House - Assigned to Judiciary"
95556,2010-02-11,"House Committee on Judiciary Refer Amended to House Committee of the Whole"
95556,2010-02-17,"House Second Reading Laid Over Daily"
95556,2010-02-18,"House Second Reading Passed with Amendments"
95556,2010-02-19,"House Third Reading Passed"
95556,2010-02-24,"Introduced In Senate - Assigned to Judiciary"
95556,2010-03-10,"Senate Committee on Judiciary Refer Unamended to Senate Committee of the Whole"
95556,2010-03-15,"Senate Second Reading Laid Over Daily"
95556,2010-03-19,"Senate Second Reading Passed"
95556,2010-03-22,"Senate Third Reading Passed"
95556,2010-04-05,"Signed by the Speaker of the House"
95556,2010-04-07,"Signed by the President of the Senate"
95556,2010-04-07,"Sent to the Governor"
95556,2010-04-15,"Governor Action - Signed"
95557,2010-01-13,"Introduced In House - Assigned to Judiciary + Appropriations"
95557,2010-01-21,"House Committee on Judiciary Refer Amended to Appropriations"
95557,2010-02-05,"House Committee on Appropriations Refer Amended to House Committee of the Whole"
95557,2010-02-10,"House Second Reading Passed with Amendments"
95557,2010-02-11,"House Third Reading Laid Over Daily"
95557,2010-02-12,"House Third Reading Passed"
95557,2010-02-17,"Introduced In Senate - Assigned to Judiciary + Appropriations"
95557,2010-03-01,"Senate Committee on Judiciary Refer Amended to Appropriations"
95557,2010-03-12,"Senate Committee on Appropriations Refer Unamended to Senate Committee of the Whole"
95557,2010-03-16,"Senate Second Reading Laid Over Daily"
95557,2010-03-23,"Senate Second Reading Passed with Amendments"
95557,2010-03-25,"Senate Third Reading Passed"
95557,2010-03-29,"House Considered Senate Amendments - Result was to Laid Over Daily"
95557,2010-03-31,"House Considered Senate Amendments - Result was to Concur - Repass"
95557,2010-04-15,"Signed by the Speaker of the House"
95557,2010-04-16,"Signed by the President of the Senate"
95557,2010-04-16,"Sent to the Governor"
95557,2010-04-21,"Governor Action - Signed"
95558,2010-01-13,"Introduced In House - Assigned to Transportation & Energy"
95558,2010-01-28,"House Committee on Transportation & Energy Refer Unamended to House Committee of the Whole"
95558,2010-02-03,"House Second Reading Laid Over Daily"
95558,2010-02-04,"House Second Reading Passed"
95558,2010-02-05,"House Third Reading Laid Over Daily"
95558,2010-02-08,"House Third Reading Passed"
95558,2010-02-09,"Introduced In Senate - Assigned to Transportation"
95558,2010-03-02,"Senate Committee on Transportation Refer Unamended to Senate Committee of the Whole"
95558,2010-03-05,"Senate Second Reading Laid Over Daily"
95558,2010-03-11,"Senate Second Reading Passed"
95558,2010-03-12,"Senate Third Reading Passed"
95558,2010-03-18,"Signed by the Speaker of the House"
95558,2010-03-22,"Signed by the President of the Senate"
95558,2010-03-22,"Sent to the Governor"
95558,2010-03-23,"Governor Action - Signed"
95559,2010-01-13,"Introduced In House - Assigned to Agriculture, Livestock, & Natural Resources + Appropriations"
95559,2010-01-27,"House Committee on Agriculture, Livestock, & Natural Resources Refer Amended to Appropriations"
95559,2010-03-19,"House Committee on Appropriations Lay Over Unamended - Amendment(s) Failed"
95559,2010-03-26,"House Committee on Appropriations Refer Amended to House Committee of the Whole"
95559,2010-04-01,"House Second Reading Passed with Amendments"
95559,2010-04-05,"House Third Reading Passed"
95559,2010-04-13,"Introduced In Senate - Assigned to Agriculture and Natural Resources"
95559,2010-04-21,"Senate Committee on Agriculture and Natural Resources Refer Amended to Senate Committee of the Whole"
95559,2010-04-23,"Senate Second Reading Laid Over Daily"
95559,2010-04-26,"Senate Second Reading Passed with Amendments"
95559,2010-04-27,"Senate Third Reading Passed"
95559,2010-04-28,"House Considered Senate Amendments - Result was to Lay Over Daily"
95559,2010-04-30,"House Considered Senate Amendments - Result was to Concur - Repass"
95559,2010-05-25,"Signed by the President of the Senate"
95559,2010-05-25,"Signed by the Speaker of the House"
95559,2010-05-25,"Sent to the Governor"
95559,2010-05-26,"Governor Action - Signed"
95560,2010-01-13,"Introduced In House - Assigned to Health and Human Services"
95560,2010-02-08,"House Committee on Health and Human Services Refer Amended to House Committee of the Whole"
95560,2010-02-19,"House Second Reading Laid Over to 06/09/2010"
95561,2010-01-13,"Introduced In House - Assigned to Local Government"
95561,2010-01-21,"House Committee on Local Government Refer Amended to House Committee of the Whole"
95561,2010-01-26,"House Second Reading Laid Over Daily"
95561,2010-01-28,"House Second Reading Passed with Amendments"
95561,2010-01-29,"House Third Reading Passed"
95561,2010-02-04,"Introduced In Senate - Assigned to Local Government and Energy"
95561,2010-03-18,"Senate Committee on Local Government and Energy Refer Amended - Consent Calendar to Senate Committee of the Whole"
95561,2010-03-23,"Senate Second Reading Passed with Amendments"
95561,2010-03-25,"Senate Third Reading Passed"
95561,2010-03-29,"House Considered Senate Amendments - Result was to Laid Over Daily"
95561,2010-03-31,"House Considered Senate Amendments - Result was to Concur - Repass"
95561,2010-04-15,"Signed by the Speaker of the House"
95561,2010-04-16,"Signed by the President of the Senate"
95561,2010-04-16,"Sent to the Governor"
95561,2010-04-21,"Governor Action - Signed"
95562,2010-01-13,"Introduced In House - Assigned to State, Veterans, & Military Affairs"
95562,2010-01-19,"House Committee on State, Veterans, & Military Affairs Refer Unamended to House Committee of the Whole"
95562,2010-01-22,"House Second Reading Passed"
95562,2010-01-25,"House Third Reading Laid Over Daily"
95562,2010-01-26,"House Third Reading Passed"
95562,2010-02-01,"Introduced In Senate - Assigned to State, Veterans & Military Affairs"
95562,2010-02-17,"Senate Committee on State, Veterans & Military Affairs Refer Unamended to Senate Committee of the Whole"
95562,2010-02-22,"Senate Second Reading Laid Over Daily"
95562,2010-02-24,"Senate Second Reading Passed"
95562,2010-02-25,"Senate Third Reading Laid Over Daily"
95562,2010-02-26,"Senate Third Reading Passed"
95562,2010-03-05,"Signed by the Speaker of the House"
95562,2010-03-08,"Signed by the President of the Senate"
95562,2010-03-08,"Sent to the Governor"
95562,2010-03-18,"Governor Action - Signed"
95563,2010-01-13,"Introduced In House - Assigned to Education"
95563,2010-01-28,"House Committee on Education Refer Unamended to House Committee of the Whole"
95563,2010-02-03,"House Second Reading Laid Over Daily"
95563,2010-02-04,"House Second Reading Passed"
95563,2010-02-05,"House Third Reading Laid Over Daily"
95563,2010-02-08,"House Third Reading Passed"
95563,2010-02-09,"Introduced In Senate - Assigned to Education"
95563,2010-03-04,"Senate Committee on Education Refer Unamended - Consent Calendar to Senate Committee of the Whole"
95563,2010-03-09,"Senate Second Reading Laid Over Daily"
95563,2010-03-10,"Senate Second Reading Passed"
95563,2010-03-12,"Senate Third Reading Passed"
95563,2010-03-18,"Signed by the Speaker of the House"
95563,2010-03-22,"Signed by the President of the Senate"
95563,2010-03-22,"Sent to the Governor"
95563,2010-03-31,"Governor Action - Signed"
95564,2010-01-13,"Introduced In House - Assigned to Judiciary"
95564,2010-01-28,"House Committee on Judiciary Refer Unamended to House Committee of the Whole"
95564,2010-02-03,"House Second Reading Laid Over Daily"
95564,2010-02-04,"House Second Reading Passed"
95564,2010-02-05,"House Third Reading Laid Over Daily"
95564,2010-02-08,"House Third Reading Passed"
95564,2010-02-09,"Introduced In Senate - Assigned to Judiciary"
95564,2010-02-17,"Senate Committee on Judiciary Refer Unamended - Consent Calendar to Senate Committee of the Whole"
95564,2010-02-22,"Senate Second Reading Laid Over Daily"
95564,2010-02-24,"Senate Second Reading Passed"
95564,2010-02-25,"Senate Third Reading Laid Over Daily"
95564,2010-02-26,"Senate Third Reading Passed"
95564,2010-03-05,"Signed by the Speaker of the House"
95564,2010-03-08,"Signed by the President of the Senate"
95564,2010-03-08,"Sent to the Governor"
95564,2010-03-18,"Governor Action - Signed"
95565,2010-01-13,"Introduced In House - Assigned to Education"
95565,2010-02-11,"House Committee on Education Postpone Indefinitely"
95566,2010-01-13,"Introduced In House - Assigned to Education"
95566,2010-01-25,"House Committee on Education Postpone Indefinitely"
95567,2010-01-13,"Introduced In House - Assigned to Transportation & Energy"
95567,2010-03-02,"House Committee on Transportation & Energy Postpone Indefinitely"
95568,2010-01-13,"Introduced In House - Assigned to Local Government"
95568,2010-01-21,"House Committee on Local Government Refer Unamended to House Committee of the Whole"
95568,2010-01-26,"House Second Reading Passed"
95568,2010-01-27,"House Third Reading Laid Over Daily"
95568,2010-01-28,"House Third Reading Passed"
95568,2010-02-01,"Introduced In Senate - Assigned to Local Government and Energy"
95568,2010-02-09,"Senate Committee on Local Government and Energy Refer Unamended to Senate Committee of the Whole"
95568,2010-02-15,"Senate Second Reading Laid Over to 03/15/2010"
95568,2010-03-15,"Senate Second Reading Laid Over Daily"
95568,2010-03-22,"Senate Second Reading Laid Over to 05/15/2010"
95569,2010-01-13,"Introduced In House - Assigned to Health and Human Services"
95569,2010-02-01,"House Committee on Health and Human Services Postpone Indefinitely"
95570,2010-01-13,"Introduced In House - Assigned to Education"
95570,2010-01-21,"House Committee on Education Refer Unamended to House Committee of the Whole"
95570,2010-01-26,"House Second Reading Laid Over Daily"
95570,2010-01-28,"House Second Reading Passed"
95570,2010-01-29,"House Third Reading Passed"
95570,2010-02-04,"Introduced In Senate - Assigned to Education"
95570,2010-03-03,"Senate Committee on Education Refer Unamended - Consent Calendar to Senate Committee of the Whole"
95570,2010-03-08,"Senate Second Reading Passed"
95570,2010-03-09,"Senate Third Reading Passed"
95570,2010-03-15,"Signed by the Speaker of the House"
95570,2010-03-18,"Signed by the President of the Senate"
95570,2010-03-18,"Sent to the Governor"
95570,2010-03-29,"Governor Action - Signed"
95571,2010-01-13,"Introduced In House - Assigned to Finance"
95571,2010-03-10,"House Committee on Finance Postpone Indefinitely"
95572,2010-01-13,"Introduced In House - Assigned to Finance + Appropriations"
95572,2010-01-20,"House Committee on Finance Refer Unamended to Appropriations"
95572,2010-04-09,"House Committee on Appropriations Refer Amended to House Committee of the Whole"
95572,2010-04-13,"House Second Reading Passed with Amendments"
95572,2010-04-14,"House Third Reading Passed"
95572,2010-04-19,"Introduced In Senate - Assigned to Finance + Appropriations"
95572,2010-04-20,"Senate Committee on Finance Refer Amended to Appropriations"
95572,2010-04-30,"Senate Committee on Appropriations Refer Unamended to Senate Committee of the Whole"
95572,2010-04-30,"Senate Second Reading Special Order - Passed with Amendments"
95572,2010-05-03,"Senate Third Reading Passed"
95572,2010-05-04,"House Considered Senate Amendments - Result was to Concur - Repass"
95572,2010-05-25,"Signed by the President of the Senate"
95572,2010-05-25,"Signed by the Speaker of the House"
95572,2010-05-25,"Sent to the Governor"
95572,2010-06-07,"Governor Action - Signed"
95573,2010-01-13,"Introduced In House - Assigned to Business Affairs and Labor"
95573,2010-01-27,"House Committee on Business Affairs and Labor Postpone Indefinitely"
95574,2010-01-13,"Introduced In House - Assigned to Business Affairs and Labor"
95574,2010-01-27,"House Committee on Business Affairs and Labor Committee Vote - Final Action Failed"
95574,2010-02-12,"House Committee on Business Affairs and Labor Postpone Indefinitely"
95575,2010-01-13,"Introduced In House - Assigned to Finance"
95575,2010-01-27,"House Committee on Finance Lay Over Unamended - Amendment(s) Failed"
95575,2010-02-02,"House Committee on Finance Refer Amended to House Committee of the Whole"
95575,2010-02-05,"House Second Reading Laid Over Daily"
95575,2010-02-08,"House Second Reading Passed with Amendments"
95575,2010-02-09,"House Third Reading Passed"
95575,2010-02-17,"Introduced In Senate - Assigned to Business, Labor and Technology"
95575,2010-03-23,"Senate Committee on Business, Labor and Technology Refer Amended - Consent Calendar to Senate Committee of the Whole"
95575,2010-03-29,"Senate Second Reading Passed with Amendments"
95575,2010-03-30,"Senate Third Reading Laid Over Daily"
95575,2010-03-31,"Senate Third Reading Passed"
95575,2010-04-01,"House Considered Senate Amendments - Result was to Concur - Repass"
95575,2010-04-16,"Signed by the Speaker of the House"
95575,2010-04-19,"Signed by the President of the Senate"
95575,2010-04-19,"Sent to the Governor"
95575,2010-04-28,"Governor Action - Signed"
95576,2010-01-13,"Introduced In House - Assigned to State, Veterans, & Military Affairs"
95576,2010-02-09,"House Committee on State, Veterans, & Military Affairs Postpone Indefinitely"
95577,2010-01-13,"Introduced In House - Assigned to State, Veterans, & Military Affairs"
95577,2010-02-16,"House Committee on State, Veterans, & Military Affairs Postpone Indefinitely"
95578,2010-01-13,"Introduced In House - Assigned to State, Veterans, & Military Affairs"
95578,2010-01-21,"House Committee on State, Veterans, & Military Affairs Postpone Indefinitely"
95579,2010-01-13,"Introduced In House - Assigned to Local Government"
95579,2010-01-26,"House Committee on Local Government Refer Unamended to House Committee of the Whole"
95579,2010-01-29,"House Second Reading Special Order - Passed"
95579,2010-02-01,"House Third Reading Passed"
95579,2010-02-04,"Introduced In Senate - Assigned to State, Veterans & Military Affairs"
95579,2010-03-01,"Senate Committee on State, Veterans & Military Affairs Refer Amended - Consent Calendar to Senate Committee of the Whole"
95579,2010-03-05,"Senate Second Reading Laid Over Daily"
95579,2010-03-08,"Senate Second Reading Passed with Amendments"
95579,2010-03-09,"Senate Third Reading Passed"
95579,2010-03-10,"House Considered Senate Amendments - Result was to Lay Over Daily"
95579,2010-03-11,"House Considered Senate Amendments - Result was to Concur - Repass"
95579,2010-03-18,"Signed by the Speaker of the House"
95579,2010-03-22,"Signed by the President of the Senate"
95579,2010-03-22,"Sent to the Governor"
95579,2010-03-31,"Governor Action - Signed"
95580,2010-01-13,"Introduced In House - Assigned to Judiciary + Appropriations"
95580,2010-02-18,"House Committee on Judiciary Refer Amended to Appropriations"
95580,2010-04-09,"House Committee on Appropriations Refer Amended to House Committee of the Whole"
95580,2010-04-13,"House Second Reading Passed with Amendments"
95580,2010-04-14,"House Third Reading Passed"
95580,2010-04-19,"Introduced In Senate - Assigned to Judiciary + Finance + Appropriations"
95580,2010-04-26,"Senate Committee on Judiciary Refer Amended to Finance"
95580,2010-04-29,"Senate Committee on Finance Refer Unamended to Appropriations"
95580,2010-05-04,"Senate Committee on Appropriations Refer Unamended to Senate Committee of the Whole"
95580,2010-05-06,"Senate Second Reading Laid Over Daily"
95580,2010-05-07,"Senate Second Reading Passed with Amendments"
95580,2010-05-10,"Senate Third Reading Passed"
95580,2010-05-11,"House Considered Senate Amendments - Result was to Concur - Repass"
95580,2010-05-19,"Signed by the Speaker of the House"
95580,2010-05-20,"Signed by the President of the Senate"
95580,2010-05-20,"Sent to the Governor"
95580,2010-05-25,"Governor Action - Signed"
95581,2010-01-13,"Introduced In House - Assigned to Judiciary + Appropriations"
95581,2010-02-22,"House Committee on Judiciary Postpone Indefinitely"
95582,2010-01-13,"Introduced In House - Assigned to Judiciary + Appropriations"
95582,2010-01-21,"House Committee on Judiciary Refer Amended to Appropriations"
95582,2010-03-05,"House Committee on Appropriations Refer Unamended to House Committee of the Whole"
95582,2010-03-09,"House Second Reading Laid Over Daily"
95582,2010-03-10,"House Second Reading Passed with Amendments"
95582,2010-03-11,"House Third Reading Passed"
95582,2010-03-15,"Introduced In Senate - Assigned to Judiciary"
95582,2010-03-26,"Senate Committee on Judiciary Refer Unamended - Consent Calendar to Senate Committee of the Whole"
95582,2010-03-31,"Senate Second Reading Laid Over Daily"
95582,2010-04-01,"Senate Second Reading Passed"
95582,2010-04-05,"Senate Third Reading Passed"
95582,2010-04-15,"Signed by the Speaker of the House"
95582,2010-04-16,"Signed by the President of the Senate"
95582,2010-04-16,"Sent to the Governor"
95582,2010-04-21,"Governor Action - Signed"
95583,2010-01-13,"Introduced In House - Assigned to Judiciary"
95583,2010-01-28,"House Committee on Judiciary Witness Testimony and/or Committee Discussion Only"
95583,2010-02-04,"House Committee on Judiciary Postpone Indefinitely"
95584,2010-01-13,"Introduced In House - Assigned to Business Affairs and Labor"
95584,2010-01-27,"House Committee on Business Affairs and Labor Refer Amended to House Committee of the Whole"
95584,2010-02-01,"House Second Reading Laid Over to 02/03/2010"
95584,2010-02-03,"House Second Reading Passed with Amendments"
95584,2010-02-04,"House Third Reading Passed"
95584,2010-02-09,"Introduced In Senate - Assigned to Business, Labor and Technology"
95584,2010-03-01,"Senate Committee on Business, Labor and Technology Refer Amended to Senate Committee of the Whole"
95584,2010-03-05,"Senate Second Reading Laid Over Daily"
95584,2010-03-11,"Senate Second Reading Passed with Amendments"
95584,2010-03-12,"Senate Third Reading Passed"
95584,2010-03-16,"House Considered Senate Amendments - Result was to Laid Over Daily"
95584,2010-03-18,"House Considered Senate Amendments - Result was to Laid Over Daily"
95584,2010-03-19,"House Considered Senate Amendments - Result was to Concur - Repass"
95584,2010-04-05,"Signed by the Speaker of the House"
95584,2010-04-07,"Signed by the President of the Senate"
95584,2010-04-07,"Sent to the Governor"
95584,2010-04-15,"Governor Action - Signed"
95585,2010-01-13,"Introduced In House - Assigned to Judiciary"
95585,2010-01-28,"House Committee on Judiciary Postpone Indefinitely"
95586,2010-01-13,"Introduced In House - Assigned to Finance + Appropriations"
95586,2010-02-10,"House Committee on Finance Postpone Indefinitely"
95587,2010-01-13,"Introduced In House - Assigned to Transportation & Energy"
95587,2010-02-02,"House Committee on Transportation & Energy Postpone Indefinitely"
95588,2010-01-13,"Introduced In House - Assigned to Judiciary + Appropriations"
95588,2010-01-28,"House Committee on Judiciary Refer Amended to Appropriations"
95588,2010-02-12,"House Committee on Appropriations Refer Unamended to House Committee of the Whole"
95588,2010-02-17,"House Second Reading Laid Over Daily"
95588,2010-02-22,"House Second Reading Passed with Amendments"
95588,2010-02-23,"House Third Reading Passed"
95588,2010-02-26,"Introduced In Senate - Assigned to Judiciary"
95588,2010-03-08,"Senate Committee on Judiciary Refer Unamended - Consent Calendar to Senate Committee of the Whole"
95588,2010-03-11,"Senate Second Reading Passed"
95588,2010-03-12,"Senate Third Reading Passed"
95588,2010-03-18,"Signed by the Speaker of the House"
95588,2010-03-22,"Signed by the President of the Senate"
95588,2010-03-22,"Sent to the Governor"
95588,2010-03-31,"Governor Action - Signed"
95589,2010-01-13,"Introduced In House - Assigned to Judiciary"
95589,2010-01-28,"House Committee on Judiciary Refer Unamended to House Committee of the Whole"
95589,2010-02-03,"House Second Reading Laid Over Daily"
95589,2010-02-04,"House Second Reading Passed with Amendments"
95589,2010-02-05,"House Third Reading Laid Over Daily"
95589,2010-02-08,"House Third Reading Passed"
95589,2010-02-09,"Introduced In Senate - Assigned to Judiciary"
95589,2010-03-01,"Senate Committee on Judiciary Refer Unamended to Senate Committee of the Whole"
95589,2010-03-05,"Senate Second Reading Laid Over Daily"
95589,2010-03-08,"Senate Second Reading Passed"
95589,2010-03-09,"Senate Third Reading Passed"
95589,2010-03-15,"Signed by the Speaker of the House"
95589,2010-03-18,"Signed by the President of the Senate"
95589,2010-03-18,"Sent to the Governor"
95589,2010-03-29,"Governor Action - Signed"
95590,2010-01-13,"Introduced In House - Assigned to State, Veterans, & Military Affairs"
95590,2010-01-21,"House Committee on State, Veterans, & Military Affairs Postpone Indefinitely"
95591,2010-01-13,"Introduced In House - Assigned to State, Veterans, & Military Affairs"
95591,2010-01-26,"House Committee on State, Veterans, & Military Affairs Postpone Indefinitely"
95592,2010-01-13,"Introduced In House - Assigned to Finance + Local Government"
95592,2010-01-26,"House Committee on Finance Refer Unamended to Local Government"
95592,2010-02-02,"House Committee on Local Government Postpone Indefinitely"
95593,2010-01-13,"Introduced In House - Assigned to Judiciary"
95593,2010-03-15,"House Committee on Judiciary Postpone Indefinitely"
95594,2010-01-13,"Introduced In House - Assigned to Local Government"
95594,2010-01-26,"House Committee on Local Government Refer Unamended to House Committee of the Whole"
95594,2010-01-29,"House Second Reading Special Order - Laid Over Daily"
95594,2010-02-01,"House Second Reading Special Order - Passed"
95594,2010-02-02,"House Third Reading Passed"
95594,2010-02-04,"Introduced In Senate - Assigned to Local Government and Energy"
95594,2010-02-16,"Senate Committee on Local Government and Energy Refer Unamended to Senate Committee of the Whole"
95594,2010-02-19,"Senate Second Reading Passed"
95594,2010-02-22,"Senate Third Reading Laid Over Daily"
95594,2010-02-24,"Senate Third Reading Passed"
95594,2010-03-01,"Signed by the Speaker of the House"
95594,2010-03-02,"Signed by the President of the Senate"
95594,2010-03-02,"Sent to the Governor"
95594,2010-03-10,"Governor Action - Signed"
95595,2010-01-13,"Introduced In House - Assigned to Transportation & Energy"
95595,2010-02-23,"House Committee on Transportation & Energy Refer Amended to House Committee of the Whole"
95595,2010-02-26,"House Second Reading Laid Over Daily"
95595,2010-03-01,"House Second Reading Passed with Amendments"
95595,2010-03-02,"House Third Reading Laid Over Daily"
95595,2010-03-03,"House Third Reading Passed"
95595,2010-03-09,"Introduced In Senate - Assigned to Transportation"
95595,2010-03-18,"Senate Committee on Transportation Refer Unamended - Consent Calendar to Senate Committee of the Whole"
95595,2010-03-23,"Senate Second Reading Passed"
95595,2010-03-25,"Senate Third Reading Passed"
95595,2010-04-14,"Senate Third Reading Passed with Amendments"
95595,2010-04-14,"Senate Third Reading Reconsidered"
95595,2010-04-15,"House Considered Senate Amendments - Result was to Lay Over Daily"
95595,2010-04-19,"House Considered Senate Amendments - Result was to Concur - Repass"
95595,2010-05-03,"Signed by the Speaker of the House"
95595,2010-05-07,"Signed by the President of the Senate"
95595,2010-05-07,"Sent to the Governor"
95595,2010-05-20,"Governor Action - Signed"
95596,2010-01-14,"Introduced In House - Assigned to Judiciary"
95596,2010-02-04,"House Committee on Judiciary Refer Amended to House Committee of the Whole"
95596,2010-02-10,"House Second Reading Laid Over to 02/12/2010"
95596,2010-02-12,"House Second Reading Special Order - Passed with Amendments"
95596,2010-02-15,"House Third Reading Laid Over Daily"
95596,2010-02-16,"House Third Reading Passed"
95596,2010-02-19,"Introduced In Senate - Assigned to Judiciary"
95596,2010-03-01,"Senate Committee on Judiciary Refer Unamended to Senate Committee of the Whole"
95596,2010-03-05,"Senate Second Reading Laid Over Daily"
95596,2010-03-08,"Senate Second Reading Passed"
95596,2010-03-09,"Senate Third Reading Passed"
95596,2010-03-15,"Signed by the Speaker of the House"
95596,2010-03-18,"Signed by the President of the Senate"
95596,2010-03-18,"Sent to the Governor"
95596,2010-03-25,"Governor Action - Signed"
95597,2010-01-14,"Introduced In House - Assigned to Transportation & Energy"
95597,2010-02-25,"House Committee on Transportation & Energy Refer Amended to House Committee of the Whole"
95597,2010-03-05,"House Second Reading Passed with Amendments"
95597,2010-03-08,"House Third Reading Passed"
95597,2010-03-11,"Introduced In Senate - Assigned to Local Government and Energy"
95597,2010-03-23,"Senate Committee on Local Government and Energy Refer Amended to Senate Committee of the Whole"
95597,2010-03-29,"Senate Second Reading Laid Over Daily"
95597,2010-04-01,"Senate Second Reading Passed with Amendments"
95597,2010-04-05,"Senate Third Reading Passed"
95597,2010-04-07,"House Considered Senate Amendments - Result was to Laid Over Daily"
95597,2010-04-08,"House Considered Senate Amendments - Result was to Not Concur - Request Conference Committee"
95597,2010-04-20,"First Conference Committee Result was to Adopt Rerevised w/ Amendments"
95597,2010-04-28,"Senate Consideration of First Conference Committee Report result was to Adhere"
95597,2010-05-06,"House Considered Senate Amendments - Result was to Concur - Repass"
95597,2010-05-06,"House Consideration of First Conference Committee Report result was to Recede"
95597,2010-05-19,"Signed by the Speaker of the House"
95597,2010-05-20,"Signed by the President of the Senate"
95597,2010-05-20,"Sent to the Governor"
95597,2010-06-11,"Governor Action - Signed"
95598,2010-01-14,"Introduced In House - Assigned to Agriculture, Livestock, & Natural Resources"
95598,2010-01-27,"House Committee on Agriculture, Livestock, & Natural Resources Refer Unamended to House Committee of the Whole"
95598,2010-02-01,"House Second Reading Laid Over to 02/03/2010"
95598,2010-02-03,"House Second Reading Passed"
95598,2010-02-04,"House Third Reading Passed"
95598,2010-02-09,"Introduced In Senate - Assigned to Agriculture and Natural Resources"
95598,2010-03-04,"Senate Committee on Agriculture and Natural Resources Refer Unamended to Senate Committee of the Whole"
95598,2010-03-09,"Senate Second Reading Laid Over Daily"
95598,2010-03-12,"Senate Second Reading Passed with Amendments"
95598,2010-03-15,"Senate Third Reading Passed"
95598,2010-03-17,"House Considered Senate Amendments - Result was to Laid Over Daily"
95598,2010-03-18,"House Considered Senate Amendments - Result was to Laid Over Daily"
95598,2010-03-19,"House Considered Senate Amendments - Result was to Not Concur - Request Conference Committee"
95598,2010-04-01,"First Conference Committee Result was to Adopt Rerevised w/ Amendments"
95598,2010-04-13,"Senate Consideration of First Conference Committee Report result was to Adopt Committee Report - Repass"
95598,2010-04-28,"House Consideration of First Conference Committee Report result was to Adopt Committee Report - Repass"
95598,2010-05-20,"Signed by the Speaker of the House"
95598,2010-05-24,"Signed by the President of the Senate"
95598,2010-05-24,"Sent to the Governor"
95598,2010-05-27,"Governor Action - Signed"
95599,2010-01-14,"Introduced In House - Assigned to State, Veterans, & Military Affairs"
95599,2010-02-09,"House Committee on State, Veterans, & Military Affairs Postpone Indefinitely"
95600,2010-01-14,"Introduced In House - Assigned to Transportation & Energy + Appropriations"
95600,2010-02-23,"House Committee on Transportation & Energy Refer Amended to Appropriations"
95600,2010-03-05,"House Committee on Appropriations Refer Unamended to House Committee of the Whole"
95600,2010-03-09,"House Second Reading Laid Over Daily"
95600,2010-03-10,"House Second Reading Passed with Amendments"
95600,2010-03-11,"House Third Reading Passed"
95600,2010-03-15,"Introduced In Senate - Assigned to State, Veterans & Military Affairs"
95600,2010-03-29,"Senate Committee on State, Veterans & Military Affairs Refer Unamended - Consent Calendar to Senate Committee of the Whole"
95600,2010-04-01,"Senate Second Reading Passed"
95600,2010-04-05,"Senate Third Reading Passed"
95600,2010-04-26,"Signed by the Speaker of the House"
95600,2010-04-29,"Signed by the President of the Senate"
95600,2010-04-29,"Sent to the Governor"
95600,2010-05-10,"Governor Action - Vetoed"
95601,2010-01-14,"Introduced In House - Assigned to State, Veterans, & Military Affairs"
95601,2010-02-09,"House Committee on State, Veterans, & Military Affairs Postpone Indefinitely"
95602,2010-01-14,"Introduced In House - Assigned to Health and Human Services + Finance + Appropriations"
95602,2010-02-25,"House Committee on Health and Human Services Refer Amended to Finance"
95602,2010-03-10,"House Committee on Finance Refer Amended to Appropriations"
95602,2010-04-16,"House Committee on Appropriations Refer Amended to House Committee of the Whole"
95602,2010-04-20,"House Second Reading Laid Over to 04/23/2010"
95602,2010-04-23,"House Second Reading Passed with Amendments"
95602,2010-04-26,"House Third Reading Passed"
95602,2010-04-27,"Introduced In Senate - Assigned to Finance + Appropriations"
95602,2010-05-04,"Senate Committee on Finance Refer Amended to Appropriations"
95602,2010-05-07,"Senate Committee on Appropriations Postpone Indefinitely"
95603,2010-01-15,"Introduced In House - Assigned to Judiciary + Appropriations"
95603,2010-02-08,"House Committee on Judiciary Witness Testimony and/or Committee Discussion Only"
95603,2010-02-26,"House Committee on Judiciary Refer Amended to Appropriations"
95603,2010-03-12,"House Committee on Appropriations Refer Unamended to House Committee of the Whole"
95603,2010-03-16,"House Second Reading Passed with Amendments"
95603,2010-03-17,"House Third Reading Passed"
95603,2010-03-19,"Introduced In Senate - Assigned to Judiciary"
95603,2010-03-23,"Senate Committee on Judiciary Refer Amended - Consent Calendar to Senate Committee of the Whole"
95603,2010-03-29,"Senate Second Reading Passed with Amendments"
95603,2010-03-30,"Senate Third Reading Laid Over Daily"
95603,2010-03-31,"Senate Third Reading Passed"
95603,2010-04-01,"House Considered Senate Amendments - Result was to Concur - Repass"
95603,2010-04-07,"Signed by the Speaker of the House"
95603,2010-04-08,"Signed by the President of the Senate"
95603,2010-04-08,"Sent to the Governor"
95603,2010-04-16,"Governor Action - Signed"
95604,2010-01-15,"Introduced In House - Assigned to Judiciary"
95604,2010-02-18,"House Committee on Judiciary Refer Unamended to House Committee of the Whole"
95604,2010-02-23,"House Second Reading Laid Over Daily"
95604,2010-02-24,"House Second Reading Passed"
95604,2010-02-25,"House Third Reading Passed"
95604,2010-03-01,"Introduced In Senate - Assigned to Judiciary"
95604,2010-05-03,"Senate Committee on Judiciary Postpone Indefinitely"
95605,2010-01-15,"Introduced In House - Assigned to Health and Human Services + Appropriations"
95605,2010-02-01,"House Committee on Health and Human Services Witness Testimony and/or Committee Discussion Only"
95605,2010-02-04,"House Committee on Health and Human Services Refer Amended to Appropriations"
95605,2010-02-12,"House Committee on Appropriations Refer Amended to House Committee of the Whole"
95605,2010-02-17,"House Second Reading Laid Over Daily"
95605,2010-02-19,"House Second Reading Passed with Amendments"
95605,2010-02-22,"House Third Reading Passed"
95605,2010-02-24,"Introduced In Senate - Assigned to Health and Human Services + Appropriations"
95605,2010-03-11,"Senate Committee on Health and Human Services Refer Unamended to Appropriations"
95605,2010-04-23,"Senate Committee on Appropriations Refer Unamended to Senate Committee of the Whole"
95605,2010-04-27,"Senate Second Reading Passed with Amendments"
95605,2010-04-28,"Senate Third Reading Passed"
95605,2010-04-30,"House Considered Senate Amendments - Result was to Laid Over Daily"
95605,2010-05-03,"Senate Third Reading Reconsidered"
95605,2010-05-03,"Senate Third Reading Passed with Amendments"
95605,2010-05-04,"House Considered Senate Amendments - Result was to Concur - Repass"
95605,2010-05-25,"Signed by the President of the Senate"
95605,2010-05-25,"Signed by the Speaker of the House"
95605,2010-05-25,"Sent to the Governor"
95605,2010-05-26,"Governor Action - Signed"
95606,2010-01-15,"Introduced In House - Assigned to Agriculture, Livestock, & Natural Resources"
95606,2010-02-03,"House Committee on Agriculture, Livestock, & Natural Resources Refer Amended to House Committee of the Whole"
95606,2010-02-05,"House Second Reading Passed with Amendments"
95606,2010-02-08,"House Third Reading Passed"
95606,2010-02-12,"Introduced In Senate - Assigned to State, Veterans & Military Affairs"
95606,2010-03-02,"Senate Committee on State, Veterans & Military Affairs Witness Testimony and/or Committee Discussion Only"
95606,2010-03-08,"Senate Committee on State, Veterans & Military Affairs Refer Amended to Senate Committee of the Whole"
95606,2010-03-12,"Senate Second Reading Laid Over Daily"
95606,2010-03-15,"Senate Second Reading Passed with Amendments"
95606,2010-03-16,"Senate Third Reading Passed"
95606,2010-03-18,"House Considered Senate Amendments - Result was to Laid Over Daily"
95606,2010-03-19,"House Considered Senate Amendments - Result was to Concur - Repass"
95606,2010-04-08,"Signed by the President of the Senate"
95606,2010-04-08,"Signed by the Speaker of the House"
95606,2010-04-09,"Sent to the Governor"
95606,2010-04-14,"Governor Action - Signed"
95607,2010-01-15,"Introduced In House - Assigned to Business Affairs and Labor"
95607,2010-02-10,"House Committee on Business Affairs and Labor Refer Amended to House Committee of the Whole"
95607,2010-02-17,"House Second Reading Passed with Amendments"
95607,2010-02-18,"House Third Reading Passed"
95607,2010-02-19,"Introduced In Senate - Assigned to Business, Labor and Technology"
95607,2010-03-03,"Senate Committee on Business, Labor and Technology Witness Testimony and/or Committee Discussion Only"
95607,2010-03-15,"Senate Committee on Business, Labor and Technology Refer Amended - Consent Calendar to Senate Committee of the Whole"
95607,2010-03-18,"Senate Second Reading Laid Over Daily"
95607,2010-03-19,"Senate Second Reading Passed with Amendments"
95607,2010-03-22,"Senate Third Reading Passed"
95607,2010-03-26,"House Considered Senate Amendments - Result was to Laid Over Daily"
95607,2010-03-29,"House Considered Senate Amendments - Result was to Laid Over Daily"
95607,2010-03-31,"House Considered Senate Amendments - Result was to Concur - Repass"
95607,2010-04-08,"Signed by the President of the Senate"
95607,2010-04-08,"Signed by the Speaker of the House"
95607,2010-04-09,"Sent to the Governor"
95607,2010-04-15,"Governor Action - Signed"
95608,2010-01-15,"Introduced In House - Assigned to Judiciary"
95608,2010-02-18,"House Committee on Judiciary Refer Amended to House Committee of the Whole"
95608,2010-02-23,"House Second Reading Laid Over Daily"
95608,2010-02-25,"House Second Reading Passed with Amendments"
95608,2010-02-26,"House Third Reading Passed"
95608,2010-03-01,"Introduced In Senate - Assigned to Judiciary"
95608,2010-03-10,"Senate Committee on Judiciary Refer Amended to Senate Committee of the Whole"
95608,2010-03-15,"Senate Second Reading Laid Over Daily"
95608,2010-03-23,"Senate Second Reading Passed with Amendments"
95608,2010-03-25,"House Considered Senate Amendments - Result was to Lay Over Daily"
95608,2010-03-25,"Senate Third Reading Passed"
95608,2010-03-31,"House Considered Senate Amendments - Result was to Concur - Repass"
95608,2010-04-16,"Signed by the Speaker of the House"
95608,2010-04-19,"Signed by the President of the Senate"
95608,2010-04-19,"Sent to the Governor"
95608,2010-04-29,"Governor Action - Signed"
95609,2010-01-15,"Introduced In House - Assigned to Appropriations"
95609,2010-01-27,"House Committee on Appropriations Refer Unamended to House Committee of the Whole"
95609,2010-01-29,"House Second Reading Special Order - Laid Over Daily"
95609,2010-02-01,"House Second Reading Special Order - Passed"
95609,2010-02-02,"House Third Reading Passed"
95609,2010-02-03,"Introduced In Senate - Assigned to Appropriations"
95609,2010-02-12,"Senate Committee on Appropriations Refer Unamended to Senate Committee of the Whole"
95609,2010-02-16,"Senate Second Reading Laid Over Daily"
95609,2010-02-19,"Senate Second Reading Passed"
95609,2010-02-22,"Senate Third Reading Laid Over Daily"
95609,2010-02-24,"Senate Third Reading Passed"
95609,2010-02-24,"Senate Third Reading Passed"
95609,2010-02-24,"Senate Third Reading Reconsidered"
95609,2010-03-04,"Signed by the President of the Senate"
95609,2010-03-04,"Signed by the Speaker of the House"
95609,2010-03-04,"Sent to the Governor"
95609,2010-03-15,"Governor Action - Signed"
95610,2010-01-15,"Introduced In House - Assigned to State, Veterans, & Military Affairs"
95610,2010-03-04,"House Committee on State, Veterans, & Military Affairs Witness Testimony and/or Committee Discussion Only"
95610,2010-03-09,"House Committee on State, Veterans, & Military Affairs Postpone Indefinitely"
95611,2010-01-15,"Introduced In House - Assigned to Judiciary"
95611,2010-02-01,"House Committee on Judiciary Refer Amended to House Committee of the Whole"
95611,2010-02-04,"House Second Reading Laid Over Daily"
95611,2010-02-05,"House Second Reading Passed with Amendments"
95611,2010-02-08,"House Third Reading Passed"
95611,2010-02-09,"Introduced In Senate - Assigned to Judiciary"
95611,2010-03-01,"Senate Committee on Judiciary Refer Amended to Senate Committee of the Whole"
95611,2010-03-05,"Senate Second Reading Laid Over Daily"
95611,2010-03-08,"Senate Second Reading Passed with Amendments"
95611,2010-03-09,"Senate Third Reading Passed"
95611,2010-03-10,"House Considered Senate Amendments - Result was to Lay Over Daily"
95611,2010-03-11,"House Considered Senate Amendments - Result was to Concur - Repass"
95611,2010-03-18,"Signed by the Speaker of the House"
95611,2010-03-22,"Signed by the President of the Senate"
95611,2010-03-22,"Sent to the Governor"
95611,2010-03-31,"Governor Action - Signed"
95612,2010-01-15,"Introduced In House - Assigned to Transportation & Energy + Appropriations"
95612,2010-03-04,"House Committee on Transportation & Energy Refer Amended to Appropriations"
95612,2010-04-16,"House Committee on Appropriations Lay Over Unamended - Amendment(s) Failed"
95612,2010-04-23,"House Committee on Appropriations Refer Amended to House Committee of the Whole"
95612,2010-04-26,"House Second Reading Laid Over Daily"
95612,2010-04-29,"House Second Reading Passed with Amendments"
95612,2010-04-30,"House Third Reading Passed with Amendments"
95612,2010-04-30,"Introduced In Senate - Assigned to Transportation + Appropriations"
95612,2010-05-04,"Senate Committee on Transportation Refer Amended to Appropriations"
95612,2010-05-06,"Senate Committee on Appropriations Refer Unamended - Consent Calendar to Senate Committee of the Whole"
95612,2010-05-07,"Senate Second Reading Special Order - Passed with Amendments"
95612,2010-05-10,"Senate Third Reading Passed"
95612,2010-05-11,"House Considered Senate Amendments - Result was to Concur - Repass"
95612,2010-05-19,"Signed by the Speaker of the House"
95612,2010-05-20,"Signed by the President of the Senate"
95612,2010-05-20,"Sent to the Governor"
95612,2010-05-21,"Governor Action - Signed"
95613,2010-01-15,"Introduced In House - Assigned to Business Affairs and Labor + Appropriations"
95613,2010-02-09,"House Committee on Business Affairs and Labor Refer Amended to Appropriations"
95613,2010-02-19,"House Committee on Appropriations Refer Amended to House Committee of the Whole"
95613,2010-02-23,"House Second Reading Laid Over Daily"
95613,2010-02-24,"House Second Reading Passed with Amendments"
95613,2010-02-25,"House Third Reading Passed"
95613,2010-03-01,"Introduced In Senate - Assigned to Business, Labor and Technology + Appropriations"
95613,2010-03-10,"Senate Committee on Business, Labor and Technology Refer Amended to Appropriations"
95613,2010-03-19,"Senate Committee on Appropriations Refer Unamended - Consent Calendar to Senate Committee of the Whole"
95613,2010-03-23,"Senate Second Reading Laid Over Daily"
95613,2010-03-25,"Senate Second Reading Passed with Amendments"
95613,2010-03-26,"Senate Third Reading Passed with Amendments"
95613,2010-03-31,"House Considered Senate Amendments - Result was to Laid Over Daily"
95613,2010-04-01,"House Considered Senate Amendments - Result was to Concur - Repass"
95613,2010-04-26,"Signed by the Speaker of the House"
95613,2010-04-30,"Signed by the President of the Senate"
95613,2010-04-30,"Sent to the Governor"
95613,2010-05-05,"Governor Action - Signed"
95614,2010-01-15,"Introduced In House - Assigned to Health and Human Services"
95614,2010-02-04,"House Committee on Health and Human Services Refer Unamended to House Committee of the Whole"
95614,2010-02-11,"House Second Reading Laid Over Daily"
95614,2010-02-12,"House Second Reading Special Order - Laid Over to 02/17/2010"
95614,2010-02-17,"House Second Reading Special Order - Passed"
95614,2010-02-18,"House Third Reading Passed"
95614,2010-02-19,"Introduced In Senate - Assigned to Health and Human Services"
95614,2010-03-10,"Senate Committee on Health and Human Services Refer Unamended to Senate Committee of the Whole"
95614,2010-03-15,"Senate Second Reading Laid Over Daily"
95614,2010-03-19,"Senate Second Reading Passed"
95614,2010-03-22,"Senate Third Reading Passed"
95614,2010-04-05,"Signed by the Speaker of the House"
95614,2010-04-07,"Signed by the President of the Senate"
95614,2010-04-07,"Sent to the Governor"
95614,2010-04-15,"Governor Action - Signed"
95615,2010-01-15,"Introduced In House - Assigned to State, Veterans, & Military Affairs"
95615,2010-01-28,"House Committee on State, Veterans, & Military Affairs Refer Unamended to House Committee of the Whole"
95615,2010-02-03,"House Second Reading Laid Over Daily"
95615,2010-02-04,"House Second Reading Passed with Amendments"
95615,2010-02-05,"House Third Reading Laid Over Daily"
95615,2010-02-08,"House Third Reading Passed"
95615,2010-02-09,"Introduced In Senate - Assigned to State, Veterans & Military Affairs"
95615,2010-03-22,"Senate Committee on State, Veterans & Military Affairs Refer Amended - Consent Calendar to Senate Committee of the Whole"
95615,2010-03-29,"Senate Second Reading Passed with Amendments"
95615,2010-03-30,"Senate Third Reading Laid Over Daily"
95615,2010-03-31,"Senate Third Reading Passed"
95615,2010-04-01,"House Considered Senate Amendments - Result was to Concur - Repass"
95615,2010-04-26,"Signed by the Speaker of the House"
95615,2010-04-30,"Signed by the President of the Senate"
95615,2010-04-30,"Sent to the Governor"
95615,2010-05-05,"Governor Action - Signed"
95616,2010-01-15,"Introduced In House - Assigned to Local Government"
95616,2010-01-28,"House Committee on Local Government Refer Amended to House Committee of the Whole"
95616,2010-02-03,"House Second Reading Laid Over Daily"
95616,2010-02-04,"House Second Reading Passed with Amendments"
95616,2010-02-05,"House Third Reading Laid Over Daily"
95616,2010-02-08,"House Third Reading Passed"
95616,2010-02-09,"Introduced In Senate - Assigned to Local Government and Energy"
95616,2010-03-25,"Senate Committee on Local Government and Energy Refer Unamended - Consent Calendar to Senate Committee of the Whole"
95616,2010-03-31,"Senate Second Reading Laid Over Daily"
95616,2010-04-01,"Senate Second Reading Passed"
95616,2010-04-05,"Senate Third Reading Passed"
95616,2010-04-26,"Signed by the Speaker of the House"
95616,2010-04-30,"Signed by the President of the Senate"
95616,2010-04-30,"Sent to the Governor"
95616,2010-05-05,"Governor Action - Signed"
95617,2010-01-15,"Introduced In House - Assigned to Local Government"
95617,2010-01-28,"House Committee on Local Government Lay Over Unamended - Amendment(s) Failed"
95617,2010-02-09,"House Committee on Local Government Refer Amended to House Committee of the Whole"
95617,2010-02-12,"House Second Reading Laid Over Daily"
95617,2010-02-18,"House Second Reading Passed with Amendments"
95617,2010-02-19,"House Third Reading Passed"
95617,2010-02-24,"Introduced In Senate - Assigned to Local Government and Energy"
95617,2010-03-16,"Senate Committee on Local Government and Energy Refer Unamended to Senate Committee of the Whole"
95617,2010-03-19,"Senate Second Reading Laid Over Daily"
95617,2010-03-23,"Senate Second Reading Passed with Amendments"
95617,2010-03-25,"Senate Third Reading Laid Over to 04/16/2010"
95617,2010-04-19,"Senate Third Reading Passed"
95617,2010-04-20,"House Considered Senate Amendments - Result was to Lay Over Daily"
95617,2010-04-28,"House Considered Senate Amendments - Result was to Concur - Repass"
95617,2010-05-20,"Signed by the Speaker of the House"
95617,2010-05-24,"Signed by the President of the Senate"
95617,2010-05-24,"Sent to the Governor"
95617,2010-06-07,"Governor Action - Signed"
95618,2010-01-15,"Introduced In House - Assigned to State, Veterans, & Military Affairs + Appropriations"
95618,2010-02-09,"House Committee on State, Veterans, & Military Affairs Refer Amended to Appropriations"
95618,2010-03-05,"House Committee on Appropriations Refer Amended to House Committee of the Whole"
95618,2010-03-09,"House Second Reading Laid Over Daily"
95618,2010-03-12,"House Second Reading Passed with Amendments"
95618,2010-03-15,"House Third Reading Laid Over Daily"
95618,2010-03-16,"House Third Reading Passed"
95618,2010-03-18,"Introduced In Senate - Assigned to Finance + Appropriations"
95618,2010-04-13,"Senate Committee on Finance Refer Amended to Appropriations"
95618,2010-04-30,"Senate Committee on Appropriations Refer Unamended to Senate Committee of the Whole"
95618,2010-04-30,"Senate Second Reading Special Order - Passed with Amendments"
95618,2010-05-03,"Senate Third Reading Passed"
95618,2010-05-04,"House Considered Senate Amendments - Result was to Concur - Repass"
95618,2010-05-25,"Signed by the President of the Senate"
95618,2010-05-25,"Signed by the Speaker of the House"
95618,2010-05-25,"Sent to the Governor"
95618,2010-06-05,"Governor Action - Signed"
95619,2010-01-15,"Introduced In House - Assigned to Judiciary + Finance"
95619,2010-02-01,"House Committee on Judiciary Postpone Indefinitely"
95620,2010-01-15,"Introduced In House - Assigned to Finance"
95620,2010-02-02,"House Committee on Finance Lay Over Unamended - Amendment(s) Failed"
95620,2010-02-02,"House Committee on Finance Postpone Indefinitely"
95621,2010-01-15,"Introduced In House - Assigned to Health and Human Services"
95621,2010-02-08,"House Committee on Health and Human Services Refer Amended to House Committee of the Whole"
95621,2010-02-22,"House Second Reading Laid Over to 02/24/2010"
95621,2010-02-24,"House Second Reading Passed with Amendments"
95621,2010-02-25,"House Third Reading Passed"
95621,2010-03-01,"Introduced In Senate - Assigned to Health and Human Services + Judiciary"
95621,2010-03-25,"Senate Committee on Health and Human Services Refer Amended to Senate Committee of the Whole"
95621,2010-04-12,"Senate Committee on Judiciary Refer Amended to Senate Committee of the Whole"
95621,2010-04-22,"Senate Second Reading Laid Over Daily"
95621,2010-04-23,"Senate Second Reading Passed with Amendments"
95621,2010-04-26,"Senate Third Reading Passed"
95621,2010-05-25,"Signed by the President of the Senate"
95621,2010-05-25,"Signed by the Speaker of the House"
95621,2010-05-25,"Sent to the Governor"
95621,2010-05-26,"Governor Action - Signed"
95622,2010-01-15,"Introduced In House - Assigned to Judiciary"
95622,2010-02-22,"House Committee on Judiciary Refer Amended to House Committee of the Whole"
