bill_id,date,action
347438,2011-01-03,"House Introduced 1/5/2011 and Referred to State-Federal Relations and Veterans Affairs; House Journal  8, PG.131 "
347438,2011-01-18,"House Public Hearing: 1/27/2011 9:30 Amendment Legislative Office Building 203 ==Executive Session to Follow== "
347438,2011-02-09,"House Retained in Committee; House Calendar 27, PG.825 "
347438,2011-05-10,"House Retained Bill - Subcommittee Work Session: 5/19/2011 9:30 Amendment Legislative Office Building 203 "
347438,2011-09-14,"House ==CANCELLED== Retained Bill - Full Committee Work Session: 10/6/2011 9:30 Amendment Legislative Office Building 203 "
347438,2011-09-27,"House Retained Bill - Executive Session: 10/6/2011 9:30 Amendment Legislative Office Building 203 "
347438,2011-10-06,"House Committee Report: Inexpedient to Legislate for Jan 4 (Vote 9-1; Consent Calendar); House Calendar 70, PG.2210 "
347438,2012-01-04,"House Inexpedient to Legislate: Motion Adopted Voice Vote; House Journal  7, PG.428 "
347439,2011-01-24,"House Introduced 1/6/2011 and Referred to Ways and Means; House Journal  11, PG. 189 "
347439,2011-02-09,"House Public Hearing: 2/24/2011 10:00 Amendment Legislative Office Building 202 "
347439,2011-02-23,"House Executive Session: 3/9/2011 1:00 PM Legislative Office Building 202 ==TIME CHANGE (Orig 2:00 PM)== "
347439,2011-03-09,"House Majority Committee Report: Ought to Pass with Amendment #0699h(NT) for Mar 15 (Vote 13-6; Regular Calendar); House Calendar 22, PG.570 "
347439,2011-03-09,"House Proposed Majority Committee Amendment #2011-0699h (New Title); House Calendar 23, PG.580 "
347439,2011-03-09,"House Minority Committee Report: Inexpedient to Legislate; House Calendar 22, PG.570 "
347439,2011-03-16,"House Special Order to Next Order of Business (Rep Bettencourt): Motion Adopted Division Vote 244-93; House Journal  28, PG.893 "
347439,2011-03-16,"House Amendment #0699h (New Title) Adopted, Voice Vote; House Journal  28, PG.893-894 "
347439,2011-03-16,"House Ought to Pass with Amendment #0699h(NT): Motion Failed Regular Calendar 234-118 Lacking Constitutionally Required Three-Fifths Vote; House Journal  28, PG.893-897 "
347439,2011-03-16,"House Inexpedient to Legislate (Rep Norelli); House Journal  28, PG.893-897 "
347439,2011-03-16,"House Lay on the Table (Rep Bettencourt): Motion Adopted Division Vote 341-14; House Journal  28, PG.897 "
347439,2011-03-30,"House Remove from the Table (Rep Bettencourt): Motion Adopted Division Vote 248-118; House Journal  34, PG.1102 "
347439,2011-03-30,"House Suspend House Rules to Take Up Further Action on CACR6 (Rep Bettencourt): Motion Adopted Regular Calendar 258-114 by Required Two-Thirds; House Journal  34, PG.1102-1104 "
347439,2011-03-30,"House Inexpedient to Legislate: Motion Failed Regular Calendar 119-251; House Journal  34, PG.1104-1106 "
347439,2011-03-30,"House Ought to Pass with Amendment (Rep Jasper); House Journal  34, PG.1106 "
347439,2011-03-30,"House Shall the Rule of the Chair be Upheld (Rep Norelli): Motion Adopted Regular Calendar 270-101; House Journal  34, PG.1107-1109 "
347439,2011-03-30,"House Floor Amendment #2011-1169h (New Title) (Rep O'Brien et al) Adopted, Regular Calendar 265-107; House Journal  34, PG.1106-1111 "
347439,2011-03-30,"House Ought to Pass with Amendment #1169h(NT): Motion Adopted Regular Calendar 256-117 by Required Three-Fifths; House Journal  34, PG.1111-1113 "
347439,2011-03-30,"House Reconsideration (Rep Bettencourt): Motion Failed Division Vote 104-269; House Journal  34, PG.1113-1114 "
347439,2011-03-30,"House Print Debate in Permanent Journal (Rep Tamburello): Motion Adopted Voice Vote; House Journal  34, PG.1114-1121 "
347439,2011-04-27,"Senate Introduced and Referred to Internal Affairs; Senate Journal 15, Pg.291 "
347439,2011-05-05,"Senate Hearing: 5/11/11, Room 100, State House, 2:00 p.m.; Senate Calendar 23 "
347439,2011-05-26,"Senate Committee Report: Rereferred to Committee, 6/1/11; Senate Calendar 26 "
347439,2011-06-01,"Senate Rereferred to Committee, Motion Adopted, Voice Vote; Senate Journal 19, Pg.517 "
347439,2012-02-01,"Senate Committee Report: Ought to Pass, 2/8/12; Senate Calendar 6 "
347439,2012-02-08,"Senate Special Order to 2/15/12, Without Objection, Motion Adopted; Senate Journal 4, Pg.104 "
347439,2012-02-08,"Senate Committee Report: Ought to Pass, 2/15/12; Senate Calendar 7 "
347439,2012-02-15,"Senate Sen. Bragdon Floor Amendment #2012-0846s, New Title, Regular Calendar 18Y-6N, Amendment Adopted; Senate Journal 5, Pg.136 "
347439,2012-02-15,"Senate Sen. Forsythe Floor Amendment #2012-0847s, Regular Calendar 18Y-6N, Amendment Adopted; Senate Journal 5, Pg.137 "
347439,2012-02-15,"Senate Ought to Pass with Amendment 0846s, New Title, 0847s, Regular Calendar 17Y-7N, Motion Adopted; OT3rdg; Senate Journal 5, Pg.137 "
347439,2012-03-07,"House House Non-Concurs with Senate Amendment's and Requests C of C (Rep Stepanek): Motion Adopted Voice Vote; House Journal  21, PG.1349 "
347439,2012-03-07,"House Speaker Appoints: Reps Stepanek, Sanborn, Ulery, and Azarian; House Journal  21, PG.1349 "
347439,2012-03-21,"Senate Sen. Bradley accedes to House Request for Committee of Conference, Motion Adopted, Voice Vote "
347439,2012-05-23,"Senate President Appoints: Senators Sanborn, DeBlois, and Larsen"
347439,2012-05-24,"House Conference Committee Meeting: 5/25/2012 11:00 Amendment State House 100 ==ROOM CHANGE (Orig Legislative Office Building 202)== ==RECESSED== "
347439,2012-05-25,"House Conferee Change: Rep Ohm Replaces Rep Azarian; House Journal  46, PG.2495 "
347439,2012-05-25,"House Conference Committee Meeting: 5/29/2012 3:00 PM Legislative Office Building 202 "
347439,2012-05-30,"Senate Conferee Change; Senator Luther Replaces Senator Larsen "
347439,2012-05-31,"Senate Conference Committee Report #2012-2458c; House Amendment + New Amendment, Filed "
347439,2012-06-06,"Senate Conference Committee Report 2458c; 3/5 necessary, Regular Calendar 14Y-9N, Adopted "
347441,2011-01-24,"House Introduced 1/6/2011 and Referred to Special Committee on Education Funding Reform; House Journal  11, PG. 187 "
347441,2011-02-08,"House Public Hearing: 2/18/2011 11:00 Amendment Legislative Office Building 205-207 "
347441,2011-02-08,"House Full Committee Work Session: 3/4/2011 9:30 Amendment Legislative Office Building 207 "
347441,2011-02-08,"House Executive Session: 3/4/2011 10:00 Amendment Legislative Office Building 207 "
347441,2011-03-04,"House Retained in Committee; House Calendar 27, PG.825 "
347441,2011-09-14,"House Retained Bill - Full Committee Work Session: 9/27/2011 10:00 Amendment Legislative Office Building 210-211 "
347441,2011-09-14,"House Retained Bill - Executive Session: 9/27/2011 11:00 Amendment or Immediately Following Work Session Legislative Office Building 210-211 "
347441,2011-10-25,"House Committee Report: Refer to Interim Study for Jan 4 (Vote 15-0; Consent Calendar); House Calendar 70, PG.2209 "
347441,2012-01-04,"House Refer to Interim Study: Motion Adopted Voice Vote; House Journal  7, PG.423 "
347441,2012-06-07,"House Referred to Special Committee on Education Funding Reform for Interim Study; House Calendar 45, PG.2434 "
347441,2012-06-19,"House Interim Study - Full Committee Work Session: 6/27/2012 1:00 PM Legislative Office Building 301 "
347441,2012-06-19,"House Interim Study - Full Committee Work Session: 6/28/2012 10:00 Amendment Legislative Office Building 301 "
347442,2011-01-25,"House Introduced 1/6/2011 and Referred to Education; House Journal  11, PG. 196 "
347442,2011-02-16,"House Public Hearing: 2/24/2011 11:00 Amendment Legislative Office Building 207 "
347442,2011-02-18,"House Executive Session: 2/24/2011 11:30 Amendment Legislative Office Building 207 "
347442,2011-02-24,"House Retained in Committee; House Calendar 27, PG.823 "
347442,2011-09-14,"House Retained Bill - Subcommittee Work Session: 9/20/2011 9:00 Amendment Legislative Office Building 207 "
347442,2011-10-04,"House Retained Bill - Executive Session: 10/18/2011 10:00 Amendment Legislative Office Building 207 (If Necessary Continued 10/25/2011 10:00 Amendment Legislative Office Building 207) "
347442,2011-11-02,"House Majority Committee Report: Ought to Pass for Jan 4 (Vote 10-5; Regular Calendar); House Calendar 70, PG.2216 "
347442,2011-11-02,"House Minority Committee Report: Inexpedient to Legislate; House Calendar 70, PG.2216-2217 "
347442,2012-01-05,"House Special Order to End of Regular Calendar Including Bills Removed from Consent Calendar (Rep Balboni): Motion Adopted Voice Vote; House Journal  8, PG.472-473 "
347442,2012-01-05,"House Special Order to Next Order of Business (Rep G.Richardson): Motion Adopted Regular Calendar 328-19; House Journal  8, PG.477-479 "
347442,2012-01-05,"House Ought to Pass: Motion Failed Regular Calendar 219-127 Lacking Required Three-Fifths Vote; House Journal  8, PG.479-482 "
347442,2012-01-05,"House Laid on Table (Rep Vaillancourt): Motion Failed Division Vote 114-234; House Journal  8, PG.482 "
347442,2012-01-05,"House Recommit (Rep Balboni): Motion Adopted Division Vote 246-103; House Journal  8, PG.482 "
347442,2012-01-11,"House Public Hearing: 2/16/2012 1:00 PM Legislative Office Building 207 "
347442,2012-01-12,"House Executive Session: 2/21/2012 10:00 Amendment Legislative Office Building 207 "
347442,2012-02-23,"House Majority Committee Report: Ought to Pass for Mar 7 (Vote 12-5; Regular Calendar); House Calendar 25, PG.1501-1502 "
347442,2012-02-23,"House Minority Committee Report: Inexpedient to Legislate; House Calendar 25, PG.1501-1502 "
347442,2012-03-08,"House Lay On The Table (Rep Bettencourt): Motion Failed Division Vote 229-83 Lacking Necessary Three-Fifths Vote; House Journal  23, PG.1427 "
347442,2012-03-08,"House Postpone to a Date Certain Being Mar 15 (Rep Bettencourt): Motion Adopted Voice Vote; House Journal  23, PG.1427 "
347442,2012-03-15,"House Special Order to a Time Certain Being March 21 Session (Rep Bettencourt): Motion Adopted Voice Vote; House Journal  26, PG.1649 "
347442,2012-03-21,"House Special Order to a Time Certain Being March 28 Session at Approx 11:00 Amendment (Rep Bettencourt): Motion Adopted Voice Vote; House Journal  28, PG.1715-1716 "
347442,2012-03-28,"House Ought to Pass: Motion Failed Regular Calendar 222-133 Lacking Necessary Three-Fifths Vote; House Journal  30, PG.1772-1775 "
347442,2012-03-28,"House Inexpedient to Legislate (Rep G.Richardson): Motion Failed Division Vote 165-190; House Journal  30, PG.1775 "
347442,2012-03-28,"House Laid On The Table (Rep Itse): Motion Adopted Division Vote 299-56; House Journal  30, PG.1775 "
347442,2012-06-06,"House Remove From The Table (Rep Greazzo): Motion Adopted Division Vote 187-164; House Journal  51, PG.2585 "
347442,2012-06-06,"House Suspend Rules to Allow Consideration (Rep Greazzo): Motion Failed Division Vote 182-163 Lacking Necessary Two-Thirds Vote; House Journal  51, PG.2585 "
347442,2012-06-06,"House Reconsideration of Rules Suspension (Rep C.Christensen): Motion Failed Regular Calendar 156-163; House Journal  51, PG.2593-259 "
347444,2011-01-25,"House Introduced 1/6/2011 and Referred to Judiciary; House Journal  11, PG. 196 "
347444,2011-02-16,"House Public Hearing: 2/22/2011 1:00 PM Legislative Office Building 208 "
347444,2011-02-23,"House Executive Session: 3/1/2011 1:00 PM Legislative Office Building 208 "
347444,2011-03-01,"House Retained in Committee; House Calendar 27, PG.824 "
347444,2011-09-15,"House Retained Bill - Subcommittee Work Session: 10/4/2011 11:00 Amendment Legislative Office Building 208 "
347444,2011-09-15,"House Retained Bill - Executive Session: 10/25/2011 11:00 Amendment Legislative Office Building 208 "
347444,2011-11-02,"House Committee Report: Inexpedient to Legislate for Jan 4 (Vote 10-6; Regular Calendar); House Calendar 70, PG.2221 "
347444,2012-01-05,"House Inexpedient to Legislate: Motion Failed Regular Calendar 151-160; House Journal  8, PG.520-522 "
347444,2012-01-05,"House Recommit (Rep Giuda): Motion Adopted Regular Calendar 207-102; House Journal  8, PG.522-524 "
347444,2012-01-11,"House Vacated from Judiciary and Referred to Constitutional Review and Statutory Recodification; House Journal  9, PG.528 "
347444,2012-02-02,"House Public Hearing: 2/14/2012 11:00 Amendment Legislative Office Building 206 "
347444,2012-02-03,"House Executive Session: 2/21/2012 10:30 Amendment Legislative Office Building 206 ==RECESSED== "
347444,2012-02-22,"House Continued Executive Session: 2/23/2012 10:00 Amendment Legislative Office Building 301 "
347444,2012-02-23,"House Majority Committee Report: Ought to Pass with Amendment #0951h(NT) for Mar 7 (Vote 10-5; Regular Calendar); House Calendar 18, PG.1084 "
347444,2012-02-23,"House Proposed Majority Committee Amendment #2012-0951h (New Title); House Calendar 17, PG.971 "
347444,2012-02-23,"House Minority Committee Report: Inexpedient to Legislate; House Calendar 18, PG.1084 "
347444,2012-03-07,"House Amendment #0951h(NT) Adopted, Voice Vote; House Journal  21, PG.1338-1339 "
347444,2012-03-07,"House Ought to Pass with Amendment #0951h(NT): Motion Failed Regular Calendar 218-120 Lacking Necessary Three-Fifths Vote; House Journal  21, PG.1339-1341 "
347444,2012-03-07,"House Inexpedient to Legislate (Rep Serlin); House Journal  21, PG.1341 "
347444,2012-03-07,"House Lay On The Table (Rep Bettencourt): Motion Adopted Division Vote 244-97 By Necessary Three-Fifths Vote; House Journal  21, PG.1341 "
347444,2012-03-21,"House Remove From Table (Rep Itse): Motion Adopted Division Vote 209-144; House Journal  28, PG.1676 "
347444,2012-03-21,"House Inexpedient to Legislate: Motion Failed Division Vote 156-200; House Journal  28, PG.1676 "
347444,2012-03-21,"House Reconsider Ought to Pass (Rep B.Murphy): Motion Failed Division Vote 172-176; House Journal  28, PG.1678 "
347445,2011-01-25,"House Introduced 1/6/2011 and Referred to Special Committee on Education Funding Reform; House Journal  11, PG. 196 "
347445,2011-02-08,"House Public Hearing: 2/18/2011 11:00 Amendment Legislative Office Building 205-207 ==RECESSED== "
347445,2011-02-24,"House ==CANCELLED== Continued Public Hearing: 3/3/2011 9:30 Amendment Legislative Office Building 305 "
347445,2011-02-24,"House Full Committee Work Session: 3/4/2011 9:30 Amendment Legislative Office Building 207 "
347445,2011-02-24,"House ==CANCELLED== Executive Session: 3/4/2011 10:00 Amendment Legislative Office Building 207 "
347445,2011-03-02,"House Continued Public Hearing: 3/9/2011 9:30 Amendment Legislative Office Building 203 ==Executive session to follow== "
347445,2011-03-10,"House Committee Report: Ought to Pass with Amendment #0613h(NT) for Mar 15 (Vote 12-2; Regular Calendar); House Calendar 22, PG.565 "
347445,2011-03-10,"House Proposed Committee Amendment #2011-0613h (New Title); House Calendar 23, PG.580-581 "
347445,2011-03-16,"House Special Order to Next Order of Business (Rep Bettencourt): Motion Adopted Division Vote 255-102; House Journal  28, PG.878 "
347445,2011-03-16,"House Amendment #0613h (New Title) Adopted, Voice Vote; House Journal  28, PG.878-879 "
347445,2011-03-16,"House Ought to Pass with Amendment #0613h(NT): Motion Adopted Regular Calendar 252-113 by Constitutionally Required Three-Fifths; House Journal  28, PG.878-881 "
347445,2011-03-16,"House Reconsideration (Rep Bettencourt): Motion Failed Voice Vote; House Journal  28, PG.881 "
347445,2011-04-20,"Senate Introduced and Referred to Internal Affairs; Senate Journal 14, Pg.272 "
347445,2011-05-05,"Senate Hearing: 5/11/11, Room 100, State House, 2:15 p.m.; Senate Calendar 23 "
347445,2011-05-26,"Senate Committee Report: Rereferred to Committee, 6/1/11; Senate Calendar 26 "
347445,2011-06-01,"Senate Rereferred to Committee, Motion Adopted, Voice Vote; Senate Journal 19, Pg.517 "
347445,2012-02-01,"Senate Committee Report: Ought to Pass with Amendment #2012-0528s, 2/8/12; Senate Calendar 6 "
347445,2012-02-08,"Senate Special Order to 2/15/12, Without Objection, Motion Adopted "
347445,2012-02-08,"Senate Committee Report: Ought to Pass with Amendment #2012-0528s, 2/15/12; Senate Calendar 7 "
347445,2012-02-15,"Senate Special Ordered to the beginning of the Calendar, Without Objection, Motion Adopted; Senate Journal 4, Pg.104 "
347445,2012-02-15,"Senate Committee Report: Ought to Pass with Amendment #2012-0528s, 2/15/12 "
347445,2012-02-15,"Senate Committee Amendment 0528s; Amendment Adopted, Voice Vote; Senate Journal 5, Pg.126 "
347445,2012-02-15,"Senate Ought to Pass with Amendment 0528s, 3/5 necessary, Regular Calendar 17Y-7N, Motion Adopted; OT3rdg; Senate Journal 5, Pg.127 "
347445,2012-03-14,"House Concur with Senate Amendment (Rep L.Ober): Motion Failed Regular Calendar 54-287; House Journal  24, PG.1462-1464 "
347445,2012-03-14,"House Non-Concur, Request C of C (Rep L.Ober): Motion Adopted Regular Calendar 295-48; House Journal  24, PG.1464-1466 "
347445,2012-03-14,"House Speaker Appoints: Reps L.Ober, Hess, Balboni, and Renzullo; House Journal  24, PG.1466 "
347445,2012-03-14,"House Place Remarks of Rep Bettencourt in Permanent Journal (Rep Jasper): Motion Failed Division Vote 168-175; House Journal  24, PG.1466 "
347445,2012-03-15,"House Speaker Appoints Alternate: Rep Robert A. Foose; House Journal  26, PG.1650 "
347445,2012-03-21,"Senate Sen. Bradley accedes to House Request for Committee of Conference, Motion Adopted, Voice Vote "
347445,2012-05-02,"Senate President Appoints: Senators Bradley, D'Allesandro, and Stiles "
347445,2012-05-08,"House Committee of Conference Meeting: 5/22/2012 1:00 PM Legislative Office Building 301-303 ==Room Change (Orig 210-211)== "
347445,2012-05-14,"House //CANCELLED// Committee of Conference Meeting: 5/23/2012 1:00 PM Legislative Office Building 210-211 "
347445,2012-05-22,"House Committee of Conference Meeting: 5/24/2012 2:30 PM Legislative Office Building 210-211 ==RECESSED== "
347445,2012-05-24,"House ==RECONVENE== Committee of Conference Meeting: 5/29/2012 3:30 PM Legislative Office Building 210-211 ==RECESSED== "
347445,2012-05-29,"House ==CANCELLED== Committee of Conference Meeting: 5/30/2012 2:30 PM Legislative Office Building 210-211 "
347445,2012-05-30,"House ==RECONVENE== Committee of Conference Meeting: 5/31/2012 10:00 Amendment Legislative Office Building 210-211 "
347445,2012-05-31,"Senate Conference Committee Report #2012-2465c; House Amendment + New Amendment, Filed "
347445,2012-06-06,"Senate Conference Committee Report 2465c; 3/5 necessary, Regular Calendar 17Y-6N, Adopted "
347445,2012-06-06,"House Conference Committee Report #2465c Failed, Regular Calendar 224-144 Lacking Necessary Three-Fifths Vote; House Journal  51, PG.2576-2578 "
347445,2012-06-06,"House Reconsideration (Rep Mirski): Motion Adopted Division Vote 208-143; House Journal  51, PG.2578 "
347445,2012-06-06,"House Conference Committee Report #2465c Failed, Regular Calendar 224-141 Lacking Necessary Three-Fifths Vote; House Journal  51, PG.2578-2580 "
347447,2011-01-25,"House Introduced 1/6/2011 and Referred to Ways and Means; House Journal  11, PG. 196 "
347447,2011-02-01,"House Public Hearing: 2/8/2011 3:00 PM Legislative Office Building 202 ==Executive Session to Follow== "
347447,2011-02-16,"House Retained in Committee; House Calendar 27, PG.826 "
347447,2011-06-02,"House Retained Bill - Full Committee Work Session: 6/7/2011 10:00 Amendment Legislative Office Building 202 "
347447,2011-09-07,"House Retained Bill - Subcommittee Work Session: 9/21/2011 10:00 Amendment Legislative Office Building 202 "
347447,2011-10-03,"House Retained Bill - Executive Session: 10/26/2011 1:00 PM Legislative Office Building 202 ==RECESSED== "
347447,2011-10-20,"House Retained Bill - Rescheduled Executive Session 10/27/2011 1:00 PM Legislative Office Building 202 "
347447,2011-11-02,"House Majority Committee Report: Ought to Pass for Jan 4 (Vote 15-5; Regular Calendar); House Calendar 70, PG.2225-2226 "
347447,2011-11-02,"House Minority Committee Report: Inexpedient to Legislate; House Calendar 70, PG.2225-2226 "
347447,2012-01-11,"House Special Order to Jan 18 Calendar (Rep Bettencourt): Motion Adopted Regular Calendar 231-116; House Journal  9, PG.543-546 "
347447,2012-01-18,"House Floor Amendment #2012-0256h (Rep Bettencourt) Adopted, Voice Vote; House Journal  10, PG.603-604 "
347447,2012-01-18,"House Ought to Pass with Amendment #0256h: Motion Adopted Regular Calendar 257-101 By Required Three-Fifths Vote; House Journal  10, PG.603-606 "
347447,2012-01-18,"House Print Debate in Permanent Journal (Rep Bettencourt): Motion Adopted Voice Vote "
347447,2012-02-15,"Senate Introduced and Referred to Internal Affairs; Senate Journal 6, Pg.144 "
347447,2012-03-29,"Senate Hearing: 4/04/12, Room 100, State House, 1:10 p.m.; Senate Calendar 13 "
347447,2012-05-07,"Senate Committee Report: Ought to Pass, 5/16/12; Senate Calendar 19 "
347447,2012-05-16,"Senate Special Ordered to the end of the Calendar, Without Objection, Motion Adopted; Senate Journal 14, Pg.515 "
347447,2012-05-16,"Senate Committee Report: Ought to Pass "
347447,2012-05-16,"Senate Sen. Bradley Floor Amendment #2012-2299s, New Title, Amendment Adopted, Voice Vote "
347447,2012-05-16,"Senate Ought to Pass with Amendment 2299s, New Title, 3/5 necessary, Regular Calendar 20Y-4N, Motion Adopted; OT3rdg "
347447,2012-05-17,"House House Non-Concurs with Senate Amendment #2299s(NT) and Requests C of C (Rep Bettencourt): Motion Adopted Voice Vote; House Journal  46, PG.2487 "
347447,2012-05-17,"House Speaker Appoints: Reps Stepanek, Ulery, Azarian, and Sanborn; House Journal  46, PG.2487 "
347447,2012-05-23,"Senate Sen. Prescott Accedes to House Request for Committee of Conference ; Motion Adopted, Voice Vote "
347447,2012-05-23,"Senate President Appoints: Senators Bradley, Larsen, and Prescott "
347447,2012-05-24,"House Conference Committee Meeting: 5/25/2012 11:30 Amendment State House 100 ==ROOM CHANGE (Orig Legislative Office Building 202)== ==RECESSED== "
347447,2012-05-25,"House Conferee Change: Rep Ohm Replaces Rep Azarian; House Journal  46, PG.2495 "
347447,2012-05-25,"House Conference Committee Meeting: 5/29/2012 4:30 PM Legislative Office Building 202 "
347447,2012-05-30,"Senate Conferee Change; Senator Bragdon Replaces Senator Larsen "
347447,2012-05-31,"Senate Conference Committee Report #2012-2450c; Senate Amendment, Filed "
347447,2012-06-06,"Senate Conference Committee Report 2450c; 3/5 necessary, Regular Calendar 19Y-4N, Adopted "
347447,2012-06-06,"House Conference Committee Report #2450c Adopted, Regular Calendar 256-110 By Necessary Three-Fifths Vote; House Journal  51, PG.2573-2576 "
347447,2012-06-06,"Senate Enrolled Bill Amendment #2502e Adopted "
347447,2012-06-06,"House Enrolled Bill Amendment #2012-2502e Adopted; House Journal  51, PG.2611-2612 "
347448,2011-11-14,"House Introduced 1/4/2012 and Referred to Legislative Administration; House Journal  7, PG.366  "
347448,2012-01-05,"House Public Hearing: 1/17/2012 10:15 Amendment Legislative Office Building 104 "
347448,2012-01-23,"House Subcommittee Work Session: 1/26/2012 3:00 PM Legislative Office Building 104 "
347448,2012-01-25,"House Executive Session: 2/7/2012 10:15 Amendment Legislative Office Building 203 "
347448,2012-02-07,"House Committee Report: Inexpedient to Legislate for Feb 15 (Vote 12-0; Consent Calendar); House Calendar 18, PG.1051 "
347448,2012-02-15,"House Removed from Consent Calendar (Rep Tregenza); House Journal  16, PG.909 "
347448,2012-02-15,"House Special Order to End of Next Week's Regular Calendar: Motion Adopted Voice Vote; House Journal  16, PG.967 "
347448,2012-03-07,"House Inexpedient to Legislate: Motion Adopted Division Vote 270-63; House Journal  21, PG.1263 "
347450,2011-11-14,"House Introduced 1/4/2012 and Referred to Election Law; House Journal  7, PG.366 "
347450,2012-02-15,"House Public Hearing: 2/21/2012 10:30 Amendment Legislative Office Building 308 "
347450,2012-02-15,"House Executive Session: 2/21/2012 1:00 PM Legislative Office Building 308 "
347450,2012-02-21,"House Majority Committee Report: Refer to Interim Study for Mar 7 (Vote 9-7; Regular Calendar); House Calendar 18, PG.1092 "
347450,2012-02-21,"House Minority Committee Report: Inexpedient to Legislate; House Calendar 18, PG.1092 "
347450,2012-03-08,"House Refer to Interim Study: Motion Adopted Division Vote 210-84; House Journal  23, PG.1431 "
347450,2012-06-07,"House Referred to Election Law for Interim Study; House Calendar 45, PG.2432 "
347450,2012-09-21,"House ==CANCELLED== Interim Study - Subcommittee Work Session: 9/27/2012 11:00 Amendment Legislative Office Building 308 "
347450,2012-09-24,"House ==RESCHEDULED== Interim Study - Subcommittee Work Session: 10/4/2012 2:30 PM Legislative Office Building 308 "
347450,2012-09-26,"House Interim Study - Executive Session: 10/16/2012 10:00 Amendment Legislative Office Building 308 "
347451,2011-11-16,"House Introduced 1/4/2012 and Referred to Judiciary; House Journal  7, PG.366 "
347451,2011-12-27,"House Public Hearing: 1/17/2012 11:30 Amendment Legislative Office Building 208 "
347451,2012-02-08,"House Executive Session: 2/14/2012 10:00 Amendment Legislative Office Building 208 "
347451,2012-02-22,"House Majority Committee Report: Ought to Pass for Mar 7 (Vote 12-4; Regular Calendar); House Calendar 19, PG.1127-1128 "
347451,2012-02-22,"House Minority Committee Report: Inexpedient to Legislate; House Calendar 19, PG.1127-1128 "
347451,2012-03-14,"House Ought to Pass: Motion Failed Division Vote 203-107 Lacking Necessary Three-Fifths Vote; House Journal  24, PG.1455 "
347451,2012-03-14,"House Inexpedient to Legislate (Rep Weber); House Journal  24, PG.1455 "
347451,2012-03-14,"House Lay On The Table (Rep Itse): Motion Failed Division Vote 211-105 Lacking Necessary Three-Fifths Vote; House Journal  24, PG.1455 "
347451,2012-03-14,"House Special Order to Mar 21 (Rep Itse): Motion Adopted Division Vote 207-111; House Journal  24, PG.1455 "
347451,2012-03-21,"House Inexpedient to Legislate: Motion Adopted Voice Vote; House Journal  28, PG.1691-1692 "
347453,2011-11-16,"House Introduced 1/4/2012 and Referred to Legislative Administration; House Journal  7, PG.366 "
347453,2012-01-18,"House Public Hearing: 1/25/2012 10:15 Amendment Legislative Office Building 104 "
347453,2012-01-25,"House Executive Session: 2/7/2012 10:15 Amendment Legislative Office Building 203 "
347453,2012-02-07,"House Committee Report: Inexpedient to Legislate for Feb 15 (Vote 13-0; Consent Calendar); House Calendar 11, PG.687 "
347453,2012-02-15,"House Inexpedient to Legislate: Motion Adopted Voice Vote; House Journal  16, PG.922 "
347454,2011-11-16,"House Introduced 1/4/2012 and Referred to Judiciary; House Journal  7, PG.366 "
347454,2011-12-27,"House Public Hearing: 1/10/2012 9:00 Amendment Legislative Office Building 208 "
347454,2012-01-11,"House Executive Session: 1/19/2012 9:30 Amendment Legislative Office Building 208 "
347454,2012-01-25,"House Committee Report: Inexpedient to Legislate for Feb 1 (Vote 15-0; Consent Calendar); House Calendar 5, PG.245 "
347454,2012-02-01,"House Inexpedient to Legislate: Motion Adopted Voice Vote; House Journal  13, PG.743 "
347456,2011-11-22,"House Introduced 1/4/2012 and Referred to Judiciary; House Journal  7, PG.366 "
347456,2011-12-27,"House Public Hearing: 1/17/2012 1:30 PM Legislative Office Building 208 "
347456,2012-01-11,"House Executive Session: 1/19/2012 1:30 PM Legislative Office Building 208 "
347456,2012-01-18,"House ===CANCELLED=== Work Session: 1/26/2012 1:30 PM Legislative Office Building 208 "
347456,2012-01-24,"House Committee Report: Inexpedient to Legislate for Feb 1 (Vote 16-1; Consent Calendar); House Calendar 5, PG.245 "
347456,2012-02-01,"House Removed from Consent Calendar (Rep Davenport); House Journal  13, PG.739 "
347456,2012-02-01,"House Inexpedient to Legislate: Motion Adopted Regular Calendar 251-47; House Journal  13, PG.793-794 "
347457,2011-11-22,"House Introduced 1/4/2012 and Referred to Judiciary; House Journal  7, PG.366 "
347457,2012-01-11,"House ===CANCELLED=== Public Hearing: 1/12/2012 3:00 PM Legislative Office Building 208 "
347457,2012-01-24,"House Rescheduled Public Hearing: 2/2/2012 1:30 PM Legislative Office Building 208 "
347457,2012-02-08,"House Executive Session: 2/14/2012 10:00 Amendment Legislative Office Building 208 "
347457,2012-02-21,"House Majority Committee Report: Ought to Pass for Mar 7 (Vote 11-5; Regular Calendar); House Calendar 19, PG.1128 "
347457,2012-02-21,"House Minority Committee Report: Inexpedient to Legislate; House Calendar 19, PG.1128 "
347457,2012-03-14,"House Special Order to Mar 21 (Rep Rowe): Motion Adopted Division Vote 218-96; House Journal  24, PG.1455 "
347457,2012-03-21,"House Special Order to Next Order of Business: Without Objection; House Journal  28, PG.1684 "
347457,2012-03-21,"House Ought to Pass: Motion Failed Regular Calendar 237-115 Lacking Necessary Three-Fifths Vote; House Journal  28, PG.1684-1686 "
347457,2012-03-21,"House Lay On The Table (Rep Jasper): Motion Failed Division Vote 210-145 Lacking Necessary Three-Fifths Vote; House Journal  28, PG.1687 "
347457,2012-03-21,"House Reconsideration of Ought to Pass (Rep Hess): Motion Adopted Regular Calendar 242-111; House Journal  28, PG.1687-1689 "
347457,2012-03-21,"House Ought to Pass: Motion Adopted Regular Calendar 239-114 By Necessary Three-Fifths Vote; House Journal  28, PG.1689-1691 "
347457,2012-03-28,"Senate Introduced and Referred to Judiciary; Senate Journal 9, Pg.335 "
347457,2012-04-11,"Senate Hearing: 5/3/12, Room 101, Legislative Office Building, 2:00 p.m.; Senate Calendar 15 "
347457,2012-04-16,"Senate Hearing: 5/3/12, Room 101, Legislative Office Building, 1:00 p.m.; Senate Calendar 16 "
347457,2012-05-08,"Senate Committee Report: Ought to Pass with Amendment #2012-2041s, New Title, 5/16/12; Senate Calendar 19 "
347457,2012-05-16,"Senate Committee Amendment 2041s; New Title, Amendment Adopted, Voice Vote "
347457,2012-05-16,"Senate Ought to Pass with Amendment 2041s, New Title, Motion Adopted, Regular Calendar 19Y-5N; OT3rdg "
347457,2012-06-06,"House House Concurs with Senate Amendment 2041s (Rep Rowe): Motion Adopted Regular Calendar 242-96 By Necessary Three-Fifths Vote; House Journal  51, PG.2587-2589 "
347457,2012-06-06,"House Reconsideration (Rep Ingbretson): Motion Failed Division Vote 90-235; House Journal  51, PG.2587-2589 "
347459,2011-11-22,"House Introduced 1/4/2012 and Referred to Legislative Administration; House Journal  7, PG.366 "
347459,2012-01-18,"House Public Hearing: 1/25/2012 11:00 Amendment Legislative Office Building 104 "
347459,2012-02-08,"House Executive Session: 2/14/2012 10:15 Amendment Legislative Office Building 205 "
347459,2012-02-14,"House Committee Report: Inexpedient to Legislate for Feb 22 (Vote 11-0; Consent Calendar); House Calendar 14, PG.805 "
347459,2012-02-22,"House Inexpedient to Legislate: Motion Adopted Voice Vote; House Journal  20, PG.1212 "
347460,2011-11-22,"House Introduced 1/4/2012 and Referred to Judiciary; House Journal  7, PG.366  "
347460,2011-12-27,"House ==CANCELLED== Public Hearing: 1/12/2012 3:30 PM Legislative Office Building 208 "
347460,2012-01-11,"House ==CANCELLED== Executive Session: 1/19/2012 1:30 PM Legislative Office Building 208 "
347460,2012-01-18,"House ==CANCELLED== Subcommittee Work Session: 1/26/2012 1:30 PM Legislative Office Building 208 "
347460,2012-01-24,"House Rescheduled Public Hearing: 2/2/2012 2:00 PM Legislative Office Building 208 "
347460,2012-01-31,"House Executive Session: 2/7/2012 10:00 Amendment Legislative Office Building 208 "
347460,2012-02-09,"House Majority Committee Report: Inexpedient to Legislate for Feb 15 (Vote 10-6; Regular Calendar); House Calendar 11, PG.697-698 "
347460,2012-02-09,"House Minority Committee Report: Ought to Pass; House Calendar 11, PG.697-698 "
347460,2012-02-15,"House Inexpedient to Legislate: Motion Adopted Regular Calendar 239-108 by Necessary Three-Fifths Vote; House Journal  940, PG.940-942 "
347462,2011-11-28,"House Introduced 1/4/2012 and Referred to Election Law; House Journal  7, PG.366 "
347462,2012-01-18,"House Public Hearing: 1/24/2012 10:00 Amendment Legislative Office Building 308 "
347462,2012-02-15,"House Executive Session: 2/21/2012 1:00 PM Legislative Office Building 308 "
347462,2012-02-21,"House Committee Report: Inexpedient to Legislate for Mar 7 (Vote 15-4; Regular Calendar); House Calendar 18, PG.1092 "
347462,2012-03-08,"House Inexpedient to Legislate: Motion Adopted Voice Vote; House Journal  23, PG.1432 "
347463,2011-11-28,"House Introduced 1/4/2012 and Referred to Judiciary; House Journal  7, PG.366 "
347463,2011-12-27,"House Public Hearing: 1/17/2012 2:00 PM Legislative Office Building 208 "
347463,2012-01-18,"House Subcommittee Work Session: 1/26/2012 1:32 PM Legislative Office Building 208 "
347463,2012-01-31,"House Executive Session: 2/7/2012 10:00 Amendment Legislative Office Building 208 "
347463,2012-02-08,"House Committee Report: Inexpedient to Legislate for Feb 15 (Vote 17-0; Consent Calendar); House Calendar 11, PG.686 "
347463,2012-02-15,"House Inexpedient to Legislate: Motion Adopted Voice Vote; House Journal  16, PG.920 "
347465,2011-11-28,"House Introduced 1/4/2012 and Referred to Children and Family Law; House Journal  7, PG.366 "
347465,2012-01-03,"House Public Hearing: 1/17/2012 10:00 Amendment Legislative Office Building 206 ==RECESSED== "
347465,2012-01-31,"House Continued Public Hearing: 2/9/2012 10:00 Amendment Legislative Office Building 206 "
347465,2012-01-31,"House Executive Session: 2/9/2012 10:30 Amendment Legislative Office Building 206 ==RECESSED== "
347465,2012-02-09,"House Subcommittee Work Session: 2/10/2012 2:30 PM Legislative Office Building 206 "
347465,2012-02-09,"House Executive Session: 2/16/2012 10:00 Amendment Legislative Office Building 206 ==RECESSED== "
347465,2012-02-15,"House Subcommittee Work Session: 2/17/2012 2:30 PM Legislative Office Building 206 "
347465,2012-02-15,"House Continued Executive Session: 2/23/2012 9:00 Amendment Legislative Office Building 206 "
347465,2012-02-23,"House Majority Committee Report: Inexpedient to Legislate for Mar 21 (Vote 11-3; Regular Calendar); House Calendar 22, PG.1354"
347465,2012-02-23,"House Minority Committee Report: Ought to Pass; House Calendar 22, PG.1354"
347465,2012-03-21,"House Inexpedient to Legislate: Motion Failed Division Vote 175-181; House Journal  28, PG.1669 "
347465,2012-03-21,"House Ought to Pass (Rep Cartwright): Motion Failed Regular Calendar 204-154 Lacking Necessary Three-Fifths Vote; House Journal  28, PG.1669-1671 "
347465,2012-03-21,"House Reconsider Inexpedient to Legislate (Rep Tucker): Motion Adopted Division Vote 251-109; House Journal  28, PG.1671-1672 "
347465,2012-03-21,"House Lay On The Table (Rep Cohn): Motion Failed Division Vote 172-187; House Journal  28, PG.1672 "
347465,2012-03-21,"House Inexpedient to Legislate: Motion Adopted Regular Calendar 214-146; House Journal  28, PG.1672-1674 "
347466,2011-12-16,"House Introduced 1/4/2012 and Referred to Judiciary; House Journal  7, PG.366 "
347466,2011-12-27,"House Public Hearing: 1/17/2012 2:30 PM Legislative Office Building 208 "
347466,2012-01-18,"House Subcommittee Work Session: 1/26/2012 1:33 PM Legislative Office Building 208 "
347466,2012-01-31,"House Executive Session: 2/7/2012 10:00 Amendment Legislative Office Building 208 "
347466,2012-02-08,"House Committee Report: Inexpedient to Legislate for Feb 15 (Vote 16-1; Consent Calendar); House Calendar 11, PG.687 "
347466,2012-02-15,"House Inexpedient to Legislate: Motion Adopted Voice Vote; House Journal  16, PG.921 "
347468,2012-01-01,"Senate Introduced 1/4/2012 and Referred to Internal Affairs; Senate Journal 1, Pg.15 "
347468,2012-02-15,"Senate Hearing: 2/22/12, Room 100, State House, 11:00 a.m.; Senate Calendar 8 "
347468,2012-03-22,"Senate Committee Report: Ought to Pass, 3/28/12; Senate Calendar 12 "
347468,2012-03-28,"Senate Ought to Pass, 3/5 necessary, Regular Calendar 14Y-10N, Motion Failed; Senate Journal 8, Pg.287 "
347468,2012-03-28,"Senate Sen. Bradley Moved Laid on Table, Motion Adopted, Voice Vote; Senate Journal 8, Pg.287 "
347469,2010-12-22,"House Introduced 1/5/2011 and Referred to Criminal Justice and Public Safety; House Journal  8, PG.128 "
347469,2011-01-04,"House Public Hearing: 1/13/2011 10:00 Amendment Legislative Office Building 204 "
347469,2011-01-13,"House Subcommittee Work Session: 1/18/2011 9:00 Amendment Legislative Office Building 204 "
347469,2011-01-13,"House ==CANCELLED== Executive Session: 1/18/2011 1:00 PM Legislative Office Building 204 "
347469,2011-01-26,"House ==CANCELLED== Continued Executive Session: 2/3/2011 10:00 Amendment Legislative Office Building 204 "
347469,2011-02-03,"House Subcommittee Work Session: 2/8/2011 8:30 Amendment Legislative Office Building 204 "
347469,2011-02-16,"House Executive Session: 2/22/2011 10:00 Amendment Legislative Office Building 204 "
347469,2011-02-22,"House Majority Committee Report: Inexpedient to Legislate for Mar 2 (Vote 11-6; Regular Calendar); House Calendar 18, PG.391 "
347469,2011-02-22,"House Minority Committee Report: Ought to Pass; House Calendar 18, PG.391 "
347469,2011-03-02,"House Inexpedient to Legislate: Motion Failed Regular Calendar 167-168, Speaker Votes Yea; House Journal  25, PG.677-679 "
347469,2011-03-02,"House Recommit (Rep Bettencourt): Motion Adopted Voice Vote; House Journal  25, PG.679 "
347469,2011-03-02,"House Executive Session: 3/9/2011 10:00 Amendment Legislative Office Building 204 "
347469,2011-03-09,"House Retained in Committee; House Calendar 27, PG.823 "
347469,2011-08-18,"House Retained Bill - Subcommittee Work Session: 9/6/2011 11:00 Amendment Legislative Office Building 204 "
347469,2011-09-27,"House Retained Bill - Executive Session: 10/20/2011 10:00 Amendment Legislative Office Building 204 "
347469,2011-10-25,"House Committee Report: Inexpedient to Legislate for Jan 4 (Vote 11-6; Regular Calendar); House Calendar 70, PG.2214-2215 "
347469,2012-01-04,"House Inexpedient to Legislate: Motion Adopted Regular Calendar 221-123; House Journal  7, PG.447-449 "
347471,2010-12-22,"House Introduced 1/5/2011 and Referred to Education; House Journal  8, PG.128  "
347471,2011-01-11,"House Public Hearing: 1/18/2011 10:30 Amendment Legislative Office Building 207 "
347471,2011-01-19,"House ==CANCELLED== Executive Session: 1/25/2011 2:00 PM Legislative Office Building 207 "
347471,2011-01-26,"House Executive Session: 2/1/2011 2:00 PM Legislative Office Building 207 "
347471,2011-02-01,"House Retained in Committee; House Calendar 27, PG.823 "
347471,2011-09-09,"House Retained Bill - Subcommittee Work Session: 9/20/2011 1:00 PM Legislative Office Building 207 "
347471,2011-10-04,"House Retained Bill - Executive Session: 10/18/2011 10:00 Amendment Legislative Office Building 207 "
347471,2011-10-21,"House Committee Report: Inexpedient to Legislate for Jan 4 (Vote 13-0; Consent Calendar); House Calendar 70, PG.2202 "
347471,2012-01-04,"House Inexpedient to Legislate: Motion Adopted Voice Vote; House Journal  7, PG.380 "
347472,2010-12-30,"House Introduced 1/5/2011 and Referred to Ways and Means; House Journal  8, PG.129 "
347472,2011-01-26,"House Public Hearing: 2/3/2011 11:00 Amendment Legislative Office Building 202 "
347472,2011-02-15,"House Executive Session: 2/16/2011 Legislative Office Building 202 Following House Session "
347472,2011-02-16,"House Committee Report: Ought to Pass for Feb 23 (Vote 18-1; Consent Calendar); House Calendar 15, PG.274 "
347472,2011-02-23,"House Ought to Pass: Motion Adopted Voice Vote; House Journal  21, PG.465 "
347472,2011-03-16,"Senate Introduced and Referred to Transportation; Senate Journal 10, Pg.169 "
347472,2011-03-24,"Senate Hearing: 3/31/11, Room 103, Legislative Office Building, 9:00 a.m.; Senate Calendar 17 "
347472,2011-04-14,"Senate Committee Report: Ought to Pass with Amendment #2011-1439s, 4/20/11; Senate Calendar 20 "
347472,2011-04-20,"Senate Committee Amendment 1439s, Amendment Adopted, Voice Vote; Senate Journal 13, Pg.268 "
347472,2011-04-20,"Senate Ought to Pass with Amendment 1439s, Motion Adopted, Voice Vote; Refer to Finance Rule 4-3; Senate Journal 13, Pg.268 "
347472,2011-04-28,"Senate Committee Report: Rereferred to Committee, 5/4/11; Senate Calendar 22 "
347472,2011-05-04,"Senate Rereferred to Committee, Motion Adopted, Voice Vote; Senate Journal 15, Pg.304 "
347472,2012-01-11,"Senate Committee Report: Inexpedient to Legislate, 1/18/12; Senate Calendar 3 "
347472,2012-01-18,"Senate Inexpedient to Legislate, Motion Failed, Voice Vote; Senate Journal 2, Pg.56 "
347472,2012-01-18,"Senate Sen. Morse Moved Refer to Interim Study, Motion Adopted, Voice Vote; Senate Journal 2, Pg.56 "
347474,2010-12-30,"House Introduced 1/5/2011 and Referred to Commerce and Consumer Affairs; House Journal  8, PG.130 "
347474,2011-01-05,"House Public Hearing: 1/13/2011 10:00 Amendment Legislative Office Building 302 Insurance/Consumer Regulation Div "
347474,2011-01-18,"House Subcommittee Work Session: 1/27/2011 9:00 Amendment Legislative Office Building 302 "
347474,2011-01-27,"House Subcommittee Work Session: 2/3/2011 9:30 Amendment Legislative Office Building 302 "
347474,2011-02-03,"House Subcommittee Work Session: 2/17/2011 9:00 Amendment Legislative Office Building 302 "
347474,2011-02-16,"House ==CANCELLED== Executive Session: 2/25/2011 10:00 Amendment Legislative Office Building 302 "
347474,2011-02-23,"House Executive Session: 3/1/2011 3:00 PM Legislative Office Building 302 "
347474,2011-03-09,"House Retained in Committee; House Calendar 27, PG.822 "
347474,2011-08-23,"House Retained Bill - Insurance/Consumer Div Subcom Work Session: 10/11/2011 1:15 PM Legislative Office Building 302 "
347474,2011-10-19,"House Retained Bill - Executive Session: 10/25/2011 1:15 PM Legislative Office Building 301-303 (If Necessary Continued 10/27/2011 1:15 PM Legislative Office Building 302) "
347474,2011-11-02,"House Committee Report: Inexpedient to Legislate for Jan 4 (Vote 15-0; Consent Calendar); House Calendar 70, PG.2199 "
347474,2012-01-04,"House Inexpedient to Legislate: Motion Adopted Voice Vote; House Journal  7, PG.368 "
347475,2010-12-30,"House Introduced 1/5/2011 and Referred to Commerce and Consumer Affairs "
347475,2011-01-05,"House Public Hearing: 1/18/2011 1:15 PM Legislative Office Building 302 Banking/Business Div "
347475,2011-01-19,"House Subcommittee Work Session: 1/25/2011 11:00 Amendment Legislative Office Building 302 "
347475,2011-02-10,"House Executive Session: 2/15/2011 Legislative Office Building 302 3:00 PM or Immediately Following House Session "
347475,2011-03-02,"House Committee Report: Ought to Pass with Amendment #0266h(NT) for Mar 15 (Vote 16-0; Consent Calendar); House Calendar 22, PG.523 "
347475,2011-03-02,"House Proposed Committee Amendment #2011-0266h (New Title); House Calendar 23, PG.584 "
347475,2011-03-15,"House Amendment #0266h (New Title) Adopted, Voice Vote; House Journal  26, PG.695 "
347475,2011-03-15,"House Ought to Pass with Amendment #0266h(NT): Motion Adopted Voice Vote; House Journal  26, PG.695 "
347475,2011-03-30,"Senate Introduced and Referred to Executive Departments and Administration; Senate Journal 12, Pg.243 "
347475,2011-04-20,"Senate Hearing: 4/28/11, Room 100, State House, 9:10 a.m.; Senate Calendar 21 "
347475,2011-04-28,"Senate Committee Report: Rereferred to Committee, 5/4/11; Senate Calendar 22 "
347475,2011-05-04,"Senate Rereferred to Committee, Motion Adopted, Voice Vote; Senate Journal 15, Pg.303 "
347475,2011-09-01,"Senate Work Session on Re-referred Bill: 9/8/11, Room 100, State House, 10:00 a.m.; Senate Calendar 36 "
347475,2011-10-20,"Senate Work Session on Re-referred Bill: 11/8/11, Room 100, State House, 1:00 p.m.; Senate Calendar 43 "
347475,2012-01-12,"Senate Committee Report: Ought to Pass with Amendment #2012-0199s, New Title, 1/18/12; Senate Calendar 3 "
347475,2012-01-18,"Senate Committee Amendment 0199s, New Title, Amendment Adopted, Voice Vote; Senate Journal 2, Pg.52 "
347475,2012-01-18,"Senate Ought to Pass with Amendment 0199s, New Title, Motion Adopted, Voice Vote; OT3rdg; Senate Journal 2, Pg.55 "
347475,2012-02-22,"House House Non-Concurs with Senate Amendment and Requests C of C (Rep Jennifer Coffey): Motion Adopted Voice Vote; House Journal  20, PG.1199 "
347475,2012-02-22,"House Speaker Appoints: Reps Hunt, Muro, McGuinness, and Gidge; House Journal  20, PG.1199 "
347475,2012-05-02,"Senate Sen. Carson Accede to House Request for Committee of Conference Motion Adopted, Voice Vote; Senate Journal 12, Pg.470 "
347475,2012-05-02,"Senate President Appoints: Senators White, Luther, and Larsen; Senate Journal 12, Pg.470 "
347475,2012-05-22,"House Conference Committee Meeting: 5/29/2012 1:15 PM Legislative Office Building 302 "
347475,2012-05-31,"House Conferee Change: Rep Itse Replaces Rep Gidge; House Journal  47, PG.2507 "
347475,2012-05-31,"Senate Conference Committee Report #2012-2406c; Senate Amendment + New Amendment, Filed "
347475,2012-06-06,"Senate Conference Committee Report 2406c; Adopted, Voice Vote "
347475,2012-06-06,"House Conference Committee Report #2406c Adopted, Voice Vote; House Journal  51, PG.2586 "
347475,2012-06-06,"Senate Enrolled "
347475,2012-06-06,"House Enrolled; House Journal  51, PG.2613 "
347475,2012-06-22,"House Signed By Governor 06/18/2012; Effective 08/17/2012; Chapter 0241 "
347477,2010-12-30,"House Introduced 1/5/2011 and Referred to Municipal and County Government; House Journal  8, PG.130 "
347477,2011-01-11,"House ==RESCHEDULED== Public Hearing: 1/20/2011 10:00 Amendment Legislative Office Building 301 "
347477,2011-02-01,"House ==CANCELLED== Executive Session: 2/8/2011 1:00 PM Legislative Office Building 301 "
347477,2011-02-10,"House Subcommittee Work Session: 2/22/2011 9:00 Amendment Legislative Office Building 301 "
347477,2011-02-23,"House Executive Session: 2/24/2011 1:00 PM Legislative Office Building 301 "
347477,2011-02-28,"House Retained in Committee; House Calendar 27, PG.824 "
347477,2011-04-12,"House ==CANCELLED== Retained Bill - Subcommittee Work Session: 4/20/2011 1:00 PM Legislative Office Building 301 "
347477,2011-04-20,"House Retained Bill - Subcommittee Work Session: 4/28/2011 10:00 Amendment Legislative Office Building 301 "
347477,2011-05-10,"House Retained Bill - Subcommittee Work Session: 5/17/2011 1:30 PM Legislative Office Building 301 "
347477,2011-05-10,"House Retained Bill - Subcommittee Work Session: 5/19/2011 10:15 Amendment Legislative Office Building 301 "
347477,2011-05-18,"House Retained Bill - Subcommittee Work Session: 5/24/2011 11:30 Amendment Legislative Office Building 301 "
347477,2011-09-14,"House Retained Bill - Executive Session: 10/11/2011 10:00 Amendment Legislative Office Building 301 "
347477,2011-10-14,"House Committee Report: Ought to Pass with Amendment #2090h(NT) for Jan 4 (Vote 16-0; Consent Calendar); House Calendar 70, PG.2207 "
347477,2011-10-14,"House Proposed Committee Amendment #2011-2090h (New Title); House Calendar 69, PG.2087-2089 "
347477,2012-01-04,"House Amendment #2090h(NT) Adopted, Voice Vote; House Journal  7, PG.415-417 "
347477,2012-01-04,"House Ought to Pass with Amendment #2090h(NT): Motion Adopted Voice Vote; House Journal  7, PG.415-417 "
347477,2012-02-15,"Senate Introduced and Referred to Public and Municipal Affairs; Senate Journal 6, Pg.144 "
347477,2012-03-05,"Senate Hearing: 3/20/12, Room 101, Legislative Office Building, 9:30 a.m.; Senate Calendar 10 "
347477,2012-04-02,"Senate Committee Report: Ought to Pass, 4/11/12; Senate Calendar 14 "
347477,2012-04-11,"Senate Ought to Pass: Motion Adopted, Voice Vote; OT3rdg; Senate Journal 9, Pg.350 "
347477,2012-04-11,"House Enrolled "
347477,2012-04-18,"Senate Enrolled; Senate Journal 11, Pg.383 "
347477,2012-05-03,"House Signed By Governor 05/02/2012; Effective 05/02/2012; Chapter 0024 "
347478,2011-01-03,"House Introduced 1/5/2011 and Referred to Criminal Justice and Public Safety; House Journal  8, PG.130 "
347478,2011-01-11,"House Public Hearing: 1/20/2011 10:00 Amendment Legislative Office Building 204 "
347478,2011-01-25,"House Subcommittee Work Session: 2/1/2011 12:00 PM Legislative Office Building 204 "
347478,2011-01-26,"House Executive Session: 2/3/2011 10:00 Amendment Legislative Office Building 204 "
347478,2011-02-03,"House Majority Committee Report: Ought to Pass with Amendment #0133h for Feb 15 (Vote 14-2; Regular Calendar); House Calendar 13, PG.234 "
347478,2011-02-03,"House Proposed Majority Committee Amendment #2011-0133h; House Calendar 13, PG.256 "
347478,2011-02-03,"House Minority Committee Report: Inexpedient to Legislate; House Calendar 13, PG.234 "
347478,2011-02-15,"House Amendment #0133h Adopted, Voice Vote; House Journal  17, PG.364-365 "
347478,2011-02-15,"House Ought to Pass with Amendment #0133h: Motion Adopted Voice Vote; House Journal  17, PG.364-365 "
347478,2011-04-13,"Senate Introduced and Referred to Judiciary; Senate Journal 13, Pg.258 "
347478,2011-05-05,"Senate Hearing: 5/26/11, Room 101, Legislative Office Building, 1:00 p.m.; Senate Calendar 23 "
347478,2011-05-26,"Senate Committee Report: Rereferred to Committee, 6/1/11; Senate Calendar 26 "
347478,2011-06-01,"Senate Rereferred to Committee, Motion Adopted, Voice Vote; Senate Journal 19, Pg.518 "
347478,2012-01-10,"Senate Committee Report: Ought to Pass with Amendment #2012-0134s, New Title, 1/18/12; Senate Calendar 3 "
347478,2012-01-18,"Senate Committee Amendment 0134s, New Title, Amendment Adopted, Voice Vote; Senate Journal 2, Pg.63 "
347478,2012-01-18,"Senate Ought to Pass with Amendment 0134s, New Title, Motion Adopted, Voice Vote; OT3rdg; Senate Journal 2, Pg.64 "
347478,2012-02-01,"House House Concurs with Senate Amendment #0134s(NT) (Rep Swinford): Motion Adopted Voice Vote; House Journal  13, PG.739 "
347478,2012-02-08,"Senate Enrolled; Senate Journal 5, Pg.123 "
347478,2012-02-08,"House Enrolled; House Journal  15, PG.906 "
347478,2012-03-12,"House Signed by the Governor 03/12/2012; Effective 03/12/2012; Chapter 0003 "
347480,2011-01-03,"House Introduced 1/5/2011 and Referred to Municipal and County Government; House Journal  8, PG.131 "
347480,2011-01-11,"House Public Hearing: 1/20/2011 11:00 Amendment Legislative Office Building 301 "
347480,2011-02-01,"House Executive Session: 2/8/2011 1:00 PM Legislative Office Building 301 "
347480,2011-02-08,"House Retained in Committee; House Calendar 27, PG.824 "
347480,2011-04-20,"House Retained Bill - Subcommittee Work Session: 4/21/2011 2:30 PM Legislative Office Building 301 "
347480,2011-09-14,"House Retained Bill - Executive Session: 10/11/2011 10:00 Amendment Legislative Office Building 301 "
347480,2011-10-14,"House Committee Report: Ought to Pass with Amendment #1540h(NT) for Jan 4 (Vote 16-0; Consent Calendar); House Calendar 70, PG.2207 "
347480,2011-10-14,"House Proposed Committee Amendment #2011-1540h (New Title); House Calendar 69, PG.2089 "
347480,2012-01-04,"House Removed from Consent Calendar (Rep Worsman); House Journal  7, PG.368 "
347480,2012-02-01,"House Amendment #1540h(NT) Adopted, Voice Vote; House Journal  13, PG.759 "
347480,2012-02-01,"House Ought to Pass with Amendment #1540h(NT): Motion Adopted Division Vote 275-56; House Journal  13, PG.758 "
347480,2012-02-01,"House Print Debate in Permanent Journal (Rep Daniels): Motion Failed Voice Vote; House Journal  13, PG.759 "
347480,2012-02-15,"Senate Introduced and Referred to Public and Municipal Affairs; Senate Journal 6, Pg.144 "
347480,2012-04-04,"Senate Hearing: 4/10/12, Room 101, Legislative Office Building, 10:45 a.m.; Senate Calendar 14 "
347480,2012-04-18,"Senate Committee Report: Ought to Pass with Amendment #2012-1721s, 4/25/12; Senate Calendar 16 "
347480,2012-04-25,"Senate Special Order to 5/2/12, Without Objection, Motion Adopted; Senate Journal 11, Pg.396 "
347480,2012-04-25,"Senate Committee Report: Ought to Pass with Amendment #2012-1721s, 5/2/12, Senate Calendar 17 "
347480,2012-05-02,"Senate Committee Amendment 1721s, Not Voted On "
347480,2012-05-02,"Senate Sen. Barnes Moved Laid On Table, Motion Adopted, Voice Vote; Senate Journal 12, Pg.451 "
347481,2011-01-03,"House Introduced 1/5/2011 and Referred to Science, Technology and Energy; House Journal  8, PG.131 "
347481,2011-01-11,"House ===CANCELLED=== Public Hearing: 1/12/2011 1:00 PM Legislative Office Building 304 "
347481,2011-01-11,"House ==RESCHEDULED== Public Hearing: 1/25/2011 1:00 PM Legislative Office Building 304 "
347481,2011-03-02,"House Executive Session: 3/2/2011 Legislative Office Building 304 Following House Session "
347481,2011-03-02,"House Retained in Committee; House Calendar 27, PG.825 "
347481,2011-08-18,"House Retained Bill - Full Committee Work Session: 9/13/2011 10:15 Amendment Legislative Office Building 301-303 "
347481,2011-10-11,"House Retained Bill - Executive Session: 10/25/2011 10:00 Amendment Legislative Office Building 304 "
347481,2011-10-27,"House Committee Report: Inexpedient to Legislate for Jan 4 (Vote 9-2; Regular Calendar); House Calendar 70, PG.2224 "
347481,2012-01-11,"House Inexpedient to Legislate: Motion Adopted Voice Vote; House Journal  9, PG.538 "
347483,2011-01-07,"House Introduced 1/6/2011 and Referred to Constitutional Review & Statutory Recodification; House Journal  11, PG. 172  "
347483,2011-01-13,"House Public Hearing: 1/18/2011 10:30 Amendment Legislative Office Building 206 "
347483,2011-01-19,"House Subcommittee Work Session: 1/25/2011 1:00 PM Legislative Office Building 206 "
347483,2011-01-26,"House Subcommittee Work Session: 2/1/2011 10:00 Amendment Legislative Office Building 206 "
347483,2011-02-01,"House Executive Session: 2/8/2011 10:00 Amendment Legislative Office Building 206 "
347483,2011-02-09,"House Majority Committee Report: Ought to Pass for Feb 15 (Vote 8-4; Regular Calendar); House Calendar 13, PG.234 "
347483,2011-02-09,"House Minority Committee Report: Inexpedient to Legislate; House Calendar 13, PG.234 "
347483,2011-02-15,"House Ought to Pass: Motion Adopted Regular Calendar 240-120; House Journal  17, PG.361-364 "
347483,2011-02-15,"House Referred to Commerce and Consumer Affairs; House Journal  17, PG.364 "
347483,2011-02-23,"House Public Hearing: 3/10/2011 1:15 PM Legislative Office Building 302 ==Executive Session to Follow== "
347483,2011-03-10,"House Retained in Committee "
347483,2011-06-22,"House Retained Bill - Banking/Business Div Subcom Work Session: 9/13/2011 11:15 Amendment Legislative Office Building 302 "
347483,2011-09-27,"House Retained Bill - Executive Session: 10/6/2011 10:00 Amendment Legislative Office Building 302 "
347483,2011-10-14,"House Committee Report: Refer to Interim Study for Jan 4 (Vote 12-0; Consent Calendar); House Calendar 70, PG.2199 "
347483,2012-01-04,"House Refer to Interim Study: Motion Adopted Voice Vote; House Journal  7, PG.368 "
347483,2012-06-07,"House Referred to Commerce and Consumer Affairs for Interim Study; House Calendar 45, PG.2432 "
347483,2012-09-07,"House Interim Study - Subcommittee Work Session: 9/18/2012 10:00 Amendment Legislative Office Building 307 =Banking Div= "
347483,2012-09-19,"House Interim Study - Executive Session: 10/2/2012 10:00 Amendment Legislative Office Building 302 "
347484,2011-01-07,"House Introduced 1/6/2011 and Referred to Commerce and Consumer Affairs; House Journal  11, PG. 172 "
347484,2011-02-09,"House Public Hearing: 2/17/2011 10:30 Amendment Legislative Office Building 302 "
347484,2011-02-16,"House ==CANCELLED== Executive Session: 2/25/2011 10:00 Amendment Legislative Office Building 302 "
347484,2011-02-23,"House Executive Session: 3/1/2011 3:00 PM Legislative Office Building 302 "
347484,2011-03-01,"House Retained in Committee; House Calendar 27, PG.822 "
347484,2011-08-23,"House Retained Bill - Insurance/Consumer Div Subcom Work Session: 9/13/2011 1:15 PM Legislative Office Building 302 "
347484,2011-09-27,"House Retained Bill - Executive Session: 10/6/2011 10:00 Amendment Legislative Office Building 302 "
347484,2011-10-14,"House Committee Report: Inexpedient to Legislate for Jan 4 (Vote 12-0; Consent Calendar); House Calendar 70, PG.2199 "
347484,2012-01-04,"House Inexpedient to Legislate: Motion Adopted Voice Vote; House Journal  7, PG.368 "
347486,2011-01-07,"House Introduced 1/6/2011 and Referred to Criminal Justice and Public Safety; House Journal  11, PG. 172 "
347486,2011-01-11,"House Public Hearing: 1/20/2011 11:00 Amendment Legislative Office Building 204 "
347486,2011-01-26,"House ==CANCELLED== Executive Session: 2/3/2011 10:00 Amendment Legislative Office Building 204 "
347486,2011-02-03,"House Subcommittee Work Session: 2/8/2011 9:15 Amendment Legislative Office Building 204 "
347486,2011-02-10,"House ==RESCHEDULED== Work Session: 2/15/2011 8:30 Amendment Legislative Office Building 204 (Orig 8:00 Amendment) "
347486,2011-02-16,"House Subcommittee Work Session: 2/22/2011 8:30 Amendment Legislative Office Building 204 "
347486,2011-03-02,"House Subcommittee Work Session: 3/9/2011 9:00 Amendment Legislative Office Building 204 "
347486,2011-03-02,"House Executive Session: 3/9/2011 10:00 Amendment Legislative Office Building 204 "
347486,2011-03-09,"House Retained in Committee; House Calendar 27, PG.823 "
347486,2011-09-13,"House Retained Bill - Subcommittee Work Session: 9/27/2011 11:00 Amendment Legislative Office Building 204 "
347486,2011-09-27,"House Retained Bill - Subcommittee Work Session: 10/5/2011 10:00 Amendment Legislative Office Building 204 "
347486,2011-10-05,"House Retained Bill - Subcommittee Work Session: 10/20/2011 9:45 Amendment Legislative Office Building 204 "
347486,2011-10-05,"House Retained Bill - Executive Session: 10/20/2011 10:00 Amendment Legislative Office Building 204 "
347486,2011-10-25,"House Committee Report: Ought to Pass with Amendment #2702h for Jan 4 (Vote 17-0; Consent Calendar); House Calendar 70, PG.2201 "
347486,2011-10-25,"House Proposed Committee Amendment #2011-2702h; House Calendar 69, PG.2089 "
347486,2012-01-04,"House Amendment #2702h Adopted, Voice Vote; House Journal  7, PG.373 "
347486,2012-01-04,"House Ought to Pass with Amendment #2702h: Motion Adopted Voice Vote; House Journal  7, PG.373 "
347486,2012-02-08,"Senate Introduced and Referred to Judiciary; Senate Journal 5, Pg.121 "
347486,2012-03-28,"Senate Hearing: 4/12/12, Room 101, Legislative Office Building, 1:45 p.m.; Senate Calendar 13 "
347486,2012-04-05,"Senate Hearing: === TIME CHANGE === 4/12/12, Room 101, Legislative Office Building, 1:00 p.m.; Senate Calendar 14 "
347486,2012-04-20,"Senate Committee Report: Ought to Pass, 4/25/12; Senate Calendar 16A "
347486,2012-04-25,"Senate Ought to Pass: Motion Adopted, Voice Vote; OT3rdg; Senate Journal 11, Pg.415 "
347486,2012-04-25,"House Enrolled; House Journal  38, PG.2211 "
347486,2012-05-02,"Senate Enrolled; Senate Journal 13, Pg.474 "
347486,2012-05-21,"House Signed By Governor 05/15/2012; Effective 07/14/2012; Chapter 0065 "
347487,2011-01-10,"House Introduced 1/6/2011 and Referred to Executive Departments and Administration; House Journal  11, PG. 173 "
347487,2011-01-19,"House Public Hearing: 1/25/2011 1:30 PM Legislative Office Building 306 "
347487,2011-02-03,"House Subcommittee Work Session: 2/10/2011 3:00 PM Legislative Office Building 306 "
347487,2011-02-17,"House Subcommittee Work Session: 3/1/2011 2:00 PM Legislative Office Building 306 "
347487,2011-03-02,"House Subcommittee Work Session: 3/3/2011 4:00 PM Legislative Office Building 306 "
347487,2011-03-02,"House Executive Session: 3/9/2011 1:00 PM Legislative Office Building 306 "
347487,2011-03-09,"House Retained in Committee; House Calendar 27, PG.823 "
347487,2011-04-05,"House Retained Bill - Subcommittee Work Session: 4/14/2011 2:00 PM Legislative Office Building 306 "
347487,2011-08-24,"House Retained Bill - Subcommittee Work Session: 8/30/2011 11:30 Amendment Legislative Office Building 306 "
347487,2011-08-30,"House Retained Bill - Subcommittee Work Session: 9/20/2011 11:30 Amendment Legislative Office Building 306 "
347487,2011-09-27,"House Retained Bill - Subcommittee Work Session: 10/4/2011 3:00 PM Legislative Office Building 306 "
347487,2011-10-12,"House Retained Bill - Subcommittee Work Session: 10/20/2011 2:30 PM Legislative Office Building 306 "
347487,2011-10-12,"House Retained Bill - Executive Session: 10/27/2011 10:00 Amendment Legislative Office Building 306 (If Necessary Continued 11/1/2011 10:30 Amendment Legislative Office Building 306) "
347487,2011-11-01,"House Committee Report: Ought to Pass with Amendment #2786h for Jan 4 (Vote 11-5; Regular Calendar); House Calendar 70, PG.2218 "
347487,2011-11-01,"House Proposed Committee Amendment #2011-2786h; House Calendar 69, PG.2089-2094 "
347487,2012-01-05,"House Amendment #2786h Adopted, Voice Vote; House Journal  8, PG.483-488 "
347487,2012-01-05,"House Ought to Pass with Amendment #2786h: Motion Adopted Voice Vote; House Journal  8, PG.483-488 "
347487,2012-03-07,"Senate Introduced and Referred to Public and Municipal Affairs; Senate Journal 7, Pg.185 "
347487,2012-03-22,"Senate Hearing: 3/27/12, Room 101, Legislative Office Building, 11:00 a.m.; Senate Calendar 12 "
347487,2012-05-03,"Senate Committee Report: Ought to Pass with Amendment #2012-1971s, 5/9/12; Vote 5-0; Consent Calendar; Senate Calendar 18 "
347487,2012-05-09,"Senate Sen. Barnes Moved to Remove HB 137 from the Consent Calendar; Senate Journal 13, Pg.476 "
347487,2012-05-09,"Senate Committee Amendment 1971s; Amendment Adopted, Voice Vote; Senate Journal 13, Pg.502 "
347487,2012-05-09,"Senate Sen. Barnes Floor Amendment #2012-2182s, Amendment Adopted, Voice Vote; Senate Journal 13, Pg.502 "
347487,2012-05-09,"Senate Ought to Pass with Amendment 1971s, 2182s, Motion Adopted, Voice Vote; OT3rdg; Senate Journal 13, Pg.505 "
347487,2012-05-30,"House House Concurs with Senate Amendment #1971s and #2182s (Rep C.McGuire): Motion Adopted Voice Vote; House Journal  47, PG.2502 "
347487,2012-06-06,"Senate Enrolled Bill Amendment #2490e Adopted, Voice Vote "
347487,2012-06-06,"House Enrolled Bill Amendment #2012-2490e Adopted; House Journal  51, PG.2609-2610 "
347487,2012-06-06,"Senate Enrolled "
347487,2012-06-06,"House Enrolled; House Journal  51, PG.2613 "
347487,2012-06-22,"House Signed By Governor 06/18/2012; Chapter 0242 "
347487,2012-06-22,"House I. Section 4 Effective 07/01/2013 "
347487,2012-06-22,"House II. Remainder Effective 06/18/2012 "
347489,2011-01-10,"House Introduced 1/6/2011 and Referred to Criminal Justice and Public Safety; House Journal  11, PG. 173 "
347489,2011-01-18,"House Public Hearing: 1/25/2011 10:00 Amendment Legislative Office Building 204 "
347489,2011-01-26,"House Executive Session: 2/3/2011 10:00 Amendment Legislative Office Building 204 "
347489,2011-02-03,"House Retained in Committee; House Calendar 27, PG.823 "
347489,2011-08-30,"House Retained Bill - Subcommittee Work Session: 9/15/2011 10:00 Amendment Legislative Office Building 204 "
347489,2011-09-19,"House Retained Bill - Subcommittee Work Session: 9/29/2011 1:00 PM Legislative Office Building 204 "
347489,2011-09-27,"House Retained Bill - Executive Session: 10/20/2011 10:00 Amendment Legislative Office Building 204 "
347489,2011-10-25,"House Committee Report: Ought to Pass for Jan 4 (Vote 16-1; Consent Calendar); House Calendar 70, PG.2201 "
347489,2012-01-04,"House Removed from Consent Calendar (Rep Hoell); House Journal  7, PG.368 "
347489,2012-02-01,"House Ought to Pass: Motion Adopted Regular Calendar 254-93; House Journal  13, PG.752-754 "
347489,2012-03-28,"Senate Introduced and Referred to Finance; Senate Journal 9, Pg.332 "
347489,2012-04-11,"Senate Hearing: 4/19/12, Room 103, State House, 1:15 p.m.; Senate Calendar 15 "
347489,2012-04-19,"Senate Committee Report: Ought to Pass with Amendment #2012-1760s, 4/25/12; Senate Calendar 16 "
347489,2012-04-25,"Senate Committee Amendment 1760s; Amendment Adopted, Voice Vote; Senate Journal 11, Pg.393 "
347489,2012-04-25,"Senate Ought to Pass with Amendment 1760s, Motion Adopted, Voice Vote; OT3rdg; Senate Journal 11, Pg.415 "
347489,2012-05-30,"House House Concurs with Senate Amendment #1760s (Rep Swinford): Motion Adopted Voice Vote; House Journal  47, PG.2498 "
347489,2012-06-06,"Senate Enrolled "
347489,2012-06-06,"House Enrolled; House Journal  51, PG.2609 "
347489,2012-06-18,"House Signed By Governor 06/13/2012; Effective 08/12/2012; Chapter 0200 "
347490,2011-01-11,"House Introduced 1/6/2011 and Referred to Criminal Justice and Public Safety; House Journal  11, PG. 174 "
347490,2011-01-18,"House Public Hearing: 1/25/2011 10:30 Amendment Legislative Office Building 204 "
347490,2011-01-25,"House ==CANCELLED== Executive Session: 2/3/2011 10:00 Amendment Legislative Office Building 204 "
347490,2011-02-03,"House Subcommittee Work Session: 2/8/2011 9:15 Amendment Legislative Office Building 204 "
347490,2011-02-10,"House ==RESCHEDULED== Work Session: 2/15/2011 8:30 Amendment Legislative Office Building 204 (Orig 8:00 Amendment) "
347490,2011-02-16,"House Subcommittee Work Session: 2/22/2011 8:31 Amendment Legislative Office Building 204 "
347490,2011-03-02,"House Subcommittee Work Session: 3/9/2011 9:00 Amendment Legislative Office Building 204 "
347490,2011-03-02,"House Executive Session: 3/9/2011 10:00 Amendment Legislative Office Building 204 "
347490,2011-03-10,"House Committee Report: Ought to Pass with Amendment #0766h(NT) for Mar 15 (Vote 13-4; Regular Calendar); House Calendar 22, PG.548 "
347490,2011-03-10,"House Proposed Committee Amendment #2011-0766h (New Title); House Calendar 23, PG.587 "
347490,2011-03-15,"House Amendment #0766h (New Title) Adopted, Regular Calendar 215-151; House Journal  26, PG.759-761 "
347490,2011-03-15,"House Ought to Pass with Amendment #0766h(NT): Motion Adopted Division Vote 296-70; House Journal  26, PG.759-761 "
347490,2011-03-23,"Senate Introduced and Referred to Judiciary; Senate Journal 11, Pg.190 "
347490,2011-05-05,"Senate Hearing: 5/26/11, Room 101, Legislative Office Building, 1:15 p.m.; Senate Calendar 23 "
347490,2011-05-26,"Senate Committee Report: Rereferred to Committee, 6/1/11; Senate Calendar 26 "
347490,2011-06-01,"Senate Rereferred to Committee, Motion Adopted, Voice Vote; Senate Journal 19, Pg.519 "
347490,2012-02-02,"Senate Committee Report: Ought to Pass with Amendment #2012-0575s, New Title, 2/8/12; Senate Calendar 6 "
347490,2012-02-08,"Senate Committee Amendment 0575s, New Title, Amendment Adopted, Voice Vote; Senate Journal 4, Pg.109 "
347490,2012-02-08,"Senate Sen. Groen Floor Amendment #2012-0673s, Amendment Adopted, Voice Vote; Senate Journal 4, Pg.110 "
347490,2012-02-08,"Senate Sen. Houde Floor Amendment #2012-0670s, Amendment Failed, Voice Vote; Senate Journal 4, Pg.110 "
347490,2012-02-08,"Senate Sen. Houde Floor Amendment #2012-0678s, Amendment Failed, Voice Vote; Senate Journal 4, Pg.111 "
347490,2012-02-08,"Senate Ought to Pass with Amendment 0575s, New Title, 0673s, Regular Calendar 18Y-5N, Motion Adopted; OT3rdg; Senate Journal 4, Pg.112 "
347490,2012-03-07,"House House Non-Concurs with Senate Amendment's and Requests C of C (Rep Swinford): Motion Adopted Voice Vote; House Journal  21, PG.1253 "
347490,2012-03-07,"House Speaker Appoints: Reps Welch, Warden, Parsons, and Ginsburg; House Journal  21, PG.1253 "
347490,2012-05-02,"Senate Sen. Houde Accede to House Request for Committee of Conference Motion Adopted, Voice Vote; Senate Journal 12, Pg.470 "
347490,2012-05-02,"Senate President Appoints: Senators Groen, Luther, and Houde; Senate Journal 12, Pg.470 "
347490,2012-05-23,"House Conference Committee Meeting: 5/29/2012 8:30 Amendment Legislative Office Building 204 ==TIME CHANGE (Orig 9:00 Amendment)== "
347490,2012-05-30,"House Conferee Change: Rep Swinford Replaces Rep Ginsburg; House Journal  47, PG.2507 "
347490,2012-05-30,"Senate Conferee Change; Senator Carson Replaces Senator Houde "
347490,2012-05-31,"Senate Conference Committee Report #2012-2390c; Senate Amendment + New Amendment, Filed "
347490,2012-06-06,"Senate Conference Committee Report 2390c; Regular Calendar 17Y-6N, Adopted "
347490,2012-06-06,"House Conference Committee Report #2390c Failed, Division Vote 148-175; House Journal  51, PG.2586 "
347492,2011-01-11,"House Introduced 1/6/2011 and Referred to Judiciary; House Journal  11, PG. 174 "
347492,2011-01-19,"House Public Hearing: 1/27/2011 11:00 Amendment Legislative Office Building 208 "
347492,2011-01-19,"House Division II Work Session: 1/27/2011 1:30 PM Legislative Office Building 208 "
347492,2011-02-02,"House Division II Work Session: 2/10/2011 Legislative Office Building 208 3:00 PM or Following Public Hearing "
347492,2011-02-15,"House Executive Session: 2/15/2011 Legislative Office Building 208 Following House Session "
347492,2011-02-16,"House Committee Report: Inexpedient to Legislate for Feb 23 (Vote 15-0; Consent Calendar); House Calendar 15, PG.270-271 "
347492,2011-02-23,"House Removed from Consent Calendar (Rep Itse); House Journal  21, PG.456 "
347492,2011-02-23,"House Recommit (Rep Rowe): Motion Adopted Division Vote 208-71; House Journal  21, PG.518 "
347492,2011-03-02,"House Executive Session: 3/9/2011 10:00 Amendment Legislative Office Building 208 "
347492,2011-03-09,"House Committee Report: Ought to Pass with Amendment #0591h(NT) for Mar 15 (Vote 17-1; Consent Calendar); House Calendar 22, PG.533 "
347492,2011-03-09,"House Proposed Committee Amendment #2011-0591h (New Title); House Calendar 23, PG.587 "
347492,2011-03-15,"House Amendment #0591h (New Title) Adopted, Voice Vote; House Journal  26, PG.718 "
347492,2011-03-15,"House Ought to Pass with Amendment #0591h(NT): Motion Adopted Voice Vote; House Journal  26, PG.718 "
347492,2011-03-23,"Senate Introduced and Referred to Judiciary; Senate Journal 11, Pg.190 "
347492,2011-04-06,"Senate Hearing: 4/14/11, Room 101, Legislative Office Building, 1:00 p.m.; Senate Calendar 19 "
347492,2011-05-26,"Senate Committee Report: Inexpedient to Legislate, 6/1/11; Senate Calendar 26 "
347492,2011-06-01,"Senate Special Order to the end of the Calendar, Without Objection, Motion Adopted; Senate Journal 19, Pg.517 "
347492,2011-06-01,"Senate Committee Report: Inexpedient to Legislate, 6/1/11; Senate Calendar 26 "
347492,2011-06-01,"Senate Inexpedient to Legislate, Division 8Y-12N, Motion Failed; Senate Journal 19, Pg.520 "
347492,2011-06-01,"Senate Sen. Carson moved to Rereferred to Committee, Motion Adopted, Voice Vote; Senate Journal 19, Pg.520 "
347492,2012-01-12,"Senate Committee Report: Ought to Pass with Amendment #2012-0062s, 1/18/12; Senate Calendar 3 "
347492,2012-01-18,"Senate Committee Amendment 0062s, Amendment Adopted, Voice Vote; Senate Journal 2, Pg.64 "
347492,2012-01-18,"Senate Ought to Pass with Amendment 0062s, Regular Calendar 15Y-9N, Motion Adopted; OT3rdg; Senate Journal 2, Pg.65 "
347492,2012-03-07,"House House Non-Concurs with Senate Amendment and Requests C of C (Rep Rowe): Motion Adopted Voice Vote; House Journal  21, PG.1253 "
347492,2012-03-07,"House Speaker Appoints: Reps Giuda, LaCasse, McClarren, and Wall; House Journal  21, PG.1253 "
347492,2012-05-02,"Senate Sen. Houde Accede to House Request for Committee of Conference Motion Adopted, Voice Vote; Senate Journal 12, Pg.470 "
347492,2012-05-02,"Senate President Appoints: Senators Forsythe, Groen, and Houde; Senate Journal 12, Pg.470 "
347492,2012-05-23,"House Conference Committee Meeting: 5/30/2012 1:00 PM Legislative Office Building 208 "
347492,2012-05-25,"House Conferee Change: Rep Rowe Replaces Rep McClarren; House Journal  46, PG.2495 "
347492,2012-05-30,"Senate Conferee Change; Senator Carson Replaces Senator Houde "
347492,2012-05-31,"House Conferee Change: Rep Silva Replaces Rep Wall; House Journal  47, PG.2507 "
347492,2012-05-31,"Senate Conference Committee Report #2012-2434c; Senate Amendment, Filed "
347492,2012-06-06,"Senate Conference Committee Report 2434c; Regular Calendar 14Y-9N, Adopted "
347492,2012-06-06,"House Conference Committee Report #2434c Adopted, Voice Vote; House Journal  51, PG.2595 "
347492,2012-06-06,"Senate Enrolled "
347492,2012-06-06,"House Enrolled; House Journal  51, PG.2613 "
347492,2012-06-22,"House Signed By Governor 06/18/2012; Effective 01/01/2013; Chapter 0243 "
347493,2011-01-11,"House Introduced 1/6/2011 and Referred to Judiciary; House Journal  11, PG. 174 "
347493,2011-01-19,"House Public Hearing: 1/27/2011 10:00 Amendment Legislative Office Building 208 "
347493,2011-01-19,"House Division II Work Session: 1/27/2011 1:30 PM Legislative Office Building 208 "
347493,2011-02-02,"House Division II Work Session: 2/10/2011 Legislative Office Building 208 3:00 PM "
347493,2011-02-15,"House Executive Session: 2/15/2011 Legislative Office Building 208 Following House Session "
347493,2011-02-15,"House Retained in Committee; House Calendar 27, PG.824 "
347493,2011-08-09,"House Retained Bill - Subcommittee Work Session: 9/13/2011 11:00 Amendment Legislative Office Building 208 "
347493,2011-09-14,"House Retained Bill - Executive Session: 10/25/2011 11:00 Amendment Legislative Office Building 208 "
347493,2011-11-02,"House Committee Report: Ought to Pass with Amendment #2586h(NT) for Jan 4 (Vote 15-1; Consent Calendar); House Calendar 70, PG.2205-2206 "
347493,2011-11-02,"House Proposed Committee Amendment #2011-2586h (New Title); House Calendar 69, PG.2094-2095 "
347493,2012-01-04,"House Amendment #2586h(NT) Adopted, Voice Vote; House Journal  7, PG.410-411 "
347493,2012-01-04,"House Ought to Pass with Amendment #2586h(NT): Motion Adopted Voice Vote; House Journal  7, PG.410-411 "
347493,2012-02-08,"Senate Introduced and Referred to Judiciary; Senate Journal 5, Pg.121 "
347493,2012-03-06,"Senate Hearing: 3/22/12, Room 101, Legislative Office Building, 2:00 p.m.; Senate Calendar 10 "
347493,2012-03-19,"Senate Hearing: === TIME CHANGE === 3/22/12, Room 101, Legislative Office Building, 2:30 p.m.; Senate Calendar 11 "
347493,2012-04-20,"Senate Committee Report: Ought to Pass, 4/25/12; Senate Calendar 16A "
347493,2012-04-25,"Senate Ought to Pass: Motion Adopted, Voice Vote; OT3rdg; Senate Journal 11, Pg.415 "
347493,2012-04-25,"House Enrolled; House Journal  38, PG.2211 "
347493,2012-05-02,"Senate Enrolled; Senate Journal 13, Pg.474 "
347493,2012-05-21,"House Signed By Governor 05/15/2012; Chapter 0066 "
347493,2012-05-21,"House I. Section 8 Effective 05/15/2012 "
347493,2012-05-21,"House II. Remainder Effective 04/05/2016 "
347495,2011-01-11,"House Introduced 1/6/2011 and Referred to Election Law; House Journal  11, PG. 174 "
347495,2011-01-26,"House Public Hearing: 2/1/2011 3:00 PM Legislative Office Building 308 "
347495,2011-02-16,"House Executive Session: 2/22/2011 10:30 Amendment Legislative Office Building 308 "
347495,2011-02-22,"House Retained in Committee; House Calendar 27, PG.823 "
347495,2011-05-11,"House Retained Bill - Ballot Access and Election Procedures Subcommittee Work Session: 5/17/2011 2:00 PM Legislative Office Building 308 "
347495,2011-10-03,"House ==CANCELLED== Retained Bill - Subcommittee Work Session: 10/12/2011 Legislative Office Building 308 2:00 PM or Immediately Following House Session "
347495,2011-10-13,"House Retained Bill - Subcommittee Work Session: 10/18/2011 12:30 PM Legislative Office Building 308 "
347495,2011-10-19,"House Retained Bill - Executive Session: 10/27/2011 Legislative Office Building 308 1:00 PM or Immediately Following Public Hearing "
347495,2011-11-02,"House Committee Report: Inexpedient to Legislate for Jan 4 (Vote 19-0; Consent Calendar); House Calendar 70, PG.2203 "
347495,2012-01-04,"House Inexpedient to Legislate: Motion Adopted Voice Vote; House Journal  7, PG.382 "
347496,2011-01-11,"House Introduced 1/6/2011 and Referred to Election Law; House Journal  11, PG. 174 "
347496,2011-01-26,"House Public Hearing: 2/1/2011 3:30 PM Legislative Office Building 308 "
347496,2011-02-16,"House Executive Session: 2/22/2011 10:30 Amendment Legislative Office Building 308 "
347496,2011-02-22,"House Retained in Committee; House Calendar 27, PG.823 "
347496,2011-05-11,"House Retained Bill - Ballot Access and Election Procedures Subcommittee Work Session: 5/17/2011 2:30 PM Legislative Office Building 308 "
347496,2011-10-03,"House ==CANCELLED== Retained Bill - Subcommittee Work Session: 10/12/2011 Legislative Office Building 308 2:00 PM or Immediately Following House Session "
347496,2011-10-13,"House Retained Bill - Subcommittee Work Session: 10/18/2011 12:30 PM Legislative Office Building 308 "
347496,2011-10-19,"House Retained Bill - Executive Session: 10/27/2011 Legislative Office Building 308 1:00 PM or Immediately Following Public Hearing "
347496,2011-11-02,"House Committee Report: Inexpedient to Legislate for Jan 4 (Vote 17-0; Consent Calendar); House Calendar 70, PG.2203 "
347496,2012-01-04,"House Inexpedient to Legislate: Motion Adopted Voice Vote; House Journal  7, PG.382 "
347498,2011-01-11,"House Introduced 1/6/2011 and Referred to Criminal Justice and Public Safety; House Journal  11, PG. 175 "
347498,2011-02-09,"House Vacated from Criminal Justice and Public Safety and Referred to Judiciary; House Journal  16, PG.308 "
347498,2011-02-16,"House Public Hearing: 2/24/2011 10:00 Amendment Legislative Office Building 208 "
347498,2011-02-23,"House ==CANCELLED== Executive Session: 3/1/2011 1:00 PM Legislative Office Building (If Necessary Continued 3/3/2011 10:00 Amendment Legislative Office Building 208) "
347498,2011-03-02,"House Executive Session: 3/9/2011 10:00 Amendment Legislative Office Building 208 "
347498,2011-03-10,"House Majority Committee Report: Ought to Pass with Amendment #0643h for Mar 15 (Vote 15-2; Regular Calendar); House Calendar 22, PG.557 "
347498,2011-03-10,"House Proposed Majority Committee Amendment #2011-0643h; House Calendar 23, PG.588 "
347498,2011-03-10,"House Minority Committee Report: Inexpedient to Legislate; House Calendar 22, PG.557 "
347498,2011-03-16,"House Amendment #0643h Adopted, Voice Vote; House Journal  28, PG.873-874 "
347498,2011-03-16,"House Ought to Pass with Amendment #0643h: Motion Adopted Voice Vote; House Journal  28, PG.873-874 "
347498,2011-03-23,"Senate Introduced and Referred to Judiciary; Senate Journal 11, Pg.190 "
347498,2011-05-04,"Senate Hearing: 5/12/11, Room 101, Legislative Office Building, 1:00 p.m.; Senate Calendar 23 "
347498,2011-05-26,"Senate Committee Report: Rereferred to Committee, 6/1/11; Senate Calendar 26 "
347498,2011-06-01,"Senate Rereferred to Committee, Motion Adopted, Voice Vote; Senate Journal 19, Pg.519 "
347498,2012-01-12,"Senate Committee Report: Ought to Pass with Amendment #2012-0022s, 1/18/12; Senate Calendar 3 "
347498,2012-01-18,"Senate Committee Amendment 0022s, Amendment Adopted, Voice Vote; Senate Journal 2, Pg.65 "
347498,2012-01-18,"Senate Ought to Pass with Amendment 0022s, Motion Adopted, Voice Vote; OT3rdg; Senate Journal 2, Pg.65 "
347498,2012-03-07,"House House Non-Concurs with Senate Amendment and Requests C of C (Rep Rowe): Motion Adopted Voice Vote; House Journal  21, PG.1253 "
347498,2012-03-07,"House Speaker Appoints: Reps B.Murphy, Hagan, B.Palmer, and Watrous; House Journal  21, PG.1253 "
347498,2012-05-02,"Senate Sen. Houde Accede to House Request for Committee of Conference Motion Adopted, Voice Vote; Senate Journal 12, Pg.470 "
347498,2012-05-02,"Senate President Appoints: Senators Carson, Luther, and Houde; Senate Journal 12, Pg.470 "
347498,2012-05-23,"House Conference Committee Meeting: 5/29/2012 10:00 Amendment Legislative Office Building 208 ==RECESSED== "
347498,2012-05-29,"House ==RECONVENE== Conference Committee Meeting: 5/30/2012 1:30 PM Legislative Office Building 208 "
347498,2012-05-31,"Senate Conference Committee Report #2012-2436c; Senate Amendment + New Amendment, Filed "
347498,2012-06-06,"Senate Conference Committee Report 2436c; Adopted, Voice Vote "
347498,2012-06-06,"House Conference Committee Report #2436c Adopted, Voice Vote; House Journal  51, PG.2595 "
347498,2012-06-06,"Senate Enrolled "
347498,2012-06-06,"House Enrolled "
347498,2012-06-22,"House Signed By Governor 06/18/2012; Effective 08/17/2012; Chapter 0244 "
347499,2011-01-11,"House Introduced 1/6/2011 and Referred to Criminal Justice and Public Safety; House Journal  11, PG. 175 "
347499,2011-01-18,"House ==CANCELLED== Public Hearing: 1/27/2011 1:00 PM Legislative Office Building 204 "
347499,2011-01-20,"House ==RESCHEDULED== Public Hearing: 2/1/2011 1:00 PM RepresentativeS HALL "
347499,2011-03-02,"House Executive Session: 3/9/2011 10:00 Amendment Legislative Office Building 204 "
347499,2011-03-09,"House Retained in Committee; House Calendar 27, PG.823 "
347499,2011-09-26,"House Retained Bill - Subcommittee Work Session: 10/6/2011 10:00 Amendment Legislative Office Building 204 "
347499,2011-09-27,"House Retained Bill - Executive Session: 10/20/2011 10:00 Amendment Legislative Office Building 204 "
347499,2011-10-25,"House Committee Report: Ought to Pass for Jan 4 (Vote 11-6; Regular Calendar); House Calendar 70, PG.2215 "
347499,2012-01-04,"House Laid on the Table (Rep Swinford): Motion Adopted Regular Calendar 176-153; House Journal  7, PG.449-451 "
347501,2011-01-11,"House Introduced 1/6/2011 and Referred to Commerce and Consumer Affairs; House Journal  11, PG. 175 "
347501,2011-01-13,"House Public Hearing: 1/20/2011 10:00 Amendment Legislative Office Building 302 "
347501,2011-03-01,"House Executive Session: 3/9/2011 9:00 Amendment Legislative Office Building 302 "
347501,2011-03-09,"House Retained in Committee; House Calendar 27, PG.822 "
347501,2011-08-23,"House Retained Bill - Insurance/Consumer Div Subcom Work Session: 10/4/2011 1:15 PM Legislative Office Building 302 "
347501,2011-10-11,"House Retained Bill - Executive Session: 10/20/2011 1:15 PM Legislative Office Building 302 "
347501,2011-10-28,"House Committee Report: Inexpedient to Legislate for Jan 4 (Vote 11-3; Regular Calendar); House Calendar 70, PG.2212 "
347501,2012-01-04,"House Inexpedient to Legislate: Motion Adopted Voice Vote; House Journal  7, PG.430 "
347502,2011-01-11,"House Introduced 1/6/2011 and Referred to Commerce and Consumer Affairs; House Journal  11, PG. 175 "
347502,2011-01-13,"House Public Hearing: 1/19/2011 11:00 Amendment Legislative Office Building 302 ==RECESSED== "
347502,2011-01-25,"House Continued Public Hearing: 2/1/2011 1:15 PM Legislative Office Building 302 "
347502,2011-02-08,"House Subcommittee Work Session: 2/22/2011 9:00 Amendment Legislative Office Building 302 "
347502,2011-02-16,"House ==CANCELLED== Executive Session: 2/25/2011 10:00 Amendment Legislative Office Building 302 "
347502,2011-02-23,"House Executive Session: 3/1/2011 3:00 PM Legislative Office Building 302 "
347502,2011-03-09,"House Retained in Committee; House Calendar 27, PG.822 "
347502,2011-05-03,"House ==CANCELLED== Retained Bill - Subcommittee Work Session: 5/5/2011 10:00 Amendment Legislative Office Building 302 Insurance Div "
347502,2011-06-22,"House Retained Bill - Banking/Business Div Subcom Work Session: 9/6/2011 10:30 Amendment Legislative Office Building 302 "
347502,2011-09-06,"House Retained Bill - Banking/Busniess Div Subcom Work Session: 9/20/2011 10:15 Amendment Legislative Office Building 302 "
347502,2011-09-27,"House Retained Bill - Executive Session: 10/6/2011 10:00 Amendment Legislative Office Building 302 "
347502,2011-10-14,"House Committee Report: Ought to Pass with Amendment #2613h for Jan 4 (Vote 12-0; Consent Calendar); House Calendar 70, PG.2199 "
347502,2011-10-17,"House Proposed Committee Amendment #2011-2613h; House Calendar 69, PG.2095 "
347502,2012-01-04,"House Amendment #2613h Adopted, Voice Vote; House Journal  7, PG.368-369 "
347502,2012-01-04,"House Ought to Pass with Amendment #2613h: Motion Adopted Voice Vote; House Journal  7, PG.368-369 "
347502,2012-02-08,"Senate Introduced and Referred to Commerce; Senate Journal 5, Pg.121 "
347502,2012-03-22,"Senate Hearing: === RECESSED === 3/27/12, Room 102, Legislative Office Building, 9:10 a.m.; Senate Calendar 12 "
347502,2012-04-05,"Senate Hearing: ===RESCHEDULED=== 4/10/12, Room 102, Legislative Office Building, 9:00 a.m.; Senate Calendar 14 "
347502,2012-04-19,"Senate Committee Report: Ought to Pass, 4/25/12; Vote 5-0; Consent Calendar; Senate Calendar 16 "
347502,2012-04-25,"Senate Ought to Pass: Motion Adopted, Voice Vote; OT3rdg; Senate Journal 11, Pg.415 "
347502,2012-04-25,"House Enrolled; House Journal  38, PG.2211 "
347502,2012-05-02,"Senate Enrolled; Senate Journal 13, Pg.474 "
347502,2012-05-21,"House Signed By Governor 05/14/2012; Effective 07/13/2012; Chapter 0049 "
347504,2011-01-11,"House Introduced 1/6/2011 and Referred to Education; House Journal  11, PG. 175 "
347504,2011-01-19,"House Public Hearing: 1/27/2011 11:30 Amendment Legislative Office Building 207 "
347504,2011-02-18,"House Executive Session: 2/24/2011 1:00 PM Legislative Office Building 207 "
347504,2011-02-24,"House Retained in Committee; House Calendar 27, PG.823 "
347504,2011-09-09,"House Retained Bill - Subcommittee Work Session: 9/20/2011 1:00 PM Legislative Office Building 207 "
347504,2011-10-04,"House Retained Bill - Executive Session: 10/18/2011 10:00 Amendment Legislative Office Building 207 "
347504,2011-10-21,"House Committee Report: Inexpedient to Legislate for Jan 4 (Vote 13-0; Consent Calendar); House Calendar 70, PG.2202 "
347504,2012-01-04,"House Inexpedient to Legislate: Motion Adopted Voice Vote; House Journal  7, PG.380 "
347505,2011-01-11,"House Introduced 1/6/2011 and Referred to Election Law; House Journal  11, PG.176 "
347505,2011-01-26,"House Public Hearing: 2/1/2011 1:30 PM Legislative Office Building 308 "
347505,2011-02-23,"House Executive Session: 3/1/2011 10:30 Amendment Legislative Office Building 308 "
347505,2011-03-09,"House Majority Committee Report: Ought to Pass with Amendment #0551h(NT) for Mar 15 (Vote 13-2; Regular Calendar); House Calendar 22, PG.551-552 "
347505,2011-03-09,"House Proposed Majority Committee Amendment #2011-0551h (New Title); House Calendar 23, PG.589 "
347505,2011-03-09,"House Minority Committee Report: Inexpedient to Legislate; House Calendar 22, PG.551-552 "
347505,2011-03-15,"House Amendment #0551h (New Title) Adopted, Voice Vote; House Journal  26, PG.795 "
347505,2011-03-15,"House Ought to Pass with Amendment #0551h(NT): Motion Adopted Voice Vote; House Journal  26, PG.795 "
347505,2011-03-23,"Senate Introduced and Referred to Public and Municipal Affairs; Senate Journal 11, Pg.190 "
347505,2011-03-29,"Senate Hearing: 4/5/11, Room 101, Legislative Office Building, 9:00 a.m.; Senate Calendar 18 "
347505,2011-04-06,"Senate Committee Report: Rereferred to Committee, 4/13/11; Senate Calendar 19 "
347505,2011-04-13,"Senate Rereferred to Committee, Motion Adopted, Voice Vote; Senate Journal 12, Pg.252 "
347505,2012-01-12,"Senate Committee Report: Ought to Pass with Amendment #2011-2609s, New Title; 1/18/12; Senate Calendar 3 "
347505,2012-01-18,"Senate Committee Amendment 2609s, New Title, Amendment Adopted, Voice Vote; Senate Journal 2, Pg.68 "
347505,2012-01-18,"Senate Ought to Pass with Amendment 2609s, New Title Motion Adopted, Voice Vote; OT3rdg; Senate Journal 2, Pg.68 "
347505,2012-02-01,"House House Non-Concurs with Senate Amendment (Rep Bates): Motion Adopted Voice Vote; House Journal  13, PG.739 "
347507,2011-01-13,"House Introduced 1/6/2011 and Referred to Executive Departments and Administration; House Journal  11, PG. 176 "
347507,2011-01-19,"House Public Hearing: 1/25/2011 11:00 Amendment Legislative Office Building 306 "
347507,2011-02-14,"House ==CANCELLED== Executive Session: 2/16/2011 Legislative Office Building 306 1:30 PM or 45 minutes after House session "
347507,2011-03-01,"House Subcommittee Work Session: 3/9/2011 9:00 Amendment Legislative Office Building 306 "
347507,2011-03-02,"House Executive Session: 3/9/2011 1:00 PM Legislative Office Building 306 "
347507,2011-03-09,"House Retained in Committee; House Calendar 27, PG.823 "
347507,2011-09-20,"House Retained Bill - Subcommittee Work Session: 10/6/2011 10:00 Amendment Legislative Office Building 306 "
347507,2011-09-27,"House Retained Bill - Executive Session: 10/27/2011 10:00 Amendment Legislative Office Building 306 (If Necessary Continued 11/1/2011 10:30 Amendment Legislative Office Building 306) "
347507,2011-11-01,"House Committee Report: Ought to Pass with Amendment #2692h for Jan 4 (Vote 17-0; Consent Calendar); House Calendar 70, PG.2203 "
347507,2011-11-01,"House Proposed Committee Amendment #2011-2692h; House Calendar 69, PG.2095-2097 "
347507,2012-01-04,"House Amendment #2692h Adopted, Voice Vote; House Journal  7, PG.382-384 "
347507,2012-01-04,"House Ought to Pass with Amendment #2692h: Motion Adopted Voice Vote; House Journal  7, PG.382-384 "
347507,2012-02-15,"Senate Introduced and Referred to Executive Departments and Administration; Senate Journal 6, Pg.144 "
347507,2012-02-29,"Senate Hearing: 3/8/12, Room 100, State House, 9:00 a.m.; Senate Calendar 9A "
347507,2012-03-22,"Senate Committee Report: Ought to Pass with Amendment #2012-1399s, 3/28/12; Vote 5-0; Consent Calendar; Senate Calendar 12 "
347507,2012-03-28,"Senate Committee Amendment 1399s; Amendment Adopted, Voice Vote; Senate Journal 8, Pg.263 "
347507,2012-03-28,"Senate Ought to Pass with Amendment 1399s, Motion Adopted, Voice Vote; OT3rdg; Senate Journal 8, Pg.328 "
347507,2012-04-11,"House House Non-Concurs with Senate Amendment and Requests C of C (Rep C.McGuire): Motion Adopted Voice Vote "
347507,2012-04-11,"House Speaker Appoints: Reps Hawkins, Hansen, Ingbretson, and Y.Thomas "
347507,2012-05-02,"Senate Sen. Carson Accede to House Request for Committee of Conference Motion Adopted, Voice Vote; Senate Journal 12, Pg.470 "
347507,2012-05-02,"Senate President Appoints: Senators Carson, Groen, and Larsen; Senate Journal 12, Pg.470 "
347507,2012-05-22,"House Conference Committee Meeting: 5/23/2012 1:00 PM Legislative Office Building 306 "
347507,2012-05-30,"Senate Conference Committee Report #2012-2430c; Senate Amendment + New Amendment, Filed "
347507,2012-06-06,"Senate Conference Committee Report 2430c; Adopted, Voice Vote "
347507,2012-06-06,"House Conference Committee Report #2430c Adopted, Voice Vote; House Journal  51, PG.2595 "
347507,2012-06-06,"Senate Enrolled "
347507,2012-06-06,"House Enrolled; House Journal  51, PG.2613 "
347507,2012-06-22,"House Signed By Governor 06/18/2012; Effective 06/18/2012; Chapter 0245 "
347508,2011-01-13,"House Introduced 1/6/2011 and Referred to Fish and Game and Marine Resources; House Journal  11, PG. 176 "
347508,2011-01-19,"House Public Hearing: 1/25/2011 2:00 PM Legislative Office Building 307 "
347508,2011-02-01,"House Executive Session: 2/10/2011 2:00 PM Legislative Office Building 307 "
347508,2011-02-24,"House Committee Report: Inexpedient to Legislate for Mar 2 (Vote 12-4; Regular Calendar); House Calendar 18, PG.391-392 "
347508,2011-03-02,"House Recommit (Rep G.Hopper): Motion Adopted Regular Calendar 241-108; House Journal  25, PG.684-686 "
347508,2011-03-02,"House Executive Session: 3/3/2011 10:00 Amendment Legislative Office Building 307 "
347508,2011-03-03,"House Retained in Committee; House Calendar 27, PG.824 "
347508,2011-09-15,"House Retained Bill - Subcommittee Work Session: 9/28/2011 9:00 Amendment Legislative Office Building 307 "
347508,2011-10-07,"House Retained Bill - Subcommittee Work Session: 10/12/2011 Legislative Office Building 307 1:00 PM Or Immediately Following House Session "
347508,2011-10-07,"House Retained Bill - Executive Session: 10/18/2011 10:00 Amendment Legislative Office Building 307 "
347508,2011-11-02,"House Majority Committee Report: Ought to Pass with Amendment #2751h(NT) for Jan 4 (Vote 7-3; Regular Calendar); House Calendar 70, PG.2220 "
347508,2011-11-02,"House Proposed Majority Committee Amendment #2011-2751h (New Title); House Calendar 69, PG.2097 "
347508,2011-11-02,"House Minority Committee Report: Inexpedient to Legislate; House Calendar 70, PG.2220 "
347508,2012-01-05,"House Amendment #2751h(NT) Adopted, Voice Vote; House Journal  8, PG.515-516 "
347508,2012-01-05,"House Ought to Pass with Amendment #2751h(NT): Motion Adopted Regular Calendar 204-110; House Journal  8, PG.515-517 "
347508,2012-01-12,"Senate Introduced 1/4/2012 and Referred to Judiciary; Senate Journal 2, Pg.19 "
347508,2012-01-19,"Senate Hearing: 1/26/12, Room 100, State House, 1:30 p.m; Senate Calendar 4 "
347508,2012-01-27,"Senate Committee Report: Referred to Interim Study, 2/8/12; Senate Calendar 6 "
347508,2012-02-08,"Senate Refer to Interim Study, Motion Adopted, Voice Vote; Senate Journal 4, Pg.112 "
347510,2011-01-13,"House Introduced 1/6/2011 and Referred to Judiciary; House Journal  11, PG. 176 "
347510,2011-01-19,"House Public Hearing: 1/25/2011 11:00 Amendment Legislative Office Building 208 "
347510,2011-01-19,"House Division I Work Session: 1/25/2011 1:30 PM Legislative Office Building 208 "
347510,2011-01-26,"House Executive Session: 2/1/2011 11:00 Amendment Legislative Office Building 208 ==RECESSED== "
347510,2011-02-09,"House Continued Executive Session: 2/14/2011 10:00 Amendment Legislative Office Building 208 "
347510,2011-02-14,"House Retained in Committee; House Calendar 27, PG.824 "
347510,2011-09-15,"House Retained Bill - Subcommittee Work Session: 10/4/2011 10:00 Amendment Legislative Office Building 208 "
347510,2011-09-15,"House Retained Bill - Executive Session: 10/25/2011 11:00 Amendment Legislative Office Building 208 "
347510,2011-11-02,"House Majority Committee Report: Inexpedient to Legislate for Jan 4 (Vote 10-6; Regular Calendar); House Calendar 70, PG.2221 "
347510,2011-11-02,"House Minority Committee Report: Ought to Pass with Amendment #0086h; House Calendar 70, PG.2221 "
347510,2011-11-02,"House Proposed Minority Committee Amendment #2011-0086h; House Calendar 69, PG.2097 "
347510,2012-01-05,"House Inexpedient to Legislate: Motion Adopted Voice Vote; House Journal  8, PG.524 "
347511,2011-01-19,"House Introduced 1/6/2011 and Referred to Criminal Justice and Public Safety; House Journal  11, PG. 177 "
347511,2011-02-16,"House Public Hearing: 3/3/2011 10:01 Amendment Legislative Office Building 204 "
347511,2011-03-02,"House Executive Session: 3/9/2011 10:00 Amendment Legislative Office Building 204 "
347511,2011-03-10,"House Committee Report: Ought to Pass for Mar 15 (Vote 9-8; Regular Calendar); House Calendar 22, PG.548 "
347511,2011-03-15,"House Ought to Pass: Motion Adopted Regular Calendar 270-92; House Journal  26, PG.762-764 "
347511,2011-03-23,"Senate Introduced and Referred to Judiciary; Senate Journal 11, Pg.191 "
347511,2011-03-31,"Senate Hearing: 4/7/11, Room 101, Legislative Office Building, 1:15 p.m.; Senate Calendar 18 "
347511,2011-05-05,"Senate Committee Report: Ought to Pass with Amendment #2011-1780s, 5/11/11; Senate Calendar 23 "
347511,2011-05-11,"Senate Committee Amendment 1780s, Amendment Adopted, Voice Vote; Senate Journal 16, Pg.333 "
347511,2011-05-11,"Senate Ought to Pass with Amendment 1780s, Motion Failed, Voice Vote; Senate Journal 16, Pg.333 "
347511,2011-05-11,"Senate Sen. Luther moved to Rereferred to Committee, Motion Adopted, Voice Vote; Senate Journal 16, Pg.333 "
347511,2012-01-27,"Senate Committee Report: Referred to Interim Study, 2/8/12; Senate Calendar 6 "
347511,2012-02-08,"Senate Refer to Interim Study, Motion Adopted, Voice Vote; Senate Journal 4, Pg.112 "
347513,2011-01-19,"House Introduced 1/6/2011 and Referred to Election Law; House Journal  11, PG.177 "
347513,2011-01-26,"House Public Hearing: 2/1/2011 1:00 PM Legislative Office Building 308 "
347513,2011-03-02,"House Executive Session: 3/9/2011 10:30 Amendment Legislative Office Building 308 "
347513,2011-03-09,"House Retained in Committee; House Calendar 27, PG.823 "
347513,2011-09-27,"House Retained Bill - Subcommittee Work Session: 10/6/2011 1:00 PM Legislative Office Building 308 "
347513,2011-10-19,"House Retained Bill - Executive Session: 10/27/2011 Legislative Office Building 308 1:00 PM or Immediately Following Public Hearing "
347513,2011-11-02,"House Committee Report: Refer to Interim Study for Jan 4 (Vote 15-4; Regular Calendar); House Calendar 70, PG.2217 "
347513,2012-01-05,"House Refer to Interim Study: Motion Adopted Voice Vote; House Journal  8, PG.482 "
347513,2012-06-07,"House Referred to Election Law for Interim Study; House Calendar 45, PG.2432 "
347513,2012-09-21,"House ==CANCELLED== Interim Study - Subcommittee Work Session: 9/27/2012 10:30 Amendment Legislative Office Building 308 "
347513,2012-09-24,"House ==RESCHEDULED== Interim Study - Subcommittee Work Session: 10/4/2012 2:00 PM Legislative Office Building 308 "
347513,2012-09-26,"House Interim Study - Executive Session: 10/16/2012 10:00 Amendment Legislative Office Building 308 "
347515,2011-01-19,"House Introduced 1/6/2011 and Referred to Criminal Justice and Public Safety; House Journal  11, PG. 177 "
347515,2011-02-09,"House Public Hearing: 2/17/2011 2:00 PM Legislative Office Building 204 "
347515,2011-02-16,"House Executive Session: 2/22/2011 10:00 Amendment Legislative Office Building 204 "
347515,2011-02-23,"House Retained in Committee; House Calendar 27, PG.823 "
347515,2011-09-07,"House Retained Bill - Subcommittee Work Session: 9/20/2011 10:00 Amendment Legislative Office Building 204 "
347515,2011-09-27,"House Retained Bill - Executive Session: 10/20/2011 10:00 Amendment Legislative Office Building 204 ==RECESSED== "
347515,2011-10-20,"House Retained Bill - Continued Executive Session: 10/25/2011 10:00 Amendment Legislative Office Building 204 "
347515,2011-10-26,"House Committee Report: Ought to Pass with Amendment #2781h(NT) for Jan 4 (Vote 12-4; Regular Calendar); House Calendar 70, PG.2215 "
347515,2011-10-26,"House Proposed Committee Amendment #2011-2781h (New Title); House Calendar 69, PG.2097-2098 "
347515,2012-01-04,"House Amendment #2781h(NT) Adopted, Voice Vote; House Journal  7, PG.451-452 "
347515,2012-01-04,"House Floor Amendment #2012-0047h(NT) (Rep Souza) Failed, Regular Calendar 139-201; House Journal  7, PG.452-455 "
347515,2012-01-04,"House Floor Amendment #2012-0010h(NT) (Rep Bettencourt) Adopted, Voice Vote; House Journal  7, PG.455-456 "
347515,2012-01-04,"House Ought to Pass with Amendment #2781h(NT) and #0010h(NT): Motion Adopted Regular Calendar 213-125; House Journal  7, PG.451-458 "
347515,2012-02-08,"Senate Introduced and Referred to Judiciary; Senate Journal 5, Pg.121 "
347515,2012-04-11,"Senate Hearing: 4/26/12, Room 101, Legislative Office Building, 2:30 p.m.; Senate Calendar 15 "
347515,2012-04-27,"Senate Committee Report: Ought to Pass with Amendment #2012-1892s, 5/2/12; Senate Calendar 17A "
347515,2012-04-27,"Senate Corrected Committee Report: Ought to Pass with Amendment #2012-1896s, New Title, 5/2/12; Senate Calendar 17B "
347515,2012-05-02,"Senate Special Order to 5/9/12, Without Objection, Motion Adopted; Senate Journal 12, Pg.421 "
347515,2012-05-02,"Senate Corrected Committee Report: Ought to Pass with Amendment #2012-1896s, 5/9/12; Senate Calendar 18 "
347515,2012-05-09,"Senate Special Ordered to 5/16/12, Without Objection, Motion Adopted; Senate Journal 13, Pg.478 "
347515,2012-05-09,"Senate Corrected Committee Report: Ought to Pass with Amendment #2012-1896s, New Title, 5/16/12 "
347515,2012-05-16,"Senate Special Ordered to the end of the Calendar, Without Objection, Motion Adopted; Senate Journal 14, Pg.515 "
347515,2012-05-16,"Senate Corrected Committee Report: Ought to Pass with Amendment #2012-1896s, New Title, 5/16/12 "
347515,2012-05-16,"Senate Committee Amendment 1896s, New Title, Amendment Failed, Voice Vote "
347515,2012-05-16,"Senate Sen. Houde Floor Amendment #2012-2287s, New Title, Regular Calendar 13Y-11N, Amendment Adopted "
347515,2012-05-16,"Senate Sen. Forsythe Floor Amendment #2012-2310s, New Title, Regular Calendar 15Y-9N, Amendment Adopted "
347515,2012-05-16,"Senate Ought to Pass with Amendments 2287s, New Title, 2310s, New Title, Motion Adopted, Regular Calendar 18Y-6N; OT3rdg "
347515,2012-05-30,"House House Concurs with Senate Amendment #2287s(NT) and #2310s(NT) (Rep Swinford): Motion Adopted Regular Calendar 210-108; House Journal  47, PG.2499-2500 "
347515,2012-06-06,"Senate Enrolled Bill Amendment #2478e Adopted, Voice Vote "
347515,2012-06-06,"House Enrolled Bill Amendment #2012-2478e Adopted; House Journal  51, PG.2610 "
347515,2012-06-06,"Senate Enrolled "
347515,2012-06-06,"House Enrolled "
347515,2012-06-18,"House Vetoed By Governor 06/18/2012; House Calendar 49, PG.2521-2522 "
347515,2012-06-27,"House Shall HB 217 Become Law: Veto Sustained, Regular Calendar 201-126 Lacking Necessary Two-Thirds Vote; House Journal  53, PG.2647-2649 "
347516,2011-01-19,"House Introduced 1/6/2011 and Referred to Education; House Journal  11, PG. 177 "
347516,2011-02-09,"House Public Hearing: 2/22/2011 10:30 Amendment Legislative Office Building 207 "
347516,2011-02-18,"House Executive Session: 3/3/2011 10:00 Amendment Legislative Office Building 207 "
347516,2011-03-04,"House Retained in Committee; House Calendar 27, PG.823 "
347516,2011-06-21,"House Retained Bill - Subcommittee Work Session: 6/22/2011 Legislative Office Building 207 During Session Lunch Break "
347516,2011-08-24,"House Retained Bill - Subcommittee Work Session: 9/6/2011 9:00 Amendment Legislative Office Building 207 "
347516,2011-08-24,"House Retained Bill - Subcommittee Work Session: 9/13/2011 9:00 Amendment Legislative Office Building 207 "
347516,2011-09-14,"House Retained Bill - Subcommittee Work Session: 9/20/2011 9:00 Amendment Legislative Office Building 205 "
347516,2011-09-20,"House Retained Bill - Subcommittee Work Session: 10/4/2011 9:00 Amendment Legislative Office Building 207 "
347516,2011-10-05,"House Retained Bill - Subcommittee Work Session: 10/11/2011 9:00 Amendment Legislative Office Building 207 "
347516,2011-10-11,"House Retained Bill - Subcommittee Work Session: 10/18/2011 8:30 Amendment Legislative Office Building 207 "
347516,2011-10-11,"House Retained Bill - Executive Session: 10/18/2011 10:00 Amendment Legislative Office Building 207 (If Necessary Continued 10/25/2011 10:00 Amendment Legislative Office Building 207) "
347516,2011-10-27,"House Committee Report: Ought to Pass with Amendment #2755h(NT) for Jan 4 (Vote 12-4; Regular Calendar); House Calendar 70, PG.2217 "
347516,2011-10-27,"House Proposed Committee Amendment #2011-2755h (New Title); House Calendar 69, PG.2098-2099 "
347516,2012-01-05,"House Special Order to 3:00 PM (Rep Balboni): Motion Adopted Division Vote 306-29; House Journal  8, PG.473-474 "
347516,2012-01-05,"House Amendment #2755h(NT) Adopted, Regular Calendar 208-109; House Journal  8, PG.501-504 "
347516,2012-01-05,"House Ought to Pass with Amendment #2755h(NT): Motion Adopted Regular Calendar 214-110; House Journal  8, PG.505-506 "
347516,2012-02-08,"Senate Introduced and Referred to Education; Senate Journal 5, Pg.121 "
347516,2012-03-29,"Senate Hearing: 4/03/12, Room 103, Legislative Office Building, 1:15 p.m.; Senate Calendar 13 "
347516,2012-04-04,"Senate Committee Report: Inexpedient to Legislate, 4/11/12; Senate Calendar 14 "
347516,2012-04-11,"Senate Inexpedient to Legislate, Motion Adopted, Voice Vote === BILL KILLED ===; Senate Journal 9, Pg.341 "
347518,2011-01-19,"House Introduced 1/6/2011 and Referred to Resources, Recreation and Development; House Journal  11, PG. 177 "
347518,2011-01-26,"House Public Hearing: 2/1/2011 2:00 PM Legislative Office Building 305 "
347518,2011-01-26,"House Executive Session: 2/8/2011 1:00 PM Legislative Office Building 305 "
347518,2011-02-09,"House Retained in Committee; House Calendar 27, PG.825 "
347518,2011-07-26,"House Retained Bill - Full Committee Work Session: 8/9/2011 10:00 Amendment Legislative Office Building 305 "
347518,2011-09-13,"House Retained Bill - Subcommittee Work Session: 10/4/2011 10:30 Amendment Legislative Office Building 305 "
347518,2011-09-13,"House Retained Bill - Executive Session: 10/25/2011 10:00 Amendment Legislative Office Building 305 "
347518,2011-11-02,"House Majority Committee Report: Ought to Pass with Amendment #2756h for Jan 4 (Vote 8-7; Regular Calendar); House Calendar 70, PG.2224 "
347518,2011-11-02,"House Proposed Majority Committee Amendment #2011-2756h; House Calendar 69, PG.2099-2101 "
347518,2011-11-02,"House Minority Committee Report: Refer to Interim Study; House Calendar 70, PG.2224 "
347518,2012-01-11,"House Amendment #2756h Failed, Voice Vote; House Journal  9, PG.536-538 "
347518,2012-01-11,"House Ought to Pass: Motion Failed Voice Vote; House Journal  9, PG.536-538 "
347518,2012-01-11,"House Refer to Interim Study (Rep Bolster): Motion Adopted Voice Vote; House Journal  9, PG.536-538 "
347518,2012-06-07,"House Referred to Resources, Recreation and Development for Interim Study; House Calendar 45, PG.2433 "
347518,2012-09-26,"House Interim Study - Executive Session: 10/16/2012 10:00 Amendment Legislative Office Building 305 "
347519,2011-01-19,"House Introduced 1/6/2011 and Referred to Executive Departments and Administration; House Journal  11, PG. 177 "
347519,2011-01-25,"House Public Hearing: 2/1/2011 1:00 PM Legislative Office Building 306 "
347519,2011-02-03,"House Subcommittee Work Session: 2/8/2011 2:30 PM Legislative Office Building 306 "
347519,2011-02-14,"House Executive Session: 2/16/2011 Legislative Office Building 306 1:30 PM or 45 minutes following House session "
347519,2011-02-17,"House Committee Report: Inexpedient to Legislate for Feb 23 (Vote 16-0; Consent Calendar); House Calendar 15, PG.268 "
347519,2011-02-23,"House Removed from Consent Calendar (Rep C.McGuire); House Journal  21, PG.456 "
347519,2011-02-23,"House Recommit (Rep C.McGuire): Motion Adopted Voice Vote; House Journal  21, PG.517-518 "
347519,2011-02-24,"House Executive Session: 3/2/2011 Legislative Office Building 306 2:00 PM or 45 Minutes Following House Session "
347519,2011-03-02,"House Retained in Committee; House Calendar 27, PG.823 "
347519,2011-04-20,"House Retained Bill - Subcommittee Work Session: 4/26/2011 10:00 Amendment Legislative Office Building 307 "
347519,2011-06-03,"House Retained Bill - Subcommittee Work Session: 8/2/2011 10:30 Amendment Legislative Office Building 306 "
347519,2011-08-02,"House Retained Bill - Subcommittee Work Session: 9/27/2011 10:30 Amendment Legislative Office Building 306 "
347519,2011-09-27,"House Retained Bill - Subcommittee Work Session: 10/4/2011 10:30 Amendment Legislative Office Building 306 "
347519,2011-09-27,"House Retained Bill - Subcommittee Work Session: 10/18/2011 10:30 Amendment Legislative Office Building 306 "
347519,2011-09-27,"House Retained Bill - Executive Session: 10/27/2011 10:00 Amendment Legislative Office Building 306 (If Necessary Continued 11/1/2011 10:30 Amendment Legislative Office Building 306) "
347519,2011-11-01,"House Committee Report: Ought to Pass with Amendment #2809h(NT) for Jan 4 (Vote 16-0; Consent Calendar); House Calendar 70, PG.2203-2204 "
347519,2011-11-01,"House Proposed Committee Amendment #2011-2809h (New Title); House Calendar 69, PG.2101-2105 "
347519,2012-01-04,"House Amendment #2809h(NT) Adopted, Voice Vote; House Journal  7, PG.384-388 "
347519,2012-01-04,"House Ought to Pass with Amendment #2809h(NT): Motion Adopted Voice Vote; House Journal  7, PG.384-388 "
347519,2012-02-15,"Senate Introduced and Referred to Executive Departments and Administration; Senate Journal 6, Pg.144 "
347519,2012-03-08,"Senate Hearing: 3/15/12, Room 100, State House, 9:30 a.m.; Senate Calendar 10 "
347519,2012-04-26,"Senate Committee Report: Ought to Pass with Amendment #2012-1880s, 5/2/12; Senate Calendar 17 "
347519,2012-05-02,"Senate Committee Amendment 1880s; Amendment Adopted, Voice Vote; Senate Journal 12, Pg.444 "
347519,2012-05-02,"Senate Ought to Pass with Amendment 1880s, Motion Adopted, Voice Vote; OT3rdg; Senate Journal 12, Pg.471 "
347519,2012-05-16,"House House Concurs with Senate Amendment #1880s (Rep C.McGuire): Motion Adopted Voice Vote; House Journal  44, PG.2351 "
347519,2012-05-23,"Senate Enrolled Bill Amendment #2383e Adopted "
347519,2012-05-30,"House Enrolled Bill Amendment #2012-2383e Adopted; House Journal  47, PG.2506 "
347519,2012-05-30,"House Enrolled; House Journal  47, PG.2508 "
347519,2012-06-05,"Senate Enrolled (05/23/12) "
347519,2012-06-15,"House Signed By Governor 06/11/2012; Effective 08/10/2012; Chapter 0171 "
347521,2011-01-19,"House Introduced 1/6/2011 and Referred to Criminal Justice and Public Safety; House Journal  11, PG.178 "
347521,2011-02-09,"House Public Hearing: 2/17/2011 10:00 Amendment Legislative Office Building 204 "
347521,2011-02-16,"House Executive Session: 2/22/2011 10:00 Amendment Legislative Office Building 204 "
347521,2011-02-22,"House Committee Report: Inexpedient to Legislate for Mar 2 (Vote 14-2; Consent Calendar); House Calendar 18, PG.386 "
347521,2011-03-02,"House Removed from Consent Calendar (Rep Giuda); House Journal  25, PG.671 "
347521,2011-03-02,"House Recommit (Rep Jasper): Motion Adopted Voice Vote; House Journal  25, PG.688 "
347521,2011-03-02,"House Executive Session: 3/9/2011 10:00 Amendment Legislative Office Building 204 "
347521,2011-03-09,"House Committee Report: Ought to Pass with Amendment #0541h for Mar 15 (Vote 11-5; Regular Calendar); House Calendar 22, PG.548 "
347521,2011-03-09,"House Proposed Committee Amendment #2011-0541h; House Calendar 23, PG.593 "
347521,2011-03-15,"House Amendment #0541h Adopted, Voice Vote; House Journal  26, PG.764 "
347521,2011-03-15,"House Ought to Pass with Amendment #0541h: Motion Adopted Regular Calendar 295-69; House Journal  26, PG.764-766 "
347521,2011-03-30,"Senate Introduced and Referred to Judiciary; Senate Journal 12, Pg.243 "
347521,2011-04-13,"Senate Hearing: 4/28/11, Room 101, Legislative Office Building, 2:00 p.m.; Senate Calendar 20 "
347521,2011-05-03,"Senate Committee Report: Rereferred to Committee, 5/11/11; Senate Calendar 23 "
347521,2011-05-11,"Senate Rereferred to Committee, Motion Adopted, Voice Vote; Senate Journal 16 "
347521,2012-02-02,"Senate Committee Report: Ought to Pass with Amendment #2012-0576s, 2/8/12; Senate Calendar 6 "
347521,2012-02-08,"Senate Committee Amendment 0576s, Amendment Adopted, Voice Vote "
347521,2012-02-08,"Senate Ought to Pass with Amendment 0576s, Motion Adopted, Voice Vote; Refer to Finance Rule 4-3; Senate Journal 4, Pg.112 "
347521,2012-04-26,"Senate Committee Report: Referred to Interim Study, 5/2/12; Senate Calendar 17 "
347521,2012-05-02,"Senate Special Order to 5/9/12, Without Objection, Motion Adopted; Senate Journal 12, Pg.421 "
347521,2012-05-02,"Senate Committee Report: Referred to Interim Study, 5/9/12; Senate Calendar 18 "
347521,2012-05-09,"Senate Refer to Interim Study, Motion Failed, Voice Vote; Senate Journal 13, Pg.487 "
347521,2012-05-09,"Senate Sen. Groen moved Ought to Pass "
347521,2012-05-09,"Senate Sen. Groen Floor Amendment #2012-2154s, Amendment Adopted, Voice Vote; Senate Journal 13, Pg.487 "
347521,2012-05-09,"Senate Ought to Pass with Amendment 2154s, Motion Adopted, Voice Vote; OT3rdg; Senate Journal 13, Pg.505 "
347521,2012-05-17,"House House Non-Concurs with Senate Amendment #0576s and #2154s and Requests C of C (Rep Hawkins): Motion Adopted Voice Vote; House Journal  46, PG.2491 "
347521,2012-05-17,"House Speaker Appoints: Reps Kreis, Parsons, Warden, and Gagne; House Journal  46, PG.2491 "
347521,2012-05-23,"Senate Sen. Houde Accedes to House Request for Committee of Conference ; Motion Adopted, Voice Vote "
347521,2012-05-23,"Senate President Appoints: Senators Groen, Luther, and Houde "
347521,2012-05-24,"House Committee of Conference Meeting: 5/29/2012 10:00 Amendment Legislative Office Building 204 "
347521,2012-05-31,"Senate Conference Committee Report; Not Signed Off "
347522,2011-01-20,"House Introduced 1/6/2011 and Referred to Special Committee on Public Employee Pensions Reform; House Journal  11, PG. 178 "
347522,2011-01-25,"House Public Hearing: 2/11/2011 10:00 Amendment Legislative Office Building 201-203 ==ROOM CHANGE (Orig Legislative Office Building 205)== "
347522,2011-02-08,"House ==CANCELLED==Full Committee Work Session: 2/18/2011 2:00 PM Legislative Office Building 201-203 "
347522,2011-02-09,"House ==CANCELLED==Executive Session: 2/18/2011 3:00 PM Legislative Office Building 201-203 "
347522,2011-03-02,"House ==RESCHEDULED== Full Committee Work Session: 3/4/2011 2:00 PM Legislative Office Building 305-307 (Orig Legislative Office Building 201-203) "
347522,2011-03-02,"House Executive Session: 3/4/2011 3:00 PM Legislative Office Building 201-203 "
347522,2011-03-04,"House Retained in Committee; House Calendar 27, PG.825 "
347522,2011-09-21,"House Retained Bill - Executive Session: 9/29/2011 1:30 PM Legislative Office Building 305-307 "
347522,2011-10-04,"House Committee Report: Inexpedient to Legislate for Jan 4 (Vote 11-0; Consent Calendar); House Calendar 70, PG.2210 "
347522,2012-01-04,"House Inexpedient to Legislate: Motion Adopted Voice Vote; House Journal  7, PG.428 "
347524,2011-01-20,"House Introduced 1/6/2011 and Referred to Health, Human Services and Elderly Affairs; House Journal  11, PG. 178 "
347524,2011-01-25,"House Public Hearing: 2/8/2011 1:30 PM Legislative Office Building 205 "
347524,2011-02-09,"House Subcommittee Work Session: 2/17/2011 2:30 PM Legislative Office Building 205 "
347524,2011-02-17,"House Subcommittee Work Session: 2/24/2011 1:00 PM Legislative Office Building 205 "
347524,2011-02-25,"House Subcommittee Work Session: 3/3/2011 2:00 PM Legislative Office Building 205 "
347524,2011-03-01,"House Executive Session: 3/9/2011 10:00 Amendment Legislative Office Building 205 "
347524,2011-03-09,"House Retained in Committee; House Calendar 27, PG.824 "
347524,2011-10-04,"House Retained Bill - Subcommittee Work Session: 10/10/2011 1:00 PM Legislative Office Building 205 "
347524,2011-10-05,"House ==CANCELLED== Retained Bill - Executive Session: 10/12/2011 Legislative Office Building 205 1:00 PM or Immediately Following House Session "
347524,2011-10-12,"House Executive Session: 10/20/2011 2:00 PM Legislative Office Building 205 "
347524,2011-10-27,"House Committee Report: Inexpedient to Legislate for Jan 4 (Vote 12-5; Regular Calendar); House Calendar 70, PG.2220 "
347524,2012-01-05,"House Special Order, Postpone to a Time Certain being January 18 (Rep Bettencourt): Motion Adopted Regular Calendar 298-18; House Journal  8, PG.518-520 "
347524,2012-01-18,"House Inexpedient to Legislate: Motion Failed Regular Calendar 150-195; House Journal  10, PG.591-593 "
347524,2012-01-18,"House Ought to Pass (Rep Tucker); House Journal  10, PG.593 "
347524,2012-01-18,"House Floor Amendment #2012-0237h(NT) (Rep Groen): Amendment Adopted Regular Calendar 206-147; House Journal  10, PG.593-596 "
347524,2012-01-18,"House Ought to Pass with Amendment #0237h(New Title): Motion Adopted Regular Calendar 207-147; House Journal  10, PG.597-598 "
347524,2012-02-15,"Senate Introduced and Referred to Health and Human Services; Senate Journal 6, Pg.144 "
347524,2012-03-14,"Senate Hearing: 4/5/12, Room 100, State House, 1:00 p.m.; Senate Calendar 11 "
347524,2012-04-20,"Senate Committee Report: Ought to Pass with Amendment #2012-1768s, 4/25/12; Senate Calendar 16A "
347524,2012-04-25,"Senate Committee Amendment 1768s, Not Voted On "
347524,2012-04-25,"Senate Sen. Bradley Moved Laid On Table, Regular Calendar 17Y-6N, Motion Adopted; Senate Journal 11, Pg.411 "
347525,2011-01-20,"House Introduced 1/6/2011 and Referred to Municipal and County Government; House Journal  11, PG. 178 "
347525,2011-01-26,"House Public Hearing: 2/3/2011 10:30 Amendment Legislative Office Building 301 "
347525,2011-02-01,"House Executive Session: 2/8/2011 1:00 PM Legislative Office Building 301 "
347525,2011-02-10,"House Subcommittee Work Session: 2/23/2011 8:30 Amendment Legislative Office Building 301 "
347525,2011-02-10,"House ==CANCELLED== Subcommittee Work Session: 3/1/2011 8:30 Amendment Legislative Office Building 301 "
347525,2011-02-23,"House Executive Session: 3/1/2011 11:00 Amendment Legislative Office Building 301 "
347525,2011-03-01,"House Retained in Committee; House Calendar 27, PG.824 "
347525,2011-05-17,"House Retained Bill - Subcommittee Work Session: 5/24/2011 10:00 Amendment Legislative Office Building 301 "
347525,2011-05-25,"House Retained Bill - Subcommittee Work Session: 6/21/2011 10:00 Amendment Legislative Office Building 301 "
347525,2011-06-21,"House Retained Bill - Subcommittee Work Session: 9/20/2011 10:00 Amendment Legislative Office Building 301 "
347525,2011-09-14,"House Retained Bill - Executive Session: 10/11/2011 10:00 Amendment Legislative Office Building 301 "
347525,2011-10-14,"House Committee Report: Inexpedient to Legislate for Jan 4 (Vote 16-0; Consent Calendar); House Calendar 70, PG.2207 "
347525,2012-01-04,"House Inexpedient to Legislate: Motion Adopted Voice Vote; House Journal  7, PG.417 "
347527,2011-01-20,"House Introduced 1/6/2011 and Referred to Special Committee on Education Funding Reform; House Journal  11, PG. 178 "
347527,2011-01-25,"House Public Hearing: 2/4/2011 9:45 Amendment Legislative Office Building 207 "
347527,2011-02-01,"House Executive Session: 2/11/2011 9:00 Amendment Legislative Office Building 207 "
347527,2011-02-11,"House Retained in Committee; House Calendar 27, PG.825 "
347527,2011-09-14,"House Retained Bill - Full Committee Work Session: 9/27/2011 10:15 Amendment Legislative Office Building 210-211 "
347527,2011-09-14,"House Retained Bill - Executive Session: 9/27/2011 11:00 Amendment or Immediately Following Work Session Legislative Office Building 210-211 "
347527,2011-10-25,"House Committee Report: Inexpedient to Legislate for Jan 4 (Vote 15-0; Consent Calendar); House Calendar 70, PG.2209 "
347527,2012-01-04,"House Inexpedient to Legislate: Motion Adopted Voice Vote; House Journal  7, PG.423 "
347528,2011-01-20,"House Introduced 1/6/2011 and Referred to Commerce and Consumer Affairs; House Journal  11, PG. 178  "
347528,2011-01-25,"House Public Hearing: 2/1/2011 11:00 Amendment Legislative Office Building 302 "
347528,2011-02-02,"House Executive Session: 2/15/2011 Legislative Office Building 302 3:00 PM or Immediately Following House Session "
347528,2011-02-15,"House Retained in Committee; House Calendar 27, PG.822 "
347528,2011-06-22,"House Retained Bill - Banking/Business Div Subcom Work Session: 9/20/2011 10:30 Amendment Legislative Office Building 302 "
347528,2011-09-20,"House Retained Bill - Banking/Business Div Subcom Work Session: 9/27/2011 10:00 Amendment Legislative Office Building 302 "
347528,2011-09-27,"House Retained Bill - Banking/Business Div Subcom Work Session: 10/18/2011 10:00 Amendment Legislative Office Building 302 "
347528,2011-10-19,"House Retained Bill - Banking/Business Div Subcom Work Session: 10/25/2011 10:00 Amendment Legislative Office Building 302 "
347528,2011-10-19,"House Retained Bill - Executive Session: 10/25/2011 1:15 PM Legislative Office Building 301-303 (If Necessary Continued 10/27/2011 1:15 PM Legislative Office Building 302) "
347528,2011-10-28,"House Committee Report: Ought to Pass with Amendment #2758h(NT) for Jan 4 (Vote 16-0; Consent Calendar) "
347528,2011-10-28,"House Proposed Committee Amendment #2011-2758h (New Title); House Calendar 69, PG.2105-2107 "
347528,2012-01-04,"House Amendment #2758h(NT) Adopted, Voice Vote; House Journal  7, PG.369-370 "
347528,2012-01-04,"House Ought to Pass with Amendment #2758h(NT): Motion Adopted Voice Vote; House Journal  7, PG.369-370 "
347528,2012-01-04,"House Referred to Finance "
347528,2012-01-11,"House Public Hearing: 1/25/2012 10:00 Amendment Legislative Office Building 210-211 "
347528,2012-01-25,"House Division I Work Session: 2/7/2012 10:30 Amendment Legislative Office Building 212 "
347528,2012-01-31,"House ==CANCELLED== Executive Session: 2/7/2012 1:30 PM Legislative Office Building 210-211 "
347528,2012-02-14,"House Executive Session: 3/20/2012 11:00 Amendment Legislative Office Building 210-211 "
347528,2012-03-21,"House Committee Report: Ought to Pass with Amendment #1033h for Mar 28 (Vote 24-0; Consent Calendar); House Calendar 25, PG.1504 "
347528,2012-03-21,"House Proposed Committee Amendment #2012-1033h; House Calendar 25, PG.1529 "
347528,2012-03-28,"House Amendment #1033h Adopted, Voice Vote; House Journal  30, PG.1753 "
347528,2012-03-28,"House Ought to Pass with Amendment #1033h: Motion Adopted Voice Vote; House Journal  30, PG.1753 "
347528,2012-03-28,"Senate Introduced and Referred to Health and Human Services; Senate Journal 9, Pg.332 "
347528,2012-04-09,"Senate Hearing: 4/19/12, Room 102, Legislative Office Building, 1:30 p.m.; Senate Calendar 15 "
347528,2012-04-20,"Senate Committee Report: Ought to Pass with Amendment #2012-1762s, New Title, 4/25/12; Senate Calendar 16A "
347528,2012-04-25,"Senate Committee Amendment 1762s, New Title, Amendment Adopted, Voice Vote; Senate Journal 11, Pg.412 "
347528,2012-04-25,"Senate Ought to Pass with Amendment 1762s, New Title, Motion Adopted, Voice Vote; OT3rdg; Senate Journal 11, Pg.415 "
347528,2012-05-09,"House House Concurs with Senate Amendment #1762s(NT) (Rep Hunt): Motion Adopted Voice Vote; House Journal  40, PG.2227 "
347528,2012-05-16,"Senate Enrolled Bill Amendment #2290e Adopted "
347528,2012-05-17,"House Enrolled Bill Amendment #2012-2290e Adopted; House Journal  46, PG.2484 "
347528,2012-05-17,"House Enrolled; House Journal  46, PG.2495 "
347528,2012-05-23,"Senate Enrolled "
347528,2012-06-07,"House Signed By Governor 06/05/2012; Effective 07/01/2012; Chapter 0114 "
347530,2011-01-20,"House Introduced 1/6/2011 and Referred to Labor, Industrial and Rehabilitative Services; House Journal  11, PG. 178 "
347530,2011-01-25,"House Public Hearing: 2/1/2011 2:00 PM Legislative Office Building 307 "
347530,2011-02-23,"House Executive Session: 3/1/2011 1:00 PM Legislative Office Building 307 "
347530,2011-03-01,"House Retained in Committee; House Calendar 27, PG.824 "
347530,2011-09-12,"House ==CANCELLED== Retained Bill - Full Committee Work Session: 9/20/2011 10:00 Amendment Legislative Office Building 307 "
347530,2011-09-13,"House Retained Bill - Full Committee Work Session: 9/21/2011 10:00 Amendment Legislative Office Building 307 "
347530,2011-09-27,"House Retained Bill - Full Committee Work Session: 10/4/2011 1:00 PM Legislative Office Building 307 "
347530,2011-09-27,"House ==CANCELLED== Retained Bill - Executive Session: 10/18/2011 1:00 PM Legislative Office Building 307 "
347530,2011-10-19,"House Retained Bill - Executive Session: 10/27/2011 1:00 PM Legislative Office Building 307 "
347530,2011-10-28,"House Committee Report: Ought to Pass with Amendment #2759h(NT) for Jan 4 (Vote 13-0; Consent Calendar); House Calendar 70, PG.2206 "
347530,2011-10-28,"House Proposed Committee Amendment #2011-2759h (New Title); House Calendar 69, PG.2107 "
347530,2012-01-04,"House Amendment #2759h(NT) Adopted, Voice Vote; House Journal  7, PG.412-413 "
347530,2012-01-04,"House Ought to Pass with Amendment #2759h(NT): Motion Adopted Voice Vote; House Journal  7, PG.412-413 "
347530,2012-02-08,"Senate Introduced and Referred to Commerce; Senate Journal 5, Pg.121 "
347530,2012-03-15,"Senate Hearing: 3/20/12, Room 102, Legislative Office Building, 10:50 a.m.; Senate Calendar 11 "
347530,2012-03-16,"Senate Hearing: === CANCELLED === 3/20/12, Room 102, Legislative Office Building, 10:50 a.m. "
347530,2012-03-22,"Senate Hearing: === RESCHEDULED === 3/27/12, Room 102, Legislative Office Building, 9:40 a.m.; Senate Calendar 12 "
347530,2012-04-04,"Senate Committee Report: Inexpedient to Legislate, 4/11/12; Vote 5-0; Consent Calendar; Senate Calendar 14 "
347530,2012-04-11,"Senate Inexpedient to Legislate, Motion Adopted, Voice Vote === BILL KILLED ===; Senate Journal 9, Pg.336 "
347531,2011-01-20,"House Introduced 1/6/2011 and Referred to Commerce and Consumer Affairs; House Journal  11, PG. 179 "
347531,2011-01-26,"House Public Hearing: 2/3/2011 1:15 PM Legislative Office Building 302 "
347531,2011-03-01,"House Executive Session: 3/9/2011 9:00 Amendment Legislative Office Building 302 "
347531,2011-03-09,"House Retained in Committee; House Calendar 27, PG.822 "
347531,2011-08-23,"House Retained Bill - Insurance/Consumer Div Subcom Work Session: 9/13/2011 2:00 PM Legislative Office Building 302 "
347531,2011-09-27,"House Retained Bill - Executive Session: 10/6/2011 10:00 Amendment Legislative Office Building 302 "
347531,2011-10-17,"House Committee Report: Refer to Interim Study for Jan 4 (Vote 13-0; Consent Calendar); House Calendar 70, PG.2200 "
347531,2012-01-04,"House Removed from Consent Calendar (Rep D.McGuire); House Journal  7, PG.367 "
347531,2012-01-11,"House Refer to Interim Study: Motion Adopted Division Vote 192-132; House Journal  9, PG.580 "
347531,2012-06-07,"House Referred to Commerce and Consumer Affairs for Interim Study; House Calendar 45, PG.2432 "
347531,2012-09-07,"House Interim Study - Subcommittee Work Session: 9/18/2012 1:15 PM Legislative Office Building 307 ==Insurance Div== "
347531,2012-09-19,"House Interim Study - Executive Session: 10/2/2012 10:00 Amendment Legislative Office Building 302 "
347533,2011-01-20,"House Introduced 1/6/2011 and Referred to Ways and Means; House Journal  11, PG. 179 "
347533,2011-02-01,"House Public Hearing: 2/10/2011 11:00 Amendment Legislative Office Building 202 "
347533,2011-02-23,"House Executive Session: 2/24/2011 12:30 PM Legislative Office Building 202 "
347533,2011-02-24,"House Retained in Committee; House Calendar 27, PG.826 "
347533,2011-06-02,"House Retained Bill - Full Committee Work Session: 6/7/2011 10:00 Amendment Legislative Office Building 202 "
347533,2011-08-04,"House Retained Bill - Subcommittee Work Session: 8/18/2011 10:00 Amendment Legislative Office Building 202 "
347533,2011-08-18,"House Retained Bill - Subcommittee Work Session: 9/1/2011 10:00 Amendment Legislative Office Building 202 "
347533,2011-09-01,"House Retained Bill - Subcommittee Work Session: 9/8/2011 10:30 Amendment Legislative Office Building 202 "
347533,2011-10-03,"House Retained Bill - Executive Session: 10/26/2011 1:00 PM Legislative Office Building 202 ==RECESSED== "
347533,2011-10-20,"House Retained Bill - Rescheduled Executive Session 10/27/2011 1:00 PM Legislative Office Building 202 "
347533,2011-11-02,"House Committee Report: Ought to Pass with Amendment #2568h(NT) for Jan 4 (Vote 16-5; Regular Calendar); House Calendar 70, PG.2226 "
347533,2011-11-02,"House Proposed Committee Amendment #2011-2568h (New Title); House Calendar 69, PG.2107-2108 "
347533,2012-01-11,"House Amendment #2568h(NT) Adopted, Voice Vote; House Journal  9, PG.546 "
347533,2012-01-11,"House Ought to Pass with Amendment #2568h(NT): Motion Adopted Regular Calendar 259-89; House Journal  9, PG.546-549 "
347533,2012-02-08,"Senate Introduced and Referred to Ways & Means; Senate Journal 5, Pg.121 "
347533,2012-03-14,"Senate Hearing: 3/20/12, Room 100, State House, 1:00 p.m.; Senate Calendar 11 "
347533,2012-04-18,"Senate Committee Report: Ought to Pass, 4/25/12; Senate Calendar 16 "
347533,2012-04-25,"Senate Ought to Pass: Regular Calendar 23Y-0N, Motion Adopted; Refer to Finance Rule 4-3; Senate Journal 11, Pg.399 "
347533,2012-04-26,"Senate Committee Report: Ought to Pass, 5/2/12; Senate Calendar 17 "
347533,2012-05-02,"Senate Ought to Pass: Motion Adopted, Voice Vote; OT3rdg; Senate Journal 12, Pg.471 "
347533,2012-05-09,"Senate Enrolled; Senate Journal 14, Pg.511 "
347533,2012-05-15,"House Enrolled; House Journal  43, PG.2345 "
347533,2012-05-25,"House Signed By Governor 05/23/2012; Effective 05/23/2012; Chapter 0071 "
347534,2011-01-20,"House Introduced 1/6/2011 and Referred to Commerce and Consumer Affairs; House Journal  11, PG. 179 "
347534,2011-01-26,"House ==CANCELLED== Public Hearing: 2/15/2011 1:15 PM Legislative Office Building 302 "
347534,2011-02-01,"House Public Hearing: 2/22/2011 1:15 PM Legislative Office Building 302 "
347534,2011-02-16,"House ==CANCELLED== Executive Session: 2/25/2011 10:00 Amendment Legislative Office Building 302 "
347534,2011-03-01,"House Executive Session: 3/9/2011 9:00 Amendment Legislative Office Building 302 "
347534,2011-03-09,"House Retained in Committee; House Calendar 27, PG.822 "
347534,2011-06-22,"House Retained Bill - Banking/Business Div Subcom Work Session: 9/27/2011 10:30 Amendment Legislative Office Building 302 "
347534,2011-09-27,"House Retained Bill - Banking/Business Div Subcom Work Session: 10/18/2011 10:30 Amendment Legislative Office Building 302 "
347534,2011-10-19,"House Retained Bill - Banking/Business Div Subcom Work Session: 10/25/2011 10:30 Amendment Legislative Office Building 302 "
347534,2011-10-19,"House Retained Bill - Executive Session: 10/25/2011 1:15 PM Legislative Office Building 301-303 (If Necessary Continued 10/27/2011 1:15 PM Legislative Office Building 302) "
347534,2011-10-28,"House Committee Report: Refer to Interim Study for Jan 4 (Vote 15-1; Consent Calendar); House Calendar 70, PG.2200 "
347534,2012-01-04,"House Removed from Consent Calendar (Rep Kurk); House Journal  7, PG.367 "
347534,2012-01-11,"House Refer to Interim Study: Motion Adopted Division Vote 174-131; House Journal  9, PG.580 "
347534,2012-06-07,"House Referred to Commerce and Consumer Affairs for Interim Study; House Calendar 45, PG.2432 "
347534,2012-09-07,"House Interim Study - Subcommittee Work Session: 9/18/2012 10:00 Amendment Legislative Office Building 307 =Banking Div= "
347534,2012-09-19,"House Interim Study - Executive Session: 10/2/2012 10:00 Amendment Legislative Office Building 302 "
347536,2011-01-20,"House Introduced 1/6/2011 and Referred to Commerce and Consumer Affairs; House Journal  11, PG. 179 "
347536,2011-01-26,"House Public Hearing: 2/8/2011 1:15 PM Legislative Office Building 302 "
347536,2011-02-15,"House Subcommittee Work Session: 2/16/2011 9:01 Amendment Legislative Office Building 302 "
347536,2011-02-16,"House ==CANCELLED== Executive Session: 2/25/2011 10:00 Amendment Legislative Office Building 302 "
347536,2011-02-23,"House Executive Session: 3/1/2011 3:00 PM Legislative Office Building 302 "
347536,2011-03-01,"House Retained in Committee; House Calendar 27, PG.822 "
347536,2011-06-22,"House Retained Bill - Banking/Business Div Subcom Work Session: 9/20/2011 11:15 Amendment Legislative Office Building 302 "
347536,2011-09-20,"House Retained Bill - Banking/Business Div Subcom Work Session: 10/11/2011 11:45 Amendment Legislative Office Building 302 "
347536,2011-10-11,"House Retained Bill - Banking/Business Div Subcom Work Session: 10/20/2011 10:45 Amendment Legislative Office Building 302 "
347536,2011-10-11,"House Retained Bill - Executive Session: 10/20/2011 1:15 PM Legislative Office Building 302 ==RECESSED== "
347536,2011-10-20,"House Retained Bill - Subcommittee Work Session: 10/25/2011 11:00 Amendment Legislative Office Building 302 "
347536,2011-10-20,"House Retained Bill - Continued Executive Session: 10/25/2011 1:15 PM Legislative Office Building 301-303 "
347536,2011-10-28,"House Committee Report: Ought to Pass with Amendment #2798h for Jan 4 (Vote 16-0; Consent Calendar); House Calendar 70, PG.2200 "
347536,2011-10-28,"House Proposed Committee Amendment #2011-2798h; House Calendar 69, PG.2108 "
347536,2012-01-04,"House Amendment #2798h Adopted, Voice Vote; House Journal  7, PG.370-371 "
347536,2012-01-05,"House Ought to Pass with Amendment #2798h: Motion Adopted Voice Vote; House Journal  7, PG.370-371 "
347536,2012-02-08,"Senate Introduced and Referred to Commerce; Senate Journal 5, Pg.121 "
347536,2012-03-22,"Senate Hearing: 3/27/12, Room 102, Legislative Office Building, 9:25 a.m.; Senate Calendar 12 "
347536,2012-04-03,"Senate Committee Report: Ought to Pass, 4/11/12; Senate Calendar 14 "
347536,2012-04-11,"Senate Ought to Pass: Motion Adopted, Voice Vote; OT3rdg; Senate Journal 9, Pg.349 "
347536,2012-04-25,"Senate Enrolled Bill Amendment #1770e Adopted; Senate Journal 12, Pg.419 "
347536,2012-04-25,"House Enrolled Bill Amendment #2012-1770e Adopted; House Journal  38, PG.2209 "
347536,2012-04-25,"House Enrolled; House Journal  38, PG.2211 "
347536,2012-05-02,"Senate Enrolled; Senate Journal 13, Pg.474 "
347536,2012-05-21,"House Signed By Governor 05/14/2012; Effective 07/13/2012; Chapter 0050 "
347537,2011-01-20,"House Introduced 1/6/2011 and Referred to Municipal and County Government; House Journal  11, PG. 179 "
347537,2011-02-01,"House Public Hearing: 2/10/2011 2:00 PM Legislative Office Building 301 ==Executive Session to Follow== "
347537,2011-02-10,"House Retained in Committee; House Calendar 27, PG.825 "
347537,2011-04-19,"House Retained Bill - Subcommittee Work Session: 4/21/2011 9:00 Amendment Legislative Office Building 301 "
347537,2011-04-21,"House Retained Bill - Subcommittee Work Session: 4/28/2011 11:30 Amendment Legislative Office Building 301 "
347537,2011-09-14,"House Retained Bill - Executive Session: 10/11/2011 10:00 Amendment Legislative Office Building 301 "
347537,2011-10-14,"House Committee Report: Inexpedient to Legislate for Jan 4 (Vote 16-0; Consent Calendar); House Calendar 70, PG.2207 "
347537,2012-01-04,"House Inexpedient to Legislate: Motion Adopted Voice Vote; House Journal  7, PG.418 "
347539,2011-01-20,"House Introduced 1/6/2011 and Referred to Resources, Recreation and Development; House Journal  11, PG. 179 "
347539,2011-01-26,"House Public Hearing: 2/3/2011 11:15 Amendment Legislative Office Building 305 "
347539,2011-01-26,"House Executive Session: 2/8/2011 1:00 PM Legislative Office Building 305 "
347539,2011-02-09,"House Retained in Committee; House Calendar 27, PG.825 "
347539,2011-07-26,"House Retained Bill - Full Committee Work Session: 8/9/2011 10:00 Amendment Legislative Office Building 305 "
347539,2011-09-07,"House Retained Bill - Subcommittee Work Session: 9/20/2011 1:00 PM Legislative Office Building 305 "
347539,2011-09-20,"House Retained Bill - Subcommittee Work Session: 10/4/2011 1:00 PM Legislative Office Building 305 "
347539,2011-10-07,"House Retained Bill - Subcommittee Work Session: 10/18/2011 10:00 Amendment Legislative Office Building 305 "
347539,2011-10-07,"House Retained Bill - Executive Session: 10/25/2011 10:00 Amendment Legislative Office Building 305 "
347539,2011-11-02,"House Committee Report: Ought to Pass with Amendment #2811h(NT) for Jan 4 (Vote 15-0; Consent Calendar); House Calendar 70, PG.2208 "
347539,2011-11-02,"House Proposed Committee Amendment #2011-2811h (New Title); House Calendar 69, PG.2109-2112 "
347539,2012-01-04,"House Amendment #2811h(NT) Adopted, Voice Vote; House Journal  7, PG.418-421 "
347539,2012-01-04,"House Ought to Pass with Amendment #2811h(NT): Motion Adopted Voice Vote; House Journal  7, PG.418-421 "
347539,2012-02-15,"Senate Introduced and Referred to Energy and Natural Resources; Senate Journal 6, Pg.144 "
347539,2012-03-13,"Senate Hearing: 3/22/12, Room 102, Legislative Office Building, 9:00 a.m.; Senate Calendar 11 "
347539,2012-04-19,"Senate Committee Report: Ought to Pass with Amendment #2012-1746s, 4/25/12; Senate Calendar 16 "
347539,2012-04-25,"Senate Committee Amendment 1746s; Amendment Adopted, Voice Vote; Senate Journal 11, Pg.393 "
347539,2012-04-25,"Senate Ought to Pass with Amendment 1746s, Motion Adopted, Voice Vote; OT3rdg; Senate Journal 11, Pg.415 "
347539,2012-05-15,"House House Non-Concurs with Senate Amendment #1746s and Requests C of C (Rep Renzullo): Motion Adopted Voice Vote; House Journal  43, PG.2281 "
347539,2012-05-15,"House Speaker Appoints: Reps Ahlgren, Howard, Spang, and Giuda; House Journal  43, PG.2281 "
347539,2012-05-23,"Senate Sen. Odell Accedes to House Request for Committee of Conference; Motion Adopted, Voice Vote "
347539,2012-05-23,"Senate President Appoints: Senators Odell, Gallus and Merrill "
347539,2012-05-24,"House Conference Committee Meeting: 5/29/2012 1:00 PM Legislative Office Building 305 ==RECESSED== "
347539,2012-05-29,"House Conferee Change: Rep Bowers Replaces Rep Spang; House Journal  46, PG.2495 "
347539,2012-05-30,"House ==RECONVENE== Conference Committee Meeting: 5/30/2012 3:00 PM Legislative Office Building 305 "
347539,2012-05-31,"Senate Conference Committee Report #2012-2461c; Senate Amendment + New Amendment, Filed "
347539,2012-06-06,"Senate Conference Committee Report 2461c; Adopted, Voice Vote "
347539,2012-06-06,"House Conference Committee Report #2461c Adopted, Voice Vote; House Journal  51, PG.2595 "
347539,2012-06-06,"Senate Enrolled "
347539,2012-06-06,"House Enrolled "
347539,2012-06-22,"House Signed By Governor 06/18/2012; Effective 06/18/2012; Chapter 0246 "
347540,2011-01-20,"House Introduced 1/6/2011 and Referred to Executive Departments and Administration; House Journal  11, PG. 179 "
347540,2011-01-25,"House Public Hearing: 2/1/2011 11:00 Amendment Legislative Office Building 306 "
347540,2011-02-03,"House Subcommittee Work Session: 2/10/2011 3:00 PM Legislative Office Building 306 "
347540,2011-02-17,"House Subcommittee Work Session: 3/1/2011 2:00 PM Legislative Office Building 306 "
347540,2011-03-02,"House Subcommittee Work Session: 3/3/2011 4:15 PM Legislative Office Building 306 "
347540,2011-03-02,"House Executive Session: 3/9/2011 1:00 PM Legislative Office Building 306 "
347540,2011-03-09,"House Retained in Committee; House Calendar 27, PG.823 "
347540,2011-06-09,"House Retained Bill - Subcommittee Work Session: 6/28/2011 10:00 Amendment Legislative Office Building 306 "
347540,2011-09-27,"House Retained Bill - Executive Session: 10/11/2011 10:30 Amendment Legislative Office Building 306 "
347540,2011-10-21,"House Committee Report: Inexpedient to Legislate for Jan 4 (Vote 12-0; Consent Calendar); House Calendar 70, PG.2204 "
347540,2012-01-04,"House Inexpedient to Legislate: Motion Adopted Voice Vote; House Journal  7, PG.388 "
347542,2011-01-20,"House Introduced 1/6/2011 and Referred to Judiciary; House Journal  11, PG. 179 "
347542,2011-02-01,"House Public Hearing: 2/8/2011 10:00 Amendment Legislative Office Building 208 "
347542,2011-02-09,"House Executive Session: 2/14/2011 10:00 Amendment Legislative Office Building 208 "
347542,2011-02-14,"House Retained in Committee; House Calendar 27, PG.824 "
347542,2011-09-15,"House Retained Bill - Subcommittee Work Session: 10/4/2011 10:00 Amendment Legislative Office Building 208 "
347542,2011-09-15,"House Retained Bill - Executive Session: 10/25/2011 11:00 Amendment Legislative Office Building 208 "
347542,2011-11-02,"House Majority Committee Report: Inexpedient to Legislate for Jan 4 (Vote 11-5; Regular Calendar); House Calendar 70, PG.2221 "
347542,2011-11-02,"House Minority Committee Report: Ought to Pass; House Calendar 70, PG.2221-2222 "
347542,2012-01-05,"House Inexpedient to Legislate: Motion Adopted Voice Vote; House Journal  8, PG.524-525 "
347543,2011-01-20,"House Introduced 1/6/2011 and Referred to Commerce and Consumer Affairs; House Journal  11, PG. 179 "
347543,2011-01-26,"House Public Hearing: 2/3/2011 11:30 Amendment Legislative Office Building 302 "
347543,2011-03-01,"House Executive Session: 3/9/2011 9:00 Amendment Legislative Office Building 302 "
347543,2011-03-09,"House Retained in Committee; House Calendar 27, PG.822 "
347543,2011-08-23,"House Retained Bill - Insurance/Consumer Div Subcom Work Session: 9/27/2011 1:15 PM Legislative Office Building 302 "
347543,2011-09-27,"House Retained Bill - Insurance/Consumer Div Subcom Work Session: 10/6/2011 2:00 PM Legislative Office Building 302 "
347543,2011-10-11,"House Retained Bill - Executive Session: 10/20/2011 1:15 PM Legislative Office Building 302 ==RECESSED== "
347543,2011-10-26,"House Retained Bill - Insurance/Consumer Div Subcom Work Session: 11/1/2011 9:30 Amendment Legislative Office Building 302 "
347543,2011-10-26,"House Retained Bill - Executive Session: 11/1/2011 10:00 Amendment Legislative Office Building 302 "
347543,2011-11-02,"House Committee Report: Ought to Pass with Amendment #2694h(NT) for Jan 4 (Vote 14-1; Consent Calendar) "
347543,2011-11-02,"House Proposed Committee Amendment #2011-2694h (New Title); House Calendar 69, PG.2112 "
347543,2012-01-04,"House Removed from Consent Calendar (Rep Rosenwald); House Journal  7, PG.367 "
347543,2012-01-11,"House Amendment #2694h(NT) Adopted, Voice Vote; House Journal  9, PG.580 "
347543,2012-01-11,"House Ought to Pass with Amendment #2694h(NT): Motion Adopted Regular Calendar 211-99; House Journal  9, PG.580; House Journal  9, PG.580-582 "
347543,2012-02-15,"Senate Introduced and Referred to Finance; Senate Journal 6, Pg.144 "
347543,2012-04-19,"Senate Hearing: 4/26/12, Room 103, State House, 1:15 p.m.; Senate Calendar 16 "
347543,2012-05-03,"Senate Committee Report: Referred to Interim Study, 5/9/12; Vote 7-0; Consent Calendar; Senate Calendar 18 "
347543,2012-05-09,"Senate Refer to Interim Study, Motion Adopted, Voice Vote; Senate Journal 13, Pg.476 "
347545,2011-01-20,"House Introduced 1/6/2011 and Referred to Special Committee on Public Employee Pensions Reform; House Journal  11, PG. 179 "
347545,2011-01-25,"House Public Hearing: 2/18/2011 10:00 Amendment RepresentativeS HALL ==ROOM CHANGE (Orig Legislative Office Building 201-203)== "
347545,2011-02-08,"House ==CANCELLED==Full Committee Work Session: 2/18/2011 2:00 PM Legislative Office Building 201-203 "
347545,2011-02-09,"House ==CANCELLED==Executive Session: 2/18/2011 3:00 PM Legislative Office Building 201-203 "
347545,2011-03-02,"House ==RESCHEDULED== Full Committee Work Session: 3/4/2011 2:00 PM Legislative Office Building 305-307 (Orig Legislative Office Building 201-203) "
347545,2011-03-02,"House Executive Session: 3/4/2011 3:00 PM Legislative Office Building 201-203 "
347545,2011-03-04,"House Retained in Committee; House Calendar 27, PG.825 "
347545,2011-09-21,"House Retained Bill - Executive Session: 9/29/2011 1:30 PM Legislative Office Building 305-307 "
347545,2011-10-04,"House Committee Report: Inexpedient to Legislate for Jan 4 (Vote 11-0; Consent Calendar); House Calendar 70, PG.2210 "
347545,2012-01-04,"House Inexpedient to Legislate: Motion Adopted Voice Vote; House Journal  7, PG.428 "
347546,2011-01-20,"House Introduced 1/6/2011 and Referred to Public Works and Highways; House Journal  11, PG.180  "
347546,2011-01-25,"House Public Hearing: 2/10/2011 9:30 Amendment Legislative Office Building 201 "
347546,2011-02-02,"House Executive Session: 2/16/2011 Legislative Office Building 201 1:00 PM or Immediately Following House Session "
347546,2011-02-16,"House Retained in Committee; House Calendar 27, PG.825 "
347546,2011-08-24,"House Retained Bill - Executive Session: 9/27/2011 10:00 Amendment Legislative Office Building 201 "
347546,2011-09-28,"House Committee Report: Inexpedient to Legislate for Jan 4 (Vote 12-0; Consent Calendar); House Calendar 70, PG.2208 "
347546,2012-01-04,"House Inexpedient to Legislate: Motion Adopted Voice Vote; House Journal  7, PG.418 "
347548,2011-01-20,"House Introduced 1/6/2011 and Referred to Finance; House Journal  11, PG. 180 "
347548,2011-01-31,"House ==CANCELLED== Public Hearing: 2/14/2011 10:30 Amendment Legislative Office Building 210-211 "
347548,2011-01-31,"House Public Hearing: 2/10/2011 10:00 Amendment Legislative Office Building 210-211 "
347548,2011-02-23,"House Executive Session: 3/1/2011 10:00 Amendment Legislative Office Building 210-211 "
347548,2011-03-01,"House Retained in Committee; House Calendar 27, PG.824 "
347548,2011-08-18,"House Retained Bill - Subcommittee Work Session: 9/8/2011 10:00 Amendment Legislative Office Building 210-211 "
347548,2011-08-18,"House Retained Bill - Subcommittee Work Session: 9/15/2011 10:00 Amendment Legislative Office Building 210-211 "
347548,2011-09-08,"House Retained Bill - Subcommittee Work Session: 9/22/2011 9:00 Amendment Legislative Office Building 210-211 ==TIME CHANGE (Orig 10:00 Amendment)== "
347548,2011-09-08,"House Retained Bill - Subcommittee Work Session: 9/29/2011 10:00 Amendment Legislative Office Building 210-211 "
347548,2011-09-14,"House Retained Bill - Subcommittee Work Session: 10/6/2011 10:00 Amendment Legislative Office Building 210-211 "
347548,2011-09-14,"House Retained Bill - Subcommittee Work Session: 10/13/2011 10:00 Amendment Legislative Office Building 210-211 "
347548,2011-10-13,"House ==CANCELLED== Retained Bill - Subcommittee Work Session: 10/20/2011 10:00 Amendment Legislative Office Building 210-211 "
347548,2011-10-13,"House ==CANCELLED== Retained Bill - Subcommittee Work Session: 10/27/2011 10:00 Amendment Legislative Office Building 210-211 "
347548,2011-10-13,"House Retained Bill - Executive Session: 10/25/2011 10:00 Amendment Legislative Office Building 210-211 "
347548,2011-10-26,"House Committee Report: Ought to Pass with Amendment #2714h(NT) for Jan 4 (Vote 17-4; Regular Calendar); House Calendar 70, PG.2219 "
347548,2011-10-26,"House Proposed Committee Amendment #2011-2714h (New Title); House Calendar 69, PG.2112 "
347548,2012-01-05,"House Amendment #2714h(NT) Adopted, Voice Vote; House Journal  8, PG.510-511 "
347548,2012-01-05,"House Ought to Pass with Amendment #2714h(NT): Motion Adopted Voice Vote; House Journal  8, PG.510-511 "
347548,2012-02-15,"Senate Introduced and Referred to Finance; Senate Journal 6, Pg.144 "
347548,2012-03-29,"Senate Hearing: 4/05/12, Room 103, State House, 1:00 p.m.; Senate Calendar 13 "
347548,2012-04-19,"Senate Committee Report: Ought to Pass with Amendment #2012-1731s, New Title, 4/25/12; Senate Calendar 16 "
347548,2012-04-25,"Senate Chair Ruled Non-Germane Amendment; Senate Journal 11, Pg.394 "
347548,2012-04-25,"Senate Without Objection Rule 3-7 is Suspended to Allow Non-Germane Amendment 1731s, 2/3 necessary, Motion Adopted; Senate Journal 11, Pg.394 "
347548,2012-04-25,"Senate Committee Amendment 1731s, New Title, Amendment Adopted, Voice Vote; Senate Journal 11, Pg.394 "
347548,2012-04-25,"Senate Ought to Pass with Amendment 1731s, New Title, Motion Adopted, Voice Vote; OT3rdg; Senate Journal 11, Pg.415 "
347548,2012-05-15,"House House Non-Concurs with Senate Amendment #1731s(NT) (Rep Weyler): Motion Adopted Voice Vote; House Journal  43, PG.2280 "
347549,2011-01-20,"House Introduced 1/6/2011 and Referred to Criminal Justice and Public Safety; House Journal  11, PG. 180 "
347549,2011-02-16,"House Public Hearing: 3/1/2011 10:00 Amendment Legislative Office Building 204 "
347549,2011-03-02,"House Executive Session: 3/9/2011 10:00 Amendment Legislative Office Building 204 "
347549,2011-03-09,"House Retained in Committee; House Calendar 27, PG.823 "
347549,2011-08-10,"House Retained Bill - Subcommittee Work Session: 8/18/2011 10:00 Amendment Legislative Office Building 204 "
347549,2011-08-18,"House Retained Bill - Subcommittee Work Session: 9/1/2011 1:00 PM Legislative Office Building 204 "
347549,2011-09-06,"House Retained Bill - Subcommittee Work Session: 9/7/2011 1:00 PM Legislative Office Building 204 "
347549,2011-09-07,"House Retained Bill - Subcommittee Work Session: 9/27/2011 10:00 Amendment Legislative Office Building 204 "
347549,2011-09-27,"House Retained Bill - Subcommittee Work Session: 10/4/2011 1:00 PM Legislative Office Building 204 "
347549,2011-09-27,"House Retained Bill - Subcommittee Work Session: 10/6/2011 11:00 Amendment Legislative Office Building 204 "
347549,2011-09-27,"House Retained Bill - Executive Session: 10/20/2011 10:00 Amendment Legislative Office Building 204 "
347549,2011-10-25,"House Committee Report: Ought to Pass with Amendment #2682h for Jan 4 (Vote 17-0; Consent Calendar); House Calendar 70, PG.2201-2202 "
347549,2011-10-25,"House Proposed Committee Amendment #2011-2682h; House Calendar 69, PG.2112-2118 "
347549,2012-01-04,"House Amendment #2682h Adopted, Voice Vote; House Journal  7, PG.374-380 "
347549,2012-01-04,"House Ought to Pass with Amendment #2682h: Motion Adopted Voice Vote; House Journal  7, PG.374-380 "
347549,2012-02-08,"Senate Introduced and Referred to Judiciary; Senate Journal 5, Pg.121 "
347549,2012-03-22,"Senate Hearing: 4/5/12, Room 101, Legislative Office Building, 1:00 p.m.; Senate Calendar 12 "
347549,2012-04-18,"Senate Committee Report: Ought to Pass with Amendment #2012-1660s, 4/25/12; Senate Calendar 16 "
347549,2012-04-25,"Senate Committee Amendment 1660s; Amendment Adopted, Voice Vote; Senate Journal 11, Pg.396 "
347549,2012-04-25,"Senate Sen. Houde Floor Amendment #2012-1830s, Amendment Adopted, Voice Vote; Senate Journal 11, Pg.396 "
347549,2012-04-25,"Senate Ought to Pass with Amendment 1660s, 1830s, Motion Adopted, Voice Vote; OT3rdg; Senate Journal 11, Pg.415 "
347549,2012-05-30,"House House Concurs with Senate Amendment #1660s and #1830s (Rep Swinford): Motion Adopted Voice Vote; House Journal  47, PG.2501 "
347549,2012-06-06,"Senate Enrolled Bill Amendment #2481e Adopted, Voice Vote "
347549,2012-06-06,"House Enrolled Bill Amendment #2012-2481e Adopted; House Journal  51, PG.2610 "
347549,2012-06-06,"Senate Enrolled "
347549,2012-06-06,"House Enrolled "
347549,2012-06-21,"House Signed By Governor 06/18/2012; Effective 01/01/2013; Chapter 0228 "
347551,2011-01-20,"House Introduced 1/6/2011 and Referred to Finance; House Journal  11, PG. 180 "
347551,2011-01-31,"House ==CANCELLED== Public Hearing: 2/14/2011 11:00 Amendment Legislative Office Building 210-211 "
347551,2011-02-09,"House Vacated from Finance and Referred to Public Works and Highways; House Journal  16, PG.308 "
347551,2011-02-09,"House Public Hearing: 3/1/2011 10:00 Amendment Legislative Office Building 201 "
347551,2011-03-02,"House Executive Session: 3/2/2011 Legislative Office Building 201 Following House Session "
347551,2011-03-02,"House Retained in Committee; House Calendar 27, PG.825 "
347551,2011-08-24,"House Retained Bill - Executive Session: 9/27/2011 10:00 Amendment Legislative Office Building 201 "
347551,2011-09-28,"House Committee Report: Inexpedient to Legislate for Jan 4 (Vote 12-0; Consent Calendar); House Calendar 70, PG.2208 "
347551,2012-01-04,"House Inexpedient to Legislate: Motion Adopted Voice Vote; House Journal  7, PG.418 "
347552,2011-01-20,"House Introduced 1/6/2011 and Referred to Municipal and County Government; House Journal  11, PG. 181 "
347552,2011-01-26,"House Public Hearing: 2/3/2011 2:00 PM Legislative Office Building 301 ==RECESSED== "
347552,2011-02-09,"House Continued Public Hearing: 2/17/2011 10:00 Amendment Legislative Office Building 301 "
347552,2011-02-23,"House Executive Session: 3/1/2011 11:00 Amendment Legislative Office Building 301 "
347552,2011-03-01,"House Retained in Committee; House Calendar 27, PG.825 "
347552,2011-04-20,"House Retained Bill - Subcommittee Work Session: 4/28/2011 1:00 PM Legislative Office Building 301 "
347552,2011-05-25,"House Retained Bill - Subcommittee Work Session: 5/31/2011 1:30 PM Legislative Office Building 301 "
347552,2011-08-30,"House Retained Bill - Subcommittee Work Session: 9/27/2011 10:00 Amendment Legislative Office Building 301 "
347552,2011-09-14,"House Retained Bill - Executive Session: 10/11/2011 10:00 Amendment Legislative Office Building 301 "
347552,2011-10-14,"House Majority Committee Report: Inexpedient to Legislate for Jan 4 (Vote 9-7; Regular Calendar); House Calendar 70, PG.2223 "
347552,2011-10-14,"House Minority Committee Report: Ought to Pass with Amendment #2685h(NT); House Calendar 70, PG.2223-2224 "
347552,2011-10-14,"House Proposed Minority Committee Amendment #2011-2685h (New Title); House Calendar 69, PG.2119 "
347552,2012-01-11,"House Inexpedient to Legislate: Motion Adopted Voice Vote; House Journal  9, PG.536 "
347554,2011-01-20,"House Introduced 1/6/2011 and Referred to Fish and Game and Marine Resources; House Journal  11, PG. 181 "
347554,2011-02-01,"House Public Hearing: 2/10/2011 10:30 Amendment Legislative Office Building 307 "
347554,2011-02-16,"House Subcommittee Work Session: 2/23/2011 3:00 PM or immediately following House session Legislative Office Building 307 "
347554,2011-02-23,"House Subcommittee Work Session: 2/24/2011 1:30 PM Legislative Office Building 303 "
347554,2011-02-23,"House Executive Session: 3/3/2011 10:00 Amendment Legislative Office Building 307 "
347554,2011-03-03,"House Retained in Committee; House Calendar 27, PG.824 "
347554,2011-09-15,"House Retained Bill - Subcommittee Work Session: 10/5/2011 9:00 Amendment Legislative Office Building 307 "
347554,2011-09-15,"House Retained Bill - Executive Session: 10/18/2011 10:00 Amendment Legislative Office Building 307 "
347554,2011-10-21,"House Committee Report: Inexpedient to Legislate for Jan 4 (Vote 10-0; Consent Calendar); House Calendar 70, PG.2205 "
347554,2012-01-04,"House Inexpedient to Legislate: Motion Adopted Voice Vote; House Journal  7, PG.409-410 "
347555,2011-01-20,"House Introduced 1/6/2011 and Referred to Education; House Journal  11, PG. 181 "
347555,2011-02-09,"House Public Hearing: 3/1/2011 10:30 Amendment Legislative Office Building 205-207 "
347555,2011-02-18,"House Executive Session: 3/3/2011 10:00 Amendment Legislative Office Building 207 "
347555,2011-03-04,"House Retained in Committee; House Calendar 27, PG.823 "
347555,2011-09-21,"House Retained Bill - Subcommittee Work Session: 9/29/2011 11:00 Amendment Legislative Office Building 207 "
347555,2011-09-29,"House Retained Bill - Subcommittee Work Session: 10/4/2011 11:00 Amendment Legislative Office Building 207 "
347555,2011-10-04,"House Retained Bill - Subcommittee Work Session: 10/12/2011 Legislative Office Building 207 1:00 PM Or Immediately Following House Session "
347555,2011-10-13,"House Retained Bill - Subcommittee Work Session: 10/18/2011 9:50 Amendment Legislative Office Building 207 "
347555,2011-10-13,"House Retained Bill - Executive Session: 10/18/2011 10:00 Amendment Legislative Office Building 207 (If Necessary Continued 10/25/2011 10:00 Amendment Legislative Office Building 207) "
347555,2011-10-26,"House Committee Report: Refer to Interim Study for Jan 4 (Vote 12-0; Consent Calendar); House Calendar 70, PG.2202 "
347555,2012-01-04,"House Refer to Interim Study: Motion Adopted Voice Vote; House Journal  7, PG.380 "
347555,2012-06-07,"House Referred to Education for Interim Study; House Calendar 45, PG.2432 "
347555,2012-06-20,"House Interim Study - Subcommittee Work Session: 6/27/2012 Legislative Office Building 207 1:00 PM or Immediately Following House Session "
347555,2012-06-28,"House Interim Study - Subcommittee Work Session: 7/17/2012 1:00 PM Legislative Office Building 207 "
347557,2011-01-20,"House Introduced 1/6/2011 and Referred to Education; House Journal  11, PG. 181 "
347557,2011-02-02,"House Public Hearing: 2/8/2011 1:00 PM Representative's Hall "
347557,2011-02-09,"House Subcommittee Work Session: 2/15/2011 8:00 Amendment Legislative Office Building 207 "
347557,2011-02-09,"House Subcommittee Work Session: 2/17/2011 8:00 Amendment Legislative Office Building 207 "
347557,2011-02-09,"House ==CANCELLED== Subcommittee Work Session: 2/22/2011 8:00 Amendment Legislative Office Building 207 "
347557,2011-02-10,"House ==CANCELLED== Subcommittee Work Session: 2/24/2011 9:00 Amendment Legislative Office Building 207 "
347557,2011-02-10,"House Executive Session: 2/24/2011 1:00 PM Legislative Office Building 207 "
347557,2011-02-24,"House Retained in Committee; House Calendar 27, PG.823 "
347557,2011-08-17,"House Retained Bill - Subcommittee Work Session: 9/6/2011 10:00 Amendment Legislative Office Building 207 "
347557,2011-08-17,"House Retained Bill - Subcommittee Work Session: 9/13/2011 10:00 Amendment Legislative Office Building 207 "
347557,2011-10-04,"House Retained Bill - Executive Session: 10/18/2011 10:00 Amendment Legislative Office Building 207 "
347557,2011-10-21,"House Committee Report: Inexpedient to Legislate for Jan 4 (Vote 14-0; Consent Calendar); House Calendar 70, PG.2202 "
347557,2012-01-04,"House Inexpedient to Legislate: Motion Adopted Voice Vote; House Journal  7, PG.380 "
347558,2011-01-21,"House Introduced 1/6/2011 and Referred to Commerce and Consumer Affairs; House Journal  11, PG. 182 "
347558,2011-01-26,"House ==CANCELLED== Public Hearing: 2/10/2011 1:15 PM Legislative Office Building 302 "
347558,2011-02-01,"House Public Hearing: 2/24/2011 1:15 PM Legislative Office Building 302 "
347558,2011-03-01,"House Executive Session: 3/9/2011 9:00 Amendment Legislative Office Building 302 "
347558,2011-03-09,"House Retained in Committee; House Calendar 27, PG.822 "
347558,2011-08-23,"House Retained Bill - Insurance/Consumer Div Subcom Work Session: 10/18/2011 1:15 PM Legislative Office Building 302 "
347558,2011-10-19,"House Retained Bill - Insurance/Consumer Div Subcom Work Session: 10/25/2011 2:00 PM Legislative Office Building 301-303 "
347558,2011-10-19,"House ==CANCELLED== Retained Bill - Executive Session: 10/27/2011 1:15 PM Legislative Office Building 302 "
347558,2011-10-20,"House Retained Bill - Executive Session: 11/01/2011 10:00 Amendment Legislative Office Building 302 ==TIME CHANGE (Orig 11:00 Amendment)== "
347558,2011-11-02,"House Majority Committee Report: Ought to Pass with Amendment #2815h(NT) for Jan 4 (Vote 13-2; Regular Calendar); House Calendar 70, PG.2212 "
347558,2011-11-02,"House Proposed Majority Committee Amendment #2011-2815h (New Title); House Calendar 69, PG.2119-2122 "
347558,2011-11-02,"House Minority Committee Report: Ought to Pass; House Calendar 70, PG.2213 "
347558,2012-01-04,"House Amendment #2815h (New Title) Adopted, Division Vote 295-64; House Journal  7, PG.430-433 "
347558,2012-01-04,"House Floor Amendment #2012-0090h (Rep Bettencourt) Adopted, Regular Calendar 231-133; House Journal  7, PG.433-436 "
347558,2012-01-04,"House Ought to Pass with Amendment #2815h(NT) and #0090h: Motion Adopted Regular Calendar 229-133; House Journal  7, PG.430-438 "
347558,2012-01-18,"Senate Introduced and Referred to Health and Human Services; Senate Journal 3, Pg.74 "
347558,2012-02-09,"Senate Hearing: === CANCELLED === 2/23/12, Room 102, Legislative Office Building, 1:00 p.m.; Senate Calendar 7 "
347558,2012-02-14,"Senate Hearing: === RESCHEDULED === 3/8/12, Room 102, Legislative Office Building, 1:00 p.m.; "
347558,2012-02-16,"Senate Hearing: === ROOM CHANGE === 3/8/12, Room 100, State House, 1:00 p.m.; Senate Calendar 8 "
347558,2012-02-29,"Senate Hearing: 3/8/12, Room 100, State House, 1:00 p.m.; Senate Calendar 9A "
347558,2012-03-15,"Senate Committee Report: Referred to Interim Study, 3/21/12; Senate Calendar 11 "
347558,2012-03-21,"Senate Refer to Interim Study, Regular Calendar 19Y-5N, Motion Adopted; Senate Journal 7, Pg. 240 "
347560,2011-01-21,"House Introduced 1/6/2011 and Referred to Executive Departments and Administration; House Journal  11, PG. 182 "
347560,2011-01-26,"House Public Hearing: 2/10/2011 11:00 Amendment Legislative Office Building 306 "
347560,2011-02-22,"House Subcommittee Work Session: 2/24/2011 2:30 PM Legislative Office Building 306 "
347560,2011-02-23,"House ==CANCELLED== Executive Session: 3/2/2011 2:00 PM or 45 mins after House session Legislative Office Building 306 "
347560,2011-03-02,"House Subcommittee Work Session: 3/3/2011 4:30 PM Legislative Office Building 306 "
347560,2011-03-02,"House Executive Session: 3/9/2011 1:00 PM Legislative Office Building 306 "
347560,2011-03-09,"House Retained in Committee; House Calendar 27, PG.823 "
347560,2011-09-27,"House Retained Bill - Executive Session: 10/27/2011 10:00 Amendment Legislative Office Building 306 (If Necessary Continued 11/1/2011 10:30 Amendment Legislative Office Building 306) "
347560,2011-11-01,"House Committee Report: Inexpedient to Legislate for Jan 4 (Vote 15-0; Consent Calendar); House Calendar 70, PG.2204 "
347560,2012-01-04,"House Inexpedient to Legislate: Motion Adopted Voice Vote; House Journal  7, PG.388 "
347561,2011-01-21,"House Introduced 1/6/2011 and Referred to Science, Technology and Energy; House Journal  11, PG. 182 "
347561,2011-01-26,"House ==CANCELLED== Public Hearing: 2/2/2011 2:00 PM Legislative Office Building 304 "
347561,2011-01-27,"House ==RESCHEDULED== Public Hearing: 2/1/2011 3:30 PM Legislative Office Building 304 ==RECESSED== "
347561,2011-02-16,"House Continued Public Hearing: 3/1/2011 1:00 PM Legislative Office Building 304 ==Executive Session To Follow== "
347561,2011-03-02,"House Retained in Committee; House Calendar 27, PG.825 "
347561,2011-04-12,"House Retained Bill - Full Committee Work Session: 4/26/2011 10:15 Amendment Legislative Office Building 302-304 "
347561,2011-08-18,"House Retained Bill - Full Committee Work Session: 9/13/2011 10:15 Amendment Legislative Office Building 301-303 "
347561,2011-10-11,"House Retained Bill - Full Committee Work Session: 10/25/2011 11:30 Amendment Legislative Office Building 304 "
347561,2011-10-11,"House Retained Bill - Executive Session: 10/25/2011 3:00 PM Legislative Office Building 304 ==RECESSED== "
347561,2011-10-26,"House Retained Bill - Continued Executive Session: 11/1/2011 10:00 Amendment Legislative Office Building 304 "
347561,2011-11-02,"House Committee Report: Refer to Interim Study for Jan 4 (Vote 6-4; Regular Calendar); House Calendar 70, PG.2224 "
347561,2012-01-11,"House Refer to Interim Study: Motion Adopted Voice Vote; House Journal  9, PG.538 "
347561,2012-06-07,"House Referred to Science, Technology and Energy for Interim Study; House Calendar 45, PG.2433 "
347561,2012-10-03,"House Interim Study - Subcommittee Work Session: 10/4/2012 3:30 PM Legislative Office Building 304 "
347563,2011-01-21,"House Introduced 1/6/2011 and Referred to Judiciary; House Journal  11, PG. 182 "
347563,2011-01-26,"House Public Hearing: 2/3/2011 1:30 PM Legislative Office Building 208 "
347563,2011-02-16,"House ==CANCELLED== Executive Session: 3/1/2011 1:00 PM Legislative Office Building 208 "
347563,2011-03-02,"House Executive Session: 3/3/2011 10:00 Amendment Legislative Office Building 208 "
347563,2011-03-03,"House Retained in Committee; House Calendar 27, PG.824 "
347563,2011-09-15,"House Retained Bill - Subcommittee Work Session: 10/4/2011 11:00 Amendment Legislative Office Building 208 "
347563,2011-09-15,"House Retained Bill - Executive Session: 10/25/2011 11:00 Amendment Legislative Office Building 208 "
347563,2011-11-02,"House Committee Report: Inexpedient to Legislate for Jan 4 (Vote 16-0; Consent Calendar); House Calendar 70, PG.2206 "
347563,2012-01-04,"House Inexpedient to Legislate: Motion Adopted Voice Vote; House Journal  7, PG.411 "
347564,2011-01-21,"House Introduced 1/6/2011 and Referred to Education; House Journal  11, PG.182  "
347564,2011-01-26,"House Public Hearing: 2/1/2011 10:30 Amendment Legislative Office Building 207 "
347564,2011-02-02,"House Executive Session: 2/10/2011 1:00 PM Legislative Office Building 207 "
347564,2011-02-15,"House Retained in Committee; House Calendar 27, PG.823 "
347564,2011-09-13,"House Retained Bill - Subcommittee Work Session: 9/20/2011 10:00 Amendment Legislative Office Building 207 "
347564,2011-09-20,"House Retained Bill - Subcommittee Work Session: 9/28/2011 10:00 Amendment Legislative Office Building 207 "
347564,2011-09-28,"House Retained Bill - Subcommittee Work Session: 10/4/2011 10:00 Amendment Legislative Office Building 207 "
347564,2011-10-04,"House Retained Bill - Subcommittee Work Session: 10/11/2011 10:00 Amendment Legislative Office Building 207 "
347564,2011-10-04,"House Retained Bill - Executive Session: 10/18/2011 10:00 Amendment Legislative Office Building 207 "
347564,2011-10-21,"House Committee Report: Inexpedient to Legislate for Jan 4 (Vote 14-0; Consent Calendar); House Calendar 70, PG.2202 "
347564,2012-01-04,"House Inexpedient to Legislate: Motion Adopted Voice Vote; House Journal  7, PG.380 "
347566,2011-01-21,"House Introduced 1/6/2011 and Referred to Resources, Recreation and Development; House Journal  11, PG.182 "
347566,2011-01-26,"House Public Hearing: 2/3/2011 1:45 PM Legislative Office Building 305 "
347566,2011-01-28,"House Executive Session: 2/8/2011 1:00 PM Legislative Office Building 305 "
347566,2011-02-09,"House Retained in Committee; House Calendar 27, PG.825 "
347566,2011-07-26,"House Retained Bill - Full Committee Work Session: 8/9/2011 10:00 Amendment Legislative Office Building 305 "
347566,2011-09-09,"House Retained Bill - Subcommittee Work Session: 9/27/2011 10:00 Amendment Legislative Office Building 305 "
347566,2011-09-13,"House Retained Bill - Executive Session: 10/25/2011 10:00 Amendment Legislative Office Building 305 "
347566,2011-11-02,"House Committee Report: Inexpedient to Legislate for Jan 4 (Vote 15-0; Consent Calendar); House Calendar 70, PG.2208 "
347566,2012-01-04,"House Inexpedient to Legislate: Motion Adopted Voice Vote; House Journal  7, PG.421 "
347567,2011-01-21,"House Introduced 1/6/2011 and Referred to Commerce and Consumer Affairs; House Journal  11, PG. 182 "
347567,2011-01-26,"House Public Hearing: 2/8/2011 11:00 Amendment Legislative Office Building 302 "
347567,2011-03-01,"House Executive Session: 3/9/2011 9:00 Amendment Legislative Office Building 302 "
347567,2011-03-09,"House Retained in Committee; House Calendar 27, PG.822 "
347567,2011-06-22,"House Retained Bill - Banking/Business Div Subcom Work Session: 9/13/2011 10:30 Amendment Legislative Office Building 302 "
347567,2011-09-27,"House Retained Bill - Executive Session: 10/6/2011 10:00 Amendment Legislative Office Building 302 "
347567,2011-10-17,"House Committee Report: Refer to Interim Study for Jan 4 (Vote 13-0; Consent Calendar); House Calendar 70, PG.2200 "
347567,2012-01-04,"House Removed from Consent Calendar (Rep Lambert); House Journal  7, PG.367 "
347567,2012-01-11,"House Refer to Interim Study: Motion Adopted Regular Calendar 188-114; House Journal  9, PG.582-584 "
347567,2012-06-07,"House Referred to Commerce and Consumer Affairs for Interim Study; House Calendar 45, PG.2432 "
347567,2012-09-07,"House Interim Study - Subcommittee Work Session: 9/18/2012 10:00 Amendment Legislative Office Building 307 =Banking Div= "
347567,2012-09-19,"House Interim Study - Executive Session: 10/2/2012 10:00 Amendment Legislative Office Building 302 "
347569,2011-01-21,"House Introduced 1/6/2011 and Referred to Environment and Agriculture; House Journal  11, PG. 182 "
347569,2011-01-25,"House Public Hearing: 2/1/2011 10:00 Amendment Legislative Office Building 303 "
347569,2011-02-01,"House Subcommittee Work Session: 2/8/2011 3:00 PM Legislative Office Building 303 "
347569,2011-02-09,"House Subcommittee Work Session: 2/22/2011 10:00 Amendment Legislative Office Building 303 "
347569,2011-02-23,"House Executive Session: 3/1/2011 1:00 PM Legislative Office Building 303 "
347569,2011-03-01,"House Retained in Committee; House Calendar 27, PG.823 "
347569,2011-06-08,"House Retained Bill - Subcommittee Work Session: 8/16/2011 10:00 Amendment Legislative Office Building 303 "
347569,2011-08-24,"House Retained Bill - Subcommittee Work Session: 9/14/2011 10:00 Amendment Legislative Office Building 303 "
347569,2011-09-14,"House Retained Bill - Subcommittee Work Session: 10/11/2011 10:30 Amendment Legislative Office Building 303 "
347569,2011-10-11,"House Retained Bill - Executive Session: 10/25/2011 10:00 Amendment Legislative Office Building 303 "
347569,2011-10-27,"House Majority Committee Report: Ought to Pass with Amendment #2796h(NT) for Jan 4 (Vote 10-2; Regular Calendar); House Calendar 70, PG.2217-2218 "
347569,2011-10-27,"House Proposed Majority Committee Amendment #2011-2796h (New Title); House Calendar 69, PG.2122-2123 "
347569,2011-10-27,"House Minority Committee Report: Inexpedient to Legislate; House Calendar 70, PG.2218 "
347569,2012-01-05,"House Amendment #2796h(NT) Adopted, Voice Vote; House Journal  8, PG.482-483 "
347569,2012-01-05,"House Ought to Pass with Amendment #2796h(NT): Motion Adopted Voice Vote; House Journal  8, PG.482-483 "
347569,2012-02-15,"Senate Introduced and Referred to Energy and Natural Resources; Senate Journal 6, Pg.144 "
347569,2012-03-13,"Senate Hearing: 3/22/12, Room 102, Legislative Office Building, 9:15 a.m.; Senate Calendar 11 "
347569,2012-04-12,"Senate Committee Report: Ought to Pass with Amendment #2012-1582s, 4/18/12; Senate Calendar 15 "
347569,2012-04-18,"Senate Committee Amendment 1582s; Amendment Adopted, Voice Vote; Senate Journal 10, Pg.364 "
347569,2012-04-18,"Senate Ought to Pass with Amendment 1582s, Motion Adopted, Voice Vote; OT3rdg; Senate Journal 10, Pg.379 "
347569,2012-05-09,"House House Concurs with Senate Amendment #1582s (Rep Haefner): Motion Adopted Voice Vote; House Journal  40, PG.2227 "
347569,2012-05-16,"Senate Enrolled Bill Amendment #2274e Adopted "
347569,2012-05-17,"House Enrolled Bill Amendment #2012-2274e Adopted; House Journal  46, PG.2484 "
347569,2012-05-23,"Senate Enrolled "
347569,2012-05-30,"House Enrolled [Recessed from 5/17/2012 Session]; House Journal  46, PG.2495 "
347569,2012-06-07,"House Signed By Governor 06/05/2012; Effective 08/04/2012; Chapter 0115 "
347570,2011-01-21,"House Introduced 1/6/2011 and Referred to Commerce and Consumer Affairs; House Journal  11, PG. 182 "
347570,2011-01-26,"House Public Hearing: 2/10/2011 10:00 Amendment Legislative Office Building 302 "
347570,2011-03-01,"House Executive Session: 3/9/2011 9:00 Amendment Legislative Office Building 302 "
347570,2011-03-09,"House Retained in Committee; House Calendar 27, PG.822 "
347570,2011-08-23,"House Retained Bill - Insurance/Consumer Div Subcom Work Session: 10/11/2011 2:45 PM Legislative Office Building 302 "
347570,2011-10-19,"House Retained Bill - Executive Session: 10/25/2011 1:15 PM Legislative Office Building 301-303 (If Necessary Continued 10/27/2011 1:15 PM Legislative Office Building 302) "
347570,2011-10-28,"House Committee Report: Inexpedient to Legislate for Jan 11 (Vote 15-0; Consent Calendar); House Calendar 70, PG.2200 "
347570,2012-01-11,"House Inexpedient to Legislate: Motion Adopted Voice Vote; House Journal  9, PG.528 "
347572,2011-01-21,"House Introduced 1/6/2011 and referred to Commerce & Consumer Affairs; House Journal  11, PG. 182 "
347572,2011-01-25,"House Public Hearing: 2/1/2011 3:00 PM Legislative Office Building 302 ==RECESSED== "
347572,2011-02-09,"House Continued Public Hearing: 2/22/2011 4:15 PM Legislative Office Building 302 "
347572,2011-02-16,"House ==CANCELLED== Executive Session: 2/25/2011 10:00 Amendment Legislative Office Building 302 "
347572,2011-02-24,"House Subcommittee Work Session: 2/28/2011 1:00 PM Legislative Office Building 302 "
347572,2011-02-24,"House Executive Session: 3/1/2011 3:00 PM Legislative Office Building 302 "
347572,2011-03-09,"House Retained in Committee; House Calendar 27, PG.822 "
347572,2011-06-22,"House Retained Bill - Banking/Business Div Subcom Work Session: 9/6/2011 11:15 Amendment Legislative Office Building 302 "
347572,2011-09-06,"House Retained Bill - Banking/Business Div Subcom Work Session: 10/11/2011 10:00 Amendment Legislative Office Building 302 "
347572,2011-10-11,"House Retained Bill - Executive Session: 10/20/2011 1:15 PM Legislative Office Building 302 "
347572,2011-10-28,"House Committee Report: Refer to Interim Study for Jan 11 (Vote 14-1; Consent Calendar); House Calendar 70, PG.2200 "
347572,2012-01-11,"House Refer to Interim Study: Motion Adopted Voice Vote; House Journal  9, PG.528 "
347572,2012-06-07,"House Referred to Commerce and Consumer Affairs for Interim Study; House Calendar 45, PG.2432 "
347572,2012-09-07,"House Interim Study - Subcommittee Work Session: 9/18/2012 10:00 Amendment Legislative Office Building 307 =Banking Div= "
347572,2012-09-19,"House Interim Study - Subcommittee Work Session: 9/26/2012 10:00 Amendment Legislative Office Building 302 "
347572,2012-09-19,"House Interim Study - Executive Session: 10/2/2012 10:00 Amendment Legislative Office Building 302 "
347573,2011-01-21,"House Introduced 1/6/2011 and referred to Criminal Justice and Public Safety; House Journal  11, PG. 182 "
347573,2011-02-16,"House ==RESCHEDULED== Public Hearing: 2/24/2011 10:00 Amendment Legislative Office Building 204 (Orig 1:30 PM) "
347573,2011-03-01,"House Subcommittee Work Session: 3/2/2011 Legislative Office Building 204 3:00 PM or Immediately Following House Session "
347573,2011-03-02,"House Executive Session: 3/9/2011 10:00 Amendment Legislative Office Building 204 "
347573,2011-03-09,"House Committee Report: Ought to Pass with Amendment #0637h for Mar 15 (Vote 11-6; Regular Calendar); House Calendar 22, PG.548-549 "
347573,2011-03-09,"House Proposed Committee Amendment #2011-0637h; House Calendar 23, PG.601-602 "
347573,2011-03-15,"House Amendment #0637h Adopted, Voice Vote; House Journal  26, PG.767-768 "
347573,2011-03-15,"House Floor Amendment #2011-0775h (New Title) (Rep Burt) Failed, Division Vote 41-261; House Journal  26, PG.768-769 "
347573,2011-03-15,"House Floor Amendment #2011-0811h (Rep Welch) Adopted, Voice Vote; House Journal  26, PG.769 "
347573,2011-03-15,"House Ought to Pass with Amendments #0637h and #0811h: Motion Adopted Regular Calendar 244-109; House Journal  26, PG.767-771 "
347573,2011-03-30,"Senate Introduced and Referred to Judiciary; Senate Journal 12, Pg.243 "
347573,2011-04-14,"Senate Hearing: 4/20/11, Room 100, State House, 1:15 p.m.; Senate Calendar 20 "
347573,2011-05-05,"Senate Committee Report: Rereferred to Committee, 5/11/11; Senate Calendar 23 "
347573,2011-05-11,"Senate Rereferred to Committee, Motion Adopted, Voice Vote; Senate Journal 16 "
347573,2012-01-27,"Senate Committee Report: Referred to Interim Study, 2/8/12; Senate Calendar 6 "
347573,2012-02-08,"Senate Refer to Interim Study, Motion Adopted, Voice Vote; Senate Journal 4, Pg.113 "
347575,2011-01-21,"House Introduced 1/6/2011 and referred to Executive Departments & Administration; House Journal  11, PG. 182 "
347575,2011-02-02,"House Public Hearing: 2/24/2011 1:00 PM Legislative Office Building 306 "
347575,2011-03-03,"House Subcommittee Work Session: 3/9/2011 12:00 PM Legislative Office Building 306 "
347575,2011-03-03,"House Executive Session: 3/9/2011 1:00 PM Legislative Office Building 306 "
347575,2011-03-10,"House Retained in Committee; House Calendar 27, PG.823 "
347575,2011-08-10,"House Retained Bill - Subcommittee Work Session: 8/16/2011 1:00 PM Legislative Office Building 306 "
347575,2011-08-10,"House Retained Bill - Subcommittee Work Session: 8/23/2011 11:00 Amendment Legislative Office Building 306 "
347575,2011-08-23,"House Retained Bill - Subcommittee Work Session: 9/1/2011 11:30 Amendment Legislative Office Building 306 "
347575,2011-09-27,"House Retained Bill - Executive Session: 10/27/2011 10:00 Amendment Legislative Office Building 306 (If Necessary Continued 11/1/2011 10:30 Amendment Legislative Office Building 306) "
347575,2011-11-01,"House Committee Report: Refer to Interim Study for Jan 4 (Vote 16-0; Consent Calendar); House Calendar 70, PG.2204 "
347575,2012-01-04,"House Refer to Interim Study: Motion Adopted Voice Vote; House Journal  7, PG.384-388 "
347575,2012-06-07,"House Referred to Executive Departments and Administration for Interim Study; House Calendar 45, PG.2433 "
347575,2012-07-09,"House Interim Study - Subcommittee Work Session: 7/18/2012 10:00 Amendment Legislative Office Building 306 "
347575,2012-09-18,"House Interim Study - Executive Session: 10/18/2012 1:30 PM Legislative Office Building 306 "
347576,2011-01-21,"House Introduced 1/6/2011 and referred to Criminal Justice & Public Safety; House Journal  11, PG. 182 "
347576,2011-02-16,"House Public Hearing: 2/24/2011 3:15 PM Legislative Office Building 204 "
347576,2011-03-02,"House Executive Session: 3/9/2011 10:00 Amendment Legislative Office Building 204 "
347576,2011-03-09,"House Retained in Committee; House Calendar 27, PG.823 "
347576,2011-06-08,"House Retained Bill - Subcommittee Work Session: 8/2/2011 1:00 PM Legislative Office Building 204 "
347576,2011-09-27,"House Retained Bill - Executive Session: 10/20/2011 10:00 Amendment Legislative Office Building 204 "
347576,2011-10-25,"House Majority Committee Report: Ought to Pass with Amendment #2563h(NT) for Jan 4 (Vote 11-6; Regular Calendar); House Calendar 70, PG.2215 "
347576,2011-10-25,"House Proposed Majority Committee Amendment #2011-2563h (New Title); House Calendar 69, PG.2123-2124 "
347576,2011-10-25,"House Minority Committee Report: Inexpedient to Legislate; House Calendar 1 ==Note: Corrected Committee Report== "
347576,2012-01-04,"House Amendment #2563h(NT) Adopted, Voice Vote; House Journal  7, PG.458-459 "
347576,2012-01-04,"House Ought to Pass with Amendment #2563h(NT): Motion Adopted Regular Calendar 180-144; House Journal  7, PG.458-461 "
347576,2012-01-12,"Senate Introduced 1/4/2012 and Referred to Judiciary; Senate Journal 2, Pg.19 "
347576,2012-01-19,"Senate Hearing: 1/26/12, Room 100, State House, 1:00 p.m; Senate Calendar 4 "
347576,2012-01-27,"Senate Committee Report: Referred to Interim Study, 2/8/12; Senate Calendar 6 "
347576,2012-02-08,"Senate Refer to Interim Study, Motion Adopted, Voice Vote; Senate Journal 4, Pg.113 "
347578,2011-01-21,"House Introduced 1/6/2011 and referred to Transportation; House Journal  11, PG. 183 "
347578,2011-02-01,"House Public Hearing: 2/8/2011 11:45 Amendment Legislative Office Building 203 "
347578,2011-02-16,"House ==CANCELLED== Executive Session: 2/16/2011 1:45 PM Legislative Office Building 203 "
347578,2011-02-23,"House Subcommittee Work Session: 3/1/2011 9:45 Amendment Legislative Office Building 203 "
347578,2011-02-23,"House Executive Session: 3/2/2011 Legislative Office Building 203 3:00 PM or Immediately After House Session "
347578,2011-03-02,"House Retained in Committee; House Calendar 27, PG.826 "
347578,2011-10-18,"House Retained Bill - Executive Session: 10/25/2011 8:30 Amendment Legislative Office Building 203 "
347578,2011-10-27,"House Committee Report: Ought to Pass for Jan 4 (Vote 10-1; Regular Calendar); House Calendar 70, PG.2225 "
347578,2012-01-11,"House Floor Amendment #2012-0079h (Rep Hikel) Adopted, Voice Vote; House Journal  9, PG.542 "
347578,2012-01-11,"House Ought to Pass with Amendment #0079h: Motion Adopted Voice Vote; House Journal  9, PG.542 "
347578,2012-02-08,"Senate Introduced and Referred to Transportation; Senate Journal 5, Pg.121 "
347578,2012-02-23,"Senate Hearing: 3/8/12, Room 103, Legislative Office Building, 9:00 a.m.; Senate Calendar 9 "
347578,2012-04-12,"Senate Committee Report: Ought to Pass, 4/18/12; Senate Calendar 15 "
347578,2012-04-18,"Senate Ought to Pass: Motion Adopted, Voice Vote; OT3rdg; Senate Journal 10, Pg.379 "
347578,2012-04-25,"House Enrolled; House Journal  38, PG.2211 "
347578,2012-05-02,"Senate Enrolled; Senate Journal 13, Pg.475 "
347578,2012-05-21,"House Signed By Governor 05/15/2012; Effective 07/14/2012; Chapter 0067 "
347579,2011-01-21,"House Introduced 1/6/2011 and referred to Judiciary; House Journal  11, PG. 183 "
347579,2011-02-16,"House Public Hearing: 2/22/2011 1:30 PM Legislative Office Building 208 "
347579,2011-02-23,"House Executive Session: 3/1/2011 1:00 PM Legislative Office Building 208 "
347579,2011-03-01,"House Retained in Committee; House Calendar 27, PG.824 "
347579,2011-09-15,"House Retained Bill - Subcommittee Work Session: 10/4/2011 11:00 Amendment Legislative Office Building 208 "
347579,2011-09-15,"House Retained Bill - Executive Session: 10/25/2011 11:00 Amendment Legislative Office Building 208 "
347579,2011-11-02,"House Committee Report: Ought to Pass with Amendment #2713h(NT) for Jan 4 (Vote 16-0; Consent Calendar); House Calendar 70, PG.2206 "
347579,2011-11-02,"House Proposed Committee Amendment #2011-2713h (New Title); House Calendar 69, PG.2124-2125 "
347579,2012-01-04,"House Amendment #2713h(NT) Adopted, Voice Vote; House Journal  7, PG.411-412 "
347579,2012-01-04,"House Ought to Pass with Amendment #2713h(NT): Motion Adopted Voice Vote; House Journal  7, PG.411-412 "
347579,2012-02-08,"Senate Introduced and Referred to Judiciary; Senate Journal 5, Pg.122 "
347579,2012-03-06,"Senate Hearing: 3/22/12, Room 101, Legislative Office Building, 1:30 p.m.; Senate Calendar 10 "
347579,2012-03-19,"Senate Hearing: === TIME CHANGE === 3/22/12, Room 101, Legislative Office Building, 2:00 p.m.; Senate Calendar 11 "
347579,2012-03-27,"Senate Committee Report: Ought to Pass, 4/11/12; Senate Calendar 14 "
347579,2012-04-11,"Senate Ought to Pass: Motion Adopted, Voice Vote; Refer to Finance Rule 4-3; Senate Journal 9, Pg.343 "
347579,2012-04-12,"Senate Committee Report: Ought to Pass, 4/18/12; Senate Calendar 15 "
347579,2012-04-18,"Senate Ought to Pass: Motion Adopted, Voice Vote; OT3rdg; Senate Journal 10, Pg.379 "
347579,2012-04-25,"House Enrolled Bill Amendment #2012-1839e Adopted "
347579,2012-05-02,"Senate Enrolled Bill Amendment #1839e Adopted, Voice Vote; Senate Journal 13, Pg.474 "
347579,2012-05-09,"Senate Enrolled; Senate Journal 14, Pg.511 "
347579,2012-05-15,"House Enrolled; House Journal  43, PG.2345 "
347579,2012-05-25,"House Signed By Governor 05/23/2012; Effective 07/22/2012; Chapter 0072 "
347581,2011-01-21,"House Introduced 1/6/2011 and referred to Legislative Administration; House Journal  11, PG.183  "
347581,2011-02-01,"House Public Hearing: 2/8/2011 10:30 Amendment Legislative Office Building 104 "
347581,2011-02-09,"House Subcommittee Work Session: 2/15/2011 9:30 Amendment Legislative Office Building 104 "
347581,2011-02-09,"House Executive Session: 2/22/2011 11:00 Amendment Legislative Office Building 104 "
347581,2011-02-22,"House Committee Report: Ought to Pass with Amendment #0238h for Mar 2 (Vote 12-0; Consent Calendar); House Calendar 18, PG.389 "
347581,2011-02-23,"House Proposed Committee Amendment #2011-0238h; House Calendar 18, PG.410-411 "
347581,2011-03-02,"House Removed from Consent Calendar (Rep Weber); House Journal  25, PG.671 "
347581,2011-03-02,"House Amendment #0238h Failed, Voice Vote; House Journal  25, PG.691 "
347581,2011-03-02,"House Ought to Pass: Motion Adopted Voice Vote; House Journal  25, PG.691 "
347581,2011-03-02,"House Referred to Executive Departments and Administration; House Journal  25, PG.691 "
347581,2011-03-02,"House Public Hearing: 3/9/2011 10:45 Amendment Legislative Office Building 306 ==Executive Session to Follow== "
347581,2011-03-09,"House Retained in Committee; House Calendar 27, PG.823 "
347581,2011-05-25,"House Retained Bill - Subcommittee Work Session: 6/2/2011 10:00 Amendment Legislative Office Building 306 "
347581,2011-08-22,"House Retained Bill - Subcommittee Work Session: 9/8/2011 9:00 Amendment Legislative Office Building 306 "
347581,2011-09-09,"House Retained Bill - Subcommittee Work Session: 9/20/2011 10:00 Amendment Legislative Office Building 305 "
347581,2011-09-23,"House Retained Bill - Subcommittee Work Session: 10/4/2011 1:00 PM Legislative Office Building 306 "
347581,2011-10-04,"House Retained Bill - Subcommittee Work Session: 10/11/2011 9:30 Amendment Legislative Office Building 308 ==ROOM CHANGE (Orig Legislative Office Building 306)== "
347581,2011-10-04,"House Retained Bill - Executive Session: 10/11/2011 10:30 Amendment Legislative Office Building 306 "
347581,2011-10-21,"House Committee Report: Ought to Pass with Amendment #2710h for Jan 4 (Vote 12-0; Consent Calendar); House Calendar 70, PG.2204 "
347581,2011-10-21,"House Proposed Committee Amendment #2011-2710h; House Calendar 69, PG.2125-2128 "
347581,2012-01-04,"House Amendment #2710h Adopted, Voice Vote; House Journal  7, PG.388-392 "
347581,2012-01-04,"House Ought to Pass with Amendment #2710h: Motion Adopted Voice Vote; House Journal  7, PG.388-392 "
347581,2012-02-15,"Senate Introduced and Referred to Finance; Senate Journal 6, Pg.144 "
347581,2012-03-29,"Senate Hearing: 4/05/12, Room 103, State House, 2:00 p.m.; Senate Calendar 13 "
347581,2012-04-20,"Senate Committee Report: Ought to Pass with Amendment #2012-1766s, 4/25/12; Senate Calendar 16A "
347581,2012-04-25,"Senate Committee Amendment 1766s; Amendment Adopted, Voice Vote; Senate Journal 11, Pg.407 "
347581,2012-04-25,"Senate Ought to Pass with Amendment 1766s, Motion Adopted, Voice Vote; OT3rdg; Senate Journal 11, Pg.415 "
347581,2012-05-15,"House House Non-Concurs with Senate Amendment #1766s and Requests C of C (Rep Mirski): Motion Adopted Voice Vote; House Journal  43, PG.2281 "
347581,2012-05-15,"House Speaker Appoints: Reps Bettencourt, D.McGuire, Winter, and Foose; House Journal  43, PG.2281 "
347581,2012-05-23,"Senate Sen. Morse Accedes to House Request for Committee of Conference; Motion Adopted, Voice Vote "
347581,2012-05-23,"Senate President Appoints: Senators Forrester, D'Allesandro, and Gallus "
347581,2012-05-29,"Senate Conferee Change; Senator Morse Replaces Senator Forrester "
347581,2012-05-29,"House Conferee Change: Rep Weyler Replaces Rep Bettencourt as First Named; House Journal  46, PG.2495 "
347581,2012-05-29,"House Conference Committee Meeting: 5/30/2012 2:00 PM Legislative Office Building 212 "
347581,2012-05-31,"Senate Conference Committee Report #2012-2464c; Senate Amendment, Filed "
347581,2012-06-06,"Senate Conference Committee Report 2464c; Adopted, Voice Vote "
347581,2012-06-06,"House Conference Committee Report #2464c Adopted, Voice Vote; House Journal  51, PG.2595 "
347581,2012-06-06,"Senate Enrolled "
347581,2012-06-06,"House Enrolled; House Journal  51, PG.2613 "
347581,2012-06-22,"House Signed By Governor 06/18/2012; Effective 08/17/2012; Chapter 0247 "
347582,2011-01-21,"House Introduced 1/6/2011 and referred to Commerce & Consumer Affairs; House Journal  11, PG. 183 "
347582,2011-02-09,"House ==CANCELLED== Public Hearing: 2/3/2011 9:00 Amendment Legislative Office Building 302 "
347582,2011-02-10,"House Public Hearing: 3/3/2011 9:00 Amendment Legislative Office Building 302 "
347582,2011-03-01,"House Executive Session: 3/9/2011 9:00 Amendment Legislative Office Building 302 "
347582,2011-03-09,"House Retained in Committee; House Calendar 27, PG.822 "
347582,2011-08-23,"House Retained Bill - Insurance/Consumer Div Subcom Work Session: 9/20/2011 1:15 PM Legislative Office Building 302 "
347582,2011-09-27,"House Retained Bill - Executive Session: 10/6/2011 10:00 Amendment Legislative Office Building 302 ==RECESSED== "
347582,2011-10-11,"House Retained Bill - Executive Session: 10/20/2011 1:15 PM Legislative Office Building 302 "
347582,2011-11-02,"House Committee Report: Ought to Pass with Amendment #2789h for Jan 4 (Vote 16-0; Consent Calendar); House Calendar 70, PG.2200 "
347582,2011-11-02,"House Proposed Committee Amendment #2011-2789h; House Calendar 69, PG.2128-2129 "
347582,2012-01-04,"House Amendment #2789h Adopted, Voice Vote; House Journal  7, PG.371-372 "
347582,2012-01-04,"House Ought to Pass with Amendment #2789h: Motion Adopted Voice Vote; House Journal  7, PG.371-372 "
347582,2012-03-07,"Senate Introduced and Referred to Commerce; Senate Journal 7, Pg.185 "
347582,2012-03-29,"Senate Hearing: 4/03/12, Room 102, Legislative Office Building, 9:00 a.m.; Senate Calendar 13 "
347582,2012-04-25,"Senate Committee Report: Ought to Pass with Amendment #2012-1827s, New Title, 5/2/12; Senate Calendar 17 "
347582,2012-05-02,"Senate Committee Amendment 1827s, New Title, Div. 16Y-8N, Amendment Adopted; Senate Journal 12, Pg.424 "
347582,2012-05-02,"Senate Sen. Sanborn Floor Amendment #2012-1916s, New Title, Amendment Adopted, Voice Vote; Senate Journal 12, Pg.425 "
347582,2012-05-02,"Senate Ought to Pass with Amendment Not Voted On "
347582,2012-05-02,"Senate Sen. Bradley Moved Laid On Table, Motion Adopted, Voice Vote; Senate Journal 12, Pg.425 "
347582,2012-05-02,"Senate Sen. Bradley Moved Remove From Table, Motion Adopted, Voice Vote; Senate Journal 12, Pg.436 "
347582,2012-05-02,"Senate Ought to Pass with Amendment 1827s, New Title, 1916s, New Title, Regular Calendar 13Y-11N, Motion Adopted, Refer to Finance Rule 4-3; Senate Journal 12, Pg.436 "
347582,2012-05-10,"Senate Committee Report: Ought to Pass, 5/16/12; Senate Calendar 19 "
347582,2012-05-16,"Senate Sen. Bradley Floor Amendment #2012-2294s, Amendment Adopted, Voice Vote; Senate Journal 14, Pg.521 "
347582,2012-05-16,"Senate Ought to Pass with Amendment 2294s, Motion Adopted, Regular Calendar 16Y-8N; OT3rdg; Senate Journal 14, Pg.587 "
347582,2012-05-17,"House House Non-Concurs with Senate Amendment #1827s(NT), #1916s(NT), #2294s and Requests C of C (Rep E.Hogan): Motion Adopted Voice Vote; House Journal  46, PG.2487 "
347582,2012-05-17,"House Speaker Appoints: Reps Hunt, Flanders, F.Rice, and Schlachman "
347582,2012-05-23,"Senate Sen. Prescott Accede to House Request for Committee of Conference ; Motion Adopted, Voice Vote; Senate Journal 6, Pg.185 "
347582,2012-05-23,"Senate President Appoints: Senators Sanborn, DeBlois, and Houde "
347582,2012-05-25,"House Conference Committee Meeting: 5/29/2012 2:15 PM Legislative Office Building 302 "
347582,2012-05-31,"Senate Conference Committee Report #2012-2416c; Senate Amendment + New Amendment, Filed "
347582,2012-06-06,"Senate Conference Committee Report 2416c; Regular Calendar 15Y-8N, Adopted "
347582,2012-06-06,"House Conference Committee Report #2416c Adopted, Voice Vote; House Journal  51, PG.2595 "
347582,2012-06-06,"Senate Enrolled "
347582,2012-06-06,"House Enrolled; House Journal  51, PG.2613 "
347582,2012-06-22,"House Signed By Governor 06/20/2012; Effective 01/01/2013; Chapter 0278 "
347584,2011-01-21,"House Introduced 1/6/2011 and referred to Municipal & County Government; House Journal  11, PG. 183 "
347584,2011-02-01,"House Public Hearing: 2/10/2011 10:30 Amendment Legislative Office Building 301 "
347584,2011-02-23,"House Executive Session: 3/3/2011 10:30 Amendment Legislative Office Building 301 "
347584,2011-03-03,"House Retained in Committee; House Calendar 27, PG.825 "
347584,2011-04-19,"House Retained Bill - Subcommittee Work Session: 4/21/2011 1:30 PM Legislative Office Building 301 "
347584,2011-04-21,"House Retained Bill - Subcommittee Work Session: 4/27/2011 9:00 Amendment Legislative Office Building 301 "
347584,2011-09-14,"House Retained Bill - Executive Session: 10/11/2011 10:00 Amendment Legislative Office Building 301 "
347584,2011-10-14,"House Committee Report: Inexpedient to Legislate for Jan 4 (Vote 16-0; Consent Calendar); House Calendar 70, PG.2208 "
347584,2012-01-04,"House Inexpedient to Legislate: Motion Adopted Voice Vote; House Journal  7, PG.418 "
347585,2011-01-21,"House Introduced 1/6/2011 and Referred to Transportation; House Journal  11, PG. 183 "
347585,2011-02-01,"House Public Hearing: 2/8/2011 1:15 PM Legislative Office Building 203 "
347585,2011-02-23,"House Executive Session: 3/2/2011 Legislative Office Building 203 3:00 PM or immediately after House session "
347585,2011-03-02,"House Retained in Committee; House Calendar 27, PG.826 "
347585,2011-04-26,"House Retained Bill - Full Committee Work Session: 5/3/2011 11:15 Amendment Legislative Office Building 203 "
347585,2011-10-18,"House Retained Bill - Executive Session: 10/25/2011 8:30 Amendment Legislative Office Building 203 "
347585,2011-10-27,"House Committee Report: Inexpedient to Legislate for Jan 4 (Vote 10-0; Consent Calendar); House Calendar 70, PG.2211 "
347585,2012-01-04,"House Removed from Consent Calendar (Rep Pepino); House Journal  7, PG.368 "
347585,2012-01-11,"House Special Ordered to Next Order of Business: Without Objection; House Journal  9, PG.543 "
347585,2012-01-11,"House Inexpedient to Legislate: Motion Adopted Division Vote 244-105; House Journal  9, PG.543 "
347587,2011-01-21,"House Introduced 1/6/2011 and Referred to Election Law; House Journal  11, PG. 183 "
347587,2011-02-08,"House Public Hearing: 2/22/2011 3:00 PM Legislative Office Building 308 ==Executive Session to Follow== "
347587,2011-02-22,"House Retained in Committee; House Calendar 27, PG.823 "
347587,2011-05-10,"House Retained Bill - Subcommittee Work Session: 5/17/2011 11:00 Amendment Legislative Office Building 308 "
347587,2011-09-01,"House Retained Bill - Subcommittee Work Session: 9/20/2011 8:30 Amendment Legislative Office Building 303 "
347587,2011-09-01,"House Retained Bill - Subcommittee Work Session: 9/21/2011 8:30 Amendment Legislative Office Building 303 "
347587,2011-09-20,"House ==CANCELLED== Retained Bill - Subcommittee Work Session: 9/27/2011 8:30 Amendment Legislative Office Building 308 "
347587,2011-09-20,"House Retained Bill - Subcommittee Work Session: 9/28/2011 9:00 Amendment Legislative Office Building 308 ==TIME CHANGE (Orig 8:30 Amendment)== "
347587,2011-09-28,"House Retained Bill - Subcommittee Work Session: 10/5/2011 10:00 Amendment Legislative Office Building 308 "
347587,2011-10-06,"House Retained Bill - Subcommittee Work Session: 10/12/2011 Legislative Office Building 308 1:00 PM Or 30 Minutes After Session "
347587,2011-10-13,"House Retained Bill - Subcommittee Work Session: 10/18/2011 11:30 Amendment Legislative Office Building 308 "
347587,2011-10-19,"House Retained Bill - Subcommittee Work Session: 10/26/2011 9:30 Amendment Legislative Office Building 308 ==RECESSED== "
347587,2011-10-19,"House Retained Bill - Continued Subcommittee Work Session: 10/27/2011 10:15 Amendment Legislative Office Building 308 "
347587,2011-10-19,"House Retained Bill - Public Hearing on Proposed Amendment: 10/27/2011 10:30 Amendment Legislative Office Building 308 "
347587,2011-10-19,"House Retained Bill - Executive Session: 10/27/2011 Legislative Office Building 308 1:00 PM or Immediately Following Public Hearing "
347587,2011-11-02,"House Committee Report: Refer to Interim Study for Jan 4 (Vote 10-9; Regular Calendar); House Calendar 70, PG.2217 "
347587,2012-01-05,"House Refer to Interim Study: Motion Adopted Division Vote 300-35; House Journal  8, PG.482 "
347587,2012-06-07,"House Referred to Election Law for Interim Study; House Calendar 45, PG.2432 "
347587,2012-09-21,"House ==CANCELLED== Interim Study - Subcommittee Work Session: 9/27/2012 10:00 Amendment Legislative Office Building 308 "
347587,2012-09-24,"House ==RESCHEDULED== Interim Study - Subcommittee Work Session: 10/4/2012 1:30 PM Legislative Office Building 308 "
347587,2012-09-26,"House Interim Study - Executive Session: 10/16/2012 10:00 Amendment Legislative Office Building 308 "
347589,2011-01-21,"House Introduced 1/6/2011 and Referred to Legislative Administration; House Journal  11, PG. 183 "
347589,2011-02-01,"House Public Hearing: 2/8/2011 10:00 Amendment Legislative Office Building 104 "
347589,2011-02-08,"House Subcommittee Work Session: 2/9/2011 Legislative Office Building 104 12:00 PM or Following House Session "
347589,2011-02-22,"House Subcommittee Work Session: 2/24/2011 1:00 PM Legislative Office Building 104 "
347589,2011-02-23,"House Executive Session: 3/1/2011 10:00 Amendment Legislative Office Building 104 "
347589,2011-03-01,"House Retained in Committee; House Calendar 27, PG.824 "
347589,2011-09-15,"House Retained Bill - Subcommittee Work Session: 9/20/2011 8:30 Amendment Legislative Office Building 208 "
347589,2011-09-15,"House Retained Bill - Executive Session: 9/20/2011 10:00 Amendment Legislative Office Building 208 "
347589,2011-09-21,"House Committee Report: Inexpedient to Legislate for Jan 4 (Vote 11-1; Consent Calendar); House Calendar 70, PG.2207 "
347589,2012-01-04,"House Inexpedient to Legislate: Motion Adopted Voice Vote; House Journal  7, PG.415 "
347590,2011-01-21,"House Introduced 1/6/2011 and referred to Public Works & Highways; House Journal  11, PG. 184  "
347590,2011-02-01,"House Public Hearing: 2/10/2011 1:00 PM Legislative Office Building 201 "
347590,2011-02-02,"House Executive Session: 2/16/2011 Legislative Office Building 201 1:00 PM or Immediately Following House Session "
347590,2011-02-16,"House Retained in Committee; House Calendar 27, PG.825 "
347590,2011-08-24,"House Retained Bill - Executive Session: 9/27/2011 10:00 Amendment Legislative Office Building 201 "
347590,2011-09-28,"House Committee Report: Inexpedient to Legislate for Jan 4 (Vote 12-0; Consent Calendar); House Calendar 70, PG.2208 "
347590,2012-01-04,"House Inexpedient to Legislate: Motion Adopted Voice Vote; House Journal  7, PG.418 "
347592,2011-01-21,"House Introduced 1/6/2011 and referred to Criminal Justice & Public Safety; House Journal  11, PG. 184 "
347592,2011-02-09,"House Public Hearing: 2/24/2011 1:00 PM Legislative Office Building 204 ==TIME CHANGE (Orig 10:00 Amendment)== "
347592,2011-03-01,"House Subcommittee Work Session: 3/2/2011 3:00 or immediately following House session PM Legislative Office Building 204 "
347592,2011-03-02,"House Executive Session: 3/9/2011 10:00 Amendment Legislative Office Building 204 "
347592,2011-03-09,"House Committee Report: Ought to Pass with Amendment #0582h(NT) for Mar 15 (Vote 13-3; Regular Calendar); House Calendar 22, PG.549 "
347592,2011-03-09,"House Proposed Committee Amendment #2011-0582h (New Title); House Calendar 23, PG.610 "
347592,2011-03-15,"House Amendment #0582h (New Title) Adopted, Voice Vote; House Journal  26, PG.771 "
347592,2011-03-15,"House Floor Amendment #2011-0864h (New Title) (Rep Pepino) Failed, Voice Vote; House Journal  26, PG.771-772 "
347592,2011-03-15,"House Ought to Pass with Amendment #0582h(NT): Motion Adopted Regular Calendar 304-54; House Journal  26, PG.771-774 "
347592,2011-03-23,"Senate Introduced and Referred to Judiciary; Senate Journal 11, Pg.192 "
347592,2011-03-31,"Senate Hearing: 4/7/11, Room 101, Legislative Office Building, 1:30 p.m.; Senate Calendar 18 "
347592,2011-05-05,"Senate Committee Report: Rereferred to Committee, 5/11/11; Senate Calendar 23 "
347592,2011-05-11,"Senate Rereferred to Committee, Motion Adopted, Voice Vote; Senate Journal 16 "
347592,2012-01-27,"Senate Committee Report: Referred to Interim Study, 2/8/12; Senate Calendar 6 "
347592,2012-02-08,"Senate Refer to Interim Study, Motion Adopted, Voice Vote; Senate Journal 4, Pg.114 "
347593,2011-01-21,"House Introduced 1/6/2011 and referred to Municipal & County Government; House Journal  11, PG. 184 "
347593,2011-02-01,"House Public Hearing: 2/10/2011 11:30 Amendment Legislative Office Building 301 "
347593,2011-02-15,"House Executive Session: 2/24/2011 1:00 PM Legislative Office Building 301 "
347593,2011-02-28,"House Committee Report: Ought to Pass with Amendment #0514h(NT) for Mar 15 (Vote 15-0; Consent Calendar); House Calendar 22, PG.537 "
347593,2011-02-28,"House Proposed Committee Amendment #2011-0514h (New Title); House Calendar 23, PG.611 "
347593,2011-03-15,"House Amendment #0514h (New Title) Adopted, Voice Vote; House Journal  26, PG.732 "
347593,2011-03-15,"House Ought to Pass with Amendment #0514h(NT): Motion Adopted Voice Vote; House Journal  26, PG.732 "
347593,2011-03-23,"Senate Introduced and Referred to Public and Municipal Affairs; Senate Journal 11, Pg.192 "
347593,2011-05-05,"Senate Hearing: 5/10/11, Room 101, Legislative Office Building, 9:00 a.m.; Senate Calendar 23 "
347593,2011-05-11,"Senate Committee Report: Rereferred to Committee, 5/18/11; Senate Calendar 24 "
347593,2011-05-18,"Senate Rereferred to Committee, Motion Adopted, Voice Vote; Senate Journal 17, Pg.354 "
347593,2012-01-12,"Senate Committee Report: Ought to Pass, 1/18/12; Senate Calendar 3 "
347593,2012-01-18,"Senate Ought to Pass, Motion Adopted, Voice Vote; OT3rdg; Senate Journal 2, Pg.68 "
347593,2012-01-25,"Senate Enrolled; Senate Journal 4, Pg.100 "
347593,2012-02-08,"House Enrolled; House Journal  15, PG.848 "
347593,2012-03-12,"House Signed by the Governor 03/12/2012; Effective 05/11/2012; Chapter 0004 "
347595,2011-01-21,"House Introduced 1/6/2011 and referred to Executive Departments & Administration; House Journal  11, PG. 184 "
347595,2011-01-26,"House Public Hearing: 2/10/2011 1:00 PM Legislative Office Building 306 "
347595,2011-03-01,"House Subcommittee Work Session: 3/3/2011 2:20 PM Legislative Office Building 306 "
347595,2011-03-02,"House Executive Session: 3/9/2011 1:00 PM Legislative Office Building 306 "
347595,2011-03-09,"House Retained in Committee; House Calendar 27, PG.823 "
347595,2011-09-27,"House Retained Bill - Executive Session: 10/11/2011 10:30 Amendment Legislative Office Building 306 "
347595,2011-10-21,"House Committee Report: Ought to Pass with Amendment #0339h for Jan 4 (Vote 11-2; Regular Calendar); House Calendar 70, PG.2218 "
347595,2011-10-24,"House Proposed Committee Amendment #2011-0339h; House Calendar 69, PG.2129 "
347595,2012-01-05,"House Corrected Committee Report, Ought to Pass (Rep C.McGuire); House Journal  8, PG.488-489 "
347595,2012-01-05,"House Laid on Table (Rep Goley): Motion Failed Division Vote 114-207; House Journal  8, PG.489 "
347595,2012-01-05,"House Floor Amendment #0339h (Rep Manuse) Adopted, Voice Vote; House Journal  8, PG.489 "
347595,2012-01-05,"House Ought to Pass with Amendment #0339h: Motion Adopted Regular Calendar 212-128; House Journal  8, PG.489-491 "
347595,2012-03-07,"Senate Introduced and Referred to Executive Departments and Administration; Senate Journal 7, Pg.185 "
347595,2012-03-29,"Senate Hearing: 4/05/12, Room 100, State House, 9:00 a.m.; Senate Calendar 13 "
347595,2012-04-12,"Senate Committee Report: Inexpedient to Legislate, 4/18/12; Senate Calendar 15 "
347595,2012-04-18,"Senate Inexpedient to Legislate Not Voted On; "
347595,2012-04-18,"Senate Sen. White Moved Laid On Table, Motion Adopted, Voice Vote; Senate Journal 10, Pg.364 "
347596,2011-01-21,"House Introduced 1/6/2011 and referred to Science, Technology & Energy; House Journal  11, PG. 184 "
347596,2011-01-26,"House Public Hearing: 2/1/2011 11:00 Amendment Legislative Office Building 304 "
347596,2011-02-09,"House ==CANCELLED== Executive Session: 2/15/2011 Legislative Office Building 304 3:00 PM or Following House Session "
347596,2011-03-02,"House Executive Session: 3/2/2011 1:30 PM Legislative Office Building 304 "
347596,2011-03-02,"House Committee Report: Ought to Pass with Amendment #0576h for Mar 15 (Vote 8-6; Regular Calendar); House Calendar 22, PG.564 "
347596,2011-03-02,"House Proposed Committee Amendment #2011-0576h; House Calendar 23, PG.611 "
347596,2011-03-16,"House Amendment #0576h Adopted, Voice Vote; House Journal  28, PG.926 "
347596,2011-03-16,"House Ought to Pass with Amendment #0576h: Motion Adopted Regular Calendar 229-93; House Journal  28, PG.926-928 "
347596,2011-03-23,"Senate Introduced and Referred to Energy and Natural Resources; Senate Journal 11, Pg.192 "
347596,2011-04-06,"Senate Hearing: 4/14/11, Room 102, Legislative Office Building, 10:30 a.m.; Senate Calendar 19 "
347596,2011-04-28,"Senate Committee Report: Rereferred to Committee, 5/4/11; Senate Calendar 22 "
347596,2011-05-04,"Senate Rereferred to Committee, Motion Adopted, Voice Vote; Senate Journal 15, Pg.302 "
347596,2012-01-12,"Senate Committee Report: Inexpedient to Legislate, 1/18/12; Senate Calendar 3 "
347596,2012-01-18,"Senate Inexpedient to Legislate, Motion Adopted, Voice Vote === BILL KILLED ===; Senate Journal 2, Pg.48 "
347598,2011-01-21,"House Introduced 1/6/2011 and referred to Science, Technology & Energy; House Journal  11, PG. 184 "
347598,2011-02-15,"House Public Hearing: 2/22/2011 1:00 PM Legislative Office Building 304 ==RECESSED== "
347598,2011-02-22,"House ==RECONVENE== Public Hearing: 3/1/2011 11:15 Amendment Legislative Office Building 304 ==Executive Session To Follow== "
347598,2011-03-02,"House Retained in Committee; House Calendar 27, PG.825 "
347598,2011-08-18,"House Retained Bill - Full Committee Work Session: 9/13/2011 10:15 Amendment Legislative Office Building 301-303 "
347598,2011-10-11,"House Retained Bill - Executive Session: 10/25/2011 10:00 Amendment Legislative Office Building 304 "
347598,2011-10-27,"House Committee Report: Ought to Pass with Amendment #2773h(NT) for Jan 4 (Vote 7-3; Regular Calendar); House Calendar 70, PG.2224 "
347598,2011-10-27,"House Proposed Committee Amendment #2011-2773h (New Title); House Calendar 69, PG.2130-2131 "
347598,2012-01-11,"House Amendment #2773h(NT) Adopted, Voice Vote; House Journal  9, PG.538-540 "
347598,2012-01-11,"House Ought to Pass with Amendment #2773h(NT): Motion Adopted Regular Calendar 214-140; House Journal  9, PG.538-542 "
347598,2012-01-11,"House Referred to Ways and Means; House Journal  9, PG.542 "
347598,2012-01-17,"House Public Hearing: 2/7/2012 2:00 PM Legislative Office Building 202 "
347598,2012-01-18,"House ==CANCELLED== Executive Session: 2/9/2012 10:00 Amendment Legislative Office Building 202 "
347598,2012-02-09,"House Subcommittee Work Session: 2/14/2012 12:00 PM Legislative Office Building 202 "
347598,2012-02-13,"House Executive Session: 2/21/2012 10:00 Amendment Legislative Office Building 202 "
347598,2012-02-21,"House Committee Report: Ought to Pass with Amendment #0907h(NT) for Mar 7 (Vote 21-0; Consent Calendar); House Calendar 18, PG.1078 "
347598,2012-02-21,"House Proposed Committee Amendment #2012-0907h (New Title); House Calendar 17, PG.972-973 "
347598,2012-03-07,"House Amendment #0907h(NT) Adopted, Voice Vote; House Journal  21, PG.1331-1332 "
347598,2012-03-07,"House Ought to Pass with Amendment #0907h(NT): Motion Adopted Voice Vote; House Journal  21, PG.1331 "
347598,2012-03-07,"Senate Introduced and Referred to Energy and Natural Resources; Senate Journal 7, Pg.185 "
347598,2012-03-23,"Senate Hearing: 3/29/12, Room 102, Legislative Office Building, 9:00 a.m.; Senate Calendar 12 "
347598,2012-04-26,"Senate Committee Report: Ought to Pass with Amendment #2012-1741s, New Title, 5/2/12; Senate Calendar 17 "
347598,2012-05-02,"Senate Committee Amendment 1741s, New Title, Amendment Adopted, Voice Vote; Senate Journal 12, Pg.437 "
347598,2012-05-02,"Senate Ought to Pass with Amendment 1741s, New Title, Motion Adopted, Voice Vote; OT3rdg; Senate Journal 12, Pg.471 "
347598,2012-05-16,"House House Non-Concurs with Senate Amendment 1741s(NT) and Requests C of C (Rep J.Garrity): Motion Adopted Voice Vote; House Journal  44, PG.2348 "
347598,2012-05-16,"House Speaker Appoints: Reps J.Garrity, Holden, Cataldo, and Parison; House Journal  44, PG.2348 "
347598,2012-05-23,"Senate Sen. Odell Accedes to House Request for Committee of Conference; Motion Adopted, Voice Vote "
347598,2012-05-23,"Senate President Appoints: Senators Odell, Lambert, and Merrill "
347598,2012-05-25,"House Conference Committee Meeting: 5/30/2012 2:00 PM Legislative Office Building 304 "
347598,2012-05-31,"Senate Conference Committee Report #2012-2447c; Senate Amendment, Filed"
347598,2012-06-06,"Senate Conference Committee Report 2447c; Adopted, Voice Vote "
347598,2012-06-06,"House Conference Committee Report #2447c Adopted, Voice Vote; House Journal  51, PG.2595 "
347598,2012-06-06,"Senate Enrolled "
347598,2012-06-06,"House Enrolled "
347598,2012-06-22,"House Signed By Governor 06/19/2012; Effective 01/01/2013; Chapter 0270 "
347599,2011-01-21,"House Introduced 1/6/2011 and Referred to Commerce and Consumer Affairs; House Journal  11, PG. 185 "
347599,2011-02-09,"House Public Hearing: 3/1/2011 11:00 Amendment Legislative Office Building 302 "
347599,2011-02-23,"House Executive Session: 3/3/2011 2:45 PM Legislative Office Building 302 "
347599,2011-03-09,"House Retained in Committee; House Calendar 27, PG.822 "
347599,2011-06-22,"House Retained Bill - Banking/Business Div Subcom Work Session: 10/4/2011 10:30 Amendment Legislative Office Building 302 "
347599,2011-10-11,"House Retained Bill - Executive Session: 10/20/2011 1:15 PM Legislative Office Building 302 "
347599,2011-10-28,"House Committee Report: Inexpedient to Legislate for Jan 4 (Vote 14-0; Consent Calendar); House Calendar 70, PG.2200 "
347599,2012-01-04,"House Inexpedient to Legislate: Motion Adopted Voice Vote; House Journal  7, PG.373 "
347601,2011-01-21,"House Introduced 1/6/2011 and Referred to Commerce and Consumer Affairs; House Journal  11, PG. 185 "
347601,2011-01-26,"House ==CANCELLED== Public Hearing: 2/15/2011 11:00 Amendment Legislative Office Building 302 "
347601,2011-02-01,"House Public Hearing: 2/22/2011 11:00 Amendment Legislative Office Building 302 "
347601,2011-02-16,"House ==CANCELLED== Executive Session: 2/25/2011 10:00 Amendment Legislative Office Building 302 "
347601,2011-02-23,"House Executive Session: 3/1/2011 3:00 PM Legislative Office Building 302 "
347601,2011-03-09,"House Committee Report: Ought to Pass for Mar 15 (Vote 12-0; Consent Calendar); House Calendar 22, PG.525 "
347601,2011-03-15,"House Ought to Pass: Motion Adopted Voice Vote; House Journal  26, PG.702 "
347601,2011-03-23,"Senate Introduced and Referred to Commerce; Senate Journal 11, Pg.192 "
347601,2011-04-14,"Senate Hearing: 4/19/11, Room 102, Legislative Office Building, 10:00 a.m.; Senate Calendar 20 "
347601,2011-04-20,"Senate Committee Report: Rereferred to Committee, 4/27/11; Senate Calendar 21 "
347601,2011-04-27,"Senate Rereferred to Committee, Motion Adopted, Voice Vote; Senate Journal 14, Pg.275 "
347601,2012-01-03,"Senate Committee Report: Inexpedient to Legislate, 1/18/12; Senate Calendar 3 "
347601,2012-01-18,"Senate Inexpedient to Legislate, Motion Adopted, Voice Vote === BILL KILLED ===; Senate Journal 2, Pg.36 "
347602,2011-01-21,"House Introduced 1/6/2011 and Referred to Commerce and Consumer Affairs; House Journal  11, PG. 185 "
347602,2011-01-26,"House Public Hearing: 2/8/2011 2:00 PM Legislative Office Building 302 "
347602,2011-02-09,"House Subcommittee Work Session: 2/16/2011 9:00 Amendment Legislative Office Building 302 "
347602,2011-02-16,"House ==CANCELLED== Subcommittee Work Session: 2/25/2011 9:15 Amendment Legislative Office Building 302 "
347602,2011-02-16,"House ==CANCELLED== Executive Session: 2/25/2011 10:00 Amendment Legislative Office Building 302 "
347602,2011-02-23,"House Executive Session: 3/1/2011 3:00 PM Legislative Office Building 302 "
347602,2011-03-01,"House Retained in Committee; House Calendar 27, PG.822 "
347602,2011-06-22,"House Retained Bill - Banking/Business Div Subcom Work Session: 9/20/2011 11:45 Amendment Legislative Office Building 302 "
347602,2011-09-20,"House Retained Bill - Banking/Business Div Subcom Work Session: 10/4/2011 11:45 Amendment Legislative Office Building 302 "
347602,2011-10-04,"House Retained Bill - Banking/Business Div Subcom Work Session: 10/20/2011 9:15 Amendment Legislative Office Building 302 "
347602,2011-10-11,"House Retained Bill - Executive Session: 10/20/2011 1:15 PM Legislative Office Building 302 "
347602,2011-10-28,"House Committee Report: Ought to Pass with Amendment #2678h(NT) for Jan 4 (Vote 14-1; Consent Calendar); House Calendar 70, PG.2201 "
347602,2011-10-28,"House Proposed Committee Amendment #2011-2678h (New Title); House Calendar 69, PG.2131 "
347602,2012-01-04,"House Amendment #2678h(NT) Adopted, Voice Vote; House Journal  7, PG.373 "
347602,2012-01-04,"House Ought to Pass with Amendment #2678h(NT): Motion Adopted Voice Vote; House Journal  7, PG.373 "
347602,2012-01-18,"Senate Introduced and Referred to Commerce; Senate Journal 3, Pg.74 "
347602,2012-03-15,"Senate Hearing: 3/20/12, Room 102, Legislative Office Building, 10:30 a.m.; Senate Calendar 11 "
347602,2012-03-16,"Senate Hearing: === CANCELLED === 3/20/12, Room 102, Legislative Office Building, 10:30 a.m. "
347602,2012-03-22,"Senate Hearing: === RESCHEDULED === 3/27/12, Room 102, Legislative Office Building, 9:00 a.m.; Senate Calendar 12 "
347602,2012-04-03,"Senate Committee Report: Ought to Pass with Amendment #2012-1465s, 4/11/12; Vote 5-0; Consent Calendar; Senate Calendar 14 "
347602,2012-04-11,"Senate Committee Amendment 1465s; Amendment Adopted, Voice Vote; Senate Journal 9, Pg.336 "
347602,2012-04-11,"Senate Ought to Pass with Amendment 1465s, Motion Adopted, Voice Vote; OT3rdg; Senate Journal 9, Pg.349 "
347602,2012-05-09,"House House Concurs with Senate Amendment #1465s (Rep Hunt): Motion Adopted Voice Vote; House Journal  40, PG.2227 "
347602,2012-05-16,"Senate Enrolled "
347602,2012-05-17,"House Enrolled; House Journal  46, PG.2480 "
347602,2012-05-31,"House Signed By Governor 05/29/2012; Effective 05/29/2012; Chapter 0085 "
347604,2011-01-21,"House Introduced 1/6/2011 and Referred to Children and Family Law; House Journal  11, PG. 185 "
347604,2011-02-23,"House Public Hearing: 3/3/2011 10:30 Amendment Legislative Office Building 206 "
347604,2011-03-01,"House Executive Session: 3/7/2011 10:00 Amendment Legislative Office Building 206 "
347604,2011-03-07,"House Retained in Committee; House Calendar 27, PG.822 "
347604,2011-04-20,"House ==CANCELLED== Retained Bill - Subcommittee Work Session: 4/27/2011 2:00 PM Legislative Office Building 206 "
347604,2011-04-27,"House Retained Bill - Subcommittee Work Session: 5/5/2011 10:00 Amendment Legislative Office Building 206 "
347604,2011-05-05,"House Retained Bill - Subcommittee Work Session: 5/19/2011 10:00 Amendment Legislative Office Building 206 "
347604,2011-09-06,"House Retained Bill - Full Committee Work Session: 9/14/2011 11:00 Amendment Legislative Office Building 206 "
347604,2011-09-14,"House Retained Bill - Subcommittee Work Session: 9/22/2011 10:00 Amendment Legislative Office Building 206 "
347604,2011-09-30,"House Retained Bill - Executive Session: 10/26/2011 10:00 Amendment Legislative Office Building 206 ==If Necessary Continued 10/27/2011 10:00 Amendment Legislative Office Building 206== "
347604,2011-11-02,"House Committee Report: Inexpedient to Legislate for Jan 4 (Vote 12-1; Consent Calendar); House Calendar 70, PG.2198 "
347604,2012-01-04,"House Removed from Consent Calendar (Rep Hoell); House Journal  7, PG.367 "
347604,2012-01-11,"House Inexpedient to Legislate: Motion Failed Regular Calendar 147-197; House Journal  9, PG.573-575 "
347604,2012-01-11,"House Ought to Pass (Rep Cohn): Motion Adopted Regular Calendar 217-129; House Journal  9, PG.575-577 "
347604,2012-01-11,"House Referred to Constitutional Review and Statutory Recodification; House Journal  9, PG.577 "
347604,2012-02-02,"House Public Hearing: 2/14/2012 2:00 PM Legislative Office Building 206 "
347604,2012-02-03,"House Executive Session: 2/21/2012 10:30 Amendment Legislative Office Building 206 ==TIME CHANGE (Orig 10:00 Amendment)== "
347604,2012-02-22,"House Continued Executive Session: 3/6/2012 10:00 Amendment Legislative Office Building 206 "
347604,2012-03-07,"House Committee Report: Ought to Pass with Amendment #1115h for Mar 14 (Vote 12-0; Consent Calendar); House Calendar 19, PG.1145 "
347604,2012-03-07,"House Proposed Committee Amendment #2012-1115h; House Calendar 19, PG.1162 "
347604,2012-03-15,"House Amendment #1115h Adopted, Voice Vote; House Journal  26, PG.1648 "
347604,2012-03-15,"House Ought to Pass with Amendment #1115h: Motion Adopted Voice Vote; House Journal  26, PG.1648 "
347604,2012-03-28,"Senate Introduced and Referred to Judiciary; Senate Journal 9, Pg.332 "
347604,2012-04-05,"Senate Hearing: 4/12/12, Room 101, Legislative Office Building, 1:45 p.m.; Senate Calendar 14 "
347604,2012-05-11,"Senate Committee Report: Referred to Interim Study, 5/16/12; Senate Calendar 19A "
347604,2012-05-16,"Senate Refer to Interim Study, Motion Adopted, Voice Vote "
347605,2011-01-21,"House Introduced 1/6/2011 and Referred to Executive Departments and Administration; House Journal  11, PG. 185 "
347605,2011-02-02,"House Public Hearing: 2/10/2011 11:30 Amendment Legislative Office Building 306 "
347605,2011-02-14,"House ==CANCELLED== Executive Session: 2/16/2011 Legislative Office Building 306 1:30 PM or 45 minutes following House session "
347605,2011-02-22,"House Subcommittee Work Session: 2/24/2011 3:00 PM Legislative Office Building 306 "
347605,2011-02-23,"House ==CANCELLED== Executive Session: 3/2/2011 2:00 PM or 45 mins after House session Legislative Office Building 306 "
347605,2011-03-02,"House Subcommittee Work Session: 3/3/2011 4:45 PM Legislative Office Building 306 "
347605,2011-03-02,"House Executive Session: 3/9/2011 1:00 PM Legislative Office Building 306 "
347605,2011-03-10,"House Committee Report: Ought to Pass with Amendment #0733h(NT) for Mar 15 (Vote 11-2; Regular Calendar); House Calendar 22, PG.554 "
347605,2011-03-10,"House Proposed Committee Amendment #2011-0733h (New Title); House Calendar 23, PG.617-619 "
347605,2011-03-15,"House Amendment #0733h (New Title) Adopted, Voice Vote; House Journal  26, PG.801-803 "
347605,2011-03-15,"House Ought to Pass with Amendment #0733h(NT): Motion Adopted Voice Vote; House Journal  26, PG.801-803 "
347605,2011-03-30,"Senate Introduced and Referred to Executive Departments and Administration; Senate Journal 12, Pg.243 "
347605,2011-04-14,"Senate Hearing: 4/21/11, Room 100, State House, 9:15 a.m.; Senate Calendar 20 "
347605,2011-04-28,"Senate Committee Report: Rereferred to Committee, 5/4/11; Senate Calendar 22 "
347605,2011-05-04,"Senate Rereferred to Committee, Motion Adopted, Voice Vote; Senate Journal 15, Pg.304 "
347605,2011-09-01,"Senate Work Session on Re-referred Bill: 9/8/11, Room 100, State House, 10:00 a.m.; Senate Calendar 36 "
347605,2012-01-12,"Senate Committee Report: Ought to Pass with Amendment #2012-0009s, 1/18/12; Senate Calendar 3 "
347605,2012-01-18,"Senate Committee Amendment 0009s, Amendment Adopted, Voice Vote; Senate Journal 2, Pg.55 "
347605,2012-01-18,"Senate Ought to Pass with Amendment 0009s, Motion Adopted, Voice Vote; OT3rdg; Senate Journal 2, Pg.55 "
347605,2012-02-01,"House House Concurs with Senate Amendment (Rep C.Mcguire): Motion Adopted Voice Vote; House Journal  13, PG.739 "
347605,2012-02-08,"Senate Enrolled; Senate Journal 5, Pg.123 "
347605,2012-02-15,"House Enrolled; House Journal  16, PG.969 "
347605,2012-03-12,"House Signed by the Governor 03/12/2012; Effective 05/11/2012; Chapter 0005 "
347607,2011-01-21,"House Introduced 1/6/2011 and Referred to Labor, Industrial and Rehabilitative Services; House Journal  11, PG. 186 "
347607,2011-02-09,"House ==CANCELLED== Public Hearing: 2/22/2011 10:15 Amendment Legislative Office Building 307 "
347607,2011-02-10,"House ==RESCHEDULED== Public Hearing: 3/1/2011 10:15 Amendment Legislative Office Building 307 "
347607,2011-02-23,"House Executive Session: 3/1/2011 1:00 PM Legislative Office Building 307 "
347607,2011-03-01,"House Retained in Committee; House Calendar 27, PG.824 "
347607,2011-06-01,"House Retained Bill - Full Committee Work Session: 6/8/2011 11:00 Amendment Legislative Office Building 307 "
347607,2011-09-12,"House ==CANCELLED== Retained Bill - Full Committee Work Session: 9/20/2011 11:00 Amendment Legislative Office Building 307 "
347607,2011-09-13,"House Retained Bill - Full Committee Work Session: 9/21/2011 11:00 Amendment Legislative Office Building 307 "
347607,2011-09-27,"House Retained Bill - Full Committee Work Session: 10/4/2011 1:00 PM Legislative Office Building 307 "
347607,2011-09-27,"House Retained Bill - Executive Session: 10/18/2011 1:00 PM Legislative Office Building 307 "
347607,2011-10-21,"House Committee Report: Ought to Pass with Amendment #2754h(NT) for Jan 4 (Vote 15-0; Consent Calendar); House Calendar 70, PG.2207 "
347607,2011-10-21,"House Proposed Committee Amendment #2011-2754h (New Title); House Calendar 69, PG.2131-2133 "
347607,2012-01-04,"House Amendment #2754h(NT) Adopted, Voice Vote; House Journal  7, PG.413-415 "
347607,2012-01-04,"House Ought to Pass with Amendment #2754h(NT): Motion Adopted Voice Vote; House Journal  7, PG.413-415 "
347607,2012-02-08,"Senate Introduced and Referred to Commerce; Senate Journal 5, Pg.122 "
347607,2012-03-22,"Senate Hearing: 3/27/12, Room 102, Legislative Office Building, 9:50 a.m.; Senate Calendar 12 "
347607,2012-04-18,"Senate Committee Report: Ought to Pass with Amendment #2012-1698s, 4/25/12; Senate Calendar 16 "
347607,2012-04-25,"Senate Committee Amendment 1698s; Amendment Adopted, Voice Vote; Senate Journal 11, Pg.388 "
347607,2012-04-25,"Senate Sen. Houde Floor Amendment #2012-1697s, Regular Calendar 5Y-18N, Amendment Failed; Senate Journal 11, Pg.389 "
347607,2012-04-25,"Senate Ought to Pass with Amendment 1698s, Regular Calendar 18Y-5N, Motion Adopted; OT3rdg; Senate Journal 11, Pg.415 "
347607,2012-05-15,"House House Concurs with Senate Amendment #1698s (Rep Daniels): Motion Adopted Voice Vote; House Journal  43, PG.2280 "
347607,2012-05-23,"Senate Enrolled "
347607,2012-05-30,"House Enrolled [Recessed from 5/17/2012 Session]; House Journal  46, PG.2495 "
347607,2012-06-11,"House Signed By Governor 06/07/2012; Effective 08/06/2012; Chapter 0139 "
347608,2011-01-21,"House Introduced 1/6/2011 and Referred to Commerce and Consumer Affairs; House Journal  11, PG.186 "
347608,2011-01-26,"House ==CANCELLED== Public Hearing: 2/15/2011 10:30 Amendment Legislative Office Building 302 "
347608,2011-02-01,"House Public Hearing: 2/22/2011 10:30 Amendment Legislative Office Building 302 "
347608,2011-02-16,"House ==CANCELLED== Executive Session: 2/25/2011 10:00 Amendment Legislative Office Building 302 "
347608,2011-02-23,"House Executive Session: 3/1/2011 3:00 PM Legislative Office Building 302 "
347608,2011-03-01,"House Retained in Committee; House Calendar 27, PG.822 "
347608,2011-06-22,"House ==CANCELLED== Retained Bill - Banking/Business Div Subcom Work Session: 10/4/2011 11:15 Amendment Legislative Office Building 302 "
347608,2011-08-23,"House Retained Bill - Banking/Business Div Subcom Work Session: 10/11/2011 10:30 Amendment Legislative Office Building 302 "
347608,2011-10-11,"House Retained Bill - Executive Session: 10/20/2011 1:15 PM Legislative Office Building 302 "
347608,2011-11-01,"House Committee Report: Inexpedient to Legislate for Jan 4 (Vote 11-3; Regular Calendar) ==Note: Corrected Committee Report==; House Calendar 1 "
347608,2012-01-04,"House Inexpedient to Legislate: Motion Adopted Voice Vote; House Journal  7, PG.438 "
347610,2011-01-21,"House Introduced 1/6/2011 and referred to Judiciary; House Journal  11, PG. 186 "
347610,2011-02-09,"House Public Hearing: 2/17/2011 10:30 Amendment Representative's Hall "
347610,2011-02-23,"House ==CANCELLED== Executive Session: 3/1/2011 1:00 PM Legislative Office Building 208 "
347610,2011-03-02,"House Executive Session: 3/3/2011 10:00 Amendment Legislative Office Building 208 "
347610,2011-03-03,"House Retained in Committee; House Calendar 27, PG.824 "
347610,2011-09-01,"House Retained Bill - Subcommittee Work Session: 9/14/2011 9:00 Amendment Legislative Office Building 208 "
347610,2011-09-14,"House Retained Bill - Executive Session: 10/25/2011 11:00 Amendment Legislative Office Building 208 "
347610,2011-11-02,"House Committee Report: Ought to Pass with Amendment #2779h(NT) for Mar 21 (Vote 11-6; Regular Calendar); House Calendar 22, PG.1356-1357 "
347610,2011-11-02,"House Proposed Committee Amendment #2011-2779h (New Title); House Calendar 22, PG.1372-1374 "
347610,2012-03-21,"House Amendment #2779h(NT) Failed, Regular Calendar 82-266; House Journal  28, PG.1692-1697 "
347610,2012-03-21,"House FL Amendment #2012-1288h(NT) (Rep Bates); House Journal  28, PG.1697-1698 "
347610,2012-03-21,"House Divide Sec.6 from FL Amendment #1288h(NT) (Rep Mirski): Motion Failed Division Vote 173-179; House Journal  28, PG.1698 "
347610,2012-03-21,"House Reconsider Division of Sec.6 from FL Amendment 1288h(NT) (Rep Manuse): Motion Failed Division Vote 128-222; House Journal  28, PG.1698 "
347610,2012-03-21,"House FL Amendment #1288h(NT) (Rep Bates): Amendment Failed Regular Calendar 162-188; House Journal  28, PG.1698-1700 "
347610,2012-03-21,"House FL Amendment #2012-1097h(NT) (Rep Manuse); House Journal  28, PG.1700 "
347610,2012-03-21,"House Lay On The Table (Rep Hunt): Motion Failed Regular Calendar 82-263; House Journal  28, PG.1700-1702 "
347610,2012-03-21,"House FL Amendment #2012-0478h (Rep Lambert); House Journal  28, PG.1702 "
347610,2012-03-21,"House Object to Consideration of Motion Regarding FL Amendment 0478h (Rep Winter): Motion Adopted Regular Calendar 286-52; House Journal  28, PG.1702-1705 "
347610,2012-03-21,"House Suspend Rule 35E to Hear FL Amendment #1097h(NT) (Rep Lambert): Motion Failed Division Vote 62-277; House Journal  28, PG.1705 "
347610,2012-03-21,"House Reconsider Comm Amendment #2779(NT) (Rep Cartwright): Motion Failed Regular Calendar 144-193; House Journal  28, PG.1705-1707 "
347610,2012-03-21,"House Ought to Pass: Motion Failed Regular Calendar 133-202; House Journal  28, PG.1707-1709 "
347610,2012-03-21,"House Inexpedient to Legislate (Rep Simmons): Motion Adopted Regular Calendar 211-116; House Journal  28, PG.1709-1711 "
347610,2012-03-21,"House Reconsider Motion of Inexpedient to Legislate (Rep Jennifer Coffey): Motion Failed Division Vote 87-211; House Journal  28, PG.1711 "
347610,2012-03-29,"House Print Debate in Permanent Journal (Rep Tregenza): Motion Failed Division Vote 136-161 "
347611,2011-01-21,"House Introduced 1/6/2011 and referred to Resources, Recreation & Development "
347611,2011-02-02,"House Public Hearing: 2/10/2011 10:00 Amendment Legislative Office Building 305 "
347611,2011-02-22,"House Executive Session: 3/1/2011 1:00 PM Legislative Office Building 305 "
347611,2011-03-03,"House Committee Report: Ought to Pass for Mar 15 (Vote 13-1; Consent Calendar); House Calendar 22, PG.540 "
347611,2011-03-15,"House Ought to Pass: Motion Adopted Voice Vote; House Journal  26, PG.738 "
347611,2011-03-23,"Senate Introduced and Referred to Energy and Natural Resources; Senate Journal 11, Pg.192 "
347611,2011-03-24,"Senate Hearing: 3/31/11, Room 102, Legislative Office Building, 9:10 a.m.; Senate Calendar 17 "
347611,2011-03-31,"Senate Committee Report: Rereferred to Committee, 4/13/11; Senate Calendar 19 "
347611,2011-04-13,"Senate Rereferred to Committee, Motion Adopted, Voice Vote; Senate Journal 12, Pg.248 "
347611,2012-01-12,"Senate Committee Report: Inexpedient to Legislate, 1/18/12; Senate Calendar 3 "
347611,2012-01-18,"Senate Inexpedient to Legislate, Motion Adopted, Voice Vote === BILL KILLED ===; Senate Journal 2, Pg.48 "
347613,2011-01-21,"House Introduced 1/6/2011 and Referred to State-Federal Relations & Veterans Affairs; House Journal  11, PG. 186  "
347613,2011-01-26,"House Public Hearing: 2/3/2011 11:00 Amendment Legislative Office Building 203 ==Executive Session to Follow== "
347613,2011-02-04,"House Majority Committee Report: Ought to Pass for Feb 15 (Vote 8-2; Regular Calendar); House Calendar 13, PG.237 "
347613,2011-02-04,"House Minority Committee Report: Inexpedient to Legislate; House Calendar 13, PG.237 "
347613,2011-02-15,"House Special Order to Feb 16: Motion Adopted Without Objection; House Journal  17, PG.378 "
347613,2011-02-16,"House Ought to Pass: Motion Adopted Regular Calendar 267-92; House Journal  19, PG.418-420 "
347613,2011-02-16,"House Referred to Commerce and Consumer Affairs; House Journal  19, PG.420 "
347613,2011-02-23,"House Public Hearing: 3/10/2011 2:00 PM Legislative Office Building 302 ==Executive Session to Follow== "
347613,2011-03-10,"House Retained in Committee "
347613,2011-08-23,"House Retained Bill - Insurance/Consumer Div Subcom Work Session: 10/11/2011 2:00 PM Legislative Office Building 302 "
347613,2011-10-19,"House Retained Bill - Executive Session: 10/25/2011 1:15 PM Legislative Office Building 301-303 (If Necessary Continued 10/27/2011 1:15 PM Legislative Office Building 302) "
347613,2011-11-02,"House Committee Report: Ought to Pass with Amendment #2718h(NT) for Jan 4 (Vote 13-2; Consent Calendar); House Calendar 70, PG.2201 "
347613,2011-11-02,"House Proposed Committee Amendment #2011-2718h (New Title); House Calendar 69, PG.2135 "
347613,2012-01-04,"House Removed from Consent Calendar (Rep G.Richardson); House Journal  7, PG.367 "
347613,2012-01-11,"House Amendment #2718h(NT) Adopted, Regular Calendar 179-118; House Journal  9, PG.584-586 "
347613,2012-01-11,"House Ought to Pass with Amendment #2718h(NT): Motion Adopted Regular Calendar 211-83; House Journal  9, PG.584-588 "
347613,2012-04-18,"Senate Without objection returned to House per Senate Rule 3-3.; Senate Journal 10, Pg.378 "
347614,2011-01-21,"House Introduced 1/6/2011 and referred to Judiciary; House Journal  11, PG. 186 "
347614,2011-02-09,"House Public Hearing: 2/17/2011 10:30 Amendment Representative's Hall "
347614,2011-02-23,"House ==CANCELLED== Executive Session: 3/1/2011 1:00 PM Legislative Office Building 208 "
347614,2011-03-02,"House Executive Session: 3/3/2011 10:00 Amendment Legislative Office Building 208 "
347614,2011-03-03,"House Retained in Committee; House Calendar 27, PG.824 "
347614,2011-09-01,"House Retained Bill - Subcommittee Work Session: 9/14/2011 9:00 Amendment Legislative Office Building 208 "
347614,2011-09-14,"House Retained Bill - Executive Session: 10/25/2011 11:00 Amendment Legislative Office Building 208 "
347614,2011-11-02,"House Committee Report: Inexpedient to Legislate Mar 21 (Vote 17-0; Consent Calendar); House Calendar 22, PG.1353 "
347614,2012-03-21,"House Inexpedient to Legislate: Motion Adopted Voice Vote; House Journal  28, PG.1666 "
347616,2011-01-21,"House Introduced 1/6/2011 and Referred to Commerce & Consumer Affairs; House Journal  11, PG.186 "
347616,2011-02-09,"House Public Hearing: 3/1/2011 2:30 PM Legislative Office Building 302 "
347616,2011-02-23,"House Executive Session: 3/3/2011 2:45 PM Legislative Office Building 302 "
347616,2011-03-09,"House Retained in Committee; House Calendar 27, PG.822 "
347616,2011-06-22,"House Retained Bill - Banking/Business Div Subcom Work Session: 9/27/2011 11:15 Amendment Legislative Office Building 302 "
347616,2011-09-27,"House Retained Bill - Banking/Business Div Subcom Work Session: 10/18/2011 11:15 Amendment Legislative Office Building 302 "
347616,2011-10-19,"House Retained Bill - Banking/Business Div Subcom Work Session: 10/25/2011 11:15 Amendment Legislative Office Building 302 "
347616,2011-10-19,"House Retained Bill - Executive Session: 10/25/2011 1:15 PM Legislative Office Building 301-303 ==RECESSED== "
347616,2011-10-26,"House Retained Bill - Executive Session: 11/1/2011 10:00 Amendment Legislative Office Building 302 "
347616,2011-11-02,"House Committee Report: Refer to Interim Study for Jan 4 (Vote 14-0; Consent Calendar); House Calendar 70, PG.2201 "
347616,2012-01-04,"House Removed from Consent Calendar (Rep Kurk); House Journal  7, PG.368 "
347616,2012-02-01,"House Refer to Interim Study: Motion Failed Regular Calendar 158-183; House Journal  13, PG.747-749 "
347616,2012-02-01,"House Ought to Pass (Rep Kurk); House Journal  13, PG.749 "
347616,2012-02-01,"House Floor Amendment #2012-0084h (Rep Kurk) Adopted, Regular Calendar 293-53; House Journal  13, PG.749-750 "
347616,2012-02-01,"House Ought to Pass with Amendment #0084h: Motion Adopted Voice Vote; House Journal  13, PG.750-752 "
347616,2012-02-01,"House Referred to Criminal Justice and Public Safety; House Journal  13, PG.752 "
347616,2012-02-28,"House Public Hearing: 3/6/2012 10:00 Amendment Legislative Office Building 204 "
347616,2012-03-13,"House Executive Session: 3/20/2012 10:00 Amendment Legislative Office Building 204 "
347616,2012-03-21,"House Committee Report: Refer to Interim Study for Mar 28 (Vote 14-0; Consent Calendar); House Calendar 25, PG.1502 "
347616,2012-03-28,"House Refer to Interim Study: Motion Adopted Voice Vote; House Journal  30, PG.1745 "
347616,2012-06-07,"House Referred to Criminal Justice and Public Safety for Interim Study; House Calendar 45, PG.2432 "
347616,2012-06-14,"House Interim Study - Subcommittee Work Session: 6/21/2012 10:30 Amendment Legislative Office Building 204 "
347616,2012-08-17,"House Interim Study - Subcommittee Work Session: 9/13/2012 10:00 Amendment Legislative Office Building 204 "
347616,2012-09-18,"House Interim Study - Executive Session: 10/10/2012 10:00 Amendment Legislative Office Building 204 "
347617,2011-01-21,"House Introduced 1/6/2011 and referred to Executive Departments & Administration; House Journal  11, PG. 186 "
347617,2011-02-09,"House Public Hearing: 2/22/2011 2:00 PM Representative's Hall "
347617,2011-02-16,"House Subcommittee Work Session: 2/24/2011 2:15 PM Legislative Office Building 306 "
347617,2011-02-23,"House Executive Session: 3/2/2011 2:00 PM or 45 mins after House session Legislative Office Building 306 "
347617,2011-03-02,"House Retained in Committee; House Calendar 27, PG.823 "
347617,2011-06-22,"House Retained Bill - Subcommittee Work Session: 6/28/2011 12:00 PM Legislative Office Building 306 "
347617,2011-07-27,"House Retained Bill - Subcommittee Work Session: 8/2/2011 11:00 Amendment Legislative Office Building 307 "
347617,2011-07-27,"House Retained Bill - Subcommittee Work Session: 8/9/2011 12:00 PM Legislative Office Building 307 "
347617,2011-08-10,"House Retained Bill - Subcommittee Work Session: 8/16/2011 9:30 Amendment Legislative Office Building 306 "
347617,2011-08-10,"House Retained Bill - Subcommittee Work Session: 8/23/2011 9:30 Amendment Legislative Office Building 306 "
347617,2011-09-27,"House Retained Bill - Subcommittee Work Session: 10/4/2011 12:00 PM Legislative Office Building 301 "
347617,2011-09-27,"House Retained Bill - Executive Session: 10/27/2011 10:00 Amendment Legislative Office Building 306 (If Necessary Continued 11/1/2011 10:30 Amendment Legislative Office Building 306) "
347617,2011-11-02,"House Majority Committee Report: Ought to Pass with Amendment #2639h for Jan 4 (Vote 9-8; Regular Calendar); House Calendar 70, PG.2218 "
347617,2011-11-02,"House Proposed Majority Committee Amendment #2011-2639h; House Calendar 69, PG.2135-2140 "
347617,2011-11-02,"House Minority Committee Report: Inexpedient to Legislate; House Calendar 70, PG.2218 "
347617,2012-01-05,"House Amendment #2639h Adopted, Voice Vote; House Journal  8, PG.491-496 "
347617,2012-01-05,"House Floor Amendment #2012-0116h(NT) (Rep Millham) Failed, Division Vote 112-219; House Journal  8, PG.496-497 "
347617,2012-01-05,"House Floor Amendment #2012-0095h (Rep Chandler) Failed, Voice Vote; House Journal  8, PG.497 "
347617,2012-01-05,"House Laid on Table (Rep Gandia): Motion Failed Regular Calendar 62-269; House Journal  8, PG.497-499 "
347617,2012-01-05,"House Ought to Pass with Amendment #2639h: Motion Failed Regular Calendar 135-195; House Journal  8, PG.499-501 "
347617,2012-01-05,"House Inexpedient to Legislate (Rep Hawkins): Motion Adopted Division Vote 214-116; House Journal  8, PG.501 "
347619,2011-01-21,"House Introduced 1/6/2011 and referred to Ways & Means; House Journal  11, PG. 186 "
347619,2011-02-09,"House Public Hearing: 2/22/2011 11:00 Amendment Legislative Office Building 202 ==Executive Session to Follow== "
347619,2011-02-28,"House Retained in Committee; House Calendar 27, PG.826 "
347619,2011-06-02,"House Retained Bill - Full Committee Work Session: 6/7/2011 10:00 Amendment Legislative Office Building 202 "
347619,2011-09-07,"House ===CANCELLED=== Work Session: 9/19/2011 1:00 PM Legislative Office Building 202 "
347619,2011-09-16,"House Retained Bill - Subcommittee Work Session: 9/28/2011 1:00 PM Legislative Office Building 202 "
347619,2011-09-28,"House ===CANCELLED=== Work Session: 10/4/2011 1:00 PM Legislative Office Building 202 "
347619,2011-09-28,"House Retained Bill - Subcommittee Work Session: 10/11/2011 10:30 Amendment Legislative Office Building 202 "
347619,2011-10-11,"House Retained Bill - Subcommittee Work Session: 10/18/2011 10:00 Amendment Legislative Office Building 202 "
347619,2011-10-11,"House Retained Bill - Executive Session: 10/26/2011 1:00 PM Legislative Office Building 202 ==RECESSED== "
347619,2011-10-20,"House Retained Bill - Rescheduled Executive Session 10/27/2011 1:00 PM Legislative Office Building 202 "
347619,2011-11-02,"House Committee Report: Refer to Interim Study for Jan 4 (Vote 19-2; Consent Calendar); House Calendar 70, PG.2211 "
347619,2012-01-04,"House Refer to Interim Study: Motion Adopted Voice Vote; House Journal  7, PG.428 "
347619,2012-06-07,"House Referred to Ways and Means for Interim Study; House Calendar 45, PG.2434 "
347619,2012-09-18,"House Interim Study - Subcommittee Work Session: 9/25/2012 11:00 Amendment Legislative Office Building 202 "
347620,2011-01-21,"House Introduced 1/6/2011 and referred to Criminal Justice & Public Safety; House Journal  11, PG. 187 "
347620,2011-02-01,"House Public Hearing: 2/10/2011 10:00 Amendment Legislative Office Building 204 "
347620,2011-02-16,"House Executive Session: 2/22/2011 10:00 Amendment Legislative Office Building 204 "
347620,2011-02-22,"House Committee Report: Inexpedient to Legislate for Mar 2 (Vote 11-5; Consent Calendar); House Calendar 18, PG.386 "
347620,2011-03-02,"House Removed from Consent Calendar (Rep Vaillancourt); House Journal  25, PG.671 "
347620,2011-03-02,"House Inexpedient to Legislate: Motion Failed Regular Calendar 158-188; House Journal  25, PG.688-690 "
347620,2011-03-02,"House Recommit (Rep Welch): Motion Adopted Division Vote 211-138; House Journal  25, PG.690 "
347620,2011-03-02,"House Executive Session: 3/9/2011 10:00 Amendment Legislative Office Building 204 "
347620,2011-03-09,"House Retained in Committee; House Calendar 27, PG.823 "
347620,2011-07-27,"House Retained Bill - Subcommittee Work Session: 8/10/2011 10:00 Amendment Legislative Office Building 204 "
347620,2011-09-27,"House Retained Bill - Executive Session: 10/20/2011 10:00 Amendment Legislative Office Building 204 "
347620,2011-10-25,"House Committee Report: Inexpedient to Legislate for Jan 4 (Vote 14-3; Regular Calendar); House Calendar 70, PG.2215 "
347620,2012-01-04,"House Laid on Table (Rep Bettencourt): Motion Adopted Voice Vote; House Journal  7, PG.461 "
347622,2011-01-21,"House Introduced 1/6/2011 and referred to Executive Departments & Administration; House Journal  11, PG. 187 "
347622,2011-02-02,"House ===CANCELLED=== Public Hearing: 3/3/2011 10:30 Amendment Legislative Office Building 306 "
347622,2011-02-02,"House Public Hearing: 3/1/2011 10:30 Amendment Legislative Office Building 306 "
347622,2011-03-02,"House Executive Session: 3/2/2011 Legislative Office Building 301 Following House Session "
347622,2011-03-03,"House Retained in Committee; House Calendar 27, PG.824 "
347622,2011-05-25,"House Retained Bill - Subcommittee Work Session: 6/2/2011 10:00 Amendment Legislative Office Building 306 "
347622,2011-08-22,"House Retained Bill - Subcommittee Work Session: 9/8/2011 9:00 Amendment Legislative Office Building 306 "
347622,2011-09-09,"House Retained Bill - Subcommittee Work Session: 9/20/2011 9:00 Amendment Legislative Office Building 305 "
347622,2011-09-27,"House Retained Bill - Executive Session: 10/11/2011 10:30 Amendment Legislative Office Building 306 "
347622,2011-10-21,"House Committee Report: Ought to Pass with Amendment #2580h(NT) for Jan 4 (Vote 12-0; Consent Calendar); House Calendar 70, PG.2204 "
347622,2011-10-21,"House Proposed Committee Amendment #2011-2580h (New Title); House Calendar 69, PG.2140 "
347622,2012-01-04,"House Amendment #2580h(NT) Adopted, Voice Vote; House Journal  7, PG.392-393 "
347622,2012-01-04,"House Ought to Pass with Amendment #2580h(NT): Motion Adopted Voice Vote; House Journal  7, PG.392-393 "
347622,2012-02-15,"Senate Introduced and Referred to Executive Departments and Administration; Senate Journal 6, Pg.144 "
347622,2012-02-29,"Senate Hearing: 3/8/12, Room 100, State House, 9:15 a.m.; Senate Calendar 9A "
347622,2012-03-15,"Senate Hearing: === RECESSED === 3/8/12, Room 100, State House, 9:15 a.m. "
347622,2012-03-15,"Senate Hearing: === RECONVENE === 3/22/12, Room 100, State House, 9:00 a.m.; Senate Calendar 11 "
347622,2012-03-22,"Senate Committee Report: Ought to Pass, 3/28/12; Senate Calendar 12 "
347622,2012-03-28,"Senate Ought to Pass: Motion Adopted, Voice Vote; OT3rdg; Senate Journal 8, Pg.328 "
347622,2012-04-11,"House Enrolled "
347622,2012-04-18,"Senate Enrolled; Senate Journal 11, Pg.383 "
347622,2012-04-24,"House Signed By Governor 04/23/2012; Effective 06/22/2012; Chapter 0010 "
347623,2011-01-21,"House Introduced 1/6/2011 and referred to Ways & Means; House Journal  11, PG. 187 "
347623,2011-02-01,"House Public Hearing: 2/10/2011 1:00 PM Legislative Office Building 202 "
347623,2011-02-10,"House Subcommittee Work Session: 2/15/2011 12:00 PM Legislative Office Building 202 "
347623,2011-02-16,"House ==CANCELLED== Subcommittee Work Session: 2/25/2011 9:30 Amendment Legislative Office Building 202 "
347623,2011-02-22,"House Subcommittee Work Session: 2/24/2011 9:30 Amendment Legislative Office Building 202 "
347623,2011-02-23,"House Subcommittee Work Session: 3/9/2011 9:30 Amendment Legislative Office Building 202 "
347623,2011-02-23,"House Executive Session: 3/9/2011 1:00 PM Legislative Office Building 202 ==TIME CHANGE (Orig 2:00 PM)== "
347623,2011-03-09,"House Retained in Committee; House Calendar 27, PG.826 "
347623,2011-06-02,"House Retained Bill - Full Committee Work Session: 6/7/2011 10:00 Amendment Legislative Office Building 202 "
347623,2011-08-04,"House Retained Bill - Subcommittee Work Session: 8/18/2011 10:30 Amendment Legislative Office Building 202 "
347623,2011-08-18,"House Retained Bill - Subcommittee Work Session: 9/1/2011 10:30 Amendment Legislative Office Building 202 "
347623,2011-10-03,"House Retained Bill - Executive Session: 10/26/2011 1:00 PM Legislative Office Building 202 ==RECESSED== "
347623,2011-10-20,"House Retained Bill - Rescheduled Executive Session 10/27/2011 1:00 PM Legislative Office Building 202 "
347623,2011-11-02,"House Committee Report: Inexpedient to Legislate for Jan 4 (Vote 21-0; Consent Calendar); House Calendar 70, PG.2211 "
347623,2012-01-04,"House Inexpedient to Legislate: Motion Adopted Voice Vote; House Journal  7, PG.428 "
347625,2011-01-21,"House Introduced 1/6/2011 and referred to Transportation; House Journal  11, PG. 187 "
347625,2011-02-08,"House Public Hearing: 2/22/2011 2:00 PM Legislative Office Building 203 "
347625,2011-02-23,"House Executive Session: 3/2/2011 Legislative Office Building 203 3:00 PM or immediately after House session "
347625,2011-03-02,"House Retained in Committee; House Calendar 27, PG.826 "
347625,2011-04-26,"House Retained Bill - Full Committee Work Session: 5/3/2011 11:00 Amendment Legislative Office Building 203 "
347625,2011-10-18,"House Retained Bill - Executive Session: 10/25/2011 8:30 Amendment Legislative Office Building 203 "
347625,2011-10-27,"House Majority Committee Report: Inexpedient to Legislate for Jan 4 (Vote 6-5; Regular Calendar); House Calendar 70, PG.2225 "
347625,2011-10-27,"House Minority Committee Report: Ought to Pass; House Calendar 70, PG.2225 "
347625,2012-01-11,"House Inexpedient to Legislate: Motion Adopted Voice Vote; House Journal  9, PG.542-543 "
347626,2011-01-21,"House Introduced 1/6/2011 and referred to Executive Departments & Administration; House Journal  11, PG. 187 "
347626,2011-02-02,"House ==CANCELLED== Public Hearing: 2/22/2011 11:00 Amendment Legislative Office Building 306 "
347626,2011-02-09,"House ==CANCELLED== Public Hearing: 2/14/2011 10:45 Amendment Legislative Office Building 306 "
347626,2011-02-10,"House Public Hearing: 2/17/2011 10:00 Amendment Legislative Office Building 306 "
347626,2011-02-23,"House Executive Session: 3/2/2011 2:00 PM or 45 mins after House session Legislative Office Building 306 "
347626,2011-03-02,"House Retained in Committee; House Calendar 27, PG.824 "
347626,2011-04-05,"House Retained Bill - Subcommittee Work Session: 4/14/2011 1:30 PM Legislative Office Building 306 "
347626,2011-05-03,"House Retained Bill - Subcommittee Work Session: 5/10/2011 11:00 Amendment Legislative Office Building 306 "
347626,2011-06-09,"House Retained Bill - Subcommittee Work Session: 6/28/2011 10:30 Amendment Legislative Office Building 306 "
347626,2011-08-24,"House Retained Bill - Subcommittee Work Session: 8/30/2011 10:45 Amendment Legislative Office Building 306 "
347626,2011-08-30,"House Retained Bill - Subcommittee Work Session: 9/20/2011 10:45 Amendment Legislative Office Building 306 "
347626,2011-09-27,"House Retained Bill - Subcommittee Work Session: 10/4/2011 4:00 PM Legislative Office Building 306 "
347626,2011-09-27,"House Retained Bill - Executive Session: 10/11/2011 10:30 Amendment Legislative Office Building 306 ==RECESSED== "
347626,2011-10-12,"House Retained Bill - Subcommittee Work Session: 10/20/2011 2:00 PM Legislative Office Building 306 "
347626,2011-10-12,"House ==RECONVENE== Retained Bill - Executive Session: 10/27/2011 2:30 PM Legislative Office Building 306 (If Necessary Continued 11/1/2011 10:30 Amendment Legislative Office Building 306) "
347626,2011-11-01,"House Committee Report: Ought to Pass with Amendment #2765h for Jan 4 (Vote 15-1; Consent Calendar); House Calendar 70, PG.2204 "
347626,2011-11-01,"House Proposed Committee Amendment #2011-2765h; House Calendar 69, PG.2140-2141 "
347626,2012-01-04,"House Amendment #2765h Adopted, Voice Vote; House Journal  7, PG.393 "
347626,2012-01-04,"House Ought to Pass with Amendment #2765h: Motion Adopted Voice Vote; House Journal  7, PG.393 "
347626,2012-02-15,"Senate Introduced and Referred to Executive Departments and Administration; Senate Journal 6, Pg.144 "
347626,2012-02-29,"Senate Hearing: 3/8/12, Room 100, State House, 9:30 a.m.; Senate Calendar 9A "
347626,2012-03-15,"Senate Hearing: === RECESSED === 3/8/12, Room 100, State House, 9:30 a.m. "
347626,2012-03-15,"Senate Hearing: === RECONVENE === 3/22/12, Room 100, State House, 9:10 a.m. "
347626,2012-03-22,"Senate Committee Report: Inexpedient to Legislate, 3/28/12; Senate Calendar 12 "
347626,2012-03-28,"Senate Inexpedient to Legislate, Motion Adopted, Voice Vote === BILL KILLED ===; Senate Journal 8, Pg.279 "
347628,2011-01-21,"House Introduced 1/6/2011 and referred to Special Committee on Public Employee Pensions Reform; House Journal  11, PG. 187 "
347628,2011-03-02,"House ==RESCHEDULED== Public Hearing: 3/4/2011 10:00 Amendment Representative's Hall (Orig Legislative Office Building 201-203) "
347628,2011-03-02,"House ==RESCHEDULED== Full Committee Work Session: 3/4/2011 2:00 PM Legislative Office Building 305-307 (Orig Legislative Office Building 201-203) "
347628,2011-03-02,"House Executive Session: 3/4/2011 3:00 PM Legislative Office Building 201-203 "
347628,2011-03-04,"House Retained in Committee; House Calendar 27, PG.825 "
347628,2011-09-21,"House Retained Bill - Executive Session: 9/29/2011 1:30 PM Legislative Office Building 305-307 "
347628,2011-10-04,"House Committee Report: Inexpedient to Legislate for Jan 4 (Vote 11-0; Consent Calendar); House Calendar 70, PG.2210 "
347628,2012-01-04,"House Inexpedient to Legislate: Motion Adopted Voice Vote; House Journal  7, PG.428 "
347629,2011-01-21,"House Introduced 1/6/2011 and Referred to Special Committee on Public Employee Pensions Reform; House Journal  11, PG. 187 "
347629,2011-02-02,"House ==CANCELLED== Public Hearing: 3/18/2011 11:00 Amendment Legislative Office Building 201-203 "
347629,2011-02-02,"House Public Hearing: 2/18/2011 11:00 Amendment RepresentativeS HALL ==ROOM CHANGE (Orig Legislative Office Building 201-203)== "
347629,2011-02-08,"House ==CANCELLED==Full Committee Work Session: 2/18/2011 2:00 PM Legislative Office Building 201-203 "
347629,2011-02-09,"House ==CANCELLED==Executive Session: 2/18/2011 3:00 PM Legislative Office Building 201-203 "
347629,2011-03-02,"House ==RESCHEDULED== Full Committee Work Session: 3/4/2011 2:00 PM Legislative Office Building 305-307 (Orig Legislative Office Building 201-203) "
347629,2011-03-02,"House Executive Session: 3/4/2011 3:00 PM Legislative Office Building 201-203 "
347629,2011-03-04,"House Retained in Committee; House Calendar 27, PG.825 "
347629,2011-09-21,"House Retained Bill - Executive Session: 9/29/2011 1:30 PM Legislative Office Building 305-307 "
347629,2011-10-04,"House Committee Report: Inexpedient to Legislate for Jan 4 (Vote 11-0; Consent Calendar); House Calendar 70, PG.2210 "
347629,2012-01-04,"House Inexpedient to Legislate: Motion Adopted Voice Vote; House Journal  7, PG.428 "
347631,2011-01-21,"House Introduced 1/6/2011 and Referred to Special Committee on Public Employee Pensions Reform; House Journal  11, PG. 187 "
347631,2011-02-02,"House Public Hearing: 2/25/2011 11:00 Amendment Legislative Office Building 201-203 "
347631,2011-03-02,"House ==RESCHEDULED== Full Committee Work Session: 3/4/2011 2:00 PM Legislative Office Building 305-307 (Orig Legislative Office Building 201-203) "
347631,2011-03-02,"House Executive Session: 3/4/2011 3:00 PM Legislative Office Building 201-203 "
347631,2011-03-04,"House Retained in Committee; House Calendar 27, PG.825 "
347631,2011-09-21,"House Retained Bill - Executive Session: 9/29/2011 1:30 PM Legislative Office Building 305-307 "
347631,2011-10-04,"House Committee Report: Inexpedient to Legislate for Jan 4 (Vote 11-0; Consent Calendar); House Calendar 70, PG.2210 "
347631,2012-01-04,"House Inexpedient to Legislate: Motion Adopted Voice Vote; House Journal  7, PG.428 "
347632,2011-01-21,"House Introduced 1/6/2011 and Referred to Election Law; House Journal  11, PG. 187 "
347632,2011-02-08,"House Public Hearing: 2/15/2011 4:00 PM Legislative Office Building 308 "
347632,2011-03-02,"House Executive Session: 3/9/2011 10:30 Amendment Legislative Office Building 308 "
347632,2011-03-10,"House Majority Committee Report: Ought to Pass for Mar 15 (Vote 14-2; Regular Calendar); House Calendar 22, PG.552-553 "
347632,2011-03-10,"House Minority Committee Report: Inexpedient to Legislate; House Calendar 22, PG.552-553 "
347632,2011-03-15,"House Floor Amendment #2011-0834h (Rep Jasper) Adopted, Voice Vote; House Journal  26, PG.797-798 "
347632,2011-03-15,"House Ought to Pass with Amendment #0834h: Motion Adopted Voice Vote; House Journal  26, PG.797-798 "
347632,2011-03-30,"Senate Introduced and Referred to Public and Municipal Affairs; Senate Journal 12, Pg.243 "
347632,2011-04-20,"Senate Hearing: 4/26/11, Room 101, Legislative Office Building, 10:20 a.m.; Senate Calendar 21 "
347632,2011-04-27,"Senate Committee Report: Rereferred to Committee, 5/4/11; Senate Calendar 22 "
347632,2011-05-04,"Senate Rereferred to Committee, Motion Adopted, Voice Vote; Senate Journal 15, Pg.307 "
347632,2012-01-12,"Senate Committee Report: Inexpedient to Legislate, 1/18/12; Senate Calendar 3 "
347632,2012-01-18,"Senate Inexpedient to Legislate, Motion Adopted, Voice Vote === BILL KILLED ===; Senate Journal 2, Pg.68 "
347634,2011-01-21,"House Introduced 1/6/2011 and Referred to Resources, Recreation and Development; House Journal  11, PG. 187 "
347634,2011-02-09,"House Public Hearing: 2/17/2011 10:00 Amendment Legislative Office Building 305 "
347634,2011-02-22,"House Executive Session: 3/1/2011 1:00 PM Legislative Office Building 305 "
347634,2011-03-01,"House Retained in Committee; House Calendar 27, PG.825 "
347634,2011-07-26,"House Retained Bill - Full Committee Work Session: 8/9/2011 10:00 Amendment Legislative Office Building 305 "
347634,2011-09-13,"House Retained Bill - Executive Session: 10/25/2011 10:00 Amendment Legislative Office Building 305 "
347634,2011-11-02,"House Committee Report: Inexpedient to Legislate for Jan 4 (Vote 15-0; Consent Calendar); House Calendar 70, PG.2208 "
347634,2012-01-04,"House Inexpedient to Legislate: Motion Adopted Voice Vote; House Journal  7, PG.421-422 "
347635,2011-01-21,"House Introduced 1/6/2011 and Referred to Criminal Justice and Public Safety; House Journal  11, PG. 188 "
347635,2011-02-01,"House Public Hearing: 2/10/2011 1:30 PM Legislative Office Building 204 "
347635,2011-02-16,"House Executive Session: 2/22/2011 10:00 Amendment Legislative Office Building 204 "
347635,2011-02-22,"House Committee Report: Ought to Pass for Mar 2 (Vote 13-1; Regular Calendar); House Calendar 18, PG.391 "
347635,2011-03-02,"House Recommit (Rep Swinford): Motion Adopted Voice Vote; House Journal  25, PG.679 "
347635,2011-03-02,"House Executive Session: 3/9/2011 10:00 Amendment Legislative Office Building 204 "
347635,2011-03-09,"House Retained in Committee; House Calendar 27, PG.823 "
347635,2011-06-15,"House Retained Bill - Subcommittee Work Session: 8/2/2011 9:00 Amendment Legislative Office Building 204 "
347635,2011-09-27,"House Retained Bill - Executive Session: 10/20/2011 10:00 Amendment Legislative Office Building 204 "
347635,2011-10-25,"House Committee Report: Ought to Pass for Jan 4 (Vote 14-3; Regular Calendar); House Calendar 70, PG.2215 "
347635,2012-01-05,"House Laid on Table (Rep Swinford): Motion Adopted Voice Vote; House Journal  8, PG.463-464 "
347637,2011-01-21,"House Introduced 1/6/2011 and Referred to Executive Departments and Administration; House Journal  11, PG. 188 "
347637,2011-02-02,"House ==CANCELLED== Public Hearing: 3/3/2011 1:30 PM Legislative Office Building 306 "
347637,2011-02-02,"House Public Hearing: 3/1/2011 1:30 PM Legislative Office Building 306 "
347637,2011-03-02,"House Executive Session: 3/9/2011 1:00 PM Legislative Office Building 306 "
347637,2011-03-09,"House Retained in Committee; House Calendar 27, PG.824 "
347637,2011-06-01,"House Retained Bill - Subcommittee Work Session: 6/15/2011 10:00 Amendment Legislative Office Building 306 "
347637,2011-06-01,"House ==CANCELLED== Retained Bill - Subcommittee Work Session: 6/16/2011 10:00 Amendment Legislative Office Building 306 "
347637,2011-06-15,"House ==CANCELLED== Retained Bill - Subcommittee Work Session: 6/22/2011 1:00 PM Legislative Office Building 306 "
347637,2011-06-16,"House Retained Bill - Subcommittee Work Session: 6/23/2011 1:00 PM Legislative Office Building 306 "
347637,2011-07-27,"House Retained Bill - Subcommittee Work Session: 8/2/2011 9:30 Amendment Legislative Office Building 307 "
347637,2011-07-27,"House Retained Bill - Subcommittee Work Session: 8/9/2011 9:30 Amendment Legislative Office Building 307 "
347637,2011-08-10,"House Retained Bill - Subcommittee Work Session: 8/16/2011 10:30 Amendment Legislative Office Building 306 "
347637,2011-08-10,"House Retained Bill - Subcommittee Work Session: 8/23/2011 11:30 Amendment Legislative Office Building 306 "
347637,2011-08-23,"House Retained Bill - Subcommittee Work Session: 9/1/2011 10:00 Amendment Legislative Office Building 306 "
347637,2011-09-07,"House Retained Bill - Subcommittee Work Session: 9/14/2011 10:00 Amendment Legislative Office Building 306 "
347637,2011-09-14,"House Retained Bill - Subcommittee Work Session: 9/21/2011 10:15 Amendment Legislative Office Building 306 "
347637,2011-09-21,"House Retained Bill - Subcommittee Work Session: 9/28/2011 10:15 Amendment Legislative Office Building 306 "
347637,2011-09-27,"House Retained Bill - Subcommittee Work Session: 10/6/2011 10:30 Amendment Legislative Office Building 306 "
347637,2011-09-27,"House Retained Bill - Executive Session: 10/27/2011 10:00 Amendment Legislative Office Building 306 (If Necessary Continued 11/1/2011 10:30 Amendment Legislative Office Building 306) "
347637,2011-11-01,"House Committee Report: Refer to Interim Study for Jan 4 (Vote 14-1; Regular Calendar); House Calendar 70, PG.2218-2219 "
347637,2012-01-05,"House Refer to Interim Study: Motion Adopted Voice Vote; House Journal  8, PG.501 "
347637,2012-06-07,"House Referred to Executive Departments and Administration for Interim Study; House Calendar 45, PG.2433 "
347637,2012-09-18,"House Interim Study - Executive Session: 10/18/2012 1:30 PM Legislative Office Building 306 "
347638,2011-01-21,"House Introduced 1/6/2011 and Referred to Health, Human Services and Elderly Affairs; House Journal  11, PG. 188  "
347638,2011-02-02,"House ===CANCELLED=== Work Session: 2/10/2011 10:00 Amendment Legislative Office Building 205 "
347638,2011-02-02,"House Public Hearing: 2/10/2011 10:00 Amendment Legislative Office Building 205 "
347638,2011-02-08,"House Executive Session: 2/17/2011 10:00 Amendment Legislative Office Building 205 "
347638,2011-02-17,"House Committee Report: Ought to Pass with Amendment #0291h for Feb 23 (Vote 16-0; Consent Calendar); House Calendar 15, PG.270 "
347638,2011-02-17,"House Proposed Committee Amendment #2011-0291h; House Calendar 15, PG.304 "
347638,2011-02-23,"House Removed from Consent Calendar (Reps O'Brien and Tucker); House Journal  21, PG.456 "
347638,2011-02-23,"House Amendment #0291h Adopted, Voice Vote; House Journal  21, PG.518 "
347638,2011-02-23,"House Ought to Pass with Amendment #0291h: Motion Adopted Voice Vote; House Journal  21, PG.518 "
347638,2011-02-23,"House Referred to Finance; House Journal  21, PG.518 "
347638,2011-03-02,"House Division III Work Session: 3/14/2011 9:00 Amendment Legislative Office Building 209 "
347638,2011-03-03,"House Executive Session: 3/17/2011 Legislative Office Building 210-211 1:00 PM or Immediately Following House Session "
347638,2011-03-22,"House Committee Report: Ought to Pass for Mar 30 (Vote 24-0; Regular Calendar); House Calendar 27, PG.818 "
347638,2011-03-30,"House Ought to Pass: Motion Adopted Voice Vote; House Journal  34, PG.1098 "
347638,2011-03-30,"Senate Introduced and Referred to Health and Human Services; Senate Journal 12, Pg.244 "
347638,2011-04-14,"Senate Hearing: 4/21/11, Room 102, Legislative Office Building, 1:30 p.m.; Senate Calendar 20 "
347638,2011-05-05,"Senate Committee Report: Rereferred to Committee, 5/11/11; Senate Calendar 23 "
347638,2011-05-11,"Senate Rereferred to Committee, Motion Adopted, Voice Vote; Senate Journal 16, Pg.331 "
347638,2012-01-12,"Senate Committee Report: Ought to Pass with Amendment #2011-2648s; New Title, 1/18/12; Senate Calendar 3 "
347638,2012-01-18,"Senate Chair Ruled Non-Germane Amendment; Senate Journal 2, Pg.57 "
347638,2012-01-18,"Senate Sen. Bradley Moved to Suspend Rule 3-7 to Allow Non-Germane Amendment 2648s, 2/3 necessary, Motion Adopted, Voice Vote; Senate Journal 2, Pg.57 "
347638,2012-01-18,"Senate Committee Amendment 2648s, New Title, Amendment Adopted, Voice Vote; Senate Journal 2, Pg.57 "
347638,2012-01-18,"Senate Ought to Pass with Amendment 2648s, New Title, Motion Adopted, Voice Vote; OT3rdg; Senate Journal 2, Pg.62 "
347638,2012-05-15,"House House Concurs with Senate Amendment #2648s(NT) (Rep Reagan): Motion Adopted Voice Vote; House Journal  43, PG.2280 "
347638,2012-05-17,"House Enrolled; House Journal  46, PG.2493 "
347638,2012-05-23,"Senate Enrolled "
347638,2012-06-11,"House Signed By Governor 06/07/2012; Effective 06/07/2012; Chapter 0162 "
347640,2011-01-21,"House Introduced 1/6/2011 and Referred to Executive Departments and Administration; House Journal  11, PG. 188 "
347640,2011-02-02,"House ==CANCELLED== Public Hearing: 3/3/2011 11:00 Amendment Legislative Office Building 306 "
347640,2011-02-02,"House Public Hearing: 3/1/2011 11:00 Amendment Legislative Office Building 306 "
347640,2011-03-02,"House Executive Session: 3/9/2011 1:00 PM Legislative Office Building 306 "
347640,2011-03-09,"House Retained in Committee; House Calendar 27, PG.824 "
347640,2011-06-01,"House Retained Bill - Subcommittee Work Session: 6/15/2011 10:00 Amendment Legislative Office Building 306 "
347640,2011-06-01,"House ==CANCELLED== Retained Bill - Subcommittee Work Session: 6/16/2011 10:00 Amendment Legislative Office Building 306 "
347640,2011-06-15,"House ==CANCELLED== Retained Bill - Subcommittee Work Session: 6/30/2011 10:00 Amendment Legislative Office Building 306 "
347640,2011-06-22,"House Retained Bill - Subcommittee Work Session: 6/28/2011 12:00 PM Legislative Office Building 306 "
347640,2011-07-27,"House Retained Bill - Subcommittee Work Session: 8/2/2011 10:30 Amendment Legislative Office Building 307 "
347640,2011-07-27,"House Retained Bill - Subcommittee Work Session: 8/9/2011 11:30 Amendment Legislative Office Building 307 "
347640,2011-08-10,"House Retained Bill - Subcommittee Work Session: 8/16/2011 11:30 Amendment Legislative Office Building 306 "
347640,2011-08-10,"House Retained Bill - Subcommittee Work Session: 8/23/2011 10:00 Amendment Legislative Office Building 306 "
347640,2011-09-27,"House Retained Bill - Executive Session: 10/11/2011 10:30 Amendment Legislative Office Building 306 "
347640,2011-10-21,"House Committee Report: Inexpedient to Legislate for Jan 4 (Vote 12-0; Consent Calendar); House Calendar 70, PG.2205 "
347640,2012-01-04,"House Inexpedient to Legislate: Motion Adopted Voice Vote; House Journal  7, PG.393-394 "
347641,2011-01-21,"House Introduced 1/6/2011 and referred to Criminal Justice & Public Safety; House Journal  11, PG. 188 "
347641,2011-02-16,"House Public Hearing: 3/1/2011 10:45 Amendment Legislative Office Building 204 "
347641,2011-03-02,"House Executive Session: 3/9/2011 10:00 Amendment Legislative Office Building 204 "
347641,2011-03-09,"House Retained in Committee; House Calendar 27, PG.823 "
347641,2011-08-10,"House Retained Bill - Subcommittee Work Session: 8/18/2011 10:00 Amendment Legislative Office Building 204 "
347641,2011-08-18,"House Retained Bill - Subcommittee Work Session: 9/1/2011 10:00 Amendment Legislative Office Building 204 "
347641,2011-08-18,"House Retained Bill - Subcommittee Work Session: 9/6/2011 10:00 Amendment Legislative Office Building 204 "
347641,2011-09-01,"House ==CANCELLED== Retained Bill - Subcommittee Work Session: 9/7/2011 1:00 PM Legislative Office Building 204 "
347641,2011-09-06,"House Retained Bill - Subcommittee Work Session: 9/14/2011 10:00 Amendment Legislative Office Building 204 "
347641,2011-09-27,"House Retained Bill - Executive Session: 10/20/2011 10:00 Amendment Legislative Office Building 204 "
347641,2011-10-25,"House Majority Committee Report: Ought to Pass with Amendment #2577h for Jan 4 (Vote 15-2; Regular Calendar); House Calendar 70, PG.2215 "
347641,2011-10-25,"House Proposed Majority Committee Amendment #2011-2577h; House Calendar 69, PG.2141 "
347641,2011-10-25,"House Minority Committee Report: Inexpedient to Legislate; House Calendar 70, PG.2215 "
347641,2012-01-05,"House Amendment #2577h Adopted, Voice Vote; House Journal  8, PG.464 "
347641,2012-01-05,"House Ought to Pass with Amendment #2577h: Motion Adopted Regular Calendar 259-48; House Journal  8, PG.464-466 "
347641,2012-02-08,"Senate Introduced and Referred to Judiciary; Senate Journal 5, Pg.122 "
347641,2012-03-22,"Senate Hearing: 4/5/12, Room 101, Legislative Office Building, 1:15 p.m.; Senate Calendar 12 "
347641,2012-04-11,"Senate Committee Report: Ought to Pass with Amendment #2012-1549s, 4/18/12; Senate Calendar 15 "
347641,2012-04-18,"Senate Committee Amendment 1549s; Amendment Adopted, Voice Vote; Senate Journal 10, Pg.369 "
347641,2012-04-18,"Senate Ought to Pass with Amendment 1549s, Motion Adopted, Voice Vote; OT3rdg; Senate Journal 10, Pg.379 "
347641,2012-05-30,"House House Concurs with Senate Amendment #1549s (Rep Swinford): Motion Adopted Division Vote 277-30; House Journal  47, PG.2501 "
347641,2012-06-06,"Senate Enrolled "
347641,2012-06-06,"House Enrolled; House Journal  51, PG.2609 "
347641,2012-06-18,"House Signed By Governor 06/13/2012; Effective 01/01/2013; Chapter 0201 "
347643,2011-01-24,"House Introduced 1/6/2011 and Referred to Health, Human Services and Elderly Affairs; House Journal  11, PG. 188 "
347643,2011-02-02,"House ===CANCELLED=== Work Session: 2/17/2011 10:00 Amendment Legislative Office Building 205 "
347643,2011-02-08,"House ===CANCELLED=== Public Hearing: 2/17/2011 10:00 Amendment Legislative Office Building 205 "
347643,2011-02-08,"House Public Hearing: 3/3/2011 10:00 Amendment Legislative Office Building 205 "
347643,2011-03-01,"House Executive Session: 3/9/2011 10:00 Amendment Legislative Office Building 205 "
347643,2011-03-09,"House Retained in Committee; House Calendar 27, PG.824 "
347643,2011-06-01,"House Retained Bill - Subcommittee Work Session: 6/9/2011 10:30 Amendment Legislative Office Building 205 "
347643,2011-09-22,"House Retained Bill - Subcommittee Work Session: 10/6/2011 10:30 Amendment Legislative Office Building 205 "
347643,2011-10-03,"House ==CANCELLED== Retained Bill - Executive Session: 10/12/2011 Legislative Office Building 205 1:00 PM or Immediately Following House Session "
347643,2011-10-12,"House Executive Session: 10/20/2011 2:00 PM Legislative Office Building 205 "
347643,2011-10-27,"House Committee Report: Refer to Interim Study for Jan 4 (Vote 17-0; Consent Calendar); House Calendar 70, PG.2205 "
347643,2012-01-04,"House Refer to Interim Study: Motion Adopted Voice Vote; House Journal  7, PG.410 "
347643,2012-06-07,"House Referred to Health, Human Services and Elderly Affairs for Interim Study; House Calendar 45, PG.2433 "
347644,2011-01-24,"House Introduced 1/6/2011 and Referred to Labor, Industrial and Rehabilitative Services; House Journal  11, PG. 188 "
347644,2011-02-09,"House ==CANCELLED== Public Hearing: 2/22/2011 1:00 PM Legislative Office Building 307 "
347644,2011-02-10,"House Public Hearing: 3/1/2011 11:00 Amendment Legislative Office Building 307 "
347644,2011-02-23,"House Executive Session: 3/1/2011 1:00 PM Legislative Office Building 307 "
347644,2011-03-01,"House Retained in Committee; House Calendar 27, PG.824 "
347644,2011-06-01,"House Retained Bill - Full Committee Work Session: 6/8/2011 10:00 Amendment Legislative Office Building 307 "
347644,2011-09-12,"House ==CANCELLED== Retained Bill - Full Committee Work Session: 9/20/2011 1:00 PM Legislative Office Building 307 "
347644,2011-09-13,"House Retained Bill - Full Committee Work Session: 9/21/2011 1:00 PM Legislative Office Building 307 "
347644,2011-09-27,"House Retained Bill - Full Committee Work Session: 10/4/2011 1:00 PM Legislative Office Building 307 "
347644,2011-09-27,"House Retained Bill - Executive Session: 10/18/2011 1:00 PM Legislative Office Building 307 "
347644,2011-10-21,"House Majority Committee Report: Ought to Pass for Jan 4 (Vote 8-7; Regular Calendar); House Calendar 70, PG.2223 "
347644,2011-10-21,"House Minority Committee Report: Inexpedient to Legislate; House Calendar 70, PG.2223 "
347644,2012-01-11,"House Floor Amendment #2012-0111h (Rep Infantine) Adopted, Regular Calendar 225-119; House Journal  9, PG.530-533 "
347644,2012-01-11,"House Ought to Pass with Amendment #0111h: Motion Failed Regular Calendar 169-180; House Journal  9, PG.533-535 "
347644,2012-01-11,"House Laid on Table (Rep Bettencourt): Motion Adopted Division Vote 182-168; House Journal  9, PG.535 "
347646,2011-01-21,"House Introduced 1/6/2011 and Referred to Children and Family Law; House Journal  11, PG. 189 "
347646,2011-02-23,"House Public Hearing: 3/3/2011 11:30 Amendment Legislative Office Building 206 "
347646,2011-03-01,"House Executive Session: 3/7/2011 10:00 Amendment Legislative Office Building 206 "
347646,2011-03-07,"House Retained in Committee; House Calendar 27, PG.822 "
347646,2011-04-20,"House ==CANCELLED== Retained Bill - Subcommittee Work Session: 4/27/2011 2:00 PM Legislative Office Building 206 "
347646,2011-04-27,"House Retained Bill - Subcommittee Work Session: 5/5/2011 10:00 Amendment Legislative Office Building 206 "
347646,2011-05-05,"House Retained Bill - Subcommittee Work Session: 5/19/2011 10:00 Amendment Legislative Office Building 206 "
347646,2011-09-06,"House Retained Bill - Full Committee Work Session: 9/14/2011 11:00 Amendment Legislative Office Building 206 "
347646,2011-09-14,"House Retained Bill - Subcommittee Work Session: 9/22/2011 10:00 Amendment Legislative Office Building 206 "
347646,2011-09-30,"House Retained Bill - Executive Session: 10/26/2011 10:00 Amendment Legislative Office Building 206 ==If Necessary Continued 10/27/2011 10:00 Amendment Legislative Office Building 206== "
347646,2011-11-02,"House Committee Report: Refer to Interim Study for Jan 4 (Vote 16-0; Consent Calendar); House Calendar 70, PG.2198-2199 "
347646,2012-01-04,"House Refer to Interim Study: Motion Adopted Voice Vote; House Journal  7, PG.368 "
347646,2012-06-07,"House Referred to Children and Family Law for Interim Study; House Calendar 45, PG.2432 "
347646,2012-09-26,"House Interim Study - Subcommittee Work Session: 10/9/2012 10:00 Amendment Legislative Office Building 206 "
347646,2012-10-01,"House Interim Study - Executive Session: 10/23/2012 10:00 Amendment Legislative Office Building 206 "
347647,2011-01-21,"House Introduced 1/6/2011 and Referred to Executive Departments and Administration; House Journal  11, PG. 189 "
347647,2011-02-09,"House Public Hearing: 3/3/2011 10:15 Amendment Legislative Office Building 306 "
347647,2011-03-03,"House Subcommittee Work Session: 3/9/2011 9:00 Amendment Legislative Office Building 306 "
347647,2011-03-03,"House Executive Session: 3/9/2011 1:00 PM Legislative Office Building 306 "
347647,2011-03-10,"House Committee Report: Ought to Pass with Amendment #0606h for Mar 15 (Vote 13-0; Consent Calendar); House Calendar 22, PG.531 "
347647,2011-03-10,"House Proposed Committee Amendment #2011-0606h; House Calendar 23, PG.639 "
347647,2011-03-15,"House Amendment #0606h Adopted, Voice Vote; House Journal  26, PG.714 "
347647,2011-03-15,"House Ought to Pass with Amendment #0606h: Motion Adopted Voice Vote; House Journal  26, PG.714 "
347647,2011-03-23,"Senate Introduced and Referred to Executive Departments and Administration; Senate Journal 11, Pg.193 "
347647,2011-03-31,"Senate Hearing: 4/7/11, Room 100, State House, 9:40 a.m.; Senate Calendar 18 "
347647,2011-04-28,"Senate Committee Report: Ought to Pass, 5/4/11; Senate Calendar 22 "
347647,2011-05-04,"Senate Ought to Pass, Motion Adopted, Voice Vote; Refer to Finance Rule 4-3; Senate Journal 15, Pg.304 "
347647,2011-05-19,"Senate Committee Report: Rereferred to Committee, 5/25/11; Senate Calendar 25 "
347647,2011-05-25,"Senate Rereferred to Committee, Motion Adopted, Voice Vote; Senate Journal 18, Pg.384 "
347647,2012-01-12,"Senate Committee Report: Ought to Pass with Amendment #2012-0012s, New Title, 1/1/13; Senate Calendar 3 "
347647,2012-01-18,"Senate Chair Ruled Non-Germane Amendment; Senate Journal 2, Pg.56 "
347647,2012-01-18,"Senate Sen. D'Allesandro Moved to Suspend Rule 3-7 to Allow Non-Germane Amendment 0012s, 2/3 necessary, Motion Adopted, Voice Vote; Senate Journal 2, Pg.56 "
347647,2012-01-18,"Senate Committee Amendment 0012s, New Title, Amendment Adopted, Voice Vote; Senate Journal 2, Pg.56 "
347647,2012-01-18,"Senate Ought to Pass with Amendment 0012s, New Title, Motion Adopted, Voice Vote; OT3rdg; Senate Journal 2, Pg.57 "
347647,2012-02-01,"House Non-Concur with Senate Amendment, Request C of C (Rep C.McGuire): Motion Adopted Division Vote 274-47; House Journal  13, PG.739 "
347647,2012-02-01,"House Speaker Appoints: Reps Bowers, Moran, Cebrowski, and Winter; House Journal  13, PG.739 "
347647,2012-05-23,"Senate Sen. Carson Refuse to Accede to House Request For C of C, Motion Adopted, Voice Vote "
347649,2011-01-21,"House Introduced 1/6/2011 and Referred to Judiciary; House Journal  11, PG. 189  "
347649,2011-02-01,"House Public Hearing: 2/8/2011 1:00 PM Legislative Office Building 208 "
347649,2011-02-16,"House Executive Session: 3/1/2011 1:00 PM Legislative Office Building 208 "
347649,2011-03-01,"House Retained in Committee; House Calendar 27, PG.824 "
347649,2011-07-06,"House Retained Bill - Subcommittee Work Session: 8/23/2011 9:00 Amendment Legislative Office Building 208 "
347649,2011-07-06,"House Retained Bill - Subcommittee Work Session: 8/25/2011 9:00 Amendment Legislative Office Building 208 "
347649,2011-08-25,"House Retained Bill - Subcommittee Work Session: 9/27/2011 9:00 Amendment Legislative Office Building 208 "
347649,2011-09-14,"House Retained Bill - Executive Session: 10/25/2011 11:00 Amendment Legislative Office Building 208 "
347649,2011-11-02,"House Committee Report: Ought to Pass with Amendment #2638h for Jan 4 (Vote 12-4; Regular Calendar); House Calendar 70, PG.2223 "
347649,2011-11-02,"House Proposed Committee Amendment #2011-2638h; House Calendar 69, PG.2141-2142 "
347649,2012-01-11,"House Laid on the Table (Rep G.Richardson): Motion Failed Voice Vote; House Journal  9, PG.528-530 "
347649,2012-01-11,"House Special Order to Regular Place on Jan 18 Calendar (Rep Rowe): Motion Adopted Voice Vote; House Journal  9, PG.530 "
347649,2012-01-18,"House Amendment #2638h Failed, Voice Vote; House Journal  10, PG.599-600 "
347649,2012-01-18,"House Floor Amendment #2012-0254h (Rep Kurk) Adopted, Regular Calendar 260-98; House Journal  10, PG.600-603 "
347649,2012-01-18,"House Ought to Pass with Amendment #0254h: Motion Adopted Voice Vote; House Journal  10, PG.599-603 "
347649,2012-02-08,"Senate Introduced and Referred to Judiciary; Senate Journal 5, Pg.122 "
347649,2012-03-14,"Senate Hearing: 3/29/12, Room 101, Legislative Office Building, 1:00 p.m.; Senate Calendar 11 "
347649,2012-04-12,"Senate Committee Report: Ought to Pass with Amendment #2012-1601s, New Title, 4/18/12; Senate Calendar 15 "
347649,2012-04-18,"Senate Committee Amendment 1601s, New Title, Amendment Adopted, Voice Vote; Senate Journal 10, Pg.371 "
347649,2012-04-18,"Senate Sen. Forsythe Floor Amendment #2012-1726s, Amendment Adopted, Voice Vote; Senate Journal 10, Pg.371 "
347649,2012-04-18,"Senate Ought to Pass with Amendment 1601s, New Title, 1726s, Motion Adopted, Voice Vote; OT3rdg; Senate Journal 10, Pg.379 "
347649,2012-05-30,"House House Concurs with Senate Amendment #1601s(NT) and #1726s (Rep Rowe): Motion Adopted Voice Vote; House Journal  47, PG.2502 "
347649,2012-06-06,"Senate Enrolled "
347649,2012-06-06,"House Enrolled; House Journal  51, PG.2609 "
347649,2012-06-18,"House Signed By Governor 06/13/2012; Effective 06/13/2012; Chapter 0202 "
347650,2011-01-24,"House Introduced 1/6/2011 and Referred to Election Law; House Journal  11, PG. 189 "
347650,2011-02-08,"House Public Hearing: 2/22/2011 2:00 PM Legislative Office Building 308 ==Executive Session to Follow== "
347650,2011-02-22,"House Retained in Committee; House Calendar 27, PG.823 "
347650,2011-05-10,"House Retained Bill - Subcommittee Work Session: 5/17/2011 11:30 Amendment Legislative Office Building 308 "
347650,2011-09-01,"House Retained Bill - Subcommittee Work Session: 9/20/2011 8:30 Amendment Legislative Office Building 303 "
347650,2011-09-01,"House Retained Bill - Subcommittee Work Session: 9/21/2011 8:30 Amendment Legislative Office Building 303 "
347650,2011-09-20,"House ==CANCELLED== Retained Bill - Subcommittee Work Session: 9/27/2011 8:30 Amendment Legislative Office Building 308 "
347650,2011-09-20,"House Retained Bill - Subcommittee Work Session: 9/28/2011 9:00 Amendment Legislative Office Building 308 ==TIME CHANGE (Orig 8:30 Amendment)== "
347650,2011-10-19,"House Retained Bill - Executive Session: 10/27/2011 Legislative Office Building 308 1:00 PM or Immediately Following Public Hearing "
347650,2011-11-02,"House Committee Report: Inexpedient to Legislate for Jan 4 (Vote 19-0; Consent Calendar); House Calendar 70, PG.2203 "
347650,2012-01-04,"House Inexpedient to Legislate: Motion Adopted Voice Vote; House Journal  7, PG.382 "
347652,2011-01-24,"House Introduced 1/6/2011 and Referred to Executive Departments and Administration; House Journal  11, PG. 189 "
347652,2011-02-09,"House Public Hearing: 2/22/2011 11:00 Amendment Legislative Office Building 306 ==TIME CHANGE (Orig 1:00 PM)== "
347652,2011-02-16,"House Subcommittee Work Session: 2/24/2011 2:00 PM Legislative Office Building 306 "
347652,2011-02-23,"House Executive Session: 3/2/2011 2:00 PM or 45 mins after House session Legislative Office Building 306 "
347652,2011-03-02,"House Retained in Committee; House Calendar 27, PG.824 "
347652,2011-06-01,"House Retained Bill - Subcommittee Work Session: 6/15/2011 10:00 Amendment Legislative Office Building 306 "
347652,2011-06-01,"House ==CANCELLED== Retained Bill - Subcommittee Work Session: 6/16/2011 10:00 Amendment Legislative Office Building 306 "
347652,2011-08-10,"House Retained Bill - Subcommittee Work Session: 8/16/2011 12:30 PM Legislative Office Building 306 "
347652,2011-08-10,"House Retained Bill - Subcommittee Work Session: 8/23/2011 10:30 Amendment Legislative Office Building 306 "
347652,2011-08-18,"House Public Hearing on Proposed Amendment #2011-2547h(NT): 9/27/2011 1:00 PM Legislative Office Building 306 "
347652,2011-09-27,"House Retained Bill - Subcommittee Work Session: 10/4/2011 10:30 Amendment Legislative Office Building 301 "
347652,2011-10-04,"House Retained Bill - Subcommittee Work Session: 10/6/2011 11:00 Amendment Legislative Office Building 306 "
347652,2011-10-04,"House Retained Bill - Executive Session: 10/27/2011 10:00 Amendment Legislative Office Building 306 (If Necessary Continued 11/1/2011 10:30 Amendment Legislative Office Building 306) "
347652,2011-11-01,"House Committee Report: Ought to Pass with Amendment #2757h(NT) for Jan 4 (Vote 14-0; Consent Calendar); House Calendar 70, PG.2205 "
347652,2011-11-01,"House Proposed Committee Amendment #2011-2757h (New Title); House Calendar 69, PG.2142-2150 "
347652,2012-01-04,"House Amendment #2757h(NT) Adopted, Voice Vote; House Journal  7, PG.394-401 "
347652,2012-01-04,"House Ought to Pass with Amendment #2757h(NT): Motion Adopted Voice Vote; House Journal  7, PG.394-401 "
347652,2012-02-15,"Senate Introduced and Referred to Executive Departments and Administration; Senate Journal 6, Pg.144 "
347652,2012-03-15,"Senate Hearing: 3/22/12, Room 100, State House, 9:20 a.m.; Senate Calendar 11 "
347652,2012-04-12,"Senate Committee Report: Referred to Interim Study, 4/18/12; Senate Calendar 15 "
347652,2012-04-18,"Senate Refer to Interim Study, Motion Adopted, Voice Vote; Senate Journal 10, Pg.364 "
347653,2011-01-24,"House Introduced 1/6/2011 and Referred to Ways and Means; House Journal  11, PG. 189 "
347653,2011-02-09,"House Public Hearing: 2/17/2011 1:00 PM Legislative Office Building 202 ==RECESSED== "
347653,2011-02-10,"House Continued Public Hearing: 2/22/2011 3:30 PM Legislative Office Building 202 "
347653,2011-02-23,"House Executive Session: 2/24/2011 12:30 PM Legislative Office Building 202 "
347653,2011-02-28,"House Retained in Committee; House Calendar 27, PG.826 "
347653,2011-06-02,"House Retained Bill - Full Committee Work Session: 6/7/2011 10:00 Amendment Legislative Office Building 202 "
347653,2011-08-04,"House Retained Bill - Subcommittee Work Session: 8/18/2011 11:00 Amendment Legislative Office Building 202 "
347653,2011-08-18,"House Retained Bill - Subcommittee Work Session: 9/1/2011 11:00 Amendment Legislative Office Building 202 "
347653,2011-09-01,"House Retained Bill - Subcommittee Work Session: 9/8/2011 10:30 Amendment Legislative Office Building 202 "
347653,2011-10-03,"House Retained Bill - Executive Session: 10/26/2011 1:00 PM Legislative Office Building 202 ==RECESSED== "
347653,2011-10-20,"House Retained Bill - Rescheduled Executive Session 10/27/2011 1:00 PM Legislative Office Building 202 "
347653,2011-11-02,"House Committee Report: Ought to Pass with Amendment #2579h(NT) for Jan 4 (Vote 21-0; Consent Calendar); House Calendar 70, PG.2211 "
347653,2011-11-02,"House Proposed Committee Amendment #2011-2579h (New Title); House Calendar 69, PG.2150 "
347653,2012-01-04,"House Amendment #2579h(NT) Adopted, Voice Vote; House Journal  7, PG.428-429 "
347653,2012-01-04,"House Ought to Pass with Amendment #2579h(NT): Motion Adopted Voice Vote; House Journal  7, PG.428-429 "
347653,2012-02-08,"Senate Introduced and Referred to Ways & Means; Senate Journal 5, Pg.122 "
347653,2012-03-06,"Senate Hearing: 3/13/12, Room 100, State House, 2:00 p.m.; Senate Calendar 10 "
347653,2012-03-14,"Senate Committee Report: Ought to Pass, 3/21/12; Senate Calendar 11 "
347653,2012-03-21,"Senate Ought to Pass Not Voted On "
347653,2012-03-21,"Senate Sen. Rausch Moved Laid On Table, Motion Adopted, Voice Vote; Senate Journal 7, Pg. 254 "
347653,2012-05-16,"Senate Sen. Odell Moved Remove HB 518 From Table, Motion Adopted, Voice Vote "
347653,2012-05-16,"Senate Ought to Pass: Regular Calendar 24Y-0N, Motion Adopted; OT3rdg "
347653,2012-05-23,"Senate Enrolled "
347653,2012-05-30,"House Enrolled [Recessed from 5/17/2012 Session]; House Journal  46, PG.2495 "
347653,2012-06-07,"House Signed By Governor 06/05/2012; Effective 08/04/2012; Chapter 0116 "
347655,2011-01-24,"House Introduced 1/6/2011 and Referred to Legislative Administration "
347655,2011-02-09,"House Public Hearing: 2/22/2011 10:30 Amendment Legislative Office Building 104 "
347655,2011-02-22,"House Subcommittee Work Session: 2/24/2011 3:00 PM Legislative Office Building 104 "
347655,2011-02-23,"House Executive Session: 3/1/2011 10:00 Amendment Legislative Office Building 104 "
347655,2011-03-01,"House Committee Report: Ought to Pass for Mar 15 (Vote 12-1; Consent Calendar); House Calendar 22, PG.536 "
347655,2011-03-15,"House Ought to Pass: Motion Adopted Voice Vote; House Journal  26, PG.729 "
347655,2011-04-20,"Senate Introduced and Referred to Finance; Senate Journal 14, Pg.272 "
347655,2011-04-28,"Senate Hearing: 5/5/11, Room 103, State House, 1:00 p.m.; Senate Calendar 22 "
347655,2011-05-19,"Senate Committee Report: Rereferred to Committee, 5/25/11; Senate Calendar 25 "
347655,2011-05-25,"Senate Rereferred to Committee, Motion Adopted, Voice Vote; Senate Journal 18, Pg.384 "
347655,2012-01-12,"Senate Committee Report: Referred to Interim Study, 1/18/12; Senate Calendar 3 "
347655,2012-01-18,"Senate Refer to Interim Study, Motion Adopted, Voice Vote; Senate Journal 2, Pg.57 "
347656,2011-01-24,"House Introduced 1/6/2011 and Referred to Judiciary; House Journal  11, PG. 190 "
347656,2011-02-16,"House Public Hearing: 2/24/2011 11:00 Amendment Legislative Office Building 208 ==Executive Session to Follow== "
347656,2011-02-28,"House Retained in Committee; House Calendar 27, PG.824 "
347656,2011-09-15,"House Retained Bill - Subcommittee Work Session: 10/4/2011 11:00 Amendment Legislative Office Building 208 "
347656,2011-09-15,"House Retained Bill - Executive Session: 10/25/2011 11:00 Amendment Legislative Office Building 208 "
347656,2011-11-02,"House Committee Report: Inexpedient to Legislate for Jan 4 (Vote 16-0; Consent Calendar); House Calendar 70, PG.2206 "
347656,2012-01-04,"House Inexpedient to Legislate: Motion Adopted Voice Vote; House Journal  7, PG.412 "
347658,2011-01-24,"House Introduced 1/6/2011 and Referred to Education; House Journal  11, PG. 190 "
347658,2011-02-09,"House Public Hearing: 2/15/2011 3:30 PM Legislative Office Building 207 "
347658,2011-02-18,"House Executive Session: 3/3/2011 10:00 Amendment Legislative Office Building 207 "
347658,2011-03-08,"House Committee Report: Ought to Pass with Amendment #0333h for Mar 15 (Vote 14-0; Regular Calendar); House Calendar 22, PG.551 "
347658,2011-03-08,"House Proposed Committee Amendment #2011-0333h; House Calendar 23, PG.639-641 "
347658,2011-03-15,"House Amendment #0333h Adopted, Voice Vote; House Journal  26, PG.791-793 "
347658,2011-03-15,"House Ought to Pass with Amendment #0333h: Motion Adopted Voice Vote; House Journal  26, PG.791-793 "
347658,2011-03-23,"Senate Introduced and Referred to Education; Senate Journal 11, Pg.193 "
347658,2011-04-06,"Senate Hearing: 4/12/11, Room 103, Legislative Office Building, 1:50 p.m.; Senate Calendar 19 "
347658,2011-04-28,"Senate Committee Report: Rereferred to Committee, 5/4/11; Senate Calendar 22 "
347658,2011-05-04,"Senate Rereferred to Committee, Motion Adopted, Voice Vote; Senate Journal 15, Pg.299 "
347658,2012-01-12,"Senate Committee Report: Inexpedient to Legislate, 1/18/12; Senate Calendar 3 "
347658,2012-01-18,"Senate Inexpedient to Legislate, Motion Adopted, Voice Vote === BILL KILLED ===; Senate Journal 2, Pg.36 "
347659,2011-01-24,"House Introduced 1/6/2011 and Referred to Special Committee on Education Funding Reform; House Journal  11, PG. 190  "
347659,2011-02-01,"House Public Hearing: 2/11/2011 9:30 Amendment Legislative Office Building 207 "
347659,2011-02-11,"House Full Committee Work Session: 2/18/2011 10:00 Amendment Legislative Office Building 207 "
347659,2011-03-02,"House Executive Session: 3/4/2011 10:00 Amendment Legislative Office Building 207 "
347659,2011-03-04,"House Retained in Committee; House Calendar 27, PG.825 "
347659,2011-09-08,"House Retained Bill - Full Committee Work Session: 9/13/2011 10:00 Amendment Legislative Office Building 210-211 ==ROOM CHANGE (Orig 212)== "
347659,2011-09-28,"House Retained Bill - Full Committee Work Session: 10/11/2011 10:00 Amendment Legislative Office Building 210-211 "
347659,2011-10-11,"House Retained Bill - Full Committee Work Session: 10/18/2011 10:30 Amendment Legislative Office Building 210-211 ==TIME CHANGE (Orig 10:00 Amendment)== "
347659,2011-10-11,"House Retained Bill - Executive Session: 10/18/2011 11:00 Amendment Legislative Office Building 210-211 ==RECESSED== "
347659,2011-10-18,"House Retained Bill - Full Committee Work Session: 10/25/2011 1:00 PM Legislative Office Building 210-211 "
347659,2011-10-18,"House ==RECONVENE== Retained Bill - Executive Session: 10/25/2011 1:45 PM Legislative Office Building 210-211 "
347659,2011-10-27,"House Committee Report: Ought to Pass with Amendment #2801h for Jan 4 (Vote 13-0; Consent Calendar); House Calendar 70, PG.2210 "
347659,2011-10-27,"House Proposed Committee Amendment #2011-2801h; House Calendar 69, PG.2150-2154 "
347659,2012-01-04,"House Amendment #2801h Adopted, Voice Vote; House Journal  7, PG.424-428 "
347659,2012-01-04,"House Ought to Pass with Amendment #2801h: Motion Adopted Voice Vote; House Journal  7, PG.424-428 "
347659,2012-01-04,"House Referred to Finance; House Journal  7, PG.428 "
347659,2012-01-11,"House Public Hearing: 1/25/2012 11:00 Amendment Legislative Office Building 210-211 "
347659,2012-01-25,"House Division II Work Session: 1/31/2012 1:30 PM Legislative Office Building 209 "
347659,2012-01-31,"House Division II Work Session: 2/7/2012 9:30 Amendment Legislative Office Building 209 "
347659,2012-01-31,"House ==CANCELLED== Executive Session: 2/7/2012 1:30 PM Legislative Office Building 210-211 "
347659,2012-02-14,"House Division II Work Session: 2/17/2012 1:00 PM Legislative Office Building 209 "
347659,2012-02-17,"House Division II Work Session: 2/21/2012 10:00 Amendment Legislative Office Building 209 "
347659,2012-02-21,"House Division II Work Session: 2/23/2012 1:00 PM Legislative Office Building 209 "
347659,2012-02-21,"House Executive Session: 3/20/2012 11:00 Amendment Legislative Office Building 210-211 "
347659,2012-03-21,"House Majority Committee Report: Ought to Pass with Amendment #1064h for Mar 28 (Vote 22-2; Regular Calendar); House Calendar 25, PG.1509 "
347659,2012-03-21,"House Proposed Majority Committee Amendment #2012-1064h; House Calendar 25, PG.1529-1533 "
347659,2012-03-21,"House Minority Committee Report: Inexpedient to Legislate; House Calendar 25, PG.1509 "
347659,2012-03-28,"House Amendment #1064h Adopted, Voice Vote; House Journal  30, PG.1841-1846 "
347659,2012-03-28,"House Ought to Pass with Amendment #1064h: Motion Adopted Division Vote 277-19; House Journal  30, PG.1841-1846 "
347659,2012-03-28,"Senate Introduced and Referred to Education; Senate Journal 9, Pg.332 "
347659,2012-04-04,"Senate Hearing: 4/10/12, Room 103, Legislative Office Building, 2:00 p.m.; Senate Calendar 14 "
347659,2012-04-11,"Senate Committee Report: Ought to Pass with Amendment #2012-1575s, New Title, 4/18/12; Senate Calendar 15 "
347659,2012-04-18,"Senate Committee Amendment 1575s, New Title, Amendment Adopted, Voice Vote; Senate Journal 10, Pg.363 "
347659,2012-04-18,"Senate Ought to Pass with Amendment 1575s, New Title, Motion Adopted, Voice Vote; OT3rdg; Senate Journal 10, Pg.379 "
347659,2012-05-09,"House House Non-Concurs with Senate Amendment #1575s(NT) and Requests C of C (Rep L.Ober): Motion Adopted Voice Vote; House Journal  40, PG.2230 "
347659,2012-05-09,"House Speaker Appoints: Reps L.Ober, Foose, W.Smith, and Umberger; House Journal  40, PG.2230 "
347659,2012-05-16,"Senate Sen. Stiles Accede to House Request for Committee of Conference, Motion Adopted,Voice Vote "
347659,2012-05-16,"Senate President Appoints: Senators Stiles, Forsythe, and Kelly "
347659,2012-05-21,"House Conference Committee Meeting: 5/24/2012 10:00 Amendment Legislative Office Building 301 ==RECESSED== "
347659,2012-05-24,"House Committee of Conference Meeting: 5/25/2012 11:30 Amendment Legislative Office Building 209 ==RECESSED== "
347659,2012-05-25,"House ==RECONVENE== Committee of Conference Meeting: 5/29/2012 11:30 Amendment Legislative Office Building 301 ==RECESSED== "
347659,2012-05-29,"House ==RECONVENE== Conference Committee Meeting: 5/30/2012 3:00 PM Legislative Office Building 301 "
347661,2011-01-24,"House Introduced 1/6/2011 and Referred to Criminal Justice and Public Safety; House Journal  11, PG. 190 "
347661,2011-02-09,"House ==CANCELLED== Public Hearing: 2/24/2011 1:30 PM Legislative Office Building 204 "
347661,2011-02-09,"House ==CANCELLED== Public Hearing: 3/1/2011 10:00 Amendment Legislative Office Building 204 "
347661,2011-02-16,"House Public Hearing: 3/3/2011 1:30 PM Legislative Office Building 204 "
347661,2011-03-02,"House Executive Session: 3/9/2011 10:00 Amendment Legislative Office Building 204 "
347661,2011-03-09,"House Retained in Committee; House Calendar 27, PG.823 "
347661,2011-09-13,"House Retained Bill - Subcommittee Work Session: 9/27/2011 1:00 PM Legislative Office Building 204 "
347661,2011-09-28,"House Retained Bill - Subcommittee Work Session: 10/5/2011 11:00 Amendment Legislative Office Building 208 "
347661,2011-09-28,"House Retained Bill - Executive Session: 10/20/2011 10:00 Amendment Legislative Office Building 204 "
347661,2011-10-25,"House Committee Report: Ought to Pass with Amendment #2679h for Jan 4 (Vote 12-5; Regular Calendar); House Calendar 70, PG.2216 "
347661,2011-10-25,"House Proposed Committee Amendment #2011-2679h; House Calendar 69, PG.2154-2155 "
347661,2012-01-05,"House Amendment #2679h Adopted, Voice Vote; House Journal  8, PG.466-467 "
347661,2012-01-05,"House Ought to Pass with Amendment #2679h: Motion Adopted Regular Calendar 193-122; House Journal  8, PG.466-469 "
347661,2012-01-12,"Senate Introduced 1/4/2012 and Referred to Judiciary; Senate Journal 2, Pg.19 "
347661,2012-01-19,"Senate Hearing: 1/26/12, Room 100, State House, 2:00 p.m; Senate Calendar 4 "
347661,2012-04-27,"Senate Committee Report: Ought to Pass with Amendment #2012-1891s, New Title, 5/2/12; Senate Calendar 17A "
347661,2012-05-02,"Senate Committee Amendment 1891s, New Title, Regular Calendar 19Y-5N, Amendment Adopted; Senate Journal 12, Pg.468 "
347661,2012-05-02,"Senate Ought to Pass with Amendment Not Voted On "
347661,2012-05-02,"Senate Sen. Forsythe Moved Laid On Table, Regular Calendar 17Y-7N, Motion Adopted; Senate Journal 12, Pg.468 "
347663,2011-01-24,"House Introduced 1/6/2011 and Referred to Science, Technology and Energy; House Journal  11, PG. 190 "
347663,2011-02-16,"House Public Hearing: 3/1/2011 10:15 Amendment Legislative Office Building 304 ==Executive Session to Follow== "
347663,2011-03-02,"House Retained in Committee; House Calendar 27, PG.825 "
347663,2011-04-12,"House Retained Bill - Full Committee Work Session: 4/26/2011 10:15 Amendment Legislative Office Building 302-304 "
347663,2011-08-18,"House Retained Bill - Full Committee Work Session: 9/13/2011 10:15 Amendment Legislative Office Building 301-303 "
347663,2011-10-11,"House Retained Bill - Full Committee Work Session: 10/25/2011 1:30 PM Legislative Office Building 304 "
347663,2011-10-11,"House Retained Bill - Executive Session: 10/25/2011 3:00 PM Legislative Office Building 304 ==RECESSED== "
347663,2011-10-26,"House Retained Bill - Continued Executive Session: 11/1/2011 10:00 Amendment Legislative Office Building 304 "
347663,2011-11-02,"House Committee Report: Refer to Interim Study for Jan 4 (Vote 6-4; Regular Calendar); House Calendar 70, PG.2224-2225 "
347663,2012-01-11,"House Refer to Interim Study: Motion Adopted Voice Vote; House Journal  9, PG.542 "
347663,2012-06-07,"House Referred to Science, Technology and Energy for Interim Study; House Calendar 45, PG.2433 "
347663,2012-10-03,"House Interim Study - Subcommittee Work Session: 10/4/2012 3:30 PM Legislative Office Building 304 "
347664,2011-01-24,"House Introduced 1/6/2011 and Referred to Education; House Journal  11, PG. 190 "
347664,2011-02-02,"House Public Hearing: 2/8/2011 10:30 Amendment Representative's Hall "
347664,2011-02-09,"House Subcommittee Work Session: 2/15/2011 8:00 Amendment Legislative Office Building 207 "
347664,2011-02-09,"House Subcommittee Work Session: 2/17/2011 8:00 Amendment Legislative Office Building 207 "
347664,2011-02-09,"House ==CANCELLED== Subcommittee Work Session: 2/22/2011 8:00 Amendment Legislative Office Building 207 "
347664,2011-02-10,"House ==CANCELLED== Subcommittee Work Session: 2/24/2011 9:00 Amendment Legislative Office Building 207 "
347664,2011-02-10,"House Executive Session: 2/24/2011 1:00 PM Legislative Office Building 207 "
347664,2011-02-24,"House Retained in Committee; House Calendar 27, PG.823 "
347664,2011-08-17,"House Retained Bill - Subcommittee Work Session: 9/6/2011 10:00 Amendment Legislative Office Building 207 "
347664,2011-08-17,"House Retained Bill - Subcommittee Work Session: 9/13/2011 10:00 Amendment Legislative Office Building 207 "
347664,2011-10-04,"House Retained Bill - Executive Session: 10/18/2011 10:00 Amendment Legislative Office Building 207 "
347664,2011-10-21,"House Committee Report: Ought to Pass with Amendment #2716h(NT) for Jan 4 (Vote 13-1; Consent Calendar); House Calendar 70, PG.2202 "
347664,2011-10-21,"House Proposed Committee Amendment #2011-2716h (New Title); House Calendar 69, PG.2155-2156 "
347664,2012-01-04,"House Amendment #2716h(NT) Adopted, Voice Vote; House Journal  7, PG.381 "
347664,2012-01-04,"House Ought to Pass with Amendment #2716h(NT): Motion Adopted Voice Vote; House Journal  7, PG.381 "
347664,2012-02-08,"Senate Introduced and Referred to Education; Senate Journal 5, Pg.122 "
347664,2012-04-11,"Senate Hearing: 4/17/12, Room 103, Legislative Office Building, 1:40 p.m.; Senate Calendar 15 "
347664,2012-05-08,"Senate Committee Report: Ought to Pass with Amendment #2012-2037s, 5/16/12; Senate Calendar 19 "
347664,2012-05-16,"Senate Committee Amendment 2037s; Amendment Adopted, Voice Vote; Senate Journal 14, Pg.517 "
347664,2012-05-16,"Senate Sen. Stiles Floor Amendment #2012-2247s, Amendment Adopted, Voice Vote; Senate Journal 14, Pg.517 "
347664,2012-05-16,"Senate Sen. Kelly Floor Amendment #2012-2296s, Amendment Failed, Voice Vote; Senate Journal 14, Pg.517 "
347664,2012-05-16,"Senate Ought to Pass with Amendment 2037s, 2247s, Motion Adopted, Voice Vote; OT3rdg; Senate Journal 14, Pg.587 "
347664,2012-05-30,"House House Concurs with Senate Amendment #2037s and #2247s (Rep Balboni): Motion Adopted Voice Vote; House Journal  47, PG.2501 "
347664,2012-06-06,"Senate Enrolled "
347664,2012-06-06,"House Enrolled; House Journal  51, PG.2609 "
347664,2012-06-18,"House Signed By Governor 06/13/2012; Effective 08/12/2012; Chapter 0203 "
347666,2011-01-24,"House Introduced 1/6/2011 and Referred to Criminal Justice and Public Safety; House Journal  11, PG. 191 "
347666,2011-02-16,"House Public Hearing: 3/1/2011 1:00 PM Legislative Office Building 204 "
347666,2011-03-02,"House Subcommittee Work Session: 3/9/2011 9:00 Amendment Legislative Office Building 204 "
347666,2011-03-02,"House Executive Session: 3/9/2011 10:00 Amendment Legislative Office Building 204 "
347666,2011-03-09,"House Retained in Committee; House Calendar 27, PG.823 "
347666,2011-09-13,"House Retained Bill - Subcommittee Work Session: 9/27/2011 11:00 Amendment Legislative Office Building 204 "
347666,2011-09-27,"House Retained Bill - Executive Session: 10/20/2011 10:00 Amendment Legislative Office Building 204 "
347666,2011-10-25,"House Committee Report: Refer to Interim Study for Jan 4 (Vote 17-0; Consent Calendar); House Calendar 70, PG.2202 "
347666,2012-01-04,"House Refer to Interim Study: Motion Adopted Voice Vote; House Journal  7, PG.380 "
347666,2012-06-07,"House Referred to Criminal Justice and Public Safety for Interim Study; House Calendar 45, PG.2432 "
347666,2012-08-08,"House Interim Study - Subcommittee Work Session: 8/15/2012 10:00 Amendment Legislative Office Building 208 "
347666,2012-08-22,"House Interim Study - Subcommittee Work Session: 8/29/2012 10:00 Amendment Legislative Office Building 204 "
347666,2012-09-18,"House Interim Study - Executive Session: 10/10/2012 10:00 Amendment Legislative Office Building 204 "
347667,2011-01-24,"House Introduced 1/6/2011 and Referred to Health, Human Services and Elderly Affairs; House Journal  11, PG. 191 "
347667,2011-02-08,"House Public Hearing: 3/3/2011 1:00 PM Legislative Office Building 205 "
347667,2011-03-01,"House Executive Session: 3/9/2011 10:00 Amendment Legislative Office Building 205 "
347667,2011-03-09,"House Retained in Committee; House Calendar 27, PG.824 "
347667,2011-06-01,"House Retained Bill - Subcommittee Work Session: 6/9/2011 1:00 PM Legislative Office Building 205 "
347667,2011-09-22,"House Retained Bill - Subcommittee Work Session: 10/6/2011 1:00 PM Legislative Office Building 205 "
347667,2011-10-03,"House ==CANCELLED== Retained Bill - Executive Session: 10/12/2011 Legislative Office Building 205 1:00 PM or Immediately Following House Session "
347667,2011-10-13,"House Retained Bill - Subcommittee Work Session: 10/20/2011 1:00 PM Legislative Office Building 205 "
347667,2011-10-13,"House Executive Session: 10/20/2011 2:00 PM Legislative Office Building 205 "
347667,2011-10-27,"House Committee Report: Refer to Interim Study for Jan 4 (Vote 15-2; Regular Calendar); House Calendar 70, PG.2221 "
347667,2012-01-05,"House Refer to Interim Study: Motion Adopted Voice Vote; House Journal  8, PG.520 "
347667,2012-06-07,"House Referred to Health, Human Services and Elderly Affairs for Interim Study; House Calendar 45, PG.2433 "
347669,2011-01-24,"House Introduced 1/6/2011 and Referred to Ways and Means; House Journal  11, PG. 191 "
347669,2011-02-09,"House Public Hearing: 2/22/2011 10:00 Amendment Legislative Office Building 202 "
347669,2011-02-23,"House Executive Session: 2/24/2011 1:00 PM Legislative Office Building 202 ==TIME CHANGE (Orig 12:30 PM)== "
347669,2011-03-09,"House Retained in Committee; House Calendar 27, PG.826 "
347669,2011-06-02,"House Retained Bill - Full Committee Work Session: 6/7/2011 10:00 Amendment Legislative Office Building 202 "
347669,2011-08-16,"House Retained Bill - Subcommittee Work Session: 8/30/2011 10:00 Amendment Legislative Office Building 202 "
347669,2011-08-16,"House Retained Bill - Subcommittee Work Session: 9/15/2011 1:00 PM Legislative Office Building 202 ==TIME CHANGE (Orig 10:00 Amendment)== "
347669,2011-09-21,"House Retained Bill - Subcommittee Work Session: 10/4/2011 9:00 Amendment Legislative Office Building 202 "
347669,2011-10-05,"House Retained Bill - Subcommittee Work Session: 10/13/2011 1:00 PM Legislative Office Building 202 "
347669,2011-10-05,"House Retained Bill - Executive Session: 10/26/2011 1:00 PM Legislative Office Building 202 ==RECESSED== "
347669,2011-10-20,"House Retained Bill - Rescheduled Executive Session 10/27/2011 1:00 PM Legislative Office Building 202 "
347669,2011-11-02,"House Majority Committee Report: Ought to Pass with Amendment #2745h(NT) for Jan 4 (Vote 16-5; Regular Calendar); House Calendar 70, PG.2226 "
347669,2011-11-02,"House Proposed Majority Committee Amendment #2011-2745h (New Title); House Calendar 69, PG.2156 "
347669,2011-11-02,"House Minority Committee Report: Inexpedient to Legislate; House Calendar 70, PG.2226-2227 "
347669,2012-01-11,"House Amendment #2745h(NT) Adopted, Voice Vote; House Journal  9, PG.549-550 "
347669,2012-01-11,"House Ought to Pass with Amendment #2745h(NT): Motion Adopted Regular Calendar 271-82; House Journal  9, PG.549-552 "
347669,2012-02-08,"Senate Introduced and Referred to Ways & Means; Senate Journal 5, Pg.122 "
347669,2012-03-14,"Senate Hearing: 3/20/12, Room 100, State House, 1:45 p.m.; Senate Calendar 11 "
347669,2012-05-03,"Senate Committee Report: Referred to Interim Study, 5/9/12; Vote 6-0; Consent Calendar; Senate Calendar 18 "
347669,2012-05-09,"Senate Refer to Interim Study, Motion Adopted, Voice Vote; Senate Journal 13, Pg.477 "
347670,2011-01-24,"House Introduced 1/6/2011 and Referred to Resources, Recreation and Development; House Journal  11, PG. 191 "
347670,2011-02-02,"House Public Hearing: 2/10/2011 1:00 PM Legislative Office Building 305 "
347670,2011-02-22,"House Executive Session: 3/1/2011 1:00 PM Legislative Office Building 305 "
347670,2011-03-01,"House Retained in Committee; House Calendar 27, PG.825 "
347670,2011-07-26,"House Retained Bill - Full Committee Work Session: 8/9/2011 10:00 Amendment Legislative Office Building 305 "
347670,2011-09-13,"House Retained Bill - Subcommittee Work Session: 10/4/2011 10:00 Amendment Legislative Office Building 305 "
347670,2011-09-13,"House Retained Bill - Executive Session: 10/25/2011 10:00 Amendment Legislative Office Building 305 "
347670,2011-11-02,"House Committee Report: Inexpedient to Legislate for Jan 4 (Vote 13-2; Consent Calendar); House Calendar 70, PG.2209 "
347670,2012-01-04,"House Inexpedient to Legislate: Motion Adopted Voice Vote; House Journal  7, PG.422 "
347672,2011-01-24,"House Introduced 1/6/2011 and Referred to Judiciary; House Journal  11, PG. 192 "
347672,2011-02-01,"House Public Hearing: 2/8/2011 2:00 PM Legislative Office Building 208 "
347672,2011-02-16,"House Executive Session: 3/1/2011 1:00 PM Legislative Office Building 208 "
347672,2011-03-01,"House Retained in Committee; House Calendar 27, PG.824 "
347672,2011-07-06,"House Retained Bill - Subcommittee Work Session: 8/23/2011 9:00 Amendment Legislative Office Building 208 "
347672,2011-07-06,"House Retained Bill - Subcommittee Work Session: 8/25/2011 9:00 Amendment Legislative Office Building 208 "
347672,2011-09-14,"House Retained Bill - Executive Session: 10/25/2011 11:00 Amendment Legislative Office Building 208 "
347672,2011-11-02,"House Committee Report: Ought to Pass for Jan 4 (Vote 16-0; Consent Calendar); House Calendar 70, PG.2206 "
347672,2012-01-04,"House Removed from Consent Calendar (Rep G.Richardson); House Journal  7, PG.368 "
347672,2012-02-01,"House Ought to Pass: Motion Adopted Regular Calendar 257-87; House Journal  13, PG.754-756 "
347672,2012-02-01,"House Laid on Table (Rep Cali-Pitts): Motion Failed Regular Calendar 92-253; House Journal  13, PG.756-758 "
347672,2012-02-08,"Senate Introduced and Referred to Judiciary; Senate Journal 5, Pg.122 "
347672,2012-03-14,"Senate Hearing: 3/29/12, Room 101, Legislative Office Building, 1:15 p.m.; Senate Calendar 11 "
347672,2012-04-26,"Senate Committee Report: Ought to Pass with Amendment #2012-1861s, 5/2/12; Vote 5-0; Consent Calendar; Senate Calendar 17 "
347672,2012-05-02,"Senate Committee Amendment 1861s; Amendment Adopted, Voice Vote; Senate Journal 12, Pg.422 "
347672,2012-05-02,"Senate Ought to Pass with Amendment 1861s, Motion Adopted, Voice Vote; OT3rdg; Senate Journal 12, Pg.471 "
347672,2012-05-30,"House House Concurs with Senate Amendment #1861s (Rep Rowe): Motion Adopted Voice Vote; House Journal  47, PG.2502 "
347672,2012-06-06,"Senate Enrolled Bill Amendment #2477e Adopted, Voice Vote "
347672,2012-06-06,"House Enrolled Bill Amendment #2012-2477e Adopted; House Journal  51, PG.2610 "
347672,2012-06-06,"Senate Enrolled "
347672,2012-06-06,"House Enrolled "
347672,2012-06-21,"House Signed By Governor 06/18/2012; Effective 08/17/2012; Chapter 0229 "
347673,2011-01-24,"House Introduced 1/6/2011 and Referred to Commerce and Consumer Affairs; House Journal  11, PG. 192 "
347673,2011-02-09,"House Public Hearing: 3/4/2011 11:00 Amendment Legislative Office Building 302 "
347673,2011-03-01,"House Executive Session: 3/9/2011 9:00 Amendment Legislative Office Building 302 "
347673,2011-03-09,"House Retained in Committee; House Calendar 27, PG.822 "
347673,2011-08-23,"House Retained Bill - Insurance/Consumer Div Subcom Work Session: 9/13/2011 2:45 PM Legislative Office Building 302 "
347673,2011-09-13,"House Retained Bill - Insurance/Consumer Div Subcom Work Session: 10/18/2011 2:30 PM Legislative Office Building 302 "
347673,2011-10-19,"House Retained Bill - Executive Session: 10/25/2011 1:15 PM Legislative Office Building 301-303 (If Necessary Continued 10/27/2011 1:15 PM Legislative Office Building 302) "
347673,2011-11-02,"House Committee Report: Inexpedient to Legislate for Jan 4 (Vote 16-0; Consent Calendar); House Calendar 70, PG.2201 "
347673,2012-01-04,"House Inexpedient to Legislate: Motion Adopted Voice Vote; House Journal  7, PG.373 "
347675,2011-01-24,"House Introduced 1/6/2011 and Referred to Commerce and Consumer Affairs; House Journal  11, PG. 192 "
347675,2011-02-09,"House Public Hearing: 3/1/2011 10:00 Amendment Legislative Office Building 302 "
347675,2011-02-23,"House Executive Session: 3/3/2011 2:45 PM Legislative Office Building 302 "
347675,2011-03-09,"House Retained in Committee; House Calendar 27, PG.822 "
347675,2011-08-23,"House Retained Bill - Banking/Business Div Subcom Work Session: 10/4/2011 11:15 Amendment Legislative Office Building 302 "
347675,2011-10-04,"House Retained Bill - Banking/Business Div Subcom Work Session: 10/20/2011 9:00 Amendment Legislative Office Building 302 "
347675,2011-10-11,"House Retained Bill - Executive Session: 10/20/2011 1:15 PM Legislative Office Building 302 "
347675,2011-10-28,"House Majority Committee Report: Ought to Pass with Amendment #2721h for Jan 4 (Vote 11-3; Regular Calendar); House Calendar 70, PG.2213 "
347675,2011-10-28,"House Proposed Majority Committee Amendment #2011-2721h; House Calendar 69, PG.2156 "
347675,2011-11-02,"House Minority Committee Report: Ought to Pass with Amendment #0173h; House Calendar 70, PG.2213 "
347675,2011-11-02,"House Proposed Minority Committee Amendment #2011-0173h; House Calendar 69, PG.2157 "
347675,2012-01-04,"House Amendment #2721h Adopted, Regular Calendar 214-137; House Journal  7, PG.438-441 "
347675,2012-01-04,"House Ought to Pass with Amendment #2721h: Motion Adopted Regular Calendar 223-129; House Journal  7, PG.438-443 "
347675,2012-03-07,"Senate Introduced and Referred to Commerce; Senate Journal 7, Pg.185 "
347675,2012-03-29,"Senate Hearing: 4/03/12, Room 102, Legislative Office Building, 10:40 a.m.; Senate Calendar 13 "
347675,2012-04-04,"Senate Committee Report: Inexpedient to Legislate, 4/11/12; Vote 5-0; Consent Calendar; Senate Calendar 14 "
347675,2012-04-11,"Senate Sen. Kelly Moved to Remove HB 581 from the Consent Calendar; Senate Journal 9, Pg.336 "
347675,2012-04-11,"Senate Inexpedient to Legislate, Regular Calendar 16Y-8N, Motion Adopted === BILL KILLED ===; Senate Journal 9, Pg.348 "
347676,2011-01-24,"House Introduced 1/6/2011 and Referred to Labor, Industrial and Rehabilitative Services; House Journal  11, PG. 192 "
347676,2011-02-10,"House ==RESCHEDULED== Public Hearing: 2/22/2011 1:00 PM Legislative Office Building 307 (Orig 1:45 PM) "
347676,2011-02-23,"House Executive Session: 3/1/2011 1:00 PM Legislative Office Building 307 "
347676,2011-03-01,"House Retained in Committee; House Calendar 27, PG.824 "
347676,2011-09-12,"House ==CANCELLED== Retained Bill - Full Committee Work Session: 9/20/2011 9:00 Amendment Legislative Office Building 307 "
347676,2011-09-13,"House Retained Bill - Full Committee Work Session: 9/21/2011 9:00 Amendment Legislative Office Building 307 "
347676,2011-09-27,"House Retained Bill - Full Committee Work Session: 10/4/2011 1:00 PM Legislative Office Building 307 "
347676,2011-09-27,"House Retained Bill - Executive Session: 10/18/2011 1:00 PM Legislative Office Building 307 "
347676,2011-10-21,"House Committee Report: Ought to Pass with Amendment #2761h for Jan 4 (Vote 11-4; Regular Calendar); House Calendar 70, PG.2223 "
347676,2011-10-21,"House Proposed Committee Amendment #2011-2761h; House Calendar 69, PG.2157 "
347676,2012-01-11,"House Amendment #2761h Adopted, Voice Vote; House Journal  9, PG.535 "
347676,2012-01-11,"House Print Remarks Between Rep Jasper and Rep Daniels in Permanent Journal (Rep Bettencourt): Motion Adopted Division Vote 302-40; House Journal  9, PG.535 "
347676,2012-01-11,"House Ought to Pass with Amendment #2761h: Motion Adopted Voice Vote; House Journal  9, PG.535 "
347676,2012-02-15,"Senate Introduced and Referred to Public and Municipal Affairs; Senate Journal 6, Pg.144 "
347676,2012-04-18,"Senate Hearing: 4/24/12, Room 101, Legislative Office Building, 9:00 a.m.; Senate Calendar 16 "
347676,2012-04-25,"Senate Committee Report: Ought to Pass, 5/2/12; Senate Calendar 17 "
347676,2012-05-02,"Senate Ought to Pass: Div. 9Y-7N, Motion Adopted; OT3rdg; Senate Journal 12, Pg.471 "
347676,2012-05-16,"Senate Enrolled Bill Amendment #2175e Adopted "
347676,2012-05-17,"House Enrolled Bill Amendment #2012-2175e Adopted; House Journal  46, PG.2485 "
347676,2012-05-23,"Senate Enrolled "
347676,2012-05-30,"House Enrolled [Recessed from 5/17/2012 Session]; House Journal  46, PG.2495 "
347676,2012-06-11,"House Signed By Governor 06/07/2012; Effective 01/01/2013; Chapter 0161 "
347678,2011-01-24,"House Introduced 1/6/2011 and Referred to Children and Family Law; House Journal  11, PG. 192 "
347678,2011-02-23,"House Public Hearing: 3/3/2011 9:30 Amendment Legislative Office Building 206 "
347678,2011-03-01,"House Executive Session: 3/7/2011 10:00 Amendment Legislative Office Building 206 "
347678,2011-03-07,"House Retained in Committee; House Calendar 27, PG.822 "
347678,2011-05-18,"House Retained Bill - Subcommittee Work Session: 5/25/2011 Legislative Office Building 206 2:00 PM or immediately following House session "
347678,2011-09-06,"House Retained Bill - Full Committee Work Session: 9/14/2011 11:00 Amendment Legislative Office Building 206 "
347678,2011-10-03,"House Retained Bill - Subcommittee Work Session: 10/19/2011 11:00 Amendment Legislative Office Building 206 "
347678,2011-10-03,"House Retained Bill - Executive Session: 10/26/2011 10:00 Amendment Legislative Office Building 206 ==If Necessary Continued 10/27/2011 10:00 Amendment Legislative Office Building 206== "
347678,2011-11-02,"House Committee Report: Inexpedient to Legislate for Jan 4 (Vote 16-0; Consent Calendar); House Calendar 70, PG.2199 "
347678,2012-01-04,"House Removed from Consent Calendar (Rep G.Hopper); House Journal  7, PG.367 "
347678,2012-01-11,"House Inexpedient to Legislate: Motion Adopted Regular Calendar 250-84; House Journal  9, PG.577-580 "
347679,2011-01-24,"House Introduced 1/6/2011 and Referred to Election Law; House Journal  11, PG. 192 "
347679,2011-02-08,"House Public Hearing: 3/1/2011 11:00 Amendment Legislative Office Building 308 "
347679,2011-03-02,"House Executive Session: 3/9/2011 10:30 Amendment Legislative Office Building 308 "
347679,2011-03-10,"House Committee Report: Ought to Pass with Amendment #0625h for Mar 15 (Vote 16-0; Consent Calendar); House Calendar 22, PG.529 "
347679,2011-03-10,"House Proposed Committee Amendment #2011-0625h; House Calendar 23, PG.643 "
347679,2011-03-15,"House Amendment #0625h Adopted, Voice Vote; House Journal  26, PG.708-709 "
347679,2011-03-15,"House Ought to Pass with Amendment #0625h: Motion Adopted Voice Vote; House Journal  26, PG.708-709 "
347679,2011-03-23,"Senate Introduced and Referred to Public and Municipal Affairs; Senate Journal 11, Pg.193 "
347679,2011-05-05,"Senate Hearing: 5/10/11, Room 101, Legislative Office Building, 9:45 a.m.; Senate Calendar 23 "
347679,2011-05-11,"Senate Committee Report: Rereferred to Committee, 5/18/11; Senate Calendar 24 "
347679,2011-05-18,"Senate Rereferred to Committee, Motion Adopted, Voice Vote; Senate Journal 17, Pg.355 "
347679,2012-01-12,"Senate Committee Report: Inexpedient to Legislate, 1/18/12; Senate Calendar 3 "
347679,2012-01-18,"Senate Inexpedient to Legislate, Motion Adopted, Voice Vote === BILL KILLED ===; Senate Journal 2, Pg.68 "
347681,2011-01-24,"House Introduced 1/6/2011 and Referred to Children and Family Law; House Journal  11, PG. 192 "
347681,2011-02-23,"House Public Hearing: 3/3/2011 1:30 PM Legislative Office Building 206 "
347681,2011-03-01,"House Executive Session: 3/7/2011 10:00 Amendment Legislative Office Building 206 "
347681,2011-03-07,"House Retained in Committee; House Calendar 27, PG.822 "
347681,2011-04-20,"House Retained Bill - Subcommittee Work Session: 5/3/2011 10:00 Amendment Legislative Office Building 206 "
347681,2011-09-06,"House Retained Bill - Full Committee Work Session: 9/14/2011 11:00 Amendment Legislative Office Building 206 "
347681,2011-09-28,"House Retained Bill - Subcommittee Work Session: 10/19/2011 10:00 Amendment Legislative Office Building 206 "
347681,2011-09-30,"House Retained Bill - Executive Session: 10/26/2011 10:00 Amendment Legislative Office Building 206 ==If Necessary Continued 10/27/2011 10:00 Amendment Legislative Office Building 206== "
347681,2011-11-02,"House Majority Committee Report: Inexpedient to Legislate for Jan 4 (Vote 11-5; Regular Calendar); House Calendar 70, PG.2212 "
347681,2011-11-02,"House Minority Committee Report: Ought to Pass with Amendment #2728h(NT); House Calendar 70, PG.2212 "
347681,2011-11-02,"House Proposed Minority Committee Amendment #2011-2728h (New Title); House Calendar 69, PG.2158 "
347681,2012-01-04,"House Laid on the Table (Rep Jasper): Motion Adopted Voice Vote; House Journal  7, PG.429-430 "
347681,2012-03-28,"House Remove from the Table (Rep Oligny): Motion Failed Division Vote 113-167; House Journal  30, PG.1853 "
347682,2011-01-24,"House Introduced 1/6/2011 and Referred to Special Committee on Redistricting; House Journal  11, PG. 192 "
347682,2011-02-16,"House ==CANCELLED== Public Hearing: 2/25/2011 2:30 PM Legislative Office Building 308 "
347682,2011-03-01,"House Public Hearing: 3/4/2011 2:30 PM Legislative Office Building 308 ==Executive Session to Follow== "
347682,2011-03-04,"House Retained in Committee; House Calendar 27, PG.825 "
347682,2011-10-12,"House Suspend House Rules to Allow Reporting Deadline to be Moved to December 23, 2011 (Rep Bettencourt): Motion Adopted Division Vote 267-98 by Required Two-Thirds; House Journal  68, PG.2048 "
347682,2011-12-08,"House Retained Bill - Public Hearing on Proposed Amendment: 12/15/2011 1:30 PM Legislative Office Building 306-308 "
347682,2011-12-08,"House Retained Bill - Executive Session: 12/20/2011 10:30 Amendment Legislative Office Building 306-308 "
347682,2012-01-13,"House Majority Committee Report: Ought to Pass with Amendment #0056h(NT) for Jan 18 (Vote 12-5; Regular Calendar); House Calendar 3, PG.123-124 "
347682,2012-01-13,"House Proposed Majority Committee Amendment #2012-0056h (New Title); House Calendar 3A, PG. 156-164 "
347682,2012-01-13,"House Minority Committee Report: Inexpedient to Legislate; House Calendar 3, PG. 124 "
347682,2012-01-18,"House Amendment #0056h(NT) Adopted, Regular Calendar 219-118; House Journal  10, PG.614-626 "
347682,2012-01-18,"House Floor Amendment #2012-0245h(NT) (Rep Mirski) Adopted, Regular Calendar 227-107; House Journal  10, PG.626-638 "
347682,2012-01-18,"House Floor Amendment #2012-0252h(NT) (Rep Pierce) Failed, Regular Calendar 70-261; House Journal  10, PG.638-655 "
347682,2012-01-18,"House Floor Amendment #2012-0218h (Rep Doherty) Failed, Regular Calendar 26-302; House Journal  10, PG.655-658 "
347682,2012-01-18,"House Floor Amendment #2012-0248h (Rep Cohn) Adopted, Division Vote 170-153; House Journal  10, PG.658-659 "
347682,2012-01-18,"House Reconsideration of FLAM #0248h (Rep Jasper): Motion Adopted Regular Calendar 209-110; House Journal  10, PG.659-661 "
347682,2012-01-18,"House Floor Amendment #0248h Failed, Regular Calendar 116-202; House Journal  10, PG.661-663 "
347682,2012-01-18,"House Floor Amendment #2012-0246h (Rep Cohn) Failed, Regular Calendar 55-238; House Journal  10, PG.663-666 "
347682,2012-01-18,"House Floor Amendment #2012-0156h (Rep Vaillancourt) Failed, Regular Calendar 89-195; House Journal  10, PG.666-669 "
347682,2012-01-18,"House Floor Amendment #2012-0243h (Rep Leishman) Failed, Regular Calendar 85-202; House Journal  10, PG.669-672 "
347682,2012-01-18,"House Ought to Pass with Amendment #0056h(NT) and #0245h(NT): Motion Adopted Regular Calendar 205-86; House Journal  10, PG.672-674 "
347682,2012-01-18,"House Print Debate in Permanent Journal (Rep Bettencourt): Motion Adopted Regular Calendar 280-10; House Journal  10, PG.674-676 "
347682,2012-01-18,"House Reconsideration (Rep Mirski): Motion Failed Voice Vote; House Journal  10, PG.676 "
347682,2012-01-25,"Senate Introduced and Referred to Internal Affairs"
347682,2012-02-02,"Senate Hearing: 2/7/12, Room 100, State House, 1:00 p.m.; Senate Calendar 6 "
347682,2012-02-23,"Senate Committee Report: Ought to Pass, 3/7/12; Senate Calendar 9 "
347682,2012-03-07,"Senate Ought to Pass: Regular Calendar 15Y-8N, Motion Adopted; OT3rdg; Senate Journal 6, Pg.162 "
347682,2012-03-07,"Senate Enrolled; Senate Journal 7, Pg.188 "
347682,2012-03-15,"House Enrolled; House Journal  26, PG.1650 "
347682,2012-03-26,"House Vetoed by the Governor 03/23/2012 "
347682,2012-03-28,"House Print Governor's Veto Message in Permanent Journal and Consider It at the Present Time (Rep Bettencourt): Motion Adopted Voice Vote; House Journal  30, PG.1776-1778 "
347682,2012-03-28,"House Veto Overridden: Regular Calendar 246-112 By Necessary Two-Thirds Vote; House Journal  30, PG.1778-1781 "
347682,2012-03-28,"House Reconsideration (Rep Bettencourt): Motion Failed Division Vote 104-254; House Journal  30, PG.1781 "
347682,2012-03-28,"House Print Debate in Permanent Journal (Rep Bettencourt): Motion Adopted Voice Vote; House Journal  30, PG.1781 "
347682,2012-03-28,"Senate Notwithstanding the Governors Veto, Shall HB 592 Become Law: Regular Calendar 17Y-7N, Veto Overridden by required two-thirds vote; Senate Journal 8, Pg.327 "
347682,2012-04-02,"House Veto Override 03/28/2012; Effective 03/28/2012; Chapter 0009 "
347684,2011-01-24,"House Introduced 1/6/2011 and Referred to Ways and Means; House Journal  11, PG. 192 "
347684,2011-02-09,"House Public Hearing: 2/22/2011 3:00 PM Legislative Office Building 202 ==Executive Session to Follow== "
347684,2011-02-28,"House Retained in Committee; House Calendar 27, PG.826 "
347684,2011-06-02,"House Retained Bill - Full Committee Work Session: 6/7/2011 10:00 Amendment Legislative Office Building 202 "
347684,2011-09-06,"House Retained Bill - Subcommittee Work Session: 9/20/2011 10:00 Amendment Legislative Office Building 202 "
347684,2011-09-19,"House Retained Bill - Subcommittee Work Session: 9/27/2011 1:00 PM Legislative Office Building 202 "
347684,2011-09-20,"House Retained Bill - Subcommittee Work Session: 9/29/2011 1:00 PM Legislative Office Building 202 "
347684,2011-09-29,"House Retained Bill - Subcommittee Work Session: 10/4/2011 10:00 Amendment Legislative Office Building 202 "
347684,2011-09-29,"House Retained Bill - Subcommittee Work Session: 10/6/2011 10:00 Amendment Legislative Office Building 202 ==TIME CHANGE (Orig 12:30 PM)== "
347684,2011-10-04,"House ==CANCELLED== Retained Bill - Subcommittee Work Session: 10/11/2011 2:00 PM Legislative Office Building 203 "
347684,2011-10-04,"House Retained Bill - Executive Session: 10/26/2011 1:00 PM Legislative Office Building 202 ==RECESSED== "
347684,2011-10-20,"House Retained Bill - Rescheduled Executive Session 10/27/2011 1:00 PM Legislative Office Building 202 "
347684,2011-11-02,"House Majority Committee Report: Ought to Pass with Amendment #2812h for Jan 4 (Vote 14-7; Regular Calendar); House Calendar 6, PG.296-297 "
347684,2011-11-02,"House Proposed Majority Committee Amendment #2011-2812h; House Calendar 6, PG.315-335 "
347684,2011-11-02,"House Minority Committee Report: Inexpedient to Legislate; House Calendar 6, PG.296-297 "
347684,2012-01-11,"House Special Order to Feb 8 Calendar (Rep Stepanek): Motion Adopted Division Vote 246-99; House Journal  9, PG.552-572 "
347684,2012-02-08,"House Special Order to Next Order of Business: Without Objection; House Journal  15, PG.860 "
347684,2012-02-08,"House Recommit (Rep Stepanek): Motion Adopted Division Vote 257-91; House Journal  15, PG.860-881 "
347684,2012-02-08,"House Public Hearing on Proposed Amendment #2012-0658h: 2/13/2012 1:00 PM Legislative Office Building 202 "
347684,2012-02-08,"House Public Hearing on Proposed Amendment #2012-0560h: 2/13/2012 1:01 PM Legislative Office Building 202 "
347684,2012-02-14,"House Subcommittee Work Session: 2/17/2012 1:00 PM Legislative Office Building 202 "
347684,2012-02-14,"House Executive Session: 2/21/2012 10:00 Amendment Legislative Office Building 202 "
347684,2012-02-21,"House Majority Committee Report: Ought to Pass with Amendment #0917h for Mar 28 (Vote 14-7; Regular Calendar); House Calendar 25, PG.1514-1515 "
347684,2012-02-21,"House Proposed Majority Committee Amendment #2012-0917h; House Calendar 25, PG.1533-1553 "
347684,2012-02-21,"House Minority Committee Report: Inexpedient to Legislate; House Calendar 25, PG.1514-1515 "
347684,2012-03-28,"House Special Order to Today to Approximately 3:00 PM (Rep Stepanek): Motion Adopted Division Vote 302-20; House Journal  30, PG.1789 "
347684,2012-03-28,"House Amendment #0917h Failed, Regular Calendar 154-195; House Journal  30, PG.1793-1816 "
347684,2012-03-28,"House Floor Amendment #2012-1372h(NT) (Rep Vaillancourt): Amendment Failed Division Vote 104-239; House Journal  30, PG.1816-1825 "
347684,2012-03-28,"House Reconsideration of Amendment #0917h (Rep Jennifer Coffey): Motion Failed Regular Calendar 129-216; House Journal  30, PG.1825-1827 "
347684,2012-03-28,"House Ought to Pass: Motion Failed Regular Calendar 118-226; House Journal  30, PG.1827-1829 "
347684,2012-03-28,"House Inexpedient to Legislate (Rep Hess): Motion Adopted Division Vote 236-108; House Journal  30, PG.1829 "
347684,2012-03-28,"House Reconsideration (Rep Hess): Motion Failed Voice Vote; House Journal  30, PG.1829 "
347685,2011-01-24,"House Introduced 1/6/2011 and Referred to Education; House Journal  11, PG. 192 "
347685,2011-02-02,"House Public Hearing: 2/8/2011 2:00 PM Representative's Hall "
347685,2011-02-09,"House Subcommittee Work Session: 2/15/2011 8:00 Amendment Legislative Office Building 207 "
347685,2011-02-09,"House Subcommittee Work Session: 2/17/2011 8:00 Amendment Legislative Office Building 207 "
347685,2011-02-09,"House ==CANCELLED== Subcommittee Work Session: 2/22/2011 8:00 Amendment Legislative Office Building 207 "
347685,2011-02-10,"House ==CANCELLED== Work Session: 2/24/2011 9:00 Amendment Legislative Office Building 207 "
347685,2011-02-10,"House Executive Session: 2/24/2011 1:00 PM Legislative Office Building 207 "
347685,2011-02-24,"House Retained in Committee; House Calendar 27, PG.823 "
347685,2011-08-17,"House Retained Bill - Subcommittee Work Session: 9/6/2011 10:00 Amendment Legislative Office Building 207 "
347685,2011-08-17,"House Retained Bill - Subcommittee Work Session: 9/13/2011 10:00 Amendment Legislative Office Building 207 "
347685,2011-10-04,"House Retained Bill - Executive Session: 10/18/2011 10:00 Amendment Legislative Office Building 207 "
347685,2011-10-21,"House Majority Committee Report: Inexpedient to Legislate for Jan 4 (Vote 12-2; Regular Calendar); House Calendar 70, PG.2217 "
347685,2011-10-21,"House Minority Committee Report: Ought to Pass; House Calendar 70, PG.2217 "
347685,2012-01-05,"House Inexpedient to Legislate: Motion Adopted Regular Calendar 263-82; House Journal  8, PG.474-477 "
347687,2011-01-24,"House Introduced 1/6/2011 and Referred to Children and Family Law; House Journal  11, PG. 192 "
347687,2011-02-16,"House ==CANCELLED== Public Hearing: 2/16/2011 9:00 Amendment Legislative Office Building 206 "
347687,2011-02-16,"House ==RESCHEDULED== Public Hearing: 2/24/2011 9:00 Amendment Legislative Office Building 206 "
347687,2011-03-01,"House Executive Session: 3/7/2011 10:00 Amendment Legislative Office Building 206 "
347687,2011-03-09,"House Committee Report: Ought to Pass for Mar 15 (Vote 11-0; Consent Calendar); House Calendar 22, PG.523 "
347687,2011-03-15,"House Ought to Pass: Motion Adopted Voice Vote; House Journal  26, PG.694 "
347687,2011-03-23,"Senate Introduced and Referred to Judiciary; Senate Journal 11, Pg.193 "
347687,2011-04-13,"Senate Hearing: 4/28/11, Room 101, Legislative Office Building, 1:45 p.m.; Senate Calendar 20 "
347687,2011-05-26,"Senate Committee Report: Rereferred to Committee, 6/1/11; Senate Calendar 26 "
347687,2011-06-01,"Senate Rereferred to Committee, Motion Adopted, Voice Vote; Senate Journal 19, Pg.519 "
347687,2012-01-10,"Senate Committee Report: Ought to Pass with Amendment #2012-0133s, 1/18/12; Senate Calendar 3 "
347687,2012-01-18,"Senate Committee Amendment 0133s, Amendment Adopted, Voice Vote; Senate Journal 2, Pg.65 "
347687,2012-01-18,"Senate Ought to Pass with Amendment 0133s, Motion Adopted, Voice Vote; OT3rdg; Senate Journal 2, Pg.66 "
347687,2012-03-07,"House House Non-Concurs with Senate Amendment and Requests C of C (Rep Moran): Motion Adopted Voice Vote; House Journal  21, PG.1253 "
347687,2012-03-07,"House Speaker Appoints: Reps Moran, E.Hogan, C.Soucy, and Lovejoy; House Journal  21, PG.1253 "
347687,2012-05-02,"Senate Sen. Houde Accede to House Request for Committee of Conference Motion Adopted, Voice Vote "
347687,2012-05-02,"Senate President Appoints: Senators Groen, Forsythe, and Houde "
347687,2012-05-23,"House Conference Committee Meeting: 5/29/2012 1:00 PM Legislative Office Building 206 "
347687,2012-05-30,"Senate Conference Committee Report #2012-2412c; Senate Amendment + New Amendment, Filed "
347687,2012-06-06,"Senate Conference Committee Report 2412c; Adopted, Voice Vote "
347687,2012-06-06,"House Conference Committee Report #2412c Adopted, Voice Vote; House Journal  51, PG.2595 "
347687,2012-06-06,"Senate Enrolled "
347687,2012-06-06,"House Enrolled; House Journal  51, PG.2613 "
347687,2012-06-22,"House Signed By Governor 06/18/2012; Effective 07/01/2013; Chapter 0248 "
347688,2011-01-24,"House Introduced 1/6/2011 and Referred to Judiciary; House Journal  11, PG. 193 "
347688,2011-02-01,"House Public Hearing: 2/10/2011 2:00 PM Legislative Office Building 208 "
347688,2011-02-15,"House Executive Session: 2/15/2011 Legislative Office Building 208 Following House Session "
347688,2011-02-15,"House Retained in Committee; House Calendar 27, PG.824 "
347688,2011-08-09,"House Retained Bill - Subcommittee Work Session: 9/13/2011 11:00 Amendment Legislative Office Building 208 "
347688,2011-09-14,"House Retained Bill - Executive Session: 10/25/2011 11:00 Amendment Legislative Office Building 208 "
347688,2011-11-02,"House Committee Report: Inexpedient to Legislate for Jan 4 (Vote 16-0; Consent Calendar); House Calendar 70, PG.2206 "
347688,2012-01-04,"House Inexpedient to Legislate: Motion Adopted Voice Vote; House Journal  7, PG.412 "
347690,2011-01-24,"House Introduced 1/6/2011 and Referred to Commerce and Consumer Affairs; House Journal  11, PG. 193  "
347690,2011-02-01,"House Public Hearing: 2/10/2011 2:00 PM Legislative Office Building 302 "
347690,2011-02-02,"House Executive Session: 2/15/2011 Legislative Office Building 302 3:00 PM or Immediately Following House Session "
347690,2011-02-15,"House Retained in Committee; House Calendar 27, PG.822 "
347690,2011-08-23,"House Retained Bill - Insurance/Consumer Div Subcom Work Session: 10/4/2011 2:00 PM Legislative Office Building 302 "
347690,2011-10-11,"House Retained Bill - Executive Session: 10/20/2011 1:15 PM Legislative Office Building 302 "
347690,2011-10-26,"House Retained Bill - Insurance/Consumer Div Subcom Work Session: 11/1/2011 9:00 Amendment Legislative Office Building 302 "
347690,2011-10-26,"House Retained Bill - Executive Session: 11/1/2011 10:00 Amendment Legislative Office Building 302 "
347690,2011-11-02,"House Majority Committee Report: Ought to Pass with Amendment #2645h for Jan 4 (Vote 12-2; Regular Calendar); House Calendar 70, PG.2214 "
347690,2011-11-02,"House Proposed Majority Committee Amendment #2011-2645h; House Calendar 69, PG.2178 "
347690,2011-11-02,"House Minority Committee Report: Ought to Pass with Amendment #2813h(NT); House Calendar 70, PG.2214 "
347690,2011-11-02,"House Proposed Minority Committee Amendment #2011-2813h (New Title); House Calendar 69, PG.2179 "
347690,2012-01-04,"House Amendment #2645h Adopted, Voice Vote; House Journal  7, PG.443-444 "
347690,2012-01-04,"House Floor Amendment #2011-2820h (Rep Manuse) Failed, Voice Vote; House Journal  7, PG.444-445 "
347690,2012-01-04,"House Ought to Pass with Amendment #2645h: Motion Adopted Voice Vote; House Journal  7, PG.443-445 "
347690,2012-01-04,"House Referred to Ways and Means; House Journal  7, PG.445 "
347690,2012-01-10,"House Public Hearing: 2/7/2012 11:00 Amendment Legislative Office Building 202 "
347690,2012-01-10,"House ==CANCELLED== Executive Session: 2/9/2012 10:00 Amendment Legislative Office Building 202 "
347690,2012-02-07,"House Subcommittee Work Session: 2/14/2012 2:00 PM Legislative Office Building 202 "
347690,2012-02-08,"House Executive Session: 2/16/2012 11:00 Amendment Legislative Office Building 202 "
347690,2012-02-16,"House Committee Report: Ought to Pass with Amendment #0831h for Mar 7 (Vote 17-2; Consent Calendar); House Calendar 18, PG.1078 "
347690,2012-02-16,"House Proposed Committee Amendment #2012-0831h; House Calendar 17, PG.973 "
347690,2012-03-07,"House Amendment #0831h Adopted, Voice Vote; House Journal  21, PG.1333 "
347690,2012-03-07,"House Ought to Pass with Amendment #0831h: Motion Adopted Voice Vote; House Journal  21, PG.1332-1333 "
347690,2012-03-07,"Senate Introduced and Referred to Health and Human Services; Senate Journal 7, Pg.185 "
347690,2012-03-23,"Senate Hearing: 3/29/12, Room 102, Legislative Office Building, 1:00 p.m.; Senate Calendar 12 "
347690,2012-04-12,"Senate Committee Report: Ought to Pass, 4/18/12; Senate Calendar 15 "
347690,2012-04-18,"Senate Ought to Pass: Motion Adopted, Voice Vote; Refer to Finance Rule 4-3; Senate Journal 10, Pg.369 "
347690,2012-04-19,"Senate Committee Report: Ought to Pass, 4/25/12; Senate Calendar 16 "
347690,2012-04-25,"Senate Ought to Pass: Motion Adopted, Voice Vote; OT3rdg; Senate Journal 11, Pg.415 "
347690,2012-05-16,"Senate Enrolled Bill Amendment #2151e Adopted "
347690,2012-05-17,"House Enrolled Bill Amendment #2012-2151e Adopted; House Journal  46, PG.2485 "
347690,2012-05-23,"Senate Enrolled "
347690,2012-05-30,"House Enrolled [Recessed from 5/17/2012 Session]; House Journal  46, PG.2495 "
347690,2012-06-07,"House Signed By Governor 06/05/2012; Effective 07/01/2012; Chapter 0117 "
347691,2011-01-24,"House Introduced 1/6/2011 and Referred to Education; House Journal  11, PG. 193  "
347691,2011-02-09,"House Public Hearing: 2/15/2011 4:00 PM Legislative Office Building 207 "
347691,2011-02-18,"House Executive Session: 2/24/2011 1:00 PM Legislative Office Building 207 "
347691,2011-02-24,"House Retained in Committee; House Calendar 27, PG.823 "
347691,2011-09-15,"House Retained Bill - Subcommittee Work Session: 9/27/2011 10:00 Amendment Legislative Office Building 207 "
347691,2011-09-15,"House Retained Bill - Subcommittee Work Session: 9/29/2011 10:00 Amendment Legislative Office Building 207 "
347691,2011-10-04,"House Retained Bill - Executive Session: 10/18/2011 10:00 Amendment Legislative Office Building 207 (If Necessary Continued 10/25/2011 10:00 Amendment Legislative Office Building 207) "
347691,2011-10-26,"House Committee Report: Ought to Pass with Amendment #2778h for Feb 15 (Vote 14-0; Consent Calendar); House Calendar 11, PG.683 "
347691,2011-10-26,"House Proposed Committee Amendment #2011-2778h; House Calendar 11, PG.720-721 "
347691,2012-02-15,"House Amendment #2778h Adopted, Voice Vote; House Journal  16, PG.913-914 "
347691,2012-02-15,"House Ought to Pass with Amendment #2778h: Motion Adopted Voice Vote; House Journal  16, PG.913-914 "
347691,2012-02-15,"House Referred to Finance; House Journal  16, PG.913-914 "
347691,2012-02-17,"House ==CANCELLED== Public Hearing: 3/8/2012 2:30 PM Legislative Office Building 210-211 "
347691,2012-02-21,"House Division II Work Session: 2/23/2012 1:00 PM Legislative Office Building 209 "
347691,2012-02-23,"House Executive Session: 3/20/2012 11:00 Amendment Legislative Office Building 210-211 "
347691,2012-03-22,"House Committee Report: Inexpedient to Legislate for Mar 28 (Vote 24-0; Consent Calendar); House Calendar 25, PG.1504 "
347691,2012-03-28,"House Inexpedient to Legislate: Motion Adopted Voice Vote; House Journal  30, PG.1753 "
347693,2011-01-25,"House Introduced 1/6/2011 and Referred to Ways and Means; House Journal  11, PG. 193 "
347693,2011-02-09,"House ==CANCELLED== Public Hearing: 2/22/2011 1:00 PM Legislative Office Building 202 "
347693,2011-02-16,"House ==CANCELLED== Public Hearing: 3/7/2011 10:00 Amendment Legislative Office Building 202 "
347693,2011-02-22,"House Public Hearing: 3/9/2011 10:00 Amendment Legislative Office Building 202 "
347693,2011-02-23,"House Executive Session: 3/9/2011 1:00 PM Legislative Office Building 202 ==TIME CHANGE (Orig 2:00 PM)== "
347693,2011-03-09,"House Retained in Committee; House Calendar 27, PG.826 "
347693,2011-06-02,"House Retained Bill - Full Committee Work Session: 6/7/2011 10:00 Amendment Legislative Office Building 202 "
347693,2011-10-03,"House Retained Bill - Executive Session: 10/26/2011 1:00 PM Legislative Office Building 202 ==RECESSED== "
347693,2011-10-20,"House Retained Bill - Rescheduled Executive Session 10/27/2011 1:00 PM Legislative Office Building 202 "
347693,2011-11-02,"House Committee Report: Refer to Interim Study for Jan 4 (Vote 20-0; Consent Calendar); House Calendar 70, PG.2211 "
347693,2012-01-04,"House Refer to Interim Study: Motion Adopted Voice Vote; House Journal  7, PG.429 "
347693,2012-06-07,"House Referred to Ways and Means for Interim Study; House Calendar 45, PG.2434 "
347693,2012-09-18,"House Interim Study - Subcommittee Work Session: 9/25/2012 10:30 Amendment Legislative Office Building 202 "
347693,2012-09-27,"House Interim Study - Subcommittee Work Session: 10/2/2012 11:00 Amendment Legislative Office Building 202 "
347694,2011-01-25,"House Introduced 1/6/2011 and Referred to Finance; House Journal  11, PG. 193 "
347694,2011-02-01,"House Public Hearing: 2/10/2011 10:45 Amendment Legislative Office Building 210-211 ==RECESSED== "
347694,2011-02-14,"House Continued Public Hearing: 2/14/2011 10:15 Amendment Legislative Office Building 210-211 "
347694,2011-02-23,"House Executive Session: 3/1/2011 10:00 Amendment Legislative Office Building 210-211 "
347694,2011-03-01,"House Retained in Committee; House Calendar 27, PG.824 "
347694,2011-08-18,"House Retained Bill - Subcommittee Work Session: 9/8/2011 10:00 Amendment Legislative Office Building 210-211 "
347694,2011-08-18,"House Retained Bill - Subcommittee Work Session: 9/15/2011 10:00 Amendment Legislative Office Building 210-211 "
347694,2011-09-08,"House Retained Bill - Subcommittee Work Session: 9/22/2011 9:00 Amendment Legislative Office Building 210-211 ==TIME CHANGE (Orig 10:00 Amendment)== "
347694,2011-09-08,"House Retained Bill - Subcommittee Work Session: 9/29/2011 10:00 Amendment Legislative Office Building 210-211 "
347694,2011-09-14,"House Retained Bill - Subcommittee Work Session: 10/6/2011 10:00 Amendment Legislative Office Building 210-211 "
347694,2011-09-14,"House Retained Bill - Subcommittee Work Session: 10/13/2011 10:00 Amendment Legislative Office Building 210-211 "
347694,2011-10-13,"House ==CANCELLED== Retained Bill - Subcommittee Work Session: 10/20/2011 10:00 Amendment Legislative Office Building 210-211 "
347694,2011-10-13,"House ==CANCELLED== Retained Bill - Subcommittee Work Session: 10/27/2011 10:00 Amendment Legislative Office Building 210-211 "
347694,2011-10-13,"House Retained Bill - Executive Session: 10/25/2011 10:00 Amendment Legislative Office Building 210-211 "
347694,2011-10-26,"House Committee Report: Ought to Pass with Amendment #2738h(NT) for Jan 4 (Vote 16-3; Regular Calendar); House Calendar 70, PG.2219-2220 "
347694,2011-10-26,"House Proposed Committee Amendment #2011-2738h (New Title); House Calendar 69, PG.2180-2182 "
347694,2012-01-05,"House Amendment #2738h(NT) Failed, Voice Vote; House Journal  8, PG.511-513 "
347694,2012-01-05,"House Floor Amendment #2012-0102h(NT) (Rep L.Ober) Adopted, Voice Vote; House Journal  8, PG.513-515 "
347694,2012-01-05,"House Ought to Pass with Amendment #0102h(NT): Motion Adopted Voice Vote; House Journal  8, PG.511-515 "
347694,2012-02-15,"Senate Introduced and Referred to Finance; Senate Journal 6, Pg.144 "
347694,2012-04-11,"Senate Hearing: 4/19/12, Room 103, State House, 1:45 p.m.; Senate Calendar 15 "
347694,2012-04-26,"Senate Committee Report: Referred to Interim Study, 5/2/12; Vote 7-0; Consent Calendar; Senate Calendar 17 "
347694,2012-05-02,"Senate Refer to Interim Study, Motion Adopted, Voice Vote; Senate Journal 12, Pg.421 "
347696,2011-01-25,"House Introduced 1/6/2011 and Referred to Commerce and Consumer Affairs; House Journal  11, PG. 193  "
347696,2011-02-01,"House Public Hearing: 2/10/2011 2:45 PM Legislative Office Building 302 "
347696,2011-02-02,"House Executive Session: 2/15/2011 Legislative Office Building 302 3:00 PM or Immediately Following House Session "
347696,2011-02-15,"House Retained in Committee; House Calendar 27, PG.822 "
347696,2011-08-23,"House Retained Bill - Insurance/Consumer Div Subcom Work Session: 9/27/2011 2:00 PM Legislative Office Building 302 "
347696,2011-10-11,"House Retained Bill - Executive Session: 10/20/2011 1:15 PM Legislative Office Building 302 "
347696,2011-11-02,"House Committee Report: Inexpedient to Legislate for Jan 4 (Vote 12-0; Consent Calendar); House Calendar 70, PG.2201 "
347696,2012-01-04,"House Inexpedient to Legislate: Motion Adopted Voice Vote; House Journal  7, PG.373 "
347697,2011-01-25,"House Introduced 1/6/2011 and Referred to Executive Departments and Administration; House Journal  11, PG. 194 "
347697,2011-02-02,"House Public Hearing: 2/24/2011 10:00 Amendment Legislative Office Building 306 "
347697,2011-03-02,"House Executive Session: 3/2/2011 Legislative Office Building 301 Following House Session "
347697,2011-03-03,"House Retained in Committee; House Calendar 27, PG.824 "
347697,2011-05-25,"House Retained Bill - Subcommittee Work Session: 6/2/2011 10:00 Amendment Legislative Office Building 306 "
347697,2011-09-22,"House Retained Bill - Subcommittee Work Session: 9/28/2011 1:00 PM Legislative Office Building 306 "
347697,2011-09-23,"House Retained Bill - Subcommittee Work Session: 10/4/2011 10:00 Amendment Legislative Office Building 306 "
347697,2011-10-20,"House Retained Bill - Subcommittee Work Session: 10/26/2011 1:00 PM Legislative Office Building 306 "
347697,2011-10-20,"House Retained Bill - Executive Session: 10/27/2011 10:00 Amendment Legislative Office Building 306 (If Necessary Continued 11/1/2011 10:30 Amendment Legislative Office Building 306) "
347697,2011-11-01,"House Committee Report: Ought to Pass with Amendment #2775h(NT) for Jan 4 (Vote 16-0; Consent Calendar); House Calendar 70, PG.2205 "
347697,2011-11-01,"House Proposed Committee Amendment #2011-2775h (New Title); House Calendar 69, PG.2182 "
347697,2012-01-04,"House Amendment #2775h(NT) Adopted, Voice Vote; House Journal  7, PG.401-402 "
347697,2012-01-04,"House Ought to Pass with Amendment #2775h(NT): Motion Adopted Voice Vote; House Journal  7, PG.401-402 "
347697,2012-02-15,"Senate Introduced and Referred to Executive Departments and Administration; Senate Journal 6, Pg.145 "
347697,2012-03-08,"Senate Hearing: 3/15/12, Room 100, State House, 9:15 a.m.; Senate Calendar 10 "
347697,2012-03-22,"Senate Committee Report: Ought to Pass with Amendment #2012-1396s, New Title, 3/28/12; Vote 5-0; Consent Calendar; Senate Calendar 12 "
347697,2012-03-28,"Senate Committee Amendment 1396s, New Title, Amendment Adopted, Voice Vote; Senate Journal 8, Pg.262; Senate Journal 8, Pg.263 "
347697,2012-03-28,"Senate Ought to Pass with Amendment 1396s, New Title, Motion Adopted, Voice Vote; OT3rdg; Senate Journal 8, Pg.328 "
347697,2012-04-11,"House House Concurs with Senate Amendment (Rep C.McGuire): Motion Adopted Voice Vote "
347697,2012-04-11,"House Enrolled "
347697,2012-04-18,"Senate Enrolled; Senate Journal 11, Pg.384 "
347697,2012-04-24,"House Signed By Governor 04/23/2012; Effective 04/23/2012; Chapter 0011 "
347699,2011-01-25,"House Introduced 1/6/2011 and Referred to Executive Departments and Administration; House Journal  11, PG. 194  "
347699,2011-02-03,"House ==CANCELLED== Public Hearing: 2/17/2011 10:00 Amendment Legislative Office Building 306 "
347699,2011-02-10,"House Public Hearing: 2/14/2011 10:00 Amendment Legislative Office Building 306 ==RECESSED== "
347699,2011-02-14,"House Continued Public Hearing: 2/15/2011 3:15 PM Legislative Office Building 306 "
347699,2011-02-14,"House Executive Session: 2/16/2011 Legislative Office Building 306 1:30 PM or 45 Minutes After Session "
347699,2011-02-17,"House Retained in Committee; House Calendar 27, PG.824 "
347699,2011-03-29,"House Retained Bill - Full Committee Work Session: 4/12/2011 1:30 PM Legislative Office Building 306 "
347699,2011-04-05,"House Retained Bill - Subcommittee Work Session: 4/14/2011 1:45 PM Legislative Office Building 306 "
347699,2011-06-09,"House Retained Bill - Subcommittee Work Session: 6/28/2011 11:00 Amendment Legislative Office Building 306 "
347699,2011-08-24,"House Retained Bill - Subcommittee Work Session: 8/30/2011 10:00 Amendment Legislative Office Building 306 "
347699,2011-08-30,"House Retained Bill - Subcommittee Work Session: 9/20/2011 10:00 Amendment Legislative Office Building 306 "
347699,2011-09-27,"House Retained Bill - Subcommittee Work Session: 10/4/2011 2:00 PM Legislative Office Building 306 "
347699,2011-09-27,"House Retained Bill - Executive Session: 10/11/2011 10:30 Amendment Legislative Office Building 306 "
347699,2011-11-01,"House Committee Report: Ought to Pass with Amendment #2666h for Jan 4 (Vote 8-2; Regular Calendar); House Calendar 70, PG.2219 "
347699,2011-11-01,"House Proposed Committee Amendment #2011-2666h; House Calendar 69, PG.2182-2185 "
347699,2012-01-04,"House Amendment #2666h Adopted, Voice Vote; House Journal  8, PG.506-509 "
347699,2012-01-04,"House Ought to Pass with Amendment #2666h: Motion Adopted Voice Vote; House Journal  8, PG.506-510 "
347699,2012-01-04,"House Referred to Finance; House Journal  8, PG.510 "
347699,2012-01-11,"House Public Hearing: 1/25/2012 1:00 PM Legislative Office Building 210-211 "
347699,2012-01-25,"House Division I Work Session: 2/7/2012 11:00 Amendment Legislative Office Building 212 "
347699,2012-01-31,"House Executive Session: 2/7/2012 1:30 PM Legislative Office Building 210-211 "
347699,2012-02-08,"House Committee Report: Refer to Interim Study for Feb 15 (Vote 22-0; Consent Calendar); House Calendar 11, PG.686 "
347699,2012-02-15,"House Refer to Interim Study: Motion Adopted Voice Vote; House Journal  16, PG.920 "
347699,2012-06-07,"House Referred to Finance for Interim Study; House Calendar 45, PG.2433 "
347699,2012-06-13,"House Interim Study - Division Vote I Organizational Meeting: 6/19/2012 11:00 Amendment Legislative Office Building 212 "
347699,2012-06-19,"House Interim Study - Division Vote I Subcommittee Work Session: 7/17/2012 10:00 Amendment Legislative Office Building 212 "
347700,2011-01-25,"House Introduced 1/6/2011 and Referred to Commerce and Consumer Affairs; House Journal  11, PG. 194 "
347700,2011-02-09,"House Public Hearing: 2/24/2011 10:30 Amendment Legislative Office Building 302 "
347700,2011-03-01,"House Executive Session: 3/9/2011 9:00 Amendment Legislative Office Building 302 "
347700,2011-03-10,"House Committee Report: Ought to Pass for Mar 15 (Vote 13-2; Consent Calendar); House Calendar 22, PG.526 "
347700,2011-03-15,"House Ought to Pass: Motion Adopted Voice Vote; House Journal  26, PG.706 "
347700,2011-03-23,"Senate Introduced and Referred to Commerce; Senate Journal 11, Pg.194 "
347700,2011-03-31,"Senate Hearing: 4/6/11, Room 102, Legislative Office Building, 9:20 a.m.; Senate Calendar 18 "
347700,2011-04-06,"Senate Committee Report: Rereferred to Committee, 4/13/11; Senate Calendar 19 "
347700,2011-04-13,"Senate Rereferred to Committee, Motion Adopted, Voice Vote; Senate Journal 12, Pg.245 "
347700,2012-01-11,"Senate Committee Report: Ought to Pass with Amendment #2012-0166s, 1/18/12; Senate Calendar 3 "
347700,2012-01-18,"Senate Committee Amendment 0166s, Amendment Adopted, Voice Vote; Senate Journal 2, Pg.36 "
347700,2012-01-18,"Senate Ought to Pass with Amendment 0166s, Motion Adopted, Voice Vote; OT3rdg; Senate Journal 2, Pg.36 "
347700,2012-02-22,"House House Non-Concurs with Senate Amendment and Requests C of C (Rep Jennifer Coffey): Motion Adopted Voice Vote; House Journal  20, PG.1200 "
347700,2012-02-22,"House Speaker Appoints: Reps Hunt, Manuse, Flanders, and Schlachman; House Journal  20, PG.1200 "
347700,2012-03-21,"Senate President Appoints: Senators White, Houde, and Prescott "
347700,2012-04-25,"Senate Sen. Prescott accedes to House Request for Committee of Conference, Motion Adopted, Voice Vote "
347700,2012-05-22,"House Conference Committee Meeting: 5/29/2012 11:00 Amendment Legislative Office Building 302 "
347700,2012-05-30,"House Conferee Change: Rep Gidge Replaces Rep Schlachman; House Journal  47, PG.2507 "
347700,2012-05-31,"Senate Conference Committee Report; Not Signed Off "
347702,2011-01-25,"House Introduced 1/6/2011 and Referred to Children and Family Law; House Journal  11, PG. 194 "
347702,2011-02-09,"House Vacated from Children and Family Law and Referred to Criminal Justice and Public Safety; House Journal  16, PG.308 "
347702,2011-02-16,"House Public Hearing: 3/1/2011 11:15 Amendment Legislative Office Building 204 "
347702,2011-03-02,"House Executive Session: 3/9/2011 10:00 Amendment Legislative Office Building 204 "
347702,2011-03-09,"House Retained in Committee; House Calendar 27, PG.823 "
347702,2011-06-08,"House Retained Bill - Subcommittee Work Session: 8/2/2011 10:00 Amendment Legislative Office Building 204 "
347702,2011-08-02,"House Retained Bill - Subcommittee Work Session: 8/16/2011 10:00 Amendment Legislative Office Building 204 "
347702,2011-08-16,"House Retained Bill - Subcommittee Work Session: 8/30/2011 10:00 Amendment Legislative Office Building 204 "
347702,2011-09-27,"House Retained Bill - Executive Session: 10/20/2011 10:00 Amendment Legislative Office Building 204 ==RECESSED== "
347702,2011-10-20,"House Retained Bill - Continued Executive Session: 10/25/2011 10:00 Amendment Legislative Office Building 204 "
347702,2011-10-26,"House Committee Report: Ought to Pass with Amendment #2768h(NT) for Jan 4 (Vote 10-6; Regular Calendar); House Calendar 70, PG.2216 "
347702,2011-10-26,"House Proposed Committee Amendment #2011-2768h (New Title); House Calendar 69, PG.2185-2186 "
347702,2012-01-05,"House Amendment #2768h(NT) Adopted, Voice Vote; House Journal  8, PG.469-470 "
347702,2012-01-05,"House Ought to Pass with Amendment #2768h(NT): Motion Adopted Regular Calendar 188-136; House Journal  8, PG.469-472 "
347702,2012-02-08,"Senate Introduced and Referred to Transportation; Senate Journal 5, Pg.122 "
347702,2012-02-23,"Senate Hearing: 3/8/12, Room 103, Legislative Office Building, 9:30 a.m.; Senate Calendar 9 "
347702,2012-04-12,"Senate Committee Report: Inexpedient to Legislate, 4/18/12; Senate Calendar 15 "
347702,2012-04-18,"Senate Inexpedient to Legislate, Motion Adopted, Voice Vote === BILL KILLED ===; Senate Journal 10, Pg.372 "
347703,2011-01-25,"House Introduced 1/6/2011 and Referred to Health, Human Services and Elderly Affairs; House Journal  11, PG. 194 "
347703,2011-02-02,"House ===CANCELLED=== Work Session: 2/10/2011 2:00 PM Legislative Office Building 205 "
347703,2011-02-02,"House Public Hearing: 2/10/2011 2:00 PM Legislative Office Building 205 "
347703,2011-02-23,"House Executive Session: 3/1/2011 9:00 Amendment Legislative Office Building 205 "
347703,2011-03-02,"House Committee Report: Ought to Pass for Mar 15 (Vote 14-3; Regular Calendar); House Calendar 22, PG.556 "
347703,2011-03-16,"House Ought to Pass: Motion Adopted Voice Vote; House Journal  28, PG.872 "
347703,2011-03-23,"Senate Introduced and Referred to Health and Human Services; Senate Journal 11, Pg.194 "
347703,2011-03-24,"Senate Hearing: 4/7/11, Room 102, Legislative Office Building, 1:50 p.m.; Senate Calendar 17 "
347703,2011-04-25,"Senate Committee Report: Rereferred to Committee, 5/4/11; Senate Calendar 22 "
347703,2011-05-04,"Senate Rereferred to Committee, Motion Adopted, Voice Vote; Senate Journal 15, Pg.307 "
347703,2012-01-12,"Senate Committee Report: Inexpedient to Legislate; 1/18/12; Senate Calendar 3 "
347703,2012-01-18,"Senate Inexpedient to Legislate, Motion Adopted, Voice Vote === BILL KILLED ===; Senate Journal 2, Pg.63 "
347705,2011-01-25,"House Introduced 1/6/2011 and Referred to Commerce and Consumer Affairs; House Journal  11, PG. 194 "
347705,2011-02-09,"House Public Hearing: 3/4/2011 10:30 Amendment Legislative Office Building 302 "
347705,2011-03-01,"House Executive Session: 3/9/2011 9:00 Amendment Legislative Office Building 302 "
347705,2011-03-09,"House Retained in Committee; House Calendar 27, PG.822 "
347705,2011-08-23,"House Retained Bill - Insurance/Consumer Div Subcom Work Session: 9/20/2011 2:00 PM Legislative Office Building 302 "
347705,2011-09-27,"House Retained Bill - Executive Session: 10/6/2011 10:00 Amendment Legislative Office Building 302 ==RECESSED== "
347705,2011-10-11,"House Retained Bill - Executive Session: 10/20/2011 1:15 PM Legislative Office Building 302 "
347705,2011-10-28,"House Committee Report: Inexpedient to Legislate for Jan 4 (Vote 12-0; Consent Calendar); House Calendar 70, PG.2201 "
347705,2012-01-04,"House Inexpedient to Legislate: Motion Adopted Voice Vote; House Journal  7, PG.373 "
347706,2011-01-25,"House Introduced 1/6/2011 and Referred to Public Works and Highways; House Journal  11, PG. 194 "
347706,2011-02-08,"House Public Hearing: 2/24/2011 9:30 Amendment Legislative Office Building 201 "
347706,2011-03-02,"House Executive Session: 3/2/2011 Legislative Office Building 201 Following House Session "
347706,2011-03-02,"House Retained in Committee; House Calendar 27, PG.825 "
347706,2011-08-24,"House Retained Bill - Executive Session: 9/27/2011 10:00 Amendment Legislative Office Building 201 "
347706,2011-09-28,"House Committee Report: Inexpedient to Legislate for Jan 4 (Vote 14-0; Consent Calendar); House Calendar 70, PG.2208 "
347706,2012-01-04,"House Inexpedient to Legislate: Motion Adopted Voice Vote; House Journal  7, PG.418 "
347708,2011-01-26,"House Introduced 1/26/2011 and Referred to Ways and Means; House Journal  14, PG.264 "
347708,2011-02-09,"House Public Hearing: 2/17/2011 10:15 Amendment Legislative Office Building 202 "
347708,2011-02-23,"House Executive Session: 2/24/2011 12:30 PM Legislative Office Building 202 "
347708,2011-02-28,"House Retained in Committee; House Calendar 27, PG.826 "
347708,2011-06-02,"House Retained Bill - Full Committee Work Session: 6/7/2011 10:00 Amendment Legislative Office Building 202 "
347708,2011-10-03,"House Retained Bill - Executive Session: 10/26/2011 1:00 PM Legislative Office Building 202 ==RECESSED== "
347708,2011-10-20,"House Retained Bill - Rescheduled Executive Session 10/27/2011 1:00 PM Legislative Office Building 202 "
347708,2011-11-02,"House Committee Report: Refer to Interim Study for Jan 4 (Vote 16-4; Regular Calendar); House Calendar 70, PG.2227 "
347708,2012-01-11,"House Refer to Interim Study: Motion Adopted Voice Vote; House Journal  9, PG.572 "
347708,2012-06-07,"House Referred to Ways and Means for Interim Study; House Calendar 45, PG.2434 "
347708,2012-09-18,"House Interim Study - Subcommittee Work Session: 9/25/2012 10:00 Amendment Legislative Office Building 202 "
347709,2011-01-28,"House Introduced 1/26/2011 and Referred to Ways and Means; House Journal  14, PG.264 "
347709,2011-02-09,"House Public Hearing: 2/17/2011 11:15 Amendment Legislative Office Building 202 "
347709,2011-02-23,"House Executive Session: 2/24/2011 12:30 PM Legislative Office Building 202 "
347709,2011-02-28,"House Retained in Committee; House Calendar 27, PG.826 "
347709,2011-06-02,"House Retained Bill - Full Committee Work Session: 6/7/2011 10:00 Amendment Legislative Office Building 202 "
347709,2011-10-03,"House Retained Bill - Executive Session: 10/26/2011 1:00 PM Legislative Office Building 202 ==RECESSED== "
347709,2011-10-20,"House Retained Bill - Rescheduled Executive Session 10/27/2011 1:00 PM Legislative Office Building 202 "
347709,2011-11-02,"House Committee Report: Refer to Interim Study for Jan 4 (Vote 16-4; Regular Calendar); House Calendar 70, PG.2227 "
347709,2012-01-11,"House Refer to Interim Study: Motion Adopted Voice Vote; House Journal  9, PG.572 "
347709,2012-06-07,"House Referred to Ways and Means for Interim Study; House Calendar 45, PG.2434 "
347709,2012-09-18,"House Interim Study - Subcommittee Work Session: 9/25/2012 10:00 Amendment Legislative Office Building 202 "
347711,2011-02-16,"House Late Drafting and Introduction Approved by Rules Committee; House Journal  19, PG.439 "
347711,2011-02-16,"House Introduced and Referred to Science, Technology and Energy; House Journal  19, PG.439 "
347711,2011-02-23,"House Public Hearing: 3/9/2011 10:15 Amendment Representative's Hall "
347711,2011-03-01,"House Executive Session: 3/10/2011 9:00 Amendment Legislative Office Building 304 "
347711,2011-03-15,"House Suspend House Rules to Allow Reporting Deadline to Be Extended No Later Than Mar 24 and House Action No Later Than Mar 31 (Reps Bettencourt & Wallner): Motion Adopted Voice Vote by Required Two-Thirds; House Journal  26, PG.693 "
347711,2011-03-16,"House Full Committee Work Session: 3/22/2011 10:15 Amendment Legislative Office Building 304 ==Executive Session to Follow== "
347711,2011-03-23,"House Committee Report: Ought to Pass with Amendment #1134h for Mar 30 (Vote 11-4; Regular Calendar); House Calendar 27, PG.821 "
347711,2011-03-23,"House Proposed Committee Amendment #2011-1134h; House Calendar 27, PG.853 "
347711,2011-03-30,"House Amendment #1134h Adopted, Voice Vote; House Journal  34, PG.1133 "
347711,2011-03-30,"House Ought to Pass with Amendment #1134h: Motion Adopted Regular Calendar 317-51; House Journal  34, PG.1133-1136 "
347711,2011-04-27,"Senate Introduced and Referred to Judiciary; Senate Journal 15, Pg.291 "
347711,2011-05-05,"Senate Hearing: 5/19/11, Representatives' Hall, 1:15 p.m.; Senate Calendar 23 "
347711,2011-05-26,"Senate Committee Report: Rereferred to Committee, 6/1/11; Senate Calendar 26 "
347711,2011-06-01,"Senate Special Order to the end of the Calendar, Without Objection, Motion Adopted; Senate Journal 19, Pg.517 "
347711,2011-06-01,"Senate Committee Report: Rereferred to Committee, 6/1/11; Senate Calendar 26 "
347711,2011-06-01,"Senate Special Order to 1 pm, Without Objection, Motion Adopted; Senate Journal 19, Pg.520 "
347711,2011-06-01,"Senate Committee Report: Rereferred to Committee, 6/1/11; Senate Calendar 26 "
347711,2011-06-01,"Senate Rereferred to Committee, Regular Calendar 14Y-10N, Motion Adopted; Senate Journal 19, Pg.539 "
347711,2012-01-12,"Senate Committee Report: Ought to Pass with Amendment #2012-0018s, New Title, 1/18/12; Senate Calendar 3 "
347711,2012-01-18,"Senate Special Order to 1/25/12 to the beginning of the regular calendar, Without Objection, Motion Adopted "
347711,2012-01-18,"Senate Committee Report: Ought to Pass with Amendment #2012-0018s, New Title, 1/25/12 "
347711,2012-01-25,"Senate Committee Amendment 0018s, New Title, Amendment Adopted, Voice Vote; Senate Journal 3, Pg.78 "
347711,2012-01-25,"Senate Sen. Carson Floor Amendment #2012-0350s, Amendment Adopted, Voice Vote; Senate Journal 3, Pg.78 "
347711,2012-01-25,"Senate Sen. Forrester Floor Amendment #2012-0367s, New Title, Regular Calendar 16Y-8N, Amendment Adopted; Senate Journal 3, Pg.79 "
347711,2012-01-25,"Senate Sen. Larsen Floor Amendment #2012-0373s, New Title, Amendment Adopted, Voice Vote; Senate Journal 3, Pg.80 "
347711,2012-01-25,"Senate Ought to Pass with Amendments 0018s, New Title, 0350s, 0367s, New Title, 0373s, New Title, Regular Calendar 23Y-1N, Motion Adopted; OT3rdg; Senate Journal 3, Pg.80 "
347711,2012-01-25,"Senate Sen. Bragdon Moved to Rescind OT3rdg; Senate Journal 3, Pg.89 "
347711,2012-01-25,"Senate Sen. Bradley Moved Reconsideration of HB 648, Motion Adopted, Voice Vote; Senate Journal 3, Pg.89 "
347711,2012-01-25,"Senate Sen. Larsen Floor Amendment #2012-0405s, New Title, Amendment Adopted, Voice Vote; Senate Journal 3, Pg.92 "
347711,2012-01-25,"Senate Ought to Pass with Amendments 0018s, New Title, 0350s, 0367s, New Title, 0373s, New Title, 0405s, New Title, Motion Adopted, Voice Vote; OT3rdg; Senate Journal 3, Pg.92 "
347711,2012-02-08,"House House Concurs with Senate Amendment's (Rep J.Garrity): Motion Adopted Voice Vote; House Journal  15, PG.904 "
347711,2012-02-08,"Senate Enrolled Bill Amendment #0723e Adopted, Voice Vote; Senate Journal 5, Pg.123 "
347711,2012-02-15,"House Enrolled Bill Amendment #2012-0723e Adopted; House Journal  16, PG.968 "
347711,2012-02-15,"Senate Enrolled "
347711,2012-02-22,"House Enrolled; House Journal  20, PG.1250 "
347711,2012-03-09,"House Signed by the Governor 03/05/2012; Chapter 0002 "
347711,2012-03-09,"House I. Section 1-5 Effective 05/04/2012 "
347711,2012-03-09,"House II. Section 8 Effective 11/01/2012 "
347711,2012-03-09,"House III. Remainder Effective 03/05/2012 "
347712,2011-02-23,"House Late Drafting and Introduction Approved by Rules Committee; House Journal  21, PG.479 "
347712,2011-02-23,"House Introduced and Referred to Science, Technology and Energy; House Journal  21, PG.479 "
347712,2011-02-23,"House Public Hearing: 3/9/2011 1:30 PM Representative's Hall "
347712,2011-03-01,"House Executive Session: 3/10/2011 9:00 Amendment Legislative Office Building 304 "
347712,2011-03-10,"House Retained in Committee "
347712,2011-03-15,"House Suspend House Rules to Allow Reporting Deadline to Be Extended No Later Than Mar 24 and House Action No Later Than Mar 31 (Reps Bettencourt & Wallner): Motion Adopted Voice Vote by Required Two-Thirds; House Journal  26, PG.693 "
347712,2011-03-16,"House Full Committee Work Session: 3/22/2011 10:16 Amendment Legislative Office Building 304 ==Executive Session To Follow== "
347712,2011-03-22,"House Retained in Committee; House Calendar 27, PG.825 "
347712,2011-08-18,"House Retained Bill - Full Committee Work Session: 9/13/2011 10:15 Amendment Legislative Office Building 301-303 "
347712,2011-10-11,"House Retained Bill - Executive Session: 10/25/2011 10:00 Amendment Legislative Office Building 304 "
347712,2011-10-27,"House Committee Report: Refer to Interim Study for Jan 4 (Vote 8-2; Regular Calendar); House Calendar 70, PG.2225 "
347712,2012-01-11,"House Refer to Interim Study: Motion Adopted Voice Vote; House Journal  9, PG.542 "
347712,2012-06-07,"House Referred to Science, Technology and Energy for Interim Study; House Calendar 45, PG.2434 "
347712,2012-10-03,"House Interim Study - Subcommittee Work Session: 10/4/2012 3:30 PM Legislative Office Building 304 "
347714,2011-09-14,"House Late Drafting and Introduction Approved by Rules Committee; House Journal  64, PG.1973 "
347714,2011-09-14,"House Rules Suspension to Permit Introduction, Printing, Referral to Committee, Public Hearing and Committee Report (Rep Bettencourt): Motion Adopted Regular Calendar 260-97 by Required Two-Thirds; House Journal  64, PG.1973-1976"
347714,2011-09-14,"House Introduced and Referred to Finance; House Journal  64, PG.1976 "
347714,2011-09-14,"House Public Hearing: 9/21/2011 1:30 PM Legislative Office Building 210-211 "
347714,2011-09-21,"House Division III Work Session: 9/28/2011 1:00 PM Legislative Office Building 209 "
347714,2011-09-28,"House Division III Work Session: 10/5/2011 8:30 PM Legislative Office Building 209 "
347714,2011-09-28,"House Executive Session: 10/5/2011 10:00 Amendment Legislative Office Building 210-211 "
347714,2011-10-05,"House Majority Committee Report: Ought to Pass for Oct 12 (Vote 15-6; Regular Calendar); House Calendar 62, PG.1931 "
347714,2011-10-05,"House Minority Committee Report: Inexpedient to Legislate; House Calendar 62, PG.1931 "
347714,2011-10-12,"House Ought to Pass: Motion Adopted Regular Calendar 259-111; House Journal  68, PG.2052-2054 "
347714,2012-01-04,"Senate Sen. Bradley Moved to Suspend all Rules necessary to allow the consideration of HB 652 and further allow it to be reported out of policy committee in the 2012 Senate Session by the adopted Senate deadline for HBs. 2/3 necessary, Motion Adopted, Regular Calendar 16Y-6N "
347714,2012-01-04,"Senate Introduced 9/7/2011 and Referred to Finance; Senate Journal 22, Pg.747 "
347714,2012-03-22,"Senate Hearing: 3/29/12, Room 103, State House, 1:00 p.m.; Senate Calendar 12 "
347714,2012-04-26,"Senate Committee Report: Inexpedient to Legislate, 5/2/12; Vote 7-0; Consent Calendar; Senate Calendar 17 "
347714,2012-05-02,"Senate Inexpedient to Legislate, Motion Adopted, Voice Vote === BILL KILLED ===; Senate Journal 12, Pg.422 "
347715,2011-09-14,"House Late Drafting and Introduction Approved by Rules Committee; House Journal  64, PG.1973 "
347715,2011-09-14,"House Rules Suspension to Permit Introduction, Printing, Referral to Committee, Public Hearing and Committee Report (Rep Bettencourt): Motion Adopted Regular Calendar 260-97 by Required Two-Thirds; House Journal  64, PG.1973-1976 "
347715,2011-09-14,"House Introduced and Referred to Finance; House Journal  64, PG.1976 "
347715,2011-09-14,"House Public Hearing: 9/21/2011 1:00 PM Legislative Office Building 210-211 "
347715,2011-09-20,"House Division I Work Session w/Judicial Branch: 9/27/2011 1:00 PM Legislative Office Building 212 "
347715,2011-09-21,"House Division I Work Session w/DRED 9/27/2011 2:00 PM Legislative Office Building 212 "
347715,2011-09-21,"House Division II Work Session: 9/27/2011 1:00 PM Legislative Office Building 209 "
347715,2011-09-21,"House ==CANCELLED== Division I Work Session: 9/28/2011 9:00 Amendment Legislative Office Building 212 "
347715,2011-09-21,"House Division III Work Session: 9/28/2011 10:00 Amendment Legislative Office Building 209 "
347715,2011-09-26,"House ==CANCELLED== Division I Work Session w/Dept of Environmental Services: 9/30/2011 9:00 Amendment Legislative Office Building 212 "
347715,2011-09-26,"House ==CANCELLED== Division I Work Session w/Information Technology: 9/30/2011 10:00 Amendment Legislative Office Building 212 "
347715,2011-09-26,"House ==CANCELLED== Division I Work Session w/Dept of Corrections: 9/30/2011 11:00 Amendment Legislative Office Building 212 "
347715,2011-09-28,"House ==CANCELLED== Division II Work Session: 10/4/2011 10:00 Amendment Legislative Office Building 209 "
347715,2011-09-28,"House Division III Work Session: 10/5/2011 8:30 Amendment Legislative Office Building 209 "
347715,2011-09-28,"House Executive Session: 10/5/2011 10:00 Amendment Legislative Office Building 210-211 "
347715,2011-10-05,"House Retained in Committee "
347715,2011-10-12,"House Suspend House Rules to Allow Reporting Deadline to be Moved to February 23, 2012: Motion Adopted Voice Vote by Required Two-Thirds; House Journal  68, PG.2048 "
347715,2012-01-31,"House Executive Session: 2/7/2012 1:30 PM Legislative Office Building 210-211 "
347715,2012-02-09,"House Committee Report: Inexpedient to Legislate for Feb 15 (Vote 24-0; Consent Calendar); House Calendar 11, PG.686 "
347715,2012-02-15,"House Inexpedient to Legislate: Motion Adopted Voice Vote; House Journal  16, PG.920 "
347717,2011-09-14,"House Late Drafting and Introduction Approved by Rules Committee; House Journal  64, PG.1973 "
347717,2011-09-14,"House Rules Suspension to Permit Introduction, Printing, Referral to Committee, Public Hearing and Committee Report (Rep Bettencourt): Motion Adopted Regular Calendar 260-97 by Required Two-Thirds; House Journal  64, PG.1973-1976 "
347717,2011-09-14,"House Introduced and Referred to Special Committee on Public Employee Pensions Reform; House Journal  64, PG.1976 "
347717,2011-09-14,"House Public Hearing: 9/22/2011 10:00 Amendment Legislative Office Building 305-307 "
347717,2011-09-21,"House Executive Session: 9/29/2011 1:30 PM Legislative Office Building 305-307 ==RECESSED== "
347717,2011-09-29,"House ==RECONVENE== Executive Session: 10/4/2011 2:30 PM Legislative Office Building 303 "
347717,2011-10-05,"House Majority Committee Report: Ought to Pass for Oct 12 (Vote 6-3; Regular Calendar); House Calendar 62, PG.1932 "
347717,2011-10-05,"House Minority Committee Report: Inexpedient to Legislate; House Calendar 62, PG.1932 "
347717,2011-10-12,"House Ought to Pass: Motion Adopted Regular Calendar 253-110; House Journal  68, PG.2057-2059 "
347717,2011-10-12,"House Suspend House Rules to Allow Second Committee (Finance) and Reporting Deadline to December 23, 2011 (Rep Shurtleff): Motion Failed Regular Calendar 113-248 by Required Two-Thirds; House Journal  68, PG.2059-2061 "
347717,2012-01-04,"Senate Sen. Bradley Moved to Suspend all Rules necessary to allow the consideration of HB 654 and further allow it to be reported out of policy committee in the 2012 Senate Session by the adopted Senate deadline for HBs. 2/3 necessary, Motion Adopted, Regular Calendar 16Y-6N "
347717,2012-01-04,"Senate Introduced 9/7/2011 and Referred to Executive Dept. & Admin; Senate Journal 22, Pg.747 "
347717,2012-03-08,"Senate Hearing: 3/15/12, Room 100, State House, 9:00 a.m.; Senate Calendar 10 "
347717,2012-03-22,"Senate Committee Report: Inexpedient to Legislate, 3/28/12; Senate Calendar 12 "
347717,2012-03-28,"Senate Inexpedient to Legislate, Motion Adopted, Voice Vote === BILL KILLED ===; Senate Journal 8, Pg.279 "
347718,2011-09-14,"House Late Drafting and Introduction Approved by Rules Committee; House Journal  64, PG.1973 "
347718,2011-09-14,"House Rules Suspension to Permit Introduction, Printing, Referral to Committee, Public Hearing and Committee Report (Rep Bettencourt): Motion Adopted Regular Calendar 260-97 by Required Two-Thirds; House Journal  64, PG.1973-1976 "
347718,2011-09-14,"House Introduced and Referred to Ways and Means; House Journal  64, PG.1976 "
347718,2011-09-14,"House Public Hearing: 9/20/2011 1:00 PM Legislative Office Building 202 ==Executive Session May Follow== "
347718,2011-09-19,"House Public Hearing on Non-Germane Amendment #2011-2606h(NT): 9/20/2011 2:00 PM Legislative Office Building 202 "
347718,2011-09-21,"House Full Committee Work Session: 9/27/2011 10:30 Amendment Legislative Office Building 202 "
347718,2011-09-21,"House Executive Session: 9/27/2011 Legislative Office Building 202 11:00 Amendment or Immediately Following Work Session "
347718,2011-09-27,"House Committee Report: Ought to Pass with Amendment #2621h for Oct 12 (Vote 15-0; Regular Calendar); House Calendar 62, PG.1933 "
347718,2011-09-27,"House Proposed Committee Amendment #2011-2621h; House Calendar 62, PG.1950 "
347718,2011-10-12,"House Lay on the Table (Rep Soltani): Motion Failed Regular Calendar 47-277; House Journal  68, PG.2074-2076 "
347718,2011-10-12,"House Amendment #2621h Failed, Regular Calendar 123-205; House Journal  68, PG.2076-2078 "
347718,2011-10-12,"House Ought to Pass: Motion Adopted Regular Calendar 323-4; House Journal  68, PG.2078-2080 "
347718,2012-01-04,"Senate Sen. Bradley Moved to Suspend all Rules necessary to allow the consideration of HB 655 and further allow it to be reported out of policy committee in the 2012 Senate Session by the adopted Senate deadline for HBs. 2/3 necessary, Motion Adopted, Regular Calendar 16Y-6N "
347718,2012-01-04,"Senate Introduced 9/7/2011 and Referred to Public & Municipal Affairs; Senate Journal 22, Pg.747 "
347718,2012-03-05,"Senate Hearing: 3/20/12, Room 101, Legislative Office Building, 9:50 a.m.; Senate Calendar 10 "
347718,2012-04-18,"Senate Committee Report: Inexpedient to Legislate, 4/25/12; Senate Calendar 16 "
347718,2012-04-25,"Senate Inexpedient to Legislate Not Voted On "
347718,2012-04-25,"Senate Sen. Boutin Moved Laid On Table, Motion Adopted, Voice Vote; Senate Journal 11, Pg.396 "
347718,2012-05-16,"Senate Sen. White Moved Remove From Table, Motion Adopted, Voice Vote "
347718,2012-05-16,"Senate Inexpedient to Legislate, Motion Failed, Voice Vote "
347718,2012-05-16,"Senate Sen. White Moved Ought to Pass "
347718,2012-05-16,"Senate Sen. White Floor Amendment #2012-2321s, New Title, Amendment Adopted, Voice Vote "
347718,2012-05-16,"Senate Ought to Pass with Amendment 2321s, New Title, Motion Adopted, Voice Vote; OT3rdg"
347718,2012-05-17,"House House Non-Concurs with Senate Amendment #2321s(NT) and Requests C of C (Rep E.Hogan): Motion Adopted Voice Vote; House Journal  46, PG.2487 "
347718,2012-05-17,"House Speaker Appoints: Reps Sapareto, Azarian, K.Murphy, and Almy; House Journal  46, PG.2487 "
347718,2012-05-23,"Senate Sen. Barnes Accedes to House Request for Committee of Conference ; Motion Adopted, Voice Vote "
347718,2012-05-23,"Senate President Appoints: Senators White, Merrill, and Sanborn "
347718,2012-05-24,"House Conference Committee Meeting: 5/25/2012 11:00 Amendment Legislative Office Building 104 ==ROOM CHANGE (Orig Legislative Office Building 204)== ==RECESSED== "
347718,2012-05-24,"House Speaker Appoints: Rep D.Sullivan as an Alternate; House Journal  46, PG.2495 "
347718,2012-05-25,"House Conferee Change: Rep Major Replaces Rep Azarian; House Journal  46, PG.2495 "
347718,2012-05-25,"House Conference Committee Meeting: 5/29/2012 3:00 PM Legislative Office Building 206 "
347718,2012-05-29,"Senate Conferee Change; Senator Prescott Replaces Senator White "
347718,2012-05-31,"House Conferee Change: Rep Itse Replaces Rep Almy; House Journal  47, PG.2507 "
347718,2012-05-31,"Senate Conference Committee Report #2012-2470c; Senate Amendment, Filed "
347718,2012-06-06,"Senate Conference Committee Report 2470c; Adopted, Voice Vote "
347718,2012-06-06,"House Conference Committee Report #2470c Adopted, Voice Vote; House Journal  51, PG.2595 "
347718,2012-06-06,"Senate Enrolled "
347718,2012-06-06,"House Enrolled; House Journal  51, PG.2612 "
347718,2012-06-21,"House Signed By Governor 06/18/2012; Effective 06/18/2012; Chapter 0230 "
347720,2011-09-14,"House Late Drafting and Introduction Approved by Rules Committee; House Journal  64, PG.1973 "
347720,2011-09-14,"House Rules Suspension to Permit Introduction, Printing, Referral to Committee, Public Hearing and Committee Report (Rep Bettencourt): Motion Adopted Regular Calendar 260-97 by Required Two-Thirds; House Journal  64, PG.1973-1976 "
347720,2011-09-14,"House Introduced and Referred to Special Committee on Redistricting; House Journal  64, PG.1976 "
347720,2011-09-14,"House Public Hearing: 9/20/2011 1:30 PM Legislative Office Building 208 "
347720,2011-09-23,"House Executive Session: 10/4/2011 1:30 PM Legislative Office Building 308 "
347720,2011-10-05,"House Majority Committee Report: Ought to Pass with Amendment #2676h for Oct 12 (Vote 12-5; Regular Calendar); House Calendar 62, PG.1932 "
347720,2011-10-05,"House Proposed Majority Committee Amendment #2011-2676h; House Calendar 62, PG.1950-1952 "
347720,2011-10-05,"House Minority Committee Report: Inexpedient to Legislate; House Calendar 62, PG.1932 "
347720,2011-10-12,"House Amendment #2676h Adopted, Regular Calendar 254-105; House Journal  68, PG.2061-2065 "
347720,2011-10-12,"House Floor Amendment #2011-2695h (Rep Vaillancourt) Failed, Regular Calendar 131-216; House Journal  68, PG.2065-2067 "
347720,2011-10-12,"House Floor Amendment #2011-2729h (Rep Mirski) Adopted, Regular Calendar 221-111; House Journal  68, PG.2068-2070 "
347720,2011-10-12,"House Lay on the Table (Rep Harding): Motion Failed Regular Calendar 126-205; House Journal  68, PG.2070-2072 "
347720,2011-10-12,"House Ought to Pass with Amendment #2676h and #2729h: Motion Adopted Regular Calendar 234-101; House Journal  68, PG.2072-2074 "
347720,2012-01-04,"Senate Sen. Bradley Moved to Suspend all Rules necessary to allow the consideration of HB 656 and further allow it to be reported out of policy committee in the 2012 Senate Session by the adopted Senate deadline for HBs. 2/3 necessary, Motion Adopted, Regular Calendar 16Y-6N "
347720,2012-01-04,"Senate Introduced 9/7/2011 and Referred to Internal Affairs; Senate Journal 22, Pg.747 "
347720,2012-02-29,"Senate Hearing: 3/6/12, Room 103, State House, 3:10 p.m.; Senate Calendar 9A "
347720,2012-03-22,"Senate Committee Report: Inexpedient to Legislate, 3/28/12; Vote 5-0; Consent Calendar; Senate Calendar 12 "
347720,2012-03-28,"Senate Inexpedient to Legislate, Motion Adopted, Voice Vote === BILL KILLED ===; Senate Journal 8, Pg.264 "
347721,2011-10-18,"House Introduced 1/4/2012 and Referred to Election Law; House Journal  7, PG.344 "
347721,2012-01-12,"House Public Hearing: 1/19/2012 12:45 PM Legislative Office Building 308 "
347721,2012-02-08,"House Executive Session: 2/14/2012 2:00 PM Legislative Office Building 308 "
347721,2012-02-14,"House Committee Report: Inexpedient to Legislate for Feb 22 (Vote 14-1; Consent Calendar); House Calendar 18, PG.1052-1053 "
347721,2012-02-22,"House Removed from Consent Calendar (Rep Kingsbury); House Journal  20, PG.1201 "
347721,2012-03-07,"House Inexpedient to Legislate: Motion Adopted Voice Vote "
347723,2011-10-18,"House Introduced 1/4/2012 and Referred to Executive Departments and Administration; House Journal  7, PG.344 "
347723,2012-01-10,"House Public Hearing: 2/16/2012 10:00 Amendment Legislative Office Building 306 "
347723,2012-02-15,"House Executive Session: 2/21/2012 3:00 PM Legislative Office Building 306 "
347723,2012-02-16,"House Committee Report: Ought to Pass for Mar 7 (Vote 13-0; Consent Calendar); House Calendar 18, PG.1065 "
347723,2012-03-07,"House Ought to Pass: Motion Adopted Voice Vote; House Journal  21, PG.1302 "
347723,2012-03-07,"Senate Introduced and Referred to Executive Departments and Administration; Senate Journal 7, Pg.185 "
347723,2012-03-22,"Senate Hearing: 3/29/12, Room 100, State House, 9:00 a.m.; Senate Calendar 12 "
347723,2012-04-03,"Senate Committee Report: Ought to Pass, 4/11/12; Senate Calendar 14 "
347723,2012-04-11,"Senate Ought to Pass: Motion Adopted, Voice Vote; OT3rdg; Senate Journal 9, Pg.349 "
347723,2012-04-11,"House Enrolled "
347723,2012-04-18,"Senate Enrolled; Senate Journal 11, Pg.383 "
347723,2012-05-03,"House Signed By Governor 05/02/2012; Effective 07/01/2012; Chapter 0025 "
347724,2011-10-18,"House Introduced 1/4/2012 and Referred to Criminal Justice and Public Safety; House Journal  7, PG.344 "
347724,2011-12-14,"House Public Hearing: 1/10/2012 10:00 Amendment Legislative Office Building 204 "
347724,2012-01-26,"House Subcommittee Work Session: 1/31/2012 12:30 PM Legislative Office Building 204 "
347724,2012-02-02,"House Executive Session: 2/6/2012 10:00 Amendment Legislative Office Building 204 "
347724,2012-02-08,"House Majority Committee Report: Ought to Pass with Amendment #0425h(NT) for Feb 15 (Vote 8-4; Regular Calendar); House Calendar 11, PG.694 "
347724,2012-02-08,"House Proposed Majority Committee Amendment #2012-0425h (New Title); House Calendar 11, PG.721-722 "
347724,2012-02-08,"House Minority Committee Report: Inexpedient to Legislate; House Calendar 11, PG.694 "
347724,2012-02-15,"House Amendment #0425h(NT) Adopted, Voice Vote; House Journal  16, PG.931-932 "
347724,2012-02-15,"House Ought to Pass with Amendment #0425h(NT): Motion Adopted Division Vote 197-143; House Journal  16, PG.932 "
347724,2012-03-28,"Senate Introduced and Referred to Transportation; Senate Journal 9, Pg.332 "
347724,2012-04-11,"Senate Hearing: 4/19/12, Room 103, Legislative Office Building, 9:00 a.m.; Senate Calendar 15 "
347724,2012-04-19,"Senate Committee Report: Ought to Pass with Amendment #2012-1756s, 4/25/12; Senate Calendar 16 "
347724,2012-04-25,"Senate Committee Amendment 1756s; Amendment Adopted, Voice Vote; Senate Journal 11, Pg.399 "
347724,2012-04-25,"Senate Ought to Pass with Amendment 1756s, Motion Adopted, Voice Vote; OT3rdg; Senate Journal 11, Pg.415 "
347724,2012-05-30,"House House Concurs with Senate Amendment #1756s (Rep Swinford): Motion Adopted Voice Vote; House Journal  47, PG.2501 "
347724,2012-06-06,"Senate Enrolled "
347724,2012-06-06,"House Enrolled; House Journal  51, PG.2609 "
347724,2012-06-18,"House Signed By Governor 06/13/2012; Effective 08/12/2012; Chapter 0204 "
347726,2011-10-18,"House Introduced 1/4/2012 and Referred to Science, Technology and Energy; House Journal  7, PG.344 "
347726,2012-01-05,"House Public Hearing: 1/24/2012 10:15 Amendment Legislative Office Building 304 "
347726,2012-01-31,"House Executive Session: 2/7/2012 10:00 Amendment Legislative Office Building 304 =RECESSED= "
347726,2012-02-09,"House Continued Executive Session: 2/15/2012 3:00 PM Legislative Office Building 304 "
347726,2012-02-22,"House Committee Report: Inexpedient to Legislate for Mar 7 (Vote 13-0; Consent Calendar); House Calendar 18, PG.1075 "
347726,2012-03-07,"House Inexpedient to Legislate: Motion Adopted Voice Vote; House Journal  21, PG.1323 "
347727,2011-10-18,"House Introduced 1/4/2012 and Referred to Public Works and Highways; House Journal  7, PG.344 "
347727,2011-12-21,"House Public Hearing: 1/19/2012 9:30 Amendment Legislative Office Building 201 ==Executive Session To Follow== "
347727,2012-02-01,"House ==CANCELLED== Executive Session: 2/9/2012 9:30 Amendment Legislative Office Building 201 "
347727,2012-02-08,"House Committee Report: Refer to Interim Study for Feb 15 (Vote 14-0; Consent Calendar); House Calendar 11, PG.689 "
347727,2012-02-15,"House Refer to Interim Study: Motion Adopted Voice Vote; House Journal  16, PG.924 "
347727,2012-06-07,"House Referred to Public Works and Highways for Interim Study; House Calendar 45, PG.2433 "
347727,2012-09-20,"House Interim Study - Executive Session: 10/30/2012 10:00 Amendment Legislative Office Building 201 "
347729,2011-10-18,"House Introduced 1/4/2012 and Referred to Consitutional Review and Statutory Recodification; House Journal  7, PG.344 "
347729,2011-12-21,"House ==CANCELLED== Public Hearing: 1/31/2012 3:00 PM Legislative Office Building 206 "
347729,2012-01-05,"House Public Hearing: 2/14/2012 10:00 Amendment Legislative Office Building 206 "
347729,2012-02-03,"House Executive Session: 2/21/2012 10:30 Amendment Legislative Office Building 206 ==TIME CHANGE (Orig 10:00 Amendment)== "
347729,2012-02-23,"House Committee Report: Ought to Pass with Amendment #0944h(NT) for Mar 7 (Vote 9-4; Regular Calendar); House Calendar 18, PG.1084-1085 "
347729,2012-02-23,"House Proposed Committee Amendment #2012-0944h (New Title); House Calendar 17, PG.973 "
347729,2012-03-07,"House Amendment #0944h(NT) Adopted, Voice Vote; House Journal  21, PG.1341 "
347729,2012-03-07,"House Ought to Pass with Amendment #0944h(NT): Motion Adopted Voice Vote; House Journal  21, PG.1341 "
347729,2012-03-07,"Senate Introduced and Referred to Judiciary; Senate Journal 7, Pg.185 "
347729,2012-04-11,"Senate Hearing: 5/3/12, Room 101, Legislative Office Building, 1:00 p.m.; Senate Calendar 15 "
347729,2012-04-16,"Senate Hearing: === TIME CHANGE === 5/3/12, Room 101, Legislative Office Building, 1:30 p.m.; Senate Calendar 16 "
347729,2012-05-08,"Senate Committee Report: Inexpedient to Legislate, 5/16/12; Senate Calendar 19 "
347729,2012-05-16,"Senate Inexpedient to Legislate, Motion Adopted, Voice Vote === BILL KILLED === "
347730,2011-10-18,"House Introduced 1/4/2012 and Referred to Fish and Game and Marine Resources; House Journal  7, PG.344 "
347730,2012-01-10,"House Public Hearing: 1/31/2012 1:45 PM Legislative Office Building 307 ==TIME CHANGE (Orig 11:00 Amendment)== "
347730,2012-02-01,"House Executive Session: 2/14/2012 10:15 Amendment Legislative Office Building 307 "
347730,2012-02-16,"House Committee Report: Inexpedient to Legislate for Feb 22 (Vote 14-0; Consent Calendar); House Calendar 14, PG.802 "
347730,2012-02-22,"House Inexpedient to Legislate: Motion Adopted Voice Vote; House Journal  20, PG.1205 "
347732,2011-10-18,"House Introduced 1/4/2012 and Referred to Science, Technology and Energy; House Journal  7, PG.344 "
347732,2012-01-05,"House Public Hearing: 1/24/2012 11:15 Amendment Legislative Office Building 304 "
347732,2012-01-31,"House Executive Session: 2/7/2012 10:00 Amendment Legislative Office Building 304 =RECESSED= "
347732,2012-02-09,"House Continued Executive Session: 2/15/2012 3:00 PM Legislative Office Building 304 "
347732,2012-02-22,"House Committee Report: Ought to Pass with Amendment #0778h for Mar 7 (Vote 13-0; Consent Calendar); House Calendar 18, PG.1075 "
347732,2012-02-22,"House Proposed Committee Amendment #2012-0778h; House Calendar 17, PG.973-974 "
347732,2012-03-07,"House Amendment #0778h Adopted, Voice Vote; House Journal  21, PG.1323 "
347732,2012-03-07,"House Ought to Pass with Amendment #0778h: Motion Adopted Voice Vote; House Journal  21, PG.1323 "
347732,2012-03-07,"Senate Introduced and Referred to Energy and Natural Resources; Senate Journal 7, Pg.185 "
347732,2012-03-23,"Senate Hearing: 3/29/12, Room 102, Legislative Office Building, 9:15 a.m.; Senate Calendar 12 "
347732,2012-04-03,"Senate Committee Report: Ought to Pass, 4/11/12; Vote 5-0; Consent Calendar; Senate Calendar 14 "
347732,2012-04-11,"Senate Ought to Pass: Motion Adopted, Voice Vote; OT3rdg; Senate Journal 9, Pg.349 "
347732,2012-04-25,"Senate Enrolled Bill Amendment #1734e Adopted; Senate Journal 12, Pg.419 "
347732,2012-04-25,"House Enrolled Bill Amendment #2012-1734e Adopted; House Journal  38, PG.2209 "
347732,2012-04-25,"House Enrolled; House Journal  38, PG.2211 "
347732,2012-05-02,"Senate Enrolled; Senate Journal 13, Pg.474 "
347732,2012-05-21,"House Signed By Governor 05/14/2012; Effective 07/13/2012; Chapter 0051 "
347733,2011-10-18,"House Introduced 1/4/2012 and Referred to Public Works and Highways; House Journal  7, PG.344 "
347733,2011-12-21,"House Public Hearing: 1/24/2012 1:15 PM Legislative Office Building 201 ==Executive Session To Follow== "
347733,2012-01-26,"House Committee Report: Ought to Pass with Amendment #0360h(NT) for Feb 1 (Vote 14-2; Consent Calendar); House Calendar 5, PG.248 "
347733,2012-01-26,"House Proposed Committee Amendment #2012-0360h (New Title); House Calendar 5, PG.278 "
347733,2012-02-01,"House Amendment #0360h(NT) Adopted, Voice Vote; House Journal  13, PG.745-746 "
347733,2012-02-01,"House Ought to Pass with Amendment #0360h(NT): Motion Adopted Voice Vote; House Journal  13, PG.745 "
347733,2012-02-15,"Senate Introduced and Referred to Public and Municipal Affairs; Senate Journal 6, Pg.145 "
347733,2012-03-05,"Senate Hearing: 3/20/12, Room 101, Legislative Office Building, 9:15 a.m.; Senate Calendar 10 "
347733,2012-03-22,"Senate Committee Report: Ought to Pass, 3/28/12; Vote 5-0; Consent Calendar; Senate Calendar 12 "
347733,2012-03-28,"Senate Ought to Pass: Motion Adopted, Voice Vote; OT3rdg; Senate Journal 8, Pg.328 "
347733,2012-04-11,"House Enrolled "
347733,2012-04-18,"Senate Enrolled; Senate Journal 11, Pg.384 "
347733,2012-04-24,"House Signed By Governor 04/23/2012; Effective 04/23/2012; Chapter 0012 "
347735,2011-10-18,"House Introduced 1/4/2012 and Referred to Judiciary; House Journal  7, PG.345 "
347735,2012-01-12,"House Public Hearing: 1/17/2012 4:30 PM Legislative Office Building 208 "
347735,2012-01-12,"House ==CANCELLED== Executive Session: 1/19/2012 1:30 PM Legislative Office Building 208 "
347735,2012-01-19,"House Subcommittee A Work Session: 1/26/2012 9:00 Amendment Legislative Office Building 208 "
347735,2012-01-31,"House Executive Session: 2/7/2012 10:00 Amendment Legislative Office Building 208 "
347735,2012-02-08,"House Majority Committee Report: Inexpedient to Legislate for Feb 15 (Vote 10-7; Regular Calendar); House Calendar 11, PG.698 "
347735,2012-02-08,"House Minority Committee Report: Ought to Pass; House Calendar 11, PG.698 "
347735,2012-02-15,"House Inexpedient to Legislate: Motion Adopted Voice Vote; House Journal  16, PG.942-943 "
347736,2011-10-18,"House Introduced 1/4/2012 and Referred to Election Law; House Journal  7, PG.345 "
347736,2012-01-18,"House Public Hearing: 1/24/2012 10:30 Amendment Legislative Office Building 308 "
347736,2012-01-25,"House Executive Session: 1/31/2012 1:00 PM Legislative Office Building 308 ==RECESSED== "
347736,2012-02-01,"House Continued Executive Session: 2/7/2012 2:30 PM Legislative Office Building 308 "
347736,2012-02-07,"House Committee Report: Ought to Pass with Amendment #0459h for Feb 15 (Vote 13-0; Consent Calendar); House Calendar 11, PG.684 "
347736,2012-02-08,"House Proposed Committee Amendment #2012-0459h; House Calendar 11, PG.722 "
347736,2012-02-15,"House Amendment #0459h Adopted, Voice Vote; House Journal  16, PG.915 "
347736,2012-02-15,"House Ought to Pass with Amendment #0459h: Motion Adopted Voice Vote; House Journal  16, PG.915 "
347736,2012-02-15,"Senate Introduced and Referred to Public and Municipal Affairs; Senate Journal 6, Pg.145 "
347736,2012-03-28,"Senate Hearing: 4/3/12, Room 101, Legislative Office Building, 9:55 a.m.; Senate Calendar 13 "
347736,2012-04-04,"Senate Committee Report: Ought to Pass, 4/11/12; Senate Calendar 14 "
347736,2012-04-11,"Senate Ought to Pass: Motion Adopted, Voice Vote; OT3rdg; Senate Journal 9, Pg.349 "
347736,2012-04-11,"House Enrolled "
347736,2012-04-18,"Senate Enrolled; Senate Journal 11, Pg.384 "
347736,2012-05-03,"House Signed By Governor 05/02/2012; Effective 07/01/2012; Chapter 0026 "
347739,2011-10-18,"House Introduced 1/4/2012 and Referred to Judiciary; House Journal  7, PG.345 "
347739,2012-01-12,"House Public Hearing: 1/17/2012 4:00 PM Legislative Office Building 208 "
347739,2012-01-12,"House Executive Session: 1/19/2012 1:30 PM Legislative Office Building 208 "
347739,2012-01-24,"House Committee Report: Inexpedient to Legislate for Feb 1 (Vote 17-0; Consent Calendar); House Calendar 5, PG.245 "
347739,2012-02-01,"House Inexpedient to Legislate: Motion Adopted Voice Vote; House Journal  13, PG.743 "
347741,2011-10-18,"House Introduced 1/4/2012 and Referred to Public Works and Highways; House Journal  7, PG.345 "
347741,2011-12-21,"House Public Hearing: 1/19/2012 11:15 Amendment Legislative Office Building 201 =Executive Session To Follow= "
347741,2012-02-01,"House Committee Report: Ought to Pass with Amendment #0292h for Feb 8 (Vote 13-0; Regular Calendar); House Calendar 6, PG.295 "
347741,2012-02-01,"House Proposed Committee Amendment #2012-0292h; House Calendar 6, PG.336 "
347741,2012-02-08,"House Special Order to Beginning of Today's Regular Calendar (Rep Chandler): Motion Adopted Voice Vote; House Journal  15, PG.855 "
347741,2012-02-08,"House Amendment #0292h Adopted, Voice Vote; House Journal  15, PG.856 "
347741,2012-02-08,"House Ought to Pass with Amendment #0292h: Motion Adopted Voice Vote Unanimous; House Journal  15, PG.856 "
347741,2012-02-08,"Senate Introduced and Referred to Transportation; Senate Journal 5, Pg.122 "
347741,2012-02-23,"Senate Hearing: 3/8/12, Room 103, Legislative Office Building, 10:20 a.m.; Senate Calendar 9 "
347741,2012-04-12,"Senate Committee Report: Ought to Pass, 4/18/12; Senate Calendar 15 "
347741,2012-04-18,"Senate Ought to Pass: Regular Calendar 24Y-0N, Motion Adopted; OT3rdg; Senate Journal 10, Pg.379 "
347741,2012-04-25,"House Enrolled; House Journal  38, PG.2211 "
347741,2012-05-02,"Senate Enrolled; Senate Journal 13, Pg.475 "
347741,2012-05-21,"House Signed By Governor 05/15/2012; Effective 07/14/2012; Chapter 0068 "
347742,2011-10-18,"House Introduced 1/4/2012 and Referred to Education; House Journal  7, PG.345 "
347742,2011-12-15,"House Public Hearing: 1/31/2012 2:00 PM Legislative Office Building 207 "
347742,2011-12-15,"House Executive Session: 2/14/2012 1:00 PM Legislative Office Building 207 "
347742,2012-02-16,"House Committee Report: Ought to Pass with Amendment #0600h for Mar 7 (Vote 14-0; Consent Calendar); House Calendar 18, PG.1061 "
347742,2012-02-16,"House Proposed Committee Amendment #2012-0600h; House Calendar 17, PG.974 "
347742,2012-03-07,"House Amendment #0600h Adopted, Voice Vote; House Journal  21, PG.1297 "
347742,2012-03-07,"House Ought to Pass with Amendment #0600h: Motion Adopted Voice Vote; House Journal  21, PG.1297-1298 "
347742,2012-03-07,"Senate Introduced and Referred to Education; Senate Journal 7, Pg.185 "
347742,2012-04-17,"Senate Hearing: 4/24/12, Room 103, Legislative Office Building, 2:00 p.m.; Senate Calendar 16 "
347742,2012-05-08,"Senate Committee Report: Ought to Pass with Amendment #2012-2033s, 5/16/12; Vote 5-0; Consent Calendar; Senate Calendar 19 "
347742,2012-05-16,"Senate Committee Amendment 2033s; Amendment Adopted, Voice Vote; Senate Journal 14, Pg.512 "
347742,2012-05-16,"Senate Ought to Pass with Amendment 2033s, Motion Adopted, Voice Vote; OT3rdg; Senate Journal 14, Pg.587 "
347742,2012-05-30,"House House Concurs with Senate Amendment #2033s (Rep Balboni): Motion Adopted Voice Vote; House Journal  47, PG.2501 "
347742,2012-06-06,"Senate Enrolled "
347742,2012-06-06,"House Enrolled "
347742,2012-06-18,"House Signed By Governor 06/15/2012; Effective 08/14/2012; Chapter 0224 "
347744,2011-10-18,"House Introduced 1/4/2012 and Referred to Resources, Recreation and Development; House Journal  7, PG.345  "
347744,2011-12-22,"House Public Hearing: 1/10/2012 10:00 Amendment Legislative Office Building 305 "
347744,2012-01-12,"House Executive Session: 1/31/2012 1:00 PM Legislative Office Building 305 =(If Necessary Continued 2/2/2012 10:30 Amendment Legislative Office Building 305)= "
347744,2012-02-03,"House Majority Committee Report: Ought to Pass for Feb 15 (Vote 12-3; Regular Calendar); House Calendar 11, PG.702 "
347744,2012-02-03,"House Minority Committee Report: Refer to Interim Study; House Calendar 11, PG.702 "
347744,2012-02-15,"House Ought to Pass: Motion Adopted Regular Calendar 295-23; House Journal  16, PG.948-950 "
347744,2012-02-15,"House Referred to State-Federal Relations and Veterans Affairs; House Journal  16, PG.950 "
347744,2012-02-22,"House ==CANCELLED== Public Hearing: 3/15/2012 9:00 Amendment Legislative Office Building 203 "
347744,2012-02-29,"House ==RESCHEDULED== Public Hearing: 3/12/2012 9:00 Amendment Legislative Office Building 203 ==Executive Session To Follow== "
347744,2012-03-12,"House Committee Report: Ought to Pass for Mar 21 (Vote 11-0; Consent Calendar); House Calendar 22, PG.1353 "
347744,2012-03-21,"House Ought to Pass: Motion Adopted Voice Vote; House Journal  28, PG.1668 "
347744,2012-03-28,"Senate Introduced and Referred to Energy and Natural Resources; Senate Journal 9, Pg.332 "
347744,2012-04-18,"Senate Hearing: 4/26/12, Room 102, Legislative Office Building, 9:00 a.m.; Senate Calendar 16 "
347744,2012-05-03,"Senate Committee Report: Ought to Pass with Amendment #2012-1920s, 5/9/12; Senate Calendar 18 "
347744,2012-05-09,"Senate Committee Amendment 1920s; Amendment Adopted, Voice Vote; Senate Journal 13, Pg.483 "
347744,2012-05-09,"Senate Ought to Pass with Amendment 1920s, Motion Adopted, Voice Vote; OT3rdg; Senate Journal 13, Pg.506 "
347744,2012-05-17,"House House Non-Concurs with Senate Amendment #1920s and Requests C of C (Rep Renzullo): Motion Adopted Voice Vote; House Journal  46, PG.2458 "
347744,2012-05-17,"House Speaker Appoints: Reps Kappler, Swinford, Baldasaro, and Parkhurst; House Journal  46, PG.2458 "
347744,2012-05-23,"Senate Sen. Odell Refuse to Accede to House Request For C of C, Motion Adopted, Voice Vote "
347745,2011-10-18,"House Introduced 1/4/2012 and Referred to Resources, Recreation and Development; House Journal  7, PG.345  "
347745,2012-01-11,"House Public Hearing: 1/24/2012 1:00 PM Legislative Office Building 305 "
347745,2012-01-12,"House Executive Session: 1/31/2012 1:00 PM Legislative Office Building 305 =(If Necessary Continued 2/2/2012 10:30 Amendment Legislative Office Building 305)= "
347745,2012-02-03,"House Committee Report: Inexpedient to Legislate for Feb 15 (Vote 15-0; Consent Calendar); House Calendar 11, PG.691 "
347745,2012-02-15,"House Inexpedient to Legislate: Motion Adopted Voice Vote; House Journal  16, PG.925 "
347747,2011-10-18,"House Introduced 1/4/2012 and Referred to Executive Departments and Administration; House Journal  7, PG.345 "
347747,2012-01-10,"House Public Hearing: 1/31/2012 2:00 PM Legislative Office Building 306 "
347747,2012-02-08,"House ==CANCELLED== Executive Session: 2/8/2012 Legislative Office Building 306 During Session Break "
347747,2012-02-08,"House Executive Session: 2/9/2012 1:00 PM Legislative Office Building 306 "
347747,2012-02-09,"House Committee Report: Refer to Interim Study for Mar 7 (Vote 12-0; Consent Calendar); House Calendar 18, PG.1065 "
347747,2012-03-11,"House Refer to Interim Study: Motion Adopted Voice Vote; House Journal  21, PG.1302 "
347747,2012-06-07,"House Referred to Executive Departments and Administration for Interim Study; House Calendar 45, PG.2433 "
347747,2012-09-18,"House Interim Study - Executive Session: 10/18/2012 1:30 PM Legislative Office Building 306 "
347748,2011-10-18,"House Introduced 1/4/2012 and Referred to Transportation; House Journal  7, PG.345 "
347748,2011-12-14,"House Public Hearing: 1/17/2012 10:00 Amendment Legislative Office Building 203 "
347748,2012-02-08,"House Executive Session: 2/14/2012 2:30 PM Legislative Office Building 203 "
347748,2012-02-15,"House Committee Report: Inexpedient to Legislate for Feb 22 (Vote 14-0; Consent Calendar); House Calendar 14, PG.808 "
347748,2012-02-22,"House Inexpedient to Legislate: Motion Adopted Voice Vote; House Journal  20, PG.1215 "
347750,2011-10-24,"House Introduced 1/4/2012 and Referred to Ways and Means; House Journal  7, PG.345 "
347750,2012-01-03,"House Public Hearing: 1/19/2012 10:00 Amendment Legislative Office Building 202 "
347750,2012-01-19,"House Subcommittee Work Session: 1/24/2012 1:30 PM Legislative Office Building 202 "
347750,2012-01-19,"House Executive Session: 1/31/2012 2:00 PM Legislative Office Building 202 "
347750,2012-01-31,"House Committee Report: Ought to Pass with Amendment #0378h for Feb 8 (Vote 20-0; Consent Calendar); House Calendar 6, PG.289-290 "
347750,2012-01-31,"House Proposed Committee Amendment #2012-0378h; House Calendar 6, PG.336 "
347750,2012-02-08,"House Amendment #0378h Adopted, Voice Vote; House Journal  15, PG.854 "
347750,2012-02-08,"House Ought to Pass with Amendment #0378h: Motion Adopted Voice Vote; House Journal  15, PG.854 "
347750,2012-02-08,"Senate Introduced and Referred to Transportation; Senate Journal 5, Pg.122 "
347750,2012-02-23,"Senate Hearing: 3/8/12, Room 103, Legislative Office Building, 9:15 a.m.; Senate Calendar 9 "
347750,2012-04-12,"Senate Committee Report: Ought to Pass with Amendment #2012-1627s, 4/18/12; Senate Calendar 15 "
347750,2012-04-18,"Senate Committee Amendment 1627s; Amendment Adopted, Voice Vote; Senate Journal 10, Pg.372 "
347750,2012-04-18,"Senate Ought to Pass with Amendment 1627s, Motion Adopted, Voice Vote; OT3rdg; Senate Journal 10, Pg.379 "
347750,2012-05-09,"House House Concurs with Senate Amendment #1627s (Rep Stepanek): Motion Adopted Voice Vote; House Journal  40, PG.2230 "
347750,2012-05-16,"Senate Enrolled "
347750,2012-05-17,"House Enrolled; House Journal  46, PG.2480 "
347750,2012-05-31,"House Signed By Governor 05/29/2012; Chapter 0086 "
347750,2012-05-31,"House I. Section 2 Effective 11/01/2012 "
347750,2012-05-31,"House II. Remainder Effective 05/29/2012 "
347751,2011-10-24,"House Introduced 1/4/2012 and Referred to Education; House Journal  7, PG.345  "
347751,2011-12-15,"House Public Hearing: 1/10/2012 10:00 Amendment Legislative Office Building 207 "
347751,2011-12-15,"House Executive Session: 1/19/2012 1:00 PM Legislative Office Building 207 "
347751,2012-01-26,"House Committee Report: Inexpedient to Legislate for Feb 1 (Vote 14-0; Consent Calendar); House Calendar 5, PG.243 "
347751,2012-02-01,"House Inexpedient to Legislate: Motion Adopted Voice Vote; House Journal  13, PG.740 "
347753,2011-10-24,"House Introduced 1/4/2012 and Referred to Constitutional Review and Statutory Recodification; House Journal  7, PG.345 "
347753,2011-12-21,"House Public Hearing: 1/31/2012 1:00 PM Legislative Office Building 206 "
347753,2012-02-09,"House Executive Session: 2/14/2012 2:30 PM Legislative Office Building 206 "
347753,2012-02-16,"House Majority Committee Report: Ought to Pass for Mar 7 (Vote 8-4; Regular Calendar); House Calendar 18, PG.1085 "
347753,2012-02-16,"House Minority Committee Report: Inexpedient to Legislate; House Calendar 18, PG.1085 "
347753,2012-03-07,"House Ought to Pass: Motion Failed Regular Calendar 155-170; House Journal  21, PG.1341-1344 "
347753,2012-03-07,"House Inexpedient to Legislate (Rep Vaillancourt): Motion Adopted Division Vote 181-143; House Journal  21, PG.1344 "
347753,2012-03-07,"House Print Remarks of Rep Vaillancourt in Permanent Journal (Rep Kurk): Motion Failed Voice Vote; House Journal  21, PG.1344 "
347753,2012-03-07,"House Reconsideration (Rep Vaillancourt): Motion Failed Division Vote 119-204; House Journal  21, PG.1344 "
347754,2011-10-24,"House Introduced 1/4/2012 and Referred to Executive Departments and Administration; House Journal  7, PG.345 "
347754,2011-12-21,"House Public Hearing: 1/10/2012 10:00 Amendment Legislative Office Building 306 ==Executive Session To Follow== "
347754,2012-01-10,"House Committee Report: Inexpedient to Legislate for Feb 1 (Vote 10-0; Consent Calendar); House Calendar 4, PG.210 "
347754,2012-02-01,"House Removed from Consent Calendar (Rep Bergevin); House Journal  13, PG.739 "
347754,2012-02-01,"House Laid on Table (Rep Jasper): Motion Adopted Regular Calendar 220-95; House Journal  13, PG.790-792 "
347756,2011-10-24,"House Introduced 1/4/2012 and Referred to Education; House Journal  7, PG.345 "
347756,2011-12-15,"House Public Hearing: 2/14/2012 11:00 Amendment Legislative Office Building 207 "
347756,2011-12-15,"House Executive Session: 2/16/2012 10:00 Amendment Legislative Office Building 207 "
347756,2012-02-17,"House Committee Report: Inexpedient to Legislate for Mar 7 (Vote 16-0; Consent Calendar); House Calendar 19, PG.1144 "
347756,2012-03-07,"House Removed from Consent Calendar (Rep Bergevin); House Journal  21, PG.1285 "
347756,2012-03-15,"House Inexpedient to Legislate: Motion Adopted Regular Calendar 280-7; House Journal  26, PG.1641-1643 "
347757,2011-10-24,"House Introduced 1/4/2012 and Referred to Municipal and County Government; House Journal  7, PG.345 "
347757,2012-01-18,"House Public Hearing: 1/31/2012 10:00 Amendment Legislative Office Building 301 "
347757,2012-02-08,"House Executive Session: 2/13/2012 11:00 Amendment Legislative Office Building 301 "
347757,2012-02-15,"House Committee Report: Inexpedient to Legislate for Feb 22 (Vote 14-0; Consent Calendar); House Calendar 14, PG.805 "
347757,2012-02-22,"House Inexpedient to Legislate: Motion Adopted Voice Vote; House Journal  20, PG.1212 "
347759,2011-10-24,"House Introduced 1/4/2012 and Referred to Executive Departments and Administration; House Journal  7, PG.345 "
347759,2012-01-10,"House Public Hearing: 2/14/2012 10:00 Amendment Legislative Office Building 306 ==Executive Session To Follow== "
347759,2012-02-14,"House Committee Report: Ought to Pass for Mar 7 (Vote 12-0; Consent Calendar); House Calendar 18, PG.1065 "
347759,2012-03-07,"House Ought to Pass: Motion Adopted Voice Vote; House Journal  21, PG.1302-1303 "
347759,2012-03-07,"Senate Introduced and Referred to Executive Departments and Administration; Senate Journal 7, Pg.185 "
347759,2012-03-29,"Senate Hearing: 4/05/12, Room 100, State House, 9:30 a.m.; Senate Calendar 13 "
347759,2012-04-12,"Senate Committee Report: Ought to Pass, 4/18/12; Senate Calendar 15 "
347759,2012-04-18,"Senate Ought to Pass: Motion Adopted, Voice Vote; OT3rdg; Senate Journal 10, Pg.379 "
347759,2012-04-25,"House Enrolled; House Journal  38, PG.2211 "
347759,2012-05-02,"Senate Enrolled; Senate Journal 13, Pg.475 "
347759,2012-05-21,"House Signed By Governor 05/14/2012; Effective 07/13/2012; Chapter 0052 "
347760,2011-10-24,"House Introduced 1/4/2012 and Referred to Municipal and County Government; House Journal  7, PG.345 "
347760,2012-01-18,"House Public Hearing: 1/31/2012 1:30 PM Legislative Office Building 301 "
347760,2012-02-08,"House Executive Session: 2/14/2012 11:00 Amendment Legislative Office Building 301 "
347760,2012-02-16,"House Committee Report: Inexpedient to Legislate for Mar 7 (Vote 17-0; Consent Calendar); House Calendar 18, PG.1073 "
347760,2012-03-07,"House Inexpedient to Legislate: Motion Adopted Voice Vote; House Journal  21, PG.1316 "
347762,2011-10-24,"House Introduced 1/4/2012 and Referred to Science, Technology and Energy; House Journal  7, PG.345 "
347762,2012-01-05,"House Public Hearing: 1/24/2012 12:00 PM Legislative Office Building 304 "
347762,2012-01-31,"House Executive Session: 2/7/2012 10:00 Amendment Legislative Office Building 304 =RECESSED= "
347762,2012-02-09,"House Continued Executive Session: 2/15/2012 3:00 PM Legislative Office Building 304 "
347762,2012-02-22,"House Committee Report: Inexpedient to Legislate for Mar 7 (Vote 13-0; Consent Calendar); House Calendar 18, PG.1076 "
347762,2012-03-07,"House Inexpedient to Legislate: Motion Adopted Voice Vote; House Journal  21, PG.1323 "
347763,2011-10-24,"House Introduced 1/4/2012 and Referred to Commerce and Consumer Affairs; House Journal  7, PG.345 "
347763,2011-12-15,"House ==CANCELLED== Public Hearing: 1/12/2012 10:30 Amendment Legislative Office Building 302 =Insurance Div= "
347763,2012-01-11,"House ==RESCHEDULED== Public Hearing: 1/20/2012 10:30 Amendment Legislative Office Building 302 =Insurance Div= "
347763,2012-01-24,"House Subcommittee Work Session: 2/2/2012 2:00 PM Legislative Office Building 302 =Insurance Div= "
347763,2012-02-09,"House Executive Session: 2/16/2012 1:15 PM Legislative Office Building 302 "
347763,2012-02-17,"House Committee Report: Inexpedient to Legislate for Mar 7 (Vote 16-0; Consent Calendar); House Calendar 18, PG.1055 "
347763,2012-03-07,"House Inexpedient to Legislate: Motion Adopted Voice Vote; House Journal  21, PG.1286 "
347765,2011-10-24,"House Introduced 1/4/2012 and Referred to Executive Departments and Administration; House Journal  7, PG.345 "
347765,2012-01-10,"House Public Hearing: 2/7/2012 10:45 Amendment Legislative Office Building 306 ==Executive Session To Follow== "
347765,2012-02-07,"House Committee Report: Refer to Interim Study for Feb 15 (Vote 13-1; Regular Calendar); House Calendar 11, PG.696 "
347765,2012-02-15,"House Refer to Interim Study: Motion Adopted Voice Vote; House Journal  16, PG.934 "
347765,2012-06-07,"House Referred to Executive Departments and Administration for Interim Study; House Calendar 45, PG.2433 "
347765,2012-07-13,"House Subcommittee Work Session: 7/26/2012 1:00 PM Legislative Office Building 306 "
347765,2012-07-27,"House Interim Study - Subcommittee Work Session: 8/16/2012 1:00 PM Legislative Office Building 306 "
347765,2012-08-17,"House Interim Study - Subcommittee Work Session: 8/23/2012 10:00 Amendment Legislative Office Building 306 "
347765,2012-08-17,"House Interim Study - Subcommittee Work Session: 8/30/2012 10:00 Amendment Legislative Office Building 306 "
347765,2012-08-17,"House Interim Study - Subcommittee Work Session: 9/6/2012 10:00 Amendment Legislative Office Building 306 "
347765,2012-08-30,"House Interim Study - Subcommittee Work Session: 9/13/2012 10:30 Amendment Legislative Office Building 306 "
347765,2012-08-30,"House Interim Study - Subcommittee Work Session: 9/26/2012 10:00 Amendment Legislative Office Building 306 "
347765,2012-09-18,"House Interim Study - Executive Session: 10/18/2012 1:30 PM Legislative Office Building 306 "
347766,2011-10-24,"House Introduced 1/4/2012 and Referred to Executive Departments and Administration; House Journal  7, PG.345 "
347766,2012-01-10,"House Public Hearing: 2/14/2012 10:30 Amendment Legislative Office Building 306 ==Executive Session To Follow== "
347766,2012-02-14,"House Committee Report: Ought to Pass with Amendment #0788h for Feb 22 (Vote 11-0; Consent Calendar); House Calendar 14, PG.800 "
347766,2012-02-14,"House Proposed Committee Amendment #2012-0788h; House Calendar 14, PG.832-833 "
347766,2012-02-22,"House Amendment #0788h Adopted, Voice Vote; House Journal  20, PG.1202 "
347766,2012-02-22,"House Ought to Pass with Amendment #0788h: Motion Adopted Voice Vote; House Journal  20, PG.1202 "
347766,2012-03-07,"Senate Introduced and Referred to Executive Departments and Administration; Senate Journal 7, Pg.185 "
347766,2012-03-29,"Senate Hearing: 4/05/12, Room 100, State House, 9:45 a.m.; Senate Calendar 13 "
347766,2012-04-05,"Senate Committee Report: Ought to Pass, 4/11/12; Senate Calendar 14 "
347766,2012-04-11,"Senate Ought to Pass: Motion Adopted, Voice Vote; OT3rdg; Senate Journal 9, Pg.349 "
347766,2012-04-11,"House Enrolled "
347766,2012-04-18,"Senate Enrolled; Senate Journal 11, Pg.383 "
347766,2012-05-03,"House Signed By Governor 05/02/2012; Effective 07/01/2012; Chapter 0027 "
347768,2011-10-24,"House Introduced 1/4/2012 and Referred to Judiciary; House Journal  7, PG.345 "
347768,2011-12-27,"House Public Hearing: 1/10/2012 9:30 Amendment Legislative Office Building 208 "
347768,2012-01-11,"House Executive Session: 1/19/2012 9:30 Amendment Legislative Office Building 208 "
347768,2012-01-26,"House Committee Report: Inexpedient to Legislate for Feb 1 (Vote 17-0; Consent Calendar); House Calendar 5, PG.245 "
347768,2012-02-01,"House Inexpedient to Legislate: Motion Adopted Voice Vote; House Journal  13, PG.743 "
347769,2011-10-24,"House Introduced 1/4/2012 and Referred to Commerce and Consumer Affairs; House Journal  7, PG.345 "
347769,2011-12-15,"House ==CANCELLED== Public Hearing: 1/12/2012 1:15 PM Legislative Office Building 302 =Insurance Div= "
347769,2012-01-11,"House ==RESCHEDULED== Public Hearing: 1/20/2012 1:15 PM Legislative Office Building 302 =Insurance Div= "
347769,2012-01-24,"House Subcommittee Work Session: 2/2/2012 2:00 PM Legislative Office Building 302 =Insurance Div= "
347769,2012-02-08,"House Subcommittee Work Session: 2/16/2012 10:00 Amendment Legislative Office Building 302 "
347769,2012-02-09,"House ==CANCELLED== Executive Session: 2/16/2012 1:15 PM Legislative Office Building 302 "
347769,2012-02-16,"House Subcommittee Work Session: 2/21/2012 10:00 Amendment Legislative Office Building 302 ==Executive Session To Follow== "
347769,2012-02-23,"House Committee Report: Ought to Pass with Amendment #0931h for Mar 7 (Vote 13-0; Consent Calendar); House Calendar 18, PG.1055 "
347769,2012-02-23,"House Proposed Committee Amendment #2012-0931h; House Calendar 17, PG.975-976 "
347769,2012-03-07,"House Amendment #0931h Adopted, Voice Vote; House Journal  21, PG.1286-1287 "
347769,2012-03-07,"House Ought to Pass with Amendment #0931h: Motion Adopted Voice Vote; House Journal  21, PG.1286 "
347769,2012-03-07,"Senate Introduced and Referred to Transportation; Senate Journal 7, Pg.185 "
347769,2012-03-22,"Senate Hearing: 3/29/12, Room 103, Legislative Office Building, 9:00 a.m.; Senate Calendar 12 "
347769,2012-04-26,"Senate Committee Report: Ought to Pass with Amendment #2012-1865s, 5/2/12; Senate Calendar 17 "
347769,2012-05-02,"Senate Committee Amendment 1865s; Amendment Adopted, Voice Vote; Senate Journal 12, Pg.452 "
347769,2012-05-02,"Senate Ought to Pass with Amendment 1865s, Motion Adopted, Voice Vote; OT3rdg; Senate Journal 12, Pg.471 "
347769,2012-05-15,"House House Concurs with Senate Amendment #1865s (Rep Hunt): Motion Adopted Voice Vote; House Journal  43, PG.2279 "
347769,2012-05-17,"House Enrolled; House Journal  46, PG.2493 "
347769,2012-05-23,"Senate Enrolled "
347769,2012-06-07,"House Signed By Governor 06/05/2012; Effective 01/01/2013; Chapter 0118 "
347771,2011-10-24,"House Introduced 1/4/2012 and Referred to Criminal Justice and Public Safety; House Journal  7, PG.345 "
347771,2012-01-03,"House Public Hearing: 1/24/2012 10:00 Amendment Legislative Office Building 204 "
347771,2012-02-02,"House Executive Session: 2/6/2012 10:00 Amendment Legislative Office Building 204 "
347771,2012-02-07,"House Committee Report: Refer to Interim Study for Feb 15 (Vote 12-1; Consent Calendar); House Calendar 11, PG.682 "
347771,2012-02-15,"House Refer to Interim Study: Motion Adopted Voice Vote; House Journal  16, PG.911 "
347771,2012-06-07,"House Referred to Criminal Justice and Public Safety for Interim Study; House Calendar 45, PG.2432 "
347771,2012-09-04,"House Interim Study - Subcommittee Work Session: 9/18/2012 10:00 Amendment Legislative Office Building 208 "
347771,2012-09-18,"House Interim Study - Executive Session: 10/10/2012 10:00 Amendment Legislative Office Building 204 "
347772,2011-10-24,"House Introduced 1/4/2012 and Referred to Municipal and County Government; House Journal  7, PG.345 "
347772,2012-01-17,"House Public Hearing: 2/9/2012 1:30 PM Legislative Office Building 301 "
347772,2012-02-08,"House Executive Session: 2/14/2012 11:00 Amendment Legislative Office Building 301 "
347772,2012-02-16,"House Committee Report: Inexpedient to Legislate for Mar 7 (Vote 17-0; Consent Calendar); House Calendar 18, PG.1073 "
347772,2012-03-07,"House Inexpedient to Legislate: Motion Adopted Voice Vote; House Journal  21, PG.1316 "
347774,2011-10-24,"House Introduced 1/4/2012 and Referred to Municipal and County Government; House Journal  7, PG.345 "
347774,2012-01-17,"House Public Hearing: 2/7/2012 2:00 PM Legislative Office Building 301 ==TIME CHANGE (Orig 1:45 PM)== "
347774,2012-02-08,"House Executive Session: 2/13/2012 11:00 Amendment Legislative Office Building 301 "
347774,2012-02-15,"House Committee Report: Inexpedient to Legislate for Feb 22 (Vote 14-0; Consent Calendar); House Calendar 14, PG.805-806 "
347774,2012-02-22,"House Inexpedient to Legislate: Motion Adopted Voice Vote; House Journal  20, PG.1212 "
347775,2011-10-24,"House Introduced 1/4/2012 and Referred to Election Law; House Journal  7, PG.345 "
347775,2012-01-18,"House Public Hearing: 1/24/2012 11:00 Amendment Legislative Office Building 308 "
347775,2012-01-25,"House Executive Session: 1/31/2012 1:00 PM Legislative Office Building 308 "
347775,2012-01-31,"House Committee Report: Inexpedient to Legislate for Feb 8 (Vote 13-0; Consent Calendar); House Calendar 6, PG.287 "
347775,2012-02-08,"House Inexpedient to Legislate: Motion Adopted Voice Vote; House Journal  15, PG.849 "
347777,2011-10-24,"House Introduced 1/4/2012 and Referred to Education; House Journal  7, PG.345 "
347777,2011-12-15,"House Public Hearing: 1/26/2012 10:00 Amendment Legislative Office Building 207 "
347777,2011-12-15,"House Executive Session: 2/2/2012 1:00 PM Legislative Office Building 207 "
347777,2012-02-09,"House Majority Committee Report: Inexpedient to Legislate for Feb 15 (Vote 14-2; Regular Calendar); House Calendar 11, PG.695 "
347777,2012-02-09,"House Minority Committee Report: Refer to Interim Study; House Calendar 11, PG.695 "
347777,2012-02-15,"House Inexpedient to Legislate: Motion Adopted Voice Vote; House Journal  16, PG.932-933 "
347778,2011-11-14,"House Introduced 1/4/2012 and Referred to Labor, Industrial and Rehabilitative Services; House Journal  7, PG.345 "
347778,2012-01-05,"House Public Hearing: 1/19/2012 9:00 Amendment Legislative Office Building 305-307 "
347778,2012-02-08,"House Full Committee Work Session: 2/14/2012 1:00 PM Legislative Office Building 303 "
347778,2012-02-15,"House Public Hearing on Proposed Amendment #2012-0822h(NT): 2/21/2012 10:00 Amendment Representatives Hall "
347778,2012-02-15,"House Full Committee Work Session: 2/21/2012 1:00 PM Legislative Office Building 307 ==Executive Session To Follow== "
347778,2012-02-23,"House Committee Report: Inexpedient to Legislate for Mar 7 (Vote 17-0; Consent Calendar); House Calendar 18, PG.1071 "
347778,2012-03-07,"House Inexpedient to Legislate: Motion Adopted Voice Vote "
347780,2011-11-14,"House Introduced 1/4/2012 and Referred to Election Law; House Journal  7, PG.345 "
347780,2012-01-18,"House Public Hearing: 1/26/2012 2:00 PM Legislative Office Building 308 "
347780,2012-02-08,"House Executive Session: 2/14/2012 2:00 PM Legislative Office Building 308 "
347780,2012-02-14,"House Committee Report: Inexpedient to Legislate for Feb 22 (Vote 14-3; Regular Calendar); House Calendar 14, PG.810 "
347780,2012-02-22,"House Inexpedient to Legislate: Motion Adopted Division Vote 261-56; House Journal  20, PG.1216 "
347781,2011-11-14,"House Introduced 1/4/2012 and Referred to Public Works and Highways; House Journal  7, PG.346 "
347781,2011-12-21,"House Public Hearing: 1/19/2012 1:15 PM Legislative Office Building 201 ==Executive Session To Follow== "
347781,2012-01-25,"House Committee Report: Ought to Pass with Amendment #0293h for Feb 1 (Vote 11-0; Regular Calendar); House Calendar 5, PG.253 "
347781,2012-01-25,"House Proposed Committee Amendment #2012-0293h; House Calendar 5, PG.278 "
347781,2012-02-01,"House Amendment #0293h Adopted, Voice Vote; House Journal  13, PG.786 "
347781,2012-02-01,"House Ought to Pass with Amendment #0293h: Motion Adopted Voice Vote; House Journal  13, PG.785-786 "
347781,2012-02-08,"Senate Introduced and Referred to Transportation; Senate Journal 5, Pg.122 "
347781,2012-02-23,"Senate Hearing: 3/8/12, Room 103, Legislative Office Building, 10:00 a.m.; Senate Calendar 9 "
347781,2012-04-12,"Senate Committee Report: Ought to Pass with Amendment #2012-1620s, 4/18/12; Senate Calendar 15 "
347781,2012-04-18,"Senate Committee Amendment 1620s; Amendment Adopted, Voice Vote; Senate Journal 10, Pg.373 "
347781,2012-04-18,"Senate Ought to Pass with Amendment 1620s, Regular Calendar 24Y-0N, Motion Adopted; OT3rdg; Senate Journal 10, Pg.379 "
347781,2012-05-09,"House House Concurs with Senate Amendment #1620s (Rep Chandler): Motion Adopted Voice Vote; House Journal  40, PG.2228 "
347781,2012-05-16,"Senate Enrolled "
347781,2012-05-17,"House Enrolled; House Journal  46, PG.2480 "
347781,2012-05-31,"House Signed By Governor 05/29/2012; Effective 05/29/2012; Chapter 0087 "
347783,2011-11-14,"House Introduced 1/4/2012 and Referred to Resources, Recreation and Development; House Journal  7, PG.346 "
347783,2011-12-22,"House Public Hearing: 1/10/2012 2:30 PM Legislative Office Building 305 "
347783,2012-01-11,"House Continued Public Hearing: 1/24/2012 10:15 Amendment Legislative Office Building 305 "
347783,2012-01-12,"House Executive Session: 1/31/2012 1:00 PM Legislative Office Building 305 =(If Necessary Continued 2/2/2012 10:30 Amendment Legislative Office Building 305)= "
347783,2012-02-03,"House Committee Report: Inexpedient to Legislate for Feb 15 (Vote 15-0; Consent Calendar); House Calendar 11, PG.691 "
347783,2012-02-15,"House Inexpedient to Legislate: Motion Adopted Voice Vote; House Journal  16, PG.925 "
347784,2011-11-14,"House Introduced 1/4/2012 and Referred to Education; House Journal  7, PG.346 "
347784,2011-12-15,"House Public Hearing: 1/26/2012 10:30 Amendment Legislative Office Building 207 "
347784,2011-12-15,"House Executive Session: 2/14/2012 1:00 PM Legislative Office Building 207 "
347784,2012-02-16,"House Committee Report: Ought to Pass with Amendment #0793h(NT) for Mar 7 (Vote 15-0; Consent Calendar); House Calendar 18, PG.1062 "
347784,2012-02-16,"House Proposed Committee Amendment #2012-0793h (New Title); House Calendar 17, PG.976 "
347784,2012-03-07,"House Amendment #0793h(NT) Adopted, Voice Vote; House Journal  21, PG.1298 "
347784,2012-03-07,"House Ought to Pass with Amendment #0793h(NT): Motion Adopted Voice Vote; House Journal  21, PG.1298 "
347784,2012-03-07,"Senate Introduced and Referred to Education; Senate Journal 7, Pg.185 "
347784,2012-04-04,"Senate Hearing: 4/10/12, Room 103, Legislative Office Building, 1:45 p.m.; Senate Calendar 14 "
347784,2012-04-11,"Senate Committee Report: Inexpedient to Legislate, 4/18/12; Senate Calendar 15 "
347784,2012-04-18,"Senate Inexpedient to Legislate, Motion Adopted, Voice Vote === BILL KILLED ===; Senate Journal 10, Pg.363 "
347786,2011-11-14,"House Introduced 1/4/2012 and Referred to Criminal Justice and Public Safety; House Journal  7, PG.346 "
347786,2011-12-14,"House Public Hearing: 1/10/2012 10:30 Amendment Legislative Office Building 204 ==Executive Session To Follow== "
347786,2012-01-25,"House Committee Report: Ought to Pass with Amendment #0070h for Feb 1 (Vote 12-0; Consent Calendar); House Calendar 5, PG.242 "
347786,2012-01-25,"House Proposed Committee Amendment #2012-0070h; House Calendar 5, PG.279 "
347786,2012-02-01,"House Amendment #0070h, Adopted Voice Vote; House Journal  13, PG.739-740 "
347786,2012-02-01,"House Ought to Pass with Amendment #0070h: Motion Adopted Voice Vote; House Journal  13, PG.739-740 "
347786,2012-02-08,"Senate Introduced and Referred to Judiciary; Senate Journal 5, Pg.122 "
347786,2012-03-28,"Senate Hearing: 4/4/12, Room 101, Legislative Office Building, 1:00 p.m.; Senate Calendar 13 "
347786,2012-04-20,"Senate Committee Report: Ought to Pass with Amendment #2012-1771s, 4/25/12; Senate Calendar 16A "
347786,2012-04-25,"Senate Committee Amendment 1771s; Amendment Adopted, Voice Vote; Senate Journal 11, Pg.414 "
347786,2012-04-25,"Senate Ought to Pass with Amendment 1771s, Motion Adopted, Voice Vote; OT3rdg; Senate Journal 11, Pg.415 "
347786,2012-05-30,"House House Concurs with Senate Amendment #1771s (Rep Swinford): Motion Adopted Voice Vote; House Journal  47, PG.2501 "
347786,2012-06-06,"Senate Enrolled Bill Amendment #2489e Adopted, Voice Vote "
347786,2012-06-06,"House Enrolled Bill Amendment #2012-2489e (New Title) Adopted; House Journal  51, PG.2610 "
347786,2012-06-06,"Senate Enrolled "
347786,2012-06-06,"House Enrolled "
347786,2012-06-22,"House Signed By Governor 06/18/2012; Effective 01/01/2013; Chapter 0249 "
347787,2011-11-14,"House Introduced 1/4/2012 and Referred to Executive Departments and Administration; House Journal  7, PG.346 "
347787,2012-01-10,"House Public Hearing: 2/7/2012 11:30 Amendment Legislative Office Building 306 ==Executive Session To Follow== "
347787,2012-02-07,"House Committee Report: Inexpedient to Legislate for Mar 7 (Vote 12-0; Consent Calendar); House Calendar 18, PG.1065 "
347787,2012-03-07,"House Inexpedient to Legislate: Motion Adopted Voice Vote; House Journal  21, PG.1303 "
347789,2011-11-14,"House Introduced 1/4/2012 and Referred to Municipal and County Government; House Journal  7, PG.346 "
347789,2012-01-03,"House Public Hearing: 1/19/2012 10:00 Amendment Legislative Office Building 301 "
347789,2012-01-18,"House Executive Session: 1/25/2012 11:30 Amendment Legislative Office Building 301 ==TIME CHANGE (Orig 11:00 Amendment)== "
347789,2012-01-26,"House Committee Report: Ought to Pass for Feb 1 (Vote 17-0; Consent Calendar); House Calendar 5, PG.247 "
347789,2012-02-01,"House Ought to Pass: Motion Adopted Voice Vote; House Journal  13, PG.745 "
347789,2012-02-08,"Senate Introduced and Referred to Public and Municipal Affairs; Senate Journal 5, Pg.122 "
347789,2012-02-13,"Senate Hearing: 2/21/12, Room 101, Legislative Office Building, 9:00 a.m.; Senate Calendar 8 "
347789,2012-02-23,"Senate Committee Report: Ought to Pass, 3/7/12; Senate Calendar 9 "
347789,2012-03-07,"Senate Ought to Pass: Motion Adopted, Voice Vote; OT3rdg; Senate Journal 6, Pg.173"
347789,2012-03-07,"Senate Enrolled; Senate Journal 7, Pg.188 "
347789,2012-03-15,"House Enrolled; House Journal  26, PG.1650 "
347789,2012-03-26,"House Signed by the Governor 03/22/2012; Effective 05/21/2012; Chapter 0006 "
347790,2011-11-14,"House Introduced 1/4/2012 and Referred to Transportation; House Journal  7, PG.346 "
347790,2011-12-15,"House Public Hearing: 1/31/2012 10:20 Amendment Legislative Office Building 203 ==TIME CHANGE (Orig 1:00 PM)== "
347790,2012-01-31,"House Executive Session: 2/7/2012 2:00 PM Legislative Office Building 203 "
347790,2012-02-08,"House Committee Report: Ought to Pass for Feb 15 (Vote 13-0; Consent Calendar); House Calendar 11, PG.693 "
347790,2012-02-15,"House Ought to Pass: Motion Adopted Voice Vote; House Journal  16, PG.927 "
347790,2012-02-15,"Senate Introduced and Referred to Transportation; Senate Journal 6, Pg.145 "
347790,2012-03-13,"Senate Hearing: 3/22/12, Room 103, Legislative Office Building, 10:00 a.m.; Senate Calendar 11 "
347790,2012-04-12,"Senate Committee Report: Ought to Pass with Amendment #2012-1628s, New Title, 4/18/12; Senate Calendar 15 "
347790,2012-04-18,"Senate Chair Ruled Non-Germane Amendment; Senate Journal 10, Pg.374 "
347790,2012-04-18,"Senate Without Objection Rule 3-7 is suspended to Allow Non-Germane Amendment 1628s, 2/3 necessary, Motion Adopted; Senate Journal 10, Pg.374 "
347790,2012-04-18,"Senate Committee Amendment 1628s; New Title, Amendment Adopted, Voice Vote; Senate Journal 10, Pg.374 "
347790,2012-04-18,"Senate Ought to Pass with Amendment 1628s, New Title, Motion Adopted, Voice Vote; OT3rdg; Senate Journal 10, Pg.379 "
347790,2012-05-15,"House House Concurs with Senate Amendment #1628s(NT) (Rep Packard): Motion Adopted Voice Vote; House Journal  43, PG.2280 "
347790,2012-05-16,"Senate Enrolled Bill Amendment #2335e Adopted 5/23/12 "
347790,2012-05-17,"House Enrolled Bill Amendment #2012-2335e Adopted; House Journal  46, PG.2494 "
347790,2012-05-30,"House Enrolled; House Journal  47, PG.2508 "
347790,2012-06-05,"Senate Enrolled (05/23/12) "
347790,2012-06-15,"House Signed By Governor 06/11/2012; Effective 08/10/2012; Chapter 0172 "
347792,2011-11-14,"House Introduced 1/4/2012 and Referred to Commerce and Consumer Affairs; House Journal  7, PG.346 "
347792,2011-12-16,"House Public Hearing: 1/31/2012 10:15 Amendment Legislative Office Building 302 =Banking Division= "
347792,2012-01-31,"House Subcommittee Work Session: 2/2/2012 2:04 PM Legislative Office Building 302 "
347792,2012-01-31,"House Subcommittee Work Session: 2/2/2012 2:04 PM Legislative Office Building 302 "
347792,2012-02-01,"House Public Hearing on Non-Germane Amendment #2012-0500h(NT): 2/9/2012 10:30 Amendment Legislative Office Building 302 ==Work Session May Follow== "
347792,2012-02-08,"House Subcommittee Work Session: 2/16/2012 10:00 Amendment Legislative Office Building 302 "
347792,2012-02-09,"House ==CANCELLED== Executive Session: 2/16/2012 1:15 PM Legislative Office Building 302 "
347792,2012-02-16,"House Subcommittee Work Session: 2/21/2012 10:00 Amendment Legislative Office Building 302 ==Executive Session To Follow== "
347792,2012-02-23,"House Committee Report: Ought to Pass with Amendment #0989h(NT) for Mar 7 (Vote 18-0; Consent Calendar); House Calendar 18, PG.1055 "
347792,2012-02-23,"House Proposed Committee Amendment #2012-0989h (New Title); House Calendar 17, PG.976-977 "
347792,2012-03-07,"House Amendment #0989h(NT) Adopted, Voice Vote; House Journal  21, PG.1287-1288 "
347792,2012-03-07,"House Ought to Pass with Amendment #0989h(NT): Motion Adopted Voice Vote; House Journal  21, PG.1287 "
347792,2012-03-07,"Senate Introduced and Referred to Commerce; Senate Journal 7, Pg.185 "
347792,2012-04-05,"Senate Hearing: 4/10/12, Room 102, Legislative Office Building, 9:10 a.m.; Senate Calendar 14 "
347792,2012-05-01,"Senate Committee Report: Ought to Pass, 5/9/12; Senate Calendar 18 "
347792,2012-05-09,"Senate Ought to Pass: Motion Adopted, Voice Vote; OT3rdg "
347792,2012-05-16,"Senate Enrolled Bill Amendment #2308e Adopted "
347792,2012-05-17,"House Enrolled Bill Amendment #2012-2308e Adopted; House Journal  46, PG.2485 "
347792,2012-05-23,"Senate Enrolled "
347792,2012-05-30,"House Enrolled [Recessed from 5/17/2012 Session]; House Journal  46, PG.2495 "
347792,2012-06-11,"House Signed By Governor 06/07/2012; Effective 08/06/2012; Chapter 0140 "
347793,2011-11-14,"House Introduced 1/4/2012 and Referred to Executive Departments and Administration; House Journal  7, PG.346 "
347793,2011-12-30,"House ===CANCELLED=== Public Hearing: 1/17/2012 1:30 PM Legislative Office Building 306 "
347793,2012-01-10,"House Public Hearing: 1/19/2012 10:00 Amendment Legislative Office Building 306 "
347793,2012-01-24,"House Subcommittee Work Session: 1/25/2012 3:15 PM Legislative Office Building 306 "
347793,2012-01-24,"House Subcommittee Work Session: 1/26/2012 12:00 PM Legislative Office Building 306 "
347793,2012-01-26,"House ===CANCELLED=== Work Session: 1/26/2012 12:03 PM Legislative Office Building 306 "
347793,2012-02-08,"House ==CANCELLED== Executive Session: 2/8/2012 Legislative Office Building 306 During Session Break "
347793,2012-02-08,"House Executive Session: 2/9/2012 1:00 PM Legislative Office Building 306 "
347793,2012-02-09,"House Committee Report: Inexpedient to Legislate for Mar 7 (Vote 12-0; Consent Calendar); House Calendar 18, PG.1065 "
347793,2012-03-07,"House Inexpedient to Legislate: Motion Adopted Voice Vote; House Journal  21, PG.1303 "
347795,2011-11-14,"House Introduced 1/4/2012 and Referred to Labor, Industrial and Rehabilitative Services; House Journal  7, PG.346 "
347795,2012-01-05,"House Public Hearing: 1/19/2012 10:00 Amendment Legislative Office Building 305-307 "
347795,2012-02-08,"House Full Committee Work Session: 2/14/2012 1:00 PM Legislative Office Building 303 "
347795,2012-02-15,"House Full Committee Work Session: 2/21/2012 1:00 PM Legislative Office Building 307 ==Executive Session To Follow== "
347795,2012-02-23,"House Committee Report: Ought to Pass with Amendment #0933h for Mar 7 (Vote 16-1; Consent Calendar); House Calendar 18, PG.1071 "
347795,2012-02-23,"House Proposed Committee Amendment #2012-0933h; House Calendar 17, PG.977 "
347795,2012-03-07,"House Amendment #0933h Adopted, Voice Vote; House Journal  21, PG.1311-1312 "
347795,2012-03-07,"House Ought to Pass with Amendment #0933h: Motion Adopted Voice Vote; House Journal  21, PG.1311 "
347795,2012-03-07,"Senate Introduced and Referred to Public and Municipal Affairs; Senate Journal 7, Pg.185 "
347795,2012-04-04,"Senate Hearing: 4/10/12, Room 101, Legislative Office Building, 10:15 a.m.; Senate Calendar 14 "
347795,2012-04-18,"Senate Committee Report: Inexpedient to Legislate, 4/25/12; Senate Calendar 16 "
347795,2012-04-25,"Senate Inexpedient to Legislate, Motion Adopted, Voice Vote === BILL KILLED ===; Senate Journal 11, Pg.396 "
347796,2011-11-14,"House Introduced 1/4/2012 and Referred to Education; House Journal  7, PG.346 "
347796,2011-12-15,"House Public Hearing: 1/26/2012 2:00 PM Legislative Office Building 207 "
347796,2011-12-15,"House Executive Session: 2/16/2012 10:00 Amendment Legislative Office Building 207 "
347796,2012-02-21,"House Committee Report: Ought to Pass for Mar 7 (Vote 9-6; Regular Calendar); House Calendar 18, PG.1091 "
347796,2012-03-08,"House Ought to Pass: Motion Adopted Voice Vote; House Journal  23, PG.1427 "
347796,2012-03-08,"Senate Introduced 3/7/2012 and Referred to Education; Senate Journal 7, Pg.185 "
347796,2012-04-11,"Senate Hearing: 4/17/12, Room 103, Legislative Office Building, 1:00 p.m.; Senate Calendar 15 "
347796,2012-05-08,"Senate Committee Report: Referred to Interim Study, 5/16/12; Vote 5-0; Consent Calendar; Senate Calendar 19 "
347796,2012-05-16,"Senate Refer to Interim Study, Motion Adopted, Voice Vote; Senate Journal 14, Pg.513 "
347798,2011-11-14,"House Introduced 1/4/2012 and Referred to Municipal and County Government; House Journal  7, PG.346 "
347798,2012-01-18,"House Public Hearing: 1/31/2012 2:00 PM Legislative Office Building 301 "
347798,2012-02-01,"House Executive Session: 2/6/2012 11:00 Amendment Legislative Office Building 301 "
347798,2012-02-07,"House Committee Report: Inexpedient to Legislate for Feb 15 (Vote 17-0; Consent Calendar); House Calendar 11, PG.688 "
347798,2012-02-15,"House Inexpedient to Legislate: Motion Adopted Voice Vote; House Journal  16, PG.922 "
347799,2011-11-14,"House Introduced 1/4/2012 and Referred to Municipal and County Government; House Journal  7, PG.346 "
347799,2012-01-17,"House Public Hearing: 1/24/2012 3:00 PM Legislative Office Building 301 "
347799,2012-02-08,"House Executive Session: 2/13/2012 11:00 Amendment Legislative Office Building 301 "
347799,2012-02-15,"House Committee Report: Inexpedient to Legislate for Feb 22 (Vote 14-0; Consent Calendar); House Calendar 14, PG.806 "
347799,2012-02-22,"House Inexpedient to Legislate: Motion Adopted Voice Vote; House Journal  20, PG.1212 "
347801,2011-11-14,"House Introduced 1/4/2012 and Referred to Judiciary; House Journal  7, PG.346 "
347801,2012-01-24,"House Public Hearing: 1/31/2012 9:00 Amendment Legislative Office Building 208 "
347801,2012-01-26,"House ===CANCELLED=== Public Hearing: 1/31/2012 9:00 Amendment Legislative Office Building 208 "
347801,2012-01-31,"House Public Hearing: 2/9/2012 9:00 Amendment Legislative Office Building 208 "
347801,2012-02-08,"House Executive Session: 2/14/2012 10:00 Amendment Legislative Office Building 208 "
347801,2012-02-17,"House Committee Report: Refer to Interim Study for Mar 7 (Vote 9-7; Regular Calendar); House Calendar 18, PG.1096 "
347801,2012-03-08,"House Refer to Interim Study: Motion Adopted Voice Vote; House Journal  23, PG.1442 "
347801,2012-06-07,"House Referred to Judiciary for Interim Study; House Calendar 45, PG.2433 "
347801,2012-09-10,"House Interim Study - Subcommittee Work Session: 10/2/2012 9:00 Amendment Legislative Office Building 208 "
347801,2012-09-17,"House Interim Study - Executive Session: 10/16/2012 10:00 Amendment Legislative Office Building 208 "
347802,2011-11-14,"House Introduced 1/4/2012 and Referred to Criminal Justice and Public Safety; House Journal  7, PG.346 "
347802,2012-01-03,"House Public Hearing: 1/24/2012 10:30 Amendment Legislative Office Building 204 "
347802,2012-02-02,"House Executive Session: 2/6/2012 10:00 Amendment Legislative Office Building 204 "
347802,2012-02-08,"House Committee Report: Inexpedient to Legislate for Feb 15 (Vote 8-4; Regular Calendar); House Calendar 11, PG.694 "
347802,2012-02-15,"House Inexpedient to Legislate: Motion Adopted Division Vote 209-134; House Journal  16, PG.932-933 "
347804,2011-11-14,"House Introduced 1/4/2012 and Referred to Judiciary; House Journal  7, PG.346 "
347804,2012-01-18,"House Public Hearing: 1/25/2012 3:30 PM Legislative Office Building 208 "
347804,2012-01-31,"House Executive Session: 2/7/2012 10:00 Amendment Legislative Office Building 208 "
347804,2012-02-14,"House Committee Report: Inexpedient to Legislate for Feb 22 (Vote 16-0; Consent Calendar); House Calendar 14, PG.803 "
347804,2012-02-22,"House Inexpedient to Legislate: Motion Adopted Voice Vote; House Journal  20, PG.1207 "
347805,2011-11-14,"House Introduced 1/4/2012 and Referred to Judiciary; House Journal  7, PG.346 "
347805,2011-12-27,"House Public Hearing: 1/10/2012 10:00 Amendment Legislative Office Building 208 "
347805,2012-01-11,"House Executive Session: 1/19/2012 9:30 Amendment Legislative Office Building 208 "
347805,2012-01-25,"House Majority Committee Report: Ought to Pass for Feb 1 (Vote 14-3; Regular Calendar); House Calendar 5, PG.252 "
347805,2012-01-25,"House Minority Committee Report: Inexpedient to Legislate; House Calendar 5, PG.252 "
347805,2012-02-01,"House Ought to Pass: Motion Adopted Regular Calendar 247-85; House Journal  13, PG.780-782 "
347805,2012-02-08,"Senate Introduced and Referred to Judiciary; Senate Journal 5, Pg.122 "
347805,2012-04-11,"Senate Without Objection HB 1181 is Vacated from Judiciary; Senate Journal 9, Pg.349 "
347805,2012-04-18,"Senate Inadvertently introduced into the Senate, without objection returned to House per Senate Rule 3-3; Senate Journal 10, Pg.378 "
347807,2011-11-14,"House Introduced 1/4/2012 and Referred to Commerce and Consumer Affairs; House Journal  7, PG.346 "
347807,2011-12-15,"House ==CANCELLED== Public Hearing: 1/12/2012 2:00 PM Legislative Office Building 302 =Insurance Div= "
347807,2012-01-11,"House ==RESCHEDULED== Public Hearing: 1/20/2012 2:00 PM Legislative Office Building 302 =Insurance Div= "
347807,2012-01-24,"House Continued Public Hearing: 2/2/2012 1:15 PM Legislative Office Building 302 "
347807,2012-01-24,"House Subcommittee Work Session: 2/2/2012 2:00 PM Legislative Office Building 302 =Insurance Div= "
347807,2012-02-08,"House Subcommittee Work Session: 2/16/2012 10:00 Amendment Legislative Office Building 302 "
347807,2012-02-09,"House Executive Session: 2/16/2012 1:15 PM Legislative Office Building 302 "
347807,2012-02-22,"House Majority Committee Report: Inexpedient to Legislate for Mar 7 (Vote 14-2; Regular Calendar); House Calendar 18, PG.1080 "
347807,2012-02-22,"House Minority Committee Report: Ought to Pass; House Calendar 18, PG.1080 "
347807,2012-03-08,"House Inexpedient to Legislate: Motion Failed Division Vote 140-142; House Journal  23, PG.1390 "
347807,2012-03-08,"House Ought to Pass (Rep B.Murphy): Motion Adopted Regular Calendar 166-125; House Journal  23, PG.1390-1392 "
347807,2012-03-28,"Senate Introduced and Referred to Commerce; Senate Journal 9, Pg.332 "
347807,2012-04-11,"Senate Hearing: 4/24/12, Room 102, Legislative Office Building, 10:40 a.m.; Senate Calendar 15 "
347807,2012-05-01,"Senate Committee Report: Inexpedient to Legislate, 5/9/12; Senate Calendar 18 "
347807,2012-05-09,"Senate Sen. White Moved Laid On Table; Senate Journal 13, Pg.478 "
347807,2012-05-09,"Senate Sen. White Withdrew Motion to Lay on Table; Senate Journal 13, Pg.478 "
347807,2012-05-09,"Senate Inexpedient to Legislate, Motion Failed, Voice Vote; Senate Journal 13, Pg.478 "
347807,2012-05-09,"Senate Sen. Bradley Moved Ought to Pass; Senate Journal 13, Pg.478 "
347807,2012-05-09,"Senate Ought to Pass Not Voted On "
347807,2012-05-09,"Senate Sen. Bradley Moved Laid on Table, Motion Adopted, Voice Vote; Senate Journal 13, Pg.478 "
347807,2012-05-16,"Senate Sen. Stiles Moved Remove HB 1182 From Table, Div. 12Y-12N, Motion Failed "
347808,2011-11-14,"House Introduced 1/4/2012 and Referred to Legislative Administration; House Journal  7, PG.346  "
347808,2012-01-05,"House Public Hearing: 1/17/2012 11:00 Amendment Legislative Office Building 104 "
347808,2012-01-23,"House Subcommittee Work Session: 1/26/2012 3:00 PM Legislative Office Building 104 "
347808,2012-01-25,"House Executive Session: 2/7/2012 10:15 Amendment Legislative Office Building 203 "
347808,2012-02-07,"House Majority Committee Report: Inexpedient to Legislate for Feb 15 (Vote 10-4; Regular Calendar); House Calendar 11, PG.699 "
347808,2012-02-07,"House Minority Committee Report: Ought to Pass; House Calendar 11, PG.699 "
347808,2012-02-15,"House Inexpedient to Legislate: Motion Adopted Division Vote 243-81; House Journal  16, PG. 944-945 "
347810,2011-11-14,"House Introduced 1/4/2012 and Referred to Criminal Justice and Public Safety; House Journal  7, PG.346 "
347810,2011-12-14,"House Public Hearing: 1/10/2012 11:00 Amendment Legislative Office Building 204 "
347810,2012-02-02,"House Executive Session: 2/6/2012 10:00 Amendment Legislative Office Building 204 "
347810,2012-02-08,"House Committee Report: Ought to Pass with Amendment #0552h(NT) for Feb 15 (Vote 12-0; Consent Calendar); House Calendar 11, PG.682 "
347810,2012-02-08,"House Proposed Committee Amendment #2012-0552h (New Title); House Calendar 11, PG.722-723 "
347810,2012-02-15,"House Amendment #0552h(NT) Adopted, Voice Vote; House Journal  16, PG.911 "
347810,2012-02-15,"House Ought to Pass with Amendment #0552h(NT): Motion Adopted Voice Vote; House Journal  16, PG.911 "
347810,2012-02-15,"Senate Introduced and Referred to Judiciary; Senate Journal 6, Pg.145 "
347810,2012-03-28,"Senate Hearing: 4/4/12, Room 101, Legislative Office Building, 1:45 p.m.; Senate Calendar 13 "
347810,2012-05-03,"Senate Committee Report: Ought to Pass with Amendment #2012-1936s, New Title, 5/9/12; Senate Calendar 18 "
347810,2012-05-09,"Senate Committee Amendment 1936s, New Title, Amendment Adopted, Voice Vote; Senate Journal 13, Pg.489 "
347810,2012-05-09,"Senate Ought to Pass with Amendment 1936s, New Title, Motion Adopted, Voice Vote; OT3rdg; Senate Journal 13, Pg.505 "
347810,2012-05-30,"House House Concurs with Senate Amendment #1936s(NT) (Rep Swinford): Motion Adopted Voice Vote; House Journal  47, PG.2501 "
347810,2012-06-06,"Senate Enrolled "
347810,2012-06-06,"House Enrolled; House Journal  51, PG.2609 "
347810,2012-06-18,"House Signed By Governor 06/13/2012; Effective 01/01/2013; Chapter 0205 "
347811,2011-11-14,"House Introduced 1/4/2012 and Referred to Executive Departments and Administration; House Journal  7, PG.346 "
347811,2012-01-10,"House Public Hearing: 2/2/2012 10:45 Amendment Legislative Office Building 306 "
347811,2012-02-06,"House Subcommittee Work Session: 2/7/2012 9:00 Amendment Legislative Office Building 306 "
347811,2012-02-09,"House Subcommittee Work Session: 2/14/2012 9:00 Amendment Legislative Office Building 306 "
347811,2012-02-14,"House ==CANCELLED== Subcommittee Work Session: 2/16/2012 9:00 Amendment Legislative Office Building 306 "
347811,2012-02-15,"House Executive Session: 2/15/2012 12:40 PM Legislative Office Building 306 "
347811,2012-02-15,"House Committee Report: Ought to Pass with Amendment #0751h for Feb 22 (Vote 14-0; Consent Calendar); House Calendar 18, PG.1053 "
347811,2012-02-15,"House Proposed Committee Amendment #2012-0751h; House Calendar 17, PG.978 "
347811,2012-02-22,"House Removed from Consent Calendar (Rep Rosenwald); House Journal  20, PG.1201 "
347811,2012-03-07,"House Amendment #0751h Adopted, Voice Vote; House Journal  21, PG.1279 "
347811,2012-03-07,"House Ought to Pass with Amendment #0751h: Motion Adopted Voice Vote; House Journal  21, PG.1279 "
347811,2012-03-07,"Senate Introduced and Referred to Executive Departments and Administration; Senate Journal 7, Pg.185 "
347811,2012-03-22,"Senate Hearing: 3/29/12, Room 100, State House, 9:40 a.m.; Senate Calendar 12 "
347811,2012-04-05,"Senate Committee Report: Inexpedient to Legislate, 4/11/12; Senate Calendar 14 "
347811,2012-04-11,"Senate Inexpedient to Legislate, Motion Adopted, Voice Vote === BILL KILLED ===; Senate Journal 9, Pg.342 "
347813,2011-11-14,"House Introduced 1/4/2012 and Referred to Commerce and Consumer Affairs; House Journal  7, PG.346 "
347813,2011-12-15,"House Public Hearing: 1/12/2012 11:15 Amendment Legislative Office Building 302 =Insurance Division= "
347813,2012-01-11,"House Withdrawn Pursuant to House Rule 38(e) (Rep Coulombe): Motion Adopted Voice Vote; House Journal  9, PG.543 "
347815,2011-11-14,"House Introduced 1/4/2012 and Referred to Executive Departments and Administration; House Journal  7, PG.346 "
347815,2012-01-10,"House Public Hearing: 1/24/2012 1:30 PM Legislative Office Building 306 "
347815,2012-02-07,"House Executive Session: 2/13/2012 1:00 PM Legislative Office Building 306 "
347815,2012-02-13,"House Committee Report: Inexpedient to Legislate for Mar 7 (Vote 10-0; Consent Calendar); House Calendar 18, PG.1065 "
347815,2012-03-07,"House Inexpedient to Legislate: Motion Adopted Voice Vote; House Journal  21, PG.1303 "
347816,2011-11-14,"House Introduced 1/4/2012 and Referred to Judiciary; House Journal  7, PG.346 "
347816,2011-12-27,"House Public Hearing: 1/10/2012 10:30 Amendment Legislative Office Building 208 "
347816,2012-01-11,"House Executive Session: 1/19/2012 9:30 Amendment Legislative Office Building 208 "
347816,2012-01-25,"House Committee Report: Inexpedient to Legislate for Feb 1 (Vote 15-1; Consent Calendar); House Calendar 5, PG.246 "
347816,2012-02-01,"House Inexpedient to Legislate: Motion Adopted Voice Vote; House Journal  13, PG.743-744 "
347818,2011-11-14,"House Introduced 1/4/2012 and Referred to Municipal and County Government; House Journal  7, PG.346 "
347818,2012-01-17,"House Public Hearing: 1/26/2012 9:30 Amendment Legislative Office Building 301 ==Executive Session To Follow== "
347818,2012-02-01,"House Majority Committee Report: Inexpedient to Legislate for Feb 8 (Vote 15-2; Regular Calendar); House Calendar 6, PG.294 "
347818,2012-02-01,"House Minority Committee Report: Ought to Pass; House Calendar 6, PG.294 "
347818,2012-02-08,"House Inexpedient to Legislate: Motion Adopted Division Vote 226-114; House Journal  15, PG.893 "
347819,2011-11-14,"House Introduced 1/4/2012 and Referred to Executive Departments and Administration; House Journal  7, PG.346 "
347819,2012-01-10,"House Public Hearing: 2/14/2012 11:00 Amendment Legislative Office Building 306 ==Executive Session To Follow== "
347819,2012-02-14,"House Committee Report: Inexpedient to Legislate for Feb 22 (Vote 10-1; Consent Calendar); House Calendar 14, PG.801 "
347819,2012-02-22,"House Inexpedient to Legislate: Motion Adopted Voice Vote; House Journal  20, PG.1203 "
347821,2011-11-14,"House Introduced 1/4/2012 and Referred to Children and Family Law; House Journal  7, PG.346 "
347821,2012-01-03,"House Public Hearing: 1/17/2012 11:00 Amendment Legislative Office Building 206 "
347821,2012-01-24,"House Executive Session: 2/2/2012 10:00 Amendment Legislative Office Building 206 "
347821,2012-02-23,"House Committee Report: Inexpedient to Legislate for Mar 7 (Vote 11-0; Consent Calendar); House Calendar 18, PG.1054 "
347821,2012-03-07,"House Inexpedient to Legislate: Motion Adopted Voice Vote; House Journal  21, PG.1285 "
347822,2011-11-14,"House Introduced 1/4/2012 and Referred to Transportation; House Journal  7, PG.346  "
347822,2011-12-15,"House ==CANCELLED== Public Hearing: 1/10/2012 10:00 Amendment Legislative Office Building 203 "
347822,2012-01-04,"House Vacated from Transportation and Referred to Public Works and Highways; House Journal  7, PG.367  "
347822,2012-01-11,"House Public Hearing: 2/2/2012 10:45 Amendment Legislative Office Building 201 ==Executive Session To Follow== "
347822,2012-02-08,"House Committee Report: Refer to Interim Study for Feb 15 (Vote 10-4; Consent Calendar); House Calendar 11, PG.690 "
347822,2012-02-15,"House Refer to Interim Study: Motion Adopted Voice Vote; House Journal  16, PG.924 "
347822,2012-06-07,"House Referred to Public Works and Highways for Interim Study; House Calendar 45, PG.2433 "
347822,2012-09-13,"House Interim Study - Full Committee Work Session: 9/20/2012 10:00 Amendment Legislative Office Building 201 "
347822,2012-09-20,"House Interim Study - Executive Session: 10/30/2012 10:00 Amendment Legislative Office Building 201 "
347824,2011-11-14,"House Introduced 1/4/2012 and Referred to Transportation; House Journal  7, PG.346 "
347824,2011-12-14,"House Public Hearing: 1/17/2012 10:30 Amendment Legislative Office Building 203 "
347824,2012-02-08,"House ==CANCELLED== Executive Session: 2/14/2012 2:30 PM Legislative Office Building 203 "
347824,2012-02-15,"House Executive Session: 2/21/2012 10:30 Amendment Legislative Office Building 203 "
347824,2012-02-22,"House Committee Report: Inexpedient to Legislate for Mar 7 (Vote 15-0; Consent Calendar); House Calendar 18, PG.1077 "
347824,2012-03-07,"House Inexpedient to Legislate: Motion Adopted Voice Vote; House Journal  21, PG.1330 "
347825,2011-11-14,"House Introduced 1/4/2012 and Referred to Constitutional Review and Statutory Recodification; House Journal  7, PG.347 "
347825,2011-12-21,"House Public Hearing: 1/31/2012 2:00 PM Legislative Office Building 206 "
347825,2012-02-09,"House Executive Session: 2/14/2012 2:30 PM Legislative Office Building 206 "
347825,2012-02-17,"House Committee Report: Inexpedient to Legislate for Mar 7 (Vote 13-0; Consent Calendar); House Calendar 18, PG.1058 "
347825,2012-03-07,"House Inexpedient to Legislate: Motion Adopted Voice Vote; House Journal  21, PG.1293 "
347827,2011-11-14,"House Introduced 1/4/2012 and Referred to Executive Departments and Administration; House Journal  7, PG.347 "
347827,2011-12-21,"House Public Hearing: 1/10/2012 10:45 Amendment Legislative Office Building 306 ==Executive Session To Follow== "
347827,2012-01-10,"House Committee Report: Ought to Pass for Feb 1 (Vote 10-0; Consent Calendar); House Calendar 4, PG.210 "
347827,2012-02-01,"House Ought to Pass: Motion Adopted Voice Vote; House Journal  13, PG.741 "
347827,2012-03-28,"Senate Introduced and Referred to Internal Affairs; Senate Journal 9, Pg.332 "
347827,2012-04-12,"Senate Hearing: 4/18/12, Room 100, State House, 2:00 p.m.; Senate Calendar 15 "
347827,2012-04-19,"Senate Committee Report: Ought to Pass, 4/25/12; Vote 5-0; Consent Calendar; Senate Calendar 16 "
347827,2012-04-25,"Senate Ought to Pass: Motion Adopted, Voice Vote; OT3rdg; Senate Journal 11, Pg.415 "
347827,2012-04-25,"House Enrolled; House Journal  38, PG.2211 "
347827,2012-05-02,"Senate Enrolled; Senate Journal 13, Pg.475 "
347827,2012-05-21,"House Signed By Governor 05/14/2012; Effective 05/14/2012; Chapter 0053 "
347828,2011-11-15,"House Introduced 1/4/2012 and Referred to Executive Departments and Administration; House Journal  7, PG.347 "
347828,2011-12-21,"House Public Hearing: 1/10/2012 11:30 Amendment Legislative Office Building 306 ==Executive Session To Follow== "
347828,2012-01-10,"House Committee Report: Ought to Pass for Feb 1 (Vote 10-0; Consent Calendar); House Calendar 4, PG.210 "
347828,2012-02-01,"House Ought to Pass: Motion Adopted Voice Vote; House Journal  13, PG.741 "
347828,2012-02-15,"Senate Introduced and Referred to Finance; Senate Journal 6, Pg.145 "
347828,2012-03-08,"Senate Hearing: 3/15/12, Room 103, State House, 1:30 p.m.; Senate Calendar 10 "
347828,2012-03-15,"Senate Committee Report: Ought to Pass, 3/21/12; Senate Calendar 11 "
347828,2012-03-21,"Senate Ought to Pass: Motion Adopted, Voice Vote; OT3rdg; Senate Journal 7, Pg.257 "
347828,2012-04-11,"House Enrolled "
347828,2012-04-18,"Senate Enrolled; Senate Journal 11, Pg.384 "
347828,2012-04-24,"House Signed By Governor 04/23/2012; Effective 04/23/2012; Chapter 0013 "
347830,2011-11-15,"House Introduced 1/4/2012 and Referred to Health, Human Services and Elderly Affairs; House Journal  7, PG.347 "
347830,2011-12-14,"House Public Hearing: 1/10/2012 10:00 Amendment Legislative Office Building 205 ==Executive Session To Follow== "
347830,2012-02-08,"House Majority Committee Report: Inexpedient to Legislate for Feb 22 (Vote 8-7; Regular Calendar); House Calendar 14, PG.812-813 "
347830,2012-02-08,"House Minority Committee Report: Ought to Pass; House Calendar 14, PG.812-813 "
347830,2012-02-22,"House Inexpedient to Legislate: Motion Adopted Regular Calendar 180-160; House Journal  20, PG.1240-1242 "
347830,2012-02-22,"House Reconsideration (Rep Kurk): Motion Failed Division Vote 77-232; House Journal  20, PG.1243 "
347831,2011-11-15,"House Introduced 1/4/2012 and Referred to Election Law; House Journal  7, PG.347 "
347831,2012-01-18,"House Public Hearing: 1/24/2012 11:30 Amendment Legislative Office Building 308 "
347831,2012-02-08,"House Executive Session: 2/14/2012 2:00 PM Legislative Office Building 308 "
347831,2012-02-14,"House Committee Report: Inexpedient to Legislate for Feb 22 (Vote 13-3; Consent Calendar); House Calendar 14, PG.800 "
347831,2012-02-22,"House Inexpedient to Legislate: Motion Adopted Voice Vote; House Journal  20, PG.1202 "
347833,2011-11-15,"House Introduced 1/4/2012 and Referred to Education; House Journal  7, PG.347 "
347833,2011-12-15,"House Public Hearing: 2/2/2012 11:00 Amendment Legislative Office Building 207 "
347833,2011-12-15,"House Executive Session: 2/21/2012 10:00 Amendment Legislative Office Building 207 "
347833,2012-02-23,"House Committee Report: Inexpedient to Legislate for Mar 7 (Vote 16-0; Consent Calendar); House Calendar 18, PG.1062 "
347833,2012-03-07,"House Inexpedient to Legislate: Motion Adopted Voice Vote; House Journal  21, PG.1298 "
347834,2011-11-15,"House Introduced 1/4/2012 and Referred to Municipal and County Government; House Journal  7, PG.347 "
347834,2012-01-17,"House Public Hearing: 1/26/2012 10:00 Amendment Legislative Office Building 301 ==Executive Session To Follow== "
347834,2012-02-01,"House Majority Committee Report: Inexpedient to Legislate for Feb 8 (Vote 16-1; Regular Calendar); House Calendar 6, PG.294-295 "
347834,2012-02-01,"House Minority Committee Report: Ought to Pass; House Calendar 6, PG.294-295 "
347834,2012-02-08,"House Inexpedient to Legislate: Motion Adopted Division Vote 253-92; House Journal  15, PG.894 "
347836,2011-11-15,"House Introduced 1/4/2012 and Referred to Municipal and County Government; House Journal  7, PG.347 "
347836,2012-01-17,"House Public Hearing: 2/9/2012 9:30 Amendment Legislative Office Building 301 "
347836,2012-02-08,"House Executive Session: 2/14/2012 11:00 Amendment Legislative Office Building 301 "
347836,2012-02-21,"House Committee Report: Inexpedient to Legislate for Mar 7 (Vote 17-0; Consent Calendar); House Calendar 18, PG.1073 "
347836,2012-03-07,"House Inexpedient to Legislate: Motion Adopted Voice Vote; House Journal  21, PG.1317 "
347837,2011-11-15,"House Introduced 1/4/2012 and Referred to Education; House Journal  7, PG.347 "
347837,2011-12-15,"House Public Hearing: 1/31/2012 10:00 Amendment Legislative Office Building 207 "
347837,2011-12-15,"House ==CANCELLED== Executive Session: 2/2/2012 1:00 PM Legislative Office Building 207 "
347837,2012-02-03,"House Subcommittee Work Session: 2/3/2012 1:30 PM Legislative Office Building 207 ==Executive Session To Follow== "
347837,2012-02-23,"House Committee Report: Ought to Pass with Amendment #0602h(NT) for Mar 7 (Vote 17-0; Consent Calendar); House Calendar 18, PG.1062 "
347837,2012-02-23,"House Proposed Committee Amendment #2012-0602h (New Title); House Calendar 17, PG.978 "
347837,2012-03-07,"House Amendment #0602h(NT) Adopted, Voice Vote; House Journal  21, PG.1299 "
347837,2012-03-07,"House Ought to Pass with Amendment #0602h(NT): Motion Adopted Voice Vote; House Journal  21, PG.1299 "
347837,2012-03-07,"Senate Introduced and Referred to Education; Senate Journal 7, Pg.185 "
347837,2012-04-04,"Senate Hearing: 4/10/12, Room 103, Legislative Office Building, 1:00 p.m.; Senate Calendar 14 "
347837,2012-04-25,"Senate Committee Report: Referred to Interim Study, 5/2/12; Senate Calendar 17 "
347837,2012-05-02,"Senate Refer to Interim Study, Motion Adopted, Voice Vote; Senate Journal 12, Pg.427 "
347839,2011-11-15,"House Introduced 1/4/2012 and Referred to Public Works and Highways; House Journal  7, PG.347 "
347839,2011-12-21,"House Public Hearing: 1/24/2012 11:00 Amendment Legislative Office Building 201 =Executive Session To Follow= "
347839,2012-02-01,"House Committee Report: Ought to Pass with Amendment #0352h for Feb 8 (Vote 15-0; Consent Calendar); House Calendar 6, PG.289 "
347839,2012-02-01,"House Proposed Committee Amendment #2012-0352h; House Calendar 6, PG.336-337 "
347839,2012-02-08,"House Amendment #0352h Adopted, Voice Vote; House Journal  15, PG.853 "
347839,2012-02-08,"House Ought to Pass with Amendment #0352h: Motion Adopted Voice Vote; House Journal  15, PG.853 "
347839,2012-02-08,"Senate Introduced and Referred to Capital Budget; Senate Journal 5, Pg.122 "
347839,2012-04-03,"Senate Committee Report: Ought to Pass, 4/11/12; Senate Calendar 14 "
347839,2012-04-11,"Senate Ought to Pass: Motion Adopted, Voice Vote; OT3rdg; Senate Journal 9, Pg.349 "
347839,2012-04-11,"House Enrolled "
347839,2012-04-18,"Senate Enrolled; Senate Journal 11, Pg.383 "
347839,2012-05-03,"House Signed By Governor 05/02/2012; Effective 07/01/2012; Chapter 0028 "
347840,2011-11-16,"House Introduced 1/4/2012 and Referred to Public Works and Highways; House Journal  7, PG.347  "
347840,2011-12-21,"House Public Hearing: 1/17/2012 9:30 Amendment Legislative Office Building 201 ==Executive Session to Follow== "
347840,2012-01-25,"House Committee Report: Ought to Pass for Feb 1 (Vote 12-0; Consent Calendar); House Calendar 5A, PG.1 "
347840,2012-02-01,"House Removed from Consent Calendar (Rep Chandler); House Journal  13, PG.739 "
347840,2012-02-01,"House Ought to Pass: Motion Adopted Voice Vote; House Journal  13, PG.795 "
347840,2012-02-01,"House Referred to Ways and Means; House Journal  13, PG.795 "
347840,2012-02-08,"House Public Hearing: 2/16/2012 10:00 Amendment Legislative Office Building 202 ==Proposed Amendment #2012-0684h(NT) Immediately Following== "
347840,2012-02-14,"House Executive Session: 2/21/2012 10:00 Amendment Legislative Office Building 202 "
347840,2012-02-21,"House Committee Report: Ought to Pass with Amendment #0684h(NT) for Mar 7 (Vote 20-0; Consent Calendar); House Calendar 18, PG.1079 "
347840,2012-02-21,"House Proposed Committee Amendment #2012-0684h (New Title); House Calendar 17, PG.978-979 "
347840,2012-03-07,"House Amendment #0684h(NT) Adopted, Voice Vote; House Journal  21, PG.1333-1334 "
347840,2012-03-07,"House Ought to Pass with Amendment #0684h(NT): Motion Adopted Voice Vote; House Journal  21, PG.1333-1334 "
347840,2012-03-07,"Senate Introduced and Referred to Ways & Means; Senate Journal 7, Pg.185 "
347840,2012-03-27,"Senate Hearing: === CANCELLED === 3/27/12, Room 100, State House, 1:00 p.m. "
347840,2012-04-03,"Senate Hearing: === RESCHEDULED === 4/10/12, Room 100, State House, 1:00 p.m.; Senate Calendar 14 "
347840,2012-04-18,"Senate Committee Report: Ought to Pass, 4/25/12; Senate Calendar 16 "
347840,2012-04-25,"Senate Ought to Pass: Motion Adopted, Voice Vote; OT3rdg; Senate Journal 11, Pg.415 "
347840,2012-05-09,"Senate Enrolled Bill Amendment #1962e Adopted, Voice Vote; House Journal  40, PG.2244 "
347840,2012-05-09,"House Enrolled Bill Amendment #2012-1962e Adopted; House Journal  40, PG.2244 "
347840,2012-05-09,"Senate Enrolled; Senate Journal 14, Pg.511 "
347840,2012-05-15,"House Enrolled; House Journal  43, PG.2345 "
347840,2012-05-25,"House Signed By Governor 05/23/2012; Chapter 0073 "
347840,2012-05-25,"House I. Section 1&2 Effective 07/22/2012 "
347840,2012-05-25,"House II. Remainder Effective 05/23/2012 "
347842,2011-11-15,"House Introduced 1/4/2012 and Referred to Public Works and Highways; House Journal  7, PG.347 "
347842,2011-12-21,"House Public Hearing: 1/24/2012 11:30 Amendment Legislative Office Building 201 ==Executive Session To Follow== "
347842,2012-01-26,"House Committee Report: Ought to Pass for Feb 1 (Vote 15-0; Consent Calendar); House Calendar 5, PG.248 "
347842,2012-02-01,"House Ought to Pass: Motion Adopted Voice Vote; House Journal  13, PG.746 "
347842,2012-03-28,"Senate Introduced and Referred to Capital Budget; Senate Journal 9, Pg.332 "
347842,2012-04-25,"Senate Hearing: 5/8/12, Room 100, State House, 1:00 p.m.; Senate Calendar 17 "
347842,2012-05-03,"Senate On 5/8/12, State House 100, at 1:10 p.m., a hearing on proposed Amendment #2012-1842s, to HB 1205 "
347842,2012-05-03,"Senate On 5/8/12, State House 100, at 1:20 p.m., a hearing on proposed Amendment #2012-1982s, to HB 1205 "
347842,2012-05-10,"Senate Committee Report: Ought to Pass with Amendment #2012-2150s, New Title, 5/16/12; Senate Calendar 19 "
347842,2012-05-16,"Senate Chair Ruled Non-Germane Amendment; Senate Journal 14, Pg.516 "
347842,2012-05-16,"Senate Without Objection Rule 3-7 is Suspended to Allow Non-Germane Amendment 2150s, 2/3 necessary, Motion Adopted; Senate Journal 14, Pg.516 "
347842,2012-05-16,"Senate Committee Amendment 2150s, New Title, Amendment Adopted, Voice Vote; Senate Journal 14, Pg.516 "
347842,2012-05-16,"Senate Ought to Pass with Amendment 2150s, New Title, Motion Adopted, Voice Vote; OT3rdg; Senate Journal 14, Pg.587 "
347842,2012-05-17,"House House Non-Concurs with Senate Amendment #2150s(NT) and Requests C of C (Rep Baroody): Motion Adopted Voice Vote; House Journal  46, PG.2487 "
347842,2012-05-17,"House Speaker Appoints: Reps Chandler, Seidel, Graham, and Campbell; House Journal  46, PG.2487 "
347842,2012-05-23,"Senate Sen. Boutin Accedes to House Request for Committee of Conference ; Motion Adopted, Voice Vote "
347842,2012-05-23,"Senate President Appoints: Senators Boutin, Larsen, and Rausch "
347842,2012-05-24,"House Conference Committee Meeting: 5/29/2012 10:00 Amendment Legislative Office Building 201 ==RECESSED== "
347842,2012-05-25,"House Conferee Change: Rep Giuda Replaces Rep Seidel; House Journal  46, PG.2495 "
347842,2012-05-25,"House Conferee Change: Rep Sprague Replaces Rep Campbell; House Journal  46, PG.2495 "
347842,2012-05-29,"House ==RECONVENE== Conference Committee Meeting: 5/31/2012 9:00 Amendment Legislative Office Building 201 "
347842,2012-05-31,"Senate Conference Committee Report; Not Signed Off "
347843,2011-11-15,"House Introduced 1/4/2012 and Referred to Labor, Industrial and Rehabilitative Services; House Journal  7, PG.347 "
347843,2012-01-05,"House Public Hearing: 1/19/2012 9:01 Amendment Legislative Office Building 305-307 "
347843,2012-02-08,"House Full Committee Work Session: 2/14/2012 1:00 PM Legislative Office Building 303 "
347843,2012-02-15,"House Public Hearing on Proposed Amendment #2012-0823h(NT): 2/21/2012 11:00 Amendment Representatives Hall "
347843,2012-02-15,"House Full Committee Work Session: 2/21/2012 1:00 PM Legislative Office Building 307 ==Executive Session To Follow== "
347843,2012-02-23,"House Majority Committee Report: Ought to Pass with Amendment #0823h(NT) for Mar 7 (Vote 12-5; Regular Calendar); House Calendar 19, PG.1131-1132 "
347843,2012-02-23,"House Proposed Majority Committee Amendment #2012-0823h (New Title); House Calendar 19, PG.1163 "
347843,2012-02-23,"House Minority Committee Report: Inexpedient to Legislate; House Calendar 19, PG.1131-1132 "
347843,2012-03-14,"House Amendment #0823h(NT) Adopted, Division Vote 197-122; House Journal  24, PG.1481 "
347843,2012-03-14,"House Ought to Pass with Amendment #0823h(NT): Motion Adopted Regular Calendar 198-137; House Journal  24, PG.1481-1483 "
347843,2012-03-15,"House Reconsider Third Reading Motion of March 14 (Reps Jasper and Norelli): Motion Adopted Voice Vote "
347843,2012-03-15,"House Third Reading: Motion Adopted Voice Vote "
347843,2012-03-28,"Senate Introduced and Referred to Executive Departments and Administration; Senate Journal 9, Pg.332 "
347843,2012-04-10,"Senate Hearing: 4/19/12, Room 100, State House, 10:00 a.m.; Senate Calendar 15 "
347843,2012-04-19,"Senate Hearing: === RECESSED === 4/19/12, Room 100, State House, 10:00 a.m. "
347843,2012-04-19,"Senate Hearing: 4/26/12, Room 100, State House, 9:00 a.m.; Senate Calendar 16 "
347843,2012-05-03,"Senate Committee Report: Inexpedient to Legislate, 5/9/12; Senate Calendar 18 "
347843,2012-05-09,"Senate Special Ordered to 5/16/12, Without Objection, Motion Adopted; Senate Journal 13, Pg.478 "
347843,2012-05-09,"Senate Committee Report: Inexpedient to Legislate, 5/16/12, Senate Calendar 19 "
347843,2012-05-16,"Senate Inexpedient to Legislate Not Voted On "
347843,2012-05-16,"Senate Sen. Larsen Moved Laid On Table, Motion Adopted, Voice Vote; Senate Journal 14, Pg.521 "
347845,2011-11-15,"House Introduced 1/4/2012 and Referred to Resources, Recreation and Development; House Journal  7, PG.347 "
347845,2011-12-27,"House ==CANCELLED== Public Hearing: 1/12/2012 1:45 PM Legislative Office Building 305 "
347845,2012-01-12,"House ==RESCHEDULED== Public Hearing: 1/25/2012 1:45 PM Legislative Office Building 305 "
347845,2012-01-12,"House Executive Session: 1/31/2012 1:00 PM Legislative Office Building 305 ==RECESSED== "
347845,2012-02-08,"House Continued Executive Session: 2/21/2012 11:00 Amendment Legislative Office Building 305 "
347845,2012-02-22,"House Committee Report: Ought to Pass with Amendment #0680h for Mar 7 (Vote 17-0; Consent Calendar); House Calendar 18, PG.1074 "
347845,2012-02-22,"House Proposed Committee Amendment #2012-0680h; House Calendar 17, PG.979 "
347845,2012-03-07,"House Amendment #0680h Adopted, Voice Vote; House Journal  21, PG.1318 "
347845,2012-03-07,"House Ought to Pass with Amendment #0680h: Motion Adopted Voice Vote; House Journal  21, PG.1317 "
347845,2012-03-07,"Senate Introduced and Referred to Ways & Means; Senate Journal 7, Pg.185 "
347845,2012-03-27,"Senate Hearing: === CANCELLED === 3/27/12, Room 100, State House, 1:15 p.m. "
347845,2012-04-03,"Senate Hearing: === RESCHEDULED === 4/10/12, Room 100, State House, 1:15 p.m.; Senate Calendar 14 "
347845,2012-04-18,"Senate Committee Report: Ought to Pass with Amendment #2012-1710s, 4/25/12; Senate Calendar 16 "
347845,2012-04-25,"Senate Committee Amendment 1710s; Amendment Adopted, Voice Vote; Senate Journal 11, Pg.400 "
347845,2012-04-25,"Senate Ought to Pass with Amendment 1710s, Motion Adopted, Voice Vote; OT3rdg; Senate Journal 11, Pg.415 "
347845,2012-05-15,"House House Concurs with Senate Amendment #1710s (Rep Renzullo): Motion Adopted Voice Vote; House Journal  43, PG.2280 "
347845,2012-05-17,"House Enrolled; House Journal  46, PG.2493 "
347845,2012-05-23,"Senate Enrolled "
347845,2012-06-11,"House Signed By Governor 06/07/2012; Effective 07/01/2012; Chapter 0141 "
347846,2011-11-16,"House Introduced 1/4/2012 and Referred to Commerce and Consumer Affairs; House Journal  7, PG.347 "
347846,2011-12-16,"House ==CANCELLED== Public Hearing: 1/31/2012 10:45 Amendment Legislative Office Building 302 =Banking Division= "
347846,2012-01-11,"House ==RESCHEDULED== Public Hearing: 1/31/2012 1:30 PM Legislative Office Building 302 =Banking Div= "
347846,2012-01-31,"House ==CANCELLED== Subcommittee Work Session: 2/2/2012 2:00 PM Legislative Office Building 302 "
347846,2012-01-31,"House ==RESCHEDULED== Work Session: 2/9/2012 1:15 PM Legislative Office Building 302 =Banking Div= "
347846,2012-02-09,"House ==CANCELLED== Executive Session: 2/16/2012 1:15 PM Legislative Office Building 302 "
347846,2012-02-16,"House Subcommittee Work Session: 2/21/2012 10:00 Amendment Legislative Office Building 302 ==Executive Session To Follow== "
347846,2012-02-23,"House Committee Report: Ought to Pass with Amendment #0941h(NT) for Mar 7 (Vote 18-0; Consent Calendar); House Calendar 18, PG.1055-1056 "
347846,2012-02-23,"House Proposed Committee Amendment #2012-0941h (New Title); House Calendar 17, PG.979-980 "
347846,2012-03-07,"House Amendment #0941h(NT) Adopted, Voice Vote; House Journal  21, PG.1288 "
347846,2012-03-07,"House Ought to Pass with Amendment #0941h(NT): Motion Adopted Voice Vote; House Journal  21, PG.1288 "
347846,2012-03-07,"Senate Introduced and Referred to Commerce; Senate Journal 7, Pg.185 "
347846,2012-04-05,"Senate Hearing: 4/10/12, Room 102, Legislative Office Building, 9:30 a.m.; Senate Calendar 14 "
347846,2012-04-19,"Senate Committee Report: Ought to Pass, 4/25/12; Vote 5-0; Consent Calendar; Senate Calendar 16 "
347846,2012-04-25,"Senate Sen. Houde Moved to Remove HB 1208 from the Consent Calendar; Senate Journal 11, Pg.385 "
347846,2012-04-25,"Senate Ought to Pass: Regular Calendar 23Y-0N, Motion Adopted; OT3rdg; Senate Journal 11, Pg.415 "
347846,2012-04-25,"House Enrolled; House Journal  38, PG.2211 "
347846,2012-05-02,"Senate Enrolled; Senate Journal 13, Pg.475 "
347846,2012-05-21,"House Signed By Governor 05/14/2012; Effective 05/14/2012; Chapter 0054 "
347848,2011-11-16,"House Introduced 1/4/2012 and Referred to Ways and Means; House Journal  7, PG.347 "
347848,2012-01-03,"House Public Hearing: 1/19/2012 11:00 Amendment Legislative Office Building 202 "
347848,2012-01-03,"House Executive Session: 1/31/2012 2:00 PM Legislative Office Building 202 "
347848,2012-01-31,"House Committee Report: Ought to Pass for Feb 8 (Vote 20-0; Consent Calendar); House Calendar 6, PG.290 "
347848,2012-02-08,"House Ought to Pass: Motion Adopted Voice Vote; House Journal  15, PG.855 "
347848,2012-02-08,"Senate Introduced and Referred to Ways & Means; Senate Journal 5, Pg.122 "
347848,2012-03-06,"Senate Hearing: 3/13/12, Room 100, State House, 2:15 p.m.; Senate Calendar 10 "
347848,2012-05-03,"Senate Committee Report: Ought to Pass with Amendment #2012-1939s, 5/9/12; Vote 6-0; Consent Calendar; Senate Calendar 18 "
347848,2012-05-09,"Senate Sen. Odell Moved to Remove HB 1209 from the Consent Calendar; Senate Journal 13, Pg.476 "
347848,2012-05-09,"Senate Committee Amendment 1939s; Amendment Adopted, Voice Vote; Senate Journal 13, Pg.503 "
347848,2012-05-09,"Senate Sen. Odell Floor Amendment #2012-2099s, Amendment Adopted, Voice Vote; Senate Journal 13, Pg.504"
347848,2012-05-09,"Senate Ought to Pass with Amendment 1939s, 2099s, Motion Adopted, Voice Vote; OT3rdg; Senate Journal 13, Pg.505 "
347848,2012-05-30,"House House Non-Concurs with Senate Amendment #1939s and #2099s (Rep Stepanek): Motion Adopted Voice Vote; House Journal  47, PG.2503 "
347849,2011-11-16,"House Introduced 1/4/2012 and Referred to Science, Technology and Energy; House Journal  7, PG.347  "
347849,2011-12-29,"House ==CANCELLED== Public Hearing: 1/12/2012 8:30 Amendment Legislative Office Building 304 "
347849,2012-01-11,"House ==RESCHEDULED== Public Hearing: 1/20/2012 8:30 Amendment Legislative Office Building 304 "
347849,2012-01-31,"House Executive Session: 2/7/2012 10:00 Amendment Legislative Office Building 304 "
347849,2012-02-09,"House Committee Report: Refer to Interim Study for Feb 15 (Vote 13-1; Consent Calendar); House Calendar 11, PG.691 "
347849,2012-02-15,"House Refer to Interim Study: Motion Adopted Voice Vote; House Journal  16, PG.926 "
347849,2012-06-07,"House Referred to Science, Technology and Energy for Interim Study; House Calendar 45, PG.2434 "
347851,2011-11-16,"House Introduced 1/4/2012 and Referred to Environment and Agriculture; House Journal  7, PG.347 "
347851,2011-12-21,"House Public Hearing: 1/17/2012 10:00 Amendment Legislative Office Building 303 "
347851,2012-01-17,"House Subcommittee Work Session: 1/25/2012 2:30 PM Legislative Office Building 303 "
347851,2012-01-25,"House Executive Session: 2/2/2012 10:00 Amendment Legislative Office Building 303 "
347851,2012-02-03,"House Committee Report: Ought to Pass with Amendment #0524h for Feb 15 (Vote 14-0; Consent Calendar); House Calendar 11, PG.684 "
347851,2012-02-03,"House Proposed Committee Amendment #2012-0524h; House Calendar 11, PG.723 "
347851,2012-02-15,"House Amendment #0524h Adopted, Voice Vote; House Journal  16, PG.916 "
347851,2012-02-15,"House Ought to Pass with Amendment #0524h: Motion Adopted Voice Vote "
347851,2012-02-15,"Senate Introduced and Referred to Energy and Natural Resources; Senate Journal 6, Pg.145 "
347851,2012-03-13,"Senate Hearing: 3/22/12, Room 102, Legislative Office Building, 9:30 a.m.; Senate Calendar 11 "
347851,2012-04-03,"Senate Committee Report: Ought to Pass with Amendment #2012-1432s, 4/11/12; Vote 5-0; Consent Calendar; Senate Calendar 14 "
347851,2012-04-11,"Senate Committee Amendment 1432s; Amendment Adopted, Voice Vote; Senate Journal 9, Pg.337 "
347851,2012-04-11,"Senate Ought to Pass with Amendment 1432s, Motion Adopted, Voice Vote; OT3rdg; Senate Journal 9, Pg.349 "
347851,2012-05-09,"House House Non-Concurs with Senate Amendment #1432s and Requests C of C (Rep Haefner): Motion Adopted Voice Vote; House Journal  40, PG.2230 "
347851,2012-05-09,"House Speaker Appoints: Rep Haefner, Babson, Gandia, and Sad; House Journal  40, PG.2230 "
347851,2012-05-16,"Senate Sen. Odell Accede to House Request for Committee of Conference, Motion Adopted,Voice Vote "
347851,2012-05-16,"Senate President Appoints: Senators Odell, Gallus, and Merrill "
347851,2012-05-22,"House Conference Committee Meeting: 5/24/2012 2:00 PM Legislative Office Building 303 "
347851,2012-05-30,"Senate Conference Committee Report #2012-2360c; Senate Amendment + New Amendment, Filed "
347851,2012-06-06,"Senate Conference Committee Report 2360c; Adopted, Voice Vote "
347851,2012-06-06,"House Conference Committee Report #2360c Adopted, Voice Vote; House Journal  51, PG.2596 "
347851,2012-06-06,"Senate Enrolled "
347851,2012-06-06,"House Enrolled; House Journal  51, PG.2613 "
347851,2012-06-22,"House Signed By Governor 06/18/2012; Chapter 0250 "
347851,2012-06-22,"House I. Section 2 Effective 11/02/2012 "
347851,2012-06-22,"House II. Remainder Effective 06/18/2012 "
347852,2011-11-16,"House Introduced 1/4/2012 and Referred to Criminal Justice and Public Safety; House Journal  7, PG.347 "
347852,2012-01-03,"House Public Hearing: 1/26/2012 2:00 PM Legislative Office Building 204 "
347852,2012-02-15,"House Executive Session: 2/21/2012 10:00 Amendment Legislative Office Building 204 "
347852,2012-02-22,"House Committee Report: Inexpedient to Legislate for Mar 7 (Vote 12-5; Regular Calendar); House Calendar 18, PG.1087 "
347852,2012-03-07,"House Inexpedient to Legislate: Motion Adopted Division Vote 196-104; House Journal  21, PG.1346 "
347854,2011-11-16,"House Introduced 1/4/2012 and Referred to Legislative Administration; House Journal  7, PG.347  "
347854,2012-01-05,"House Public Hearing: 1/17/2012 1:45 PM Legislative Office Building 104 "
347854,2012-01-25,"House Executive Session: 2/7/2012 10:15 Amendment Legislative Office Building 203 "
347854,2012-02-07,"House Committee Report: Inexpedient to Legislate for Feb 15 (Vote 13-0; Consent Calendar); House Calendar 11, PG.688 "
347854,2012-02-15,"House Inexpedient to Legislate: Motion Adopted Voice Vote; House Journal  16, PG.922 "
347855,2011-11-16,"House Introduced 1/4/2012 and Referred to Science, Technology and Energy; House Journal  7, PG.347 "
347855,2012-01-05,"House Public Hearing: 1/19/2012 8:30 Amendment Legislative Office Building 304 "
347855,2012-01-31,"House Executive Session: 2/7/2012 10:00 Amendment Legislative Office Building 304 =RECESSED= "
347855,2012-02-09,"House Continued Executive Session: 2/15/2012 3:00 PM Legislative Office Building 304 "
347855,2012-02-22,"House Majority Committee Report: Ought to Pass for Mar 7 (Vote 7-6; Regular Calendar); House Calendar 18, PG.1108 "
347855,2012-02-22,"House Minority Committee Report: Inexpedient to Legislate; House Calendar 18, PG.1108 "
347855,2012-03-07,"House Special Order to Next Order of Business: Without Objection; House Journal  21, PG.1264 "
347855,2012-03-07,"House Ought to Pass: Motion Adopted Voice Vote; House Journal  21, PG.1264 "
347855,2012-03-07,"Senate Introduced and Referred to Energy and Natural Resources; Senate Journal 7, Pg.185 "
347855,2012-04-11,"Senate Without Objection HB 1214 is vacated from Energy and Natural Resources; Senate Journal 9, Pg.349 "
347855,2012-04-18,"Senate Inadvertently introduced into the Senate, without objection returned to House per Senate Rule 3-3; Senate Journal 10, Pg.378 "
347857,2011-11-17,"House Introduced 1/4/2012 and Referred to Municipal and County Government; House Journal  7, PG.347 "
347857,2012-01-05,"House ===CANCELLED=== Public Hearing: 1/12/2012 12:05 PM Legislative Office Building 301 "
347857,2012-01-17,"House Public Hearing: 2/7/2012 1:30 PM Legislative Office Building 301 ==TIME CHANGE (Orig 1:15 PM)== "
347857,2012-02-08,"House Executive Session: 2/13/2012 11:00 Amendment Legislative Office Building 301 "
347857,2012-02-15,"House Committee Report: Inexpedient to Legislate for Feb 22 (Vote 15-0; Consent Calendar); House Calendar 14, PG.806 "
347857,2012-02-22,"House Inexpedient to Legislate: Motion Adopted Voice Vote; House Journal  20, PG.1212 "
347858,2011-11-16,"House Introduced 1/4/2012 and Referred to Judiciary; House Journal  7, PG.347 "
347858,2012-01-18,"House Public Hearing: 1/24/2012 2:30 PM Legislative Office Building 208 "
347858,2012-01-18,"House Subcommittee Work Session: 1/26/2012 9:00 Amendment Legislative Office Building 202 "
347858,2012-01-31,"House ==CANCELLED== Executive Session: 2/7/2012 10:00 Amendment Legislative Office Building 208 "
347858,2012-02-08,"House Subcommittee Work Session: 2/14/2012 9:00 Amendment Legislative Office Building 208 "
347858,2012-02-15,"House Executive Session: 2/21/2012 10:30 Amendment Legislative Office Building 208 "
347858,2012-02-22,"House Majority Committee Report: Ought to Pass with Amendment #0952h for Mar 7 (Vote 11-3; Regular Calendar); House Calendar 19, PG.1128 "
347858,2012-02-22,"House Proposed Majority Committee Amendment #2012-0952h; House Calendar 19, PG.1163 "
347858,2012-02-22,"House Minority Committee Report: Inexpedient to Legislate; House Calendar 19, PG.1128 "
347858,2012-03-14,"House Amendment #0952h Adopted, Voice Vote; House Journal  24, PG.1456 "
347858,2012-03-14,"House Ought to Pass with Amendment #0952h: Motion Adopted Division Vote 206-118; House Journal  24, PG.1456 "
347858,2012-03-15,"House Reconsider Third Reading Motion of March 14 (Reps Jasper and Norelli): Motion Adopted Voice Vote "
347858,2012-03-15,"House Third Reading: Motion Adopted Voice Vote "
347858,2012-03-28,"Senate Introduced and Referred to Judiciary; Senate Journal 9, Pg.332 "
347858,2012-04-20,"Senate Hearing: 4/30/12, Room 101, Legislative Office Building, 1:30 p.m.; Senate Calendar 16A "
347858,2012-05-11,"Senate Committee Report: Ought to Pass with Amendment #2012-2229s, 5/16/12; Senate Calendar 19A "
347858,2012-05-16,"Senate Committee Amendment 2229s; Amendment Adopted, Voice Vote "
347858,2012-05-16,"Senate Ought to Pass with Amendment 2229s, Motion Adopted, Voice Vote; OT3rdg "
347858,2012-05-17,"House House Non-Concurs with Senate Amendment #2229s and Requests C of C (Rep E.Hogan): Motion Adopted Voice Vote; House Journal  46, PG.2489 "
347858,2012-05-17,"House Speaker Appoints: Reps K.Souza, Hagan, Itse, and Rowe; House Journal  46, PG.2489 "
347858,2012-05-23,"Senate Sen. Houde Accedes to House Request for Committee of Conference ; Motion Adopted, Voice Vote "
347858,2012-05-23,"Senate President Appoints: Senators Houde, Carson, and Luther "
347858,2012-05-29,"House ==CANCELLED== Conference Committee Meeting: 5/31/2012 11:00 Amendment Legislative Office Building 208 "
347858,2012-05-29,"House Conference Committee Meeting: 5/30/2012 3:30 PM Legislative Office Building 208 "
347858,2012-05-31,"Senate Conference Committee Report #2012-2453c; Senate Amendment + New Amendment, Filed "
347858,2012-06-06,"Senate Conference Committee Report 2453c; Adopted, Voice Vote "
347858,2012-06-06,"House Conference Committee Report #2453c Adopted, Voice Vote; House Journal  51, PG.2596 "
347858,2012-06-06,"Senate Enrolled "
347858,2012-06-06,"House Enrolled "
347858,2012-06-22,"House Signed By Governor 06/18/2012; Effective 01/01/2013; Chapter 0251 "
347860,2011-11-16,"House Introduced 1/4/2012 and Referred to Judiciary; House Journal  7, PG.347 "
347860,2012-01-18,"House Public Hearing: 1/24/2012 3:00 PM Legislative Office Building 208 "
347860,2012-01-18,"House Subcommittee Work Session: 1/26/2012 9:01 Amendment Legislative Office Building 202 "
347860,2012-01-31,"House ==CANCELLED== Executive Session: 2/7/2012 10:00 Amendment Legislative Office Building 208 "
347860,2012-02-08,"House Subcommittee Work Session: 2/14/2012 9:00 Amendment Legislative Office Building 208 "
347860,2012-02-15,"House Executive Session: 2/21/2012 10:30 Amendment Legislative Office Building 208 "
347860,2012-02-22,"House Majority Committee Report: Ought to Pass for Mar 7 (Vote 13-4; Regular Calendar); House Calendar 19, PG.1128-1129 "
347860,2012-02-22,"House Minority Committee Report: Inexpedient to Legislate; House Calendar 19, PG.1128-1129 "
347860,2012-03-14,"House Ought to Pass: Motion Adopted Division Vote 214-110; House Journal  24, PG.1457 "
347860,2012-03-15,"House Reconsider Third Reading Motion of March 14 (Reps Jasper and Norelli): Motion Adopted Voice Vote "
347860,2012-03-15,"House Third Reading: Motion Adopted Voice Vote "
347860,2012-03-28,"Senate Introduced and Referred to Health and Human Services; Senate Journal 9, Pg.332 "
347860,2012-04-09,"Senate Hearing: 4/19/12, Room 102, Legislative Office Building, 1:45 p.m.; Senate Calendar 15 "
347860,2012-04-27,"Senate Committee Report: Ought to Pass with Amendment #2012-1889s, New Title, 5/2/12; Senate Calendar 17A "
347860,2012-05-02,"Senate Committee Amendment 1889s, New Title, Amendment Adopted, Voice Vote; Senate Journal 12, Pg.460 "
347860,2012-05-02,"Senate Ought to Pass with Amendment 1889s, New Title, Motion Adopted, Voice Vote; OT3rdg; Senate Journal 12, Pg.471 "
347860,2012-05-17,"House House Non-Concurs with Senate Amendment #1889s(NT) and Requests C of C (Rep E.Hogan): Motion Adopted Voice Vote; House Journal  46, PG.2487 "
347860,2012-05-17,"House Speaker Appoints: Reps K.Souza, Itse, Cebrowski, and Giuda; House Journal  46, PG.2487 "
347860,2012-05-23,"Senate Sen. Bradley Accedes to House Request for Committee of Conference ; Motion Adopted, Voice Vote "
347860,2012-05-23,"Senate President Appoints: Senators Bradley, DeBlois, and Kelly "
347860,2012-05-24,"House Conference Committee Meeting: 5/31/2012 10:00 Amendment Legislative Office Building 208 "
347860,2012-05-31,"Senate Conference Committee Report #2012-2463c; Senate Amendment, Filed "
347860,2012-06-06,"Senate Conference Committee Report 2463c; Adopted, Voice Vote "
347860,2012-06-06,"House Conference Committee Report #2463c Adopted, Voice Vote; House Journal  51, PG.2596 "
347860,2012-06-06,"Senate Enrolled "
347860,2012-06-06,"House Enrolled; House Journal  51, PG.2613 "
347860,2012-06-22,"House Signed By Governor 06/18/2012; Effective 06/18/2012; Chapter 0252 "
347861,2011-11-17,"House Introduced 1/4/2012 and Referred to Executive Departments and Administration; House Journal  7, PG.347 "
347861,2012-01-10,"House Public Hearing: 2/2/2012 2:00 PM Legislative Office Building 306 "
347861,2012-02-07,"House Subcommittee Work Session: 2/13/2012 10:30 Amendment Legislative Office Building 306 "
347861,2012-02-07,"House Executive Session: 2/13/2012 1:00 PM Legislative Office Building 306 "
347861,2012-02-13,"House Majority Committee Report: Inexpedient to Legislate for Mar 7 (Vote 10-3; Regular Calendar); House Calendar 18, PG.1093-1094 "
347861,2012-02-13,"House Minority Committee Report: Ought to Pass; House Calendar 18, PG.1093-1094 "
347861,2012-03-08,"House Inexpedient to Legislate: Motion Adopted Voice Vote; House Journal  23, PG.1440 "
347863,2011-11-17,"House Introduced 1/4/2012 and Referred to Environment and Agriculture; House Journal  7, PG.347 "
347863,2012-01-04,"House Vacated from Environment and Agriculture and Referred to Fish and Game and Marine Resources; House Journal  7, PG.367 "
347863,2012-01-10,"House Public Hearing: 1/25/2012 1:00 PM Legislative Office Building 307 "
347863,2012-02-01,"House Executive Session: 2/14/2012 10:15 Amendment Legislative Office Building 307 "
347863,2012-02-16,"House Majority Committee Report: Inexpedient to Legislate for Feb 22 (Vote 12-2; Regular Calendar); House Calendar 14, PG.811 "
347863,2012-02-16,"House Minority Committee Report: Ought to Pass; House Calendar 14, PG.811 "
347863,2012-02-22,"House Inexpedient to Legislate: Motion Adopted Regular Calendar 241-100; House Journal  20, PG.1221 "
347864,2011-11-17,"House Introduced 1/4/2012 and Referred to Criminal Justice and Public Safety; House Journal  7, PG.347 "
347864,2012-01-03,"House Public Hearing: 1/26/2012 1:00 PM Legislative Office Building 204 "
347864,2012-02-15,"House Executive Session: 2/21/2012 10:00 Amendment Legislative Office Building 204 "
347864,2012-02-23,"House Committee Report: Inexpedient to Legislate for Mar 7 (Vote 15-2; Consent Calendar); House Calendar 19, PG.1143 "
347864,2012-03-07,"House Removed from Consent Calendar (Rep D.McGuire); House Journal  21, PG.1284 "
347864,2012-03-15,"House Lay On The Table (Rep D.McGuire): Motion Adopted Division Vote 252-36; House Journal  26, PG.1640 "
347866,2011-11-17,"House Introduced 1/4/2012 and Referred to Ways and Means; House Journal  7, PG.347 "
347866,2012-01-03,"House Public Hearing: 1/19/2012 1:00 PM Legislative Office Building 202 ==Executive Session To Follow== "
347866,2012-01-19,"House Committee Report: Ought to Pass for Feb 1 (Vote 18-0; Consent Calendar); House Calendar 5, PG.249 "
347866,2012-02-01,"House Ought to Pass: Motion Adopted Voice Vote; House Journal  13, PG.747 "
347866,2012-02-08,"Senate Introduced and Referred to Ways & Means; Senate Journal 5, Pg.122 "
347866,2012-03-14,"Senate Hearing: 3/20/12, Room 100, State House, 1:15 p.m.; Senate Calendar 11 "
347866,2012-03-22,"Senate Committee Report: Ought to Pass, 3/28/12; Senate Calendar 12 "
347866,2012-03-28,"Senate Ought to Pass Not Voted On "
347866,2012-03-28,"Senate Sen. Odell Moved Laid On Table, Motion Adopted, Voice Vote; Senate Journal 8, Pg.291 "
347866,2012-04-18,"Senate Sen. Bradley Moved Remove HB 1221 From Table, Motion Adopted, Voice Vote; Senate Journal 10, Pg.378 "
347866,2012-04-18,"Senate Chair Ruled Non-Germane Amendment; Senate Journal 10, Pg.378 "
347866,2012-04-18,"Senate Without Objection Rule 3-7 is Suspended to Allow Non-Germane Amendment 1712s, 2/3 necessary, Motion Adopted "
347866,2012-04-18,"Senate Sen. Bradley Floor Amendment #2012-1712s, Amendment Adopted, Voice Vote; Senate Journal 10, Pg.378 "
347866,2012-04-18,"Senate Ought to Pass with Amendment 1712s, Regular Calendar 24Y-0N, Motion Adopted; Refer to Finance Rule 4-3; Senate Journal 10, Pg.378 "
347866,2012-04-19,"Senate Committee Report: Ought to Pass, 4/25/12; Senate Calendar 16 "
347866,2012-04-25,"Senate Ought to Pass: Motion Adopted, Voice Vote; OT3rdg; Senate Journal 11, Pg.415 "
347866,2012-05-09,"House House Non-Concurs with Senate Amendment #1712s(NT) and Requests C of C (Rep Stepanek): Motion Adopted Voice Vote; House Journal  40, PG.2230 "
347866,2012-05-09,"House Speaker Appoints: Reps Stepanek, Ohm, Azarian, and Hamm; House Journal  40, PG.2230 "
347866,2012-05-16,"Senate Sen. Odell Accede to House Request for Committee of Conference, Motion Adopted,Voice Vote "
347866,2012-05-16,"Senate President Appoints: Senators Odell, Luther, and DAllesandro "
347866,2012-05-22,"House Conference Committee Meeting: 5/25/2012 10:00 Amendment State House 100 ==ROOM CHANGE (Orig Legislative Office Building 202)== "
347866,2012-05-24,"House Conferee Change: Rep Almy Replaces Rep Hamm; House Journal  46, PG.2495 "
347866,2012-05-31,"Senate Conference Committee Report #2012-2373c; As Passed by the House, Filed "
347866,2012-06-06,"Senate Conference Committee Report 2373c; Adopted, Voice Vote "
347866,2012-06-06,"House Conference Committee Report #2373c Adopted, Voice Vote; House Journal  51, PG.2595 "
347866,2012-06-06,"Senate Enrolled "
347866,2012-06-06,"House Enrolled; House Journal  51, PG.2613 "
347866,2012-06-22,"House Signed By Governor 06/18/2012; Effective 07/01/2012; Chapter 0253 "
347867,2011-11-17,"House Introduced 1/4/2012 and Referred to Ways and Means; House Journal  7, PG.347 "
347867,2012-01-03,"House ==CANCELLED== Public Hearing: 1/12/2012 10:00 Amendment Legislative Office Building 202 "
347867,2012-01-12,"House ==RESCHEDULED== Public Hearing: 1/23/2012 10:00 Amendment Legislative Office Building 202 "
347867,2012-01-23,"House Subcommittee Work Session: 1/31/2012 1:30 PM Legislative Office Building 202 "
347867,2012-01-23,"House Executive Session: 1/31/2012 2:00 PM Legislative Office Building 202 "
347867,2012-01-31,"House Committee Report: Inexpedient to Legislate for Feb 8 (Vote 19-1; Consent Calendar); House Calendar 6, PG.290 "
347867,2012-02-08,"House Inexpedient to Legislate: Motion Adopted Voice Vote; House Journal  15, PG.855 "
347869,2011-11-17,"House Introduced 1/4/2012 and Referred to Judiciary; House Journal  7, PG.347 "
347869,2012-01-11,"House ===CANCELLED=== Public Hearing: 1/12/2012 1:30 PM Legislative Office Building 208 "
347869,2012-01-18,"House Public Hearing: 1/24/2012 9:00 Amendment Legislative Office Building 208 "
347869,2012-02-09,"House Executive Session: 2/16/2012 10:30 Amendment Legislative Office Building 208 "
347869,2012-02-21,"House Committee Report: Ought to Pass with Amendment #0866h for Mar 7 (Vote 12-0; Consent Calendar); House Calendar 18, PG.1068 "
347869,2012-02-21,"House Proposed Committee Amendment #2012-0866h; House Calendar 17, PG.980 "
347869,2012-03-07,"House Amendment #0866h Adopted, Voice Vote; House Journal  21, PG.1308-1309 "
347869,2012-03-07,"House Ought to Pass with Amendment #0866h: Motion Adopted Voice Vote; House Journal  21, PG.1308-1309 "
347869,2012-03-07,"Senate Introduced and Referred to Judiciary; Senate Journal 7, Pg.185 "
347869,2012-03-28,"Senate Hearing: 4/12/12, Room 101, Legislative Office Building, 1:30 p.m.; Senate Calendar 13 "
347869,2012-04-05,"Senate Hearing: === TIME CHANGE === 4/12/12, Room 101, Legislative Office Building, 1:15 p.m.; Senate Calendar 14 "
347869,2012-04-26,"Senate Committee Report: Ought to Pass with Amendment #2012-1860s, 5/2/12; Senate Calendar 17 "
347869,2012-05-02,"Senate Committee Amendment 1860s; Amendment Adopted, Voice Vote; Senate Journal 12, Pg.448 "
347869,2012-05-02,"Senate Sen. Houde Floor Amendment #2012-1925s, Amendment Adopted, Voice Vote; Senate Journal 12, Pg.449 "
347869,2012-05-02,"Senate Ought to Pass with Amendment 1860s, 1925s, Motion Adopted, Voice Vote; OT3rdg; Senate Journal 12, Pg.471 "
347869,2012-05-30,"House House Concurs with Senate Amendment #1860s and #1925s (Rep Rowe): Motion Adopted Voice Vote; House Journal  47, PG.2502 "
347869,2012-06-06,"Senate Enrolled "
347869,2012-06-06,"House Enrolled; House Journal  51, PG.2609 "
347869,2012-06-18,"House Signed By Governor 06/13/2012; Effective 01/01/2013; Chapter 0206 "
347870,2011-11-17,"House Introduced 1/4/2012 and Referred to Municipal and County Government; House Journal  7, PG.348 "
347870,2012-01-17,"House ==CANCELLED== Public Hearing: 1/24/2012 2:30 PM Legislative Office Building 301 "
347870,2012-01-25,"House ==RESCHEDULED== Public Hearing: 2/7/2012 11:00 Amendment Legislative Office Building 301 ==TIME CHANGE (Orig 10:30 Amendment)== "
347870,2012-02-08,"House Executive Session: 2/13/2012 11:00 Amendment Legislative Office Building 301 "
347870,2012-02-15,"House Committee Report: Ought to Pass with Amendment #0765h(NT) for Feb 22 (Vote 17-0; Consent Calendar); House Calendar 14, PG.806 "
347870,2012-02-15,"House Proposed Committee Amendment #2012-0765h (New Title); House Calendar 14, PG.833-834 "
347870,2012-02-22,"House Amendment #0765h(NT) Adopted, Voice Vote; House Journal  20, PG.1213 "
347870,2012-02-22,"House Ought to Pass with Amendment #0765h(NT): Motion Adopted Voice Vote; House Journal  20, PG.1213 "
347870,2012-03-07,"Senate Introduced and Referred to Public and Municipal Affairs; Senate Journal 7, Pg.185 "
347870,2012-03-23,"Senate Hearing: 3/27/12, Room 101, Legislative Office Building, 10:30 a.m.; Senate Calendar 12 "
347870,2012-04-04,"Senate Committee Report: Ought to Pass, 4/11/12; Vote 5-0; Consent Calendar; Senate Calendar 14 "
347870,2012-04-11,"Senate Ought to Pass: Motion Adopted, Voice Vote; OT3rdg; Senate Journal 9, Pg.338 "
347870,2012-04-11,"House Enrolled "
347870,2012-04-18,"Senate Enrolled; Senate Journal 11, Pg.384 "
347870,2012-05-03,"House Signed By Governor 05/02/2012; Effective 07/01/2012; Chapter 0029 "
347872,2011-11-17,"House Introduced 1/4/2012 and Referred to Education; House Journal  7, PG.348  "
347872,2011-12-15,"House ==CANCELLED== Public Hearing: 1/12/2012 10:00 Amendment Legislative Office Building 207 "
347872,2012-01-12,"House ==RESCHEDULED== Public Hearing: 1/20/2012 10:00 Amendment Legislative Office Building 207 "
347872,2012-01-12,"House Executive Session: 1/24/2012 10:00 Amendment Legislative Office Building 207 "
347872,2012-01-26,"House Committee Report: Ought to Pass for Feb 1 (Vote 16-0; Consent Calendar); House Calendar 5, PG.243 "
347872,2012-02-01,"House Ought to Pass: Motion Adopted Voice Vote; House Journal  13, PG.740 "
347872,2012-02-01,"House Referred to Special Committee on Education Funding Reform; House Journal  13, PG.740 "
347872,2012-02-07,"House Public Hearing: 2/13/2012 10:30 Amendment Legislative Office Building 207 "
347872,2012-02-21,"House Full Committee Work Session: 3/5/2012 10:00 Amendment Legislative Office Building 210-211 "
347872,2012-03-06,"House Full Committee Work Session: 3/15/2012 12:00 PM Representatives Hall "
347872,2012-03-07,"House Executive Session: 3/15/2012 Legislative Office Building 301 12:00 PM or during House lunch break "
347872,2012-03-15,"House Committee Report: Ought to Pass with Amendment #1105h for Mar 21 (Vote 14-0; Consent Calendar); House Calendar 22, PG.1353"
347872,2012-03-15,"House Proposed Committee Amendment #2012-1105h; House Calendar 22, PG.1380"
347872,2012-03-21,"House Amendment #1105h Adopted, Voice Vote; House Journal  28, PG.1666-1667 "
347872,2012-03-21,"House Ought to Pass with Amendment #1105h: Motion Adopted Voice Vote; House Journal  28, PG.1666-1667 "
347872,2012-03-28,"Senate Introduced and Referred to Education; Senate Journal 9, Pg.332 "
347872,2012-04-11,"Senate Hearing: 4/17/12, Room 103, Legislative Office Building, 1:10 p.m.; Senate Calendar 15 "
347872,2012-05-08,"Senate Committee Report: Ought to Pass, 5/16/12; Senate Calendar 19 "
347872,2012-05-16,"Senate Ought to Pass: Motion Adopted, Voice Vote; OT3rdg; Senate Journal 14, Pg.588 "
347872,2012-05-17,"House Enrolled; House Journal  46, PG.2495 "
347872,2012-05-23,"Senate Enrolled "
347872,2012-06-07,"House Signed By Governor 06/05/2012; Effective 08/04/2012; Chapter 0119 "
347873,2011-11-17,"House Introduced 1/4/2012 and Referred to Ways and Means; House Journal  7, PG.348  "
347873,2012-01-03,"House ==CANCELLED== Public Hearing: 1/12/2012 11:00 Amendment Legislative Office Building 202 "
347873,2012-01-12,"House ==RESCHEDULED== Public Hearing: 1/23/2012 11:00 Amendment Legislative Office Building 202 "
347873,2012-01-12,"House Subcommittee Work Session: 1/30/2012 2:00 PM Legislative Office Building 202 "
347873,2012-01-12,"House Executive Session: 1/31/2012 2:00 PM Legislative Office Building 202 "
347873,2012-01-31,"House Committee Report: Inexpedient to Legislate for Feb 8 (Vote 18-0; Consent Calendar); House Calendar 6, PG.290 "
347873,2012-02-08,"House Inexpedient to Legislate: Motion Adopted Voice Vote; House Journal  15, PG.855 "
347875,2011-11-17,"House Introduced 1/4/2012 and Referred to Legislative Administration; House Journal  7, PG.348  "
347875,2012-01-05,"House Public Hearing: 1/17/2012 2:45 PM Legislative Office Building 104 "
347875,2012-01-20,"House Subcommittee Work Session: 1/27/2012 11:00 Amendment Legislative Office Building 104 "
347875,2012-01-27,"House Subcommittee Work Session: 1/31/2012 10:15 Amendment Legislative Office Building 308 "
347875,2012-01-28,"House Executive Session: 2/7/2012 10:15 Amendment Legislative Office Building 203 "
347875,2012-02-07,"House Majority Committee Report: Ought to Pass with Amendment #0435h for Feb 15 (Vote 10-2; Regular Calendar); House Calendar 11, PG.699-700 "
347875,2012-02-07,"House Proposed Majority Committee Amendment #2012-0435h; House Calendar 11, PG.723 "
347875,2012-02-07,"House Minority Committee Report: Inexpedient to Legislate; House Calendar 11, PG.699-700 "
347875,2012-02-15,"House Amendment #0435h Adopted, Voice Vote; House Journal  16, PG.945 "
347875,2012-02-15,"House Floor Amendment #2012-0795h (Rep Ball) Adopted, Voice Vote; House Journal  16, PG.945 "
347875,2012-02-15,"House Ought to Pass with Amendment #0435h and #0795h: Motion Adopted Division Vote 229-85; House Journal  16, PG.945 "
347875,2012-02-15,"House Referred to Constitutional Review and Statutory Recodification; House Journal  16, PG.945 "
347875,2012-03-07,"House Public Hearing: 3/20/2012 10:00 Amendment Legislative Office Building 206 ==Executive Session To Follow== "
347875,2012-03-21,"House Committee Report: Refer to Interim Study for Mar 28 (Vote 11-5; Regular Calendar); House Calendar 25, PG.1506 "
347875,2012-03-28,"House Refer to Interim Study: Motion Adopted Voice Vote; House Journal  30, PG.1755 "
347875,2012-06-07,"House Referred to Constitutional Review and Statutory Recodification for Interim Study; House Calendar 45, PG.2432 "
347876,2011-11-17,"House Introduced 1/4/2012 and Referred to Commerce and Consumer Affairs; House Journal  7, PG.348 "
347876,2011-12-15,"House Public Hearing: 1/26/2012 1:15 PM Legislative Office Building 302 =Insurance Div= "
347876,2012-01-24,"House Subcommittee Work Session: 2/2/2012 2:00 PM Legislative Office Building 302 =Insurance Div= "
347876,2012-02-09,"House Executive Session: 2/16/2012 1:15 PM Legislative Office Building 302 "
347876,2012-02-21,"House Committee Report: Inexpedient to Legislate for Mar 7 (Vote 15-0; Consent Calendar); House Calendar 18, PG.1056 "
347876,2012-03-07,"House Inexpedient to Legislate: Motion Adopted Voice Vote; House Journal  21, PG.1288 "
347878,2011-11-17,"House Introduced 1/4/2012 and Referred to State-Federal Relations and Veterans Affairs; House Journal  7, PG.348 "
347878,2012-01-11,"House ===CANCELLED=== Public Hearing: 1/12/2012 9:30 Amendment Legislative Office Building 203 "
347878,2012-01-12,"House ==RESCHEDULED== Public Hearing: 1/27/2012 9:30 Amendment Legislative Office Building 203 ==Executive Session To Follow== "
347878,2012-01-27,"House Committee Report: Ought to Pass for Feb 8 (Vote 10-0; Regular Calendar); House Calendar 6, PG.295 "
347878,2012-02-08,"House Ought to Pass: Motion Adopted Regular Calendar 327-8; House Journal  15, PG.894-897 "
347878,2012-02-08,"House Print Remarks in Permanent Journal (Rep Sapareto): Motion Adopted Voice Vote "
347878,2012-02-15,"Senate Introduced and Referred to Public and Municipal Affairs; Senate Journal 6, Pg.145 "
347878,2012-03-05,"Senate Hearing: 3/20/12, Room 101, Legislative Office Building, 9:00 a.m.; Senate Calendar 10 "
347878,2012-03-22,"Senate Committee Report: Inexpedient to Legislate, 3/28/12; Senate Calendar 12 "
347878,2012-03-28,"Senate Inexpedient to Legislate, Motion Adopted, Voice Vote === BILL KILLED ===; Senate Journal 8, Pg.290 "
347879,2011-11-17,"House Introduced 1/4/2012 and Referred to Executive Departments and Administration; House Journal  7, PG.348 "
347879,2012-01-04,"House Vacated from Executive Departments and Administration and Referred to Public Works and Highways; House Journal  7, PG.367 "
347879,2012-01-11,"House Public Hearing: 2/7/2012 10:45 Amendment Legislative Office Building 201 ==Executive Session To Follow== "
347879,2012-02-17,"House Committee Report: Ought to Pass with Amendment #0726h for Mar 7 (Vote 14-0; Consent Calendar); House Calendar 18, PG.1073 "
347879,2012-02-17,"House Proposed Committee Amendment #2012-0726h; House Calendar 17, PG.980-981 "
347879,2012-03-07,"House Amendment #0726h Adopted, Voice Vote; House Journal  21, PG.1317 "
347879,2012-03-07,"House Ought to Pass with Amendment #0726h: Motion Adopted Voice Vote; House Journal  21, PG.1317 "
347879,2012-03-28,"Senate Introduced and Referred to Finance; Senate Journal 9, Pg.332 "
347879,2012-04-11,"Senate Hearing: 4/19/12, Room 103, State House, 1:00 p.m.; Senate Calendar 15 "
347879,2012-04-20,"Senate Committee Report: Ought to Pass with Amendment #2012-1765s, New Title, 4/25/12; Senate Calendar 16A "
347879,2012-04-25,"Senate Chair Ruled Non-Germane Amendment; Senate Journal 11, Pg.408 "
347879,2012-04-25,"Senate Without Objection Rule 3-7 is Suspended to Allow Non-Germane Amendment 1765s, 2/3 necessary, Motion Adopted; Senate Journal 11, Pg.408 "
347879,2012-04-25,"Senate Committee Amendment 1765s, New Title, Amendment Adopted, Voice Vote; Senate Journal 11, Pg.408 "
347879,2012-04-25,"Senate Ought to Pass with Amendment 1765s, New Title, Motion Adopted, Voice Vote; OT3rdg; Senate Journal 11, Pg.415 "
347879,2012-05-09,"House House Non-Concurs with Senate Amendment #1765s(NT) and Requests C of C (Rep Chandler): Motion Adopted Voice Vote; House Journal  40, PG.2230 "
347879,2012-05-09,"House Speaker Appoints: Reps Graham, E.Smith, McConkey, and Bouchard; House Journal  40, PG.2230 "
347879,2012-05-16,"Senate Sen. Morse Accede to House Request for Committee of Conference, Motion Adopted,Voice Vote "
347879,2012-05-16,"Senate President Appoints: Senators Morse, Forrester, and DAllensandro "
347879,2012-05-18,"House Committee of Conference Meeting: 5/24/2012 12:00 PM Legislative Office Building 201 "
347879,2012-05-31,"Senate Conference Committee Report #2012-2357c; Senate Amendment, Filed "
347879,2012-06-06,"Senate Conference Committee Report 2357c; Adopted, Voice Vote "
347879,2012-06-06,"House Conference Committee Report #2357c Adopted, Voice Vote; House Journal  51, PG.2596 "
347879,2012-06-06,"Senate Enrolled Bill Amendment #2501e Adopted "
347879,2012-06-06,"House Enrolled Bill Amendment #2012-2501e Adopted; House Journal  51, PG.2612 "
347879,2012-06-06,"Senate Enrolled "
347879,2012-06-06,"House Enrolled "
347879,2012-06-22,"House Signed By Governor 06/18/2012; Effective 06/18/2012; Chapter 0254 "
347881,2011-11-17,"House Introduced 1/4/2012 and Referred to Commerce and Consumer Affairs; House Journal  7, PG.348 "
347881,2011-12-15,"House Public Hearing: 1/26/2012 2:00 PM Legislative Office Building 302 =Insurance Div= "
347881,2012-01-24,"House Subcommittee Work Session: 2/2/2012 2:05 PM Legislative Office Building 302 =Insurance Div= "
347881,2012-02-09,"House Executive Session: 2/16/2012 1:15 PM Legislative Office Building 302 "
347881,2012-02-17,"House Committee Report: Ought to Pass with Amendment #0446h(NT) for Mar 7 (Vote 16-0; Consent Calendar); House Calendar 18, PG.1056 "
347881,2012-02-17,"House Proposed Committee Amendment #2012-0446h (New Title); House Calendar 17, PG.981 "
347881,2012-03-07,"House Amendment #0446h(NT) Adopted, Voice Vote; House Journal  21, PG.1289 "
347881,2012-03-07,"House Ought to Pass with Amendment #0446h(NT): Motion Adopted Voice Vote; House Journal  21, PG.1289 "
347881,2012-03-07,"Senate Introduced and Referred to Energy and Natural Resources; Senate Journal 7, Pg.185 "
347881,2012-03-29,"Senate Hearing: 4/5/12, Room 102, Legislative Office Building, 9:00 a.m.; Senate Calendar 13 "
347881,2012-04-05,"Senate Committee Report: Ought to Pass, 4/11/12; Senate Calendar 14 "
347881,2012-04-11,"Senate Ought to Pass: Motion Adopted, Voice Vote; OT3rdg; Senate Journal 9, Pg.349 "
347881,2012-04-25,"Senate Enrolled Bill Amendment #1685e Adopted; Senate Journal 12, Pg.420 "
347881,2012-04-25,"House Enrolled Bill Amendment #2012-1685e Adopted; House Journal  38, PG.2209 "
347881,2012-04-25,"House Enrolled; House Journal  38, PG.2211 "
347881,2012-05-02,"Senate Enrolled; Senate Journal 13, Pg.475 "
347881,2012-05-25,"House Signed By Governor 05/23/2012; Effective 07/22/2012; Chapter 0082 "
347882,2011-11-17,"House Introduced 1/4/2012 and Referred to Election Law; House Journal  7, PG.348 "
347882,2012-02-08,"House Public Hearing: 2/14/2012 10:15 Amendment Legislative Office Building 308 "
347882,2012-02-15,"House Executive Session: 2/16/2012 9:30 Amendment Legislative Office Building 303 "
347882,2012-02-16,"House Committee Report: Ought to Pass for Mar 7 (Vote 9-1; Consent Calendar); House Calendar 18, PG.1064 "
347882,2012-03-07,"House Ought to Pass: Motion Adopted Voice Vote; House Journal  21, PG.1301 "
347882,2012-03-07,"Senate Introduced and Referred to Public and Municipal Affairs; Senate Journal 7, Pg.185 "
347882,2012-04-11,"Senate Without Objection, HB 1232 is vacated from Public and Municipal Affairs; Senate Journal 9, Pg.349 "
347882,2012-04-18,"Senate Inadvertently introduced into the Senate, without objection returned to House per Senate Rule 3-3; Senate Journal 10, Pg.378 "
347884,2011-11-17,"House Introduced 1/4/2012 and Referred to Resources, Recreation and Development; House Journal  7, PG.348 "
347884,2011-12-22,"House Public Hearing: 1/17/2012 10:45 Amendment Legislative Office Building 305 "
347884,2012-01-18,"House Subcommittee Work Session: 1/26/2012 10:30 Amendment Legislative Office Building 305 "
347884,2012-01-18,"House ==CANCELLED== Executive Session: 1/31/2012 1:00 PM Legislative Office Building 305 "
347884,2012-02-01,"House Subcommittee Work Session: 2/2/2012 10:30 Amendment Legislative Office Building 305 "
347884,2012-02-08,"House Executive Session: 2/21/2012 11:00 Amendment Legislative Office Building 305 "
347884,2012-02-22,"House Committee Report: Ought to Pass with Amendment #0562h for Mar 7 (Vote 17-0; Consent Calendar); House Calendar 18, PG.1074 "
347884,2012-02-22,"House Proposed Committee Amendment #2012-0562h; House Calendar 17, PG.981 "
347884,2012-03-07,"House Amendment #0562h Adopted, Voice Vote; House Journal  21, PG.1318 "
347884,2012-03-07,"House Ought to Pass with Amendment #0562h: Motion Adopted Voice Vote; House Journal  21, PG.1318 "
