bill_number,bill_id,title
HB1522,272602,"Income tax and franchise tax; authorize credit for investments in digital interactive applications."
HB1523,272422,"City of Ridgeland; authorize the city to levy an additional sales tax for certain purposes."
HB1524,272573,"Lee County; authorize contribution to the Sanctuary Hospice House."
HB1525,273116,"City of Sardis; extend repealer on authority to impose tax on hotels, motels and restaurants."
HB1526,275770,"Sales tax; exempt certain sales of personal property to certain organizations coordinating professional golf tournaments in this state."
HB1527,274516,"Bonds; authorize issuance to provide funds for construction of the Wellspring Center for Professional Futures."
HB1528,275540,"Mississippi Small Business Investment Company Act; create."
HB1529,275327,"Bonds; authorize issuance to provide funds to assist City of Jackson with purchase of fire fighting equipment."
HB1530,277424,"City of Hattiesburg; extend repealer on Hattiesburg Tourism Commission and hotel/motel tax."
HB1531,278065,"Bonds; authorize issuance to pay costs of state parks' construction &amp; renovation &amp; transfer certain responsibilities."
HB1532,278260,"Bonds; authorize issuance to provide funds for construction of Mississippi Civil Rights Museum and Museum of Mississippi History."
HB1533,278804,"Bonds; authorize issuance to provide funds to assist Rail Authority of East MS with construction of East MS Intermodal Railroad."
HB1534,277736,"Homestead exemption; increase and prorate for homeowner reaching age 65 after January 1 of year for which exemption is claimed."
HB1535,278196,"Income tax; revise treatment of certain Gulf oil spill related compensation as gross income."
HB1536,277647,"Bonds; authorize issuance for Local System Bridge Program and County Bridge and Road Safety Fund."
HB1537,277267,"Bonds; authorize issuance to provide funds for repair of bridges in Alcorn and Tishomingo Counties."
HB1538,277571,"Bonds; authorize issuance to provide funds for repair of Oakland School Road Bridge in Alcorn County."
HB1539,278791,"Ad valorem tax; revise definition of ""home"" or ""homestead"" under the homestead exemption law."
HB1540,278794,"Madison County; authorize erection of certain electronic gates for the purpose of enclosing neighborhoods."
HB1541,285370,"Bonds; authorize issuance for road and bridge improvements in small municipalities."
HB1542,285245,"Bonds; authorize issuance to provide funds for upgrades to Department of Revenue's information technology systems."
HB1543,285310,"Bonds; authorize issuance of for various railroad related projects."
HB1544,285724,"Bonds; authorize issuance for improvements to Mississippi Museum of Natural Science and certain projects in the City of Corinth."
HB1545,285611,"DeSoto County; authorize contribution to the Memphis Child Advocacy Center."
HB1546,285486,"Bonds; authorize for various projects and economic development programs."
HB1547,286339,"Economically Distressed Municipalities Development Act; create."
HB1548,288133,"Income tax; revise provisions regarding certain business deductions."
HB1549,319765,"Jackson County and the City of Pascagoula; may jointly create the LaPointe-Krebs Foundation, Inc."
HB1550,320632,"Suffrage; restore to Gene King of Clay County."
HB1551,320189,"Suffrage; restore to Dale Eugene Ott of Monroe County."
HB1552,314483,"City of Columbus and Lowndes County; establish Columbus-Lowndes Convention and Visitors Bureau."
HB1553,310181,"City of Indianola; extend repealer on Indianola Tourism Commission."
HB1554,316544,"Suffrage; restore to James Ronnie Daines of Tippah county."
HB1555,320773,"Suffrage; restore to Clay Buford Ferguson of Attala County."
HB1556,311892,"City of Waynesboro and Wayne County; extend repealer on recreational facilities tax."
HB1557,320198,"City of Richland; authorize the city to acquire and convey real property in the Richland Industrial and Commercial Park."
HB1558,311174,"Harrison County; authorize contribution to the Feed My Sheep program."
HB1559,316213,"Hancock County; authorize board of supervisors to enter into certain contracts to promote tourism."
HB1560,308160,"Town of Oakland; authorize contribution to Charles Johnson Scholarship Fund."
HB1561,321406,"Suffrage; restore to Dorothy Jones of Amite County."
HB1562,319863,"Tallahatchie County; authorize contribution to Mid-State Opportunity, Inc."
HB1563,321163,"City of Oxford; authorize to establish the City of Oxford Municipal Reserve and Trust Fund."
HB1564,315920,"Perry County; authorize contribution to Community Development, Inc."
HB1565,314705,"City of Moss Point; authorize to expand water, sewer and gas services more than five miles outside of corporate limits."
HB1566,320005,"City of Ellisville; revise the amount of tax that may be levied on hotels, motels and restaurants."
HB1567,310496,"City of McComb; authorize to impose a tourism tax to promote tourism, parks and recreation."
HB1568,314591,"Washington County; authorize to impose a hotel/motel tax for purposes of funding a sports complex for youth."
HB1569,312038,"City of Greenwood; extend repealer on Greenwood Tourism Commission."
HB1570,320051,"Jackson County; authorize pilot program for sheriff to use radar."
HB1571,310364,"Jackson County; authorize sheriff to use radar on county roads."
HB1572,314318,"Washington County; extend repealer on Washington County Convention and Visitors Committee and revise terms of committee members."
HB1573,320547,"Marshall County; authorize to establish the Cayce Community Sewer District."
HB1574,320973,"Suffrage; restore to Jerry Eugene Arnold of Tippah County."
HB1575,313227,"Suffrage; restore to Malcolm Myers of Pike County."
HB1576,309466,"Lafayette County; authorize contributions to Interfaith Compassion Ministries Homeless Shelter programs and facilities."
HB1577,312133,"City of Jackson; authorize councilmen to maintain individual offices within City Hall."
HB1578,315520,"Prentiss, Alcorn, Benton, Marshall, Tippah, Tishomingo Counties; extend repealer on authority to contribute to NE MS Comm. Services."
HB1579,309261,"Marshall County; authorize to contribute to Northeast Mississippi Community Services, Incorporated."
HB1580,316897,"Benton County; authorize to contribute to Northeast Mississippi Community Services, Inc."
HB1581,314213,"Benton County; authorize contribution to the United Community Action Agency, Inc."
HB1582,311340,"Hinds County; authorize to pay PERS employer contributions on net fee income of constables."
HB1583,315669,"Town of Isola; authorize to contract for the purchase of water from the Humphreys County Water Association."
HB1584,316872,"Mayor-council form of government; authorize council members of certain to have offices in City Hall."
HB1585,319583,"Rankin County; authorize erection of certain electronic gates for the purpose of enclosing neighborhoods."
HB1586,310160,"Lauderdale County; revise membership of Emergency Communications Commission."
HB1587,311824,"City of Columbus; authorize to allow the Columbus Light and Water Department to offer certain assistance to certain consumers."
HB1588,315916,"Lauderdale County; authorize to fund chaplaincy program of the detention facility from revenue of inmate phone service."
HR1,213846,"House Rules; member may serve as Speaker for only two terms."
HR2,213847,"House Rules; amend to allow member to request that conference report be read in full before vote on adoption."
HR3,213848,"Mrs. Ella Sellers Street; commend life, service and legacy upon her passing."
HR4,213849,"Long Beach High School Bearcats Girls Volleyball Team; commend and congratulate upon winning MHSAA Class II State Championship."
HR5,213850,"Claiborne C. Davis, Sr.; commend life and legacy upon his passing."
HR6,213851,"House Rules; before conference report is considered, require that House be informed of any new provisions."
HR7,224746,"Reverend James Patterson; commend spiritual leadership and excellence of and for leading the House of Representatives in prayer."
HR8,224747,"HR; Mrs. Birdie Clara Spencer; commend life, legacy and service upon her passing."
HR9,227928,"Crime and corrections; create House study committee to study and make recommendations."
HR10,229239,"Mr. Jimmy Carter Fairley; commend life, legacy and service of upon his passing."
HR11,233052,"Mississippi businesses; urge to implement ergonomic practices to protect the health of the state's workforce."
HR12,233053,"Coach Eric Neel; commend upon being named Clarion-Ledger's 2010 Mississippi Softball Coach of the Year."
HR13,233054,"Dr. William Edwin Moak; commend upon retirement after 60 years of medical practice in Richton, Mississippi."
HR14,236391,"Frances Fredericks; commend and congratulate upon being honored at ""Black and White Affair"" hosted by Harrison County Democratic Party."
HR15,236392,"Cervical Cancer Awareness Month; acknowledge the month of January 2011 as in Mississippi."
HR16,236848,"Ethel Jefferson; commend upon the occasion of her 90th birthday."
HR17,245348,"Hamilton High School Cheerleaders; commend on winning 2010 MHSAA Class 2A Overall State Championship."
HR18,247413,"Frances Washington; commend on receiving 2010 AARP Andrus Award for Community Service."
HR19,247065,"Betty Harris; commend upon retirement from MS Department of Rehabilitation Services-Office of Vocational Rehabilitation."
HR20,247147,"Susan Alsbury; commend upon retirement from Town of Wesson's Library after 15 years of service."
HR21,253008,"William ""Larry"" Lucas; commend career accomplishments on being honored by the Mississippi Legislative Black Caucus."
HR22,252701,"Legendary Bluesman Robert Johnson; acknowledge and designate 2011 as the 100th anniversary of birth."
HR23,259838,"Mississippi dentist and dental laboratories; commend volunteerism and support of Donated Dental Services."
HR24,263638,"Lisa Michele Hamel; commend work with the Carnival Association of Long Beach and spirit of volunteerism."
HR25,266670,"Mrs. A.M.E. Logan; commending the life and expressing sympathy upon the passing of the ""Mother of the Jackson Civil Rights Movement""."
HR26,267024,"Albert Jackson, III; commend and congratulate on achieving Eagle Scout project."
HR27,266441,"Javoral Quantez Harris; commend and congratulate upon receiving the Eagle Scout Award."
HR28,273233,"Walter J. Payton Recreation and Wellness Center; congratulate on occasion of its fifth year anniversary."
HR29,273255,"Mary Catherine Langley; commend upon spirit of volunteerism and upon success of teddy bears for children project."
HR30,274168,"Coach Leslie Frazier; commend and congratulate upon being named Head Coach of the Minnesota Vikings Football Team."
HR31,277378,"Coach Brad Duncan of West Marion High School; commend for winning 2010 Coach of the Year Award."
HR32,278011,"Mrs. Leola G. Blackmon; honor the life and legacy of and express sympathy upon her passing."
HR33,285274,"""Links Day at the Capitol""; recognize February 22, 2011 as."
HR34,285232,"Lewis Tillman; commend for athletic accomplishments and for being a member of NFL team that has won the Super Bowl."
HR35,285359,"Lawrence Dwight Pillers; commend athletic accomplishments of and for being a two-time Super Bowl champion."
HR36,287985,"Eugene Coleman Roberts, Jr.; commend life of upon his passing."
HR37,287611,"Jamie Scott and Gladys Scott; commend upon being named co-recipients of the Fannie Lou Hamer Human Rights Award."
HR38,287717,"Mrs. Dollie R. Creath; commend upon named a recipient of the Fannie Lou Human Rights Award."
HR39,290559,"Roy Lee Hilton; commend on athletic accomplishments and upon being a Super Bowl champion."
HR40,290242,"Miss Whitney Miller; commend and congratulate for winning title of ""MasterChef""."
HR41,290973,"""Delta Day at the Capitol""; recognize March 1, 2011, as and congratulate the Jackson Alumnae Chapter upon its 70th anniversary."
HR42,291083,"Grand National Assembly of Turkey; welcome and recognize legislators visiting on March 2, 2011."
HR43,316443,"Mrs. Melvina Swaggard King Strong; commend life and legacy upon her passing."
HR44,312963,"Jeramey Anderson; commend upon being named the ""2010 Youth of the Year"" of the boys and Girls Clubs of Jackson County."
HR45,309352,"Republic of Turkey; recognize contributions of republic and of Turquoise Council of Americans and Eurasians."
HR46,310158,"NFL Player Donald Driver; commend for humanitarian efforts and winning 2011 Super Bowl."
HR47,311291,"Karen R. Anderson; commend life and accomplishments upon her passing."
HR48,320739,"Dr. Willis H. Lott; commend distinguished service as president of MGCCC upon the occasion of his retirement."
HR49,313310,"MS Army National Guard 287th EN (MAC) of Lucedale, MS; commend upon return home from tour in Afghanistan."
HR50,320420,"Frank Buckles; commend life and express sympathy on passing of last known American veteran of WWI."
HR51,311744,"Bethani Grace Alman; congratulate on being named Miniature Miss Mississippi."
HR52,321232,"Julie Grimes Waldorf &amp; Michael Waldorf; commend/express appreciation for contribution to building Playgarden Park in Fulton."
HR53,314943,"Rev. L.D. Bass, Jr.; commend life, legacy and service upon his passing."
HR54,313987,"Mrs. Deloris Harris Wilson; commend upon retirement from 33 years with Mississippi school districts."
HR55,320870,"Jermaine Whitehead; commend academic and athletic success and congratulate upon signing with Auburn University."
HR56,315711,"Lamar county School District; commend for meeting the Healthier US School Challenge."
HR57,311204,"Brookhaven Academy Lady Cougars Basketball Team; commend and congratulate on winning the MAIS overall Championship."
HR58,313599,"Lindsey Horton; commend and congratulate on the 40th anniversary of the JSU Taekwondo Karate Club."
HR59,308623,"Mr. Henry Wiltcher; commend life, legacy and service upon his passing."
HR60,309471,"Mary Alice Busby; commend 24 years of service as Circuit Clerk of Lafayette County &amp; congratulate upon retirement on Dec. 31, 2011."
HR61,313863,"Dominique Dionne McNair Cruz; commend life and legacy upon her passing."
HR62,310981,"Kiara Ruffin; commend and congratulate on being named 2010-2011 SWAC Women's Basketball Player of the Year."
HR63,308533,"Tonya Edwards; commend for being named 2010-2011 SWAC Women's Basketball Coach of the Year."
HR64,312726,"Durant High School Tigers Boys Basketball Team; commend and congratulate on winning Class 1A State Championship."
HR65,313139,"Donation of photo; recognize transfer, assignment and assumption of responsibility between Rep. Hamilton (109th) and Rep. Zuber."
HR66,320906,"Red Cross Month; designate March 2011 for observance of."
HR67,316132,"Brittany S. Morgan; commend life and legacy upon her passing."
HR68,315464,"Long Beach High School Cheerleading Team; commend on winning Class 5A Championship."
HR69,315298,"Mrs. Vivan Valeria Sebren; commend and congratulate on the occasion of her 100th birthday."
HR70,316322,"Mr. Porter ""Bo Dollar"" Hubbard; commend life and legacy upon his passing."
HR71,308996,"Mississippi Home Education Week; designate week of May 16-20, 2011, as in the State of MS."
HR72,320758,"BornFree of Mississippi; commend on its 15th Anniversary."
HR73,320243,"Jordan Nicholas Johnson; commend academic success upon making a composite score of 22 on the ACT at 12 years of age."
HR74,313528,"Lee Jennings Davis; commend and congratulate on the occasion of his 95th birthday."
HR75,308985,"Wayne County High School War Eagles Boys Basketball Team; commend and congratulate on winning Class 5A State Championship."
HR76,313614,"Aurelia Norris Young; commend the life, legacy and accomplishments upon her passing."
HR77,308498,"Samuel Smith; commend services as a veteran of World War II."
HR78,314621,"Sutter Smith; commend service as a veteran of World War II."
HR79,312300,"New Albany Lady Bulldogs Basketball Team; commend for winning the class 4A Championship."
HR80,314175,"Paul Green; commend for his selection as a National Merit Finalist."
HR81,319775,"Mississippi Drug Court Program; commend on saving lives and saving money for Mississippi taxpayers."
HR82,321290,"Lanier High School Lady Bulldogs Basketball Team; commend on perfect season and winning the MHSAA Class 5A State Championship."
HR83,314414,"Aurlee Mae Griffin Johnson; commend life and legacy on her passing."
HR84,312416,"Dr. Albert B. Britton, Jr.; commend life and express sympathy upon passing."
HR85,315500,"Tougaloo College Men's Basketball Team and Coach Lafayette Stribling; commend upon successful season."
HR86,308621,"Drug court graduates; recognize and commend upon successful completion of the program."
HR87,320604,"Attorney Takiyah H. Perkins; commend career success upon appointment as Washington County Assistant D.A."
HR88,315261,"Linda and Jimmy Cockroft; commend &amp; congratulate being named King &amp; Queen of the 2011 Kosciusko Junior Auxiliary Charity Ball."
HR89,316821,"Clifford F. Dance, Jr.; commend life and legacy upon his passing."
HR90,320476,"Jerry Clower; acknowledge legacy and talent upon dedication of Country Music Trail Marker in his honor."
HR91,321011,"Ashley Johnson; commend and congratulate upon being named the Sun Herald's Soccer Player of the Year."
HR92,308646,"Special Olympics Mississippi Team; commend achievements of and extend wishes for success at Special Olympic World Summer Games."
HR93,317084,"Redistricting; urge Speaker to appoint conferees."
HR94,309140,"Omega Psi Phi Fraternity, Inc.; commend and congratulate on occasion of its 100th anniversary."
HR95,311102,"Sarah Bobo; commend and congratulate upon being crowned Miss Mississippi Teen USA 2011."
HR96,315526,"Monroe County Vocational Center; commend success in robotics competition and representing the state in the World Robotics Competition."
HR97,320231,"Myrlie Evers-Williams; recognize legacy and celebrate contributions."
HR98,314428,"Charles Evers; recognize the civic leadership and contributions of."
HR99,308987,"Mississippi Valley State University retirees; congratulate for numerous years of service."
HR100,312302,"2010 Greenwood Public School District retirees; congratulate for numerous years of dedicated service."
HR101,321094,"Clara Louise Wilson-Goodwin; commend life and legacy of."
HR102,308374,"Mrs. Myrtis Mayo; commend and congratulate on 104th birthday."
HR103,314864,"Vicksburg High School Boys Basketball Team; commend on outstanding season."
HR104,310311,"Toby Trowbridge, Jr.; commend remarkable service as Sheriff of Madison County upon his retirement."
HR105,308452,"Piney Woods High School Tornadoes Boys Basketball Team; commend upon winning MHSAA Class 2A State Championship."
HR106,309748,"Rosetta Swims; commend and congratulate on her 90th birthday."
HR107,319965,"Dr. Doris Hamilton McGowan; commend dedicated service upon her retirement after over 50 years in education."
HR108,319818,"H.W. Byers Lady Lions Girls Basketball Team; commend upon winning MHSAA Class 1A State Championship."
HR109,319842,"Michael D. Kent; commend dedicated service upon his retirement from Madison County Schools upon his retirement."
HR110,310765,"Medgar Wiley Evers; honor legacy and contributions to Mississippi."
HR111,314851,"Smithville High School Band; commend."
HR112,321409,"Ralph Barnes; commend service to the State Board of Public Contractors."
HR113,312788,"Jon Mark Weathers; commend meritorious service upon his retirement."
HR114,308877,"Leflore County School District 2011 retirees; congratulate for numerous years of dedicated service."
HR115,310553,"W.L. ""Frank"" Latham; commend life, legacy, success and service upon his passing."
HR116,312561,"Jack Gadd; commend legislative service upon his retirement."
HR117,316094,"Representative Dannie Loyd Reed; commend legislative legacy and congratulate upon his retirement."
HR118,312265,"Representative Ted Mayhall; commend legislative service upon his retirement."
HR119,317489,"Representative Billy Nicholson; commend legislative legacy and congratulate upon retirement after 12 years of service."
HR120,319827,"Representative Tad Campbell; commend legislative service and congratulate upon retirement."
HR121,320328,"Representative Deryk Parker; commend legislative service upon his retirement."
HR122,315057,"Representative Frank Hamilton; commend legislative service and congratulate upon retirement."
HR123,309283,"Representative Frances Fredericks; honor legacy to the MS House of Representatives and congratulate upon retirement."
HR124,314409,"Representative Greg Ward; commend legislative legacy and congratulate upon the occasion of his retirement."
HR125,316294,"Representative Noal Akins; commend legislative service and congratulate upon his retirement."
HR126,309409,"Representative Larry Baker; commend legislative service and congratulate upon the occasion of his retirement."
HR127,312134,"Mrs. Dessie Caulfield; commend life and express sympathy upon passing."
HR128,317143,"Dr. Eugene Murphey; commend for 65 years of dedicated service as a physician."
HR129,312462,"Mark Ormon; commend dedicated service upon his retirement as Benton County Chancery Clerk."
HR130,319893,"Franklin Oakley Menzies; commend upon receiving United States Citizenship."
HR131,317006,"Jansen Jibril Young; commend on receiving football scholarship to Alcorn State University."
HR132,316275,"Jobie Martin commend life, legacy and service of upon his passing."
HR133,319886,"Moyle H. ""Butch"" Surrette; commend career and public service to Yalobusha County upon his retirement."
HR134,308858,"Keeley Patterson; commend and congratulate on being crowned Miss Mississippi USA 2011."
HR135,313343,"Corinth High School Warriors Boys Cross- Country Team; commend on winning 2010 MHSAA Class 3A State Championship."
HR136,320717,"Sully D. Ayers; commend life, public service and legacy of upon his passing."
HR137,316096,"Mrs. Jean Ramage; commend dedicated service and congratulate upon her retirement from Mid-Mississippi Regional Library System."
HR138,316498,"Dr. Edrie George-Royals; commend upon induction into MS Nursing Association Hall of Fame."
HR139,320933,"David ""D.J."" Gardner; commend athletic success upon being named to First-Team Parade All-American Basketball Team."
HR140,316005,"Citizens' environmental commission and environmental justice in the State of Mississippi; promote."
HR141,308559,"Earnestine Perkins Purnell; commend upon her retirement from the Leflore County School District after 23 years of service."
HR142,309202,"Dr. Gene Young; commend life and legacy upon his passing."
HR143,320513,"Dr. Gene Young; commend life and legacy upon his passing."
HR144,316055,"Bobby O'Quinn; commend life, legacy and brave feat of heroism upon his passing."
HR145,311151,"State agencies; commend on response to Deepwater Horizon oil spill."
HR146,312451,"Dr. Lovetta A. Brown; commend dedicated and laudable service to the State of Mississippi."
HR147,315264,"Chief Master Sergeant Harold B. Wilcher; commend service upon his retirement."
HR148,313956,"Larry Gregory; commend upon his retirement as Executive Director of the Mississippi Gaming Commission."
HR149,316028,"Jack Alexander; commend distinguished and dedicated career upon his retirement."
HC1,213823,"Constitution; amend to provide for a state university system state board of governors and local board of trustees."
HC2,213824,"Slavery; issue apology for state's role in upholding and perpetuating the institution of in Mississippi."
HC3,213825,"Constitution; amend to require Governor to give Legislature advance notice of extraordinary session."
HC4,213826,"Amend Constitution; exclude murder and capital murder from Governor's pardon power."
HC5,213827,"Amend Constitution; require public hearing before pardon for felony."
HC6,213828,"Constitution; amend to change vote requirement from 3/5 to majority for passage of a bill that reduces a tax."
HC7,213829,"Constitution; amend to provide that Supreme Court judges be appointed by the Governor."
HC8,213830,"Constitution; amend to limit members of Legislature to 20 years of service."
HC9,213831,"Constitution; amend to provide that the Legislature shall meet in regular session once every two years."
HC10,213832,"10th Amendment State Sovereignty; urge U.S. Congress to be mindful of."
HC11,213833,"U.S. Congress; memorialize to designate the ""Honor and Remember Flag"" as a national symbol of service and sacrifice."
HC12,213834,"Christy Knapp; commend and congratulate upon being elected President of the MS Economic Development Council."
HC13,213835,"Constitution; amend to change day of November election for statewide officers from Tuesday to Saturday."
HC14,213836,"Constitutional amendment; bail not allowed for sex offenses."
HC15,213837,"Constitution; amend to elect State Superintendent of Public Education."
HC16,213838,"Diamondhead VFW; commend and congratulate on having second-largest percentage of veterans in the country."
HC17,213839,"U.S. Congress; memorialize to amend the U.S. Constitution to require a balanced federal budget at the end of each fiscal year."
HC18,213840,"State appointments, certain; urge to reflect more of the demographics and diversity of the state."
HC19,213841,"State of Mississippi; urge to take critical and fundamental actions to improve the state's economic and social rankings."
HC20,213842,"Joint Session; call to hear State of the State address of the Governor."
HC21,213843,"Honorable Judge Samac S. Richardson; commend and congratulate upon the occasion of his retirement."
HC22,213844,"The Diabetes Center and KC Arnold; commend and congratulate upon being awarded the 2010 Nicholas E. Davies Ambulatory Award of Excellence."
HC23,213845,"Constitution; amend to restrict use of eminent domain."
HC24,224736,"Constitution; amend to elect Governor by majority of popular vote, with no electoral vote requirement."
HC25,224737,"Constitution; amend to set elections for statewide elective offices in even-numbered years."
