bill_number,bill_id,title
HB759,224732,"Ad valorem tax, homestead property; exempt increase in assessed value above assessed value for preceding year for persons 65 or older."
HB760,224733,"Retirement; revise amount that PERS disability retiree may earn from gainful employment."
HB761,224734,"Public hearings for coastal wetland permits; revise procedure."
HB762,224735,"Coastal wetlands permit application; revise review period of."
HB763,227862,"Commercial harvesting of seafood; revise location in which one may engage in."
HB764,227863,"Saltwater minnows; revise definition of."
HB765,227864,"Live bait camps; authorize and require inspection of."
HB766,227865,"Shrimp; revise where can be taken and clarify personal consumption."
HB767,227866,"Distinctive license tag; reauthorize Dept. of Marine Resource's tag for supporters of seafood industry."
HB768,227867,"""Free Fishing Weekend""; designate and authorize exemption from saltwater sport fishing."
HB769,227868,"MS Highways 24 and 33; designate certain segments of."
HB770,227869,"Homochitto National Forest lands; establish season for hunting deer with guns and with dogs."
HB771,227870,"Mississippi Wireless Communication Commission; revise membership of."
HB772,227871,"Support Our Law Enforcement and Safe Neighborhoods Act of 2011; create."
HB773,227872,"Judicial candidates; revise procedures for certain vacancies."
HB774,227873,"Medicaid; require division to cooperate with Health Benefit Exchange and create Health Benefit Exchange Act."
HB775,227874,"Nursing home administrators licensure law; revise educational and experience requirements and complaint procedure."
HB776,227875,"Legal holiday; provide that Columbus Day shall be."
HB777,227876,"Medicaid; revise certain provisions regarding hearings on eligibility claims."
HB778,227877,"Commercial mobile radio service providers; require to identify county of primary use of its wireless customers."
HB779,227878,"District attorney; authorize supplement for salary of."
HB780,227879,"Check cashers; reduce maximum rate of interest that may be charged for cashing checks."
HB781,227880,"Deceased persons; establish rights of others to control disposition of remains of."
HB782,227881,"Abandoned sections of county road system; revise procedures."
HB783,227882,"Insurance; revise uninsured motorist coverage law and require Commissioner of Insurance to establish homeowners bill of rights."
HB784,227883,"Forfeiture; provide for assets involved in certain trademark and recordings violations."
HB785,227884,"Surplus lines insurance; revise provisions of law regarding."
HB786,227885,"Emergency communications districts; require identifying information for distribution of proceeds from emergency telephone charge."
HB787,227886,"CON; suspend statutory restrictions on issuance of for certain health care facilities until July 1, 2012."
HB788,227887,"CON; exempt construction of ICF-MR facility on leased or transferred Columbia Training School property from requirement for issuance of."
HB789,227888,"Child custody, require court hearing before custodial parent may remove the child from the state."
HB790,227889,"Bastardy; change terminology in code."
HB791,227890,"State Personnel System; remove officials and employees other than teaching staffs at colleges and universities from nonstate service."
HB792,227891,"Vulnerable persons; increase fine for failure to report abuse or neglect of patient or resident of care facility."
HB793,227892,"Bastardy; remove reference in code."
HB794,227893,"Child custody; provide notice and procedure for relocating a child's residence."
HB795,227894,"Elevator Safety Act of Mississippi; enact."
HB796,227895,"Electric vehicles; impose annual tax on, based on mileage traveled each year."
HB797,227896,"Burn Center; repeal requirement for UMMC to establish and provide for reimbursement for certain other burn centers."
HB798,227897,"Personal care homes; require licensure and regulation if they provide living arrangements for one or more persons."
HB799,227898,"Weapons; authorize investigators employed by the Real Estate Commission to carry."
HB800,227899,"Wrongful death; damages distributed as provided in will if one exists."
HB801,227900,"Mississippi Registered Agents Act; create."
HB802,227901,"Mississippi Department of Labor; create."
HB803,229186,"Affordable housing; create trust fund to assist in development, rehabilitation and preservation of."
HB804,227902,"Military; require leave of absence for family of active duty and revise other provisions."
HB805,227903,"Homeowners; remove any liability when contractor fails to pay subcontractor."
HB806,227904,"Medicaid; provide state funding for regional mental health centers in division's appropriation, not Dept. of Mental Health's."
HB807,227905,"Law enforcement Employment Procedures Act; create."
HB808,227906,"Small Municipalities and Limited Population Counties Fund; authorize issuance of bonds for."
HB809,227907,"S.A.F.E. Mortgage Act; exempt real property sellers who receive mortgages as security for purchase money obligations."
HB810,227908,"Judgments; clarify renewal."
HB811,227909,"Law enforcement officer; employers shall provide with body armor."
HB812,227910,"Law enforcement Officers; provide minimum due process rights for municipal."
HB813,227911,"Law enforcement officers and fire fighters; increase amount of death benefits payable to."
HB814,227912,"Election commissioner; require to be a nonpartisan office."
HB815,227913,"Justice court judges; increase jurisdictional amount to $5,000.00."
HB816,227914,"Liens; clarify where and when enforcement takes place."
HB817,227915,"Department Information Technology Services; require agencies to virtualize servers through data center."
HB818,227916,"Engineering; delete expert testimony from definition of practice of engineering."
HB819,227917,"Board of supervisors; revise number of days that notice must be given before a special meeting of."
HB820,227918,"Trial and Appellate Court Judges; increase salaries of."
HB821,227919,"Judges; provide additional chancellor for the Fourth Chancery Court District."
HB822,227920,"Perpetual care cemeteries; provide for appointment of maintenance committee for under certain circumstances."
HB823,227921,"Hospitals; Department of Health may authorize to operate off-campus emergency departments."
HB824,227922,"Debt Management Services Act; exempt certain services provided by attorneys."
HB825,227923,"State Board of Health; authorize to increase various licensure and regulatory fees."
HB826,227924,"CON; provide for direct appeals to Supreme Court and for expedited review for certain expenditures."
HB827,227925,"Nonresident pharmacies; require that adult sign for Schedule II drugs shipped to private residence in Mississippi."
HB828,227926,"Assistant teachers; require school districts to provide notice of nonreemployment at least five days before the school year ends."
HB829,229187,"Private adoptions; require licensed adoption agencies and attorneys to maintain certain records."
HB830,229188,"Ad valorem taxation; revise procedure for appeal of decisions regarding objections to assessments of real or personal property."
HB831,229189,"Crimes against animals; enact ""Mississippi Dog and Cat Pet Protection Law of 2011""."
HB832,229190,"Distinctive license tag; authorize issuance to supporters of Taylorsville High School."
HB833,229191,"Distinctive license tag; authorize issuance to supporters of Raleigh High School."
HB834,229192,"Distinctive license tag; authorize issuance to supporters of Mize Attendance Center."
HB835,229193,"Distinctive license tag; authorize issuance to supporters of crappie fishing."
HB836,229194,"Public school; prohibit athletic and academic teams from participating in certain unaudited associations."
HB837,229195,"Retirement; participants in optional retirement program may become PERS members and purchase credit for previous service."
HB838,229196,"Private business and vocational schools; authorize to submit evidence of certain accreditation in lieu of other application requests."
HB839,229197,"Child custody; provide for hearing before relocating child."
HB840,229198,"Cellular telephone; prohibit any driver from sending or receiving written messages on and impose $25.00 for."
HB841,229199,"Student grades; prohibit certain school administrators and district employees from influencing a change in."
HB842,229200,"Student testing; prohibit requirement that teachers readminister test to student on more than one occasion."
HB843,229201,"Counties; require hearings and meetings to begin after 5:00 p.m. central standard time."
HB844,229202,"Municipalities; require hearings and meetings to begin after 5:00 p.m. central standard time."
HB845,229203,"Funeral directing; allow reinstatement of expired license for if certain conditions are met."
HB846,229204,"Scenic byways; designate certain segments in Hancock County as ""Beach Boulevard Scenic Byway"" and ""Scenic Byways to Space."""
HB847,229205,"Driver's license; revise various laws regarding."
HB848,229206,"Inspection stickers; revise to make two years and revise fees."
HB849,229207,"Driver's license; provide that original and renewal will expire after six years and prescribe fee for."
HB850,229208,"Mississippi Optional Sales Tax Act; enact."
HB851,229209,"Harrison County Utility Authority; revise voting requirements of."
HB852,229210,"Law Student Limited Practice Act; revise to allow certain federal judges to issue orders to admit certain law students to limited practice."
HB853,229211,"Congressional districts; conform to 2000 census."
HB854,229212,"Absentee ballot; revise where such are counted."
HB855,229213,"Highway Patrol officers; allow to be employed after retirement under certain circumstances."
HB856,229214,"DEQ; authorize to charge fees for expedited permitting process for certain environmental programs."
HB857,229215,"State bid law requirements; revise process for awarding contracts for renovation and restoration of certain historical buildings."
HB858,229216,"PERS; revise benefits for persons who become members after July 1, 2011."
HB859,229217,"Retirement; allow members who retire under Option 4 to modify benefits if their marital status changes."
HB860,229218,"PERS; provide for payment and collection of employee and employer contribution for chancery and circuit clerks."
HB861,229219,"Retirement; provide that persons who exercise control over certain PERS investments shall act as fiduciaries."
HB862,229220,"Legislators and elected state officials in executive branch; reduce salaries of by 5% during fiscal year 2012."
HB863,229221,"Smoke-free Act of 2011; enact."
HB864,229222,"Health Care Practitioner Transparency Act; create."
HB865,229223,"Open Meetings and Public Records Acts; revise imposition of penalties for violation of."
HB866,229224,"Mississippi Highway 198; designate certain segment in Greene County as the ""Blue Star Highway."""
HB867,229225,"Mississippi Housing Trust Fund; authorize."
HB868,229226,"School influenza vaccination program; Health Dept apply for federal grants."
HB869,229227,"Cathinone derivatives; include in Schedule I."
HB870,229228,"Public university property; authorize DFA to sell certain property at University of Southern Mississippi Gulf Coast."
HB871,229229,"Medicaid; art therapy services shall be reimbursable under."
HB872,229230,"School classrooms; delete repealer on authority of parents to choose if twins or other multiples attend same or separate classes."
HB873,229231,"School districts; exempt from advertising requirements if no millage rate increase."
HB874,229232,"Mississippi Proprietary School and College Registration Law; revise provisions of law regarding fees and surety bonds."
HB875,229233,"Education Achievement Council; direct to develop funding mechanism for community colleges and universities based on productivity."
HB876,229234,"State Board for Community and Junior Colleges; require office of shared service to administer central business, payroll and purchasing services."
HB877,229235,"School bus turnarounds; authorize superintendents of education to request county maintenance in large school districts."
HB878,229236,"Title to mineral estate; allow to revert to surface estate owner after a ten-year period."
HB879,229237,"Hunting license; authorize."
HB880,229349,"DHS; maintain database of organizations providing meals to elderly, to notify persons on DHS waiting list."
HB881,229350,"Weapons; allow coroners to carry."
HB882,229351,"License tags; provide that the month and year shall be specified on one license decal."
HB883,229352,"Intrastate use of facsimile machine for certain unsolicited advertising material; prohibit."
HB884,229353,"Court fees; provide civil filing fee in circuit and chancery court to provide pay increase for judges and prosecutors."
HB885,229354,"Abandoned county road; revise how many findings must be made to declare."
HB886,229355,"Tuition waiver; provide for certain foster and adopted children and wards of the state to attend a state-supported IHL."
HB887,229356,"Social workers; revise licensure as prerequisite to performance of services."
HB888,229357,"Teacher scholarship; authorize for college graduates for costs of courses required for teacher licensure."
HB889,229358,"Random drug tests; require of all public school students in Grades 6 through 12."
HB890,229359,"Nursing education; unspent TANF funds shall be spent to pay expenses of persons enrolled as part of workforce training."
HB891,229360,"Appropriation; Health Department to provide funding to federally qualified health centers."
HB892,229361,"Mississippi Save Our Children Act; create to require programs in certain school districts."
HB893,229362,"Social workers; provide in schools having high incidences of crime via video conferencing means."
HB894,229363,"CON; issue for nursing home in Jones County."
HB895,229364,"Medicaid; provide for a database of electronic medical records of Medicaid recipients, with access by Medicaid providers."
HB896,229365,"Nursing education; require community colleges to offer online program for LPNs to obtain associate degree in."
HB897,229366,"Nursing schools and programs; make eligible for funding to increase faculty if increase enrollment proportionately."
HB898,229367,"Health insurance; require providers to allow children under 30 who are veterans to be covered under parent's policy."
HB899,229368,"Outdoor advertising; prohibit promoting or marketing alcoholic beverages, tobacco products and fast food in certain areas."
HB900,229369,"Minority set-aside; revise qualifications of eligibility for obtaining purchasing contracts under."
HB901,229370,"School nutrition; require school districts to serve low-fat meals and snacks to students diagnosed as overweight."
HB902,229371,"School curriculum; require students to receive additional instruction in healthy living."
HB903,229372,"Healthcare Coordinating Council; require to make a report on specific health goals for the state."
HB904,229373,"Small business health insurance pool; create."
HB905,229374,"Appropriation; Recreational Facilities Activity Program Fund administered by the State Department of Education."
HB906,229375,"Preexisting condition; prohibit abuse-related medical condition from being."
HB907,229376,"Children's services and programs; require all state agencies to provide information relating to such in a list to the Legislature."
HB908,229377,"Children's Resource Commission; create to coordinate and streamline the state's efforts to provide services to children."
HB909,229378,"""Dream Makers Program""; create as an after-school program for students in Grades 7 and 8."
HB910,229379,"""Health Careers Academy""; create for students in Grades 9 through 12."
HB911,229380,"Mississippi Senior Cadets Program; establish in State Department of Education."
HB912,229381,"Middle schools; require academic plans for students, peer mentoring and other programs."
HB913,229382,"Online learning programs; improve oversight and quality assurance of in public schools."
HB914,229383,"Dropout Prevention and Student Re-engagement Act; create."
HB915,229384,"Early Commitment to College Program; authorize for underperforming school districts."
HB916,229385,"College and Career Readiness Planning Program; create."
HB917,229386,"Vision 2020: An Education Blueprint for Two Thousand Twenty; create."
HB918,229387,"Mathematics and science instruction; enhance through new programs in middle schools."
HB919,229388,"Hope Program; establish and develop system to re-enroll high school dropouts in programs leading to a high school diploma."
HB920,229389,"Charter schools; authorize all public schools to seek to convert to charter status."
HB921,229390,"Universities; require to place 33% of bowl game revenue in escrow account to distribute to graduating athletes."
HB922,229391,"State Medical Examiner; revise certain provisions relating to."
HB923,229392,"Pharmacy Practice Act; reenact and extend repealer on and make various changes to."
HB924,229393,"Council on Combating Obesity in Mississippi; create."
HB925,229394,"Distinctive license tag; exempt veterans of Afghanistan from minimum number requirements."
HB926,229395,"Distinctive license tag; authorize issuance to supporters of Tylertown High School."
HB927,229396,"Deer-breeding farms; authorize State Veterinarian to regulate."
HB928,229397,"Human Embryo Protection Act; create."
HB929,229398,"""Mississippi Renewable Energy Development Act of 2011""; create."
HB930,229399,"Sex offenders; prohibit residing near victim and require notice to persons residing near offender."
HB931,229400,"Legislators and certain state elected officials and state employees; reduce salaries of by 10%."
HB932,229401,"Identity theft; establish procedure for victim to have debt forgiven and credit reports purged."
HB933,229402,"MAEP; define ""at-risk pupil"" and include a child diagnosed with an autism spectrum disorder."
HB934,229403,"Life jackets; increase minimum age of person required to wear on certain vessels."
HB935,229404,"Student residency requirements; require State Board of Education to adopt uniform policy to be implemented by school boards."
HB936,229405,"State employees with certain licenses; require to be paid same as other state employees with license if certain skills used."
HB937,229406,"Motorcycles; create Safety and Operator Training Program."
HB938,229407,"Juneteenth Freedom Day; designate as day of commemoration, not paid legal holiday."
HB939,229408,"Gasoline; require all sold in the state for certain purposes to contain 10%, by volume, denatured ethanol by 2014."
HB940,229409,"Crimes; create offense regarding throwing objects from an overpass and striking a motor vehicle."
HB941,229410,"Housing Loan Assistance Pilot Program; create."
HB942,229411,"Contributing to the neglect or delinquency of a child and abuse of a child; revise penalties for."
HB943,229412,"Bonds; authorize issuance to provide funds for public school capital improvements."
HB944,229413,"State assessment; provide for violation of not obeying signal indicating approaching train."
HB945,229414,"Adequate Education Program; increase adjustment to base student cost for at-risk students."
HB946,229415,"Health insurance policies; require coverage for certain obesity treatments."
HB947,229416,"Trimester School Year Pilot Program; establish."
HB948,229417,"Compulsory School Attendance Law; delete provision allowing parent to disenroll child from kindergarten."
HB949,229418,"School curriculum; require comprehensive Mississippi history course for public school students in Grade 9."
HB950,229419,"Statewide System of Care; reduce reliance on institutions and expend home- and community-based services."
HB951,229420,"School social workers and psychologists; authorize districts to employ and receive partial state reimbursement for salaries."
HB952,229421,"Housing repair grant program; authorize issuance of bonds to provide funds for grants to low income individuals for home repair."
HB953,229422,"Income tax; exclude overtime compensation from gross income."
HB954,229423,"Pre-kindergarten; require Department of Education to create the ""ABC Program"" to provide instruction via Internet."
HB955,229424,"Health and human services agencies; require to prepare videos with certain information for benefit recipients and others."
HB956,229425,"Body mass index (BMI); require schools to collect for certain students and provide to parents with an explanation."
HB957,229426,"Health Disparities Council; create."
HB958,229427,"Appropriation; Health Department for additional funds for Office of Health Disparity Elimination."
HB959,229428,"Elementary school counselors; allocate funds under the Mississippi Adequate Education Program for."
HB960,229429,"Task force to address the disparity of African-American males in the judicial system; create."
HB961,229430,"School districts; require policies if accredited at the three lowest levels and alternate curriculum."
HB962,229431,"Motivating Parents and Children (M.P.A.C.) pilot program; establish within the State Department of Education."
HB963,229432,"Comprehensive School Health Education Program; include additional components in and require school nurse to teach."
HB964,229433,"Mississippi Comprehensive Communities of Color Teen Pregnancy Prevention Act; create."
HB965,229434,"Comprehensive sex education; require to be taught in Grades K through 12."
HB966,229435,"Medicaid; require participation in medical home concept and require obese persons to participate in online program on obesity."
HB967,229436,"TANF and Medicaid; require teenage recipients of to participate in programs about birth control, abstinence and parenting."
HB968,229437,"Health screening; require annually for Medicaid, CHIP and State Health Plan recipients and participants."
HB969,229438,"Medicaid; children under age 18 in foster care are eligible for."
HB970,229439,"Compulsory school attendance; increase age of and revise various provisions."
HB971,229440,"Public high schools; revise graduation requirements and authorize pre-apprentice programs."
HB972,229441,"Volunteer and Parents Incentive Program Act; create."
HB973,229442,"Mississippi High School Dropout Prevention Act of 2011; create."
HB974,229443,"Open Meetings Law; prescribe civil penalty for disclosing information from executive session of public body."
HB975,229444,"Hinds County State Highway System Study Committee; create."
HB976,229445,"Sales tax; provide diversion to Jackson to defray ad valorem tax loss and increased costs incurred as seat of state government."
HB977,229446,"MS Sesquicentennial of the American Civil War Commission; increase membership."
HB978,230440,"Public defenders; compensation shall be same as county prosecutors."
HB979,230441,"Public Service Commission; repeal authority to use alternate method of cost recovery on certain power generation."
HB980,230442,"Workers' compensation; provide employer the right to require autopsy in death cases."
HB981,230443,"Workers' Compensation Law; define purpose to be impartially construed."
HB982,230444,"Mississippi Human Embryo Adoption Act; create."
HB983,230445,"Burying of dead livestock or poultry; authorize boards of supervisors of counties to do so in emergency situations."
HB984,230446,"Public contracts; give preference to resident bidders, and prescribe specific penalties for violations."
HB985,230447,"Family protection specialists and workers; require training in legal duties to protect rights of persons being investigated."
HB986,230448,"Crimes; revise expunction of certain convictions."
HB987,230449,"School boards; revise notice form and content of notice required for annual ad valorem tax effort."
HB988,230450,"Local taxing entities; revise form and content of notice required for annual ad valorem tax efforts and budget proposals."
HB989,230451,"Sales tax; extend repealer on tax imposed on sales of machinery and construction services at certain refineries."
HB990,230452,"Real estate; authorize broker opinions of value."
HB991,230453,"State buildings; rename MDOT building in Jackson, MS, the ""William J. 'Billy' McCoy Building""."
HB992,230454,"State buildings; name the MEMA building in Pearl, MS, the ""Haley R. Barbour Building""."
HB993,230455,"State buildings; name the MS Highway Patrol District Office in Meridian, MS, the ""Charles L. Young, Sr., District Office""."
HB994,230456,"Unemployment compensation; make certain revisions for employees discharged due to misconduct."
HB995,230457,"Department of Public Safety's Planning Division; clarify certain duties of."
HB996,230458,"Youth court records, certain; authorize inspection by the Department of Public Safety's Planning Division."
HB997,230459,"Preneed contracts; allow naming of substitute provider at any time, and require all to be funded by insurance beginning 7-1-13."
HB998,230460,"Exemption on Health Foods Act of 2011; create."
HB999,230461,"Sex-related education; require local school boards to adopt a policy on and implement."
HB1000,230462,"Guardians ad litem who are laymen; clarify that certain county courts may appoint."
HB1001,230463,"Publication requirements; revise."
HB1002,230464,"Weapon in vehicle; prohibit restricting on private property."
HB1003,230465,"Concealed weapons; remove all state restrictions where permittees may carry."
HB1004,230466,"Abuse of school officials and personnel; include students in list of persons who may be charged with."
HB1005,230467,"Bonds; increase amount that may be issued to provide grants to counties/municipalities for improvements to livestock facilities."
HB1006,230468,"School ad valorem taxes; transfer school board's authority to increase to levying authority."
HB1007,230469,"Bonds; authorize issuance for grants to counties/municipalities for improvements to livestock facilities."
