bill_number,bill_id,title
SB2376,224962,"Driver's license; increase fee for reinstatement following suspension."
SB2377,224963,"State and local governments; shall strip law enforcement vehicles before selling or disposing of the vehicles."
SB2378,224964,"Students with disabilities; parents have option of tape recording IEP meetings."
SB2379,224965,"Capital Improvements Preplanning Fund; extend repealer on."
SB2380,224966,"Land records; revise instrument recordation minimum standards."
SB2381,224967,"SREB contract program at Southern College of Optometry; students not required to practice in Mississippi."
SB2382,224968,"MS Debt Management Services Act; exempt certain services provided by attorneys in the regular course of the practice of law."
SB2383,224969,"Students participating in General Educational Development (GED) option programs; clarify funding."
SB2384,224970,"Mississippi Money Transmitters Act; revise the license and examination fees."
SB2385,224971,"Students with disabilities; parents provided alternate assessment scores at no cost."
SB2386,224972,"Students with disabilities; parents shall receive copy of outside evaluation and observation report."
SB2387,224973,"Students with a disability; parents provided copy of child's assessment."
SB2388,224974,"Financial reimbursements to sponsoring school districts for students placed in youth detention centers; SDE issue policy."
SB2389,224975,"Homeschooled students; to be tested for grade assignment prior to transfer into public school district."
SB2390,224976,"School textbooks; clarify procedure for executing publishing contracts."
SB2391,224977,"Concurrent jurisdiction; establish with United States for crimes committed on federal military installations."
SB2392,224978,"School teacher and administrator licensure; provide penalties for sexual involvement of school employees with a student."
SB2393,224979,"Drug courts; authorize drug court judge to assess direct cost of confinement for person in jail."
SB2394,224980,"Bonds; authorize issuance for repair of bridges in Alcorn and Tishomingo Counties."
SB2395,224981,"State agencies; delete repealer on Department of Employment Security and related laws of other agencies."
SB2396,224982,"MS Motor Vehicle Safety Inspection Law; repeal and provide additional tag fee."
SB2397,224983,"Income taxation; exclude wages of certain full-time students from gross income."
SB2398,224984,"Early voting; authorize a pilot program in Alcorn County."
SB2399,224985,"Early voting; authorize a pilot program in Alcorn County."
SB2400,224986,"MS Community Heritage Preservation Grant Fund; revise use of certain funds."
SB2401,224987,"Elected judiciary and district attorneys; bring forward law relating to the annual salaries of."
SB2402,224988,"Bonds; issue state general obligation bonds for purchase of rights-of-way for Hwy. 15 from U.S. 78 to Tennessee state line."
SB2403,224989,"Headlights; require use during precipitation."
SB2404,224990,"Highways; Transportation Department construct Highway 72 bypass for City of Corinth."
SB2405,224991,"Early Voting Act; authorize voting prior to election day."
SB2406,224992,"Corrections; authorize MDOC to contract with Tishomingo County for regional prison."
SB2407,224993,"Employment Security Law; exclude services performed by individuals in the delivery of newspapers regardless of age."
SB2408,224994,"Corporate charters; provide for automatic statutory extension."
SB2409,224995,"Banks; shall post owner information of ATM if machine is owned by another bank or entity."
SB2410,224996,"Counties; maintain private roads used as Head Start turnarounds."
SB2411,224997,"Human Relations Commission; establish."
SB2412,224998,"Unemployment compensation law; provide a direct seller exemption from."
SB2413,224999,"Blue Alert System; create."
SB2414,225000,"Deferred Retirement Option Program (DROP); create."
SB2415,225001,"Motor carriers; change incorrect reference to Interstate Commerce Commission."
SB2416,225002,"Vehicle service contracts; provider not required to be named insured under reimbursement policy upon certain conditions."
SB2417,225003,"Franchise tax; base the levy on retained earnings employed in this state."
SB2418,225004,"""Mississippi Free Health Clinic Volunteers in Medicine Act""; enact."
SB2419,225005,"Licensing of insurance adjusters; revise definition to exclude multi-peril crop insurance adjusters."
SB2420,225006,"""Eyebrow threading""; define for regulatory purposes and require registration."
SB2421,225007,"Workers' compensation; provide that appeals from commission go directly to Court of Appeals."
SB2422,225008,"Ad valorem taxation; exempt military housing constructed pursuant to the Military Housing Privatization Initiative."
SB2423,225009,"State Board of Cosmetology; extend repealer on."
SB2424,225010,"State Board of Barber Examiners; extend automatic repealer on."
SB2425,225011,"Central business services and procurement for all public school districts; DFA Office of Shared Services administers on regional basis."
SB2426,225012,"Obstruction of emergency assistance; create offense."
SB2427,225013,"State Superintendent of Education; State Board of Education shall set salary of."
SB2428,225014,"Funding mechanism for community colleges and universities based on productivity; direct Education Achievement Council to develop."
SB2429,225015,"Revenue from leasing of channels awarded by the FCC; are public funds expendable by the state agency leasing the channels."
SB2430,225016,"Nurse practitioner supervision by physician or dentist; revise."
SB2431,225017,"Law enforcement officers; provide minimum due process rights for municipal."
SB2432,225018,"Absentee ballots; revise the manner in which absentee ballots are counted."
SB2433,225019,"Children with identified disabilities; revise distribution of certain documents to parents."
SB2434,225020,"Distinctive motor vehicle license tags; authorize for supporters of Le Bonheur Children's Hospital."
SB2435,225021,"State Medical Examiner; transfer to Mississippi Department of Health."
SB2436,225022,"Public schools; require certain appropriate conduct by students."
SB2437,225023,"PERS; provide for payment and collection of employee and employer contribution for chancery and circuit clerks."
SB2438,225024,"Retirement; provide that persons who exercise control over certain PERS investments shall act as fiduciaries."
SB2439,225025,"PERS; revise benefits for persons who become members after July 1, 2011."
SB2440,225026,"Retirement; allow members who retire under Option 4 to modify benefits if their marital status changes."
SB2441,225027,"Fees charged by the State Department of Health; revise."
SB2442,225028,"Manslaughter; distinguish between voluntary and involuntary."
SB2443,225029,"DUI; increase penalties for 4th and 5th offenses."
SB2444,225030,"Mississippi Nonprofit Corporation Act; revise."
SB2445,225031,"""Mississippi Pharmacy Practice Act""; extend repealer on and make technical amendments."
SB2446,225032,"Mississippi Board of Psychology; reenact and make technical amendments."
SB2447,225033,"Medicaid program; direct DOM to establish a medical home program to support primary care providers."
SB2448,225034,"Certificate of need review; provide for direct appeal and expedited review for certain health care expenditures."
SB2449,225035,"Distinctive motor vehicle license tag; authorize for supporters of the Mississippi Veterinary Association."
SB2450,225036,"Agriculture; conform state organic certification program to USDA National Organic Program."
SB2451,225037,"IHL; may waive out-of-state tuition for students on a reciprocity basis."
SB2452,225038,"Medicaid coverage for breast prosthesis and bra; provide reimbursement for."
SB2453,225039,"Kidnapping; expand definition."
SB2454,225040,"Uniform Prudent Management of Institutional Funds Act; enact."
SB2455,225041,"Service of process; Model Registered Agents Act (ULC)."
SB2456,225042,"Counties; authorize to acquire cell phones for Wildlife, Fisheries and Parks' officers."
SB2457,225043,"Malicious prosecution; define as an intentional common-law tort."
SB2458,225044,"Retired teachers; may draw retirement benefits and be reemployed as teachers if they have 30 years of creditable service."
SB2459,225045,"Local system roads; allow portion of state aid allocated to counties to be used to retire debt for."
SB2460,225046,"Chancery clerks; authorize, upon request, the redaction of social security numbers on recorded documents."
SB2461,225047,"Unemployment compensation; increase the minimum weekly benefit."
SB2462,225048,"Board on Law Enforcement Standards and Training; revise qualification for certain officers."
SB2463,225049,"Sixteenth section school land; limit rent increases on farm-residential land."
SB2464,225050,"Appropriations; tobacco litigation funds, supplemental health insurance for law enforcement; FY2012."
SB2465,225051,"Regional Alternative School Pilot Program (R.A.S.P.); authorize under Division of Youth Services."
SB2466,225052,"School bus drivers; school districts may pay health insurance premium of retirees employed as school bus drivers."
SB2467,225053,"Tuition-free attendance at any state IHL or community college; authorize for Mississippi residents age 65 or over."
SB2468,225054,"Gaming; create statewide lottery to fund Hope College Scholarship Program."
SB2469,225055,"Concealed weapons; remove prohibition against carrying in certain places."
SB2470,225056,"State budget; exclude state veterans home patient rates from budget cuts."
SB2471,225057,"Sidearm; allow district attorneys and certain staff to retain upon retirement (MPA)."
SB2472,225058,"Nathan's law; increase penalty for unlawful passing of school bus."
SB2473,225059,"Radar; authorize use by sheriffs."
SB2474,225060,"Judicial procedure; clarify setting of bail in municipal court."
SB2475,225061,"Child abuse and neglect; revise persons with a duty to inform (AG)."
SB2476,225062,"Uniform Controlled Substances Act; revise forfeiture under."
SB2477,225063,"Radar; prohibit use within 1,000 feet of posted point where speed limit is reduced."
SB2478,225064,"Unemployment compensation benefits; eliminate one-week waiting period for eligibility."
SB2479,225065,"Traffic safety violator course; may be an Internet course."
SB2480,225066,"Expunction of felony offenses; clarify filing fee for petition."
SB2481,225067,"Sheriffs; bring forward law relating to annual salaries of."
SB2482,225068,"Pearl River Valley Water Supply District; add two board members from the City of Jackson."
SB2483,225069,"Medicaid recipients; redetermine eligibility every 6 months."
SB2484,225070,"Drug violations; enhance penalties when children under 18 are present."
SB2485,225071,"Coroners; allow to carry a concealed weapon without a permit."
SB2486,225072,"Sidearm; allow district attorneys and certain staff to retain upon retirement."
SB2487,225073,"Circuit Court Community Corrections Act of 2010; clarify discretionary nature of."
SB2488,225074,"Local law enforcement officers; authorize supplemental pay for certain."
SB2489,225075,"County board of education is levying authority for all school districts in county school system; provide."
SB2490,225076,"Judicial elections; provide procedure to be followed when the only candidate for a judicial office dies, resigns or is disqualified."
SB2491,225077,"Convicted felons; clarify prohibition against possession of knife."
SB2492,225078,"Controlled substances; acquiring by theft, fraud and the like."
SB2493,225079,"Marriage and Family Therapy and Social Worker Licensure Act; delete repealer and make technical amendments."
SB2494,225080,"Retirement; revise amount that disability retiree may earn from gainful employment."
SB2495,225081,"Distinctive license tag for Afghanistan service; exempt from pre-purchase requirements."
SB2496,225082,"Elections; prescribe minimum number of OMR ballots that must be printed &amp; voting machines &amp; DRE units that must be utilized at elections."
SB2497,225083,"Circuit clerks; authorize fee for the docketing and filing of a Notice of Renewal of Judgment."
SB2498,225084,"Child Protection Act; enact."
SB2499,225085,"Trauma Care Systems Fund; exempt certain golf carts from fee imposed for."
SB2500,225086,"Motor vehicles; authorize the operation of low-speed electric vehicles on certain public roads."
SB2501,225087,"Memorial highway; designate a certain segment of I-59 as ""Mississippi Gold Star Memorial Highway."""
SB2502,225088,"""Mississippi"" by Danny Wayne Purcell; designate as official Country Music Song of Mississippi."
SB2503,225089,"Public Service Commission; shall have jurisdiction over rates for electricity provided by TVA directly to industrial customers."
SB2504,225090,"School district trustees in special municipal school district embracing entire county; change qualifying date requirement."
SB2505,225091,"Domestic abuse; Protective Order Registry to be checked before granting bail on another charge."
SB2506,225092,"Concealed weapon; authorize carrying in church with permit."
SB2507,225093,"Exemption on Health Foods Act of 2011; create."
SB2508,225094,"Highway patrol officer; revise minimum qualifications."
SB2509,225095,"Uniform traffic ticket; revise responsibility for devising form and accounting for copies."
SB2510,225096,"Ad valorem taxes; revise advertising requirements when school district proposes no millage increase."
SB2511,225097,"Hunting rights on sixteenth section school land; local school board may hold an auction on leases for."
SB2512,225098,"Criminal convictions; judge to explain to convict whether he remains a qualified elector."
SB2513,225099,"Licensed school employees; allow use of personal leave near holiday if summoned by court."
SB2514,225100,"Smoking in all public places; prohibit."
SB2515,225101,"Income tax; increase credit for ad valorem tax paid on inventory."
SB2516,225102,"Alcoholic beverages, light wine and beer permits; suspend or revoke for the discharge of a firearm on the premises."
SB2517,225103,"Noise abatement; revise offense of noise disturbance."
SB2518,225104,"MS Forestry Commission; extend date of repeal on authority to hire law enforcement officers to investigate woods arson."
SB2519,225105,"Motor carriers/shipper indemnity contracts; create study committee."
SB2520,227929,"Wildlife; prohibits nonresidents from hunting in second season of hunting deer with guns and dogs in the Homochitto Nat'l. Forest."
SB2521,227930,"Hunting; require a gun to be enclosed in a case when transported on a public road."
SB2522,227931,"Elections; allow mileage to receiving and returning managers."
SB2523,227932,"Managers of election; require to attend training courses annually."
SB2524,227933,"Election commissioners; provide that the office shall be nonpartisan."
SB2525,227934,"Secretary of State; authorize to convey certain buildings in Jackson County to United States Coast Guard."
SB2526,227935,"State Advisory Panel on Special Education; revise membership and duties."
SB2527,227936,"Students with disabilities; revise complaint procedures to supply parents with response information."
SB2528,227937,"Wildlife; allow mentally handicapped persons to hunt during special youth season and exempt from license requirements."
SB2529,227938,"Schools at-risk of failing; revise procedures and sanctions under school district conservatorship law."
SB2530,227939,"Wildlife; regulate deer-breeding farms."
SB2531,227940,"Reading Sufficiency Program of Instruction; repeal specific components."
SB2532,227941,"Central business functions; payroll and purchases for all state agencies; establish DFA Office of Shared Services."
SB2533,227942,"School district conservator/financial advisor; remove from requirements of Personal Service Contract Review Board."
SB2534,227943,"Mississippi Pawnshop Act; make various amendments."
SB2535,227944,"Compulsory school attendance law; delete authority to disenroll kindergarten student and prohibit automatic failure for absenteeism."
SB2536,227945,"Parental choice for assignment of twins to class; delete repealer."
SB2537,227946,"Mississippi Auto Liability Insurance No Pay, No Play Act; create."
SB2538,227947,"Residential builders and remodelers and State Board of Contractors; extend repealer."
SB2539,227948,"Commissioner of Banking; authorize to disclose certain regulatory information to other government agencies."
SB2540,227949,"Commissioner of Banking; may require consumer industry licensees to participate in a multistate licensing system."
SB2541,227950,"Counties; authorize to work on natural and man-made drainage structures."
SB2542,229240,"Immigration Reform Act of 2011; enact."
SB2543,229241,"Authorize Tunica County; authorize contribution to Institute of Community Services, Inc."
SB2544,229242,"Controlled substances; enhance penalty for illegal sale in proximity to drug rehab facility."
SB2545,229243,"Indecent assault; create crime of unlawful sexual touching."
SB2546,229244,"DNA testing; revise in context of post-conviction relief."
SB2547,229245,"Ad valorem school taxes; exempt publication requirement if no increase in ad valorem tax effort in dollars is proposed."
SB2548,229246,"Long-arm statute; revise completion of service of process."
SB2549,229247,"Voter registration; authorize person to apply online."
SB2550,229248,"Motorcycle Operator Safety Program; establish."
SB2551,229249,"State employee wellness councils; state agencies shall allow employees to participate."
SB2552,229250,"Child support; authorize chancery judge to assess cost of confinement for person in jail for delinquent child support."
SB2553,229251,"Local school district budgets; require at least 75% to be expended for instructional purposes."
SB2554,229252,"""Mississippi Accountability and Transparency Act""; define data to be maintained on searchable website."
SB2555,229253,"Homeschool students; authorize dual enrollment in public schools."
SB2556,229254,"Recall election procedures for local officials by referendum; specifically include local school board members."
SB2557,229255,"Career track program for students not pursuing baccalaureate degree; provide certain conditions."
SB2558,229256,"Children's Product Safety; create (AG)."
SB2559,229257,"Automatic school district transfer for children of military parents stationed in Mississippi; provide for."
SB2560,229258,"Workers' Compensation Law; define purpose to be impartially construed."
SB2561,229259,"Toys; prohibit sale of those containing lead at toxic levels."
SB2562,229260,"School buses; require new buses to be equipped with seatbelts."
SB2563,229261,"Office of Capital Defense Counsel/Office of Indigent Appeals; merge into Office of State Public Defender."
SB2564,229262,"Mississippi Adequate Education Program; increase funding for at-risk pupils."
SB2565,229263,"School Employment Procedures Law; include assistant teachers under."
SB2566,229264,"Certified emergency telecommunicators; require continuing education for."
SB2567,229265,"Traffic tickets; clarify time of filing in certain circumstances and revise authority to prescribe form of ticket."
SB2568,229266,"Real estate transactions; require disclosure if meth production occurred on the property."
SB2569,229267,"Health care certificates of need; issue for construction of PRTF and child acute care beds in certain counties."
SB2570,229268,"State agency personnel; remove from certain State Personnel Board procedures."
SB2571,229269,"Arrest warrant; require probable cause hearing before issuance."
SB2572,229270,"Official state song; adopt ""My Home Mississippi."""
SB2573,229271,"Landlord tenant relations; require locks to be changed between residential tenancies."
SB2574,229272,"Motor vehicle license tags; require proof of citizenship or legal alien status to obtain."
SB2575,229273,"Alcoholic beverages; qualified resort areas may be established in dry counties only after a countywide vote."
SB2576,229274,"Institutions of higher learning; implement vehicle management system."
SB2577,229275,"Wildlife; prevent waste of migratory game birds when hunting from a boat in certain small streams."
SB2578,229276,"Income tax credit; authorize for taxpayers who maintain, support and care for a dependent with a diagnosis of developmental disability."
SB2579,229277,"""Mississippi Student Religious Liberties Act of 2011""; enact."
SB2580,229278,"Legal gaming; limit conduct to counties in which it is already being conducted."
SB2581,229279,"Charitable organizations; violations of the Charitable Bingo Law are also a violation of law requiring registration."
SB2582,229280,"Retired teachers; may draw retirement benefits and be reemployed as teachers if they have 30 years of creditable service."
SB2583,229281,"Radar; repeal requirements and restrictions."
SB2584,229282,"Radar; authorize speed detection by all officers."
SB2585,229283,"Radar; revise entities authorized to operate."
SB2586,229284,"Disabled veterans; increase for totally disabled veterans and extend to unremarried surviving spouses of such veterans."
SB2587,229285,"Corrections; prohibit trusty convicted of murder or any other crime of violence from working at Governor's Mansion."
SB2588,229286,"Property insurance; prohibit hurricane deductible unless damages arose from a named storm."
SB2589,229287,"Major medical leave; MBN officers injured in the line of duty shall not be required to use."
SB2590,229288,"Ad valorem taxes; revise advertising requirements when county proposes no millage increase."
SB2591,229289,"Rating Bureau; shall use Fire Suppression Rating Schedule (FSRS) published by ISO when rating municipalities or districts."
SB2592,229290,"Sex offense; revise definition (MPA)."
SB2593,229291,"School term; revise first day and reduce length in all school districts."
SB2594,229292,"High school students suspended from extracurricular/athletic activity for failure to maintain certain grades; repeal."
SB2595,229293,"Psychiatric residential treatment facility; allow all beds in facility in DeSoto County to participate in Medicaid."
SB2596,229294,"Statement of economic interest; revise penalty and procedure upon failure to file."
SB2597,229449,"Alcoholic beverages; prohibit adults from allowing party at private premises if minors obtain and adults know."
SB2598,229450,"Sheriff of Tunica County; authorize additional salary supplement by board of supervisors."
SB2599,229451,"CON; authorize transfer of beds from Hancock County and new CON in Lamar County."
SB2600,229452,"Distinctive horse trailer tags; authorize for supporters of the Mississippi State Equine Association."
SB2601,229453,"Tunica County; authorize contract with and/or contribute to Mid-State Opportunity, Inc."
SB2602,229454,"Tunica County; authorize contribution to Aaron E. Henry Community Health Clinic, P.A."
SB2603,229455,"Memorial highways; designate segments of U.S. Highways as memorial highways."
SB2604,229456,"Salaries of judges; increase/establish funding."
SB2605,229457,"Memorial highway; designate MS Highway 6 in Pontotoc County as ""Military Order of the Purple Heart Highway."""
SB2606,229458,"Ad valorem taxation; revise the definition of ""home"" or ""homestead"" under the homestead exemption law."
SB2607,229459,"MS Telephone Solicitation Act; apply to commercial telephone lines."
SB2608,229460,"Physician licensees from other states; provide for Mississippi license without examination under certain conditions."
SB2609,229461,"Mississippi Interagency Council on Homelessness; establish."
SB2610,229462,"Mississippi Individual On-Site Wastewater Disposal System Law; extend repealer."
SB2611,229463,"Municipally owned waterworks; prohibit from charging higher rates to certain customers in another municipality."
SB2612,229464,"Community hospital services in certain counties; authorize direct negotiation with hospital in adjoining county to provide."
SB2613,229465,"Contempt of the PEER Committee; provide criminal penalties."
SB2614,229466,"Elections; increase fee paid by legislative candidates upon entering the race for party nominations."
SB2615,229467,"Feticide; revise killing or injury of an unborn child."
SB2616,229468,"Wireless Communication Commission; revise membership."
SB2617,229469,"Abortions; all physicians performing in abortion clinics must have admitting privileges at a local hospital."
SB2618,229470,"Sunshine Attorney Act; create."
SB2619,229471,"MS Gulf Coast Region Utility Board; extend repealer."
SB2620,229472,"Dept. of Fin. &amp; Administration; may grant an easement on certain property located in the Howard Miller Wildlife Management Area."
SB2621,229473,"State Employees Health Insurance Management Board; shall use certain procedures to procure CHIP insurance."
SB2622,229474,"DFA; authorize to sell certain real property at Delta State University."
SB2623,229475,"Hospitals to require authentication of verbal physician orders; direct."
SB2624,229476,"Unlawful absences from school; no promotion or graduation if student has accumulated 21 or more absences in preceding school year."
SB2625,229477,"Physicians who self-refer diagnostic imaging tests; limit billing options."
SB2626,229478,"Taxation; limit prosecution's authority to plea-bargain."
SB2627,229479,"Alcoholic beverage; certain advertisements for may originate in dry areas."
SB2628,229480,"Intercept gaming winnings of parents with a child support arrearage; provide procedures for."
SB2629,229481,"Health care insurance; no person, employer or health care provider shall be required to participate in any health care plan."
SB2630,229482,"Prescription Monitoring Program; practitioners to check database before prescribing Schedule II drugs to new patients."
SB2631,229483,"Task Force to Study Teacher Salaries; establish."
SB2632,229484,"Credit cards; place restrictions on marketing to college students."
SB2633,229485,"Mississippi Civil Rights Museum; establish commission to select site and employ director."
