bill_number,bill_id,title
HB1,213367,"Elections for state officers; change day of week to Saturday."
HB2,213368,"Chancery clerks; revise monies to be included within salary limitation."
HB3,213369,"Revenue from motor vehicle parking lots and garages operated by airport authorities; exempt from state, county and local sales tax."
HB4,213370,"Lobbyists; prohibit agencies, universities and colleges from hiring contract lobbyists with public funds."
HB5,213371,"State institutions; patients admitted for less than six months not required to pay social security disability benefits to the institution."
HB6,213372,"Retirement; exclude value of noncash maintenance furnished to PERS members for retirement purposes."
HB7,213373,"Mental Health, Department of; revise qualifications for executive director of."
HB8,213374,"Mental Health, Department of; employees who are provided housing on facility grounds must pay rent."
HB9,213375,"State Board of Mental Health; reconstitute membership of."
HB10,213376,"State law enforcement officers; not required to use personal or major medical leave when injured in line of duty."
HB11,213377,"Medicare Advantage plans &amp; Prescription Drug plans; provide civil &amp; criminal penalties for violating federal marketing restrictions on."
HB12,213378,"Extracurricular and athletic activities; require students to maintain a 2.0 weekly grade point average for participation in."
HB13,213379,"Ethics violation; revise enforcement provisions for charges against a public body."
HB14,213380,"University of Mississippi Medical Center - Act Center Fund; require annual transfer of funds from State General Fund to."
HB15,213381,"Sales tax; exempt sales of nonperishable food to certain charitable organizations."
HB16,213382,"Loans; create the Mississippi Alternative Loan Act."
HB17,213383,"Radar; prohibit use within 1,000 feet of posted point where speed limit is reduced."
HB18,213384,"Whistleblower Law; provide for damages."
HB19,213385,"Sales tax; exempt retail sales of certain clothing and school supplies on third Saturday in July and first Saturday in December."
HB20,213386,"Income tax; revise time within which Department of Revenue must refund overpayment before taxpayer may petition for hearing."
HB21,213387,"Retirement medical benefits account; establish for state officers and employees."
HB22,213388,"Income tax; authorize an adjustment to gross income for higher education tuition, fees and other costs."
HB23,213389,"Income tax; authorize fuel cost adjustment to gross income."
HB24,213390,"Income tax; provide credit to contractors for homes constructed in accordance with certain Green standards."
HB25,213391,"Homestead exemption; increase for totally disabled veterans and extend to unremarried surviving spouses of such veterans."
HB26,213392,"Sales tax; exempt retail sales of hearing aids."
HB27,213393,"Income tax; provide credit for taxpayer paying home security expenses for primary residence."
HB28,213394,"Ad valorem taxation; revise definition of ""head of a family"" and ""home"" or ""homestead"" under the homestead exemption law."
HB29,213395,"Fax solicitations, certain; prohibit under Mississippi Telephone Solicitation Act."
HB30,213396,"Homestead exemption; increase."
HB31,213397,"Ad valorem tax; revise date and amount for which cities/counties may allow partial payments, revise interest rate on unpaid taxes."
HB32,213398,"Sales tax; exempt sales of utilities to churches."
HB33,213399,"Sales tax; reduce rate on retail sales of motorcycles."
HB34,213400,"Homestead exemption; increase."
HB35,213401,"Eminent domain; restrict use of."
HB36,213402,"Lawsuits; plaintiff liable for defendant's costs if defendant prevails."
HB37,213403,"Lien; allow for hospitals against damages recovered by patient."
HB38,213404,"Homestead exemption; provide for certain owners of manufactured homes or mobile homes."
HB39,213405,"Budget; prohibit certain actions by state agencies during current and next fiscal years."
HB40,213406,"Income tax; authorize a deduction for contributions to qualified tuition programs."
HB41,213407,"Ad valorem tax; bring forward certain sections of law regarding assessment of property for purposes of."
HB42,213408,"School of the Arts; close at Brookhaven campus and relocate on campus of MUW."
HB43,213409,"School cafeteria workers; provide state funded health insurance on a phased-in basis."
HB44,213410,"Lobbying; prohibit legislator from engaging in for four years after leaving office."
HB45,213411,"Indecent exposure; revise penalties."
HB46,213412,"I.B. Diploma Program; require IHL to grant minimum credit to certain graduates of."
HB47,213413,"Uniform laws; enact Uniform Prudent Management of Institutional Funds Act."
HB48,213414,"Uniform laws; enact Uniform Interstate Deposition and Discovery Act."
HB49,213415,"Uniform laws; enact Uniform Real Property Electronic Recording Act."
HB50,213416,"Euclatubba Road; name bridge over U.S. Highway 45 as the ""Euclatubba Memorial Crossing."""
HB51,213417,"Motor vehicle liability insurance; remove provision allowing penalty reduction if person produces new policy in court."
HB52,213418,"Wireless interactive communication; prohibiting use of by person operating a motor vehicle."
HB53,213419,"Municipal utility districts, certain; place under jurisdiction of the Public Service Commission."
HB54,213420,"Immigration; support our Law Enforcement and Safe Neighborhoods Act of 2011."
HB55,213421,"Uniform laws; create Uniform Adult Guardianship and Protective Proceedings Jurisdiction Act."
HB56,213422,"Personal care home licensure; delete reverter on exemption for private residences in which those services are provided to veterans."
HB57,213423,"Personal care home licensure; extend reverter on exemption for private residences in which those services are provided to veterans."
HB58,213424,"Medicaid; bring forward certain sections for purposes of amendment."
HB59,213425,"Highways; require MDOT install rumble strips along shoulders of newly constructed or resurfaced roadways."
HB60,213426,"Religious Viewpoints Antidiscrimination Act/Schoolchildren's Religious Liberties Act; create."
HB61,213427,"Workers' compensation; revise criteria for drug and alcohol testing, increase benefits for disfigurement, vocational rehab and death."
HB62,213428,"School start date; restrict local school boards from starting school year before Labor Day."
HB63,213429,"Ad valorem tax; exempt business inventories from."
HB64,213430,"Workers' Compensation Law; define purpose to be impartially construed."
HB65,213431,"Uninsured motorist coverage; revise number of vehicles necessary to purchase nonstacking coverage."
HB66,213432,"Pistol or revolver; authorize to carry unless specifically prohibited by law."
HB67,213433,"Habitual offender; no plea bargaining for violent offenders."
HB68,213434,"Controlled substances; felony to bring into state, county or municipal facility."
HB69,213435,"Sales tax and use tax; exempt finance charges from."
HB70,213436,"Income tax; authorize an adjustment to gross income for portion of self-employment taxes paid by self-employed individuals."
HB71,213437,"Sales tax, liability; limit liability if previous Department of Revenue audits determined taxpayer to be in compliance with law."
HB72,213438,"Workers' compensation; increase benefits for disfigurement, vocational rehab and death, allow employer to request autopsy."
HB73,213439,"Workers' compensation; results of drug and alcohol test, employer-administered or otherwise, are admissible for certain purposes."
HB74,213440,"Office of Homeland Security; create within Department of Public Safety."
HB75,213441,"Workers' compensation; clarify the exclusiveness of liability and provide penalties for bad faith claims."
HB76,213442,"Traffic-control devices; require that placement of shall be based on factors relevant to public safety."
HB77,213443,"Mississippi Civil Rights Museum; construct in Leflore County and place under jurisdiction of Department of Archives and History."
HB78,213444,"All-terrain vehicles; establish ownership registration network for."
HB79,213445,"Mississippi Civil Rights Museum; create under Department of Archives and History and issue bonds to construct."
HB80,213446,"Appropriation; IHL for Special Task Force for Revitalization of the Mississippi Delta Region."
HB81,213447,"Medicaid; require testing of applicants and recipients for illegal drugs."
HB82,213448,"Election commissioners; provide that they will be members of the Public Employees' Retirement System."
HB83,213449,"Sales tax; exempt sales of tangible personal property and services to certain organizations providing food to needy persons."
HB84,213450,"Bonds; mandate election on issuing county or municipal bonds."
HB85,213451,"Distinctive license tag; authorize for Silver Star recipient, exempt from privilege taxes, ad valorem taxes and fees."
HB86,213452,"Immunizations; allow parents with bona fide belief that such will harm children to be exempt from requirements."
HB87,213453,"Homestead exemption; increase for persons 65 years of age or older or totally disabled."
HB88,213454,"Water rates for consumers who are within one mile of municipal corporate boundaries; limit."
HB89,213455,"Water rates for consumers who are within one mile of a certain municipal corporate boundary; limit."
HB90,213456,"Water rates for consumers within one mile of municipal corporate boundary and who are not subsidized by municipal ad valorem taxes; limit."
HB91,213457,"Mississippi Dairy Industry Stabilization Act; create."
HB92,213458,"Trusty status; prohibit individual convicted of murder or capital murder from becoming eligible for."
HB93,213459,"State Parole Board; require recommendation be made to Governor either in support or nonsupport of requested pardon."
HB94,213460,"Water, sewer, garbage disposal and fire protection districts; authorize penalties for violations of regulations created by commissioners of."
HB95,213461,"Homestead exemption; increase for persons 65 years of age or older or totally disabled."
HB96,213462,"Income tax; provide a credit for certain energy efficiency improvements to homestead property."
HB97,213463,"Youth taken into custody by law enforcement, certain; require presence of parent before interrogation of youth occurs."
HB98,213464,"Public improvement districts; revise newspaper notice when issuing certificates of public convenience &amp; necessity in certain areas."
HB99,213465,"Economic development financial incentives; require repayment if recipient convicted of certain crimes."
HB100,213466,"Trusty status offenders; revise crimes that make offenders ineligible for additional earned time."
HB101,213467,"Gaming; clarify that wagering on certain athletic events is unlawful."
HB102,213468,"County superintendent of education; change from elected to appointed by school board in certain counties."
HB103,213469,"Totally bedridden nonviolent offenders; authorize placement on conditional medical release by DOC commissioner and medical director."
HB104,213470,"Distinctive motor vehicle license tags; authorize for various purposes."
HB105,213471,"Mississippi Individual On-site Wastewater Disposal System Law; extend repealer on."
HB106,213472,"Livestock facilities; expand organization that may use certain for livestock shows."
HB107,213473,"State agencies; require certain to be open for extended office hours and to assign employees to flexible working hours."
HB108,213474,"Graduate degree teacher incentive loans; establish for teachers agreeing to teach in public schools or IHLs."
HB109,213475,"Bill of Rights for patients and residents of health care facilities; provide."
HB110,213476,"Medicaid and CHIP; redetermination of eligibility for shall be available by mail in hardship cases."
HB111,213477,"Mississippi Code; provide set to each public defender."
HB112,213478,"Sales taxation; exempt retail sales of school supplies during the last weekend in July."
HB113,213479,"Insurance companies; require to offer property and casualty insurance if offered in another state."
HB114,213480,"Tobacco; increase excise tax on all products except cigarettes."
HB115,213481,"Left-hand lane traffic; require to move over when overtaken by vehicle traveling at higher rate of speed."
HB116,213482,"Child endangerment; provide for DUI violations."
HB117,213483,"Radar; authorize sheriffs, deputies and constables to use on county roads to enforce speed limits."
HB118,213484,"Income tax; authorize establishment of catastrophe savings accounts and exempt contributions and distributions from tax."
HB119,213485,"Rest areas, highway; provide that transportation commission shall adopt and enforce parking duration restrictions."
HB120,213486,"Driver's license; provide that retired law enforcement officer may request identifying symbol, character or endorsement."
HB121,213487,"Retirement; allow retired county/city elected officials to receive salary of up to 50% of average compensation."
HB122,213488,"Sales tax; reduce on retail sales of certain food."
HB123,213489,"Youth adjudicated to perform community service, certain; authorize judges to order parents to participate in the service."
HB124,213490,"Automobile insurance; provide that payment of a total loss claim includes payment for certain taxes and fees."
HB125,213491,"Crimes; create offense of using cell phone without hands-free accessories while driving."
HB126,213492,"DUI; revise minimum penalty for death and maiming."
HB127,213493,"Death penalty; provide moratorium for purpose of completing study on impact."
HB128,213494,"Tobacco use by minors; provide penalty for possession."
HB129,213495,"Homestead exemption; increase for totally disabled veterans."
HB130,213496,"Motor vehicle; provide it is unlawful for person under age 18 to ride in portion not designed for passengers."
HB131,213497,"Smoke-Free Air Act of 2011; enact."
HB132,213498,"Death penalty; revise written finding requirements by a jury to impose."
HB133,213499,"Assistant teachers; include under the Education Employment Procedures Law."
HB134,213500,"Gasoline excise tax; increase and use additional revenues for city, county and state highways purposes."
HB135,213501,"Death penalty; require notice of state's intention to seek or reject."
HB136,213502,"Medicaid; provide reimbursement for breast prosthesis and bra after cancer surgery."
HB137,213503,"Forensic evidence; require review of certain cases."
HB138,213504,"Health insurance; require coverage for pregnancy."
HB139,213505,"Income tax; authorize transfer of credit received for rehabilitation of certain historic structures, extend repealer on credit."
HB140,213506,"Sales tax; exempt retail sales of fruits and vegetables."
HB141,213507,"Sales tax; exempt retail sales of exercise equipment to individuals for home use."
HB142,213508,"County road construction and repair; create state funding program to assist."
HB143,213509,"Income tax; provide credit for contributions to school tuition organizations or public schools."
HB144,213510,"Health care providers; provide for a lien on certain third-party payment for services to patient or policyholder."
HB145,213511,"Health insurance; prohibit issuance of policy restricting insurer from assigning benefits to provider."
HB146,213512,"Reappraisal; local taxing units must publish certain information regarding to receive homestead exemption reimbursement."
HB147,213513,"State agency purchases and contracts; require percentage of total expenditures for to be made with disabled veterans."
HB148,213514,"Pharmacy Benefit Prompt Pay Act; transfer Insurance Commissioner's duties to Pharmacy Board."
HB149,213515,"Distinctive license tag; reauthorize issuance to supporters of Rotary International."
HB150,213516,"Internal audit law; remove condition for specific appropriations to fund, and delay implementation date."
HB151,213517,"Mississippi Motor Vehicle Safety Inspection Law; repeal."
HB152,213518,"Distinctive license tag; reauthorize issuance to supporters of the Mississippi Wing of the Civil Air Patrol."
HB153,213519,"Public defenders; create pilot project."
HB154,213520,"Implied consent; refusal appeal to toll suspension for reasonable time to contest."
HB155,213521,"Mississippi Minimum Wage Law; enact."
HB156,213522,"Fair Pay Act of 2011; create to require equivalent pay for equivalent jobs."
HB157,213523,"Internet in schools; require State Board of Education to adopt safety and acceptable usage policy."
HB158,213524,"""Mississippi Postsecondary Textbook Pricing and Access Act of 2011""; create."
HB159,213525,"Employment-at-will doctrine; abolish and create ""Good Faith in Employment Act""."
HB160,213526,"DNA testing; prohibit use of test results for discriminatory purpose."
HB161,213527,"Grandparents' visitation rights; expand availability of."
HB162,213528,"Irreconcilable differences; additional ground for divorce."
HB163,213529,"Mineral rights; revert to surface owner after certain period of time."
HB164,213530,"DUI; repeal provision that refusal to take breath test is evidence of."
HB165,213531,"Nursing homes; require to purchase and maintain a minimum amount of liability insurance."
HB166,213532,"Eminent domain; restrict to direct public use."
HB167,213533,"Criminal penalties; sentence for accessory before the fact cannot be more severe than sentence for the principal."
HB168,213534,"Law enforcement officers, fire fighters and conservation officers; legal to videotape while on duty."
HB169,213535,"Children's products; ban phthalates and other ingredients from."
HB170,213536,"Child support; delinquent payments are still property of custodial parent after child is age 21 or emancipated."
HB171,213537,"""Mississippi Renewable Energy Development Act of 2011""; create."
HB172,213538,"Execution or attachment; revise property exempt from seizure under."
HB173,213539,"Alcohol; increase excise tax and markup on alcoholic beverages, increase excise tax on light wine and beer."
HB174,213540,"Cigarettes; increase excise tax on."
HB175,213541,"Income tax; increase rate of."
HB176,213542,"Budget; State Fiscal Officer shall not reduce funds of Department of Education when state revenues fall below estimate."
HB177,213543,"Controlled Substances Law; revise forfeiture proceedings."
HB178,213544,"DUI; revise license suspension for test refusal if licensee pleads guilty."
HB179,213545,"Elected official; prohibit from changing political party affiliation during term of office."
HB180,213546,"Irrigation wells; require meters to be placed on."
HB181,213547,"Compensation for appointed counsel for indigents; revise."
HB182,213548,"Mississippi Delta Region Revitalization Act of 2006; reenact sections repealed on July 1, 2009, and extend repealer."
HB183,213549,"District attorney; provide additional assistant for the Fourth Circuit Court District."
HB184,213550,"Annexed territory; prohibit municipality from levying ad valorem taxes until services are provided."
HB185,213551,"Municipal annexation; require election on question of."
HB186,213552,"Constables; authorize to be paid after diligent search and inquiry upon unsuccessful service of process."
HB187,213553,"Municipal annexation; require approval by majority of electors in territory to be annexed."
HB188,213554,"""Mississippi Renewable Energy Development Act of 2011""; create."
HB189,213555,"Income tax; exclude active duty military compensation received by a resident while stationed out of state."
HB190,213556,"Mississippi Highway 42; require MDOT to reconstruct a portion in Forrest and Perry Counties to four lanes."
HB191,213557,"Public hearing; require when Governor exercises to grant a pardon for a felony crime."
HB192,213558,"Health insurance; require coverage for treatment of infertility in certain policies."
HB193,213559,"Cities and counties; authorize to donate to court appointed special advocates."
HB194,213560,"College tuition; waive the cost of for individuals age 65 or older."
HB195,213561,"Crimes; create offense of lewd and lascivious acts or obscene electronic communication regarding minors under 16."
HB196,213562,"Domestic violence; allow use of global positioning monitoring system as condition of bond."
HB197,213563,"Murderer; clarify that murderer cannot inherit property of victim."
HB198,213564,"""Comprehensive Election Reform Act of 2011""; create."
HB199,213565,"Criminal records; require permanent storage."
HB200,213566,"Unfair ins. practices; prohibit requirement of mandatory electronic funds transfers for certain payment, as condition to acquiring."
HB201,213567,"Liquefied petroleum gas; allow only owner to fill container."
HB202,213568,"Law enforcement officer; create crime of public intimidation of."
HB203,213569,"Civil actions; provide that P&amp;C insurers have burden of proof for exclusions in ""all perils"" coverage policy."
HB204,213570,"Counties; authorize to work on natural and man-made drainage structures."
HB205,213571,"Ballots in primary elections; require names of all party nominees to appear in each county."
HB206,213572,"Income tax, refund; authorize setoff for unpaid fines and fees owed counties and municipalities."
HB207,213573,"Midwives; provide for licensure of practice of midwifery."
HB208,213574,"Mississippi False Claims Act; create."
HB209,213575,"Distinctive license tag; authorize issuance to supporters of the Mississippi Music Educators Association."
HB210,213576,"I.B. Diploma Program; require IHL to grant minimum credit to certain graduates of."
HB211,213577,"General inmate authority of Department of Corrections; extend repealer on."
HB212,213578,"Prison Industries; extend repealer on prohibition of procurement of certain prison made goods from other states."
HB213,213579,"Public Service Commission; extend repealer on."
HB214,213580,"Expunction; allow for certain felony convictions by first-time offenders."
HB215,213581,"DUI; revise license suspension for test refusal if licensee pleads guilty."
HB216,213582,"Pawnbrokers, title pledge lenders and check cashers; reduce maximum rate of interest that they may charge for their services."
HB217,213583,"House arrest; authorize use as a condition for nonadjudicated sentences."
HB218,213584,"Jurors; revise competency requirements."
HB219,213585,"Bonds; authorize issuance of general obligation bonds for construction of a lake in Alcorn County."
HB220,213586,"Open primaries; establish and abolish partisan primaries."
HB221,213587,"State and local governmental agencies; require to post details of expenditures on website."
HB222,213588,"MS Highway 382; designate certain segment in Monroe County as ""The Gulf Ordinance Plant Memorial Highway""."
HB223,213589,"Drug courts; revise participation requirements."
HB224,213590,"Drug court; court having jurisdiction has final determination about participation in."
HB225,213591,"Workers' compensation; prohibit discharge of employee filing claim in good faith."
HB226,213592,"Homeowners; remove any liability when contractor fails to pay subcontractor."
HB227,213593,"Sexual offenses against children; revise certain provisions."
HB228,213594,"Elections; make various revisions to the state election law."
HB229,213595,"Appellate judges; provide for appointed judges of Supreme Court and Court of Appeals."
HB230,213596,"Elected officials; indictment results in suspension without pay and conviction results in removal."
HB231,213597,"Attempted murder; create criminal offense."
HB232,213598,"Municipal employees; prohibit governing authorities from requiring to reside inside municipal boundaries."
HB233,213599,"Voter identification; require before voting in person or by absentee."
HB234,213600,"School districts; require administrative consolidation into one district per county."
HB235,213601,"Open Lawyer Fees Act; create."
HB236,213602,"Tuition; waive at universities and colleges for children of certain deceased veterans."
HB237,213603,"Photo voter identification; require when a person appears to vote at registrar's office or polling place."
HB238,213604,"Educator sexual misconduct; revise reporting requirements and criminal penalty for such with a student."
HB239,213605,"Limited liability companies; revise fees."
HB240,213606,"Campaign contributions; restrict use by candidate for purposes unrelated to election campaign."
HB241,213607,"Income tax; partially exclude active duty military compensation received by nonresident while stationed in this state."
HB242,213608,"Fishing privileges; authorize reciprocity with adjacent states for persons aged 65 or older."
HB243,213609,"Income tax; exclude active duty military compensation received by a resident while stationed out of state."
HB244,213610,"Ad valorem taxes; school district not required to advertise revenue increase when district proposes no millage increase."
HB245,213611,"Public benefits; deny to any person not lawfully present in the United States."
HB246,213612,"Homestead exemption; increase for totally disabled veterans and extend to unremarried surviving spouses of such veterans."
HB247,213613,"Blood tests; authorize EMTs to administer under Implied Consent Law."
HB248,213614,"Uniform laws; enact Uniform Emergency Volunteer Health Practitioners Act."
HB249,213615,"Homestead exemption; increase for totally disabled veterans and extend to unremarried surviving spouses of such veterans."
HB250,213616,"Bonds; authorize issuance to provide funds for the Mississippi Community Heritage Preservation Grant Fund."
HB251,213617,"MS Highway 370; designate a certain segment of in Lee County as the ""Trooper Steve Hood Memorial Highway""."
HB252,213618,"Early Voting Act; require voting systems only."
HB253,213619,"Distinctive motorcycle license tag; authorize for Purple Heart recipients."
HB254,213620,"First Circuit Court District; provide additional legal assistant."
HB255,213621,"Income tax; authorize a job credit for employers that hire certain unemployed persons."
