bill_number,bill_id,title
HB1665,588558,"Kindergarten; Entrance Age"
HB1666,588571,"Fireworks; Redistribution; Shipper Duties"
HB1667,588534,"State Vehicle Registration Fee; Veterans; Exemption; Report"
HB1668,588606,"Disorderly Conduct; Invasion of Privacy"
HB1669,588568,"Family Court; Judge; Support Staff; Appropriation ($)"
HB1670,588604,"Crime Victim Restitution; Lost Wages; Therapy"
HB1671,588581,"Transient Accommodations Tax; Counties; Revenues"
HB1672,588575,"Board of Education; Public Meetings; Oral Testimony"
HB1673,588548,"Motor Vehicle Driver Licensing; Undocumented Immigrants"
HB1674,588525,"CIP; 35th Representative District ($)"
HB1675,588609,"Department of Education; Student Instructional Hours"
HB1676,588529,"Executive Office on Early Learning; Department of Education; Charter Schools; Public Preschools; Appropriation  ($)"
HB1677,588526,"Hawaii Employer-Union Health Benefits Trust Fund; Medicare"
HB1678,588599,"DLNR; Historic Preservation; Review Exemptions; Residential Property; Inventory of Historic Buildings"
HB1679,588528,"Diamond Head Seawall; Appropriation ($)"
HB1680,588600,"Congress; Members-elect; Vacancies"
HB1681,588566,"Child Health; Early Intervention; Appropriation ($)"
HB1682,588587,"Fetal Alcohol Spectrum Disorder; Appropriation"
HB1683,588579,"Aging Prison Populations; Economic Fiscal Impact; Costs"
HB1684,588578,"Manta Rays; Aggregation Sites; Limitation on Access"
HB1685,588562,"Niihau; Community-Based Subsistence Fishing Area"
HB1686,588574,"DLNR; Opihi; Niihau; Nonresidents; Taking; Rules; Penalties"
HB1687,588557,"Commercial Fishing; Niihau; Shoreline; Prohibited"
HB1688,588597,"Public Lands; Extension of Lease"
HB1689,588544,"UH; Mauna Kea Lands; Lease Revenues; Mauna Kea Lands Management Special Fund"
HB1690,590826,"Appropriation; Public Schools; Noise Control; Air Conditioning ($)"
HB1691,590672,"Privacy; Unmanned Aircraft Systems; Drones; Surveillance; Information Gathering"
HB1692,591373,"Hawaii Tourism Authority; Marketing Plan; Annual Report"
HB1693,591376,"Late Payments; Interest; Adult Day Care Facility; Community Care Foster Family Home; Adult Residential Care Home"
HB1694,591429,"Foster Care; Monthly Board Rate; Appropriation ($)"
HB1695,591368,"Adult Residential Care Homes; Domiciliary Care Facilities; State Supplemental Income"
HB1696,591366,"Charter Schools; Foreign Students; High School Diploma; Tuition"
HB1697,591416,"Office of Youth Services; Safe Places for Youth Pilot Program; Appropriation ($)"
HB1698,591417,"Advanced Practice Registered Nurses; Oral Health Treatment"
HB1699,591397,"Permit Approval; Business; Housing; Administrative Procedure"
HB1700,591346,"State budget. ($)"
HB1701,591434,"Assault; Sports Officials"
HB1702,591344,"Capital Infrastructure Tax Credit; Kapalama Container Terminal Project; Displaced Tenants"
HB1703,591340,"Conveyance Tax; Controlling Interest Transfer"
HB1704,591332,"Tax Credit; Research Activities; Appropriation ($)"
HB1705,591372,"Firefighters; Presumption"
HB1706,591398,"Parking a Vehicle on a Bicycle Lane or Pathway; Fine"
HB1707,592797,"Conservation and Resources; Resource Management; Opihi"
HB1708,592843,"Marijuana; Legalization"
HB1709,593168,"Marijuana; Civil Penalties for Possession of One Ounce or Less"
HB1710,593136,"Counties; Compassion Centers"
HB1711,592755,"Hawaii State Art Museum"
HB1712,592783,"State Bonds"
HB1713,593120,"Aging; Long-term Care Education; Appropriations; Majority Package ($)"
HB1714,593196,"Majority Package; Climate Change Adaptation Planning; Interagency Climate Adaptation Committee; Appropriation ($)"
HB1715,593152,"Office of the Securities Commissioner; Investor Education Programs; Financial Education Programs; Kupuna; Appropriation ($)"
HB1716,592944,"Invasive Species Council; Appropriation ($)"
HB1717,593321,"Retention of Biological Evidence"
HB1718,593368,"Long-term Care Insurance"
HB1719,593367,"Tax Credit; Low-Income Taxpayers"
HB1720,593386,"CIP; 38th Representative District ($)"
HB1721,593292,"Controlled Substances; Marijuana; Schedule II"
HB1722,593333,"Emergency Medical Services; Advanced Life Support Ambulances; Appropriation ($)"
HB1723,593450,"Psychiatric Facilities; Notice of Intent to Discharge"
HB1724,593427,"Adult Residential Care Home; Adult Foster Home; Readmission"
HB1725,593429,"Adult Foster Homes; Community Care Foster Homes"
HB1726,593433,"Corporation Income Tax; Real Estate Investment Trusts"
HB1727,593271,"University of Hawaii; Revenue Bonds"
HB1728,593400,"Disputed Roads; Road Maintenance; Quitclaim"
HB1729,593442,"Dam and Reservoir Removal; Studies; Board of Land and Natural Resources"
HB1730,593283,"SPRB; Pacific Power Group, LLC ($)"
HB1731,593414,"SPRB; Sewage Processing ($)"
HB1732,593315,"Legislative Allowance; Per Diem"
HB1733,593298,"Hawaii Disaster Resilience Plan; Hawaii Disaster Resilience Task Force ($)"
HB1734,593288,"Department of Health; Website Information; Care Homes Inventory ($)"
HB1735,593335,"Goddard Building; Public-Private Partnership; Community Center"
HB1736,593343,"Care Homes; Foster Homes; State Supplemental Income ($)"
HB1737,593326,"Office of Community Services; DLIR; Report; Appropriations ($)"
HB1738,593284,"Care and Foster Homes; Working Group; Transition Oversight"
HB1739,593424,"Caregivers; Minimum Age; Continuing Education"
HB1740,593388,"Statewide Language Access Resource Center; Multilingual Website Pilot Project; Appropriations ($)"
HB1741,593312,"Construction; Revolving Fund; Appropriations ($)"
HB1742,593279,"Hawaii Health Systems Corporation Primary Care Training Program; Appropriation  ($)"
HB1743,593272,"CIP; 23rd Representative District ($)"
HB1744,593403,"University of Hawaii; McNair Student Achievement Program; Appropriation ($)"
HB1745,593383,"Education; Charter Schools"
HB1746,593385,"Department of Education; Department of Health; Interagency Working Group"
HB1747,593448,"Education; Automated External Defibrillators"
HB1748,593390,"Office of Language Access; Language Interpreters; Appropriation ($)"
HB1749,593376,"Office of Language Access; Appropriation; Department of Health ($)"
HB1750,593320,"Violation of Privacy in the First Degree; Disclosure of an Image or Video of Another with the Intent to Harm"
HB1751,593650,"Community Health Centers; Appropriations"
HB1752,593943,"Quality, Cost-effective Healthcare; Appropriations ($)"
HB1753,593983,"Nurses; Nursing; Continuing Education; Licensing; Renewal"
HB1754,593669,"Medicaid Buy-in Program for Workers with Disabilities; Medicaid Buy-in Pilot Program; Appropriation ($)"
HB1755,594218,"Board of Agriculture; Membership; Organic Farming"
HB1756,593844,"Youth; After-school Programs; Resources for Enrichment, Athletics, Culture, and Health Program; Appropriation ($)"
HB1757,593402,"Home Schooling; Extracurricular Activities"
HB1758,593359,"NELHA; Research Advisory Committee; Terms; Limits"
HB1759,593430,"Elections; Voter Identification"
HB1760,593299,"Deposit Beverage Container Program; Lieutenant Governor; Appropriation ($)"
HB1761,593418,"Controlled Substances; Pharmacist; Mail Order Prescriptions"
HB1762,593317,"DHS; Service Dogs; Certification Program; Penalty"
HB1763,593374,"Pharmacy Benefit Managers; Violations; Penalties"
HB1764,593436,"Tax; Studies"
HB1765,594237,"Native Sandalwood; DLNR; Sustainable Forestry; Task Force"
HB1766,594139,"Geothermal Resources Development; Subzones; Public Health Assessments"
HB1767,594178,"Historic Preservation; Phased Reviews"
HB1768,593727,"Counties; Wastewater; Individual Systems"
HB1769,593806,"Invasive Species; Appropriation; Albizia ($)"
HB1770,594022,"Veterans; Driver's License; State Identification Card"
HB1771,593785,"Civil Air Patrol; Appropriation ($)"
HB1772,594002,"GET; Exemption; Patient-Centered Community Care; Veterans Affairs"
HB1773,593863,"Provisional and Drivers Licenses; Requirement Waivers; Out-of-State"
HB1774,593708,"CIP; 24th Representative District ($)"
HB1775,593747,"Remotely Operated Vehicles; Unmanned Aerial Vehicles; Restrictions on Use"
HB1776,593610,"Education; Physical Examination; Appropriation ($)"
HB1777,593493,"Department of Education; Department of Health; Administration of Auto-injectable Epinephrine; Appropriation ($)"
HB1778,593531,"Sexuality Health Education Program; Department of Education"
HB1779,593825,"Youth Suffrage; Age Qualification; Voting"
HB1780,593905,"Appropriation; Department of the Attorney General; Child Support Enforcement Agency ($)"
HB1781,594256,"Youth Suffrage; Age Qualification; Constitutional Amendment (ConAm)"
HB1782,593552,"Guardianships; Minors; Notice"
HB1783,593474,"Tanning Facilities; Tanning Equipment; Notice; Warning Signs; Requirements; Minors; Penalties"
HB1784,594100,"Child Custody; Primary Caregiver Visitation"
HB1785,594081,"Young Adult Defendants; Department of Public Safety; Life Sentences without Parole; Appropriation ($)"
HB1786,594062,"Child Custody; Grandparent Visitation"
HB1787,594275,"Child Support; Child Support Enforcement Agency; Adult Dependent Children; Education"
HB1788,594197,"Flavored Tobacco Products; Tobacco Products; Electronic Smoking Devices; Menthol; Penalties"
HB1789,593688,"Conversion Therapy; Sexual Orientation; Minors"
HB1790,593924,"Office of Youth Services; Safe Places for Youth Pilot Program; Appropriation ($)"
HB1791,593512,"Tobacco; Flavored Tobacco Products"
HB1792,593631,"Board of Regents; Tuition; University of Hawaii"
HB1793,593766,"Good Samaritan Policies; Medical Amnesty; Controlled Substances"
HB1794,593964,"Keiki Caucus; Department of Education; Comprehensive Sex Education"
HB1795,593886,"Keiki, Opio, and Kupuna Trust Fund; Department of Land and Natural Resources; Ecotourism Program; Keiki Caucus; Kupuna Caucus ($)"
HB1796,593590,"Restraint and Seclusion; Public Schools; Appropriation ($)"
HB1797,594159,"Department of Education; Department of Human Services; Voter Registration Information"
HB1798,594041,"Healthy Start; Child Abuse Prevention; Appropriation ($)"
HB1799,594294,"Name Change; Children; Sexual Abuse; Divorce"
HB1800,596831,"Consumer Fireworks; Limited Use for Cultural Events"
HB1801,596756,"Fireworks; Display Permit Fee"
HB1802,597426,"Digital Manufacturing Technology; Firearms"
HB1803,596793,"Law Enforcement Standards Board; Special Fund; Appropriations ($)"
HB1804,597353,"False Statements and Documents; Law Enforcement; Investigation"
HB1805,595364,"Refundable Food/Excise Tax Credit"
HB1806,595812,"Income Tax; Credit; Tax Liability"
HB1807,595177,"Earned Income Tax Credit; EITC; Taxation"
HB1808,597281,"Income Tax Credit; Low-Income Household Renters"
HB1809,596369,"Task Force; Medicaid Payments and Reimbursement; Appropriation ($)"
HB1810,595663,"Typhoon Haiyan; Accelerated Tax Benefits; Taxation"
HB1811,595883,"Department of Transportation; Airport; Concessions"
HB1812,595919,"Law Enforcement; Police Officer; Misconduct; Records Retention"
HB1813,595588,"Airport Hangars; Storage"
HB1814,595701,"Pay Cards; Direct Deposit; Electronic Transfer; Methods of Wage Payment"
HB1815,595325,"Taxation; Inflation Adjustments"
HB1816,596607,"Initiative; Referendum (ConAm)"
HB1817,594878,"Education; Public School Curriculum"
HB1818,596569,"Education; Compulsory Kindergarten"
HB1819,596420,"Child Welfare; Wraparound Services Program; Appropriation ($)"
HB1820,596869,"Health; Health Insurance; Community Navigators"
HB1821,595551,"State Service Fees; Public Notice; Public Hearing"
HB1822,595438,"Religious Freedom; Compelling Interest Test"
HB1823,595739,"Public Lands; Reopening Lease; Mediation; Arbitration"
HB1824,595993,"Kokee State Park Advisory Council; Abolished"
HB1825,596031,"Political Fundraisers; Legislators"
HB1826,595063,"Marriage; Annulment, Divorce, or Separation; Domicile and Physical Presence Requirements"
HB1827,595775,"Unmanned Aircraft Systems"
HB1828,595514,"Public Access Room; Legislative Broadcast Program; Record ($)"
HB1829,597462,"Wild and Feral Pigs; Feeding, Keeping, Breeding, Crossbreeding, or Harboring; Penalty"
HB1830,597664,"Real Estate Appraisers; Arbitration Awards; Recordation; Non-confidentiality"
HB1831,597471,"Chiropractic; Scope of Practice"
HB1832,597475,"University of Hawaii; Tuition; Moratorium"
HB1833,597660,"University of Hawaii; Board of Regents; General Counsel; Audit"
HB1834,597620,"University of Hawaii Manoa; Auditor; System-wide Financial Audit; Appropriation ($)"
HB1835,597474,"Flat Income Tax; Medicaid"
HB1836,597717,"Medical Assistance; Medicaid; Estate Recovery of Assets; Long-Term Care Costs"
HB1837,597678,"Hawaii Health Authority; Appropriation; Chair ($)"
HB1838,597735,"Mandated Coverage; Cognitive Rehabilitation; Brain Injury"
HB1839,597527,"Hawaii Hope Card Program; Protective Orders ($)"
HB1840,597650,"Transportation Study; Appropriation ($)"
HB1841,597493,"Homeless; Hale Kokua Program; Appropriation ($)"
HB1842,597616,"Homelessness; Housing; Homeless Assistance Working Group; Appropriations ($)"
HB1843,597676,"Education; Public School Curriculum; Opt-out"
HB1844,598117,"Suits at Common Law; Jury Trial; Value in Controversy (ConAm)"
HB1845,597572,"Suits at Common Law; Jury Trials; Value in Controversy"
HB1846,597593,"District Court; Jurisdiction"
HB1847,597564,"General Excise Tax; Returns; Electronic Filing"
HB1848,597470,"General Excise Tax; Monthly Returns; Electronic Filing"
HB1849,597570,"Cigars; Tax"
HB1850,597712,"Conveyance Tax; Controlling Interest Transfer"
HB1851,597723,"Dental Services; Dental Health Organizations"
HB1852,597709,"Insurance; Dental; Payment"
HB1853,597680,"Trusts; Diversification; Trust Administration; Trustees; Standards and Performance; Advisors"
HB1854,597705,"Nuisance Abatement; Storage of Personal Property"
HB1855,597545,"University of Hawaii at West Oahu; Sale or Gift of Land"
HB1856,597720,"Motorcycles; Mopeds; Noisy Mufflers; Penalty"
HB1857,597533,"Sexual Assault; Sexual Penetration or Contact by Compulsion; Elements"
HB1858,597590,"Penal Code; Assault; Liquor Commission Investigators"
HB1859,597634,"Sidewalks; Obstructing"
HB1860,597668,"Hawaii Community Development Authority"
HB1861,597592,"Hawaii Community Development Authority; Redevelopment"
HB1862,597728,"Hawaii Community Development Authority; Affordable Housing"
HB1863,597571,"HCDA; Kakaako; Cause of Action; Private Attorney General"
HB1864,597630,"Hawaii Community Development Authority ($)"
HB1865,597625,"Hawaii Community Development Authority; Kakaako; Auditor Study"
HB1866,597586,"Hawaii Community Development Authority"
HB1867,597669,"Kakaako Community Development District; Prohibitions"
HB1868,597498,"School Buildings; Emergency Shelters ($)"
HB1869,597622,"Appropriation; Emergency and Budget Reserve Fund ($)"
HB1870,597602,"Residential Backup Generator Tax Credit"
HB1871,597520,"Hurricane Reserve Trust Fund; Appropriation ($)"
HB1872,597576,"Fix Hawaii's Schools Act ($)"
HB1873,597599,"Use Tax; Increase; Agribusiness Development Corporation; Acquisition and Management of Agricultural Lands ($)"
HB1874,597515,"UHERO; Pay Forward, Pay Back; Pilot Program; Appropriation ($)"
HB1875,597558,"Host Municipality Benefit Fees; Landfills"
HB1876,597525,"Fees; Department of Commerce and Consumer Affairs"
HB1877,597648,"Workforce Development Act; University of Hawaii; Appropriation"
HB1878,597484,"Interconnection Fees; Public Utilities Commission; Solar Energy"
HB1879,597671,"Solar Shade Control; Solar Energy Systems; Private Nuisance"
HB1880,597579,"Podiatrists; Podiatry; Surgery; Definitions"
HB1881,597577,"Center for Nursing; Advisory Board; Members; Powers and Duties"
HB1882,597646,"Podiatrists; Podiatry; Minimum Residency Requirements; Licensure"
HB1883,597694,"Veterans Treatment Court; Appropriation ($)"
HB1884,597529,"Comprehensive Sexuality Education"
HB1885,597702,"Sand Island State Recreation Area; Appropriation ($)"
HB1886,597711,"Housing; Appropriations ($)"
HB1887,597726,"Motor Vehicle Insurance; Uninsured Motorist Identification Database Program ($)"
HB1888,597614,"Fish Labeling; Fines; Special Fund ($)"
HB1889,597626,"Homeless Persons; Bill of Rights"
HB1890,597684,"Minimum Wage; Employment"
HB1891,597539,"Welfare Overpayment Recovery; Investigators and Recovery Workers; Appropriation ($)"
HB1892,597706,"Recovery of Public Assistance Overpayments; Maximum Recovery"
HB1893,597672,"Income Tax; Check-off Box; Disaster Response Special Fund"
HB1894,597707,"Car-sharing Vehicle Surcharge Tax"
HB1895,597689,"Driver License Reciprocity with Foreign Countries"
HB1896,597575,"Mobile Electronic Devices"
HB1897,597635,"Public Lands; Banyan Drive Lessees"
HB1898,597639,"Uniform Commercial Code; Sales; Express Warranties"
HB1899,597670,"CIP; 2nd Representative District ($)"
HB1900,597494,"Destination Club Membership Plan; Taxation"
HB1901,597540,"Interstate Wildlife Violator Compact; Task Force"
HB1902,597724,"DLNR; Hunting; Hunting Advisory Commission; Report; Appropriation ($)"
HB1903,597547,"Outdoor Heritage Month; Established"
HB1904,597550,"Invasive Species Hawaii; Invasive Species Council; Appropriation ($)"
HB1905,597644,"DLNR; Hawaii Hunting Apprentice Permit; Children"
HB1906,597496,"Kawaiahae Small Boat Harbor-North Basin; Puako Boat Ramp; Appropriation ($)"
HB1907,597693,"Hunting License; Disabled Veterans"
HB1908,597729,"Land Use Commission; Conflict of Interest"
HB1909,597585,"Boards and Commission Membership; Gender Equity"
HB1910,597645,"Disabled Persons; Bill of Rights"
HB1911,597487,"DLNR; Fishing; Fishing License; Study; Appropriation ($)"
HB1912,597562,"Marine Fishing; Licenses; Special Fund ($)"
HB1913,597531,"Environmental Response Revolving Fund; Audit"
HB1914,597734,"Historic Property; Public Lands"
HB1915,597546,"Agricultural Employee Housing; Exemptions"
HB1916,597696,"Appropriation; Hawaii Association of Conservation Districts ($)"
HB1917,597697,"General Obligation Bonds; Agriculture; Galbraith Estate"
HB1918,597483,"Agricultural Land Use; Agricultural Tourism; Educational Retreat"
HB1919,597721,"Counties; Kupuna Retreat Education Act for Teaching Ecology"
HB1920,597528,"Department of Land and Natural Resources; Annual Reports"
HB1921,597518,"Aquatic Life; Marine Waters; Shoreline"
HB1922,597731,"Transportation; Mopeds; Mufflers; Noise Control"
HB1923,597700,"Condominium; Notice"
HB1924,597560,"Council on Revenues; Interdepartmental Research Task Force; Appropriation ($)"
HB1925,597601,"Youth Risk Behavior Survey; Appropriation ($)"
HB1926,597595,"Prostitution; Sex Crimes"
HB1927,597491,"Cybertrafficking; Indecent Advertising"
HB1928,597468,"Juvenile Prostitution; Pilot Program; Established; Appropriation ($)"
HB1929,597643,"Agriculture; Farmers' Markets; General Excise Tax; Exemption"
HB1930,597611,"Veterinary Medicine; Criminal Penalties; Pet Animals"
HB1931,597536,"Macadamia Nut Trees; Macadamia Felted Coccid; Agriculture; Appropriation ($)"
HB1932,597481,"Biosecurity Program; Department of Agriculture; Appropriation ($)"
HB1933,597633,"4-H; University of Hawaii; College of Tropical Agriculture and Human Resources; Organic Garden; Appropriation ($)"
HB1934,597478,"Homelessness; Housing; Homeless Assistance Working Group; Appropriation ($)"
HB1935,597485,"Appropriation; Housing Omnibus; Affordable Housing ($)"
HB1936,597507,"Taxation; Low-Income Tax Credit; Earned-Income Tax Credit; Refundable Food/Excise Tax Credit; Low-income Household Tax Credit"
HB1937,597511,"Hawaii Health Systems Corporation; Structural Reform ($)"
HB1938,597667,"Measurement Standards; Measurement Rules; Adoption; Ethanol-blended Fuel"
HB1939,597583,"Clean Energy Initiative; Renewable Portfolio Standards"
HB1940,597523,"Solar Energy Devices; Installation; Court Action; Attorney's Fees; Warranty."
HB1941,597686,"Environmental Impact Statements; Climate Change; Sea Level Rise"
HB1942,597652,"Special Purpose Revenue Bonds; Princeton Energy Group or Related Special Purpose Entity; Renewable Energy Project; Energy Storage Technology ($)"
HB1943,597651,"Grid Modernization; Hawaii Electric System; Public Utilities Commission; ($)"
HB1944,597535,"Procurement; Civil Rights Compliance; Public Contracts"
HB1945,597673,"Transportation; Electric Bicycle; Bicycle"
HB1946,597549,"Pulse Oximetry Screening; Congenital Heart Defects; Birthing Facilities; Newborns; Appropriation ($)"
HB1947,597479,"School Impact Fees; Exemption; Reduction"
HB1948,597654,"Epinephrine Auto-Injectors"
HB1949,597532,"Epinephrine Auto-Injectors; Use in Schools"
HB1950,597501,"Seawater Air Conditioning District Cooling Systems; Enterprise Zones"
HB1951,597627,"Special Purpose Revenue Bond; SPRB; Seawater Air Conditioning ($)"
HB1952,597506,"University of Hawaii; Asian Americans; Pacific Islanders; Appropriation ($)"
HB1953,597502,"University of Hawaii; Appropriation; Student Employees ($)"
HB1954,597980,"Civil Service"
HB1955,597891,"Collective Bargaining Cost Items; Bargaining Unit (14); Appropriations ($)"
HB1956,597901,"Collective Bargaining Cost Items; Bargaining Unit (6); Appropriations ($)"
HB1957,597938,"Office of Talent Management; Human Resources; Appropriation ($)"
HB1958,597756,"Overtime Compensation; Public Works"
HB1959,597778,"Weighted Student Formula; Minimum Staffing Requirements"
HB1960,597869,"Workers' Compensation Insurance; Motor Vehicle Insurance; Drug Pricing"
HB1961,597761,"Workers' Compensation; Medical Examinations; Mutual Agreement"
HB1962,598045,"Workforce Development; Technical Amendment"
HB1963,598070,"EUTF; Technical Amendment"
HB1964,598074,"Pensions; Technical Amendment"
HB1965,597795,"Labor; Technical Amendment"
HB1966,598095,"Public Employees; Civil Service Exemption; State Auditor"
HB1967,597939,"University of Hawaii at Hilo; Hawaii Community College; Aeronautical Training Programs; International Flight Training Center; Appropriation ($)"
HB1968,597907,"Public Lands"
HB1969,598079,"Water; State Aquifer Royalty"
HB1970,598063,"Geothermal Mining; Royalties"
HB1971,598022,"Civil Service Status; Employee Rights; Charter Schools ($)"
HB1972,598018,"Office of Language Access; State Employees; Proficiency in Languages Other than English ($)"
HB1973,597993,"Workers' Compensation; Penalty; Temporary Partial Disability Benefits; Eligibility Determination"
HB1974,597900,"Workers' Compensation Medical Fee Schedule; Appropriation ($)"
HB1975,597860,"Criminal History Record Checks; State and County Employees"
HB1976,597850,"Public Works; Wage and Hour Law; Special Fund; Appropriation ($)"
HB1977,598052,"Collective Bargaining; Arbitration"
HB1978,597884,"Civil Service"
HB1979,597831,"Public Officers and Employees Excluded from Collective Bargaining; Salaries and Benefits"
HB1980,597927,"Civil Service"
HB1981,597914,"Judicial Court Calendars; Priority for Child Victims of Serious Crimes"
HB1982,598041,"Video Evidence of Child Victims"
HB1983,597992,"Silver Alert System; Senior Citizens; Safety; Missing Persons"
HB1984,597983,"United States Military Veteran Designation; Driver's License or License Renewal"
HB1985,598005,"Ethics; Disclosure; Financial Interests"
HB1986,597774,"Income Tax Exclusion; Military"
HB1987,598118,"Raw Milk; Agriculture; Public Health; Cow, Goat, Sheep Shares"
HB1988,598067,"Hawaii Farm to School Program; Farm to School Coordinator; Appropriation ($)"
HB1989,597951,"Agriculture; Pilot On-farm Training Program for Mentors; College of Tropical Agriculture and Human Resources ($)"
HB1990,597875,"DOA; Hawaii Good Agricultural Practices Program; Appropriation ($)"
HB1991,598120,"Procurement Code Exemption; Fresh Meat and Produce and Animals and Plants"
HB1992,597752,"Cottage Food; Cottage Food Operations; Permits; Registration"
HB1993,597856,"Domestic Violence; Abuse of Family or Household Member; Mandatory Reasonable Inquiry; Mandatory No-Contact Period; Presence of a Minor; Class C Felony"
HB1994,597743,"Invasive Species; Civil Liability; Intrastate Transport; Task Force; Appropriation ($)"
HB1995,597786,"Appropriation; Department of Education; Lahainaluna High School Boarding Program ($)"
HB1996,597740,"Maui Food Innovation Center; University of Hawaii Maui College; General Obligation Bonds ($)"
HB1997,597868,"Department of Energy; Established"
HB1998,597863,"Cable Television Systems; Public, Educational, and Governmental Access Channels; DCCA"
HB1999,597953,"Electric Utilities; Franchise; Legislative Utility Review Task Force"
HB2000,598035,"Taxation; Depreciation; Net Operating Loss Deductions"
HB2001,597966,"Automatic Voter Registration Upon Issuance of Civil Identification Card or Driver's License"
HB2002,597812,"Land Court; Master Certificate of Title; Common Interest Communities"
HB2003,597809,"Cybersecurity; Coordinator; Established ($)"
HB2004,597947,"Cable Television Systems; Access Organizations; Public Educational, and Governmental Channels"
HB2005,597741,"Securities and Commodities Exchange; Establishment"
HB2006,598068,"Discrimination in Public Accommodations; Religious Organizations"
HB2007,598111,"Appropriation; University of Hawaii; Local and Immigrant Farmer Education Program ($)"
HB2008,598115,"Agriculture; Future Farmers of America Program; Appropriation ($)"
HB2009,597780,"Milk Control Special Fund; Milk Control Act"
HB2010,597767,"Agricultural Loans; Biosecurity Loans"
HB2011,597797,"Acquisition of Oahu Agricultural Lands; Agribusiness Development Corporation; Appropriation ($)"
HB2012,598023,"Event Ticket Sales Practices; Ticket Scalping; Price Limitations; Website Sales Requirements; Disclosures; Remedies; Unfair and Deceptive Practices; Circumvention of Online Ticket Purchase Processes"
HB2013,598046,"Short Form; Energy"
HB2014,597887,"Short Form; Hawaii Health Connector"
HB2015,597894,"General Excise Tax; Certificate of Ownership Fee; Insurance"
HB2016,597798,"Income Tax; Exemption; Substitute Teachers; Settlement"
HB2017,597815,"Condominiums; Condominium Projects; Agricultural Uses and Activities"
HB2018,597959,"Time Shares; Disclosure Statement; Nonprofit Entities; Not-for-profit Entities; Foreign Time Share Plans"
HB2019,597837,"Time Share; Disclosure Statement; Electronic Documents; Renewal Registration; Developers"
