bill_number,bill_id,title
SB1179,584920,"Correctional Facilities; Involuntary Medical Treatment"
SB1181,583714,"Committed Persons on Furloughs"
SB1182,584593,"Department of Public Safety; Judiciary; Service of Process"
SB1186,585332,"Transient Accommodations Tax; Penalties"
SB1189,583943,"Tax Fraud"
SB1195,583884,"General Excise Tax Exemption for Certain Scientific Contracts With the United States"
SB1198,583653,"Renewable Energy Technologies Income Tax Credit"
SB1199,583654,"Unlawful Disclosure of Tax Returns and Tax Return Information"
SB1200,584761,"Taxation; Unauthorized Inspection of Tax Returns and Tax Return Information"
SB1201,583767,"Transient Accommodations Tax"
SB1202,584258,"Transient Accommodations Tax"
SB1204,585441,"Estate and Generation-Skipping Transfer Tax; Conformity to Certain Internal Revenue Code Provisions; Public Law 112-240"
SB1205,583886,"Income Tax; Conformity to certain Internal Revenue Code Provisions; Public Law 112-240"
SB1208,584462,"Transportation; Federal Regulations; Conformity"
SB1210,585009,"Harbors; Indemnification"
SB1211,584564,"Highway Safety; Use of Mobile Electronic Devices"
SB1212,584894,"State Fuel Tax"
SB1213,586401,"Department of Transportation; Franchise Utility"
SB1215,585872,"Non-agricultural Park Lands; Bids"
SB1216,583919,"Agricultural Task Force; Appropriation ($)"
SB1217,585462,"CIP; Twenty-Fifth Senatorial District ($)"
SB1218,586423,"Medical Marijuana; Department of Health; Transfer"
SB1219,586615,"Prescriptive Authority; Psychologists; Pilot Program"
SB1220,585431,"Hawaii Health Systems Corporation; Training Program; Appropriation ($)"
SB1222,585236,"Transient accommodations tax; exemption."
SB1223,583878,"Electronic monitoring; sexual assault of a minor; sentencing."
SB1224,584960,"Counties; Land Use; Accessory Dwelling Units"
SB1225,586482,"Insurance; Reimbursement for Benefits; Recoupment"
SB1226,585633,"Family Court; Child Custody Evaluators"
SB1227,585394,"Mandated Coverage; Cognitive Rehabilitation; Brain Injury"
SB1228,583587,"Hawaii Public Housing Authority; Definition of Public Housing Project"
SB1229,583917,"Autonomous Motor Vehicles; Department of Transportation; Operation and Licensing"
SB1230,585924,"Government Motor Vehicles; Use Exceptions; Board of Water Supply"
SB1231,585684,"Medicaid; Reimbursement Policies"
SB1232,586323,"Private Guards"
SB1233,584402,"Employment; Leave of Absence; Organ, Bone Marrow, or Peripheral Blood Stem Cell Donation"
SB1234,584679,"High Technology Innovation Corporation; Hawaii Public Procurement Code"
SB1235,584600,"Cable Television; Hawaiian Language Content; Appropriation ($)"
SB1236,586435,"Infrastructure; Fiber Optic Cable; Condominiums; Planned Communities"
SB1237,586066,"Nursing Facility Sustainability Program; Nursing Facility Sustainability Program Special Fund ($)"
SB1238,584391,"Health; Medical Research; Maternal Mortality Review Panel ($)"
SB1239,584052,"Laiopua 2020; Appropriation ($)"
SB1240,584958,"Keiki Dental Health Coverage; Health Connector"
SB1241,584205,"Health Care Transformation Program; Department of Commerce and Consumer Affairs"
SB1242,584779,"Hawaii Community Development Authority; Kakaako Community Development District"
SB1243,583615,"Special Purpose Revenue Bonds; United States Citizenship and Immigration Service designated EB-5 Regional Center; Important Agricultural Lands ($)"
SB1244,585255,"Special Purpose Revenue Bonds; United States Citizenship and Immigration Service designated EB-5 Regional Center; Important Agricultural Lands ($)"
SB1245,585727,"Special Purpose Revenue Bonds; United States Citizenship and Immigration Service designated EB-5 Regional Center; Important Agricultural Lands ($)"
SB1246,584840,"University of Hawaii-West Oahu; Nisei Legacy Center; Appropriation ($)"
SB1247,585442,"Collective Bargaining; Prohibited Practices; Public Employment; Bad Faith"
SB1248,586183,"Collective Bargaining; Public Employment; Labor Relations Board; Deadlines for Decisions"
SB1249,585424,"Compensation of Trustees"
SB1250,585289,"Gaming; Bingo; Raffles; Licensing; Recreation Activities Control Board"
SB1251,584122,"Lottery; Commission ($)"
SB1252,585805,"Circuit Court Clerk Electronic Citation Fund; Fee"
SB1253,583596,"Parole; Structured Community Placement; Non-violent Female Offenders"
SB1254,583670,"Emergency Medical Care; Appropriation ($)"
SB1255,585637,"Emergency Medical Services; Appropriation ($)"
SB1257,584508,"Contractors; Licensure Requirements"
SB1258,586388,"Real Estate Appraisers; Arbitration Awards; Recordation"
SB1259,583869,"Freedom of Information; Significant Privacy Interests"
SB1260,584200,"Advertising and Marketing; Place of Origin; Beer"
SB1261,584370,"Liquor Tax; Small Breweries and Brewpubs"
SB1262,584178,"Host Municipality Benefit Fees; Landfills"
SB1263,584143,"Meal Breaks; Employees"
SB1264,585487,"Wellness Programs; Participants"
SB1266,583770,"Motor Vehicle Insurance"
SB1267,586570,"Hawaii Health Systems Corporation; Health Care; Non-Public Status"
SB1268,584292,"Lieutenant Governor; Allowance for Expenses"
SB1269,585207,"Taro; Land; Protection"
SB1270,584368,"Taro Security and Purity Task Force"
SB1271,586618,"Glass Container Recovery; Deposit Beverage Container Program; Definitions"
SB1272,585497,"Employment Security; Contribution Rate Schedules; Schedule F"
SB1273,585539,"Economic Development; Academy for Creative Media; Appropriation ($)"
SB1274,584102,"Roads in Limbo; Liability for Maintenance"
SB1275,586267,"Kahoolawe Island Reserve Commission; Procurement Exemption"
SB1276,583810,"Mixed Martial Arts; Permit Requirements"
SB1277,583940,"Charter Schools; Collective Bargaining"
SB1278,584244,"Hawaii Educational Policy Center; Appropriation ($)"
SB1279,584707,"University of Hawaii; Revenue Bonds"
SB1281,585657,"Kahilu Theatre; Appropriation ($)"
SB1282,585532,"Unlicensed Contacting Offenses; Unlicensed Activity"
SB1283,585877,"Irrigation; General Obligation Bonds; Appropriation ($)"
SB1284,585310,"Food Sustainability; Department of Agriculture ($)"
SB1285,586502,"Hazardous Recreational Activity; Government Agencies; Private Landowners; Limited Liability"
SB1286,586405,"Landowners' Liability"
SB1287,585342,"Public Safety; National Guard; Income Tax Credit"
SB1288,586613,"Family Leave; Siblings"
SB1289,585113,"Taxation; Construction Services; Non-Wage Payments"
SB1290,586446,"Labeling; Genetically Engineered Whole Food"
SB1291,585485,"Public Utilities; Net Energy Metering"
SB1292,583813,"Constitutional Amendment; Marriage (ConAm)"
SB1293,584266,"Contractors; Electrical Work; Licensing Requirements"
SB1294,585459,"Legislative Officers and Employees; Appropriation ($)"
SB1295,585254,"Boards and Commissions; Gender Equity"
SB1296,584220,"Department of Education; Electronic-based Curriculum Tools Pilot Program; Appropriation ($)"
SB1297,586298,"Parks; Public Lands; Counties; DLNR; Advisory Task Force"
SB1298,585899,"Six-Year Program and Financial Plan; Operating Costs for Capital Improvements"
SB1299,583623,"State Highways; Transfer to Counties; Task Force"
SB1300,583990,"Public Workers; Overpayment; Garnishment"
SB1301,584540,"Electricians and Plumbers; Journey Worker Air Conditioning and Refrigeration Plumber; Journey Worker Fire Sprinkler Plumber; Licensing; Continuing Education"
SB1302,585674,"Workers' Compensation; Repackaged Medications and Compounded Medications"
SB1303,585914,"CIP; 24th Senatorial District ($)"
SB1304,584621,"General Obligation Bonds; City and County of Honolulu; Sewer Infrastructure; Appropriation ($)"
SB1305,586593,"Permeable Surfaces; Water Infiltration; Tax Credit; Tax Deduction"
SB1306,584727,"Hawaii Health Systems Corporation; Health Care; Non-Public Status"
SB1307,583650,"Health; Tobacco Products Tax"
SB1308,586021,"Evidence; Apology; Health Care Providers"
SB1309,586219,"Traumatic Brain Injuries; Helmets; All-terrain Vehicles; Motorcycles; Mopeds; Motor Scooters"
SB1310,586277,"Education; Industrially Produced Trans Fat; Appropriation ($)"
SB1311,585413,"CIP; 8th Senatorial District ($)"
SB1312,585379,"Hawaii Health Systems Corporation"
SB1313,586394,"EB-5 Loan; Repayment From General Excise Tax Revenues"
SB1314,585828,"Feed-in Tariffs."
SB1315,584353,"Power of Arrest; Federal Officers"
SB1316,585749,"Internet Dating Services; Safety Awareness Notification"
SB1317,583620,"Japanese American Experience in Hawaii; Nisei Veterans Legacy Center; Honouliuli Internment Camp Educational Center; Appropriation; Matching Funds ($)"
SB1318,585851,"Japanese American Experience in Hawaii; Nisei Veterans Legacy Center; Honouliuli Internment Camp Educational Center; Appropriation; Matching Funds ($)"
SB1319,585701,"Particulate Matter; Road Pollution; Motor Vehicles"
SB1320,584360,"Fishing; Prohibit; Parrot Fish"
SB1321,585756,"Identification; Merchants; Policy; Controlled Substances"
SB1322,585818,"Historic Preservation; Income Tax Credit"
SB1323,585422,"Tax Credits; Small Businesses; Full-time Employees"
SB1324,586537,"Education; Charter Schools"
SB1325,585691,"CIP; 16th Senatorial District ($)"
SB1326,586545,"Rooftop Agricultural Production ($)"
SB1327,584125,"Cacao; Labeling Requirements"
SB1328,585957,"Department of Defense; Civil Air Patrol; Appropriation ($)"
SB1329,585664,"Labeling of Genetically Engineered Whole Foods; Private Civil Enforcement"
SB1330,585076,"Community-based Renewable Energy Program; Facilities"
SB1331,583665,"State Payments; Hawaii Electronic Benefit Transfer System; Direct Deposit"
SB1332,586418,"Intoxicating Liquor; Caffeine; Prohibitions"
SB1333,585386,"Elections; Elections Commission; Chief Election Officer"
SB1334,584625,"Retailers; Customer Service and Support; Disclosure"
SB1335,584139,"General Excise Tax; Use Tax"
SB1337,585193,"Gambling; Wellness Programs; Health Insurance"
SB1338,584632,"Hawaiian Language; Prekindergarten; Department of Human Services; Department of Education; Appropriation ($)"
SB1341,585445,"Landfills; Leeward Coast; Moratorium"
SB1342,584246,"Petty Misdemeanor; Forfeiture"
SB1343,583696,"Adequate Highway Capacity Requirement; Highways; Housing"
SB1344,584437,"CIP; Seventeenth Senatorial District ($)"
SB1345,586578,"Constitutional Amendment; Lieutenant Governor; Appointment; Elections; Governor (ConAm)"
SB1346,583959,"Lieutenant Governor; Allowance for Expenses"
SB1347,585676,"Order of Succession; Lieutenant Governor"
SB1348,583695,"Stroke; Hospitals; Health Care Facilities; Recognition; Advertising; Stroke Data Collection and Reporting"
SB1350,585862,"Board of Education; School Safety; Bullying; Behavioral Intervention"
SB1351,586524,"Personal Information Protection; Unlawful Use of Hawaii Identification Card or Drivers' License"
SB1352,584720,"Campaign Spending Commission; Partial Public Financing ($)"
SB1353,586381,"University of Hawaii at Hilo; Hawaiian Language; Appropriation ($)"
SB1354,586337,"ERS; Post-Retirement Allowance"
SB1355,584514,"Hawaii Health Systems Corporation Board; Composition"
SB1356,585042,"Workers Cooperative Association; Incorporation; Business Registration"
SB1357,585844,"Liability; Road Maintenance; Disputed Roads"
SB1358,583638,"Molokai Irrigation System; GO Bonds ($)"
SB1359,586513,"Non-violence and Peace Awareness Month; October"
SB1361,585030,"Banyan Drive; DLNR; Community Development Board"
SB1362,583592,"CIP; 4th Senatorial District ($)"
SB1363,584155,"CIP; 11th Senatorial District ($)"
SB1364,583798,"University of Hawaii; General Obligation Bonds; Appropriation ($)"
SB1365,583664,"Collective Bargaining; University of Hawaii; Graduate Students"
SB1366,583900,"Private Investigators and Guards; Registration, Instruction, and Training Requirements"
SB1367,586448,"University of Hawaii; Procurement; Exemption"
SB1368,584898,"Condominiums; Real Estate Commission; Enforcement Action"
SB1369,585715,"Marriage; Marriage Equality"
SB1370,584906,"Mortgage Foreclosures; Judicial Foreclosure Actions for Residential Property; Mandatory Dispute Resolution; Mediation"
SB1371,583693,"Small Boat Harbors; Native Hawaiian Canoes"
SB1372,584223,"DLNR; Lipoa Point; Land Acquisition; Appropriation ($)"
SB1373,583616,"Collective Bargaining; Hawaii Employer-union Health Benefits"
SB1374,585387,"Collective Bargaining; Union Dues"
SB1375,584350,"Collective Bargaining; Impasse; Arbitration"
SB1376,584884,"Lottery; DCCA"
SB1377,583673,"Vital Records; Reporting Deaths to State Agencies"
SB1378,584982,"Department of Education; Diabetes; Students; Appropriation ($)"
SB1379,584541,"Elections; Advertising; Communications Media; Fact-finder's Report"
SB1380,586629,"Procurement; Past Performance; Criteria"
SB1381,583829,"Health; General Excise Tax; Farmer; Fresh Farm Produce; Retail Sales"
SB1382,585723,"CIP; Fourteenth Senatorial District ($)"
SB1383,586552,"University of Hawaii; Department of Accounting and General Services; Procurement; Construction Contracts"
SB1384,584880,"University of Hawaii; Board of Regents; General Counsel; Audit"
SB1385,584730,"University of Hawaii; Board of Regents; Sunshine Law; Open Records Law; Training"
SB1386,586114,"University of Hawaii; Board of Regents; Financial Disclosure"
SB1387,584605,"University of Hawaii; Board of Regents; Regents Candidate Advisory Council; Governor"
SB2001,584393,"Child Protective Act; Investigation; Interview; Recording"
SB2002,586436,"Child Protective Proceedings; Open Hearings; Records"
SB2003,584442,"Child Abuse or Neglect; Parents and Guardians; Reports; Notice; Rights; Department of Human Services"
SB2004,583578,"Home Care Licensing; Extension; Appropriation;  ($)"
SB2005,584371,"Home Care Licensing; Appropriation ($)"
SB2006,583836,"Adult Foster Homes; Certified Caregiver; Dual Certification"
SB2007,584182,"Air Pollution Control; Crematoriums; Mercury; Filters"
SB2008,584796,"Deposit Beverage Container Program; Appropriation ($)"
SB2009,586087,"Community Health Centers; Appropriations; Federally Qualified Health Centers ($)"
SB2010,585031,"Vendors; Concessions; Public Property"
SB2011,585306,"University of Hawaii; School of Physical, Occupational, and Speech Therapy"
SB2012,585242,"Elections; Ballots"
SB2013,584665,"Tax; Wholesale"
SB2014,584544,"Transient Accommodations Tax; Resident Owner Exemption"
SB2015,584502,"Youth Suffrage; Age Qualification; Voting"
SB2016,583974,"Youth Suffrage; Age Qualification; Constitutional Amendment (ConAm)"
SB2017,585153,"Student Health and Safety; Anaphylaxis; Emergency Administration of Epinephrine"
SB2018,586334,"Water Pollution; Unlimited Liability; Hazardous Substances"
SB2019,585369,"School Meals; Nutritional Information"
SB2020,585718,"Agricultural Foreign-trade Zone; Economic Development; Establishment"
SB2021,584469,"Resisting Arrest in the First Degree"
SB2022,585866,"Child Support; Adult Child; College"
SB2023,585794,"Small Claims Court"
SB2024,586126,"Animal Welfare; Import and Sale of Ivory; Elephants"
SB2025,585855,"Penal Code; Abuse of Family or Household Member; Mandatory Reasonable Inquiry; Mandatory No-Contact Period"
SB2026,583762,"Penal Code; Animal Cruelty; Slaughter or Trafficking of Dogs or Cats for Human Consumption"
SB2027,584364,"GO Bond; Department of Public Safety; New Correctional Facility; Appropriation ($)"
SB2028,583907,"Grant-In-Aid; Honolulu Prosecuting Attorney; Appropriation ($)"
SB2029,585964,"Tobacco Sales; Age Restriction"
SB2030,583698,"Health; Cigarette Tax"
SB2031,584297,"Centers for Medicare and Medicaid Services; Physical Presence; Durable Medical Equipment"
SB2032,586586,"Assault in the Second Degree; Medical Services Providers"
SB2033,586317,Dentists
SB2034,585398,"Dental Services; Dental Health Organizations"
SB2035,585713,"Hawaii Health Authority; Appropriation; Chair ($)"
SB2036,584173,"Agricultural Land; Agribusiness Development Corporation; Appropriation ($)"
SB2037,584684,"Farming Technique Mentor Program; Agriculture; Appropriation ($)"
SB2038,585174,"University of Hawaii, CTAHR; Appropriation ($)"
SB2039,585022,"College of Tropical Agriculture and Human Resources at the University of Hawaii; Appropriation ($)"
SB2040,586439,"PUC; Preferential Energy Rates; Agricultural Activities"
SB2041,585865,"General Excise Tax; Increase; Agribusiness Development Corporation; Acquisition and Management of Agricultural Lands"
SB2042,586326,"Puerto Rican Cultural Exchange Commission; Appropriation ($)"
SB2043,585426,"Emergency Medical Ambulance Services"
SB2044,585364,"Energy Resources; Solar Energy Devices; Solar or Photovoltaic Shingles; Private Entities"
SB2045,585247,"Colorectal Cancer Screening Pilot Program; Appropriation ($)"
SB2046,583590,"Hawaii Employers' Mutual Insurance Company; Oversight Council"
SB2047,583577,"Real Estate Appraisers; Arbitration Awards; Recordation; Openness; Transparency"
SB2048,586416,"Cable Television Systems; Access Organizations; Public, Educational, and Governmental Channels"
SB2049,584062,"Dog Owners; Civil Liability"
SB2050,585159,"Firearms; Registration"
SB2051,585582,"Liquor; Gallonage Tax"
SB2052,585728,"Medical Apology; Rules of Evidence"
SB2053,586592,"Use of Intoxicants While Operating a Vehicle"
SB2054,584733,"Actuarial Analysis; Screening, Diagnosis, and Treatment; Autism Spectrum Disorders; Appropriation ($)"
SB2055,584558,"Health; Narcotic Drugs; Controlled Substances Act; Prescriptive Authority"
SB2056,585747,"Hospital Sustainability Program; Hospital Sustainability Program Special Fund; Appropriation ($)"
SB2057,586245,"Nursing Facility Sustainability Program; Nursing Facility Sustainability Program Special Fund; Appropriation ($)"
SB2058,583689,"Hawaii Health Corps' Hawaii Rural Health Care Provider Loan Repayment Program; University of Hawaii; John A. Burns School of Medicine; Appropriation ($)"
SB2059,586619,"Judiciary; Family Court; Children; Guardians Ad Litem; Mediation; Child Custody"
SB2060,584147,"Appropriation; Department of the Attorney General; Child Support Enforcement Agency ($)"
SB2061,584318,"Nurses; Nursing; Continuing Education; Licensing; Renewal"
SB2062,585878,"Natural Area Reserve Fund; Watershed Protection; Appropriation ($)"
SB2063,585450,"CIP; 3rd Senatorial District ($)"
SB2064,585526,"Workers' Compensation; Psychological and Psychiatric Services"
SB2065,583999,"Infant Mortality; Elective Pre-term Deliveries; Point-of-care Newborn Screening; Task Force; Appropriation ($)"
SB2066,585934,"Tobacco Products; Tax"
SB2067,583961,"Health; Dietary Supplements; Food, Drug, and Cosmetic Act; Good Manufacturing Practices"
SB2068,585028,"Native Hawaiian Health; John A. Burns School of Medicine; Task Force; Appropriation ($)"
SB2069,586043,"Hawaii Health Authority; Establishment; Appropriation ($)"
SB2070,585953,"Naturopathic Physicians; Naturopathic Childbirth Attendance; Certificate; Requirements"
SB2071,585251,"Helmets; All-terrain Vehicles; Motorcycles; Mopeds; Motor Scooters"
SB2072,586230,"Service of Process; Assumpsit"
SB2073,585277,"Collective Bargaining Cost Items; Bargaining Unit (6); Appropriations ($)"
SB2074,584175,"Collective Bargaining Cost Items; Bargaining Unit (9); Appropriations ($)"
SB2075,586294,"Collective Bargaining Cost Items; Bargaining Unit (14); Appropriations ($)"
SB2076,585753,"Unlicensed Contractor Fraud"
SB2077,584977,"Maui Food Innovation Center; University of Hawaii Maui College; Capital Improvement Project; Appropriation ($)"
SB2078,586231,"Condominiums; Condominium Projects; Agricultural Uses and Activities"
SB2079,588371,"Hawaii Film Office; Motion Picture, Digital Media, and Film Production Income Tax Credit"
SB2080,588023,"Judiciary Package; Uniform Mediation Act"
SB2081,591017,"Judiciary Package; Administrative Director and Deputy; Salaries"
SB2082,588445,"Judiciary Package; Land Court; Fees"
SB2083,588475,"Judiciary Package; Driver Education and Training Fund"
SB2084,587903,"Judiciary Package; Supplemental Appropriations; Budget ($)"
SB2085,588296,"State Fire Council Package; Fireworks; Shippers"
SB2086,588358,"State Fire Council Package; Service-Connected Disability and Medical Coverage"
SB2087,587946,"State Fire Council Package; Fireworks Permit Fees"
SB2088,588191,"State Fire Council Package; Fire Protection"
SB2089,588385,"State Fire Council Package; Public Safety; Fire Protection"
SB2090,587814,"State Fire Council Package; Consumer Fireworks; Limited Use for Cultural Events"
SB2091,588326,"State Fire Council Package; Fireworks"
SB2092,587978,"State Fire Council Package; Hawaii State Building Code Council; Appropriation ($)"
SB2093,588429,"Honolulu Prosecutor's Package; Unlicensed Contractor Fraud"
SB2094,588041,"Honolulu Prosecutor's Package; Computer Damage"
SB2095,588401,"Honolulu Prosecutor's Package; Stored Communications; Governmental Access"
SB2096,588084,"Honolulu Prosecutor's Package; Violation of Privacy"
SB2097,588312,"Honolulu Prosecutor's Package; Pen Register"
SB2098,588145,"Honolulu Prosecutor's Package; Theft of Computers"
SB2099,587919,"Honolulu Prosecutor's Package; Repeat Offenders"
SB2100,588205,"Honolulu Prosecutor's Package; Correctional Facilities ($)"
SB2101,587963,"Honolulu Prosecuting Attorney Package; Grants-in-Aid; Appropriations ($)"
SB2102,588502,"Motorcycles; Mopeds; Noisy Mufflers; Penalty"
SB2103,588129,"OHA Package; State Planning Act; Health Disparities"
SB2104,588070,"OHA Package; Public Lands; Remnant Lands"
SB2105,588177,"OHA Package; Board of Land and Natural Resources; Composition"
SB2106,588101,"OHA Package; Historic Preservation Project Reviews; Programmatic Agreement"
SB2107,587858,"HSAC Package; Hawaii Health Systems Corporation Primary Care Training Program; Appropriation ($)"
SB2108,587828,"Public Land Liability"
SB2109,588341,"HSAC Package (3); Roads in Limbo; Liability; Road Maintenance"
SB2110,588008,"Pesticides; Regulation; Appropriation ($)"
SB2111,587874,"Kauai County Package; Solar Water Heater Variance Requirements"
SB2112,587845,"Kauai County Package; Tort Liability; Public Lands; Lifeguards"
SB2113,588056,"Kauai County Package; Kauai Humane Society"
SB2114,587992,"Kauai County Package; Capital Improvement Projects; Eighth Senatorial District ($)"
SB2115,588248,"County Surcharge on State Tax"
SB2116,588281,"Public Land Liability"
SB2117,587887,"Campaign Spending Commission Package; Report Filing Deadlines"
SB2118,587801,"Campaign Spending Commission Package; Expenditure Limits"
SB2119,588459,"Campaign Spending Commission Package; Elections"
SB2120,588222,"Campaign Spending; Contribution Limits; Exemption"
SB2121,588263,"Insurance; Dental; Payments"
SB2122,588584,"Revision Bill"
SB2123,588551,"Workers' Compensation; Medical Examinations; Mutual Agreement"
SB2124,588561,"Conservation and Resources; Resource Management; Opihi"
SB2125,588590,"DLNR; Marine Life Conservation District; Task Force; Niihau"
SB2126,588550,"United States Senate; Members-elect; Vacancy; Appointment"
SB2127,588541,"Workers' Compensation; Penalty; Temporary Partial Disability Benefits; Temporary Total Disability Benefits; Eligibility Determination"
SB2128,588537,"Retention; Biological Evidence"
SB2129,588589,"Veterinary Medicine; Criminal Penalties; Pet Animals"
SB2130,588539,"Diamond Head Seawall; Appropriation ($)"
SB2131,588585,"University of Hawaii System; Veterans; Residency; Tuition; Waiver"
SB2132,588533,"Banyan Drive; DLNR; Community Development Board"
SB2133,589333,"Motor Vehicle Registration; Veterans; Exemption"
SB2134,588595,"Education; Special Education; Individuals with Disabilities Education Act"
SB2135,588536,"Boards and Commissions; Term Limits"
SB2136,588593,"Department of Education; Attendance; Enrollment"
SB2137,588555,"Board of Education; Members; Terms"
SB2138,588554,"Neighborhood Electric Vehicles; Definition; Passenger Capacity; Weight Rating"
SB2139,588570,"Department of Education; Student Instructional Hours"
SB2140,588547,"Glyphosate; Moratorium; Working Group"
SB2141,590871,"Recall (ConAm)"
SB2142,591431,"Initiative (ConAm)"
SB2143,591425,"Referendum (ConAm)"
SB2144,590486,"Term Limits (ConAm)"
SB2145,591365,"Judicial court calendars; priority for child victims of serious crimes"
SB2146,591395,"Video evidence of child victims"
SB2147,591380,"Silver Alert Program; Senior Citizens"
SB2148,592396,"Fraudulent or improper financing statements; penalties"
SB2149,592680,"Fraudulent records; civil actions and administrative procedures"
SB2150,592457,"Unwarranted Surveillance; unmanned aircraft system prohibitions and exceptions"
SB2151,590974,"United States Military Veteran designation; driver's license or license renewal"
SB2152,591391,"Unmanned Aircraft Systems"
SB2153,591271,"State Tax Expenditures; Biennial Report; Evaluation"
SB2154,590757,"Unicameral Legislature (ConAm)"
SB2155,591393,"Practitioners License; Limited authority or validation"
SB2156,590770,"Eminent domain; Fees and costs; good-faith estimates"
SB2157,590842,"Expiration of Motor Vehicle Licenses"
SB2158,590932,"Civil Liability; Limitation; Justification; Use of Force"
SB2159,592438,"Ethics; Disclosure; Financial Interests"
SB2160,591404,"Felony; Report Death or Disappearance of Child; False Report; Missing Child"
SB2161,591337,"Electric companies; Customer choice; Deregulation"
SB2162,590544,"Unemployment; Definition of Employment; Excluded Services."
SB2163,590571,"Employment security; Wages"
SB2164,591199,"Discrimination in Public Accommodations; Religious Organizations"
SB2165,590660,"Home Schooling; Extracurricular Activities"
SB2166,591228,"Attorney General; Elections (ConAm)"
SB2167,591115,"Income Tax Exclusion; Military"
SB2168,591298,"Pistols or Revolvers; Concealed Carry License"
SB2169,591375,"General Excise Tax; Food and Medical Services"
SB2170,591400,"Transient accommodations tax; exemption"
SB2171,591410,"General Excise Tax; Intermediary Business Transactions"
SB2172,591339,"Taxation; Personal Exemption; Conformance"
SB2173,590690,"Specialty Tier Prescription Coverage; Specialty Drugs; Health Plan"
SB2174,590559,"Air Pollution; Motor Vehicles"
