bill_number,bill_id,title
HB05264,623398,"An Act Requiring The State To Provide Pilot Moneys To Municipalities Hosting Correctional Facilities."
HB05265,623469,"An Act Appropriating Funds To The Department Of Correction To Ensure Adequate Staffing Of Correction Officers."
HB05266,623455,"An Act Concerning The Treatment Of Certified Checks As Cash For Purposes Of Real Estate Closings."
HB05267,623510,"An Act Concerning Revisions To The Banking Statutes."
HB05268,623305,"An Act Concerning Consumer Credit Licenses."
HB05269,623428,"An Act Creating Parity Between Paid Sick Leave Benefits And Other Employer-provided Benefits."
HB05270,623489,"An Act Concerning The Delegation Authority Of The Commissioner Of Economic And Community Development."
HB05271,623433,"An Act Authorizing Bonds Of The State For The Advanced Manufacturing Of Composites In Connecticut."
HB05272,623303,"An Act Consolidating Certified Historic Structure Rehabilitation Tax Credits."
HB05273,623350,"An Act Restoring The Commissioner Of Economic And Community Development's Duty To Determine Whether Surplus State Property Can Be Used For Economic Development Purposes."
HB05274,623378,"An Act Concerning Unemployed Individuals And Discriminatory Hiring Practices."
HB05275,623476,"An Act Concerning The Learn Here, Live Here Program And Business Creation."
HB05276,623436,"An Act Concerning Supplemental Funding Under The Preseed Financing Program."
HB05277,623538,"An Act Concerning A Knowing And Wilful Violation Of Chapter 155."
HB05278,623528,"An Act Concerning Mandatory Registrar Of Voter Sessions."
HB05279,623337,"An Act Eliminating The Minimum Fair Wage Exception For Certain Citizens Of Connecticut."
HB05280,623403,"An Act Concerning Executive Employee Compensation."
HB05281,623443,"An Act Concerning Members Of The Disability Retirement Board."
HB05282,623331,"An Act Concerning Workers' Compensation And Small Business Owners."
HB05283,623495,"An Act Concerning Expansion Of Family And Medical Leave."
HB05284,623345,"An Act Prohibiting Smoking In Certain Areas Of Railroad Stations."
HB05285,623296,"An Act Concerning A Study Of The Renewal Times For Occupational Licenses."
HB05286,623353,"An Act Requiring Labeling Of Electronic Cigarettes."
HB05287,623450,"An Act Concerning Distracted Driving In Public School Education."
HB05288,623323,"An Act Concerning Chemical Road Treatments."
HB05289,623419,"An Act Establishing The Connecticut Port Authority."
HB05290,623314,"An Act Revising Motor Vehicle Laws."
HB05291,623356,"An Act Establishing ""red Zones"" On Connecticut's Highways."
HB05292,623332,"An Act Concerning Motor Vehicle Registration."
HB05293,623381,"An Act Concerning Stolen Valor, Veterans' Service Officers And Technical Corrections To The Definition Of Veteran."
HB05294,623500,"An Act Concerning The Admission Of Veterans To Hospitals And The Application Of Military Occupational Training To State Licensure Requirements."
HB05295,623407,"An Act Concerning Prohibited Activity On Property Controlled By The Department Of Veterans' Affairs."
HB05296,623448,"An Act Concerning Admissions To The Veterans' Home Or To A Hospital."
HB05297,623518,"An Act Concerning A Deduction From The Income Tax For Amounts Received As Active Service Pay."
HB05298,623421,"An Act Concerning Active Service Pay For Members Of The Connecticut National Guard."
HB05299,623320,"An Act Concerning The Findings Of The Military Occupational Specialty Task Force."
HB05300,624391,"An Act Concerning Nursing Home Notifications."
HB05301,624389,"An Act Decreasing Legislative Postal Costs."
HB05302,624410,"An Act Requiring Funding Of The State's Pension Obligations."
HB05303,624401,"An Act Concerning Access To Emergency Medicine For Children With Epilepsy."
HB05304,624406,"An Act Preventing Homelessness For Youth Under The Care Of The Commissioner Of Children And Families."
HB05305,624310,"An Act Concerning Cadmium Levels In Children's Jewelry."
HB05306,624349,"An Act Concerning A Random Drawing For A Lifetime Hunting Or Freshwater Fishing License."
HB05307,624342,"An Act Revising Certain Requirements For The Registration Of Radioactive Materials."
HB05308,624395,"An Act Concerning The Regulation Of Fracking Waste And Fracking By-products."
HB05309,624372,"An Act Concerning Abandoned Vessels."
HB05310,624402,"An Act Concerning Connecticut's Seed Law."
HB05311,624411,"An Act Establishing The Construction Contracting And Bidding Transparency Working Group."
HB05312,624347,"An Act Concerning State Contracting, Government Administration And Notification Regarding Extensions Of Polling Place Hours."
HB05313,624368,"An Act Concerning Homemaker Services And Homemaker Companion Agencies."
HB05314,624350,"An Act Concerning Payments On Advances From The Federal Unemployment Account."
HB05315,624382,"An Act Allowing Employers To Pay Wages Using Payroll Cards."
HB05316,624341,"An Act Concerning The Resident State Policemen."
HB05317,624336,"An Act Concerning The Regional Telecommunications Centers."
HB05318,624308,"An Act Concerning The Resident State Policemen."
HB05319,625296,"An Act Authorizing Bonds Of The State For A Community Center For Non-english Speaking Persons With Disabilities."
HB05320,625300,"An Act Authorizing Bonds Of The State For The Rehabilitation And Repair Of The Trowbridge Community Center."
HB05321,625303,"An Act Concerning Interpreter Qualifications."
HB05322,625275,"An Act Concerning Nursing Home Facility Minimum Staffing Levels."
HB05323,625293,"An Act Concerning The Child Poverty And Prevention Council."
HB05324,625286,"An Act Increasing The Minimum Amount Of Assets That May Be Retained By The Spouse Of An Institutionalized Person."
HB05325,625281,"An Act Eliminating The Home-care Cost Cap."
HB05326,625301,"An Act Concerning Compassionate Aid In Dying For Terminally Ill Patients."
HB05327,625311,"An Act Concerning The Provision Of Services By Classical Homeopaths."
HB05328,625279,"An Act Concerning Advisory And Planning Councils For State Developmental Services Regions, A Change In Terminology And The Autism Spectrum Disorder Advisory Council."
HB05329,625310,"An Act Concerning The Definition Of Natural Food."
HB05330,625317,"An Act Concerning The Application Of Pesticides At Parks, Playgrounds, Athletic Fields And Municipal Greens."
HB05331,625274,"An Act Concerning The Implementation Of The Revisions To The Peac Guidelines."
HB05332,626533,"An Act Concerning The Taxation Of Certain Public Golf Courses."
HB05333,626584,"An Act Concerning The Return Of Outdated Drugs From Pharmacies To Wholesalers, Manufacturers And Distributors."
HB05334,626507,"An Act Establishing An Off-site Farm Winery Sales And Tasting Permit."
HB05335,626751,"An Act Concerning Criminal History Records Checks For Residential Security Systems Installers, Servicers And Repairers."
HB05336,626544,"An Act Concerning The Possession Of Alcoholic Liquor By Minors."
HB05337,626360,"An Act Concerning Fees Charged For Services Provided At Hospital-based Facilities."
HB05338,626645,"An Act Concerning The Admissibility Of Records And Reports Of Certain Expert Witnesses As Business Entries."
HB05339,626629,"An Act Concerning The Administration Of Oaths And The Validation Of Certain Marriages."
HB05340,626597,"An Act Concerning The Liability Of A Landowner Who Permits Maple-sugaring Activities On The Land."
HB05341,626679,"An Act Concerning The Designation Of A Person Convicted Of Criminal Violation Of A Standing Criminal Protective Order As A Persistent Offender."
HB05342,626491,"An Act Concerning The Penalty For Larceny By Defrauding A Public Community."
HB05343,626783,"An Act Concerning Costs Incurred By State Residents When Responding To Certain Discovery Requests."
HB05344,626713,"An Act Concerning Child Endangerment While Operating A Motor Vehicle While Under The Influence Of Intoxicating Liquor Or Drugs."
HB05345,626661,"An Act Concerning Cooperative Health Care Arrangements."
HB05346,626388,"An Act Concerning Workforce Investment Boards."
HB05347,626400,"An Act Allowing Certain Municipalities To Create Scholarship Funds Through Municipal Bonding."
HB05348,626345,"An Act Concerning The Consideration Of Property Values When Determining Eligibility For A Certain Property Tax Relief Program."
HB05349,626520,"An Act Concerning The Time In Which Certain Residential Property Owners May Appeal An Assessment."
HB05350,628065,"An Act Concerning An Assistant To The Long-term Care Ombudsman."
HB05351,628058,"An Act Establishing A Revolving Loan Fund For Payment Of Property Taxes For Elderly Homeowners."
HB05352,628050,"An Act Concerning Mortgage Servicers."
HB05353,628085,"An Act Concerning Mortgage Servicers, Connecticut Financial Institutions, Consumer Credit Licenses, The Foreclosure Mediation Program, Minor Revisions To The Banking Statutes, The Modernization Of Corporation Law And Reverse Mortgage Transactions."
HB05354,628049,"An Act Concerning Chemicals Of High Concern To Children."
HB05355,628068,"An Act Concerning Collaboration Between Boards Of Education And School Resource Officers."
HB05356,628060,"An Act Concerning The Inclusion Of Social Media Education In The Public School Curriculum."
HB05357,628079,"An Act Concerning Chronic Absenteeism."
HB05358,628033,"An Act Authorizing The Regulation Review Committee To Recommend The Repeal Of Obsolete Or Burdensome Regulations."
HB05359,628093,"An Act Conveying A Parcel Of Land To The Catherine Violet Hubbard Foundation, Inc."
HB05360,628030,"An Act Concerning Certification Of Candidates."
HB05361,628021,"An Act Concerning A Plan For Participation In A State Authorization Reciprocity Agreement Regarding Distance Learning Programs."
HB05362,628087,"An Act Targeting State Financial Aid To Support Technical Training."
HB05363,628062,"An Act Prohibiting Gender As A Rating Factor For Long-term Care Insurance Policies."
HB05364,628069,"An Act Requiring Uninsured And Underinsured Motorist Coverage To Be Optional And Concerning Underinsured Motorist Conversion Coverage."
HB05365,628078,"An Act Concerning Surplus Lines Insurance Policies."
HB05366,628095,"An Act Concerning Certain Surplus Lines Insurance Policies And The Duties Of Surplus Lines Insurance Brokers."
HB05367,628055,"An Act Concerning The Implementation Of Enhanced Protections Against Discrimination."
HB05368,628070,"An Act Establishing The Point Stratford Infrastructure Improvement District Within The Town Of Stratford."
HB05369,628073,"An Act Implementing The Recommendations Of The Program Review And Investigations Committee Concerning Certain Fiscal And Resource-related Matters Pertaining To State Parks."
HB05370,628056,"An Act Implementing The Recommendations Of The Program Review And Investigations Committee Concerning Certain Fiscal And Resource-related Matters Pertaining To State Parks."
HB05371,628031,"An Act Implementing The Recommendations Of The Legislative Program Review And Investigations Committee Study On Access To Substance Use Treatment For Insured Youth As They Relate To The Department Of Children And Families."
HB05372,628025,"An Act Implementing The Recommendations Of The Legislative Program Review And Investigations Committee Concerning The Alcohol And Drug Policy Council."
HB05373,628103,"An Act Implementing The Recommendations Of The Legislative Program Review And Investigations Committee Concerning The Reporting Of Certain Data By Managed Care Organizations And Health Insurance Companies To The Insurance Department."
HB05374,628038,"An Act Implementing The Recommendations Of The Legislative Program Review And Investigations Committee Study On The Department Of Children And Families As They Relate To Preparation Of Youths Aging Out Of State Care."
HB05375,628024,"An Act Implementing The Recommendations Of The Legislative Program Review And Investigations Committee On The Reemployment Of Older Workers Concerning The Technical High School System."
HB05376,628045,"An Act Implementing The Recommendations Of The Legislative Program Review And Investigations Committee On The Reemployment Of Older Workers As They Relate To The Board Of Regents For Higher Education."
HB05377,628081,"An Act Implementing The Recommendations Of The Legislative Program Review And Investigations Committee On The Reemployment Of Older Workers As They Relate To The Labor Department."
HB05378,628029,"An Act Implementing The Recommendations Of The Legislative Program Review And Investigations Committee Concerning Medicaid-funded Emergency Department Visits."
HB05379,628046,"An Act Implementing The Recommendations Of The Legislative Program Review And Investigations Committee Concerning A Study Of The Establishment Of A Tuition Pledge Program And A Financial Aid Pledge Program At The University Of Connecticut."
HB05380,628086,"An Act Implementing The Recommendations Of The Program Review And Investigations Committee Concerning A Report On Financial Aid Awards And Tracking Transfer Credits By The University Of Connecticut."
HB05381,628084,"An Act Implementing The Recommendations Of The Legislative Program Review And Investigations Committee Concerning The Publication Of Tuition And Fee Schedule Increases And The Development Of A System To Track Graduates' Success By The University Of Connecticut."
HB05382,628020,"An Act Implementing The Recommendations Of The Legislative Program Review And Investigations Committee Study On The Reemployment Of Older Workers As They Relate To Job Advertisements."
HB05383,628028,"An Act Concerning Screening Protocols For Urinary Tract Infections."
HB05384,628100,"An Act Concerning Reports Of Nurse Staffing Levels."
HB05385,628072,"An Act Concerning Language Interpreters In Hospitals."
HB05386,628092,"An Act Concerning Care Coordination For Chronic Disease."
HB05387,628053,"An Act Concerning Keno."
HB05388,628032,"An Act Concerning The Penalty For Assault Of Fire Marshals, Deputy Fire Marshals, Fire Inspectors, Building Officials And Assistant Building Officials."
HB05389,628041,"An Act Concerning The Use Of Electronic Defense Weapons By Police Officers."
HB05390,628054,"An Act Concerning State Marshals."
HB05391,628044,"An Act Concerning Overtime And Fringe Benefits Of Resident State Troopers."
HB05392,628067,"An Act Concerning The Collection And Disposal Of Unwanted Medication."
HB05393,628057,"An Act Concerning Mental Health Services For Members Of The National Guard."
HB05394,628039,"An Act Concerning Property Tax Relief For Veterans."
HB05395,629282,"An Act Concerning Aging In Place."
HB05396,628923,"An Act Concerning Retention Of The Coparticipant Option Under The Teachers' Retirement System After Divorce."
HB05397,629110,"An Act Concerning Interest On Unclaimed Contributions For Inactive Members Of The Teachers' Retirement System And Eliminating Certain Obsolete Language."
HB05398,629231,"An Act Concerning The Availability Of Actuarial Valuations."
HB05399,629118,"An Act Concerning Expenditures Of The General Fund."
HB05400,628999,"An Act Concerning Expenditures For The Programs And Services Of The Department Of Education."
HB05401,629082,"An Act Concerning Expenditures For Programs And Services Related To Higher Education."
HB05402,628935,"An Act Concerning Waivers For Medicaid-financed, Home And Community-based Programs For Individuals With Acquired Brain Injury."
HB05403,629131,"An Act Concerning Funding For The Connecticut Invention Convention."
HB05404,629129,"An Act Concerning Financial Assistance For Businesses Affected By Prolonged State Infrastucture Projects."
HB05405,628878,"An Act Concerning Legislative Approval Of First Five Plus Program Investments."
HB05406,628888,"An Act Authorizing Bonds Of The State For Commercial Rail Freight Line Improvements."
HB05407,628816,"An Act Concerning Minor And Technical Changes To Commerce-related Statutes."
HB05408,628800,"An Act Concerning Tree Trimming."
HB05409,629217,"An Act Concerning Hydraulic Fracturing Waste."
HB05410,628786,"An Act Concerning Lost And Unaccounted For Gas."
HB05411,628955,"An Act Authorizing Electric Meter Aggregation For Nonprofit Entities."
HB05412,629241,"An Act Concerning Shared Clean Energy Facilities."
HB05413,628820,"An Act Appropriating Funds For The Public, Educational And Governmental Programming And Education Technology Investment Account And The Clean Energy Finance And Investment Authority."
HB05414,629157,"An Act Concerning Energy Sources."
HB05415,628813,"An Act Concerning The Air Line State Park Trail."
HB05416,629056,"An Act Establishing A Livestock Care Standards Advisory Council."
HB05417,629195,"An Act Establishing A Season For The Taking Of Glass Eels."
HB05418,628747,"An Act Concerning Financial Liability For The Clean-up Of Certain Hazardous Waste."
HB05419,629258,"An Act Concerning The Preservation Of The Savin Farm In Lebanon."
HB05420,629029,"An Act Concerning Funds For Water Supplies In Contaminated Areas."
HB05421,629221,"An Act Authorizing The Use Of Alternative Sewage Treatment Plants In Certain Wastewater Management Districts."
HB05422,628980,"An Act Concerning Awareness Of Heartworm Disease And The Standard Dog Licensing Form."
HB05423,629093,"An Act Concerning The Speed Of Vessels Along Certain Portions Of The Connecticut River."
HB05424,629011,"An Act Concerning The Responsibilities Of The Water Planning Council."
HB05425,629251,"An Act Concerning The Sale Of Farm Winery Brandy."
HB05426,629186,"An Act Concerning Free Wine Tastings On Premises Where Wine Kits Are Sold."
HB05427,628898,"An Act Concerning Untimely Shipping And Unauthorized Deliveries By Alcoholic Liquor Manufacturers And Out-of-state Shippers."
HB05428,628909,"An Act Concerning A Floor Stock Allowance For Beer."
HB05429,628987,"An Act Establishing A Craft Alcoholic Liquor Distiller Permit."
HB05430,629106,"An Act Permitting Restaurant And Cafe Permit Holders To Sell Growlers Of Beer At Retail."
HB05431,629032,"An Act Requiring The Suspension Of Administrative Penalties Imposed On Certain Business Entities."
HB05432,629064,"An Act Requiring A Report On Performance Audits."
HB05433,629245,"An Act Establishing An Office Of Inspector General."
HB05434,628885,"An Act Concerning A Plan For Career Readiness And Manufacturing Apprenticeship Preparation Programs At The Technical High Schools."
HB05435,628907,"An Act Requiring An Evaluation Of Higher Education Certificate Programs."
HB05436,629263,"An Act Establishing A Pilot Program To Provide Medical Respite For The Homeless."
HB05437,629167,"An Act Creating Incentives For Young Professionals To Live In Urban Areas."
HB05438,629003,"An Act Concerning The Rights And Responsibilities Of Landlords And Tenants Regarding The Treatment Of Bed Bug Infestations."
HB05439,628796,"An Act Concerning Brand Name Drug Prescriptions For State Medical Assistance Recipients."
HB05440,629267,"An Act Concerning Medicaid Reimbursement For Emergency Department Physicians."
HB05441,628849,"An Act Concerning Direct Payment Of Residential Care Facilities."
HB05442,629091,"An Act Concerning The State-administered General Assistance Program."
HB05443,629276,"An Act Concerning Coverage Under State Medical Assistance Programs For Certain Over-the-counter Drugs."
HB05444,629042,"An Act Concerning Medicaid Coverage Of Chiropractic Services."
HB05445,628781,"An Act Concerning Medicaid Coverage Of Telemonitoring Services."
HB05446,629022,"An Act Concerning The Prevention Or Elimination Of Double Child Care Subsidies."
HB05447,628960,"An Act Concerning Rates Of Reimbursement For Emergency Ambulance Transportation Fees Paid By The Department Of Social Services."
HB05448,629077,"An Act Concerning The Discontinuance Of Highways And Private Ways By Municipalities."
HB05449,628920,"An Act Concerning Residency Restrictions For Registered Sexual Offenders."
HB05450,629287,"An Act Concerning Arbitration In Motor Vehicle Accident Cases."
HB05451,629054,"An Act Concerning Health Care Pooling."
HB05452,628941,"An Act Concerning Community Service And Unemployment Benefits."
HB05453,628947,"An Act Concerning Employers And Home Care Workers."
HB05454,629144,"An Act Concerning Apprenticeship Ratios."
HB05455,629123,"An Act Concerning The Issuance Of Municipal Soft-serve Ice Cream Vendor Permits."
HB05456,628903,"An Act Concerning Mandatory Reporting Of Abuse And Neglect Of Individuals With Autism Spectrum Disorder, The Definition Of Abuse, And The Department Of Developmental Services Abuse And Neglect Registry."
HB05457,629036,"An Act Concerning The Collection Of Data By Health And Human Services Agencies."
HB05458,628868,"An Act Concerning The Sale, Via Internet Auction, Of License Plates Issued By The Department Of Motor Vehicles."
HB05459,628761,"An Act Concerning The Adoption Of The Uniform Certificate Of Title For Vessels Act."
HB05460,628772,"An Act Allowing Persons With Medical Conditions Controlled With Medication To Obtain Certain Motor Vehicle Operator's Licenses."
HB05461,629069,"An Act Concerning Retirement And Group Welfare Benefits For Certain Unclassified Employees Of The Connecticut Airport Authority."
HB05462,629141,"An Act Concerning Sales And Use Exemptions For Tax Shipping And Handling Charges."
HB05463,632106,"An Act Concerning Preparation Of The State Budget."
HB05464,632140,"An Act Concerning Payments Distributed By The Municipal Revenue Sharing Account."
HB05465,631833,"An Act Concerning The Connecticut Aerospace Reinvestment Act."
HB05466,632073,"An Act Concerning The Department Of Revenue Services' Statutes And Procedures, Including Background Checks For Employees, The Master Settlement Agreement, The Motor Vehicle Fuels Tax, The Estate Tax, Additions And Changes To Various Public Lists Maintained By The Department, The Payment Schedule For The Sales And Use Tax, A Data Match System With Financial Institutions, The Personal Income Tax And Technical Corrections."
HB05467,631971,"An Act Concerning Procedures For Debt Certifications And The Tax Expenditure Report."
HB05468,631936,"An Act Concerning Connecticut Scholarships."
HB05469,631902,"An Act Concerning Workforce Development."
HB05470,632587,"An Act Requiring A Sales And Use Tax Exemption For Sales To Connecticut Credit Unions."
HB05471,632525,"An Act Concerning The Legislative Commissioners' Recommendations For Technical And Minor Changes To Taxation And Related Statutes."
HB05472,632704,"An Act Concerning Failure To File For Property Tax Exemptions."
HB05473,632766,"An Act Concerning Cash Refunds For Gift Card Balances."
HB05474,632666,"An Act Exempting Veterinarians From The Electronic Prescription Drug Monitoring Program."
HB05475,632720,"An Act Concerning Prescription Drug Container Labels."
HB05476,632578,"An Act Concerning A Study Of The Feasibility Of Legalizing Industrial Hemp."
HB05477,632539,"An Act Concerning A State-wide Platform For The Distribution Of Electronic Books."
HB05478,632617,"An Act Concerning Attempted Illegal Voting."
HB05479,632496,"An Act Concerning An Extension Of The Activity Distance Ban To Exits Of Polling Places."
HB05480,632689,"An Act Concerning Registrars Of Voters, The Authority Of The Secretary Of The State And The State Elections Enforcement Commission, And The Posting Of Requirements For Voter Identification."
HB05481,632735,"An Act Establishing The Central Office Of Administrative Hearings."
HB05482,632631,"An Act Concerning Public Housing Grievance Procedures."
HB05483,632743,"An Act Extending The Foreclosure Mediation Program."
HB05484,632533,"An Act Concerning The Claim Against The State Of The Town Of Cheshire."
HB05485,632751,"An Act Concerning Voyeurism."
HB05486,632642,"An Act Concerning The Assault Of A Sports Official."
HB05487,632593,"An Act Providing Immunity To A Person Who Administers An Opioid Antagonist To Another Person Experiencing An Opioid-related Drug Overdose."
HB05488,632729,"An Act Concerning Health Insurance Coverage For Probate Court Personnel."
HB05489,632610,"An Act Concerning The Integrity Of The Business Registry."
HB05490,633284,"An Act Concerning Financial Literacy."
HB05491,633286,"An Act Concerning Customer Sales And Service Calls Made From Outside The United States."
HB05492,633383,"An Act Concerning A Demonstration Project For The Use Of Electronic Equipment For Conducting Audits."
HB05493,633434,"An Act Requiring A State-wide Plan To Provide Education, Training And Job Placement In Emerging Industries."
HB05494,633302,"An Act Concerning Student Membership On The Board Of Trustees For The University Of Connecticut."
HB05495,633305,"An Act Establishing An Accelerated Certificates Program."
HB05496,633407,"An Act Concerning Higher Education And Remedial Support."
HB05497,633341,"An Act Implementing An I-best Program On A Regional Basis."
HB05498,633309,"An Act Concerning Child Day Care Licensure Exemptions."
HB05499,633291,"An Act Concerning The Department Of Children And Families."
HB05500,633408,"An Act Concerning Provider Audits Under The Medicaid Program."
HB05501,633394,"An Act Authorizing A Limited Scope Real Estate Estimated Valuation."
HB05502,633319,"An Act Concerning Changes To The Property And Casualty And Surplus Lines Insurance Statutes."
HB05503,633283,"An Act Concerning Emergency Medical Services For Certain State Campuses."
HB05504,633349,"An Act Concerning The Department Of Public Health's Recommendations Regarding Local Health Departments And Districts."
HB05505,633329,"An Act Concerning A Study Of A State-wide Property Maintenance Code."
HB05506,633297,"An Act Concerning Scrap Metal Sold On Behalf Of Municipalities."
HB05507,633360,"An Act Concerning The Appointment Of Zoning Enforcement Officials, Building Officials And Fire Marshals."
HB05508,633330,"An Act Concerning Municipal Assessment And Taxation Of Property Used For Public Educational Purposes."
HB05509,633337,"An Act Concerning The Admission Of The City Of Middletown To The Mattabassett District."
HB05510,633334,"An Act Providing A Limited Property Tax Exemption For Homes Under Construction."
