bill_number,bill_id,title
HB05511,633325,"An Act Granting A Moratorium From The Affordable Housing Land Use Appeals Process Upon Completion Of An Incentive Housing Development."
HB05512,634179,"An Act Concerning Payday Loans."
HB05513,634052,"An Act Concerning The Modernization Of Connecticut Corporation Law."
HB05514,634086,"An Act Concerning An Optional Method Of Foreclosure."
HB05515,634223,"An Act Allowing The Designation Of Areas Within The Towns Of Thomaston And Wallingford As Enterprise Zones."
HB05516,634188,"An Act Concerning A Study Of Kitchen Incubators."
HB05517,634291,"An Act Concerning A Study Of Connecticut Manufacturing Workforce Needs."
HB05518,634123,"An Act Concerning The Liabilities Of Applicants For State Financial Assistance."
HB05519,634093,"An Act Concerning Student Internships."
HB05520,634173,"An Act Concerning The Availability Of An On-line Study Skills Curriculum."
HB05521,634058,"An Act Concerning The Storage And Administration Of Epinephrine At Public Schools."
HB05522,634043,"An Act Concerning School Readiness Funding."
HB05523,634116,"An Act Establishing A Task Force To Study Paraprofessional Staffing Levels."
HB05524,634230,"An Act Concerning The Recommendations Of The Law Revision Commission With Respect To The Alimony Statutes."
HB05525,634029,"An Act Concerning Child Pornography And Providing Notice To The Chief Executive Officer Of A Municipality Upon The Release Of A Registered Sexual Offender Into Such Municipality."
HB05526,634036,"An Act Concerning Delinquent Child Support Obligors."
HB05527,634099,"An Act Concerning The Task Force On Domestic Workers."
HB05528,634145,"An Act Concerning Essential Public Health Services And The Euthanization Of Animals In A Facility Subject To Regulation By The United States Department Of Agriculture."
HB05529,634079,"An Act Concerning The Definition Of Medical Necessity."
HB05530,634194,"An Act Concerning The Department Of Public Health's Recommendations Regarding Bulk Water Haulers."
HB05531,634130,"An Act Concerning Mutual Consolidation Of Dispatch Facilities."
HB05532,634246,"An Act Concerning Boxing And Mixed Martial Arts."
HB05533,634071,"An Act Concerning Workers' Compensation Coverage For Public Employees With Post-traumatic Stress Disorder."
HB05534,634835,"An Act Concerning The Provision Of Services To Individuals With Intellectual Disability."
HB05535,634890,"An Act Concerning Notice Of A Patient's Observation Status."
HB05536,634923,"An Act Concerning Continuing Education Requirements For Psychologists."
HB05537,634941,"An Act Concerning The Department Of Public Health's Recommendations Regarding Various Revisions To The Public Health Statutes."
HB05538,634958,"An Act Concerning Juice Bars."
HB05539,635254,"An Act Concerning The Revitalization Of Housing In Distressed Municipalities."
HB05540,635229,"An Act Amending The Charters Of The Civic Association Of Short Beach In The Town Of Branford And The Mattabassett District."
HB05541,635212,"An Act Concerning The Thompsonville Fire District."
HB05542,635262,"An Act Concerning The Recommendations Of The Connecticut Emergency Medical Services Primary Service Area Task Force."
HB05543,635238,"An Act Concerning Water Quality."
HB05544,636107,"An Act Revising Certain Brownfield Related Statutes."
HB05545,636089,"An Act Concerning A Comprehensive Study Of The State's Tax Structure."
HB05546,636103,"An Act Concerning Certain Recommendations Of The Auditors Of Public Accounts, An Expansion Of The Neighborhood Assistance Act, Certification Of Minority Business Enterprises And An Allocation To The Legacy Foundation Of Hartford."
HB05547,636101,"An Act Concerning The Legislative Commissioners' Recommendations For Technical Revisions To The Government Administration And Elections Statutes."
HB05548,636174,"An Act Establishing A Task Force To Study The General Statutes."
HB05549,636077,"An Act Concerning Violations By State Contractors Or Prospective State Contractors Of Campaign Contribution Laws."
HB05550,636124,"An Act Concerning The Conveyance Of Certain Parcels Of State Land And The Rate Of Assessment Of Certain Residential Property In Hartford."
HB05551,636159,"An Act Requiring A Review Of The Computerized Voter-tally System By The Auditors Of Public Accounts."
HB05552,636071,"An Act Concerning Slate Committees."
HB05553,636169,"An Act Exempting Certain Agreements Between Institutions Of Higher Education And Private Entities From Contracting Requirements."
HB05554,636116,"An Act Concerning The Duties Of State Marshals."
HB05555,636171,"An Act Concerning The Provision Of Emergency Assistance To Animals."
HB05556,636097,"An Act Concerning Fees Received By Officers And Persons Serving Process And Performing Other Duties."
HB05557,636131,"An Act Concerning Neglected Cemeteries."
HB05558,636082,"An Act Concerning Services For Persons With Autism Spectrum Disorder."
HB05559,636799,"An Act Concerning The Recommendations Of The Uniform Regional School Calendar Task Force, Licensure Exemptions For Certain After School Programs And Expanding Opportunities Under The Subsidized Training And Employment Program."
HB05560,636809,"An Act Concerning Education Mandate Relief."
HB05561,636865,"An Act Concerning State And Local Charter School Accountability And Transparency And Participation In Cooperative Arrangements."
HB05562,636771,"An Act Establishing The Office Of Early Childhood, Expanding Opportunities For Early Childhood Education And Concerning Dyslexia And Special Education."
HB05563,636900,"An Act Concerning The Technical High School System And Agricultural Science And Technology Education Centers."
HB05564,636824,"An Act Concerning The Review And Approval Of Safe School Climate Plans By The Department Of Education And A Student Safety Hotline Feasibility Study."
HB05565,636889,"An Act Concerning The Minimum Budget Requirement."
HB05566,636895,"An Act Concerning Minor Revisions To The Education Statutes."
HB05567,636851,"An Act Establishing A Task Force To Study Alternative School Programs In The State."
HB05568,636847,"An Act Concerning Attempted Fraudulent Voting."
HB05569,636830,"An Act Establishing A Child Nursery Facility At The Connecticut Correctional Institution, Niantic."
HB05570,636885,"An Act Concerning The Applicability Of The Statute Of Limitations To Construction And Design Actions Brought By The State Or A Political Subdivision Of The State."
HB05571,636834,"An Act Concerning Certificate Of Need Requirements, Hospital Conversions And Medical Foundations."
HB05572,637315,"An Act Establishing An Entrepreneur Learner's Permit Program."
HB05573,637290,"An Act Concerning Brownfield Remediation And Development."
HB05574,637337,"An Act Implementing The Recommendations Of The Southeastern Connecticut Bioscience Capabilities Assessment Report."
HB05575,637350,"An Act Concerning Promotion Of The Commercial Use Of The State's Deep Water Ports."
HB05576,637309,"An Act Concerning Funding For Brownfield Remediation And Development."
HB05577,637354,"An Act Concerning A Crowdfunding Study By The Department Of Banking."
HB05578,637285,"An Act Concerning The Health Insurance Grievance Process For Adverse Determinations."
HB05579,637296,"An Act Extending The Grace Period For Nonpayment Of Premium For Certain Health Plans And Concerning Disclosure By Health Carriers To Health Care Providers Of Enrollees' Paid-up Status."
HB05580,637332,"An Act Concerning The Pesticide Advisory Council And The Elimination Of A Municipal Mandate."
HB05581,637280,"An Act Concerning Sewer Assessment Appeals And The Approval Of Certain Property Tax Exemptions."
HB05582,637284,"An Act Concerning The Recommendations Of The Impediments To Fair Housing Choice Task Force."
HB05583,637310,"An Act Concerning The Payment Of Real Property Taxes By Certain Institutions Of Higher Learning And Hospital Facilities."
HB05584,637303,"An Act Concerning Regionalism And Making Technical Changes To Statutes Concerning Municipal Tax Collection."
HB05585,637281,"An Act Concerning Surveillance Of Cell Phone Communication By Law Enforcement Officials."
HB05586,638422,"An Act Concerning Revisions To Various Statutes Concerning The Criminal Justice System."
HB05587,638440,"An Act Concerning Search Warrants."
HB05588,638407,"An Act Concerning Bail Bonds."
HB05589,638459,"An Act Concerning Custodial Interrogations."
HB05590,638903,"An Act Establishing A Pilot Program For The Mediation Of Condominium-related Disputes."
HB05591,640131,"An Act Concerning The Adoption Of The Uniform Foreign-country Money Judgments Recognition Act."
HB05592,640117,"An Act Concerning The Time Limitation For Prosecuting A Motor Vehicle Violation Or Offense That Results In The Death Of Another Person."
HB05593,640160,"An Act Concerning Domestic Violence And Sexual Assault."
HB05594,640145,"An Act Concerning Diversionary Programs."
HB05595,640791,"An Act Concerning Collateral Source Payments In Personal Injury And Wrongful Death Actions And Required Disclosures Upon The Purchase Of An Annuity To Fund Pension Benefits."
HB05596,647203,"An Act Making Adjustments To State Expenditures And Revenues For The Fiscal Year Ending June 30, 2015."
HB05597,647821,"An Act Implementing Provisions Of The State Budget For The Fiscal Year Ending June 30, 2015."
SB00001,612911,"An Act Encouraging Economic Development Through The Remediation Of State-owned Brownfields."
SB00002,612922,"An Act Concerning Electric Customer Consumer Protection."
SB00003,612876,"An Act Establishing An Employee Ownership Program To Promote Business Retention And Growth."
SB00004,612930,"An Act Reducing The Sales And Use Tax To Six Per Cent."
SB00005,612882,"An Act Concerning Health Insurance Coverage For Pediatric Autoimmune Neuropsychiatric Disorder Associated With Streptococcal Infections."
SB00006,612853,"An Act Concerning Disclosures For Universal Life Insurance Policies."
SB00007,612895,"An Act Concerning The Use Of Step Therapy For And Off-label Prescribing Of Prescription Drugs."
SB00008,612891,"An Act Requiring Health Insurance Coverage For Lung Cancer Screening."
SB00009,612902,"An Act Requiring Certain Disclosures For Long-term Care Insurance Policies."
SB00010,612870,"An Act Concerning Copayments For Breast Ultrasound Screenings And Occupational Therapy Services."
SB00011,612941,"An Act Concerning The Duties Of The Connecticut Health Insurance Exchange."
SB00012,612859,"An Act Establishing A Tax Credit For Long-term Care Insurance Premium Payments."
SB00013,612889,"An Act Requiring Public Comment For Certain Long-term Care Insurance Policy Rate Increase Requests."
SB00014,612939,"An Act Concerning Pharmacy Audits And Electronic Funds Transfer Payments To Pharmacies."
SB00015,612908,"An Act Concerning The Connecticut Health Insurance Exchange Board Of Directors."
SB00016,612849,"An Act Concerning Additional Payments To Reduce Capital Indebtedness."
SB00017,612840,"An Act Concerning The Use Of Bond Proceeds To Reduce Bonded Indebtedness."
SB00018,613299,"An Act Concerning The English Language Learner Educator Incentive Program."
SB00019,613093,"An Act Establishing Uniform State Academic Degree Standards."
SB00020,613247,"An Act Concerning The Minority Advancement Program."
SB00021,615611,"An Act Implementing The Budget Recommendations Of The Governor Concerning General Government."
SB00022,615604,"An Act Concerning The Prevention Of Fraud In Government Programs."
SB00023,615522,"An Act Concerning Benefit Corporations And Encouraging Social Enterprise."
SB00024,615594,"An Act Concerning The Governor's Recommendations Regarding Electronic Nicotine Delivery Systems And Youth Smoking Prevention."
SB00025,615566,"An Act Establishing The Connecticut Smart Start Program."
SB00026,615517,"An Act Expanding Opportunities For Early Childhood Education."
SB00027,615642,"An Act Concerning Connecticut's Recycling And Materials Management Strategy."
SB00028,615505,"An Act Concerning Revenue Items To Implement The Governor's Budget."
SB00029,615635,"An Act Authorizing And Adjusting Bonds Of The State For Capital Improvements, Transportation And Other Purposes, And Concerning Miscellaneous Programs, Including The Smart Start Program, The Water Improvement System Program, School Security Grants, The Regenerative Medicine Research Fund, The Connecticut Manufacturing Innovation Fund And The Board Of Regents For Higher Education Infrastructure Act."
SB00030,615572,"An Act Concerning The Board Of Regents For Higher Education Infrastructure Act."
SB00031,615546,"An Act Concerning Continued Delivery Of Legal Services To The Poor."
SB00032,615499,"An Act Concerning Working Families' Wages."
SB00033,615586,"An Act Establishing A New Haven Region Development Authority."
SB00034,615539,"An Act Concerning The Certification Of Household Goods Carriers."
SB00035,615497,"An Act Concerning Notice Of Acquisitions, Joint Ventures, Affiliations Of Group Medical Practices And Hospital Admissions, Medical Foundations And Certificates Of Need."
SB00036,615587,"An Act Concerning The Governor's Recommendations To Improve Access To Health Care."
SB00037,615515,"An Act Concerning Municipal Assessors In The Town Of Sprague."
SB00038,615504,"An Act Concerning The Interest Rate On Delinquent Property Taxes."
SB00039,615603,"An Act Authorizing Municipalities To Collect The Marijuana And Controlled Substances Tax."
SB00040,615617,"An Act Concerning The Publication Of Municipal Legal Notices In Newspapers."
SB00041,615549,"An Act Concerning The Purchase Of Advertising Space On Connecticut River Ferry Premises."
SB00042,615542,"An Act Authorizing Bonds Of The State For A Senior And Community Center In Simsbury."
SB00043,615616,"An Act Concerning Revisions To The Department Of Children And Families Statutes."
SB00044,615573,"An Act Concerning Children's Safety."
SB00045,615636,"An Act Concerning The Department Of Children And Families And The Education Of Children."
SB00046,615646,"An Act Concerning Pesticides On School Grounds."
SB00047,615667,"An Act Concerning Second Parent Adoption."
SB00048,615553,"An Act Concerning Nutrition Standards For Child Care Settings."
SB00049,615533,"An Act Establishing A Pilot Program For A Sales Tax-free Period For Beer, Wine And Liquor."
SB00050,615658,"An Act Concerning The Sales Tax On Beer."
SB00051,615578,"An Act Concerning The Regional Telecommunications Centers."
SB00052,616833,"An Act Concerning The Possessions Of Deceased Tenants."
SB00053,616819,"An Act Concerning The Reduction Of The Appropriation To The Department Of Education For The Purpose Of An Advertising Campaign For The Common Core State Standards."
SB00054,616847,"An Act Concerning Collaboration Between Boards Of Education And Law Enforcement Personnel."
SB00055,616812,"An Act Concerning Complaints That Allege Misconduct By Law Enforcement Agency Personnel."
SB00056,616837,"An Act Concerning Severe Mental Or Emotional Impairment And Workers' Compensation Coverage."
SB00057,616859,"An Act Concerning The Direct Deposit Of Wages."
SB00058,616845,"An Act Concerning An Increase In Penalties Due To False Or Misleading Declarations, Statements Or Representations."
SB00059,616811,"An Act Concerning Hazardous Duty Retirement For Certain Employees At The Department Of Energy And Environmental Protection."
SB00060,616839,"An Act Concerning Employee Gratuities."
SB00061,616809,"An Act Concerning Workers' Compensation And Liability For Hospital And Ambulatory Surgical Center Services."
SB00062,616823,"An Act Concerning The Retention Of Promotional Exam Results."
SB00063,616821,"An Act Concerning Timelines For Arbitration Awards."
SB00064,616862,"An Act Concerning The Connecticut Employment And Training Commission And Amendments To The Department Of Labor Statutes."
SB00065,617601,"An Act Concerning The Sale Of Farm Products As ""connecticut-grown"" And Certification For ""connecticut-grown"" Markets And Restaurants."
SB00066,617554,"An Act Concerning Outdoor Wood-burning Furnaces."
SB00067,617514,"An Act Concerning The Inclusion Of Juices, Teas And Sports Drinks Under Connecticut's Bottle Bill."
SB00068,617336,"An Act Authorizing The Use Of Certain Microbial And Biochemical Pesticides And Grub Control Products On School Grounds."
SB00069,617498,"An Act Concerning The Farmland Restoration And Vacant Public Lands Programs Of The Department Of Agriculture."
SB00070,617388,"An Act Concerning The Grant Of Property Interests In Property Held By The Departments Of Agriculture And Energy And Environmental Protection And The Establishment Of A Public Use And Benefit Land Registry."
SB00071,617583,"An Act Concerning Certain Revisions To The Mattress Stewardship Program."
SB00072,617462,"An Act Concerning Liability For The Growing Of Running Bamboo."
SB00073,617534,"An Act Authorizing Bonds Of The State For The Shakespeare Theatre In The Town Of Stratford."
SB00074,617443,"An Act Authorizing Bonds Of The State For Goodspeed Musicals."
SB00075,617612,"An Act Increasing The Cap On The Neighborhood Assistance Act Tax Credit Program."
SB00076,617377,"An Act Expanding The Manufacturing Reinvestment Account Program."
SB00077,617393,"An Act Appropriating Funds For The Haddam Historical Society."
SB00078,617491,"An Act Extending The Job Expansion Tax Credit Program."
SB00079,617548,"An Act Concerning The Sharing Of The Sales Tax With Municipalities."
SB00080,617524,"An Act Prohibiting Internet Sweepstakes Cafes."
SB00081,617430,"An Act Repealing The Hospitals Tax."
SB00082,617417,"An Act Concerning Package Stores And The Sale Of Gift Baskets."
SB00083,617331,"An Act Concerning Municipal Notice Of Alcoholic Liquor Permit Renewals."
SB00084,617345,"An Act Concerning Cadmium In Children's Jewelry."
SB00085,618668,"An Act Concerning Grants In Lieu Of Taxes."
SB00086,618453,"An Act Authorizing Bonds For The Repair Of The Lewis Pond Dam In North Stonington."
SB00087,618653,"An Act Exempting Vitamins From The Sales Tax."
SB00088,618461,"An Act Concerning An Exemption From The Sales Tax For Nonprescription Drugs."
SB00089,618540,"An Act Increasing The Property Tax Credit."
SB00090,618484,"An Act Concerning Keno."
SB00091,618579,"An Act Modifying Records Retention Requirements For Certain Records In Electronic Form."
SB00092,618508,"An Act Permitting The Joint Committee On Legislative Management To Purchase Certain Goods And Services Using Existing Contracts."
SB00093,618638,"An Act Concerning Revisions To Statutes Concerning The Comptroller."
SB00094,618569,"An Act Concerning The Publication Of Municipal Legal Notices In Newspapers."
SB00095,618443,"An Act Concerning The Membership And Name Of The Advisory Council To The Superior Court On Housing Session."
SB00096,618556,"An Act Imposing A Tax On Beverages That Are High In Calories And Sugar."
SB00097,618455,"An Act Concerning A Phase-out Of The Hospitals Tax."
SB00098,618606,"An Act Establishing Standards For Public School Security Personnel."
SB00099,618470,"An Act Concerning Motor Vehicles Formerly Used For Law Enforcement."
SB00100,618658,"An Act Concerning Bazaars And Raffles."
SB00101,618476,"An Act Establishing First Responder Day."
SB00102,618635,"An Act Prohibiting Internet Sweepstakes Cafes."
SB00103,618640,"An Act Concerning Compliance With Fire Department Apparatus Maintenance Standards."
SB00104,618646,"An Act Providing Financial Relief To Nursing Homes For Uncompensated Care."
SB00105,618563,"An Act Concerning Social Innovation Investment."
SB00106,618560,"An Act Concerning Improving Employment Opportunities Through Education And Ensuring Safe School Climates."
SB00107,618613,"An Act Concerning Delivery Of The Yellow Pages Phone Book."
SB00108,618497,"An Act Concerning Registration And Use Of Certain Low-speed Neighborhood Vehicles."
SB00109,618500,"An Act Concerning Rates Of Certain Water Systems."
SB00110,618473,"An Act Concerning Fraud Prevention In Connecticut's Utility Termination Protection Programs."
SB00111,618441,"An Act Concerning A Revision To The Supportive Housing Initiative Statute."
SB00112,618457,"An Act Concerning Public Housing."
SB00113,618512,"An Act Making Technical Corrections To Statutes Concerning Housing."
SB00114,618576,"An Act Establishing A Property Tax Program To Encourage The Preservation Of Historic Agricultural Structures."
SB00115,618468,"An Act Concerning The Governance Of Special Taxing Districts Created By Special Act."
SB00116,618645,"An Act Concerning Personal Property Tax Relief For Businesses Affected By Major Construction Activities."
SB00117,618523,"An Act Authorizing Municipalities To Modify Zoning Standards."
SB00118,618526,"An Act Concerning The Education Cost Sharing Formula And The Town Of Haddam."
SB00119,618585,"An Act Concerning The Inclusion Of Private And Parochial Schools In The School Security Infrastructure Competitive Grant Program."
SB00120,618584,"An Act Concerning Dyslexia And Special Education."
SB00121,618650,"An Act Concerning A Deduction From Income Tax For Gambling Losses."
SB00122,618517,"An Act Concerning The Income Tax Treatment Of Military Retirement Pay."
SB00123,618446,"An Act Concerning The Income Tax Treatment Of Military Retirement Pay."
SB00124,618654,"An Act Concerning Licensure Requirements For Master Social Workers."
SB00125,618515,"An Act Concerning The Legislative Commissioners' Recommendations For Technical Corrections To The Public Health Statutes."
SB00126,618549,"An Act Concerning Children's Exposure To Chemicals."
SB00127,621320,"An Act Concerning The Department Of Banking."
SB00128,621339,"An Act Concerning Economic Development."
SB00129,621443,"An Act Concerning Protection Of Exempt Funds In Bank Accounts."
SB00130,621417,"An Act Concerning The Payment Of First Or Secondary Mortgage Loan Proceeds By Wire Transfer."
SB00131,621422,"An Act Increasing Funding For Brownfield Remediation Projects."
SB00132,621298,"An Act Concerning Funding For The Consortium Of Connecticut Art Museums."
SB00133,621402,"An Act Concerning Energy Assistance Programs For Low-income Customers."
SB00134,621378,"An Act Appropriating Funds To The Clean Energy Finance And Investment Authority."
SB00135,621412,"An Act Concerning The Public, Educational And Governmental Programming And Education Technology Investment Account."
SB00136,621327,"An Act Increasing The Fee For Lobbyist Registration."
SB00137,621385,"An Act Concerning Eliminating Double Child Care Subsidies."
SB00138,621323,"An Act Expanding Services Under A Medicaid Waiver For Persons With Autism Spectrum Disorder."
SB00139,621316,"An Act Concerning Tweed-new Haven Airport."
SB00140,621399,"An Act Authorizing Bonds Of The State For Improvements To Route 34 And The Reconfiguration Of Orange Street In New Haven."
SB00141,621474,"An Act Authorizing Bonds Of The State For The Eastern Connecticut Performing Arts Association."
SB00142,621311,"An Act Requiring The Consideration Of The Unemployment Rates Of Municipalities When Making Allocations Under State Economic Incentive Programs."
SB00143,621346,"An Act Authorizing Bonds Of The State For The Connecticut Trolley Museum In The Town Of East Windsor."
SB00144,621314,"An Act Concerning A Reduction In The Tax On Gasoline."
SB00145,621317,"An Act Concerning Reduced Fares On The Metro-north Railroad."
SB00146,621457,"An Act Excluding Overtime Pay From The Calculation Of State Employee Pension Benefits."
SB00147,621435,"An Act Concerning The Constitutional Spending Cap."
SB00148,621381,"An Act Concerning Funding For The Auditors Of Public Accounts."
SB00149,621448,"An Act Preventing The Introduction Of Keno In The State."
SB00150,621379,"An Act Concerning Filing Fees For Annual Reports That Are Electronically Filed By Limited Partnerships And Limited Liability Companies."
SB00151,621337,"An Act Concerning Contract Compliance Requirements For The Metropolitan District Of Hartford."
SB00152,621463,"An Act Concerning Court Support Services."
SB00153,621358,"An Act Concerning The Recommendations Of The Connecticut Sentencing Commission With Respect To Certificates Of Rehabilitation."
SB00154,621469,"An Act Concerning Probate Court Operations."
SB00155,621395,"An Act Concerning Probate Courts."
SB00156,621453,"An Act Concerning The Desecration Of Property Located In A Cemetery."
SB00157,621355,"An Act Authorizing Bonds Of The State For The Subase Youth Center In Groton."
SB00158,621310,"An Act Reopening Eligibility For The Rental Rebate Program."
SB00159,621340,"An Act Concerning A Reduction In The Gas Tax."
SB00160,621393,"An Act Concerning The Income Tax Treatment Of Social Security Benefits."
SB00161,621342,"An Act Concerning Fully Funding The Elderly Nutrition Program."
SB00162,621313,"An Act Increasing The Personal Needs Allowance For Certain Long-term Care Facility Residents."
SB00163,621330,"An Act Expanding Income Eligibility For The Connecticut Home-care Program For The Elderly."
SB00164,621444,"An Act Increasing Funding For The Dial-a-ride Program."
SB00165,621356,"An Act Redefining Terms Concerning The Spending Cap."
SB00166,621440,"An Act Concerning An Exemption From Personal Income Tax For Social Security Income."
SB00167,621467,"An Act Concerning A Tax Credit For Long-term Care Insurance."
SB00168,621369,"An Act Repealing The Business Entity Tax."
SB00169,621450,"An Act Appropriating Moneys To The Department Of Public Health For Breast Cancer Research And Education."
SB00170,621446,"An Act Concerning Funding Of The Soldiers, Sailors And Marines Fund."
SB00171,621396,"An Act Concerning A Phase-out Of The Hospitals Tax."
SB00172,621301,"An Act Concerning Transportation Infrastructure Improvements For East Hartford."
SB00173,622411,"An Act Concerning An Income Tax Deduction For Long-term Care Insurance Premiums."
SB00174,622301,"An Act Concerning Fairness In Medicaid Eligibility Determinations For Home-care Clients."
SB00175,622479,"An Act Concerning A Study Of Emergency Power Needs In Public Housing For The Elderly."
SB00176,622367,"An Act Concerning The Purchase Of Medicare Supplement Policies By Qualified Medicare Beneficiaries."
