bill_number,bill_id,title
SJR10,884610,"Resource Conservation and Development Week, week of September 21st, recognized"
SJR11,884607,"Brown, Jesse C., II, outstanding professional service, commended"
SJR12,884606,"Buddy Cox Memorial Highway, portion of Interstate Highway 65, named"
SJR13,884616,"Southern Research, 75th anniversary, recognized"
SJR14,884622,"Hill, Michael E., commended"
SJR15,884627,"Bennett, Jim, death mourned"
SJR16,884643,"Supreme Court, urged to rule expeditiously"
SJR17,884646,"Taylor, Hilda Leigh Dismukes, death mourned"
SJR18,884644,"Plight of Veterans, urging awareness of"
SJR19,884663,"Veterans Memorial Bridge, the Eastside Bridge on Alabama State Highway 35 in Jackson County, named"
SJR21,884664,"Drummond, Garry Neil, Sr., death mourned"
SJR23,884680,"Olympic athletes, urging Congress to exempt taxes on Olympic winnings"
SJR24,884681,"Alabama Public Television, commended"
SJR28,884728,"Secretary of State, directed to include Senate Bill 7, 2016 First Special Session, to the 2016 General Election ballot"
SJR30,885566,"Dellinger, LaFaye, outstanding professional achievement, commended"
SJR31,885575,"Bowen, David, distinguished public service, commended"
SJR32,885556,"Hragyil, Mark, distinguished public service, commended"
SJR33,885558,"Taylor, James M., III., commended"
