bill_number,bill_id,title
SB469,117158,"Schools; authorizing Oklahoma Commission for Teacher Preparation to offer professional development institute in scientifically research-based instructional strategies for teachers of English language learners and children in poverty. Effective date. Emergency."
SB470,117159,"Schools; placing burden of proof on school districts in special education proceedings. Effective date. Emergency."
SB471,117160,"Higher education; increasing family income limitation for Oklahoma Higher Learning Access Program eligibility. Effective date. Emergency."
SB472,117161,"Schools; establishing notification and reporting requirements for students educated by other means; removing exemption from truancy and temporary detention provisions. Effective date. Emergency."
SB473,117162,"Schools; providing additional criteria under which a school performance review may be conducted by Office of Accountability. Effective date. Emergency."
SB474,117163,"Electric suppliers; providing guidelines for tree trimming. Effective date. Emergency."
SB475,117164,"State government; creating the Oklahoma Department on Aging. Effective date. Emergency."
SB476,117165,"Statutes and reports; authorizing electronic transmission of bills and resolutions for prefiling. Effective date."
SB477,117166,"Public health and safety; creating the Compassionate Assistance for Rape Victims Emergency (CARE) Act. Effective date."
SB478,117167,"Children; modifying requirements for child care facility liability insurance. Emergency."
SB479,117168,"Professions and occupations; creating the Oklahoma Interventional Pain Management and Treatment Act. Emergency."
SB480,117169,"Cities and towns; relating to annexation; providing for award of attorney fees to prevailing owner in certain circumstances. Effective date."
SB481,117170,"Revenue and taxation; relating to ad valorem tax; requiring Oklahoma Tax Commission to prescribe form for taxpayer information for tax assessment. Effective date."
SB482,117171,"Capitol and capitol buildings; creating the Oklahoma Capitol Restoration Act. Emergency."
SB483,117172,"Public safety; directing Department of Public Safety to establish procedures to access computerized images. Effective date."
SB484,117173,"Motor vehicles; requiring mail notification of driver license expiration. Effective date."
SB485,117174,"Workers' Compensation; modifying provisions relating to election of physician. Effective date."
SB486,117175,"Revenue and taxation; relating to cost of visual inspection of property for ad valorem taxation; requiring contracts as part of budget to be on specified basis. Effective date."
SB487,117176,"Officers; relating to community health care providers; modifying procedures for the Volunteer Professional Services Immunity Act. Effective date."
SB488,117177,"Oil and gas; clarifying statutory reference. Emergency."
SB489,117178,"Revenue and taxation; extending sales tax exemption to surviving spouse of disabled veteran and providing limit; providing for a misdemeanor. Effective date."
SB490,117179,"Public finance; modifying number of persons required to institute certain suit. Effective date."
SB491,117180,"Oil and gas; clarifying statutory reference. Emergency."
SB492,117181,"Geologic storage of carbon dioxide; creating the Geologic Sequestration Activities Act. Effective date."
SB493,117182,"Public finance; modifying membership of the Economic Development Generating Excellence (EDGE) Fund Policy Board. Effective date."
SB494,117183,"Family planning; creating the Right to Choose Life Act. Effective date."
SB495,117184,"Insurance; requiring coverage for prescription contraception in certain circumstances. Effective date."
SB496,117185,"Public health and safety; specifying eligibility for Medicaid Income Pension Trusts. Effective date. Emergency."
SB497,117186,"Schools; providing for reporting of business and industry-recognized endorsements attained on student transcripts. Effective date."
SB498,117187,"State Auditor and Inspector; modifying requirements for audits and financial statements. Effective date. Emergency."
SB499,117188,"Council on Judicial Complaints; relating to dual office holding; providing exemption. Effective date."
SB500,117189,"Public safety; relating to motor carriers; expanding exemption for certain permit. Effective date. Emergency."
SB501,117190,"Revenue and taxation; clarifying language. Effective date."
SB502,117191,"Revenue and taxation; clarifying language. Effective date."
SB503,117192,"Motor vehicles; creating the Household Goods Act of 2009. Effective date."
SB504,117193,"Telemarketing Restriction Act; modifying definition of consumer. Effective date."
SB505,117194,"Cities and towns; relating to the city planning commission; modifying membership. Effective date."
SB506,117195,"Definitions and general provisions; designating the Lawton Rangers the official horse riding club of the State of Oklahoma. Effective date."
SB507,117196,"State government; creating the Deferred Maintenance Revolving Fund for the Department of Central Services. Emergency."
SB508,117197,"Scenic Rivers Act; authorizing commission to expend funds within certain counties. Emergency."
SB509,117198,"Schools; relating to alternative governance arrangements; modifying provisions related to alternative governance procedures. Emergency."
SB510,117199,"Cities and towns; requiring municipalities to test fire hydrants; requiring agencies to promulgate rules. Effective date."
SB511,117200,"Environment and natural resources; modifying call log procedures for highway hazardous waste remediation. Effective date. Emergency."
SB512,117201,"Oil and gas; clarifying statutory language. Emergency."
SB513,117202,"Public health and safety; modifying authorized expenditures of the Oklahoma Emergency Response Systems Stabilization and Improvement Revolving Fund. Effective date. Emergency."
SB514,117203,"Crimes and punishments; prohibiting storage of firearms in certain manner under specified circumstances. Effective date."
SB515,117204,"Public health and safety; creating a misdemeanor for certain use of driver license or identification card information. Emergency."
SB516,117205,"Motor vehicles; providing for special license plate demonstrating support for National Weather Center. Effective date."
SB517,117206,"Cities and towns and revenue and taxation; requiring notice and procedures relating to sales tax when territory is annexed. Effective date."
SB518,117207,"Criminal procedure; relating to the Oklahoma Crime Victims Compensation Act; modifying scope of certain reimbursable cost; relating to victim impact statements; adding grandparent to definition of members of the immediate family. Effective date."
SB519,117208,"Revenue and taxation; providing transferable tax credits against various types of tax liability to a qualified housing component manufacturing facility. Effective date."
SB520,117209,"Roads, bridges and ferries; designating Wes and Lou Watkins Highway. Emergency."
SB521,117210,"Public finance; creating Oklahoma Centennial Botanical Garden Authority Revolving Fund."
SB522,117211,"Torts; specifying asbestos-related liability for corporations. Effective date."
SB523,117212,"State government; relating to sale of state property; expanding types of property subject to requirements. Effective date. Emergency."
SB524,117213,"Soldiers and sailors; requiring employers to allow employees to take leave under certain circumstances. Emergency."
SB525,117214,"Schools; relating to the Ardmore Higher Education Program; authorizing the Board of Trustees to establish plans and benefits for its employees. Effective date. Emergency."
SB526,117215,"Amusements and sports and labor; modifying authorized use of Oklahoma Education Lottery Trust Fund; requiring school districts to provide for a living wage for employees. Effective date. Emergency."
SB527,117216,"Labor; requiring an employer to reimburse an employee for fees or costs relating to a check that a bank refuses to honor due to insufficient funds or a stop payment notice; modifying the required size of notices. Effective date."
SB528,117217,"Corrections; authorizing meals for correctional personnel. Effective date. Emergency."
SB529,117218,"Revenue and taxation; providing sales tax exemption for property and services relating to funerals; providing exception. Effective date."
SB530,117219,"Crimes and punishments; adding assault and battery upon a peace officer offense to mandatory minimum sentence list. Effective date."
SB531,117220,"Insurance; clarifying language. Effective date."
SB532,117221,"Insurance; providing procedures regarding the verification of payment of health care services by insurers. Effective date."
SB533,117222,"Motor vehicle insurance; modifying procedures relating to uninsured motorists coverage. Effective date."
SB534,117223,"Commercial telephone solicitation; clarifying reference. Effective date."
SB535,117224,"Fair Pay for Construction Act; clarifying references. Effective date."
SB536,117225,"Fair Pay for Construction Act; deleting exceptions. Effective date."
SB537,117226,"Revenue and taxation; modifying definition relating to sales tax exemption for manufacturers. Effective date."
SB538,117227,"Crimes and punishments; prohibiting making a false report of an alleged criminal wrongdoing to any law enforcement agency or prosecuting attorney's office; setting penalty. Effective date. Emergency."
SB539,117228,"Criminal procedure; relating to the victims and witnesses rights; expanding scope of rights; stating certain duty of law enforcement officer; providing written victim notification; Effective date. Emergency."
SB540,117229,"Revenue and taxation; providing income tax exemption for certain surviving spouses. Effective date."
SB541,117230,"Public health and safety; modifying certificate of need fees for long-term care facilities. Emergency."
SB542,117231,"Revenue and taxation; providing sales tax exemption for over-the-counter drugs and food, food products and beverages. Effective date."
SB543,117232,"Revenue and taxation; defining little cigar relating to tax on tobacco products. Effective date. Emergency."
SB544,117233,"Public health and safety; restricting minors' access to tanning devices. Effective date."
SB545,117234,"Waters and water rights; modifying water moratorium criteria. Emergency."
SB546,117235,"Professions and occupations; creating the Therapeutic Recreation Practice Act. Effective date."
SB547,117236,"Civil procedure; clarifying language. Effective date."
SB548,117237,"Criminal procedure; requiring establishment of drug court programs. Effective date."
SB549,117238,"Insurance; clarifying statutory reference. Effective date."
SB550,117239,"Waters and water rights; prioritizing water permit applications for in-state applicants. Emergency."
SB551,117240,"State government; specifying exceptions for Department of Environmental Quality contracts; relating to minimum annualized salary; modifying exceptions for salary adjustments."
SB552,117241,"Oil and gas; modifying procedures relating to payment of surface damages from seismic exploration activities. Effective date."
SB553,117242,"Insurance; relating to the Health Insurance High Risk Pool Act; modifying definitions and providing exceptions; relating to extension and termination of group accident and health coverage; expanding scope of coverage; expanding coverage period. Emergency."
SB554,117243,"Insurance; clarifying language. Effective date."
SB555,117244,"Teachers' Retirement System of Oklahoma; modifying post-retirement earnings limit. Effective date. Emergency."
SB556,117245,"Oil and gas; modifying notification relating to surface damages. Effective date."
SB557,117246,"Juvenile justice; creating the Oklahoma Juvenile Justice Reform Committee. Emergency."
SB558,117247,"Eminent domain; modifying definitions. Emergency."
SB559,117248,"Revenue and taxation; modifying income tax exemption for certain retirement benefits. Effective date."
SB560,117249,"State government; removing Oklahoma Board of Nursing from executive salary listing. Effective date. Emergency."
SB561,117250,"Schools; requiring goal to reduce electric consumption; requiring conservation. Emergency."
SB562,117251,"Oklahoma Public Employees Retirement System; allowing elected officials to make maximum contribution rate under certain conditions. Effective date. Emergency."
SB563,117252,"Oklahoma Public Employees Retirement System; modifying normal retirement date. Effective date. Emergency."
SB564,117253,"Crimes and punishments; relating to false or bogus checks; modifying definition; prohibiting a bogus check from being considered credit. Effective date."
SB565,117254,"Railroads; relating to the acquisition of land; modifying method of demanding a jury trial. Effective date."
SB566,117255,"Elections; extending hours for in-person absentee voting for elections. Effective date."
SB567,117256,"Revenue and taxation; modifying eligibility for and amount of Sales Tax Relief Act under specified circumstances; providing for annual adjustment of income amounts. Effective date."
SB568,117257,"Public health and safety; clarifying language. Effective date."
SB569,117258,"Courts; clarifying language. Effective date."
SB570,117259,"Criminal procedure; clarifying statutory reference. Effective date."
SB571,103793,"Public health and safety; relating to the statewide nine-one-one advisory board; adding definitions; stating contents of report; requiring report. Effective date."
SB572,103794,"Public health and safety; prohibiting health regulations from being more stringent than state law; exemptions. Effective date."
SB573,103795,"Public buildings and public works; relating to retainage of payments in certain construction contracts; reducing maximum percentage of retainage allowed in construction contracts. Emergency."
SB574,117260,"Motor vehicles; deleting authorization for Northern Cherokee Nation of the Old Louisiana Territory special license plate. Effective date."
SB575,117261,"Motor vehicles; modifying time limits for registration of used vehicles. Effective date."
SB576,117262,"Professions and occupations; modifying membership of the Construction Industries Board. Effective date. Emergency."
SB577,117263,"Professions and occupations; clarifying language relating to the Electrical License Act. Effective date."
SB578,117264,"Intoxicating liquors; clarifying language relating to reports by manufacturers and wholesalers. Effective date."
SB579,117265,"Debtor and creditor; amending and adding various provisions in the Credit Services Organization Act. Effective date."
SB580,117266,"Professions and occupations; permitting long-term care pharmacies to maintain emergency electronic medication kits. Effective date."
SB581,117267,"State government; authorizing the Department of Corrections to establish a Career Incentive Bonus Program for employees. Effective date. Emergency."
SB582,117268,"Schools; relating to alternative teacher certification; providing for licensure and certification of individuals eligible through the Troops to Teachers and Passport to Teaching programs. Effective date."
SB583,117269,"Corrections; relating to the Private Prison and Halfway House Capacity Development Revolving Fund; clarifying language. Effective date."
SB584,117270,"Revenue and taxation; modifying and increasing income tax exemption for specified employers; creating new exemption for specified employers. Effective date."
SB585,117271,"Open records; providing for confidentiality of campus security plans for public educational institutions. Effective date. Emergency."
SB586,117272,"Schools; authorizing sponsorship of charter schools by federally recognized Indian tribes or a statewide organization that represents and whose members are public school teachers. Effective date."
SB587,117273,"Eminent domain; restricting power. Emergency."
SB588,117274,"Counties and county officers; allowing contracts with private attorneys; authorizing board of county commissioners to employ general counsel. Effective date."
SB589,117275,"Agriculture; clarifying statutory reference. Effective date."
SB590,117276,"Agriculture; clarifying statutory language. Effective date."
SB591,117277,"Agriculture; clarifying language. Effective date."
SB592,117278,"Professions and occupations; relating to the State Architectural and Registered Interior Designers Act; changing the name of the Act and the Board; modifying powers of the Board; providing for registered interior designers. Effective date. Emergency."
SB593,117279,"Public health and safety; creating the Joint Legislative Oversight Committee for Long-Term Care. Effective date. Emergency."
SB594,117280,"Public health and safety; creating a food employee education and certification program. Effective date."
SB595,117281,"Children; creating the Juvenile Justice Public Works Act. Effective date."
SB596,117282,"Medicaid; disapproving part of Oklahoma Health Care Authority Board rules. Effective date."
SB597,117283,"Mental health; permitting persons to be transported to out-of-state facilities. Effective date."
SB598,117284,"Mental health; modifying provisions related to the Department of Mental Health and Substance Abuse Services. Effective date."
SB599,117285,"Fees; modifying certain State Board of Health fees. Effective date. Emergency."
SB600,117286,"Revenue and taxation; exempting sales of food and beverages from state sales tax; providing exception from exemption for local jurisdictions. Effective date. Emergency."
SB601,117287,"Revenue and taxation; broadening applicability of limit on homestead exemptions; requiring signed statement. Effective date."
SB602,117288,"Oklahoma Real Estate License Code; prohibiting the Oklahoma Real Estate Commission from issuing licenses for felony convictions or pleas. Effective date."
SB603,117289,"Schools; creating the Task Force on Concurrent Enrollment. Effective date. Emergency."
SB604,117290,"Schools; creating Task Force on Internet-Based Instruction. Effective date. Emergency."
SB605,117291,"School security; establishing Oklahoma School Security Grant Program Act; directing Oklahoma Office of Homeland Security to solicit proposals and make grants for campus security to certain institutions. Effective date. Emergency."
SB606,117292,"Schools; creating the School Protection Act. Effective date."
SB607,117293,"Schools; creating the Oklahoma School for the Visual and Performing Arts. Effective date. Emergency."
SB608,117294,"Revenue and taxation; amending various provisions relating to cigarette and tobacco taxes. Effective date."
SB609,117295,"Workers' Compensation; modifying positions of the Court; requiring confirmation by the Senate. Effective date."
SB610,117296,"Geologic storage of carbon dioxide; creating the Oklahoma Carbon Capture and Geologic Sequestration Act; stating regulatory authority. Effective date."
SB611,117297,"Criminal procedure; authorizing use of DNA report. Effective date."
SB612,117298,"Criminal procedure; modifying notice requirements; modifying requirements for compensation for certain services. Effective date."
SB613,117299,"Criminal procedure; prohibiting deferred sentence under certain circumstances; modifying definition; authorizing officials to witness executions. Effective date."
SB614,117300,"Criminal procedure; modifying supervision fee; deleting sunset provision. Effective date. Emergency."
SB615,117301,"Probate procedure; establishing exception to lien liability. Effective date."
SB616,117302,"Corporations; modifying fees. Effective date."
SB617,117303,"Revenue and taxation; clarifying language relating to Oklahoma Tax Code. Effective date."
SB618,117304,"Motor vehicles; modifying eligibility requirements for vehicle registration; limiting application of reduced registration fee. Effective date."
SB619,117305,"Animals; clarifying language. Effective date."
SB620,117306,"Revenue and taxation; modifying circumstances in which county lodging tax is inapplicable. Emergency."
SB621,117307,"Public finance; clarifying reference. Effective date."
SB622,117308,"Public health and safety; creating the Oklahoma Uniform Anatomical Gift Act. Effective date."
SB623,117309,"Counties and county officers; clarifying statutory reference. Effective date."
SB624,117310,"Counties and county officers; clarifying statutory reference. Effective date."
SB625,117311,"Game and fish; clarifying language. Effective date."
SB626,117312,"Game and fish; clarifying statutory reference. Effective date."
SB627,117313,"Game and fish; clarifying language. Effective date."
SB628,117314,"Game and fish; clarifying language. Effective date."
SB629,117315,"Game and fish; clarifying language. Effective date."
SB630,117316,"Agriculture; clarifying statutory reference. Effective date."
SB631,117317,"Agriculture; clarifying statutory reference. Effective date."
SB632,117318,"Public safety; creating the Matt Evans/Jeff Rominger Interoperable Communications Act. Effective date."
SB633,117319,"Higher education; providing resident tuition for students with a grandparent who is a state resident and has filed a state tax return for ten years. Effective date."
SB634,117320,"Higher education; repealing eligibility for enrollment and resident tuition for undocumented immigrants. Effective date."
SB635,117321,"Agriculture; relating the Oklahoma Milk and Milk Products Act; modifying entity authorized to issue permits and inspect premises; requiring fee. Effective date."
SB636,117322,"Agriculture; relating to powers and duties of the Board; making it unlawful for persons to misrepresent the quantity determined by weights and measures. Effective date. Emergency."
SB637,117323,"Animals; clarifying statutory reference. Effective date."
SB638,117324,"Public power; providing procedures in lieu of payment for generation facilities. Effective date."
SB639,117325,"Animals; clarifying statutory reference. Effective date."
SB640,117326,"Public finance; providing short title. Effective date. Emergency."
SB641,117327,"Schools; prohibiting alcohol on all public high school campuses; defining terms; requiring dating violence education. Effective date."
SB642,117328,"Health care; creating the Medical Price Transparency Act. Effective date."
SB643,117329,"State Capitol building; modifying space under management and control of Legislature. Effective date."
SB644,117330,"Revenue and taxation; expanding income tax rebate to include video game production and development. Effective date."
SB645,117331,"Professions and occupations; amending provisions relating to exemptions, qualifications for licensure and continuing education in the Home Inspection Licensing Act. Effective date."
SB646,117332,"State government; creating the Accountability, Innovation and Privatization Act. Effective date. Emergency."
SB647,117333,"Criminal justice; transferring the Criminal Justice Resource Center to the Oklahoma State Bureau of Investigation and Office of Attorney General. Effective date. Emergency."
SB648,117334,"State government; creating the Oklahoma Certified Retirement City Program Act. Effective date."
SB649,117335,"Waters and water rights; authorizing the Oklahoma Water Resources Board to promulgate rules governing metering in sensitive sole source groundwater basins. Effective date. Emergency."
SB650,117336,"Waters and water rights; directing the Oklahoma Water Resources Board to establish a technical review group. Effective date. Emergency."
SB651,117337,"Game and fish; modifying prohibitions. Effective date."
SB652,117338,"Public libraries; clarifying reference. Effective date."
SB653,117339,"Corrections; relating to judicial review; modifying report requirements. Emergency."
SB654,117340,"Motor vehicles; clarifying references. Effective date."
SB655,117341,"Waters and water rights; stating priority for in-state water permit applications. Emergency."
SB656,117342,"Higher education; modifying Oklahoma Higher Learning Access Program; including payment of mandatory fees and portion of costs of required textbooks. Effective date. Emergency."
SB657,117343,"Schools; directing the State Board of Career and Technology Education to increase the number of Dropout Recovery Programs contingent on the availability of funds. Effective date. Emergency."
SB658,117344,"Motor vehicles; increasing penalty for failure to register vehicles within specified time period; providing for distribution of penalty amounts. Effective date. Emergency."
SB659,117345,"Children; modifying procedures related to postadjudication review boards. Effective date."
SB660,117346,"Corporations; setting effective date."
SB661,117347,"Public health; directing the Commissioner of Health to develop grant program. Effective date."
SB662,117348,"Roads, bridges and ferries; designating Representative Terry Hyman Memorial Highway. Emergency."
SB663,117349,"Higher education; requesting the Oklahoma State Regents for Higher Education to establish certain combined degree program. Effective date."
SB664,117350,"Professions and occupations; creating the Oklahoma Fair Debt Collection Practices Act. Effective date."
SB665,117351,"Professions and occupations; relating to the Electrical License Act; modifying provisions relating to the application and construction of the Act. Effective date."
SB666,117352,"Lawsuit reform; modifying provisions. Effective date."
SB667,117353,"Counties and county officers; authorizing counties to make schedules and information about meetings available on the Internet. Effective date."
SB668,117354,"Counties and county officers; creating the Oklahoma Energy Independence Act Emergency."
SB669,117355,"State government; authorizing the Department of Central Services to acquire real property under certain circumstances. Effective date."
SB670,117356,"State government; relating to voluntary payroll deductions; increasing membership requirement; setting out changes which simplify calculations of the value of donated leave. Effective date. Emergency."
