bill_id,date,action
124543,2009-01-07,"House Introduced 1/7/2009 and Referred to Ways and Means; House Journal  8, PG.126 "
124543,2009-02-25,"House Public Hearing: 3/5/2009 2:30 PM Legislative Office Building 202 "
124543,2009-03-11,"House Subcommittee Work Session: 3/13/2009 1:30 PM Legislative Office Building 201 "
124543,2009-03-11,"House ===CANCELLED=== Work Session: 3/18/2009 2:30 PM Legislative Office Building 202 "
124543,2009-03-11,"House Executive Session: 3/18/2009 9:00 Amendment Legislative Office Building 202 (Continued 3/19/09 9:00 Amendment Legislative Office Building 202 If Needed) "
124543,2009-03-19,"House Retained in Committee "
124543,2009-07-21,"House Retained Bill - Subcommittee Work Session: 8/12/2009 10:00 Amendment Legislative Office Building 202 "
124543,2009-08-12,"House Retained Bill - Subcommittee Work Session: 8/25/2009 1:00 PM Legislative Office Building 202 "
124543,2009-10-27,"House Retained Bill - Subcommittee Work Session: 11/12/2009 1:00 PM Legislative Office Building 202 "
124543,2009-11-02,"House Retained Bill - Executive Session: 11/18/2009 10:00 Amendment Legislative Office Building 202 ==TIME CHANGE (Orig 9:00 Amendment)== "
124543,2009-11-19,"House Committee Report: Inexpedient to Legislate for Jan 6 Consent Calendar (vote 16-1); House Calendar 2, PG.86 "
124543,2010-01-06,"House Inexpedient to Legislate: Motion Adopted Voice Vote; House Journal  6, PG.268 "
124544,2009-12-10,"House Introduced 1/6/2010 and Referred to Judiciary; House Journal  6, PG.248 "
124544,2010-01-06,"House Public Hearing: 1/21/2010 1:30 PM Legislative Office Building 208 "
124544,2010-01-26,"House Executive Session: 2/2/2010 10:00 Amendment Legislative Office Building 208 "
124544,2010-02-17,"House Majority Committee Report: Inexpedient to Legislate for Mar 3 Regular Calendar (Vote 10-8); House Calendar 17, PG.821-822 "
124544,2010-02-17,"House Minority Committee Report: Ought to Pass; House Calendar 17, PG.822 "
124544,2010-03-03,"House Inexpedient to Legislate: Motion Adopted Regular Calendar 188-135; House Journal  20, PG.1169-1171 "
124545,2010-01-06,"House Introduced and Referred to Judiciary; House Journal  6, PG.249 "
124545,2010-01-06,"House Public Hearing: 1/14/2010 10:30 Amendment Legislative Office Building 208 "
124545,2010-01-26,"House Executive Session: 2/2/2010 10:00 Amendment Legislative Office Building 208 "
124545,2010-02-10,"House Committee Report: Inexpedient to Legislate for Feb 17 Regular Calendar (vote 14-3); House Calendar 14, PG.606 "
124545,2010-02-17,"House Inexpedient to Legislate: Motion Adopted Division Vote 286-32; House Journal  18, PG.1001 "
124546,2009-12-10,"House Introduced 1/6/2010 and Referred to Ways and Means; House Journal  6, PG.249 "
124546,2009-12-22,"House Public Hearing: 1/14/2010 2:00 PM Legislative Office Building 202 "
124546,2010-01-26,"House Executive Session: 2/4/2010 10:00 Amendment Legislative Office Building 202 "
124546,2010-02-10,"House Committee Report: Inexpedient to Legislate for Feb 17 Consent Calendar (vote 18-1); House Calendar 14, PG.599 "
124546,2010-02-17,"House Inexpedient to Legislate: Motion Adopted Voice Vote; House Journal  18, PG.979 "
124547,2009-12-10,"House Introduced 1/6/2010 and Referred to Ways and Means; House Journal  6, PG.249 "
124547,2010-01-12,"House Public Hearing: 1/19/2010 10:20 Amendment Legislative Office Building 202 "
124547,2010-01-20,"House Executive Session: 1/26/2010 10:00 Amendment Legislative Office Building 202 (Continued 1/27/2010 10:00 Amendment Legislative Office Building 202 If Necessary) "
124547,2010-01-27,"House Majority Committee Report: Inexpedient to Legislate for Feb 3 Regular Calendar (vote 13-3); House Calendar 11, PG.471 "
124547,2010-01-27,"House Minority Committee Report: Ought to Pass; House Calendar 11, PG.471 "
124547,2010-02-03,"House Inexpedient to Legislate: Motion Adopted Regular Calendar 239-108; House Journal  15, PG.711-713 "
124548,2009-12-10,"House Introduced 1/6/2010 and Referred to Ways and Means; House Journal  6, PG.249 "
124548,2010-01-12,"House Public Hearing: 1/19/2010 10:40 Amendment Legislative Office Building 202 "
124548,2010-01-20,"House Executive Session: 1/26/2010 10:00 Amendment Legislative Office Building 202 (Continued 1/27/2010 10:00 Amendment Legislative Office Building 202 If Necessary) "
124548,2010-01-27,"House Committee Report: Inexpedient to Legislate for Feb 3 Consent Calendar (vote 16-0); House Calendar 11, PG.465 "
124548,2010-02-03,"House Inexpedient to Legislate: Motion Adopted Voice Vote; House Journal  15, PG.672 "
124549,2009-12-10,"House Introduced 1/6/2010 and Referred to Election Law; House Journal  6, PG.249 "
124549,2010-01-05,"House Public Hearing: 1/19/2010 10:00 Amendment Legislative Office Building 308 "
124549,2010-01-06,"House Executive Session: 1/26/2010 10:00 Amendment Legislative Office Building 308 "
124549,2010-01-26,"House Committee Report: Inexpedient to Legislate for Feb 3 Consent Calendar (vote 17-1); House Calendar 11, PG.461 "
124549,2010-02-03,"House Inexpedient to Legislate: Motion Adopted Voice Vote; House Journal  15, PG.668 "
124550,2009-12-10,"House Introduced 1/6/2010 and Referred to Ways and Means; House Journal  6, PG.249 "
124550,2010-01-12,"House Public Hearing: 1/19/2010 10:00 Amendment Legislative Office Building 202 "
124550,2010-01-20,"House Executive Session: 1/26/2010 10:00 Amendment Legislative Office Building 202 (Continued 1/27/2010 10:00 Amendment Legislative Office Building 202 If Necessary) "
124550,2010-01-28,"House Majority Committee Report: Inexpedient to Legislate for Feb 3 Regular Calendar (vote 10-6); House Calendar 11, PG.471 "
124550,2010-01-28,"House Minority Committee Report: Ought to Pass; House Calendar 11, PG.471 "
124550,2010-02-03,"House Inexpedient to Legislate: Motion Adopted Regular Calendar 221-136; House Journal  15, PG.713-715 "
124550,2010-02-03,"House Print Rep Kurk's Remarks in Permanent Journal (Rep W.D.Scamman): Motion Adopted Voice Vote; House Journal  15, PG.715-716 "
124551,2009-12-10,"House Introduced 1/6/2010 and Referred to Finance; House Journal  6, PG.249 "
124551,2010-01-05,"House Public Hearing: 1/19/2010 10:00 Amendment Legislative Office Building 210-211 "
124551,2010-01-05,"House Full Committee Work Session: 1/20/2010 10:00 Amendment Legislative Office Building 210-211 "
124551,2010-01-05,"House Executive Session: 1/26/2010 10:00 Amendment Legislative Office Building 210-211 "
124551,2010-01-28,"House Committee Report: Inexpedient to Legislate for Feb 3 Regular Calendar (vote 19-0); House Calendar 11, PG.469 "
124551,2010-02-03,"House Inexpedient to Legislate: Motion Adopted Regular Calendar 233-125; House Journal  15, PG.686-688 "
124552,2009-12-10,"House Introduced 1/6/2010 and Referred to Judiciary; House Journal  6, PG.249 "
124552,2010-01-06,"House Public Hearing: 1/20/2010 1:00 PM Legislative Office Building 206-208 "
124552,2010-02-04,"House Executive Session: 2/9/2010 10:00 Amendment Legislative Office Building 208 "
124552,2010-02-11,"House Majority Committee Report: Inexpedient to Legislate for Feb 17 Regular Calendar (Vote 12-8); House Calendar 14, PG.606 "
124552,2010-02-11,"House Minority Committee Report: Ought to Pass; House Calendar 14, PG.606 "
124552,2010-02-17,"House Postpone Definitely to Mar 17 (Rep Bates): Motion Failed Regular Calendar 148-191; House Journal  18, PG.1001-1003 "
124552,2010-02-17,"House Inexpedient to Legislate: Motion Adopted Regular Calendar 201-135; House Journal  18, PG.1001-1005 "
124552,2010-02-17,"House Reconsideration (Rep Eaton): Motion Failed Regular Calendar 109-207; House Journal  18, PG.1010-1012 "
124553,2009-12-10,"House Introduced 1/6/2010 and Referred to Children and Family Law; House Journal  6, PG.249 "
124553,2009-12-24,"House ==ROOM CHANGE== Public Hearing: 1/7/2010 1:15 PM Legislative Office Building 201-203 (Orig Legislative Office Building 206) "
124553,2010-01-26,"House Subcommittee Work Session: 2/2/2010 9:30 Amendment Legislative Office Building 206 "
124553,2010-02-11,"House Subcommittee Work Session: 2/16/2010 11:30 Amendment Legislative Office Building 206 "
124553,2010-02-11,"House Executive Session: 2/16/2010 1:15 PM Legislative Office Building 206 "
124553,2010-02-18,"House Committee Report: Inexpedient to Legislate for March 3 Consent Calendar (vote 16-0); House Calendar 17, PG.792 "
124553,2010-03-03,"House Removed from Consent Calendar (Rep Itse); House Journal  20 PG.1094 "
124553,2010-03-03,"House Special Ordered to Next Session Without Objection; House Journal  20, PG.1180 "
124553,2010-03-10,"House Inexpedient to Legislate: Motion Adopted Regular Calendar 249-96; House Journal  23, PG.1264-1267 "
124554,2009-12-10,"House Introduced 1/6/2010 and Referred to Commerce and Consumer Affairs; House Journal  6, PG.249 "
124554,2010-01-05,"House Public Hearing: 1/19/2010 2:15 PM Legislative Office Building 302 "
124554,2010-01-20,"House Executive Session: 1/26/2010 10:00 Amendment Legislative Office Building 302 "
124554,2010-01-27,"House Committee Report: Inexpedient to Legislate for Feb 3 Regular Calendar (vote 18-0); House Calendar 11, PG.467 "
124554,2010-02-03,"House Inexpedient to Legislate: Motion Adopted Voice Vote; House Journal  15, PG.673 "
124555,2010-01-06,"Senate Introduced 1/6/2010 and Referred to Election Law and Veterans' Affairs; Senate Journal 1, Pg.9 "
124555,2010-01-13,"Senate Hearing; January 19, 2010, Room 101, Legislative Office Building, 9:00 a.m.; Senate Calendar 3 "
124555,2010-02-10,"Senate Committee Report: Referred to Interim Study 2/17/10; Senate Calendar 7 "
124555,2010-02-17,"Senate Refer to Interim Study; Regular Calendar 14Y-9N, Motion Adopted; Senate Journal 7, Pg.83 "
124556,2010-01-13,"Senate Introduced and Referred to Judiciary; Senate Journal 2, Pg.31 "
124556,2010-01-27,"Senate Hearing: February 2, 2010, Room 103, State House, 3:15 p.m.; Senate Calendar 5 "
124556,2010-02-02,"Senate Hearing: === RECESSED === February 2, 2010, Room 103, State House, 3:15 p.m. Senate Calendar 6 "
124556,2010-02-03,"Senate Hearing: === RECONVENE === February 9, 2010, Room 103, State House, 3:15 p.m.; Senate Calendar 6 "
124556,2010-03-17,"Senate Committee Report: Ought to Pass 3/24/10; Senate Calendar 12 "
124556,2010-03-24,"Senate Without Objection, Chair moved to Special Order forward; Senate Journal 11, Pg.227 "
124556,2010-03-24,"Senate Ought to Pass, Regular Calendar 24Y-0N, Motion Adopted; OT3rdg; Senate Journal 11, Pg.240 "
124556,2010-03-24,"Senate Passed by Third Reading Resolution; Senate Journal 11, Pg.256 "
124556,2010-03-24,"House Introduced and Referred to Judiciary; House Journal  30, PG.1521 "
124556,2010-03-31,"House Public Hearing: 4/6/2010 10:00 Amendment Legislative Office Building 208 "
124556,2010-04-13,"House Executive Session: 4/20/2010 10:00 Amendment Legislative Office Building 208 ==RECESSED== "
124556,2010-04-20,"House Continued Executive Session: 4/29/2010 10:00 Amendment Legislative Office Building 208 "
124556,2010-05-03,"House Committee Report: Refer to Interim Study for May 12 (Vote 14-3; Regular Calendar); House Journal  37, PG.1743 "
124556,2010-05-12,"House Refer to Interim Study: Motion Adopted Division Vote 281-17; House Journal  41, PG.2088 "
124556,2010-05-12,"House Referred to the Judiciary Committee for Interim Study "
124556,2010-08-31,"House Interim Study - Subcommittee Work Session: 9/28/2010 2:00 PM Legislative Office Building 208 "
124556,2010-09-29,"House Interim Study - Executive Session: 10/27/2010 10:00 Amendment Legislative Office Building 208 "
124557,2010-01-13,"Senate Introduced and Referred to Judiciary; Senate Journal 2, Pg.31 "
124557,2010-01-28,"Senate Hearing: February 9, 2010, Room 103, State House, 2:30 p.m.; Senate Calendar 5 "
124557,2010-03-11,"Senate Committee Report: Inexpedient to Legislate 3/17/10; Senate Calendar 11 "
124557,2010-03-17,"Senate Without Objection, Chair moved to Special-Order CACR 33 to the front of the Calendar; Senate Journal 10, Pg.158 "
124557,2010-03-17,"Senate Inexpedient to Legislate, Regular Calendar 14Y-9N, Motion Adopted, === BILL KILLED === Senate Journal 10, Pg.158 "
124558,2010-01-13,"Senate Introduced and Referred to Judiciary; Senate Journal 2, Pg.31 "
124558,2010-01-28,"Senate Hearing: February 9, 2010, Room 103, State House, 3:00 p.m.; Senate Calendar 5 "
124558,2010-03-11,"Senate Committee Report: Inexpedient to Legislate 3/17/10; Senate Calendar 11 "
124558,2010-03-17,"Senate Without Objection, Chair moved to Special-Order CACR 34 to the front of the Calendar; Senate Journal 10, Pg.158 "
124558,2010-03-17,"Senate Inexpedient to Legislate, Not Voted On "
124558,2010-03-17,"Senate Sen. Lasky Moved Laid on Table, Regular Calendar 14Y-9N, Motion Adopted; Senate Journal 10, Pg.158 "
124559,2009-01-07,"House Introduced 1/7/2009 and Referred to Environment and Agriculture; House Journal  8, PG. 120  "
124559,2009-01-14,"House Public Hearing: 1/29/2009 9:00 Amendment Legislative Office Building 308 "
124559,2009-01-27,"House Subcommittee Work Session: 2/2/2009 1:00 PM Legislative Office Building 308 "
124559,2009-01-29,"House ===CANCELLED=== Work Session: 2/2/2009 1:00 PM Legislative Office Building 308 "
124559,2009-01-29,"House Subcommittee Work Session: 2/3/2009 9:30 Amendment Legislative Office Building 104 "
124559,2009-02-04,"House Executive Session: 2/11/2009 1:00 PM Legislative Office Building 308 (If Needed Continued 2/19/09 9:00 Amendment Legislative Office Building 308) "
124559,2009-02-12,"House Committee Report: Ought to Pass with Amendment #0152h for Mar 4 Consent Calendar (vote 15-0); House Calendar 16, PG.364 "
124559,2009-02-12,"House Proposed Amendment #0152h; House Calendar 15, PG.308 "
124559,2009-03-04,"House Amendment #0152h Adopted, Voice Vote; House Journal  21, PG.579 "
124559,2009-03-04,"House Ought to Pass with Amendment #0152h: Motion Adopted Voice Vote; House Journal  21, PG.579 "
124559,2009-03-04,"House Referred to Executive Departments and Administration; House Journal  21, PG.579 "
124559,2009-03-24,"House Full Committee Work Session: 3/31/2009 1:15 PM Legislative Office Building 306 "
124559,2009-03-25,"House Executive Session: 4/2/2009 10:00 Amendment Legislative Office Building 306 "
124559,2009-04-02,"House Retained in Committee "
124559,2009-05-13,"House ==TIME CHANGE==Retained Bill - Subcommittee Work Session: 5/19/2009 11:30 Amendment Legislative Office Building 306 (Orig 11:00 Amendment) "
124559,2009-05-29,"House ==CANCELLED== Retained Bill - Subcommittee Work Session: 6/9/2009 1:00 PM Legislative Office Building 306 "
124559,2009-07-21,"House Retained Bill - Subcommittee Work Session: 8/6/2009 1:00 PM Legislative Office Building 306 "
124559,2009-08-07,"House Retained Bill - Subcommittee Work Session: 8/25/2009 9:30 Amendment Legislative Office Building 306 "
124559,2009-08-25,"House Retained Bill - Subcommittee Work Session: 9/16/2009 2:00 PM Legislative Office Building 305 "
124559,2009-09-16,"House Retained Bill - Subcommittee Work Session: 9/23/2009 1:00 PM Legislative Office Building 305 "
124559,2009-09-23,"House Retained Bill - Subcommittee Work Session: 9/30/09 10:00 Amendment Legislative Office Building 307 "
124559,2009-09-30,"House Retained Bill - Subcommittee Work Session: 10/6/09 9:00 Amendment Legislative Office Building 306 "
124559,2009-10-06,"House Retained Bill - Subcommittee Work Session: 10/27/09 1:00 PM Legislative Office Building 306 "
124559,2009-10-30,"House Retained Bill - Executive Session: 11/19/2009 10:00 Amendment Legislative Office Building 306 "
124559,2009-11-20,"House Committee Report: Refer to Interim Study for Jan 6 Consent Calendar (vote 16-1); House Calendar 2, PG.81 "
124559,2010-01-06,"House Refer to Interim Study: Motion Adopted Voice Vote; House Journal  6, PG.260 "
124559,2010-03-17,"House Referred to Executive Departments and Administration for Interim Study; House Journal  26, PG.1365 "
124559,2010-05-12,"House Interim Study - Subcommittee Work Session: 5/18/2010 9:45 Amendment Legislative Office Building 306 "
124559,2010-06-09,"House Interim Study - Subcommittee Work Session: 6/15/2010 11:30 Amendment Legislative Office Building 306 "
124559,2010-06-15,"House Interim Study - Subcommittee Work Session: 8/3/2010 1:00 PM Legislative Office Building 306 "
124559,2010-09-17,"House Interim Study - Executive Session: 10/13/2010 10:00 Amendment Legislative Office Building 306 "
124560,2009-01-07,"House Introduced 1/7/2009 and referred to Criminal Justice and Public Safety; House Journal  8, PG. 120 "
124560,2009-01-14,"House Public Hearing: 1/27/2009 10:00 Amendment Legislative Office Building 204 "
124560,2009-02-10,"House Executive Session: 2/17/2009 10:00 Amendment Legislative Office Building 204 "
124560,2009-02-26,"House Retained in Committee "
124560,2009-08-18,"House Retained Bill - Subcommittee Work Session: 8/25/2009 10:00 Amendment Legislative Office Building 204 "
124560,2009-09-24,"House Retained Bill - Executive Session: 11/5/2009 10:00 Amendment Legislative Office Building 204 "
124560,2009-11-09,"House Committee Report: Inexpedient to Legislate for Jan 6 Regular Calendar (vote 15-1); House Calendar 2, PG.91 "
124560,2010-01-06,"House Inexpedient to Legislate: Motion Adopted Voice Vote; House Journal  6, PG.309 "
124561,2009-01-07,"House Introduced 1/7/2009 and referred to Environment and Agriculture; House Journal  8, PG. 120 "
124561,2009-01-14,"House Public Hearing: 1/29/2009 10:30 Amendment Legislative Office Building 308 "
124561,2009-01-29,"House ===CANCELLED=== Work Session: 2/2/2009 2:00 PM Legislative Office Building 308 "
124561,2009-01-29,"House Subcommittee Work Session: 2/3/2009 10:30 Amendment Legislative Office Building 104 "
124561,2009-03-12,"House Executive Session: 3/18/2009 10:00 Amendment Legislative Office Building 308 (Continued 3/19/09 10:00 Amendment Legislative Office Building 308 If Needed) "
124561,2009-03-19,"House Retained in Committee "
124561,2009-05-21,"House Retained Bill - Subcommittee Work Session: 6/2/2009 2:00 PM Legislative Office Building 308 "
124561,2009-09-15,"House Retained Bill - Subcommittee Work Session: 9/29/2009 1:00 PM Legislative Office Building 308 "
124561,2009-10-28,"House ==CANCELLED== Retained Bill - Subcommittee Work Session: 10/10/2009 10:00 Amendment Legislative Office Building 308 "
124561,2009-10-28,"House Retained Bill - Subcommittee Work Session: 11/10/2009 10:00 Amendment Legislative Office Building 308 "
124561,2009-10-29,"House Retained Bill - Executive Session: 11/17/2009 10:00 Amendment Legislative Office Building 307 "
124561,2009-11-19,"House Committee Report: Refer to Interim Study for Jan 6 Consent Calendar (vote 16-0); House Calendar 2, PG.81 "
124561,2010-01-06,"House Refer to Interim Study: Motion Adopted Voice Vote; House Journal  6, PG.258 "
124561,2010-03-17,"House Referred to Environment and Agriculture for Interim Study; House Journal  26, PG.1365 "
124561,2010-09-14,"House Interim Study - Full Committee Work Session: 10/12/2010 1:00 PM Legislative Office Building 308 "
124561,2010-09-14,"House Interim Study - Executive Session: 10/19/2010 10:00 Amendment Legislative Office Building 308 "
124562,2009-01-07,"House Introduced 1/7/2009 and referred to Judiciary; House Journal  8, PG. 120 "
124562,2009-02-03,"House Public Hearing: 2/10/2009 10:00 Amendment Legislative Office Building 208 "
124562,2009-02-18,"House Subcommittee Work Session: 3/3/2008 10:00 Amendment Legislative Office Building 208 "
124562,2009-03-04,"House Executive Session: 3/9/2009 11:00 Amendment Legislative Office Building 208 "
124562,2009-03-10,"House Retained in Committee "
124562,2009-09-14,"House Retained Bill - Subcommittee Work Session: 10/21/2009 10:00 Amendment Legislative Office Building 208 "
124562,2009-10-21,"House Retained Bill - Executive Session: 11/17/2009 10:00 Amendment Legislative Office Building 208 "
124562,2009-11-20,"House Committee Report: Ought to Pass with Amendment #2434h (New Title) for Jan 6 Regular Calendar (vote 18-1); House Calendar 2, PG.95 "
124562,2009-11-20,"House Proposed Committee Amendment #2434h (New Title); House Calendar 1, PG.2 "
124562,2010-01-06,"House Special Ordered to Next Session Date in Regular Calendar Order; House Journal  6, PG.310 "
124562,2010-01-13,"House Amendment #2434h (New Title) Adopted, Voice Vote; House Journal  9, PG.405-406 "
124562,2010-01-13,"House Ought to Pass with Amendment #2434h (New Title): Motion Adopted Division Vote 330-19; House Journal  9, PG.405-406 "
124562,2010-03-24,"Senate Introduced and Referred to Judiciary; Senate Journal 11, Pg.259 "
124562,2010-04-15,"Senate Hearing: April 27, 2010, Room 103, State House, 2:00 p.m.; Senate Calendar 16 "
124562,2010-04-29,"Senate Committee Report: Ought to Pass, 5/5/10; Senate Calendar 18 "
124562,2010-05-05,"Senate Ought to Pass Not Voted On "
124562,2010-05-05,"Senate Sen. Hassan Moved Laid on Table, Motion Adopted, Voice Vote; Senate Journal 17, Pg.388 "
124563,2009-01-07,"House Introduced 1/7/2009 and referred to Judiciary; House Journal  8, PG. 120 "
124563,2009-01-07,"House Public Hearing: 1/14/2009 1:00 PM Legislative Office Building 208 "
124563,2009-02-23,"House Subcommittee Work Session: 3/5/2009 12:00 PM Legislative Office Building 208 "
124563,2009-03-10,"House Executive Session: 3/17/2009 11:00 Amendment Legislative Office Building 208 (Contined 3/18&19/09 11:00 Amendment Legislative Office Building 208 If Needed) "
124563,2009-03-17,"House Retained in Committee "
124563,2009-08-06,"House Retained Bill - Subcommittee Work Session: 9/15/2009 11:00 Amendment Legislative Office Building 208 "
124563,2009-09-15,"House Retained Bill - Subcommittee Work Session: 9/22/2009 10:00 Amendment Legislative Office Building 208 "
124563,2009-10-20,"House Retained Bill - Subcommittee Work Session: 11/17/2009 9:45 Amendment Legislative Office Building 208 "
124563,2009-10-21,"House Retained Bill - Executive Session: 11/17/2009 10:00 Amendment Legislative Office Building 208 "
124563,2009-11-20,"House Committee Report: Ought to Pass with Amendment #2384h for Jan 6 Consent Calendar (vote 19-0); House Calendar 2, PG.83 "
124563,2009-11-20,"House Proposed Committee Amendment #2384h; House Calendar 1, PG.3 "
124563,2010-01-06,"House Amendment #2384h Adopted, Voice Vote; House Journal  6, PG.263 "
124563,2010-01-06,"House Ought to Pass with Amendment #2384h: Motion Adopted Voice Vote; House Journal  6, PG.263 "
124563,2010-03-24,"Senate Introduced and Referred to Public and Municipal Affairs, Senate Journal 11, Pg.259 "
124563,2010-04-22,"Senate Hearing: May 6, 2010, Room 103, Legislative Office Building, 8:50 a.m.; Senate Calendar 17 "
124563,2010-05-06,"Senate Committee Report: Ought to Pass, 5/12/10; Senate Calendar 19 "
124563,2010-05-12,"Senate Ought to Pass, Motion Adopted, Voice Vote; OT3rdg; Senate Journal 18, Pg.479 "
124563,2010-05-12,"Senate Passed by Third Reading Resolution; Senate Journal 18, Pg.496 "
124563,2010-05-19,"Senate Enrolled; Senate Journal 20, Pg.664 "
124563,2010-05-19,"House Enrolled; House Journal  46, PG.2244 "
124563,2010-07-27,"House Vetoed by the Governor 07/23/2010 "
124564,2009-01-07,"House Introduced 1/7/2009 and Referred to Health, Human Services and Elderly Affairs; House Journal  8, PG. 120  "
124564,2009-01-07,"House Public Hearing: 1/15/2009 11:00 Amendment Legislative Office Building 205 "
124564,2009-01-29,"House Executive Session: 2/3/2009 10:00 Amendment Legislative Office Building 205 "
124564,2009-02-03,"House Committee Report: Ought to Pass with Amendment #0139h for Feb 12 Consent Calendar (vote 19-0); House Calendar 11, PG.179 "
124564,2009-02-03,"House Proposed Amendment #0139h; House Calendar 11, PG.204-205 "
124564,2009-02-12,"House Amendment #0139h Adopted, Voice Vote; House Journal  17, PG.420 "
124564,2009-02-12,"House Ought to Pass with Amendment #0139h: Motion Adopted Voice Vote; House Journal  17, PG.419-420 "
124564,2009-02-12,"House Referred to Ways and Means; House Journal  17, PG.420 "
124564,2009-03-04,"House Subcommittee Work Session: 3/9/2009 1:40 PM Legislative Office Building 308 "
124564,2009-03-18,"House ==TIME CHANGE== Full Committee Work Session: 3/27/2009 11:15 Amendment Legislative Office Building 204 (Orig 11:30 Amendment) "
124564,2009-03-25,"House Executive Session: 3/31/2009 9:30 Amendment Legislative Office Building 202 "
124564,2009-03-31,"House Retained in Committee "
124564,2009-04-15,"House Retained Bill - Subcommittee Work Session: 4/22/2009 10:00 Amendment Legislative Office Building 202 "
124564,2009-07-22,"House Retained Bill - Subcommittee Work Session: 8/6/2009 10:00 Amendment Legislative Office Building 202 "
124564,2009-08-06,"House Retained Bill - Subcommittee Work Session: 8/27/2009 10:00 Amendment Legislative Office Building 202 "
124564,2009-08-27,"House Retained Bill - Subcommittee Work Session: 9/16/2009 1:30 PM Legislative Office Building 202 "
124564,2009-09-16,"House Retained Bill - Subcommittee Work Session: 9/30/2009 11:00 Amendment Legislative Office Building 202 "
124564,2009-10-21,"House ==CANCELLED== Retained Bill - Executive Session: 10/28/2009 Legislative Office Building 202 1:30 PM "
124564,2009-11-02,"House Retained Bill - Executive Session: 11/18/2009 10:00 Amendment Legislative Office Building 202 ==TIME CHANGE (Orig 9:00 Amendment)== "
124564,2009-11-19,"House Committee Report: Inexpedient to Legislate for Jan 6 Consent Calendar (vote 19-0); House Calendar 2, PG.86 "
124564,2010-01-06,"House Inexpedient to Legislate: Motion Adopted Voice Vote; House Journal  6, PG.268 "
124565,2009-01-07,"House Introduced 1/7/2009 and Referred to Environment and Agriculture; House Journal  8, PG. 121 "
124565,2009-01-14,"House Public Hearing: 1/29/2009 10:00 Amendment Legislative Office Building 308 "
124565,2009-01-29,"House ===CANCELLED=== Work Session: 2/2/2009 1:30 PM Legislative Office Building 308 "
124565,2009-01-29,"House Subcommittee Work Session: 2/3/2009 10:00 Amendment Legislative Office Building 104 "
124565,2009-02-19,"House Subcommittee Work Session: 3/3/2009 11:00 Amendment Legislative Office Building 308 "
124565,2009-03-12,"House Executive Session: 3/18/2009 10:00 Amendment Legislative Office Building 308 (Continued 3/19/09 10:00 Amendment Legislative Office Building 308 If Needed) "
124565,2009-03-19,"House Retained in Committee "
124565,2009-05-21,"House Retained Bill - Subcommittee Work Session: 6/2/2009 2:00 PM Legislative Office Building 308 "
124565,2009-08-11,"House Retained Bill - Subcommittee Work Session: 9/15/2009 11:00 Amendment Legislative Office Building 305 ==ROOM CHANGE (Orig Legislative Office Building 308)== "
124565,2009-09-15,"House Retained Bill - Subcommittee Work Session: 9/29/2009 1:00 PM Legislative Office Building 308 "
124565,2009-10-28,"House ==CANCELLED== Retained Bill - Subcommittee Work Session: 10/10/2009 10:00 Amendment Legislative Office Building 308 "
124565,2009-10-28,"House Retained Bill - Subcommittee Work Session: 11/10/2009 10:00 Amendment Legislative Office Building 308 "
124565,2009-10-29,"House Retained Bill - Executive Session: 11/17/2009 10:00 Amendment Legislative Office Building 307 "
124565,2009-11-19,"House Committee Report: Inexpedient to Legislate for Jan 6 Consent Calendar (vote 16-0); House Calendar 2, PG.81 "
124565,2010-01-06,"House Inexpedient to Legislate: Motion Adopted Voice Vote; House Journal  6, PG.258 "
124566,2009-01-07,"House Introduced 1/7/2009 and Referred to Labor, Industrial and Rehabilitative Services; House Journal  8, PG. 122 "
124566,2009-01-14,"House Public Hearing: 1/29/2009 1:00 PM Legislative Office Building 307 "
124566,2009-01-30,"House Subcommittee Work Session: 2/4/2009 2:00 PM Legislative Office Building 101 "
124566,2009-02-04,"House Subcommittee Work Session: 2/12/2009 2:00 PM Legislative Office Building 307 "
124566,2009-02-04,"House ==CANCELLED== Executive Session: 2/19/2009 11:30 Amendment Legislative Office Building 307 "
124566,2009-03-05,"House ==CANCELLED== Executive Session: 3/12/2009 10:00 Amendment Legislative Office Building 307 "
124566,2009-03-10,"House Subcommittee Work Session: 3/17/2009 9:00 Amendment Legislative Office Building 307 "
124566,2009-03-12,"House Executive Session: 3/18/2009 10:00 Amendment Legislative Office Building 307 "
124566,2009-03-19,"House Retained in Committee "
124566,2009-09-15,"House Retained Bill - Subcommittee Work Session: 9/22/2009 11:15 Amendment Legislative Office Building 307 "
124566,2009-11-20,"House Retained Bill - Executive Session: 11/24/2009 1:00 PM Legislative Office Building 307 "
124566,2009-11-25,"House Committee Report: Refer to Interim Study for Jan 6 Regular Calendar (vote 14-3); House Calendar 2, PG.96 "
124566,2010-01-06,"House Special Ordered to Next Session Date in Regular Calendar Order; House Journal  6, PG.310 "
124566,2010-01-13,"House Refer to Interim Study: Motion Adopted Voice Vote; House Journal  9, PG.413 "
124566,2010-03-17,"House Referred to Labor, Industrial and Rehabilitative Services for Interim Study; House Journal  26, PG.1365 "
124566,2010-09-29,"House Interim Study - Executive Session: 10/13/2010 10:00 Amendment Legislative Office Building 307 "
124567,2009-01-07,"House Introduced 1/7/2009 and Referred to Criminal Justice and Public Safety; House Journal  8, PG. 122 "
124567,2009-01-14,"House Public Hearing: 1/27/2009 1:30 PM Legislative Office Building 204 "
124567,2009-02-10,"House Executive Session: 2/17/2009 10:00 Amendment Legislative Office Building 204 "
124567,2009-02-26,"House Retained in Committee "
124567,2009-06-25,"House Retained Bill - Subcommittee Work Session: 6/30/2009 10:00 Amendment Legislative Office Building 204 "
124567,2009-08-05,"House Retained Bill - Subcommittee Work Session: 8/20/2009 10:00 Amendment Legislative Office Building 204 "
124567,2009-09-16,"House Retained Bill - Subcommittee Work Session: 9/30/2009 2:00 PM Legislative Office Building 204 "
124567,2009-09-23,"House Retained Bill - Subcommittee Work Session: 10/29/2009 10:00 Amendment Legislative Office Building 204 "
124567,2009-09-24,"House Retained Bill - Executive Session: 11/5/2009 10:00 Amendment Legislative Office Building 204 "
124567,2009-11-09,"House Committee Report: Refer to Interim Study for Jan 6 Regular Calendar (vote 16-0); House Calendar 2, PG.91 "
124567,2010-01-06,"House Refer to Interim Study: Motion Adopted Voice Vote; House Journal  6, PG.310 "
124567,2010-03-17,"House Referred to Criminal Justice and Public Safety for Interim Study; House Journal  26, PG.1365 "
124567,2010-08-02,"House Interim Study - Subcommittee Work Session: 8/24/2010 9:30 Amendment Legislative Office Building 204 "
124567,2010-09-20,"House Interim Study - Executive Session: 10/13/2010 10:00 Amendment Legislative Office Building 204 "
124568,2009-01-07,"House Introduced 1/7/2009 and Referred to Public Works and Highways; House Journal  8, PG. 122  "
124568,2009-02-11,"House Public Hearing: 2/17/2009 2:30 PM Legislative Office Building 201 "
124568,2009-02-11,"House Executive Session: 2/19/2009 10:15 Amendment Legislative Office Building 201 "
124568,2009-02-26,"House Retained in Committee "
124568,2009-07-01,"House Retained Bill - Subcommittee Work Session: 9/8/2009 10:00 Amendment Legislative Office Building 201 "
124568,2009-10-05,"House Retained Bill - Executive Session: 10/28/2009 Legislative Office Building 201 1:00 PM or Immediately Following Session "
124568,2009-11-03,"House Committee Report: Inexpedient to Legislate for Jan 6 Consent Calendar (vote 18-0); House Calendar 2, PG.85 "
124568,2010-01-06,"House Inexpedient to Legislate: Motion Adopted Voice Vote; House Journal  6, PG.267 "
124569,2009-01-07,"House Introduced 1/7/2009 and Referred to Legislative Administration; House Journal  8, PG. 122 "
124569,2009-01-27,"House Public Hearing: 2/3/2009 3:15 PM Legislative Office Building 104 "
124569,2009-01-27,"House ==CANCELLED== Executive Session: 2/4/2009 3:00 PM Legislative Office Building 104 "
124569,2009-03-09,"House Subcommittee Work Session: 3/9/2009 11:45 Amendment Legislative Office Building 104 "
124569,2009-03-09,"House Executive Session: 3/12/2009 9:00 Amendment Legislative Office Building 104 "
124569,2009-03-12,"House Retained in Committee "
124569,2009-10-20,"House ==CANCELLED== Retained Bill - Subcommittee Work Session: 11/5/2009 1:30 PM Legislative Office Building 104 "
124569,2009-10-20,"House ==CANCELLED== Retained Bill - Executive Session: 11/12/2009 3:00 PM Legislative Office Building 104 "
124569,2009-10-21,"House Retained Bill - Subcommittee Work Session: 11/17/2009 1:30 PM Legislative Office Building 104 "
124569,2009-11-16,"House Retained Bill - Executive Session: 11/24/2009 3:00 PM Legislative Office Building 104 "
124569,2009-11-25,"House Committee Report: Inexpedient to Legislate for Jan 6 Consent Calendar (vote 10-0); House Calendar 2, PG.84 "
124569,2010-01-06,"House Inexpedient to Legislate: Motion Adopted Voice Vote; House Journal  6, PG.266 "
124570,2009-01-07,"House Introduced 1/7/2009 and Referred to Labor, Industrial and Rehabilitative Services; House Journal  8, PG. 122 "
124570,2009-01-14,"House Public Hearing: 1/21/2009 1:30 PM Legislative Office Building 307 "
124570,2009-01-21,"House Subcommittee Work Session: 1/29/2009 9:00 Amendment Legislative Office Building 307 "
124570,2009-01-29,"House Subcommittee Work Session: 2/3/2009 9:30 Amendment Legislative Office Building 307 "
124570,2009-03-04,"House Subcommittee Work Session: 3/12/2009 9:30 Amendment Legislative Office Building 307 "
124570,2009-03-05,"House Executive Session: 3/12/2009 10:00 Amendment Legislative Office Building 307 "
124570,2009-03-18,"House Retained in Committee "
124570,2009-09-29,"House Retained Bill - Subcommittee Work Session: 10/29/2009 1:00 PM Legislative Office Building 307 "
124570,2009-10-29,"House Retained Bill - Subcommittee Work Session: 11/5/2009 1:00 PM Legislative Office Building 307 "
124570,2009-11-03,"House ==CANCELLED== Retained Bill - Executive Session: 11/10/2009 11:00 Amendment Legislative Office Building 307 "
124570,2009-11-17,"House Retained Bill - Executive Session: 11/24/2009 1:00 PM Legislative Office Building 307 "
124570,2009-11-25,"House Majority Committee Report: Ought to Pass with Amendment #2509h (NT) for Jan 6 Regular Calendar (vote 10-7); House Calendar4, PG.133 "
124570,2009-11-25,"House Proposed Majority Committee Amendment #2509h (New Title); House Calendar 1, PG.3 "
124570,2009-11-25,"House Minority Committee Report: Inexpedient to Legislate; House Calendar 4, PG.133-134 "
124570,2010-01-06,"House Special Ordered to Next Session Date in Regular Calendar Order; House Journal  6, PG.310 "
124570,2010-01-13,"House Amendment #2509h (New Title) Adopted, Voice Vote; House Journal  9, PG.413-414 "
124570,2010-01-13,"House Ought to Pass with Amendment #2509h (NT): Motion Failed Division Vote 136-126 Lacking Necessary Two-Thirds; House Journal  9, PG.413-414 "
124570,2010-01-13,"House Laid on the Table (Rep Eaton): Motion Adopted Division Vote 299-27; House Journal  9, PG.414 "
124571,2009-01-07,"House Introduced 1/7/2009 and Referred to Judiciary; House Journal  8, PG. 122 "
124571,2009-01-07,"House Public Hearing: 1/14/2009 2:00 PM Legislative Office Building 208 "
124571,2009-02-23,"House Subcommittee Work Session: 3/5/2009 12:00 PM Legislative Office Building 208 "
124571,2009-03-10,"House Executive Session: 3/17/2009 11:00 Amendment Legislative Office Building 208 (Contined 3/18&19/09 11:00 Amendment Legislative Office Building 208 If Needed) "
124571,2009-03-17,"House Retained in Committee "
124571,2009-08-06,"House Retained Bill - Subcommittee Work Session: 9/15/2009 11:00 Amendment Legislative Office Building 208 "
124571,2009-09-15,"House Retained Bill - Subcommittee Work Session: 9/22/2009 10:00 Amendment Legislative Office Building 208 "
124571,2009-10-21,"House Retained Bill - Executive Session: 11/17/2009 10:00 Amendment Legislative Office Building 208 "
124571,2009-11-20,"House Committee Report: Inexpedient to Legislate for Jan 6 Consent Calendar (vote 18-0); House Calendar 2, PG.83 "
124571,2010-01-06,"House Inexpedient to Legislate: Motion Adopted Voice Vote; House Journal  6, PG.263 "
124572,2009-01-07,"House Introduced 1/7/2009 and Referred to Criminal Justice and Public Safety; House Journal  8, PG.123 "
124572,2009-01-14,"House Public Hearing: 1/27/2009 2:00 PM Legislative Office Building 204 "
124572,2009-01-30,"House Subcommittee Work Session: 2/10/2009 9:00 Amendment Legislative Office Building 204 "
124572,2009-02-10,"House Subcommittee Work Session: 2/17/2009 12:00 PM Legislative Office Building 204 "
124572,2009-02-10,"House ==CANCELLED== Executive Session: 3/5/2009 1:30 PM Legislative Office Building 204 "
124572,2009-03-10,"House Executive Session: 3/17/2009 10:15 Amendment Legislative Office Building 204 (Continued 3/18&19/09 10:00 Amendment Legislative Office Building 204 If Needed) "
124572,2009-03-17,"House Retained in Committee "
124572,2009-09-22,"House Retained Bill - Subcommittee Work Session: 9/29/2009 10:00 Amendment Legislative Office Building 204 "
124572,2009-09-23,"House Retained Bill - Subcommittee Work Session: 10/6/2009 11:00 Amendment Legislative Office Building 205 "
124572,2009-09-24,"House Retained Bill - Subcommittee Work Session: 10/29/2009 11:00 Amendment Legislative Office Building 204 "
124572,2009-09-25,"House Retained Bill - Executive Session: 11/5/2009 10:00 Amendment Legislative Office Building 204 "
124572,2009-11-09,"House Committee Report: Ought to Pass with Amendment #2476h for Jan 6 Consent Calendar (vote 16-0); House Calendar 2, PG.80 "
124572,2009-11-09,"House Proposed Committee Amendment #2476h; House Calendar 1, PG.3-5 "
124572,2010-01-06,"House Amendment #2476h Adopted, Voice Vote; House Journal  6, PG.251-253 "
124572,2010-01-06,"House Ought to Pass with Amendment #2476h: Motion Adopted Voice Vote; House Journal  6, PG.251-253 "
124572,2010-03-24,"Senate Introduced and Referred to Judiciary, Senate Journal 11, Pg.259 "
124572,2010-04-07,"Senate Hearing: April 20, 2010, Room 103, State House, 2:00 p.m.; Senate Calendar 15 "
124572,2010-04-28,"Senate Committee Report: Ought to Pass with Amendment 1686s, 5/5/10; Senate Calendar 18 "
124572,2010-05-05,"Senate Committee Amendment 1686s, Amendment Adopted, Voice Vote; Senate Journal 17, Pg.388 "
124572,2010-05-05,"Senate Ought to Pass with Amendment 1686s, Motion Adopted, Voice Vote; OT3rdg; Senate Journal 17, Pg.388 "
124572,2010-05-05,"Senate Passed by Third Reading Resolution; Senate Journal 17, Pg.398 "
124572,2010-05-19,"House House Concurs with Senate Amendment #1686s (Rep Shurtleff): Motion Adopted Voice Vote; House Journal  46, PG.2225 "
124572,2010-06-02,"House Enrolled "
124572,2010-06-02,"Senate Enrolled "
124572,2010-07-15,"House Signed by the Governor 07/13/2010; Chapter 0287 "
124572,2010-07-15,"House I. Section 4-6 Effective 09/01/2010 at 12:01 a.m. "
124572,2010-07-15,"House II. Remainder Effective 07/13/2010 "
124573,2009-01-07,"House Introduced 1/7/2009 and Referred to Children and Family Law; House Journal  8, PG.123 "
124573,2009-01-15,"House Public Hearing: 2/3/2009 11:00 Amendment Legislative Office Building 206 "
124573,2009-02-10,"House Subcommittee Work Session: 2/17/2009 12:30 PM Legislative Office Building 206 "
124573,2009-02-26,"House ==CANCELLED== Work Session: 3/3/2009 9:00 Amendment Legislative Office Building 206 "
124573,2009-03-03,"House ==CANCELLED== Work Session: 3/10/2009 10:00 Amendment Legislative Office Building 206 "
124573,2009-03-03,"House Subcommittee Work Session: 3/12/2009 1:00 PM Legislative Office Building 206 "
124573,2009-03-04,"House Executive Session: 3/18/2009 10:00 Amendment Legislative Office Building 206 "
124573,2009-03-19,"House Retained in Committee "
124573,2009-09-16,"House Retained Bill - Subcommittee Work Session: 10/6/2009 1:00 PM Legislative Office Building 206 "
124573,2009-09-17,"House Retained Bill - Executive Session: 10/28/2009 Legislative Office Building 206 11:00 Amendment or Immediately Following Session "
124573,2009-11-02,"House Committee Report: Refer to Interim Study for Jan 6 Regular Calendar (vote 18-0); House Calendar 2, PG.88 "
124573,2010-01-06,"House Refer to Interim Study: Motion Adopted Voice Vote; House Journal  6, PG.273 "
124573,2010-03-17,"House Referred to Children and Family Law for Interim Study; House Journal  26, PG.1365 "
124573,2010-09-15,"House Interim Study - Subcommittee Work Session: 10/6/2010 10:00 Amendment Legislative Office Building 206 "
124573,2010-09-22,"House Interim Study - Executive Session: 10/19/2010 10:00 Amendment Legislative Office Building 206 "
124574,2009-01-07,"House Introduced 1/7/2009 and Referred to Education; House Journal  8, PG.123  "
124574,2009-01-07,"House Public Hearing: 1/14/2009 11:30 Amendment Legislative Office Building 207 "
124574,2009-01-20,"House Subcommittee Work Session: 2/3/2009 1:00 PM Legislative Office Building 207 "
124574,2009-01-20,"House Executive Session: 2/10/2009 1:00 PM Legislative Office Building 207 "
124574,2009-02-10,"House Committee Report: Ought to Pass with Amendment #0165h for Feb 18 Regular Calendar (vote 13-7); House Calendar 14, PG.271 "
124574,2009-02-10,"House Proposed Amendment #0165h; House Calendar 14, PG.298 "
124574,2009-02-18,"House Amendment #0165h Adopted, Voice Vote; House Journal  18, PG.475 "
124574,2009-02-18,"House Ought to Pass with Amendment #0165h: Motion Adopted Voice Vote; House Journal  18, PG.475 "
124574,2009-02-18,"House Referred to Finance; House Journal  18, PG.475 "
124574,2009-02-25,"House Division II Work Session: 3/5/2009 2:30 PM Legislative Office Building 210-211 "
124574,2009-02-25,"House Executive Session: 3/13/2009 10:00 Amendment Legislative Office Building 210-211 "
124574,2009-03-13,"House Retained in Committee "
124574,2009-08-21,"House Retained Bill - Division II Subcommittee Work Session: 9/29/2009 1:00 PM Legislative Office Building 210-211 "
124574,2009-09-30,"House Retained Bill - Executive Session: 10/28/2009 Legislative Office Building 210-211 1:00 PM or Immediately Following Session "
124574,2009-11-13,"House Committee Report: Refer to Interim Study for Jan 6 Consent Calendar (vote 19-0); House Calendar 2, PG.82 "
124574,2010-01-06,"House Refer to Interim Study: Motion Adopted Voice Vote; House Journal  6, PG.261 "
124574,2010-03-17,"House Referred to Finance for Interim Study; House Journal  26, PG.1365 "
124574,2010-06-23,"House Interim Study - Subcom Work Session: 6/30/2010 11:00 Amendment Legislative Office Building 212 ==ROOM CHANGE (Orig Legislative Office Building 210-211)== "
124574,2010-08-10,"House Interim Study - Executive Session: 10/20/2010 10:00 Amendment Legislative Office Building 210-211 "
124575,2009-01-07,"House Introduced 1/7/2009 and Referred to Education; House Journal  8, PG.123 "
124575,2009-01-15,"House Public Hearing: 1/27/2009 11:00 Amendment Legislative Office Building 207 "
124575,2009-01-29,"House ===CANCELLED=== Work Session: 2/3/2009 9:00 Amendment Legislative Office Building 207 "
124575,2009-01-29,"House ===CANCELLED=== Work Session: 2/5/2009 9:00 Amendment Legislative Office Building 207 "
124575,2009-02-05,"House Subcommittee Work Session: 2/17/2009 9:00 Amendment Legislative Office Building 207 "
124575,2009-02-17,"House Subcommittee Work Session: 3/3/2009 9:00 Amendment Legislative Office Building 207 "
124575,2009-02-19,"House Executive Session: 3/5/2009 10:00 Amendment Legislative Office Building 207 "
124575,2009-03-05,"House Committee Report: Ought to Pass with Amendment #0555h for Mar 24 Consent Calendar (vote 19-0); House Calendar 22, PG.653-654 "
124575,2009-03-05,"House Proposed Committee Amendment #0555h; House Calendar 22, PG.704 "
124575,2009-03-24,"House Amendment #0555h Adopted, Voice Vote; House Journal  25, PG.844 "
124575,2009-03-24,"House Ought to Pass with Amendment #0555h: Motion Adopted Voice Vote; House Journal  25, PG.844 "
124575,2009-04-08,"Senate Introduced and Referred to Education; Senate Journal 11, Pg.232 "
124575,2009-04-21,"Senate Hearing; April 28, 2009, Room 103, Legislative Office Building, 10:35 a.m.; Senate Calendar 21 "
124575,2009-05-19,"Senate Committee Report; Rereferred to Committee 05/27/09; Senate Calendar 25 "
124575,2009-05-27,"Senate Rereferred to Committee, Motion Adopted, Voice Vote; Senate Journal 17, Pg.367 "
124575,2010-01-07,"Senate Committee Report, Inexpedient to Legislate; 1/13/10; Senate Calendar 2 "
124575,2010-01-13,"Senate Inexpedient to Legislate, Motion Adopted, Voice Vote === BILL KILLED === Senate Journal 2, Pg.19 "
124576,2009-01-07,"House Introduced 1/7/2009 and Referred to Education; House Journal  8, PG.123 "
124576,2009-01-15,"House Public Hearing: 2/3/2009 10:00 Amendment Legislative Office Building 207 "
124576,2009-02-19,"House Executive Session: 3/5/2009 10:00 Amendment Legislative Office Building 207 "
124576,2009-03-05,"House Committee Report: Ought to Pass with Amendment #0213h for Mar 24 Consent Calendar (vote 18-1); House Calendar 22, PG.654 "
124576,2009-03-05,"House Proposed Committee Amendment #0213h; House Calendar 22, PG.704 "
124576,2009-03-24,"House Amendment #0213h Adopted, Voice Vote; House Journal  25, PG.844-845 "
124576,2009-03-24,"House Ought to Pass with Amendment #0213h: Motion Adopted Voice Vote; House Journal  25, PG.844-845 "
124576,2009-04-08,"Senate Introduced and Referred to Education; Senate Journal 11, Pg.232 "
124576,2009-04-14,"Senate Hearing; April 21, 2009, Room 103, Legislative Office Building, 10:15 a.m.; Senate Calendar 20 "
124576,2009-05-19,"Senate Committee Report; Rereferred to Committee [05/27/09]; Senate Calendar 25 "
124576,2009-05-27,"Senate Rereferred to Committee, Motion Adopted, Voice Vote "
124576,2010-01-07,"Senate Committee Report, Ought to Pass with Amendment 0083s; 1/13/10; Senate Calendar 2 Pg.7 "
124576,2010-01-13,"Senate Committee Amendment 0083s, Amendment Adopted, Voice Vote "
124576,2010-01-13,"Senate Ought to Pass with Amendment 0083s, Motion Adopted, Voice Vote; OT3rdg, Senate Journal 2, Pg.20 "
124576,2010-01-13,"Senate Passed by Third Reading Resolution; Senate Journal 2, Pg.27 "
124576,2010-04-14,"House House Concurs with Senate Amendment #0083s (Rep Rous): Motion Adopted Voice Vote; House Journal  32, PG.1587 "
124576,2010-04-21,"Senate Enrolled "
124576,2010-04-21,"House Enrolled; House Journal  35, PG.1671 "
124576,2010-05-10,"House Signed By the Governor 05/07/2010; Effective 07/06/2010; Chapter 0009 "
124577,2009-01-07,"House Introduced 1/7/2009 and Referred to Criminal Justice and Public Safety; House Journal  8, PG.123 "
124577,2009-01-14,"House Public Hearing: 1/29/2009 1:30 PM Legislative Office Building 202-204 ==RECESSED== "
124577,2009-01-30,"House ==RECONVENED== Public Hearing: 2/12/2009 1:45 PM Legislative Office Building 204 (or 30 Minutes After Session) "
124577,2009-02-10,"House ==CANCELLED== Executive Session: 3/5/2009 1:30 PM Legislative Office Building 204 "
124577,2009-03-04,"House Subcommittee Work Session: 3/17/2009 9:00 Amendment Legislative Office Building 204 "
124577,2009-03-10,"House Executive Session: 3/17/2009 10:15 Amendment Legislative Office Building 204 (Continued 3/18&19/09 10:00 Amendment Legislative Office Building 204 If Needed) "
124577,2009-03-17,"House Retained in Committee "
124577,2009-09-15,"House ==CANCELLED== Retained Bill - Subcommittee Work Session: 10/14/2009 10:00 Amendment Legislative Office Building 204 "
124577,2009-09-21,"House Retained Bill - Subcommittee Work Session: 10/21/2009 10:00 Amendment Legislative Office Building 206 "
124577,2009-09-22,"House Retained Bill - Subcommittee Work Session: 10/29/2009 9:30 Amendment Legislative Office Building 204 "
124577,2009-09-24,"House Retained Bill - Executive Session: 11/5/2009 10:00 Amendment Legislative Office Building 204 "
124577,2009-11-09,"House Committee Report: Ought to Pass with Amendment #2461h (New Title) for Jan 6 Regular Calendar (vote 11-5); House Calendar 2, PG.91 "
124577,2009-11-09,"House Proposed Committee Amendment #2461h (New Title); House Calendar 1, PG.5 "
124577,2010-01-06,"House Special Ordered to Next Session Date in Regular Calendar Order; House Journal  6, PG.310 "
124577,2010-01-13,"House Amendment #2461h (New Title) Failed, Regular Calendar 3-326; House Journal  9, PG.365-368 "
124577,2010-01-13,"House Floor Amendment #2010-0059h (Rep Welch) Adopted, Division Vote 202-147; House Journal  9, PG.368 "
124577,2010-01-13,"House Floor Amendment #2010-0125h (New Title) Failed, Regular Calendar 148-206; House Journal  9, PG.368-370 "
124577,2010-01-13,"House Ought to Pass with Amendment #2010-0059h: Motion Adopted Regular Calendar 189-166; House Journal  9, PG.365-372 "
124577,2010-03-03,"Senate Introduced and Referred to Judiciary "
124577,2010-03-16,"Senate Hearing: March 23, 2010, Room 103, State House, 2:30 p.m.; Senate Calendar 12 "
124577,2010-05-06,"Senate Committee Report: Ought to Pass, 5/12/10; Senate Calendar 19 "
124577,2010-05-12,"Senate Sen. Letourneau Floor Amendment 2044s, New Title, Regular Calendar 10Y-14N Amendment Failed; Senate Journal 18, Pg.465 "
124577,2010-05-12,"Senate Ought to Pass, Regular Calendar 24Y-0N, Motion Adopted; OT3rdg; Senate Journal 18, Pg.465 "
124577,2010-05-12,"Senate Passed by Third Reading Resolution; Senate Journal 18, Pg.496 "
124577,2010-05-19,"Senate Enrolled Bill Amendment #2096 Adopted; Senate Journal 20, Pg.660 "
124577,2010-05-19,"House Enrolled Bill Amendment #2096 Adopted; House Journal  46, PG.2244 "
124577,2010-05-19,"Senate Enrolled; Senate Journal 20, Pg.664 "
124577,2010-05-19,"House Enrolled; House Journal  46, PG.2247 "
124577,2010-07-28,"House Signed by the Governor 07/23/2010; Effective 01/01/2011; Chapter 0361 "
124578,2009-01-07,"House Introduced 1/7/2009 and Referred to Executive Departments and Administration; House Journal  8, PG.123  "
124578,2009-01-14,"House Public Hearing: 1/21/2009 10:00 Amendment Legislative Office Building 306 "
124578,2009-01-29,"House Executive Session: 2/4/2009 2:00 PM Legislative Office Building 306 or 1 Hour After Session "
124578,2009-02-05,"House Committee Report: Ought to Pass with Amendment #0157h for Feb 12 Consent Calendar (vote 18-1); House Calendar 11, PG.178 "
124578,2009-02-05,"House Proposed Amendment #0157h; House Calendar 11, PG.209 "
124578,2009-02-12,"House Amendment #0157h Adopted, Voice Vote; House Journal  17, PG.418 "
124578,2009-02-12,"House Ought to Pass with Amendment #0157h: Motion Adopted Voice Vote; House Journal  17, PG.418 "
124578,2009-02-12,"House Referred to Ways and Means; House Journal  17, PG.418 "
124578,2009-03-04,"House Subcommittee Work Session: 3/9/2009 2:00 PM Legislative Office Building 202 "
124578,2009-03-16,"House Full Committee Work Session: 3/17/2009 1:30 PM Legislative Office Building 202 "
124578,2009-03-16,"House Executive Session: 3/19/2009 10:00 Amendment Legislative Office Building 202 "
124578,2009-03-20,"House ==CONTINUED== Executive Session: 3/23/2009 1:00 PM Legislative Office Building 202 ==RECESSED== "
124578,2009-03-25,"House ==CONTINUED== Executive Session: 3/31/2009 9:30 Amendment Legislative Office Building 202 "
124578,2009-04-02,"House Retained in Committee "
124578,2009-11-02,"House Retained Bill - Executive Session: 11/18/2009 10:00 Amendment Legislative Office Building 202 ==TIME CHANGE (Orig 9:00 Amendment)== "
124578,2009-11-19,"House Committee Report: Inexpedient to Legislate for Jan 6 Consent Calendar (vote 19-0); House Calendar 2, PG.86 "
124578,2010-01-06,"House Inexpedient to Legislate: Motion Adopted Voice Vote; House Journal  6, PG.268 "
124579,2009-01-07,"House Introduced 1/7/2009 and Referred to Executive Departments and Administration; House Journal  8, PG.124  "
124579,2009-01-14,"House Public Hearing: 1/27/2009 1:00 PM Legislative Office Building 306 "
124579,2009-01-29,"House Subcommittee Work Session: 2/5/2009 8:45 Amendment Legislative Office Building 306 "
124579,2009-02-05,"House Subcommittee Work Session: 2/11/2009 9:00 Amendment Legislative Office Building 306 "
124579,2009-02-05,"House Executive Session: 2/12/2009 2:00 PM Legislative Office Building 306 "
124579,2009-02-17,"House Committee Report: Ought to Pass with Amendment #0322h for Mar 4 Regular Calendar (vote 16-1); House Calendar 16, PG.374 "
124579,2009-02-17,"House Proposed Amendment #0322h; House Calendar 15, PG.314-315 "
124579,2009-03-04,"House Amendment #0322h Adopted, Voice Vote; House Journal  21, PG.604-605 "
124579,2009-03-04,"House Ought to Pass with Amendment #0322h: Motion Adopted Voice Vote; House Journal  21, PG.604-605 "
124579,2009-03-04,"House Referred to Finance; House Journal  21, PG.605 "
124579,2009-03-05,"House Division I Work Session: 3/18/2009 10:00 Amendment Legislative Office Building 212 "
124579,2009-03-18,"House Division I Work Session: 3/30/2009 9:30 Amendment Legislative Office Building 212 "
124579,2009-03-19,"House Executive Session: 3/31/2009 10:00 Amendment Legislative Office Building 210-211 ==RECESSED== "
124579,2009-04-01,"House ==CONTINUED== Executive Session: 4/1/2009 10:00 Amendment Legislative Office Building 210-211 "
124579,2009-04-01,"House Committee Report: Ought to Pass for April 8 Consent Calendar (vote 22-0); House Calendar 26, PG.919 "
124579,2009-04-08,"House Ought to Pass: Motion Adopted Voice Vote; House Journal  31, PG.1280 "
124579,2009-04-08,"Senate Introduced and Referred to Executive Departments and Administration; Senate Journal 11, Pg.232 "
124579,2009-04-23,"Senate Hearing; April 28, 2009, Room 101, Legislative Office Building, 2:00 p.m.; Senate Calendar 21 "
124579,2009-05-07,"Senate Committee Report; Ought to Pass 05/13/09; Senate Calendar 23 "
124579,2009-05-13,"Senate Ought to Pass, Motion Adopted, Voice Vote; Refer to Finance Rule 26; Senate Journal 15, Pg.313 "
124579,2009-05-28,"Senate Committee Report; Inexpedient to Legislate 06/03/09; Senate Calendar 26 "
124579,2009-06-03,"Senate Without Objection, Chair moved to Special-Order HB 174 to the front of the Calendar; Senate Journal 18, Pg.398 "
124579,2009-06-03,"Senate Inexpedient to Legislate, Motion Failed, Voice Vote; Senate Journal 18, Pg.485 "
124579,2009-06-03,"Senate Sen. D'Allesandro Moved Rerefer to Committee; Senate Journal 18, Pg.485 "
124579,2009-06-03,"Senate Rereferred to Committee, Motion Adopted, Voice Vote; Senate Journal 18, Pg.485 "
124579,2010-01-14,"Senate Committee Report; Inexpedient to Legislate 1/21/10; Senate Calendar 3 "
124579,2010-01-21,"Senate Inexpedient to Legislate, Motion Adopted, Voice Vote, === BILL KILLED ===; Senate Journal 3, Pg.40 "
124580,2009-01-07,"House Introduced 1/7/2009 and Referred to Children and Family Law; House Journal  8, PG.124  "
124580,2009-01-14,"House Public Hearing: 1/27/2009 1:15 PM Legislative Office Building 206 "
124580,2009-02-02,"House ==ROOM CHANGE== Subcommittee Work Session: 2/5/2009 1:00 PM Legislative Office Building 104 (Orig Legislative Office Building 206) "
124580,2009-02-09,"House Subcommittee Work Session: 2/10/2009 9:45 Amendment Legislative Office Building 206 "
124580,2009-02-09,"House Executive Session: 2/10/2009 1:15 PM Legislative Office Building 206 ==RECESSED== "
124580,2009-02-12,"House ==CONTINUED== Executive Session: 2/19/2009 1:15 PM Legislative Office Building 206 "
124580,2009-02-26,"House Retained in Committee "
124580,2009-08-27,"House Retained Bill - Subcommittee Work Session: 9/10/2009 10:00 Amendment Legislative Office Building 206 "
124580,2009-09-15,"House Retained Bill - Subcommittee Work Session: 9/24/2009 10:00 Amendment Legislative Office Building 206 "
124580,2009-09-16,"House Retained Bill - Subcommittee Work Session: 10/8/2009 2:00 PM Legislative Office Building 206 "
124580,2009-09-17,"House Retained Bill - Subcommittee Work Session: 10/20/2009 1:00 PM Legislative Office Building 301 =ROOM CHANGE (Orig Legislative Office Building 204)= "
124580,2009-09-18,"House Retained Bill - Executive Session: 10/28/2009 Legislative Office Building 206 11:00 Amendment or Immediately Following Session "
124580,2009-11-02,"House Committee Report: Refer to Interim Study for Jan 6 Regular Calendar (vote 17-0); House Calendar 2, PG.88 "
124580,2010-01-06,"House Refer to Interim Study: Motion Adopted Voice Vote; House Journal  6, PG.274 "
124580,2010-03-17,"House Referred to Children and Family Law for Interim Study; House Journal  26, PG.1365 "
124580,2010-08-24,"House Interim Study - Subcommittee Work Session: 9/21/2010 9:30 Amendment Legislative Office Building 207 "
124580,2010-09-22,"House Interim Study - Executive Session: 10/19/2010 10:00 Amendment Legislative Office Building 206 "
124581,2009-01-07,"House Introduced 1/7/2009 and Referred to Judiciary; House Journal  8, PG.124 "
124581,2009-01-13,"House Public Hearing: 1/27/2009 11:30 Amendment Legislative Office Building 208 "
124581,2009-02-17,"House Executive Session: 3/5/2009 11:00 Amendment Legislative Office Building 208 (Continued 3/12/09 10:00 Amendment Legislative Office Building 208 If Needed) "
124581,2009-03-06,"House Retained in Committee "
124581,2009-09-21,"House Retained Bill - Subcommittee Work Session: 10/21/2009 1:00 PM Legislative Office Building 208 "
124581,2009-10-21,"House Retained Bill - Executive Session: 11/17/2009 10:00 Amendment Legislative Office Building 208 "
124581,2009-11-20,"House Committee Report: Ought to Pass for Jan 6 Regular Calendar (vote 13-6); House Calendar 2, PG.95 "
124581,2010-01-06,"House Special Ordered to Next Session Date in Regular Calendar Order; House Journal  6, PG.310 "
124581,2010-01-13,"House Ought to Pass: Motion Adopted Voice Vote; House Journal  9, PG.406 "
124581,2010-03-24,"Senate Introduced and Referred to Judiciary; Senate Journal 11, Pg.259 "
124581,2010-04-15,"Senate Hearing: April 27, 2010, Room 103, State House, 2:45 p.m.; Senate Calendar 16 "
124581,2010-04-28,"Senate Committee Report: Ought to Pass, 5/5/10; Senate Calendar 18 "
124581,2010-05-05,"Senate Ought to Pass, Motion Adopted, Voice Vote; OT3rdg "
124581,2010-05-05,"Senate Passed by Third Reading Resolution "
124581,2010-05-13,"Senate Enrolled Bill Amendment #2085 Adopted "
124581,2010-05-19,"House Enrolled Bill Amendment #2085 Adopted; House Journal  46, PG.2238 "
124581,2010-05-19,"House Enrolled; House Journal  46, PG.2247 "
124581,2010-05-19,"Senate Enrolled "
124581,2010-06-16,"House Signed by the Governor 06/14/2010; Effective 01/01/2011; Chapter 0131 "
124582,2009-01-07,"House Introduced 1/7/2009 and Referred to Commerce and Consumer Affairs; House Journal  8, PG.125 "
124582,2009-01-08,"House Public Hearing: 1/21/2009 11:30 Amendment Legislative Office Building 302 "
124582,2009-02-10,"House Subcommittee Work Session: 2/19/2009 9:00 Amendment Legislative Office Building 302 "
124582,2009-02-19,"House Subcommittee Work Session: 3/3/2009 2:30 PM Legislative Office Building 302 "
124582,2009-02-19,"House Executive Session: 3/5/2009 1:00 PM Legislative Office Building 302 "
124582,2009-03-06,"House Retained in Committee "
124582,2009-09-29,"House Retained Bill - Subcommittee Work Session: 10/6/2009 10:00 Amendment Legislative Office Building 304 "
124582,2009-09-30,"House Retained Bill - Subcommittee Work Session: 10/13/2009 11:00 Amendment Legislative Office Building 302 "
124582,2009-10-01,"House Retained Bill - Subcommittee Work Session: 10/20/2009 11:00 Amendment Legislative Office Building 302 "
124582,2009-10-02,"House Retained Bill - Subcommittee Work Session: 10/27/2009 11:00 Amendment Legislative Office Building 302 "
124582,2009-10-03,"House ==CANCELLED== Retained Bill - Executive Session: 10/28/2009 1:00 PM Legislative Office Building 302 "
124582,2009-10-03,"House Retained Bill - Subcommittee Work Session: 11/3/2009 11:00 Amendment Legislative Office Building 302 "
124582,2009-10-29,"House Retained Bill - Executive Session: 11/12/2009 10:15 Amendment Legislative Office Building 302 ==TIME CHANGE (Orig 10:00AM)== "
124582,2009-11-25,"House Committee Report: Inexpedient to Legislate for Jan 6 Consent Calendar (vote 16-0); House Calendar 2, PG.79 "
124582,2010-01-06,"House Inexpedient to Legislate: Motion Adopted Voice Vote; House Journal  6, PG.250 "
124583,2009-01-07,"House Introduced 1/7/2009 and Referred to Resources, Recreation and Development; House Journal  8, PG.125  "
124583,2009-01-08,"House Public Hearing: 1/15/2009 11:00 Amendment Legislative Office Building 305 "
124583,2009-01-15,"House Subcommittee Work Session: 1/21/2009 10:30 Amendment Legislative Office Building 207 "
124583,2009-01-28,"House Subcommittee Work Session: 2/5/2009 9:30 Amendment Legislative Office Building 305 "
124583,2009-02-04,"House Subcommittee Work Session: 2/10/2009 9:30 Amendment Legislative Office Building 305 "
124583,2009-02-11,"House Executive Session: 2/17/2009 10:00 Amendment Legislative Office Building 305 "
124583,2009-02-18,"House Committee Report: Ought to Pass with Amendment #0265h for Mar 4 Regular Calendar (vote 15-2); House Calendar 16, PG.381 "
124583,2009-02-18,"House Proposed Amendment #0265h; House Calendar 15, PG.315-316 "
124583,2009-03-04,"House Amendment #0265h Adopted, Voice Vote; House Journal  21, PG.635 "
124583,2009-03-04,"House Ought to Pass with Amendment #0265h: Motion Adopted Division Vote 183-123; House Journal  21, PG.634-635 "
124583,2009-03-04,"House Referred to Ways and Means; House Journal  21, PG.635 "
124583,2009-03-11,"House Full Committee Work Session: 3/20/2009 9:30 Amendment Legislative Office Building 202 "
124583,2009-03-18,"House Full Committee Work Session: 3/23/2009 10:00 Amendment Legislative Office Building 202 "
124583,2009-03-25,"House Executive Session: 3/31/2009 9:30 Amendment Legislative Office Building 202 "
124583,2009-03-31,"House Retained in Committee "
124583,2009-04-15,"House Retained Bill - Subcommittee Work Session: 4/22/2009 9:30 Amendment Legislative Office Building 202 "
124583,2009-10-07,"House Retained Bill - Executive Session: 10/28/2009 Legislative Office Building 202 1:30 PM or Immediately Following Session "
124583,2009-11-05,"House Committee Report: Inexpedient to Legislate for Jan 6 Consent Calendar (vote 19-0); House Calendar 2, PG.86 "
124583,2010-01-06,"House Inexpedient to Legislate: Motion Adopted Voice Vote; House Journal  6, PG.268 "
124584,2009-01-07,"House Introduced 1/7/2009 and Referred to Science, Technology and Energy; House Journal  8, PG.125  "
124584,2009-01-15,"House Public Hearing: 1/27/2009 1:00 PM Legislative Office Building 304 "
124584,2009-01-27,"House Full Committee Work Session: 2/3/2009 9:00 Amendment Legislative Office Building 304 "
124584,2009-02-03,"House ===CANCELLED=== Work Session: 2/4/2009 2:00 PM Legislative Office Building 304 "
124584,2009-02-03,"House ===CANCELLED=== Work Session: 2/5/2009 2:00 PM Legislative Office Building 304 "
124584,2009-02-03,"House Full Committee Work Session: 2/10/2009 9:00 Amendment Legislative Office Building 304 "
124584,2009-02-10,"House ==TIME CHANGE== Executive Session: 2/19/2009 11:00 Amendment Legislative Office Building 304 (Orig 1:00 PM) "
124584,2009-02-26,"House Retained in Committee "
124584,2009-04-29,"House Retained Bill - Full Committee Work Session: 5/5/2009 11:00 Amendment Legislative Office Building 307 "
124584,2009-05-08,"House Retained Bill - Subcommittee Work Session: 5/13/2009 1:30 PM Legislative Office Building 304 "
124584,2009-09-15,"House Retained Bill - Full Committee Work Session: 10/9/2009 1:30 PM Legislative Office Building 304 "
124584,2009-09-15,"House Retained Bill - Executive Session: 10/9/2009 2:30 PM Legislative Office Building 304 "
124584,2009-10-13,"House Retained Bill - Continued Executive Session: 10/28/2009 Legislative Office Building 304 1:00 PM or Immediately After Session "
124584,2009-11-02,"House Committee Report: Ought to Pass with Amendment #2453h for Jan 6 Regular Calendar (vote 17-0); House Calendar 2, PG.99 "
124584,2009-11-02,"House Proposed Committee Amendment #2453h; House Calendar 1, PG.5-6 "
124584,2010-01-06,"House Special Ordered to Next Session Date in Regular Calendar Order; House Journal  6, PG.310 "
124584,2010-01-13,"House Amendment #2453h Adopted, Voice Vote; House Journal  9, PG.435-436 "
124584,2010-01-13,"House Floor Amendment #2010-0038h (Rep Kaen) Adopted, Voice Vote; House Journal  9, PG.436 "
124584,2010-01-13,"House Ought to Pass with Amendments #2453h and #0038h: Motion Adopted Regular Calendar 318-3; House Journal  9, PG.435-438 "
124584,2010-01-13,"House Referred to Finance; House Journal  9, PG.438 "
124584,2010-01-14,"House Full Committee Work Session: 1/27/2010 10:00 Amendment Legislative Office Building 210-211 "
124584,2010-01-27,"House Full Committee Work Session: 2/2/2010 10:00 Amendment Legislative Office Building 210-211 "
124584,2010-01-28,"House Executive Session: 2/4/2010 10:00 Amendment Legislative Office Building 210-211 "
124584,2010-02-04,"House Committee Report: Ought to Pass with Amendment #0497h for Feb 10 Consent Calendar (vote 22-0); House Calendar 13, PG.527 "
124584,2010-02-04,"House Proposed Committee Amendment #0497h; House Calendar 13, PG.555 "
124584,2010-02-10,"House Removed from Consent Calendar (Rep Vaillancourt); House Journal  16, PG.748 "
124584,2010-02-10,"House Special Ordered to Regular Place in Feb 17 Consent Calendar: Motion Adopted Without Objection; House Journal  16, PG.783 "
124584,2010-02-17,"House Amendment #0497h Adopted, Voice Vote; House Journal  18, PG.955 "
124584,2010-02-17,"House Ought to Pass with Amendment #0497h: Motion Adopted Voice Vote; House Journal  18, PG.955 "
124584,2010-03-03,"Senate Introduced and Referred to Commerce, Labor and Consumer Protection "
124584,2010-04-06,"Senate Hearing: April 13, 2010, Room 102, Legislative Office Building, 8:30 a.m.; Senate Calendar 15 "
124584,2010-04-22,"Senate Committee Report: Ought to Pass with Amendment 1561s, 4/28/10; Senate Calendar 17 "
124584,2010-04-28,"Senate Committee Amendment 1561s, Not Voted On "
124584,2010-04-28,"Senate Sen. DeVries Moved Laid on Table, Motion Adopted, Voice Vote; Senate Journal 16, Pg.343 "
124584,2010-05-05,"Senate Sen. DeVries Moved Remove From Table, Motion Adopted Voice Vote; Senate Journal 17, Pg.364 "
124584,2010-05-05,"Senate Committee Amendment 1561s, Amendment Adopted, Voice Vote; Senate Journal 17, Pg.367 "
124584,2010-05-05,"Senate Ought to Pass with Amendment 1561s, Motion Adopted, Voice Vote; OT3rdg; Senate Journal 17, Pg.367 "
124584,2010-05-05,"Senate Passed by Third Reading Resolution; Senate Journal 17, Pg.398 "
124584,2010-05-19,"House House Concurs with Senate Amendment #1561s (Reps Kaen & M.Smith): Motion Adopted Voice Vote; House Journal  46, PG.2229 "
124584,2010-06-02,"House Enrolled; House Journal  51, PG.2321 "
124585,2009-01-07,"House Introduced 1/7/2009 and Referred to Labor, Industrial and Rehabilitative Services; House Journal  8, PG.125 "
124585,2009-01-14,"House Public Hearing: 1/29/2009 10:30 Amendment Legislative Office Building 307 "
124585,2009-02-04,"House Executive Session: 2/11/2009 11:30 Amendment Legislative Office Building 307 "
124585,2009-02-12,"House Committee Report: Ought to Pass with Amendment #0192h for Feb 18 Consent Calendar (vote 19-0); House Calendar 14, PG.265 "
124585,2009-02-12,"House Proposed Amendment #0192h; House Calendar 14, PG.299 "
124585,2009-02-18,"House Amendment #0192h Adopted, Voice Vote; House Journal  18, PG.449 "
124585,2009-02-18,"House Ought to Pass with Amendment #0192h: Motion Adopted Voice Vote; House Journal  18, PG.449 "
124585,2009-03-18,"Senate Introduced and Referred to Commerce, Labor and Consumer Protection; Senate Journal 8, pg. 133 "
124585,2009-04-09,"Senate Hearing; April 14, 2009, Room 102, Legislative Office Building, 8:30 a.m.; Senate Calendar 19 "
124585,2009-05-26,"Senate Committee Report; Rereferred to Committee [06/03/09]; Senate Calendar 26 "
124585,2009-06-03,"Senate Rereferred to Committee, Motion Adopted, Voice Vote "
124585,2010-01-19,"Senate Committee Report; Ought to Pass with Amendment 0178s, 1/21/10; Senate Calendar 3A, Pg.3 "
124585,2010-01-21,"Senate "
124585,2010-01-21,"Senate Ought to Pass with Amendment 0178s, Motion Adopted, Voice Vote; OT3rdg, Senate Journal 3, Pg.34 "
124585,2010-01-21,"Senate Passed By Third Reading Resolution, Senate Journal 3, Pg.44 "
124585,2010-04-14,"House House Concurs with Senate Amendment #0178s (Rep Goley): Motion Adopted Voice Vote; House Journal  32, PG.1587 "
124585,2010-04-21,"Senate Enrolled "
124585,2010-04-21,"House Enrolled; House Journal  35, PG.1671 "
124585,2010-05-10,"House Signed By the Governor 05/07/2010; Effective 01/01/2011; Chapter 0010 "
124586,2009-01-07,"House Introduced 1/7/2009 and Referred to Resources, Recreation and Development; House Journal  8, PG.125  "
124586,2009-01-08,"House Public Hearing: 1/15/2009 1:30 PM Legislative Office Building 305 "
124586,2009-02-04,"House Executive Session: 2/11/2009 10:00 Amendment Legislative Office Building 305 "
124586,2009-02-26,"House Retained in Committee "
124586,2009-09-14,"House Retained Bill - Full Committee Work Session: 9/22/2009 1:00 PM Legislative Office Building 305 "
124586,2009-09-14,"House Retained Bill - Full Committee Work Session: 9/30/2009 10:00 Amendment Legislative Office Building 305 "
124586,2009-09-30,"House Retained Bill - Subcommittee Work Session: 10/6/2009 9:00 Amendment Legislative Office Building 305 "
124586,2009-10-07,"House Retained Bill - Subcommittee Work Session: 10/20/2009 11:30 Amendment Legislative Office Building 307 "
124586,2009-10-21,"House Retained Bill - Subcommittee Work Session: 10/26/2009 1:00 PM Legislative Office Building 308 "
124586,2009-11-02,"House Retained Bill - Executive Session: 11/24/2009 9:30 Amendment Legislative Office Building 305 "
124586,2009-11-25,"House Committee Report: Ought to Pass with Amendment #2514h for Jan 6 Regular Calendar (vote 15-5); House Calendar 2, PG.98 "
124586,2009-11-25,"House Proposed Committee Amendment #2514h; House Calendar 1, PG.6-7 "
124586,2010-01-06,"House Special Ordered to Next Session Date in Regular Calendar Order; House Journal  6, PG.310 "
124586,2010-01-13,"House Amendment #2514h Adopted, Voice Vote; House Journal  9, PG.420 "
124586,2010-01-13,"House Ought to Pass with Amendment #2514h: Motion Adopted Voice Vote; House Journal  9, PG.420 "
124586,2010-01-13,"House Referred to Executive Departments and Administration; House Journal  9, PG.420 "
124586,2010-02-18,"House Public Hearing: 3/2/2010 1:45 PM Legislative Office Building 306 "
124586,2010-03-03,"House Executive Session: 3/16/2010 10:30 Amendment Legislative Office Building 306 "
124586,2010-03-17,"House Committee Report: Refer to Interim Study for Mar 24 (Vote 11-5; Regular Calendar); House Calendar 22, PG.1222 "
124586,2010-03-24,"House Refer to Interim Study: Motion Adopted Voice Vote; House Journal  30, PG.1491 "
124586,2010-03-24,"House Referred to Executive Departments and Administration for Interim Study "
124586,2010-06-23,"House Interim Study - Subcommittee Work Session: 6/29/2010 2:00 PM Legislative Office Building 306 "
124586,2010-09-01,"House Interim Study - Subcommittee Work Session: 9/8/2010 12:15 PM Legislative Office Building 306 "
124586,2010-09-08,"House Interim Study - Subcommittee Work Session: 9/22/2010 12:15 PM Legislative Office Building 306 "
124586,2010-09-22,"House Interim Study - Subcommittee Work Session: 10/6/2010 1:00 PM Legislative Office Building 306 "
124586,2010-09-23,"House Interim Study - Executive Session: 10/13/2010 10:00 Amendment Legislative Office Building 306 "
124587,2009-01-07,"House Introduced 1/7/2009 and Referred to Judiciary; House Journal  8, PG.125 "
124587,2009-01-22,"House ==CANCELLED== Public Hearing: 2/4/2009 10:00 Amendment Legislative Office Building 208 "
124587,2009-02-03,"House Public Hearing: 2/19/2009 10:00 Amendment Legislative Office Building 208 "
124587,2009-03-04,"House Executive Session: 3/9/2009 11:00 Amendment Legislative Office Building 208 "
124587,2009-03-10,"House Retained in Committee "
124587,2009-09-14,"House Retained Bill - Subcommittee Work Session: 10/6/2009 10:30 Amendment Legislative Office Building 208 "
124587,2009-10-06,"House ==CANCELLED== Retained Bill - Subcommittee Work Session: 10/20/2009 10:30 Amendment Legislative Office Building 208 "
124587,2009-10-16,"House ==CANCELLED== Retained Bill - Subcommittee Work Session: 10/27/2009 10:30 Amendment Legislative Office Building 208 "
124587,2009-10-20,"House Retained Bill - Subcommittee Work Session: 11/3/2009 11:00 Amendment Legislative Office Building 208 "
124587,2009-10-21,"House Retained Bill - Subcommittee Work Session: 11/17/2009 9:45 Amendment Legislative Office Building 206 "
124587,2009-10-21,"House Retained Bill - Executive Session: 11/17/2009 10:00 Amendment Legislative Office Building 208 "
124587,2009-11-20,"House Majority Committee Report: Ought to Pass with Amendment #2490h for Jan 6 Regular Calendar (vote 13-6); House Calendar 2, PG.95 "
124587,2009-11-20,"House Proposed Majority Committee Amendment #2490h; House Calendar 1, PG.7-8 "
124587,2009-11-20,"House Minority Committee Report: Inexpedient to Legislate; House Calendar 2, PG.95-96 "
124587,2010-01-06,"House Special Ordered to Next Session Date in Regular Calendar Order; House Journal  6, PG.310 "
124587,2010-01-13,"House Amendment #2490h Adopted, Voice Vote; House Journal  9, PG.407-408 "
124587,2010-01-13,"House Ought to Pass with Amendment #2490h: Motion Adopted Voice Vote; House Journal  9, PG.407-408 "
124587,2010-03-24,"Senate Introduced and Referred to Judiciary; Senate Journal 11, Pg.259 "
124587,2010-04-15,"Senate Hearing: April 27, 2010, Room 103, State House, 3:00 p.m.; Senate Calendar 16 "
124587,2010-04-29,"Senate Committee Report: Ought to Pass with Amendment 1738s, 5/5/10; Senate Calendar 18 "
124587,2010-05-05,"Senate Committee Amendment 1738s, Amendment Adopted, Voice Vote; Senate Journal 17, Pg.389 "
124587,2010-05-05,"Senate Ought to Pass with Amendment 1738s, Motion Adopted, Voice Vote; OT3rdg; Senate Journal 17, Pg.389 "
124587,2010-05-05,"Senate Passed by Third Reading Resolution; Senate Journal 17, Pg.398 "
124587,2010-05-19,"House House Concurs with Senate Amendment #1738s (Rep Cote): Motion Adopted Voice Vote; House Journal  46, PG.2226 "
124587,2010-06-02,"House Enrolled "
124587,2010-06-02,"Senate Enrolled "
124587,2010-07-15,"House Signed by the Governor 07/13/2010; Effective 01/01/2011; Chapter 0288 "
124588,2009-01-07,"House Introduced 1/7/2009 and Referred to Resources, Recreation and Development; House Journal  8, PG.125 "
124588,2009-01-08,"House ===CANCELLED=== Public Hearing: 1/22/2009 1:00 PM Legislative Office Building 305 "
124588,2009-01-14,"House Public Hearing: 1/27/2009 1:00 PM Legislative Office Building 305 "
124588,2009-01-28,"House Subcommittee Work Session: 1/29/2009 9:45 Amendment Legislative Office Building 305 "
124588,2009-02-04,"House Subcommittee Work Session: 2/10/2009 2:30 PM Legislative Office Building 305 "
124588,2009-03-04,"House Subcommittee Work Session: 3/12/2009 1:30 PM Legislative Office Building 305 "
124588,2009-03-12,"House Subcommittee Work Session: 3/16/2009 3:00 PM Legislative Office Building 305 "
124588,2009-03-12,"House Executive Session: 3/17/2009 10:30 Amendment Legislative Office Building 305 (Continued 3/18/09 10:00 Amendment Legislative Office Building 305 If Needed) "
124588,2009-03-18,"House Retained in Committee "
124588,2009-11-02,"House ==CANCELLED== Public Hearing: 11/10/2009 11:00 Amendment Legislative Office Building 305 "
124588,2009-11-02,"House Retained Bill - Subcommittee Work Session: 11/16/2009 1:00 PM Legislative Office Building 305 "
124588,2009-11-02,"House ==CANCELLED== Public Hearing on Proposed Amendment: 11/17/2009 11:00 Amendment Legislative Office Building 305 "
124588,2009-11-09,"House Public Hearing on Proposed Amendment: 11/19/2009 9:00 Amendment Legislative Office Building 305-307 "
124588,2009-11-10,"House Retained Bill - Subcommittee Work Session: 11/23/2009 10:00 Amendment Legislative Office Building 305 "
124588,2009-11-11,"House Retained Bill - Executive Session: 11/24/2009 9:30 Amendment Legislative Office Building 305 "
124588,2009-11-23,"House Retained Bill - Subcommittee Work Session: 11/24/2009 10:15 Amendment Legislative Office Building 305 "
124588,2009-11-25,"House Majority Committee Rept: Ought to Pass with Amendment #2010-0006h (NT) for Jan 6 Regular Calendar (vote 11-9); House Calendar2, PG.98 "
124588,2009-11-25,"House Proposed Majority Committee Amendment #2010-0006h (New Title); House Calendar 1, PG.8 "
124588,2009-11-25,"House Minority Committee Report: Inexpedient to Legislate; House Calendar 2, PG.98 "
124588,2010-01-06,"House Special Ordered to Next Session Date in Regular Calendar Order; House Journal  6, PG.310 "
124588,2010-01-13,"House Majority Committee Amendment #2010-0006h (New Title) Failed, Voice Vote; House Journal  9, PG.420-421 "
124588,2010-01-13,"House Ought to Pass: Motion Failed Voice Vote; House Journal  9, PG.420-421 "
124588,2010-01-13,"House Refer to Interim Study (Rep Spang): Motion Adopted Voice Vote; House Journal  9, PG.420-421 "
124588,2010-03-17,"House Referred to Resources, Recreation and Development for Interim Study; House Journal  26, PG.1365 "
124588,2010-09-13,"House Interim Study - Executive Session: 10/26/2010 10:00 Amendment Legislative Office Building 305 "
124589,2009-01-08,"House Introduced and Referred to Criminal Justice and Public Safety; House Journal  12, PG.220 "
124589,2009-01-14,"House Public Hearing: 1/29/2009 10:30 Amendment Legislative Office Building 204 "
124589,2009-02-03,"House Subcommittee Work Session: 2/10/2009 9:00 Amendment Legislative Office Building 204 "
124589,2009-02-10,"House Executive Session: 2/17/2009 10:00 Amendment Legislative Office Building 204 "
124589,2009-03-03,"House Committee Report: Ought to Pass with Amendment #0291h for Mar 11 Consent Calendar (vote 20-0); House Calendar 19, PG.500 "
124589,2009-03-03,"House Proposed Amendment #0291h; House Calendar 19, PG.532-533 "
124589,2009-03-11,"House Amendment #0291h Adopted, Voice Vote; House Journal  24, PG.785 "
124589,2009-03-11,"House Ought to Pass with Amendment #0291h: Motion Adopted Voice Vote; House Journal  24, PG.785 "
124589,2009-03-18,"Senate Introduced and Referred to Judiciary; Senate Journal 8, pg. 133 "
124589,2009-05-07,"Senate Hearing; May 12 , 2009, Room 103, State House, 03:30 p.m.; Senate Calendar 23 "
124589,2009-05-28,"Senate Committee Report; Rereferred to Committee [06/03/09]; Senate Calendar 26 "
124589,2009-06-03,"Senate Without Objection, Chair moved to Special-Order HB 230 to the front of the Calendar; Senate Journal 18, Pg.398 "
124589,2009-06-03,"Senate Rereferred to Committee, Motion Adopted, Voice Vote; Senate Journal 18, Pg.503 "
124589,2010-01-20,"Senate Committee Report; Ought to Pass with Amendment 0199s, 1/27/10; Senate Calendar 4 pg. 6 "
124589,2010-01-27,"Senate Committee Amendment 0199s, Amendment Failed, Voice Vote; "
124589,2010-01-27,"Senate Sen. Reynolds Floor Amendment 0328s, New Title, Amendment Adopted, Voice Vote "
124589,2010-01-27,"Senate Ought to Pass with Amendment 0328s, New Title, Motion Adopted, Voice Vote; OT3rdg; Senate Journal 4, Pg.51 "
124589,2010-01-27,"Senate Passed By Third Reading Resolution; Senate Journal 4, Pg.56 "
124589,2010-04-14,"House House Non Concurs w/Senate Amendment#0328s(NT), Req Comm of Conf (Rep Shurtleff): Motion Adopted Voice Vote; House Journal  32, PG.1587 "
124589,2010-04-14,"House Speaker Appoints Reps Chandley, Stevens, Welch & Shurtleff; House Journal  32, PG.1587 "
124589,2010-05-19,"Senate Sen. Reynolds Accedes to House Request for Committee of Conference, Motion Adopted, Voice Vote; Senate Journal 20, Pg.648 "
124589,2010-05-19,"Senate President Appoints: Senators Lasky, Reynolds and Roberge; Senate Journal 20, Pg.648 "
124589,2010-05-24,"House Conference Committee Meeting: 5/25/2010 3:00 PM Legislative Office Building 204 "
124589,2010-05-27,"Senate Conference Committee Report 2195; Senate Amendment + New Amendment, Filed "
124589,2010-06-02,"Senate Conference Committee Report 2195; Adopted, Voice Vote "
124589,2010-06-02,"House Conference Committee Report #2195 Adopted, Voice Vote "
124589,2010-06-02,"Senate Enrolled Bill Amendment #2394 Adopted "
124589,2010-06-02,"House Enrolled Bill Amendment #2394 Adopted "
124589,2010-06-02,"Senate Enrolled "
124589,2010-06-02,"House Enrolled "
124589,2010-07-15,"House Signed by the Governor 07/13/2010; Effective 01/01/2011; Chapter 0289 "
124590,2009-01-08,"House Introduced and Referred to Environment and Agriculture; House Journal  12, PG. 220  "
124590,2009-01-14,"House Public Hearing: 1/21/2009 11:00 Amendment Legislative Office Building 305 "
124590,2009-01-21,"House Subcommittee Work Session: 1/29/2009 3:00 PM Legislative Office Building 308 "
124590,2009-02-04,"House Executive Session: 2/11/2009 1:00 PM Legislative Office Building 308 (If Needed Continued 2/19/09 9:00 Amendment Legislative Office Building 308) "
124590,2009-02-12,"House Committee Report: Ought to Pass for Feb 18 Consent Calendar (vote 14-1); House Calendar 14, PG.264 "
124590,2009-02-18,"House Ought to Pass: Motion Adopted Voice Vote; House Journal  18, PG.447 "
124590,2009-02-18,"House Referred to Ways and Means; House Journal  18, PG.447 "
124590,2009-02-25,"House Public Hearing: 3/5/2009 10:30 Amendment Legislative Office Building 202 "
124590,2009-03-16,"House Subcommittee Work Session: 3/17/2009 10:00 Amendment Legislative Office Building 207 "
124590,2009-03-16,"House Full Committee Work Session: 3/17/2009 1:30 PM Legislative Office Building 202 "
124590,2009-03-16,"House Executive Session: 3/19/2009 10:00 Amendment Legislative Office Building 202 "
124590,2009-03-20,"House ==CONTINUED== Executive Session: 3/23/2009 1:00 PM Legislative Office Building 202 ==RECESSED== "
124590,2009-03-27,"House Subcommittee Work Session: 3/31/2009 9:30 Amendment Legislative Office Building 202 "
124590,2009-03-28,"House ==CONTINUED== Executive Session: 3/31/2009 9:30 Amendment Legislative Office Building 202 "
124590,2009-03-31,"House Retained in Committee "
124590,2009-09-02,"House Retained Bill - Subcommittee Work Session 9/10/2009 10:00 Amendment Legislative Office Building 202 "
124590,2009-10-07,"House ==CANCELLED== Retained Bill - Executive Session: 10/28/2009 Legislative Office Building 202 1:30 PM "
124590,2009-10-29,"House Retained Bill - Subcommittee Work Session: 11/10/2009 10:30 Amendment Legislative Office Building 202 "
124590,2009-11-01,"House Retained Bill - Subcommittee Work Session: 11/18/2009 9:00 Amendment Legislative Office Building 202 "
124590,2009-11-02,"House Retained Bill - Executive Session: 11/18/2009 10:00 Amendment Legislative Office Building 202 ==TIME CHANGE (Orig 9:00 Amendment)== "
124590,2009-11-19,"House Committee Report: Refer to Interim Study for Jan 6 Consent Calendar (vote 19-0); House Calendar 2, PG.86 "
124590,2010-01-06,"House Removed from Consent Calendar (Rep Almy); House Journal  6, PG.250 "
124590,2010-01-06,"House Special Ordered to Next Session Date; House Journal  6, PG.310 "
124590,2010-01-13,"House Refer to Interim Study: Motion Failed Voice Vote; House Journal  9, PG.443 "
124590,2010-01-13,"House Floor Amendment #2010-0105h (New Title) (Rep S.Scamman) Adopted, Division Vote 202-100; House Journal  9, PG.443-444 "
124590,2010-01-13,"House Ought to Pass with Amendment #2010-0105h (New Title): Motion Adopted Regular Calendar 204-102; House Journal  9, PG.443-445 "
124590,2010-03-24,"Senate Introduced and Referred to Energy, Environment and Economic Development; Senate Journal 11, Pg.259 "
124590,2010-04-01,"Senate Hearing: April 8, 2010, Room 102, Legislative Office Building, 9:15 a.m.; Senate Calendar 14 "
124590,2010-04-15,"Senate Committee Report: Ought to Pass 4/21/10; Senate Calendar 16 "
124590,2010-04-21,"Senate Without Objection, Chair moved to Special Order to 04/28/10 "
124590,2010-04-21,"Senate Committee Report: Ought to Pass 4/28/10 "
124590,2010-04-28,"Senate Ought to Pass, Motion Adopted, Voice Vote; OT3rdg "
124590,2010-04-28,"Senate Passed by Third Reading Resolution "
124590,2010-05-12,"House Enrolled; House Journal  41, PG.2097 "
124590,2010-05-12,"Senate Enrolled "
124590,2010-05-26,"House Signed by the Governor 05/25/2010; Effective 07/01/2010; Chapter 0083 "
124591,2009-01-08,"House Introduced and Referred to Municipal and County Government; House Journal  12, PG.221 "
124591,2009-01-20,"House Public Hearing: 1/29/2009 10:30 Amendment Legislative Office Building 301 "
124591,2009-01-29,"House Executive Session: 2/4/2009 1:00 PM Legislative Office Building 301 (Continued 2/5/09 2:00 PM Legislative Office Building 301 if Needed) "
124591,2009-02-09,"House Executive Session: 2/17/2009 2:30 PM Legislative Office Building 301 (Continued from 2/5/09) "
124591,2009-02-19,"House Executive Session: 2/19/2009 1:00 PM Legislative Office Building 301 (Continued from 2/17/09) "
124591,2009-03-04,"House Executive Session: 3/5/2009 11:00 Amendment Legislative Office Building 301 (Continued from 2/19/09) "
124591,2009-03-04,"House Executive Session: 3/12/2009 1:00 PM Legislative Office Building 301 (Continued from 3/5/09) "
124591,2009-03-12,"House Retained in Committee "
124591,2009-05-26,"House ==CANCELLED== Retained Bill - Subcommittee Work Session: 6/9/2009 11:30 Amendment Legislative Office Building 301 "
124591,2009-09-02,"House Retained Bill - Subcommittee Work Session: 9/15/2009 1:00 PM Legislative Office Building 301 "
124591,2009-09-28,"House Retained Bill - Executive Session: 10/28/2009 Legislative Office Building 301 1:00 PM or Immediately Following Session "
124591,2009-11-02,"House Committee Report: Inexpedient to Legislate for Jan 6 Consent Calendar (vote 15-0); House Calendar 2, PG.85 "
124591,2010-01-06,"House Inexpedient to Legislate: Motion Adopted Voice Vote; House Journal  6, PG.266 "
124592,2009-01-08,"House Introduced and Referred to Judiciary; House Journal  12, PG.221 "
124592,2009-01-13,"House Public Hearing: 1/21/2009 2:00 PM Legislative Office Building 208 "
124592,2009-03-10,"House Executive Session: 3/17/2009 11:00 Amendment Legislative Office Building 208 (Contined 3/18&19/09 11:00 Amendment Legislative Office Building 208 If Needed) "
124592,2009-03-17,"House Retained in Committee "
124592,2009-07-27,"House Retained Bill - Subcommittee Work Session 9/15/2009 11:00 Amendment Legislative Office Building 208 "
124592,2009-10-21,"House Retained Bill - Executive Session: 11/17/2009 10:00 Amendment Legislative Office Building 208 "
124592,2009-11-20,"House Committee Report: Inexpedient to Legislate for Jan 6 Consent Calendar (vote 18-0); House Calendar 2, PG.83 "
124592,2010-01-06,"House Inexpedient to Legislate: Motion Adopted Voice Vote; House Journal  6, PG.263 "
124593,2009-01-08,"House Introduced and Referred to Executive Departments and Administration; House Journal  12, PG.221  "
124593,2009-01-14,"House Public Hearing: 1/27/2009 10:00 Amendment Legislative Office Building 306 "
124593,2009-01-29,"House Subcommittee Work Session: 2/5/2009 8:45 Amendment Legislative Office Building 306 "
124593,2009-02-04,"House ==CANCELLED== Executive Session: 2/10/2009 2:15 PM Legislative Office Building 306 "
124593,2009-02-10,"House Subcommittee Work Session: 2/11/2009 9:00 Amendment Legislative Office Building 306 "
124593,2009-02-11,"House Executive Session: 2/17/2009 2:45 PM Legislative Office Building 306 "
124593,2009-02-26,"House Retained in Committee "
124593,2009-05-13,"House ==TIME CHANGE==Retained Bill - Subcommittee Work Session: 5/19/2009 11:30 Amendment Legislative Office Building 306 (Orig 11:00 Amendment) "
124593,2009-09-17,"House Retained Bill - Subcommittee Work Session: 9/23/2009 2:00 PM Legislative Office Building 306 "
124593,2009-09-17,"House Retained Bill - Subcommittee Work Session: 9/30/2009 2:00 PM Legislative Office Building 307 ==ROOM CHANGE (Orig Legislative Office Building 306)== "
124593,2009-10-30,"House Retained Bill - Executive Session: 11/19/2009 10:00 Amendment Legislative Office Building 306 "
124593,2009-11-20,"House Committee Report: Ought to Pass with Amendment #2529h for Jan 6 Consent Calendar (vote 17-0); House Calendar 2, PG.81 "
124593,2009-11-20,"House Proposed Committee Amendment #2529h; House Calendar 1, PG.8-9 "
124593,2010-01-06,"House Amendment #2529h Adopted, Voice Vote; House Journal  6, PG.260-261 "
124593,2010-01-06,"House Ought to Pass with Amendment #2529h: Motion Adopted Voice Vote; House Journal  6, PG.260-261 "
124593,2010-01-06,"House Referred to Finance "
124593,2010-01-14,"House Full Committee Work Session: 1/27/2010 10:01 Amendment Legislative Office Building 210-211 "
124593,2010-01-14,"House Executive Session: 2/4/2010 10:00 Amendment Legislative Office Building 210-211 "
124593,2010-02-04,"House Committee Report: Ought to Pass for Feb 10 Consent Calendar (vote 22-0); House Calendar 13, PG.527 "
124593,2010-02-10,"House Removed from Consent Calendar (Rep Vaillancourt); House Journal  16, PG.748 "
124593,2010-02-10,"House Special Ordered to Regular Place in Feb 17 Consent Calendar: Motion Adopted Without Objection; House Journal  16, PG.783 "
124593,2010-02-17,"House Ought to Pass: Motion Adopted Voice Vote; House Journal  18, PG.955 "
124593,2010-03-03,"Senate Introduced and Referred to Executive Departments and Administration "
124593,2010-03-19,"Senate Hearing: March 30, 2010, Room 101, Legislative Office Building, 2:30 p.m.; Senate Calendar 12A "
124593,2010-03-31,"Senate Committee Report: Ought to Pass 4/7/10; Senate Calendar 14 "
124593,2010-04-07,"Senate Ought to Pass, Motion Adopted, Voice Vote; OT3rdg; Senate Journal 13, Pg.275 "
124593,2010-04-07,"Senate Passed by Third Reading Resolution; Senate Journal 13, Pg.282 "
124593,2010-04-14,"Senate Enrolled; Senate Journal 14, Pg.301 "
124593,2010-04-14,"House Enrolled; House Journal  32, PG.1587 "
124593,2010-05-10,"House Signed By the Governor 05/07/2010; Effective 07/06/2010; Chapter 0011 "
124594,2009-01-08,"House Introduced and Referred to Labor, Industrial and Rehabilitative Services; House Journal  12, PG.221  "
124594,2009-01-14,"House Public Hearing: 1/29/2009 11:15 Amendment Legislative Office Building 307 "
124594,2009-02-03,"House Subcommittee Work Session: 2/11/2009 9:30 Amendment Legislative Office Building 307 "
124594,2009-02-04,"House ==CANCELLED== Executive Session: 2/11/2009 11:30 Amendment Legislative Office Building 307 "
124594,2009-02-17,"House Subcommittee Work Session: 2/19/2009 9:00 Amendment Legislative Office Building 307 "
124594,2009-02-17,"House Executive Session: 2/19/2009 11:30 Amendment Legislative Office Building 307 "
124594,2009-02-26,"House Retained in Committee "
124594,2009-09-14,"House Retained Bill - Subcommittee Work Session: 9/22/2009 9:00 Amendment Legislative Office Building 307 "
124594,2009-09-30,"House Retained Bill - Subcommittee Work Session: 10/13/2009 9:30 Amendment Legislative Office Building 303 "
124594,2009-10-27,"House Retained Bill - Subcommittee Work Session: 11/3/2009 9:00 Amendment Legislative Office Building 307 "
124594,2009-11-03,"House Retained Bill - Subcommittee Work Session: 11/10/2009 9:15 Amendment Legislative Office Building 307 "
124594,2009-11-04,"House ==CANCELLED== Retained Bill - Executive Session: 11/10/2009 11:00 Amendment Legislative Office Building 307 "
124594,2009-11-10,"House Retained Bill - Subcommittee Work Session: 11/17/2009 9:00 Amendment Legislative Office Building 307 "
124594,2009-11-17,"House Retained Bill - Executive Session: 11/24/2009 1:00 PM Legislative Office Building 307 "
124594,2009-11-25,"House Committee Report: Ought to Pass with Amendment #2527h for Jan 6 Regular Calendar (vote 11-6); House Calendar 4, PG.134 "
124594,2009-11-25,"House Proposed Committee Amendment #2527h; House Calendar 1, PG.9 "
124594,2010-01-06,"House Special Ordered to Next Session Date in Regular Calendar Order; House Journal  6, PG.310 "
124594,2010-01-13,"House Amendment #2527h Adopted, Division Vote 195-123; House Journal  9, PG.414-415 "
124594,2010-01-13,"House Ought to Pass with Amendment #2527h: Motion Adopted Division Vote 180-141; House Journal  9, PG.414-415 "
124594,2010-01-13,"House Referred to Ways and Means; House Journal  9, PG.415 "
124594,2010-01-26,"House Public Hearing: 2/2/2010 11:00 Amendment Legislative Office Building 202 "
124594,2010-03-10,"House Executive Session: 3/16/2010 10:00 Amendment Legislative Office Building 202 (Continued 3/17/10 9:00 Amendment Legislative Office Building 202 If Necessary) "
124594,2010-03-18,"House Corrected Committee Report: Ought to Pass for March 24 (Vote 10-3; Regular Calendar); House Calendar 22B, PG.1 "
124594,2010-03-24,"House Ought to Pass: Motion Adopted Voice Vote; House Journal  30, PG.1483 "
124594,2010-03-24,"Senate Introduced and Referred to Commerce, Labor and Consumer Protection; Senate Journal 11, Pg.259 "
124594,2010-04-06,"Senate Hearing: April 20, 2010, Room 102, Legislative Office Building, 8:30 a.m.; Senate Calendar 15 "
124594,2010-04-20,"Senate Committee Report: Ought to Pass 4/28/10; Senate Calendar 17 "
124594,2010-04-28,"Senate Ought to Pass, Motion Adopted, Voice Vote; OT3rdg "
124594,2010-04-28,"Senate Passed by Third Reading Resolution "
124594,2010-05-05,"House Enrolled Bill Amendment #1812 Adopted; House Journal  38, PG.1915 "
124594,2010-05-05,"Senate Enrolled Bill Amendment #1812 Adopted "
124594,2010-05-12,"House Enrolled; House Journal  41, PG.2097 "
124594,2010-05-12,"Senate Enrolled "
124594,2010-05-26,"House Signed by the Governor 05/25/2010; Effective 07/01/2010; Chapter 0084 "
124595,2009-01-08,"House Introduced and Referred to Election Law; House Journal  12, PG.222  "
124595,2009-01-13,"House Public Hearing: 1/27/2009 11:30 Amendment Legislative Office Building 308 "
124595,2009-01-21,"House Executive Session: 2/3/2009 1:00 PM Legislative Office Building 308 "
124595,2009-02-05,"House Committee Report: Ought to Pass with Amendment #0132h for Feb 12 Regular Calendar (vote 16-0); House Calendar 11, PG.183 "
124595,2009-02-05,"House Proposed Amendment #0132h; House Calendar 11, PG.210-212 "
124595,2009-02-12,"House Special Ordered to Follow First Bill on Regular Calendar for Feb 18: Motion Adopted Voice Vote; House Journal  17, PG.430 "
124595,2009-02-18,"House Amendment #0132h Adopted, Voice Vote; House Journal  18, PG.456-458 "
124595,2009-02-18,"House Ought to Pass with Amendment #0132h: Motion Adopted Regular Calendar 256-114; House Journal  18, PG.456-460 "
124595,2009-02-18,"House Referred to Criminal Justice and Public Safety; House Journal  18, PG.460 "
124595,2009-03-11,"House ===CANCELLED=== Public Hearing: 3/24/2009 11:00 Amendment Legislative Office Building 204 "
124595,2009-03-13,"House Public Hearing: 3/31/2009 10:30 Amendment Legislative Office Building 204 "
124595,2009-03-16,"House Executive Session: 4/2/2009 10:00 Amendment Legislative Office Building 204 "
124595,2009-04-02,"House Committee Report: Ought to Pass with Amendment #1193h for April 8 Consent Calendar (vote 19-1); House Calendar 26, PG.918 "
124595,2009-04-02,"House Proposed Committee Amendment #1193h; House Calendar 26, PG.950 "
124595,2009-04-08,"House Amendment #1193h Adopted, Voice Vote; House Journal  31, PG.1279 "
124595,2009-04-08,"House Ought to Pass with Amendment #1193h: Motion Adopted Voice Vote; House Journal  31, PG.1279 "
124595,2009-04-08,"Senate Introduced and Referred to Election Law and Veterans' Affairs; Senate Journal 11, Pg.233 "
124595,2009-04-22,"Senate Hearing; April 28, 2009, Room 101, Legislative Office Building, 8:30 a.m.; Senate Calendar 21 "
124595,2009-05-05,"Senate Committee Report; Rereferred to Committee 05/13/09; Senate Calendar 23 "
124595,2009-05-13,"Senate Rereferred to Committee, Motion Adopted, Voice Vote; Senate Journal 15, Pg.310 "
124595,2010-01-19,"Senate Committee Report; Ought to Pass 1/21/10; Senate Calendar 3A "
124595,2010-01-21,"Senate Without Objection, Chair moved to Special Order to 01/21/10, 2:00 p.m. "
124595,2010-01-21,"Senate Sen. Carson Floor Amendment 0223s, Regular Calendar 9Y-14N, Amendment Failed "
124595,2010-01-21,"Senate Ought to Pass, Regular Calendar 14Y-9N, Motion Adopted; OT3rdg, Senate Journal 3, Pg.36 "
124595,2010-01-21,"Senate Passed by Third Reading Resolution; Senate Journal 3, Pg.44 "
124595,2010-01-27,"Senate Enrolled; Senate Journal 4, Pg.60 "
124595,2010-02-04,"House Enrolled; House Journal  15, PG.710 "
124595,2010-02-16,"House Vetoed by the Governor on 02/12/2010; House Calendar 17, PG.786 "
124595,2010-05-19,"House Notwithstanding Gov's Veto Shall HB276 Become Law (Rep W.O'Brien): Motion Failed Regular Calendar 1-327; House Journal 46, PG.2193-2195 "
124595,2010-05-24,"House Veto Sustained 05/19/2010; House Journal  46, PG.2193-2195 "
124596,2009-01-08,"House Introduced and Referred to Environment and Agriculture; House Journal  12, PG.222  "
124596,2009-01-14,"House Public Hearing: 1/21/2009 9:00 Amendment Legislative Office Building 305 "
124596,2009-01-21,"House Subcommittee Work Session: 2/5/2009 2:45 PM Legislative Office Building 308 "
124596,2009-02-04,"House Executive Session: 2/11/2009 1:00 PM Legislative Office Building 308 (If Needed Continued 2/19/09 9:00 Amendment Legislative Office Building 308) "
124596,2009-02-26,"House Retained in Committee "
124596,2009-04-14,"House Retained Bill - Subcommittee Work Session: 4/22/2009 10:30 Amendment Legislative Office Building 104 "
124596,2009-04-22,"House Retained Bill - Subcommittee Work Session: 4/28/2009 2:00 PM Legislative Office Building 308 "
124596,2009-04-28,"House Retained Bill - Subcommittee Work Session: 5/14/2009 11:00 Amendment Legislative Office Building 308 "
124596,2009-05-14,"House Retained Bill - Subcommittee Work Session: 5/21/2009 2:00 PM Legislative Office Building 307 "
124596,2009-05-21,"House Retained Bill - Subcommittee Work Session: 6/2/2009 11:00 Amendment Legislative Office Building 308 "
124596,2009-06-09,"House Retained Bill - Subcommittee Work Session: 6/30/2009 11:00 Amendment Legislative Office Building 308 "
124596,2009-08-28,"House Retained Bill - Subcommittee Work Session: 9/23/2009 10:00 Amendment Legislative Office Building 307 ==ROOM CHANGE (Orig Legislative Office Building 308)== "
124596,2009-10-27,"House Retained Bill - Executive Session: 11/17/2009 10:00 Amendment Legislative Office Building 307 "
124596,2009-11-19,"House Committee Report: Inexpedient to Legislate for Jan 6 Consent Calendar (vote 16-1); House Calendar 2, PG.81 "
124596,2010-01-06,"House Inexpedient to Legislate: Motion Adopted Voice Vote; House Journal  6, PG.259 "
124597,2009-01-08,"House Introduced and Referred to Commerce and Consumer Affairs; House Journal  12, PG.222 "
124597,2009-01-14,"House Public Hearing: 1/29/2009 2:15 PM Legislative Office Building 302 "
124597,2009-02-10,"House ==CANCELLED== Executive Session: 3/5/2009 1:00 PM Legislative Office Building 302 "
124597,2009-03-11,"House Executive Session: 3/12/2009 11:00 Amendment Legislative Office Building 302 "
124597,2009-03-12,"House Retained in Committee "
124597,2009-08-03,"House Retained Bill - Subcommittee Work Session: 8/19/2009 9:30 Amendment Legislative Office Building 302 "
124597,2009-08-19,"House Retained Bill - Subcommittee Work Session: 8/26/2009 9:30 Amendment Legislative Office Building 302 "
124597,2009-10-01,"House Retained Bill - Executive Session: 10/28/2009 Legislative Office Building 302 1:00 PM or Immediately Following Session "
124597,2009-10-01,"House =CANCELLED= Retained Bill - Continued Executive Session If Neeeded: 11/3/2009 10:00 Amendment Legislative Office Building 302 "
124597,2009-10-28,"House Retained Bill - Continued Executive Session If Neeeded: 11/12/2009 10:00 Amendment Legislative Office Building 302 "
124597,2009-11-03,"House Committee Report: Ought to Pass with Amendment #2371h for Jan 6 Consent Calendar (vote 16-0); House Calendar 2, PG.79 "
124597,2009-11-03,"House Proposed Committee Amendment #2371h; House Calendar 1, PG.9 "
124597,2010-01-06,"House Amendment #2371h Adopted, Voice Vote; House Journal  6, PG.250 "
124597,2010-01-06,"House Ought to Pass with Amendment #2371h: Motion Adopted Voice Vote; House Journal  6, PG.250 "
124597,2010-03-17,"Senate Introduced and Referred to Commerce, Labor and Consumer Protection, Senate Journal 10, Pg.171 "
124597,2010-04-01,"Senate Hearing: April 8, 2010, Room 103, State House, 1:00 p.m.; Senate Calendar 14 "
124597,2010-04-08,"Senate Committee Report: Ought to Pass 4/14/10; Senate Calendar 15 "
124597,2010-04-14,"Senate Ought to Pass, Motion Adopted, Voice Vote; OT3rdg; Senate Journal 14, Pg.286 "
124597,2010-04-14,"Senate Passed by Third Reading Resolution; Senate Journal 14, Pg.295 "
124597,2010-04-21,"Senate Enrolled "
124597,2010-04-28,"House Enrolled; House Journal  36, PG.1729 "
124597,2010-05-10,"House Signed By the Governor 05/07/2010; Effective 07/06/2010; Chapter 0012 "
124598,2009-01-08,"House Introduced and Referred to Transportation; House Journal  12, PG.222  "
124598,2009-01-27,"House Public Hearing: 2/3/2009 11:30 Amendment Legislative Office Building 203 "
124598,2009-02-03,"House ==CANCELLED== Executive Session: 2/10/2009 10:00 Amendment Legislative Office Building 203 "
124598,2009-02-10,"House Full Committee Work Session: 2/12/2009 2:00 PM Legislative Office Building 203 "
124598,2009-02-11,"House Executive Session: 2/17/2009 10:00 Amendment Legislative Office Building 203 "
124598,2009-02-26,"House Retained in Committee "
124598,2009-10-04,"House Retained Bill - Subcommittee Work Session: 10/28/2009 8:30 Amendment Legislative Office Building 203 "
124598,2009-10-05,"House Retained Bill - Executive Session: 10/28/2009 Legislative Office Building 203 1:00 PM or Immediately Following Session "
124598,2009-11-02,"House Committee Report: Inexpedient to Legislate for Jan 6 Consent Calendar (vote 17-0); House Calendar 2, PG.86 "
124598,2010-01-06,"House Inexpedient to Legislate: Motion Adopted Voice Vote; House Journal  6, PG.268 "
124599,2009-01-08,"House Introduced and Referred to Commerce and Consumer Affairs; House Journal  12, PG.223 "
124599,2009-01-29,"House Public Hearing: 2/11/2009 1:30 PM Legislative Office Building 302 "
124599,2009-03-06,"House Subcommittee Work Session: 3/12/2009 8:40 Amendment Legislative Office Building 302 "
124599,2009-03-06,"House Executive Session: 3/12/2009 11:00 Amendment Legislative Office Building 302 "
124599,2009-03-12,"House Retained in Committee "
124599,2009-09-22,"House Retained Bill - Subcommittee Work Session: 10/14/2009 10:00 Amendment Legislative Office Building 302 "
124599,2009-10-01,"House ==CANCELLED== Retained Bill - Executive Session: 10/28/2009 Legislative Office Building 302 1:00 PM "
124599,2009-10-01,"House =CANCELLED= Retained Bill - Continued Executive Session If Neeeded: 11/3/2009 10:00 Amendment Legislative Office Building 302 "
124599,2009-10-28,"House Retained Bill - Executive Session: 11/12/2009 10:15 Amendment Legislative Office Building 302 ==TIME CHANGE (Orig 10:00AM)== "
124599,2009-11-24,"House Committee Report: Ought to Pass with Amendment #2479h (NT) for Jan 6 Regular Calendar (vote 10-7); House Calendar 2, PG.88 "
124599,2009-11-24,"House Proposed Committee Amendment #2479h (New Title); House Calendar 1, PG.9-10 "
124599,2010-01-06,"House Amendment #2479h (New Title) Adopted, Voice Vote; House Journal  6, PG.274 "
124599,2010-01-06,"House Ought to Pass with Amendment #2479h (New Title): Motion Adopted Division Vote 255-93; House Journal  6, PG.274 "
124599,2010-03-24,"Senate Introduced and Referred to Commerce, Labor and Consumer Protection; Senate Journal 11, Pg.259 "
124599,2010-04-06,"Senate Hearing: April 13, 2010, Room 102, Legislative Office Building, 9:00 a.m.; Senate Calendar 15 "
124599,2010-04-20,"Senate Committee Report: Inexpedient to Legislate 4/28/10; Senate Calendar 17 "
124599,2010-04-28,"Senate Inexpedient to Legislate, Motion Adopted, Voice Vote === BILL KILLED ===; Senate Journal 16, Pg.344 "
124600,2009-01-08,"House Introduced and Referred to Judiciary; House Journal  12, PG.223 "
124600,2009-01-22,"House ===CANCELLED=== Public Hearing: 2/4/2009 10:30 Amendment Legislative Office Building 208 "
124600,2009-02-03,"House ==ROOM CHANGE== Public Hearing: 2/19/2009 11:00 Amendment RepresentativeS HALL (Orig Legislative Office Building 208) "
124600,2009-03-10,"House Executive Session: 3/17/2009 11:00 Amendment Legislative Office Building 208 (Contined 3/18&19/09 11:00 Amendment Legislative Office Building 208 If Needed) "
124600,2009-03-17,"House Retained in Committee "
124600,2009-09-10,"House Retained Bill - Full Committee Work Session: 9/24/2009 10:00 Amendment Legislative Office Building 208 "
124600,2009-10-21,"House Retained Bill - Executive Session: 11/10/2009 10:00 Amendment Legislative Office Building 208 "
124600,2009-11-10,"House Majority Committee Report: Inexpedient to Legislate for Jan 6 Regular Calendar (vote 14-3); House Calendar 2, PG.96 "
124600,2009-11-10,"House Minority Committee Report: Refer to Interim Study; House Calendar 2, PG.96 "
124600,2010-01-06,"House Special Ordered to Next Session Date in Regular Calendar Order; House Journal  6, PG.310 "
124600,2010-01-13,"House Inexpedient to Legislate: Motion Adopted Regular Calendar 242-113; House Journal  9, PG.408-410 "
124601,2009-01-08,"House Introduced and Referred to Local and Regulated Revenues; House Journal  12, PG.223 "
124601,2009-02-04,"House Public Hearing: 2/11/2009 1:30 PM Legislative Office Building 303 "
124601,2009-03-04,"House Subcommittee Work Session: 3/12/2009 2:00 PM Legislative Office Building 303 "
124601,2009-03-04,"House Executive Session: 3/17/2009 10:00 Amendment Legislative Office Building 303 "
124601,2009-03-17,"House Retained in Committee "
124601,2009-06-17,"House Retained Bill - Subcommittee Work Session: 6/30/2009 9:30 Amendment Legislative Office Building 303 "
124601,2009-08-03,"House Retained Bill - Subcommittee Work Session: 8/5/2009 10:00 Amendment Legislative Office Building 303 "
124601,2009-10-16,"House Retained Bill - Executive Session: 11/18/2009 10:00 Amendment Legislative Office Building 303 "
124601,2009-11-20,"House Committee Report: Inexpedient to Legislate for Jan 6 Consent Calendar (vote 16-2); House Calendar 2, PG.84-85 "
124601,2010-01-06,"House Inexpedient to Legislate: Motion Adopted Voice Vote; House Journal  6, PG.266 "
124602,2009-01-08,"House Introduced and Referred to Resources, Recreation and Development; House Journal  12, PG.223 "
124602,2009-02-18,"House Public Hearing: 3/5/2009 1:00 PM Legislative Office Building 305 "
124602,2009-03-06,"House Subcommittee Work Session: 3/9/2009 1:00 PM Legislative Office Building 305 "
124602,2009-03-06,"House Executive Session: 3/12/2009 10:30 Amendment Legislative Office Building 305 "
124602,2009-03-17,"House Committee Report: Ought to Pass with Amendment #0750h (NT) for Mar 24 Consent Calendar (vote 16-1); House Calendar 22, PG.663 "
124602,2009-03-17,"House Proposed Committee Amendment #0750h (New Title); House Calendar 22, PG.717 "
124602,2009-03-24,"House Amendment #0750h (New Title) Adopted, Voice Vote; House Journal  25, PG.864-865 "
124602,2009-03-24,"House Ought to Pass with Amendment #0750h (New Title): Motion Adopted Voice Vote; House Journal  25, PG.864-865 "
124602,2009-04-08,"Senate Introduced and Referred to Energy, Environment and Economic Development; Senate Journal 11, Pg.233 "
124602,2009-05-14,"Senate Hearing; May 21, 2009, Room 102, Legislative Office Building, 9:00 a.m.; Senate Calendar 24 "
124602,2009-05-28,"Senate Committee Report; Rereferred to Committee 06/03/09; Senate Calendar 26 "
124602,2009-06-03,"Senate Without Objection, Chair moved to Special-Order HB 314 to the front of the Calendar; Senate Journal 18, Pg.398 "
124602,2009-06-03,"Senate Rereferred to Committee, Motion Adopted, Voice Vote; Senate Journal 18, Pg.498 "
124602,2009-12-28,"Senate Committee Report; Ought to Pass 01/06/10; Senate Calendar 1 "
124602,2010-01-06,"Senate "
124602,2010-01-06,"Senate Sen. Cilley Moved Recommit, Motion Adopted, Voice Vote; Senate Journal 1, Pg.10 "
124602,2010-01-21,"Senate Committee Report; Inexpedient to Legislate 1/27/10; Senate Calendar 4 "
124602,2010-01-27,"Senate Without Objection, Chair moved to Special-Order HB 314 to the end of the Calendar, Senate Journal 4, Pg.47 "
124602,2010-01-27,"Senate Inexpedient to Legislate, Not Voted On "
124602,2010-01-27,"Senate Sen. Hassan Moved Laid On Table; Motion Adopted, Voice Vote; Senate Journal 4, Pg.55 "
124603,2009-01-08,"House Introduced and Referred to Judiciary; House Journal  12, PG.224 "
124603,2009-02-03,"House Public Hearing: 2/11/2009 11:30 Amendment Legislative Office Building 208 "
124603,2009-02-17,"House Executive Session: 3/5/2009 11:00 Amendment Legislative Office Building 208 (Continued 3/12/09 10:00 Amendment Legislative Office Building 208 If Needed) "
124603,2009-03-06,"House Retained in Committee "
124603,2009-10-19,"House Retained Bill - Subcommittee Work Session: 11/3/2009 1:00 PM Legislative Office Building 208 ==TIME CHANGE (Orig 9:00AM)= "
124603,2009-10-20,"House Retained Bill - Subcommittee Work Session: 11/10/2009 Legislative Office Building 208 Immediately After 10:00 Amendment Exec Sess "
124603,2009-10-21,"House Retained Bill - Subcommittee Work Session: 11/13/2009 9:00 Amendment Legislative Office Building 208 "
124603,2009-10-22,"House Retained Bill - Executive Session: 11/17/2009 10:00 Amendment Legislative Office Building 208 "
124603,2009-11-20,"House Committee Report: Ought to Pass with Amendment #2522h (New Title) for Jan 6 Consent Calendar (vote 18-0); House Calendar 2, PG.83 "
124603,2009-11-20,"House Proposed Committee Amendment #2522h (New Title); House Calendar 1, PG.10-11 "
124603,2010-01-06,"House Amendment #2522h (New Title) Adopted, Voice Vote; House Journal  6, PG.264-265 "
124603,2010-01-06,"House Ought to Pass with Amendment #2522h (New Title): Motion Adopted Voice Vote; House Journal  6, PG.264-265 "
124603,2010-03-24,"Senate Introduced and Referred to Judiciary; Senate Journal 11, Pg.259 "
124603,2010-04-15,"Senate Hearing: April 27, 2010, Room 103, State House, 3:15 p.m.; Senate Calendar 16 "
124603,2010-04-29,"Senate Committee Report: Inexpedient to Legislate, 5/5/10; Senate Calendar 18 "
124603,2010-05-05,"Senate Inexpedient to Legislate, Motion Adopted, Voice Vote === BILL KILLED === Senate Journal 17, Pg.389 "
124604,2009-01-08,"House Introduced and Referred to Education; House Journal  12, PG.224  "
124604,2009-01-15,"House Public Hearing: 1/27/2009 2:00 PM Legislative Office Building 207 "
124604,2009-01-27,"House Subcommittee Work Session: 2/3/2009 3:00 PM Legislative Office Building 207 "
124604,2009-01-28,"House Executive Session: 2/10/2009 1:00 PM Legislative Office Building 207 "
124604,2009-02-26,"House Retained in Committee "
124604,2009-10-21,"House ==CANCELLED== Retained Bill - Executive Session: 12/1/2009 10:00 Amendment Legislative Office Building 207 "
124604,2009-10-30,"House Retained Bill - Executive Session: 11/19/2009 10:00 Amendment Legislative Office Building 207 "
124604,2009-11-30,"House Committee Report: Inexpedient to Legislate for Jan 6 Consent Calendar (vote 15-1); House Calendar 2, PG.80 "
124604,2010-01-06,"House Inexpedient to Legislate: Motion Adopted Voice Vote; House Journal  6, PG.253 "
124605,2009-01-08,"House Introduced and Referred to Judiciary; House Journal  12, PG.224 "
124605,2009-01-21,"House Public Hearing: 1/27/2009 1:30 PM Legislative Office Building 208 "
124605,2009-02-23,"House Subcommittee Work Session: 3/5/2009 12:00 PM Legislative Office Building 208 "
124605,2009-03-10,"House Executive Session: 3/17/2009 11:00 Amendment Legislative Office Building 208 (Contined 3/18&19/09 11:00 Amendment Legislative Office Building 208 If Needed) "
124605,2009-03-17,"House Retained in Committee "
124605,2009-07-27,"House Retained Bill - Subcommittee Work Session 9/15/2009 11:00 Amendment Legislative Office Building 208 "
124605,2009-10-21,"House Retained Bill - Executive Session: 11/17/2009 10:00 Amendment Legislative Office Building 208 "
124605,2009-11-20,"House Committee Report: Inexpedient to Legislate for Jan 6 Consent Calendar (vote 18-0); House Calendar 2, PG.84 "
124605,2010-01-06,"House Inexpedient to Legislate: Motion Adopted Voice Vote; House Journal  6, PG.265 "
124606,2009-01-08,"House Introduced and Referred to Election Law; House Journal  12, PG.224 "
124606,2009-01-21,"House Public Hearing: 2/3/2009 10:30 Amendment Legislative Office Building 308 "
124606,2009-01-21,"House ==CANCELLED== Executive Session: 2/17/2009 10:00 Amendment Legislative Office Building 308 "
124606,2009-01-29,"House ==ROOM CHANGE== Executive Session: 2/4/2009 1:00 PM Legislative Office Building 308 (Orig Legislative Office Building 101) "
124606,2009-02-26,"House Retained in Committee "
124606,2009-09-29,"House Retained Bill - Subcommittee Work Session: 10/20/2009 10:00 Amendment Legislative Office Building 308 =DATE CHANGE (Orig 10/14/09)= "
124606,2009-10-20,"House Retained Bill - Subcommittee Work Session: 11/4/2009 10:00 Amendment Legislative Office Building 308 "
124606,2009-10-21,"House Retained Bill - Subcommittee Work Session: 11/17/2009 9:00 Amendment Legislative Office Building 308 "
124606,2009-10-22,"House Retained Bill - Executive Session: 11/17/2009 9:30 Amendment Legislative Office Building 308 "
124606,2009-11-30,"House Committee Report: Ought to Pass with Amendment #2524h for Jan 6 Regular Calendar (vote 15-0); House Calendar 2, PG.93 "
124606,2009-11-30,"House Proposed Committee Amendment #2524h; House Calendar 1, PG.11 "
124606,2010-01-06,"House Special Ordered to Next Session Date in Regular Calendar Order; House Journal  6, PG.310 "
124606,2010-01-13,"House Amendment #2524h Adopted, Voice Vote; House Journal  9, PG.385 "
124606,2010-01-13,"House Ought to Pass with Amendment #2524h: Motion Adopted Voice Vote; House Journal  9, PG.385 "
124606,2010-03-24,"Senate Introduced and Referred to Election Law and Veterans' Affairs; Senate Journal 11, Pg.259 "
124606,2010-04-15,"Senate Hearing: April 20, 2010, Room 101, Legislative Office Building, 8:30 a.m.; Senate Calendar 16 "
124606,2010-04-21,"Senate Committee Report: Ought to Pass 4/28/10; Senate Calendar 17 "
124606,2010-04-28,"Senate Ought to Pass, Motion Adopted, Voice Vote; OT3rdg "
124606,2010-04-28,"Senate Passed by Third Reading Resolution "
124606,2010-05-12,"House Enrolled; House Journal  41, PG.2097 "
124606,2010-05-12,"Senate Enrolled "
124606,2010-06-15,"House Signed by the Governor 06/09/2010; Effective 08/08/2010; Chapter 0121 "
124607,2009-01-08,"House Introduced and Referred to Criminal Justice and Public Safety; House Journal  12, PG.224 "
124607,2009-02-10,"House Public Hearing: 2/19/2009 10:00 Amendment Legislative Office Building 204 "
124607,2009-02-10,"House ==CANCELLED== Executive Session: 3/5/2009 1:30 PM Legislative Office Building 204 "
124607,2009-03-04,"House Subcommittee Work Session: 3/12/2009 1:00 PM Legislative Office Building 204 "
124607,2009-03-10,"House Executive Session: 3/17/2009 10:15 Amendment Legislative Office Building 204 (Continued 3/18&19/09 10:00 Amendment Legislative Office Building 204 If Needed) "
124607,2009-03-17,"House Retained in Committee "
124607,2009-09-02,"House Retained Bill - Subcommittee Work Session 9/16/2009 10:00 Amendment Legislative Office Building 204 "
124607,2009-09-24,"House Retained Bill - Executive Session: 11/5/2009 10:00 Amendment Legislative Office Building 204 "
124607,2009-11-09,"House Committee Report: Inexpedient to Legislate for Jan 6 Consent Calendar (vote 15-0); House Calendar 2, PG.80 "
124607,2010-01-06,"House Inexpedient to Legislate: Motion Adopted Voice Vote; House Journal  6, PG.253 "
124608,2009-01-08,"House Introduced and Referred to Resources, Recreation and Development; House Journal  12, PG.225  "
124608,2009-01-28,"House Public Hearing: 2/3/2009 10:15 Amendment Legislative Office Building 305 "
124608,2009-02-11,"House Executive Session: 2/17/2009 10:00 Amendment Legislative Office Building 305 "
124608,2009-02-18,"House Committee Report: Ought to Pass for Mar 4 Consent Calendar (vote 16-0); House Calendar 16, PG.370 "
124608,2009-03-04,"House Removed from Consent Calendar (Rep Graham); House Journal  21, PG.559 "
124608,2009-03-04,"House Ought to Pass: Motion Adopted Voice Vote; House Journal  21, PG.637 "
124608,2009-03-04,"House Referred to Ways and Means; House Journal  21, PG.637 "
124608,2009-03-11,"House Subcommittee Work Session: 3/16/2009 10:00 Amendment Legislative Office Building 204 "
124608,2009-03-16,"House Subcommittee Work Session: 3/17/2009 9:00 Amendment Legislative Office Building 202 "
124608,2009-03-16,"House ==CANCELLED== Executive Session: 3/19/2009 10:00 Amendment Legislative Office Building 202 "
124608,2009-03-25,"House Executive Session: 3/31/2009 9:30 Amendment Legislative Office Building 202 "
124608,2009-04-01,"House Retained in Committee "
124608,2009-11-02,"House Retained Bill - Subcommittee Work Session: 11/10/2009 11:30 Amendment Legislative Office Building 202 "
124608,2009-11-02,"House Retained Bill - Executive Session: 11/18/2009 10:00 Amendment Legislative Office Building 202 ==TIME CHANGE (Orig 9:00 Amendment)== "
124608,2009-11-19,"House Committee Report: Inexpedient to Legislate for Jan 6 Consent Calendar (vote 18-1); House Calendar 2, PG.86 "
124608,2010-01-06,"House Inexpedient to Legislate: Motion Adopted Voice Vote; House Journal  6, PG.268 "
124609,2009-01-08,"House Introduced and Referred to Legislative Administration; House Journal  12, PG.225 "
124609,2009-01-27,"House Public Hearing: 2/3/2009 3:45 PM Legislative Office Building 104 "
124609,2009-01-27,"House ==CANCELLED== Executive Session: 2/4/2009 3:00 PM Legislative Office Building 104 "
124609,2009-02-17,"House ==CANCELLED== Public Hearing: 3/3/2009 3:30 PM Legislative Office Building 104 "
124609,2009-02-17,"House ==CANCELLED== Executive Session: 3/5/2009 9:00 Amendment Legislative Office Building 104 "
124609,2009-03-09,"House Subcommittee Work Session: 3/9/2009 11:15 Amendment Legislative Office Building 104 "
124609,2009-03-09,"House Executive Session: 3/12/2009 9:00 Amendment Legislative Office Building 104 "
124609,2009-03-12,"House Committee Report: Ought to Pass for Mar 24 Consent Calendar (vote 12-0); House Calendar 22, PG.660 "
124609,2009-03-24,"House Ought to Pass: Motion Adopted Voice Vote; House Journal  25, PG.858 "
124609,2009-04-08,"Senate Introduced and Referred to Executive Departments and Administration; Senate Journal 11, Pg.234 "
124609,2009-05-14,"Senate Hearing; May 19, 2009, Room 101, Legislative Office Building, 3:20 p.m.; Senate Calendar 24 "
124609,2009-05-27,"Senate Committee Report; Rereferred to Committee 06/03/09; Senate Calendar 26 "
124609,2009-06-03,"Senate Rereferred to Committee, Motion Adopted, Voice Vote; Senate Journal 18, Pg.531 "
124609,2010-01-13,"Senate Committee Report; Inexpedient to Legislate 1/21/10; Senate Calendar 3 "
124609,2010-01-21,"Senate Inexpedient to Legislate, Motion Adopted, Voice Vote === BILL KILLED ===; Senate Journal 3, Pg.39 "
124610,2009-01-08,"House Introduced and Referred to Commerce and Consumer Affairs; House Journal  12, PG.225 "
124610,2009-01-29,"House Public Hearing: 2/10/2009 11:00 Amendment Legislative Office Building 302 "
124610,2009-02-11,"House Subcommittee Work Session: 3/5/2009 9:00 Amendment Legislative Office Building 302 "
124610,2009-03-09,"House Subcommittee Work Session: 3/12/2009 10:15 Amendment Legislative Office Building 302 "
124610,2009-03-09,"House Executive Session: 3/12/2009 11:00 Amendment Legislative Office Building 302 "
124610,2009-03-12,"House Retained in Committee "
124610,2009-09-02,"House Retained Bill - Subcommittee Work Session 9/16/2009 3:00 PM Legislative Office Building 302 "
124610,2009-09-21,"House Retained Bill - Subcommittee Work Session 9/29/2009 9:30 Amendment Legislative Office Building 302 "
124610,2009-09-29,"House Retained Bill - Subcommittee Work Session 10/14/2009 2:00 PM Legislative Office Building 302 "
124610,2009-10-01,"House Retained Bill - Executive Session: 10/28/2009 Legislative Office Building 302 1:00 PM or Immediately Following Session "
124610,2009-10-01,"House =CANCELLED= Retained Bill - Continued Executive Session If Neeeded: 11/3/2009 10:00 Amendment Legislative Office Building 302 "
124610,2009-11-03,"House Majority Committee Report: Ought to Pass with Amendment #2437h for Jan 6 Regular Calendar (vote 14-4); House Calendar 2, PG.88 "
124610,2009-11-03,"House Proposed Majority Committee Amendment #2437h; House Calendar 1, PG.11 "
124610,2009-11-03,"House Minority Committee Report: Inexpedient to Legislate; House Calendar 2, PG.88 "
124610,2010-01-06,"House Amendment #2437h Adopted, Voice Vote; House Journal  6, PG.274-275 "
124610,2010-01-06,"House Ought to Pass with Amendment #2437h: Motion Adopted Division Vote 201-144; House Journal  6, PG.274-275 "
124610,2010-03-24,"Senate Introduced and Referred to Commerce, Labor and Consumer Protection; Senate Journal 11, Pg.259 "
124610,2010-04-06,"Senate Hearing: April 22, 2010, Room 103, Legislative Office Building, 12:30 p.m.; Senate Calendar 15 "
124610,2010-05-11,"Senate Committee Report: Ought to Pass with Amendment 2021s, 5/12/10; Senate Calendar 19A "
124610,2010-05-12,"Senate Without Objection, Chair moved to Special Order to the end of the Calendar; Senate Journal 18, Pg.413 "
124610,2010-05-12,"Senate Committee Report: Ought to Pass with Amendment 2021s, 5/12/10 "
124610,2010-05-12,"Senate Without Objection, Chair moved to Special Order to 5/13/10; Senate Journal 18, Pg.496 "
124610,2010-05-12,"Senate Committee Report: Ought to Pass with Amendment 2021s, 5/13/10 "
124610,2010-05-13,"Senate Committee Amendment 2021s, Amendment Failed, Voice Vote "
124610,2010-05-13,"Senate Sen. DeVries Floor Amendment 2084s, Amendment Adopted, Voice Vote; Senate Journal 19, Pg.520 "
124610,2010-05-13,"Senate Ought to Pass with Amendment 2084s, Motion Adopted, Voice Vote; OT3rdg; Senate Journal 19, Pg.520 "
124610,2010-05-13,"Senate Passed by Third Reading Resolution; Senate Journal 19, Pg.633 "
124610,2010-05-19,"House House Concurs with Senate Amendment #2084s (Rep Butler): Motion Adopted Voice Vote; House Journal  46, PG.2224 "
124610,2010-06-02,"House Enrolled "
124610,2010-06-02,"Senate Enrolled "
124610,2010-07-15,"House Signed by the Governor 07/13/2010; Effective 09/11/2010; Chapter 0290 "
124611,2009-01-08,"House Introduced and Referred to Education; House Journal  12, PG.225 "
124611,2009-01-27,"House Public Hearing: 2/11/2009 1:00 PM Representative's Hall "
124611,2009-02-19,"House Executive Session: 3/5/2009 10:00 Amendment Legislative Office Building 207 "
124611,2009-03-06,"House Retained in Committee "
124611,2009-04-14,"House Retained Bill - Full Committee Work Session: 4/21/2009 11:00 Amendment Legislative Office Building 207 "
124611,2009-04-22,"House Retained Bill - Evaluation & Records Subcommittee Work Session: 4/29/2009 10:00 Amendment Legislative Office Building 207 "
124611,2009-05-21,"House Retained Bill - Survey to Superintendents Subcommittee Work Session: 6/2/2009 10:00 Amendment Legislative Office Building 207 "
124611,2009-06-02,"House ==CANCELLED==Retained Bill-Survey to Superintendents Subcom Work Session: 6/23/2009 10:00 Amendment Legislative Office Building 307 "
124611,2009-06-10,"House ==CANCELLED==Retained Bill-Survey to Superintendents Subcom Work Session: 6/23/2009 1:00 PM Legislative Office Building 207 "
124611,2009-09-02,"House Retained Bill - Survey to Superintendents Subcommittee Work Session: 9/29/2009 10:00 Amendment Legislative Office Building 207 "
124611,2009-09-28,"House Retained Bill - Notification Subcommittee Work Session: 10/13/2009 1:00 PM Legislative Office Building 207 "
124611,2009-10-13,"House Retained Bill - Evaluation & Records Subcommittee Work Session: 10/20/2009 9:00 Amendment Legislative Office Building 205 "
124611,2009-10-13,"House Retained Bill - Survey to Superintendents Subcommittee Work Session: 10/20/2009 10:00 Amendment Legislative Office Building 207 "
124611,2009-10-20,"House Retained Bill -Evaluation & Records Subcom Work Session: 10/28/2009 Legislative Office Building 207 1:30 PM or After Session "
124611,2009-10-20,"House Retained Bill -Probational Appeals Subcom Wk Sess: 10/28/2009 Legislative Office Building207 2:00PM or after Eval&Rec Subcom "
124611,2009-10-20,"House Retained Bill - Definitions Subcommittee Work Session: 10/28/2009 Legislative Office Building 205 2:00 PM or After Session "
124611,2009-10-21,"House Retained Bill - Definitions Subcommittee Work Session: 11/10/2009 1:00 PM Legislative Office Building 207 "
124611,2009-10-22,"House ==CANCELLED== Retained Bill - Executive Session: 12/1/2009 10:00 Amendment Legislative Office Building 207 "
124611,2009-10-30,"House Retained Bill - Executive Session: 11/19/2009 10:00 Amendment Legislative Office Building 207 "
124611,2009-12-01,"House Majority Committee Report: Inexpedient to Legislate for Jan 6 Regular Calendar (vote 14-6); House Calendar 2, PG.92 "
124611,2009-12-01,"House Minority Committee Report: Ought to Pass with Amendment #2010-0018h (New Title); House Calendar 2, PG.92 "
124611,2009-12-01,"House Proposed Minority Committee Amendment #2010-0018h (New Title); House Calendar 1, PG.11-13 "
124611,2010-01-06,"House Special Ordered to Next Session Date in Regular Calendar Order; House Journal  6, PG.310 "
124611,2010-01-13,"House Inexpedient to Legislate: Motion Adopted Regular Calendar 324-34; House Journal  9, PG.382-384 "
124612,2009-01-08,"House Introduced and Referred to Judiciary; House Journal  12, PG.225 "
124612,2009-01-21,"House Public Hearing: 1/29/2009 2:00 PM Legislative Office Building 208 "
124612,2009-02-23,"House Subcommittee Work Session: 3/5/2009 12:00 PM Legislative Office Building 208 "
124612,2009-03-10,"House Executive Session: 3/17/2009 11:00 Amendment Legislative Office Building 208 (Contined 3/18&19/09 11:00 Amendment Legislative Office Building 208 If Needed) "
124612,2009-03-18,"House Retained in Committee "
124612,2009-07-27,"House Retained Bill - Subcommittee Work Session 9/15/2009 11:00 Amendment Legislative Office Building 208 "
124612,2009-10-20,"House Retained Bill - Subcommittee Work Session: 11/17/2009 9:45 Amendment Legislative Office Building 208 "
124612,2009-10-21,"House Retained Bill - Executive Session: 11/17/2009 10:00 Amendment Legislative Office Building 208 "
124612,2009-11-20,"House Majority Committee Report: Ought to Pass with Amendment #2390h for Jan 6 Regular Calendar (vote 11-8); House Calendar 2, PG.96 "
124612,2009-11-20,"House Proposed Majority Committee Amendment #2390h; House Calendar 1, PG.13 "
124612,2009-11-20,"House Minority Committee Report: Inexpedient to Legislate; House Calendar 2, PG.96 "
124612,2010-01-06,"House Special Ordered to Next Session Date in Regular Calendar Order; House Journal  6, PG.310 "
124612,2010-01-13,"House Amendment #2390h Adopted, Division Vote 187-127; House Journal  9, PG.411 "
124612,2010-01-13,"House Ought to Pass with Amendment #2390h: Motion Adopted Regular Calendar 199-141; House Journal  9, PG.410-413 "
124612,2010-03-24,"Senate Introduced and Referred to Public and Municipal Affairs; Senate Journal 11, Pg.259 "
124612,2010-04-22,"Senate Hearing: May 6, 2010, Room 103, Legislative Office Building, 8:40 a.m.; Senate Calendar 17 "
124612,2010-05-06,"Senate Committee Report: Ought to Pass, 5/12/10; Senate Calendar 19 "
124612,2010-05-12,"Senate Ought to Pass, Motion Adopted, Voice Vote; OT3rdg; Senate Journal 18, Pg.479 "
124612,2010-05-12,"Senate Passed by Third Reading Resolution; Senate Journal 18, Pg.496 "
124612,2010-05-19,"Senate Enrolled Bill Amendment #2102 Adopted; Senate Journal 20, Pg.660 "
124612,2010-05-19,"House Enrolled Bill Amendment #2102 Adopted; House Journal  46, PG.2244-2245 "
124612,2010-05-19,"House Enrolled; House Journal  46, PG.2247 "
124612,2010-05-19,"Senate Enrolled; Senate Journal 20, Pg.664 "
124612,2010-07-27,"House Vetoed by the Governor 07/26/2010 "
124613,2009-01-08,"House Introduced and Referred to Health, Human Services and Elderly Affairs; House Journal  12, PG.225 "
124613,2009-02-11,"House Public Hearing: 2/19/2009 1:00 PM Legislative Office Building 205 "
124613,2009-03-04,"House Subcommittee Work Session: 3/12/2009 9:00 Amendment Legislative Office Building 205 "
124613,2009-03-12,"House Subcommittee Work Session: 3/16/2009 1:00 PM Legislative Office Building 205 "
124613,2009-03-12,"House Executive Session: 3/18/2009 9:30 Amendment Legislative Office Building 205 "
124613,2009-03-18,"House Retained in Committee "
124613,2009-09-29,"House Retained Bill - Subcommittee Work Session: 9/30/2009 1:00 PM Legislative Office Building 205 "
124613,2009-10-13,"House Retained Bill - Executive Session: 11/10/2009 1:00 PM Legislative Office Building 205 "
124613,2009-11-12,"House Committee Report: Refer to Interim Study for Jan 6 Consent Calendar (vote 14-0); House Calendar 2, PG.82 "
124613,2010-01-06,"House Removed from Consent Calendar (Rep Vaillancourt); House Journal  6, PG.250 "
124613,2010-01-06,"House Special Ordered to Next Session Date; House Journal  6, PG.310 "
124613,2010-01-13,"House Refer to Interim Study: Motion Adopted Voice Vote; House Journal  9, PG.443 "
124613,2010-03-17,"House Referred to Health, Human Services and Elderly Affairs for Interim Study; House Journal  26, PG.1365 "
124613,2010-07-12,"House Interim Study - Subcommittee Work Session: 8/3/2010 10:00 Amendment Legislative Office Building 205 "
124613,2010-09-07,"House Interim Study - Executive Session: 10/26/2010 10:00 Amendment Legislative Office Building 205 "
124614,2009-01-08,"House Introduced and Referred to Executive Departments and Administration; House Journal  12, PG.226 "
124614,2009-01-21,"House Public Hearing: 2/3/2009 11:00 Amendment Legislative Office Building 306 "
124614,2009-03-05,"House Executive Session: 3/12/2009 2:00 PM Legislative Office Building 306 "
124614,2009-03-12,"House Retained in Committee "
124614,2009-05-13,"House ==TIME CHANGE==Retained Bill - Subcommittee Work Session: 5/19/2009 11:30 Amendment Legislative Office Building 306 (Orig 11:00 Amendment) "
124614,2009-09-17,"House Retained Bill - Subcommittee Work Session: 9/23/2009 2:00 PM Legislative Office Building 306 "
124614,2009-09-17,"House Retained Bill - Subcommittee Work Session: 9/30/2009 2:00 PM Legislative Office Building 307 ==ROOM CHANGE (Orig Legislative Office Building 306)== "
124614,2009-10-30,"House Retained Bill - Executive Session: 11/19/2009 10:00 Amendment Legislative Office Building 306 "
124614,2009-11-20,"House Majority Committee Report: Ought to Pass for Jan 6 Regular Calendar (vote 11-6); House Calendar 2, PG.94 "
124614,2009-11-20,"House Minority Committee Report: Inexpedient to Legislate; House Calendar 2, PG.94 "
124614,2010-01-06,"House Special Ordered to Next Session Date in Regular Calendar Order; House Journal  6, PG.310 "
124614,2010-01-13,"House Ought to Pass: Motion Failed Division Vote 154-185; House Journal  9, PG.396-397 "
124614,2010-01-13,"House Inexpedient to Legislate (Rep Eaton): Motion Adopted Regular Calendar 200-147; House Journal  9, PG.396-399 "
124615,2009-01-08,"House Introduced and Referred to Children and Family Law; House Journal  12, PG.227 "
124615,2009-01-27,"House Public Hearing: 2/5/2009 11:15 Amendment Legislative Office Building 206 "
124615,2009-03-04,"House Executive Session: 3/18/2009 10:00 Amendment Legislative Office Building 206 "
124615,2009-03-19,"House Retained in Committee "
124615,2009-09-15,"House Retained Bill - Subcommittee Work Session: 9/22/2009 10:00 Amendment Legislative Office Building 206 "
124615,2009-09-16,"House Retained Bill - Subcommittee Work Session: 10/7/2009 10:00 Amendment Legislative Office Building 206 "
124615,2009-09-17,"House Retained Bill - Executive Session: 10/28/2009 Legislative Office Building 206 11:00 Amendment or Immediately Following Session "
124615,2009-11-02,"House Committee Report: Inexpedient to Legislate for Jan 6 Consent Calendar (vote 17-0); House Calendar 2, PG.79 "
124615,2010-01-06,"House Inexpedient to Legislate: Motion Adopted Voice Vote; House Journal  6, PG.250 "
124616,2009-01-08,"House Introduced and Referred to Executive Departments and Administration; House Journal  12, PG.227 "
124616,2009-02-18,"House Public Hearing: 3/5/2009 2:00 PM Legislative Office Building 306 "
124616,2009-03-11,"House Subcommittee Work Session: 3/17/2009 10:15 Amendment Legislative Office Building 306 "
124616,2009-03-11,"House Executive Session: 3/18/2009 9:30 Amendment Legislative Office Building 306 "
124616,2009-03-18,"House Retained in Committee "
124616,2009-05-13,"House Retained Bill - Subcommittee Work Session: 5/26/2009 1:00 PM Legislative Office Building 306 "
124616,2009-05-27,"House ==CANCELLED== Retained Bill - Subcommittee Work Session: 6/9/2009 10:00 Amendment Legislative Office Building 306 "
124616,2009-05-27,"House ==CANCELLED== Retained Bill - Subcommittee Work Session: 6/23/2009 10:00 Amendment Legislative Office Building 306 "
124616,2009-06-10,"House ==CANCELLED== Retained Bill - Subcommittee Work Session: 6/23/2009 1:00 PM Legislative Office Building 306 "
124616,2009-07-01,"House Retained Bill - Subcommittee Work Session: 8/6/2009 10:00 Amendment Legislative Office Building 306 "
124616,2009-08-11,"House Retained Bill - Subcommittee Work Session: 8/18/2009 10:00 Amendment Legislative Office Building 306 "
124616,2009-08-18,"House Retained Bill - Presentation by Dr. Mary Brunette on Co-Occurring Illnesses: 9/22/2009 9:30AM Legislative Office Building306 "
124616,2009-08-18,"House Retained Bill - Subcommittee Work Session: 9/22/2009 10:00 Amendment Legislative Office Building 306-308 "
124616,2009-10-01,"House Retained Bill - Subcommittee Work Session: 10/13/2009 1:00 PM Legislative Office Building 306-308 "
124616,2009-10-15,"House Retained Bill - Subcommittee Work Session: 10/27/2009 1:00 PM Legislative Office Building 307 "
124616,2009-10-30,"House Retained Bill - Executive Session: 11/19/2009 10:00 Amendment Legislative Office Building 306 "
124616,2009-11-20,"House Committee Report: Ought to Pass with Amendment #2521h for Jan 6 Regular Calendar (vote 17-0); House Calendar 2, PG.94 "
124616,2009-11-20,"House Proposed Committee Amendment #2521h; House Calendar 1, PG.13-18 "
124616,2010-01-06,"House Special Ordered to Next Session Date in Regular Calendar Order; House Journal  6, PG.310 "
124616,2010-01-13,"House Amendment #2521h Adopted, Voice Vote; House Journal  9, PG.399-405 "
124616,2010-01-13,"House Ought to Pass with Amendment #2521h: Motion Adopted Voice Vote; House Journal  9, PG.399-405 "
124616,2010-01-13,"House Referred to Ways and Means; House Journal  9, PG.405 "
124616,2010-01-20,"House Public Hearing: 1/28/2010 10:00 Amendment Legislative Office Building 202 "
124616,2010-02-02,"House Executive Session: 2/11/2010 9:30 Amendment Legislative Office Building 202 "
124616,2010-02-12,"House Committee Report: Ought to Pass for Mar 3 Consent Calendar (Vote 15-1); House Calendar 17, PG.816 "
124616,2010-03-03,"House Ought to Pass: Motion Adopted Voice Vote; House Journal  20, PG.1164 "
124616,2010-03-24,"Senate Introduced and Referred to Executive Departments and Administration; Senate Journal 11, Pg.259 "
124616,2010-04-15,"Senate Hearing: April 20, 2010, Room 101, Legislative Office Building, 2:00 p.m.; Senate Calendar 16 "
124616,2010-05-05,"Senate Committee Report: Ought to Pass, 5/12/10; Senate Calendar 19 "
124616,2010-05-12,"Senate Ought to Pass, Motion Adopted, Voice Vote; OT3rdg "
124616,2010-05-12,"Senate Passed by Third Reading Resolution "
124616,2010-05-19,"House Enrolled Bill Amendment #2099 Adopted; House Journal  46, PG.2246 "
124616,2010-05-19,"Senate Enrolled Bill Amendment #2099 Adopted "
124616,2010-06-02,"Senate Enrolled "
124616,2010-06-02,"House Enrolled "
124616,2010-07-07,"House Signed by the Governor 07/06/2010; Effective 09/04/2010; Chapter 0249 "
124617,2009-01-08,"House Introduced and Referred to Election Law; House Journal  12, PG.227 "
124617,2009-01-21,"House Public Hearing: 2/10/2009 1:30 PM Legislative Office Building 308 "
124617,2009-02-04,"House ==TIME CHANGE== Executive Session: 2/17/2009 10:00 Amendment Legislative Office Building 308 (Orig 9:30 Amendment) "
124617,2009-02-26,"House Retained in Committee "
124617,2009-08-20,"House Retained Bill - Subcommittee Work Session: 9/15/2009 10:30 Amendment Legislative Office Building 307 "
124617,2009-10-21,"House Retained Bill - Executive Session: 11/17/2009 9:30 Amendment Legislative Office Building 308 "
124617,2009-11-24,"House Committee Report: Inexpedient to Legislate for Jan 6 Consent Calendar (vote 17-0); House Calendar 2, PG.81 "
124617,2010-01-06,"House Inexpedient to Legislate: Motion Adopted Voice Vote; House Journal  6, PG.258 "
124618,2009-01-08,"House Introduced and Referred to Local and Regulated Revenues; House Journal  12, PG.227 "
124618,2009-01-29,"House Public Hearing: 2/5/2009 11:00 Amendment Legislative Office Building 303 "
124618,2009-03-04,"House Executive Session: 3/12/2009 10:45 Amendment Legislative Office Building 303 "
124618,2009-03-12,"House Retained in Committee "
124618,2009-09-08,"House Retained Bill - Subcommittee Work Session: 9/23/2009 10:00 Amendment Legislative Office Building 303 "
124618,2009-10-16,"House Retained Bill - Executive Session: 11/18/2009 10:00 Amendment Legislative Office Building 303 "
124618,2009-11-20,"House Committee Report: Inexpedient to Legislate for Jan 6 Consent Calendar (vote 17-0); House Calendar 2, PG.85 "
124618,2010-01-06,"House Inexpedient to Legislate: Motion Adopted Voice Vote; House Journal  6, PG.266 "
124619,2009-01-08,"House Introduced and Referred to Judiciary; House Journal  12, PG.227  "
124619,2009-01-21,"House Public Hearing: 1/27/2009 1:00 PM Legislative Office Building 208 "
124619,2009-02-09,"House Subcommittee Work Session: 2/11/2009 12:00 PM Legislative Office Building 208 "
124619,2009-02-12,"House Subcommittee Work Session: 2/17/2009 9:55 Amendment Legislative Office Building 208 "
124619,2009-02-13,"House Executive Session: 2/17/2009 10:00 Amendment Legislative Office Building 208 "
124619,2009-02-26,"House Retained in Committee "
124619,2009-07-27,"House Retained Bill - Subcommittee Work Session 9/15/2009 11:00 Amendment Legislative Office Building 208 "
124619,2009-09-15,"House Retained Bill - Subcommittee Work Session: 9/22/2009 10:00 Amendment Legislative Office Building 208 "
124619,2009-10-20,"House Retained Bill - Subcommittee Work Session: 11/17/2009 9:45 Amendment Legislative Office Building 208 "
124619,2009-10-21,"House Retained Bill - Executive Session: 11/17/2009 10:00 Amendment Legislative Office Building 208 "
124619,2009-11-20,"House Committee Report: Ought to Pass with Amendment #2383h for Jan 6 Consent Calendar (vote 19-0); House Calendar 2, PG.84 "
124619,2009-11-20,"House Proposed Committee Amendment #2383h; House Calendar 1, PG.18-19 "
124619,2010-01-06,"House Amendment #2383h Adopted, Voice Vote; House Journal  6, PG.265-266 "
124619,2010-01-06,"House Ought to Pass with Amendment #2383h: Motion Adopted Voice Vote; House Journal  6, PG.265-266 "
124619,2010-01-06,"House Referred to Ways and Means "
124619,2010-01-12,"House Public Hearing: 1/20/2010 10:15 Amendment Legislative Office Building 202 "
124619,2010-02-02,"House Executive Session: 2/11/2010 9:30 Amendment Legislative Office Building 202 "
124619,2010-02-12,"House Committee Report: Ought to Pass with Amendment #0650h (NT) for Mar 3 Consent Calendar (Vote 17-0); House Calendar 17, PG.816 "
124619,2010-02-12,"House Proposed Committee Amendment #0650h (New Title); House Calendar 17, PG.834 "
124619,2010-03-03,"House Amendment #0650h (New Title) Adopted, Voice Vote; House Journal  20, PG.1164 "
124619,2010-03-03,"House Ought to Pass with Amendment #0650h (New Title): Motion Adopted Voice Vote; House Journal  20, PG.1164 "
124619,2010-03-10,"Senate Introduced and Referred to Judiciary "
124619,2010-03-22,"Senate Hearing: March 30, 2010, Room 103, State House, 2:30 p.m.; Senate Calendar 13 "
124619,2010-04-14,"Senate Committee Report: Inexpedient to Legislate 4/21/10; Senate Calendar 16 "
124619,2010-04-21,"Senate Inexpedient to Legislate, Motion Adopted, Voice Vote === BILL KILLED ===; Senate Journal 15, Pg.319 "
124620,2009-01-08,"House Introduced and Referred to Commerce and Consumer Affairs; House Journal  12, PG.228  "
124620,2009-01-27,"House Public Hearing: 2/4/2009 2:30 PM Legislative Office Building 302 "
124620,2009-02-05,"House Subcommittee Work Session: 2/10/2009 9:30 Amendment Legislative Office Building 302 "
124620,2009-02-05,"House Executive Session: 2/11/2009 10:00 Amendment Legislative Office Building 302 "
124620,2009-02-26,"House Retained in Committee "
124620,2009-09-21,"House Retained Bill - Subcommittee Work Session: 10/6/2009 2:00 PM Legislative Office Building 302 "
124620,2009-10-01,"House Retained Bill - Executive Session: 10/28/2009 Legislative Office Building 302 1:00 PM or Immediately Following Session "
124620,2009-10-01,"House =CANCELLED= Retained Bill - Continued Executive Session If Neeeded: 11/3/2009 10:00 Amendment Legislative Office Building 302 "
124620,2009-10-28,"House Retained Bill - Continued Executive Session If Neeeded: 11/12/2009 10:15 Amendment Legislative Office Building 302 "
124620,2009-11-24,"House Committee Report: Ought to Pass with Amendment #2448h for Jan 6 Regular Calendar (vote 16-1); House Calendar 2, PG.88-89 "
124620,2009-11-24,"House Proposed Committee Amendment #2448h; House Calendar 1, PG.19 "
124620,2010-01-06,"House Amendment #2448h Adopted, Voice Vote; House Journal  6, PG.275 "
124620,2010-01-06,"House Ought to Pass with Amendment #2448h: Motion Adopted Division Vote 242-104; House Journal  6, PG.275 "
124620,2010-01-06,"House Referred to Criminal Justice and Public Safety; House Journal  6, PG.275 "
124620,2010-02-23,"House Public Hearing: 3/4/2010 10:00 Amendment Legislative Office Building 204 "
124620,2010-02-23,"House Executive Session: 3/4/2010 1:00 PM Legislative Office Building 204 "
124620,2010-03-05,"House Committee Report: Ought to Pass for Mar 24 (Vote 15-2; Regular Calendar); House Calendar 22, PG.1222 "
124620,2010-03-24,"House Ought to Pass: Motion Adopted Division Vote 251-92; House Journal  30, PG.1490 "
124620,2010-03-24,"Senate Introduced and Referred to Energy, Environment and Economic Development; Senate Journal 11, Pg.259 "
124620,2010-04-01,"Senate Hearing: April 8, 2010, Room 102, Legislative Office Building, 8:35 a.m.; Senate Calendar 14 "
124620,2010-04-15,"Senate Committee Report: Ought to Pass with Amendment 1413s, 4/21/10; Senate Calendar 16 "
124620,2010-04-21,"Senate Committee Amendment 1413s Not Voted On "
124620,2010-04-21,"Senate Sen. Merrill Moved Laid on Table, Motion Adopted, Voice Vote; Senate Journal 15, Pg.316 "
124620,2010-05-13,"Senate Sen. Fuller Clark Moved Remove From Table, Motion Adopted, Voice Vote; Senate Journal 19, Pg.505 "
124620,2010-05-13,"Senate Committee Amendment 1413s, Amendment Failed, Voice Vote; Senate Journal 19, Pg 506 "
124620,2010-05-13,"Senate Sen. Fuller Clark Floor Amendment 2063s, Amendment Adopted, Voice Vote; Senate Journal 19, Pg.507 "
124620,2010-05-13,"Senate Ought to Pass with Amendment 2063s, Motion Adopted, Voice Vote; OT3rdg; Senate Journal 19, Pg.507 "
124620,2010-05-13,"Senate Passed by Third Reading Resolution; Senate Journal 19, Pg.633 "
124620,2010-05-19,"House House Non-Concurs with Senate Amendment and Requests Comm of Conf (Rep Hess): Motion Adopted Voice Vote; House Journal  46, PG.2239 "
124620,2010-05-19,"House Speaker Appoints: Reps Nord, Schlachman, Movsesian & Hunt; House Journal  46, PG.2239 "
124620,2010-05-19,"Senate Sen. Hassan accedes to House Request for Committee of Conference, Motion Adopted, Voice Vote; Senate Journal 20, Pg.655 "
124620,2010-05-19,"Senate President Appoints: Senators Fuller Clark, Merrill and Odell; Senate Journal 20, Pg.655 "
124620,2010-05-21,"House Conference Committee Meeting: 5/26/2010 1:00 PM Legislative Office Building 304 "
124620,2010-05-27,"Senate Conference Committee Report 2246; Unable to Reach Agreement, Filed "
124620,2010-06-02,"Senate Conference Committee Report 2246; Adopted, Voice Vote; Senate Journal 21, Pg.667 "
124620,2010-06-02,"House Conference Committee Report #2246 Adopted, Voice Vote; House Journal  51, PG.2311 "
124621,2009-01-08,"House Introduced and Referred to Commerce anad Consumer Affairs; House Journal  12, PG.228 "
124621,2009-02-10,"House Public Hearing: 3/17/2009 11:30 Amendment Legislative Office Building 302 "
124621,2009-02-12,"House ==CANCELLED== Executive Session: 3/19/2009 10:00 Amendment Legislative Office Building 302 "
124621,2009-03-09,"House Executive Session: 3/18/2009 11:00 Amendment Legislative Office Building 302 "
124621,2009-03-18,"House Retained in Committee "
124621,2009-09-29,"House Retained Bill - Subcommittee Work Session: 10/14/2009 2:30 PM Legislative Office Building 302 "
124621,2009-09-30,"House Retained Bill - Subcommittee Work Session: 10/20/2009 2:30 PM Legislative Office Building302 "
124621,2009-10-01,"House Retained Bill - Executive Session: 10/28/2009 Legislative Office Building 302 1:00 PM or Immediately Following Session "
124621,2009-10-01,"House =CANCELLED= Retained Bill - Continued Executive Session If Neeeded: 11/3/2009 10:00 Amendment Legislative Office Building 302 "
124621,2009-10-28,"House Retained Bill - Continued Executive Session If Neeeded: 11/12/2009 10:15 Amendment Legislative Office Building 302 "
124621,2009-11-24,"House Committee Report: Inexpedient to Legislate for Jan 6 Consent Calendar (vote 16-0); House Calendar 2, PG.79 "
124621,2010-01-06,"House Inexpedient to Legislate: Motion Adopted Voice Vote; House Journal  6, PG.250 "
124622,2009-01-08,"House Introduced and Referred to Municipal and County Government; House Journal  12, PG.228 "
124622,2009-01-29,"House Public Hearing: 2/5/2009 1:00 PM Legislative Office Building 301 "
124622,2009-02-18,"House ==TIME CHANGE== Executive Session: 2/19/2009 1:00 PM Legislative Office Building 301 (Orig 2:00 PM) "
124622,2009-02-20,"House Committee Report: Ought to Pass with Amendment #0088h for Mar 11 Consent Calendar (vote 14-0); House Calendar 19, PG.503 "
124622,2009-02-20,"House Proposed Amendment #0088h; House Calendar 19, PG.537 "
124622,2009-03-11,"House Amendment #0088h Adopted, Voice Vote; House Journal  24, PG.796-797 "
124622,2009-03-11,"House Ought to Pass with Amendment #0088h: Motion Adopted Voice Vote; House Journal  24, PG.796-797 "
124622,2009-03-18,"Senate Introduced and Referred to Public and Municipal Affairs; Senate Journal 8, pg. 134 "
124622,2009-04-30,"Senate Hearing; May 14 , 2009, Room 103, Legislative Office Building, 09:15 a.m.; Senate Calendar 22 "
124622,2009-05-14,"Senate Hearing; === RECESSED === May 14, 2009 Room 103, Legislative Office Building, 9:15 a.m.; Senate Calendar 24 "
124622,2009-05-14,"Senate Hearing; === RECONVENE === May 21, 2009, Room 103, Legislative Office Building, 9:10 a.m.; Senate Calendar 24 "
124622,2009-05-28,"Senate Committee Report; Rereferred to Committee [06/03/09]; Senate Calendar 26 "
124622,2009-06-03,"Senate Without Objection, Chair moved to Special-Order HB 446 to the front of the Calendar; Senate Journal 18, Pg.398 "
124622,2009-06-03,"Senate Rereferred to Committee, Motion Adopted, Voice Vote; Senate Journal 18, Pg.513 "
124622,2010-01-20,"Senate Committee Report; Inexpedient to Legislate 1/27/10; Senate Calendar 4 "
124622,2010-01-27,"Senate Inexpedient to Legislate, Motion Adopted, Voice Vote === BILL KILLED ===; Senate Journal 4, Pg.54 "
124623,2009-01-08,"House Introduced and Referred to Public Works and Highways; House Journal  12, PG.228 "
124623,2009-01-20,"House Public Hearing: 1/27/2009 11:30 Amendment Legislative Office Building 201 "
124623,2009-01-27,"House ==CANCELLED== Executive Session: 2/3/2009 10:30 Amendment Legislative Office Building 201 "
124623,2009-02-03,"House ==CANCELLED== Executive Session: 2/10/2009 10:15 Amendment Legislative Office Building 201 "
124623,2009-02-04,"House Executive Session: 2/11/2009 10:00 Amendment Legislative Office Building 201 "
124623,2009-02-20,"House Committee Report: Ought to Pass with Amendment #0159h for Mar 4 Consent Calendar (vote 17-0); House Calendar 16, PG.370 "
124623,2009-02-20,"House Proposed Amendment #0159h; House Calendar 15, PG.324-325 "
124623,2009-03-04,"House Amendment #0159h Adopted, Voice Vote; House Journal  21, PG.591 "
124623,2009-03-04,"House Ought to Pass with Amendment #0159h: Motion Adopted Voice Vote; House Journal  21, PG.591 "
124623,2009-03-18,"Senate Introduced and Referred to Transportation & Interstate Cooperation; Senate Journal 8, pg. 134 "
124623,2009-03-19,"Senate Hearing; March 26 , 2009, Room 101, Legislative Office Building, 11:15 a.m.; Senate Calendar 16 "
124623,2009-05-21,"Senate Committee Report; Ought to Pass [05/27/09]; Senate Calendar 25 "
124623,2009-05-27,"Senate Ought to Pass, Motion Failed, Voice Vote; Senate Journal 17, Pg.388 "
124623,2009-05-27,"Senate Rereferred to Committee, Motion Adopted, Voice Vote; Senate Journal 17, Pg.388 "
124623,2010-01-07,"Senate Committee Report: Ought to Pass, 01/13/10; Senate Calendar 2 "
124623,2010-01-13,"Senate Ought to Pass, Motion Adopted, Voice Vote; OT3rdg; Senate Journal 2, Pg.26 "
124623,2010-01-13,"Senate Passed By Third Reading Resolution; Senate Journal 2, Pg.27 "
124623,2010-01-21,"Senate Enrolled; Senate Journal 3, Pg.47 "
124623,2010-01-25,"House Enrolled; House Journal  10, PG.458 "
124623,2010-02-02,"House Signed by the Governor 02/01/2010; Effective 04/02/2010; Chapter 0002 "
124624,2009-01-08,"House Introduced and Referred to Transportation; House Journal  12, PG.229 "
124624,2009-02-11,"House Public Hearing: 2/17/2009 1:00 PM Legislative Office Building 203 "
124624,2009-02-11,"House ==CANCELLED== Executive Session: 2/18/2009 2:00 PM Legislative Office Building 203 "
124624,2009-03-09,"House Retained in Committee "
124624,2009-05-12,"House Retained Bill - Subcommittee Work Session: 5/27/2009 11:00 Amendment Legislative Office Building 203 "
124624,2009-09-14,"House Retained Bill - Subcommittee Work Session: 9/23/2009 9:30 Amendment Legislative Office Building 203 "
124624,2009-10-01,"House Retained Bill - Subcommittee Work Session: 10/14/2009 9:30 Amendment Legislative Office Building 203 "
124624,2009-10-05,"House Retained Bill - Executive Session: 10/28/2009 Legislative Office Building 203 1:00 PM or Immediately Following Session "
124624,2009-11-02,"House Committee Report: Inexpedient to Legislate for Jan 6 Consent Calendar (vote 17-0); House Calendar 2, PG.86 "
124624,2010-01-06,"House Inexpedient to Legislate: Motion Adopted Voice Vote; House Journal  6, PG.268 "
124625,2009-01-08,"House Introduced and Referred to Commerce and Consumer Affairs; House Journal  12, PG.230 "
124625,2009-02-10,"House Public Hearing: 3/9/2009 1:30 PM Legislative Office Building 302 "
124625,2009-03-11,"House ==TIME CHANGE== Subcommittee Work Session: 3/13/2009 1:00 PM Legislative Office Building 302 (Orig 10:00 Amendment) "
124625,2009-03-12,"House Executive Session: 3/17/2009 1:00 PM Legislative Office Building 302 (Continued 3/18/09 11:00 Amendment Legislative Office Building 302 If Needed) "
124625,2009-03-18,"House Retained in Committee "
124625,2009-09-29,"House Retained Bill - Subcommittee Work Session: 10/14/2009 1:00 PM Legislative Office Building 307 "
124625,2009-09-30,"House Retained Bill - Subcommittee Work Session: 10/22/09 1:00 PM Legislative Office Building 302 "
124625,2009-10-01,"House ==CANCELLED== Retained Bill - Executive Session: 10/28/2009 1:00 PM Legislative Office Building 302 "
124625,2009-10-01,"House Retained Bill - Subcommittee Work Session: 11/2/09 10:00 Amendment Legislative Office Building 302 "
124625,2009-10-01,"House ==CANCELLED== Retained Bill - Executive Session: 11/3/2009 10:00 Amendment Legislative Office Building 302 "
124625,2009-10-28,"House Retained Bill - Executive Session: 11/12/2009 10:15 Amendment Legislative Office Building 302 ==TIME CHANGE (Orig 10:00AM)== "
124625,2009-11-24,"House Majority Committee Report: Ought to Pass with Amendment #2471h (NT) for Jan 6 Regular Calendar (vote 14-3); House Calendar 2, PG.89 "
124625,2009-11-24,"House Proposed Majority Committee Amendment #2471h (New Title); House Calendar 1, PG.19-20 "
124625,2009-11-24,"House Minority Committee Report: Ought to Pass with Amendment #2511h (New Title); House Calendar 2, PG.89 "
124625,2009-11-24,"House Proposed Minority Committee Amendment #2511h (New Title); House Calendar 1, PG.20-22 "
124625,2010-01-06,"House Amendment #2471h (New Title) Failed, Division Vote 170-185; House Journal  6, PG.278-279 "
124625,2010-01-06,"House Ought to Pass: Motion Adopted Division Vote 186-170; House Journal  6, PG.278-279 "
124625,2010-01-06,"House Reconsideration (Rep Kurk): Motion Failed Division Vote 117-240; House Journal  6, PG.279 "
124625,2010-03-10,"Senate Introduced and Referred to Commerce, Labor and Consumer Protection "
124625,2010-03-18,"Senate Hearing: === TIME CHANGE === March 23, 2010, Room 102, Legislative Office Building, 8:30 a.m.; Senate Calendar 12 "
124625,2010-04-15,"Senate Committee Report: Ought to Pass with Amendment 1426s, New Title, 4/21/10; Senate Calendar 16 "
124625,2010-04-21,"Senate Committee Amendment 1426s, New Title, Amendment Adopted, Voice Vote; Senate Journal 15, Pg.306 "
124625,2010-04-21,"Senate Ought to Pass with Amendment 1426s, New Title, Motion Adopted, Voice Vote; OT3rdg; Senate Journal 15, Pg.306 "
124625,2010-04-21,"Senate Passed by Third Reading Resolution; Senate Journal 15, Pg.324 "
124625,2010-05-05,"House House Non-Concurs with Senate Amendment & Requests C of C (Rep Butler): Motion Adopted Voice Vote; House Journal  38, PG.1884 "
124625,2010-05-05,"House Speaker Appoints: Reps Nord, Winters, Schlachman & Dowling; House Journal  38, PG.1884 "
124625,2010-05-19,"Senate Sen. Hassan Accedes to House Request for Committee of Conference, Motion Adopted, Voice Vote; Senate Journal 20, Pg.648 "
124625,2010-05-19,"Senate President Appoints: Senators Cilley, DeVries and Bragdon; Senate Journal 20, Pg.648 "
124625,2010-05-20,"House Committee of Conference Meeting: 5/21/2010 2:00 PM Legislative Office Building 303 "
124625,2010-05-27,"House Conferee Change: Rep Davis Replaces Rep Dowling; House Journal  46, PG.2247 "
124625,2010-05-27,"Senate Conference Committee Report; Not Signed Off "
124626,2009-01-08,"House Introduced and Referred to Local and Regulated Revenues; House Journal  12, PG.230 "
124626,2009-01-29,"House Public Hearing: 2/5/2009 1:45 PM Legislative Office Building 303 "
124626,2009-02-18,"House Subcommittee Work Session: 3/3/2009 9:30 Amendment Legislative Office Building 307 "
124626,2009-03-04,"House Executive Session: 3/17/2009 10:00 Amendment Legislative Office Building 303 "
124626,2009-03-17,"House Retained in Committee "
124626,2009-05-18,"House Retained Bill - Subcommittee Work Session: 5/26/2009 1:00 PM Legislative Office Building 303 "
124626,2009-10-16,"House Retained Bill - Executive Session: 11/18/2009 10:00 Amendment Legislative Office Building 303 "
124626,2009-11-20,"House Committee Report: Refer to Interim Study for Jan 6 Regular Calendar (vote 12-6); House Calendar 2, PG.97 "
124626,2010-01-06,"House Special Ordered to Next Session Date in Regular Calendar Order; House Journal  6, PG.310 "
124626,2010-01-13,"House Refer to Interim Study: Motion Adopted Voice Vote; House Journal  9, PG.415 "
124626,2010-03-17,"House Referred to Local and Regulated Revenues for Interim Study; House Journal  26, PG.1365 "
124626,2010-05-13,"House ==CANCELLED== Interim Study - Subcommittee Work Session: 5/20/2010 9:00 Amendment Legislative Office Building 303 "
124626,2010-05-26,"House Interim Study - Subcommittee Work Session: 6/3/2010 10:00 Amendment Legislative Office Building 303 "
124626,2010-06-03,"House Interim Study - Subcommittee Work Session: 6/15/2010 12:30 PM Legislative Office Building 303 "
124626,2010-06-15,"House Interim Study - Subcommittee Work Session: 6/23/2010 12:30 PM Legislative Office Building 303 "
124626,2010-09-22,"House Interim Study - Executive Session: 10/13/2010 10:30 Amendment Legislative Office Building 303 "
124627,2009-01-08,"House Introduced and Referred to Local and Regulated Revenues; House Journal  12, PG.230 "
124627,2009-02-04,"House Public Hearing: 2/11/2009 10:00 Amendment Legislative Office Building 303 "
124627,2009-02-18,"House Subcommittee Work Session: 3/3/2009 9:00 Amendment Legislative Office Building 307 "
124627,2009-03-04,"House Executive Session: 3/17/2009 10:00 Amendment Legislative Office Building 303 "
124627,2009-03-17,"House Retained in Committee "
124627,2009-05-19,"House Retained Bill - Subcommittee Work Session: 5/26/2009 2:00 PM Legislative Office Building 303 "
124627,2009-08-20,"House Retained Bill - Subcommittee Work Session: 9/8/2009 10:00 Amendment Legislative Office Building 307 "
124627,2009-09-09,"House Retained Bill - Subcommittee Work Session: 9/24/2009 10:00 Amendment Legislative Office Building 307 "
124627,2009-10-15,"House Retained Bill - Subcommittee Work Session: 11/12/2009 10:00 Amendment Legislative Office Building 303 "
124627,2009-10-16,"House Retained Bill - Subcommittee Work Session: 11/16/2009 10:00 Amendment Legislative Office Building 303 "
124627,2009-10-17,"House Retained Bill - Executive Session: 11/18/2009 10:00 Amendment Legislative Office Building 303 "
124627,2009-11-20,"House Committee Report: Refer to Interim Study for Jan 6 Regular Calendar (vote 10-8); House Calendar 2, PG.97 "
124627,2010-01-06,"House Special Ordered to Next Session Date in Regular Calendar Order; House Journal  6, PG.310 "
124627,2010-01-13,"House Refer to Interim Study: Motion Adopted Voice Vote; House Journal  9, PG.415 "
124627,2010-03-17,"House Referred to Local and Regulated Revenues for Interim Study; House Journal  26, PG.1365 "
124627,2010-09-24,"House ==CANCELLED== Interim Study - Subcommittee Work Session: 10/7/2010 10:00 Amendment Legislative Office Building 303 "
124627,2010-09-27,"House ==RESCHEDULED== Work Session: 10/6/2010 10:00 Amendment Legislative Office Building 303 "
124627,2010-09-27,"House Interim Study - Executive Session: 10/13/2010 10:30 Amendment Legislative Office Building 303 "
124628,2009-01-08,"House Introduced and Referred to Resources, Recreation and Development; House Journal  12, PG.230  "
124628,2009-01-28,"House Public Hearing: 2/5/2009 2:00 PM Legislative Office Building 305 "
124628,2009-02-06,"House Subcommittee Work Session: 2/11/2009 9:00 Amendment Legislative Office Building 305 "
124628,2009-02-06,"House ==CANCELLED== Executive Session: 2/11/2009 10:00 Amendment Legislative Office Building 305 "
124628,2009-02-11,"House Executive Session: 2/17/2009 10:00 Amendment Legislative Office Building 305 "
124628,2009-02-18,"House Committee Report: Ought to Pass with Amendment #0314h (NT) for Mar 4 Consent Calendar (vote 16-0); House Calendar 16, PG.370 "
124628,2009-02-18,"House Proposed Amendment #0314h (New Title); House Calendar 15, PG.333-334 "
124628,2009-03-04,"House Amendment #0314h (New Title) Adopted, Voice Vote; House Journal  21, PG.592 "
124628,2009-03-04,"House Ought to Pass with Amendment #0314h (New Title): Motion Adopted Voice Vote; House Journal  21, PG.592 "
124628,2009-03-04,"House Referred to Ways and Means; House Journal  21, PG.592 "
124628,2009-03-11,"House Full Committee Work Session: 3/20/2009 9:30 Amendment Legislative Office Building 202 "
124628,2009-03-18,"House Full Committee Work Session: 3/23/2009 10:00 Amendment Legislative Office Building 202 "
124628,2009-03-25,"House Executive Session: 3/31/2009 9:30 Amendment Legislative Office Building 202 "
124628,2009-04-01,"House Retained in Committee "
124628,2009-09-02,"House Retained Bill - Subcommittee Work Session 9/9/2009 10:30 Amendment Legislative Office Building 202 "
124628,2009-09-15,"House Retained Bill - Subcommittee Work Session 9/22/2009 9:30 Amendment Legislative Office Building 202 ==TIME CHANGE (Orig 11:00 Amendment)== "
124628,2009-09-24,"House Retained Bill - Subcommittee Work Session 10/6/2009 11:00 Amendment Legislative Office Building 204 =DATE CHANGE (Orig 10/7/09)= "
124628,2009-10-07,"House Retained Bill - Subcommittee Work Session 10/20/2009 11:00 Amendment Legislative Office Building 203 =ROOM CHANGE (Orig Legislative Office Building 202)= "
124628,2009-10-22,"House Retained Bill - Subcommittee Work Session 11/3/2009 10:30 Amendment Legislative Office Building 202 "
124628,2009-11-01,"House Retained Bill - Subcommittee Work Session 11/9/2009 1:00 PM Legislative Office Building 202 "
124628,2009-11-02,"House Retained Bill - Executive Session: 11/18/2009 10:00 Amendment Legislative Office Building 202 ==TIME CHANGE (Orig 9:00 Amendment)== "
124628,2009-11-19,"House Committee Report: Inexpedient to Legislate for Jan 6 Consent Calendar (vote 19-0); House Calendar 2, PG.86-87 "
124628,2010-01-06,"House Inexpedient to Legislate: Motion Adopted Voice Vote; House Journal  6, PG.268 "
124629,2009-01-08,"House Introduced and Referred to Health, Human Services and Elderly Affairs; House Journal  12, PG.230  "
124629,2009-01-27,"House Public Hearing: 2/3/2009 11:00 Amendment Legislative Office Building 205 "
124629,2009-02-03,"House Subcommittee Work Session: 2/4/2009 3:30 PM Legislative Office Building 205 "
124629,2009-02-10,"House Subcommittee Work Session: 2/12/2009 4:00 PM Legislative Office Building 205 "
124629,2009-02-11,"House Executive Session: 2/17/2009 10:00 Amendment Legislative Office Building 205 "
124629,2009-02-26,"House Retained in Committee "
124629,2009-04-01,"House ==TIME CHANGE== Retained Bill - Subcommittee Work Session: 4/14/2009 1:45 PM Legislative Office Building 205 (Orig 1:00 PM) "
124629,2009-04-21,"House Retained Bill - Subcommittee Work Session: 5/12/2009 2:00 PM Legislative Office Building 205 "
124629,2009-07-27,"House Retained Bill - Subcommittee Work Session: 9/16/2009 1:00 PM Legislative Office Building 205 "
124629,2009-10-13,"House Retained Bill - Executive Session: 11/10/2009 1:00 PM Legislative Office Building 205 "
124629,2009-11-12,"House Committee Report: Inexpedient to Legislate for Jan 6 Consent Calendar (vote 15-0); House Calendar 2, PG.82 "
124629,2010-01-06,"House Inexpedient to Legislate: Motion Adopted Voice Vote; House Journal  6, PG.262 "
124630,2009-01-08,"House Introduced and Referred to Commerce and Consumer Affairs; House Journal  12, PG.230 "
124630,2009-02-10,"House Public Hearing: 3/3/2009 10:30 Amendment Legislative Office Building 302 "
124630,2009-03-06,"House Subcommittee Work Session: 3/9/2009 9:15 Amendment Legislative Office Building 304 "
124630,2009-03-06,"House Executive Session: 3/12/2009 11:00 Amendment Legislative Office Building 302 "
124630,2009-03-12,"House Retained in Committee "
124630,2009-08-26,"House Retained Bill - Subcommittee Work Session: 9/16/2009 10:00 Amendment Legislative Office Building 302 "
124630,2009-09-16,"House Retained Bill - Subcommittee Work Session: 9/23/2009 10:00 Amendment Legislative Office Building 302 "
124630,2009-10-01,"House Retained Bill - Executive Session: 10/28/2009 Legislative Office Building 302 1:00 PM or Immediately Following Session "
124630,2009-10-01,"House =CANCELLED= Retained Bill - Continued Executive Session If Neeeded: 11/3/2009 10:00 Amendment Legislative Office Building 302 "
124630,2009-11-03,"House Committee Report: Inexpedient to Legislate for Jan 6 Consent Calendar (vote 17-0); House Calendar 2, PG.79 "
124630,2010-01-06,"House Inexpedient to Legislate: Motion Adopted Voice Vote; House Journal  6, PG.250-251 "
124631,2009-01-08,"House Introduced and Referred to Commerce and Consumer Affairs; House Journal  12, PG.231  "
124631,2009-01-27,"House Public Hearing: 2/3/2009 1:45 PM Legislative Office Building 302 "
124631,2009-01-29,"House Executive Session: 2/11/2009 10:00 Amendment Legislative Office Building 302 ==RECESSED== "
124631,2009-02-11,"House ==CONTINUED== Executive Session: 2/17/2009 10:00 Amendment Legislative Office Building 302 "
124631,2009-02-26,"House Retained in Committee "
124631,2009-09-22,"House Retained Bill - Subcommittee Work Session: 10/14/2009 11:00 Amendment Legislative Office Building 302 "
124631,2009-10-01,"House Retained Bill - Executive Session: 10/28/2009 Legislative Office Building 302 1:00 PM or Immediately Following Session "
124631,2009-10-01,"House =CANCELLED= Retained Bill - Continued Executive Session If Neeeded: 11/3/2009 10:00 Amendment Legislative Office Building 302 "
124631,2009-11-03,"House Committee Report: Ought to Pass with Amendment #2410h for Jan 6 Regular Calendar (vote 16-2); House Calendar 2, PG.89 "
124631,2009-11-03,"House Proposed Committee Amendment #2410h; House Calendar 1, PG.22 "
124631,2010-01-06,"House Amendment #2410h Adopted, Voice Vote; House Journal  6, PG.280 "
124631,2010-01-06,"House Ought to Pass with Amendment #2410h: Motion Adopted Division Vote 208-146; House Journal  6, PG.280 "
124631,2010-01-06,"House Referred to Ways and Means; House Journal  6, PG.280 "
124631,2010-01-12,"House Public Hearing: 1/20/2010 10:30 Amendment Legislative Office Building 202 ==RECESSED== "
124631,2010-01-20,"House Continued Public Hearing: 1/28/2010 9:30 Amendment Legislative Office Building 202 "
124631,2010-02-02,"House ==CANCELLED== Subcommittee Work Session: 2/11/2010 1:00 PM Legislative Office Building 202 "
124631,2010-02-17,"House Subcommittee Work Session: 3/2/2010 2:30 PM Legislative Office Building 202 "
124631,2010-03-10,"House Executive Session: 3/16/2010 10:00 Amendment Legislative Office Building 202 (Continued 3/17/10 9:00 Amendment Legislative Office Building 202 If Necessary) "
124631,2010-03-17,"House Majority Committee Report: Ought to Pass with Amendment #0915h for Mar 24 (Vote 10-9; Regular Calendar); House Calendar 22, PG.1226 "
124631,2010-03-17,"House Proposed Majority Committee Amendment #0915h; House Calendar 22, PG.1237 "
124631,2010-03-17,"House Minority Committee Report: Inexpedient to Legislate; House Calendar 22, PG.1226 "
124631,2010-03-24,"House Amendment #0915h Adopted, Voice Vote; House Journal  30, PG.1483-1484 "
124631,2010-03-24,"House Ought to Pass with Amendment #0915h: Motion Adopted Voice Vote; House Journal  30, PG.1483-1484 "
124631,2010-03-24,"Senate Introduced and Referred to Ways & Means; Senate Journal 11, Pg.259 "
124631,2010-04-01,"Senate Hearing: April 6, 2010, Room 100, State House, 10:45 a.m.; Senate Calendar 14 "
124631,2010-04-07,"Senate Committee Report: Ought to Pass 4/14/10; Senate Calendar 15 "
124631,2010-04-14,"Senate Ought to Pass, Motion Adopted, Voice Vote; OT3rdg; Senate Journal 14, Pg.291 "
124631,2010-04-14,"Senate Passed by Third Reading Resolution; Senate Journal 14, Pg.295 "
124631,2010-04-21,"Senate Enrolled "
124631,2010-04-28,"House Enrolled; House Journal  36, PG.1729 "
124631,2010-05-10,"House Signed By the Governor 05/07/2010; Effective 07/01/2010; Chapter 0013 "
124632,2009-01-08,"House Introduced and Referred to Education; House Journal  12, PG.231 "
124632,2009-01-27,"House Public Hearing: 2/10/2009 11:00 Amendment Legislative Office Building 207 "
124632,2009-02-19,"House Executive Session: 3/5/2009 10:00 Amendment Legislative Office Building 207 "
124632,2009-03-05,"House Committee Report: Ought to Pass with Amendment #0632h for Mar 24 Consent Calendar (vote 19-0); House Calendar 22, PG.654 "
124632,2009-03-05,"House Proposed Committee Amendment #0632h; House Calendar 22, PG.736 "
124632,2009-03-24,"House Amendment #0632h Adopted, Voice Vote; House Journal  25, PG.845 "
124632,2009-03-24,"House Ought to Pass with Amendment #0632h: Motion Adopted Voice Vote; House Journal  25, PG.845 "
124632,2009-04-08,"Senate Introduced and Referred to Education; Senate Journal 11, Pg.235 "
124632,2009-04-21,"Senate Hearing; April 28, 2009, Room 103, Legislative Office Building, 11:05 a.m.; Senate Calendar 21 "
124632,2009-05-19,"Senate Committee Report; Rereferred to Committee [05/27/09]; Senate Calendar 25 "
124632,2009-05-27,"Senate Rereferred to Committee, Motion Adopted, Voice Vote; Senate Journal 17, Pg.368 "
124632,2010-01-07,"Senate Committee Report, Inexpedient to Legislate; 1/13/10; Senate Calendar 2 "
124632,2010-01-13,"Senate Inexpedient to Legislate, Motion Adopted, Voice Vote === BILL KILLED === Senate Journal 2, Pg.20 "
124633,2009-01-08,"House Introduced and Referred to Executive Departments and Administration; House Journal  12, PG.231 "
124633,2009-02-04,"House Public Hearing: 2/19/2009 1:45 PM Legislative Office Building 306 "
124633,2009-02-18,"House Executive Session: 3/3/2009 2:00 PM Legislative Office Building 306 "
124633,2009-03-06,"House Retained in Committee "
124633,2009-05-13,"House Retained Bill - Subcommittee Work Session: 5/26/2009 1:00 PM Legislative Office Building 306 "
124633,2009-10-30,"House Retained Bill - Executive Session: 11/19/2009 10:00 Amendment Legislative Office Building 306 "
124633,2009-11-20,"House Committee Report: Ought to Pass with Amendment #2518h for Jan 6 Consent Calendar (vote 18-0); House Calendar 2, PG.82 "
124633,2009-11-20,"House Proposed Committee Amendment #2518h; House Calendar 1, PG.22-23 "
124633,2010-01-06,"House Amendment #2518h Adopted, Voice Vote; House Journal  6, PG.261 "
124633,2010-01-06,"House Ought to Pass with Amendment #2518h: Motion Adopted Voice Vote; House Journal  6, PG.261 "
124633,2010-03-24,"Senate Introduced and Referred to Executive Departments and Administration; Senate Journal 11, Pg.259 "
124633,2010-04-08,"Senate Hearing: April 13, 2010, Room 101, Legislative Office Building, 2:00 p.m.; Senate Calendar 15 "
124633,2010-04-15,"Senate Committee Report: Ought to Pass 4/21/10; Senate Calendar 16 "
124633,2010-04-21,"Senate Without Objection, Chair moved to Special Order to 04/28/10; Senate Journal 15, Pg.303 "
124633,2010-04-21,"Senate Committee Report: Ought to Pass 4/21/10 "
124633,2010-04-28,"Senate Ought to Pass, Motion Adopted, Voice Vote; OT3rdg "
124633,2010-04-28,"Senate Passed by Third Reading Resolution "
124633,2010-05-12,"House Enrolled; House Journal  41, PG.2097 "
124633,2010-05-12,"Senate Enrolled "
124633,2010-06-15,"House Signed by the Governor 06/09/2010; Effective 08/08/2010; Chapter 0122 "
124634,2009-01-08,"House Introduced and Referred to Executive Departments and Administration; House Journal  12, PG.231 "
124634,2009-01-29,"House Public Hearing: 2/5/2009 2:00 PM Legislative Office Building 306 "
124634,2009-02-18,"House Executive Session: 3/3/2009 2:00 PM Legislative Office Building 306 "
124634,2009-03-04,"House Committee Report: Ought to Pass with Amendment #0512h for Mar 11 Consent Calendar (vote 18-0); House Calendar 19, PG.501 "
124634,2009-03-04,"House Proposed Amendment #0512h; House Calendar 19, PG.537-539 "
124634,2009-03-11,"House Amendment #0512h Adopted, Voice Vote; House Journal  24, PG.789-791 "
124634,2009-03-11,"House Ought to Pass with Amendment #0512h: Motion Adopted Voice Vote; House Journal  24, PG.789-791 "
124634,2009-03-18,"Senate Introduced and Referred to Executive Departments and Administration; Senate Journal 8, pg. 134 "
124634,2009-05-14,"Senate Hearing; May 19, 2009, Room 101, Legislative Office Building, 3:40 p.m.; Senate Calendar 24 "
124634,2009-05-27,"Senate Committee Report; Rereferred to Committee 06/03/09; Senate Calendar 26 "
124634,2009-06-03,"Senate Rereferred to Committee, Motion Adopted, Voice Vote; Senate Journal 18, Pg.531 "
124634,2010-01-13,"Senate Committee Report; Referred to Interim Study 1/21/10; Senate Calendar 3 "
124634,2010-01-21,"Senate Referred to Interim Study, Motion Adopted, Voice Vote; Senate Journal 3, Pg.39 "
124635,2009-01-08,"House Introduced and Referred to Criminal Justice and Public Safety; House Journal  12, PG.231 "
124635,2009-01-28,"House Public Hearing: 2/5/2009 1:30 PM Legislative Office Building 204 "
124635,2009-02-10,"House ==CANCELLED== Executive Session: 2/17/2009 10:00 Amendment Legislative Office Building 204 "
124635,2009-03-04,"House Subcommittee Work Session: 3/12/2009 9:00 Amendment Legislative Office Building 204 "
124635,2009-03-04,"House Executive Session: 3/12/2009 10:00 Amendment Legislative Office Building 204 "
124635,2009-03-13,"House Retained in Committee "
124635,2009-08-06,"House Retained Bill - Subcommittee Work Session: 9/1/2009 10:00 Amendment Legislative Office Building 204 "
124635,2009-09-02,"House Retained Bill - Subcommittee Work Session: 9/15/2009 10:00 Amendment Legislative Office Building 204 "
124635,2009-09-15,"House Retained Bill - Subcommittee Work Session: 10/20/2009 10:00 Amendment Legislative Office Building 204 "
124635,2009-09-24,"House Retained Bill - Executive Session: 11/5/2009 10:00 Amendment Legislative Office Building 204 "
124635,2009-11-09,"House Committee Report: Ought to Pass with Amendment #2444h for Jan 6 Regular Calendar (vote 15-0); House Calendar 2, PG.92 "
124635,2009-11-09,"House Proposed Committee Amendment #2444h; House Calendar 1, PG.23 "
124635,2010-01-06,"House Special Ordered to Next Session Date in Regular Calendar Order; House Journal  6, PG.310 "
124635,2010-01-13,"House Amendment #2444h Adopted, Voice Vote; House Journal  9, PG.373 "
124635,2010-01-13,"House Floor Amendment #2010-0085h (Rep Kurk) Failed, Division Vote 89-262; House Journal  9, PG.373-374 "
124635,2010-01-13,"House Ought to Pass with Amendment #2444h: Motion Adopted Voice Vote; House Journal  9, PG.373-374 "
124635,2010-01-13,"House Referred to Finance; House Journal  9, PG.374 "
124635,2010-01-14,"House Full Committee Work Session: 1/27/2010 10:02 Amendment Legislative Office Building 210-211 "
124635,2010-01-27,"House Full Committee Work Session: 2/2/2010 10:01 Amendment Legislative Office Building 210-211 "
124635,2010-01-28,"House Executive Session: 2/4/2010 10:00 Amendment Legislative Office Building 210-211 "
124635,2010-02-04,"House Committee Report: Ought to Pass with Amendment #0445h for Feb 10 Consent Calendar (vote 22-1); House Calendar 13, PG.527 "
124635,2010-02-04,"House Proposed Committee Amendment #0445h; House Calendar 13, PG.555 "
124635,2010-02-10,"House Removed from Consent Calendar (Rep Vaillancourt); House Journal  16, PG.748 "
124635,2010-02-10,"House Special Ordered to Regular Place in Feb 17 Consent Calendar: Motion Adopted Without Objection; House Journal  16, PG.783 "
124635,2010-02-17,"House Amendment #0445h Adopted, Voice Vote; House Journal  18, PG.955 "
124635,2010-02-17,"House Ought to Pass with Amendment #0445h: Motion Adopted Voice Vote; House Journal  18, PG.955 "
124635,2010-03-03,"Senate Introduced and Referred to Judiciary "
124635,2010-03-26,"Senate Hearing: April 6, 2010, Room 103, State House, 2:00 p.m.; Senate Calendar 13 "
124635,2010-04-14,"Senate Committee Report: Ought to Pass 4/21/10; Senate Calendar 16 "
124635,2010-04-21,"Senate Ought to Pass, Motion Adopted, Voice Vote; Refer to Finance Rule 26; Senate Journal 15, Pg.319 "
124635,2010-05-06,"Senate Committee Report: Ought to Pass with Amendment 1941s, New Title, 5/12/10; Senate Calendar 19 "
124635,2010-05-12,"Senate Committee Amendment 1941s, New Title, Amendment Adopted, Voice Vote "
124635,2010-05-12,"Senate Ought to Pass with Amendment 1941s, New Title, Motion Adopted, Voice Vote; OT3rdg "
124635,2010-05-12,"Senate Passed by Third Reading Resolution "
124635,2010-05-19,"House House Concurs with Senate Amendment #1941s(NT) (Reps Shurtleff & M.Smith): Motion Adopted Voice Vote; House Journal  46, PG.2225 "
124635,2010-06-02,"Senate Enrolled "
124635,2010-06-02,"House Enrolled "
124635,2010-06-28,"House Signed by the Governor 06/25/2010; Chapter 0208 "
124635,2010-06-28,"House I. Section 4 Effective 07/01/2011 "
124635,2010-06-28,"House II. Section 8 Effective 12/31/2014 "
124636,2009-01-08,"House Introduced and Referred to Municipal and County Government; House Journal  12, PG.232  "
124636,2009-02-04,"House Public Hearing: 2/11/2009 10:00 Amendment Legislative Office Building 301 "
124636,2009-02-04,"House Executive Session: 2/17/2009 11:00 Amendment Legislative Office Building 301 (Continued if Needed 2/19/09 1:00 PM Legislative Office Building 301) "
124636,2009-02-26,"House Retained in Committee "
124636,2009-04-01,"House ==CANCELLED==Retained Bill - Subcommittee Work Session: 4/7/2009 1:00 PM Legislative Office Building 301 "
124636,2009-04-07,"House Retained Bill - Subcommittee Work Session: 4/14/2009 1:00 PM Legislative Office Building 301 "
124636,2009-04-28,"House Retained Bill - Subcommittee Work Session: 5/5/2009 1:30 PM Legislative Office Building 301 "
124636,2009-09-02,"House Retained Bill - Subcommittee Work Session: 9/15/2009 1:00 PM Legislative Office Building 301 "
124636,2009-09-27,"House Retained Bill - Subcommittee Work Session: 10/27/2009 2:00 PM Legislative Office Building 301 "
124636,2009-09-28,"House Retained Bill - Executive Session: 10/28/2009 Legislative Office Building 301 1:00 PM or Immediately Following Session "
124636,2009-11-02,"House Committee Report: Inexpedient to Legislate for Jan 6 Consent Calendar (vote 16-0); House Calendar 2, PG.85 "
124636,2010-01-06,"House Inexpedient to Legislate: Motion Adopted Voice Vote; House Journal  6, PG.266 "
124637,2009-01-08,"House Introduced and Referred to Ways and Means; House Journal  12, PG.232 "
124637,2009-01-27,"House Public Hearing: 2/10/2009 1:00 PM Legislative Office Building 202 "
124637,2009-03-04,"House Subcommittee Work Session: 3/6/2009 11:45 Amendment Legislative Office Building 202 "
124637,2009-03-11,"House Subcommittee Work Session: 3/16/2009 10:00 Amendment Legislative Office Building 201 "
124637,2009-03-16,"House Full Committee Work Session: 3/17/2009 1:30 PM Legislative Office Building 202 "
124637,2009-03-16,"House Executive Session: 3/18/2009 9:00 Amendment Legislative Office Building 202 (Continued 3/19/09 9:00 Amendment Legislative Office Building 202 If Needed) "
124637,2009-03-18,"House Full committee work session on amendments 3/18/09 8:58 Amendment Room202,Legislative Office Building "
124637,2009-03-19,"House Retained in Committee "
124637,2009-04-15,"House Retained Bill - Subcommittee Work Session: 4/21/2009 2:00 PM Legislative Office Building 202 "
124637,2009-10-07,"House Retained Bill - Executive Session: 10/28/2009 Legislative Office Building 202 1:30 PM or Immediately Following Session "
124637,2009-11-05,"House Committee Report: Inexpedient to Legislate for Jan 6 Consent Calendar (vote 17-0); House Calendar 2, PG.87 "
124637,2010-01-06,"House Inexpedient to Legislate: Motion Adopted Voice Vote; House Journal  6, PG.268 "
124638,2009-01-08,"House Introduced and Referred to Transportation; House Journal  12, PG.232  "
124638,2009-02-03,"House Public Hearing: 2/11/2009 10:00 Amendment Legislative Office Building 203 "
124638,2009-02-03,"House ==CANCELLED== Executive Session: 2/11/2009 11:00 Amendment Legislative Office Building 203 "
124638,2009-02-11,"House Executive Session: 2/17/2009 10:00 Amendment Legislative Office Building 203 "
124638,2009-02-17,"House Committee Report: Ought to Pass for Mar 4 Consent Calendar (vote 14-1); House Calendar 16, PG.372 "
124638,2009-03-04,"House Ought to Pass: Motion Adopted Voice Vote; House Journal  21, PG.598 "
124638,2009-03-04,"House Referred to Ways and Means; House Journal  21, PG.598 "
124638,2009-03-18,"House Full Committee Work Session: 3/27/2009 10:00 Amendment Legislative Office Building 202 "
124638,2009-03-25,"House Executive Session: 3/31/2009 9:30 Amendment Legislative Office Building 202 "
124638,2009-04-01,"House Retained in Committee "
124638,2009-07-21,"House Retained Bill - Subcommittee Work Session: 8/5/2009 10:00 Amendment Legislative Office Building 202 "
124638,2009-09-09,"House Retained Bill - Subcommittee Work Session: 9/23/2009 9:00 Amendment Legislative Office Building 202 "
124638,2009-10-07,"House Retained Bill - Executive Session: 10/28/2009 Legislative Office Building 202 1:30 PM or Immediately Following Session "
124638,2009-11-05,"House Committee Report: Ought to Pass with Amendment #2391h (New Title) for Jan 6 Consent Calendar (vote 19-0); House Calendar 2, PG.87 "
124638,2009-11-05,"House Proposed Committee Amendment #2391h (New Title); House Calendar 1, PG.24 "
124638,2010-01-06,"House Amendment #2391h (New Title) Adopted, Voice Vote; House Journal  6, PG.269 "
124638,2010-01-06,"House Ought to Pass with Amendment #2391h (New Title): Motion Adopted Voice Vote; House Journal  6, PG.268-269 "
124638,2010-03-03,"Senate Introduced and Referred to Transportation & Interstate Cooperation "
124638,2010-03-18,"Senate Hearing: April 1, 2010, Room 101, Legislative Office Building, 10:30 a.m.; Senate Calendar 12 "
124638,2010-03-23,"Senate Hearing: === TIME CHANGE === April 1, 2010, Room 101, Legislative Office Building, 10:55 a.m.; Senate Calendar 13 "
124638,2010-04-01,"Senate Committee Report: Ought to Pass 4/7/10; Senate Calendar 14 "
124638,2010-04-07,"Senate Ought to Pass, Motion Adopted, Voice Vote; OT3rdg; Senate Journal 13, Pg.277 "
124638,2010-04-07,"Senate Passed by Third Reading Resolution; Senate Journal 13, Pg.282 "
124638,2010-04-14,"Senate Enrolled; Senate Journal 14, Pg.301 "
124638,2010-04-14,"House Enrolled; House Journal  32, PG.1587 "
124638,2010-05-10,"House Signed By the Governor 05/07/2010; Chapter 0014 "
124638,2010-05-10,"House I. Section 4-6 Effective 01/01/2013 "
124638,2010-05-10,"House II. Remainder Effective 09/04/2010 "
124639,2009-01-08,"House Introduced and Referred to Resources, Recreation and Development; House Journal  12, PG.233  "
124639,2009-02-04,"House Public Hearing: 2/12/2009 2:30 PM Legislative Office Building 305 "
124639,2009-02-11,"House Executive Session: 2/17/2009 10:00 Amendment Legislative Office Building 305 "
124639,2009-02-26,"House Retained in Committee "
124639,2009-09-14,"House Retained Bill - Full Committee Work Session: 9/22/2009 1:00 PM Legislative Office Building 305 "
124639,2009-09-14,"House Retained Bill - Full Committee Work Session: 9/30/2009 10:00 Amendment Legislative Office Building 305 "
124639,2009-09-30,"House Retained Bill - Subcommittee Work Session: 10/6/2009 9:00 Amendment Legislative Office Building 305 "
124639,2009-09-30,"House ==CANCELLED== Retained Bill - Subcommittee Work Session: 10/16/2009 10:30 Amendment Legislative Office Building 305 "
124639,2009-09-30,"House Retained Bill - Subcommittee Work Session: 10/13/2009 11:30 Amendment Legislative Office Building 305 "
124639,2009-10-08,"House Retained Bill - Subcommittee Work Session: 10/20/2009 11:00 Amendment Legislative Office Building 303 =ROOM CHANGE (Orig Legislative Office Building 305)= "
124639,2009-10-08,"House Retained Bill - Subcommittee Work Session: 10/26/2009 1:30 PM Legislative Office Building 305 "
124639,2009-10-26,"House Retained Bill - Subcommittee Work Session: 11/4/2009 1:00 PM Legislative Office Building 305 "
124639,2009-11-02,"House Retained Bill - Executive Session: 11/24/2009 9:30 Amendment Legislative Office Building 305 "
124639,2009-11-25,"House Majority Committee Rept: Ought to Pass with Amendment #2010-0011h (NT) for Jan 6 Regular Calendar (vote 11-7); House Calendar2, PG.98 "
124639,2009-11-25,"House Proposed Majority Committee Amendment #2010-0011h (New Title); House Calendar 1, PG.24-26 "
124639,2009-11-25,"House Minority Committee Report: Inexpedient to Legislate; House Calendar 2, PG.98 "
124639,2010-01-06,"House Special Ordered to Next Session Date in Regular Calendar Order; House Journal  6, PG.310 "
124639,2010-01-13,"House Amendment #2010-0011h (New Title) Adopted, Division Vote 144-127; House Journal  9, PG.421-423 "
124639,2010-01-13,"House Floor Amendment #2010-0139h (New Title) (Rep Bolster); House Journal  9, PG.423-425 "
124639,2010-01-13,"House Divide Floor Amendment #2010-0139h (NT) (Rep Spaulding); House Journal  9, PG.426 "
124639,2010-01-13,"House Floor Amendment #2010-0139h (New Title) (Rep Bolster) Failed, Regular Calendar 93-236; House Journal  9, PG.423-428 "
124639,2010-01-13,"House Lay on the Table (Rep Renzullo): Motion Failed Regular Calendar 154-173; House Journal  9, PG.428-430 "
124639,2010-01-13,"House Ought to Pass with Amendment #2010-0011h (New Title): Motion Failed Division Vote 157-171; House Journal  9, PG.421-430 "
124639,2010-01-13,"House Inexpedient to Legislate (Rep Chandler); House Journal  9, PG.430 "
124639,2010-01-13,"House Recommit (Rep Spang): Motion Adopted Regular Calendar 172-158; House Journal  9, PG.430-432 "
124639,2010-01-20,"House Subcommittee Work Session: 1/27/2010 10:00 Amendment Legislative Office Building 305 "
124639,2010-01-20,"House Executive Session: 1/28/2010 10:00 Amendment Legislative Office Building 305 (Continued 2/2/2010 10:00 Amendment Legislative Office Building 305 If Necessary) "
124639,2010-02-03,"House Committee Report: Ought to Pass with Amendment #0417h (New Title) for Feb 10 Regular Calendar (vote 14-4); House Calendar 13, PG.540 "
124639,2010-02-03,"House Proposed Committee Amendment #0417h (New Title); House Calendar 13, PG.555-557 "
124639,2010-02-10,"House Amendment #0417h (New Title) Adopted, Division Vote 230-53; House Journal  16, PG.762-763 "
124639,2010-02-10,"House Recommit (Rep Baldasaro): Motion Failed Division Vote 127-225; House Journal  16, PG.763 "
124639,2010-02-10,"House Ought to Pass with Amendment #0417h (New Title): Motion Adopted 213-141; House Journal  16, PG.761-765 "
124639,2010-02-10,"House Referred to Ways and Means; House Journal  16, PG.765 "
124639,2010-02-17,"House Full Committee Work Session: 3/2/2010 1:00 PM Legislative Office Building 202 "
124639,2010-03-10,"House Executive Session: 3/16/2010 10:00 Amendment Legislative Office Building 202 (Continued 3/17/10 9:00 Amendment Legislative Office Building 202 If Necessary) "
124639,2010-03-18,"House Committee Report: Ought to Pass for March 24 (Vote 10-6;Regular Calendar); House Calendar 22, PG.1226-1227 "
124639,2010-03-24,"House Floor Amendment #0878h (Rep Swinford) Adopted, Division Vote 293-42; House Journal  30, PG.1484 "
124639,2010-03-24,"House Ought to Pass with Amendment #0878h: Motion Adopted Division Vote 233-106; House Journal  30, PG.1484 "
124639,2010-03-24,"Senate Introduced and Referred to Ways & Means; Senate Journal 11, Pg.260 "
124639,2010-04-01,"Senate Hearing: April 6, 2010, Room 100, State House, 10:15 a.m.; Senate Calendar 14 "
124639,2010-04-07,"Senate Committee Report: Inexpedient to Legislate 4/14/10; Senate Calendar 15 "
124640,2009-01-08,"House Introduced and Referred to Education; House Journal  12, PG.233 "
124640,2009-01-27,"House Public Hearing: 2/11/2009 10:30 Amendment Legislative Office Building 207 "
124640,2009-02-19,"House Executive Session: 3/5/2009 10:00 Amendment Legislative Office Building 207 "
124640,2009-03-06,"House Retained in Committee "
124640,2009-04-14,"House Retained Bill - Subcommittee Work Session: 4/22/2009 10:00 Amendment Legislative Office Building 207 "
124640,2009-04-29,"House Retained Bill - Subcommittee Work Session: 5/5/2009 8:30 Amendment Legislative Office Building 207 "
124640,2009-10-21,"House ==CANCELLED== Retained Bill - Executive Session: 12/1/2009 10:00 Amendment Legislative Office Building 207 "
124640,2009-10-30,"House Retained Bill - Executive Session: 11/19/2009 10:00 Amendment Legislative Office Building 207 "
124640,2009-11-30,"House Committee Report: Inexpedient to Legislate for Jan 6 Consent Calendar (vote 15-1); House Calendar 2, PG.80 "
124640,2010-01-06,"House Inexpedient to Legislate: Motion Adopted Voice Vote; House Journal  6, PG.253 "
124641,2009-01-08,"House Introduced and Referred to Commerce and Consumer Affairs; House Journal  12, PG.233 "
124641,2009-02-10,"House Public Hearing: 3/3/2009 11:00 Amendment Legislative Office Building 302 "
124641,2009-02-10,"House ==CANCELLED== Executive Session: 3/12/2009 11:00 Amendment Legislative Office Building 302 "
124641,2009-03-09,"House Subcommittee Work Session: 3/18/2009 9:00 Amendment Legislative Office Building 302 "
124641,2009-03-09,"House Executive Session: 3/18/2009 11:00 Amendment Legislative Office Building 302 "
124641,2009-03-18,"House Retained in Committee "
124641,2009-09-29,"House Retained Bill - Subcommittee Work Session: 10/6/2009 1:00 PM Legislative Office Building 302 "
124641,2009-09-30,"House Retained Bill - Subcommittee Work Session: 10/15/2009 11:00 Amendment Legislative Office Building 302 "
124641,2009-10-01,"House Retained Bill - Subcommittee Work Session: 10/27/2009 1:00 PM Legislative Office Building 302 "
124641,2009-10-02,"House ==CANCELLED== Retained Bill - Executive Session: 10/28/2009 Legislative Office Building 302 1:00 PM "
124641,2009-10-02,"House =CANCELLED= Retained Bill - Continued Executive Session If Neeeded: 11/3/2009 10:00 Amendment Legislative Office Building 302 "
124641,2009-10-28,"House Retained Bill - Executive Session: 11/12/2009 10:15 Amendment Legislative Office Building 302 ==TIME CHANGE (Orig 10:00AM)== "
124641,2009-11-25,"House Majority Committee Report: Ought to Pass for Jan 6 Regular Calendar (vote 9-7); House Calendar 2, PG.89 "
124641,2009-11-25,"House Minority Committee Report: Inexpedient to Legislate; House Calendar 2, PG.89 "
124641,2010-01-06,"House Special Ordered to Beginning of Regular Calendar (Rep Butler): Motion Adopted Voice Vote; House Journal  6, PG.271 "
124641,2010-01-06,"House Ought to Pass: Motion Adopted Regular Calendar 209-157; House Journal  6, PG.271-273 "
124641,2010-03-03,"Senate Introduced and Referred to Commerce, Labor and Consumer Protection "
124641,2010-03-18,"Senate Hearing: === RESCHEDULED === March 30, 2010, Room 102, Legislative Office Building, 8:30 a.m.; Senate Calendar 12A "
124641,2010-03-26,"Senate Hearing: === ROOM CHANGE === March 30, 2010, Room 205-207, Legislative Office Building, 8:30 a.m.; Senate Calendar 13 "
124641,2010-04-15,"Senate Committee Report: Ought to Pass with Amendment 1427s, 4/21/10; Senate Calendar 16 "
124641,2010-04-21,"Senate Committee Amendment 1427s, Amendment Adopted, Voice Vote; Senate Journal 15, Pg.307 "
124641,2010-04-21,"Senate Sen. Hassan Floor Amendment 1480s, Amendment Adopted, Voice Vote; Senate Journal 15, Pg.308 "
124641,2010-04-21,"Senate Ought to Pass with Amendments 1427s, 1480s, Motion Adopted, Voice Vote; OT3rdg; Senate Journal 15, Pg.308 "
124641,2010-04-21,"Senate Passed by Third Reading Resolution; Senate Journal 15, Pg.324 "
124641,2010-05-19,"House House Concurs with Senate Amendment #1427s & #1480s (Rep Butler): Motion Adopted Division Vote 188-108; House Journal  46, PG.2224 "
124641,2010-06-02,"House Enrolled "
124641,2010-06-02,"Senate Enrolled; Senate Journal 21, Pg.776 "
124641,2010-07-28,"House Signed by the Governor 07/23/2010; Effective 01/01/2011; Chapter 0362 "
124642,2009-01-08,"House Introduced and Referred to Commerce and Consumer Affairs; House Journal  12, PG.233  "
124642,2009-01-27,"House Public Hearing: 2/5/2009 10:30 Amendment Legislative Office Building 302 "
124642,2009-01-29,"House Executive Session: 2/11/2009 10:00 Amendment Legislative Office Building 302 "
124642,2009-02-11,"House Committee Report: Ought to Pass with Amendment #0278h for Feb 18 Consent Calendar (vote 20-0); House Calendar 14, PG.263 "
124642,2009-02-11,"House Proposed Amendment #0278h; House Calendar 14, PG.303-304 "
124642,2009-02-18,"House Amendment #0278h Adopted, Voice Vote; House Journal  18, PG.445-446 "
124642,2009-02-18,"House Ought to Pass with Amendment #0278h: Motion Adopted Voice Vote; House Journal  18, PG.445-446 "
124642,2009-02-18,"House Referred to Public Works and Highways; House Journal  18, PG.446 "
124642,2009-03-03,"House Public Hearing: 3/12/2009 11:45 Amendment Legislative Office Building 201 "
124642,2009-03-03,"House Executive Session: 3/17/2009 10:15 Amendment Legislative Office Building 201 "
124642,2009-03-17,"House Retained in Committee "
124642,2009-07-01,"House Retained Bill - Subcommittee Work Session: 9/8/2009 10:00 Amendment Legislative Office Building 201 "
124642,2009-09-09,"House Retained Bill - Subcommittee Work Session: 9/16/2009 10:00 Amendment Legislative Office Building 201 "
124642,2009-10-05,"House Retained Bill - Executive Session: 10/28/2009 Legislative Office Building 201 1:00 PM or Immediately Following Session "
124642,2009-11-03,"House Committee Report: Ought to Pass with Amendment #2457h (New Title) for Jan 6 Consent Calendar (vote 19-0); House Calendar 2, PG.85 "
124642,2009-11-03,"House Proposed Committee Amendment #2457h (New Title); House Calendar 1, PG.26-27 "
124642,2010-01-06,"House Amendment #2457h (New Title) Adopted, Voice Vote; House Journal  6, PG.267 "
124642,2010-01-06,"House Ought to Pass with Amendment #2457h (New Title): Motion Adopted Voice Vote; House Journal  6, PG.267 "
124642,2010-03-10,"Senate Introduced and Referred to Public and Municipal Affairs "
124642,2010-03-18,"Senate Hearing: March 25, 2010, Room 103, Legislative Office Building, 8:30 a.m.; Senate Calendar 12 "
124642,2010-04-08,"Senate Committee Report: Referred to Interim Study 4/14/10; Senate Calendar 15 "
124642,2010-04-14,"Senate Refer to Interim Study, Motion Adopted, Voice Vote; Senate Journal 14, Pg.290 "
124643,2009-01-08,"House Introduced and Referred to Ways and Means; House Journal  12, PG.233 "
124643,2009-02-11,"House Public Hearing: 2/19/2009 10:00 Amendment Legislative Office Building 202 "
124643,2009-02-25,"House Subcommittee Work Session: 3/6/2009 10:15 Amendment Legislative Office Building 202 "
124643,2009-03-11,"House Subcommittee Work Session: 3/16/2009 9:30 Amendment Legislative Office Building 202 "
124643,2009-03-16,"House Full Committee Work Session: 3/17/2009 1:00 PM Legislative Office Building 202 "
124643,2009-03-16,"House Executive Session: 3/18/2009 9:00 Amendment Legislative Office Building 202 (Continued 3/19/09 9:00 Amendment Legislative Office Building 202 If Needed) "
124643,2009-03-19,"House Retained in Committee "
124643,2009-10-07,"House Retained Bill - Executive Session: 10/28/2009 Legislative Office Building 202 1:30 PM or Immediately Following Session "
124643,2009-11-05,"House Committee Report: Inexpedient to Legislate for Jan 6 Consent Calendar (vote 19-0); House Calendar 2, PG.87 "
124643,2010-01-06,"House Inexpedient to Legislate: Motion Adopted Voice Vote; House Journal  6, PG.269 "
124644,2009-01-08,"House Introduced and Referred to Commerce and Consumer Affairs; House Journal  12, PG.233 "
124644,2009-02-10,"House Public Hearing: 3/9/2009 11:30 Amendment Legislative Office Building 302 "
124644,2009-03-11,"House Subcommittee Work Session: 3/13/2009 11:00 Amendment Legislative Office Building 302 "
124644,2009-03-12,"House Executive Session: 3/17/2009 1:00 PM Legislative Office Building 302 (Continued 3/18/09 11:00 Amendment Legislative Office Building 302 If Needed) "
124644,2009-03-18,"House Retained in Committee "
124644,2009-03-31,"House Retained Bill - Subcommittee Work Session: 4/2/2009 9:00 Amendment Legislative Office Building 302 "
124644,2009-04-14,"House Retained Bill - Subcommittee Work Session: 4/16/2009 9:00 Amendment Legislative Office Building 302 "
124644,2009-08-26,"House Retained Bill - Subcommittee Work Session: 9/9/2009 10:00 Amendment Legislative Office Building 302 "
124644,2009-09-09,"House Retained Bill - Subcommittee Work Session: 10/7/2009 10:00 Amendment Legislative Office Building 302 "
124644,2009-09-30,"House Retained Bill - Subcommittee Work Session: 10/21/2009 10:00 Amendment Legislative Office Building 302 "
124644,2009-10-01,"House ==CANCELLED== Retained Bill - Executive Session: 10/28/2009 Legislative Office Building 302 1:00 PM "
124644,2009-10-02,"House Retained Bill - Subcommittee Work Session: 10/29/2009 10:00 Amendment Legislative Office Building 302 "
124644,2009-10-03,"House ==CANCELLED== Retained Bill - Executive Session: 11/3/2009 10:00 Amendment Legislative Office Building 302 "
124644,2009-10-27,"House Retained Bill - Subcommittee Work Session: 11/12/2009 9:50 Amendment Legislative Office Building 302 "
124644,2009-10-28,"House Retained Bill - Executive Session: 11/12/2009 10:15 Amendment Legislative Office Building 302 ==TIME CHANGE (Orig 10:00AM)== "
124644,2009-11-24,"House Majority Committee Report: Ought to Pass with Amendment #2462h (NT) for Jan 6 Regular Calendar (vote 13-3); House Calendar 2, PG.90 "
124644,2009-11-24,"House Proposed Majority Committee Amendment #2462h (New Title); House Calendar 1, PG.27-28 "
124644,2009-11-24,"House Minority Committee Report: Inexpedient to Legislate; House Calendar 2, PG.90 "
124644,2010-01-06,"House Amendment #2462h (New Title) Adopted, Division Vote 184-155; House Journal  6, PG.281 "
124644,2010-01-06,"House Ought to Pass with Amendment #2462h (New Title): Motion Adopted Regular Calendar 213-147; House Journal  6, PG.280-283 "
124644,2010-03-03,"Senate Introduced and Referred to Commerce, Labor and Consumer Protection "
124644,2010-04-01,"Senate Hearing: April 6, 2010, Room 210-211, Legislative Office Building, 8:30 a.m.; Senate Calendar 14 "
124644,2010-04-15,"Senate Committee Report: Ought to Pass with Amendment 1429s, New Title, 4/21/10; Senate Calendar 16 "
124644,2010-04-21,"Senate Without Objection, Chair moved to Special Order to 04/28/10; Senate Journal 15, Pg.303 "
124644,2010-04-21,"Senate Committee Report: Ought to Pass with Amendment 1429s, New Title, 4/28/10 "
124644,2010-04-28,"Senate Without Objection, Chair moved to Special Order to 05/5/10; Senate Journal 16, Pg.333 "
124644,2010-04-28,"Senate Committee Report: Ought to Pass with Amendment 1429s, New Title, 5/5/10 "
124644,2010-05-05,"Senate Without Objection, Chair moved to Special Order to the end of ED & A; Senate Journal 17, Pg.360 "
124644,2010-05-05,"Senate Committee Report: Ought to Pass with Amendment 1429s, New Title, 5/5/10 "
124644,2010-05-05,"Senate Without Objection, Chair moved to Special Order to the end of calendar; Senate Journal 17, Pg.384 "
124644,2010-05-05,"Senate Committee Report: Ought to Pass with Amendment 1429s, New Title, 5/5/10 "
124644,2010-05-05,"Senate Without Objection, Chair moved to Special Order prior to Public & Munic; Senate Journal 17, Pg.392 "
124644,2010-05-05,"Senate Committee Report: Ought to Pass with Amendment 1429s, New Title, 5/5/10 "
124644,2010-05-05,"Senate Committee Amendment 1429s, Amendment Failed, Voice Vote; Senate Journal 17, Pg.393 "
124644,2010-05-05,"Senate Sen. Hassan Floor Amendment 1906s, Amendment Adopted, Voice Vote; Senate Journal 17, Pg.394 "
124644,2010-05-05,"Senate Ought to Pass with Amendment 1906s, Motion Adopted, Voice Vote; OT3rdg; Senate Journal 17, Pg.394 "
124644,2010-05-05,"Senate Passed by Third Reading Resolution; Senate Journal 17, Pg.398 "
124644,2010-05-19,"House House Concurs with Senate Amendment #1906s (Rep Butler): Motion Adopted Voice Vote; House Journal  46, PG.2224 "
124644,2010-06-02,"House Enrolled "
124644,2010-06-02,"Senate Enrolled; Senate Journal 21, Pg.776 "
124644,2010-07-28,"House Signed by the Governor 07/23/2010; Effective 07/23/2010; Chapter 0363 "
124645,2009-01-08,"House Introduced and Referred to Transportation; House Journal  12, PG.233  "
124645,2009-01-29,"House Public Hearing: 2/4/2009 2:30 PM Legislative Office Building 203 "
124645,2009-02-03,"House ==CANCELLED== Executive Session: 2/10/2009 10:00 Amendment Legislative Office Building 203 "
124645,2009-02-11,"House Subcommittee Work Session: 2/17/2009 9:30 Amendment Legislative Office Building 203 "
124645,2009-02-11,"House Executive Session: 2/17/2009 10:00 Amendment Legislative Office Building 203 "
124645,2009-02-26,"House Retained in Committee "
124645,2009-05-12,"House Retained Bill - Subcommittee Work Session: 5/27/2009 11:00 Amendment Legislative Office Building 203 "
124645,2009-09-17,"House Retained Bill - Subcommittee Work Session: 9/23/2009 9:30 Amendment Legislative Office Building 203 "
124645,2009-10-01,"House Retained Bill - Subcommittee Work Session: 10/14/2009 9:30 Amendment Legislative Office Building 203 "
124645,2009-10-05,"House Retained Bill - Executive Session: 10/28/2009 Legislative Office Building 203 1:00 PM or Immediately Following Session "
124645,2009-11-02,"House Committee Report: Inexpedient to Legislate for Jan 6 Regular Calendar (vote 13-3); House Calendar 2, PG.99 "
124645,2010-01-06,"House Special Ordered to Next Session Date in Regular Calendar Order; House Journal  6, PG.310 "
124645,2010-01-13,"House Special Ordered to First Order of Business Next Session: Motion Adopted Voice Vote; House Journal  9, PG.438 "
124645,2010-01-27,"House Inexpedient to Legislate: Motion Adopted Division Vote 247-102; House Journal  12, PG.494 "
124646,2009-01-08,"House Introduced and Referred to Health, Human Services and Elderly Affairs; House Journal  12, PG.233 "
124646,2009-02-18,"House Public Hearing: 3/3/2009 10:15 Amendment Legislative Office Building 205 "
124646,2009-03-04,"House Subcommittee Work Session: 3/9/2009 3:30 PM Legislative Office Building 205 "
124646,2009-03-04,"House Executive Session: 3/18/2009 9:30 Amendment Legislative Office Building 205 "
124646,2009-03-18,"House Retained in Committee "
124646,2009-07-08,"House Retained Bill - Subcommittee Work Session: 8/6/2009 1:00 PM Legislative Office Building 205 "
124646,2009-08-06,"House Retained Bill - Subcommittee Work Session: 9/9/2009 1:00 PM Legislative Office Building 205 "
124646,2009-10-12,"House Retained Bill - Subcommittee Work Session: 11/10/2009 12:30 PM Legislative Office Building 205 "
124646,2009-10-13,"House Retained Bill - Executive Session: 11/10/2009 1:00 PM Legislative Office Building 205 "
124646,2009-11-12,"House Committee Report: Ought to Pass with Amendment #2376h for Jan 6 Consent Calendar (vote 15-0); House Calendar 2, PG.82-83 "
124646,2009-11-12,"House Proposed Committee Amendment #2376h; House Calendar 1, PG.28 "
124646,2010-01-06,"House Amendment #2376h Adopted, Voice Vote; House Journal  6, PG.262-263 "
124646,2010-01-06,"House Ought to Pass with Amendment #2376h: Motion Adopted Voice Vote; House Journal  6, PG.262-263 "
124646,2010-03-03,"Senate Introduced and Referred to Health and Human Services "
124646,2010-03-10,"Senate Hearing: March 16, 2010, Room 103, State House, 9:00 a.m.; Senate Calendar 11 "
124646,2010-03-22,"Senate Committee Report: Ought to Pass 3/31/10; Senate Calendar 13 "
124646,2010-03-31,"Senate Ought to Pass, Motion Adopted, Voice Vote; OT3rdg; Senate Journal 12, Pg.269 "
124646,2010-03-31,"Senate Passed by Third Reading Resolution; Senate Journal 12, Pg.271 "
124646,2010-04-07,"Senate Enrolled; Senate Journal 13, Pg.285 "
124646,2010-04-12,"House Enrolled; House Journal  32, PG.1577 "
124646,2010-05-10,"House Signed By the Governor 05/07/2010; Effective 05/07/2010; Chapter 0015 "
124647,2009-01-08,"House Introduced and Referred to Transportation; House Journal  12, PG.233 "
124647,2009-02-24,"House Public Hearing: 3/3/2009 1:00 PM Legislative Office Building 203 "
124647,2009-02-25,"House ==ROOM CHANGE== Executive Session: 3/12/2009 9:30 Amendment Legislative Office Building 207 (Orig Legislative Office Building 203) "
124647,2009-03-16,"House Retained in Committee "
124647,2009-10-05,"House Retained Bill - Subcommittee Work Session: 10/27/2009 1:00 PM Legislative Office Building 203 "
124647,2009-10-05,"House ==CANCELLED== Retained Bill - Executive Session: 10/28/2009 Legislative Office Building 203 1:00 PM "
124647,2009-10-09,"House Retained Bill - Subcommittee Work Session 11/10/2009 10:00 Amendment Legislative Office Building 205 "
124647,2009-11-02,"House Retained Bill - Executive Session: 11/17/2009 9:00 Amendment Legislative Office Building 203 "
124647,2009-11-20,"House Majority Committee Report: Ought to Pass with Amendment #2510h for Jan 6 Reg Cal (vote 8-7); House Calendar 2, PG.99 "
124647,2009-11-20,"House Proposed Majority Committee Amendment #2510h; House Calendar 1, PG.28-29 "
124647,2009-11-20,"House Minority Committee Report: Inexpedient to Legislate; House Calendar 2, PG.99 "
124647,2010-01-06,"House Special Ordered to Next Session Date in Regular Calendar Order; House Journal  6, PG.310 "
124647,2010-01-13,"House Special Order to Second Order of Business Next Session Day (Rep M.O'Brien): Motion Adopted Voice Vote; House Journal  9, PG.438-440 "
124647,2010-01-27,"House Amendment #2510h Adopted, Voice Vote; House Journal  12, PG.495-496 "
124647,2010-01-27,"House Floor Amendment #0132h (Rep M.O'Brien) Adopted, Voice Vote; House Journal  12, PG.496 "
124647,2010-01-27,"House Ought to Pass with Amendments #2510h and #0132h: Motion Failed Regular Calendar 164-192; House Journal  12, PG.496-498 "
124647,2010-01-27,"House Inexpedient to Legislate (Rep Bettencourt): Motion Adopted Division Vote 207-148; House Journal  12, PG.498 "
124647,2010-01-27,"House Reconsideration (Rep Packard): Motion Failed Division Vote 109-212; House Journal  12, PG.520 "
124648,2009-01-08,"House Introduced and Referred to Criminal Justice and Public Safety; House Journal  12, PG.234 "
124648,2009-02-24,"House ==TIME CHANGE== Public Hearing: 3/3/2009 2:00 PM Legislative Office Building 204 (Orig 11:30 Amendment) "
124648,2009-02-25,"House ==CANCELLED== Executive Session: 3/5/2009 1:30 PM Legislative Office Building 204 "
124648,2009-03-10,"House Executive Session: 3/17/2009 10:15 Amendment Legislative Office Building 204 (Continued 3/18&19/09 10:00 Amendment Legislative Office Building 204 If Needed) "
124648,2009-03-18,"House Committee Report: Ought to Pass with Amendment #0773h for Mar 24 Consent Calendar (vote 18-0); House Calendar 22, PG.653 "
124648,2009-03-18,"House Proposed Committee Amendment #0773h; House Calendar 22, PG.744-745 "
124648,2009-03-24,"House Amendment #0773h Adopted, Voice Vote; House Journal  25, PG.841-842 "
124648,2009-03-24,"House Ought to Pass with Amendment #0773h: Motion Adopted Voice Vote; House Journal  25, PG.841-842 "
124648,2009-04-08,"Senate Introduced and Referred to Executive Departments and Administration "
124648,2009-04-16,"Senate Hearing; April 21, 2009, Room 101, Legislative Office Building, 3:15 p.m.; Senate Calendar 20 "
124648,2009-05-07,"Senate Committee Report; Ought to Pass with Amendment 1571s [05/13/09]; Senate Calendar 23 "
124648,2009-05-13,"Senate Committee Amendment 1571s, Amendment Adopted, Voice Vote; Senate Journal 15, Pgs.315-516 "
124648,2009-05-13,"Senate Ought to Pass with Amendment 1571s, Motion Adopted, Voice Vote; Refer to Finance [Rule 26]; Senate Journal 15, Pg.316 "
124648,2009-05-28,"Senate Committee Report; Rereferred to Committee [06/03/09]; Senate Calendar 26 "
124648,2009-06-03,"Senate Without Objection, Chair moved to Special-Order HB 587 to the front of the Calendar; Senate Journal 18, Pg.398 "
124648,2009-06-03,"Senate Rereferred to Committee, Motion Adopted, Voice Vote; Senate Journal 18, Pg.488 "
124648,2010-01-14,"Senate Committee Report; Ought to Pass with Amendment 0153s, 1/21/10; Senate Calendar 3 Pg.6 "
124648,2010-01-21,"Senate Committee Amendment 0153s, Amendment Adopted, Voice Vote "
124648,2010-01-21,"Senate Ought to Pass with Amendment 0153s, Motion Adopted, Voice Vote; OT3rdg, Senate Journal 3, Pg.41 "
124648,2010-01-21,"Senate Passed By Third Reading Resolution, Senate Journal 3, Pg.44 "
124648,2010-04-14,"House House Concurs with Senate Amendment's #1471s & #0153s (Rep Shurtleff): Motion Adopted Voice Vote; House Journal  32, PG.1587 "
124648,2010-04-28,"House Enrolled Bill Amendment #1567 Adopted; House Journal  36, PG.1730 "
124648,2010-04-28,"Senate Enrolled Bill Amendment #1567 Adopted "
124648,2010-05-05,"Senate Enrolled "
124648,2010-05-05,"House Enrolled; House Journal  38, PG.1914 "
124648,2010-05-24,"House Signed by the Governor 05/19/2010; Effective 05/19/2010; Chapter 0082 "
124649,2009-01-08,"House Introduced and Referred to Ways and Means; House Journal  12, PG.234 "
124649,2009-02-04,"House Public Hearing: 2/11/2009 10:15 Amendment Legislative Office Building 202 "
124649,2009-03-03,"House Subcommittee Work Session: 3/6/2009 9:15 Amendment Legislative Office Building 202 "
124649,2009-03-11,"House Subcommittee Work Session: 3/16/2009 9:00 Amendment Legislative Office Building 202 "
124649,2009-03-16,"House Subcommittee Work Session: 3/17/2009 1:00 PM Legislative Office Building 202 "
124649,2009-03-16,"House Executive Session: 3/18/2009 9:00 Amendment Legislative Office Building 202 (Continued 3/19/09 9:00 Amendment Legislative Office Building 202 If Needed) "
124649,2009-03-19,"House Retained in Committee "
124649,2009-04-15,"House Retained Bill - Subcommittee Work Session: 4/21/2009 1:30 PM Legislative Office Building 202 "
124649,2009-10-15,"House Retained Bill - Subcommittee Work Session: 11/05/2009 11:00 Amendment Legislative Office Building 202 "
124649,2009-11-01,"House Retained Bill - Subcommittee Work Session 11/17/2009 9:30 Amendment Legislative Office Building 202 "
124649,2009-11-02,"House Retained Bill - Executive Session: 11/18/2009 10:00 Amendment Legislative Office Building 202 ==TIME CHANGE (Orig 9:00 Amendment)== "
124649,2009-11-19,"House Committee Report: Refer to Interim Study for Jan 6 Regular Calendar (vote 11-8); House Calendar 2, PG.100 "
124649,2010-01-06,"House Special Ordered to Next Session Date in Regular Calendar Order; House Journal  6, PG.310 "
124649,2010-01-13,"House Refer to Interim Study: Motion Adopted Voice Vote; House Journal  9, PG.440 "
124649,2010-03-17,"House Referred to Ways and Means for Interim Study; House Journal  26, PG.1365 "
124649,2010-09-10,"House Interim Study - Executive Session: 10/13/2010 10:00 Amendment Legislative Office Building 202 "
124649,2010-09-22,"House Interim Study - Subcommittee Work Session: 9/28/2010 1:00 PM Legislative Office Building 202 "
124649,2010-09-28,"House Interim Study - Subcommittee Work Session: 10/5/2010 1:00 PM Legislative Office Building 202 "
124649,2010-09-28,"House ==CANCELLED== Interim Study - Subcommittee Work Session: 10/12/2010 10:00 Amendment Legislative Office Building 202 "
124650,2009-01-08,"House Introduced and Referred to Executive Departments and Administration; House Journal  12, PG.234  "
124650,2009-01-29,"House Public Hearing: 2/3/2009 2:30 PM Legislative Office Building 306 "
124650,2009-02-04,"House Subcommittee Work Session: 2/11/2009 9:00 Amendment Legislative Office Building 306 "
124650,2009-02-04,"House Executive Session: 2/12/2009 2:00 PM Legislative Office Building 306 "
124650,2009-02-17,"House Committee Report: Ought to Pass with Amendment #0296h for Mar 4 Regular Calendar (vote 10-9); House Calendar 16, PG.375 "
124650,2009-02-17,"House Proposed Amendment #0296h; House Calendar 15, PG.334 "
124650,2009-03-04,"House Amendment #0296h Adopted, Voice Vote; House Journal  21, PG.606 "
124650,2009-03-04,"House Ought to Pass with Amendment #0296h: Motion Adopted Voice Vote; House Journal  21, PG.605-606 "
124650,2009-03-04,"House Referred to Ways and Means; House Journal  21, PG.606 "
124650,2009-03-18,"House Full Committee Work Session: 3/27/2009 10:00 Amendment Legislative Office Building 202 "
124650,2009-03-25,"House Executive Session: 3/31/2009 9:30 Amendment Legislative Office Building 202 "
124650,2009-04-01,"House Committee Report: Ought to Pass or April 8 Consent Calendar (vote 18-0); House Calendar 26, PG.920 "
124650,2009-04-08,"House Ought to Pass: Motion Adopted Voice Vote; House Journal  31, PG.1282 "
124650,2009-04-08,"Senate Introduced and Referred to Executive Departments and Administration; Senate Journal 11, Pg.236 "
124650,2009-04-23,"Senate Hearing; April 28, 2009, Room 101, Legislative Office Building, 2:50 p.m.; Senate Calendar 21 "
124650,2009-05-07,"Senate Committee Report; Rereferred to Committee [05/13/09]; Senate Calendar 23 "
124650,2009-05-13,"Senate Rereferred to Committee, Motion Adopted, Voice Vote; Senate Journal 15, Pg.318 "
124650,2009-12-28,"Senate Committee Report; Ought to Pass with Amendment 2429s; 01/06/10; Senate Calendar 1 Pg.2 "
124650,2010-01-06,"Senate Committee Amendment 2429s Amendment Adopted, Voice Vote; Senate Journal 1, Pg.10 "
124650,2010-01-06,"Senate Sen. Carson Floor Amendment 0035s Amendment Adopted, Voice Vote; "
124650,2010-01-06,"Senate Ought to Pass with Amendment 2429s, 0035s, Motion Adopted Voice Vote; OT3rdg; Senate Journal 1, Pg.11 "
124650,2010-01-06,"Senate Passed by Third Reading Resolution; Senate Journal 1, Pg.11 "
124650,2010-05-19,"House House Concurs with Senate Amendment #2429s & #0035s (Rep Harding): Motion Adopted Voice Vote; House Journal  46, PG.2226 "
124650,2010-06-02,"House Enrolled Bill Amendment #2421 Adopted "
124650,2010-06-02,"Senate Enrolled Bill Amendment #2421 Adopted "
124650,2010-06-02,"House Enrolled "
124650,2010-06-02,"Senate Enrolled "
124650,2010-07-15,"House Signed by the Governor 07/13/2010; Effective 01/01/2011; Chapter 0291 "
124651,2009-01-08,"House Introduced and Referred to Commerce and Consumer Affairs; House Journal  12, PG.234  "
124651,2009-01-27,"House Public Hearing: 2/4/2009 1:30 PM Legislative Office Building 302 "
124651,2009-02-05,"House Subcommittee Work Session: 2/10/2009 9:00 Amendment Legislative Office Building 302 "
124651,2009-02-05,"House Executive Session: 2/11/2009 10:00 Amendment Legislative Office Building 302 "
124651,2009-02-11,"House Committee Report: Ought to Pass with Amendment #0261h for Feb 18 Regular Calendar (vote 18-1); House Calendar 14, PG.275 "
124651,2009-02-11,"House Proposed Amendment #0261h; House Calendar 14, PG.304-305 "
124651,2009-02-18,"House Amendment #0261h Adopted, Voice Vote; House Journal  18, PG.496 "
124651,2009-02-18,"House Ought to Pass with Amendment #0261h: Motion Adopted Voice Vote; House Journal  18, PG.496 "
124651,2009-03-18,"Senate Introduced and Referred to Commerce, Labor and Consumer Protection; Senate Journal 8, pg. 134 "
124651,2009-04-16,"Senate Hearing; April 21, 2009, Room 102, Legislative Office Building, 8:45 a.m.; Senate Calendar 20 "
124651,2009-05-07,"Senate Committee Report; Rereferred to Committee 05/13/09; Senate Calendar 23 "
124651,2009-05-13,"Senate Rereferred to Committee, Motion Adopted, Voice Vote; Senate Journal 15, Pg.305 "
124651,2010-01-12,"Senate Committee Report; Inexpedient to Legislate 1/13/10; Senate Calendar 2A "
124651,2010-01-13,"Senate Inexpedient to Legislate, Motion Adopted, Voice Vote === BILL KILLED === Senate Journal 2, Pg.18 "
124652,2009-01-08,"House Introduced and Referred to Health, Human Services and Elderly Affairs; House Journal  12, PG.235  "
124652,2009-02-04,"House Public Hearing: 2/10/2009 2:00 PM Legislative Office Building 205 "
124652,2009-02-10,"House Subcommittee Work Session: 2/12/2009 3:30 PM Legislative Office Building 205 "
124652,2009-02-12,"House Subcommittee Work Session: 2/17/2009 9:15 Amendment Legislative Office Building 205 "
124652,2009-02-13,"House Executive Session: 2/17/2009 10:00 Amendment Legislative Office Building 205 "
124652,2009-02-26,"House Retained in Committee "
124652,2009-09-23,"House Retained Bill - Subcommittee Work Session: 9/30/2006 2:30 PM Legislative Office Building 205 "
124652,2009-10-13,"House Retained Bill - Executive Session: 11/10/2009 1:00 PM Legislative Office Building 205 "
124652,2009-11-12,"House Committee Report: Refer to Interim Study for Jan 6 Consent Calendar (vote 15-0); House Calendar 2, PG.83 "
124652,2010-01-06,"House Refer to Interim Study: Motion Adopted Voice Vote; House Journal  6, PG.263 "
124652,2010-03-17,"House Referred to Health, Human Services and Elderly Affairs for Interim Study; House Journal  26, PG.1365 "
124652,2010-09-20,"House Interim Study - Subcommittee Work Session: 10/6/2010 12:30 PM Legislative Office Building 203 "
124652,2010-09-21,"House Interim Study - Executive Session: 10/26/2010 10:00 Amendment Legislative Office Building 205 "
124653,2009-01-08,"House Introduced and Referred to Commerce and Consumer Affairs; House Journal  12, PG.235  "
124653,2009-01-29,"House Public Hearing: 2/10/2009 1:30 PM Legislative Office Building 302 "
124653,2009-02-10,"House ==CANCELLED== Executive Session: 2/17/2009 10:00 Amendment Legislative Office Building 302 "
124653,2009-02-11,"House ==CANCELLED== Executive Session: 3/17/2009 1:00 PM Legislative Office Building 302 "
124653,2009-02-26,"House Retained in Committee "
124653,2009-09-09,"House Retained Bill - Subcommittee Work Session: 10/1/2009 10:00 Amendment Legislative Office Building 302 "
124653,2009-09-09,"House Retained Bill - Subcommittee Work Session: 10/6/2009 10:00 Amendment Legislative Office Building 302 "
124653,2009-09-30,"House Retained Bill - Subcommittee Work Session: 10/14/2009 9:00 Amendment Legislative Office Building 302 "
124653,2009-10-01,"House Retained Bill - Subcommittee Work Session: 10/21/2009 11:00 Amendment Legislative Office Building 302 "
124653,2009-10-01,"House Retained Bill - Subcommittee Work Session: 10/27/2009 10:00 Amendment Legislative Office Building 302 "
124653,2009-10-01,"House ==CANCELLED== Retained Bill - Executive Session: 10/28/2009 Legislative Office Building 302 1:00 PM "
124653,2009-10-01,"House Retained Bill - Subcommittee Work Session: 11/4/2009 11:00 Amendment Legislative Office Building 302 "
124653,2009-10-09,"House Retained Bill - Subcommittee Work Session: 11/10/2009 10:00 Amendment Legislative Office Building 302 "
124653,2009-10-28,"House Retained Bill - Executive Session: 11/12/2009 10:15 Amendment Legislative Office Building 302 ==TIME CHANGE (Orig 10:00AM)== "
124653,2009-11-24,"House Committee Report: Refer to Interim Study for Jan 6 Consent Calendar (vote 16-0); House Calendar 2, PG.79 "
124653,2010-01-06,"House Refer to Interim Study: Motion Adopted Voice Vote; House Journal  6, PG.251 "
124653,2010-03-17,"House Referred to Commerce and Consumer Affairs for Interim Study; House Journal  26, PG.1365 "
124653,2010-05-04,"House Interim Study Subcom Work Sess: 5/7/2010 1:00 PM Legislative Office Building 302 Members: Reps Nevins, Schlachman & R.Holden "
124653,2010-05-04,"House Interim Study Subcom Work Sess: 5/21/2010 1:00PM Legislative Office Building 302 Members: Reps Nevins, Schlachman & R.Holden "
124653,2010-05-04,"House ==CANCELLED==Interim Study Subcom Work Sess: 6/9/2010 1:00 PM Legislative Office Building 302 =DATE CHANGE (Orig 5/28/2010)= "
124653,2010-05-04,"House Members: Reps Nevins, Schlachman & R.Holden "
124653,2010-06-09,"House Interim Study - Subcommittee Work Session: 6/15/2010 10:00 Amendment Legislative Office Building 302 "
124653,2010-06-14,"House Interim Study - Subcommittee Work Session: 6/23/2010 10:00 Amendment Legislative Office Building 302 "
124653,2010-06-14,"House ==CANCELLED== Interim Study - Subcommittee Work Session: 6/25/2010 10:00 Amendment Legislative Office Building 302 "
124653,2010-06-23,"House Interim Study - Subcommittee Work Session: 6/30/2010 1:00 PM Legislative Office Building 302 "
124653,2010-09-22,"House Interim Study - Executive Session 10/26/2010 10:00 Legislative Office Building 302 "
124654,2009-01-08,"House Introduced and Referred to Judiciary; House Journal  12, PG.235  "
124654,2009-01-27,"House ===CANCELLED=== Public Hearing: 2/10/2009 10:30 Amendment Legislative Office Building 208 "
124654,2009-01-27,"House Public Hearing: 2/4/2009 1:30 PM Legislative Office Building 208 "
124654,2009-02-03,"House Executive Session: 2/17/2009 10:00 Amendment Legislative Office Building 208 "
124654,2009-02-18,"House Committee Report: Ought to Pass for Mar 4 Consent Calendar (vote 16-1); House Calendar 16, PG.368 "
124654,2009-03-04,"House Ought to Pass: Motion Adopted Voice Vote; House Journal  21, PG.588-589 "
124654,2009-03-04,"House Referred to Ways and Means; House Journal  21, PG.589 "
124654,2009-03-11,"House Full Committee Work Session: 3/20/2009 1:00 PM Legislative Office Building 202 "
124654,2009-03-18,"House Full Committee Work Session: 3/23/2009 10:00 Amendment Legislative Office Building 202 "
124654,2009-03-25,"House Executive Session: 3/31/2009 9:30 Amendment Legislative Office Building 202 "
124654,2009-04-01,"House Retained in Committee "
124654,2009-10-07,"House Retained Bill - Executive Session: 10/28/2009 Legislative Office Building 202 1:30 PM or Immediately Following Session "
124654,2009-11-05,"House Committee Report: Inexpedient to Legislate for Jan 6 Consent Calendar (vote 19-0); House Calendar 2, PG.87 "
124654,2010-01-06,"House Inexpedient to Legislate: Motion Adopted Voice Vote; House Journal  6, PG.270 "
124655,2009-01-08,"House Introduced and Referred to Education; House Journal  12, PG.235 "
124655,2009-02-03,"House Public Hearing: 2/17/2009 10:00 Amendment Legislative Office Building 207 "
124655,2009-02-19,"House Executive Session: 3/5/2009 10:00 Amendment Legislative Office Building 207 "
124655,2009-03-06,"House Retained in Committee "
124655,2009-10-06,"House Retained Bill - Subcommittee Work Session: 10/14/2009 1:00 PM Legislative Office Building 207 "
124655,2009-10-21,"House ==CANCELLED== Retained Bill - Executive Session: 12/1/2009 10:00 Amendment Legislative Office Building 207 "
124655,2009-10-30,"House Retained Bill - Executive Session: 11/19/2009 10:00 Amendment Legislative Office Building 207 "
124655,2009-11-30,"House Committee Report: Ought to Pass with Amendment #2523h (New Title) for Jan 6 Consent Calendar (vote 16-0); House Calendar 2, PG.80 "
124655,2009-11-30,"House Proposed Committee Amendment #2523h (New Title); House Calendar 1, PG.29-34 "
124655,2010-01-06,"House Amendment #2523h (New Title) Adopted, Voice Vote; House Journal  6, PG.253-258 "
124655,2010-01-06,"House Ought to Pass with Amendment #2523h (New Title): Motion Adopted Voice Vote; House Journal  6, PG.253-258 "
124655,2010-03-03,"Senate Introduced and Referred to Education "
124655,2010-03-11,"Senate Hearing: March 16, 2010, Room 103, Legislative Office Building, 11:30 a.m.; Senate Calendar 11 "
124655,2010-04-06,"Senate Committee Report: Ought to Pass with Amendment 1254s, New Title, 4/7/10; Senate Calendar 14A "
124655,2010-04-07,"Senate Without Objection, Chair moved to Special Order to the end of the Calendar; Senate Journal 13, Pg.275 "
124655,2010-04-07,"Senate Committee Amendment 1254s, New Title, Amendment Adopted, Voice Vote; Senate Journal 13, Pg.280 "
124655,2010-04-07,"Senate Ought to Pass with Amendment 1254s, New Title, Motion Adopted, Voice Vote; OT3rdg; Senate Journal 13, Pg.280 "
124655,2010-04-07,"Senate Passed by Third Reading Resolution; Senate Journal 13, Pg.282 "
124655,2010-04-14,"House House Concurs with Senate Amendment #1254s (New Title) (Rep Rous): Motion Adopted Voice Vote; House Journal  32, PG.1587 "
124655,2010-04-14,"Senate Enrolled Bill Amendment #1391, New Title, Adopted "
124655,2010-04-14,"House Enrolled Bill Amendment #1391 (New Title) Adopted; House Journal  32, PG.1588-1589 "
124655,2010-04-14,"Senate Enrolled; Senate Journal 14, Pg.302 "
124655,2010-04-14,"House Enrolled; House Journal  32, PG.1589 "
124655,2010-04-19,"House Signed by the Governor 04/19/2010; Chapter 0005 "
124655,2010-04-19,"House I. Section 1-3 Effective 06/18/2010 "
124655,2010-04-19,"House II. Remainder Effective 04/19/2010 "
124656,2009-01-08,"House Introduced and Referred to Executive Departments and Administration; House Journal  12, PG.235  "
124656,2009-01-29,"House Public Hearing: 2/10/2009 1:45 PM Legislative Office Building 306 "
124656,2009-02-11,"House Executive Session: 2/17/2009 2:45 PM Legislative Office Building 306 "
124656,2009-02-26,"House Retained in Committee "
124656,2009-05-13,"House ==TIME CHANGE==Retained Bill - Subcommittee Work Session: 5/19/2009 11:30 Amendment Legislative Office Building 306 (Orig 11:00 Amendment) "
124656,2009-09-17,"House Retained Bill - Subcommittee Work Session: 9/23/2009 2:00 PM Legislative Office Building 306 "
124656,2009-09-17,"House Retained Bill - Subcommittee Work Session: 9/30/2009 2:00 PM Legislative Office Building 307 ==ROOM CHANGE (Orig Legislative Office Building 306)== "
124656,2009-10-30,"House Retained Bill - Executive Session: 11/19/2009 10:00 Amendment Legislative Office Building 306 "
124656,2009-11-20,"House Committee Report: Inexpedient to Legislate for Jan 6 Consent Calendar (vote 17-0); House Calendar 2, PG.82 "
124656,2010-01-06,"House Inexpedient to Legislate: Motion Adopted Voice Vote; House Journal  6, PG.261 "
124657,2009-01-08,"House Introduced and Referred to Criminal Justice and Public Safety; House Journal  12, PG.235 "
124657,2009-02-10,"House Public Hearing: 2/19/2009 11:00 Amendment Legislative Office Building 204 "
124657,2009-02-25,"House ==CANCELLED== Executive Session: 3/5/2009 1:30 PM Legislative Office Building 204 "
124657,2009-03-04,"House ==TIME CHANGE== Subcommittee Work Session: 3/9/2009 9:30 Amendment Legislative Office Building 204 (Orig 9:00 Amendment) "
124657,2009-03-09,"House Subcommittee Work Session: 3/17/2009 9:00 Amendment Legislative Office Building 204 "
124657,2009-03-10,"House Executive Session: 3/17/2009 10:15 Amendment Legislative Office Building 204 (Continued 3/18&19/09 10:00 Amendment Legislative Office Building 204 If Needed) "
124657,2009-03-18,"House Committee Report: Ought to Pass with Amendment #0846h (NT) for Mar 24 Consent Calendar (vote 17-0); House Calendar 22, PG.653 "
124657,2009-03-18,"House Proposed Committee Amendment #0846h (New Title); House Calendar 22, PG.746-748 "
124657,2009-03-24,"House Amendment #0846h (New Title) Adopted, Voice Vote; House Journal  25, PG.842-843 "
124657,2009-03-24,"House Ought to Pass with Amendment #0846h (New Title): Motion Adopted Voice Vote; House Journal  25, PG.842-843 "
124657,2009-04-08,"Senate Introduced and Referred to Judiciary; Senate Journal 11, Pg.236 "
124657,2009-05-14,"Senate Hearing; === Time Change === May 26, 2009, Room 103, State House, 3:00 p.m.; Senate Calendar 25 "
124657,2009-05-28,"Senate Committee Report; Rereferred to Committee [06/03/09]; Senate Calendar 26 "
124657,2009-06-03,"Senate Without Objection, Chair moved to Special-Order HB 621 to the front of the Calendar; Senate Journal 18, Pg.398 "
124657,2009-06-03,"Senate Rereferred to Committee, Motion Adopted, Voice Vote; Senate Journal 18, Pg.505 "
124657,2010-01-20,"Senate Committee Report; Ought to Pass 1/27/10; Senate Calendar 4 "
124657,2010-01-27,"Senate Sen. Lasky Floor Amendment 0331s, Amendment Adopted, Voice Vote "
124657,2010-01-27,"Senate Ought to Pass with Amendment 0331s, Motion Adopted, Voice Vote; OT3rdg; Senate Journal 4, Pg.52 "
124657,2010-01-27,"Senate Passed by Third Reading Resolution; Senate Journal 4, Pg.56 "
124657,2010-04-21,"House House Non-Concurs with Senate Amendment, Requests Comm of Conf (Rep Shurtleff): Motion Adopted Voice Vote; House Journal  35, PG.1694 "
124657,2010-04-21,"House Speaker Appoints: Reps Cushing, Rodd, Swinford & Gagne; House Journal  35, PG.1694 "
124657,2010-05-19,"Senate Sen. Reynolds Accedes to House Request for Committee of Conference, Motion Adopted, Voice Vote "
124657,2010-05-19,"Senate President Appoints: Senators Lasky, Houde and Roberge "
124657,2010-05-21,"House Conference Committee Meeting: 5/26/2010 9:00 Amendment Legislative Office Building 204 "
124657,2010-05-27,"Senate Conference Committee Report 2239; Senate Amendment + New Amendment, Filed "
124657,2010-06-02,"Senate Conference Committee Report 2239; Adopted, Voice Vote "
124657,2010-06-02,"House Conference Committee Report #2239 Adopted, Voice Vote "
124657,2010-06-02,"House Enrolled "
124657,2010-06-02,"Senate Enrolled "
124657,2010-07-07,"House Signed by the Governor 07/06/2010; Chapter 0250 "
124657,2010-07-07,"House I. Section 1 Effective 09/04/2010 "
124657,2010-07-07,"House II. Section 3 Effective 01/02/2011 "
124657,2010-07-07,"House III. Remainder Effective 07/06/2010 "
124658,2009-01-08,"House Introduced and Referred to Election Law; House Journal  12, PG.235  "
124658,2009-01-29,"House Public Hearing: 2/3/2009 9:30 Amendment Legislative Office Building 308 "
124658,2009-01-29,"House ==ROOM CHANGE== Executive Session: 2/4/2009 1:00 PM Legislative Office Building 308 (Orig Legislative Office Building 101) "
124658,2009-02-26,"House Retained in Committee "
124658,2009-08-20,"House Retained Bill - Subcommittee Work Session: 9/15/2009 1:30 PM Legislative Office Building 307 "
124658,2009-09-16,"House Retained Bill - Subcommittee Work Session: 9/24/2009 10:30 Amendment Legislative Office Building 308 "
124658,2009-10-21,"House Retained Bill - Executive Session: 11/17/2009 9:30 Amendment Legislative Office Building 308 "
124658,2009-11-24,"House Committee Report: Ought to Pass with Amendment #2516h (New Title) for Jan 6 Regular Calendar (vote 14-2); House Calendar 2, PG.93 "
124658,2009-11-24,"House Proposed Committee Amendment #2516h (New Title); House Calendar 1, PG.34-36 "
124658,2010-01-06,"House Special Ordered to Next Session Date in Regular Calendar Order; House Journal  6, PG.310 "
124658,2010-01-13,"House Amendment #2516h (New Title) Adopted, Voice Vote; House Journal  9, PG.386-388 "
124658,2010-01-13,"House Ought to Pass with Amendment #2516h (New Title): Motion Adopted Voice Vote; House Journal  9, PG.386-388 "
124658,2010-01-13,"House Referred to Ways and Means; House Journal  9, PG.388 "
124658,2010-01-26,"House Public Hearing: 2/2/2010 1:00 PM Legislative Office Building 202 "
124658,2010-02-02,"House ==CANCELLED== Subcommittee Work Session: 2/11/2010 1:30 PM Legislative Office Building 101 "
124658,2010-02-17,"House Subcommittee Work Session: 3/2/2010 2:30 PM Legislative Office Building 202 "
124658,2010-03-10,"House Executive Session: 3/16/2010 10:00 Amendment Legislative Office Building 202 (Continued 3/17/10 9:00 Amendment Legislative Office Building 202 If Necessary) "
124658,2010-03-17,"House Committee Report: Ought to Pass with Amendment #0513h for Mar 24 (Vote 17-1; Consent Calendar); House Calendar 22, PG.1220 "
124658,2010-03-17,"House Proposed Committee Amendment #0513h; House Calendar 22, PG.1237-1238 "
124658,2010-03-24,"House Amendment #0513h Adopted, Voice Vote; House Journal  30, PG.1476-1477 "
124658,2010-03-24,"House Ought to Pass with Amendment #0513h: Motion Adopted Voice Vote; House Journal  30, PG.1476-1477 "
124658,2010-03-24,"Senate Introduced and Referred to Election Law and Veterans' Affairs; Senate Journal 11, Pg.260 "
124658,2010-04-01,"Senate Hearing: April 6, 2010, Room 101, Legislative Office Building, 8:30 a.m.; Senate Calendar 14 "
124658,2010-04-13,"Senate Committee Report: Inexpedient to Legislate 4/21/10; Senate Calendar 16 "
124658,2010-04-21,"Senate Without Objection, Chair moved to Special Order to 04/28/10; Senate Journal 15, Pg.303 "
124658,2010-04-21,"Senate Committee Report: Inexpedient to Legislate 4/28/10 "
124658,2010-04-28,"Senate Inexpedient to Legislate, Motion Failed, Voice Vote; Senate Journal 16, Pg.334 "
124658,2010-04-28,"Senate Sen. Boutin moved Ought to Pass, Senate Journal 16, Pg.334 "
124658,2010-04-28,"Senate Sen. Boutin Floor Amendment 1504s, New Title, Amendment Adopted, Voice Vote; Senate Journal 16, Pg.334 "
124658,2010-04-28,"Senate Ought to Pass with Amendment 1504s, New Title, Motion Adopted, Voice Vote; OT3rdg; Senate Journal 16, Pg.335 "
124658,2010-04-28,"Senate Passed by Third Reading Resolution; Senate Journal 16, Pg.353 "
124658,2010-05-19,"House House Non-Concurs with Senate Amendment (Rep Clemons): Motion Adopted Voice Vote; House Journal  46, PG.2205 "
124659,2009-01-08,"House Introduced and Referred to Ways and Means; House Journal  12, PG.235 "
124659,2009-02-04,"House Public Hearing: 2/11/2009 10:30 Amendment Legislative Office Building 202 "
124659,2009-03-11,"House Subcommittee Work Session: 3/13/2009 1:30 PM Legislative Office Building 202 "
124659,2009-03-16,"House Subcommittee Work Session: 3/17/2009 10:00 Amendment Legislative Office Building 202 "
124659,2009-03-16,"House Full Committee Work Session: 3/17/2009 1:30 PM Legislative Office Building 202 "
124659,2009-03-16,"House Executive Session: 3/18/2009 9:00 Amendment Legislative Office Building 202 (Continued 3/19/09 9:00 Amendment Legislative Office Building 202 If Needed) "
124659,2009-03-19,"House Retained in Committee "
124659,2009-10-07,"House Retained Bill - Executive Session: 10/28/2009 Legislative Office Building 202 1:30 PM or Immediately Following Session "
124659,2009-11-05,"House Committee Report: Inexpedient to Legislate for Jan 6 Consent Calendar (vote 18-1); House Calendar 2, PG.87 "
124659,2010-01-06,"House Inexpedient to Legislate: Motion Adopted Voice Vote; House Journal  6, PG.270 "
124660,2009-01-08,"House Introduced and Referred to Transportation; House Journal  12, PG.235  "
124660,2009-02-03,"House Public Hearing: 2/10/2009 11:30 Amendment Legislative Office Building 203 "
124660,2009-02-03,"House ==CANCELLED== Executive Session: 2/11/2009 11:00 Amendment Legislative Office Building 203 "
124660,2009-02-11,"House Subcommittee Work Session: 2/12/2009 3:00 PM Legislative Office Building 203 "
124660,2009-02-11,"House Executive Session: 2/18/2009 2:00 PM Legislative Office Building 203 (or 1/2 Hour After Session) "
124660,2009-02-18,"House Committee Report: Ought to Pass with Amendment #0329h for Mar 4 Consent Calendar (vote 14-0); House Calendar 16, PG.372 "
124660,2009-02-18,"House Proposed Amendment #0329h; House Calendar 15, PG.351 "
124660,2009-03-04,"House Amendment #0329h Adopted, Voice Vote; House Journal  21, PG.598 "
124660,2009-03-04,"House Ought to Pass with Amendment #0329h: Motion Adopted Voice Vote; House Journal  21, PG.598 "
124660,2009-03-04,"House Referred to Ways and Means; House Journal  21, PG.598 "
124660,2009-03-11,"House Full Committee Work Session: 3/20/2009 9:30 Amendment Legislative Office Building 202 "
124660,2009-03-18,"House Full Committee Work Session: 3/23/2009 10:00 Amendment Legislative Office Building 202 "
124660,2009-03-25,"House Executive Session: 3/31/2009 9:30 Amendment Legislative Office Building 202 "
124660,2009-04-01,"House Retained in Committee "
124660,2009-07-22,"House Retained Bill - Subcommittee Work Session: 8/11/2009 10:00 Amendment Legislative Office Building 202 "
124660,2009-08-11,"House Retained Bill - Subcommittee Work Session: 9/1/2009 11:00 Amendment Legislative Office Building 202 "
124660,2009-10-07,"House Retained Bill - Executive Session: 10/28/2009 Legislative Office Building 202 1:30 PM or Immediately Following Session "
124660,2009-11-05,"House Committee Report: Ought to Pass with Amendment #2375h (New Title) for Jan 6 Consent Calendar (vote 18-1); House Calendar 2, PG.87 "
124660,2009-11-05,"House Proposed Committee Amendment #2375h (New Title); House Calendar 1, PG.36-37 "
124660,2010-01-06,"House Amendment #2375h (New Title) Adopted, Voice Vote; House Journal  6, PG.270-271 "
124660,2010-01-06,"House Ought to Pass with Amendment #2375h (New Title): Motion Adopted Voice Vote; House Journal  6, PG.270-271 "
124660,2010-03-10,"Senate Introduced and Referred to Transportation & Interstate Cooperation "
124660,2010-03-18,"Senate Hearing: April 1, 2010, Room 101, Legislative Office Building, 10:50 a.m.; Senate Calendar 12 "
124660,2010-03-23,"Senate Hearing: === TIME CHANGE === April 1, 2010, Room 101, Legislative Office Building, 11:35 a.m.; Senate Calendar 13 "
124660,2010-04-01,"Senate Committee Report: Ought to Pass with Amendment 1210s, 4/7/10; Senate Calendar 14 "
124660,2010-04-07,"Senate Committee Amendment 1210s, Amendment Adopted, Voice Vote; Senate Journal 13, Pg.277 "
124660,2010-04-07,"Senate Ought to Pass with Amendment 1210s, Motion Adopted, Voice Vote; OT3rdg; Senate Journal 13, Pg.277 "
124660,2010-04-07,"Senate Passed by Third Reading Resolution; Senate Journal 13, Pg.282 "
124660,2010-05-19,"House House Non-Concurs with Sen Amendment & Req Comm of Conf (Rep Almy): Motion Adopted Regular Calendar 189-154; House Journal  46, PG.2195-2197 "
124660,2010-05-19,"House Speaker Appoints: Reps Hatch, Osgood, Shattuck & Almy; House Journal  46, PG.2195-2197 "
124660,2010-05-19,"Senate Sen. Letourneau accedes to House Request for Committee of Conference, Motion Adopted, Voice Vote "
124660,2010-05-19,"Senate President Appoints: Senators Gilmour, Kelly and Boutin "
124660,2010-05-21,"House Conference Committee Meeting: 5/26/2010 3:30 PM Legislative Office Building 202 "
124660,2010-05-27,"Senate Conference Committee Report 2258; Senate Amendment + New Amendment, Filed "
124660,2010-06-02,"Senate Conference Committee Report 2258; Adopted, Voice Vote "
124660,2010-06-02,"House Conference Committee Report #2258 Adopted, Voice Vote "
124660,2010-06-02,"House Enrolled "
124660,2010-06-02,"Senate Enrolled "
124660,2010-07-07,"House Signed by the Governor 07/06/2010; Effective 09/04/2010; Chapter 0251 "
124661,2009-01-08,"House Introduced and Referred to Local and Regulated Revenues; House Journal  12, PG.235  "
124661,2009-02-04,"House Public Hearing: 2/10/2009 10:00 Amendment Legislative Office Building 303 "
124661,2009-02-11,"House Executive Session: 2/17/2009 1:00 PM Legislative Office Building 303 "
124661,2009-02-26,"House Retained in Committee "
124661,2009-10-14,"House Retained Bill - Subcommittee Work Session: 10/27/2009 10:00 Amendment Legislative Office Building 303 "
124661,2009-10-15,"House Retained Bill - Subcommittee Work Session: 10/28/2009 Legislative Office Building 303 1:00 PM or Following Session "
124661,2009-10-16,"House Retained Bill - Subcommittee Work Session: 11/2/2009 10:00 Amendment Legislative Office Building 303 "
124661,2009-10-16,"House Retained Bill - Subcommittee Work Session: 11/18/2009 9:00 Amendment Legislative Office Building 303 "
124661,2009-10-16,"House Retained Bill - Executive Session: 11/18/2009 10:00 Amendment Legislative Office Building 303 "
124661,2009-11-19,"House Committee Report: Ought to Pass with Amendment #2531h for Jan 6 Regular Calendar (vote 15-2); House Calendar 2, PG.97 "
124661,2009-11-19,"House Proposed Committee Amendment #2531h; House Calendar 1, PG.37-41 "
124661,2010-01-06,"House Special Ordered to Next Session Date in Regular Calendar Order; House Journal  6, PG.310 "
124661,2010-01-13,"House Amendment #2531h Adopted, Voice Vote; House Journal  9, PG.415-419 "
124661,2010-01-13,"House Floor Amendment #2010-0065h (Rep Walz) Adopted, Voice Vote; House Journal  9, PG.419 "
124661,2010-01-13,"House Ought to Pass with Amendments #2531h and #2010-0065h: Motion Adopted Voice Vote; House Journal  9, PG.415-419 "
124661,2010-01-13,"House Referred to Ways and Means; House Journal  9, PG.419 "
124661,2010-01-20,"House Public Hearing: 1/28/2010 10:20 Amendment Legislative Office Building 202 "
124661,2010-03-10,"House Executive Session: 3/16/2010 10:00 Amendment Legislative Office Building 202 (Continued 3/17/10 9:00 Amendment Legislative Office Building 202 If Necessary) "
124661,2010-03-17,"House Corrected Majority Committee Report: Ought to Pass for Mar 24 (Vote 12-5; Regular Calendar); House Calendar 22A, PG.1 "
124661,2010-03-17,"House Minority Committee Report: Inexpedient to Legislate; House Calendar 22A, PG.1 "
124661,2010-03-24,"House Lay on the Table (Rep Weare): Motion Failed Division Vote 152-198; House Journal  30, PG.1485 "
124661,2010-03-24,"House Ought to Pass: Motion Adopted Regular Calendar 245-113; House Journal  30, PG.1484-1487 "
124661,2010-03-24,"House Reconsideration (Rep Vaillancourt): Motion Failed Voice Vote; House Journal  30, PG.1487 "
124661,2010-03-24,"Senate Introduced and Referred to Ways & Means; Senate Journal 11, Pg.260 "
124661,2010-04-01,"Senate Hearing: April 6, 2010, Room 100, State House, 10:30 a.m.; Senate Calendar 14 "
124661,2010-04-08,"Senate Committee Report: Ought to Pass with Amendment 1272s, 4/14/10; Senate Calendar 15 "
124661,2010-04-14,"Senate Committee Amendment 1272s, Amendment Adopted, Voice Vote; Senate Journal 14, Pg.292 "
124661,2010-04-14,"Senate Sen. Sgambati Floor Amendment 1375s, New Title, Division Vote, 10Y-14N, Amendment Failed, Voice Vote; Senate Journal 14, Pg.294 "
124661,2010-04-14,"Senate Ought to Pass with Amendment 1272s, Motion Adopted, Voice Vote; OT3rdg; Senate Journal 14, Pg.294 "
124661,2010-04-14,"Senate Passed by Third Reading Resolution; Senate Journal 14, Pg.295 "
124661,2010-04-28,"House House Concurs with Senate Amendment #1272s (Reps Walz & Almy): Motion Adopted Regular Calendar 250-82; House Journal  36, PG.1722-1724 "
124661,2010-05-13,"Senate Enrolled Bill Amendment #2070 Adopted "
124661,2010-05-19,"House Enrolled Bill Amendment #2070 Adopted; House Journal  46, PG.2238 "
124661,2010-05-19,"House Enrolled; House Journal  46, PG.2247 "
124661,2010-05-19,"Senate Enrolled "
124661,2010-07-09,"House Signed by the Governor 07/08/2010; Chapter 0272 "
124661,2010-07-09,"House I. Section 20 Effective 01/01/2015 "
124661,2010-07-09,"House II. Remainder Effective 01/01/2011 "
124662,2009-01-08,"House Introduced and Referred to Labor, Industrial and Rehabilitative Services; House Journal  12, PG.236 "
124662,2009-02-10,"House Public Hearing: 2/19/2009 1:00 PM Legislative Office Building 307 "
124662,2009-03-04,"House Subcommittee Work Session: 3/12/2009 9:00 Amendment Legislative Office Building 307 "
124662,2009-03-12,"House Executive Session: 3/18/2009 10:00 Amendment Legislative Office Building 307 "
124662,2009-03-19,"House Retained in Committee "
124662,2009-10-14,"House Retained Bill - Full Committee Work Session: 10/28/2009 1:00 PM Legislative Office Building 306 "
124662,2009-11-03,"House Retained Bill - Full Committee Work Session: 11/10/2009 10:00 Amendment Legislative Office Building 307 "
124662,2009-11-17,"House Retained Bill - Full Committee Work Session: 11/24/2009 11:00 Amendment Legislative Office Building 307 "
124662,2009-11-20,"House Retained Bill - Executive Session: 11/24/2009 1:00 PM Legislative Office Building 307 "
124662,2009-11-25,"House Committee Report: Inexpedient to Legislate for Jan 6 Consent Calendar (vote 17-0); House Calendar 2, PG.84 "
124662,2010-01-06,"House Removed from Consent Calendar (Rep Burridge); House Journal  6, PG.250 "
124662,2010-01-06,"House Special Ordered to Next Session Date; House Journal  6, PG.310 "
124662,2010-01-13,"House Inexpedient to Legislate: Motion Adopted Voice Vote; House Journal  9, PG.443 "
124663,2009-01-08,"House Introduced and Referred to Ways and Means; House Journal  12, PG.236 "
124663,2009-02-11,"House Public Hearing: 2/19/2009 11:00 Amendment Legislative Office Building 202 "
124663,2009-03-05,"House Public Hearing On Proposed Non-Germane Amendments: 3/12/2009 Legislative Office Building 202 As Follows: "
124663,2009-03-05,"House 9:00 Amendment #0565h relative to the funding and operating of liquor stores by the liquor commission "
124663,2009-03-05,"House 10:00 Amendment #0568h establishing a tax on gambling winnings "
124663,2009-03-05,"House 11:00 Amendment #0566h increasing the rate of the meals and rooms tax "
124663,2009-03-05,"House 11:30 Amendment #0570h increasing the filing fee for complaints about unfair labor practices "
124663,2009-03-05,"House 1:00 PM #0577h relative to fees for certain food and beverage licenses "
124663,2009-03-05,"House 1:30 PM #0575h increasing fees for health facilities and community living facilities "
124663,2009-03-05,"House 2:00 PM #0573h amending the department of transportation's oversize & overweight permit fee schedule "
124663,2009-03-05,"House 2:30 PM #0572h establishing a driveway permit review and inspection fee "
124663,2009-03-05,"House 3:00 PM #0562h relative to subdivision fees and environmental services' subsurface systems program "
124663,2009-03-05,"House 3:15 PM #0563h estab motor vehicle air pollution abatement fund & increasing mv inspection fee "
124663,2009-03-05,"House 3:30 PM #0564h rel admin costs state water pollution control & drinking water revolving loan funds "
124663,2009-03-11,"House Subcommittee Work Session: 3/16/2009 11:30 Amendment Legislative Office Building 202 (On Proposed Amendment 0568h & 0570h) "
124663,2009-03-11,"House Subcom Work Session: 3/16/2009 11:30 Amendment Legislative Office Building 201 (On Proposed Amendment 0573h, 0572h, 0562h, 0563h, & 0564h) "
124663,2009-03-11,"House Subcommittee Work Session: 3/16/2009 11:30 Amendment Legislative Office Building 204 (On Proposed Amendment 0565h, 0566h, 0577h, & 0575h) "
124663,2009-03-16,"House Subcommittee Work Session: 3/17/2009 10:15 Amendment Legislative Office Building 207 "
124663,2009-03-16,"House Subcommittee Work Session: 3/17/2009 10:30 Amendment Legislative Office Building 207 (On Proposed Amendment 0566, 0577, 0575) "
124663,2009-03-16,"House Subcommittee Work Session: 3/17/2009 1:00 PM Legislative Office Building 307 (On Proposed Amendment 0565) "
124663,2009-03-16,"House Full Committee Work Session: 3/17/2009 1:30 PM Legislative Office Building 202 "
124663,2009-03-17,"House Full committee work session on amendments 3/18/09 8:58AM Room202, Legislative Office Building "
124663,2009-03-17,"House Subcommittee Work Session: 3/18/2009 8:30 Amendment Legislative Office Building 204 "
124663,2009-03-17,"House Executive Session: 3/18/2009 9:00 Amendment Legislative Office Building 202 (Continued 3/19/09 9:00 Amendment Legislative Office Building 202 If Needed) "
124663,2009-03-19,"House Retained in Committee "
124663,2009-10-07,"House Retained Bill - Executive Session: 10/28/2009 Legislative Office Building 202 1:30 PM or Immediately Following Session "
124663,2009-11-05,"House Committee Report: Inexpedient to Legislate for Jan 6 Consent Calendar (vote 18-0); House Calendar 2, PG.87 "
124663,2010-01-06,"House Inexpedient to Legislate: Motion Adopted Voice Vote; House Journal  6, PG.271 "
124664,2009-01-08,"House Introduced and Referred to Ways and Means; House Journal  12, PG.236 "
124664,2009-02-25,"House Public Hearing: 3/5/2009 1:30 PM Legislative Office Building 202 "
124664,2009-03-11,"House Subcommittee Work Session: 3/13/2009 1:45 PM Legislative Office Building 201 "
124664,2009-03-11,"House ===CANCELLED=== Work Session: 3/18/2009 2:00 PM Legislative Office Building 202 "
124664,2009-03-11,"House Executive Session: 3/18/2009 9:00 Amendment Legislative Office Building 202 (Continued 3/19/09 9:00 Amendment Legislative Office Building 202 If Needed) "
124664,2009-03-19,"House Retained in Committee "
124664,2009-07-21,"House Retained Bill - Subcommittee Work Session: 8/12/2009 10:00 Amendment Legislative Office Building 202 "
124664,2009-08-12,"House Retained Bill - Subcommittee Work Session: 8/25/2009 1:00 PM Legislative Office Building 202 "
124664,2009-09-02,"House Retained Bill - Subcommittee Work Session: 9/10/2009 11:00 Amendment Legislative Office Building 202 "
124664,2009-10-27,"House Retained Bill - Subcommittee Work Session: 11/12/2009 1:00 PM Legislative Office Building 202 "
124664,2009-11-02,"House Retained Bill - Executive Session: 11/18/2009 9:00 Amendment Legislative Office Building 202 "
124664,2009-11-19,"House Committee Report: Inexpedient to Legislate for Jan 6 Regular Calendar (vote 16-1); House Calendar 2, PG.100 "
124664,2010-01-06,"House Special Ordered to Next Session Date in Regular Calendar Order; House Journal  6, PG.310 "
124664,2010-01-13,"House Inexpedient to Legislate: Motion Adopted Regular Calendar 244-72; House Journal  9, PG.440-442 "
124665,2009-01-08,"House Introduced and Referred to Science, Technology and Energy; House Journal  12, PG.236  "
124665,2009-01-30,"House Public Hearing: 2/3/2009 2:30 PM Legislative Office Building 304 "
124665,2009-02-10,"House ==TIME CHANGE== Executive Session: 2/19/2009 11:00 Amendment Legislative Office Building 304 (Orig 1:00 PM) "
124665,2009-02-26,"House Retained in Committee "
124665,2009-04-29,"House Retained Bill - Full Committee Work Session: 5/5/2009 10:30 Amendment Legislative Office Building 307 "
124665,2009-05-08,"House Retained Bill - Subcommittee Work Session: 5/13/2009 1:30 PM Legislative Office Building 304 "
124665,2009-09-15,"House Retained Bill - Full Committee Work Session: 10/9/2009 1:30 PM Legislative Office Building 304 "
124665,2009-09-15,"House Retained Bill - Executive Session: 10/9/2009 2:30 PM Legislative Office Building 304 "
124665,2009-10-13,"House Retained Bill - Continued Executive Session: 10/28/2009 Legislative Office Building 304 1:00 PM or Immediately After Session "
124665,2009-11-02,"House Committee Report: Inexpedient to Legislate for Jan 6 Consent Calendar (vote 17-0); House Calendar 2, PG.85-86 "
124665,2010-01-06,"House Inexpedient to Legislate: Motion Adopted Voice Vote; House Journal  6, PG.267-268 "
124666,2009-01-08,"House Introduced and Referred to Public Works and Highways; House Journal  12, PG.236  "
124666,2009-02-11,"House Public Hearing: 2/17/2009 10:15 Amendment Legislative Office Building 201 "
124666,2009-02-11,"House Executive Session: 2/19/2009 10:15 Amendment Legislative Office Building 201 "
124666,2009-02-19,"House Committee Rprt: Ought to Pass with Amendment #0415h (NT) for Mar 4 Regular Calendar (vote 14-3); House Calendar 16, PG.379-380 "
124666,2009-02-19,"House Proposed Amendment #0415h (New Title); House Calendar 15, PG.351-352 "
124666,2009-03-04,"House Amendment #0415h (New Title) Adopted, Voice Vote; House Journal  21, PG.628-629 "
124666,2009-03-04,"House Ought to Pass with Amendment #0415h (New Title): Motion Adopted Regular Calendar 190-162; House Journal  21, PG.626-631 "
124666,2009-03-04,"House Referred to Ways and Means; House Journal  21, PG.631 "
124666,2009-03-05,"House Public Hearing: 3/13/2009 9:00 Amendment Legislative Office Building 202 "
124666,2009-03-16,"House Subcommittee Work Session: 3/17/2009 10:15 Amendment Legislative Office Building 202 "
124666,2009-03-16,"House Full Committee Work Session: 3/17/2009 1:30 PM Legislative Office Building 202 "
124666,2009-03-25,"House Executive Session: 3/31/2009 9:30 Amendment Legislative Office Building 202 "
124666,2009-04-01,"House Retained in Committee "
124666,2009-10-07,"House Retained Bill - Executive Session: 10/28/2009 Legislative Office Building 202 1:30 PM or Immediately Following Session "
124666,2009-11-05,"House Committee Report: Inexpedient to Legislate for Jan 6 Consent Calendar (vote 18-0); House Calendar 2, PG.87 "
124666,2010-01-06,"House Inexpedient to Legislate: Motion Adopted Voice Vote; House Journal  6, PG.271 "
124667,2009-01-08,"House Introduced and Referred to Municipal and County Government; House Journal  12, PG.236  "
124667,2009-01-29,"House Public Hearing: 2/10/2009 2:30 PM Legislative Office Building 301 "
124667,2009-02-04,"House Executive Session: 2/17/2009 11:00 Amendment Legislative Office Building 301 (Continued if Needed 2/19/09 1:00 PM Legislative Office Building 301) "
124667,2009-02-26,"House Retained in Committee "
124667,2009-09-02,"House Retained Bill - Subcommittee Work Session: 9/15/2009 1:00 PM Legislative Office Building 301 "
124667,2009-09-28,"House Retained Bill - Executive Session: 10/28/2009 Legislative Office Building 301 1:00 PM or Immediately Following Session "
124667,2009-11-02,"House Committee Report: Inexpedient to Legislate for Jan 6 Regular Calendar (vote 13-3); House Calendar 2, PG.97 "
124667,2010-01-06,"House Special Ordered to Next Session Date in Regular Calendar Order; House Journal  6, PG.310 "
124667,2010-01-13,"House Recommitted (Rep Cooney): Motion Adopted Voice Vote; House Journal  9, PG.419-420 "
124667,2010-01-20,"House Public Hearing: 1/26/2010 1:00 PM Legislative Office Building 301 "
124667,2010-01-26,"House Executive Session: 2/2/2010 1:30 PM Legislative Office Building 301 "
124667,2010-02-03,"House Committee Report: Ought to Pass with Amendment #0192h (NT) for Feb 10 Regular Calendar (vote 15-0); House Calendar 13, PG.539-540 "
124667,2010-02-03,"House Proposed Committee Amendment #0192h (New Title); House Calendar 13, PG.557 "
124667,2010-02-10,"House Amendment #0192h (New Title) Adopted, Division Vote 343-4; House Journal  16, PG.760 "
124667,2010-02-10,"House Ought to Pass with Amendment #0192h (New Title): Motion Adopted Division Vote 344-4; House Journal  16, PG.760-761 "
124667,2010-02-10,"House Referred to Finance; House Journal  16, PG.761 "
124667,2010-02-24,"House Full Committee Work Session: 3/2/2010 10:30 Amendment Legislative Office Building 210-211 "
124667,2010-02-24,"House Full Committee Work Session: 3/4/2010 10:00 Amendment Legislative Office Building 210-211 "
124667,2010-02-24,"House Executive Session: 3/4/2010 2:00 PM Legislative Office Building 210-211 "
124667,2010-03-05,"House Committee Report: Inexpedient to Legislate for Mar 24 (Vote 22-3; Regular Calendar); House Calendar 22, PG.1222 "
124667,2010-03-24,"House Inexpedient to Legislate: Motion Adopted Division Vote 264-90; House Journal  30, PG.1493 "
124668,2009-01-08,"House Introduced and Referred to Executive Departments and Administration; House Journal  12, PG.236  "
124668,2009-01-29,"House Public Hearing: 2/10/2009 10:15 Amendment Legislative Office Building 306 "
124668,2009-02-11,"House Subcommittee Work Session: 2/17/2009 9:00 Amendment Legislative Office Building 306 "
124668,2009-02-11,"House ==CANCELLED== Executive Session: 2/17/2009 2:45 PM Legislative Office Building 306 "
124668,2009-02-18,"House Subcommittee Work Session: 2/19/2009 8:30 Amendment Legislative Office Building 301 "
124668,2009-02-18,"House Executive Session: 2/19/2009 8:45 Amendment Legislative Office Building 306 "
124668,2009-02-19,"House Committee Report: Ought to Pass with Amendment #0434h for Mar 4 Regular Calendar (vote 11-0); House Calendar 16, PG.375 "
124668,2009-02-19,"House Proposed Amendment #0434h; House Calendar 15, PG.353-357 "
124668,2009-03-04,"House Amendment #0434h Adopted, Voice Vote; House Journal  21, PG.606-611 "
124668,2009-03-04,"House Floor Amendment #0548h (Rep Kurk) Adopted, Voice Vote; House Journal  21, PG.611 "
124668,2009-03-04,"House Ought to Pass with Amendments #0434h and #0548h: Motion Adopted Voice Vote; House Journal  21, PG.606-611 "
124668,2009-03-04,"House Referred to Criminal Justice and Public Safety; House Journal  21, PG.611 "
124668,2009-03-11,"House ===CANCELLED=== Public Hearing: 3/24/2009 3:00 PM Legislative Office Building 204 "
124668,2009-03-13,"House Public Hearing: 3/31/2009 12:00 PM Legislative Office Building 204 "
124668,2009-03-16,"House Executive Session: 4/2/2009 10:00 Amendment Legislative Office Building 204 "
124668,2009-04-02,"House Committee Report: Ought to Pass for April 8 Consent Calendar (vote 19-0); House Calendar 26, PG.918 "
124668,2009-04-08,"House Ought to Pass: Motion Adopted Voice Vote; House Journal  31, PG.1280 "
124668,2009-04-08,"Senate Introduced and Referred to Executive Departments and Administration; Senate Journal 11, Pg.236 "
124668,2009-04-23,"Senate Hearing; April 28, 2009, Room 101, Legislative Office Building, 3:05 p.m.; Senate Calendar 21 "
124668,2009-05-07,"Senate Committee Report; Rereferred to Committee [05/13/09]; Senate Calendar 23 "
124668,2009-05-13,"Senate Rereferred to Committee, Motion Adopted, Voice Vote; Senate Journal 15, Pg.319 "
124668,2010-01-14,"Senate Committee Report; Ought to Pass with Amendment 0150s; 01/21/10; Senate Calendar 3 Pg.6 "
124668,2010-01-21,"Senate Committee Amendment 0150s, Amendment Adopted, Voice Vote "
124668,2010-01-21,"Senate Ought to Pass with Amendment 0150s, Motion Adopted, Voice Vote; OT3rdg, Senate Journal 3, Pg.40 "
124668,2010-01-21,"Senate Passed By Third Reading Resolution, Senate Journal 3, Pg.44 "
124668,2010-05-05,"House House Non-Concurs with Senate Amendment & Requests C of C (Reps Harding & Shurtleff): Motion Adopted Voice Vote; House Journal  38, PG.1885 "
124668,2010-05-05,"House Speaker Appoints: Reps Houde-Quimby, Hawkins, D.Ryder & Stevens; House Journal  38, PG.1885 "
124668,2010-05-19,"Senate Sen. Cilley Accedes to House Request for Committee of Conference, Motion Adopted, Voice Vote "
124668,2010-05-19,"Senate President Appoints: Senators DeVries, Cilley and Downing "
124668,2010-05-20,"House Conference Committee Meeting: 5/25/2010 1:00 PM Legislative Office Building 308 "
124668,2010-05-21,"House Conferee Change: Rep C.McGuire Replaces Rep D.Ryder; House Journal  46, PG.2245 "
124668,2010-05-27,"Senate Conference Committee Report 2214; Senate Amendment + New Amendment, Filed "
124668,2010-06-02,"Senate Conference Committee Report 2214; Adopted, Voice Vote "
124668,2010-06-02,"House Conference Committee Report #2214 Adopted, Voice Vote "
124668,2010-06-02,"House Enrolled Bill Amendment #2431 Adopted "
124668,2010-06-02,"Senate Enrolled Bill Amendment #2431 Adopted "
124668,2010-06-02,"Senate Enrolled "
124668,2010-06-02,"House Enrolled "
124668,2010-07-15,"House Signed by the Governor 07/13/2010; Effective 01/01/2011; Chapter 0292 "
124669,2009-01-08,"House Introduced and Referred to Environment and Agriculture; House Journal  12, PG.236  "
124669,2009-01-29,"House ===CANCELLED=== Public Hearing: 2/6/2009 10:00 Amendment Legislative Office Building 308 "
124669,2009-01-29,"House Public Hearing: 2/4/2009 3:30 PM Legislative Office Building 307 "
124669,2009-02-11,"House ==TIME CHANGE== Subcommittee Work Session: 2/12/2009 2:00 PM Legislative Office Building 104 (Orig 10:45 Amendment) "
124669,2009-02-12,"House Executive Session: 2/19/2009 9:00 Amendment Legislative Office Building 308 "
124669,2009-02-26,"House Retained in Committee "
124669,2009-06-17,"House Retained Bill - Subcommittee Work Session: 6/30/2009 9:00 Amendment Legislative Office Building 308 "
124669,2009-07-08,"House Retained Bill - Subcommittee Work Session: 9/15/2009 10:00 Amendment Legislative Office Building 305 ==ROOM CHANGE (Orig Legislative Office Building 308)== "
124669,2009-09-15,"House Retained Bill - Subcommittee Work Session: 9/29/2009 10:00 Amendment Legislative Office Building 308 "
124669,2009-09-29,"House Retained Bill - Subcommittee Work Session: 10/13/2009 10:00 Amendment Legislative Office Building 307 =ROOM CHANGE (Orig Legislative Office Building 308)= "
124669,2009-10-27,"House Retained Bill - Executive Session: 11/17/2009 10:00 Amendment Legislative Office Building 307 "
124669,2009-11-23,"House Majority Committee Report: Refer to Interim Study for Jan 6 Regular Calendar (vote 10-7); House Calendar 2, PG.93 "
124669,2009-11-23,"House Minority Committee Report: Ought to Pass with Amendment #2409h (New Title); House Calendar 2, PG.93 "
124669,2009-11-23,"House Proposed Minority Committee Amendment #2409h (New Title); House Calendar 1, PG.41 "
124669,2010-01-06,"House Special Ordered to Next Session Date in Regular Calendar Order; House Journal  6, PG.310 "
124669,2010-01-13,"House Refer to Interim Study: Motion Adopted Voice Vote; House Journal  9, PG.396 "
124669,2010-03-17,"House Referred to Environment and Agriculture for Interim Study; House Journal  26, PG.1365 "
124669,2010-09-14,"House Interim Study - Full Committee Work Session: 10/12/2010 1:15 PM Legislative Office Building 308 "
124669,2010-09-14,"House Interim Study - Executive Session: 10/19/2010 10:00 Amendment Legislative Office Building 308 "
124670,2009-01-08,"House Introduced and Referred to Ways and Means; House Journal  12, PG.236 "
124670,2009-02-04,"House Public Hearing: 2/11/2009 11:00 Amendment Legislative Office Building 202 "
124670,2009-03-03,"House Subcommittee Work Session: 3/6/2009 9:30 Amendment Legislative Office Building 202 "
124670,2009-03-11,"House Subcommittee Work Session: 3/16/2009 9:00 Amendment Legislative Office Building 202 "
124670,2009-03-16,"House Subcommittee Work Session: 3/17/2009 1:00 PM Legislative Office Building 202 "
124670,2009-03-16,"House Executive Session: 3/18/2009 9:00 Amendment Legislative Office Building 202 (Continued 3/19/09 9:00 Amendment Legislative Office Building 202 If Needed) "
124670,2009-03-19,"House Retained in Committee "
124670,2009-04-15,"House Retained Bill - Subcommittee Work Session: 4/21/2009 1:30 PM Legislative Office Building 202 "
124670,2009-10-15,"House Retained Bill - Subcommittee Work Session: 11/05/2009 11:00 Amendment Legislative Office Building 202 "
124670,2009-11-01,"House Retained Bill - Subcommittee Work Session: 11/17/2009 9:30 Amendment Legislative Office Building 202 "
124670,2009-11-02,"House Retained Bill - Executive Session: 11/18/2009 10:00 Amendment Legislative Office Building 202 ==TIME CHANGE (Orig 9:00 Amendment)== "
124670,2009-11-19,"House Majority Committee Report: Refer to Interim Study for Jan 6 Regular Calendar (vote 11-8); House Calendar 2, PG.100 "
124670,2009-11-19,"House Minority Committee Report: Ought to Pass with Amendment #2532h; House Calendar 2, PG.100 "
124670,2009-11-19,"House Proposed Minority Committee Amendment #2532h; House Calendar 1, PG.42-45 "
124670,2010-01-06,"House Special Ordered to Next Session Date in Regular Calendar Order; House Journal  6, PG.310 "
124670,2010-01-13,"House Refer to Interim Study: Motion Adopted Voice Vote; House Journal  9, PG.442 "
124670,2010-03-17,"House Referred to Ways and Means for Interim Study; House Journal  26, PG.1365 "
124670,2010-09-10,"House Interim Study - Executive Session: 10/13/2010 10:00 Amendment Legislative Office Building 202 "
124670,2010-09-22,"House Interim Study - Subcommittee Work Session: 9/28/2010 1:01 PM Legislative Office Building 202 "
124670,2010-09-28,"House Interim Study - Subcommittee Work Session: 10/5/2010 1:00 PM Legislative Office Building 202 "
124670,2010-09-28,"House ==CANCELLED== Interim Study - Subcommittee Work Session: 10/12/2010 10:00 Amendment Legislative Office Building 202 "
124671,2009-01-08,"House Introduced and Referred to Health, Human Services and Elderly Affairs; House Journal  12, PG.237 "
124671,2009-02-04,"House Public Hearing: 2/10/2009 10:45 Amendment Legislative Office Building 205 "
124671,2009-03-04,"House ==TIME CHANGE== Executive Session: 3/9/2009 1:30 PM Legislative Office Building 205 (Orig 1:00 PM) "
124671,2009-03-09,"House Majority Committee Report: Ought to Pass for Mar 24 Regular Calendar (vote 15-5); House Calendar 22, PG.684 "
124671,2009-03-09,"House Minority Committee Report: Inexpedient to Legislate; House Calendar 22, PG.684 "
124671,2009-03-24,"House Special Ordered to Mar 25 Without Objection; House Journal  25, PG.914 "
124671,2009-03-25,"House Ought to Pass: Motion Adopted Division Vote 194-159; House Journal  27, PG.1108 "
124671,2009-04-08,"Senate Introduced and Referred to Health and Human Services; Senate Journal 11, Pg.236 "
124671,2009-04-16,"Senate Hearing; April 28, 2009, Room 103, State House, 9:00 a.m.; Senate Calendar 20 "
124671,2009-04-28,"Senate Committee Report; Ought to Pass [05/06/09]; Senate Calendar 22 "
124671,2009-05-06,"Senate Ought to Pass [Not Voted on] "
124671,2009-05-06,"Senate Sen. Kelly Moved Laid on Table, Motion Adopted, Voice Vote; Senate Journal 14, Pg.270 "
124671,2009-05-13,"Senate Sen. Fuller Clark Moved Remove From Table, Motion Adopted, Voice Vote; Senate Journal 15, Pg.321 "
124671,2009-05-13,"Senate Ought to Pass, Motion Failed, Voice Vote; Senate Journal 15, Pg.321 "
124671,2009-05-13,"Senate Sen. Fuller Clark Moved Rereferred to Committee; Senate Journal 15, Pg.321 "
124671,2009-05-13,"Senate Rereferred to Committee, Motion Adopted, Voice Vote; Senate Journal 15, Pg.321 "
124671,2010-01-19,"Senate Committee Report; Referred to Interim Study 1/21/10; Senate Calendar 3A "
124671,2010-01-21,"Senate Referred to Interim Study Motion Adopted, Voice Vote; Senate Journal 3, Pg.41 "
124672,2009-01-08,"House Introduced and Referred to Commerce and Consumer Affairs; House Journal  12, PG.237 "
124672,2009-02-05,"House ==TIME CHANGE== Public Hearing: 2/17/2009 10:15 Amendment Legislative Office Building 302 (Orig 10:00 Amendment) "
124672,2009-02-10,"House Executive Session: 3/17/2009 1:00 PM Legislative Office Building 302 (Continued 3/18/09 11:00 Amendment Legislative Office Building 302 If Needed) "
124672,2009-03-18,"House Retained in Committee "
124672,2009-08-03,"House Retained Bill - Subcommittee Work Session: 8/19/2009 10:00 Amendment Legislative Office Building 302 "
124672,2009-08-19,"House Retained Bill - Subcommittee Work Session: 8/26/2009 10:00 Amendment Legislative Office Building 302 "
124672,2009-08-26,"House Retained Bill - Subcommittee Work Session: 9/9/2009 10:00 Amendment Legislative Office Building 301 "
124672,2009-09-09,"House Retained Bill - Subcommittee Work Session: 9/25/2009 10:00 Amendment Legislative Office Building 302 "
124672,2009-09-30,"House Retained Bill - Subcommittee Work Session: 10/13/2009 10:00 Amendment Legislative Office Building 302 "
124672,2009-10-01,"House Retained Bill - Subcommittee Work Session: 10/20/2009 10:00 Amendment Legislative Office Building 302 "
124672,2009-10-01,"House ==CANCELLED== Retained Bill - Executive Session: 10/28/2009 Legislative Office Building 302 1:00 PM "
124672,2009-10-01,"House =CANCELLED= Retained Bill - Continued Executive Session If Neeeded: 11/3/2009 10:00 Amendment Legislative Office Building 302 "
124672,2009-10-27,"House Retained Bill - Subcommittee Work Session: 11/3/2009 2:00 PM Legislative Office Building 302 "
124672,2009-11-04,"House Retained Bill - Subcommittee Work Session: 11/12/2009 10:00 Amendment Legislative Office Building 302 "
124672,2009-11-04,"House Retained Bill - Executive Session: 11/12/2009 10:15 Amendment Legislative Office Building 302 ==TIME CHANGE (Orig 10:00AM)== "
124672,2009-11-24,"House Committee Report: Ought to Pass with Amendment #2482h for Jan 6 Regular Calendar (vote 10-7); House Calendar 2, PG.90 "
124672,2009-11-24,"House Proposed Committee Amendment #2482h; House Calendar 1, PG.45-62 "
124672,2010-01-06,"House Amendment #2482h Adopted, Voice Vote; House Journal  6, PG.284-300 "
124672,2010-01-06,"House Ought to Pass with Amendment #2482h: Motion Adopted Voice Vote; House Journal  6, PG.284-300 "
124672,2010-01-06,"House Referred to Ways and Means; House Journal  6, PG.300 "
124672,2010-01-12,"House Public Hearing: 1/20/2010 10:00 Amendment Legislative Office Building 202 "
124672,2010-01-26,"House Executive Session: 2/4/2010 10:00 Amendment Legislative Office Building 202 "
124672,2010-02-08,"House Committee Report: Ought to Pass with Amendment #0439h for Feb 17 Consent Calendar (Vote 17-1); House Calendar 14, PG.599-600 "
124672,2010-02-08,"House Proposed Committee Amendment #0439h; House Calendar 14, PG.619 "
124672,2010-02-17,"House Amendment #0439h Adopted, Voice Vote; House Journal  18, PG.979 "
124672,2010-02-17,"House Ought to Pass with Amendment #0439h: Motion Adopted Voice Vote; House Journal  18, PG.979 "
124672,2010-03-17,"Senate Introduced and Referred to Commerce, Labor and Consumer Protection, Senate Journal 10, Pg.171 "
124672,2010-04-01,"Senate Hearing: April 8, 2010, Room 103, State House, 12:30 p.m.; Senate Calendar 14 "
124672,2010-04-15,"Senate Committee Report: Ought to Pass with Amendment 1430s, 4/21/10; Senate Calendar 16 "
124672,2010-04-21,"Senate Committee Amendment 1430s, Amendment Adopted, Voice Vote; Senate Journal 15, Pg.309 "
124672,2010-04-21,"Senate Sen. Hassan Floor Amendment 1479s, Amendment Adopted, Voice Vote; Senate Journal 15, Pg.310 "
124672,2010-04-21,"Senate Ought to Pass with Amendments 1430s, 1479s, Motion Adopted, Voice Vote; OT3rdg; Senate Journal 15, Pg.310 "
124672,2010-04-21,"Senate Passed by Third Reading Resolution; Senate Journal 15, Pg.325 "
124672,2010-05-05,"House House Concurs with Senate Amendment 1430s & 1479s (Reps Butler & Almy): Motion Adopted Voice Vote; House Journal  38, PG.1882 "
124672,2010-05-19,"Senate Enrolled Bill Amendment #2100 Adopted "
124672,2010-05-19,"House Enrolled Bill Amendment #2100 Adopted "
124672,2010-05-19,"House Enrolled "
124672,2010-05-19,"Senate Enrolled "
124672,2010-06-16,"House Signed by the Governor 06/14/2010; Effective 06/14/2010; Chapter 0132 "
124673,2009-01-08,"House Introduced and Referred to Commerce and Consumer Affairs; House Journal  12, PG.237  "
124673,2009-01-27,"House Public Hearing: 2/3/2009 2:15 PM Legislative Office Building 302 "
124673,2009-01-29,"House Executive Session: 2/11/2009 10:00 Amendment Legislative Office Building 302 "
124673,2009-02-26,"House Retained in Committee "
124673,2009-09-30,"House Retained Bill - Subcommittee Work Session: 10/6/2009 11:00 Amendment Legislative Office Building 302 "
124673,2009-09-30,"House Retained Bill - Subcommittee Work Session: 10/15/2009 10:00 Amendment Legislative Office Building 302 "
124673,2009-10-01,"House Retained Bill - Subcommittee Work Session: 10/27/2009 2:00 PM Legislative Office Building 302 "
124673,2009-10-02,"House Retained Bill - Executive Session: 10/28/2009 Legislative Office Building 302 1:00 PM or Immediately Following Session "
124673,2009-10-02,"House =CANCELLED= Retained Bill - Continued Executive Session If Neeeded: 11/3/2009 10:00 Amendment Legislative Office Building 302 "
124673,2009-11-03,"House Committee Report: Refer to Interim Study for Jan 6 Regular Calendar (vote 16-0); House Calendar 2, PG.91 "
124673,2010-01-06,"House Refer to Interim Study: Motion Adopted Voice Vote; House Journal  6, PG.301 "
124673,2010-03-17,"House Referred to Commerce and Consumer Affairs for Interim Study; House Journal  26, PG.1365 "
124673,2010-06-14,"House Interim Study - Subcommittee Work Session: 6/22/2010 9:30 Amendment Legislative Office Building 302 "
124673,2010-09-27,"House Interim Study - Subcommittee Work Session: 10/6/2010 9:30 Amendment Legislative Office Building 302 "
124673,2010-09-27,"House Interim Study - Executive Session 10/26/2010 10:00 Legislative Office Building 302 "
124674,2009-01-08,"House Introduced and Referred to Labor, Industrial and Rehabilitative Services; House Journal  12, PG.237 "
124674,2009-01-28,"House Public Hearing: 2/3/2009 11:00 Amendment Legislative Office Building 307 "
124674,2009-02-04,"House Executive Session: 2/11/2009 11:30 Amendment Legislative Office Building 307 "
124674,2009-02-26,"House Retained in Committee "
124674,2009-09-14,"House Retained Bill - Subcommittee Work Session: 9/22/2009 10:00 Amendment Legislative Office Building 307 "
124674,2009-10-01,"House Retained Bill - Subcommittee Work Session: 10/13/2009 8:45 Amendment Legislative Office Building 303 "
124674,2009-11-03,"House Retained Bill - Subcommittee Work Session: 11/10/2009 9:45 Amendment Legislative Office Building 307 "
124674,2009-11-03,"House ==CANCELLED== Retained Bill - Executive Session: 11/10/2009 11:00 Amendment Legislative Office Building 307 "
124674,2009-11-20,"House Retained Bill - Subcommittee Work Session: 11/24/2009 10:45 Amendment Legislative Office Building 307 "
124674,2009-11-21,"House Retained Bill - Executive Session: 11/24/2009 1:00 PM Legislative Office Building 307 "
124674,2009-11-25,"House Committee Report: Refer to Interim Study for Jan 6 Regular Calendar (vote 9-8); House Calendar 2, PG.97 "
124674,2010-01-06,"House Special Ordered to Next Session Date in Regular Calendar Order; House Journal  6, PG.310 "
124674,2010-01-13,"House Refer to Interim Study: Motion Adopted Voice Vote; House Journal  9, PG.415 "
124674,2010-03-17,"House Referred to Labor, Industrial and Rehabilitative Services for Interim Study; House Journal  26, PG.1365 "
124674,2010-09-09,"House Interim Study - Subcommittee Work Session: 9/23/2010 9:00 Amendment Legislative Office Building 307 "
124674,2010-09-29,"House Interim Study - Executive Session: 10/13/2010 10:00 Amendment Legislative Office Building 307 "
124675,2009-01-08,"House Introduced and Referred to Labor, Industrial and Rehabilitative Services; House Journal  12, PG.237 "
124675,2009-01-28,"House Public Hearing: 2/3/2009 1:00 PM Legislative Office Building 307 "
124675,2009-02-04,"House Executive Session: 2/11/2009 11:30 Amendment Legislative Office Building 307 "
124675,2009-02-26,"House Retained in Committee "
124675,2009-09-14,"House Retained Bill - Subcommittee Work Session: 9/22/2009 10:00 Amendment Legislative Office Building 307 "
124675,2009-11-03,"House Retained Bill - Executive Session: 11/10/2009 11:00 Amendment Legislative Office Building 307 "
124675,2009-11-25,"House Committee Report: Refer to Interim Study for Jan 6 Consent Calendar (vote 11-2); House Calendar 2, PG.84 "
124675,2010-01-06,"House Removed from Consent Calendar (Rep Vaillancourt); House Journal  6, PG.250 "
124675,2010-01-06,"House Special Ordered to Next Session Date; House Journal  6, PG.310 "
124675,2010-01-13,"House Refer to Interim Study: Motion Adopted Voice Vote; House Journal  9, PG.443 "
124675,2010-03-17,"House Referred to Labor, Industrial and Rehabilitative Services for Interim Study; House Journal  26, PG.1365 "
124675,2010-09-09,"House Interim Study - Subcommittee Work Session: 9/23/2010 9:30 Amendment Legislative Office Building 307 "
124675,2010-09-29,"House Interim Study - Executive Session: 10/13/2010 10:00 Amendment Legislative Office Building 307 "
124676,2009-01-08,"House Introduced and Referred to Ways and Means; House Journal  12, PG.237 "
124676,2009-02-25,"House Public Hearing: 3/5/2009 9:30 Amendment Legislative Office Building 202 "
124676,2009-03-11,"House Subcommittee Work Session: 3/16/2009 10:00 Amendment Legislative Office Building 202 "
124676,2009-03-16,"House Full Committee Work Session: 3/17/2009 1:30 PM Legislative Office Building 202 "
124676,2009-03-16,"House Executive Session: 3/18/2009 9:00 Amendment Legislative Office Building 202 (Continued 3/19/09 9:00 Amendment Legislative Office Building 202 If Needed) "
124676,2009-03-19,"House Retained in Committee "
124676,2009-10-07,"House Retained Bill - Executive Session: 10/28/2009 Legislative Office Building 202 1:30 PM or Immediately Following Session "
124676,2009-11-05,"House Committee Report: Inexpedient to Legislate for Jan 6 Consent Calendar (vote 18-0); House Calendar 2, PG.87 "
124676,2010-01-06,"House Inexpedient to Legislate: Motion Adopted Voice Vote; House Journal  6, PG.271 "
124677,2009-01-08,"House Introduced and Referred to Criminal Justice and Public Safety; House Journal  12, PG.237 "
124677,2009-02-10,"House Public Hearing: 3/5/2009 10:00 Amendment Legislative Office Building 204 "
124677,2009-02-25,"House ==CANCELLED== Executive Session: 3/9/2009 10:00 Amendment Legislative Office Building 204 "
124677,2009-03-09,"House Subcommittee Work Session: 3/17/2009 10:00 Amendment Legislative Office Building 204 "
124677,2009-03-10,"House Executive Session: 3/17/2009 10:15 Amendment Legislative Office Building 204 (Continued 3/18&19/09 10:00 Amendment Legislative Office Building 204 If Needed) "
124677,2009-03-17,"House Retained in Committee "
124677,2009-08-18,"House Retained Bill - Subcommittee Work Session: 8/25/2009 10:30 Amendment Legislative Office Building 204 "
124677,2009-08-26,"House Retained Bill - Subcommittee Work Session: 9/1/2009 10:30 Amendment Legislative Office Building 204 "
124677,2009-09-24,"House Retained Bill - Executive Session: 11/5/2009 10:00 Amendment Legislative Office Building 204 "
124677,2009-11-09,"House Majority Committee Report: Ought to Pass for Jan 6 Regular Calendar (vote 9-7); House Calendar 2, PG.92 "
124677,2009-11-09,"House Minority Committee Report: Inexpedient to Legislate; House Calendar 2, PG.92 "
124677,2010-01-06,"House Special Ordered to Next Session Date in Regular Calendar Order; House Journal  6, PG.310 "
124677,2010-01-13,"House Ought to Pass: Motion Failed Regular Calendar 85-274; House Journal  9, PG.374-376 "
124677,2010-01-13,"House Inexpedient to Legislate (Rep Rodd): Motion Adopted Voice Vote; House Journal  9, PG.374-376 "
124678,2009-01-08,"House Introduced and Referred to Commerce and Consumer Affairs; House Journal  12, PG.237 "
124678,2009-01-29,"House Public Hearing: 2/17/2009 11:00 Amendment Legislative Office Building 302 "
124678,2009-02-10,"House Executive Session: 3/17/2009 1:00 PM Legislative Office Building 302 (Continued 3/18/09 11:00 Amendment Legislative Office Building 302 If Needed) "
124678,2009-03-18,"House Retained in Committee "
124678,2009-08-03,"House Retained Bill - Subcommittee Work Session: 8/19/2009 10:00 Amendment Legislative Office Building 302 "
124678,2009-08-19,"House Retained Bill - Subcommittee Work Session: 8/26/2009 10:00 Amendment Legislative Office Building 302 "
124678,2009-08-26,"House Retained Bill - Subcommittee Work Session: 9/9/2009 10:00 Amendment Legislative Office Building 301 "
124678,2009-09-09,"House Retained Bill - Subcommittee Work Session: 9/25/2009 10:00 Amendment Legislative Office Building 302 "
124678,2009-09-30,"House Retained Bill - Subcommittee Work Session: 10/13/2009 10:00 Amendment Legislative Office Building 302 "
124678,2009-10-01,"House Retained Bill - Subcommittee Work Session: 10/20/2009 10:00 Amendment Legislative Office Building 302 "
124678,2009-10-01,"House ==CANCELLED== Retained Bill - Executive Session: 10/28/2009 Legislative Office Building 302 1:00 PM "
124678,2009-10-01,"House =CANCELLED= Retained Bill - Continued Executive Session If Neeeded: 11/3/2009 10:00 Amendment Legislative Office Building 302 "
124678,2009-10-27,"House Retained Bill - Subcommittee Work Session: 11/3/2009 2:00 PM Legislative Office Building 302 "
124678,2009-10-28,"House Retained Bill - Executive Session: 11/12/2009 10:15 Amendment Legislative Office Building 302 ==TIME CHANGE (Orig 10:00AM)== "
124678,2009-11-24,"House Committee Report: Inexpedient to Legislate for Jan 6 Consent Calendar (vote 17-0); House Calendar 2, PG.79 "
124678,2010-01-06,"House Inexpedient to Legislate: Motion Adopted Voice Vote; House Journal  6, PG.251 "
124679,2009-01-08,"House Introduced and Referred to Executive Departments and Administration; House Journal  12, PG.237 "
124679,2009-02-18,"House Public Hearing: 3/3/2009 11:00 Amendment Legislative Office Building 306 "
124679,2009-03-03,"House Subcommittee Work Session: 3/5/2009 8:45 Amendment Legislative Office Building 308 "
124679,2009-03-05,"House Subcommittee Work Session: 3/9/2009 3:00 PM Legislative Office Building 306 "
124679,2009-03-12,"House Subcommittee Work Session: 3/17/2009 10:15 Amendment Legislative Office Building 306 "
124679,2009-03-12,"House Executive Session: 3/18/2009 9:30 Amendment Legislative Office Building 306 "
124679,2009-03-18,"House Retained in Committee "
124679,2009-05-13,"House ==TIME CHANGE==Retained Bill - Subcommittee Work Session: 5/19/2009 11:30 Amendment Legislative Office Building 306 (Orig 11:00 Amendment) "
124679,2009-09-17,"House Retained Bill - Subcommittee Work Session: 9/23/2009 2:00 PM Legislative Office Building 306 "
124679,2009-09-17,"House Retained Bill - Subcommittee Work Session: 9/30/2009 2:00 PM Legislative Office Building 307 ==ROOM CHANGE (Orig Legislative Office Building 306)== "
124679,2009-10-30,"House Retained Bill - Executive Session: 11/19/2009 10:00 Amendment Legislative Office Building 306 "
124679,2009-11-20,"House Committee Report: Inexpedient to Legislate for Jan 6 Regular Calendar (vote 11-6); House Calendar 2, PG.95 "
124679,2010-01-06,"House Special Ordered to Next Session Date in Regular Calendar Order; House Journal  6, PG.310 "
124679,2010-01-13,"House Inexpedient to Legislate: Motion Adopted Voice Vote; House Journal  9, PG.405 "
124680,2009-01-08,"House Introduced and Referred to Environment and Agriculture; House Journal  12, PG.237  "
124680,2009-01-29,"House ===CANCELLED=== Public Hearing: 2/4/2009 5:30 PM Legislative Office Building 307 "
124680,2009-01-29,"House ===CANCELLED=== Public Hearing: 2/6/2009 11:00 Amendment Legislative Office Building 308 "
124680,2009-01-29,"House Public Hearing: 2/11/2009 9:00 Amendment Legislative Office Building 308 "
124680,2009-02-11,"House Subcommittee Work Session: 2/12/2009 2:00 PM Legislative Office Building 305 "
124680,2009-02-11,"House Executive Session: 2/19/2009 9:00 Amendment Legislative Office Building 308 "
124680,2009-02-26,"House Retained in Committee "
124680,2009-04-14,"House Retained Bill - Subcommittee Work Session: 4/22/2009 9:00 Amendment Legislative Office Building 104 "
124680,2009-04-22,"House Retained Bill - Subcommittee Work Session: 4/28/2009 1:00 PM Legislative Office Building 308 "
124680,2009-04-28,"House Retained Bill - Subcommittee Work Session: 5/14/2009 10:00 Amendment Legislative Office Building 308 "
124680,2009-05-14,"House Retained Bill - Subcommittee Work Session: 5/21/2009 2:00 PM Legislative Office Building 307 "
124680,2009-05-21,"House Retained Bill - Subcommittee Work Session: 6/2/2009 10:00 Amendment Legislative Office Building 308 "
124680,2009-06-09,"House Retained Bill - Subcommittee Work Session: 6/30/2009 11:00 Amendment Legislative Office Building 308 "
124680,2009-08-28,"House Retained Bill - Subcommittee Work Session: 9/23/2009 10:00 Amendment Legislative Office Building 307 ==ROOM CHANGE (Orig Legislative Office Building 308)== "
124680,2009-09-23,"House Retained Bill - Subcommittee Work Session: 10/28/2009 1:30 PM Legislative Office Building 308 "
124680,2009-10-27,"House Retained Bill - Executive Session: 11/17/2009 10:00 Amendment Legislative Office Building 307 "
124680,2009-11-19,"House Majority Committee Report: Refer to Interim Study for Jan 6 Regular Calendar (vote 9-8); House Calendar 2, PG.94 "
124680,2009-11-19,"House Minority Committee Report: Inexpedient to Legislate; House Calendar 2, PG.94 "
124680,2010-01-06,"House Special Ordered to Next Session Date in Regular Calendar Order; House Journal  6, PG.310 "
124680,2010-01-13,"House Refer to Interim Study: Motion Adopted Voice Vote; House Journal  9, PG.396 "
124680,2010-03-17,"House Referred to Environment and Agriculture for Interim Study; House Journal  26, PG.1365 "
124680,2010-07-26,"House Interim Study - Full Committee Work Session: 8/10/2010 11:00 Amendment Legislative Office Building 308 "
124680,2010-08-03,"House Interim Study - Full Committee Work Session: 8/17/2010 11:00 Amendment Legislative Office Building 308 "
124680,2010-09-14,"House Interim Study - Full Committee Work Session: 10/5/2010 1:00 PM Legislative Office Building 307 "
124680,2010-09-14,"House Interim Study - Executive Session: 10/19/2010 10:00 Amendment Legislative Office Building 308 "
124681,2009-01-08,"House Introduced and Referred to Judiciary; House Journal  12, PG.237 "
124681,2009-02-03,"House Public Hearing: 2/11/2009 11:00 Amendment Legislative Office Building 208 "
124681,2009-02-17,"House Executive Session: 3/5/2009 11:00 Amendment Legislative Office Building 208 (Continued 3/12/09 10:00 Amendment Legislative Office Building 208 If Needed) "
124681,2009-03-06,"House Retained in Committee "
124681,2009-10-07,"House Retained Bill - Subcommittee Work Session: 10/20/2009 11:30 Amendment Legislative Office Building 208 "
124681,2009-10-21,"House Retained Bill - Executive Session: 11/17/2009 10:00 Amendment Legislative Office Building 208 "
124681,2009-11-20,"House Committee Report: Inexpedient to Legislate for Jan 6 Consent Calendar (vote 19-0); House Calendar 2, PG.84 "
124681,2010-01-06,"House Inexpedient to Legislate: Motion Adopted Voice Vote; House Journal  6, PG.266 "
124682,2009-01-08,"House Introduced and Referred to Commerce and Consumer Affairs; House Journal  12, PG.237 "
124682,2009-02-10,"House Public Hearing: 3/17/2009 11:00 Amendment Legislative Office Building 302 "
124682,2009-02-12,"House ==CANCELLED== Executive Session: 3/19/2009 10:00 Amendment Legislative Office Building 302 "
124682,2009-03-09,"House Executive Session: 3/18/2009 11:00 Amendment Legislative Office Building 302 "
124682,2009-03-18,"House Retained in Committee "
124682,2009-10-01,"House Retained Bill - Executive Session: 10/28/2009 Legislative Office Building 302 1:00 PM or Immediately Following Session "
124682,2009-10-01,"House =CANCELLED= Retained Bill - Continued Executive Session If Neeeded: 11/3/2009 10:00 Amendment Legislative Office Building 302 "
124682,2009-11-03,"House Committee Report: Inexpedient to Legislate for Jan 6 Consent Calendar (vote 16-0); House Calendar 2, PG.80 "
124682,2010-01-06,"House Inexpedient to Legislate: Motion Adopted Voice Vote; House Journal  6, PG.251 "
124683,2009-01-08,"House Introduced and Referred to Resources, Recreation and Development; House Journal  12, PG.237 "
124683,2009-02-11,"House Public Hearing: 2/19/2009 1:30 PM Legislative Office Building 305 "
124683,2009-03-05,"House Executive Session: 3/12/2009 10:30 Amendment Legislative Office Building 305 "
124683,2009-03-18,"House Retained in Committee "
124683,2009-09-14,"House Retained Bill - Full Committee Work Session: 9/22/2009 1:00 PM Legislative Office Building 305 "
124683,2009-09-14,"House Retained Bill - Full Committee Work Session: 9/30/2009 10:00 Amendment Legislative Office Building 305 "
124683,2009-11-02,"House ==CANCELLED== Public Hearing: 11/10/2009 9:30 Amendment Legislative Office Building 305 "
124683,2009-11-02,"House ==CANCELLED== Public Hearing on Proposed Amendment: 11/17/2009 9:30 Amendment Legislative Office Building 305 "
124683,2009-11-09,"House Public Hearing on Proposed Amendment: 11/19/2009 11:30 Amendment Legislative Office Building 305-307 "
124683,2009-11-09,"House Retained Bill - Executive Session: 11/24/2009 9:30 Amendment Legislative Office Building 305 "
124683,2009-11-25,"House Majority Committee Rept: Ought to Pass with Amendment #2010-0005h (NT) for Jan 6 Regular Calendar (vote 14-6); House Calendar2, PG.99 "
124683,2009-11-25,"House Proposed Majority Amendment #2010-0005h (New Title); House Calendar 1, PG.62-63 "
124683,2009-11-25,"House Minority Committee Report: Inexpedient to Legislate; House Calendar 2, PG.99 "
124683,2010-01-06,"House Special Ordered to Next Session Date in Regular Calendar Order; House Journal  6, PG.310 "
124683,2010-01-13,"House Amendment #2010-0005h (New Title) Adopted, Regular Calendar 173-146; House Journal  9, PG.432-434 "
124683,2010-01-13,"House Ought to Pass with Amendment #2010-0005h (New Title): Motion Adopted Division Vote 171-149; House Journal  9, PG.432-435 "
124683,2010-01-13,"House Referred to Ways and Means; House Journal  9, PG.435 "
124683,2010-01-26,"House Public Hearing: 2/2/2010 1:30 PM Legislative Office Building 202 "
124683,2010-02-02,"House Executive Session: 2/11/2010 9:30 Amendment Legislative Office Building 202 "
124683,2010-02-12,"House Committee Report: Ought to Pass for Mar 3 Consent Calendar (Vote 15-2); House Calendar 17, PG.816 "
124683,2010-03-03,"House Ought to Pass: Motion Adopted Voice Vote; House Journal  20, PG.1164 "
124683,2010-03-17,"Senate Introduced and Referred to Energy, Environment and Economic Development, Senate Journal 10, Pg.171 "
124683,2010-03-26,"Senate Hearing: April 1, 2010, Room 102, Legislative Office Building, 9:10 a.m.; Senate Calendar 13 "
124683,2010-04-01,"Senate Committee Report: Ought to Pass 4/7/10; Senate Calendar 14 "
124683,2010-04-07,"Senate Ought to Pass, Motion Adopted, Voice Vote; OT3rdg; Senate Journal 13, Pg.275 "
124683,2010-04-07,"Senate Passed by Third Reading Resolution; Senate Journal 13, Pg.282 "
124683,2010-04-14,"Senate Enrolled; Senate Journal 14, Pg.302 "
124683,2010-04-14,"House Enrolled; House Journal  32, PG.1587 "
124683,2010-05-10,"House Signed By the Governor 05/07/2010; Chapter 0016 "
124683,2010-05-10,"House I. Section 3, 5, 7 Effective 07/01/12 "
124683,2010-05-10,"House II. Section 1 Effective 07/01/2010 at 12:01 a.m. "
124683,2010-05-10,"House III. Remainder Effective 07/01/2010 "
124684,2009-01-08,"House Introduced and Referred to Judiciary; House Journal  12, PG.237  "
124684,2009-01-27,"House ===CANCELLED=== Public Hearing: 2/10/2009 11:00 Amendment Legislative Office Building 208 "
124684,2009-01-27,"House Public Hearing: 2/4/2009 2:00 PM Legislative Office Building 208 "
124684,2009-02-03,"House Executive Session: 2/17/2009 10:00 Amendment Legislative Office Building 208 "
124684,2009-02-18,"House Majority Committee Report: Ought to Pass for Mar 4 Regular Calendar (vote 12-8); House Calendar 16, PG.377 "
124684,2009-02-18,"House Minority Committee Report: Inexpedient to Legislate; House Calendar 16, PG.377 "
124684,2009-03-04,"House Ought to Pass: Motion Adopted Division Vote 202-168; House Journal  21, PG.617-618 "
124684,2009-03-04,"House Referred to Finance; House Journal  21, PG.618 "
124684,2009-03-05,"House ==TIME CHANGE== Division I Work Session: 3/18/2009 1:30 PM Legislative Office Building 212 (Orig 2:00 PM) "
124684,2009-03-18,"House Division I Work Session: 3/30/2009 9:30 Amendment Legislative Office Building 212 "
124684,2009-03-19,"House Executive Session: 3/31/2009 10:00 Amendment Legislative Office Building 210-211 "
124684,2009-03-31,"House Retained in Committee "
124684,2009-08-19,"House Retained Bill - Division I Work Session: 9/29/2009 2:30 PM Legislative Office Building 212 ==TIME CHANGE (Orig 1:00 PM)== "
124684,2009-09-30,"House Retained Bill - Executive Session: 10/28/2009 Legislative Office Building 210-211 1:00 PM or Immediately Following Session "
124684,2009-11-12,"House Committee Report: Inexpedient to Legislate for Jan 6 Regular Calendar (vote 14-4); House Calendar 2, PG.95 "
124684,2010-01-06,"House Special Ordered to Next Session Date in Regular Calendar Order; House Journal  6, PG.310 "
124684,2010-01-13,"House Inexpedient to Legislate: Motion Adopted Voice Vote; House Journal  9, PG.405 "
124685,2009-01-08,"House Introduced and Referred to Commerce and Consumer Affairs; House Journal  12, PG.238 "
124685,2009-02-04,"House Vacated from Commerce & Consumer Affairs and Referred to Judiciary; House Journal  13, PG.240 "
124685,2009-02-04,"House Public Hearing: 3/3/2009 2:00 PM Legislative Office Building 208 "
124685,2009-03-04,"House Executive Session: 3/9/2009 11:00 Amendment Legislative Office Building 208 "
124685,2009-03-19,"House Majority Committee Report: Ought to Pass for Mar 24 Regular Calendar (vote 8-5); House Calendar 22, PG.686 "
124685,2009-03-19,"House Minority Committee Report: Inexpedient to Legislate; House Calendar 22, PG.686 "
124685,2009-03-24,"House Special Ordered to Mar 25 Without Objection; House Journal  25, PG.914 "
124685,2009-03-25,"House Ought to Pass: Motion Adopted Regular Calendar 172-152; House Journal  27, PG.1127-1129 "
124685,2009-03-25,"House Reconsideration (Rep Levesque): Motion Failed Division Vote 138-180; House Journal  27, PG.1129 "
124685,2009-04-08,"Senate Introduced and Referred to Judiciary "
124685,2009-05-14,"Senate Hearing; === Time Change === May 26, 2009, Room 103, State House, 3:15 p.m.; Senate Calendar 25 "
124685,2009-05-28,"Senate Committee Report; Rereferred to Committee [06/03/09]; Senate Calendar 26 "
124685,2009-06-03,"Senate Without Objection, Chair moved to Special-Order HB 686 to the front of the Calendar; Senate Journal 18, Pg.398 "
124685,2009-06-03,"Senate Rereferred to Committee, Motion Adopted, Voice Vote; Senate Journal 18, Pg.505 "
124685,2010-01-20,"Senate Committee Report; Inexpedient to Legislate 1/27/10; Senate Calendar 4 "
124685,2010-01-27,"Senate Inexpedient to Legislate, Motion Adopted, Voice Vote === BILL KILLED ===; Senate Journal 4, Pg.52 "
124686,2009-01-08,"House Introduced and Referred to Education; House Journal  12, PG.238  "
124686,2009-01-27,"House ==ROOM CHANGE== Public Hearing: 2/5/2009 1:30 PM Legislative Office Building 302 (Orig Legislative Office Building 207) "
124686,2009-01-29,"House Executive Session: 2/10/2009 1:00 PM Legislative Office Building 207 "
124686,2009-02-10,"House Majority Committee Report: Ought to Pass with Amendment #0250h for Feb 18 Regular Calendar (vote 18-2); House Calendar 14, PG.271-272 "
124686,2009-02-10,"House Proposed Majority Committee Amendment #0250h; House Calendar 14, PG.305-306 "
124686,2009-02-10,"House Minority Committee Report: Inexpedient to Legislate; House Calendar 14, PG.271-272 "
124686,2009-02-18,"House Amendment #0250h Adopted, Voice Vote; House Journal  18, PG.480-481 "
124686,2009-02-18,"House Ought to Pass with Amendment #0250h: Motion Adopted Voice Vote; House Journal  18, PG.480-481 "
124686,2009-02-18,"House Referred to Finance; House Journal  18, PG.481 "
124686,2009-02-25,"House Division II Work Session: 3/5/2009 2:00 PM Legislative Office Building 210-211 "
124686,2009-02-25,"House Executive Session: 3/13/2009 10:00 Amendment Legislative Office Building 210-211 "
124686,2009-03-31,"House Retained in Committee "
124686,2009-08-21,"House Retained Bill - Division II Subcommittee Work Session: 9/29/2009 1:00 PM Legislative Office Building 210-211 "
124686,2009-09-30,"House Retained Bill - Executive Session: 10/28/2009 Legislative Office Building 210-211 1:00 PM or Immediately Following Session "
124686,2009-11-13,"House Committee Report: Inexpedient to Legislate for Jan 6 Consent Calendar (vote 16-3); House Calendar 2, PG.82 "
124686,2010-01-06,"House Inexpedient to Legislate: Motion Adopted Voice Vote; House Journal  6, PG.262 "
124687,2009-01-08,"House Introduced and Referred to Ways and Means; House Journal  12, PG.238 "
124687,2009-02-04,"House Public Hearing: 2/11/2009 1:00 PM Legislative Office Building 202 "
124687,2009-03-03,"House Subcommittee Work Session: 3/13/2009 11:15 Amendment Legislative Office Building 202 "
124687,2009-03-11,"House ===CANCELLED=== Work Session: 3/18/2009 3:30 PM Legislative Office Building 202 "
124687,2009-03-16,"House Full Committee Work Session: 3/17/2009 1:30 PM Legislative Office Building 202 "
124687,2009-03-16,"House Executive Session: 3/18/2009 9:00 Amendment Legislative Office Building 202 (Continued 3/19/09 9:00 Amendment Legislative Office Building 202 If Needed) "
124687,2009-03-19,"House Retained in Committee "
124687,2009-10-07,"House Retained Bill - Executive Session: 10/28/2009 Legislative Office Building 202 1:30 PM or Immediately Following Session "
124687,2009-11-05,"House Committee Report: Inexpedient to Legislate for Jan 6 Consent Calendar (vote 18-0); House Calendar 2, PG.87 "
124687,2010-01-06,"House Inexpedient to Legislate: Motion Adopted Voice Vote; House Journal  6, PG.271 "
124688,2009-01-08,"House Late Draft and Intro Approved by Rules Comm: Ref to Health, Human Svcs & Elderly Affairs; House Journal 12 PG238 "
124688,2009-02-04,"House Public Hearing: 2/11/2009 2:00 PM Legislative Office Building 205 "
124688,2009-03-04,"House Subcommittee Work Session: 3/9/2009 2:30 PM Legislative Office Building 205 "
124688,2009-03-04,"House Executive Session: 3/18/2009 9:30 Amendment Legislative Office Building 205 "
124688,2009-03-18,"House Retained in Committee "
124688,2009-10-12,"House Retained Bill - Subcommittee Work Session: 10/21/2009 1:15 PM Legislative Office Building 307 "
124688,2009-10-13,"House Retained Bill - Subcommittee Work Session: 10/29/2009 3:00 PM Legislative Office Building 205 "
124688,2009-10-14,"House Retained Bill - Subcommittee work session 11/10/2009 9:00 Amendment Legislative Office Building 205 "
124688,2009-10-14,"House Retained Bill - Subcommittee Work Session: 11/10/2009 10:00 Amendment Legislative Office Building 205 "
124688,2009-10-15,"House Retained Bill - Executive Session: 11/10/2009 1:00 PM Legislative Office Building 205 "
124688,2009-11-12,"House Committee Report: Refer to Interim Study for Jan 6 Consent Calendar (vote 15-0); House Calendar 2, PG.83 "
124688,2010-01-06,"House Refer to Interim Study: Motion Adopted Voice Vote; House Journal  6, PG.263 "
124688,2010-03-17,"House Referred to Health, Human Services and Elderly Affairs for Interim Study; House Journal  26, PG.1365 "
124688,2010-07-22,"House Interim Study - Subcommittee Work Session: 9/1/2010 10:30 Amendment Legislative Office Building 205 "
124688,2010-09-01,"House Interim Study - Subcommittee Work Session: 9/16/2010 10:30 Amendment Legislative Office Building 305 "
124688,2010-09-07,"House Interim Study - Executive Session: 10/26/2010 10:00 Amendment Legislative Office Building 205 "
124689,2010-01-06,"House Introduced and Referred to Municipal and County Government; House Journal  6, PG.229 "
124689,2010-01-06,"House Public Hearing: 1/7/2010 11:30 Amendment Legislative Office Building 301==RECESSED== "
124689,2010-01-12,"House ==CANCELLED== Executive Session: 1/20/2010 10:00 Amendment Legislative Office Building 301 "
124689,2010-01-13,"House ==RESCHEDULED== Public Hearing: 1/26/2010 10:30 Amendment Legislative Office Building 301 "
124689,2010-01-26,"House Executive Session: 2/4/2010 10:30 Amendment Legislative Office Building 301 "
124689,2010-02-18,"House Majority Committee Report: Inexpedient to Legislate for Mar 10 (Vote 11-6; Regular Calendar); House Calendar 19, PG.1035-1036 "
124689,2010-02-18,"House Minority Committee Report: Ought to Pass; House Calendar 19, PG.1035-1036 "
124689,2010-03-10,"House Special Order to Regular Place on Mar 11 Calendar, Without Objection; House Journal  23, PG.1294 "
124689,2010-03-11,"House Special Order to Beginning of Mar 17 Calendar, Without Objection; House Journal  24, PG.1349 "
124689,2010-03-17,"House Inexpedient to Legislate: Motion Adopted Division Vote 175-153; House Journal  26, PG.1369 "
124690,2010-01-06,"House Introduced and Referred to Judiciary; House Journal  6, PG.229 "
124690,2010-01-06,"House Public Hearing: 1/7/2010 1:30 PM Legislative Office Building 208 "
124690,2010-01-26,"House Executive Session: 2/2/2010 10:00 Amendment Legislative Office Building 208 "
124690,2010-02-03,"House Committee Report: Ought to Pass for Feb 10 Consent Calendar (vote 17-0); House Calendar 13, PG.529 "
124690,2010-02-10,"House Removed from Consent Calendar (Rep Vaillancourt); House Journal  16, PG.748 "
124690,2010-02-10,"House Special Ordered to Regular Place in Feb 17 Consent Calendar: Motion Adopted Without Objection; House Journal  16, PG.783 "
124690,2010-02-17,"House Ought to Pass: Motion Adopted Voice Vote; House Journal  18, PG.960 "
124690,2010-03-24,"Senate Introduced and Referred to Judiciary; Senate Journal 11, Pg.260 "
124690,2010-04-15,"Senate Hearing: April 27, 2010, Room 103, State House, 3:30 p.m.; Senate Calendar 16 "
124690,2010-04-29,"Senate Committee Report: Inexpedient to Legislate, 5/5/10; Senate Calendar 18 "
124690,2010-05-05,"Senate Inexpedient to Legislate, Motion Adopted, Voice Vote === BILL KILLED === Senate Journal 17, Pg.389 "
124691,2009-12-10,"House Introduced 1/6/2010 and Referred to Finance; House Journal  6, PG.229 "
124691,2010-01-05,"House Public Hearing: 1/19/2010 10:30 Amendment Legislative Office Building 210-211 "
124691,2010-01-05,"House Full Committee Work Session: 1/20/2010 10:00 Amendment Legislative Office Building 210-211 "
124691,2010-01-05,"House Executive Session: 1/26/2010 10:00 Amendment Legislative Office Building 210-211 "
124691,2010-01-27,"House Committee Report: Inexpedient to Legislate for Feb 3 Regular Calendar (vote 11-8); House Calendar 11, PG.469 "
124691,2010-02-03,"House Inexpedient to Legislate: Motion Failed Regular Calendar 174-184; House Journal  15, PG.688-690 "
124691,2010-02-03,"House Ought to Pass (Rep Kurk): Motion Adopted Regular Calendar 189-169; House Journal  15, PG.690-692 "
124691,2010-02-03,"House Reconsideration (Rep Kurk): Motion Failed Regular Calendar 162-198; House Journal  15, PG.692-694 "
124691,2010-03-10,"Senate Introduced and Referred to Finance "
124691,2010-03-25,"Senate Hearing: April 1, 2010, Room 100, State House, 10:30 a.m.; Senate Calendar 13 "
124691,2010-05-06,"Senate Committee Report: Ought to Pass, 5/12/10; Senate Calendar 19 "
124691,2010-05-12,"Senate Without Objection, Chair moved to Special Order to the end of the Calendar; Senate Journal 18, Pg.413 "
124691,2010-05-12,"Senate Committee Report: Ought to Pass, 5/12/10 "
124691,2010-05-12,"Senate Without Objection, Chair moved to Special Order to 5/13/10; Senate Journal 18, Pg.496 "
124691,2010-05-12,"Senate Committee Report: Ought to Pass, 5/13/10 "
124691,2010-05-13,"Senate Without Objection, Chair moved to Special Order to end of calendar; Senate Journal 19, Pg.520 "
124691,2010-05-13,"Senate Committee Report: Ought to Pass, 5/13/10 "
124691,2010-05-13,"Senate Sen. DAllesandro Floor Amendment 2077s, New Title, Regular Calendar 14Y-10N, Amendment Adopted; Senate Journal 19, Pg.552 "
124691,2010-05-13,"Senate Sen. Sgambati Floor Amendment 2089s, New Title, Regular Calendar 14Y-10N, Amendment Adopted; Senate Journal 19, Pg.616 "
124691,2010-05-13,"Senate Ought to Pass with Amendment 2077s, New Title, 2089s, New Title, Regular Calendar 13Y-11N, Motion Adopted; OT3rdg; Senate Journal 19, Pg.616 "
124691,2010-05-13,"Senate Passed by Third Reading Resolution; Senate Journal 19, Pg.633 "
124691,2010-05-19,"House Shall Rule of Chair Be Upheld (Rep W.O'Brien): Motion Adopted Regular Calendar 209-147; House Journal  46, PG.2205-2207 "
124691,2010-05-19,"House Special Order Until 3:00 PM (Rep Packard): Motion Failed Regular Calendar 166-190; House Journal  46, PG.2205 & 2207-2209 "
124691,2010-05-19,"House Lay on the Table (Rep Hess): Motion Failed Regular Calendar 160-198; House Journal  46, PG.2209-2211 "
124691,2010-05-19,"House Recess Until 2:00 PM (Rep W.O'Brien): Motion Failed Regular Calendar 167-191; House Journal  46, PG.2211-2213 "
124691,2010-05-19,"House Move Previous Question (Rep Campbell): Motion Adopted Regular Calendar 200-157; House Journal  46, PG.2213-2215 "
124691,2010-05-19,"House Shall Rule of Chair Be Upheld (Rep Vaillancourt): Motion Adopted Regular Calendar 192-157; House Journal  46, PG.2215-2217 "
124691,2010-05-19,"House House Non-Concurs Unless Senate Accedes to Request for Comm of Conf on SB 450 by 3 PM (Rep M.Smith): "
124691,2010-05-19,"House Motion Adopted Regular Calendar 181-169; House Journal  46, PG.2218-2220 "
124691,2010-05-19,"House Reconsideration (Rep Eaton); House Journal  46, PG.2220 "
124691,2010-05-19,"House Lay on the Table (Rep W.O'Brien): Motion Failed Regular Calendar 147-187; House Journal  46, PG.2220-2222 "
124691,2010-05-19,"House Reconsideration (Rep Eaton): Motion Failed Regular Calendar 158-179; House Journal  46, PG.2222-2224 "
124691,2010-05-19,"House House Non-Concurs and Requests Comm of Conf (Rep M.Smith); House Journal  46, PG.2205-2224 "
124691,2010-05-19,"House Speaker Appoints: Reps M.Smith, Eaton, Nordgren, Kurk & Foster; House Journal  46, PG.2235 "
124691,2010-05-19,"House Speaker Appoints Alternates: Reps Foose & W.D.Scamman; House Journal  46, PG.2235 "
124691,2010-05-19,"Senate Sen. D'Allesandro accedes to House Request for Committee of Conference, Motion Adopted, Voice Vote; Senate Journal 20, Pg.655 "
124691,2010-05-19,"Senate President Appoints: Senators D'Allesandro, Sgambati, Janeway and Gallus; Senate Journal 20, Pg.655 "
124691,2010-05-19,"Senate President Appoints Alternates: Senators Hassan, Larsen and Odell; Senate Journal 20, Pg.655 "
124691,2010-05-20,"House Speaker Appoints Alternate: Rep Almy; House Journal  46, PG.2245 "
124691,2010-05-20,"House Speaker Appoints Alternate: Rep Wallner; House Journal  46, PG.2245 "
124691,2010-05-20,"House Committee of Conference Meeting: 5/24/2010 10:00 Amendment Legislative Office Building 210-211 ==Recessed Until 3:00 PM== RECESSED "
124691,2010-05-25,"House ==Reconvene== Conference Committee Meeting: 5/25/2010 10:00 Amendment Legislative Office Building 210-211 ==Recessed== "
124692,2009-12-10,"House Introduced 1/6/2010 and Referred to Fish and Game and Marine Resources; House Journal  6, PG.229  "
124692,2009-12-22,"House Public Hearing: 1/14/2010 10:30 Amendment Legislative Office Building 307 "
124692,2010-01-06,"House Executive Session: 1/19/2010 1:00 PM Legislative Office Building 307 "
124692,2010-01-20,"House Committee Report: Ought to Pass for Jan 27 Consent Calendar (vote 13-0); House Calendar 8, PG.332 "
124692,2010-01-27,"House Ought to Pass: Motion Adopted Voice Vote; House Journal  12, PG.501 "
124692,2010-01-27,"House Referred to Ways and Means; House Journal  12, PG.501 "
124692,2010-02-02,"House Public Hearing: 2/9/2010 10:00 Amendment Legislative Office Building 202 "
124692,2010-03-10,"House Executive Session: 3/16/2010 10:00 Amendment Legislative Office Building 202 (Continued 3/17/10 9:00 Amendment Legislative Office Building 202 If Necessary) "
124692,2010-03-18,"House Committee Report: Ought to Pass for March 24 (Vote 18-0; Consent Calendar); House Calendar 22, PG.1220 "
124692,2010-03-24,"House Ought to Pass: Motion Adopted Voice Vote; House Journal  30, PG.1477 "
124692,2010-03-24,"Senate Introduced and Referred to Wildlife, Fish and Game & Agriculture; Senate Journal 11, Pg.260 "
124692,2010-03-31,"Senate Hearing: April 6, 2010, Room 103, Legislative Office Building, 2:00 p.m.; Senate Calendar 14 "
124692,2010-04-07,"Senate Committee Report: Ought to Pass 4/14/10; Senate Calendar 15 "
124692,2010-04-14,"Senate Ought to Pass, Motion Adopted, Voice Vote; OT3rdg; Senate Journal 14, Pg.294 "
124692,2010-04-14,"Senate Passed by Third Reading Resolution; Senate Journal 14, Pg.295 "
124692,2010-04-21,"Senate Enrolled "
124692,2010-04-21,"House Enrolled; House Journal  35, PG.1671 "
124692,2010-05-10,"House Signed By the Governor 05/07/2010; Effective 07/06/2010; Chapter 0017 "
124693,2010-01-06,"House Introduced and Referred to Judiciary; House Journal  6, PG.230 "
124693,2010-01-06,"House Public Hearing: 1/12/2010 1:00 PM Legislative Office Building 208 "
124693,2010-01-26,"House Executive Session: 2/2/2010 10:00 Amendment Legislative Office Building 208 "
124693,2010-02-03,"House Committee Report: Inexpedient to Legislate for Feb 10 Consent Calendar (vote 17-1); House Calendar 13, PG.529 "
124693,2010-02-10,"House Removed from Consent Calendar (Rep Vaillancourt); House Journal  16, PG.748 "
124693,2010-02-10,"House Special Ordered to Regular Place in Feb 17 Consent Calendar: Motion Adopted Without Objection; House Journal  16, PG.783 "
124693,2010-02-17,"House Inexpedient to Legislate: Motion Adopted Voice Vote; House Journal  18, PG.960 "
124694,2010-01-06,"House Introduced and Referred to Criminal Justice and Public Safety; House Journal  6, PG.230 "
124694,2010-01-06,"House Public Hearing: 1/7/2010 1:30 PM Legislative Office Building 204 "
124694,2010-01-13,"House Subcommittee Work Session: 1/21/2010 9:30 Amendment Legislative Office Building 204 "
124694,2010-01-21,"House Subcom Work Sess: 2/2/2010 9:30 Amendment Legislative Office Building 204 (Members: Reps Welch(Ch), Pantelakos, Charron & Chandley) "
124694,2010-02-03,"House Executive Session: 2/9/2010 10:00 Amendment Legislative Office Building 204 "
124694,2010-02-09,"House Committee Report: Ought to Pass for Feb 17 Consent Calendar (Vote 17-0); House Calendar 14, PG.581 "
124694,2010-02-17,"House Ought to Pass: Motion Adopted Voice Vote; House Journal  18, PG.933 "
124694,2010-02-17,"Senate Introduced and Referred to Executive Departments and Administration; Senate Journal 7, Pg.93 "
124694,2010-02-18,"Senate Hearing: March 2, 2010, Room 101, Legislative Office Building, 2:30 p.m.; Senate Calendar 8 "
124694,2010-03-03,"Senate Committee Report: Ought to Pass 3/10/10; Senate Calendar 10 "
124694,2010-03-10,"Senate Ought to Pass, Motion Adopted, Voice Vote; OT3rdg; Senate Journal 9, Pg.137 "
124694,2010-03-10,"Senate Passed by Third Reading Resolution; Senate Journal 9, Pg.151 "
124694,2010-03-10,"Senate Enrolled; Senate Journal 9, Pg.157 "
124694,2010-03-17,"House Enrolled; House Journal  26, PG.1391 "
124694,2010-03-29,"House Signed by the Governor 03/25/2010; Effective 05/24/2010; Chapter 0003 "
124695,2010-01-06,"House Introduced and Referred to Judiciary; House Journal  6, PG.230 "
124695,2010-01-06,"House Public Hearing: 1/12/2010 1:30 PM Legislative Office Building 208 "
124695,2010-01-26,"House Executive Session: 2/2/2010 10:00 Amendment Legislative Office Building 208 "
124695,2010-02-10,"House Committee Report: Inexpedient to Legislate for Feb 17 Consent Calendar (vote 16-2); House Calendar 14, PG.591 "
124695,2010-02-17,"House Inexpedient to Legislate: Motion Adopted Voice Vote; House Journal  18, PG.960 "
124696,2009-12-10,"House Introduced 1/6/2010 and Referred to Judiciary; House Journal  6, PG.230 "
124696,2010-01-15,"House Public Hearing: 1/28/2010 10:30 Amendment Legislative Office Building 208 "
124696,2010-02-09,"House Executive Session: 2/16/2010 10:00 Amendment Legislative Office Building 208 (Continued 2/18/2010 10:00 Amendment Legislative Office Building 208 If Necessary) "
124696,2010-02-18,"House Committee Report: Ought to Pass for March 3 Consent Calendar (vote 13-1); House Calendar 17, PG.804 "
124696,2010-03-03,"House Ought to Pass: Motion Adopted Voice Vote; House Journal  20, PG.1145 "
124696,2010-03-24,"Senate Introduced and Referred to Judiciary; Senate Journal 11, Pg.260 "
124696,2010-04-19,"Senate Hearing: May 4, 2010, Room 103, State House, 2:00 p.m.; Senate Calendar 17 "
124696,2010-05-06,"Senate Committee Report: Ought to Pass with Amendment 1946s, New Title, 5/12/10; Senate Calendar 19 "
124696,2010-05-12,"Senate Committee Amendment 1946s, New Title, Amendment Adopted, Voice Vote; Senate Journal 18, Pg.467 "
124696,2010-05-12,"Senate Sen. Houde Floor Amendment 2031s, New Title, Amendment Adopted, Voice Vote; Senate Journal 18, Pg.467 "
124696,2010-05-12,"Senate Ought to Pass with Amendments 1946s, New Title, 2031s, New Title, Motion Adopted, Voice Vote; OT3rdg; Senate Journal 18, Pg.467 "
124696,2010-05-12,"Senate Passed by Third Reading Resolution; Senate Journal 18, Pg.496 "
124696,2010-05-19,"House House Concurs with Senate Amendment #1946s(NT) & #2031s(NT) (Rep Cote): Motion Adopted Voice Vote; House Journal  46, PG.2226 "
124696,2010-06-02,"House Enrolled "
124696,2010-06-02,"Senate Enrolled "
124696,2010-07-15,"House Signed by the Governor 07/13/2010; Effective 09/11/2010; Chapter 0293 "
124697,2010-01-06,"House Introduced and Referred to Criminal Justice and Public Safety; House Journal  6, PG.230 "
124697,2010-01-06,"House Public Hearing: 1/14/2010 2:00 PM Legislative Office Building 204 "
124697,2010-02-03,"House Subcommittee Work Session: 2/11/2010 9:00 Amendment Legislative Office Building 204 "
124697,2010-02-03,"House Subcommittee Members: Reps Pantelakos(Ch), Stevens & Movsesian "
124697,2010-02-03,"House =Cancelled= Executive Session: 2/11/2010 10:00 Amendment Legislative Office Building 204 "
124697,2010-02-10,"House Executive Session: 2/16/2010 10:00 Amendment Legislative Office Building 204 "
124697,2010-02-16,"House Committee Report: Ought to Pass with Amendment #0687h (NT) for Mar 3 Consent Calendar (Vote 14-1); House Calendar 17, PG.797 "
124697,2010-02-16,"House Proposed Committee Amendment #0687h (New Title); House Calendar 17, PG.834-835 "
124697,2010-03-03,"House Amendment #0687h (New Title) Adopted, Voice Vote; House Journal  20, PG.1129 "
124697,2010-03-03,"House Ought to Pass with Amendment #0687h (New Title): Motion Adopted Voice Vote; House Journal  20, PG.1129 "
124697,2010-03-24,"Senate Introduced and Referred to Judiciary; Senate Journal 11, Pg.260 "
124697,2010-04-19,"Senate Hearing: May 4, 2010, Room 103, State House, 2:15 p.m.; Senate Calendar 17 "
124697,2010-05-05,"Senate Committee Report: Inexpedient to Legislate, 5/12/10; Senate Calendar 19 "
124697,2010-05-12,"Senate Inexpedient to Legislate, Motion Adopted, Voice Vote === BILL KILLED === Senate Journal 18, Pg.467 "
124698,2010-01-06,"House Introduced and Referred to Criminal Justice and Public Safety; House Journal  6, PG.230 "
124698,2010-01-06,"House Public Hearing: 1/7/2010 1:00 PM Legislative Office Building 204 "
124698,2010-01-26,"House Executive Session: 2/2/2010 10:00 Amendment Legislative Office Building 204 (Continued 2/2/2010 1:30 PM Legislative Office Building 204 if Necessary) "
124698,2010-02-03,"House Committee Report: Inexpedient to Legislate for Feb 10 Consent Calendar (vote 18-0); House Calendar 13, PG.522 "
124698,2010-02-10,"House Removed from Consent Calendar (Rep Vaillancourt); House Journal  16, PG.748 "
124698,2010-02-10,"House Special Ordered to Regular Place in Feb 17 Consent Calendar: Motion Adopted Without Objection; House Journal  16, PG.783 "
124698,2010-02-17,"House Inexpedient to Legislate: Motion Adopted Voice Vote; House Journal  18, PG.933 "
124699,2009-12-10,"House Introduced 1/6/2010 and Referred to Health, Human Services and Elderly Affairs; House Journal  6, PG.230 "
124699,2010-01-07,"House Public Hearing: 1/26/2010 11:15 Amendment Legislative Office Building 205 "
124699,2010-01-27,"House Subcommittee Work Session: 2/1/2010 10:00 Amendment Legislative Office Building 205 "
124699,2010-01-28,"House ==CANCELLED== Executive Session: 2/9/2010 1:45 PM Legislative Office Building 205 "
124699,2010-02-01,"House Subcommittee Work Session: 2/11/2010 9:00 Amendment Legislative Office Building 205 "
124699,2010-02-03,"House Executive Session: 2/16/2010 10:00 Amendment Legislative Office Building 205 "
124699,2010-02-16,"House Committee Report: Ought to Pass with Amendment #0715h for Mar 3 Consent Calendar (Vote 19-0); House Calendar 17, PG.802 "
124699,2010-02-16,"House Proposed Committee Amendment #0715h; House Calendar 17, PG.835 "
124699,2010-03-03,"House Amendment #0715h Adopted, Voice Vote; House Journal  20, PG.1139-1140 "
124699,2010-03-03,"House Ought to Pass with Amendment #0715h: Motion Adopted Voice Vote; House Journal  20, PG.1139-1140 "
124699,2010-03-24,"Senate Introduced and Referred to Health and Human Services; Senate Journal 11, Pg.260 "
124699,2010-03-31,"Senate Hearing: April 13, 2010, Room 103, State House, 8:30 a.m.; Senate Calendar 14 "
124699,2010-04-13,"Senate Committee Report: Ought to Pass 4/21/10; Senate Calendar 16 "
124699,2010-04-21,"Senate Ought to Pass, Motion Adopted, Voice Vote; OT3rdg "
124699,2010-04-21,"Senate Passed by Third Reading Resolution "
124699,2010-05-05,"Senate Enrolled "
124699,2010-05-05,"House Enrolled; House Journal  38, PG.1914 "
124699,2010-05-24,"House Signed by the Governor 05/18/2010; Effective 05/18/2010; Chapter 0046 "
124700,2009-12-10,"House Introduced 1/6/2010 and Referred to Labor, Industrial and Rehabilitative Services; House Journal  6, PG.230 "
124700,2009-12-22,"House Public Hearing: 1/7/2010 10:00 Amendment Legislative Office Building 307 "
124700,2010-01-27,"House Subcommittee Work Session: 2/4/2010 10:00 Amendment Legislative Office Building 307 "
124700,2010-02-02,"House Executive Session: 2/9/2010 9:30 Amendment Legislative Office Building 307 "
124700,2010-02-10,"House Committee Report: Ought to Pass with Amendment #0519h for Feb 17 Consent Calendar (Vote 17-0); House Calendar 14, PG.592 "
124700,2010-02-10,"House Proposed Committee Amendment #0519h; House Calendar 14, PG.619 "
124700,2010-02-17,"House Amendment #0519h Adopted, Voice Vote; House Journal  18, PG.962 "
124700,2010-02-17,"House Ought to Pass with Amendment #0519h: Motion Adopted Voice Vote; House Journal  18, PG.962 "
124700,2010-03-03,"Senate Introduced and Referred to Commerce, Labor and Consumer Protection "
124700,2010-04-06,"Senate Hearing: April 13, 2010, Room 102, Legislative Office Building, 9:15 a.m.; Senate Calendar 15 "
124700,2010-05-11,"Senate Committee Report: Inexpedient to Legislate, 5/12/10; Senate Calendar 19A "
124700,2010-05-12,"Senate Inexpedient to Legislate, Division 6Y-18N, Motion Failed "
124700,2010-05-12,"Senate Sen. Bragdon moved Ought to Pass "
124700,2010-05-12,"Senate Ought to Pass, Motion Adopted, Voice Vote; OT3rdg "
124700,2010-05-12,"Senate Passed by Third Reading Resolution "
124700,2010-05-19,"Senate Enrolled "
124700,2010-05-19,"House Enrolled "
124700,2010-06-16,"House Signed by the Governor 06/14/2010; Effective 08/13/2010; Chapter 0133 "
124701,2009-12-10,"House Introduced 1/6/2010 and Referred to Local and Regulated Revenues; House Journal  6, PG.230 "
124701,2010-01-12,"House Public Hearing: 1/20/2010 10:00 Amendment Legislative Office Building 303 "
124701,2010-02-03,"House Executive Session: 2/9/2010 1:00 PM Legislative Office Building 303 (Continued 2/11/2010 10:00 Amendment Legislative Office Building 303 If Necessary) "
124701,2010-02-16,"House Committee Report: Ought to Pass for Mar 10 (Vote 17-1; Regular Calendar); House Calendar 19, PG.1034 "
124701,2010-03-10,"House Ought to Pass: Motion Adopted Voice Vote; House Journal  23, PG.1292 "
124701,2010-03-24,"Senate Introduced and Referred to Public and Municipal Affairs; Senate Journal 11, Pg.260 "
124701,2010-04-08,"Senate Hearing: April 15, 2010, Room 103, Legislative Office Building, 8:45 a.m.; Senate Calendar 15 "
124701,2010-04-15,"Senate Committee Report: Ought to Pass 4/21/10; Senate Calendar 16 "
124701,2010-04-21,"Senate Without Objection, Chair moved to Special Order to 04/28/10 "
124701,2010-04-21,"Senate Committee Report: Ought to Pass 4/28/10 "
124701,2010-04-28,"Senate Ought to Pass, Motion Adopted, Voice Vote; OT3rdg "
124701,2010-04-28,"Senate Passed by Third Reading Resolution "
124701,2010-05-12,"House Enrolled; House Journal  41, PG.2097 "
124701,2010-05-12,"Senate Enrolled "
124701,2010-05-26,"House Signed by the Governor 05/25/2010; Effective 07/24/2010; Chapter 0085 "
124702,2009-12-10,"House Introduced 1/6/2010 and Referred to Executive Departments and Administration; House Journal  6, PG.230 "
124702,2010-01-20,"House Public Hearing: 1/27/2010 10:00 Amendment Legislative Office Building 306 "
124702,2010-01-27,"House Subcommittee Work Session: 2/2/2010 9:00 Amendment Legislative Office Building 308 "
124702,2010-02-02,"House Subcommittee Work Session: 2/9/2010 9:00 Amendment Legislative Office Building 306 "
124702,2010-02-04,"House Executive Session: 2/9/2010 10:30 Amendment Legislative Office Building 306 "
124702,2010-02-09,"House Committee Report: Ought to Pass with Amendment #0491h for Feb 17 Consent Calendar (Vote 17-0); House Calendar 14, PG.586 "
124702,2010-02-09,"House Proposed Committee Amendment #0491h; House Calendar 14, PG.619-620 "
124702,2010-02-17,"House Amendment #0491h Adopted, Voice Vote; House Journal  18, PG.952 "
124702,2010-02-17,"House Ought to Pass with Amendment #0491h: Motion Adopted Voice Vote; House Journal  18, PG.952 "
124702,2010-03-03,"Senate Introduced and Referred to Executive Departments and Administration "
124702,2010-03-19,"Senate Hearing: March 30, 2010, Room 101, Legislative Office Building, 2:45 p.m.; Senate Calendar 12A "
124702,2010-03-31,"Senate Committee Report: Ought to Pass 4/7/10; Senate Calendar 14 "
124702,2010-04-07,"Senate Ought to Pass, Motion Adopted, Voice Vote; OT3rdg; Senate Journal 13, Pg.276 "
124702,2010-04-07,"Senate Passed by Third Reading Resolution; Senate Journal 13, Pg.282 "
124702,2010-04-14,"House Enrolled Bill Amendment #1414 Adopted; House Journal  32, PG.1589 "
124702,2010-04-14,"Senate Enrolled Bill Amendment #1414, Adopted "
124702,2010-04-21,"Senate Enrolled "
124702,2010-04-21,"House Enrolled; House Journal  35, PG.1671 "
124702,2010-05-24,"House Signed by the Governor 05/19/2010; Effective 07/18/2010; Chapter 0068 "
124703,2009-12-10,"House Introduced 1/6/2010 and Referred to Health, Human Services and Elderly Affairs; House Journal  6, PG.230 "
124703,2010-01-06,"House Public Hearing: 1/27/2010 9:30 Amendment Legislative Office Building 205 "
124703,2010-01-20,"House Executive Session: 2/2/2010 10:00 Amendment Legislative Office Building 205 "
124703,2010-02-02,"House Committee Report: Inexpedient to Legislate for Feb 10 Consent Calendar (vote 18-0); House Calendar 13, PG.527 "
124703,2010-02-10,"House Removed from Consent Calendar (Rep Vaillancourt); House Journal  16, PG.748 "
124703,2010-02-10,"House Special Ordered to Regular Place in Feb 17 Consent Calendar: Motion Adopted Without Objection; House Journal  16, PG.783 "
124703,2010-02-17,"House Inexpedient to Legislate: Motion Adopted Voice Vote; House Journal  18, PG.958 "
124704,2009-12-10,"House Introduced 1/6/2010 and Referred to Transportation; House Journal  6, PG.230 "
124704,2009-12-21,"House Public Hearing: 1/12/2010 1:00 PM Legislative Office Building 203 "
124704,2010-01-12,"House Executive Session: 1/19/2010 11:15 Amendment Legislative Office Building 203 "
124704,2010-01-20,"House Committee Report: Inexpedient to Legislate for Jan 27 Consent Calendar (vote 14-0); House Calendar 8, PG.337 "
124704,2010-01-27,"House Inexpedient to Legislate: Motion Adopted Voice Vote; House Journal  12, PG.507 "
124705,2009-12-10,"House Introduced 1/6/2010 and Referred to Municipal and County Government; House Journal  6, PG.230 "
124705,2010-01-13,"House Public Hearing: 1/26/2010 11:30 Amendment Legislative Office Building 301 "
124705,2010-01-26,"House Executive Session: 2/4/2010 10:30 Amendment Legislative Office Building 301 "
124705,2010-02-09,"House Committee Report: Inexpedient to Legislate for Feb 17 Consent Calendar (Vote 17-0); House Calendar 14, PG.594 "
124705,2010-02-17,"House Inexpedient to Legislate: Motion Adopted Voice Vote; House Journal  18, PG.972 "
124706,2009-12-10,"House Introduced 1/6/2010 and Referred to Transportation; House Journal  6, PG.230 "
124706,2010-01-26,"House Public Hearing: 2/4/2010 9:30 Amendment Legislative Office Building 204 "
124706,2010-02-03,"House Executive Session: 2/9/2010 10:15 Amendment Legislative Office Building 203 "
124706,2010-02-11,"House Committee Report: Ought to Pass with Amendment #0508h (NT) for Mar 10 (Vote 8-6; Regular Calendar); House Calendar 19, PG.1038 "
124706,2010-02-11,"House Proposed Committee Amendment #0508h (New Title); House Calendar 19, PG.1047 "
124706,2010-03-10,"House Special Ordered to Regular Place on Mar 11 Calendar, Without Objection; House Journal  23, PG.1294 "
124706,2010-03-11,"House Amendment #0508h (New Title) Adopted, Voice Vote; House Journal  24, PG.1320 "
124706,2010-03-11,"House Ought to Pass with Amendment #0508h (NT): Motion Adopted Voice Vote; House Journal  24, PG.1320 "
124706,2010-03-24,"Senate Introduced and Referred to Transportation & Interstate Cooperation; Senate Journal 11, Pg.260 "
124706,2010-04-15,"Senate Hearing: April 29, 2010, Room 101, Legislative Office Building, 10:30 a.m.; Senate Calendar 16 "
124706,2010-04-29,"Senate Committee Report: Ought to Pass, 5/5/10; Senate Calendar 18 "
124706,2010-05-05,"Senate Ought to Pass, Motion Adopted, Voice Vote; OT3rdg "
124706,2010-05-05,"Senate Passed by Third Reading Resolution "
124706,2010-05-13,"House Enrolled; House Journal  42, PG.2153 "
124706,2010-05-13,"Senate Enrolled "
124706,2010-05-26,"House Signed by the Governor 05/25/2010; Effective 01/01/2011; Chapter 0086 "
124707,2009-12-10,"House Introduced 1/6/2010 and Referred to Fish and Game and Marine Resources; House Journal  6, PG.230 "
124707,2009-12-22,"House Public Hearing: 1/14/2010 1:45 PM Legislative Office Building 307 "
124707,2010-01-06,"House Executive Session: 1/19/2010 1:00 PM Legislative Office Building 307 "
124707,2010-01-20,"House Committee Report: Ought to Pass for Jan 27 Consent Calendar (vote 13-0); House Calendar 8, PG.333 "
124707,2010-01-27,"House Ought to Pass: Motion Adopted Voice Vote; House Journal  12, PG.501 "
124707,2010-03-03,"Senate Introduced and Referred to Wildlife, Fish and Game & Agriculture "
124707,2010-03-31,"Senate Hearing: April 6, 2010, Room 103, Legislative Office Building, 2:35 p.m.; Senate Calendar 14 "
124707,2010-04-07,"Senate Committee Report: Ought to Pass 4/14/10; Senate Calendar 15 "
124707,2010-04-14,"Senate Ought to Pass, Motion Adopted, Voice Vote; OT3rdg; Senate Journal 14, Pg.294 "
124707,2010-04-14,"Senate Passed by Third Reading Resolution; Senate Journal 14, Pg.295 "
124707,2010-04-21,"Senate Enrolled "
124707,2010-04-21,"House Enrolled; House Journal  35, PG.1671 "
124707,2010-05-10,"House Signed By the Governor 05/07/2010; Effective 07/06/2010; Chapter 0018 "
124708,2009-12-10,"House Introduced 1/6/2010 and Referred to Executive Departments and Administration; House Journal  6, PG.230 "
124708,2010-01-20,"House Public Hearing: 1/28/2010 9:30 Amendment Legislative Office Building 306 "
124708,2010-01-29,"House Subcommittee Work Session: 2/4/2010 9:00 Amendment Legislative Office Building 306 "
124708,2010-02-02,"House Executive Session: 2/9/2010 10:30 Amendment Legislative Office Building 306 "
124708,2010-02-10,"House Committee Report: Inexpedient to Legislate for Feb 17 Consent Calendar (vote 17-0); House Calendar 14, PG.586 "
124708,2010-02-17,"House Inexpedient to Legislate: Motion Adopted Voice Vote; House Journal  18, PG.952 "
124709,2010-01-06,"House Introduced and Referred to Criminal Justice and Public Safety; House Journal  6, PG.230 "
124709,2010-01-06,"House Public Hearing: 1/14/2010 1:00 PM Legislative Office Building 204 "
124709,2010-01-26,"House Executive Session: 2/2/2010 10:00 Amendment Legislative Office Building 204 (Continued 2/2/2010 1:30 PM Legislative Office Building 204 if Necessary) "
124709,2010-02-03,"House Committee Report: Ought to Pass for Mar 3 (Vote 18-0; Regular Calendar); House Calendar 17, PG.819 "
124709,2010-03-03,"House Special Ordered to Next Session Without Objection; House Journal  20, PG.1180 "
124709,2010-03-10,"House Lay on the Table (Rep Shurtleff): Motion Adopted Voice Vote; House Journal  23, PG.1259-1260 "
124710,2009-12-10,"House Introduced 1/6/2010 and Referred to Local and Regulated Revenues; House Journal  6, PG.230 "
124710,2009-12-29,"House Public Hearing: 1/7/2010 1:15 PM Legislative Office Building 303 "
124710,2010-01-21,"House Subcommittee Work Session: 1/28/2010 1:30 PM Legislative Office Building 303 "
124710,2010-02-03,"House Executive Session: 2/9/2010 1:00 PM Legislative Office Building 303 (Continued 2/11/2010 10:00 Amendment Legislative Office Building 303 If Necessary) "
124710,2010-02-10,"House Majority Committee Report: Inexpedient to Legislate for Mar 10 (Vote 14-3; Regular Calendar); House Calendar 19, PG.1034 "
124710,2010-02-10,"House Minority Committee Report: Ought to Pass; House Calendar 19, PG.1034 "
124710,2010-03-10,"House Special Order to Regular Place on Mar 11 Calendar, Without Objection; House Journal  23, PG.1294 "
124710,2010-03-11,"House Special Order to Beginning of Mar 17 Calendar, Without Objection; House Journal  24, PG.1349 "
124710,2010-03-17,"House Inexpedient to Legislate: Motion Adopted Division Vote 283-47; House Journal  26, PG.1368-1369 "
124711,2009-12-10,"House Introduced 1/6/2010 and Referred to Resources, Recreation and Development; House Journal  6, PG.230 "
124711,2010-02-02,"House Public Hearing: 2/9/2010 9:00 Amendment Legislative Office Building 305 "
124711,2010-02-03,"House Executive Session: 2/11/2010 9:30 Amendment Legislative Office Building 305 "
124711,2010-02-11,"House Committee Report: Inexpedient to Legislate for Mar 3 Consent Calendar (Vote 16-0); House Calendar 17, PG.811 "
124711,2010-03-03,"House Inexpedient to Legislate: Motion Adopted Voice Vote; House Journal  20, PG.1156 "
124712,2010-01-06,"House Introduced and Referred to Executive Departments and Administration; House Journal  6, PG.230 "
124712,2010-01-06,"House Public Hearing: 1/12/2010 1:15 PM Legislative Office Building 306 "
124712,2010-01-20,"House Executive Session: 1/26/2010 10:30 Amendment Legislative Office Building 306 "
124712,2010-01-26,"House Committee Report: Ought to Pass with Amendment #0081h (New Title) for Feb 3 Consent Calendar (vote 19-0); House Calendar 11, PG.462 "
124712,2010-01-26,"House Proposed Committee Amendment #0081h (New Title); House Calendar 11, PG.487-488 "
124712,2010-02-03,"House Removed from Consent Calendar (Rep L.Christiansen); House Journal  15, PG.666 "
124712,2010-02-03,"House Amendment #0081h (New Title) Adopted, Voice Vote; House Journal  15, PG.730-731 "
124712,2010-02-03,"House Ought to Pass with Amendment #0081h (New Title): Motion Adopted Voice Vote; House Journal  15, PG.730-731 "
124712,2010-03-24,"Senate Introduced and Referred to Executive Departments and Administration; Senate Journal 11, Pg.260 "
124712,2010-03-31,"Senate Hearing: April 6, 2010, Room 101, Legislative Office Building, 2:00 p.m.; Senate Calendar 14 "
124712,2010-04-07,"Senate Committee Report: Ought to Pass with Amendment 1261s, New Title, 4/14/10; Senate Calendar 15 "
124712,2010-04-14,"Senate Committee Amendment 1261s, New Title, Amendment Adopted, Voice Vote; Senate Journal 14, Pg.288 "
124712,2010-04-14,"Senate Ought to Pass with Amendment 1261s, New Title, Motion Adopted, Voice Vote; OT3rdg; Senate Journal 14, Pg.288 "
124712,2010-04-14,"Senate Passed by Third Reading Resolution; Senate Journal 14, Pg.295 "
124712,2010-04-28,"House House Concurs with Senate Amendment #1261s(NT) (Rep Harding): Motion Adopted Voice Vote; House Journal  36, PG.1722 "
124712,2010-05-12,"House Enrolled; House Journal  41, PG.2097 "
124712,2010-05-12,"Senate Enrolled "
124712,2010-06-15,"House Signed by the Governor 06/09/2010; Chapter 0123 "
124712,2010-06-15,"House I. Section 1 Effective 07/01/2010 at 12:01 a.m. "
124712,2010-06-15,"House II. Remainder Effective 06/09/2010 "
124713,2009-12-10,"House Introduced 1/6/2010 and Referred to Election Law; House Journal  6, PG.230 "
124713,2009-12-16,"House Public Hearing: 1/12/2010 10:00 Amendment Legislative Office Building 308 "
124713,2010-01-06,"House Executive Session: 2/9/2010 10:00 Amendment Legislative Office Building 308 "
124713,2010-02-10,"House Committee Report: Ought to Pass for Feb 17 Consent Calendar (vote 15-0); House Calendar 14, PG.584 "
124713,2010-02-17,"House Ought to Pass: Motion Adopted Voice Vote; House Journal  18, PG.938 "
124713,2010-03-03,"Senate Introduced and Referred to Election Law and Veterans' Affairs "
124713,2010-03-11,"Senate Hearing: March 16, 2010, Room 101, Legislative Office Building, 8:30 a.m.; Senate Calendar 11 "
124713,2010-03-22,"Senate Committee Report: Ought to Pass 3/31/10; Senate Calendar 13 "
124713,2010-03-31,"Senate Ought to Pass, Motion Adopted, Voice Vote; OT3rdg; Senate Journal 12, Pg.268 "
124713,2010-03-31,"Senate Passed by Third Reading Resolution; Senate Journal 12, Pg.271 "
124713,2010-04-07,"Senate Enrolled; Senate Journal 13, Pg.285 "
124713,2010-04-12,"House Enrolled; House Journal  32, PG.1577 "
124713,2010-05-10,"House Signed By the Governor 05/07/2010; Effective 07/06/2010; Chapter 0019 "
124714,2010-01-06,"House Introduced and Referred to Municipal and County Government; House Journal  6, PG.230 "
124714,2010-01-06,"House Public Hearing: 1/7/2010 11:00 Amendment Legislative Office Building 301 "
124714,2010-01-06,"House ==CANCELLED== Executive Session: 1/20/2010 10:00 Amendment Legislative Office Building 301 "
124714,2010-01-21,"House Subcommittee Work Session: 1/26/2010 9:00 Amendment Legislative Office Building 104 "
124714,2010-01-27,"House ==RESCHEDULED== Subcommittee Work Session: 2/9/2010 10:00 Amendment Legislative Office Building 301 (Orig 9:00 Amendment) "
124714,2010-02-09,"House Subcommittee Work Session: 2/11/2010 11:30 Amendment Legislative Office Building 301 "
124714,2010-02-09,"House Executive Session: 2/16/2010 11:00 Amendment Legislative Office Building 301 (Continued 2/18/2010 9:00 Amendment Legislative Office Building 301 If Necessary) "
124714,2010-02-17,"House Committee Report: Inexpedient to Legislate for March 3 Consent Calendar (vote 15-0); House Calendar 17, PG.807 "
124714,2010-03-03,"House Inexpedient to Legislate: Motion Adopted Voice Vote; House Journal  20, PG.1147 "
124715,2009-12-10,"House Introduced 1/6/2010 and Referred to Public Works and Highways; House Journal  6, PG.230 "
124715,2010-01-12,"House Public Hearing: 1/20/2010 2:15 PM Legislative Office Building 201 "
124715,2010-01-13,"House Executive Session: 1/20/2010 2:25 PM Legislative Office Building 201 "
124715,2010-01-21,"House Committee Report: Ought to Pass with Amendment #0207h (New Title) for Jan 27 Regular Calendar (vote 15-0); House Calendar 8, PG.339 "
124715,2010-01-21,"House Proposed Committee Amendment #0207h (New Title); House Calendar 8, PG.357 "
124715,2010-01-27,"House Special Order to Beginning of Regular Calendar (Rep Bouchard): Motion Adopted Voice Vote; House Journal  12, PG.508 "
124715,2010-01-27,"House Amendment #0207h (New Title) Adopted, Voice Vote; House Journal  12, PG.508 "
124715,2010-01-27,"House Ought to Pass with Amendment #0207h (New Title): Motion Adopted Voice Vote; House Journal  12, PG.508-509 "
124715,2010-03-03,"Senate Introduced and Referred to Transportation & Interstate Cooperation "
124715,2010-03-17,"Senate Hearing: March 25, 2010, Room 101, Legislative Office Building, 10:30 a.m.; Senate Calendar 12 "
124715,2010-03-25,"Senate Committee Report: Ought to Pass 3/31/10; Senate Calendar 13 "
124715,2010-03-31,"Senate Without Objection, Chair moved to Special Order to the front of the Calendar; Senate Journal 12, Pg.266 "
124715,2010-03-31,"Senate Sen. Letourneau Floor Amendment 1199s, Amendment Adopted, Voice Vote; Senate Journal 12, Pg.267 "
124715,2010-03-31,"Senate Ought to Pass with Amendment 1199s, Regular Calendar 24Y-0N, Motion Adopted,; OT3rdg; Senate Journal 12, Pg.267 "
124715,2010-03-31,"Senate Passed by Third Reading Resolution; Senate Journal 12, Pg.271 "
124715,2010-04-14,"House House Concurs with Senate Amendment #1199s (Rep Bouchard): Motion Adopted Voice Vote; House Journal  32, PG.1587 "
124715,2010-04-21,"Senate Enrolled "
124715,2010-04-21,"House Enrolled; House Journal  35, PG.1671 "
124715,2010-05-10,"House Signed By the Governor 05/07/2010; Effective 05/07/2010; Chapter 0020 "
124716,2009-12-10,"House Introduced 1/6/2010 and Referred to Resources, Recreation and Development; House Journal  6, PG.230 "
124716,2010-02-02,"House Public Hearing: 2/9/2010 9:20 Amendment Legislative Office Building 305 "
124716,2010-02-03,"House Executive Session: 2/11/2010 9:30 Amendment Legislative Office Building 305 "
124716,2010-02-11,"House Committee Report: Ought to Pass with Amendment #0546h for Mar 3 Consent Calendar (Vote 17-0); House Calendar 17, PG.811 "
124716,2010-02-11,"House Proposed Committee Amendment #0546h; House Calendar 17, PG.835 "
124716,2010-03-03,"House Amendment #0546h Adopted, Voice Vote; House Journal  20, PG.1156 "
124716,2010-03-03,"House Ought to Pass with Amendment #0546h: Motion Adopted Voice Vote; House Journal  20, PG.1156 "
124716,2010-03-24,"Senate Introduced and Referred to Energy, Environment and Economic Development; Senate Journal 11, Pg.260 "
124716,2010-04-01,"Senate Hearing: April 8, 2010, Room 102, Legislative Office Building, 8:30 a.m.; Senate Calendar 14 "
124716,2010-04-08,"Senate Committee Report: Ought to Pass 4/14/10; Senate Calendar 15 "
124716,2010-04-14,"Senate Ought to Pass, Motion Adopted, Voice Vote; OT3rdg; Senate Journal 14, Pg.287 "
124716,2010-04-14,"Senate Passed by Third Reading Resolution; Senate Journal 14, Pg.295 "
124716,2010-04-21,"Senate Enrolled "
124716,2010-04-21,"House Enrolled; House Journal  35, PG.1671 "
124716,2010-05-10,"House Signed By the Governor 05/07/2010; Effective 05/07/2010; Chapter 0021 "
124717,2010-01-06,"House Introduced and Referred to Judiciary; House Journal  6, PG.230 "
124717,2010-01-06,"House Public Hearing: 1/7/2010 1:00 PM Legislative Office Building 208 "
124717,2010-02-04,"House Executive Session: 2/9/2010 10:00 Amendment Legislative Office Building 208 "
124717,2010-02-16,"House Committee Report: Inexpedient to Legislate for Mar 3 Consent Calendar (Vote 18-0); House Calendar 17, PG.804 "
124717,2010-03-03,"House Inexpedient to Legislate: Motion Adopted Voice Vote; House Journal  20, PG.1145 "
124718,2010-01-06,"House Introduced and Referred to Municipal and County Government; House Journal  6, PG.230 "
124718,2010-01-06,"House Public Hearing: 1/7/2010 1:30 PM Legislative Office Building 301 "
124718,2010-01-06,"House Executive Session: 1/20/2010 10:00 Amendment Legislative Office Building 301 "
124718,2010-01-20,"House Continued Executive Session If Necessary: 2/2/2010 1:30 PM Legislative Office Building 301 "
124718,2010-02-04,"House Committee Report: Ought to Pass with Amendment #0248h for Feb 10 Consent Calendar (vote 14-0); House Calendar 13, PG.531 "
124718,2010-02-04,"House Proposed Committee Amendment #0248h; House Calendar 13, PG.557-558 "
124718,2010-02-10,"House Removed from Consent Calendar (Rep Vaillancourt); House Journal  16, PG.748 "
124718,2010-02-10,"House Special Ordered to Regular Place in Feb 17 Consent Calendar: Motion Adopted Without Objection; House Journal  16, PG.783 "
124718,2010-02-17,"House Amendment #0248h Adopted, Voice Vote; House Journal  18, PG.972 "
124718,2010-02-17,"House Ought to Pass with Amendment #0248h: Motion Adopted Voice Vote; House Journal  18, PG.972 "
124718,2010-03-03,"Senate Introduced and Referred to Energy, Environment and Economic Development "
124718,2010-03-17,"Senate Hearing: March 25, 2010, Room 102, Legislative Office Building, 8:50 a.m.; Senate Calendar 12 "
124718,2010-03-25,"Senate Committee Report: Ought to Pass with Amendment 1185s, 3/31/10; Senate Calendar 13 "
124718,2010-03-31,"Senate Committee Amendment 1185s, Amendment Adopted, Voice Vote; Senate Journal 12, Pg.269 "
124718,2010-03-31,"Senate Ought to Pass with Amendment 1185s, Motion Adopted, Voice Vote; OT3rdg; Senate Journal 12, Pg.269 "
124718,2010-03-31,"Senate Passed by Third Reading Resolution; Senate Journal 12, Pg.271 "
124718,2010-04-14,"House House Concurs with Senate Amendment #1185s (Rep Cooney): Motion Adopted Voice Vote; House Journal  32, PG.1587 "
124718,2010-04-21,"Senate Enrolled "
124718,2010-04-21,"House Enrolled; House Journal  35, PG.1671 "
124718,2010-05-10,"House Signed By the Governor 05/07/2010; Effective 07/06/2010; Chapter 0022 "
124719,2009-12-10,"House Introduced 1/6/2010 and Referred to Children and Family Law; House Journal  6, PG.230 "
124719,2009-12-24,"House Public Hearing: 1/12/2010 11:00 Amendment Legislative Office Building 206 "
124719,2010-01-27,"House Subcommittee Work Session: 2/4/2010 2:30 PM Legislative Office Building 206 "
124719,2010-02-08,"House Subcommittee Work Session: 2/9/2010 1:00 PM Legislative Office Building 206 "
124719,2010-02-08,"House Executive Session: 2/11/2010 11:00 Amendment Legislative Office Building 206 "
124719,2010-02-16,"House Committee Report: Ought to Pass with Amendment #0571h for Mar 3 Consent Calendar (Vote 14-0); House Calendar 17, PG.793 "
124719,2010-02-16,"House Proposed Committee Amendment #0571h; House Calendar 17, PG.835-836 "
124719,2010-03-03,"House Amendment #0571h Adopted, Voice Vote; House Journal  20 PG.1095 "
124719,2010-03-03,"House Ought to Pass with Amendment #0571h: Motion Adopted Voice Vote; House Journal  20 PG.1095 "
124719,2010-03-24,"Senate Introduced and Referred to Judiciary; Senate Journal 11, Pg.260 "
124719,2010-04-07,"Senate Hearing: April 14, 2010, Room 103, State House, 2:00 p.m.; Senate Calendar 15 "
124719,2010-05-06,"Senate Committee Report: Referred to Interim Study, 5/12/10; Senate Calendar 19 "
124719,2010-05-12,"Senate Refer to Interim Study, Division 9Y-15N, Motion Failed; Senate Journal 18, Pg.473 "
124719,2010-05-12,"Senate Sen. Roberge moved Ought to Pass; Senate Journal 18, Pg.473 "
124719,2010-05-12,"Senate Ought to Pass, Motion Adopted, Voice Vote; OT3rdg; Senate Journal 18, Pg.473 "
124719,2010-05-12,"Senate Passed by Third Reading Resolution; Senate Journal 18, Pg.496 "
124719,2010-05-19,"Senate Enrolled "
124719,2010-05-19,"House Enrolled; House Journal  46, PG.2244 "
124719,2010-07-09,"House Signed by the Governor 07/08/2010; Effective 09/06/2010; Chapter 0273 "
124720,2009-12-10,"House Introduced 1/6/2010 and Referred to Education; House Journal  6, PG.230 "
124720,2010-01-05,"House Public Hearing: 1/12/2010 10:00 Amendment Legislative Office Building 207 "
124720,2010-01-05,"House Executive Session: 1/20/2010 1:00 PM Legislative Office Building 207 "
124720,2010-01-21,"House Committee Report: Ought to Pass with Amendment #0184h for Jan 27 Consent Calendar (vote 19-0); House Calendar 8, PG.331 "
124720,2010-01-21,"House Proposed Committee Amendment #0184h; House Calendar 8, PG.357 "
124720,2010-01-27,"House Amendment #0184h Adopted, Voice Vote; House Journal  12, PG.499 "
124720,2010-01-27,"House Ought to Pass with Amendment #0184h: Motion Adopted Voice Vote; House Journal  12, PG.499 "
124720,2010-03-03,"Senate Introduced and Referred to Education "
124720,2010-03-11,"Senate Hearing: March 16, 2010, Room 103, Legislative Office Building, 11:00 a.m.; Senate Calendar 11 "
124720,2010-03-22,"Senate Committee Report: Ought to Pass 3/31/10; Senate Calendar 13 "
124720,2010-03-31,"Senate Ought to Pass, Motion Adopted, Voice Vote; OT3rdg; Senate Journal 12, Pg.268 "
124720,2010-03-31,"Senate Passed by Third Reading Resolution; Senate Journal 12, Pg.271 "
124720,2010-04-07,"Senate Enrolled; Senate Journal 13, Pg.285 "
124720,2010-04-12,"House Enrolled; House Journal  32, PG.1577 "
124720,2010-05-10,"House Signed By the Governor 05/07/2010; Effective 07/06/2010; Chapter 0023 "
124721,2010-01-06,"House Introduced and Referred to Health, Human Services and Elderly Affairs; House Journal  6, PG.230 "
124721,2010-01-06,"House Public Hearing: 1/7/2010 9:30 Amendment Legislative Office Building 205 "
124721,2010-01-06,"House Executive Session: 1/12/2010 2:30 PM Legislative Office Building 205 "
124721,2010-01-12,"House Committee Report: Ought to Pass for Jan 27 Consent Calendar (vote 16-0); House Calendar 8, PG.333 "
124721,2010-01-27,"House Ought to Pass: Motion Adopted Voice Vote; House Journal  12, PG.502 "
124721,2010-03-24,"Senate Introduced and Referred to Executive Departments and Administration; Senate Journal 11, Pg.260 "
124721,2010-04-08,"Senate Hearing: April 13, 2010, Room 101, Legislative Office Building, 2:15 p.m.; Senate Calendar 15 "
124721,2010-04-15,"Senate Committee Report: Ought to Pass 4/21/10; Senate Calendar 16 "
124721,2010-04-21,"Senate Without Objection, Chair moved to Special Order to 04/28/10 "
124721,2010-04-21,"Senate Committee Report: Ought to Pass 4/28/10 "
124721,2010-04-28,"Senate Ought to Pass, Motion Adopted, Voice Vote; OT3rdg "
124721,2010-04-28,"Senate Passed by Third Reading Resolution "
124721,2010-05-12,"House Enrolled; House Journal  41, PG.2097 "
124721,2010-05-12,"Senate Enrolled "
124721,2010-05-26,"House Signed by the Governor 05/25/2010; Effective 07/24/2010; Chapter 0087 "
124722,2009-12-10,"House Introduced 1/6/2010 and Referred to Resources, Recreation and Development; House Journal  6, PG.230 "
124722,2010-02-02,"House Public Hearing: 2/9/2010 9:45 Amendment Legislative Office Building 305 "
124722,2010-02-03,"House Executive Session: 2/11/2010 9:30 Amendment Legislative Office Building 305 "
124722,2010-02-11,"House Committee Report: Ought to Pass for Mar 3 Consent Calendar (Vote 17-0); House Calendar 17, PG.811 "
124722,2010-03-03,"House Ought to Pass: Motion Adopted Voice Vote; House Journal  20, PG.1156 "
124722,2010-03-24,"Senate Introduced and Referred to Transportation & Interstate Cooperation; Senate Journal 11, Pg.260 "
124722,2010-04-08,"Senate Hearing: April 22, 2010, Room 101, Legislative Office Building, 11:20 a.m.; Senate Calendar 15 "
124722,2010-04-22,"Senate Committee Report: Ought to Pass 4/28/10; Senate Calendar 17 "
124722,2010-04-28,"Senate Ought to Pass, Motion Adopted, Voice Vote; OT3rdg "
124722,2010-04-28,"Senate Passed by Third Reading Resolution "
124722,2010-05-12,"House Enrolled; House Journal  41, PG.2097 "
124722,2010-05-12,"Senate Enrolled "
124722,2010-05-26,"House Signed by the Governor 05/25/2010; Effective 07/24/2010; Chapter 0088 "
124723,2009-12-10,"House Introduced 1/6/2010 and Referred to Health, Human Services and Elderly Affairs; House Journal  6, PG.230  "
124723,2010-01-06,"House Public Hearing: 1/27/2010 10:00 Amendment Legislative Office Building 205 "
124723,2010-01-20,"House Executive Session: 2/2/2010 10:00 Amendment Legislative Office Building 205 "
124723,2010-02-02,"House Committee Report: Inexpedient to Legislate for Feb 10 Consent Calendar (vote 16-1); House Calendar 13, PG.528 "
124723,2010-02-10,"House Removed from Consent Calendar (Rep Vaillancourt); House Journal  16, PG.748 "
124723,2010-02-10,"House Inexpedient to Legislate: Motion Adopted Voice Vote; House Journal  16, PG.778 "
124724,2009-12-10,"House Introduced 1/6/2010 and Referred to Criminal Justice and Public Safety; House Journal  6, PG.231 "
124724,2010-01-12,"House Public Hearing: 1/19/2010 10:00 Amendment Legislative Office Building 204 "
124724,2010-01-26,"House Executive Session: 2/2/2010 10:00 Amendment Legislative Office Building 204 (Continued 2/2/2010 1:30 PM Legislative Office Building 204 if Necessary) "
124724,2010-02-02,"House Committee Report: Ought to Pass with Amendment #0190h for Feb 17 Consent Calendar (vote 17-0); House Calendar 14, PG.581 "
124724,2010-02-02,"House Proposed Committee Amendment #0190h; House Calendar 14, PG.621 "
124724,2010-02-17,"House Amendment #0190h Adopted, Voice Vote; House Journal  18, PG.933 "
124724,2010-02-17,"House Ought to Pass with Amendment #0190h: Motion Adopted Voice Vote; House Journal  18, PG.933 "
124724,2010-03-03,"Senate Introduced and Referred to Judiciary "
124724,2010-03-16,"Senate Hearing: March 23, 2010, Room 103, State House, 2:15 p.m.; Senate Calendar 12 "
124724,2010-04-21,"Senate Committee Report: Ought to Pass 4/28/10; Senate Calendar 17 "
124724,2010-04-28,"Senate Ought to Pass, Motion Adopted, Voice Vote; OT3rdg; Senate Journal 16, Pg.348 "
124724,2010-04-28,"Senate Passed by Third Reading Resolution; Senate Journal 16, Pg.353 "
124724,2010-05-12,"House Enrolled; House Journal  41, PG.2097 "
124724,2010-05-12,"Senate Enrolled; Senate Journal 18, Pg.504 "
124724,2010-07-27,"House Vetoed by the Governor 07/26/2010 "
124725,2009-12-10,"House Introduced 1/6/2010 and Referred to Transportation; House Journal  6, PG.231 "
124725,2010-01-07,"House Public Hearing: 1/28/2010 10:30 Amendment Representative's Hall "
124725,2010-01-26,"House Executive Session: 2/2/2010 10:15 Amendment Legislative Office Building 203 "
124725,2010-02-03,"House Committee Report: Inexpedient to Legislate for Feb 10 Consent Calendar (vote 19-0); House Calendar 13, PG.533 "
124725,2010-02-10,"House Removed from Consent Calendar (Rep Vaillancourt); House Journal  16, PG.748 "
124725,2010-02-10,"House Special Ordered to Regular Place in Feb 17 Consent Calendar: Motion Adopted Without Objection; House Journal  16, PG.783 "
124725,2010-02-17,"House Inexpedient to Legislate: Motion Adopted Voice Vote; House Journal  18, PG.977 "
124726,2009-12-10,"House Introduced 1/6/2010 and Referred to Labor, Industrial and Rehabilitative Services; House Journal  6, PG.231 "
124726,2009-12-22,"House Public Hearing: 1/7/2010 10:30 Amendment Legislative Office Building 307 "
124726,2010-01-15,"House Subcommittee Work Session: 1/20/2010 2:00 PM Legislative Office Building 307 "
124726,2010-01-28,"House Subcommittee Work Session: 2/2/2010 11:45 Amendment Legislative Office Building 307 "
124726,2010-02-02,"House Subcommittee Work Session: 2/9/2010 9:15 Amendment Legislative Office Building 307 "
124726,2010-02-02,"House Executive Session: 2/9/2010 9:30 Amendment Legislative Office Building 307 "
124726,2010-02-10,"House Committee Report: Ought to Pass with Amendment #0309h (NT) for Feb 17 Consent Calendar (Vote 17-0); House Calendar 14, PG.592 "
124726,2010-02-10,"House Proposed Committee Amendment #0309h (New Title); House Calendar 14, PG.621 "
124726,2010-02-17,"House Amendment #0309h (New Title) Adopted, Voice Vote; House Journal  18, PG.962 "
124726,2010-02-17,"House Ought to Pass with Amendment #0309h (New Title): Motion Adopted Voice Vote; House Journal  18, PG.962 "
124726,2010-03-03,"Senate Introduced and Referred to Commerce, Labor and Consumer Protection "
124726,2010-04-06,"Senate Hearing: April 20, 2010, Room 102, Legislative Office Building, 8:45 a.m.; Senate Calendar 15 "
124726,2010-05-11,"Senate Committee Report: Ought to Pass, 5/12/10; Senate Calendar 19A "
124726,2010-05-12,"Senate Ought to Pass, Motion Adopted, Voice Vote; OT3rdg "
124726,2010-05-12,"Senate Passed by Third Reading Resolution "
124726,2010-05-19,"Senate Enrolled "
124726,2010-05-19,"House Enrolled "
124726,2010-06-16,"House Signed by the Governor 06/14/2010; Effective 07/14/2010; Chapter 0134 "
124727,2009-12-10,"House Introduced 1/6/2010 and Referred to Health, Human Services and Elderly Affairs; House Journal  6, PG.231 "
124727,2010-01-06,"House Public Hearing: 1/27/2010 11:00 Amendment Legislative Office Building 205 "
124727,2010-01-20,"House Executive Session: 2/2/2010 10:00 Amendment Legislative Office Building 205 "
124727,2010-02-02,"House Committee Report: Ought to Pass for Feb 10 Consent Calendar (vote 19-0); House Calendar 13, PG.528 "
124727,2010-02-10,"House Removed from Consent Calendar (Rep Vaillancourt); House Journal  16, PG.748 "
124727,2010-02-10,"House Special Ordered to Regular Place in Feb 17 Consent Calendar: Motion Adopted Without Objection; House Journal  16, PG.783 "
124727,2010-02-17,"House Removed from Consent Calendar (Rep Kurk); House Journal  18, PG.927 "
124727,2010-02-17,"House Special Ordered to Next Session Day Beginning of Calendar: Motion Adopted Without Objection; House Journal  18, PG.1015 "
124727,2010-03-03,"House Floor Amendment #0615h (Rep Kurk) Adopted, Voice Vote; House Journal  20, PG.1090 "
124727,2010-03-03,"House Ought to Pass with Amendment #0615h: Motion Adopted Voice Vote; House Journal  20, PG.1090 "
124727,2010-03-24,"Senate Introduced and Referred to Health and Human Services; Senate Journal 11, Pg.260 "
124727,2010-03-31,"Senate Hearing: April 13, 2010, Room 103, State House, 8:45 a.m.; Senate Calendar 14 "
124727,2010-04-28,"Senate Committee Report: Ought to Pass, 5/5/10; Senate Calendar 18 "
124727,2010-05-05,"Senate Sen. Sgambati Floor Amendment 1650s, Amendment Adopted, Voice Vote "
124727,2010-05-05,"Senate Ought to Pass with Amendment 1650s, Motion Adopted, Voice Vote; OT3rdg "
124727,2010-05-05,"Senate Passed by Third Reading Resolution "
124727,2010-05-19,"House House Concurs with Senate Amendment #1650s (Rep Rosenwald): Motion Adopted Voice Vote; House Journal  46, PG.2226 "
124727,2010-06-02,"House Enrolled Bill Amendment #2138 Adopted "
124727,2010-06-02,"Senate Enrolled Bill Amendment #2138 Adopted "
124727,2010-06-02,"Senate Enrolled "
124727,2010-06-02,"House Enrolled "
124727,2010-07-02,"House Signed by the Governor 07/01/2010; Effective 07/01/2010; Chapter 0233 "
124728,2009-12-10,"House Introduced 1/6/2010 and Referred to Children and Family Law; House Journal  6, PG.231 "
124728,2009-12-24,"House Public Hearing: 1/12/2010 10:00 Amendment Legislative Office Building 206 "
124728,2010-01-19,"House Executive Session: 1/28/2010 2:00 PM Legislative Office Building 206 "
124728,2010-01-29,"House Committee Report: Ought to Pass for Feb 10 Consent Calendar (vote 15-0); House Calendar 13, PG.522 "
124728,2010-02-10,"House Removed from Consent Calendar (Rep Vaillancourt); House Journal  16, PG.748 "
124728,2010-02-10,"House Special Ordered to Regular Place in Feb 17 Consent Calendar: Motion Adopted Without Objection; House Journal  16, PG.783 "
124728,2010-02-17,"House Ought to Pass: Motion Adopted Voice Vote; House Journal  18, PG.927 "
124728,2010-03-03,"Senate Introduced and Referred to Commerce, Labor and Consumer Protection "
124728,2010-04-01,"Senate Hearing: April 6, 2010, Room 210-211, Legislative Office Building, 9:45 a.m.; Senate Calendar 14 "
124728,2010-04-06,"Senate Committee Report: Ought to Pass 4/14/10; Senate Calendar 15 "
124728,2010-04-14,"Senate Ought to Pass, Motion Adopted, Voice Vote; OT3rdg; Senate Journal 14, Pg.286 "
124728,2010-04-14,"Senate Passed by Third Reading Resolution; Senate Journal 14, Pg.295 "
124728,2010-04-21,"Senate Enrolled "
124728,2010-04-21,"House Enrolled; House Journal  35, PG.1671 "
124728,2010-05-10,"House Signed By the Governor 05/07/2010; Effective 05/07/2010; Chapter 0024 "
124729,2010-01-06,"House Introduced and Referred to Public Works and Highways; House Journal  6, PG.231 "
124729,2010-01-06,"House Public Hearing: 1/12/2010 2:00 PM Legislative Office Building 201 "
124729,2010-01-12,"House Full Committee Work Session: 1/21/2010 10:00 Amendment Legislative Office Building 201 "
124729,2010-01-13,"House Executive Session: 2/2/2010 10:15 Amendment Legislative Office Building 201 "
124729,2010-02-03,"House Committee Report: Ought to Pass with Amendment #0249h for Feb 10 Consent Calendar (vote 17-0); House Calendar 13, PG.531 "
124729,2010-02-03,"House Proposed Committee Amendment #0249h; House Calendar 13, PG.558 "
124729,2010-02-10,"House Removed from Consent Calendar (Rep Vaillancourt); House Journal  16, PG.748 "
124729,2010-02-10,"House Special Ordered to Regular Place in Feb 17 Consent Calendar: Motion Adopted Without Objection; House Journal  16, PG.783 "
124729,2010-02-17,"House Amendment #0249h Adopted, Voice Vote; House Journal  18, PG.974-975 "
124729,2010-02-17,"House Ought to Pass with Amendment #0249h: Motion Adopted Voice Vote; House Journal  18, PG.974-975 "
124729,2010-03-03,"Senate Introduced and Referred to Executive Departments and Administration "
124729,2010-03-18,"Senate Hearing: March 23, 2010, Room 101, Legislative Office Building, 2:30 p.m.; Senate Calendar 12 "
124729,2010-04-15,"Senate Committee Report: Ought to Pass with Amendment 1374s, 4/21/10; Senate Calendar 16 "
124729,2010-04-21,"Senate Without Objection, Chair moved to Special Order to 04/28/10; Senate Journal 15, Pg.303 "
124729,2010-04-21,"Senate Committee Report: Ought to Pass with Amendment 1374s, 4/28/10 "
124729,2010-04-28,"Senate Committee Amendment 1374s, Amendment Adopted, Voice Vote; Senate Journal 16, Pg.339 "
124729,2010-04-28,"Senate Ought to Pass with Amendment 1374s, Motion Adopted, Voice Vote; OT3rdg; Senate Journal 16, Pg.339 "
124729,2010-04-28,"Senate Passed by Third Reading Resolution; Senate Journal 16, Pg.353 "
124729,2010-05-19,"House House Concurs with Senate Amendment #1374s (Rep Bouchard): Motion Adopted Voice Vote; House Journal  46, PG.2229 "
124729,2010-06-02,"House Enrolled "
124729,2010-06-02,"Senate Enrolled "
124729,2010-06-28,"House Signed by the Governor 06/28/2010; Effective 08/27/2010; Chapter 0209 "
124730,2010-01-06,"House Introduced and Referred to Criminal Justice and Public Safety; House Journal  6, PG.231 "
124730,2010-01-06,"House Public Hearing: 1/14/2010 11:30 Amendment Legislative Office Building 204 "
124730,2010-01-20,"House Executive Session: 1/27/2010 10:00 Amendment Legislative Office Building 204 "
124730,2010-01-27,"House Committee Report: Ought to Pass for Feb 3 Consent Calendar (vote 17-0); House Calendar 11, PG.461 "
124730,2010-02-03,"House Ought to Pass: Motion Adopted Voice Vote; House Journal  15, PG.667 "
124730,2010-03-24,"Senate Introduced and Referred to Judiciary; Senate Journal 11, Pg.260 "
124730,2010-04-19,"Senate Hearing: April 28, 2010, Room 103, State House, 1:00 p.m.; Senate Calendar 17 "
124730,2010-05-06,"Senate Committee Report: Ought to Pass with Amendment 1893s, 5/12/10; Senate Calendar 19 "
124730,2010-05-12,"Senate Committee Amendment 1893s, Amendment Adopted, Voice Vote "
124730,2010-05-12,"Senate Ought to Pass with Amendment 1893s, Motion Adopted, Voice Vote; OT3rdg "
124730,2010-05-12,"Senate Passed by Third Reading Resolution "
124730,2010-05-19,"House House Concurs with Senate Amendment #1893s (Rep Shurtleff): Motion Adopted Voice Vote; House Journal  46, PG.2225 "
124730,2010-06-02,"Senate Enrolled "
124730,2010-06-02,"House Enrolled "
124730,2010-07-09,"House Signed by the Governor 07/08/2010; Effective 07/08/2010; Chapter 0274 "
124731,2009-12-10,"House Introduced 1/6/2010 and Referred to Labor, Industrial and Rehabilitative Services; House Journal  6, PG.231 "
124731,2010-01-07,"House Public Hearing: 1/21/2010 9:30 Amendment Legislative Office Building 307 "
124731,2010-01-27,"House Subcommittee Work Session: 2/4/2010 11:00 Amendment Legislative Office Building 307 "
124731,2010-02-02,"House Executive Session: 2/9/2010 9:30 Amendment Legislative Office Building 307 "
124731,2010-02-10,"House Committee Report: Ought to Pass with Amendment #0525h for Feb 17 Consent Calendar (Vote 17-0); House Calendar 14, PG.592 "
124731,2010-02-10,"House Proposed Committee Amendment #0525h; House Calendar 14, PG.622 "
124731,2010-02-17,"House Amendment #0525h Adopted, Voice Vote; House Journal  18, PG.962 "
124731,2010-02-17,"House Ought to Pass with Amendment #0525h: Motion Adopted Voice Vote; House Journal  18, PG.962 "
124731,2010-03-03,"Senate Introduced and Referred to Commerce, Labor and Consumer Protection "
124731,2010-04-06,"Senate Hearing: April 13, 2010, Room 102, Legislative Office Building, 9:45 a.m.; Senate Calendar 15 "
124731,2010-04-15,"Senate Committee Report: Ought to Pass with Amendment 1417s, 4/21/10; Senate Calendar 16 "
124731,2010-04-21,"Senate Committee Amendment 1417s, Amendment Adopted, Voice Vote; Senate Journal 15, Pg.311 "
124731,2010-04-21,"Senate Ought to Pass with Amendment 1417s, Motion Adopted, Voice Vote; OT3rdg; Senate Journal 15, Pg.311 "
124731,2010-04-21,"Senate Passed by Third Reading Resolution; Senate Journal 15, Pg.325 "
124731,2010-05-19,"House House Non-Concurs with Senate Amendment & Requests Comm of Conf (Rep G.Richardson): Motion Adopted Voice Vote; House Journal  42, PG.2155 "
124731,2010-05-19,"House Speaker Appoints: Reps Goley, S.Kelly, J.Knowles & Infantine; House Journal  42, PG.2155 "
124731,2010-05-19,"Senate Sen. Hassan Accedes to House Request for Committee of Conference, Motion Adopted, Voice Vote "
124731,2010-05-19,"Senate President Appoints: Senators DeVries, Reynolds and Roberge "
124731,2010-05-21,"House Conference Committee Meeting: 5/25/2010 9:30 Amendment Legislative Office Building 307 "
124731,2010-05-27,"House Conferee Change: Rep Davis Replaces Rep Infantine; House Journal  46, PG.2247 "
124731,2010-05-27,"Senate Conference Committee Report 2179; Senate Amendment + New Amendment, Filed "
124731,2010-06-02,"Senate Conference Committee Report 2179; Adopted, Voice Vote "
124731,2010-06-02,"House Conference Committee Report #2179 Adopted, Division Vote 201-108 "
124731,2010-06-02,"Senate Enrolled "
124731,2010-06-02,"House Enrolled "
124731,2010-07-09,"House Signed by the Governor 07/08/2010; Effective 09/06/2010; Chapter 0275 "
124732,2009-12-10,"House Introduced 1/6/2010 and Referred to Health, Human Services and Elderly Affairs; House Journal  6, PG.231 "
124732,2010-01-06,"House ==CANCELLED== Public Hearing: 1/28/2010 9:30 Amendment Legislative Office Building 205 "
124732,2010-01-22,"House ==RESCHEDULED== Public Hearing: 2/9/2010 10:00 Amendment Legislative Office Building 205 (Orig 9:30 Amendment) "
124732,2010-02-03,"House Executive Session: 2/16/2010 10:00 Amendment Legislative Office Building 205 "
124732,2010-02-09,"House Subcommittee Work Session: 2/11/2010 12:00 PM Legislative Office Building 208 "
124732,2010-02-16,"House Committee Report: Ought to Pass with Amendment #0700h (NT) for Mar 3 Consent Calendar (Vote 19-0); House Calendar 17, PG.802 "
124732,2010-02-16,"House Proposed Committee Amendment #0700h (New Title); House Calendar 17, PG.836-837 "
124732,2010-03-03,"House Amendment #0700h (New Title) Adopted, Voice Vote; House Journal  20, PG.1140 "
124732,2010-03-03,"House Ought to Pass with Amendment #0700h (New Title): Motion Adopted Voice Vote; House Journal  20, PG.1140 "
124732,2010-03-24,"Senate Introduced and Referred to Health and Human Services; Senate Journal 11, Pg.260 "
124732,2010-03-31,"Senate Hearing: April 13, 2010, Room 103, State House, 9:00 a.m.; Senate Calendar 14 "
124732,2010-04-13,"Senate Committee Report: Ought to Pass 4/21/10; Senate Calendar 16 "
124732,2010-04-21,"Senate Ought to Pass, Motion Adopted, Voice Vote; OT3rdg; Senate Journal 15, Pg.318 "
124732,2010-04-21,"Senate Passed by Third Reading Resolution; Senate Journal 15, Pg.325 "
124732,2010-05-05,"Senate Enrolled "
124732,2010-05-05,"House Enrolled; House Journal  38, PG.1914 "
124732,2010-05-27,"House Signed by the Governor 05/26/2010; Effective 05/26/2010; Chapter 0098 "
124733,2010-01-06,"House Introduced and Referred to Health, Human Services and Elderly Affairs; House Journal  6, PG.231  "
124733,2010-01-06,"House Public Hearing: 1/14/2010 10:00 Amendment Legislative Office Building 205 "
124733,2010-01-06,"House ==CANCELLED== Executive Session: 1/20/2010 9:30 Amendment Legislative Office Building 205 "
124733,2010-01-29,"House Executive Session: 2/2/2010 10:00 PM Legislative Office Building 205 "
124733,2010-02-02,"House Committee Report: Ought to Pass with Amendment #0363h for Feb 10 Consent Calendar (vote 19-0); House Calendar 13, PG.528 "
124733,2010-02-02,"House Proposed Committee Amendment #0363h; House Calendar 13, PG.558-559 "
124733,2010-02-10,"House Removed from Consent Calendar (Rep Vaillancourt); House Journal  16, PG.748 "
124733,2010-02-10,"House Amendment #0363h Adopted, Voice Vote; House Journal  16, PG.778 "
124733,2010-02-10,"House Ought to Pass with Amendment #0363h: Motion Adopted Voice Vote; House Journal  16, PG.778 "
124733,2010-02-10,"House Referred to Executive Departments and Administration; House Journal  16, PG.778 "
124733,2010-02-18,"House Public Hearing: 3/2/2010 11:15 Amendment Legislative Office Building 306 "
124733,2010-03-03,"House Executive Session: 3/16/2010 10:30 Amendment Legislative Office Building 306 "
124733,2010-03-17,"House Committee Report: Ought to Pass for Mar 24 (Vote 17-0; Consent Calendar); House Calendar 22, PG.1220 "
124733,2010-03-24,"House Ought to Pass: Motion Adopted Voice Vote; House Journal  30, PG.1476 "
124733,2010-03-24,"Senate Introduced and Referred to Executive Departments and Administration; Senate Journal 11, Pg.260 "
124733,2010-04-21,"Senate Hearing: May 4, 2010, Room 101, Legislative Office Building, 2:00 p.m.; Senate Calendar 17 "
124733,2010-05-05,"Senate Committee Report: Ought to Pass, 5/12/10; Senate Calendar 19 "
124733,2010-05-12,"Senate Ought to Pass, Motion Adopted, Voice Vote; OT3rdg "
124733,2010-05-12,"Senate Passed by Third Reading Resolution "
124733,2010-05-19,"Senate Enrolled "
124733,2010-05-19,"House Enrolled "
124733,2010-06-16,"House Signed by the Governor 06/14/2010; Effective 06/14/2010; Chapter 0135 "
124734,2009-12-10,"House Introduced 1/6/2010 and Referred to Commerce and Consumer Affairs; House Journal  6, PG.231 "
124734,2010-01-19,"House Public Hearing: 1/25/2010 11:30 Amendment Legislative Office Building 302 "
124734,2010-01-20,"House Executive Session: 1/26/2010 10:00 Amendment Legislative Office Building 302 "
124734,2010-01-27,"House Committee Report: Ought to Pass for Feb 3 Consent Calendar (vote 19-0); House Calendar 11, PG.460 "
124734,2010-02-03,"House Ought to Pass: Motion Adopted Voice Vote; House Journal  15, PG.666 "
124734,2010-03-03,"Senate Introduced and Referred to Commerce, Labor and Consumer Protection "
124734,2010-04-06,"Senate Hearing: April 20, 2010, Room 102, Legislative Office Building, 9:00 a.m.; Senate Calendar 15 "
124734,2010-04-22,"Senate Committee Report: Ought to Pass with Amendment 1544s, 4/28/10; Senate Calendar 17 "
124734,2010-04-28,"Senate Committee Amendment 1544s, Amendment Adopted, Voice Vote; Senate Journal 16, Pg.344 "
124734,2010-04-28,"Senate Sen. DeVries Floor Amendment 1559s, New Title, Amendment Adopted, Voice Vote; Senate Journal 16, Pg.344 "
124734,2010-04-28,"Senate Ought to Pass with Amendments 1544s, 1559s, New Title, Motion Adopted, Voice Vote; OT3rdg; Senate Journal 16, Pg.345 "
124734,2010-04-28,"Senate Passed by Third Reading Resolution; Senate Journal 16, Pg.353 "
124734,2010-05-19,"House House Non-Concurs with Senate Amendment & Requests Comm of Conf (Rep G.Richardson): Motion Adopted Voice Vote; House Journal  42, PG.2155 "
124734,2010-05-19,"House Speaker Appoints: Reps Nord, DeStefano, Meader & R.Holden; House Journal  42, PG.2155 "
124734,2010-05-19,"Senate Sen. Hassan Accedes to House Request for Committee of Conference, Motion Adopted, Voice Vote; Senate Journal 20, Pg.648 "
124734,2010-05-19,"Senate President Appoints: Senators DeVries, Hassan and Downing; Senate Journal 20, Pg.648 "
124734,2010-05-21,"House Conference Committee Meeting: 5/26/2010 10:15 Amendment Legislative Office Building 304 "
124734,2010-05-27,"Senate Conference Committee Report 2245; Unable to Reach Agreement, Filed "
124734,2010-06-02,"Senate Conference Committee Report 2245; Adopted, Voice Vote; Senate Journal 21, Pg.670 "
124734,2010-06-02,"House Conference Committee Report #2245 Adopted, Voice Vote; House Journal  51, PG.2311 "
124735,2009-12-10,"House Introduced 1/6/2010 and Referred to Environment and Agriculture; House Journal  6, PG.231 "
124735,2010-01-26,"House Public Hearing: 2/11/2010 1:00 PM Legislative Office Building 308 "
124735,2010-02-02,"House Executive Session: 2/18/2010 9:00 Amendment Legislative Office Building 308 "
124735,2010-02-18,"House Majority Committee Report: Refer to Interim Study for Mar 10 (Vote 13-3; Regular Calendar); House Calendar 19, PG.1028 "
124735,2010-02-18,"House Minority Committee Report: Ought to Pass; House Calendar 19, PG.1028 "
124735,2010-03-10,"House Special Ordered to Regular Place on Mar 11 Calendar, Without Objection; House Journal  23, PG.1294 "
124735,2010-03-11,"House Refer to Interim Study: Motion Adopted Voice Vote; House Journal  24, PG.1326 "
124735,2010-03-17,"House Referred to Environment and Agriculture for Interim Study; House Journal  26, PG.1365 "
124735,2010-05-19,"House Interim Study - Full Committee Work Session: 6/1/2010 10:00 Amendment Legislative Office Building 308 "
124735,2010-05-19,"House Interim Study - Full Committee Work Session: 6/15/2010 10:00 Amendment Legislative Office Building 308 "
124735,2010-06-15,"House Interim Study - Full Committee Work Session: 6/22/2010 10:00 Amendment Legislative Office Building 308 "
124735,2010-06-15,"House Interim Study - Full Committee Work Session: 6/29/2010 10:00 Amendment Legislative Office Building 308 "
124735,2010-09-14,"House Interim Study - Full Committee Work Session: 10/5/2010 10:00 Amendment Legislative Office Building 307 "
124735,2010-09-14,"House Interim Study - Executive Session: 10/19/2010 10:00 Amendment Legislative Office Building 308 "
124736,2010-01-06,"House Introduced and Referred to Criminal Justice and Public Safety; House Journal  6, PG.231 "
124736,2010-01-06,"House Public Hearing: 1/14/2010 1:30 PM Legislative Office Building 204 "
124736,2010-02-03,"House Executive Session: 2/9/2010 10:00 Amendment Legislative Office Building 204 "
124736,2010-02-09,"House Committee Report: Refer to Interim Study for Feb 17 Consent Calendar (Vote 18-0); House Calendar 14, PG.581 "
124736,2010-02-17,"House Refer to Interim Study: Motion Adopted Voice Vote; House Journal  18, PG.933 "
124736,2010-03-17,"House Referred to Criminal Justice and Public Safety for Interim Study; House Journal  26, PG.1365 "
124736,2010-09-07,"House Interim Study - //TIME CHANGE// Subcommittee Work Session: 9/23/2010 10:30 Amendment Legislative Office Building 204 "
124736,2010-09-20,"House Interim Study - Executive Session: 10/13/2010 10:00 Amendment Legislative Office Building 204 "
124737,2010-01-06,"House Introduced and Referred to Municipal and County Government; House Journal  6, PG.231 "
124737,2010-01-06,"House Public Hearing: 1/12/2010 10:00 Amendment Legislative Office Building 301 "
124737,2010-01-06,"House Executive Session: 1/20/2010 10:00 Amendment Legislative Office Building 301 "
124737,2010-01-21,"House Committee Report: Ought to Pass with Amendment #0200h (New Title) for Jan 27 Consent Calendar (vote 18-0); House Calendar 8, PG.334 "
124737,2010-01-21,"House Proposed Committee Amendment #0200h (New Title); House Calendar 8, PG.357-358 "
124737,2010-01-27,"House Amendment #0200h (New Title) Adopted, Voice Vote; House Journal  12, PG.503-504 "
124737,2010-01-27,"House Ought to Pass with Amendment #0200h (New Title): Motion Adopted Voice Vote; House Journal  12, PG.503-504 "
124737,2010-03-24,"Senate Introduced and Referred to Public and Municipal Affairs; Senate Journal 11, Pg.260 "
124737,2010-04-01,"Senate Hearing: April 8, 2010, Room 103, Legislative Office Building, 8:30 a.m.; Senate Calendar 14 "
124737,2010-04-22,"Senate Committee Report: Ought to Pass with Amendment 1551s, 4/28/10; Senate Calendar 17 "
124737,2010-04-28,"Senate Committee Amendment 1551s, Amendment Adopted, Voice Vote; Senate Journal 16, Pg.351 "
124737,2010-04-28,"Senate Ought to Pass with Amendment 1551s, Motion Adopted, Voice Vote; OT3rdg; Senate Journal 16, Pg.351 "
124737,2010-04-28,"Senate Passed by Third Reading Resolution; Senate Journal 16, Pg.353 "
124737,2010-05-19,"House House Concurs with Senate Amendment #1551s (Rep Cooney): Motion Adopted Voice Vote; House Journal  46, PG.2227 "
124737,2010-06-02,"House Enrolled "
124737,2010-06-02,"Senate Enrolled "
124737,2010-06-29,"House Signed by the Governor 06/28/2010; Effective 08/27/2010; Chapter 0226 "
124738,2009-12-10,"House Introduced 1/6/2010 and Referred to Fish and Game and Marine Resources; House Journal  6, PG.231 "
124738,2010-01-05,"House Public Hearing: 1/19/2010 10:00 Amendment Legislative Office Building 307 "
124738,2010-01-19,"House Executive Session: 1/26/2010 10:00 Amendment Legislative Office Building 307 "
124738,2010-01-26,"House Committee Report: Ought to Pass for Feb 3 Consent Calendar (vote 13-0); House Calendar 11, PG.462 "
124738,2010-02-03,"House Ought to Pass: Motion Adopted Voice Vote; House Journal  15, PG.670 "
124738,2010-03-03,"Senate Introduced and Referred to Wildlife, Fish and Game & Agriculture "
124738,2010-03-31,"Senate Hearing: April 6, 2010, Room 103, Legislative Office Building, 2:15 p.m.; Senate Calendar 14 "
124738,2010-04-07,"Senate Committee Report: Ought to Pass 4/14/10; Senate Calendar 15 "
124738,2010-04-14,"Senate Ought to Pass, Motion Adopted, Voice Vote; OT3rdg; Senate Journal 14, Pg.294 "
124738,2010-04-14,"Senate Passed by Third Reading Resolution; Senate Journal 14, Pg.295 "
124738,2010-04-21,"Senate Enrolled "
124738,2010-04-21,"House Enrolled; House Journal  35, PG.1671 "
124738,2010-05-10,"House Signed By the Governor 05/07/2010; Effective 07/06/2010; Chapter 0025 "
124739,2009-12-10,"House Introduced 1/6/2010 and Referred to Municipal and County Government; House Journal  6, PG.231 "
124739,2010-01-20,"House Public Hearing: 2/2/2010 10:30 Amendment Legislative Office Building 301 "
124739,2010-02-09,"House Executive Session: 2/16/2010 11:00 Amendment Legislative Office Building 301 (Continued 2/18/2010 9:00 Amendment Legislative Office Building 301 If Necessary) "
124739,2010-02-17,"House Committee Report: Inexpedient to Legislate for March 3 Consent Calendar (vote 15-0); House Calendar 17, PG.807 "
124739,2010-03-03,"House Inexpedient to Legislate: Motion Adopted Voice Vote; House Journal  20, PG.1148 "
124740,2009-12-10,"House Introduced 1/6/2010 and Referred to Children and Family Law; House Journal  6, PG.231 "
124740,2009-12-24,"House Public Hearing: 1/14/2010 10:00 Amendment Legislative Office Building 206 "
124740,2010-01-19,"House Executive Session: 1/28/2010 2:00 PM Legislative Office Building 206 "
124740,2010-01-29,"House Committee Report: Ought to Pass for Feb 10 Consent Calendar (vote 14-0); House Calendar 13, PG.522 "
124740,2010-02-10,"House Removed from Consent Calendar (Rep Vaillancourt); House Journal  16, PG.748 "
124740,2010-02-10,"House Special Ordered to Regular Place in Feb 17 Consent Calendar: Motion Adopted Without Objection; House Journal  16, PG.783 "
124740,2010-02-17,"House Ought to Pass: Motion Adopted Voice Vote; House Journal  18, PG.927 "
124740,2010-03-03,"Senate Introduced and Referred to Judiciary "
124740,2010-04-07,"Senate Hearing: April 21, 2010, Room 103, State House, 2:30 p.m.; Senate Calendar 15 "
124740,2010-04-22,"Senate Committee Report: Ought to Pass with Amendment 1540s, 4/28/10; Senate Calendar 17 "
124740,2010-04-28,"Senate Committee Amendment 1540s, Amendment Adopted, Voice Vote; Senate Journal 16, Pg.348 "
124740,2010-04-28,"Senate Ought to Pass with Amendment 1540s, Motion Adopted, Voice Vote; OT3rdg; Senate Journal 16, Pg.348 "
124740,2010-04-28,"Senate Passed by Third Reading Resolution; Senate Journal 16, Pg.353 "
124740,2010-05-19,"House House Concurs with Sen Amendment #1540s (Rep Gile): Motion Adopted Division Vote 243-51; House Journal  46, PG.2224 "
124740,2010-05-19,"Senate Enrolled Bill Amendment #2174 Adopted "
124740,2010-05-19,"House Enrolled Bill Amendment #2174 Adopted; House Journal  46, PG.2247 "
124740,2010-06-02,"Senate Enrolled "
124740,2010-06-02,"House Enrolled "
124740,2010-07-09,"House Signed by the Governor 07/08/2010; Effective 07/08/2010; Chapter 0276 "
124741,2009-12-10,"House Introduced 1/6/2010 and Referred to Children and Family Law; House Journal  6, PG.231 "
124741,2009-12-24,"House Public Hearing: 1/12/2010 1:15 PM Legislative Office Building 206 "
124741,2010-01-19,"House Executive Session: 1/28/2010 2:00 PM Legislative Office Building 206 "
124741,2010-01-29,"House Committee Report: Inexpedient to Legislate for Feb 10 Consent Calendar (vote 15-0); House Calendar 13, PG.522 "
124741,2010-02-10,"House Removed from Consent Calendar (Rep Vaillancourt); House Journal  16, PG.748 "
124741,2010-02-10,"House Special Ordered to Regular Place in Feb 17 Consent Calendar: Motion Adopted Without Objection; House Journal  16, PG.783 "
124741,2010-02-17,"House Inexpedient to Legislate: Motion Adopted Voice Vote; House Journal  18, PG.927 "
124742,2010-01-06,"House Introduced and Referred to Judiciary; House Journal  6, PG.231 "
124742,2010-01-06,"House Public Hearing: 1/12/2010 10:00 Amendment Legislative Office Building 208 "
124742,2010-02-04,"House Executive Session: 2/9/2010 10:00 Amendment Legislative Office Building 208 "
124742,2010-02-17,"House Majority Committee Report: Inexpedient to Legislate for Mar 10 (Vote 15-3; Regular Calendar); House Calendar 19, PG.1031 "
124742,2010-02-17,"House Minority Committee Report: Ought to Pass; House Calendar 19, PG.1031 "
124742,2010-03-10,"House Inexpedient to Legislate: Motion Adopted Voice Vote; House Journal  23, PG.1289 "
124743,2009-12-10,"House Introduced 1/6/2010 and Referred to Science, Technology and Energy; House Journal  6, PG.231 "
124743,2010-01-06,"House Vacated from Sci, Tech & Energy and Referred to Comm & Consumer Affairs: Motion Adopted Voice Vote; House Journal  6, PG.249 "
124743,2010-01-22,"House Public Hearing: 2/8/2010 2:30 PM Legislative Office Building 302 "
124743,2010-02-02,"House Executive Session: 2/11/2010 10:00 Amendment Legislative Office Building 302 "
124743,2010-02-18,"House Committee Report: Inexpedient to Legislate for Mar 10 (vote 13-4; Regular Calendar); House Calendar 19, PG.1025 "
124743,2010-03-10,"House Special Ordered to Regular Place on Mar 11 Calendar, Without Objection; House Journal  23, PG.1294 "
124743,2010-03-11,"House Inexpedient to Legislate: Motion Adopted Voice Vote; House Journal  24, PG.1320 "
124744,2009-12-10,"House Introduced 1/6/2010 and Referred to Public Works and Highways; House Journal  6, PG.231 "
124744,2010-01-12,"House Public Hearing: 1/20/2010 2:45 PM Legislative Office Building 201 "
124744,2010-01-13,"House Executive Session: 1/20/2010 3:00 PM Legislative Office Building 201 "
124744,2010-01-21,"House Committee Report: Ought to Pass for Jan 27 Regular Calendar (vote 14-0); House Calendar 8, PG.339 "
124744,2010-01-27,"House Special Order to Beginning of Regular Calendar (Rep Bouchard): Motion Adopted Voice Vote; House Journal  12, PG.508 "
124744,2010-01-27,"House Ought to Pass: Motion Adopted Voice Vote; House Journal  12, PG.509 "
124744,2010-03-24,"Senate Introduced and Referred to Transportation & Interstate Cooperation; Senate Journal 11, Pg.260 "
124744,2010-04-08,"Senate Hearing: April 22, 2010, Room 101, Legislative Office Building, 10:30 a.m.; Senate Calendar 15 "
124744,2010-04-22,"Senate Committee Report: Ought to Pass 4/28/10; Senate Calendar 17 "
124744,2010-04-28,"Senate Ought to Pass, Regular Calendar 24Y-0N, Motion Adopted; OT3rdg "
124744,2010-04-28,"Senate Passed by Third Reading Resolution "
124744,2010-05-12,"House Enrolled; House Journal  41, PG.2097 "
124744,2010-05-12,"Senate Enrolled "
124744,2010-05-27,"House Signed by the Governor 05/25/2010; Effective 07/24/2010; Chapter 0097 "
124745,2009-12-10,"House Introduced 1/6/2010 and Referred to Executive Departments and Administration; House Journal  6, PG.231 "
124745,2010-02-02,"House Public Hearing: 2/9/2010 1:00 PM Legislative Office Building 306 "
124745,2010-02-09,"House Subcommittee Work Session: 2/11/2010 9:00 Amendment Legislative Office Building 306 "
124745,2010-02-10,"House Executive Session: 2/16/2010 10:30 Amendment Legislative Office Building 306 "
124745,2010-02-17,"House Committee Report: Inexpedient to Legislate for March 3 Regular Calendar (vote 9-7); House Calendar 17, PG.820 "
124745,2010-03-03,"House Inexpedient to Legislate: Motion Adopted Voice Vote; House Journal  20, PG.1166 "
124746,2010-01-06,"House Introduced and Referred to Criminal Justice and Public Safety; House Journal  6, PG.231 "
124746,2010-01-06,"House ===CANCELLED=== Public Hearing: 1/7/2010 10:00 Amendment Legislative Office Building 204 "
124746,2010-01-06,"House Public Hearing: 1/7/2010 10:45 Amendment Legislative Office Building 204 "
124746,2010-01-20,"House Executive Session: 1/27/2010 10:00 Amendment Legislative Office Building 204 "
124746,2010-01-28,"House Committee Report: Ought to Pass for Feb 3 Consent Calendar (vote 17-0); House Calendar 11, PG.461 "
124746,2010-02-03,"House Ought to Pass: Motion Adopted Voice Vote; House Journal  15, PG.668 "
124746,2010-03-03,"Senate Introduced and Referred to Judiciary "
124746,2010-04-07,"Senate Hearing: April 20, 2010, Room 103, State House, 2:15 p.m.; Senate Calendar 15 "
124746,2010-05-06,"Senate Committee Report: Ought to Pass with Amendment 1890s, 5/12/10; Senate Calendar 19 "
124746,2010-05-12,"Senate Committee Amendment 1890s, Amendment Adopted, Voice Vote; Senate Journal 18, Pg.474 "
124746,2010-05-12,"Senate Ought to Pass with Amendment 1890s, Motion Adopted, Voice Vote; OT3rdg; Senate Journal 18, Pg.474 "
124746,2010-05-12,"Senate Passed by Third Reading Resolution; Senate Journal 18, Pg.497 "
124746,2010-05-19,"House House Concurs with Senate Amendment #1890s (Rep Shurtleff): Motion Adopted Voice Vote; House Journal  46, PG.2225 "
124746,2010-06-02,"House Enrolled "
124746,2010-06-02,"Senate Enrolled "
124746,2010-07-15,"House Signed by the Governor 07/13/2010; Effective 07/13/2010; Chapter 0294 "
124747,2010-01-06,"House Introduced and Referred to Health, Human Services and Elderly Affairs; House Journal  6, PG.231 "
124747,2010-01-06,"House Public Hearing: 1/7/2010 10:00 Amendment Legislative Office Building 205 "
124747,2010-01-06,"House ==CANCELLED== Executive Session: 1/12/2010 2:30 PM Legislative Office Building 205 "
124747,2010-01-12,"House Subcommittee Work Session: 1/21/2010 12:30 PM Legislative Office Building 104 "
124747,2010-01-20,"House Executive Session: 2/2/2010 10:00 Amendment Legislative Office Building 205 "
124747,2010-02-02,"House Committee Report: Ought to Pass with Amendment #0267h for Feb 10 Consent Calendar (vote 19-0); House Calendar 13, PG.528 "
124747,2010-02-02,"House Proposed Committee Amendment #0267h; House Calendar 13, PG.559 "
124747,2010-02-10,"House Removed from Consent Calendar (Rep Vaillancourt); House Journal  16, PG.748 "
124747,2010-02-10,"House Special Ordered to Regular Place in Feb 17 Consent Calendar: Motion Adopted Without Objection; House Journal  16, PG.783 "
124747,2010-02-17,"House Amendment #0267h Adopted, Voice Vote; House Journal  18, PG.958-959 "
124747,2010-02-17,"House Ought to Pass with Amendment #0267h: Motion Adopted Voice Vote; House Journal  18, PG.958-959 "
124747,2010-03-03,"Senate Introduced and Referred to Health and Human Services "
124747,2010-03-18,"Senate Hearing: March 23, 2010, Room 103, State House, 8:45 a.m.; Senate Calendar 12 "
124747,2010-04-13,"Senate Committee Report: Ought to Pass with Amendment 1335s, 4/21/10; Senate Calendar 16 "
124747,2010-04-21,"Senate Committee Amendment 1335s, Amendment Adopted, Voice Vote; Senate Journal 15, Pg.318 "
124747,2010-04-21,"Senate Ought to Pass with Amendment 1335s, Motion Adopted, Voice Vote; OT3rdg; Senate Journal 15, Pg.318 "
124747,2010-04-21,"Senate Passed by Third Reading Resolution; Senate Journal 15, Pg.325 "
124747,2010-05-05,"House House Concurs with Senate Amendment 1335s (Rep Rosenwald): Motion Adopted Voice Vote; House Journal  38, PG.1882 "
124747,2010-05-13,"House Enrolled; House Journal  42, PG.2153 "
124747,2010-05-13,"Senate Enrolled "
124747,2010-05-26,"House Signed by the Governor 05/25/2010; Effective 07/24/2010; Chapter 0089 "
124748,2010-01-06,"House Introduced and Referred to Judiciary; House Journal  6, PG.231 "
124748,2010-01-06,"House Public Hearing: 1/14/2010 10:00 Amendment Legislative Office Building 208 "
124748,2010-01-26,"House Executive Session: 2/2/2010 10:00 Amendment Legislative Office Building 208 "
124748,2010-02-03,"House Committee Report: Ought to Pass for Feb 10 Regular Calendar (vote 12-6); House Calendar 13, PG.537 "
124748,2010-02-10,"House Special Ordered to Beginning of Feb 17 Regular Calendar: Motion Adopted Without Objection; House Journal  16, PG.783 "
124748,2010-02-17,"House Ought to Pass: Motion Adopted Voice Vote; House Journal  18, PG.987 "
124748,2010-03-03,"Senate Introduced and Referred to Judiciary "
124748,2010-04-19,"Senate Hearing: May 4, 2010, Room 103, State House, 2:30 p.m.; Senate Calendar 17 "
124748,2010-05-06,"Senate Committee Report: Inexpedient to Legislate, 5/12/10; Senate Calendar 19 "
124748,2010-05-12,"Senate Inexpedient to Legislate, Regular Calendar 15Y-9N, Motion Adopted, === BILL KILLED === Senate Journal 18, Pg.474 "
124749,2009-12-10,"House Introduced 1/6/2010 and Referred to Resources, Recreation and Development; House Journal  6, PG.231 "
124749,2010-02-02,"House Public Hearing: 2/11/2010 2:00 PM Legislative Office Building 305 "
124749,2010-02-10,"House Executive Session: 2/16/2010 10:00 Amendment Legislative Office Building 305 "
124749,2010-02-16,"House Majority Committee Report: Refer to Interim Study for Mar 10 (Vote 11-6; Regular Calendar); House Calendar 19, PG.1036 "
124749,2010-02-16,"House Minority Committee Report: Inexpedient to Legislate; House Calendar 19, PG.1036 "
124749,2010-03-10,"House Special Ordered to Regular Place on Mar 11 Calendar, Without Objection; House Journal  23, PG.1294 "
124749,2010-03-11,"House Refer to Interim Study: Motion Adopted Regular Calendar 174-140; House Journal  24, PG.1328-1330 "
124749,2010-03-17,"House Referred to Resources, Recreation and Development for Interim Study; House Journal  26, PG.1365 "
124749,2010-04-21,"House Interim Study - Subcommittee Work Session: 4/27/2010 9:30 Amendment Legislative Office Building 205 "
124749,2010-04-27,"House ==CANCELLED== Interim Study - Subcommittee Work Session: 5/11/2010 1:30 PM Legislative Office Building 305 "
124749,2010-05-12,"House Interim Study - Subcommittee Work Session: 5/17/2010 11:30 Amendment Legislative Office Building 305 "
124749,2010-09-13,"House Interim Study - Executive Session: 10/26/2010 10:00 Amendment Legislative Office Building 305 "
124750,2009-12-10,"House Introduced 1/6/2010 and Referred to Labor, Industrial and Rehabilitative Services; House Journal  6, PG.231 "
124750,2009-12-22,"House Public Hearing: 1/7/2010 11:00 Amendment Legislative Office Building 307 "
124750,2010-01-21,"House Subcommittee Work Session: 1/28/2010 9:30 Amendment Legislative Office Building 307 "
124750,2010-01-22,"House ==CANCELLED== Executive Session: 1/28/2010 1:00 PM Legislative Office Building 307 "
124750,2010-01-28,"House Subcommittee Work Session: 2/2/2010 9:45 Amendment Legislative Office Building 307 "
124750,2010-02-02,"House Executive Session: 2/9/2010 9:30 Amendment Legislative Office Building 307 "
124750,2010-02-10,"House Committee Report: Ought to Pass with Amendment #0381h for Feb 17 Consent Calendar (Vote 17-0); House Calendar 14, PG.592 "
124750,2010-02-10,"House Proposed Committee Amendment #0381h; House Calendar 14, PG.623 "
124750,2010-02-17,"House Amendment #0381h Adopted, Voice Vote; House Journal  18, PG.962-963 "
124750,2010-02-17,"House Ought to Pass with Amendment #0381h: Motion Adopted Voice Vote; House Journal  18, PG.962-963 "
124750,2010-03-03,"Senate Introduced and Referred to Commerce, Labor and Consumer Protection "
124750,2010-04-06,"Senate Hearing: April 27, 2010, Room 102, Legislative Office Building, 8:30 a.m.; Senate Calendar 15 "
124750,2010-04-29,"Senate Committee Report: Ought to Pass with Amendment 1773s, 5/5/10; Senate Calendar 18 "
124750,2010-05-05,"Senate Committee Amendment 1773s, Amendment Adopted, Voice Vote "
124750,2010-05-05,"Senate Ought to Pass with Amendment 1773s, Motion Adopted, Voice Vote; OT3rdg "
124750,2010-05-05,"Senate Passed by Third Reading Resolution "
124750,2010-05-19,"House House Concurs with Senate Amendment #1773s (Rep Goley): Motion Adopted Voice Vote; House Journal  46, PG.2226 "
124750,2010-06-02,"House Enrolled "
124750,2010-06-02,"Senate Enrolled "
124750,2010-06-28,"House Signed by the Governor 06/28/2010; Effective 01/01/2011; Chapter 0210 "
124751,2009-12-10,"House Introduced 1/6/2010 and Referred to Election Law; House Journal  6, PG.231 "
124751,2009-12-16,"House Public Hearing: 1/12/2010 1:00 PM Legislative Office Building 308 "
124751,2010-01-06,"House Executive Session: 2/9/2010 10:00 Amendment Legislative Office Building 308 ==RECESSED== "
124751,2010-02-09,"House Full Committee Work Session: 2/16/2010 1:00 PM Legislative Office Building 308 "
124751,2010-02-09,"House Continued Executive Session: 2/16/2010 1:30 PM Legislative Office Building 308 "
124751,2010-02-17,"House Majority Committee Report: Ought to Pass with Amendment #0726h (NT) for Mar 10 (Vote 8-6; Regular Calendar); House Calendar19, PG1028 "
124751,2010-02-17,"House Proposed Majority Committee Amendment #0726h (New Title); House Calendar 19, PG.1047-1048 "
124751,2010-02-17,"House Minority Committee Report: Refer to Interim Study; House Calendar 19, PG.1028 "
124751,2010-03-10,"House Special Ordered to Regular Place on Mar 11 Calendar, Without Objection; House Journal  23, PG.1294 "
124751,2010-03-11,"House Lay on the Table (Rep Pierce): Motion Adopted Voice Vote; House Journal  24, PG.1335 "
124751,2010-05-13,"House Remove From Table (Rep Comerford): Motion Failed Division Vote 78-244; House Journal  42, PG.2120 "
124752,2009-12-10,"House Introduced 1/6/2010 and Referred to Election Law; House Journal  6, PG.231 "
124752,2010-01-14,"House ==RESCHEDULED== Public Hearing: 1/19/2010 1:00 PM Legislative Office Building 308 (Orig 10:30 Amendment) "
124752,2010-01-14,"House Executive Session: 1/26/2010 10:00 Amendment Legislative Office Building 308 "
124752,2010-01-26,"House Committee Report: Inexpedient to Legislate for Feb 3 Consent Calendar (vote 18-0); House Calendar 11, PG.461 "
124752,2010-02-03,"House Inexpedient to Legislate: Motion Adopted Voice Vote; House Journal  15, PG.668 "
124753,2009-12-10,"House Introduced 1/6/2010 and Referred to Transportation; House Journal  6, PG.231 "
124753,2009-12-21,"House Public Hearing: 1/12/2010 1:30 PM Legislative Office Building 203 "
124753,2010-01-12,"House Subcommittee Work Session: 1/26/2010 1:00 PM Legislative Office Building 203 "
124753,2010-02-03,"House Executive Session: 2/9/2010 10:15 Amendment Legislative Office Building 203 "
124753,2010-02-10,"House Committee Report: Inexpedient to Legislate for Feb 17 Consent Calendar (vote 14-0); House Calendar 14, PG.598 "
124753,2010-02-17,"House Inexpedient to Legislate: Motion Adopted Voice Vote; House Journal  18, PG.977 "
124754,2010-01-06,"House Introduced and Referred to Commerce and Consumer Affairs; House Journal  6, PG.231 "
124754,2010-01-06,"House Public Hearing: 1/12/2010 11:00 Amendment Legislative Office Building 302 "
124754,2010-01-13,"House Subcommittee Work Session: 1/21/2010 9:00 Amendment Legislative Office Building 302 "
124754,2010-01-20,"House Executive Session: 1/26/2010 10:00 Amendment Legislative Office Building 302 ==RECESSED== "
124754,2010-01-27,"House Continued Executive Session: 2/4/2010 10:00 Amendment Legislative Office Building 302 "
124754,2010-02-05,"House Committee Report: Refer to Interim Study for Feb 17 Consent Calendar (Vote 16-0); House Calendar 14, PG.579 "
124754,2010-02-17,"House Refer to Interim Study: Motion Adopted Voice Vote; House Journal  18, PG.929 "
124754,2010-03-17,"House Referred to Commerce and Consumer Affairs for Interim Study; House Journal  26, PG.1365 "
124754,2010-09-22,"House Interim Study - Executive Session 10/26/2010 10:00 Legislative Office Building 302 "
124755,2009-12-10,"House Introduced 1/6/2010 and Referred to Transportation; House Journal  6, PG.231 "
124755,2010-01-12,"House Public Hearing: 1/20/2010 9:30 Amendment Legislative Office Building 203 "
124755,2010-01-26,"House ==CANCELLED== Executive Session: 2/2/2010 10:15 Amendment Legislative Office Building 203 "
124755,2010-02-03,"House Executive Session: 2/16/2010 10:15 Amendment Legislative Office Building 203 "
124755,2010-02-18,"House Committee Report: Ought to Pass for Mar 10 (Vote 10-4; Regular Calendar); House Calendar 19, PG.1038 "
124755,2010-03-10,"House Special Ordered to Regular Place on Mar 11 Calendar, Without Objection; House Journal  23, PG.1294 "
124755,2010-03-11,"House Ought to Pass: Motion Adopted Voice Vote; House Journal  24, PG.1320 "
124755,2010-03-24,"Senate Introduced and Referred to Transportation & Interstate Cooperation; Senate Journal 11, Pg.260 "
124755,2010-04-15,"Senate Hearing: April 29, 2010, Room 101, Legislative Office Building, 10:45 a.m.; Senate Calendar 16 "
124755,2010-05-06,"Senate Committee Report: Inexpedient to Legislate, 5/12/10; Senate Calendar 19 "
124755,2010-05-12,"Senate Inexpedient to Legislate, Motion Adopted, Voice Vote === BILL KILLED === Senate Journal 18, Pg.493 "
124756,2009-12-10,"House Introduced 1/6/2010 and Referred to Children and Family Law; House Journal  6, PG.231 "
124756,2009-12-24,"House Public Hearing: 1/14/2010 1:30 PM Legislative Office Building 206 ==RECESSED== "
124756,2010-01-15,"House Continued Public Hearing: 1/26/2010 2:00 PM Legislative Office Building 206 "
124756,2010-01-27,"House ==DATE CHANGE== Executive Session: 2/4/2010 1:15 PM Legislative Office Building 206 (Orig 2/2/10) "
124756,2010-02-08,"House Committee Report: Ought to Pass with Amendment #0142h for Feb 17 Consent Calendar (Vote 18-0); House Calendar 14, PG.578 "
124756,2010-02-08,"House Proposed Committee Amendment #0142h; House Calendar 14, PG.623 "
124756,2010-02-17,"House Amendment #0142h Adopted, Voice Vote; House Journal  18, PG.927-928 "
124756,2010-02-17,"House Ought to Pass with Amendment #0142h: Motion Adopted Voice Vote; House Journal  18, PG.927-928 "
124756,2010-03-03,"Senate Introduced and Referred to Health and Human Services "
124756,2010-03-10,"Senate Hearing: March 16, 2010, Room 103, State House, 8:45 a.m.; Senate Calendar 11 "
124756,2010-03-22,"Senate Committee Report: Ought to Pass 3/31/10; Senate Calendar 13 "
124756,2010-03-31,"Senate Ought to Pass, Motion Adopted, Voice Vote; OT3rdg; Senate Journal 12, Pg.269 "
124756,2010-03-31,"Senate Passed by Third Reading Resolution; Senate Journal 12, Pg.271 "
124756,2010-04-14,"House Enrolled Bill Amendment #1280 Adopted; House Journal  32, PG.1589 "
124756,2010-04-14,"Senate Enrolled Bill Amendment #1280, Adopted "
124756,2010-04-21,"Senate Enrolled "
124756,2010-04-21,"House Enrolled; House Journal  35, PG.1671 "
124756,2010-05-10,"House Signed By the Governor 05/07/2010; Chapter 0026 "
124756,2010-05-10,"House I. Section 1 Effective 01/01/2011 "
124756,2010-05-10,"House II. Remainder Effective 05/07/2010 "
124757,2009-12-10,"House Introduced 1/6/2010 and Referred to Resources, Recreation and Development; House Journal  6, PG.232 "
124757,2010-02-02,"House Public Hearing: 2/11/2010 2:30 PM Legislative Office Building 305 "
124757,2010-02-10,"House Executive Session: 2/16/2010 10:00 Amendment Legislative Office Building 305 "
124757,2010-02-16,"House Committee Report: Refer to Interim Study for Mar 3 Consent Calendar (Vote 16-1); House Calendar 17, PG.811 "
124757,2010-03-03,"House Removed from Consent Calendar (Rep J.Day); House Journal  20 PG.1095 "
124757,2010-03-03,"House Special Ordered to Next Session Without Objection; House Journal  20, PG.1180 "
124757,2010-03-10,"House Refer to Interim Study: Motion Adopted Regular Calendar 230-111; House Journal  23, PG.1274-1276 "
124757,2010-03-17,"House Referred to Resources, Recreation and Development for Interim Study; House Journal  26, PG.1365 "
124757,2010-04-21,"House Interim Study - Subcommittee Work Session: 4/27/2010 9:30 Amendment Legislative Office Building 205 "
124757,2010-04-27,"House Interim Study - Subcommittee Work Session: 5/11/2010 1:30 PM Legislative Office Building 305 "
124757,2010-05-04,"House ===CANCELLED=== Work Session: 5/11/2010 1:31 PM Legislative Office Building 305 "
124757,2010-05-12,"House Interim Study - Subcommittee Work Session: 5/17/2010 11:30 Amendment Legislative Office Building 305 "
124757,2010-09-11,"House Interim Study - Subcommittee Work Session: 10/04/2010 7:00 PM Rye Public Library "
124757,2010-09-13,"House Interim Study - Executive Session: 10/26/2010 10:00 Amendment Legislative Office Building 305 "
124758,2009-12-10,"House Introduced 1/6/2010 and Referred to Transportation; House Journal  6, PG.232 "
124758,2010-01-12,"House Public Hearing: 1/21/2010 1:30 PM Legislative Office Building 203 "
124758,2010-01-19,"House Executive Session: 1/26/2010 10:45 Amendment Legislative Office Building 203 "
124758,2010-01-27,"House Committee Report: Ought to Pass with Amendment #0307h for Feb 3 Consent Calendar (vote 13-0); House Calendar 11, PG.465 "
124758,2010-01-27,"House Proposed Committee Amendment #0307h; House Calendar 11, PG.488 "
124758,2010-02-03,"House Amendment #0307h Adopted, Voice Vote; House Journal  15, PG.671 "
124758,2010-02-03,"House Ought to Pass with Amendment #0307h: Motion Adopted Voice Vote; House Journal  15, PG.671 "
124758,2010-03-03,"Senate Introduced and Referred to Transportation & Interstate Cooperation "
124758,2010-03-18,"Senate Hearing: April 15, 2010, Room 101, Legislative Office Building, 10:50 a.m.; Senate Calendar 12 "
124758,2010-04-29,"Senate Committee Report: Ought to Pass with Amendment 1754s, 5/5/10; Senate Calendar 18 "
124758,2010-05-05,"Senate Committee Amendment 1754s, Amendment Adopted, Voice Vote "
124758,2010-05-05,"Senate Ought to Pass with Amendment 1754s, Motion Adopted, Voice Vote; OT3rdg "
124758,2010-05-05,"Senate Passed by Third Reading Resolution "
124758,2010-05-19,"House House Concurs with Senate Amendment #1754s (Rep M.O'Brien): Motion Adopted Voice Vote; House Journal  46, PG.2231 "
124758,2010-06-02,"House Enrolled "
124758,2010-06-02,"Senate Enrolled "
124758,2010-06-28,"House Signed by the Governor 06/28/2010; Effective 08/27/2010; Chapter 0211 "
124759,2009-12-10,"House Introduced 1/6/2010 and Referred to Judiciary; House Journal  6, PG.232 "
124759,2010-01-15,"House Public Hearing: 1/28/2010 1:00 PM Legislative Office Building 208 "
124759,2010-02-09,"House Executive Session: 2/16/2010 10:00 Amendment Legislative Office Building 208 (Continued 2/18/2010 10:00 Amendment Legislative Office Building 208 If Necessary) "
124759,2010-02-18,"House Committee Report: Inexpedient to Legislate for March 3 Consent Calendar (vote 14-0); House Calendar 17, PG.804-805 "
124759,2010-03-03,"House Inexpedient to Legislate: Motion Adopted Voice Vote; House Journal  20, PG.1145 "
124760,2009-12-10,"House Introduced 1/6/2010 and Referred to Children and Family Law; House Journal  6, PG.232 "
124760,2010-01-06,"House Public Hearing: 1/19/2010 10:00 Amendment Legislative Office Building 206 "
124760,2010-01-26,"House Subcommittee Work Session: 2/4/2010 10:00 Amendment Legislative Office Building 206 "
124760,2010-02-04,"House Subcommittee Work Session: 2/9/2010 9:30 Amendment Legislative Office Building 206 "
124760,2010-02-04,"House Executive Session: 2/9/2010 1:15 PM Legislative Office Building 206 =RECESSED= "
124760,2010-02-10,"House Continued Executive Session: 2/16/2010 1:15 PM Legislative Office Building 206 "
124760,2010-02-18,"House Committee Report: Inexpedient to Legislate for March 3 Consent Calendar (vote 15-1); House Calendar 17, PG.793 "
124760,2010-03-03,"House Inexpedient to Legislate: Motion Adopted Voice Vote; House Journal  20 PG.1095 "
124761,2009-12-10,"House Introduced 1/6/2010 and Referred to Municipal and County Government; House Journal  6, PG.232 "
124761,2010-01-13,"House Public Hearing: 1/28/2010 1:30 PM Legislative Office Building 301 "
124761,2010-01-26,"House Executive Session: 2/4/2010 10:30 Amendment Legislative Office Building 301 ==RECESSED== "
124761,2010-02-09,"House Continued Executive Session: 2/16/2010 11:00 Amendment Legislative Office Building 301 "
124761,2010-02-17,"House Committee Report: Ought to Pass with Amendment #0536h for Mar 3 Consent Calendar (Vote 15-0); House Calendar 17, PG.808 "
124761,2010-02-17,"House Proposed Committee Amendment #0536h; House Calendar 17, PG.837-838 "
124761,2010-03-03,"House Amendment #0536h Adopted, Voice Vote; House Journal  20, PG.1148 "
124761,2010-03-03,"House Ought to Pass with Amendment #0536h: Motion Adopted Voice Vote; House Journal  20, PG.1148 "
124761,2010-03-24,"Senate Introduced and Referred to Public and Municipal Affairs; Senate Journal 11, Pg.260 "
124761,2010-04-08,"Senate Hearing: April 15, 2010, Room 103, Legislative Office Building, 9:15 a.m.; Senate Calendar 15 "
124761,2010-04-15,"Senate Committee Report: Ought to Pass 4/21/10; Senate Calendar 16 "
124761,2010-04-21,"Senate Sen. Bradley Floor Amendment 1481s, New Title, Amendment Adopted, Voice Vote; Senate Journal 15, Pg.322 "
124761,2010-04-21,"Senate Ought to Pass with Amendment 1481s, New Title, Motion Adopted, Voice Vote; OT3rdg; Senate Journal 15, Pg.322 "
124761,2010-04-21,"Senate Passed by Third Reading Resolution; Senate Journal 15, Pg.325 "
124761,2010-05-05,"House House Concurs with Senate Amendment 1481s (NT) (Rep Cooney): Motion Adopted Voice Vote; House Journal  38, PG.1882 "
124761,2010-05-13,"House Enrolled; House Journal  42, PG.2153 "
124761,2010-05-13,"Senate Enrolled "
124761,2010-05-26,"House Signed by the Governor 05/25/2010; Chapter 0090 "
124761,2010-05-26,"House I. Section 5 Effective 05/25/2010 "
124761,2010-05-26,"House II. Remainder Effective 07/24/2010 "
124762,2010-01-06,"House Introduced and Referred to Municipal and County Government; House Journal  6, PG.232 "
124762,2010-01-06,"House ==CANCELLED== Public Hearing: 1/14/2010 11:45 Amendment Legislative Office Building 301 "
124762,2010-01-06,"House ==RESCHEDULED== Public Hearing: 1/14/2010 1:00 PM Legislative Office Building 301 "
124762,2010-01-06,"House Executive Session: 1/20/2010 10:00 Amendment Legislative Office Building 301 "
124762,2010-01-20,"House Continued Executive Session If Necessary: 2/2/2010 1:30 PM Legislative Office Building 301 "
124762,2010-02-04,"House Committee Report: Ought to Pass with Amendment #0220h (New Title) for Feb 10 Consent Calendar (vote 14-0); House Calendar 13, PG.531 "
124762,2010-02-04,"House Proposed Committee Amendment #0220h (New Title); House Calendar 13, PG.560 "
124762,2010-02-10,"House Removed from Consent Calendar (Rep Vaillancourt); House Journal  16, PG.748 "
124762,2010-02-10,"House Special Ordered to Regular Place in Feb 17 Consent Calendar: Motion Adopted Without Objection; House Journal  16, PG.783 "
124762,2010-02-17,"House Amendment #0220h (New Title) Adopted, Voice Vote; House Journal  18, PG.972 "
124762,2010-02-17,"House Ought to Pass with Amendment #0220h (New Title): Motion Adopted Voice Vote; House Journal  18, PG.972 "
124762,2010-03-03,"Senate Introduced and Referred to Public and Municipal Affairs "
124762,2010-03-11,"Senate Hearing: March 18, 2010, Room 103, Legislative Office Building, 8:30 a.m.; Senate Calendar 11 "
124762,2010-03-22,"Senate Committee Report: Ought to Pass 3/31/10; Senate Calendar 13 "
124762,2010-03-31,"Senate Ought to Pass, Motion Adopted, Voice Vote; OT3rdg; Senate Journal 12, Pg.270 "
124762,2010-03-31,"Senate Passed by Third Reading Resolution; Senate Journal 12, Pg.271 "
124762,2010-04-07,"Senate Enrolled; Senate Journal 13, Pg.285 "
124762,2010-04-12,"House Enrolled; House Journal  32, PG.1577 "
124762,2010-05-10,"House Signed By the Governor 05/07/2010; Effective 07/06/2010; Chapter 0027 "
124763,2010-01-06,"House Introduced and Referred to Municipal and County Government; House Journal  6, PG.232 "
124763,2010-01-06,"House Public Hearing: 1/12/2010 1:30 PM Legislative Office Building 301 "
124763,2010-01-06,"House Executive Session: 1/20/2010 10:00 Amendment Legislative Office Building 301 "
124763,2010-01-21,"House Majority Committee Report: Inexpedient to Legislate for Jan 27 Regular Calendar (vote 16-2); House Calendar 8, PG.338 "
124763,2010-01-21,"House Minority Committee Report: Refer to Interim Study; House Calendar 8, PG.338-339 "
124763,2010-01-27,"House Inexpedient to Legislate: Motion Adopted Voice Vote; House Journal  12, PG.513 "
124764,2009-12-10,"House Introduced 1/6/2010 and Referred to Fish and Game and Marine Resources; House Journal  6, PG.232 "
124764,2009-12-22,"House Public Hearing: 1/14/2010 1:00 PM Legislative Office Building 307 "
124764,2010-01-06,"House ==CANCELLED== Executive Session: 1/19/2010 1:00 PM Legislative Office Building 307 "
124764,2010-01-19,"House Subcommittee Work Session: 1/26/2010 11:00 Amendment Legislative Office Building 307 "
124764,2010-01-29,"House Executive Session: 2/9/2010 1:30 PM Legislative Office Building 307 "
124764,2010-02-10,"House Majority Committee Report: Ought to Pass with Amendment #0319h(NT) for Feb 17 Regular Calendar (vote 14-1); House Calendar 14, PG.605 "
124764,2010-02-10,"House Proposed Majority Committee Amendment #0319h (New Title); House Calendar 14, PG.623-624 "
124764,2010-02-10,"House Minority Committee Report: Inexpedient to Legislate; House Calendar 14, PG.605 "
124764,2010-02-17,"House Amendment #0319h (New Title) Adopted, Voice Vote; House Journal  18, PB.997-998 "
124764,2010-02-17,"House Floor Amendment #0632h (Rep Hopper) Failed, Voice Vote; House Journal  18, PB.998 "
124764,2010-02-17,"House Ought to Pass with Amendment #0319h (New Title): Motion Adopted Regular Calendar 241-115; House Journal  18, PG.997-1000 "
124764,2010-03-03,"Senate Introduced and Referred to Wildlife, Fish and Game & Agriculture "
124764,2010-03-31,"Senate Hearing: April 6, 2010, Room 103, Legislative Office Building, 2:40 p.m.; Senate Calendar 14 "
124764,2010-04-21,"Senate Committee Report: Ought to Pass with Amendment 1502s, 4/28/10; Senate Calendar 17 "
124764,2010-04-28,"Senate Committee Amendment 1502s, Not Voted On "
124764,2010-04-28,"Senate Sen. Boutin Moved Laid on Table, Motion Adopted, Voice Vote; Senate Journal 16, Pg.352 "
124765,2009-12-10,"House Introduced 1/6/2010 and Referred to Science, Technology and Energy; House Journal  6, PG.232 "
124765,2010-01-06,"House Public Hearing: 1/21/2010 2:15 PM Legislative Office Building 304 "
124765,2010-01-26,"House Executive Session: 2/2/2010 11:00 Amendment Legislative Office Building 304 "
124765,2010-02-02,"House Committee Report: Inexpedient to Legislate for Feb 10 Regular Calendar (vote 11-4); House Calendar 13, PG.540 "
124765,2010-02-10,"House Special Ordered to Beginning of Feb 17 Regular Calendar: Motion Adopted Without Objection; House Journal  16, PG.783 "
124765,2010-02-17,"House Inexpedient to Legislate: Motion Adopted Voice Vote; House Journal  18, PG.994 "
124766,2009-12-10,"House Introduced 1/6/2010 and Referred to Transportation; House Journal  6, PG.232 "
124766,2010-01-12,"House Public Hearing: 1/21/2010 2:00 PM Legislative Office Building 203 "
124766,2010-01-19,"House Executive Session: 1/26/2010 10:45 Amendment Legislative Office Building 203 "
124766,2010-01-27,"House Committee Report: Ought to Pass for Feb 3 Consent Calendar (vote 10-2); House Calendar 11, PG.465 "
124766,2010-02-03,"House Ought to Pass: Motion Adopted Voice Vote; House Journal  15, PG.672 "
124766,2010-03-03,"Senate Introduced and Referred to Transportation & Interstate Cooperation "
124766,2010-03-18,"Senate Hearing: April 8, 2010, Room 101, Legislative Office Building, 10:30 a.m.; Senate Calendar 12 "
124766,2010-03-23,"Senate Hearing: === TIME CHANGE === April 8, 2010, Room 101, Legislative Office Building, 10:50 a.m.; Senate Calendar 13 "
124766,2010-04-29,"Senate Committee Report: Referred to Interim Study, 5/5/10; Senate Calendar 18 "
124766,2010-05-05,"Senate Refer to Interim Study, Motion Adopted, Voice Vote; Senate Journal 17, Pg.397 "
124767,2009-12-10,"House Introduced 1/6/2010 and Referred to Transportation; House Journal  6, PG.232 "
124767,2010-01-12,"House Public Hearing: 1/21/2010 10:00 Amendment Legislative Office Building 203 "
124767,2010-01-19,"House Executive Session: 1/26/2010 10:45 Amendment Legislative Office Building 203 "
124767,2010-01-27,"House Committee Report: Ought to Pass for Feb 10 Consent Calendar (vote 12-0); House Calendar 13, PG.533 "
124767,2010-02-10,"House Removed from Consent Calendar (Rep Vaillancourt); House Journal  16, PG.748 "
124767,2010-02-10,"House Special Ordered to Regular Place in Feb 17 Consent Calendar: Motion Adopted Without Objection; House Journal  16, PG.783 "
124767,2010-02-17,"House Ought to Pass: Motion Adopted Voice Vote; House Journal  18, PG.978 "
124767,2010-03-03,"Senate Introduced and Referred to Transportation & Interstate Cooperation "
124767,2010-03-18,"Senate Hearing: April 8, 2010, Room 101, Legislative Office Building, 10:50 a.m.; Senate Calendar 12 "
124767,2010-03-23,"Senate Hearing: === TIME CHANGE === April 8, 2010, Room 101, Legislative Office Building, 11:10 a.m.; Senate Calendar 13 "
124767,2010-04-08,"Senate Committee Report: Ought to Pass 4/14/10; Senate Calendar 15 "
124767,2010-04-14,"Senate Ought to Pass, Motion Adopted, Voice Vote; OT3rdg; Senate Journal 14, Pg.291 "
124767,2010-04-14,"Senate Passed by Third Reading Resolution; Senate Journal 14, Pg.295 "
124767,2010-05-05,"Senate Enrolled "
124767,2010-05-05,"House Enrolled; House Journal  38, PG.1914 "
124767,2010-05-24,"House Signed by the Governor 05/18/2010; Effective 01/01/2011; Chapter 0047 "
124768,2009-12-10,"House Introduced 1/6/2010 and Referred to Election Law; House Journal  6, PG.232 "
124768,2009-12-16,"House Public Hearing: 1/12/2010 10:30 Amendment Legislative Office Building 308 "
124768,2010-01-06,"House Executive Session: 2/9/2010 10:00 Amendment Legislative Office Building 308 "
124768,2010-02-10,"House Committee Report: Inexpedient to Legislate for Feb 17 Consent Calendar (vote 18-1); House Calendar 14, PG.584 "
124768,2010-02-17,"House Inexpedient to Legislate: Motion Adopted Voice Vote; House Journal  18, PG.938 "
124769,2009-12-10,"House Introduced 1/6/2010 and Referred to Environment and Agriculture; House Journal  6, PG.232 "
124769,2010-01-19,"House Public Hearing: 2/4/2010 10:00 Amendment Legislative Office Building 308 "
124769,2010-01-26,"House Executive Session: 2/11/2010 2:00 PM Legislative Office Building 308 "
124769,2010-02-18,"House Committee Report: No Recommendation for Mar 17 (RC); House Calendar 21, PG.1190-1191 "
124769,2010-03-17,"House Special Order to Regular Place on Mar 18 Calendar, Without Objection; House Journal  26, PG.1391 "
124769,2010-03-18,"House Ought to Pass (Rep Mitchell); House Journal  27, PG.1429 "
124769,2010-03-18,"House Lay on the Table (Rep McGuire): Motion Failed Division Vote 103-192; House Journal  27, PG.1429 "
124769,2010-03-18,"House Ought to Pass: Motion Adopted Division Vote 230-74; House Journal  27, PG.1429-1430 "
124769,2010-03-24,"Senate Introduced and Referred to Executive Departments and Administration; Senate Journal 11, Pg.260 "
124769,2010-04-21,"Senate Hearing: May 4, 2010, Room 101, Legislative Office Building, 2:45 p.m.; Senate Calendar 17 "
124769,2010-05-05,"Senate Committee Report: Ought to Pass, 5/12/10; Senate Calendar 19 "
124769,2010-05-12,"Senate Without Objection, Chair moved to Special Order to the front of the Calendar "
124769,2010-05-12,"Senate Ought to Pass, Motion Adopted, Voice Vote; OT3rdg "
124769,2010-05-12,"Senate Passed by Third Reading Resolution "
124769,2010-05-19,"Senate Enrolled "
124769,2010-05-19,"House Enrolled; House Journal  46, PG.2244 "
124769,2010-07-09,"House Signed by the Governor 07/08/2010; Effective 09/06/2010; Chapter 0277 "
124770,2010-01-06,"House Introduced and Referred to Commerce and Consumer Affairs; House Journal  6, PG.232 "
124770,2010-01-06,"House Public Hearing: 1/7/2010 1:00 PM Legislative Office Building 302 "
124770,2010-01-20,"House Executive Session: 1/26/2010 10:00 Amendment Legislative Office Building 302 "
124770,2010-01-28,"House Committee Report: Ought to Pass for Feb 10 Consent Calendar (vote 19-0); House Calendar 13, PG.522 "
124770,2010-02-10,"House Removed from Consent Calendar (Rep Vaillancourt); House Journal  16, PG.748 "
124770,2010-02-10,"House Special Ordered to Regular Place in Feb 17 Consent Calendar: Motion Adopted Without Objection; House Journal  16, PG.783 "
124770,2010-02-17,"House Ought to Pass: Motion Adopted Voice Vote; House Journal  18, PG.929 "
124770,2010-03-03,"Senate Introduced and Referred to Commerce, Labor and Consumer Protection "
124770,2010-04-06,"Senate Hearing: April 20, 2010, Room 102, Legislative Office Building, 9:15 a.m.; Senate Calendar 15 "
124770,2010-04-20,"Senate Committee Report: Ought to Pass 4/28/10; Senate Calendar 17 "
124770,2010-04-28,"Senate Ought to Pass, Motion Adopted, Voice Vote; OT3rdg "
124770,2010-04-28,"Senate Passed by Third Reading Resolution "
124770,2010-05-12,"House Enrolled; House Journal  41, PG.2097 "
124770,2010-05-12,"Senate Enrolled "
124770,2010-05-26,"House Signed by the Governor 05/25/2010; Effective 07/24/2010; Chapter 0091 "
124771,2009-12-10,"House Introduced 1/6/2010 and Referred to Commerce and Consumer Affairs; House Journal  6, PG.232 "
124771,2010-01-22,"House Public Hearing: 2/1/2010 11:30 Amendment Legislative Office Building 302 "
124771,2010-01-27,"House Executive Session: 2/4/2010 10:00 Amendment Legislative Office Building 302 "
124771,2010-02-05,"House Committee Report: Ought to Pass for Feb 17 Consent Calendar (Vote 16-1); House Calendar 14, PG.579 "
124771,2010-02-17,"House Ought to Pass: Motion Adopted Voice Vote; House Journal  18, PG.929 "
124771,2010-03-03,"Senate Introduced and Referred to Commerce, Labor and Consumer Protection "
124771,2010-04-06,"Senate Hearing: April 22, 2010, Room 103, Legislative Office Building, 1:00 p.m.; Senate Calendar 15 "
124771,2010-04-22,"Senate Committee Report: Ought to Pass with Amendment 1560s, 4/28/10; Senate Calendar 17 "
124771,2010-04-28,"Senate Committee Amendment 1560s, Amendment Adopted, Voice Vote "
124771,2010-04-28,"Senate Ought to Pass with Amendment 1560s, Motion Adopted, Voice Vote; OT3rdg "
124771,2010-04-28,"Senate Passed by Third Reading Resolution "
124771,2010-05-05,"House House Concurs with Senate Amendment 1560s (Rep Butler): Motion Adopted Voice Vote; House Journal  38, PG.1882 "
124771,2010-05-13,"House Enrolled; House Journal  42, PG.2153 "
124771,2010-05-13,"Senate Enrolled "
124771,2010-05-26,"House Signed by the Governor 05/25/2010; Effective 07/24/2010; Chapter 0092 "
124772,2009-12-10,"House Introduced 1/6/2010 and Referred to Commerce and Consumer Affairs; House Journal  6, PG.232 "
124772,2010-01-22,"House Public Hearing: 2/1/2010 11:00 Amendment Legislative Office Building 302 "
124772,2010-01-27,"House Executive Session: 2/4/2010 10:00 Amendment Legislative Office Building 302 "
124772,2010-02-09,"House Committee Report: Inexpedient to Legislate for Feb 17 Consent Calendar (Vote 17-0); House Calendar 14, PG.579 "
124772,2010-02-17,"House Inexpedient to Legislate: Motion Adopted Voice Vote; House Journal  18, PG.929 "
124773,2009-12-10,"House Introduced 1/6/2010 and Referred to Legislative Administration; House Journal  6, PG.232 "
124773,2009-12-29,"House Public Hearing: 1/11/2010 11:00 Amendment Legislative Office Building 104 "
124773,2010-01-14,"House ==ROOM CHANGE== Executive Session: 1/26/2010 3:00 PM Legislative Office Building 306 (Orig Legislative Office Building 104) ==RECESSED== "
124773,2010-02-01,"House =Cancelled= Executive Session: 2/16/2010 3:00 PM Legislative Office Building 104 "
124773,2010-02-10,"House Executive Session: 2/17/2010 12:00 PM Legislative Office Building 104 "
124773,2010-02-18,"House Committee Report: Inexpedient to Legislate for Mar 3 Consent Calendar (vote 16-2); House Calendar 17, PG.806-807 "
124773,2010-03-03,"House Inexpedient to Legislate: Motion Adopted Voice Vote; House Journal  20, PG.1147 "
124774,2009-12-10,"House Introduced 1/6/2010 and Referred to Municipal and County Government; House Journal  6, PG.232 "
124774,2010-01-13,"House Public Hearing: 1/28/2010 11:30 Amendment Legislative Office Building 301 "
124774,2010-01-26,"House Executive Session: 2/4/2010 10:30 Amendment Legislative Office Building 301 "
124774,2010-02-09,"House Committee Report: Ought to Pass for Feb 17 Consent Calendar (Vote 18-0); House Calendar 14, PG.595 "
124774,2010-02-17,"House Ought to Pass: Motion Adopted Voice Vote; House Journal  18, PG.972 "
124774,2010-03-03,"Senate Introduced and Referred to Public and Municipal Affairs "
124774,2010-03-29,"Senate Hearing: April 1, 2010, Room 103, Legislative Office Building, 9:00 a.m.; Senate Calendar 13 "
124774,2010-04-01,"Senate Committee Report: Ought to Pass 4/7/10; Senate Calendar 14 "
124774,2010-04-07,"Senate Ought to Pass, Motion Adopted, Voice Vote; OT3rdg; Senate Journal 13, Pg.276 "
124774,2010-04-07,"Senate Passed by Third Reading Resolution; Senate Journal 13, Pg.282 "
124774,2010-04-14,"Senate Enrolled; Senate Journal 14, Pg.302 "
124774,2010-04-14,"House Enrolled; House Journal  32, PG.1587 "
124774,2010-05-24,"House Signed by the Governor 05/19/2010; Effective 07/18/2010; Chapter 0069 "
124775,2009-12-10,"House Introduced 1/6/2010 and Referred to Municipal and County Government; House Journal  6, PG.232 "
124775,2010-01-13,"House Public Hearing: 1/28/2010 1:00 PM Legislative Office Building 301 "
124775,2010-01-26,"House Executive Session: 2/4/2010 10:30 Amendment Legislative Office Building 301 ==RECESSED== "
124775,2010-02-09,"House Continued Executive Session: 2/16/2010 11:00 Amendment Legislative Office Building 301 "
124775,2010-02-17,"House Committee Report: Inexpedient to Legislate for Mar 10 (Vote 13-2; Regular Calendar); House Calendar 19, PG.1036 "
124775,2010-03-10,"House Special Ordered to Regular Place on Mar 11 Calendar, Without Objection; House Journal  23, PG.1294 "
124775,2010-03-11,"House Inexpedient to Legislate: Motion Adopted Voice Vote; House Journal  24, PG.1319 "
124776,2010-01-06,"House Introduced and Referred to Judiciary; House Journal  6, PG.232 "
124776,2010-01-06,"House Public Hearing: 1/12/2010 2:00 PM Legislative Office Building 208 "
124776,2010-01-26,"House Executive Session: 2/2/2010 10:00 Amendment Legislative Office Building 208 "
124776,2010-02-03,"House Majority Committee Report: Ought to Pass for Feb 10 Regular Calendar (vote 10-8); House Calendar 13, PG.537-538 "
124776,2010-02-03,"House Minority Committee Report: Inexpedient to Legislate; House Calendar 13, PG.537-538 "
124776,2010-02-10,"House Special Ordered to Beginning of Feb 17 Regular Calendar: Motion Adopted Without Objection; House Journal  16, PG.783 "
124776,2010-02-17,"House Ought to Pass: Motion Adopted Regular Calendar 192-158; House Journal  18, PG.987-990 "
124776,2010-03-24,"Senate Introduced and Referred to Judiciary; Senate Journal 11, Pg.260 "
124776,2010-04-07,"Senate Hearing: April 14, 2010, Room 103, State House, 2:15 p.m.; Senate Calendar 15 "
124776,2010-05-05,"Senate Committee Report: Inexpedient to Legislate, 5/12/10; Senate Calendar 19 "
124776,2010-05-12,"Senate Inexpedient to Legislate, Motion Adopted, Voice Vote === BILL KILLED === Senate Journal 18, Pg.474 "
124777,2009-12-10,"House Introduced 1/6/2010 and Referred to Children and Family Law; House Journal  6, PG.232 "
124777,2010-01-06,"House Public Hearing: 1/19/2010 1:15 PM Legislative Office Building 206 "
124777,2010-01-19,"House Executive Session: 1/28/2010 2:00 PM Legislative Office Building 206 "
124777,2010-02-09,"House Committee Report: Ought to Pass with Amendment #0430h for Feb 17 Consent Calendar (Vote 18-0); House Calendar 14, PG.578 "
124777,2010-02-09,"House Proposed Committee Amendment #0430h; House Calendar 14, PG.624 "
124777,2010-02-17,"House Amendment #0430h Adopted, Voice Vote; House Journal  18, PG.928 "
124777,2010-02-17,"House Ought to Pass with Amendment #0430h: Motion Adopted Voice Vote; House Journal  18, PG.928 "
124777,2010-03-03,"Senate Introduced and Referred to Health and Human Services "
124777,2010-03-10,"Senate Hearing: March 16, 2010, Room 103, State House, 8:30 a.m.; Senate Calendar 11 "
124777,2010-03-22,"Senate Committee Report: Ought to Pass 3/31/10; Senate Calendar 13 "
124777,2010-03-31,"Senate Ought to Pass, Motion Adopted, Voice Vote; OT3rdg; Senate Journal 12, Pg.269 "
124777,2010-03-31,"Senate Passed by Third Reading Resolution; Senate Journal 12, Pg.271 "
124777,2010-04-07,"Senate Enrolled; Senate Journal 13, Pg. 285 "
124777,2010-04-12,"House Enrolled; House Journal  32, PG.1577 "
124777,2010-05-24,"House Signed by the Governor 05/19/2010; Effective 07/18/2010; Chapter 0070 "
124778,2009-12-10,"House Introduced 1/6/2010 and Referred to Children and Family Law; House Journal  6, PG.232 "
124778,2010-01-06,"House Public Hearing: 1/19/2010 2:00 PM Legislative Office Building 206 "
124778,2010-01-19,"House Executive Session: 1/28/2010 2:00 PM Legislative Office Building 206 ==RECESSED== "
124778,2010-02-04,"House Continued Executive Session: 2/9/2010 1:15 PM Legislative Office Building 206 "
124778,2010-02-16,"House Committee Report: Ought to Pass with Amendment #0559h for Mar 3 Consent Calendar (Vote 12-0); House Calendar 17, PG.793 "
124778,2010-02-16,"House Proposed Committee Amendment #0559h; House Calendar 17, PG.838 "
124778,2010-03-03,"House Amendment #0559h Adopted, Voice Vote; House Journal  20 PG.1095-1096 "
124778,2010-03-03,"House Ought to Pass with Amendment #0559h: Motion Adopted Voice Vote; House Journal  20 PG.1095-1096 "
124778,2010-03-24,"Senate Introduced and Referred to Judiciary; Senate Journal 11, Pg.260 "
124778,2010-04-19,"Senate Hearing: May 4, 2010, Room 103, State House, 2:45 p.m.; Senate Calendar 17 "
124778,2010-05-05,"Senate Committee Report: Ought to Pass, 5/12/10; Senate Calendar 19 "
124778,2010-05-12,"Senate Ought to Pass, Motion Adopted, Voice Vote; OT3rdg "
124778,2010-05-12,"Senate Passed by Third Reading Resolution "
124778,2010-05-19,"Senate Enrolled "
124778,2010-05-19,"House Enrolled "
124778,2010-06-16,"House Signed by the Governor 06/14/2010; Effective 08/13/2010; Chapter 0136 "
124779,2009-12-10,"House Introduced 1/6/2010 and Referred to Children and Family Law; House Journal  6, PG.232 "
124779,2010-01-06,"House Public Hearing: 1/19/2010 11:00 Amendment Legislative Office Building 206 "
124779,2010-01-27,"House Subcommittee Work Session: 2/4/2010 11:00 Amendment Legislative Office Building 206 "
124779,2010-02-04,"House Executive Session: 2/11/2010 11:00 Amendment Legislative Office Building 206 ==RECESSED== "
124779,2010-02-11,"House Subcommittee Work Session: 2/16/2010 11:00 Amendment Legislative Office Building 206 "
124779,2010-02-11,"House Continued Executive Session: 2/16/2010 1:15 PM Legislative Office Building 206 "
124779,2010-02-18,"House Majority Committee Report: Inexpedient to Legislate for Mar 10 (Vote 9-7; Regular Calendar); House Calendar 19, PG.1025 "
124779,2010-02-18,"House Minority Committee Report: Ought to Pass; House Calendar 19, PG.1025 "
124779,2010-03-10,"House Special Order to Regular Place on Mar 11 Calendar, Without Objection; House Journal  23, PG.1294 "
124779,2010-03-11,"House Special Order to Beginning of Mar 17 Calendar, Without Objection; House Journal  24, PG.1349 "
124779,2010-03-17,"House Inexpedient to Legislate: Motion Failed Division Vote 143-165; House Journal  26, PG.1375 "
124779,2010-03-17,"House Ought to Pass (Rep Gile): Motion Adopted Division Vote 257-51; House Journal  26, PG.1375 "
124779,2010-03-24,"Senate Introduced and Referred to Health and Human Services; Senate Journal 11, Pg.260 "
124779,2010-03-31,"Senate Hearing: April 13, 2010, Room 103, State House, 9:15 a.m.; Senate Calendar 14 "
124779,2010-04-13,"Senate Committee Report: Ought to Pass 4/21/10; Senate Calendar 16 "
124779,2010-04-21,"Senate Ought to Pass, Motion Adopted, Voice Vote; OT3rdg "
124779,2010-04-21,"Senate Passed by Third Reading Resolution "
124779,2010-05-05,"Senate Enrolled "
124779,2010-05-05,"House Enrolled; House Journal  38, PG.1914 "
124779,2010-05-24,"House Signed by the Governor 05/19/2010; Effective 01/01/2011; Chapter 0071 "
124780,2009-12-10,"House Introduced 1/6/2010 and Referred to Labor, Industrial and Rehabilitative Services; House Journal  6, PG.232 "
124780,2010-01-06,"House Vacated from Labor, Industrial & Rehab Svcs & Referred to Children & Family Law: Motion Adopted Voice Vote; House Journal  6, PG.249 "
124780,2010-01-12,"House Public Hearing: 1/28/2010 1:15 PM Legislative Office Building 206 "
124780,2010-01-27,"House ==DATE CHANGE== Executive Session: 2/4/2010 1:15 PM Legislative Office Building 206 (Orig 2/2/10) "
124780,2010-02-08,"House Committee Report: Ought to Pass with Amendment #0511h for Feb 17 Consent Calendar (Vote 18-0); House Calendar 14, PG.578 "
124780,2010-02-08,"House Proposed Committee Amendment #0511h; House Calendar 14, PG.624 "
124780,2010-02-17,"House Amendment #0511h Adopted, Voice Vote; House Journal  18, PG.928 "
124780,2010-02-17,"House Ought to Pass with Amendment #0511h: Motion Adopted Voice Vote; House Journal  18, PG.928 "
124780,2010-03-24,"Senate Introduced and Referred to Judiciary; Senate Journal 11, Pg.260 "
124780,2010-04-07,"Senate Hearing: April 21, 2010, Room 103, State House, 2:00 p.m.; Senate Calendar 15 "
124780,2010-04-22,"Senate Committee Report: Inexpedient to Legislate 4/28/10; Senate Calendar 17 "
124780,2010-04-28,"Senate Inexpedient to Legislate, Motion Adopted, Voice Vote === BILL KILLED ===; Senate Journal 16, Pg.348 "
124781,2009-12-10,"House Introduced 1/6/2010 and Referred to State-Federal Relations and Veterans Affairs; House Journal  6, PG.232 "
124781,2010-01-05,"House Public Hearing: 1/19/2010 3:00 PM Legislative Office Building 305 "
124781,2010-01-19,"House ==CANCELLED== Executive Session: 1/27/2010 10:00 Amendment Legislative Office Building 203 "
124781,2010-01-26,"House Executive Session: 2/4/2010 1:45 PM Legislative Office Building 203 "
124781,2010-02-17,"House Majority Committee Report: Inexpedient to Legislate for Mar 10 (Vote 10-6; Regular Calendar); House Calendar 19, PG.1037 "
124781,2010-02-17,"House Minority Committee Report: Ought to Pass; House Calendar 19, PG.1037 "
124781,2010-03-10,"House Special Ordered to Regular Place on Mar 11 Calendar, Without Objection; House Journal  23, PG.1294 "
124781,2010-03-11,"House Inexpedient to Legislate: Motion Adopted Regular Calendar 176-139; House Journal  24, PG.1330-1332 "
124782,2010-01-06,"House Introduced and Referred to Judiciary; House Journal  6, PG.232 "
124782,2010-01-06,"House Public Hearing: 1/7/2010 10:00 Amendment Legislative Office Building 208 "
124782,2010-01-26,"House Executive Session: 2/2/2010 10:00 Amendment Legislative Office Building 208 "
124782,2010-02-10,"House Committee Report: Ought to Pass for Feb 17 Consent Calendar (vote 18-0); House Calendar 14, PG.591 "
124782,2010-02-17,"House Ought to Pass: Motion Adopted Voice Vote; House Journal  18, PG.961 "
124782,2010-03-03,"Senate Introduced and Referred to Judiciary "
124782,2010-03-16,"Senate Hearing: March 23, 2010, Room 103, State House, 2:45 p.m.; Senate Calendar 12 "
124782,2010-04-28,"Senate Committee Report: Ought to Pass, 5/5/10; Senate Calendar 18 "
124782,2010-05-05,"Senate Ought to Pass, Motion Adopted, Voice Vote; OT3rdg "
124782,2010-05-05,"Senate Passed by Third Reading Resolution "
124782,2010-05-13,"House Enrolled; House Journal  42, PG.2153 "
124782,2010-05-13,"Senate Enrolled "
124782,2010-06-15,"House Signed by the Governor 06/09/2010; Effective 08/08/2010; Chapter 0124 "
124783,2009-12-10,"House Introduced 1/6/2010 & Referred to Executive Departments & Administration; House Journal  6, PG.232 "
124783,2010-01-26,"House Public Hearing: 2/2/2010 2:45 PM Legislative Office Building 305-307 "
124783,2010-02-02,"House Executive Session: 2/9/2010 10:30 Amendment Legislative Office Building 306 "
124783,2010-02-10,"House Committee Report: Ought to Pass for Feb 17 Consent Calendar (vote 17-0); House Calendar 14, PG.586 "
124783,2010-02-17,"House Ought to Pass: Motion Adopted Voice Vote; House Journal  18, PG.953 "
124783,2010-03-03,"Senate Introduced and Referred to Executive Departments and Administration "
124783,2010-03-18,"Senate Hearing: March 23, 2010, Room 101, Legislative Office Building, 2:45 p.m.; Senate Calendar 12 "
124783,2010-03-19,"Senate Hearing: === CANCELLED === March 23, 2010, Room 101, Legislative Office Building, 2:45 p.m.; Senate Calendar 12A "
124783,2010-03-19,"Senate Hearing: === RESCHEDULED === March 30, 2010, Room 101, Legislative Office Building, 2:00 p.m.; Senate Calendar 12A "
124783,2010-03-31,"Senate Committee Report: Ought to Pass 4/7/10; Senate Calendar 14 "
124783,2010-04-07,"Senate Ought to Pass, Motion Adopted, Voice Vote; OT3rdg; Senate Journal 13, Pg.276 "
124783,2010-04-07,"Senate Passed by Third Reading Resolution; Senate Journal 13, Pg 282 "
124783,2010-04-14,"House Enrolled; House Journal  32, PG.1587 "
124783,2010-04-14,"Senate Enrolled; Senate Journal 14, Pg.302 "
124783,2010-05-24,"House Signed by the Governor 05/18/2010; Effective 07/17/2010; Chapter 0048 "
124784,2009-12-10,"House Introduced 1/6/2010 and Referred to Resources, Recreation and Development; House Journal  6, PG.232 "
124784,2010-01-20,"House Public Hearing: 1/26/2010 10:00 Amendment Legislative Office Building 305 "
124784,2010-01-27,"House Full Committee Work Session: 1/28/2010 12:30 PM Legislative Office Building 305 "
124784,2010-01-27,"House Executive Session: 2/4/2010 9:30 Amendment Legislative Office Building 305 "
124784,2010-02-08,"House Committee Report: Inexpedient to Legislate for Feb 17 Consent Calendar (Vote 19-1); House Calendar 14, PG.597 "
124784,2010-02-17,"House Inexpedient to Legislate: Motion Adopted Voice Vote; House Journal  18, PG.976 "
124785,2009-12-10,"House Introduced 1/6/2010 and Referred to Resources, Recreation and Development; House Journal  6, PG.232 "
124785,2010-02-02,"House Public Hearing: 2/9/2010 2:00 PM Legislative Office Building 305 "
124785,2010-02-03,"House Executive Session: 2/11/2010 9:30 Amendment Legislative Office Building 305 "
124785,2010-02-11,"House Committee Report: Inexpedient to Legislate for Mar 3 Consent Calendar (Vote 18-0); House Calendar 17, PG.811 "
124785,2010-03-03,"House Inexpedient to Legislate: Motion Adopted Voice Vote; House Journal  20, PG.1156 "
124786,2009-12-10,"House Introduced 1/6/2010 and Referred to Judiciary; House Journal  6, PG.232 "
124786,2010-01-15,"House Public Hearing: 1/28/2010 2:00 PM Legislative Office Building 208 "
124786,2010-02-09,"House Executive Session: 2/16/2010 10:00 Amendment Legislative Office Building 208 (Continued 2/18/2010 10:00 Amendment Legislative Office Building 208 If Necessary) "
124786,2010-02-17,"House Committee Report: Ought to Pass for Mar 3 Consent Calendar (vote 14-0); House Calendar 17, PG.805 "
124786,2010-03-03,"House Ought to Pass: Motion Adopted Voice Vote; House Journal  20, PG.1145 "
124786,2010-03-24,"Senate Introduced and Referred to Judiciary; Senate Journal 11, Pg.260 "
124786,2010-04-19,"Senate Hearing: May 4, 2010, Room 103, State House, 3:00 p.m.; Senate Calendar 17 "
124786,2010-05-05,"Senate Committee Report: Ought to Pass, 5/12/10; Senate Calendar 19 "
124786,2010-05-12,"Senate Ought to Pass, Motion Adopted, Voice Vote; OT3rdg "
124786,2010-05-12,"Senate Passed by Third Reading Resolution "
124786,2010-05-19,"Senate Enrolled "
124786,2010-05-19,"House Enrolled "
124786,2010-06-16,"House Signed by the Governor 06/14/2010; Effective 01/01/2011; Chapter 0137 "
124787,2009-12-10,"House Introduced 1/6/2010 and Referred to Education; House Journal  6, PG.232 "
124787,2010-01-05,"House Public Hearing: 1/12/2010 10:30 Amendment Legislative Office Building 207 "
124787,2010-01-05,"House ==CANCELLED== Executive Session: 1/20/2010 1:00 PM Legislative Office Building 207 "
124787,2010-01-19,"House Subcommittee Work Session: 1/28/2010 9:00 Amendment Legislative Office Building 207 "
124787,2010-01-27,"House Executive Session: 2/2/2010 10:00 Amendment Legislative Office Building 207 "
124787,2010-02-02,"House Committee Report: Ought to Pass with Amendment #0419h for Feb 10 Consent Calendar (vote 20-0); House Calendar 13, PG.524 "
124787,2010-02-02,"House Proposed Committee Amendment #0419h; House Calendar 13, PG.560-561 "
124787,2010-02-10,"House Removed from Consent Calendar (Rep Vaillancourt); House Journal  16, PG.748 "
124787,2010-02-10,"House Special Ordered to Regular Place in Feb 17 Consent Calendar: Motion Adopted Without Objection; House Journal  16, PG.783 "
124787,2010-02-17,"House Removed from Consent Calendar (Rep Webb); House Journal  18, PG.927 "
124787,2010-02-17,"House Special Ordered to Next Session Day Beginning of Calendar: Motion Adopted Without Objection; House Journal  18, PG.1015 "
124787,2010-03-03,"House Amendment #0419h Failed, Regular Calendar 129-205; House Journal  20, PG.1085-1088 "
124787,2010-03-03,"House Lay on the Table (Rep Eaton): Motion Adopted Voice Vote; House Journal  20, PG.1088 "
124787,2010-03-24,"House Remove from the Table (Rep Rous): Motion Adopted Division Vote 219-140; House Journal  30, PG.1516 "
124787,2010-03-24,"House Floor Amendment #1090h (Rep Rous) Adopted, Division Vote 225-128; House Journal  30, PG.1516-1517 "
124787,2010-03-24,"House Ought to Pass with Amendment #1090h: Motion Adopted Division Vote 234-116; House Journal  30, PG.1516-1517 "
124787,2010-03-24,"Senate Introduced and Referred to Education; Senate Journal 11, Pg.261 "
124787,2010-03-29,"Senate Hearing: March 30, 2010, Room 103, Legislative Office Building, 10:15 a.m.; Senate Calendar 13 "
124787,2010-04-14,"Senate Committee Report: Ought to Pass with Amendment 1360s, 4/21/10; Senate Calendar 16 "
124787,2010-04-21,"Senate Committee Amendment 1360s, Amendment Adopted, Voice Vote; Senate Journal 15, Pg.314 "
124787,2010-04-21,"Senate Ought to Pass with Amendment 1360s, Motion Adopted, Voice Vote; OT3rdg "
124787,2010-04-21,"Senate Passed by Third Reading Resolution; Senate Journal 15, Pg.325 "
124787,2010-05-05,"House House Concurs with Senate Amendment 1360s (Rep Rous): Motion Adopted Voice Vote; House Journal  38, PG.1882 "
124787,2010-05-13,"Senate Enrolled Bill Amendment #2079 Adopted "
124787,2010-05-19,"House Enrolled Bill Amendment #2079 Adopted; House Journal  46, PG.2238 "
124787,2010-05-19,"House Enrolled; House Journal  46, PG.2247 "
124787,2010-05-19,"Senate Enrolled "
124787,2010-06-16,"House Signed by the Governor 06/14/2010; Chapter 0138 "
124787,2010-06-16,"House I. Section 2 Effective as Provided in Section 3 "
124787,2010-06-16,"House II. Remainder Effective 08/13/2010 "
124788,2009-12-10,"House Introduced 1/6/2010 and Referred to Election Law; House Journal  6, PG.232 "
124788,2009-12-16,"House Public Hearing: 1/12/2010 11:00 Amendment Legislative Office Building 308 "
124788,2010-01-06,"House Executive Session: 2/9/2010 10:00 Amendment Legislative Office Building 308 "
124788,2010-02-10,"House Committee Report: Inexpedient to Legislate for Feb 17 Consent Calendar (vote 17-0); House Calendar 14, PG.584 "
124788,2010-02-17,"House Inexpedient to Legislate: Motion Adopted Voice Vote; House Journal  18, PG.938 "
124789,2010-01-06,"House Introduced and Referred to Health, Human Services and Elderly Affairs; House Journal  6, PG.232  "
124789,2010-01-06,"House Public Hearing: 1/14/2010 11:00 Amendment Legislative Office Building 205 "
124789,2010-01-06,"House Executive Session: 1/20/2010 9:30 Amendment Legislative Office Building 205 "
124789,2010-01-20,"House Committee Report: Ought to Pass for Jan 27 Consent Calendar (vote 16-1); House Calendar 8, PG.333 "
124789,2010-01-27,"House Ought to Pass: Motion Adopted Voice Vote; House Journal  12, PG.502 "
124789,2010-01-27,"House Referred to Finance; House Journal  12, PG.502 "
124789,2010-02-09,"House Full Committee Work Session: 2/16/2010 10:00 Amendment Legislative Office Building 210-211 "
124789,2010-02-09,"House Executive Session: 2/18/2010 11:00 Amendment Legislative Office Building 210-211 "
124789,2010-02-23,"House Majority Comm Report: Ought to Pass with Amendment #0771h for Mar 24 (Vote 13-9; Regular Calendar); House Calendar 22, PG.1222-1223 "
124789,2010-02-23,"House Proposed Majority Committee Amendment #0771h; House Calendar 22, PG.1238 "
124789,2010-02-23,"House Minority Committee Report: Refer to Interim Study; House Calendar 22, PG.1222-1223 "
124789,2010-03-24,"House Amendment #0771h Adopted, Voice Vote; House Journal  30, PG.1493-1494 "
124789,2010-03-24,"House Ought to Pass with Amendment #0771h: Motion Adopted Division Vote 201-153; House Journal  30, PG.1493-1494 "
124789,2010-03-24,"Senate Introduced and Referred to Health and Human Services; Senate Journal 11, Pg.261 "
124789,2010-03-31,"Senate Hearing: April 6, 2010, Room 103, State House, 8:30 a.m.; Senate Calendar 14 "
124789,2010-04-06,"Senate Committee Report: Ought to Pass 4/14/10; Senate Calendar 15 "
124789,2010-04-14,"Senate Ought to Pass, Motion Adopted, Voice Vote; OT3rdg; Senate Journal 14, Pg.290 "
124789,2010-04-14,"Senate Passed by Third Reading Resolution; Senate Journal 14, Pg.295 "
124789,2010-04-21,"Senate Enrolled "
124789,2010-04-21,"House Enrolled; House Journal  35, PG.1671 "
124789,2010-05-24,"House Signed by the Governor 05/19/2010; Effective 07/18/2010; Chapter 0081 "
124790,2009-12-10,"House Introduced 1/6/2010 and Referred to Science, Technology and Energy; House Journal  6, PG.233 "
124790,2009-12-16,"House Public Hearing: 1/14/2010 11:00 Amendment Legislative Office Building 304 "
124790,2010-01-20,"House Executive Session: 1/28/2010 10:15 Amendment Legislative Office Building 304 "
124790,2010-02-01,"House Committee Report: Ought to Pass for Feb 10 Consent Calendar (vote 13-0); House Calendar 13, PG.533 "
124790,2010-02-10,"House Removed from Consent Calendar (Rep Vaillancourt); House Journal  16, PG.748 "
124790,2010-02-10,"House Special Ordered to Regular Place in Feb 17 Consent Calendar: Motion Adopted Without Objection; House Journal  16, PG.783 "
124790,2010-02-17,"House Ought to Pass: Motion Adopted Voice Vote; House Journal  18, PG.977 "
124790,2010-03-03,"Senate Introduced and Referred to Public and Municipal Affairs "
124790,2010-03-11,"Senate Hearing: March 18, 2010, Room 103, Legislative Office Building, 8:45 a.m.; Senate Calendar 11 "
124790,2010-03-22,"Senate Committee Report: Ought to Pass 3/31/10; Senate Calendar 13 "
124790,2010-03-31,"Senate Ought to Pass, Motion Adopted, Voice Vote; OT3rdg; Senate Journal 12, Pg.270 "
124790,2010-03-31,"Senate Passed by Third Reading Resolution; Senate Journal 12, Pg.271 "
124790,2010-04-07,"Senate Enrolled; Senate Journal 13, Pg.285 "
124790,2010-04-12,"House Enrolled; House Journal  32, PG.1577 "
124790,2010-05-24,"House Signed by the Governor 05/18/2010; Effective 07/17/2010; Chapter 0049 "
124791,2009-12-10,"House Introduced 1/6/2010 and Referred to Health, Human Services and Elderly Affairs; House Journal  6, PG.233 "
124791,2010-01-13,"House ==RESCHEDULED== Public Hearing: 1/28/2010 10:00 Amendment Legislative Office Building 205 (Orig 2:00 PM) "
124791,2010-01-20,"House Executive Session: 2/9/2010 1:45 PM Legislative Office Building 205 "
124791,2010-02-10,"House Committee Report: Inexpedient to Legislate for Feb 17 Consent Calendar (vote 18-0); House Calendar 14, PG.589 "
124791,2010-02-17,"House Inexpedient to Legislate: Motion Adopted Voice Vote; House Journal  18, PG.959 "
124792,2009-12-10,"House Introduced 1/6/2010 and Referred to Executive Departments and Administration; House Journal  6, PG.233 "
124792,2010-02-02,"House Public Hearing: 2/9/2010 1:45 PM Legislative Office Building 306 "
124792,2010-02-09,"House Subcommittee Work Session: 2/11/2010 9:02 Amendment Legislative Office Building 306 "
124792,2010-02-10,"House Executive Session: 2/16/2010 10:30 Amendment Legislative Office Building 306 "
124792,2010-02-17,"House Committee Report: Inexpedient to Legislate for March 3 Consent Calendar (vote 15-0); House Calendar 17, PG.800 "
124792,2010-03-03,"House Inexpedient to Legislate: Motion Adopted Voice Vote; House Journal  20, PG.1137 "
124793,2009-12-10,"House Introduced 1/6/2010 and Referred to Transportation; House Journal  6, PG.233 "
124793,2010-01-12,"House Public Hearing: 1/21/2010 1:00 PM Legislative Office Building 203 "
124793,2010-01-19,"House Executive Session: 1/26/2010 10:45 Amendment Legislative Office Building 203 "
124793,2010-01-27,"House Committee Report: Ought to Pass with Amendment #0244h for Feb 3 Consent Calendar (vote 13-0); House Calendar 11, PG.465 "
124793,2010-01-27,"House Proposed Committee Amendment #0244h; House Calendar 11, PG.488 "
124793,2010-02-03,"House Removed from Consent Calendar (Rep W.O'Brien); House Journal  15, PG.666 "
124793,2010-02-03,"House Amendment #0244h Adopted, Voice Vote; House Journal  15, PG.743 "
124793,2010-02-03,"House Ought to Pass with Amendment #0244h: Motion Adopted Regular Calendar 192-87; House Journal  15, PG.743-745 "
124793,2010-03-03,"Senate Introduced and Referred to Transportation & Interstate Cooperation "
124793,2010-03-18,"Senate Hearing: April 15, 2010, Room 101, Legislative Office Building, 11:10 a.m.; Senate Calendar 12 "
124793,2010-04-15,"Senate Committee Report: Ought to Pass 4/21/10; Senate Calendar 16 "
124793,2010-04-21,"Senate Without Objection, Chair moved to Special Order to 04/28/10 "
124793,2010-04-21,"Senate Committee Report: Ought to Pass 4/28/10 "
124793,2010-04-28,"Senate Ought to Pass, Motion Adopted, Voice Vote; OT3rdg "
124793,2010-04-28,"Senate Passed by Third Reading Resolution "
124793,2010-05-12,"House Enrolled; House Journal  41, PG.2097 "
124793,2010-05-12,"Senate Enrolled "
124793,2010-05-27,"House Signed by the Governor 05/26/2010; Effective 01/01/2011; Chapter 0099 "
124794,2009-12-10,"House Introduced 1/6/2010 and Referred to Resources, Recreation and Development; House Journal  6, PG.233 "
124794,2010-02-02,"House Public Hearing: 2/9/2010 12:10 PM Legislative Office Building 305 "
124794,2010-02-03,"House Executive Session: 2/11/2010 9:30 Amendment Legislative Office Building 305 "
124794,2010-02-11,"House Committee Report: Inexpedient to Legislate for Mar 3 Consent Calendar (Vote 17-0); House Calendar 17, PG.811-819 "
124794,2010-03-03,"House Inexpedient to Legislate: Motion Adopted Voice Vote; House Journal  20, PG.1156 "
124795,2009-12-10,"House Introduced 1/6/2010 and Referred to Health, Human Services and Elderly Affairs; House Journal  6, PG.233 "
124795,2010-01-20,"House Public Hearing: 2/4/2010 10:00 Amendment Legislative Office Building 205 "
124795,2010-01-20,"House Executive Session: 2/9/2010 1:45 PM Legislative Office Building 205 "
124795,2010-02-09,"House Committee Report: Inexpedient to Legislate for Feb 17 Consent Calendar (Vote 19-0); House Calendar 14, PG.589 "
124795,2010-02-17,"House Removed from Consent Calendar (Rep Gidge); House Journal  18, PG.927 "
124795,2010-02-17,"House Special Ordered to Next Session Day Beginning of Calendar: Motion Adopted Without Objection; House Journal  18, PG.1015 "
124795,2010-03-03,"House Inexpedient to Legislate: Motion Adopted Voice Vote; House Journal  20, PG.1090 "
124796,2009-12-10,"House Introduced 1/6/2010 and Referred to Commerce and Consumer Affairs; House Journal  6, PG.233 "
124796,2010-01-22,"House Public Hearing: 2/9/2010 1:00 PM Legislative Office Building 302 "
124796,2010-02-02,"House Executive Session: 2/11/2010 10:00 Amendment Legislative Office Building 302 "
124796,2010-02-18,"House Committee Report: Inexpedient to Legislate for March 3 Consent Calendar (vote 15-1); House Calendar 17, PG.794 "
124796,2010-03-03,"House Inexpedient to Legislate: Motion Adopted Voice Vote; House Journal  20 PG.1098 "
124797,2009-12-10,"House Introduced 1/6/2010 and Referred to Commerce and Consumer Affairs; House Journal  6, PG.233 "
124797,2009-12-16,"House ===CANCELLED=== Public Hearing: 1/12/2010 9:30 Amendment Legislative Office Building 302 "
124797,2010-01-06,"House Public Hearing: 1/21/2010 1:45 PM Legislative Office Building 302 "
124797,2010-01-27,"House Executive Session: 2/4/2010 10:00 Amendment Legislative Office Building 302 ==RECESSED== "
124797,2010-02-04,"House Continued Executive Session: 2/11/2010 10:00 Amendment Legislative Office Building 302 "
124797,2010-02-17,"House Committee Report: Refer to Interim Study for Mar 10 Consent Calendar (Vote 13-3); House Calendar 19, PG.1025 "
124797,2010-03-10,"House Special Order to Regular Place on Mar 11 Calendar, Without Objection; House Journal  23, PG.1294 "
124797,2010-03-11,"House Special Order to Beginning of Mar 17 Calendar, Without Objection; House Journal  24, PG.1349 "
124797,2010-03-17,"House Refer to Interim Study: Motion Adopted Voice Vote; House Journal  26, PG.1375 "
124797,2010-03-17,"House Referred to Commerce and Consumer Affairs for Interim Study; House Journal  26, PG.1365 "
124797,2010-09-22,"House Interim Study - Executive Session 10/26/2010 10:00 Legislative Office Building 302 "
124798,2009-12-10,"House Introduced 1/6/2010 and Referred to Executive Departments and Administration; House Journal  6, PG.233 "
124798,2010-01-20,"House Public Hearing: 1/28/2010 10:15 Amendment Legislative Office Building 306 "
124798,2010-01-29,"House Subcommittee Work Session: 2/4/2010 9:00 Amendment Legislative Office Building 306 "
124798,2010-02-02,"House Subcommittee Work Session: 2/9/2010 9:00 Amendment Legislative Office Building 306 "
124798,2010-02-04,"House Executive Session: 2/9/2010 10:30 Amendment Legislative Office Building 306 "
124798,2010-02-11,"House Committee Report: Ought to Pass with Amendment #0502h for Feb 17 Consent Calendar (Vote 15-1); House Calendar 14, PG.586 "
124798,2010-02-11,"House Proposed Committee Amendment #0502h; House Calendar 14, PG.625-626 "
124798,2010-02-17,"House Amendment #0502h Adopted, Voice Vote; House Journal  18, PG.953 "
124798,2010-02-17,"House Ought to Pass with Amendment #0502h: Motion Adopted Voice Vote; House Journal  18, PG.953 "
124798,2010-03-24,"Senate Introduced and Referred to Executive Departments and Administration; Senate Journal 11, Pg.261 "
124798,2010-04-21,"Senate Hearing: April 27, 2010, Room 101, Legislative Office Building, 2:00 p.m.; Senate Calendar 17 "
124798,2010-04-28,"Senate Committee Report: Ought to Pass, 5/5/10; Senate Calendar 18 "
124798,2010-05-05,"Senate Ought to Pass, Motion Adopted, Voice Vote; OT3rdg "
124798,2010-05-05,"Senate Passed by Third Reading Resolution "
124798,2010-05-12,"Senate Enrolled Bill Amendment #2025 Adopted "
124798,2010-05-13,"House Enrolled Bill Amendment #2025 Adopted; House Journal  42, PG.2153 "
124798,2010-05-19,"Senate Enrolled "
124798,2010-05-19,"House Enrolled; House Journal  46, PG.2244 "
124798,2010-06-16,"House Signed by the Governor 06/14/2010; Effective 08/13/2010; Chapter 0139 "
124799,2009-12-10,"House Introduced 1/6/2010 and Referred to Commerce and Consumer Affairs; House Journal  6, PG.233 "
124799,2010-01-22,"House Public Hearing: 2/1/2010 10:30 Amendment Legislative Office Building 302 "
124799,2010-01-27,"House Executive Session: 2/4/2010 10:00 Amendment Legislative Office Building 302 "
124799,2010-02-05,"House Committee Report: Ought to Pass for Feb 17 Consent Calendar (Vote 16-0); House Calendar 14, PG.579 "
124799,2010-02-17,"House Ought to Pass: Motion Adopted Voice Vote; House Journal  18, PG.929 "
124799,2010-03-24,"Senate Introduced and Referred to Commerce, Labor and Consumer Protection; Senate Journal 11, Pg.261 "
124799,2010-04-06,"Senate Hearing: April 20, 2010, Room 102, Legislative Office Building, 9:30 a.m.; Senate Calendar 15 "
124799,2010-04-20,"Senate Committee Report: Ought to Pass 4/28/10; Senate Calendar 17 "
124799,2010-04-28,"Senate Ought to Pass, Motion Adopted, Voice Vote; OT3rdg "
124799,2010-04-28,"Senate Passed by Third Reading Resolution "
124799,2010-05-12,"House Enrolled; House Journal  41, PG.2097 "
124799,2010-05-12,"Senate Enrolled "
124799,2010-06-15,"House Signed by the Governor 06/09/2010; Effective 01/01/2011; Chapter 0125 "
124800,2010-01-06,"House Introduced and Referred to Executive Departments and Administration; House Journal  6, PG.233 "
124800,2010-01-06,"House Public Hearing: 1/12/2010 2:00 PM Legislative Office Building 306 "
124800,2010-01-20,"House Executive Session: 1/26/2010 10:30 Amendment Legislative Office Building 306 "
124800,2010-01-27,"House Committee Report: Ought to Pass for Feb 3 Consent Calendar (vote 19-0); House Calendar 11, PG.462 "
124800,2010-02-03,"House Ought to Pass: Motion Adopted Voice Vote; House Journal  15, PG.669-670 "
124800,2010-03-24,"Senate Introduced and Referred to Commerce, Labor and Consumer Protection; Senate Journal 11, Pg.261 "
124800,2010-04-06,"Senate Hearing: April 22, 2010, Room 103, Legislative Office Building, 1:15 p.m.; Senate Calendar 15 "
124800,2010-04-22,"Senate Committee Report: Ought to Pass 4/28/10; Senate Calendar 17 "
124800,2010-04-28,"Senate Ought to Pass, Motion Adopted, Voice Vote; OT3rdg "
124800,2010-04-28,"Senate Passed by Third Reading Resolution "
124800,2010-05-12,"House Enrolled; House Journal  41, PG.2097 "
124800,2010-05-12,"Senate Enrolled "
124800,2010-05-26,"House Signed by the Governor 05/25/2010; Effective 07/24/2010; Chapter 0093 "
124801,2009-12-10,"House Introduced 1/6/2010 and Referred to Education; House Journal  6, PG.233 "
124801,2010-01-05,"House Public Hearing: 1/12/2010 11:30 Amendment Legislative Office Building 207 "
124801,2010-01-05,"House Executive Session: 1/20/2010 1:00 PM Legislative Office Building 207 "
124801,2010-01-21,"House Committee Report: Refer to Interim Study for Jan 27 Consent Calendar (vote 18-1); House Calendar 8, PG.331 "
124801,2010-01-27,"House Refer to Interim Study: Motion Adopted Voice Vote; House Journal  12, PG.499 "
124801,2010-03-17,"House Referred to Education for Interim Study; House Journal  26, PG.1365 "
124801,2010-09-15,"House Interim Study - Executive Session: 10/13/2010 11:00 Amendment Legislative Office Building 207 "
124802,2009-12-10,"House Introduced 1/6/2010 and Referred to Resources, Recreation and Development; House Journal  6, PG.233 "
124802,2010-01-20,"House Public Hearing: 1/26/2010 11:00 Amendment Legislative Office Building 305 "
124802,2010-01-27,"House Executive Session: 2/2/2010 10:00 Amendment Legislative Office Building 305 "
124802,2010-02-03,"House Committee Report: Ought to Pass with Amendment #0261h (New Title) for Feb 10 Consent Calendar (vote 16-1); House Calendar 13, PG.532 "
124802,2010-02-03,"House Proposed Committee Amendment #0261h (New Title); House Calendar 13, PG.561-562 "
124802,2010-02-10,"House Removed from Consent Calendar (Rep Vaillancourt); House Journal  16, PG.748 "
124802,2010-02-10,"House Special Ordered to Regular Place in Feb 17 Consent Calendar: Motion Adopted Without Objection; House Journal  16, PG.783 "
124802,2010-02-17,"House Removed from Consent Calendar (Rep Groen); House Journal  18, PG.927 "
124802,2010-02-17,"House Special Ordered to Next Session Day Beginning of Calendar: Motion Adopted Without Objection; House Journal  18, PG.1015 "
124802,2010-03-03,"House Amendment #0261h (New Title) Adopted, Voice Vote; House Journal  20, PG.1093-1094 "
124802,2010-03-03,"House Ought to Pass with Amendment #0261h (New Title): Motion Adopted Division Vote 186-124; House Journal  20, PG.1093-1094 "
124802,2010-03-03,"House Suspend Rules, Allow Sec Comm Ref (Reps Almy & Major): Motion Adopted Division Vote 301-24 by Req 2/3; House Journal  20 PG.1094 "
124802,2010-03-03,"House Referred to Ways and Means "
124802,2010-03-04,"House Full Committee Work Session: 3/8/2010 9:30 Amendment Legislative Office Building 202 "
124802,2010-03-10,"House Executive Session: 3/16/2010 10:00 Amendment Legislative Office Building 202 (Continued 3/17/10 9:00 Amendment Legislative Office Building 202 If Necessary) "
124802,2010-03-18,"House Majority Committee Report: Ought to Pass with Amendment #0996h for Mar 24 (Vote 17-3; Regular Calendar); House Calendar 22, PG.1227 "
124802,2010-03-18,"House Proposed Majority Committee Amendment #0996h; House Calendar 22, PG.1238 "
124802,2010-03-18,"House Minority Committee Report: Inexpedient to Legislate; House Calendar 22, PG.1227 "
124802,2010-03-24,"House Amendment #0996h Adopted, Voice Vote; House Journal  30, PG.1487-1488 "
124802,2010-03-24,"House Ought to Pass with Amendment #0996h: Motion Adopted Division Vote 206-108; House Journal  30, PG.1487-1488 "
124802,2010-03-24,"Senate Introduced and Referred to Energy, Environment and Economic Development; Senate Journal 11, Pg.261 "
124802,2010-04-09,"Senate Hearing: April 22, 2010, Room 102, Legislative Office Building, 9:30 a.m.; Senate Calendar 15 "
124802,2010-05-06,"Senate Committee Report: Ought to Pass with Amendment 1958s, 5/12/10; Senate Calendar 19 "
124802,2010-05-12,"Senate Committee Amendment 1958s Not Voted On "
124802,2010-05-12,"Senate Sen. Fuller Clark Moved Laid On Table Motion Adopted, Voice Vote; Senate Journal 18, Pg.451 "
124802,2010-05-13,"Senate Sen. Fuller Clark Moved Remove From Table, Motion Adopted, Voice Vote; Senate Journal 19, Pg.507 "
124802,2010-05-13,"Senate Committee Amendment 1958s, Amendment Failed, Voice Vote; Senate Journal 19, Pg.512 "
124802,2010-05-13,"Senate Sen. Fuller Clark Floor Amendment 2071s, New Title, Amendment Adopted, Voice Vote; Senate Journal 19, Pg.517 "
124802,2010-05-13,"Senate Ought to Pass with Amendment 2071s, New Title, Motion Adopted, Voice Vote; OT3rdg; Senate Journal 19, Pg.517 "
124802,2010-05-13,"Senate Passed by Third Reading Resolution; Senate Journal 19, Pg.633 "
124802,2010-05-19,"House House Non-Concurs with Senate Amendment and Req Comm of Conf (Reps Spang & Almy): Motion Adopted Voice Vote; House Journal  46, PG.2195 "
124802,2010-05-19,"House Speaker Appoints: Reps Spang, McClammer, Rous & C.Christensen; House Journal  46, PG.2195 "
124802,2010-05-19,"Senate Sen. Fuller Clark accedes to House Request for Committee of Conference, Motion Adopted, Voice Vote; Senate Journal 20, Pg.656 "
124802,2010-05-19,"Senate President Appoints: Senators Fuller Clark, Merrill and Odell; Senate Journal 20, Pg.656 "
124802,2010-05-21,"House Conference Committee Meeting: 5/24/2010 3:00 PM Legislative Office Building 305 "
124802,2010-05-27,"Senate Conference Committee Report 2153; Senate Amendment + New Amendment, Filed "
124802,2010-06-02,"Senate Conference Committee Report 2153; Adopted, Voice Vote; Senate Journal 21, Pg.670 "
124802,2010-06-02,"House Conference Committee Report #2153 Adopted, Voice Vote; House Journal  51, PG.2311 "
124802,2010-06-02,"House Enrolled; House Journal  51, PG.2327 "
124802,2010-06-02,"Senate Enrolled; Senate Journal 21, Pg.777 "
124803,2009-12-10,"House Introduced 1/6/2010 and Referred to Executive Departments and Administration; House Journal  6, PG.233 "
124803,2010-02-02,"House Public Hearing: 2/11/2010 11:30 Amendment Legislative Office Building 306 "
124803,2010-02-10,"House Executive Session: 2/16/2010 10:30 Amendment Legislative Office Building 306 "
124803,2010-02-17,"House Committee Report: Ought to Pass with Amendment #0551h for Mar 3 Consent Calendar (Vote 17-1); House Calendar 17, PG.800 "
124803,2010-02-17,"House Proposed Committee Amendment #0551h; House Calendar 17, PG.841-842 "
124803,2010-03-03,"House Amendment #0551h Adopted, Voice Vote; House Journal  20, PG.1137-1138 "
124803,2010-03-03,"House Ought to Pass with Amendment #0551h: Motion Adopted Voice Vote; House Journal  20, PG.1137-1138 "
124803,2010-03-10,"Senate Introduced and Referred to Executive Departments and Administration "
124803,2010-03-18,"Senate Hearing: March 23, 2010, Room 101, Legislative Office Building, 2:00 p.m.; Senate Calendar 12 "
124803,2010-03-24,"Senate Committee Report: Ought to Pass 3/31/10; Senate Calendar 13 "
124803,2010-03-31,"Senate Ought to Pass, Motion Adopted, Voice Vote; OT3rdg; Senate Journal 12, Pg.269 "
124803,2010-03-31,"Senate Passed by Third Reading Resolution; Senate Journal 12, Pg.271 "
124803,2010-04-07,"Senate Enrolled; Senate Journal 13, Pg.285 "
124803,2010-04-12,"House Enrolled; House Journal  32, PG.1577 "
124803,2010-05-24,"House Signed by the Governor 05/19/2010; Effective 07/18/2010; Chapter 0072 "
124804,2009-12-10,"House Introduced 1/6/2010 and Referred to Transportation; House Journal  6, PG.233 "
124804,2010-01-04,"House Public Hearing: 1/12/2010 11:30 Amendment Legislative Office Building 203 "
124804,2010-01-12,"House Executive Session: 1/19/2010 11:15 Amendment Legislative Office Building 203 "
124804,2010-01-20,"House Committee Report: Inexpedient to Legislate for Jan 27 Consent Calendar (vote 13-1); House Calendar 8, PG.337 "
124804,2010-01-27,"House Inexpedient to Legislate: Motion Adopted Voice Vote; House Journal  12, PG.508 "
124805,2009-12-10,"House Introduced 1/6/2010 and Referred to Municipal and County Government; House Journal  6, PG.233 "
124805,2010-01-06,"House Vacated from Municipal and County Government: Motion Adopted Voice Vote; House Journal  6, PG.249 "
124805,2010-01-06,"House Referred to Science, Technology and Energy: Motion Adopted Voice Vote; House Journal  6, PG.249 "
124805,2010-01-12,"House Public Hearing: 1/19/2010 2:00 PM Legislative Office Building 304 "
124805,2010-01-20,"House Full Committee Work Session: 1/27/2010 9:30 Amendment Legislative Office Building 304 "
124805,2010-01-28,"House Full Committee Work Session: 2/4/2010 1:00 PM Legislative Office Building 304 "
124805,2010-02-04,"House Full Committee Work Session: 2/11/2010 11:00 Amendment Legislative Office Building 304 "
124805,2010-02-04,"House Executive Session: 2/16/2010 10:00 Amendment Legislative Office Building 304 "
124805,2010-02-18,"House Committee Report: Refer to Interim Study for March 17 (Vote 14-1; Regular Calendar); House Calendar 21, PG.1195 "
124805,2010-03-17,"House Refer to Interim Study: Motion Adopted Voice Vote; House Journal  26, PG.1378 "
124805,2010-03-17,"House Referred to Science, Technology & Energy for Interim Study; House Journal  26, PG.1365 "
124805,2010-03-31,"House Interim Study - Full Committee Work Session, Planning Meeting: 4/6/2010 11:30 Amendment Legislative Office Building 304 "
124805,2010-03-31,"House Interim Study - Full Committee Work Session, Presentation: 4/13/2010 1:00 PM Legislative Office Building 304 "
124805,2010-04-07,"House Interim Study - Full Committee Work Session: 4/20/2010 12:30 PM Legislative Office Building 304 "
124805,2010-04-21,"House Interim Study - Full Committee Work Session: 4/27/2010 1:00 PM Legislative Office Building 301 "
124805,2010-04-27,"House Interim Study - Full Committee Work Session: 4/28/2010 1:30 PM Legislative Office Building 304 "
124805,2010-05-28,"House Interim Study - Subcommittee Work Session: 6/3/2010 10:00 Amendment Legislative Office Building 304 "
124805,2010-06-07,"House Interim Study - Subcommittee Work Session: 6/10/2010 1:00 PM Legislative Office Building 304 "
124805,2010-09-01,"House Interim Study - Subcommittee Work Session: 9/7/2010 10:00 Amendment Legislative Office Building 304 "
124805,2010-09-08,"House Interim Study - Subcommittee Work Session: 9/16/2010 1:00 PM Legislative Office Building 304 "
124805,2010-10-06,"House Interim Study - Subcommittee Work Session: 10/12/2010 2:00 PM Legislative Office Building 301 "
124805,2010-10-06,"House Interim Study - Executive Session: 10/13/2010 10:00 Amendment Legislative Office Building 304 "
124806,2009-12-10,"House Introduced 1/6/2010 and Referred to Commerce and Consumer Affairs; House Journal  6, PG.233 "
124806,2010-01-19,"House Public Hearing: 1/28/2010 2:00 PM Legislative Office Building 302 "
124806,2010-02-02,"House Executive Session: 2/11/2010 10:00 Amendment Legislative Office Building 302 "
124806,2010-02-18,"House Committee Report: Inexpedient to Legislate for March 3 Consent Calendar (vote 16-0); House Calendar 17, PG.794 "
124806,2010-03-03,"House Inexpedient to Legislate: Motion Adopted Voice Vote; House Journal  20 PG.1098 "
124807,2009-12-10,"House Introduced 1/6/2010 and Referred to Commerce and Consumer Affairs; House Journal  6, PG.233 "
124807,2010-01-22,"House Public Hearing: 2/9/2010 10:00 Amendment Legislative Office Building 302 "
124807,2010-02-02,"House Executive Session: 2/11/2010 10:00 Amendment Legislative Office Building 302 "
124807,2010-02-17,"House Majority Committee Report: Inexpedient to Legislate for Mar 3 (Vote 11-5; Regular Calendar); House Calendar 17, PG.818 "
124807,2010-02-17,"House Minority Committee Report: Ought to Pass; House Calendar 17, PG.818 "
124807,2010-03-03,"House Special Ordered to Next Session Without Objection; House Journal  20, PG.1180 "
124807,2010-03-10,"House Inexpedient to Legislate: Motion Adopted Division Vote 267-82; House Journal  23, PG.1256 "
124808,2009-12-10,"House Introduced 1/6/2010 and Referred to Election Law; House Journal  6, PG.233 "
124808,2010-01-14,"House ==RESCHEDULED== Public Hearing: 1/19/2010 10:15 Amendment Legislative Office Building 308 (Orig 11:00 Amendment) "
124808,2010-01-14,"House Executive Session: 1/26/2010 10:00 Amendment Legislative Office Building 308 "
124808,2010-02-03,"House Committee Report: Ought to Pass with Amendment #0353h (New Title) for Feb 10 Consent Calendar (vote 14-0); House Calendar 13, PG.525 "
124808,2010-02-03,"House Proposed Committee Amendment #0353h (New Title); House Calendar 13, PG.562-563 "
124808,2010-02-10,"House Removed from Consent Calendar (Rep Vaillancourt); House Journal  16, PG.748 "
124808,2010-02-10,"House Special Ordered to Regular Place in Feb 17 Consent Calendar: Motion Adopted Without Objection; House Journal  16, PG.783 "
124808,2010-02-17,"House Removed from Consent Calendar (Rep Jasper); House Journal  18, PG.927 "
124808,2010-02-17,"House Special Ordered to Next Session Day Beginning of Calendar: Motion Adopted Without Objection; House Journal  18, PG.1015 "
124808,2010-03-03,"House Amendment #0353h (New Title) Adopted, Voice Vote; House Journal  20, PG.1089 "
124808,2010-03-03,"House Floor Amendment #0595h (New Title) (Rep Jasper) Adopted, Voice Vote; House Journal  20, PG.1089 "
124808,2010-03-03,"House Ought to Pass with Amendments #0353h (New Title) and #0595h (New Title): Motion Adopted Voice Vote; House Journal  20, PG.1089 "
124808,2010-03-24,"Senate Introduced and Referred to Election Law and Veterans' Affairs; Senate Journal 11, Pg.261 "
124808,2010-04-01,"Senate Hearing: April 6, 2010, Room 101, Legislative Office Building, 9:15 a.m.; Senate Calendar 14 "
124808,2010-04-07,"Senate Committee Report: Ought to Pass 4/14/10; Senate Calendar 15 "
124808,2010-04-14,"Senate Ought to Pass, Motion Adopted, Voice Vote; OT3rdg; Senate Journal 14, Pg.287 "
124808,2010-04-14,"Senate Passed by Third Reading Resolution; Senate Journal 14, Pg.295 "
124808,2010-04-28,"House Enrolled Bill Amendment #1557 Adopted; House Journal  36, PG.1730 "
124808,2010-04-28,"Senate Enrolled Bill Amendment #1557 Adopted "
124808,2010-05-05,"Senate Enrolled "
124808,2010-05-05,"House Enrolled; House Journal  38, PG.1914 "
124808,2010-05-24,"House Signed by the Governor 05/18/2010; Chapter 0050 "
124808,2010-05-24,"House I. Sections 2-3 Effective as Provided in Section 4 "
124808,2010-05-24,"House II. Remainder Effective 07/17/2010 "
124809,2009-12-10,"House Introduced 1/6/2010 and Referred to Local and Regulated Revenues; House Journal  6, PG.233 "
124809,2009-12-16,"House Public Hearing: 1/14/2010 10:30 Amendment Legislative Office Building 303 "
124809,2010-01-20,"House Executive Session: 1/28/2010 10:30 Amendment Legislative Office Building 303 "
124809,2010-02-02,"House Committee Report: Inexpedient to Legislate for Feb 10 Consent Calendar (vote 12-0); House Calendar 13, PG.530 "
124809,2010-02-10,"House Removed from Consent Calendar (Rep Vaillancourt); House Journal  16, PG.748 "
124809,2010-02-10,"House Special Ordered to Regular Place in Feb 17 Consent Calendar: Motion Adopted Without Objection; House Journal  16, PG.783 "
124809,2010-02-17,"House Inexpedient to Legislate: Motion Adopted Voice Vote; House Journal  18, PG.971 "
124810,2009-12-10,"House Introduced 1/6/2010 and Referred to Transportation; House Journal  6, PG.233 "
124810,2010-01-12,"House Public Hearing: 1/21/2010 9:00 Amendment Legislative Office Building 203 "
124810,2010-01-19,"House Executive Session: 1/26/2010 10:45 Amendment Legislative Office Building 203 "
124810,2010-02-03,"House Executive Session: 2/9/2010 10:15 Amendment Legislative Office Building 203 "
124810,2010-02-10,"House Majority Committee Report: Ought to Pass with Amendment #0584h(NT) for Feb 17 Regular Calendar (Vote 12-1); House Calendar 14, PG.609 "
124810,2010-02-10,"House Proposed Majority Committee Amendment #0584h (New Title); House Calendar 14, PG.628-629 "
124810,2010-02-10,"House Minority Committee Report: Refer to Interim Study; House Calendar 14, PG.609 "
124810,2010-02-17,"House Special Ordered to Next Session Day Beginning of Calendar: Motion Adopted Without Objection; House Journal  18, PG.1015 "
124810,2010-03-03,"House Amendment #0584h (New Title) Adopted, Voice Vote; House Journal  20, PG.1072 "
124810,2010-03-03,"House Ought to Pass with Amendment #0584h (New Title): Motion Adopted Voice Vote; House Journal  20, PG.1072 "
124810,2010-03-03,"House Reconsideration (Rep Sapareto): Motion Failed Regular Calendar 165-189; House Journal  20, PG.1075-1077 "
124810,2010-03-03,"Senate Introduced and Referred to Transportation & Interstate Cooperation "
124810,2010-03-18,"Senate Hearing: April 8, 2010, Room 101, Legislative Office Building, 11:10 a.m.; Senate Calendar 12 "
124810,2010-03-23,"Senate Hearing: === TIME CHANGE === April 8, 2010, Room 101, Legislative Office Building, 11:30 a.m.; Senate Calendar 13 "
124810,2010-04-08,"Senate Committee Report: Ought to Pass 4/14/10; Senate Calendar 15 "
124810,2010-04-14,"Senate Ought to Pass, Motion Adopted, Voice Vote; OT3rdg; Senate Journal 14, Pg.291 "
124810,2010-04-14,"Senate Passed by Third Reading Resolution; Senate Journal 14, Pg.295 "
124810,2010-04-21,"Senate Enrolled "
124810,2010-04-21,"House Enrolled; House Journal  35, PG.1671 "
124810,2010-05-24,"House Signed by the Governor 05/18/2010; Effective 05/18/2010; Chapter 0051 "
124811,2010-01-06,"House Introduced and Referred to Commerce and Consumer Affairs; House Journal  6, PG.233 "
124811,2010-01-06,"House Public Hearing: 1/14/2010 9:30 Amendment Legislative Office Building 302 "
124811,2010-01-19,"House Subcommittee Work Session: 1/27/2010 10:30 Amendment Legislative Office Building 302 (Members: Reps DeStefano, Palfrey & Keans) "
124811,2010-01-27,"House Executive Session: 2/4/2010 10:00 Amendment Legislative Office Building 302 "
124811,2010-02-10,"House Majority Committee Report: Inexpedient to Legislate for Mar 17 (vote 11-6; Regular Calendar); House Calendar 21, PG.1187-1188 "
124811,2010-02-10,"House Minority Committee Report: Ought to Pass with Amendment #0594h (New Title); House Calendar 21, PG.1187-1188 "
124811,2010-02-10,"House Proposed Minority Committee Amendment #0594h (New Title); House Calendar 21, PG.1206 "
124811,2010-03-17,"House Special Order to Regular Place in Mar 18 Calendar (Rep Kurk): Motion Adopted Division Vote 243-49; House Journal  26, PG.1386 "
124811,2010-03-18,"House Inexpedient to Legislate: Motion Adopted Division Vote 207-77; House Journal  27, PG.1420 "
124812,2009-12-10,"House Introduced 1/6/2010 and Referred to Transportation; House Journal  6, PG.233 "
124812,2010-02-03,"House Public Hearing: 2/11/2010 11:30 Amendment Legislative Office Building 201 "
124812,2010-02-03,"House Executive Session: 2/16/2010 10:15 Amendment Legislative Office Building 203 "
124812,2010-02-17,"House Committee Report: Ought to Pass with Amendment #0669h for Mar 3 Consent Calendar (Vote 12-0); House Calendar 17, PG.814-815 "
124812,2010-02-17,"House Proposed Committee Amendment #0669h; House Calendar 17, PG.844 "
124812,2010-03-03,"House Amendment #0669h Adopted, Voice Vote; House Journal  20, PG.1163 "
124812,2010-03-03,"House Ought to Pass with Amendment #0669h: Motion Adopted Voice Vote; House Journal  20, PG.1163 "
124812,2010-03-24,"Senate Introduced and Referred to Transportation & Interstate Cooperation; Senate Journal 11, Pg.261 "
124812,2010-04-08,"Senate Hearing: April 22, 2010, Room 101, Legislative Office Building, 10:50 a.m.; Senate Calendar 15 "
124812,2010-04-22,"Senate Committee Report: Ought to Pass 4/28/10; Senate Calendar 17 "
124812,2010-04-28,"Senate Ought to Pass, Motion Adopted, Voice Vote; OT3rdg "
124812,2010-04-28,"Senate Passed by Third Reading Resolution "
124812,2010-05-12,"House Enrolled; House Journal  41, PG.2097 "
124812,2010-05-12,"Senate Enrolled "
124812,2010-06-15,"House Signed by the Governor 06/09/2010; Chapter 0126 "
124812,2010-06-15,"House I. Section 2 Effective 01/01/2013 "
124812,2010-06-15,"House II. Remainder Effective 01/01/2011 "
124813,2009-12-10,"House Introduced 1/6/2010 and Referred to Environment and Agriculture; House Journal  6, PG.233 "
124813,2010-01-19,"House Public Hearing: 2/4/2010 1:00 PM Legislative Office Building 308 "
124813,2010-01-26,"House Executive Session: 2/11/2010 2:00 PM Legislative Office Building 308 "
124813,2010-02-19,"House Committee Report: Inexpedient to Legislate for March 3 Consent Calendar (vote 16-0); House Calendar 17, PG.799-800 "
124813,2010-03-03,"House Inexpedient to Legislate: Motion Adopted Voice Vote; House Journal  20, PG.1137 "
124814,2009-12-10,"House Introduced 1/6/2010 and Referred to Science, Technology and Energy; House Journal  6, PG.233  "
124814,2009-12-16,"House Public Hearing: 1/12/2010 2:45 PM Legislative Office Building 304 "
124814,2010-01-14,"House Executive Session: 1/20/2010 11:30 Amendment Legislative Office Building 304 "
124814,2010-01-20,"House Committee Report: Ought to Pass with Amendment #0180h for Jan 27 Consent Calendar (vote 15-1); House Calendar 8, PG.336 "
124814,2010-01-20,"House Proposed Committee Amendment #0180h; House Calendar 8, PG.358-359 "
124814,2010-01-27,"House Amendment #0180h Adopted, Voice Vote; House Journal  12, PG.506-507 "
124814,2010-01-27,"House Ought to Pass with Amendment #0180h: Motion Adopted Voice Vote; House Journal  12, PG.506-507 "
124814,2010-01-27,"House Referred to Ways and Means; House Journal  12, PG.507 "
124814,2010-02-17,"House Full Committee Work Session: 3/2/2010 10:00 Amendment Legislative Office Building 202 "
124814,2010-03-10,"House Executive Session: 3/16/2010 10:00 Amendment Legislative Office Building 202 (Continued 3/17/10 9:00 Amendment Legislative Office Building 202 If Necessary) "
124814,2010-03-18,"House Committee Report: Ought to Pass for March 24 (Vote 20-0; Consent Calendar); House Calendar 22, PG.1220-1221 "
124814,2010-03-24,"House Ought to Pass: Motion Adopted Voice Vote; House Journal  30, PG.1477 "
124814,2010-03-24,"Senate Introduced and Referred to Energy, Environment and Economic Development; Senate Journal 11, Pg.261 "
124814,2010-04-09,"Senate Hearing: April 15, 2010, Room 102, Legislative Office Building, 8:30 a.m.; Senate Calendar 15 "
124814,2010-04-15,"Senate Committee Report: Ought to Pass 4/21/10; Senate Calendar 16 "
124814,2010-04-21,"Senate Without Objection, Chair moved to Special Order to 04/28/10; Senate Journal 15, Pg.303 "
124814,2010-04-21,"Senate Committee Report: Ought to Pass 4/28/10 "
124814,2010-04-28,"Senate Ought to Pass, Motion Adopted, Voice Vote; OT3rdg "
124814,2010-04-28,"Senate Passed by Third Reading Resolution "
124814,2010-05-12,"House Enrolled; House Journal  41, PG.2097 "
124814,2010-05-12,"Senate Enrolled "
124814,2010-06-15,"House Signed by the Governor 06/09/2010; Effective 06/09/2010; Chapter 0127 "
124815,2009-12-10,"House Introduced 1/6/2010 and Referred to Commerce and Consumer Affairs; House Journal  6, PG.233 "
124815,2010-01-22,"House Public Hearing: 2/9/2010 1:30 PM Legislative Office Building 302 "
124815,2010-02-02,"House Executive Session: 2/11/2010 10:00 Amendment Legislative Office Building 302 "
124815,2010-02-16,"House Majority Committee Report: Ought to Pass for Mar 10 (Vote 9-7; Regular Calendar); House Calendar 19, PG.1025 "
124815,2010-02-16,"House Minority Committee Report: Inexpedient to Legislate; House Calendar 19, PG.1025 "
124815,2010-03-10,"House Special Order to Regular Place on Mar 11 Calendar, Without Objection; House Journal  23, PG.1294 "
124815,2010-03-11,"House Special Order to Beginning of Mar 17 Calendar, Without Objection; House Journal  24, PG.1349 "
124815,2010-03-17,"House Ought to Pass: Motion Adopted Division Vote 170-152; House Journal  26, PG.1376 "
124815,2010-03-24,"Senate Introduced and Referred to Commerce, Labor and Consumer Protection; Senate Journal 11, Pg.261 "
124815,2010-04-05,"Senate Hearing: April 29, 2010, Room 103, State House, 1:30 p.m.; Senate Calendar 15 "
124815,2010-04-06,"Senate Hearing: === TIME CHANGE === April 29, 2010, Room 103, State House, 1:15 p.m.; Senate Calendar 16 "
124815,2010-04-29,"Senate Committee Report: Ought to Pass with Amendment 1767s, 5/5/10; Senate Calendar 18 "
124815,2010-05-05,"Senate Committee Amendment 1767s, Amendment Adopted, Voice Vote; Senate Journal 17, Pg.362 "
124815,2010-05-05,"Senate Ought to Pass with Amendment 1767s, Motion Adopted, Voice Vote; OT3rdg; Senate Journal 17, Pg.362 "
124815,2010-05-05,"Senate Passed by Third Reading Resolution; Senate Journal 17, Pg.398 "
124815,2010-05-19,"House House Concurs with Senate Amendment #1767s (Rep Butler): Motion Adopted Voice Vote; House Journal  46, PG.2224 "
124815,2010-06-02,"House Enrolled "
124815,2010-06-02,"Senate Enrolled "
124815,2010-07-15,"House Signed by the Governor 07/13/2010; Effective 01/01/2011; Chapter 0296 "
124816,2009-12-10,"House Introduced 1/6/2010 and Referred to Commerce and Consumer Affairs; House Journal  6, PG.233 "
124816,2010-01-22,"House Public Hearing: 2/9/2010 10:30 Amendment Legislative Office Building 302 "
124816,2010-02-02,"House Executive Session: 2/11/2010 10:00 Amendment Legislative Office Building 302 (Continued 2/16/2010 10:00 Amendment Legislative Office Building 302 If Necessary) "
124816,2010-02-23,"House Committee Report: Inexpedient to Legislate for Mar 17 (Vote 10-3; Regular Calendar); House Calendar 21, PG.1188 "
124816,2010-03-17,"House Inexpedient to Legislate: Motion Adopted Voice Vote; House Journal  26, PG.1386-1387 "
124817,2009-12-10,"House Introduced 1/6/2010 and Referred to Judiciary; House Journal  6, PG.233 "
124817,2010-01-15,"House Public Hearing: 1/26/2010 10:00 Amendment Legislative Office Building 208 "
124817,2010-02-09,"House Executive Session: 2/16/2010 10:00 Amendment Legislative Office Building 208 (Continued 2/18/2010 10:00 Amendment Legislative Office Building 208 If Necessary) "
124817,2010-02-18,"House Majority Committee Report: Ought to Pass with Amendment #0743h for Mar 3 Regular Calendar (Vote 11-5); House Calendar 17, PG.822 "
124817,2010-02-18,"House Proposed Majority Committee Amendment #0743h; House Calendar 17, PG.844 "
124817,2010-02-18,"House Minority Committee Report: Inexpedient to Legislate; House Calendar 17, PG.822 "
124817,2010-03-03,"House Amendment #0743h Adopted, Voice Vote; House Journal  20, PG.1171-1172 "
124817,2010-03-03,"House Ought to Pass with Amendment #0743h: Motion Adopted Regular Calendar 159-148; House Journal  20, PG.1171-1174 "
124817,2010-03-03,"House Reconsideration (Rep Nixon): Motion Failed Division Vote 150-156; House Journal  20, PG.1174 "
124817,2010-03-03,"Senate Introduced and Referred to Commerce, Labor and Consumer Protection "
124817,2010-04-06,"Senate Hearing: April 29, 2010, Room 103, State House, 1:15 p.m.; Senate Calendar 15 "
124817,2010-04-09,"Senate Hearing: === TIME CHANGE === April 29, 2010, Room 103, State House, 1:00 p.m.; Senate Calendar 16 "
124817,2010-04-29,"Senate Committee Report: Ought to Pass with Amendment 1762s, 5/5/10; Senate Calendar 18 "
124817,2010-05-05,"Senate Committee Amendment 1762s, Amendment Adopted, Voice Vote; Senate Journal 17, Pg.362 "
124817,2010-05-05,"Senate Ought to Pass with Amendment 1762s, Motion Adopted, Voice Vote; OT3rdg; Senate Journal 17, Pg.362 "
124817,2010-05-05,"Senate Passed by Third Reading Resolution; Senate Journal 17, Pg.398 "
124817,2010-05-19,"House House Concurs with Senate Amendment #1762s (Rep Cote): Motion Adopted Voice Vote; House Journal  46, PG.2226 "
124817,2010-06-02,"House Enrolled "
124817,2010-06-02,"Senate Enrolled "
124817,2010-07-15,"House Signed by the Governor 07/13/2010; Effective 01/01/2011; Chapter 0297 "
124818,2009-12-10,"House Introduced 1/6/2010 and Referred to Judiciary; House Journal  6, PG.233 "
124818,2010-01-15,"House Public Hearing: 1/26/2010 10:30 Amendment Legislative Office Building 208 "
124818,2010-02-09,"House Executive Session: 2/16/2010 10:00 Amendment Legislative Office Building 208 (Continued 2/18/2010 10:00 Amendment Legislative Office Building 208 If Necessary) "
124818,2010-02-18,"House Committee Report: Inexpedient to Legislate for March 3 Consent Calendar (vote 14-0); House Calendar 17, PG.805 "
124818,2010-03-03,"House Inexpedient to Legislate: Motion Adopted Voice Vote; House Journal  20, PG.1145 "
124819,2009-12-10,"House Introduced 1/6/2010 and Referred to Judiciary; House Journal  6, PG.234 "
124819,2010-01-15,"House Public Hearing: 1/26/2010 11:00 Amendment Legislative Office Building 208 "
124819,2010-02-09,"House Executive Session: 2/16/2010 10:00 Amendment Legislative Office Building 208 (Continued 2/18/2010 10:00 Amendment Legislative Office Building 208 If Necessary) "
124819,2010-02-18,"House Committee Report: Inexpedient to Legislate for Mar 10 (Vote 10-5; Regular Calendar); House Calendar 19, PG.1031 "
124819,2010-03-10,"House Inexpedient to Legislate: Motion Adopted Voice Vote; House Journal  23, PG.1289-1290 "
124820,2009-12-10,"House Introduced 1/6/2010 and Referred to Judiciary; House Journal  6, PG.234 "
124820,2010-01-15,"House Public Hearing: 1/26/2010 1:00 PM Legislative Office Building 208 "
124820,2010-02-09,"House Executive Session: 2/16/2010 10:00 Amendment Legislative Office Building 208 "
124820,2010-02-17,"House Committee Report: Ought to Pass with Amendment #0769h for Mar 3 Consent Calendar (Vote 15-0); House Calendar 17, PG.805 "
124820,2010-02-17,"House Proposed Committee Amendment #0769h; House Calendar 17, PG.844-845 "
124820,2010-03-03,"House Amendment #0769h Adopted, Voice Vote; House Journal  20, PG.1145-1146 "
124820,2010-03-03,"House Ought to Pass with Amendment #0769h: Motion Adopted Voice Vote; House Journal  20, PG.1145-1146 "
124820,2010-03-24,"Senate Introduced and Referred to Judiciary; Senate Journal 11, Pg.261 "
124820,2010-04-15,"Senate Hearing: April 27, 2010, Room 103, State House, 2:30 p.m.; Senate Calendar 16 "
124820,2010-04-29,"Senate Committee Report: Inexpedient to Legislate, 5/5/10; Senate Calendar 18 "
124820,2010-05-05,"Senate Inexpedient to Legislate, Motion Adopted, Voice Vote === BILL KILLED === Senate Journal 17, Pg.389 "
124821,2009-12-10,"House Introduced 1/6/2010 and Referred to Judiciary; House Journal  6, PG.234 "
124821,2010-01-15,"House Public Hearing: 1/26/2010 1:30 PM Legislative Office Building 208 "
124821,2010-02-09,"House Executive Session: 2/16/2010 10:00 Amendment Legislative Office Building 208 (Continued 2/18/2010 10:00 Amendment Legislative Office Building 208 If Necessary) "
124821,2010-02-18,"House Committee Report: Inexpedient to Legislate for March 3 Consent Calendar (vote 15-0); House Calendar 17, PG.805 "
124821,2010-03-03,"House Inexpedient to Legislate: Motion Adopted Voice Vote; House Journal  20, PG.1146 "
124822,2009-12-10,"House Introduced 1/6/2010 and Referred to Judiciary; House Journal  6, PG.234 "
124822,2010-01-15,"House Public Hearing: 1/26/2010 2:00 PM Legislative Office Building 208 "
124822,2010-02-09,"House Executive Session: 2/16/2010 10:00 Amendment Legislative Office Building 208 (Continued 2/18/2010 10:00 Amendment Legislative Office Building 208 If Necessary) "
124822,2010-02-18,"House Committee Report: Ought to Pass with Amendment #0777h for Mar 3 Consent Calendar (Vote 13-0); House Calendar 17, PG.805 "
124822,2010-02-18,"House Proposed Committee Amendment #0777h; House Calendar 17, PG.845 "
124822,2010-03-03,"House Amendment #0777h Adopted, Voice Vote; House Journal  20, PG.1146 "
124822,2010-03-03,"House Ought to Pass with Amendment #0777h: Motion Adopted Voice Vote; House Journal  20, PG.1146 "
124822,2010-03-24,"Senate Introduced and Referred to Judiciary; Senate Journal 11, Pg.261 "
124822,2010-04-19,"Senate Hearing: May 4, 2010, Room 103, State House, 3:15 p.m.; Senate Calendar 17 "
124822,2010-05-06,"Senate Committee Report: Ought to Pass with Amendment 1925s, 5/12/10; Senate Calendar 19 "
124822,2010-05-12,"Senate Committee Amendment 1925s, Amendment Adopted, Voice Vote; Senate Journal 18, Pg.475 "
124822,2010-05-12,"Senate Ought to Pass with Amendment 1925s, Motion Adopted, Voice Vote; OT3rdg; Senate Journal 18, Pg.475 "
124822,2010-05-12,"Senate Passed by Third Reading Resolution; Senate Journal 18, Pg.497 "
124822,2010-05-19,"House House Concurs with Senate Amendment #1925s (Rep Cote): Motion Adopted Voice Vote; House Journal  46, PG.2226 "
124822,2010-06-02,"Senate Enrolled; Senate Journal 21, Pg.777 "
124822,2010-06-02,"House Enrolled "
124822,2010-07-28,"House Signed by the Governor 07/23/2010; Effective 01/01/2011; Chapter 0364 "
124823,2009-12-10,"House Introduced 1/6/2010 and Referred to Judiciary; House Journal  6, PG.234 "
124823,2010-01-15,"House Public Hearing: 1/26/2010 2:30 PM Legislative Office Building 208 "
124823,2010-02-09,"House Executive Session: 2/16/2010 10:00 Amendment Legislative Office Building 208 (Continued 2/18/2010 10:00 Amendment Legislative Office Building 208 If Necessary) "
124823,2010-02-18,"House Maj Comm Rpt: Ought to Pass with Amendment #0768h(NT) for Mar 3 (Vote 8-5; Regular Calendar); House Calendar17, PG822-823 "
124823,2010-02-18,"House Proposed Majority Committee Amendment #0768h (New Title); House Calendar 17, PG.845 "
124823,2010-02-18,"House Minority Committee Report: Inexpedient to Legislate; House Calendar 17, PG.822-823 "
124823,2010-03-03,"House Amendment #0768h (New Title) Adopted, Voice Vote; House Journal  20, PG.1174 "
124823,2010-03-03,"House Ought to Pass with Amendment #0768h (New Title): Motion Failed Regular Calendar 143-158; House Journal  20, PG.1174-1176 "
124823,2010-03-03,"House Inexpedient to Legislate (Rep Packard): Motion Adopted Division Vote 171-130; House Journal  20, PG.1174-1176 "
124823,2010-03-03,"House Reconsideration (Rep W.O'Brien): Motion Failed Voice Vote; House Journal  20, PG.1176 "
124824,2010-01-06,"House Introduced 1/6/2010 and Referred to Transportation; House Journal  6, PG.234  "
124824,2010-01-07,"House Public Hearing: 1/28/2010 9:30 Amendment Representative's Hall "
124824,2010-01-26,"House Executive Session: 2/2/2010 10:15 Amendment Legislative Office Building 203 "
124824,2010-02-03,"House Committee Report: Inexpedient to Legislate for Feb 10 Consent Calendar (vote 19-0); House Calendar 13, PG.533 "
124824,2010-02-10,"House Removed from Consent Calendar (Rep Vaillancourt); House Journal  16, PG.748 "
124824,2010-02-10,"House Inexpedient to Legislate: Motion Adopted Division Vote 267-28; House Journal  16, PG.783 "
124825,2009-12-10,"House Introduced 1/6/2010 and Referred to Transportation; House Journal  6, PG.234 "
124825,2009-12-21,"House Public Hearing: 1/12/2010 10:15 Amendment Legislative Office Building 203 ==RECESSED== "
124825,2010-01-12,"House ==CANCELLED== Executive Session: 1/19/2010 11:15 Amendment Legislative Office Building 203 "
124825,2010-01-19,"House Continued Public Hearing: 1/26/2010 10:15 Amendment Legislative Office Building 203 "
124825,2010-01-26,"House Executive Session: 2/2/2010 10:15 Amendment Legislative Office Building 203 "
124825,2010-02-03,"House Committee Report: Ought to Pass with Amendment #0137h for Feb 10 Consent Calendar (vote 16-0); House Calendar 13, PG.533 "
124825,2010-02-03,"House Proposed Committee Amendment #0390h; House Calendar 13, PG.563 "
124825,2010-02-10,"House Removed from Consent Calendar (Rep Vaillancourt); House Journal  16, PG.748 "
124825,2010-02-10,"House Special Ordered to Regular Place in Feb 17 Consent Calendar: Motion Adopted Without Objection; House Journal  16, PG.783 "
124825,2010-02-17,"House Amendment #0390h Adopted, Voice Vote; House Journal  18, PG.978 "
124825,2010-02-17,"House Ought to Pass with Amendment #0137h: Motion Adopted Voice Vote; House Journal  18, PG.978 "
124825,2010-03-24,"Senate Introduced and Referred to Transportation & Interstate Cooperation; Senate Journal 11, Pg.261 "
124825,2010-04-15,"Senate Hearing: April 29, 2010, Room 101, Legislative Office Building, 11:15 a.m.; Senate Calendar 16 "
124825,2010-05-06,"Senate Committee Report: Ought to Pass with Amendment 1944s, 5/12/10; Senate Calendar 19 "
124825,2010-05-12,"Senate Committee Amendment 1944s, Amendment Adopted, Voice Vote "
124825,2010-05-12,"Senate Ought to Pass with Amendment 1944s, Motion Adopted, Voice Vote; OT3rdg "
124825,2010-05-12,"Senate Passed by Third Reading Resolution "
124825,2010-05-19,"House House Non-Concurs with Senate Amendment & Requests Comm of Conf (Rep G.Richardson): Motion Adopted Voice Vote; House Journal  42, PG.2155 "
124825,2010-05-19,"House Speaker Appoints: Reps M.O'Brien, R.Williams, L'Heureux & C.Williams; House Journal  42, PG.2155 "
124825,2010-05-19,"Senate Sen. Letourneau Accedes to House Request for Committee of Conference, Motion Adopted, Voice Vote "
124825,2010-05-19,"Senate President Appoints: Senators Gilmour, Fuller Clark and Boutin "
124825,2010-05-24,"House Conference Committee Meeting: 5/25/2010 2:00 PM Legislative Office Building 203 "
124825,2010-05-27,"Senate Conference Committee Report 2197; Senate Amendment + New Amendment, Filed "
124825,2010-06-02,"Senate Conference Committee Report 2197; Adopted, Voice Vote "
124825,2010-06-02,"House Conference Committee Report #2197 Adopted, Voice Vote "
124825,2010-06-02,"Senate Enrolled "
124825,2010-06-02,"House Enrolled "
124825,2010-07-07,"House Signed by the Governor 07/06/2010; Effective 01/01/2011; Chapter 0252 "
124826,2009-12-10,"House Introduced 1/6/2010 and Referred to Criminal Justice and Public Safety; House Journal  6, PG.234 "
124826,2010-01-12,"House Public Hearing: 1/21/2010 1:00 PM Legislative Office Building 204 "
124826,2010-01-26,"House Executive Session: 2/2/2010 10:00 Amendment Legislative Office Building 204 (Continued 2/2/2010 1:30 PM Legislative Office Building 204 if Necessary) "
124826,2010-02-03,"House Committee Report: Inexpedient to Legislate for Feb 10 Consent Calendar (vote 17-2); House Calendar 13, PG.523 "
124826,2010-02-10,"House Removed from Consent Calendar (Rep Vaillancourt); House Journal  16, PG.748 "
124826,2010-02-10,"House Special Ordered to Regular Place in Feb 17 Consent Calendar: Motion Adopted Without Objection; House Journal  16, PG.783 "
124826,2010-02-17,"House Inexpedient to Legislate: Motion Adopted Voice Vote; House Journal  18, PG.934 "
124827,2009-12-10,"House To Be Introduced 1/6/2010 and Referred to Election Law; House Journal  6, PG.234 "
124827,2009-12-16,"House Public Hearing: 1/12/2010 2:30 PM Legislative Office Building 308 "
124827,2010-01-06,"House Executive Session: 2/9/2010 10:00 Amendment Legislative Office Building 308 "
124827,2010-02-16,"House Committee Report: Refer to Interim Study for Mar 10 (Vote 11-1; Regular Calendar); House Calendar 19, PG.1028 "
124827,2010-03-10,"House Special Ordered to Regular Place on Mar 11 Calendar, Without Objection; House Journal  23, PG.1294 "
124827,2010-03-11,"House Refer to Interim Study: Motion Adopted Voice Vote; House Journal  24, PG.1326 "
124827,2010-03-17,"House Referred to Election Law for Interim Study; House Journal  26, PG.1365 "
124827,2010-09-08,"House Interim Study - Subcommittee Work Session: 10/13/2010 9:30 Amendment Legislative Office Building 308 "
124828,2009-12-10,"House To Be Introduced 1/6/2010 and Referred to Education; House Journal  6, PG.234 "
124828,2010-01-05,"House Public Hearing: 1/12/2010 1:00 PM Legislative Office Building 207 "
124828,2010-01-14,"House Subcommittee Work Session: 1/19/2010 9:00 Amendment Legislative Office Building 207 "
124828,2010-01-15,"House Executive Session: 1/20/2010 1:00 PM Legislative Office Building 207 "
124828,2010-01-21,"House Committee Report: Ought to Pass with Amendment #0195h for Jan 27 Consent Calendar (vote 18-1); House Calendar 8, PG.331 "
124828,2010-01-21,"House Proposed Committee Amendment #0195h; House Calendar 8, PG.359 "
124828,2010-01-27,"House Amendment #0195h Adopted, Voice Vote; House Journal  12, PG.499 "
124828,2010-01-27,"House Ought to Pass with Amendment #0195h: Motion Adopted Voice Vote; House Journal  12, PG.499 "
124828,2010-03-24,"Senate Introduced and Referred to Education; Senate Journal 11, Pg.261 "
124828,2010-03-31,"Senate Hearing: April 6, 2010, Room 103, Legislative Office Building, 10:15 a.m.; Senate Calendar 14 "
124828,2010-04-07,"Senate Committee Report: Ought to Pass 4/14/10; Senate Calendar 15 "
124828,2010-04-14,"Senate Ought to Pass, Motion Adopted, Voice Vote; OT3rdg; Senate Journal 14, Pg.287 "
124828,2010-04-14,"Senate Passed by Third Reading Resolution; Senate Journal 14, Pg.295 "
124828,2010-04-21,"Senate Enrolled "
124828,2010-04-21,"House Enrolled; House Journal  35, PG.1671 "
124828,2010-05-27,"House Signed by the Governor 05/26/2010; Effective 01/01/2011; Chapter 0100 "
124829,2009-12-10,"House Introduced 1/6/2010 and Referred to Resources, Recreation and Development; House Journal  6, PG.234 "
124829,2010-02-02,"House Public Hearing: 2/9/2010 12:30 PM Legislative Office Building 305 "
124829,2010-02-03,"House Executive Session: 2/11/2010 9:30 Amendment Legislative Office Building 305 "
124829,2010-02-11,"House Committee Report: Ought to Pass for Mar 3 Consent Calendar (Vote 17-0); House Calendar 17, PG.812 "
124829,2010-03-03,"House Ought to Pass: Motion Adopted Voice Vote; House Journal  20, PG.1156 "
124829,2010-03-24,"Senate Introduced and Referred to Energy, Environment and Economic Development; Senate Journal 11, Pg.261 "
124829,2010-04-09,"Senate Hearing: April 22, 2010, Room 102, Legislative Office Building, 8:30 a.m.; Senate Calendar 15 "
124829,2010-04-22,"Senate Committee Report: Ought to Pass 4/28/10; Senate Calendar 17 "
124829,2010-04-28,"Senate Ought to Pass, Motion Adopted, Voice Vote; OT3rdg "
124829,2010-04-28,"Senate Passed by Third Reading Resolution "
124829,2010-05-12,"House Enrolled; House Journal  41, PG.2097 "
124829,2010-05-12,"Senate Enrolled "
124829,2010-06-15,"House Signed by the Governor 06/09/2010; Effective 08/08/2010; Chapter 0128 "
124830,2010-01-06,"House Introduced and Referred to Municipal and County Government; House Journal  6, PG.234 "
124830,2010-01-06,"House Public Hearing: 1/14/2010 10:00 Amendment Legislative Office Building 301 "
124830,2010-01-06,"House ==CANCELLED== Executive Session: 1/20/2010 10:00 Amendment Legislative Office Building 301 "
124830,2010-01-27,"House Subcommittee Work Session: 2/2/2010 9:00 Amendment Legislative Office Building 201 "
124830,2010-01-27,"House Subcommittee Work Session: 2/9/2010 1:00 PM Legislative Office Building 301 "
124830,2010-02-09,"House ==RESCHEDULED== Subcommittee Work Session: 2/11/2010 10:00 Amendment Legislative Office Building 301 (Orig 1:00 PM) "
124830,2010-02-09,"House Executive Session: 2/16/2010 11:00 Amendment Legislative Office Building 301 "
124830,2010-02-17,"House Committee Report: Ought to Pass with Amendment #0628h for Mar 3 Consent Calendar (Vote 15-0); House Calendar 17, PG 808 "
124830,2010-02-17,"House Proposed Committee Amendment #0628h; House Calendar 17, PG 845-847 "
124830,2010-03-03,"House Amendment #0628h Adopted, Voice Vote; House Journal  20, PG.1148-1150 "
124830,2010-03-03,"House Ought to Pass with Amendment #0628h: Motion Adopted Voice Vote; House Journal  20, PG.1148-1150 "
124830,2010-03-24,"Senate Introduced and Referred to Executive Departments and Administration; Senate Journal 11, Pg.261 "
124830,2010-04-21,"Senate Hearing: April 27, 2010, Room 101, Legislative Office Building, 2:15 p.m.; Senate Calendar 17 "
124830,2010-05-05,"Senate Committee Report: Ought to Pass with Amendment 1882s, 5/12/10; Senate Calendar 19 "
124830,2010-05-12,"Senate Committee Amendment 1882s, Amendment Adopted, Voice Vote; Senate Journal 18, Pg.458 "
124830,2010-05-12,"Senate Ought to Pass with Amendment 1882s, Motion Adopted, Voice Vote; OT3rdg; Senate Journal 18, Pg.458 "
124830,2010-05-12,"Senate Passed by Third Reading Resolution; Senate Journal 18, Pg.497 "
124830,2010-05-19,"House House Non-Concurs with Senate Amendment and Req Comm of Conf (Rep Cooney): Motion Adopted Voice Vote; House Journal  46, PG.2195 "
124830,2010-05-19,"House Speaker Appoints: Reps Cooney, Sterling, Schuett & Wheeler; House Journal  46, PG.2195 "
124830,2010-05-19,"Senate Sen. Cilley accedes to House Request for Committee of Conference, Motion Adopted, Voice Vote "
124830,2010-05-19,"Senate President Appoints: Senators DeVries, Fuller Clark and Downing "
124830,2010-05-21,"House Conference Committee Meeting: 5/26/2010 11:30 Amendment Legislative Office Building 301 "
124830,2010-05-27,"Senate Conference Committee Report 2295; House Amendment + New Amendment, Filed "
124830,2010-06-02,"Senate Conference Committee Report 2295; Adopted, Voice Vote "
124830,2010-06-02,"House Conference Committee Report #2295 Adopted, Voice Vote "
124830,2010-06-02,"Senate Enrolled Bill Amendment #2430 Adopted "
124830,2010-06-02,"House Enrolled Bill Amendment #2430 Adopted "
124830,2010-06-02,"Senate Enrolled "
124830,2010-06-02,"House Enrolled "
124830,2010-07-15,"House Signed by the Governor 07/13/2010; Effective 09/11/2010; Chapter 0298 "
124831,2009-12-10,"House Introduced 1/6/2010 and Referred to Commerce and Consumer Affairs; House Journal  6, PG.234 "
124831,2010-01-22,"House Public Hearing: 2/1/2010 2:00 PM Legislative Office Building 302 "
124831,2010-01-27,"House Executive Session: 2/4/2010 10:00 Amendment Legislative Office Building 302 "
124831,2010-02-05,"House Committee Report: Inexpedient to Legislate for Feb 17 Regular Calendar (Vote 16-2); House Calendar 14, PG.604 "
124831,2010-02-17,"House Special Ordered to Next Session Day Beginning of Calendar: Motion Adopted Without Objection; House Journal  18, PG.1015 "
124831,2010-03-03,"House Inexpedient to Legislate: Motion Adopted Division Vote 338-15; House Journal  20, PG.1077 "
124832,2009-12-10,"House Introduced 1/6/2010 and Referred to Transportation; House Journal  6, PG.234 "
124832,2010-02-03,"House Public Hearing: 2/11/2010 10:30 Amendment Legislative Office Building 201 "
124832,2010-02-03,"House Executive Session: 2/16/2010 10:15 Amendment Legislative Office Building 203 "
124832,2010-02-17,"House Committee Report: Ought to Pass with Amendment #0596h for Mar 3 Consent Calendar (Vote 13-0); House Calendar 17, PG.815 "
124832,2010-02-17,"House Proposed Committee Amendment #0596h; House Calendar 17, PG.847 "
124832,2010-03-03,"House Amendment #0596h Adopted, Voice Vote; House Journal  20, PG.1163 "
124832,2010-03-03,"House Ought to Pass with Amendment #0596h: Motion Adopted Voice Vote; House Journal  20, PG.1163 "
124832,2010-03-24,"Senate Introduced and Referred to Transportation & Interstate Cooperation; Senate Journal 11, Pg.261 "
124832,2010-04-08,"Senate Hearing: April 22, 2010, Room 101, Legislative Office Building, 11:05 a.m.; Senate Calendar 15 "
124832,2010-04-22,"Senate Committee Report: Ought to Pass 4/28/10; Senate Calendar 17 "
124832,2010-04-28,"Senate Ought to Pass, Motion Adopted, Voice Vote; OT3rdg; Senate Journal 16, Pg.351 "
124832,2010-04-28,"Senate Passed by Third Reading Resolution; Senate Journal 16, Pg. 353 "
124832,2010-05-12,"House Enrolled; House Journal  41, PG.2097 "
124832,2010-05-12,"Senate Enrolled "
124832,2010-07-07,"House Signed by the Governor 07/06/2010; Effective 09/04/2010; Chapter 0253 "
124833,2009-12-10,"House Introduced 1/6/2010 and Referred to Science, Technology and Energy; House Journal  6, PG.234 "
124833,2010-01-06,"House Public Hearing: 1/21/2010 1:30 PM Legislative Office Building 304 "
124833,2010-01-21,"House Full Committee Work Session: 1/28/2010 9:00 Amendment Legislative Office Building 304 "
124833,2010-01-28,"House ==CANCELLED== Full Committee Work Session: 2/2/2010 9:00 Amendment Legislative Office Building 304 "
124833,2010-01-28,"House Executive Session: 2/2/2010 11:00 Amendment Legislative Office Building 304 ==RECESSED== "
124833,2010-02-03,"House Public Hearing: 2/9/2010 10:00 Amendment Legislative Office Building 304 "
124833,2010-02-09,"House Full Committee Work Session: 2/11/2010 2:00 PM Legislative Office Building 304 "
124833,2010-02-09,"House Continued Executive Session: 2/16/2010 10:00 Amendment Legislative Office Building 304 "
124833,2010-02-17,"House Committee Report: Ought to Pass with Amendment #0682h (NT) for Mar 3 Consent Calendar (Vote 14-0); House Calendar 17, PG.813 "
124833,2010-02-17,"House Proposed Committee Amendment #0682h (New Title); House Calendar 17, PG.847 "
124833,2010-03-03,"House Amendment #0682h (New Title) Adopted, Voice Vote; House Journal  20, PG.1158 "
124833,2010-03-03,"House Ought to Pass with Amendment #0682h (New Title): Motion Adopted Voice Vote; House Journal  20, PG.1158 "
124833,2010-03-24,"Senate Introduced and Referred to Energy, Environment and Economic Development; Senate Journal 11, Pg.261 "
124833,2010-04-09,"Senate Hearing: April 15, 2010, Room 102, Legislative Office Building, 9:30 a.m.; Senate Calendar 15 "
124833,2010-05-06,"Senate Committee Report: Ought to Pass with Amendment 1952s, New Title, 5/12/10; Senate Calendar 19 "
124833,2010-05-12,"Senate Without Objection, Chair moved to Special Order to the end of the Calendar "
124833,2010-05-12,"Senate Committee Report: Ought to Pass with Amendment 1952s, New Title, 5/12/10 "
124833,2010-05-12,"Senate Without Objection, Chair moved to Special Order to 5/13/10 "
124833,2010-05-12,"Senate Committee Report: Ought to Pass with Amendment 1952s, New Title, 5/13/10 "
124833,2010-05-13,"Senate Committee Amendment 1952s, New Title, Amendment Adopted, Voice Vote "
124833,2010-05-13,"Senate Ought to Pass with Amendment 1952s, New Title, Motion Adopted, Voice Vote; OT3rdg "
124833,2010-05-13,"Senate Passed by Third Reading Resolution "
124833,2010-05-19,"House House Concurs with Senate Amendment #1952s(NT) (Rep Kaen): Motion Adopted Regular Calendar 172-118; House Journal  46, PG.2229-2231 "
124833,2010-05-19,"Senate Enrolled Bill Amendment #2139 Adopted "
124833,2010-05-19,"House Enrolled Bill Amendment #2139 Adopted; House Journal  46, PG.2247 "
124833,2010-06-02,"Senate Enrolled "
124833,2010-06-02,"House Enrolled "
124833,2010-07-07,"House Signed by the Governor 07/06/2010; Effective 07/06/2010; Chapter 0254 "
124834,2009-12-10,"House Introduced 1/6/2010 and Referred to Labor, Industrial and Rehabilitative Services; House Journal  6, PG.234 "
124834,2009-12-22,"House Public Hearing: 1/7/2010 1:00 PM Legislative Office Building 307 "
124834,2010-01-20,"House Executive Session: 1/28/2010 1:00 PM Legislative Office Building 307 "
124834,2010-01-28,"House Committee Report: Ought to Pass with Amendment #0346h (New Title) for Feb 10 Consent Calendar (vote 13-0); House Calendar 13, PG.530 "
124834,2010-01-28,"House Proposed Committee Amendment #0346h (New Title); House Calendar 13, PG.563-564 "
124834,2010-02-10,"House Removed from Consent Calendar (Rep Vaillancourt); House Journal  16, PG.748 "
124834,2010-02-10,"House Special Ordered to Regular Place in Feb 17 Consent Calendar: Motion Adopted Without Objection; House Journal  16, PG.783 "
124834,2010-02-17,"House Amendment #0346h (New Title) Adopted, Voice Vote; House Journal  18, PG.963-964 "
124834,2010-02-17,"House Ought to Pass with Amendment #0346h (New Title): Motion Adopted Voice Vote; House Journal  18, PG.963-964 "
124834,2010-03-24,"Senate Introduced and Referred to Executive Departments and Administration; Senate Journal 11, Pg.261 "
124834,2010-04-08,"Senate Hearing: April 13, 2010, Room 101, Legislative Office Building, 2:30 p.m.; Senate Calendar 15 "
124834,2010-04-15,"Senate Committee Report: Ought to Pass with Amendment 1372s, 4/21/10; Senate Calendar 16 "
124834,2010-04-21,"Senate Without Objection, Chair moved to Special Order to 04/28/10; Senate Journal 15, Pg.303 "
124834,2010-04-21,"Senate Committee Report: Ought to Pass with Amendment 1372s, 4/28/10 "
124834,2010-04-28,"Senate Committee Amendment 1372s, Amendment Adopted, Voice Vote; Senate Journal 16, Pg.339 "
124834,2010-04-28,"Senate Ought to Pass with Amendment 1372s, Motion Adopted, Voice Vote; OT3rdg; Senate Journal 16, Pg.339 "
124834,2010-04-28,"Senate Passed by Third Reading Resolution; Senate Journal 16, Pg.353 "
124834,2010-05-19,"House House Concurs with Senate Amendment #1372s (Rep Goley): Motion Adopted Voice Vote House Journal  46, PG.2227 "
124834,2010-06-02,"House Enrolled Bill Amendment #2287 Adopted "
124834,2010-06-02,"Senate Enrolled Bill Amendment #2287 Adopted "
124834,2010-06-02,"House Enrolled "
124834,2010-06-02,"Senate Enrolled "
124834,2010-07-07,"House Signed by the Governor 07/06/2010; Effective 07/06/2010; Chapter 0255 "
124835,2009-12-10,"House Introduced 1/6/2010 and Referred to Local and Regulated Revenues; House Journal  6, PG.234 "
124835,2009-12-16,"House Public Hearing: 1/14/2010 11:00 Amendment Legislative Office Building 303 "
124835,2010-01-28,"House ==CANCELLED== Subcommittee Work Session: 2/11/2010 1:30 PM Legislative Office Building 303 "
124835,2010-01-28,"House ==CANCELLED== Subcommittee Work Session: 2/2/2010 2:00 PM Legislative Office Building 303 "
124835,2010-01-28,"House ==RESCHEDULED== Subcommittee Work Session: 2/4/2010 2:00 PM Legislative Office Building 303 "
124835,2010-01-28,"House Subcommittee Members: Reps C.Webber (Chair), Hamm, Theberge, Blankenbeker & A.Peterson "
124835,2010-02-03,"House Executive Session: 2/11/2010 10:30 Amendment Legislative Office Building 303 "
124835,2010-02-16,"House Committee Report: Ought to Pass with Amendment #0499h for Mar 10 (Vote 14-3; Regular Calendar); House Calendar 19, PG.1034 "
124835,2010-02-16,"House Proposed Committee Amendment #0499h; House Calendar 19, PG.1048 "
124835,2010-03-09,"House Corrected Committee Report: Inexpedient to Legislate for Mar 10 (Vote 14-3; Regular Calendar); House Calendar 19A, PG.1 "
124835,2010-03-10,"House Inexpedient to Legislate: Motion Adopted Voice Vote; House Journal  23, PG.1292-1293 "
124836,2009-12-10,"House Introduced 1/6/2010 and Referred to Executive Departments and Administration; House Journal  6, PG.234 "
124836,2010-02-02,"House Public Hearing: 2/11/2010 10:00 Amendment Legislative Office Building 306 "
124836,2010-02-10,"House Executive Session: 2/16/2010 10:30 Amendment Legislative Office Building 306 "
124836,2010-02-17,"House Committee Report: Inexpedient to Legislate for Mar 3 Consent Calendar (vote 16-1)HC 17, PG.800 "
