bill_number,bill_id,title
HB1,812201,"Law enforcement officers, authorized to issue traffic citations at the scene of the crash for traffic offenses, under certain conditions, additional fines, Sec. 32-5-171 am'd."
HB2,812547,"Wireless communications providers, location information of customer required upon request of law enforcement on certain circumstances, Kelsey Smith Act"
HB3,812068,"Monuments, Alabama Heritage Preservation Act, prohibit removal, alteration, or other disturbance of any statue or monument located on public property, exempt Transportation Department"
HB4,812364,"Public education employees, cost-of-living increase provided"
HB5,812043,"Taxation, State Personnel Board, tax deferred compensation plan, created, Sec. 36-26-14 am'd."
HB6,812095,"Taxation, Association of Christians of Tallassee for Service, exempt from state, county, and municipal sales and use taxes"
HB7,812225,"Insurance, service contracts, term ""road hazard"" defined, Sec. 8-32-2 am'd."
HB8,811855,"Child abuse, crimes and offenses, aggravated child abuse of a child under age of six, penalties, Sec. 26-15-3.2 added"
HB9,812273,"Driver's licenses, penalties for violations of restrictions on Stage II driver's licenses, revised, Sec. 32-6-7.2 am'd."
HB10,812148,"Lottery, Alabama Lottery Corporation, estab., distrib. of revenues for college scholarships, operation of casinos prohib., Sec. 65, Constitution of Alabama of 1901 am'd., const. amend."
HB11,812409,"Drivers' licenses, renewal period, extended to 6 months prior to expiration, Sec. 32-6-1 am'd"
HB12,812318,"Colleges and universities, carrying of concealed pistols on campuses under certain conditions authorized, const. amend."
HB13,812501,"Lotteries, Legislature authorized to provide by general law, const. amend"
HB14,812455,"Choctaw Co., retirement benefits, Co. Revenue Commissioner to receive simultaneously supernumerary retirement benefits and benefits from Teachers' Retirement System related to separate time periods"
HB15,811988,"LifeSouth Community Blood Centers, tax exempt"
HB16,816793,"County officers, Omnibus Pay Act, compensation increases, requirement that increases be granted at the time of the budget deleted, Sec. 11-2A-4 am'd."
HB17,816570,"Taxation, State Personnel Board, tax deferred compensation plan, created, Sec. 36-26-14 am'd."
HB18,816719,"Dale Co., sheriff, service of process, fee established, proceeds deposited in Dale Co. Sheriff's Service of Process Fee Fund"
HB19,816643,"Women's commission, quorum for holding meetings and conducting business, Sec. 41-9-410 am'd."
HB20,833703,"Workers' compensation insurance, corporate officer exempt from, procedures provided for, Sec. 25-5-50 am'd."
HB21,833766,"Fetal Heartbeat Act, prohibits physician from performing abortion without first determining fetal heartbeat, physician who does not make determination or who performs abortion when heartbeat detected is guilty of Class C felony"
HB22,833733,"Driver's licenses, penalties for violations of restrictions on Stage II driver's licenses, revised, Sec. 32-6-7.2 am'd."
HB23,833713,"Appropriation, Education Trust Fund to State Dept, of Education for $225,000 for fiscal year ending Sept. 30, 2017, for K-12 alert system"
HB24,833867,"Counties and municipal governing bodies, by local law, solid waste program, use of funds, procedure for collection, Sec. 22-27-5 am'd."
HB25,833778,"Search warrants, execution at any time, execution provisions requiring during daytime under certain conditions deleted, Sec. 15-5-8 am'd."
HB26,833877,"Shelby Co., probate court, recording fees, additional, for legislative delegation office, Act 248, 1975 Reg. Sess. am'd."
HB27,833337,"Fair Ballot Commission, ballot statement to be posted on website of Sec. of State in lieu of Legislative website, Sec. 17-6-81 am'd."
HB28,833857,"Boards, commissions, committees, task forces, authorities, inactive or inoperable, abolished, Secs. 20-2-190, 22-1-12, 22-23A-3, 24-10-2, 24-10-4, 24-10-5, 41-23-23 am'd; Secs. 2-7-1 to 2-7-7, inclusive, 2-13A-1, 2-13A-2, 4-2A-1 to 4-2A-23, inclusive, 9-6A-1 to 9-6A-10, inclusive, 9-12-142, 9-13-25, 14-1-18, 16-18A-1 to 16-18A-13, inclusive, 16-25A-13, 16-55-20 to 16-55-24, inclusive, 22-4A-1 to 22-4A-7, inclusive, 22-18-20 to 22-18-23, inclusive, 22-30E-12, 22-50-25, 24-10-8, 24-10-9, 29-2-220 to 29-2-228, inclusive, 32-3-1 to 32-3-7, inclusive, 36-21-140 to 36-21-142, inclusive, 36-36-10, 38-7A-1 to 38-7A-4, inclusive, 40-23-242, 41-9-190 to 41-9-196, inclusive, 41-9-490 to 41-9-498, inclusive, 41-9-570 to 41-9-574, inclusive, 41-9-780 to 41-9-787, inclusive, 41-9-830 to 41-9-833, inclusive, 41-10-200 to 41-10-215, inclusive, 41-10-490 to 41-10-523, inclusive, 41-25-1 to 41-25-5 inclusive repealed; Acts 1975-1178, Act 1979-43, Act 1984-319, Act 1985-138, Act 1985-280, Act 1985-301, Act 1985-811, Act 1987-02, Act 1988-213, Act 1991-259, Act 1991-325, Act 1992-56, Act 1994-764, Act 1996-289, Act 1997-68, Act 1997-818, Act 1998-107, Act 1998-156, Act 2000-8, Act 2001-62, Act 2002-318, Act 2004-421, Act 2004-540, Act 2005-257, Act 2006-430, Act 2007-171, Act 2007-421, Act 2007-507, Act 2007-565, Act 2007-592, Act 2008-25, Act 2008-121, Act 2008-337, Act 2008-386, Act 2009-142, Act 2009-180, Act 2009-794, Act 2009-798, Act 2009-806, Act 2010-458, Act 2010-638, Act 2011-132, Act 2011-356, Act 2012-25, Act 2012-597, Act 2014-194 repealed"
HB29,833811,"Hearing Instrument Dealers, definitions revised, fees to be determined by rule of board, testing of applicants revised, Sec. 34-14-34 added; Secs. 34-14-1 to 34-14-9, inclusive, 34-14-11, 34-14-30, 34-14-32, 34-14-33 am'd."
HB30,833892,"Agriculture and Industries Dept. seeds, regulation reserved to dept., local regulation prohibited, Sec. 2-26-3.1 added"
HB31,833834,"Milleage allowance, state employees and officials, traveling on official business, three-fourths the federal rate allowed, Sec. 36-7-22 am'd."
HB32,833755,"Class 3 municipality organized under Act 618, 1973 Reg. Sess., Montgomery Co., airport authority, two additional members appointed by county commission"
HB33,833803,"Montgomery Co., sheriff authorized to participate in Employees' Retirement System in lieu of supernumerary program, const. amend."
HB34,833847,"Alabama Renewal Act, certain tax credits for the state's port facilities and other tax credits, authorized, Secs. 40-18-400 to 40-18-403, inclusive, 40-18-410 to 40-18-416, inclusive, added"
HB35,833823,"Polygraph Examiners, further requirements for licensure by Board of Polygraph Examiners, regarding fingerprints and criminal background checks, Sec. 34-25-22 am'd"
HB36,833787,"Small Business Act, tax credits for small business employers authorized under certain conditions, Sec. 40-18-321 am'd."
HB37,833379,"Right to work public, policy declared, membership in or payment of dues to labor union may not be required for employment, const. amend."
HB38,833743,"Taxpayer Advocate, duties expanded, appointed by Governor, maintenance of public website required, annual report to certain legislative committees by regaining tax law ambiguities, Sec. 40-2A-4 am'd."
HB39,834068,"Judges, abolish a judgeship in the 29th Judicial Circuit, Secs. 9, 10, and 11 of Act 85-546, 1985 Reg. Sess., repealed; Sec. 12-17-20 am'd."
HB40,834141,"Health care providers, Natural Death Act, physicians do not attempt resuscitation orders specifically provided for in medical records, procedures, rules by Board of Health and Board of Medical Examiners, Sec. 22-8A-4.1 added; Secs. 22-8A-2, 22-8A-3, 22-8A-7, 22-8A-8 am'd."
HB41,834029,"Alabama Ahead Act, provisions re pen-enabled, phase-in, reassignment, and advisory committee deleted, oversight committee established, use of funds for high-quality standards-based broadband wifi infrastructure provided, effective date amended, Secs. 16-16B-1, 16-16B-2 am'd., Act 2012-560 am'd."
HB42,834706,"Article V constitutional convention, compact to set convention to require Congress to balance the budget, adopted"
HB43,834606,"Hunting, authorize the taking of whitetail deer or feral swine by means of bait, Secs. 9-11-244, 9-11-245 am'd."
HB44,834656,"Conservation and Natural Resources Department, wild animal or birds or bird eggs, permits and fees to collect for scientific or educational purposes, law to apply to wild invertebrate or vertebrate species, fines, Sec. 9-11-231 am'd."
HB45,834755,"Unborn infants, bodily remains disposition regulated, sale or unlawful disposition of bodily remains of unborn infant prohibited, use of unborn infant for certain research or transplantation, prohibited, criminal penalties, Unborn Infants Dignity of Life Act"
HB46,834557,"Alcoholic beverages, distilleries, sale of liquor at retail by, for off-site consumption authorized, Sec. 28-3A-6 am'd."
HB47,835002,"Warrantless arrests, authorized for a person trespassing on property of an educational institution, Secs. 13A-7-1, 15-10-3 am'd."
HB48,835062,"Tuscaloosa Co., 6th Judicial Circuit, additional circuit judge, conditioned on funding for compensation and benefits by county commission, election"
HB49,835308,"Courts, certain court costs and docket fees revert to the General Fund"
HB50,835568,"Ad valorem taxes, co. bd. of equalization, appeals to circuit court re valuation of commercial property, co. commission to secure legal counsel or payment through co. self-insurance fund, Sec. 40-3-26 am'd."
HB51,835430,"Code of Alabama 1975, Secretary of State, amount of copies distributed to certain entities reduced, Sec. 41-21-1 am'd."
HB52,835480,"Elections, notification of absentee voter of defective and uncounted ballot, Sec. 17-11-10 am'd."
HB53,835456,"Ethics law, retired director, chief or division chief, employment by contract for transition period authorized, prohibition on former government employee serving as a lobbyist before former employer, include working under contract, Sec. 36-25-13 am'd."
HB54,835407,"Municipalities, golf carts, limited operation on streets authorized, restrictions, liability insurance"
HB55,835445,"Civil Procedure, certain caregiver volunteers immune from civil action, Sec. 6-5-332 am'd."
HB56,835545,"Fantasy contests, regulation of, consumer protection measures by operators required, audits, civil penalties"
HB57,835426,"Fire safety, sky lanterns and novelty lighters, prohibited, penalties"
HB58,835412,"Drugs, prescription, exempt from business license tax based on gross receipts, Sec. 40-23-4.1 am'd."
HB59,835524,"Social Work Examiners, State Board of, definition of practice, licensure classification of ""graduate social worker"" and ""certified social worker"" changed to ""master social worker"" and ""independent clinical social worker"", Secs. 34-30-1, 34-30-3, 34-30-5, 34-30-20, 34-30-22, 34-30-24, 34-30-30, 34-30-31, 34-30-33 am'd."
HB60,835487,"Local bills, advertisement or posting prior to introduction, procedures, amendment further provided for, introduction limited, Sec. 106 (Recompiled Constitution of Alabama of 1901) am'd., const. amend."
HB61,835434,"Cannabidiol, possession and use of for certain debilitating conditions allowed, Leni's Law"
HB62,835419,"Taxation, tax credits for rehabilitation of qualified structures, credits extended until 2022, Secs.40-9F-4, 40-9F-7 am'd."
HB63,835583,"Taxation, defined contribution deferred compensation plans, 90 percent of income exempt from tax, Sec. 40-18-19 am'd."
HB64,835459,"Taxation, defined contribution deferred compensation plans, first $15,000, $30,000 of benefits exempt from state and local income taxes, Revenue Dept. authorized to adopt administrative rules, Sec. 40-18-19 am'd."
HB65,835529,"Insurance Department, regulation of insurance companies, provision for Own Risk Management Assessments (ORSA) with Commissioner of Insurance, confidentially under certain conditions, Secs. 27-29A-1 to 27-29A-10 added"
HB66,835415,"Civil procedure, extending immunity to certain firefighter paramedics or firefighter emergency medical technicians, Sec. 6-5-338 am'd."
HB67,835560,"Teachers' Retirement System, 10 percent cost-of-living adjustment provided to retirees beginning October 1, 2016."
HB68,835572,"Lobbying, executive branch, prohibited from contracting lobbyists"
HB69,835484,"Alcoholic beverages, add'l type of community development district, established, marina included, Secs. 35-8B-1, 35-8B-2, 35-8B-3 am'd."
HB70,835542,"Wages, establish the Alabama Minimum Wage Act, to set the state minimum wage, provide for a cost-of-living increase, const. amend."
HB71,835422,"Wages, establish the Alabama Minimum Wage, to set the state minimum wage, provide for a cost of living increase"
HB72,835472,"Voter registration, automatic, authorized"
HB73,835538,"Medical records, requests for, release to trial court or attorney of record, Secs. 12-21-5, 12-21-6, 12-21-7 am'd."
HB74,835564,"Rural physician tax credit, Secs. 40-18-130, 40-18-131, 40-18-132 am'd."
HB75,835590,"Mobile Co., alcoholic beverages sold in state ABC stores, sales and use tax, add, distrib. for district attorney"
HB76,835532,"Election, repealing maximum age limitation, prohibiting general law age restriction, const. amend."
HB77,835587,"Trespassing, critical infrastructure, crime established, penalties"
HB78,835580,"Cooperatives, formation of registration as nonprofit corp. required, governing documents, assessments, liens, homestead exemption, Cooperative Housing Corporation Act of 2016, Secs. 35-8C-1 to 35-8C-11, inclusive, 40-9-19.2 added"
HB79,835548,"Motor vehicles, crime of endangerment of a highway worker in a construction zone, created, exceptions, penalties"
HB80,835491,"Impaired Drivers Trust Fund, name changed to Alabama Head and Spinal Cord Injury Trust Fund, Secs. 16-38A-1, 16-38A-2, 16-38A-4, 32-5A-191, 32-5A-191.2 am'd."
HB81,835576,"Medical Examiners, powers and duties of Board of Medical Examiners, rulemaking authority clarified, Sec. 34-24-53.1 added"
HB82,835513,"Administrative rules, further review by Legislative Reference Service and Joint Committee on Administrative Regulation Review of rules regulating professions by boards with active market participants, fees, Sec. 41-22-22.1 added"
HB83,835520,"Wineries, establish one additional off-site tasting room, authorized, Secs. 28-3A-6, 28-7-18 am'd."
HB84,835495,"Education, Education Savings Account program, created"
HB85,835438,"Insurance Department and life insurance companies, Standard Nonforfeiture Law, reserves, Standard Valuation Law, Secs. 27-15-70 to 27-15-83, inclusive, 27-36A-1 to 27-36A-20, inclusive; Secs. 27-15-28, 27-36-7 repealed"
HB86,835898,"Insurance, health benefit plans prohibited from charging higher copayment or deductible for orally administered and self administered anticancer drugs than for intravenous"
HB87,835975,"Municipalities, commission form of gov't under Chapter 44, Title 11, special election procedures, repealed, savings provisions Chapter 44, Title 11 and Article 3, Chapter 46, Title 11 repealed, Secs. 11-44-1 to 11-44-162, inclusive, Secs. 11-46-90 to 11-46-145 inclusive, repealed"
HB88,836029,"Motor vehicles, truck weights, concrete mixing trucks, operation within 50 miles of home base, subject to maximum gross weight requirements, Sec. 32-9-20 am'd."
HB89,835965,"Taxation, collection of fees for nonpayable money order and nonpayable electronic funds, Sec. 40-29-70 am'd"
HB90,836088,"Taxation, defined contribution deferred compensation plans, first $15,000, $30,000 of benefits exempt from state and local income taxes, Revenue Dept. authorized to adopt administrative rules, Sec. 40-18-19 am'd."
HB91,836002,"Deferred compensation plans, portion of income exempt from income tax, Sec. 40-18-19 am'd."
HB92,835944,"Income tax, defined benefit plans, distributions, including retirement under Teachers and State Employees Retirement, exemption limited, contributions to defined benefit plans exempt from income under certain conditions, Secs. 16-25-23, 36-27-28, 36-27-170, 40-18-14, 40-18-19 am'd; Sec. 40-18-20 repealed"
HB93,835882,"Escambia Co., Oil and Gas Severance Trust, tax proceeds, investments in certificate of deposit, Sec. 45-27-246.30 am'd."
HB94,836467,"Motor vehicles, disabled veteran license plates, exemption or reductions in fees, may be applied by disabled veteran to obtain other plates, Secs. 32-6-130, 40-12-244, 40-12-254 am'd."
HB95,836390,"Probate court, court costs, payable at discretion of court when pleading filed, security deposits for court costs authorized, Secs. 12-19-43, 26-3-13, 43-2-82 am'd."
HB96,836487,"Searches and seizures, surveillance, electronic tracking devices, law enforcement authorized to use upon issuance of a warrant"
HB97,836425,"Insurance adjusters, licensing by Insurance Dept., applicant employed by state insurance company exempt from examination under certain conditions, Sec. 27-9A-9 am'd."
HB98,836412,"Firearms, pistol permits, retired military, lifetime permit provided at no cost, power of sheriff to revoke"
HB99,836415,"Dependent children, guardianship or conservatorship of, visitation action by isolated family members, procedure, Secs. 26-2A-112 to 26-2A-117, inclusive, added; Sec. 26-2A-108 am'd."
HB100,836448,"Rescue squads, included in definition of firefighters, Secs. 36-21-102, 36-30-1 am'd."
HB101,836459,"Motor Vehicles, dump trucks, operation with bed raised prohibited, penalties"
HB102,836419,"Children First Trust Fund, appropriations from for fiscal year ending September 30, 2017, use of allocation pursuant to Section 41-15B-2.2 and this act, tobacco settlement revenues deposited in fund within 30 days of receipt, Finance Director to notify each agency of allocation, appropriations conditional on tobacco revenues, appropriation of additional tobacco settlement funds, audit, Children's Affairs Department to report to Legislature and Children's Policy Council, appropriations from General Fund to various entities contingent upon adoption of const. amend. proposed by SB147, 2012 Reg. Sess."
HB103,836442,"Coalition Against Domestic Violence, appropriation, operations plan and audited financial statement required, quarterly and end-of-year reports required"
HB104,836485,"General Fund budget, appropriations for other functions of government, debt service, and capital outlay for fiscal year ending September 30, 2017."
HB105,836394,"Supplemental appropriation, SBI Cost of Evidence Fund to the Alabama Law Enforcement Agency for the fiscal year ending September 30, 2016."
HB106,836398,"Fire Departments, non-volunteer, diesel exhaust system installed in the fire station building, required within certain time frame and under certain conditions"
HB107,836402,"Chiropractic Examiners, St. Bd. of, licensed chiropractors, continuing education requirement, board to provide by rule, Sec. 34-24-165 amd."
HB108,836423,"House parties, minors under 21 present and alcoholic beverages or controlled substances being consumed, prohibited, penalty increased, Sec. 13A-11-10.1 am'd."
HB109,836454,"Health Savings Accounts, income tax deduction auth. for contributions to, Sec. 40-18-15.6 added."
HB110,836481,"Cable television, rates subject to regulation by Public Service Commission"
HB111,836392,"Probate court, having equity jurisdiction, concurrent with circuit court, civil contempt, powers same as circuit court, Sec. 12-13-9 am'd."
HB112,836429,"Parental rights, right to direct upbringing, education, care, and custody of child, const. amend."
HB113,836388,"Fraudulent Transfer Act, make applicable to domestic settlements, Sec. 8-9A-1 am'd."
HB114,836434,"Fire protection sprinkler systems, State Fire Marshal authorized to issue permits for installation, Secs. 34-33-1, 34-33-2, 34-33-3, 34-33-4, 34-33-5 am'd."
HB115,836404,"Grocery items, tobacco products, beer, sales not taxed at time of sale reported to Department of Revenue"
HB116,837018,"Sales and use tax, simplified seller use tax remittance, definition of seller, continued participation if physical address established, Secs. 40-23-191, 40-23-198 am'd."
HB117,836940,"Education budget, appropriations for the support, maintenance, and development of public education"
HB118,836456,"Talladega College, appropriation"
HB119,836444,"Lyman Ward Military Academy, appropriation"
HB120,836475,"Tuskegee University, appropriation"
HB121,836396,"Public education employees, salary increase, including K-12 and certain other designated education institutions, liability insurance program to be established by Finance Department in consultation with Education Department"
HB122,836452,"Appropriations, supplemental appropriations for fiscal year ending September 30, 2016, from Education Trust Fund to the Department of Labor and to the Department of Archives and History"
HB123,836473,"Appropriations, supplemental appropriations for fiscal year ending September 30, 2016, Education Trust Fund Advancement and Technology Fund to the Department of Education"
HB124,836437,"County superintendents of education, requirement to maintain office at co. seat deleted, Sec. 16-9-24 am'd."
HB125,836408,"Education, Alabama Longitudinal Data System created, matching of student performance data and workforce data, privacy and protection of student information required, administered by the Alabama Office of Education and Workforce Statistics created within the Dept. of Labor"
HB126,842368,"Local Government Insurance Program, Children's Advocacy Center authorized to participate, Sec. 11-91A-2 am'd."
HB127,842394,"Indigent Defense Advisory Boards, immunity for board members, annual meetings required, governing rules to be adopted by the Office of Indigent Defense Services, Sec. 15-12-4 am'd."
HB128,842473,"Murder, aggravated child abuse resulting in death of child, commission or attempt constitutes murder, Sec. 13A-6-2 am'd."
HB129,842566,"Title Insurance, agents, attorneys exempt from licenses by Insurance Department, Sec. 27-25-3 am'd."
HB130,842247,"Marriages, persons authorized to solemnize marriage not required to perform solemnize marriage, Sec. 30-1-7 am'd."
HB131,842213,"Children, foster care and guardianship, kinship guardian agreements, many of successor guardians, age appropriate activities, adoption of prudent parent standard, limitation of liability, age for court to consider independent living lowered, Secs.12-15-301, 12-15-314, 12-15-315, 38-12-32, 38-12-35, 38-12-36, 38-12-37, 38-12-38, 38-12-40 am'd."
HB132,842376,"Real Estate Appraisers Board, prohibited from establishing fees that an appraiser can charge, Sec. 34-27A-5 am'd."
HB133,842524,"Municipalities, police jurisdiction, reduced, authorized to be extended by local law under certain conditions, ordinances repealed if outside police jurisdiction, Sec. 11-40-10 am'd."
HB134,842177,"Pike Co., bd. of registrars, expense allowance and compensation, add'l., payable from co. gen. fund"
HB135,842504,"Taxation, sales and use taxes, Joe Jackson's Dog World, Inc., exempt from state, county, and municipal taxes"
HB136,842405,"Motorcycles and bicycles, red lights, authorized to disregard traffic-control signal and proceed under certain conditions, Sec. 32-5A-32 am'd."
HB137,842284,"Motor vehicles, used motor vehicle dealer or motor vehicle wholesaler, licensure and regulation, additional training required for new applicants, Revenue Department to enforce, Secs. 40-12-390, 40-12-391 am'd."
HB138,842601,"Appropriation, supplemental appropriation from Education Trust Fund to Sickle Cell Oversight and Regulatory Commission, fiscal year ending September 30, 2016."
HB139,842416,"Auctioneers, Board of, fines for violations increased, quorum defined, Secs. 34-4-29, 34-4-52 am'd."
HB140,842327,"Lexington, alcoholic beverages, sale of draft beer for on-premises and off-premises consumption for each day of the week except Sunday authorized, establishments that sell draft beer required to provide equipment necessary to dispense, referendum"
HB141,842455,"Deepwater Horizon Oil Spill, distribution of funds from BP settlement, road and bridge projects in Baldwin and Mobile Counties, insurance reform"
HB142,842609,"Hunting and fishing licenses, nonresidents enrolled in college or university, authorized to purchase resident licenses except for lifetime licenses, Sec. 9-11-73 added"
HB143,842584,"Hunting licenses, nonresidents, Conservation and Natural Resources Department authorized to enter reciprocity agreements with other states, Sec. 9-11-53.3 am'd."
HB144,842308,"Taxation, income tax refund check-off, contribution to Alabama State Parks, Mental Health Department, or Alabama Medicaid Agency, Sec. 40-18-140 am'd."
HB145,842515,"Municipalities, annexation of property enclosed within corporate limits, special procedure"
HB146,842355,"Boats and vessels, registration, Law Enforcement Agency., number sticker provided by dept., distinctive registration decals, distinctive letters authorized in lieu of numbers, fees, distrib. of part of fees to State Parks, Sec. 33-5-11am'd."
HB147,842256,"Feral swine, declaration as destructive and invasive species, Conservation and Natural Resources Dept. authorized to adopt rules to reduce population and protect public health and property"
HB148,842532,"Alcoholic beverages, permit a retail licensee and state liquor store to conduct distilled liquor and wine tastings, Sec. 28-3A-25 am'd."
HB149,842222,"Voter registration, automatic, authorized"
HB150,842265,"Equal Pay Remedies and Enforcement Act, established, legislative findings regarding wage differentials between minorities and nonminorities and males and females, Equal Pay Commission established, members, duties, powers, report to Governor and Legislature"
HB151,843114,"District courts, jurisdictional limit increased, filing fees and docket fees revised, Secs. 12-11-30, 12-12-30, 12-19-71, 12-19-72 am'd."
HB152,843045,"Hunting, nighttime hunting, to be authorized by rule of Dept. of Conservation and Natural Resources, nighttime hours further defined for Chapter 11, Title 9, Sec. 9-11-235 am'd."
