bill_number,bill_id,title
SB171,842724,"Title Insurance Agents, continuing education requirements met if mandatory continuing legal education requirements are met, Sec. 27-25-4.4 am'd."
SB172,842749,"Law Enforcement Agency, drivers' license office, operational in each county a minimum of two days each week"
SB173,843136,"Driver's licenses, penalties for violations of restrictions on Stage II driver's licenses, revised, Sec. 32-6-7.2 am'd."
SB174,842898,"Expungement of criminal records, authorized for youthful offenders, Sec. 15-27-2.1 added"
SB175,842908,"Competitive bids, public works Transportation Department and other agencies, increase the bid guarantee if Dept. of Transportation is awarding authority, Secs. 23-1-2, 39-2-4 am'd."
SB176,843337,"Circuit judgeships, Chief Justice of Alabama Supreme Court auth. to reallocate judgeships to a different circuit after vacancy, study by Judicial System Study Commission to make recommendations"
SB177,842940,"Hunting on land without permission, penalties revised, fines increased, restitution, forfeiture of hunting gear and firearms, Secs. 9-11-241, 9-11-242, 9-11-243 repealed"
SB178,843350,"Motor vehicles, autonomous technology, operation and testing, ALEA, drivers license endorsement"
SB179,843191,"Sex offenders, obscene materials containing visual depiction of persons under 17 years, disseminating, publicly displaying, possessing, or possessing with intent to disseminate, term further defined, crime of possession, penalties, Alabama Sex Offender Registration and Community Notification Act on 1st or 2nd offense, Secs.13A-12-190, 13A-12-191, 13A-12-192 am'd."
SB180,843159,"Transportation Safety Fund, established in State Treasury, distribution of certain funds and redistribution to state, counties, and municipalities, use of funds and restrictions on use of funds"
SB181,842977,"Lieutenant Governor, duties and powers over Senate, removed, salary established, joint election with Governor established, const. amend."
SB182,843104,"Medicaid, expanded to include persons for whom matching funds are available under the Patient Protection and Affordable Care Act, Alabama Medicaid Agency to implement, appropriation"
SB183,842638,"Tax refund, interest paid by Department of Revenue on overpayments, required after receipt of refund petition, Sec. 40-1-44 am'd."
SB184,843056,"Lane Cake, designated as official state dessert"
SB185,842628,"Wages, establish the Alabama Minimum Wage Act, to set the state minimum wage, provide for a cost of living increase, const. amend."
SB186,843020,"Restoration of Voting Rights, application process expedited, notification regarding procedures and eligibility required, Sec. 15-22-36.1 am'd."
SB187,842670,"Taxation, State Personnel Board, tax deferred compensation plan, created, Sec. 36-26-14 am'd."
SB188,842714,"Deepwater Horizon Oil Spill Disaster Settlement, distribution of funds to relieve certain debt of the state and remaining funds transferred to the State General Fund"
SB189,842848,"Municipalities, police jurisdiction, reduced, authorized to be extended by local law under certain conditions, ordinances repealed if outside police jurisdiction, Sec. 11-40-10 am'd."
SB190,843216,"Travel expenses, state employees, use of personal vehicle for official duties, mileage, reimbursement formula changed, American Automobile Association Daily Fuel Gauge Report, Sec. 36-7-22 am'd."
SB191,843327,"State employees, cost-of-living increase for fiscal year beginning October 1, 2017."
SB192,843146,"Securities Commission, directors salary to be fixed by commission with approval of State Personnel Board, Sec. 8-6-56 am'd."
SB193,842648,"Legislature, retired under the Teachers' Retirement System or Employees' Retirement System authorized to earn compensation with an employer in the TRS or ERS, Secs. 16-25-26, 36-27-8.2 am'd."
SB194,842805,"Municipalities, motor vehicles, automated photographic parking enforcement, authorized, procedures, adoption of municipal ordinances, civil fines, municipal court jurisdiction, appeals"
SB195,843226,"Auctioneers, Board of, fines for violations increased, quorum defined, Secs. 34-4-29, 34-4-52 am'd."
SB196,843090,"Motor vehicles, crime of endangerment of a highway worker in a construction zone, created, exceptions, penalties, Marshall James Walton Highway Worker Safety Act, established"
SB197,842703,"Birmingham Botanical Gardens, exempt from state, county, and municipal sales and use taxes"
SB198,842759,"Taxation, Vestavia Hills Soccer Club, exempt from state, co. and municipal sales and use taxes"
SB199,842883,"Briarwood Presbyterian Church, law enforcement officers with state police powers, employment authorized"
SB200,845654,"Electronic poll books in lieu of printed lists of qualified voters at polling place, Sec. of State authorized to implement pilot program, Sec. 17-4-2.1 added; Sec. 17-4-2 am'd."
SB201,845669,"Montgomery, traffic camera enforcement, Act 2011-298, 2011 Reg. Sess., Act 2011-337, 2011 Reg. Sess., repealed; Act 2009-740, 2009 Reg. Sess., am'd."
SB202,845416,"Corporate income tax, combined reporting of income required, Secs. 40-18-36, 40-18-38, 40-18-38.1 added; Secs. 40-18-1, 40-18-30, 40-18-31, 40-18-39 am'd."
SB203,845882,"Board of Dental Scholarship Awards, Alabama Dental Service Program established, funding through Education Trust Fund provided, procedures for awarding loans provided, process for repaying by serving in medically underserved areas provided, Secs. 16-47-76 to 16-47-81, inclusive, am'd."
SB204,845392,"Child Care Provider Inclusion Act, established, state prohibited from discriminating against child care service providers under certain conditions, civil remedies, provided for"
SB205,845755,"Abortion, Department of Public Health may not issue or renew licenses of clinics located near schools"
SB206,845842,"Physician's Assistants Service Program, created, administered by the Board of Medical Scholarship Awards, funding of program, tax credits for participation"
SB207,845552,"Taxation, exempt municipality and public industrial authority from granting abatement if they do not levy or impose one or more of the taxes to be abated, Sec. 40-9B-5 am'd."
SB208,845806,"Tax incentives, economic, state agency administered, report of cost to Legislature annually"
SB209,845528,"Credit unions, modernize language regulating and provide parity with federal credit unions, Secs. 5-17-8.1, 5-17-60 added; Secs. 5-17-2, 5-17-4, 5-17-6, 5-17-7, 5-17-8, 5-17-10, 5-17-11, 5-17-12, 5-17-13, 5-17-19, 5-17-21, 5-17-22, 5-17-42, 5-17-45, 5-17-46, 5-17-47, 5-17-51, 5-17-52, 5-17-54, 5-17-55 am'd."
SB210,845767,"Contract Review Committee, 45-day period of review, clarifies that the 45-day period does not begin until all required information is presented to the committee, additional request for information extends review period, Sec. 29-2-41 am'd."
SB211,845742,"Alcoholic beverages, breweries and brewpubs, sale of alcoholic beverages, Secs. 28-3-1, 28-3A-6, 28-4A-3 am'd."
SB212,846220,"Broadband telecommunications network facility, exempt from taxation for 10 years on facility built after January 1, 2016, Secs. 40-21-6, 40-21-9, 40-21-17, 40-21-18, 40-21-20, 40-21-21 am'd."
SB213,845931,"Broadband telecommunications network facility, sales and use tax exemption provided for, equipment or materials used by any such facility, Secs. 40-23-1, 40-23-4, 40-23-62 am'd."
SB214,846277,"Broadband telecommunication network facilities, tax credit for percentage of investment, Sec. 40-18-371.1 added; Sec. 40-18-370 am'd."
SB215,846145,"School buses, automated civil enforcement of school bus violations, county and city boards of education may initiate and enforce, district and municipal courts, county and city law enforcement"
SB216,845922,"Fraudulent claims, treble damages for persons filing false claims, civil penalties, Attorney General required to investigate and initiate civil actions, retaliatory action by employers prohibited, limitation of actions, Medicaid False Claims Act"
SB217,846034,"Trespassing, critical infrastructure, crime established, penalties"
SB218,845896,"Municipalities, police jurisdiction, not to extend in additional territory after effective date of this act without affirmative vote of municipal council, Sec. 11-40-10 am'd."
SB219,845959,"Alcoholic beverages, permit a retail licensee and state liquor store to conduct distilled liquor and wine tastings, Sec. 28-3A-25 am'd."
SB220,846136,"Adults, vulnerable adults protection from financial exploitation, reporting to Alabama Securities Commission and Dept. of Senior Services, immunity from administrative and civil action for certain disclosures"
SB221,848760,"Jefferson Co., ad valorem tax, special school district add'l tax, procedures for levy, use for public school purposes in district where levied, const. amend."
SB222,846015,"Massage Therapy, Board of, massage therapists further regulated, penalties increased, Secs. 34-43-3, 34-43-5, 34-43-6, 34-43-7, 34-43-9, 34-43-11, 34-43-12, 34-43-14, 34-43-15, 34-43-17, 34-43-20, 34-43-21 am'd; Sec. 34-43-10 repealed"
SB223,846311,"Public education employees, salary increase, including K-12 and certain other designated education institutions, liability insurance program to be established by Finance Department in consultation with Education Department"
SB224,846255,"Autism, health benefit plans, coverage of autism spectrum disorder under certain conditions, Secs. 10A-20-6.16, 27-21A-23, 27-54A-2 am'd."
SB225,845980,"Pickens Co., judge of probate, elections, run for reelection up to age of 75 years, const. amend."
SB226,845994,"Controlled substances, additional compounds included in Schedule I, Sec. 20-2-23 am'd."
SB227,845909,"Advanced Practice Nurses, Loan-Repayment Program established for, to pay for education of, Secs. 34-21-94 to 34-21-99, inclusive, added"
SB228,846151,"Workers' compensation insurance, corporate officer exempt from, procedures provided for, Sec. 25-5-50 am'd."
SB229,848804,"Virtual education, program open to resident students and past residents who are military dependents, distribution of state and federal funds clarified, Act 2015-89, 2015 Reg. Sess., am'd; Sec. 16-46A-2 am'd."
SB230,848495,"Taxation, tax credits for rehabilitation of qualified structures, credits extended until 2022, Secs.40-9F-4, 40-9F-7 am'd."
SB231,848515,"Definition of Moral Turpitude Act, established, crimes which disqualify citizens from voting provided, Sec. 17-3-30.1 added; Secs. 17-4-3, 17-4-4 am'd."
SB232,848826,"Alabama Lottery estab., participation in multi-state lottery games only, constitutional amendment"
SB233,848558,"Sales and use tax, simplified seller use tax remittance, definition of seller, continued participation if physical address established, Secs. 40-23-191, 40-23-198 am'd."
SB234,848647,"Crimes and offenses, criminal penalties and sanctions for racketeering and corrupt organizations, forfeiture of property used in racketeering activity, liens, Alabama RICO (Racketeering Influenced and Corrupt Organizations) Act"
SB235,848693,"Individual income tax, providing for the deduction of prenatal medcal expenses, Sec. 40-18-15 am'd."
SB236,848538,"Teachers' Retirement System, cost-of-living increase authorized"
SB237,849125,"Innocence Inquiry Commission, creation within Administrative Office of Courts, duties, review of by felony conviction upon presentation of verifiable evidence of innocence not previously presented, referral to court of original jurisdiction for review"
SB238,848907,"Consumers and consumer protection, protection of data containing personal information, notification of breach of to Attorney General and consumers required, disposal of records, civil penalty"
SB239,848960,"Railroads, qualified employees required to operate railroad train in this state, criminal penalties"
SB240,849146,"Psychology, Board of Examiners in, qualifications and membership, inactive license fee, criminal history background checks, penalty for violations increased, obsolete language removed, Sec. 34-26-20 repealed; Secs. 34-26-21, 34-26-41, 34-26-43.1, 34-26-62, 34-26-65, 34-26-66 am'd."
SB241,848991,"Taxation, transient occupancy tax, definitions, application clarified, Sec. 40-26-1 am'd."
SB242,849095,"Sales and use taxes, application of taxes, wholesale sale, definition amended to require component to become part of finished product, definition of tangible personal property and digital goods included, including electronic data, digital products or services, Secs. 40-23-1, 40-23-2, 40-23-60, 40-23-61 am'd."
SB243,849089,"Universities that operate medical school, authorized to incorporate authorities to own and operate health care facilities, University Authority Act"
SB244,848927,"Deputy sheriffs, practice of law, prohibition removed, Sec. 34-3-14 am'd."
SB245,849119,"Eyeglasses, over-the-counter eyeglasses, nonprescription glasses further defined, sale regulated, enforcement"
SB246,848978,"Community College System, establish as a body corporate, employees hired after January 1, 2017 not subject to Students First Act of 2011, board of trustees of system to establish procedures for discipline and tenure, powers re acquisition of property provided, Act 2015-125, 2015 Reg. Sess., am'd; Secs. 16-60-110.1, 16-60-111.4, 16-60-111.10 am'd."
SB247,849033,"Colleges and universities, University of North Alabama, Board of Trustees, authorized to establish and modify benefits for instructors and other officers, Sec. 16-51-6 am'd."
SB248,848972,"Motor vehicles, window tint law, medical exemption for light-sensitive porphyria, applicable to all areas of windshield, Sec. 32-5C-4 am'd."
SB249,849042,"Public education employees, salary increase, including K-12 and certain other designated education institutions, liability insurance program to be established by Finance Department in consultation with Education Department"
SB250,850402,"Autauga Co., coroner, benefits provided by county commission, reimbursement of certain expenses"
SB251,850532,"Autauga Co., sheriff, use of debit or credit card provided for"
SB252,850422,"Autauga Co., sheriffs, additional qualifications, continuing education, expense allowance and compensation"
SB253,850323,"Term limits, members of Senate and House of Representatives, board, commission, or public office receiving state funding, limited to three consecutive full terms"
SB254,850449,"Hale Co., abolishing office of constable"
SB255,850505,"Driving under the influence, criminal offense further defined, penalties further provided for, consideration of prior offenses expanded, Secs. 32-5A-191, 32-6-19 am'd."
SB256,850628,"Nondriver ID cards, parolees, Commissioner of Dept. of Corrections and Secretary of the ALEA, authority to establish program to issue nondriver ID to resident parolees upon release"
SB257,850478,"Public education employees, salary increase, including K-12 and certain other designated education institutions, liability insurance program to be established by Finance Department in consultation with Education Department"
SB258,850594,"Elections, ballots, reorder offices and candidates names, Sec. 17-6-25 am'd."
SB259,850460,"Motor vehicles, courts required to forward certain traffic offenses to Alabama Law Enforcement Agency, penalties for specified traffic offenses at railroad highway crossing grades revised, time frame for reporting nonresident commercial traffic violations, reduced, Secs. 32-5A-195, 32-5A-304, 32-6-49.11, 32-6-49.14 am'd."
SB260,850468,"State Parks Fund and the Parks Revolving Fund, transfer to other public accounts prohibited, const. amend."
SB261,850604,"Jefferson Co., Retirement System, Pension Board, membership revised, Act 2013-415, 2013 Reg. Sess., am'd; Sec. 45-37-123.21 am'd."
SB262,850376,"Transportation, transportation network companies, insurance coverage and disclosure requirements, provided for"
SB263,850340,"Income tax, individual and corporate returns, date required to be filed, filed on date for corresponding federal returns, Secs. 40-18-27, 40-18-39, 40-18-42 am'd."
SB264,850540,"Labor, child labor law enforcement, Sec. 25-8-59 am'd."
SB265,850567,"Uniform Severance Tax Act, exception for minerals severed in Alabama, sold to buyer in another state, and not transported on public roads in Alabama deleted, Sec. 40-13-53 am'd."
SB266,851362,"Vessels, certificate of title, uniform act, requirements, issuance by State Law Enforcement Agency, security agreement, perfection"
SB267,850549,"Deepwater Horizon Oil Spill Disaster Settlements, creaton of authority by Legislature required to issue bonds for certain purposes, Alabama Strategic Investment Initiative, const. amend."
SB268,851097,"Medicaid, inmates in city or county jail or custody of Dept. of Corrections, benefits suspended during custody"
SB269,851226,"Disabled persons, preference for services provided by under direction of the Department of Alabama Institute for Deaf and Blind, Sec. 21-2-2 am'd."
SB270,851195,"Deceptive trade practices, allowing consumers who rely on certain information to bring action for consumer fraud, Sec. 8-19-10 am'd."
SB271,851129,"Law Enforcement Agency, sale of vehicles and equipment authorized, distrib. of proceeds, Sec. 32-2-83 am'd."
SB272,851064,"State sales and use tax increased, phase-in period, sales and use tax on food phased out, exempt by 2017, counties and municipalities prohibited from increasing sales tax on food, Secs. 40-23-2, 40-23-61 am'd."
SB273,851108,"Transportation Dept., deputy directors and chief engineer, appointments of deputy director and chief engineer, appointment in unclassified service, Secs. 23-1-21.4, 23-1-22 am'd."
SB274,854767,"Educator-Student Interaction Training Act, State Superintendent of Education, School Superintendent of Alabama, and AEA required to develop and disseminate one hour of training at annual institute on appropriate and inappropriate interaction between educators and students"
SB275,854733,"Insurance adjusters, licensing by Insurance Dept., applicant employed by state insurance company exempt from examination under certain conditions, Sec. 27-9A-9 am'd."
SB276,854631,"Drivers' licenses, renewal period, extended to 6 months prior to expiration, Sec. 32-6-1 am'd"
SB277,854642,"Code of Alabama 1975, Acts of 2015 Regular Session as contained in 2015 supplements and replacement volumes, codified with certain corrections, local laws of certain counties codified, duties of Secretary of State"
SB278,854727,"Revenue Department, notification requirements by local governments regarding tax levies, revised, certain collection services authorized at no cost, Sec. 11-51-210.1 added; Secs. 11-3-11.3, 11-51-183, 11-51-208, 11-51-210, 40-12-4, 40-12-7 am'd."
SB279,854716,"Ethics, informal opinion by State Ethics Commission provided, prohibition of elected public officials lobbying revised, thing of value definition revised, Sec. 36-25-4.4 added; Secs. 36-25-1, 36-25-13, 36-25-23, 36-25-27 am'd."
SB280,854647,"Prescription drugs, indication that use of generic drug not allowed, notation by prescribing physician, Sec. 16-25A-18 am'd."
SB281,854742,"Motor vehicles, certificates of title, issuance by Revenue Dept., exemptions further provided for, penalties for violations by dealers, involuntary transfers, notice to Revenue Dept. required, Secs. 32-8-30, 32-8-31, 32-8-42, 32-8-46 am'd."
SB282,854676,"Motor Vehicles, dump trucks, operation with bed raised prohibited, penalties"
SB283,854697,"Teachers' Retirement System, designated non-governmental and quasi-governmental agencies and any elected local superintendent of education elected to office on or after January 1, 2017, prohibited from participation in, Secs. 16-25-1, 16-25-10.1 to 16-25-10.12, inclusive, 16-25-32, 16-25A-11, 36-29-14 am'd."
SB284,854708,"Medicaid fraud, crime of further provided for, statutes of limitations revised for certain fraudulent activity, Sec. 22-1-11 am'd."
SB285,854738,"Public assistance, revised procedures and limitations required for various public assistance programs administered by the Human Resources Dept."
SB286,854777,"Interest, due or paid on properties reduced subject to tax sale, Secs. 40-10-75, 40-10-76, 40-10-77, 40-10-83, 40-10-121, 40-10-122 am'd."
SB287,854811,"Prisons, Alabama Prison Transformation Initiative Act, construction of new facilities provided for, Joint Legislative Prison Committee, reporting requirements increased, Alabama Corrections Institution Finance Authority, bonds authorized for prison facilities, construction agreements, renovating and demolishing existing prison facilities, proceeds on existing one mill tax, distribution further provided for, Secs. 14-2-1, 14-2-12, 14-2-13.1, 14-2-14, 14-2-16, 14-2-19, 14-2-21, 14-2-28, 14-2-34, 38-4-12, 40-8-3 am'd."
SB288,854771,"Credit card debt, three year statute of limitations for delinquent card accounts, Sec. 6-2-37 am'd."
SB289,854931,"Appropriation, Forever Wild Land Trust, expenditures of funds prohibited for advertising, const. amend."
SB290,855552,"Sewage discharges to ground, unlawful, Sec. 22-26-5 repealed; Sec. 22-26-2 am'd."
SB291,855521,"Contracts, health care services, payment through Automated Clearing House (ACH) electronic fund transfers must be honored, language required in contract, Sec. 27-1-17.1 added"
SB292,855479,"Alcoholic beverages, retail sale by state phased out, privilege granted to Class A and Class B licensees, inventory bailment system, tax, displaced employees benefits, leases, market zones established, Secs. 28-1-4, 28-2-22, 28-3-43, 28-3-53.1, 28-3-53.2, 28-3-202, 28-3-205, 28-3-207, 28-3-241, 28-3A-11, 28-3A-12, 28-3A-19, 28-3A-20, 28-3A-21, 28-3A-22, 28-3A-24, 28-7-16 am'd.; Secs. 28-3-74, 28-3-280 to 28-3-286, inclusive, repealed on October 1, 2012"
SB293,855643,"Elections, qualification of electors, not serving court-ordered sentence of imprisonment, eligible to register and vote, Sec. 17-3-30 am'd."
SB294,855556,"Montgomery Co., sheriff authorized to participate in Employees' Retirement System in lieu of supernumerary program, const. amend."
SB295,855564,"Eminent domain proceedings, costs, condemnation proceedings filed by Dept. of Transportation, the department pays condemnee's reasonable attorney fees, appraisal and engineering costs if final award is 20 percent or higher than department's offer, Sec. 18-1A-293 am'd."
SB296,855450,"Epinephrine, auto-injectors, authorize administration of by non medical persons, program created"
SB297,855702,"Tax increment districts, provide that compensation may be determined solely by local governing body if a district is within a Major 21st Century Manufacturing Zone"
SB298,855514,"Insurance, Alabama Coastal Insurance Authority, create to provide affordable windstorm insurance in areas contiguous to Gulf of Mexico and Mobile Bay, Board of Directors, plan of operation and sale of bonds provided, commissioner authorized to require quarterly reports, authority authorized to assess policyholders of excess losses, Secs. 27-22B-1 to 27-22B-12, inclusive, added; Sec. 27-1-24 repealed"
SB299,855695,"Pharmacy, State Board of, training of pharmacy technicians regulated, Sec. 34-23-92 am'd."
SB300,855541,"Explosives, manufacturing defined, crimes of unlawful manufacture of a destructive device or bacteriological or biological weapon in first and second degrees established, Fire Marshal to establish qualifications for a permit to lawfully manufacture, Secs. 13A-10-193.1, 13A-10-193.2 added; Sec. 13A-10-190 am'd."
SB301,855572,"Title loan lenders, licensure and regulation of, established, Alabama Title Loan Act"
SB302,856181,"Voting, early voting procedure established, all elections"
SB303,857445,"Jackson Co., TVA in lieu of taxes, distribution, use of funds distributed to co. commission for disaster relief authorized, Economic Development Fund created, Sec. 45-36-162 am'd."
SB304,857401,"Pistol permits, sheriff authorized to issue to resident of another county, Sec.13A-11-75 am'd."
SB305,857564,"Taxation, tax liability, payment of with money order or electronic funds prohibited, Sec. 40-29-70 am'd."
SB306,857490,"Municipality or county, business license tax, home health agency and hospice, tax due only where headquarters or branch office is located, tax not to be levied only because of delivery of service by employees, Sec 11-51-90.4 added"
SB307,857467,"Legislative Council and Joint Committee on Administrative Regulation Review, quorum, vote requirements, Sec. 29-6-3 am'd."
SB308,857539,"Board of Dental Examiners, powers and duties, rulemaking authority clarified, Sec. 34-9-43.2 added"
SB309,857666,"Insurance, health benefit plans prohibited from charging higher copayment or deductible for orally administered and self administered anticancer drugs than for intravenous"
SB310,857701,"State Board of Pharmacy, powers and duties of board, rulemaking authority clarified with regard to anticompetitive rules that prioritize patient safety and wellness, Sec. 34-24-92.1 added"
SB311,857797,"Teachers' Retirement System, cost-of-living increase authorized"
SB312,857655,"Economic development, Alabama Jobs Act, development of certain closed military installations subject to jobs credit under certain conditions, Act 2015-27, 2015 Reg. Sess., am'd; Secs.40-18-370, 40-18-376.2 am'd."
SB313,857645,"Class 5 municipalities, tax sale properties acquired from State Land Commissioner, expedited procedure to quiet title in lieu of procedures in Title 40, Chapter 10, Code of Alabama 1975"
SB314,857696,"Class 5 municipalities, establish certified animal control officers, authorize imposition of civil penalties by"
SB315,857661,"Volunteer fire depts., certification by Forestry Commission, minimum standards for equipment, decertification authorized, rules re certification and decertification authorized, Sec. 9-3-17am'd."
