bill_number,bill_id,title
H0148,727356,"Amends, repeals and adds to existing law to provide for commission members, to provide for terms, to provide for meetings for the selection of commission nominees, to provide for notice of meetings and to provide for vacancies; and to provide for powers and duties."
H0149,728518,"Amends existing law to prohibit certain acts by manufacturers and distributors of contact lenses."
H0150,728641,"Adds to existing law to establish the Interstate Medical Licensure Compact."
H0151,728661,"Amends existing law to provide that certain information about health benefit plans be made available to users of the health insurance exchange."
H0152,728421,"Adds to existing law to provide for the licensure of sign language interpreters."
H0153,728592,"Amends existing law to provide that authorized personnel may provide community health emergency medical services."
H0154,728813,"Adds to existing law to provide requirements for chemical abortions and for administering certain drugs in abortions, to provide for a civil cause of action and conditions for anonymity of the female and to provide for construction."
H0155,728570,"Repeals, amends and adds to existing law to provide that consideration of certain labor contract offers may be held in executive session and to increase monetary civil penalties for violations of the Open Meeting Law; to establish provisions relating to negotiations in open session, to provide that an executive session may be held for certain specific purposes, to provide that certain documents exchanged between parties shall be subject to public writings disclosure laws and to provide that public testimony shall be posted as an agenda item."
H0156,728763,"Amends existing law to provide that the county tax collector may bid on property for sale if it is deemed in the best interest of the county and to provide that the tax collector shall dispose of the purchased property by sale in the same manner as other personal property belonging to the county."
H0157,728691,"Amends existing law to authorize the Idaho State Police to contract with private entities under certain conditions when necessary for public safety."
H0158,728860,"Amends existing law to provide for setting bail when a defendant fails to appear in court under certain conditions."
H0159,728928,"Amends existing law to revise a provision relating to selling or distributing tobacco products, to reclassify certain tobacco-related offenses as infractions, and to revise penalties."
H0160,728838,"Amends existing law to provide that willfully placing debris on a highway under certain conditions shall be a misdemeanor and to provide a penalty."
H0161,728544,"Amends existing law to reclassify certain violations as infractions and to provide for penalties."
H0162,728740,"Amends and adds to existing law to establish additional provisions relating to juror compensation for lengthy trials; to establish an additional power of the Supreme Court to make rules concerning juries; to establish the Lengthy Trial Juror Compensation Fund; and to increase certain fees and to provide for the deposit of certain fees."
H0163,728617,"Amends existing law relating to the Idaho criminal justice system to revise effective dates."
H0164,728492,"Amends existing law to provide that offenders who commit certain violent offenses shall register as a violent offender."
H0165,728467,"Amends existing law to revise the fee for original issuance of a concealed weapons license."
H0166,728786,"Amends and adds to existing law to provide resolutions for the development and operation of mitigation plans and recharge projects, to provide that the amount of obligation or contract indebtedness proposed to be issued be set forth, to provide that the contract indebtedness in a proposed resolution be submitted to a vote if certain conditions are met, to provide criteria whereby a district shall be authorized to incur indebtedness or obligations or enter into certain contracts, to provide that certain action shall be subject to judicial examination, to provide for answers to petitions, to provide for action by the court, to provide for costs and to provide for review of judgments."
H0167,728445,"Repeals, amends and adds to existing law to remove provisions relating to labor negotiations conducted in executive session, to provide that consideration of labor contract offers may be held in executive session; to establish provisions relating to negotiations in open session, to provide that an executive session may be held for certain specific purposes, to provide that certain documents exchanged between parties shall be subject to public writings disclosure laws, to provide for notice and to provide that public testimony shall be posted as an agenda item."
H0168,730194,"Appropriating an additional $3,640,500 for fiscal year 2015 to the Superintendent of Public Instruction to pay for broadband at public schools; providing legislative intent for use of the funds; providing legislative intent regarding the law governing procurement for school districts; providing legislative intent for reporting requirements; and reducing the appropriation to the Department of Administration for fiscal year 2015 by $5,052,000 for the Idaho Education Network."
H0169,729960,"Amends existing law to remove a sunset date and an effective date."
H0170,730118,"Adds to existing law to provide that the State Department of Education may enter into Pay for Success contracts, to provide contract requirements, to provide for an external evaluator, to provide for investor moneys, to provide for a third-party administrator, to establish an oversight committee, to provide reporting requirements and to grant rulemaking authority."
H0171,731607,"Adds to existing law to provide that transportation network companies and their drivers shall maintain insurance."
H0172,732309,"Amends existing law to revise the definition of ""new jobs""; to revise application requirements; to revise the agreement with the applicant; and to revise applicant reporting requirements."
H0173,731415,"Amends existing law to specify the use of a certain percent of the new construction roll shall be for bond retirement of school districts and for other safety needs of the public schools or for public charter school buildings."
H0174,731864,"Amends existing law to provide that the Idaho Code is in the public domain and to provide that no copyright may be claimed by the State of Idaho or any other entity; and repealing a section that provides the Idaho Code is the property of the State of Idaho."
H0175,732058,"Adds to existing law to require certain communication about biosimilar medications."
H0176,731735,"Adds to existing law to authorize medication synchronization and dispensing fee standardization."
H0177,732249,"Amends existing law to prohibit using tanning devices on minors except under certain circumstances."
H0178,731798,"Amends existing law to revise the maximum amount of educational debt repayments for rural physicians and to provide that the review board shall make a certain consideration before granting awards."
H0179,732121,"Amends and adds to existing law to provide investment limitations for hospital treasurers."
H0180,731544,"Adds to existing law to provide a mechanism to obtain insurance status information."
H0181,731478,"Adds to existing law to provide the Naturopathic Medical Physicians Licensing Act."
H0182,734864,"Amends existing law to exclude consumer operated and oriented health plans from guaranty association coverage."
H0183,736517,"Amends existing law to allow for posters and signs for victims of human trafficking in state rest areas along highways and to provide for contents of the posters and signs."
H0184,736429,"Amends existing law to clarify provisions relating to small brewer self-distribution."
H0185,735994,"Amends existing law to provide for an exception to a defined term where electricity is purchased to charge batteries of electric motor vehicles as provided by order or rule of the Idaho Public Utilities Commission."
H0186,736342,"Amends existing law to provide that the costs of acquiring, feeding, caring for and maintaining wildlife or fish available for hunting or fishing are eligible for the production exemption when the hunting or fishing activity is taxable."
H0187,736561,"Amends and adds to existing law to establish requirements relating to home kitchen operations."
H0188,736032,"Adds to existing law to provide for pharmacy audit integrity and to authorize the use of pharmacy benefit managers."
H0189,736386,"Adds to existing law to establish the Idaho Telehealth Access Act."
H0190,736293,"Amends existing law to revise a fee for undergoing a criminal history check."
H0191,736163,"Amends and adds to existing law to apply a section to an additional group of individuals, to revise penalty provisions; and to provide requirements for harassment, intimidation and bullying information and professional development."
H0192,738232,"Amends and adds to existing law to provide for Pet Friendly license plates."
H0193,738672,"Adds to existing law to provide for limited applicability of the Unfair Sales Act."
H0194,738617,"Amends existing law to revise harvest season provisions; to revise a braking requirement exemption in the use of farm trailers; to revise a chaining requirement exemption for the transportation of agricultural products; to remove language relating to the operation of refuse or sanitation trucks; and to provide an exception to specified weight restrictions for axles, bridges and gross vehicle weight limits for farm vehicles, vehicles that are operated to transport forest products and certain refuse or sanitation trucks."
H0195,738126,"Amends existing law to provide penalties for a fireworks violation."
H0196,738452,"Amends existing law to provide for limited liability companies relating to dealer and salesman licensing, to provide for denial of licenses under certain conditions; to restrict licensed manufacturers and distributors from engaging in certain acts relating to purchasers of new motor vehicles, to provide for an extension of the operation of a dealership by a manufacturer or distributor; to provide for successors to ownership of dealerships and to provide that a manufacturer may request and receive certain information from a successor to a dealership who is not a family member."
H0197,738341,"Amends existing law to establish provisions for ground water and mine operators."
H0198,738287,"Adds to existing law to provide an exemption from daylight saving time."
H0199,738178,"Amends existing law to revise criteria as to how certain nonprofit corporations, funds, foundations, trusts or associations qualify for a state income tax credit."
H0200,740536,"Adds to existing law to establish the Office of the Inspector General."
H0201,740441,"Adds to existing law to provide for regulation of transportation network companies and drivers."
H0202,740302,"Amends existing law to provide requirements relating to assessing the value of certain personal property, to provide requirements for the sale of certain personal property and to provide that certain individuals are not eligible to acquire certain personal property."
H0203,740559,"Amends existing law to provide requirements for contracts entered into by a board of fire district commissioners for employment of officers, agents and employees."
H0204,740584,"Amends and adds to existing law to revise provisions relating to the residence requirements of fire protection commissioners; to establish provisions relating to residence requirements for fire protection commissioners, to provide requirements relating to the Board of Fire Protection Commissioners' responsibility to revise subdistricts; and to establish a process to decrease the size of a fire protection board."
H0205,741957,"Appropriates an additional $62,761,000 for the Division of Medicaid from dedicated receipt funds; and reduces the appropriation for the Division of Medicaid by $17,110,000 from the General Fund and $41,890,000 from federal funds for a net increase of $3,761,000 for fiscal year 2015."
H0206,742081,"Appropriates to the Department of Correction an additional $398,600 from the General Fund, $156,900 from the Inmate Labor Fund, and $200,000 from the Parolee Supervision Fund for a total of $755,500 for fiscal year 2015; authorizes an additional two full-time equivalent positions; and reduces the General Fund appropriation to the Department of Correction by $2,369,900 for fiscal year 2015. These changes represent a net reduction of $1,971,300 in the General Fund and an overall net reduction of $1,614,400 in all funds."
H0207,742159,"Appropriates $4,254,600 to the Office of Drug Policy for fiscal year 2016; and limits the number of full-time equivalent positions to 6."
H0208,742188,"Amends existing law to further define the term ""claimant."""
H0209,741984,"Amends existing law to revise the definition of ""tangible personal property"" and to remove the definition of ""digital videos."""
H0210,742060,"Changes the fiscal year 2015 appropriation to shift $3,605,700 from federal to dedicated funds; appropriates an additional $8,124,500 in dedicated funds to Self-Reliance Operations; and transfers 15 FTP from the Southwest Idaho Treatment Center to Self-Reliance Operations."
H0211,741934,"Changes the fiscal year 2015 appropriation by adding an additional $3,236,300 of federal fund appropriation for the Benefit Payments Program in the Division of Welfare; transfers $1,300,000 of General Fund personnel costs to operating expenditures and capital outlay and adds $2,600,000 of federal fund appropriation for Indirect Support Services."
H0212,742037,"Amends and adds to existing law to define a term; to remove obsolete language; to revise provisions relating to disclosures in elections to authorize a levy; to provide additional qualifications for the election of district judges; to provide that no candidate's name may appear on a ballot for more than one judicial office; to authorize county adoption of an electronic poll book and to provide duties of the secretary of state; to establish additional provisions relating to a recount; and to remove the authority of an election board judge to require a certain declaration."
H0213,742015,"Amends existing law to revise provisions relating to the annual meetings of public library district boards and to revise provisions relating to administering an oath of office."
H0214,742128,"Amends existing law to revise the definition of ""nonbusiness entity""; to revise expenditure requirements by nonbusiness entities; and to revise certain duties of lobbyists."
H0215,742250,"Amends and adds to existing law to revise the number of year-round liquor licenses that may be issued upon certain circumstances; to provide for a resort city conference and event center liquor license; to provide for a resort city restaurant liquor license, to define terms and to establish provisions for renewal."
H0216,743165,"Repeals, amends and adds to existing law to provide initiative and referendum procedures for cities."
H0217,744491,"Amends existing law to revise provisions for the applicability of specified law."
H0218,744616,"Creates the new Healthcare Policy Initiatives Program and provides seven positions and $3,479,800 from federal funds for FY 2015; provides an additional $41,900 in federal funds and one position for Physical Health Services for FY 2015; reduces the General Fund appropriation by $57,800 and one position for the Medically Indigent Administration Program; and reduces the Southwest Idaho Treatment Center FTP count by eight."
H0219,745846,"Amends existing law to revise procedures regarding disclosures in elections to authorize bonded indebtedness; and to revise procedures regarding disclosures in elections to authorize tax levies."
H0220,746094,"Amends existing law to revise criteria as to how certain nonprofit corporations, funds, foundations, trusts or associations qualify for a state income tax credit."
H0221,745883,"Amends existing law to provide that the costs of acquiring, feeding, caring for and maintaining wildlife or fish available for hunting or fishing are eligible for the production exemption when the hunting or fishing activity is taxable."
H0222,745941,"Amends and adds to existing law to revise provisions for staff allowance; to revise provisions for the experience and education multiplier; to provide for a career ladder and related requirements; to revise provisions for each district's salary-based apportionment; and to revise provisions for leadership premiums."
H0223,745713,"Appropriates $1,515,000 to the Office of Energy Resources for fiscal year 2016; and limits the number of full-time equivalent positions to 8."
H0224,746113,"Appropriates $5,534,000 to the Medical Boards for fiscal year 2016; and limits the number of full-time equivalent positions to 45.1."
H0225,745996,"Appropriates $1,968,700 to the Lava Hot Springs Foundation for fiscal year 2016; and limits the number of full-time equivalent positions to 13.8."
H0226,746036,"Appropriates $51,454,300 to the Department of Juvenile Corrections for fiscal year 2016; and limits the number of authorized full-time equivalent positions to 410."
H0227,745826,"Appropriates $32,168,700 to the Division of Veterans Services for fiscal year 2016; and limits the number of full-time equivalent positions to 331."
H0228,745961,"Appropriates $6,163,700 to the Public Utilities Commission for fiscal year 2016; and limits the number of full-time equivalent positions to 52."
H0229,746057,"Appropriates an additional $25,000 from the General Fund to the Military Division for the Military Management Program to cover inauguration expenses for fiscal year 2015; appropriates $67,913,400 to the Military Division for fiscal year 2016; limits the number of authorized full-time equivalent positions to 317.8; provides clarification and guidance regarding the Flat Top Butte communication site; and grants a continuous appropriation for the Bureau of Homeland Security's Miscellaneous Revenue Fund for the purpose of covering incurred costs arising out of hazardous substance incidents."
H0230,745769,"Appropriates $8,719,200 from the General Fund to the Public Health Districts for fiscal year 2016."
H0231,745661,"Appropriates $644,500 to the Endowment Fund Investment Board for fiscal year 2016; limits the number of full-time equivalent positions to 3.7; authorizes continuous appropriation authority for certain costs; and expresses legislative intent with regard to transfers from the earnings reserve funds to the income funds."
H0232,746018,"Changes the fiscal year 2015 appropriation to the Department of Health and Welfare with a one-time transfer of General Funds from Adult Mental Health to Children's Mental Health; changes the fiscal year 2015 appropriation for the Substance Abuse Treatment and Prevention Program with the transfer of 2.0 FTP from the Southwest Idaho Treatment Center and provides an additional appropriation of $796,700 from federal funds."
H0233,746821,"Amends and adds to existing law to provide an amount needed for school counseling support; to revise provisions and to establish additional provisions for school counselors; to provide for academic and college or career advisors and student mentors, to grant school districts and charter schools the authority to employ certain staff, to require school districts to provide professional development for certain staff and to provide notice and reporting requirements."
H0234,746641,"Amends existing law to revise the property tax exemption for certain business property, to revise definitions, to revise capital investment requirements in counties within a certain population criteria and to revise the exemption period."
H0235,746880,"Adds to existing law to establish requirements for health insurance policies covering certain types of chemotherapy."
H0236,747604,"Adds to existing law to provide for an agreement for exchange of information between the State Tax Commission and the departments of Correction and Health and Welfare in relation to the food tax credit."
H0237,747859,"Amends existing law to provide that the use tax shall not apply to a retailer supplying prepared food or beverages free of charge to its employee when that retailer sells prepared food or beverages in its normal course of business."
H0238,747691,"Amends existing law to provide an exemption for certain equipment."
H0239,747432,"Amends and adds to existing law to provide that urban renewal agency board commissioners must have certain qualifications, to provide that an agency's budget shall be included in a certain report, to provide a penalty for urban renewal agencies that fail to file a certain report; to provide that revenue allocation funds shall not be used to construct certain buildings; and to provide that urban renewal agencies shall give notice of a certain meeting."
H0240,747517,"Appropriates $2,103,501,600 for the Medicaid Division in the Department of Health and Welfare for fiscal year 2016; limits the number of authorized full-time equivalent positions to 208; provides for transfers to the Cooperative Welfare Fund; limits transfers from trustee and benefit payments; provides legislative intent regarding program integrity; requires monthly Medicaid tracking reports; provides for transfers between programs; requires biannual reports regarding managed care implementation; and requires an annual report on flexible spending authority."
H0241,749105,"Amends existing law to redesignate no conduct orders as orders prohibiting conduct, to revise a provision concerning the issuance of an order prohibiting conduct, to provide that the order shall define prohibited conduct and that the order shall be served on the defendant prior to enforcement, and to revise provisions concerning when a violation of an order prohibiting conduct is committed."
H0242,749443,"Amends existing law to revise provisions and procedures when an automatic recount in an election occurs."
H0243,749266,"Repeals, amends and adds to existing law relating to the carrying of concealed weapons."
H0244,749085,"Amends existing law to revise the formula for state lottery distributions."
H0245,749239,"Amends existing law to remove the exception for a foreign exchange pupil from applying to a postsecondary institution to enroll in nonsectarian courses."
H0246,749218,"Amends and adds to existing law to apply a section to an additional group of individuals; and to provide requirements for harassment, intimidation and bullying information and professional development."
H0247,749169,"Appropriates a total of $70,732,700 to the Idaho State Police for fiscal year 2016; and limits the number of authorized full-time equivalent positions to 560.5."
H0248,749400,"Appropriates $12,492,400 to the Commission on Aging for fiscal year 2016; limits the number of authorized full-time equivalent positions to 13; and requires a management review."
H0249,749335,"Appropriates $14,464,200 to the Idaho State Controller for fiscal year 2016; limits the number of authorized full-time equivalent positions to 95; provides for the recovery of State Controller service costs to the General Fund; provides dedicated fund reappropriation authority; and appropriates an additional $250,000 to the Idaho State Controller for fiscal year 2015."
H0250,749355,"Appropriates $5,261,100 to the Idaho Commission for Libraries for fiscal year 2016; and limits the number of authorized full-time equivalent positions to 37.5."
H0251,749045,"Appropriates $25,443,700 to the Division of Vocational Rehabilitation for fiscal year 2016; and limits the number of full-time equivalent positions to 152.5."
H0252,749149,"Amends existing law to impose a sales and use tax exemption where that portion of tax exceeds the sales and use tax rate that a nonresident purchaser would pay in the state of residence on sales under certain conditions, to provide duties of the State Tax Commission and to impose a sales and use tax exemption for sales of certain items manufactured in Idaho for use and licensing outside of Idaho when sold directly by the manufacturer to the out-of-state purchaser; and to provide for distribution of these moneys."
H0253,752236,"Appropriates $4,750,000 to the Commission for the Blind and Visually Impaired for fiscal year 2016; and limits the number of full-time equivalent positions to 40.12."
H0254,752111,"Appropriates $22,796,000 to the Attorney General for fiscal year 2016; limits the number of authorized full-time equivalent positions to 202.6; and exempts the Attorney General from object and program transfer limitations."
H0255,752083,"Amends and adds to existing law to clarify statutory authority of the Department of Lands, the Department of Water Resources and the Water Resource Board over recreational and small-scale dredge mining."
H0256,751833,"Amends existing law to revise provisions concerning the applicability of specified law."
H0257,752297,"Amends existing law to provide that park model vehicles shall be assessed per the National Automobile Dealers Association standard for recreational vehicles classified as park model homes for property tax purposes."
H0258,752267,"Amends existing law to revise the definition of ""food establishment."""
H0259,752018,"Amends existing law to revise a surcharge for providing evidence of a certain entity filing and to remove a provision relating to a surcharge for certain records."
