bill_number,bill_id,title
H0260,751951,"Amends and adds to existing law to revise provisions concerning the apportionment of the highway distribution account; to revise transfer fee provisions concerning certain revenue received by the petroleum clean water trust fund; to provide for the distribution of transfer fees and interest accruing to the petroleum clean water trust fund; to provide for an electric vehicle fee and to provide for a hybrid vehicle fee; to provide for certain transfers from the general fund to the highway distribution account upon the occurrence of certain conditions, to provide for appropriation and to provide a sunset provision; to revise provisions concerning tax on motor fuel, to provide for the reduction in tax on motor fuel upon the occurrence of certain conditions and to provide a sunset provision."
H0261,751890,"Adds to existing law to provide that certain state general fund moneys shall be dedicated to the Highway Distribution Account by appropriation."
H0262,752047,"Adds to existing law to provide for regulation of transportation network companies and drivers."
H0263,755172,"Amends existing law to provide for certain payments to schools."
H0264,754885,"Appropriates $88,007,100 to the divisions of Mental Health, Psychiatric Hospitalization, and Substance Abuse Treatment and Prevention for fiscal year 2016; limits the number of full-time equivalent positions for the three divisions to 673; provides for General Fund transfers to the Cooperative Welfare Fund; directs expenditures for trustee and benefit payments; provides for program integrity; limits transfers of legislative appropriations; clarifies responsibility for education of certain children in state care; directs an interagency payment; provides for Court Services Fund transfers; and provides legislative intent relating to a Crisis Center location."
H0265,754699,"Adds to existing law to provide for the Interstate Compact on Transfer of Public Lands."
H0266,755266,"Amends, repeals and adds to existing law to revise the transfer fee imposed on petroleum products and to provide alternate means of distribution of transfer fees; to revise registration fees; to revise certain permit fees; to provide for criteria relating to registration; to provide for electric vehicle and hybrid vehicle fees; to provide for the transfer of certain General Fund collections to the Budget Stabilization Fund and the Transportation Infrastructure Fund and to provide for the Transportation Infrastructure Fund; to provide for appropriation of General Fund moneys into the GARVEE Debt Service Fund; to revise the tax imposed on motor fuel; and to revise provisions regarding the distribution of tax imposed on motor fuel."
H0267,754978,"Amends existing law to provide a deduction for certain health care and medical services costs."
H0268,756750,"Appropriates an additional $69,600 to the Department of Lands for fiscal year 2015; appropriates $50,641,800 to the Department of Lands for fiscal year 2016; limits the number of full-time equivalent positions to 283.12; exempts certain appropriation object transfer limitations; and provides legislative intent with regard to Flat Top Butte."
H0269,758050,"Amends existing law to revise how the tax on the production of oil and gas is administered and collected and to define ""gross income."""
H0270,757997,"Adds to existing law to provide for the At-Home School Readiness Pilot Program."
H0271,757965,"Appropriates $2,476,300 to the State Appellate Public Defender for fiscal year 2016; limits the number of full-time equivalent positions to 23; provides legislative intent for the payment of outside counsel costs; provides legislative intent for the payment of capital representation costs; and provides for a cash transfer."
H0272,757930,"Appropriates $3,828,700 to the State Treasurer for fiscal year 2016; limits the number of full-time equivalent positions to 26; provides for reappropriation authority for the LGIP Fund; provides legislative intent regarding conference-related activities; provides legislative intent regarding payment of bank service fees; provides legislative intent regarding mitigation of bank service fees; and provides legislative intent regarding consultation with the State Treasurer Investment Advisory Board."
H0273,757948,"Appropriates $20,683,200 to the Department of Water Resources for fiscal year 2016; limits the number of full-time equivalent positions to 152; appropriates and transfers $716,000 from the Revolving Development Fund to the Aquifer Planning and Management Fund; and provides legislative intent for the director to commence a water rights adjudication of the Palouse River Basin."
H0274,757983,"WELFARE DIVISION- Appropriates $149,545,500 for the Welfare Division in the Department of Health and Welfare for fiscal year 2016; limits the number of authorized full-time equivalent positions to 634.55; provides for transfers to the Cooperative Welfare Fund; directs expenditures for trustee and benefit payments; provides legislative intent for program integrity; and requires biannual forecast reports."
H0275,758032,"Amends existing law to provide an exemption concerning the Educational Support Program and a decrease in average daily attendance and to provide a term of participation if no exemption is requested."
H0276,758754,"Appropriates $99,734,500 to the Department of Health and Welfare for the divisions of Child Welfare, Services for the Developmentally Disabled and Service Integration for fiscal year 2016; limits the number of authorized full-time equivalent positions for the three divisions to 734.21; provides for General Fund transfers to the Cooperative Welfare Fund; limits transfers for trustee and benefit payments; provides for program integrity; provides legislative intent on educating children in the department's care; and directs expenditures for Head Start."
H0277,758647,"Amends and adds to existing law to establish additional provisions concerning the business of title insurance; to establish additional provisions concerning the business of title insurance operating under the control and supervision of the director of the Department of Insurance; to provide that a title insurer may issue closing or settlement protection to certain persons, to provide a limitation on closing or settlement protection, to provide a rate and to establish provisions for construing the section."
H0278,758858,"Amends and adds to existing law to provide an amount needed for school counseling support; to revise provisions and to establish additional provisions for school counselors; and to provide for academic and college or career advisors and student mentors, to grant school districts and charter schools the authority to employ certain staff, to require school districts provide professional development for certain staff and to provide notice and reporting requirements."
H0279,758591,"Repeals and amends existing law to create the Idaho State Gaming Commission to oversee the lottery, racing, Indian gaming and bingo and raffles."
H0280,759422,"Amends existing law to provide for the issuance of a liquor license to the owner, operator or lessee of a conference and event center that is within the city limits of a resort city."
H0281,759519,"Appropriates $110,359,900 to the Department of Health and Welfare for the Public Health Services Division for fiscal year 2016; limits the number of authorized full-time equivalent positions to 221.5; provides for transfers to the Cooperative Welfare Fund; limits the transfer of funds budgeted for trustee and benefit payments; provides for program integrity; provides for specific use of General Funds; and requires an annual report on accreditation status."
H0282,759484,"Appropriates $27 million from the General Fund and directs the transfer to the Catastrophic Health Care Cost Fund for fiscal year 2016; and provides guidance regarding unexpended and unencumbered General Funds."
H0283,759539,"Amends and adds to existing law to enact the Streamlined Sales Tax."
H0284,759442,"Appropriates $226,163,000 to the Department of Correction for fiscal year 2016; limits the number of authorized full-time equivalent positions to 1,972.85; and expresses legislative intent regarding the distribution of moneys for the Special Assistant United States Attorney Project."
H0285,759500,"Amends and adds to existing law to revise provisions for staff allowance; to revise provisions for the experience and education multiplier; to provide for a career ladder and related requirements; to revise provisions for each district's salary-based apportionment; and to revise provisions for leadership premiums."
H0286,759403,"Amends existing law to revise the property tax exemption for certain business property, to revise definitions, to revise capital investment requirements in counties within a certain population criteria and to revise the exemption criteria."
H0287,760214,"Appropriates $13,098,800 to the State Board of Education and the Board of Regents of the University of Idaho for Health Education Programs for fiscal year 2016; limits the number of authorized full-time equivalent positions to 23.8; provides a lump sum appropriation for dedicated funds; and reappropriates unexpended and unencumbered dedicated fund balances in the Dental Education Program."
H0288,760262,"Appropriates $62,134,600 to the Department of Health and Welfare for the divisions of Independent Councils, Indirect Support Services, Healthcare Policy Initiatives and Licensing and Certification for fiscal year 2016; limits the number of authorized full-time equivalent positions to 373.5; provides for General Fund transfers to the Cooperative Welfare Fund; restricts the transfer of trustee and benefit payments; limits services to available resources; requires a monthly Medicaid tracking report; requires a biannual Medicaid Integrity Unit report; requires quarterly transfer reports; requires a report on VOCA funds; and requires a report on facility licensing and certification."
H0289,760315,"Appropriates an additional $201,600 of dedicated funds and reduces the federal fund appropriation by $301,600 in fiscal year 2015."
H0290,760279,"Appropriates $11,920,100 to Special Programs under the State Board of Education for fiscal year 2016; limits the number of full-time equivalent positions to 38.13; and provides for the transfer of any unexpended and unencumbered General Fund moneys to the Opportunity Scholarship Program Fund at the end of fiscal year 2015."
H0291,760232,"Amends existing law to provide that land management plans required for voluntary stewardship agreements pursuant to law and agreements relating to the conservation of sage grouse and entered into voluntarily by owners or occupiers of land with a soil conservation district are exempt from disclosure under the Public Records Act."
H0292,760297,"Adds to existing law to define terms and to establish insurance provisions."
H0293,760146,"Appropriates $5,892,900 to the Idaho State Historical Society for fiscal year 2016; and limits the number of authorized full-time equivalent positions to 49.02."
H0294,760347,"Appropriates $2,642,000 to the Idaho State Capitol Commission for fiscal year 2016; provides a cash transfer; and provides reappropriation authority."
H0295,760359,"Appropriates $12,303,000 to the Department of Administration for the Bond Payment Program for fiscal year 2016."
H0296,760249,"Amends and adds to existing law to revise provisions for staff allowance; to revise provisions for the experience and education multiplier; to provide for a career ladder and related requirements; to revise provisions for each district's salary-based apportionment; and to revise provisions for leadership premiums."
H0297,760162,"Repeals and amends existing law to provide that there shall be a Director of the Department of Revenue and Taxation appointed by the State Tax Commission and that the State Tax Commission shall serve as the Board of Tax Appeals."
H0298,760180,"Amends existing law to provide that certain services provided to adolescents shall be reimbursed at a certain percentage of the current Medicare rate."
H0299,760198,"Amends, repeals and adds to existing law to revise apportionment provisions relating to the Highway Distribution Account; to revise the transfer fee imposed on petroleum products and to provide alternate means of distribution of transfer fees; to revise registration fees; to revise certain permit fees; to provide for criteria relating to registration; to provide for electric vehicle and hybrid vehicle fees; to provide for the transfer of certain General Fund collections to the Budget Stabilization Fund and the Transportation Infrastructure Fund and to provide for the Transportation Infrastructure Fund; to revise the tax imposed on motor fuel; and to revise provisions regarding the distribution of tax imposed on motor fuel."
H0300,760749,"Amends existing law to provide that computation of alternative school support units shall include grades 6 through 12."
H0301,760908,"Repeals, amends and adds to existing law relating to the carrying of concealed weapons."
H0302,761223,"Adds to existing law to create in the Office of the Governor the Science, Technology, Engineering and Math Action Center and the STEM Action Center Board, to provide powers and duties and to provide for reports."
H0303,761181,"Amends existing law to require certain evidence in cases in which eminent domain is intended to be exercised for specific purposes."
H0304,761320,"Appropriates $34,561,000 to the State Board of Education for community colleges for fiscal year 2016; exempts appropriation object and program transfer limitations; provides legislative intent relating to system-wide expenditures; and requires an update on the Complete College Idaho initiative."
H0305,761302,"Appropriates $5,857,500 to the Office of the State Board of Education for fiscal year 2016; limits the number of full-time equivalent positions to 25.75; and authorizes the reappropriation of certain funds."
H0306,762089,"Adds to existing law to grant the State Board of Education rulemaking authority concerning the flexibility document associated with the federal Elementary and Secondary Education Act, to provide testing requirements, to provide requirements concerning the contents of the flexibility document and to provide review requirements."
H0307,762132,"Amends and adds to existing law to establish provisions relating to a voluntary kindergarten preparedness pilot program."
H0308,762721,"Amends existing law to provide that certain code provisions relating to pupil service staff allowance do not apply to public charter schools."
H0309,762843,"Adds to existing law to create the Public Charter School Debt Reserve, to provide conditions to use the Public Charter School Debt Reserve, to provide for approval from the Idaho Housing and Finance Association, to establish the Public Charter School Debt Reserve Fund, to provide for continuous appropriation, to provide for the deposit of certain moneys into the fund, to establish provisions concerning a default on an outstanding debt and to provide for repayment of moneys withdrawn from the Public Charter School Debt Reserve Fund."
H0310,762490,"Amends existing law to revise apportionment provisions relating to the Highway Distribution Account; and to provide for the transfer of certain General Fund collections to the State Highway Account."
H0311,762605,"Amends, repeals and adds to existing law to revise the tax imposed on motor fuel and to provide for floor stock tax provisions; to establish provisions concerning the distribution of revenues from tax on motor fuel; to establish provisions concerning the distribution of revenues from tax on special fuels; to revise income tax rates; to provide a sales and use tax exemption for the purchase of food; and to establish additional provisions concerning the revenue sharing account."
H0312,762784,"Repeals, amends and adds to existing law to revise registration fees; to provide for additional registration fees; to provide a fee for electric and hybrid vehicles, to provide for the deposit of fees and to define terms; to revise the tax imposed on motor fuel; to revise provisions relating to the distribution of tax imposed on motor fuel; to provide for the Strategic Initiatives Program, to establish the Strategic Initiatives Program Fund, to provide for the deposit of certain moneys into the fund and to provide for use of moneys in the fund; to revise provisions relating to transfers of moneys into the Budget Stabilization Fund, to provide for the transfer of certain excess cash balances into the Budget Stabilization Fund and to remove provisions relating to the maximum fund balance; to provide for the Budget Stabilization Fund; and to revise a distribution provision."
H0313,763459,"Amends and adds to existing law to provide an amount needed for school counseling support; to revise provisions and to establish additional provisions for school counselors; to provide for academic and college or career advisors and student mentors, to grant school districts and charter schools the authority to employ certain staff, to require school districts provide professional development for certain staff and to provide notice and reporting requirements."
H0314,763420,"Adds to existing law to grant the State Board of Education rulemaking authority concerning the flexibility document associated with the federal Elementary and Secondary Education Act, to provide testing requirements, to provide requirements concerning the contents of the flexibility document and to provide review requirements."
H0315,763375,"Repeals and adds to existing law to establish the Education Opportunity Network Board and to provide for board duties, certain requirements, board membership and board officers, to provide for a governmental entity and to establish provisions relating to the governmental entity, to establish provisions relating to assistance to school districts, to establish an oversight committee and to establish an interim working group."
H0316,763495,"Adds to existing law to establish insurance requirements for transportation network companies and drivers; and to revise a definition."
H0317,763339,"Amends and adds to existing law to establish provisions regarding contracts made by state officers."
H0318,764121,"Amends existing law to provide for the issuance of a liquor license to the owner, operator or lessee of a conference and event center that is within the city limits of a resort city."
H0319,764592,"Adds to existing law to provide that administrative rules that expire on July 1, 2015, will continue to be effective until July 1, 2016, to provide that administrative rules approved or extended by the adoption of a concurrent resolution shall be effective until July 1, 2016, or until such time as they expire, to provide that rules rejected by concurrent resolution shall be null, void and of no force and effect and to authorize agencies to amend or repeal certain rules pursuant to the Administrative Procedure Act."
H0320,764910,"Appropriates an additional $1,600,000 to the Department of Fish and Game for fiscal year 2015 for onetime projects."
H0321,765156,"Appropriates an additional $121,000 from the General Fund to the Superintendent of Public Instruction for fiscal year 2016 for background checks."
H0322,765043,"Amends existing law to revise provisions regarding appointments to certain offices."
H0323,765981,"Amends existing law to provide that certain staff may not be placed on a renewable contract status."
H0324,767682,"Amends existing law to increase monetary civil penalties for violations of the Open Meeting Law."
H0325,767681,"Appropriates an additional $127,000 to the Bureau of Occupational Licenses for fiscal year 2016 as a trailer appropriation to Senate Bill No.1080, Genetic Counselor Licensing, and House Bill No.152, Sign Language Interpreter Licensing; and adds two additional full-time equivalent positions."
H0326,767684,"Appropriates $647,300 to the STEM Action Center for fiscal year 2016; limits the number of authorized full-time equivalent positions to two; and provides legislative intent."
H0327,767685,"Amends existing law to revise provisions for underinsured motor vehicle coverage."
H0328,767679,"Repeals and adds to existing law to recodify the laws regarding the compiling and printing of Session Laws and Journals of the Legislature; and to revise duties of the Secretary of State regarding Session Laws."
H0329,767677,"Amends and adds to existing law to revise authority provisions of the council; to provide for the exchange and distribution of certain funds, to provide for the administration of certain projects, to provide for the retention of certain property and moneys, to provide for interview opportunities for certain personnel, to provide for the transfer of the Idaho Technology Transfer Center and to provide for a memorandum of understanding; and to prohibit the council from engaging in the administration of projects or programs on behalf of cities, counties or local highway jurisdictions."
H0330,767844,"Amends existing law to revise the income food tax credit and refunds against the state income tax."
HCR001,673152,"Provides for a joint session of the House of Representatives and the Senate to hear the Governor's State of the State Address."
HCR002,707982,"Stating findings of the Legislature and recognizing the 150th anniversary of the building of the first bridge to span the Snake River which started the settlement that became Idaho Falls."
HCR003,711774,"Stating findings of the Legislature and authorizing the Legislative Council to appoint a committee to undertake and complete a study of the state's elementary, secondary and postsecondary longitudinal data systems."
HCR004,713374,"Stating findings of the Legislature and rejecting certain rules of the State Tax Commission relating to Idaho Sales and Use Tax Administrative Rules."
HCR005,718074,"Stating findings of the Legislature and recognizing American Diabetes Month in November and supporting its goals and ideals."
HCR006,723078,"Stating findings of the Legislature and rejecting a certain rule docket of the Public Employee Retirement System of Idaho relating to PERSI Contribution Rules."
HCR007,723032,"Stating findings of the Legislature and inviting Outdoor Retailer to host its biannual show and to express the importance of outdoor recreation to the economy of Idaho and to the lives of Idahoans."
HCR008,723817,"Stating findings of the Legislature and authorizing the Legislative Council to appoint a committee to undertake and complete a study of natural resource issues."
HCR009,728908,"Stating findings of the Legislature and proclaiming March 2015 as Social Work Recognition Month and calling upon all citizens to join with the National Association of Social Workers in celebration and support of the social work profession."
HCR010,728714,"Stating findings of the Legislature and rejecting a certain rule docket of the Department of Water Resources relating to Rules for Conjunctive Management of Surface and Ground Water Resources."
HCR011,732186,"Stating findings of the Legislature and rejecting a certain rule docket of the Office of the Governor relating to the Idaho Commission for the Blind and Visually Impaired."
HCR012,731995,"Stating findings of the Legislature and authorizing the Legislative Council to appoint a committee to undertake and complete a study of endowment asset issues of importance to Idaho and to monitor implementation of the Callan Report recommendations."
HCR013,735101,"Stating findings of the Legislature and rejecting a certain rule of the Idaho State Police relating to the Idaho Peace Officer Standards and Training Council."
HCR014,738396,"Stating findings of the Legislature and recognizing and honoring the Idaho Farm Bureau Federation for its 75 years of accomplishments and service to Idaho agriculture."
HCR015,740606,"Stating findings of the Legislature and celebrating the 125th anniversary of statehood for Idaho."
HCR016,740488,"Stating findings of the Legislature and recognizing and congratulating Benewah County and its residents for the county's Centennial Anniversary in 2015."
HCR017,747942,"Stating findings of the Legislature and authorizing the Legislative Council to appoint a committee to undertake and complete a study of urban renewal plans and issues."
HCR018,751859,"Stating findings of the Legislature and applying to Congress, under the provisions of Article V of the Constitution of the United States, for calling a convention of the states limited to proposing an amendment to the Constitution of the United States requiring that in the absence of a national emergency the total of all federal appropriations made by Congress for any fiscal year may not exceed the total of all estimated federal revenues for that fiscal year, together with any related and appropriate fiscal restraints."
HCR019,758807,"Stating findings of the Legislature and directing the EMS bureau to convene a working group to prepare legislation on emergency medical services in Idaho."
HCR020,760332,"Stating findings of the Legislature and rejecting a certain final rule of the Bureau of Occupational Licenses relating to Rules of the State Board of Chiropractic Physicians."
HCR021,760775,"Stating findings of the Legislature and rejecting a certain rule docket of the State Board of and State Department of Education relating to Rules Governing Thoroughness."
HCR022,760959,"Stating findings of the Legislature and rejecting a certain rule of the State Board of and State Department of Education relating to Rules Governing Uniformity."
HCR023,761263,"Stating findings of the Legislature and authorizing the Legislative Council to appoint a committee to undertake and complete a study of the state's purchasing laws."
